广州市稳达电子有限公司,http:////www.11467.com/guangzhou/co/593442.htm
广州市稳达电子有限公司的商铺,http://guangzhou0593442.11467.com
深圳市梦美怡美容仪器有限公司,http:////www.11467.com/shenzhen/co/1088771.htm
深圳市梦美怡美容仪器有限公司的商铺,http://shenzhen01088771.11467.com
杭州中兴医院有限公司,http:////www.11467.com/hangzhou/co/493116.htm
杭州中兴医院有限公司的商铺,http://hangzhou0493116.11467.com
广州市白云区石井美匙美容仪器厂,http:////www.11467.com/guangzhou/co/702050.htm
广州市白云区石井美匙美容仪器厂的商铺,http://guangzhou0702050.11467.com
石家庄朵朵皮具护理服务有限公司,http:////www.11467.com/shijiazhuang/co/194788.htm
石家庄朵朵皮具护理服务有限公司的商铺,http://shijiazhuang0194788.11467.com
广东喜喜投资发展有限公司,http:////www.11467.com/guangzhou/co/699294.htm
广东喜喜投资发展有限公司的商铺,http://guangzhou0699294.11467.com
佛山市南海区浪标洁具厂,http:////www.11467.com/foshan/co/402195.htm
佛山市南海区浪标洁具厂的商铺,http://foshan0402195.11467.com
广州市皇廷电子有限公司,http:////www.11467.com/guangzhou/co/683466.htm
广州市皇廷电子有限公司的商铺,http://guangzhou0683466.11467.com
湖北省一致魔芋生物科技有限公司,http:////www.11467.com/yichang/co/58322.htm
湖北省一致魔芋生物科技有限公司的商铺,http://yichang058322.11467.com
扬州皓牛牙刷厂,http:////www.11467.com/yangzhou/co/117364.htm
扬州皓牛牙刷厂的商铺,http://yangzhou0117364.11467.com
广州快美顺生物科技有限公司,http:////www.11467.com/guangzhou/co/633961.htm
广州快美顺生物科技有限公司的商铺,http://guangzhou0633961.11467.com
广州恒美煤业美容仪器有限公司,http:////www.11467.com/guangzhou/co/696598.htm
广州恒美煤业美容仪器有限公司的商铺,http://guangzhou0696598.11467.com
张掖市甘州区圣和百货批发部,http:////www.11467.com/zhangye/co/12633.htm
张掖市甘州区圣和百货批发部的商铺,http://zhangye012633.11467.com
广州市儒美科技有限公司,http:////www.11467.com/guangzhou/co/692971.htm
广州市儒美科技有限公司的商铺,http://guangzhou0692971.11467.com
深圳市丽姿美科技有限公司,http:////www.11467.com/shenzhen/co/1037476.htm
深圳市丽姿美科技有限公司的商铺,http://shenzhen01037476.11467.com
广州慎美美容设备有限公司,http:////www.11467.com/guangzhou/co/660594.htm
广州慎美美容设备有限公司的商铺,http://guangzhou0660594.11467.com
郑州比高电子科技有限公司,http:////www.11467.com/zhengzhou/co/213089.htm
郑州比高电子科技有限公司的商铺,http://zhengzhou0213089.11467.com
深圳神龙永旺投资发展有限公司,http:////www.11467.com/shenzhen/co/983492.htm
深圳神龙永旺投资发展有限公司的商铺,http://shenzhen0983492.11467.com
河北逸巢卫浴设备有限公司,http:////www.11467.com/xintai/co/82194.htm
河北逸巢卫浴设备有限公司的商铺,http://xintai082194.11467.com
广州市恒美美业美容仪器有限公司,http:////www.11467.com/guangzhou/co/693129.htm
广州市恒美美业美容仪器有限公司的商铺,http://guangzhou0693129.11467.com
广州美加化妆品有限公司,http:////www.11467.com/guangzhou/co/696799.htm
广州美加化妆品有限公司的商铺,http://guangzhou0696799.11467.com
广州市柏苒化妆品有限公司,http:////www.11467.com/guangzhou/co/696608.htm
广州市柏苒化妆品有限公司的商铺,http://guangzhou0696608.11467.com
深圳市佳兰电子有限公司,http:////www.11467.com/shenzhen/co/949848.htm
深圳市佳兰电子有限公司的商铺,http://shenzhen0949848.11467.com
深圳市品极口腔生物科技有限公司,http:////www.11467.com/shenzhen/co/1064798.htm
深圳市品极口腔生物科技有限公司的商铺,http://shenzhen01064798.11467.com
广东皇廷电子科技有限公司,http:////www.11467.com/guangzhou/co/699312.htm
广东皇廷电子科技有限公司的商铺,http://guangzhou0699312.11467.com
广州舒邦威娜有限公司,http:////www.11467.com/guangzhou/co/696730.htm
广州舒邦威娜有限公司的商铺,http://guangzhou0696730.11467.com
深圳尧福科技有限公司,http:////www.11467.com/shenzhen/co/1087018.htm
深圳尧福科技有限公司的商铺,http://shenzhen01087018.11467.com
济南正熙文化艺术有限公司,http:////www.11467.com/jinan/co/154015.htm
济南正熙文化艺术有限公司的商铺,http://jinan0154015.11467.com
合肥思婉生物科技有限公司,http:////www.11467.com/hefei/co/152533.htm
合肥思婉生物科技有限公司的商铺,http://hefei0152533.11467.com
深圳市雅美特化妆用具有限公司,http:////www.11467.com/shenzhen/co/983300.htm
深圳市雅美特化妆用具有限公司的商铺,http://shenzhen0983300.11467.com
深圳市益生乐科技有限公司,http:////www.11467.com/shenzhen/co/949852.htm
深圳市益生乐科技有限公司的商铺,http://shenzhen0949852.11467.com
东莞市先博酒店用品厂,http:////www.11467.com/dongguan/co/612165.htm
东莞市先博酒店用品厂的商铺,http://dongguan0612165.11467.com
杭州永铭卫浴有限公司,http:////www.11467.com/hangzhou/co/438172.htm
杭州永铭卫浴有限公司的商铺,http://hangzhou0438172.11467.com
泉州市闺蜜礼物卫生用品有限公司,http:////www.11467.com/quanzhou/co/169604.htm
泉州市闺蜜礼物卫生用品有限公司的商铺,http://quanzhou0169604.11467.com
盛世宏业北京科技有限公司,http:////www.11467.com/beijing/co/763527.htm
盛世宏业北京科技有限公司的商铺,http://beijing0763527.11467.com
佛山市竹下卫浴有限公司,http:////www.11467.com/foshan/co/467715.htm
佛山市竹下卫浴有限公司的商铺,http://foshan0467715.11467.com
慈溪爱啦啦家庭用品有限公司,http:////www.11467.com/ningbo/co/231431.htm
慈溪爱啦啦家庭用品有限公司的商铺,http://ningbo0231431.11467.com
青岛膨利源化妆品有限公司,http:////www.11467.com/qingdao/co/188082.htm
青岛膨利源化妆品有限公司的商铺,http://qingdao0188082.11467.com
北京黛莱美专卖店,http:////www.11467.com/beijing/co/762251.htm
北京黛莱美专卖店的商铺,http://beijing0762251.11467.com
东莞市美恒工艺品有限公司,http:////www.11467.com/qiye/22648449.htm
东莞市美恒工艺品有限公司的商铺,http://22648449.b2b.11467.com
广州市年生贸易有限公司,http:////www.11467.com/guangzhou/co/683409.htm
广州市年生贸易有限公司的商铺,http://guangzhou0683409.11467.com
佛山市南海悦品卫浴厂,http:////www.11467.com/foshan/co/407405.htm
佛山市南海悦品卫浴厂的商铺,http://foshan0407405.11467.com
西安汇之媛商贸有限公司,http:////www.11467.com/xian/co/140047.htm
西安汇之媛商贸有限公司的商铺,http://xian0140047.11467.com
安平县誉达医疗器械贸易有限公司,http:////www.11467.com/hengshui/co/57598.htm
安平县誉达医疗器械贸易有限公司的商铺,http://hengshui057598.11467.com
佛山市南海区欧冠卫浴商行,http:////www.11467.com/foshan/co/421153.htm
佛山市南海区欧冠卫浴商行的商铺,http://foshan0421153.11467.com
开平市水口镇煌佳卫浴厂,http:////www.11467.com/jiangmen/co/139140.htm
开平市水口镇煌佳卫浴厂的商铺,http://jiangmen0139140.11467.com
北京睿益康泰医学科技有限公司,http:////www.11467.com/beijing/co/761128.htm
广州市震澳美容美体设备有限公司,http:////www.11467.com/guangzhou/co/701364.htm
广州清丽泡棉有限公司,http:////www.11467.com/guangzhou/co/702084.htm
广州清丽泡棉有限公司的商铺,http://guangzhou0702084.11467.com
广州意凯电子科技有限公司,http:////www.11467.com/guangzhou/co/735400.htm
广州意凯电子科技有限公司的商铺,http://guangzhou0735400.11467.com
广州美莱雅美容美体仪器有限公司,http:////www.11467.com/guangzhou/co/430361.htm
广州美莱雅美容美体仪器有限公司的商铺,http://guangzhou0430361.11467.com
河南缤扬医疗科技有限公司,http:////www.11467.com/qiye/93171865.htm
河南缤扬医疗科技有限公司的商铺,http://93171865.b2b.11467.com
大连辛诺康美科技开发有限公司,http:////www.11467.com/dalian/co/37653.htm
大连辛诺康美科技开发有限公司的商铺,http://dalian037653.11467.com
盈峰國際實業有限公司A-WIN INDUSTRIE,http:////www.11467.com/dongguan/co/157972.htm
盈峰國際實業有限公司A-WIN INDUSTRIE的商铺,http://dongguan0157972.11467.com
佛山市顺德区怡德塑料制品有限公司,http:////www.11467.com/foshan/co/209048.htm
佛山市顺德区怡德塑料制品有限公司的商铺,http://foshan0209048.11467.com
福建省罗源县名匠工艺品厂,http:////www.11467.com/fuzhou/co/139122.htm
福建省罗源县名匠工艺品厂的商铺,http://fuzhou0139122.11467.com
广州迪美斯美容仪器厂,http:////www.11467.com/guangzhou/co/141848.htm
广州迪美斯美容仪器厂的商铺,http://guangzhou0141848.11467.com
广州铼众电子科技有限公司,http:////www.11467.com/guangzhou/co/141961.htm
广州铼众电子科技有限公司的商铺,http://guangzhou0141961.11467.com
佛山市顺德区容桂晶骏玻璃工艺厂,http:////www.11467.com/foshan/co/209265.htm
佛山市顺德区容桂晶骏玻璃工艺厂的商铺,http://foshan0209265.11467.com
中山市强福五金机械有限公司,http:////www.11467.com/foshan/co/209094.htm
中山市强福五金机械有限公司的商铺,http://foshan0209094.11467.com
山东创美生物科技有限公司,http:////www.11467.com/zibo/co/118133.htm
山东创美生物科技有限公司的商铺,http://zibo0118133.11467.com
广州市艾颜佳美容美发设备有限公司,http:////www.11467.com/guangzhou/co/431072.htm
广州市艾颜佳美容美发设备有限公司的商铺,http://guangzhou0431072.11467.com
广州是皇廷电子有限公司,http:////www.11467.com/guangzhou/co/724882.htm
广州是皇廷电子有限公司的商铺,http://guangzhou0724882.11467.com
广州市皇廷电子科技责任有限公司,http:////www.11467.com/guangzhou/co/735557.htm
广州市皇廷电子科技责任有限公司的商铺,http://guangzhou0735557.11467.com
北京起航骏业有限公司,http:////www.11467.com/beijing/co/764365.htm
北京起航骏业有限公司的商铺,http://beijing0764365.11467.com
广州市亮帆美仪器有限公司,http:////www.11467.com/guangzhou/co/735721.htm
广州市亮帆美仪器有限公司的商铺,http://guangzhou0735721.11467.com
深圳市安娜时尚色彩形象顾问有限公司,http:////www.11467.com/shenzhen/co/1128857.htm
深圳市安娜时尚色彩形象顾问有限公司的商铺,http://shenzhen01128857.11467.com
广州美匙美容仪器有限公司,http:////www.11467.com/guangzhou/co/745084.htm
广州美匙美容仪器有限公司的商铺,http://guangzhou0745084.11467.com
天津富勤科技股份有限公司,http:////www.11467.com/tianjin/co/289115.htm
天津富勤科技股份有限公司的商铺,http://tianjin0289115.11467.com
深圳市朗康科技有限公司,http:////www.11467.com/shenzhen/co/729590.htm
深圳市朗康科技有限公司的商铺,http://shenzhen0729590.11467.com
深圳市刷本进出口有限公司,http:////www.11467.com/shenzhen/co/1136847.htm
深圳市刷本进出口有限公司的商铺,http://shenzhen01136847.11467.com
广东顺德西瓜皮健康科技有限公司,http:////www.11467.com/foshan/co/474803.htm
广东顺德西瓜皮健康科技有限公司的商铺,http://foshan0474803.11467.com
上海北敖电子商务有限公司,http:////www.11467.com/shanghai/co/1305078.htm
上海北敖电子商务有限公司的商铺,http://shanghai01305078.11467.com
禹州市顺泽贸易有限公司,http:////www.11467.com/xuchang/co/22859.htm
禹州市顺泽贸易有限公司的商铺,http://xuchang022859.11467.com
深圳市兴酬电子有限公司,http:////www.11467.com/shenzhen/co/1108396.htm
深圳市兴酬电子有限公司的商铺,http://shenzhen01108396.11467.com
广州柯斯诺美容仪器厂,http:////www.11467.com/guangzhou/co/428653.htm
广州柯斯诺美容仪器厂的商铺,http://guangzhou0428653.11467.com
广州市蓓焱美美容仪器有限公司,http:////www.11467.com/guangzhou/co/745473.htm
广州市蓓焱美美容仪器有限公司的商铺,http://guangzhou0745473.11467.com
广州丽美电子科技有限公司,http:////www.11467.com/guangzhou/co/753128.htm
广州丽美电子科技有限公司的商铺,http://guangzhou0753128.11467.com
广州圣薇娜生物科技有限公司,http:////www.11467.com/qiye/93081561.htm
广州圣薇娜生物科技有限公司的商铺,http://93081561.b2b.11467.com
广州亮帆美仪器有限公司,http:////www.11467.com/guangzhou/co/724749.htm
广州亮帆美仪器有限公司的商铺,http://guangzhou0724749.11467.com
广州金缘美容用品有限公司,http:////www.11467.com/guangzhou/co/459228.htm
广州金缘美容用品有限公司的商铺,http://guangzhou0459228.11467.com
丹东市振安区纺织厂,http:////www.11467.com/dandong/co/12585.htm
丹东市振安区纺织厂的商铺,http://dandong012585.11467.com
广州市白云区必盛仪器厂,http:////www.11467.com/guangzhou/co/95165.htm
广州市白云区必盛仪器厂的商铺,http://guangzhou095165.11467.com
佛山市悦妃卫浴有限公司,http:////www.11467.com/foshan/co/356161.htm
佛山市悦妃卫浴有限公司的商铺,http://foshan0356161.11467.com
陈映华（个体经营）,http:////www.11467.com/guangzhou/co/495123.htm
陈映华（个体经营）的商铺,http://guangzhou0495123.11467.com
沈阳丹意达贸易有限公司,http:////www.11467.com/shenyang/co/109874.htm
沈阳丹意达贸易有限公司的商铺,http://shenyang0109874.11467.com
徐州市美诺电子科技有限公司,http:////www.11467.com/xuzhou/co/92483.htm
徐州市美诺电子科技有限公司的商铺,http://xuzhou092483.11467.com
广州汇博进出口商贸有限公司,http:////www.11467.com/guangzhou/co/745340.htm
广州汇博进出口商贸有限公司的商铺,http://guangzhou0745340.11467.com
东莞市洪源贸易有限公司,http:////www.11467.com/dongguan/co/641917.htm
东莞市洪源贸易有限公司的商铺,http://dongguan0641917.11467.com
佛山市顺德区龙江镇蒂旺家具厂,http:////www.11467.com/foshan/co/193593.htm
佛山市顺德区龙江镇蒂旺家具厂的商铺,http://foshan0193593.11467.com
广州捷迪美容仪器有限公司,http:////www.11467.com/guangzhou/co/717011.htm
广州捷迪美容仪器有限公司的商铺,http://guangzhou0717011.11467.com
宝蔻（厦门）卫浴有限公司,http:////www.11467.com/xiamen/co/179532.htm
宝蔻（厦门）卫浴有限公司的商铺,http://xiamen0179532.11467.com
温州乐于美业生物科技有限公司,http:////www.11467.com/wenzhou/co/329825.htm
温州乐于美业生物科技有限公司的商铺,http://wenzhou0329825.11467.com
北京尚美时黛国际管理咨询有限公司,http:////www.11467.com/beijing/co/764504.htm
北京尚美时黛国际管理咨询有限公司的商铺,http://beijing0764504.11467.com
佛山市顺德区海润海绵工艺制品有限公司,http:////www.11467.com/foshan/co/99639.htm
佛山市顺德区海润海绵工艺制品有限公司的商铺,http://foshan099639.11467.com
广州市美迪美容仪器制造厂,http:////www.11467.com/guangzhou/co/350411.htm
深圳赛克斯化妆刷制品厂,http:////www.11467.com/shenzhen/co/791641.htm
安阳金管家管理公司,http:////www.11467.com/anyang/co/32218.htm
河南雅顺生物科技有限公司,http:////www.11467.com/zhengzhou/co/191974.htm
雷明登电器（天津）有限公司,http:////www.11467.com/tianjin/co/262997.htm
雷明登电器（天津）有限公司的商铺,http://tianjin0262997.11467.com
扬州汇彩制刷有限公司,http:////www.11467.com/yangzhou/co/10591.htm
扬州汇彩制刷有限公司的商铺,http://yangzhou010591.11467.com
天津立发医疗用品有限公司,http:////www.11467.com/tianjin/co/166611.htm
天津立发医疗用品有限公司的商铺,http://tianjin0166611.11467.com
江门市新会区溢洋日用制品厂,http:////www.11467.com/jiangmen/co/3551.htm
江门市新会区溢洋日用制品厂的商铺,http://jiangmen03551.11467.com
广州市白云区三元里玺庆化妆品商行,http:////www.11467.com/qiye/93223592.htm
广州市白云区三元里玺庆化妆品商行的商铺,http://93223592.b2b.11467.com
淮安经济技术开发区橙柚家居用品厂,http:////www.11467.com/jinzhou/co/51125.htm
淮安经济技术开发区橙柚家居用品厂的商铺,http://jinzhou051125.11467.com
西安北半天医疗器械有限公司,http:////www.11467.com/xian/co/1896.htm
西安北半天医疗器械有限公司的商铺,http://xian01896.11467.com
深圳市诚耀科技有限公司,http:////www.11467.com/shenzhen/co/141912.htm
深圳市诚耀科技有限公司的商铺,http://shenzhen0141912.11467.com
广州市德隆化工贸易有限公司,http:////www.11467.com/guangzhou/co/95141.htm
广州市德隆化工贸易有限公司的商铺,http://guangzhou095141.11467.com
广州市正曜科技有限公司,http:////www.11467.com/qiye/93305235.htm
广州市正曜科技有限公司的商铺,http://93305235.b2b.11467.com
日照施华菲尔日用品有限公司,http:////www.11467.com/qiye/93308713.htm
日照施华菲尔日用品有限公司的商铺,http://93308713.b2b.11467.com
徐州医美电子科技有限公司,http:////www.11467.com/qiye/93452131.htm
徐州医美电子科技有限公司的商铺,http://93452131.b2b.11467.com
开平市晨帆卫浴有限公司,http:////www.11467.com/jiangmen/co/136064.htm
开平市晨帆卫浴有限公司的商铺,http://jiangmen0136064.11467.com
广州市越秀区依恋化妆品商行,http:////www.11467.com/guangzhou/co/495093.htm
广州市越秀区依恋化妆品商行的商铺,http://guangzhou0495093.11467.com
沈阳海奥思科技有限公司,http:////www.11467.com/shenyang/co/81156.htm
沈阳海奥思科技有限公司的商铺,http://shenyang081156.11467.com
佛山市顺德区晶一镜业制品有限公司,http:////www.11467.com/foshan/co/324301.htm
佛山市顺德区晶一镜业制品有限公司的商铺,http://foshan0324301.11467.com
佛山市顺德区奇登卫浴洁具有限公司,http:////www.11467.com/foshan/co/335978.htm
佛山市顺德区奇登卫浴洁具有限公司的商铺,http://foshan0335978.11467.com
宁波海曙想的卫浴有限公司,http:////www.11467.com/ningbo/co/96746.htm
宁波海曙想的卫浴有限公司的商铺,http://ningbo096746.11467.com
香菊医药公司,http:////www.11467.com/shangluo/co/8372.htm
贵州雨田集团,http:////www.11467.com/liupanshui/co/10442.htm
南昌市东兴美容沐浴用品厂,http:////www.11467.com/nanchang/co/100659.htm
创世纪美发用品商店,http:////www.11467.com/shuangyashang/co/9408.htm
威海紫光生物科技开发有限公司,http:////www.11467.com/weihai/co/54724.htm
湖北华旭达药业有限公司,http:////www.11467.com/xiantao/co/14423.htm
陕西秦卫生物医药有限公司,http:////www.11467.com/xianyang/co/22948.htm
云南美年大健康产业有限公司,http:////www.11467.com/kunming/co/134122.htm
岳阳新华达制药有限公司,http:////www.11467.com/yueyang/co/34459.htm
石家庄渡康医疗器械有限公司,http:////www.11467.com/shijiazhuang/co/135161.htm
磊烁有限责任公司,http:////www.11467.com/aletai/co/5991.htm
浦江县水晶仙子日化制品厂,http:////www.11467.com/changchun/co/83210.htm
个体经营者杜佳（个体经营）,http:////www.11467.com/changji/co/12480.htm
湖南省建筑工程集团总公司,http:////www.11467.com/changsha/co/1760.htm
湖南科尔生物技术有限公司,http:////www.11467.com/changsha/co/96082.htm
四川旭康医疗电器有限公司,http:////www.11467.com/chengdu/co/137918.htm
楚威数码有限公司,http:////www.11467.com/chuxiong/co/13097.htm
德州德药制药有限公司,http:////www.11467.com/dezhou/co/2216.htm
卡斯美发有限公司,http:////www.11467.com/dingxi/co/7956.htm
合肥优乐优美化妆品有限公司,http:////www.11467.com/hefei/co/104046.htm
合肥市景天医药科技有限公司,http:////www.11467.com/hefei/co/99564.htm
江苏创伟实业有限公司,http:////www.11467.com/huangshan/co/14248.htm
湖南金凤凰生物科技有限公司,http:////www.11467.com/changsha/co/118726.htm
广州市尚誉化妆品有限公司,http:////www.11467.com/guangzhou/co/455873.htm
北京红墙嘉顺教育咨询有限公司,http:////www.11467.com/beijing/co/691334.htm
江苏奇力康皮肤药业有限公司,http:////www.11467.com/suzhou/co/269229.htm
广州市麦力声医疗器械有限公司,http:////www.11467.com/guangzhou/co/417539.htm
贵阳爱尔眼科医院有限公司,http:////www.11467.com/guiyang/co/89432.htm
河南绿萝品牌策划有限公司,http:////www.11467.com/pingdingshan/co/33196.htm
陕西久福大健康产业股份有限公司,http:////www.11467.com/xian/co/167763.htm
湖南慕她生物科技发展有限公司,http:////www.11467.com/zhuzhou/co/59051.htm
吉林修正电子商务有限公司,http:////www.11467.com/changchun/co/83223.htm
吉林省百利生物科技有限公司,http:////www.11467.com/changchun/co/81167.htm
长沙艾迪康医学检验所有限公司,http:////www.11467.com/changsha/co/115651.htm
湖南守护神制药有限公司,http:////www.11467.com/changsha/co/18604.htm
发福呵呵公司,http:////www.11467.com/tongliao/co/9450.htm
百货贸易有限公司,http:////www.11467.com/tongren/co/7576.htm
康广善（个体经营）,http:////www.11467.com/tulufan/co/4559.htm
武汉市爱之家实业有限公司,http:////www.11467.com/wuhan/co/61228.htm
芜湖杰晟环保塑业有限公司,http:////www.11467.com/wuhu/co/24880.htm
厦门蓝湾科技有限公司,http:////www.11467.com/xiamen/co/51135.htm
厦门凯浦瑞电子科技有限公司,http:////www.11467.com/xiamen/co/30352.htm
厦门市旺得富木制品有限公司,http:////www.11467.com/xiamen/co/85330.htm
陕西关爱制药有限公司,http:////www.11467.com/xian/co/91130.htm
凤凰县小草手工艺品有限公司,http:////www.11467.com/xianxi/co/8424.htm
孝昌县兴荣国际贸易有限公司,http:////www.11467.com/xiaogan/co/20857.htm
沙河市昊轩玻璃有限公司,http:////www.11467.com/xintai/co/39553.htm
泾县榔桥西林竹木制品厂,http:////www.11467.com/xuancheng/co/21212.htm
易爱商品公司,http:////www.11467.com/yaan/co/7882.htm
华创测井公司,http:////www.11467.com/yanan/co/12502.htm
海欣贸易有限公司,http:////www.11467.com/yanan/co/12498.htm
延安江海餐饮有限公司,http:////www.11467.com/yanan/co/12484.htm
盐城力神塑业有限公司,http:////www.11467.com/yancheng/co/60982.htm
扬州市东源日化旅游用品厂,http:////www.11467.com/yangzhou/co/105958.htm
烟台市红蓝紫纺织品加工厂,http:////www.11467.com/yantai/co/133808.htm
中山市伟莎卫浴有限公司,http:////www.11467.com/zhongshan/co/147304.htm
珠海经济特区泓龙企业发展有限公司,http:////www.11467.com/zhuhai/co/60694.htm
山东英科医疗制品有限公司,http:////www.11467.com/zibo/co/99136.htm
唯美度科技（北京）有限公司,http:////www.11467.com/beijing/co/88557.htm
天地未来（北京）科技发展有限公司,http:////www.11467.com/beijing/co/419757.htm
心诺普医疗技术（北京）有限公司,http:////www.11467.com/beijing/co/397190.htm
上海丰泽园医药研究所,http:////www.11467.com/shanghai/co/950996.htm
上海润诚实业发展有限公司,http:////www.11467.com/shanghai/co/1046068.htm
天津强微特生物科技有限公司,http:////www.11467.com/tianjin/co/197841.htm
中山市酷女孩美甲有限公司,http:////www.11467.com/guangzhou/co/553895.htm
湖南一特电子医用工程股份有限公司,http:////www.11467.com/changsha/co/151011.htm
东之美网络公司,http:////www.11467.com/guangzhou/co/699936.htm
高碑店市中祥环保科技有限公司,http:////www.11467.com/baoding/co/167696.htm
吉林修正药业保健品有限公司,http:////www.11467.com/beijing/co/33287.htm
北京泰怡康成电子商务有限公司,http:////www.11467.com/suzhou/co/270691.htm
苏州良辰生物医药科技有限公司,http:////www.11467.com/suzhou/co/313093.htm
山东欣希安药业股份有限公司,http:////www.11467.com/jinan/co/133585.htm
深圳市中瑞奇电子科技有限公司,http:////www.11467.com/shenzhen/co/808655.htm
阿克苏奇购新奇特产品商行(个体经营),http:////www.11467.com/akesu/co/11079.htm
吕瑞(个体经营),http:////www.11467.com/akesu/co/11075.htm
安阳市华中药业有限公司,http:////www.11467.com/anyang/co/31892.htm
亳州市深科源置业投资有限公司,http:////www.11467.com/bozhou/co/13089.htm
长春市蓝梦集团实业有限公司,http:////www.11467.com/changchun/co/76907.htm
吉林省裕康医药有限公司,http:////www.11467.com/changchun/co/82213.htm
长春新宇制药有限公司,http:////www.11467.com/changchun/co/82198.htm
长春吉原生物科技有限公司,http:////www.11467.com/changchun/co/76798.htm
马鞍山贝斯特太阳能制造有限公司,http:////www.11467.com/maanshan/co/20578.htm
艺．沙廊专业造型,http:////www.11467.com/maanshan/co/20568.htm
南京天朗制药有限公司,http:////www.11467.com/nanjing/co/153743.htm
南京舒普思达医疗设备有限公司,http:////www.11467.com/nanjing/co/155056.htm
南京中脉科技发展有限公司,http:////www.11467.com/nanjing/co/93445.htm
南京万福金安生物技术有限公司,http:////www.11467.com/nanjing/co/93802.htm
广西昌弘制药有限公司,http:////www.11467.com/nanning/co/21216.htm
