凯美特科技发展公司的商铺,http://zhengzhou0148081.11467.com
中山市迪美卫浴设备有限公司,http:////www.11467.com/zhongshan/co/86665.htm
中山市迪美卫浴设备有限公司的商铺,http://zhongshan086665.11467.com
北京新科以仁科技发展有限公司,http:////www.11467.com/beijing/co/389400.htm
北京新科以仁科技发展有限公司的商铺,http://beijing0389400.11467.com
北京伊丽美科技有限公司,http:////www.11467.com/beijing/co/439369.htm
北京伊丽美科技有限公司的商铺,http://beijing0439369.11467.com
广州市维她美美容用品有限公司,http:////www.11467.com/guangzhou/co/428635.htm
广州市维她美美容用品有限公司的商铺,http://guangzhou0428635.11467.com
珠海樱草园生物科技有限公司,http:////www.11467.com/zhuhai/co/98777.htm
珠海樱草园生物科技有限公司的商铺,http://zhuhai098777.11467.com
广州萱姿生物科技有限公司,http:////www.11467.com/guangzhou/co/745504.htm
广州萱姿生物科技有限公司的商铺,http://guangzhou0745504.11467.com
广州宇珊化妆品有限公司,http:////www.11467.com/guangzhou/co/753019.htm
广州宇珊化妆品有限公司的商铺,http://guangzhou0753019.11467.com
青岛熙和医疗连锁有限公司,http:////www.11467.com/qingdao/co/124633.htm
青岛熙和医疗连锁有限公司的商铺,http://qingdao0124633.11467.com
上海贝览得生活用品有限公司,http:////www.11467.com/shanghai/co/1040026.htm
上海贝览得生活用品有限公司的商铺,http://shanghai01040026.11467.com
成都蜀南木业制品厂,http:////www.11467.com/chengdu/co/141969.htm
成都蜀南木业制品厂的商铺,http://chengdu0141969.11467.com
新奇特七区眼霜,http:////www.11467.com/quanzhou/co/113990.htm
新奇特七区眼霜的商铺,http://quanzhou0113990.11467.com
广州尊华生物科技有限公司,http:////www.11467.com/guangzhou/co/724721.htm
广州尊华生物科技有限公司的商铺,http://guangzhou0724721.11467.com
山东丽波电子科技有限公司,http:////www.11467.com/linyi/co/133919.htm
山东丽波电子科技有限公司的商铺,http://linyi0133919.11467.com
成都天府妇科医院有限责任公司,http:////www.11467.com/chengdu/co/289882.htm
成都天府妇科医院有限责任公司的商铺,http://chengdu0289882.11467.com
青岛安利产品康洁美专卖店,http:////www.11467.com/qingdao/co/124649.htm
柳州市鱼峰区万众家政服务部,http:////www.11467.com/liuzhou/co/44718.htm
天津昕美美容工艺品有限公司,http:////www.11467.com/tianjin/co/19599.htm
凯美特科技发展有限公司,http:////www.11467.com/zhengzhou/co/128016.htm
东莞市逸旺日用品有限公司,http:////www.11467.com/dongguan/co/409672.htm
中国维迈商贸公司,http:////www.11467.com/shenzhen/co/727609.htm
联合美丽五金制品,http:////www.11467.com/foshan/co/306548.htm
凯美特科技发展有限公司,http:////www.11467.com/zhengzhou/co/128016.htm
广州市金科丽美容仪器设备厂,http:////www.11467.com/guangzhou/co/428395.htm
金泉纳米科技有限公司,http:////www.11467.com/shijiazhuang/co/56336.htm
深圳市财升桑拿泳池设备有限公司,http:////www.11467.com/qiye/3109.htm
广州市好轻松医疗科技有限公司,http:////www.11467.com/guangzhou/co/131869.htm
瑞昌市新华卫浴制造厂,http:////www.11467.com/jiujiang/co/24454.htm
扬州天涯旅游用品厂,http:////www.11467.com/yangzhou/co/107041.htm
深圳市创晟电子有限公司,http:////www.11467.com/shenzhen/co/764511.htm
深圳市曼威光电技术有限公司,http:////www.11467.com/shenzhen/co/179618.htm
北京宏安光讯科技有限公司,http:////www.11467.com/beijing/co/145444.htm
北京柔影兰光电技术有限公司,http:////www.11467.com/beijing/co/554288.htm
佛山赛典养生有限公司,http:////www.11467.com/foshan/co/337563.htm
佛山赛典养生有限公司的商铺,http://foshan0337563.11467.com
广州市姿由体电子有限公司,http:////www.11467.com/guangzhou/co/455848.htm
广州市姿由体电子有限公司的商铺,http://guangzhou0455848.11467.com
上海翔露生物科技有限公司,http:////www.11467.com/shanghai/co/1036812.htm
上海翔露生物科技有限公司的商铺,http://shanghai01036812.11467.com
深圳市鑫来雅电子科技有限公司武汉分公司,http:////www.11467.com/shenzhen/co/758489.htm
深圳市鑫来雅电子科技有限公司武汉分公司的商铺,http://shenzhen0758489.11467.com
深圳市盛阳康科技有限公司,http:////www.11467.com/shenzhen/co/178808.htm
深圳市盛阳康科技有限公司的商铺,http://shenzhen0178808.11467.com
潮州市可达利陶瓷实业有限公司,http:////www.11467.com/chaozhou/co/25496.htm
潮州市可达利陶瓷实业有限公司的商铺,http://chaozhou025496.11467.com
东莞市金顿研磨材料有限公司,http:////www.11467.com/dongguan/co/164450.htm
东莞市金顿研磨材料有限公司的商铺,http://dongguan0164450.11467.com
东莞市美香日用品有限公司,http:////www.11467.com/dongguan/co/164604.htm
东莞市美香日用品有限公司的商铺,http://dongguan0164604.11467.com
东港市前阳镇万利捻织厂,http:////www.11467.com/dandong/co/45667.htm
东港市前阳镇万利捻织厂的商铺,http://dandong045667.11467.com
东莞市塘厦有间日用品店,http:////www.11467.com/dongguan/co/164629.htm
东莞市塘厦有间日用品店的商铺,http://dongguan0164629.11467.com
潮州市开发区亨嘉瓷艺厂,http:////www.11467.com/chaozhou/co/25486.htm
潮州市开发区亨嘉瓷艺厂的商铺,http://chaozhou025486.11467.com
潮州市凤新豪举美艺瓷厂,http:////www.11467.com/chaozhou/co/28086.htm
潮州市凤新豪举美艺瓷厂的商铺,http://chaozhou028086.11467.com
潮州市宝士陶瓷有限公司,http:////www.11467.com/chaozhou/co/25267.htm
潮州市宝士陶瓷有限公司的商铺,http://chaozhou025267.11467.com
天浩化妆刷制作公司,http:////www.11467.com/cangzhou/co/39164.htm
天浩化妆刷制作公司的商铺,http://cangzhou039164.11467.com
吉林省紫燕科技发展有限责任公司,http:////www.11467.com/changchun/co/69457.htm
吉林省紫燕科技发展有限责任公司的商铺,http://changchun069457.11467.com
蚌埠市中区宏丽化妆品经营部,http:////www.11467.com/bengbu/co/26568.htm
蚌埠市中区宏丽化妆品经营部的商铺,http://bengbu026568.11467.com
三弟洗浴用品厂,http:////www.11467.com/anyang/co/26691.htm
三弟洗浴用品厂的商铺,http://anyang026691.11467.com
广陵区爱思家宾馆酒店用品厂,http:////www.11467.com/yangzhou/co/105948.htm
广陵区爱思家宾馆酒店用品厂的商铺,http://yangzhou0105948.11467.com
广陵区艺泽旅游用品厂,http:////www.11467.com/yangzhou/co/105994.htm
广陵区艺泽旅游用品厂的商铺,http://yangzhou0105994.11467.com
湖南木矛木心商贸有限公司,http:////www.11467.com/changsha/co/74609.htm
湖南木矛木心商贸有限公司的商铺,http://changsha074609.11467.com
沧县民乐五金厂,http:////www.11467.com/cangzhou/co/67747.htm
沧县民乐五金厂的商铺,http://cangzhou067747.11467.com
东莞市锐强电线套管有限公司,http:////www.11467.com/dongguan/co/228416.htm
东莞市锐强电线套管有限公司的商铺,http://dongguan0228416.11467.com
刘 康（个体经营）,http:////www.11467.com/changsha/co/78958.htm
刘 康（个体经营）的商铺,http://changsha078958.11467.com
长沙市雨花区湖南高桥大市场会平百货商行,http:////www.11467.com/changsha/co/135390.htm
长沙市雨花区湖南高桥大市场会平百货商行的商铺,http://changsha0135390.11467.com
广东康得宝科技保健有限公司,http:////www.11467.com/foshan/co/337572.htm
广东康得宝科技保健有限公司的商铺,http://foshan0337572.11467.com
东莞市特顺手袋皮具有限公司,http:////www.11467.com/dongguan/co/411852.htm
东莞市特顺手袋皮具有限公司的商铺,http://dongguan0411852.11467.com
东莞市横沥斯曼德五金电子厂,http:////www.11467.com/dongguan/co/532126.htm
东莞市横沥斯曼德五金电子厂的商铺,http://dongguan0532126.11467.com
东莞市长安冠耀日用品店,http:////www.11467.com/dongguan/co/337138.htm
东莞市长安冠耀日用品店的商铺,http://dongguan0337138.11467.com
东莞市昌鑫电机有限公司,http:////www.11467.com/dongguan/co/134019.htm
东莞市昌鑫电机有限公司的商铺,http://dongguan0134019.11467.com
大连祥达木制品有限公司,http:////www.11467.com/dalian/co/66057.htm
大连祥达木制品有限公司的商铺,http://dalian066057.11467.com
东莞市捷达日用品有限公司,http:////www.11467.com/dongguan/co/410585.htm
东莞市捷达日用品有限公司的商铺,http://dongguan0410585.11467.com
东莞市大朗恒贵五金加工店,http:////www.11467.com/dongguan/co/253968.htm
东莞市大朗恒贵五金加工店的商铺,http://dongguan0253968.11467.com
东莞市石排永兴玻璃加工店,http:////www.11467.com/dongguan/co/199764.htm
东莞市石排永兴玻璃加工店的商铺,http://dongguan0199764.11467.com
东莞市鑫锋日用品有限公司,http:////www.11467.com/dongguan/co/410419.htm
东莞市鑫锋日用品有限公司的商铺,http://dongguan0410419.11467.com
安庆市慧美刷业有限公司,http:////www.11467.com/anqing/co/35057.htm
安庆市慧美刷业有限公司的商铺,http://anqing035057.11467.com
广州市简单爱生物科技有限公司,http:////www.11467.com/guangzhou/co/456340.htm
广州市简单爱生物科技有限公司的商铺,http://guangzhou0456340.11467.com
深圳康怡科技有限公司,http:////www.11467.com/shenzhen/co/779632.htm
深圳康怡科技有限公司的商铺,http://shenzhen0779632.11467.com
潜山县辉腾刷业制造厂,http:////www.11467.com/anqing/co/35139.htm
潜山县辉腾刷业制造厂的商铺,http://anqing035139.11467.com
定州市大地纺织配件有限公司,http:////www.11467.com/baoding/co/63916.htm
定州市大地纺织配件有限公司的商铺,http://baoding063916.11467.com
佛山康鼎养生设备第有限公司,http:////www.11467.com/foshan/co/337585.htm
佛山康鼎养生设备第有限公司的商铺,http://foshan0337585.11467.com
许昌自由美发饰品有限公司,http:////www.11467.com/xuchang/co/23285.htm
许昌自由美发饰品有限公司的商铺,http://xuchang023285.11467.com
深圳市盛阳康科技有限公司,http:////www.11467.com/shenzhen/co/178808.htm
深圳市盛阳康科技有限公司的商铺,http://shenzhen0178808.11467.com
长沙市岳麓区海杰装饰材料商店,http:////www.11467.com/changsha/co/135425.htm
长沙市岳麓区海杰装饰材料商店的商铺,http://changsha0135425.11467.com
常州华纳非织造布有限公司,http:////www.11467.com/changzhou/co/96540.htm
常州华纳非织造布有限公司的商铺,http://changzhou096540.11467.com
常州蓓琦丽日用品有限公司,http:////www.11467.com/changzhou/co/152240.htm
常州蓓琦丽日用品有限公司的商铺,http://changzhou0152240.11467.com
东光县找王镇小曹升旺制镜厂,http:////www.11467.com/cangzhou/co/10524.htm
东光县找王镇小曹升旺制镜厂的商铺,http://cangzhou010524.11467.com
大连港湾阁贸易有限公司,http:////www.11467.com/dalian/co/12315.htm
大连港湾阁贸易有限公司的商铺,http://dalian012315.11467.com
东莞市石排茂鑫玻璃镜业制品厂,http:////www.11467.com/dongguan/co/556055.htm
东莞市石排茂鑫玻璃镜业制品厂的商铺,http://dongguan0556055.11467.com
东莞市科琳娜家居用品有限公司,http:////www.11467.com/dongguan/co/410696.htm
东莞市科琳娜家居用品有限公司的商铺,http://dongguan0410696.11467.com
东莞市大岭山腾辉电子制品厂,http:////www.11467.com/dongguan/co/469287.htm
东莞市大岭山腾辉电子制品厂的商铺,http://dongguan0469287.11467.com
象山区古今工艺品总汇,http:////www.11467.com/guilin/co/42687.htm
象山区古今工艺品总汇的商铺,http://guilin042687.11467.com
广州雅加怡生物科技有限公司,http:////www.11467.com/guangzhou/co/144113.htm
广州雅加怡生物科技有限公司的商铺,http://guangzhou0144113.11467.com
广州市白云区三元里古川美容美发用品商行,http:////www.11467.com/guangzhou/co/142089.htm
广州市白云区三元里古川美容美发用品商行的商铺,http://guangzhou0142089.11467.com
广州上野美妆用品有限公司,http:////www.11467.com/guangzhou/co/462427.htm
广州上野美妆用品有限公司的商铺,http://guangzhou0462427.11467.com
哈尔滨市融林木制品厂,http:////www.11467.com/haerbin/co/43301.htm
哈尔滨市融林木制品厂的商铺,http://haerbin043301.11467.com
哈尔滨双丰木业有限公司,http:////www.11467.com/haerbin/co/53533.htm
哈尔滨双丰木业有限公司的商铺,http://haerbin053533.11467.com
广州兴隆木桶厂,http:////www.11467.com/guangzhou/co/142113.htm
广州兴隆木桶厂的商铺,http://guangzhou0142113.11467.com
广州市康大电子科技服务有限公司,http:////www.11467.com/guangzhou/co/141956.htm
广州市康大电子科技服务有限公司的商铺,http://guangzhou0141956.11467.com
广州市白云区三元里怡美美容用具商行,http:////www.11467.com/guangzhou/co/142189.htm
广州市白云区三元里怡美美容用具商行的商铺,http://guangzhou0142189.11467.com
广州市泰丰电子科技有限公司,http:////www.11467.com/guangzhou/co/144096.htm
广州市泰丰电子科技有限公司的商铺,http://guangzhou0144096.11467.com
广州市银狐美容美发仪器有限公司,http:////www.11467.com/guangzhou/co/142061.htm
广州市银狐美容美发仪器有限公司的商铺,http://guangzhou0142061.11467.com
广州市亚罗美容仪器有限公司,http:////www.11467.com/guangzhou/co/142125.htm
广州市亚罗美容仪器有限公司的商铺,http://guangzhou0142125.11467.com
广州诺珂尼化妆用品有限公司,http:////www.11467.com/guangzhou/co/160367.htm
广州诺珂尼化妆用品有限公司的商铺,http://guangzhou0160367.11467.com
广州市香草山美容美发用品开发有限公司,http:////www.11467.com/guangzhou/co/141704.htm
广州市香草山美容美发用品开发有限公司的商铺,http://guangzhou0141704.11467.com
广州市昊邦美容美发设备有限公司,http:////www.11467.com/guangzhou/co/142036.htm
广州市昊邦美容美发设备有限公司的商铺,http://guangzhou0142036.11467.com
罗居伦（个体经营）,http:////www.11467.com/guangzhou/co/141982.htm
罗居伦（个体经营）的商铺,http://guangzhou0141982.11467.com
卓伟实业全资公司,http:////www.11467.com/guangzhou/co/142288.htm
卓伟实业全资公司的商铺,http://guangzhou0142288.11467.com
马浪生(个体经营),http:////www.11467.com/guangzhou/co/141729.htm
马浪生(个体经营)的商铺,http://guangzhou0141729.11467.com
哈尔滨金百康医疗器械有限公司,http:////www.11467.com/haerbin/co/43320.htm
哈尔滨金百康医疗器械有限公司的商铺,http://haerbin043320.11467.com
刘警标(个体经营),http:////www.11467.com/guangzhou/co/141944.htm
刘警标(个体经营)的商铺,http://guangzhou0141944.11467.com
广州市越秀区实美装饰材料商行,http:////www.11467.com/guangzhou/co/142043.htm
广州市越秀区实美装饰材料商行的商铺,http://guangzhou0142043.11467.com
广州市清逸贸易有限公司,http:////www.11467.com/guangzhou/co/1717.htm
广州市清逸贸易有限公司的商铺,http://guangzhou01717.11467.com
广州市悦美佳贸易有限公司,http:////www.11467.com/guangzhou/co/429554.htm
广州市悦美佳贸易有限公司的商铺,http://guangzhou0429554.11467.com
广州市越秀区康爽化妆品商行,http:////www.11467.com/guangzhou/co/455643.htm
广州市越秀区康爽化妆品商行的商铺,http://guangzhou0455643.11467.com
广州市利远汽配城锋达汽车用品商行,http:////www.11467.com/guangzhou/co/434557.htm
广州市利远汽配城锋达汽车用品商行的商铺,http://guangzhou0434557.11467.com
广州市越秀区鑫励达汽车用品商行,http:////www.11467.com/guangzhou/co/431373.htm
广州市越秀区鑫励达汽车用品商行的商铺,http://guangzhou0431373.11467.com
广州彩挚恒机械设备有限公司,http:////www.11467.com/guangzhou/co/429715.htm
广州彩挚恒机械设备有限公司的商铺,http://guangzhou0429715.11467.com
广州丽榜化妆品有限公司,http:////www.11467.com/guangzhou/co/496239.htm
广州丽榜化妆品有限公司的商铺,http://guangzhou0496239.11467.com
黄俐个体经营,http:////www.11467.com/guangzhou/co/146998.htm
黄俐个体经营的商铺,http://guangzhou0146998.11467.com
广州市海田美容仪器有限公司,http:////www.11467.com/guangzhou/co/459234.htm
广州市海田美容仪器有限公司的商铺,http://guangzhou0459234.11467.com
广州市白云区迪美美容美体仪器厂,http:////www.11467.com/guangzhou/co/204019.htm
广州市白云区迪美美容美体仪器厂的商铺,http://guangzhou0204019.11467.com
广州市越秀区雅特思贸易商行,http:////www.11467.com/guangzhou/co/428832.htm
广州市越秀区雅特思贸易商行的商铺,http://guangzhou0428832.11467.com
广州市越秀区林立玩具经营部,http:////www.11467.com/guangzhou/co/390214.htm
广州市越秀区林立玩具经营部的商铺,http://guangzhou0390214.11467.com
广州市源然生物科技有限公司,http:////www.11467.com/guangzhou/co/495697.htm
广州市源然生物科技有限公司的商铺,http://guangzhou0495697.11467.com
广州市越秀区绿芳洲纺织品经营部,http:////www.11467.com/guangzhou/co/141602.htm
广州市越秀区绿芳洲纺织品经营部的商铺,http://guangzhou0141602.11467.com
深圳市宝安区沙井魔甲仙指美甲用品批发商行,http:////www.11467.com/guangzhou/co/496071.htm
深圳市宝安区沙井魔甲仙指美甲用品批发商行的商铺,http://guangzhou0496071.11467.com
广州雅诗达电子科技有限公司,http:////www.11467.com/guangzhou/co/457936.htm
广州雅诗达电子科技有限公司的商铺,http://guangzhou0457936.11467.com
香港百利康沐足洗浴用品有限公司,http:////www.11467.com/guangzhou/co/467739.htm
香港百利康沐足洗浴用品有限公司的商铺,http://guangzhou0467739.11467.com
广州市越秀区格丽美容用品商行,http:////www.11467.com/guangzhou/co/429551.htm
广州市越秀区格丽美容用品商行的商铺,http://guangzhou0429551.11467.com
深圳市罗湖区牧妆人化妆品店,http:////www.11467.com/guangzhou/co/455708.htm
深圳市罗湖区牧妆人化妆品店的商铺,http://guangzhou0455708.11467.com
广州台风生物科技有限公司,http:////www.11467.com/guangzhou/co/194725.htm
广州台风生物科技有限公司的商铺,http://guangzhou0194725.11467.com
广州仪健电子有限公司,http:////www.11467.com/guangzhou/co/127411.htm
广州仪健电子有限公司的商铺,http://guangzhou0127411.11467.com
广州市白云区三元里香魅雅美甲用品店,http:////www.11467.com/guangzhou/co/495813.htm
广州市白云区三元里香魅雅美甲用品店的商铺,http://guangzhou0495813.11467.com
广州中天铝业有限公司,http:////www.11467.com/guangzhou/co/126319.htm
广州中天铝业有限公司的商铺,http://guangzhou0126319.11467.com
广州市越秀区万黛美容美发用品商行,http:////www.11467.com/guangzhou/co/141149.htm
广州市越秀区万黛美容美发用品商行的商铺,http://guangzhou0141149.11467.com
广州市越秀区御延堂化妆品商行,http:////www.11467.com/guangzhou/co/142157.htm
广州市越秀区御延堂化妆品商行的商铺,http://guangzhou0142157.11467.com
广州雪贝儿美妆用品有限公司,http:////www.11467.com/guangzhou/co/430145.htm
广州雪贝儿美妆用品有限公司的商铺,http://guangzhou0430145.11467.com
广州市增城雅佳仕五金制品厂,http:////www.11467.com/guangzhou/co/454166.htm
广州市增城雅佳仕五金制品厂的商铺,http://guangzhou0454166.11467.com
广州市角斗士百货有限公司,http:////www.11467.com/guangzhou/co/232653.htm
广州市角斗士百货有限公司的商铺,http://guangzhou0232653.11467.com
广州圣吉日用品有限公司,http:////www.11467.com/guangzhou/co/489252.htm
广州圣吉日用品有限公司的商铺,http://guangzhou0489252.11467.com
合肥市信天飞商贸有限公司,http:////www.11467.com/hefei/co/129564.htm
合肥市信天飞商贸有限公司的商铺,http://hefei0129564.11467.com
深圳市柯亚桑拿泳池设备有限公司,http:////www.11467.com/huizhou/co/69492.htm
深圳市柯亚桑拿泳池设备有限公司的商铺,http://huizhou069492.11467.com
揭阳市试验区恒新不锈制品厂,http:////www.11467.com/jieyang/co/21631.htm
揭阳市试验区恒新不锈制品厂的商铺,http://jieyang021631.11467.com
江门市蓬江区中康医疗器械商行,http:////www.11467.com/jiangmen/co/85679.htm
江门市蓬江区中康医疗器械商行的商铺,http://jiangmen085679.11467.com
江门市锦隆实业有限公司,http:////www.11467.com/jiangmen/co/85654.htm
江门市锦隆实业有限公司的商铺,http://jiangmen085654.11467.com
江门市蓬江区爱美高日用制品有限公司,http:////www.11467.com/jiangmen/co/82776.htm
江门市蓬江区爱美高日用制品有限公司的商铺,http://jiangmen082776.11467.com
惠州市新禾利实业有限公司,http:////www.11467.com/huizhou/co/60820.htm
惠州市新禾利实业有限公司的商铺,http://huizhou060820.11467.com
博罗县石湾镇银华电子厂,http:////www.11467.com/huizhou/co/65021.htm
博罗县石湾镇银华电子厂的商铺,http://huizhou065021.11467.com
江门市新会区光盛金属制品厂,http:////www.11467.com/jiangmen/co/83211.htm
江门市新会区光盛金属制品厂的商铺,http://jiangmen083211.11467.com
江门市新会区大泽龙发美容美发床椅厂,http:////www.11467.com/jiangmen/co/83227.htm
江门市新会区大泽龙发美容美发床椅厂的商铺,http://jiangmen083227.11467.com
江门市新会区龙安塑料制品厂,http:////www.11467.com/jiangmen/co/92966.htm
江门市新会区龙安塑料制品厂的商铺,http://jiangmen092966.11467.com
江门市新会区华兴金属塑料制品厂,http:////www.11467.com/jiangmen/co/92175.htm
江门市新会区华兴金属塑料制品厂的商铺,http://jiangmen092175.11467.com
江门市蓬江区图强五金制品厂,http:////www.11467.com/jiangmen/co/83134.htm
江门市蓬江区图强五金制品厂的商铺,http://jiangmen083134.11467.com
安徽安丰瑞世电子科技有限公司,http:////www.11467.com/hefei/co/81735.htm
安徽安丰瑞世电子科技有限公司的商铺,http://hefei081735.11467.com
衡阳市珠晖区信易美工艺制品厂,http:////www.11467.com/hengyang/co/25270.htm
衡阳市珠晖区信易美工艺制品厂的商铺,http://hengyang025270.11467.com
黄石市科林不锈钢制品厂,http:////www.11467.com/huangshi/co/1745.htm
黄石市科林不锈钢制品厂的商铺,http://huangshi01745.11467.com
惠州市惠阳区淡水欢乐居家私部,http:////www.11467.com/huizhou/co/59674.htm
惠州市惠阳区淡水欢乐居家私部的商铺,http://huizhou059674.11467.com
海宁市亿吉刀片厂,http:////www.11467.com/jiaxing/co/80520.htm
海宁市亿吉刀片厂的商铺,http://jiaxing080520.11467.com
揭阳市区通宝家用电器厂,http:////www.11467.com/jieyang/co/2131.htm
揭阳市区通宝家用电器厂的商铺,http://jieyang02131.11467.com
惠阳区新圩联溢制品厂,http:////www.11467.com/huizhou/co/59664.htm
惠阳区新圩联溢制品厂的商铺,http://huizhou059664.11467.com
江门市新会区浩邦五金纸业有限公司,http:////www.11467.com/jiangmen/co/83216.htm
江门市新会区浩邦五金纸业有限公司的商铺,http://jiangmen083216.11467.com
江门市新会区健昌海棉制品厂,http:////www.11467.com/jiangmen/co/95310.htm
江门市新会区健昌海棉制品厂的商铺,http://jiangmen095310.11467.com
江门市新会区司前艺轩美容美发床椅厂,http:////www.11467.com/jiangmen/co/83247.htm
江门市新会区司前艺轩美容美发床椅厂的商铺,http://jiangmen083247.11467.com
江门市蓬江区伟昌框业工艺厂,http:////www.11467.com/jiangmen/co/96868.htm
江门市蓬江区伟昌框业工艺厂的商铺,http://jiangmen096868.11467.com
淮安乐天广告传媒有限公司,http:////www.11467.com/huaian/co/52783.htm
淮安乐天广告传媒有限公司的商铺,http://huaian052783.11467.com
江门市蓬江区百汇高理容器材有限公司,http:////www.11467.com/jiangmen/co/83207.htm
江门市蓬江区百汇高理容器材有限公司的商铺,http://jiangmen083207.11467.com
衡水滨湖新区鹏凯商贸有限公司,http:////www.11467.com/hengshui/co/33270.htm
衡水滨湖新区鹏凯商贸有限公司的商铺,http://hengshui033270.11467.com
桐庐天天制笔厂,http:////www.11467.com/hangzhou/co/86573.htm
桐庐天天制笔厂的商铺,http://hangzhou086573.11467.com
杭州冰儿无纺布有限公司,http:////www.11467.com/hangzhou/co/235590.htm
杭州冰儿无纺布有限公司的商铺,http://hangzhou0235590.11467.com
杭州乐源丝绸有限公司,http:////www.11467.com/hangzhou/co/81441.htm
杭州乐源丝绸有限公司的商铺,http://hangzhou081441.11467.com
永康市林海工贸有限公司,http:////www.11467.com/jinhua/co/67862.htm
永康市林海工贸有限公司的商铺,http://jinhua067862.11467.com
霸州市康仙庄康洁塑料制品厂,http:////www.11467.com/langfang/co/53555.htm
霸州市康仙庄康洁塑料制品厂的商铺,http://langfang053555.11467.com
揭阳市中天行电器有限公司,http:////www.11467.com/jieyang/co/32056.htm
揭阳市中天行电器有限公司的商铺,http://jieyang032056.11467.com
