阳江巧夫人刀业制品有限公司的商铺,http://yangjiang023673.11467.com
阳东县合山镇嘉利五金厂,http:////www.11467.com/yangjiang/co/23946.htm
阳东县合山镇嘉利五金厂的商铺,http://yangjiang023946.11467.com
阳东县一州不锈钢制品有限公司,http:////www.11467.com/yangjiang/co/11719.htm
阳东县一州不锈钢制品有限公司的商铺,http://yangjiang011719.11467.com
阳江市江城区金铭海五金工具厂,http:////www.11467.com/yangjiang/co/18264.htm
阳江市江城区金铭海五金工具厂的商铺,http://yangjiang018264.11467.com
阳江市江城区雅莉康美容工具制品厂,http:////www.11467.com/yangjiang/co/23942.htm
阳江市江城区雅莉康美容工具制品厂的商铺,http://yangjiang023942.11467.com
阳江市祥田工贸有限公司,http:////www.11467.com/yangjiang/co/22164.htm
阳江市祥田工贸有限公司的商铺,http://yangjiang022164.11467.com
阳江市永刚五金制品有限公司,http:////www.11467.com/yangjiang/co/18371.htm
阳江市永刚五金制品有限公司的商铺,http://yangjiang018371.11467.com
扬州市怡然洗涤日化用品有限公司,http:////www.11467.com/yangzhou/co/77339.htm
扬州市怡然洗涤日化用品有限公司的商铺,http://yangzhou077339.11467.com
阳江市君怡工贸有限公司,http:////www.11467.com/yangjiang/co/16727.htm
阳江市君怡工贸有限公司的商铺,http://yangjiang016727.11467.com
阳江市江城区美琳娜美容制品厂,http:////www.11467.com/yangjiang/co/15975.htm
阳江市江城区美琳娜美容制品厂的商铺,http://yangjiang015975.11467.com
阳江市为民五金塑料有限公司,http:////www.11467.com/yangjiang/co/9676.htm
阳江市为民五金塑料有限公司的商铺,http://yangjiang09676.11467.com
扬州市芙乐爱生活用品有限公司,http:////www.11467.com/yangzhou/co/77458.htm
扬州市芙乐爱生活用品有限公司的商铺,http://yangzhou077458.11467.com
扬州市广陵区圣康刷业厂,http:////www.11467.com/yangzhou/co/77350.htm
扬州市广陵区圣康刷业厂的商铺,http://yangzhou077350.11467.com
扬州市步步高酒店用品厂,http:////www.11467.com/yangzhou/co/77210.htm
扬州市步步高酒店用品厂的商铺,http://yangzhou077210.11467.com
扬州市国缘日用品有限公司,http:////www.11467.com/yangzhou/co/79786.htm
扬州市国缘日用品有限公司的商铺,http://yangzhou079786.11467.com
阳江市美嘉乐美容制品工贸有限公司,http:////www.11467.com/yangjiang/co/12701.htm
阳江市美嘉乐美容制品工贸有限公司的商铺,http://yangjiang012701.11467.com
覃汉显(个体经营),http:////www.11467.com/yangjiang/co/13936.htm
覃汉显(个体经营)的商铺,http://yangjiang013936.11467.com
阳江市江城区中艺五金厂,http:////www.11467.com/yangjiang/co/12664.htm
阳江市江城区中艺五金厂的商铺,http://yangjiang012664.11467.com
阳江市八圣子美容制品有限公司,http:////www.11467.com/yangjiang/co/12737.htm
阳江市八圣子美容制品有限公司的商铺,http://yangjiang012737.11467.com
阳江市江城区鼎祥美容制品厂,http:////www.11467.com/yangjiang/co/12735.htm
阳江市江城区鼎祥美容制品厂的商铺,http://yangjiang012735.11467.com
阳江市瑞阳工业制品有限公司,http:////www.11467.com/yangjiang/co/12549.htm
阳江市瑞阳工业制品有限公司的商铺,http://yangjiang012549.11467.com
阳江市秦远五金塑料制品有限公司,http:////www.11467.com/yangjiang/co/14606.htm
阳江市秦远五金塑料制品有限公司的商铺,http://yangjiang014606.11467.com
阳江市宝悦美容用品有限公司,http:////www.11467.com/yangjiang/co/16308.htm
阳江市宝悦美容用品有限公司的商铺,http://yangjiang016308.11467.com
阳江市美斯日用制品有限公司,http:////www.11467.com/yangjiang/co/13926.htm
阳江市美斯日用制品有限公司的商铺,http://yangjiang013926.11467.com
阳江市名洲五金塑料制品有限公司,http:////www.11467.com/yangjiang/co/15566.htm
阳江市名洲五金塑料制品有限公司的商铺,http://yangjiang015566.11467.com
扬州万佳昕日用制品有限公司,http:////www.11467.com/yangzhou/co/77407.htm
扬州万佳昕日用制品有限公司的商铺,http://yangzhou077407.11467.com
扬州顺成刷业有限公司,http:////www.11467.com/yangzhou/co/78169.htm
扬州顺成刷业有限公司的商铺,http://yangzhou078169.11467.com
扬州万利通旅游用品有限公司,http:////www.11467.com/yangzhou/co/77352.htm
扬州万利通旅游用品有限公司的商铺,http://yangzhou077352.11467.com
扬州市神鹰旅游用品有限公司,http:////www.11467.com/yangzhou/co/77348.htm
扬州市神鹰旅游用品有限公司的商铺,http://yangzhou077348.11467.com
阳江市柏丽美容塑金有限公司,http:////www.11467.com/yangjiang/co/1038.htm
阳江市柏丽美容塑金有限公司的商铺,http://yangjiang01038.11467.com
扬州市邗江富森塑料制刷厂,http:////www.11467.com/yangzhou/co/77347.htm
扬州市邗江富森塑料制刷厂的商铺,http://yangzhou077347.11467.com
扬州恒源日化塑胶有限公司,http:////www.11467.com/yangzhou/co/77314.htm
扬州恒源日化塑胶有限公司的商铺,http://yangzhou077314.11467.com
扬州市邗江杭集今飞旅游用品厂,http:////www.11467.com/yangzhou/co/77161.htm
扬州市邗江杭集今飞旅游用品厂的商铺,http://yangzhou077161.11467.com
扬州洁豪刷业有限公司,http:////www.11467.com/yangzhou/co/77419.htm
扬州洁豪刷业有限公司的商铺,http://yangzhou077419.11467.com
扬州市好迪日用品有限公司,http:////www.11467.com/yangzhou/co/71242.htm
扬州市好迪日用品有限公司的商铺,http://yangzhou071242.11467.com
扬州佳宾旅游用品有限公司,http:////www.11467.com/yangzhou/co/86669.htm
扬州佳宾旅游用品有限公司的商铺,http://yangzhou086669.11467.com
扬州市新桥旅游用品厂,http:////www.11467.com/yangzhou/co/77383.htm
扬州市新桥旅游用品厂的商铺,http://yangzhou077383.11467.com
扬州市茉莉刷业有限公司,http:////www.11467.com/yangzhou/co/77417.htm
扬州市茉莉刷业有限公司的商铺,http://yangzhou077417.11467.com
扬州市邗江龙王旅游日用品厂,http:////www.11467.com/yangzhou/co/70162.htm
扬州市邗江龙王旅游日用品厂的商铺,http://yangzhou070162.11467.com
扬州市邗江杭集爱德酒店用品经营部,http:////www.11467.com/yangzhou/co/77354.htm
扬州市邗江杭集爱德酒店用品经营部的商铺,http://yangzhou077354.11467.com
江苏五星刷业有限公司,http:////www.11467.com/yangzhou/co/77423.htm
江苏五星刷业有限公司的商铺,http://yangzhou077423.11467.com
扬州市宇一酒店用品有限责任公司,http:////www.11467.com/yangzhou/co/77340.htm
扬州市宇一酒店用品有限责任公司的商铺,http://yangzhou077340.11467.com
扬州市邗江大峰旅游用品厂,http:////www.11467.com/yangzhou/co/77355.htm
扬州市邗江大峰旅游用品厂的商铺,http://yangzhou077355.11467.com
阳江市江城区方顺五金厂,http:////www.11467.com/yangjiang/co/14564.htm
阳江市江城区方顺五金厂的商铺,http://yangjiang014564.11467.com
扬州民生刷业日化有限公司,http:////www.11467.com/yangzhou/co/77332.htm
扬州民生刷业日化有限公司的商铺,http://yangzhou077332.11467.com
扬州市邗江健华塑胶制品厂,http:////www.11467.com/yangzhou/co/77316.htm
扬州市邗江健华塑胶制品厂的商铺,http://yangzhou077316.11467.com
扬州祥胜笔刷有限公司,http:////www.11467.com/yangzhou/co/9413.htm
扬州祥胜笔刷有限公司的商铺,http://yangzhou09413.11467.com
扬州市邗江彩虹牙刷厂,http:////www.11467.com/yangzhou/co/10330.htm
扬州市邗江彩虹牙刷厂的商铺,http://yangzhou010330.11467.com
扬州市邗江杭集伟祥旅游用品厂,http:////www.11467.com/yangzhou/co/77382.htm
扬州市邗江杭集伟祥旅游用品厂的商铺,http://yangzhou077382.11467.com
阳东县阳升五金制品厂,http:////www.11467.com/yangjiang/co/23962.htm
阳东县阳升五金制品厂的商铺,http://yangjiang023962.11467.com
扬州业之峰酒店用品有限公司,http:////www.11467.com/yangzhou/co/105917.htm
扬州业之峰酒店用品有限公司的商铺,http://yangzhou0105917.11467.com
江苏鑫禾缘塑胶日化有限公司,http:////www.11467.com/yangzhou/co/86070.htm
江苏鑫禾缘塑胶日化有限公司的商铺,http://yangzhou086070.11467.com
扬州市邗江区新坝联合制刷厂,http:////www.11467.com/yangzhou/co/86744.htm
扬州市邗江区新坝联合制刷厂的商铺,http://yangzhou086744.11467.com
广陵区永大塑料制品厂,http:////www.11467.com/yangzhou/co/108931.htm
广陵区永大塑料制品厂的商铺,http://yangzhou0108931.11467.com
阳江市金帝日用品有限公司,http:////www.11467.com/yangjiang/co/18441.htm
阳江市金帝日用品有限公司的商铺,http://yangjiang018441.11467.com
扬州金源旅游用品有限公司,http:////www.11467.com/yangzhou/co/85851.htm
扬州金源旅游用品有限公司的商铺,http://yangzhou085851.11467.com
阳江市江城区恒鑫五金厂,http:////www.11467.com/yangjiang/co/23939.htm
阳江市江城区恒鑫五金厂的商铺,http://yangjiang023939.11467.com
郑州天翔医疗器械有限公司,http:////www.11467.com/beijing/co/584788.htm
郑州天翔医疗器械有限公司的商铺,http://beijing0584788.11467.com
珠海市艾莎发品贸易行,http:////www.11467.com/zhuhai/co/66802.htm
珠海市艾莎发品贸易行的商铺,http://zhuhai066802.11467.com
北京世纪赢佳生物技术有限公司,http:////www.11467.com/beijing/co/619966.htm
北京世纪赢佳生物技术有限公司的商铺,http://beijing0619966.11467.com
珠海市精首枝化妆用品有限公司,http:////www.11467.com/zhuhai/co/68107.htm
珠海市精首枝化妆用品有限公司的商铺,http://zhuhai068107.11467.com
扬州市邗江飞昕旅游用品厂,http:////www.11467.com/yangzhou/co/77413.htm
扬州市邗江飞昕旅游用品厂的商铺,http://yangzhou077413.11467.com
郑州市二七区豪情百货商行,http:////www.11467.com/zhengzhou/co/127593.htm
郑州市二七区豪情百货商行的商铺,http://zhengzhou0127593.11467.com
扬州三达制刷日化有限公司,http:////www.11467.com/yangzhou/co/84646.htm
扬州三达制刷日化有限公司的商铺,http://yangzhou084646.11467.com
扬州嘉业旅游用品有限公司,http:////www.11467.com/yangzhou/co/77317.htm
扬州嘉业旅游用品有限公司的商铺,http://yangzhou077317.11467.com
扬州市晨美旅游用品厂,http:////www.11467.com/yangzhou/co/82765.htm
扬州市晨美旅游用品厂的商铺,http://yangzhou082765.11467.com
扬州八怪酒店用品有限公司,http:////www.11467.com/yangzhou/co/79758.htm
扬州八怪酒店用品有限公司的商铺,http://yangzhou079758.11467.com
扬州市三星油画笔厂,http:////www.11467.com/yangzhou/co/77335.htm
扬州市三星油画笔厂的商铺,http://yangzhou077335.11467.com
扬州市邗江万紫千红旅游用品厂,http:////www.11467.com/yangzhou/co/77357.htm
扬州市邗江万紫千红旅游用品厂的商铺,http://yangzhou077357.11467.com
扬州市海王牙刷厂,http:////www.11467.com/yangzhou/co/77308.htm
扬州市海王牙刷厂的商铺,http://yangzhou077308.11467.com
扬州市邗江一帆旅游用品厂,http:////www.11467.com/yangzhou/co/77359.htm
扬州市邗江一帆旅游用品厂的商铺,http://yangzhou077359.11467.com
扬州一帘幽梦眼罩厂,http:////www.11467.com/yangzhou/co/86767.htm
扬州一帘幽梦眼罩厂的商铺,http://yangzhou086767.11467.com
香港立方盛世美容(国际)有限公司,http:////www.11467.com/beijing/co/213565.htm
香港立方盛世美容(国际)有限公司的商铺,http://beijing0213565.11467.com
北京康柏伟业商贸有限公司,http:////www.11467.com/beijing/co/299630.htm
北京康柏伟业商贸有限公司的商铺,http://beijing0299630.11467.com
上海慈佛经贸发展有限公司,http:////www.11467.com/shanghai/co/972149.htm
上海慈佛经贸发展有限公司的商铺,http://shanghai0972149.11467.com
北京赛影经贸有限公司,http:////www.11467.com/beijing/co/303938.htm
北京赛影经贸有限公司的商铺,http://beijing0303938.11467.com
北京童童齿科医疗器材有限公司,http:////www.11467.com/beijing/co/649441.htm
北京童童齿科医疗器材有限公司的商铺,http://beijing0649441.11467.com
北京伟明宏业科技发展有限公司,http:////www.11467.com/beijing/co/304034.htm
北京伟明宏业科技发展有限公司的商铺,http://beijing0304034.11467.com
北京鹏博龙益美容美体设备有限公司,http:////www.11467.com/beijing/co/304422.htm
北京鹏博龙益美容美体设备有限公司的商铺,http://beijing0304422.11467.com
赵艾华（个体经营）,http:////www.11467.com/beijing/co/304016.htm
赵艾华（个体经营）的商铺,http://beijing0304016.11467.com
扬州市舒洁日化洗涤用品有限公司,http:////www.11467.com/yangzhou/co/77369.htm
扬州市舒洁日化洗涤用品有限公司的商铺,http://yangzhou077369.11467.com
扬州市皓洁塑料制品有限公司,http:////www.11467.com/yangzhou/co/77377.htm
扬州市皓洁塑料制品有限公司的商铺,http://yangzhou077377.11467.com
扬州市七彩刷业有限公司,http:////www.11467.com/yangzhou/co/77356.htm
扬州市七彩刷业有限公司的商铺,http://yangzhou077356.11467.com
蓝琦电器有限公司,http:////www.11467.com/zhuhai/co/66812.htm
蓝琦电器有限公司的商铺,http://zhuhai066812.11467.com
漳州市锦工工贸有限公司,http:////www.11467.com/zhangzhou/co/36927.htm
漳州市锦工工贸有限公司的商铺,http://zhangzhou036927.11467.com
广陵区玉喜制刷厂,http:////www.11467.com/yangzhou/co/105893.htm
广陵区玉喜制刷厂的商铺,http://yangzhou0105893.11467.com
扬州市邗江玉喜制刷厂,http:////www.11467.com/yangzhou/co/77333.htm
扬州市邗江玉喜制刷厂的商铺,http://yangzhou077333.11467.com
珠海市香洲优美达百货批发商行,http:////www.11467.com/zhuhai/co/100043.htm
珠海市香洲优美达百货批发商行的商铺,http://zhuhai0100043.11467.com
广陵区杭集红叶塑料制品厂,http:////www.11467.com/yangzhou/co/106286.htm
广陵区杭集红叶塑料制品厂的商铺,http://yangzhou0106286.11467.com
北京树唐园林有限公司,http:////www.11467.com/beijing/co/394436.htm
北京树唐园林有限公司的商铺,http://beijing0394436.11467.com
北京生机天天生物科技有限公司,http:////www.11467.com/beijing/co/715059.htm
北京生机天天生物科技有限公司的商铺,http://beijing0715059.11467.com
广陵区杭集镇国辉酒店用品经营部,http:////www.11467.com/yangzhou/co/105916.htm
广陵区杭集镇国辉酒店用品经营部的商铺,http://yangzhou0105916.11467.com
扬州赟烁酒店用品有限公司,http:////www.11467.com/yangzhou/co/106284.htm
扬州赟烁酒店用品有限公司的商铺,http://yangzhou0106284.11467.com
扬州市王氏刷业制品厂,http:////www.11467.com/yangzhou/co/106277.htm
扬州市王氏刷业制品厂的商铺,http://yangzhou0106277.11467.com
扬州市龙王旅游日用品厂,http:////www.11467.com/yangzhou/co/106391.htm
扬州市龙王旅游日用品厂的商铺,http://yangzhou0106391.11467.com
曲沟镇先伟清洁用品百货部,http:////www.11467.com/zhengzhou/co/188994.htm
曲沟镇先伟清洁用品百货部的商铺,http://zhengzhou0188994.11467.com
北京沐润科技发展有限公司,http:////www.11467.com/beijing/co/303491.htm
北京沐润科技发展有限公司的商铺,http://beijing0303491.11467.com
郑州无纺生活用品有限公司,http:////www.11467.com/zhengzhou/co/105552.htm
郑州无纺生活用品有限公司的商铺,http://zhengzhou0105552.11467.com
江苏兴盛刷业有限公司,http:////www.11467.com/yangzhou/co/109008.htm
江苏兴盛刷业有限公司的商铺,http://yangzhou0109008.11467.com
蓬莱晟盛商贸有限公司,http:////www.11467.com/yantai/co/157450.htm
蓬莱晟盛商贸有限公司的商铺,http://yantai0157450.11467.com
中山市东凤镇前途电器厂,http:////www.11467.com/zhongshan/co/118639.htm
中山市东凤镇前途电器厂的商铺,http://zhongshan0118639.11467.com
中山市马顿贸易有限公司,http:////www.11467.com/zhongshan/co/148844.htm
中山市马顿贸易有限公司的商铺,http://zhongshan0148844.11467.com
中山市壹品日用品有限公司,http:////www.11467.com/zhongshan/co/61263.htm
中山市壹品日用品有限公司的商铺,http://zhongshan061263.11467.com
中山市康裕电子科技有限公司,http:////www.11467.com/zhongshan/co/43593.htm
中山市康裕电子科技有限公司的商铺,http://zhongshan043593.11467.com
扬州晟事绩业贸易有限公司,http:////www.11467.com/yangzhou/co/105932.htm
扬州晟事绩业贸易有限公司的商铺,http://yangzhou0105932.11467.com
北京华普领行激光技术有限责任公司,http:////www.11467.com/beijing/co/626782.htm
北京华普领行激光技术有限责任公司的商铺,http://beijing0626782.11467.com
北京霞光骏业光电科技有限公司,http:////www.11467.com/beijing/co/696938.htm
北京霞光骏业光电科技有限公司的商铺,http://beijing0696938.11467.com
南京市九盈机械设备有限公司,http:////www.11467.com/nanjing/co/167721.htm
南京市九盈机械设备有限公司的商铺,http://nanjing0167721.11467.com
扬州市白王刷业有限公司,http:////www.11467.com/yangzhou/co/109219.htm
扬州市白王刷业有限公司的商铺,http://yangzhou0109219.11467.com
上海傲帝机电设备制造有限公司,http:////www.11467.com/shanghai/co/1074288.htm
上海傲帝机电设备制造有限公司的商铺,http://shanghai01074288.11467.com
深圳云春健康科技有限公司,http:////www.11467.com/shenzhen/co/814737.htm
深圳云春健康科技有限公司的商铺,http://shenzhen0814737.11467.com
天津市雷帝贸易发展有限公司,http:////www.11467.com/tianjin/co/86854.htm
天津市雷帝贸易发展有限公司的商铺,http://tianjin086854.11467.com
兰旗轩国际贸易（天津）有限公司,http:////www.11467.com/tianjin/co/60906.htm
兰旗轩国际贸易（天津）有限公司的商铺,http://tianjin060906.11467.com
上海启坚贸易有限公司,http:////www.11467.com/shanghai/co/82504.htm
上海启坚贸易有限公司的商铺,http://shanghai082504.11467.com
上海亮点接发有限公司,http:////www.11467.com/shanghai/co/733863.htm
上海亮点接发有限公司的商铺,http://shanghai0733863.11467.com
林炜(个体经营),http:////www.11467.com/shanghai/co/245621.htm
林炜(个体经营)的商铺,http://shanghai0245621.11467.com
李古森(个体经营）,http:////www.11467.com/shanghai/co/681824.htm
李古森(个体经营）的商铺,http://shanghai0681824.11467.com
天津市华颖印刷有限公司,http:////www.11467.com/tianjin/co/116559.htm
天津市华颖印刷有限公司的商铺,http://tianjin0116559.11467.com
天津中骏美容用品有限公司,http:////www.11467.com/tianjin/co/14435.htm
天津中骏美容用品有限公司的商铺,http://tianjin014435.11467.com
佛山宝康养生保健仪器有限公司,http:////www.11467.com/foshan/co/361473.htm
佛山宝康养生保健仪器有限公司的商铺,http://foshan0361473.11467.com
天津市凤巢理容器材厂,http:////www.11467.com/tianjin/co/14438.htm
天津市凤巢理容器材厂的商铺,http://tianjin014438.11467.com
上海市青浦区练塘镇永丽家具厂,http:////www.11467.com/shanghai/co/801818.htm
上海市青浦区练塘镇永丽家具厂的商铺,http://shanghai0801818.11467.com
天津华世达工贸有限公司,http:////www.11467.com/tianjin/co/187188.htm
天津华世达工贸有限公司的商铺,http://tianjin0187188.11467.com
天津美乐清洁用品有限公司,http:////www.11467.com/tianjin/co/187190.htm
天津美乐清洁用品有限公司的商铺,http://tianjin0187190.11467.com
上海尧圣伍佑实业有限公司,http:////www.11467.com/shanghai/co/801864.htm
上海尧圣伍佑实业有限公司的商铺,http://shanghai0801864.11467.com
上海泰富科技有限公司,http:////www.11467.com/shanghai/co/733827.htm
上海泰富科技有限公司的商铺,http://shanghai0733827.11467.com
上海医妮实业有限公司,http:////www.11467.com/shanghai/co/933763.htm
上海医妮实业有限公司的商铺,http://shanghai0933763.11467.com
佛山康鼎熏蒸设备二一零公司,http:////www.11467.com/foshan/co/374302.htm
佛山康鼎熏蒸设备二一零公司的商铺,http://foshan0374302.11467.com
佛山水姿然美容科技有限公司,http:////www.11467.com/foshan/co/361495.htm
佛山水姿然美容科技有限公司的商铺,http://foshan0361495.11467.com
天津市盈源数码电子产品销售中心,http:////www.11467.com/tianjin/co/139860.htm
天津市盈源数码电子产品销售中心的商铺,http://tianjin0139860.11467.com
深圳市溢美化妆用具有限公司,http:////www.11467.com/shenzhen/co/814508.htm
深圳市溢美化妆用具有限公司的商铺,http://shenzhen0814508.11467.com
广陵区爱思家宾馆酒店用品厂销售部,http:////www.11467.com/yangzhou/co/109225.htm
广陵区爱思家宾馆酒店用品厂销售部的商铺,http://yangzhou0109225.11467.com
阳江市江城区荣杰美容五金厂,http:////www.11467.com/yangjiang/co/28304.htm
阳江市江城区荣杰美容五金厂的商铺,http://yangjiang028304.11467.com
上海山客环保科技发展有限公司,http:////www.11467.com/shanghai/co/260771.htm
上海山客环保科技发展有限公司的商铺,http://shanghai0260771.11467.com
上海梦科实业有限公司,http:////www.11467.com/shanghai/co/1037253.htm
上海梦科实业有限公司的商铺,http://shanghai01037253.11467.com
天津市正和宜保健用品有限公司,http:////www.11467.com/tianjin/co/196315.htm
天津市正和宜保健用品有限公司的商铺,http://tianjin0196315.11467.com
长沙森思卫浴设备有限公司,http:////www.11467.com/changsha/co/142670.htm
长沙森思卫浴设备有限公司的商铺,http://changsha0142670.11467.com
东莞木之美实业有限公司,http:////www.11467.com/dongguan/co/557891.htm
东莞木之美实业有限公司的商铺,http://dongguan0557891.11467.com
北京午晟智造建筑工程有限公司,http:////www.11467.com/beijing/co/732234.htm
北京午晟智造建筑工程有限公司的商铺,http://beijing0732234.11467.com
东莞市万江康浴美日用品店,http:////www.11467.com/dongguan/co/600912.htm
东莞市万江康浴美日用品店的商铺,http://dongguan0600912.11467.com
深圳市鸿宇酒店用品有限公司,http:////www.11467.com/shenzhen/co/880566.htm
深圳市鸿宇酒店用品有限公司的商铺,http://shenzhen0880566.11467.com
广州市白云区龙归金恒美美容美体设备厂,http:////www.11467.com/guangzhou/co/554451.htm
广州市白云区龙归金恒美美容美体设备厂的商铺,http://guangzhou0554451.11467.com
云城区庆业石材护理产品店,http:////www.11467.com/yunfu/co/30313.htm
云城区庆业石材护理产品店的商铺,http://yunfu030313.11467.com
法尔曼中国化妆品有限公司,http:////www.11467.com/shenzhen/co/820595.htm
法尔曼中国化妆品有限公司的商铺,http://shenzhen0820595.11467.com
潮州市潮安区约汉保罗卫浴有限公司,http:////www.11467.com/chaozhou/co/37251.htm
潮州市潮安区约汉保罗卫浴有限公司的商铺,http://chaozhou037251.11467.com
潮州市潮安区英歌尼斯卫浴有限公司,http:////www.11467.com/chaozhou/co/37393.htm
潮州市潮安区英歌尼斯卫浴有限公司的商铺,http://chaozhou037393.11467.com
南安林芳卫浴有限公司,http:////www.11467.com/quanzhou/co/153785.htm
南安林芳卫浴有限公司的商铺,http://quanzhou0153785.11467.com
广州广曼生物科技有限公司,http:////www.11467.com/guangzhou/co/536060.htm
广州广曼生物科技有限公司的商铺,http://guangzhou0536060.11467.com
扬州华寅旅游用品公司,http:////www.11467.com/yangzhou/co/109263.htm
扬州华寅旅游用品公司的商铺,http://yangzhou0109263.11467.com
香港美研国际有限公司,http:////www.11467.com/shenzhen/co/1003682.htm
香港美研国际有限公司的商铺,http://shenzhen01003682.11467.com
深圳市素妍美科技有限公司,http:////www.11467.com/shenzhen/co/853743.htm
深圳市素妍美科技有限公司的商铺,http://shenzhen0853743.11467.com
连云港久工商贸有限公司,http:////www.11467.com/lianyungang/co/45254.htm
连云港久工商贸有限公司的商铺,http://lianyungang045254.11467.com
欣然旅游用品厂,http:////www.11467.com/yangzhou/co/113602.htm
欣然旅游用品厂的商铺,http://yangzhou0113602.11467.com
东莞市舒博日用品有限公司,http:////www.11467.com/dongguan/co/571152.htm
东莞市舒博日用品有限公司的商铺,http://dongguan0571152.11467.com
泉州瑞航卫浴有限公司,http:////www.11467.com/quanzhou/co/152789.htm
泉州瑞航卫浴有限公司的商铺,http://quanzhou0152789.11467.com
上海柯迪经贸发展有限公司,http:////www.11467.com/shanghai/co/892856.htm
上海柯迪经贸发展有限公司的商铺,http://shanghai0892856.11467.com
上海吉速护理用品有限公司,http:////www.11467.com/shanghai/co/424337.htm
上海吉速护理用品有限公司的商铺,http://shanghai0424337.11467.com
广州市智颜美容设备有限公司,http:////www.11467.com/guangzhou/co/696762.htm
广州市智颜美容设备有限公司的商铺,http://guangzhou0696762.11467.com
扬州优美乐口腔护理用品有限公司,http:////www.11467.com/yangzhou/co/117331.htm
扬州优美乐口腔护理用品有限公司的商铺,http://yangzhou0117331.11467.com
