南京利昂医疗设备制造有限公司,http:////www.11467.com/nanjing/co/172656.htm
南京利昂医疗设备制造有限公司的商铺,http://nanjing0172656.11467.com
山东三汇医疗科技有限公司,http:////www.11467.com/linyi/co/112006.htm
山东三汇医疗科技有限公司的商铺,http://linyi0112006.11467.com
山东泽普医疗科技有限公司,http:////www.11467.com/weifang/co/172831.htm
山东泽普医疗科技有限公司的商铺,http://weifang0172831.11467.com
广州辰美化妆品有限公司,http:////www.11467.com/guangzhou/co/668537.htm
广州辰美化妆品有限公司的商铺,http://guangzhou0668537.11467.com
济南闰凯医疗器械有限公司,http:////www.11467.com/jinan/co/133168.htm
济南闰凯医疗器械有限公司的商铺,http://jinan0133168.11467.com
深圳市景瑞科技有限公司,http:////www.11467.com/shenzhen/co/766275.htm
深圳市景瑞科技有限公司的商铺,http://shenzhen0766275.11467.com
景众盛（北京）国际贸易有限公司,http:////www.11467.com/beijing/co/691503.htm
景众盛（北京）国际贸易有限公司的商铺,http://beijing0691503.11467.com
北京中成康富科技有限公司,http:////www.11467.com/beijing/co/704336.htm
北京中成康富科技有限公司的商铺,http://beijing0704336.11467.com
北京加成通业信息咨询有限公司,http:////www.11467.com/beijing/co/85111.htm
桂林益多贝养生咨询有限公司,http:////www.11467.com/guilin/co/51223.htm
山东方格医疗器械有限公司,http:////www.11467.com/liaocheng/co/38347.htm
山东方格医疗器械有限公司的商铺,http://liaocheng038347.11467.com
上海开元骨科医院有限公司,http:////www.11467.com/shanghai/co/1040070.htm
上海开元骨科医院有限公司的商铺,http://shanghai01040070.11467.com
广州市健奥科技有限公司,http:////www.11467.com/guangzhou/co/696778.htm
广州市健奥科技有限公司的商铺,http://guangzhou0696778.11467.com
山东九尔实业集团有限公司,http:////www.11467.com/jining/co/106688.htm
山东九尔实业集团有限公司的商铺,http://jining0106688.11467.com
山东世通检测评价技术服务有限公司,http:////www.11467.com/qingdao/co/194406.htm
山东世通检测评价技术服务有限公司的商铺,http://qingdao0194406.11467.com
广东金豪漾控股有限公司,http:////www.11467.com/guangzhou/co/735742.htm
广东金豪漾控股有限公司的商铺,http://guangzhou0735742.11467.com
山东木齐健康科技有限公司,http:////www.11467.com/jinan/co/153331.htm
山东木齐健康科技有限公司的商铺,http://jinan0153331.11467.com
广州市多魅化妆品有限公司,http:////www.11467.com/guangzhou/co/748110.htm
广州市多魅化妆品有限公司的商铺,http://guangzhou0748110.11467.com
广州汉妆生物科技有限公司,http:////www.11467.com/guangzhou/co/668475.htm
广州汉妆生物科技有限公司的商铺,http://guangzhou0668475.11467.com
北京中科海德科技有限公司,http:////www.11467.com/beijing/co/338129.htm
北京中科海德科技有限公司的商铺,http://beijing0338129.11467.com
山东圣海保健品有限公司,http:////www.11467.com/zibo/co/84066.htm
山东圣海保健品有限公司的商铺,http://zibo084066.11467.com
臻汇美（北京）科技有限公司,http:////www.11467.com/beijing/co/762186.htm
臻汇美（北京）科技有限公司的商铺,http://beijing0762186.11467.com
广州荣陶医疗科技有限公司,http:////www.11467.com/guangzhou/co/506995.htm
广州荣陶医疗科技有限公司的商铺,http://guangzhou0506995.11467.com
烟台市马可波罗电子科技有限公司,http:////www.11467.com/yantai/co/127276.htm
烟台市马可波罗电子科技有限公司的商铺,http://yantai0127276.11467.com
漯河市华辉日用品有限公司,http:////www.11467.com/luohe/co/18752.htm
漯河市华辉日用品有限公司的商铺,http://luohe018752.11467.com
河南阿拉丁医疗器械有限公司,http:////www.11467.com/zhengzhou/co/170334.htm
河南阿拉丁医疗器械有限公司的商铺,http://zhengzhou0170334.11467.com
武汉航美科技有限公司,http:////www.11467.com/wuhan/co/210833.htm
武汉航美科技有限公司的商铺,http://wuhan0210833.11467.com
北京创发卫生用品有限公司,http:////www.11467.com/beijing/co/631309.htm
北京创发卫生用品有限公司的商铺,http://beijing0631309.11467.com
广州诗蒂兰化妆品有限公司,http:////www.11467.com/guangzhou/co/683239.htm
广州诗蒂兰化妆品有限公司的商铺,http://guangzhou0683239.11467.com
广州荫薇贸易有限公司成都分公司,http:////www.11467.com/chengdu/co/289092.htm
广州荫薇贸易有限公司成都分公司的商铺,http://chengdu0289092.11467.com
广州艾爱贴生物科技有限公司,http:////www.11467.com/guangzhou/co/735649.htm
广州艾爱贴生物科技有限公司的商铺,http://guangzhou0735649.11467.com
上海梅宁医疗设备科技有限公司,http:////www.11467.com/shanghai/co/1194613.htm
上海梅宁医疗设备科技有限公司的商铺,http://shanghai01194613.11467.com
河南和贵恒实业有限公司,http:////www.11467.com/zhengzhou/co/199552.htm
河南和贵恒实业有限公司的商铺,http://zhengzhou0199552.11467.com
济南百洁帮环保科技有限公司,http:////www.11467.com/jinan/co/159206.htm
济南百洁帮环保科技有限公司的商铺,http://jinan0159206.11467.com
北京波斯卡科技有限公司,http:////www.11467.com/beijing/co/116873.htm
北京波斯卡科技有限公司的商铺,http://beijing0116873.11467.com
广州珂纳偲生物技术有限公司,http:////www.11467.com/guangzhou/co/608859.htm
广州珂纳偲生物技术有限公司的商铺,http://guangzhou0608859.11467.com
广州创弘医疗科技有限公司,http:////www.11467.com/guangzhou/co/683249.htm
广州创弘医疗科技有限公司的商铺,http://guangzhou0683249.11467.com
广州碧莲生物科技有限公司,http:////www.11467.com/guangzhou/co/696735.htm
广州碧莲生物科技有限公司的商铺,http://guangzhou0696735.11467.com
洛阳美贝宠物食品有限公司,http:////www.11467.com/luoyang/co/50541.htm
洛阳美贝宠物食品有限公司的商铺,http://luoyang050541.11467.com
西安捷康医疗科技有限公司,http:////www.11467.com/xian/co/171206.htm
西安捷康医疗科技有限公司的商铺,http://xian0171206.11467.com
广州玟莎生物科技有限公司,http:////www.11467.com/guangzhou/co/730525.htm
广州玟莎生物科技有限公司的商铺,http://guangzhou0730525.11467.com
武汉波睿达生物科技有限公司,http:////www.11467.com/wuhan/co/201300.htm
武汉波睿达生物科技有限公司的商铺,http://wuhan0201300.11467.com
广州汉森生物科技有限公司,http:////www.11467.com/guangzhou/co/701961.htm
广州汉森生物科技有限公司的商铺,http://guangzhou0701961.11467.com
广州市世季彩生物科技有限公司,http:////www.11467.com/guangzhou/co/702059.htm
广州市世季彩生物科技有限公司的商铺,http://guangzhou0702059.11467.com
中山市优普卫浴有限公司,http:////www.11467.com/zhongshan/co/132974.htm
中山市优普卫浴有限公司的商铺,http://zhongshan0132974.11467.com
中山市莎丽卫浴设备有限公司,http:////www.11467.com/foshan/co/159375.htm
中山市莎丽卫浴设备有限公司的商铺,http://foshan0159375.11467.com
广州良美电子有限公司,http:////www.11467.com/guangzhou/co/459942.htm
广州良美电子有限公司的商铺,http://guangzhou0459942.11467.com
广州市康亦健医疗设备有限公司,http:////www.11467.com/guangzhou/co/418226.htm
广州市康亦健医疗设备有限公司的商铺,http://guangzhou0418226.11467.com
北京灵如韵文化传播有限公司,http:////www.11467.com/beijing/co/762144.htm
北京灵如韵文化传播有限公司的商铺,http://beijing0762144.11467.com
上海汉甲美甲艺术有限公司,http:////www.11467.com/shanghai/co/1117957.htm
上海汉甲美甲艺术有限公司的商铺,http://shanghai01117957.11467.com
广州淳雅生物科技有限公司,http:////www.11467.com/guangzhou/co/668700.htm
广州淳雅生物科技有限公司的商铺,http://guangzhou0668700.11467.com
广州臻濠美生物科技有限公司,http:////www.11467.com/guangzhou/co/642988.htm
上海宁耳医疗器械有限公司,http:////www.11467.com/shanghai/co/1198220.htm
上海宁耳医疗器械有限公司的商铺,http://shanghai01198220.11467.com
南昌迈柯尔医疗器械有限公司,http:////www.11467.com/nanchang/co/107360.htm
南昌迈柯尔医疗器械有限公司的商铺,http://nanchang0107360.11467.com
广州奇俊电子科技有限公司,http:////www.11467.com/zhengzhou/co/148747.htm
广州奇俊电子科技有限公司的商铺,http://zhengzhou0148747.11467.com
深圳弗犹彻电子有限公司,http:////www.11467.com/shenzhen/co/154576.htm
深圳弗犹彻电子有限公司的商铺,http://shenzhen0154576.11467.com
广州源美生物科技有限公司,http:////www.11467.com/guangzhou/co/432165.htm
广州源美生物科技有限公司的商铺,http://guangzhou0432165.11467.com
广州索诺星信息科技有限公司,http:////www.11467.com/guangzhou/co/455106.htm
广州索诺星信息科技有限公司的商铺,http://guangzhou0455106.11467.com
扬州众邦家居有限公司,http:////www.11467.com/yangzhou/co/89826.htm
扬州众邦家居有限公司的商铺,http://yangzhou089826.11467.com
承德市双桥汇佳商店,http:////www.11467.com/chengde/co/21928.htm
承德市双桥汇佳商店的商铺,http://chengde021928.11467.com
纪露露（个体经营）,http:////www.11467.com/chuzhou/co/20704.htm
纪露露（个体经营）的商铺,http://chuzhou020704.11467.com
广州市美丽鑫达美容仪器有限公司,http:////www.11467.com/guangzhou/co/724879.htm
广州市美丽鑫达美容仪器有限公司的商铺,http://guangzhou0724879.11467.com
臻汇美北京科技有限公司,http:////www.11467.com/beijing/co/762546.htm
臻汇美北京科技有限公司的商铺,http://beijing0762546.11467.com
济南费格医疗器械有限公司,http:////www.11467.com/jinan/co/113870.htm
济南费格医疗器械有限公司的商铺,http://jinan0113870.11467.com
广州姿矜美美容设备有限公司,http:////www.11467.com/guangzhou/co/610030.htm
广州姿矜美美容设备有限公司的商铺,http://guangzhou0610030.11467.com
钟祥安利（王海波）工作室,http:////www.11467.com/jingmen/co/19351.htm
钟祥安利（王海波）工作室的商铺,http://jingmen019351.11467.com
安平县三石医用颈托厂,http:////www.11467.com/hengshui/co/61988.htm
安平县三石医用颈托厂的商铺,http://hengshui061988.11467.com
北京金华汉新技术有限责任公司,http:////www.11467.com/beijing/co/251780.htm
北京金华汉新技术有限责任公司的商铺,http://beijing0251780.11467.com
沈阳市视明青少年近视研究中心,http:////www.11467.com/shenyang/co/54616.htm
沈阳市视明青少年近视研究中心的商铺,http://shenyang054616.11467.com
天津市康婷生物工程有限公司,http:////www.11467.com/tianjin/co/247014.htm
天津市康婷生物工程有限公司的商铺,http://tianjin0247014.11467.com
佛山澳蓝朵护理用品有限公司,http:////www.11467.com/foshan/co/434815.htm
佛山澳蓝朵护理用品有限公司的商铺,http://foshan0434815.11467.com
安庆钰喜卫生制品有限公司,http:////www.11467.com/anqing/co/24149.htm
安庆钰喜卫生制品有限公司的商铺,http://anqing024149.11467.com
广州市东樱生物科技有限公司,http:////www.11467.com/guangzhou/co/413604.htm
广州市东樱生物科技有限公司的商铺,http://guangzhou0413604.11467.com
上海福祥商贸有限公司,http:////www.11467.com/shanghai/co/362204.htm
上海福祥商贸有限公司的商铺,http://shanghai0362204.11467.com
深圳市渲美科技股份有限公司,http:////www.11467.com/shenzhen/co/1128268.htm
深圳市渲美科技股份有限公司的商铺,http://shenzhen01128268.11467.com
广州帕芙欧生物科技有限公司,http:////www.11467.com/guangzhou/co/753095.htm
广州帕芙欧生物科技有限公司的商铺,http://guangzhou0753095.11467.com
郑州纤仙秀美容仪器有限公司,http:////www.11467.com/zhengzhou/co/236862.htm
郑州纤仙秀美容仪器有限公司的商铺,http://zhengzhou0236862.11467.com
东莞市潮牌牙膏有限公司,http:////www.11467.com/dongguan/co/632290.htm
东莞市潮牌牙膏有限公司的商铺,http://dongguan0632290.11467.com
深圳市贝斯曼精密仪器有限公司,http:////www.11467.com/shenzhen/co/708168.htm
深圳市贝斯曼精密仪器有限公司的商铺,http://shenzhen0708168.11467.com
北京宏强科技有限责任公司,http:////www.11467.com/beijing/co/761200.htm
北京宏强科技有限责任公司的商铺,http://beijing0761200.11467.com
东莞东韵科技有限公司,http:////www.11467.com/dongguan/co/614392.htm
东莞东韵科技有限公司的商铺,http://dongguan0614392.11467.com
广州市有喜化妆品有限公司,http:////www.11467.com/guangzhou/co/429511.htm
广州市有喜化妆品有限公司的商铺,http://guangzhou0429511.11467.com
佛山市顺德区大心卫浴实业有限公司,http:////www.11467.com/foshan/co/345169.htm
佛山市顺德区大心卫浴实业有限公司的商铺,http://foshan0345169.11467.com
温州永钰理容五金有限公司,http:////www.11467.com/wenzhou/co/284130.htm
温州永钰理容五金有限公司的商铺,http://wenzhou0284130.11467.com
世明网络工作室,http:////www.11467.com/jinhua/co/195874.htm
世明网络工作室的商铺,http://jinhua0195874.11467.com
平阳韩禾一禾三生商贸有限公司,http:////www.11467.com/changsha/co/165804.htm
平阳韩禾一禾三生商贸有限公司的商铺,http://changsha0165804.11467.com
广州惠仕康保健用品有限公司,http:////www.11467.com/guangzhou/co/460710.htm
广州惠仕康保健用品有限公司的商铺,http://guangzhou0460710.11467.com
广州市康蓉科技有限公司,http:////www.11467.com/guangzhou/co/132849.htm
广州市康蓉科技有限公司的商铺,http://guangzhou0132849.11467.com
安徽天添塑业有限公司,http:////www.11467.com/anqing/co/35199.htm
安徽天添塑业有限公司的商铺,http://anqing035199.11467.com
三维医疗科技江苏股份有限公司,http:////www.11467.com/xuzhou/co/63649.htm
三维医疗科技江苏股份有限公司的商铺,http://xuzhou063649.11467.com
广州普馨生物科技有限公司,http:////www.11467.com/guangzhou/co/724912.htm
广州普馨生物科技有限公司的商铺,http://guangzhou0724912.11467.com
深圳市世博视科技有限公司,http:////www.11467.com/shenzhen/co/1127835.htm
深圳市世博视科技有限公司的商铺,http://shenzhen01127835.11467.com
深圳市宜丽环保科技股份有限公司,http:////www.11467.com/shenzhen/co/1128064.htm
深圳市宜丽环保科技股份有限公司的商铺,http://shenzhen01128064.11467.com
青岛正信检测分析有限公司,http:////www.11467.com/qingdao/co/188327.htm
青岛正信检测分析有限公司的商铺,http://qingdao0188327.11467.com
北京盛美利亚生物科技有限公司,http:////www.11467.com/beijing/co/763327.htm
北京盛美利亚生物科技有限公司的商铺,http://beijing0763327.11467.com
西安麦子网络科技有限公司,http:////www.11467.com/xian/co/167788.htm
西安麦子网络科技有限公司的商铺,http://xian0167788.11467.com
鋭茵科技（深圳）有限公司,http:////www.11467.com/qiye/93077942.htm
鋭茵科技（深圳）有限公司的商铺,http://93077942.b2b.11467.com
美添美粒科技（深圳）有限公司,http:////www.11467.com/qiye/93161514.htm
美添美粒科技（深圳）有限公司的商铺,http://93161514.b2b.11467.com
广州杨家造生物科技有限公司,http:////www.11467.com/guangzhou/co/745331.htm
广州杨家造生物科技有限公司的商铺,http://guangzhou0745331.11467.com
安徽省华笙信息咨询有限公司,http:////www.11467.com/hefei/co/176213.htm
安徽省华笙信息咨询有限公司的商铺,http://hefei0176213.11467.com
烟台市宜生健保健科技有限公司,http:////www.11467.com/yantai/co/121402.htm
烟台市宜生健保健科技有限公司的商铺,http://yantai0121402.11467.com
陕西森弗高科实业有限公司,http:////www.11467.com/xian/co/85298.htm
陕西森弗高科实业有限公司的商铺,http://xian085298.11467.com
广州美子工艺品制造有限公司,http:////www.11467.com/guangzhou/co/160974.htm
广州美子工艺品制造有限公司的商铺,http://guangzhou0160974.11467.com
汕头市澄海区日丽工艺礼品厂,http:////www.11467.com/guangzhou/co/161254.htm
汕头市澄海区日丽工艺礼品厂的商铺,http://guangzhou0161254.11467.com
阳江市精致工贸有限公司,http:////www.11467.com/yangjiang/co/14695.htm
阳江市精致工贸有限公司的商铺,http://yangjiang014695.11467.com
广州中汉口腔用品有限公司,http:////www.11467.com/guangzhou/co/142026.htm
广州中汉口腔用品有限公司的商铺,http://guangzhou0142026.11467.com
江门市新会区广鸿五金塑料制品有限公司,http:////www.11467.com/jiangmen/co/88635.htm
江门市新会区广鸿五金塑料制品有限公司的商铺,http://jiangmen088635.11467.com
揭阳市榕城区新兴喜乐塑胶制品厂,http:////www.11467.com/jieyang/co/17679.htm
揭阳市榕城区新兴喜乐塑胶制品厂的商铺,http://jieyang017679.11467.com
南宁红健红商贸有限责任公司,http:////www.11467.com/nanning/co/61966.htm
南宁红健红商贸有限责任公司的商铺,http://nanning061966.11467.com
辽宁佳时保健植物油开发有限公司,http:////www.11467.com/shenyang/co/73405.htm
辽宁佳时保健植物油开发有限公司的商铺,http://shenyang073405.11467.com
广州智尚美容用品有限公司,http:////www.11467.com/guangzhou/co/142130.htm
广州智尚美容用品有限公司的商铺,http://guangzhou0142130.11467.com
广州艾颜佳美容美发设备有限公司,http:////www.11467.com/guangzhou/co/459216.htm
广州艾颜佳美容美发设备有限公司的商铺,http://guangzhou0459216.11467.com
西安际华三五一一家纺有限公司,http:////www.11467.com/xian/co/52300.htm
西安际华三五一一家纺有限公司的商铺,http://xian052300.11467.com
深圳市中家家庭服务有限公司,http:////www.11467.com/shenzhen/co/689238.htm
深圳市中家家庭服务有限公司的商铺,http://shenzhen0689238.11467.com
辽宁维视康眼镜有限公司,http:////www.11467.com/shenyang/co/96378.htm
辽宁维视康眼镜有限公司的商铺,http://shenyang096378.11467.com
广州汉佰斯日化科技发展有限公司,http:////www.11467.com/guangzhou/co/494759.htm
广州汉佰斯日化科技发展有限公司的商铺,http://guangzhou0494759.11467.com
许昌正远工贸有限公司,http:////www.11467.com/xuchang/co/16911.htm
许昌正远工贸有限公司的商铺,http://xuchang016911.11467.com
广州净派保洁消毒用品有限公司,http:////www.11467.com/guangzhou/co/472346.htm
广州净派保洁消毒用品有限公司的商铺,http://guangzhou0472346.11467.com
杭州凯扬电子有限公司,http:////www.11467.com/hangzhou/co/249637.htm
杭州凯扬电子有限公司的商铺,http://hangzhou0249637.11467.com
深圳市华立鑫科技有限公司,http:////www.11467.com/shenzhen/co/115706.htm
深圳市华立鑫科技有限公司的商铺,http://shenzhen0115706.11467.com
无锡圣马科技有限公司,http:////www.11467.com/hangzhou/co/237146.htm
无锡圣马科技有限公司的商铺,http://hangzhou0237146.11467.com
广州市白云区富强美容仪器厂,http:////www.11467.com/guangzhou/co/475193.htm
广州市白云区富强美容仪器厂的商铺,http://guangzhou0475193.11467.com
深圳市理研现代科技有限公司,http:////www.11467.com/shenzhen/co/768894.htm
深圳市理研现代科技有限公司的商铺,http://shenzhen0768894.11467.com
广州市杰森健身器材有限公司,http:////www.11467.com/guangzhou/co/455621.htm
广州市杰森健身器材有限公司的商铺,http://guangzhou0455621.11467.com
广州鸿盛电子科技有限公司,http:////www.11467.com/guangzhou/co/161556.htm
广州鸿盛电子科技有限公司的商铺,http://guangzhou0161556.11467.com
安平县隆基医疗器械厂,http:////www.11467.com/hengshui/co/35277.htm
安平县隆基医疗器械厂的商铺,http://hengshui035277.11467.com
深圳市易博利科技有限公司,http:////www.11467.com/shenzhen/co/159046.htm
深圳市易博利科技有限公司的商铺,http://shenzhen0159046.11467.com
深圳市欧脉威科技有限公司,http:////www.11467.com/shenzhen/co/775524.htm
深圳市欧脉威科技有限公司的商铺,http://shenzhen0775524.11467.com
阳江佳永实业有限公司,http:////www.11467.com/yangjiang/co/22039.htm
阳江佳永实业有限公司的商铺,http://yangjiang022039.11467.com
深圳市怡康科技有限公司,http:////www.11467.com/shenzhen/co/223940.htm
深圳市怡康科技有限公司的商铺,http://shenzhen0223940.11467.com
广州京妍生物科技有限公司,http:////www.11467.com/guangzhou/co/494807.htm
广州京妍生物科技有限公司的商铺,http://guangzhou0494807.11467.com
广州康的商贸有限公司,http:////www.11467.com/guangzhou/co/150773.htm
广州康的商贸有限公司的商铺,http://guangzhou0150773.11467.com
杭州临安英姿无纺制品有限公司,http:////www.11467.com/hangzhou/co/391403.htm
杭州临安英姿无纺制品有限公司的商铺,http://hangzhou0391403.11467.com
吉林生物研究院有限公司,http:////www.11467.com/jilinshi/co/30843.htm
吉林生物研究院有限公司的商铺,http://jilinshi030843.11467.com
深圳市景年商贸有限公司,http:////www.11467.com/shenzhen/co/578210.htm
深圳市景年商贸有限公司的商铺,http://shenzhen0578210.11467.com
深圳市铭煌达电子有限公司,http:////www.11467.com/shenzhen/co/724980.htm
深圳市铭煌达电子有限公司的商铺,http://shenzhen0724980.11467.com
深圳市恩鹏科技有限公司,http:////www.11467.com/shenzhen/co/3005.htm
深圳市恩鹏科技有限公司的商铺,http://shenzhen03005.11467.com
深圳市安诺日化用品有限公司,http:////www.11467.com/shenzhen/co/87751.htm
深圳市安诺日化用品有限公司的商铺,http://shenzhen087751.11467.com
义乌市赛飞美容用具有限公司,http:////www.11467.com/jinhua/co/122926.htm
义乌市赛飞美容用具有限公司的商铺,http://jinhua0122926.11467.com
青岛嘉人贸易有限公司,http:////www.11467.com/qingdao/co/172258.htm
青岛嘉人贸易有限公司的商铺,http://qingdao0172258.11467.com
广州乐儿达儿童用品有限公司,http:////www.11467.com/guangzhou/co/195257.htm
广州乐儿达儿童用品有限公司的商铺,http://guangzhou0195257.11467.com
广州市德馨蜡制品有限公司,http:////www.11467.com/guangzhou/co/430716.htm
广州市德馨蜡制品有限公司的商铺,http://guangzhou0430716.11467.com
江苏梦妃丝织造有限公司,http:////www.11467.com/huaian/co/52820.htm
江苏梦妃丝织造有限公司的商铺,http://huaian052820.11467.com
广州市吉康医疗科技有限公司,http:////www.11467.com/guangzhou/co/430872.htm
广州市吉康医疗科技有限公司的商铺,http://guangzhou0430872.11467.com
深圳市雅诗卡洛科技有限公司,http:////www.11467.com/shenzhen/co/791638.htm
深圳市雅诗卡洛科技有限公司的商铺,http://shenzhen0791638.11467.com
许昌艾丝发制品有限公司,http:////www.11467.com/xuchang/co/22584.htm
许昌艾丝发制品有限公司的商铺,http://xuchang022584.11467.com
石家庄惠众科技有限公司,http:////www.11467.com/shijiazhuang/co/91690.htm
石家庄惠众科技有限公司的商铺,http://shijiazhuang091690.11467.com
山西京海实业有限公司,http:////www.11467.com/taiyuan/co/91514.htm
山西京海实业有限公司的商铺,http://taiyuan091514.11467.com
潍坊正德医疗科技有限公司,http:////www.11467.com/weifang/co/103063.htm
潍坊正德医疗科技有限公司的商铺,http://weifang0103063.11467.com
武汉南韩爱丽光电科技有限公司,http:////www.11467.com/wuhan/co/142108.htm
武汉南韩爱丽光电科技有限公司的商铺,http://wuhan0142108.11467.com
广州汇格生物科技有限公司,http:////www.11467.com/guangzhou/co/655215.htm
广州汇格生物科技有限公司的商铺,http://guangzhou0655215.11467.com
济宁市碧海洗涤用品有限公司,http:////www.11467.com/jining/co/107352.htm
济宁市碧海洗涤用品有限公司的商铺,http://jining0107352.11467.com
广州鼎松生物科技有限公司,http:////www.11467.com/guangzhou/co/554477.htm
广州鼎松生物科技有限公司的商铺,http://guangzhou0554477.11467.com
广州家事无忧家庭服务股份有限公司,http:////www.11467.com/guangzhou/co/660166.htm
广州家事无忧家庭服务股份有限公司的商铺,http://guangzhou0660166.11467.com
天津泰科激光科技发展有限公司,http:////www.11467.com/tianjin/co/36489.htm
天津泰科激光科技发展有限公司的商铺,http://tianjin036489.11467.com
重庆新大地电子有限公司,http:////www.11467.com/chongqing/co/8182.htm
重庆新大地电子有限公司的商铺,http://chongqing08182.11467.com
御美坊(北京)化妆品有限公司,http:////www.11467.com/beijing/co/213531.htm
御美坊(北京)化妆品有限公司的商铺,http://beijing0213531.11467.com
天津世纪圣发集团有限公司,http:////www.11467.com/tianjin/co/34900.htm
天津世纪圣发集团有限公司的商铺,http://tianjin034900.11467.com
天津市世纪中海医疗设备有限公司,http:////www.11467.com/tianjin/co/48504.htm
天津市世纪中海医疗设备有限公司的商铺,http://tianjin048504.11467.com
