合肥德徽印务有限公司,http:////www.11467.com/hefei/co/104410.htm
合肥德徽印务有限公司的商铺,http://hefei0104410.11467.com
北京市青云兴业印刷有限公司,http:////www.11467.com/beijing/co/763644.htm
北京市青云兴业印刷有限公司的商铺,http://beijing0763644.11467.com
上海晨辉印刷厂,http:////www.11467.com/shanghai/co/1306126.htm
北京梅珍文化发展有限公司,http:////www.11467.com/beijing/co/115126.htm
北京梅珍文化发展有限公司的商铺,http://beijing0115126.11467.com
安徽省快马印务有限责任公司,http:////www.11467.com/hefei/co/87000.htm
安徽省快马印务有限责任公司的商铺,http://hefei087000.11467.com
苍南县意宝工艺厂,http:////www.11467.com/wenzhou/co/215716.htm
苍南县意宝工艺厂的商铺,http://wenzhou0215716.11467.com
北京富瑞思泰包装制品有限公司,http:////www.11467.com/beijing/co/701348.htm
北京富瑞思泰包装制品有限公司的商铺,http://beijing0701348.11467.com
南昌挂历、画册广告礼品销售有限公司,http:////www.11467.com/nanchang/co/100680.htm
南昌挂历、画册广告礼品销售有限公司的商铺,http://nanchang0100680.11467.com
东莞石排印刷厂,http:////www.11467.com/dongguan/co/488376.htm
东莞石排印刷厂的商铺,http://dongguan0488376.11467.com
常州市华诚印刷有限公司,http:////www.11467.com/changzhou/co/10504.htm
常州市华诚印刷有限公司的商铺,http://changzhou010504.11467.com
衡阳市顺昌印务有限公司,http:////www.11467.com/hengyang/co/26656.htm
衡阳市顺昌印务有限公司的商铺,http://hengyang026656.11467.com
湘潭鸿嘉彩色印刷有限公司,http:////www.11467.com/xiangtan/co/24536.htm
湘潭鸿嘉彩色印刷有限公司的商铺,http://xiangtan024536.11467.com
长沙市新天地印刷设计有限公司,http:////www.11467.com/changsha/co/78987.htm
长沙市新天地印刷设计有限公司的商铺,http://changsha078987.11467.com
廊坊市恒泰印务有限公司 销售部,http:////www.11467.com/langfang/co/32544.htm
廊坊市恒泰印务有限公司 销售部的商铺,http://langfang032544.11467.com
廊坊市安次区码头镇利军印刷厂,http:////www.11467.com/langfang/co/29976.htm
廊坊市安次区码头镇利军印刷厂的商铺,http://langfang029976.11467.com
郑州东升印务有限公司,http:////www.11467.com/zhengzhou/co/250926.htm
郑州东升印务有限公司的商铺,http://zhengzhou0250926.11467.com
深圳市腾盛印刷设计有限公司,http:////www.11467.com/shenzhen/co/941020.htm
深圳市腾盛印刷设计有限公司的商铺,http://shenzhen0941020.11467.com
廊坊市宏明印刷有限公司,http:////www.11467.com/langfang/co/32780.htm
廊坊市宏明印刷有限公司的商铺,http://langfang032780.11467.com
安徽广印彩印有限公司,http:////www.11467.com/hefei/co/87024.htm
安徽广印彩印有限公司的商铺,http://hefei087024.11467.com
西安宜展广告文化传播有限公司,http:////www.11467.com/xian/co/167522.htm
西安宜展广告文化传播有限公司的商铺,http://xian0167522.11467.com
马建兵(个体经营),http:////www.11467.com/langfang/co/33832.htm
马建兵(个体经营)的商铺,http://langfang033832.11467.com
深圳市华丰联合印刷有限公司,http:////www.11467.com/shenzhen/co/814611.htm
深圳市华丰联合印刷有限公司的商铺,http://shenzhen0814611.11467.com
深圳市美达印刷有限公司,http:////www.11467.com/shenzhen/co/81467.htm
深圳市美达印刷有限公司的商铺,http://shenzhen081467.11467.com
深圳市理想空间企业形象策划有限公司,http:////www.11467.com/shenzhen/co/651803.htm
深圳市理想空间企业形象策划有限公司的商铺,http://shenzhen0651803.11467.com
杭州阳丽印刷有限公司,http:////www.11467.com/hangzhou/co/237074.htm
杭州阳丽印刷有限公司的商铺,http://hangzhou0237074.11467.com
东莞市常平鸿日广告设计服务部,http:////www.11467.com/dongguan/co/334045.htm
东莞市常平鸿日广告设计服务部的商铺,http://dongguan0334045.11467.com
广州市永泉印刷有限公司,http:////www.11467.com/guangzhou/co/495217.htm
广州市永泉印刷有限公司的商铺,http://guangzhou0495217.11467.com
珠海市豪迈实业有限公司,http:////www.11467.com/zhuhai/co/45022.htm
珠海市豪迈实业有限公司的商铺,http://zhuhai045022.11467.com
泰州市高港区天泰印刷厂,http:////www.11467.com/taizhoushi/co/35297.htm
泰州市高港区天泰印刷厂的商铺,http://taizhoushi035297.11467.com
中山市彩丽恒广告有限公司,http:////www.11467.com/zhongshan/co/123686.htm
中山市彩丽恒广告有限公司的商铺,http://zhongshan0123686.11467.com
陈辉,http:////www.11467.com/guangzhou/co/495959.htm
陈辉的商铺,http://guangzhou0495959.11467.com
广州市杰卓印务有限公司,http:////www.11467.com/guangzhou/co/455430.htm
广州市杰卓印务有限公司的商铺,http://guangzhou0455430.11467.com
杭州柏盛印刷有限公司,http:////www.11467.com/hangzhou/co/50172.htm
杭州柏盛印刷有限公司的商铺,http://hangzhou050172.11467.com
兴宁市新新兴印刷厂,http:////www.11467.com/meizhou/co/23996.htm
兴宁市新新兴印刷厂的商铺,http://meizhou023996.11467.com
无锡市经远不锈钢有限公司,http:////www.11467.com/wuxi/co/210687.htm
无锡市经远不锈钢有限公司的商铺,http://wuxi0210687.11467.com
郑州智美纸制品销售有限公司,http:////www.11467.com/zhengzhou/co/273868.htm
郑州智美纸制品销售有限公司的商铺,http://zhengzhou0273868.11467.com
厦门彩亿龙印刷有限公司,http:////www.11467.com/xiamen/co/40286.htm
厦门彩亿龙印刷有限公司的商铺,http://xiamen040286.11467.com
金马广告展览公司,http:////www.11467.com/changsha/co/140434.htm
金马广告展览公司的商铺,http://changsha0140434.11467.com
东莞市廉美彩色包装印刷有限公司,http:////www.11467.com/dongguan/co/200038.htm
东莞市廉美彩色包装印刷有限公司的商铺,http://dongguan0200038.11467.com
杭州天佳印刷有限公司,http:////www.11467.com/hangzhou/co/311933.htm
杭州天佳印刷有限公司的商铺,http://hangzhou0311933.11467.com
深圳市永利兴印刷有限公司,http:////www.11467.com/shenzhen/co/578644.htm
深圳市永利兴印刷有限公司的商铺,http://shenzhen0578644.11467.com
深圳市源昌盛彩色印刷有限公司,http:////www.11467.com/shenzhen/co/279846.htm
深圳市源昌盛彩色印刷有限公司的商铺,http://shenzhen0279846.11467.com
义乌市中创纸制品有限公司,http:////www.11467.com/jinhua/co/122823.htm
义乌市中创纸制品有限公司的商铺,http://jinhua0122823.11467.com
广州江美印刷有限公司,http:////www.11467.com/guangzhou/co/213792.htm
广州江美印刷有限公司的商铺,http://guangzhou0213792.11467.com
广州市白云区骏达印刷厂,http:////www.11467.com/guangzhou/co/309520.htm
广州市白云区骏达印刷厂的商铺,http://guangzhou0309520.11467.com
广州市海珠区彩丰印刷厂,http:////www.11467.com/guangzhou/co/125951.htm
广州市海珠区彩丰印刷厂的商铺,http://guangzhou0125951.11467.com
深圳市远大印刷有限公司,http:////www.11467.com/shenzhen/co/759774.htm
深圳市远大印刷有限公司的商铺,http://shenzhen0759774.11467.com
北京光盘制作公司,http:////www.11467.com/beijing/co/253878.htm
北京光盘制作公司的商铺,http://beijing0253878.11467.com
浙江海虹彩色印刷有限公司,http:////www.11467.com/hangzhou/co/269568.htm
广东印元印刷包装科技股份有限公司,http:////www.11467.com/guangzhou/co/512411.htm
重庆彼客文化发展有限公司,http:////www.11467.com/chongqing/co/124257.htm
重庆彼客文化发展有限公司的商铺,http://chongqing0124257.11467.com
佛山市顺德区帝图印刷有限公司,http:////www.11467.com/foshan/co/260339.htm
佛山市顺德区帝图印刷有限公司的商铺,http://foshan0260339.11467.com
江苏凤凰通达印刷有限公司,http:////www.11467.com/nanjing/co/88615.htm
江苏凤凰通达印刷有限公司的商铺,http://nanjing088615.11467.com
绍兴市名诚印务制本有限公司,http:////www.11467.com/shaoxing/co/59929.htm
绍兴市名诚印务制本有限公司的商铺,http://shaoxing059929.11467.com
深圳市鹰达印刷包装有限公司,http:////www.11467.com/shenzhen/co/149639.htm
深圳市鹰达印刷包装有限公司的商铺,http://shenzhen0149639.11467.com
无锡市海晨彩色印刷有限公司,http:////www.11467.com/wuxi/co/202265.htm
无锡市海晨彩色印刷有限公司的商铺,http://wuxi0202265.11467.com
扬州兰天印务有限公司,http:////www.11467.com/yangzhou/co/79771.htm
扬州兰天印务有限公司的商铺,http://yangzhou079771.11467.com
绍兴伊罗兰印刷包装有限公司,http:////www.11467.com/shaoxing/co/80184.htm
绍兴伊罗兰印刷包装有限公司的商铺,http://shaoxing080184.11467.com
深圳市华之彩印刷有限公司,http:////www.11467.com/shenzhen/co/285730.htm
深圳市华之彩印刷有限公司的商铺,http://shenzhen0285730.11467.com
深圳市千年红广告有限公司,http:////www.11467.com/shenzhen/co/271973.htm
深圳市千年红广告有限公司的商铺,http://shenzhen0271973.11467.com
迅得粘合剂(深圳)有限公司,http:////www.11467.com/shenzhen/co/838229.htm
迅得粘合剂(深圳)有限公司的商铺,http://shenzhen0838229.11467.com
深圳市钲昊印刷有限公司,http:////www.11467.com/shenzhen/co/272277.htm
深圳市钲昊印刷有限公司的商铺,http://shenzhen0272277.11467.com
东莞印刷有限责任公司,http:////www.11467.com/dongguan/co/421792.htm
东莞印刷有限责任公司的商铺,http://dongguan0421792.11467.com
东莞市柏金印刷有限公司,http:////www.11467.com/dongguan/co/421658.htm
东莞市柏金印刷有限公司的商铺,http://dongguan0421658.11467.com
深圳远大印刷有限公司,http:////www.11467.com/shenzhen/co/731379.htm
深圳远大印刷有限公司的商铺,http://shenzhen0731379.11467.com
上海朗波湾图文印务有限公司,http:////www.11467.com/shanghai/co/330495.htm
上海朗波湾图文印务有限公司的商铺,http://shanghai0330495.11467.com
厦门福祥利印刷有限公司,http:////www.11467.com/xiamen/co/40647.htm
厦门福祥利印刷有限公司的商铺,http://xiamen040647.11467.com
深圳市莱斯诺科技有限公司,http:////www.11467.com/shenzhen/co/583132.htm
深圳市莱斯诺科技有限公司的商铺,http://shenzhen0583132.11467.com
苏州苏润印刷制品有限公司,http:////www.11467.com/suzhou/co/269383.htm
苏州苏润印刷制品有限公司的商铺,http://suzhou0269383.11467.com
深圳市愚道印刷有限公司,http:////www.11467.com/shenzhen/co/723010.htm
深圳市愚道印刷有限公司的商铺,http://shenzhen0723010.11467.com
深圳市东彩印刷有限公司,http:////www.11467.com/shenzhen/co/551349.htm
深圳市东彩印刷有限公司的商铺,http://shenzhen0551349.11467.com
厦门兴金鑫工贸有限公司,http:////www.11467.com/xiamen/co/95894.htm
厦门兴金鑫工贸有限公司的商铺,http://xiamen095894.11467.com
佛山市金华彩印刷有限公司,http:////www.11467.com/foshan/co/362201.htm
佛山市金华彩印刷有限公司的商铺,http://foshan0362201.11467.com
廊坊晶艺印务纸制品印刷厂,http:////www.11467.com/langfang/co/35776.htm
廊坊晶艺印务纸制品印刷厂的商铺,http://langfang035776.11467.com
大企源（上海）印务有限公司,http:////www.11467.com/shanghai/co/898340.htm
大企源（上海）印务有限公司的商铺,http://shanghai0898340.11467.com
广东东莞市大朗镇兴达实业彩色画册印刷有限公司,http:////www.11467.com/dongguan/co/414050.htm
广东东莞市大朗镇兴达实业彩色画册印刷有限公司的商铺,http://dongguan0414050.11467.com
新乡好印刷中心,http:////www.11467.com/xinxiang/co/29703.htm
新乡好印刷中心的商铺,http://xinxiang029703.11467.com
北京坤之彩设计印刷有限公司,http:////www.11467.com/beijing/co/331137.htm
北京坤之彩设计印刷有限公司的商铺,http://beijing0331137.11467.com
深圳金印文化传播有限公司外贸销售部,http:////www.11467.com/shenzhen/co/730377.htm
深圳金印文化传播有限公司外贸销售部的商铺,http://shenzhen0730377.11467.com
金印文化传播有限公司,http:////www.11467.com/shenzhen/co/730410.htm
金印文化传播有限公司的商铺,http://shenzhen0730410.11467.com
成都厂自贡五天办公,http:////www.11467.com/zigong/co/23059.htm
成都厂自贡五天办公的商铺,http://zigong023059.11467.com
泉州市新联美术印刷,http:////www.11467.com/quanzhou/co/114032.htm
岳阳市岳阳楼区力天图文店,http:////www.11467.com/yueyang/co/34691.htm
北京博集天卷图书发行有限公司,http:////www.11467.com/beijing/co/63643.htm
东营墨轩广告印刷有限公司,http:////www.11467.com/dongying/co/32788.htm
广州惠州尔热突然方法水电费速度发生的,http:////www.11467.com/huizhou/co/81893.htm
湖南新湘彩色印务有限公司,http:////www.11467.com/changsha/co/104364.htm
济南致中和印刷有限公司,http:////www.11467.com/jinan/co/114423.htm
湖南常德群逸印刷公司,http:////www.11467.com/changde/co/33030.htm
深圳市金秋印刷设计有限公司,http:////www.11467.com/shenzhen/co/64920.htm
上海右文企业形象策划有限公司,http:////www.11467.com/qiye/2506.htm
广州今人彩色印刷有限公司,http:////www.11467.com/guangzhou/co/211025.htm
大连晟景印务中心数码快印有限公司,http:////www.11467.com/dalian/co/42051.htm
廊坊印刷公司,http:////www.11467.com/langfang/co/29913.htm
小森印刷(北京)有限公司,http:////www.11467.com/beijing/co/221011.htm
广州天琥彩色有限公司,http:////www.11467.com/guangzhou/co/428481.htm
新青年设计摄影,http:////www.11467.com/jingdezhen/co/13008.htm
大连晟景数码快印有限公司,http:////www.11467.com/dalian/co/65979.htm
烟台光亮印刷有限公司,http:////www.11467.com/yantai/co/133647.htm
德阳市区鑫星印务部,http:////www.11467.com/deyang/co/33133.htm
福州市仓山第三印刷厂,http:////www.11467.com/fuzhou/co/25571.htm
福州市仓山第三印刷厂的商铺,http://fuzhou025571.11467.com
东莞新丰印刷有限公司,http:////www.11467.com/dongguan/co/9918.htm
东莞新丰印刷有限公司的商铺,http://dongguan09918.11467.com
深圳市衡维印刷有限公司,http:////www.11467.com/shenzhen/co/148139.htm
深圳市衡维印刷有限公司的商铺,http://shenzhen0148139.11467.com
泉州市丰泽区迅昌彩印有限公司,http:////www.11467.com/quanzhou/co/5882.htm
泉州市丰泽区迅昌彩印有限公司的商铺,http://quanzhou05882.11467.com
泉州艺海品牌设计机构,http:////www.11467.com/quanzhou/co/105368.htm
泉州艺海品牌设计机构的商铺,http://quanzhou0105368.11467.com
泉州市鲤城七彩印刷有限公司,http:////www.11467.com/quanzhou/co/382.htm
泉州市鲤城七彩印刷有限公司的商铺,http://quanzhou0382.11467.com
深圳市宝安区益诚纸品包装厂,http:////www.11467.com/shenzhen/co/148164.htm
深圳市宝安区益诚纸品包装厂的商铺,http://shenzhen0148164.11467.com
广西大一迪美印刷有限公司,http:////www.11467.com/nanning/co/63305.htm
广西大一迪美印刷有限公司的商铺,http://nanning063305.11467.com
佛山市敦煌彩色印刷有限公司,http:////www.11467.com/foshan/co/5884.htm
佛山市敦煌彩色印刷有限公司的商铺,http://foshan05884.11467.com
沧州市银丰印刷有限公司,http:////www.11467.com/cangzhou/co/39033.htm
沧州市银丰印刷有限公司的商铺,http://cangzhou039033.11467.com
湖南曙光包装印务有限公司,http:////www.11467.com/changsha/co/3744.htm
湖南曙光包装印务有限公司的商铺,http://changsha03744.11467.com
廊坊市泽润印务有限公司,http:////www.11467.com/langfang/co/29993.htm
廊坊市泽润印务有限公司的商铺,http://langfang029993.11467.com
苍南县派司礼品包装厂,http:////www.11467.com/nanchang/co/91874.htm
苍南县派司礼品包装厂的商铺,http://nanchang091874.11467.com
长春市佰佳印刷有限公司,http:////www.11467.com/changchun/co/69382.htm
长春市佰佳印刷有限公司的商铺,http://changchun069382.11467.com
秦皇岛康文数码印刷有限公司,http:////www.11467.com/qinhuangdao/co/34389.htm
秦皇岛康文数码印刷有限公司的商铺,http://qinhuangdao034389.11467.com
莆田市宏达彩印包装有限公司,http:////www.11467.com/putian/co/28142.htm
莆田市宏达彩印包装有限公司的商铺,http://putian028142.11467.com
廊坊市旭日源印务有限公司,http:////www.11467.com/langfang/co/29968.htm
廊坊市旭日源印务有限公司的商铺,http://langfang029968.11467.com
广州市华信彩印厂有限公司,http:////www.11467.com/guangzhou/co/211010.htm
广州市华信彩印厂有限公司的商铺,http://guangzhou0211010.11467.com
福州广茂彩印有限公司,http:////www.11467.com/fuzhou/co/140296.htm
福州广茂彩印有限公司的商铺,http://fuzhou0140296.11467.com
杭州石特广告设计制作有限公司,http:////www.11467.com/hangzhou/co/236300.htm
杭州石特广告设计制作有限公司的商铺,http://hangzhou0236300.11467.com
深圳市众彩达印务有限公司,http:////www.11467.com/guangzhou/co/489291.htm
深圳市众彩达印务有限公司的商铺,http://guangzhou0489291.11467.com
深圳市佳顺印刷包装有限公司,http:////www.11467.com/shenzhen/co/278096.htm
深圳市佳顺印刷包装有限公司的商铺,http://shenzhen0278096.11467.com
东莞市彩源印刷包装有限公司,http:////www.11467.com/dongguan/co/412713.htm
东莞市彩源印刷包装有限公司的商铺,http://dongguan0412713.11467.com
广西汇工印业有限公司,http:////www.11467.com/nanning/co/85970.htm
广西汇工印业有限公司的商铺,http://nanning085970.11467.com
广州鹏凯服饰有限公司,http:////www.11467.com/guangzhou/co/318563.htm
广州鹏凯服饰有限公司的商铺,http://guangzhou0318563.11467.com
广州市彩源印刷有限公司,http:////www.11467.com/guangzhou/co/208851.htm
广州市彩源印刷有限公司的商铺,http://guangzhou0208851.11467.com
广州市贝的包装印刷有限公司,http:////www.11467.com/guangzhou/co/472409.htm
广州市贝的包装印刷有限公司的商铺,http://guangzhou0472409.11467.com
广州市精彩同方纸品有限公司,http:////www.11467.com/guangzhou/co/210785.htm
广州市精彩同方纸品有限公司的商铺,http://guangzhou0210785.11467.com
嘉兴市南湖区城东亮卡电子商务经营部,http:////www.11467.com/jiaxing/co/125189.htm
嘉兴市南湖区城东亮卡电子商务经营部的商铺,http://jiaxing0125189.11467.com
昆明北印电子科技有限公司,http:////www.11467.com/kunming/co/4599.htm
昆明北印电子科技有限公司的商铺,http://kunming04599.11467.com
廊坊市安次区智诚纸塑制品厂,http:////www.11467.com/langfang/co/53497.htm
廊坊市安次区智诚纸塑制品厂的商铺,http://langfang053497.11467.com
东莞市华莹印刷有限公司,http:////www.11467.com/dongguan/co/206881.htm
东莞市华莹印刷有限公司的商铺,http://dongguan0206881.11467.com
深圳市海朴数码科技有限公司,http:////www.11467.com/shenzhen/co/765701.htm
深圳市海朴数码科技有限公司的商铺,http://shenzhen0765701.11467.com
深圳市翰墨贸易有限公司,http:////www.11467.com/shenzhen/co/757729.htm
深圳市翰墨贸易有限公司的商铺,http://shenzhen0757729.11467.com
深圳市晨奕印刷有限公司,http:////www.11467.com/shenzhen/co/758376.htm
深圳市晨奕印刷有限公司的商铺,http://shenzhen0758376.11467.com
南京文博印刷厂,http:////www.11467.com/nanjing/co/67413.htm
南京文博印刷厂的商铺,http://nanjing067413.11467.com
南京大望印务有限公司,http:////www.11467.com/nanjing/co/65979.htm
南京大望印务有限公司的商铺,http://nanjing065979.11467.com
广州市艺沣包装有限公司,http:////www.11467.com/guangzhou/co/24459.htm
广州市艺沣包装有限公司的商铺,http://guangzhou024459.11467.com
广州市综艺印刷有限公司,http:////www.11467.com/guangzhou/co/210973.htm
广州市综艺印刷有限公司的商铺,http://guangzhou0210973.11467.com
杭州德海印务有限公司,http:////www.11467.com/hangzhou/co/270467.htm
杭州德海印务有限公司的商铺,http://hangzhou0270467.11467.com
杭州鹤立印刷技术有限公司,http:////www.11467.com/hangzhou/co/227005.htm
杭州鹤立印刷技术有限公司的商铺,http://hangzhou0227005.11467.com
杭州胜蓝印务有限公司,http:////www.11467.com/hangzhou/co/390952.htm
杭州胜蓝印务有限公司的商铺,http://hangzhou0390952.11467.com
杭州麦德高包装制品有限公司,http:////www.11467.com/hangzhou/co/269749.htm
杭州麦德高包装制品有限公司的商铺,http://hangzhou0269749.11467.com
杭州坤维广告策划有限公司,http:////www.11467.com/hangzhou/co/369680.htm
杭州坤维广告策划有限公司的商铺,http://hangzhou0369680.11467.com
广州市天河东圃福利印刷厂,http:////www.11467.com/guangzhou/co/315425.htm
广州市天河东圃福利印刷厂的商铺,http://guangzhou0315425.11467.com
郑州市二七区简尚家居工艺销售部,http:////www.11467.com/baoding/co/91194.htm
郑州市二七区简尚家居工艺销售部的商铺,http://baoding091194.11467.com
东莞市南城格新企业形象设计服务部,http:////www.11467.com/dongguan/co/490013.htm
东莞市南城格新企业形象设计服务部的商铺,http://dongguan0490013.11467.com
东莞市南城飞达广告设计服务部,http:////www.11467.com/dongguan/co/556630.htm
东莞市南城飞达广告设计服务部的商铺,http://dongguan0556630.11467.com
东莞市塘厦忆盛隆印刷厂,http:////www.11467.com/dongguan/co/199453.htm
东莞市塘厦忆盛隆印刷厂的商铺,http://dongguan0199453.11467.com
东莞市兴溢印刷有限公司,http:////www.11467.com/dongguan/co/196294.htm
东莞市兴溢印刷有限公司的商铺,http://dongguan0196294.11467.com
天津远森科技发展有限公司,http:////www.11467.com/tianjin/co/213604.htm
天津远森科技发展有限公司的商铺,http://tianjin0213604.11467.com
上海港发包装印务科技有限公司,http:////www.11467.com/shanghai/co/949012.htm
上海港发包装印务科技有限公司的商铺,http://shanghai0949012.11467.com
无锡市刘潭印刷包装厂,http:////www.11467.com/wuxi/co/18153.htm
无锡市刘潭印刷包装厂的商铺,http://wuxi018153.11467.com
上海市印刷十厂有限公司,http:////www.11467.com/shanghai/co/962217.htm
上海市印刷十厂有限公司的商铺,http://shanghai0962217.11467.com
北京中盛博宇科技发展有限公司,http:////www.11467.com/beijing/co/418468.htm
北京中盛博宇科技发展有限公司的商铺,http://beijing0418468.11467.com
天津市凯宏印务有限公司,http:////www.11467.com/tianjin/co/61346.htm
天津市凯宏印务有限公司的商铺,http://tianjin061346.11467.com
上海万吉印刷科技有限公司,http:////www.11467.com/shanghai/co/1013247.htm
上海万吉印刷科技有限公司的商铺,http://shanghai01013247.11467.com
天津市虹田墨农彩印有限公司,http:////www.11467.com/tianjin/co/132583.htm
天津市虹田墨农彩印有限公司的商铺,http://tianjin0132583.11467.com
无锡市榕锡教学仪器设备有限公司,http:////www.11467.com/wuxi/co/6281.htm
无锡市榕锡教学仪器设备有限公司的商铺,http://wuxi06281.11467.com
西安天翰文化产业有限公司,http:////www.11467.com/xian/co/74737.htm
西安天翰文化产业有限公司的商铺,http://xian074737.11467.com
武汉市汉阳区艺云印刷厂,http:////www.11467.com/wuhan/co/69838.htm
武汉市汉阳区艺云印刷厂的商铺,http://wuhan069838.11467.com
深圳市雅特美设计印刷有限公司,http:////www.11467.com/shenzhen/co/148179.htm
深圳市雅特美设计印刷有限公司的商铺,http://shenzhen0148179.11467.com
深圳市新视线印务有限公司,http:////www.11467.com/shenzhen/co/148138.htm
深圳市新视线印务有限公司的商铺,http://shenzhen0148138.11467.com
无锡市龙马广告有限公司,http:////www.11467.com/wuxi/co/10822.htm
无锡市龙马广告有限公司的商铺,http://wuxi010822.11467.com
深圳市石化印刷有限公司,http:////www.11467.com/shenzhen/co/149917.htm
深圳市石化印刷有限公司的商铺,http://shenzhen0149917.11467.com
深圳市唐氏印刷有限公司,http:////www.11467.com/shenzhen/co/281520.htm
深圳市唐氏印刷有限公司的商铺,http://shenzhen0281520.11467.com
扬州市开发区中港图文制作中心,http:////www.11467.com/yangzhou/co/79764.htm
扬州市开发区中港图文制作中心的商铺,http://yangzhou079764.11467.com
深圳市志鹏兴印刷有限公司,http:////www.11467.com/shenzhen/co/584205.htm
深圳市志鹏兴印刷有限公司的商铺,http://shenzhen0584205.11467.com
大连甘井子区中华路街道利汇纸制品商行,http:////www.11467.com/dalian/co/81273.htm
大连甘井子区中华路街道利汇纸制品商行的商铺,http://dalian081273.11467.com
深圳市仁彩印刷有限公司,http:////www.11467.com/shenzhen/co/273397.htm
深圳市仁彩印刷有限公司的商铺,http://shenzhen0273397.11467.com
深圳市麦尔思设计有限公司,http:////www.11467.com/shenzhen/co/272211.htm
深圳市麦尔思设计有限公司的商铺,http://shenzhen0272211.11467.com
深圳市创美风尚广告有限公司,http:////www.11467.com/shenzhen/co/809516.htm
深圳市创美风尚广告有限公司的商铺,http://shenzhen0809516.11467.com
