慈溪市桥头镇客隆毛绒厂,http:////www.11467.com/ningbo/co/223549.htm
佛山市武易皮革有限公司,http:////www.11467.com/foshan/co/383006.htm
佛山市武易皮革有限公司的商铺,http://foshan0383006.11467.com
东莞市大朗志源纺织品贸易行,http:////www.11467.com/dongguan/co/174108.htm
东莞市大朗志源纺织品贸易行的商铺,http://dongguan0174108.11467.com
东莞市立达信皮革有限公司,http:////www.11467.com/dongguan/co/556954.htm
东莞市立达信皮革有限公司的商铺,http://dongguan0556954.11467.com
绍兴县方氏毛绒有限公司,http:////www.11467.com/shaoxing/co/82340.htm
绍兴县方氏毛绒有限公司的商铺,http://shaoxing082340.11467.com
南京美胜纺织有限公司,http:////www.11467.com/nanjing/co/92164.htm
南京美胜纺织有限公司的商铺,http://nanjing092164.11467.com
绍兴县守整纺织有限公司,http:////www.11467.com/shaoxing/co/76858.htm
绍兴县守整纺织有限公司的商铺,http://shaoxing076858.11467.com
哈尔滨市秀龙小商品城天翼百货店,http:////www.11467.com/haerbin/co/44548.htm
哈尔滨市秀龙小商品城天翼百货店的商铺,http://haerbin044548.11467.com
邵阳市紫华纺织有限公司,http:////www.11467.com/shaoyang/co/22841.htm
邵阳市紫华纺织有限公司的商铺,http://shaoyang022841.11467.com
东莞市佰泰纺织有限公司,http:////www.11467.com/dongguan/co/497126.htm
东莞市佰泰纺织有限公司的商铺,http://dongguan0497126.11467.com
东莞市厚街定岛皮革经营部,http:////www.11467.com/dongguan/co/558157.htm
东莞市厚街定岛皮革经营部的商铺,http://dongguan0558157.11467.com
南通新帝克单丝科技股份有限公司,http:////www.11467.com/nantong/co/140559.htm
南通新帝克单丝科技股份有限公司的商铺,http://nantong0140559.11467.com
江苏恒旺纺织有限责任公司,http:////www.11467.com/yancheng/co/53504.htm
江苏恒旺纺织有限责任公司的商铺,http://yancheng053504.11467.com
深圳昱歌洋家具材料有限公司,http:////www.11467.com/shenzhen/co/814112.htm
深圳昱歌洋家具材料有限公司的商铺,http://shenzhen0814112.11467.com
郫县新石界石材经营部,http:////www.11467.com/chengdu/co/211664.htm
郫县新石界石材经营部的商铺,http://chengdu0211664.11467.com
南宫市鹰月绒毛有限公司,http:////www.11467.com/xintai/co/49011.htm
南宫市鹰月绒毛有限公司的商铺,http://xintai049011.11467.com
东莞市奔月布业有限公司,http:////www.11467.com/dongguan/co/411027.htm
东莞市奔月布业有限公司的商铺,http://dongguan0411027.11467.com
扬州广茂毛绒有限公司,http:////www.11467.com/yangzhou/co/89699.htm
扬州广茂毛绒有限公司的商铺,http://yangzhou089699.11467.com
杨金鹏(个体经营),http:////www.11467.com/xintai/co/57688.htm
杨金鹏(个体经营)的商铺,http://xintai057688.11467.com
东莞市鼎级皮革有限公司,http:////www.11467.com/dongguan/co/558322.htm
东莞市鼎级皮革有限公司的商铺,http://dongguan0558322.11467.com
蠡县南齐村丽兴织物经销处,http:////www.11467.com/baoding/co/91566.htm
蠡县南齐村丽兴织物经销处的商铺,http://baoding091566.11467.com
绍兴县网上轻纺城秀泽纺织商行,http:////www.11467.com/shaoxing/co/127308.htm
绍兴县网上轻纺城秀泽纺织商行的商铺,http://shaoxing0127308.11467.com
绍兴市银山纺织品有限公司,http:////www.11467.com/shaoxing/co/115083.htm
绍兴市银山纺织品有限公司的商铺,http://shaoxing0115083.11467.com
威县养发百货经销处,http:////www.11467.com/xintai/co/57690.htm
威县养发百货经销处的商铺,http://xintai057690.11467.com
深圳市龙岗区浩轩皮革商行,http:////www.11467.com/shenzhen/co/811472.htm
深圳市龙岗区浩轩皮革商行的商铺,http://shenzhen0811472.11467.com
吴江市三羊纺织植绒厂,http:////www.11467.com/suzhou/co/318886.htm
吴江市三羊纺织植绒厂的商铺,http://suzhou0318886.11467.com
吴江市振华复合面料厂,http:////www.11467.com/suzhou/co/356994.htm
吴江市振华复合面料厂的商铺,http://suzhou0356994.11467.com
无锡海知机械有限公司,http:////www.11467.com/wuxi/co/243937.htm
无锡海知机械有限公司的商铺,http://wuxi0243937.11467.com
宋玉品(个体经营),http:////www.11467.com/xintai/co/57689.htm
宋玉品(个体经营)的商铺,http://xintai057689.11467.com
张延岭（个体经营）,http:////www.11467.com/xintai/co/57685.htm
张延岭（个体经营）的商铺,http://xintai057685.11467.com
深圳市金峰盛植绒制品有限公司,http:////www.11467.com/shenzhen/co/277229.htm
深圳市金峰盛植绒制品有限公司的商铺,http://shenzhen0277229.11467.com
绍兴县鹏蓝纺织品有限公司,http:////www.11467.com/shaoxing/co/86862.htm
绍兴县鹏蓝纺织品有限公司的商铺,http://shaoxing086862.11467.com
青岛德邦诺人造毛皮有限公司,http:////www.11467.com/qingdao/co/156303.htm
青岛德邦诺人造毛皮有限公司的商铺,http://qingdao0156303.11467.com
晋江兆顺毛绒布业贸易有限公司,http:////www.11467.com/quanzhou/co/147228.htm
晋江兆顺毛绒布业贸易有限公司的商铺,http://quanzhou0147228.11467.com
兰跃方(个体经营),http:////www.11467.com/shaoxing/co/127393.htm
兰跃方(个体经营)的商铺,http://shaoxing0127393.11467.com
东莞市宝丞手袋皮具制品有限公司,http:////www.11467.com/dongguan/co/514992.htm
东莞市宝丞手袋皮具制品有限公司的商铺,http://dongguan0514992.11467.com
鸡泽县博宇染料经销有限公司,http:////www.11467.com/hengshui/co/42936.htm
鸡泽县博宇染料经销有限公司的商铺,http://hengshui042936.11467.com
浙江嘉善悦达针织毛皮有限公司,http:////www.11467.com/jiaxing/co/122948.htm
浙江嘉善悦达针织毛皮有限公司的商铺,http://jiaxing0122948.11467.com
嘉兴市裕佳纺织品有限公司,http:////www.11467.com/jiaxing/co/123544.htm
嘉兴市裕佳纺织品有限公司的商铺,http://jiaxing0123544.11467.com
绍兴县众雅针纺有限公司,http:////www.11467.com/lvliang/co/25844.htm
绍兴县众雅针纺有限公司的商铺,http://lvliang025844.11467.com
东莞市华顺纺织有限公司,http:////www.11467.com/dongguan/co/557147.htm
东莞市华顺纺织有限公司的商铺,http://dongguan0557147.11467.com
广州市唐隆纺织花边有限公司,http:////www.11467.com/guangzhou/co/494859.htm
广州市唐隆纺织花边有限公司的商铺,http://guangzhou0494859.11467.com
广州市花都区狮岭香包坊手袋厂,http:////www.11467.com/guangzhou/co/496427.htm
广州市花都区狮岭香包坊手袋厂的商铺,http://guangzhou0496427.11467.com
浙江购美家居有限公司,http:////www.11467.com/hangzhou/co/391752.htm
浙江购美家居有限公司的商铺,http://hangzhou0391752.11467.com
北京信诺国际有限公司,http:////www.11467.com/beijing/co/716078.htm
北京信诺国际有限公司的商铺,http://beijing0716078.11467.com
王栋洁(个体经营),http:////www.11467.com/xintai/co/57638.htm
王栋洁(个体经营)的商铺,http://xintai057638.11467.com
青岛春霖毛绒有限公司,http:////www.11467.com/qingdao/co/54647.htm
广州市联运港进出口有限公司,http:////www.11467.com/guangzhou/co/470928.htm
南京金豹纺织服饰有限公司,http:////www.11467.com/nanjing/co/62229.htm
盐城市硕丰毛绒纺织品有限公司,http:////www.11467.com/yancheng/co/60929.htm
东莞长欣车缝制品厂,http:////www.11467.com/dongguan/co/508719.htm
东莞市尚德皮革有限公司,http:////www.11467.com/dongguan/co/71432.htm
东莞市惠慧纺织品有限公司,http:////www.11467.com/dongguan/co/478606.htm
东莞市畅帆进出口贸易有限公司,http:////www.11467.com/dongguan/co/500593.htm
东莞市宏阳皮革有限公司,http:////www.11467.com/dongguan/co/173769.htm
京华皮革制品厂,http:////www.11467.com/dongguan/co/498929.htm
佛山市名高染料化工有限公司,http:////www.11467.com/foshan/co/192803.htm
南海联港皮革公司,http:////www.11467.com/foshan/co/346828.htm
广州鸿顺毛绒有限公司,http:////www.11467.com/guangzhou/co/487102.htm
广州灵创计算机科技有限公司,http:////www.11467.com/guangzhou/co/446947.htm
东莞市宏美纺织有限公司,http:////www.11467.com/guangzhou/co/236241.htm
广州君翼进出口贸易有限公司,http:////www.11467.com/guangzhou/co/489142.htm
广州韩至皮具有限公司,http:////www.11467.com/guangzhou/co/452635.htm
广州长盛纺织有限公司,http:////www.11467.com/guangzhou/co/339161.htm
广州网艺贸易有限公司,http:////www.11467.com/guangzhou/co/485350.htm
广州市黛安娜皮具有限公司,http:////www.11467.com/guangzhou/co/452904.htm
广州市利度纺织品有限公司,http:////www.11467.com/guangzhou/co/479630.htm
广州市海珠区晟福皮带厂,http:////www.11467.com/guangzhou/co/277705.htm
李主招(个体经营),http:////www.11467.com/guangzhou/co/489260.htm
红日皮革 服装有限公司,http:////www.11467.com/guangzhou/co/477405.htm
盈冠皮业有限公司,http:////www.11467.com/guangzhou/co/477404.htm
谭娟(个体经营),http:////www.11467.com/guangzhou/co/146450.htm
佳美嘉实业有限公司,http:////www.11467.com/guangzhou/co/470929.htm
广州鑫联贸易有限公司,http:////www.11467.com/guangzhou/co/409212.htm
广州鑫华皮具厂,http:////www.11467.com/guangzhou/co/460732.htm
广州新卓物业管理有限公司荔湾分公司,http:////www.11467.com/guangzhou/co/457339.htm
香港圣炎国际皮业有限公司,http:////www.11467.com/guangzhou/co/480010.htm
广州市兴昊皮具贸易有限公司,http:////www.11467.com/guangzhou/co/489140.htm
广州皇家皮具公司,http:////www.11467.com/guangzhou/co/460734.htm
广州原瑟贸易有限公司,http:////www.11467.com/guangzhou/co/486813.htm
杭州海驰贸易有限公司,http:////www.11467.com/hangzhou/co/112839.htm
杭州国信经济贸易有限公司,http:////www.11467.com/hangzhou/co/175794.htm
徐水华（个体经营）,http:////www.11467.com/hangzhou/co/219667.htm
河北凤东皮草有限公司,http:////www.11467.com/hengshui/co/37393.htm
培雪裘皮有限公司,http:////www.11467.com/hengshui/co/37249.htm
河北腾新皮草有限公司,http:////www.11467.com/hengshui/co/34244.htm
黄国才(个体经营),http:////www.11467.com/heyuan/co/14085.htm
台湾丰瑞盛世企业有限公司江门办事处,http:////www.11467.com/jiangmen/co/115611.htm
焦作市生旺獭兔养殖有限公司,http:////www.11467.com/jiaozuo/co/27092.htm
嘉兴市长河贸易有限公司,http:////www.11467.com/jiaxing/co/92379.htm
海宁极限贸易有限公司,http:////www.11467.com/jiaxing/co/126712.htm
威尔凯皮革贸易有限公司,http:////www.11467.com/jiaxing/co/123992.htm
桐乡市长虹实业有限责任公司,http:////www.11467.com/jiaxing/co/54015.htm
九江赤湖国际皮革工业城有限公司,http:////www.11467.com/jiujiang/co/26498.htm
刘丽花（个体经营）,http:////www.11467.com/langfang/co/33998.htm
灌南县鑫源獭兔养殖专业合作社,http:////www.11467.com/lianyungang/co/44048.htm
南通大昌纺织有限公司,http:////www.11467.com/nantong/co/122816.htm
南通密你特纺织有限公司,http:////www.11467.com/nantong/co/122864.htm
秦皇岛市海洋皮草贸易公司,http:////www.11467.com/qinhuangdao/co/45748.htm
瑞华水貂貉子养殖厂,http:////www.11467.com/qinhuangdao/co/45875.htm
仙桃市人造毛皮厂,http:////www.11467.com/qiye/92296127.htm
