苏州市联捷真空设备有限公司,http:////www.11467.com/suzhou/co/240199.htm
苏州市联捷真空设备有限公司的商铺,http://suzhou0240199.11467.com
马鞍山贝斯特机械厂,http:////www.11467.com/maanshan/co/19714.htm
马鞍山贝斯特机械厂的商铺,http://maanshan019714.11467.com
镇江东联仪表有限公司,http:////www.11467.com/zhenjiang/co/11854.htm
镇江东联仪表有限公司的商铺,http://zhenjiang011854.11467.com
西安市帅奇电器有限公司,http:////www.11467.com/xian/co/129045.htm
西安市帅奇电器有限公司的商铺,http://xian0129045.11467.com
武强县滏阳仪表厂,http:////www.11467.com/hengshui/co/34314.htm
武强县滏阳仪表厂的商铺,http://hengshui034314.11467.com
泰安市山衡衡器有限公司,http:////www.11467.com/taian/co/36896.htm
泰安市山衡衡器有限公司的商铺,http://taian036896.11467.com
苏州益凯盛电子有限公司,http:////www.11467.com/suzhou/co/233182.htm
苏州益凯盛电子有限公司的商铺,http://suzhou0233182.11467.com
无锡市王珏磁钢厂,http:////www.11467.com/wuxi/co/194204.htm
无锡市王珏磁钢厂的商铺,http://wuxi0194204.11467.com
无锡徽科特测控技术有限公司,http:////www.11467.com/wuxi/co/244361.htm
无锡徽科特测控技术有限公司的商铺,http://wuxi0244361.11467.com
上海仪伯自动化仪表有限公司,http:////www.11467.com/qiye/93135277.htm
上海仪伯自动化仪表有限公司的商铺,http://93135277.b2b.11467.com
天津市万风工贸发展有限公司,http:////www.11467.com/tianjin/co/141402.htm
天津市万风工贸发展有限公司的商铺,http://tianjin0141402.11467.com
唐山市高铝刚玉工业陶瓷厂,http:////www.11467.com/tangshan/co/53541.htm
唐山市高铝刚玉工业陶瓷厂的商铺,http://tangshan053541.11467.com
武汉市镭亚光电子有限公司,http:////www.11467.com/wuhan/co/81271.htm
武汉市镭亚光电子有限公司的商铺,http://wuhan081271.11467.com
苏州兆正仪表有限公司,http:////www.11467.com/suzhou/co/233181.htm
苏州兆正仪表有限公司的商铺,http://suzhou0233181.11467.com
大连海华控制系统工程有限公司,http:////www.11467.com/dalian/co/47010.htm
大连海华控制系统工程有限公司的商铺,http://dalian047010.11467.com
深圳市华测电子有限公司,http:////www.11467.com/shenzhen/co/431125.htm
深圳市华测电子有限公司的商铺,http://shenzhen0431125.11467.com
昆山市张浦镇立尔信电子仪器商行,http:////www.11467.com/suzhou/co/357064.htm
昆山市张浦镇立尔信电子仪器商行的商铺,http://suzhou0357064.11467.com
深圳市好顺景工业皮带有限公司,http:////www.11467.com/shenzhen/co/498308.htm
深圳市好顺景工业皮带有限公司的商铺,http://shenzhen0498308.11467.com
徐州雷宝电子有限公司,http:////www.11467.com/xuzhou/co/56005.htm
徐州雷宝电子有限公司的商铺,http://xuzhou056005.11467.com
宜宾市信通电子器材厂,http:////www.11467.com/yibin/co/19594.htm
宜宾市信通电子器材厂的商铺,http://yibin019594.11467.com
上海米卓仪器仪表有限公司,http:////www.11467.com/shanghai/co/898610.htm
上海米卓仪器仪表有限公司的商铺,http://shanghai0898610.11467.com
武汉华特电力新技术有限公司,http:////www.11467.com/wuhan/co/116977.htm
武汉华特电力新技术有限公司的商铺,http://wuhan0116977.11467.com
无锡赛莱迪仪表有限公司,http:////www.11467.com/wuxi/co/255036.htm
无锡赛莱迪仪表有限公司的商铺,http://wuxi0255036.11467.com
沧州金余工程仪器有限公司,http:////www.11467.com/qiye/19172417.htm
沧州金余工程仪器有限公司的商铺,http://19172417.b2b.11467.com
中山市南头镇精晖绝缘材料制品厂,http:////www.11467.com/zhongshan/co/118419.htm
中山市南头镇精晖绝缘材料制品厂的商铺,http://zhongshan0118419.11467.com
天津伊贝斯特科技有限公司,http:////www.11467.com/tianjin/co/195784.htm
天津伊贝斯特科技有限公司的商铺,http://tianjin0195784.11467.com
无锡超翔高频科技有限公司,http:////www.11467.com/wuxi/co/91329.htm
无锡超翔高频科技有限公司的商铺,http://wuxi091329.11467.com
武汉国电中星电力设备有限公司,http:////www.11467.com/wuhan/co/118919.htm
武汉国电中星电力设备有限公司的商铺,http://wuhan0118919.11467.com
安徽省黄山市远程仪表电器有限公司,http:////www.11467.com/huangshan/co/19443.htm
安徽省黄山市远程仪表电器有限公司的商铺,http://huangshan019443.11467.com
泊头市恒宝仪表有限公司,http:////www.11467.com/cangzhou/co/75368.htm
泊头市恒宝仪表有限公司的商铺,http://cangzhou075368.11467.com
郑州科尔电气实业有限公司,http:////www.11467.com/zhengzhou/co/76934.htm
郑州科尔电气实业有限公司的商铺,http://zhengzhou076934.11467.com
广州仁朗电子科技有限公司,http:////www.11467.com/guangzhou/co/462370.htm
广州仁朗电子科技有限公司的商铺,http://guangzhou0462370.11467.com
杭州好久自动化工程有限公司,http:////www.11467.com/hangzhou/co/391286.htm
杭州好久自动化工程有限公司的商铺,http://hangzhou0391286.11467.com
兴化市骏驰电热电器厂,http:////www.11467.com/taizhoushi/co/51825.htm
兴化市骏驰电热电器厂的商铺,http://taizhoushi051825.11467.com
兴化市飞宇热工仪表厂,http:////www.11467.com/taizhoushi/co/51824.htm
兴化市飞宇热工仪表厂的商铺,http://taizhoushi051824.11467.com
吴江道宏精密五金有限公司,http:////www.11467.com/suzhou/co/325242.htm
吴江道宏精密五金有限公司的商铺,http://suzhou0325242.11467.com
厦门实意达自动化科技有限公司,http:////www.11467.com/xiamen/co/103444.htm
厦门实意达自动化科技有限公司的商铺,http://xiamen0103444.11467.com
杭州瑞宁仪器仪表有限公司,http:////www.11467.com/hangzhou/co/251895.htm
杭州瑞宁仪器仪表有限公司的商铺,http://hangzhou0251895.11467.com
深圳市智田精密机电有限公司,http:////www.11467.com/shenzhen/co/807584.htm
深圳市智田精密机电有限公司的商铺,http://shenzhen0807584.11467.com
南昌市共创实业有限公司,http:////www.11467.com/nanchang/co/87142.htm
南昌市共创实业有限公司的商铺,http://nanchang087142.11467.com
郑州科泰实验设备有限公司,http:////www.11467.com/zhengzhou/co/172877.htm
郑州科泰实验设备有限公司的商铺,http://zhengzhou0172877.11467.com
镇江华程仪表有限公司,http:////www.11467.com/zhenjiang/co/63980.htm
镇江华程仪表有限公司的商铺,http://zhenjiang063980.11467.com
天津宏宇试验仪器制造有限公司,http:////www.11467.com/tianjin/co/300580.htm
天津宏宇试验仪器制造有限公司的商铺,http://tianjin0300580.11467.com
北京天康杰森仪表有限公司销售部,http:////www.11467.com/beijing/co/565668.htm
天津市强尔科技发展有限责任公司,http:////www.11467.com/tjwuqing/co/25757.htm
三门峡中科精密量仪有限公司,http:////www.11467.com/changzhi/co/31920.htm
常州市八达仪器厂,http:////www.11467.com/changzhou/co/16851.htm
常州市技鼎精密机械厂,http:////www.11467.com/changzhou/co/134304.htm
常州市美骏机械设备厂,http:////www.11467.com/changzhou/co/134594.htm
天长市天云电气有限公司,http:////www.11467.com/chuzhou/co/30346.htm
东莞市长安海森机电设备厂,http:////www.11467.com/dongguan/co/249472.htm
东莞市茶山飞思达电子仪器经营部,http:////www.11467.com/dongguan/co/511985.htm
东莞市塘厦镇昕东电子工具仪器公司,http:////www.11467.com/dongguan/co/494900.htm
东莞市亚东仪器设备有限公司,http:////www.11467.com/dongguan/co/497657.htm
东莞市沙田超盛仪表设备厂,http:////www.11467.com/dongguan/co/141210.htm
东莞市弘研精密模具有限公司,http:////www.11467.com/dongguan/co/256444.htm
东莞市时利和电子科技有限公司,http:////www.11467.com/dongguan/co/83954.htm
恒丰五金厂,http:////www.11467.com/dongguan/co/252588.htm
领业电子有限公司,http:////www.11467.com/dongguan/co/199281.htm
东莞市勇创电子科技有限公司,http:////www.11467.com/dongguan/co/246935.htm
佛山市铭康机械有限公司,http:////www.11467.com/foshan/co/231597.htm
佛山市顺德区容桂精亮抛磨材料厂,http:////www.11467.com/foshan/co/232196.htm
佛山市南海区威铭铝制品加工厂,http:////www.11467.com/foshan/co/188188.htm
广州市善工机械设备有限公司,http:////www.11467.com/guangzhou/co/458168.htm
永辉光电公司,http:////www.11467.com/guangzhou/co/209655.htm
杭州平望科技有限公司-市场部,http:////www.11467.com/hangzhou/co/237021.htm
杭州萧山致能模具厂,http:////www.11467.com/hangzhou/co/354695.htm
杭州正普科技有限公司,http:////www.11467.com/hangzhou/co/263403.htm
杭州连城废旧物资回收有限公司,http:////www.11467.com/hangzhou/co/369692.htm
浙江海太数码技术有限公司,http:////www.11467.com/hangzhou/co/118639.htm
合肥精都机电仪表有限公司,http:////www.11467.com/hefei/co/38367.htm
武强县中兴玻璃计器厂,http:////www.11467.com/hengshui/co/26796.htm
江苏华能自动化仪表有限公司,http:////www.11467.com/huaian/co/52160.htm
江苏科迪自动化仪表有限公司,http:////www.11467.com/huaian/co/51693.htm
惠城区元力精密仪器经营部,http:////www.11467.com/huizhou/co/96738.htm
济南众联恒业经贸有限公司,http:////www.11467.com/jinan/co/84513.htm
济南鸿禧机械制造有限公司,http:////www.11467.com/jinan/co/94064.htm
高唐县博恒精密机械有限公司,http:////www.11467.com/liaocheng/co/16451.htm
山东聊城佛斯特精密机械有限公司销售部,http:////www.11467.com/liaocheng/co/32657.htm
安徽中创传感器有限公司,http:////www.11467.com/liuan/co/23145.htm
南京巍峰机械喷涂加工厂,http:////www.11467.com/nanjing/co/88979.htm
南京南数数控设备有限公司,http:////www.11467.com/nanjing/co/20330.htm
南京世久贵金属有限公司,http:////www.11467.com/nanjing/co/133342.htm
南京弘润自动化技术有限公司,http:////www.11467.com/nanjing/co/141802.htm
内江市杨生机械零件加工有限公司,http:////www.11467.com/neijiang/co/18457.htm
成都英特罗克科技有限公司青岛办事处,http:////www.11467.com/qingdao/co/101568.htm
玉环鸿楚阀业有限公司,http:////www.11467.com/qingyang/co/10883.htm
绍兴五洲机械有限公司,http:////www.11467.com/shaoxing/co/86815.htm
诚创立科技有限公司,http:////www.11467.com/shenzhen/co/766102.htm
利盛钟表实业有限公司（销售部）,http:////www.11467.com/shenzhen/co/275732.htm
深圳市海诚自动化设备有限公司,http:////www.11467.com/shenzhen/co/729636.htm
深圳市宝安区松岗保利印刷厂,http:////www.11467.com/shenzhen/co/277039.htm
深圳市恒泰金五金制品有限公司,http:////www.11467.com/shenzhen/co/426082.htm
深圳市鸿瑞源二手仪器有限公司,http:////www.11467.com/shenzhen/co/760713.htm
深圳市富吉康电子有限公司,http:////www.11467.com/shenzhen/co/51186.htm
常州富源电子有限公司,http:////www.11467.com/changzhou/co/29239.htm
常州市常光光学仪器有限公司,http:////www.11467.com/changzhou/co/16848.htm
常州市帅棋精密机械有限公司,http:////www.11467.com/changzhou/co/115713.htm
江苏常州金珑器件厂,http:////www.11467.com/changzhou/co/115757.htm
常州市奇顺机械有限公司,http:////www.11467.com/changzhou/co/105220.htm
东莞市奥卡隆电子科技有限公司,http:////www.11467.com/dongguan/co/487467.htm
东莞市衡科五金有限公司,http:////www.11467.com/dongguan/co/538312.htm
东莞市天发标牌有限公司,http:////www.11467.com/dongguan/co/515099.htm
东莞市润平机电设备有限公司,http:////www.11467.com/dongguan/co/518828.htm
东莞中锂自动化设备有限公司,http:////www.11467.com/dongguan/co/129140.htm
东莞市伟思创精密模具有限公司,http:////www.11467.com/dongguan/co/57357.htm
广州市广试仪器有限公司,http:////www.11467.com/guangzhou/co/273003.htm
广州腾达喷涂厂,http:////www.11467.com/guangzhou/co/210058.htm
深圳奥励达光学有限公司,http:////www.11467.com/shenzhen/co/149562.htm
深圳市立创辉科技有限公司,http:////www.11467.com/shenzhen/co/760726.htm
深圳市利勤电子有限责任公司《销售部》,http:////www.11467.com/shenzhen/co/579614.htm
深圳市品益电子有限公司,http:////www.11467.com/shenzhen/co/771513.htm
深圳市庞大科技有限公司,http:////www.11467.com/shenzhen/co/431138.htm
深圳市仪丰电子仪器有限公司,http:////www.11467.com/shenzhen/co/766100.htm
深圳市荣诚通科技有限公司,http:////www.11467.com/shenzhen/co/149485.htm
深圳市新城旋钮有限公司,http:////www.11467.com/shenzhen/co/722753.htm
深圳市亿利盛精密模具有限公司,http:////www.11467.com/shenzhen/co/137510.htm
苏州林洋仪表有限公司,http:////www.11467.com/suzhou/co/244402.htm
苏州恒乐自动化系统有限公司,http:////www.11467.com/suzhou/co/207160.htm
苏州驻成精密机械有限公司,http:////www.11467.com/suzhou/co/310457.htm
苏州市欧康诺电子科技有限公司,http:////www.11467.com/suzhou/co/241094.htm
武汉市长城电子技术开发中心,http:////www.11467.com/wuhan/co/56775.htm
武汉吉百瑞科技有限责任公司,http:////www.11467.com/wuhan/co/140051.htm
武汉楚鹰科技开发有限公司市场部,http:////www.11467.com/wuhan/co/89718.htm
武汉智能创想科技有限公司,http:////www.11467.com/wuhan/co/144365.htm
江阴市欧瑞孚技术有限公司,http:////www.11467.com/wuxi/co/246800.htm
无锡齐生电子有限公司,http:////www.11467.com/wuxi/co/240412.htm
无锡科丰自控设备有限公司,http:////www.11467.com/wuxi/co/202359.htm
无锡市佳友物资回收有限公司,http:////www.11467.com/wuxi/co/243683.htm
徐州佳信电子医疗机箱厂,http:////www.11467.com/xuzhou/co/52082.htm
烟台瑞通精密仪器有限公司生产部,http:////www.11467.com/yantai/co/127083.htm
丹东集源电子有限公司,http:////www.11467.com/yingkou/co/46988.htm
镇江恒通管缆有限公司,http:////www.11467.com/zhenjiang/co/61858.htm
镇江新区姚桥迎东五金胶木厂,http:////www.11467.com/zhenjiang/co/65326.htm
淄博固特电气有限公司,http:////www.11467.com/zibo/co/59123.htm
淄博拉斐尔自动化仪表有限公司,http:////www.11467.com/zibo/co/72175.htm
淄博德信机械制造有限公司,http:////www.11467.com/zibo/co/60649.htm
北京北研兴电力仪表有限责任公司（南京办事处）,http:////www.11467.com/beijing/co/398795.htm
天津七一二通信广播有限公司,http:////www.11467.com/tianjin/co/49567.htm
湖北飞驰科技有限公司,http:////www.11467.com/yichang/co/56276.htm
天津创元科技发展有限公司,http:////www.11467.com/tianjin/co/300581.htm
上海帝冠管业有限公司,http:////www.11467.com/shanghai/co/1082742.htm
天津市维肯度商贸有限公司,http:////www.11467.com/tianjin/co/300582.htm
天津恒泽机械设备有限公司,http:////www.11467.com/tianjin/co/300598.htm
天津睿衡仪表有限公司,http:////www.11467.com/tianjin/co/300674.htm
东莞市展鹏机电有限公司,http:////www.11467.com/dongguan/co/484099.htm
富阳多宝电子有限公司,http:////www.11467.com/hangzhou/co/99989.htm
杭州莫德电气有限公司,http:////www.11467.com/hangzhou/co/377713.htm
临安市众杰精密元件有限公司,http:////www.11467.com/hangzhou/co/348419.htm
杭州叶航塑胶有限公司,http:////www.11467.com/hangzhou/co/251900.htm
浙江博美特能源设备有限公司,http:////www.11467.com/hangzhou/co/251903.htm
河北鑫亿华仪表有限公司,http:////www.11467.com/hengshui/co/34312.htm
惠州市惠城区天杨五金加工厂,http:////www.11467.com/huizhou/co/96747.htm
惠州东惠电子电器回收有限公司 惠州二手仪器回收,http:////www.11467.com/huizhou/co/97158.htm
惠州市硕贝德通讯设备有限公司,http:////www.11467.com/huizhou/co/73817.htm
惠州市斯达威电子设备有限公司,http:////www.11467.com/huizhou/co/97211.htm
济南庄盟生物技术有限公司,http:////www.11467.com/jinan/co/133813.htm
昆明晨农绿色产品有限公司,http:////www.11467.com/kunming/co/95352.htm
兰州连华环保科技有限公司,http:////www.11467.com/lanzhou/co/50697.htm
南京安英德科技有限公司,http:////www.11467.com/nanjing/co/54524.htm
上海嘉标测试仪器有限公司,http:////www.11467.com/nanjing/co/54230.htm
南通宏大实验仪器有限公司,http:////www.11467.com/nantong/co/32337.htm
南通市长兴电气设备有限责任公司,http:////www.11467.com/nantong/co/80209.htm
南通市金玻光学仪器有限公司,http:////www.11467.com/nantong/co/18351.htm
四川比能信电气有限公司,http:////www.11467.com/neijiang/co/21252.htm
成都宏特精工科技有限公司,http:////www.11467.com/panzhihua/co/19498.htm
辽宁科达机械设备有限公司项目部,http:////www.11467.com/shenyang/co/57886.htm
深圳市昶特科技有限公司,http:////www.11467.com/shenzhen/co/693055.htm
深圳市功德利电子有限公司,http:////www.11467.com/shenzhen/co/276786.htm
深圳市荣鹰电子仪器有限公司,http:////www.11467.com/shenzhen/co/113517.htm
深圳市兴明宇科技有限公司,http:////www.11467.com/shenzhen/co/808106.htm
深圳市新源通仪器有限公司,http:////www.11467.com/shenzhen/co/771512.htm
首顾表面处理（深圳）有限公司,http:////www.11467.com/shenzhen/co/43118.htm
石家庄嘉航仪器仪表有限公司,http:////www.11467.com/shijiazhuang/co/83920.htm
苏州新区科雷特电力设备有限公司,http:////www.11467.com/suzhou/co/163097.htm
泰安市宏达电子有限公司,http:////www.11467.com/taian/co/1984.htm
武汉科新电力设备有限公司,http:////www.11467.com/wuhan/co/55331.htm
安徽省芜湖仪器仪表研究有限责任公司,http:////www.11467.com/wuhu/co/20090.htm
徐州汉唐金属设备有限责任公司,http:////www.11467.com/xuzhou/co/70302.htm
烟台市同利自动化仪表设备有限公司,http:////www.11467.com/yantai/co/117017.htm
罗杰有机玻璃工艺制品厂,http:////www.11467.com/zhenjiang/co/51361.htm
驻马店市金雀数字仪表有限公司,http:////www.11467.com/zhumadian/co/552.htm
北京平庄信息咨询服务部,http:////www.11467.com/beijing/co/384894.htm
美兰电子上海分公司,http:////www.11467.com/shanghai/co/1037008.htm
上海沿臻电子仪器深圳美蓝分公司,http:////www.11467.com/shanghai/co/1037065.htm
上海安苏拓电子科技有限公司,http:////www.11467.com/shanghai/co/664120.htm
友仁光仪服务部,http:////www.11467.com/tianjin/co/197068.htm
天津鑫科飞达燃气设备有限公司,http:////www.11467.com/tianjin/co/302057.htm
南阳瀚宇光电科技有限公司,http:////www.11467.com/nanyang/co/75702.htm
河北欧亿自动化设备有限公司,http:////www.11467.com/qiye/93141371.htm
乐清市锐峰电子仪表厂,http:////www.11467.com/qiye/93173986.htm
珠海嘉仪测试设备有限公司,http:////www.11467.com/qiye/93191966.htm
连云港腾越电子科技有限公司,http:////www.11467.com/lianyungang/co/28712.htm
连云港腾越电子科技有限公司的商铺,http://lianyungang028712.11467.com
新乡市新博玻璃石英制品有限公司,http:////www.11467.com/xinxiang/co/22530.htm
新乡市新博玻璃石英制品有限公司的商铺,http://xinxiang022530.11467.com
杭州合创超声波科技有限公司,http:////www.11467.com/hangzhou/co/311088.htm
杭州合创超声波科技有限公司的商铺,http://hangzhou0311088.11467.com
东莞市汇泰机械有限公司,http:////www.11467.com/dongguan/co/244939.htm
东莞市汇泰机械有限公司的商铺,http://dongguan0244939.11467.com
株洲市共创科技有限公司,http:////www.11467.com/zhuzhou/co/35216.htm
株洲市共创科技有限公司的商铺,http://zhuzhou035216.11467.com
深圳市湾边贸易有限公司,http:////www.11467.com/shenzhen/co/130037.htm
深圳市湾边贸易有限公司的商铺,http://shenzhen0130037.11467.com
宜昌瑞杰衡器研发有限公司,http:////www.11467.com/yichang/co/45621.htm
宜昌瑞杰衡器研发有限公司的商铺,http://yichang045621.11467.com
南京汇讯自控设备有限公司,http:////www.11467.com/nanjing/co/89162.htm
南京汇讯自控设备有限公司的商铺,http://nanjing089162.11467.com
大连东联仪器仪表有限公司,http:////www.11467.com/dalian/co/72954.htm
大连东联仪器仪表有限公司的商铺,http://dalian072954.11467.com
深圳市同力兴科技有限公司,http:////www.11467.com/shenzhen/co/412861.htm
深圳市同力兴科技有限公司的商铺,http://shenzhen0412861.11467.com
吴忠市气动元件厂,http:////www.11467.com/wuzhong/co/6977.htm
吴忠市气动元件厂的商铺,http://wuzhong06977.11467.com
上海润羿仪器科技有限公司,http:////www.11467.com/qiye/93047648.htm
上海润羿仪器科技有限公司的商铺,http://93047648.b2b.11467.com
珠海鼎通科技有限公司,http:////www.11467.com/zhuhai/co/57318.htm
珠海鼎通科技有限公司的商铺,http://zhuhai057318.11467.com
长春市齐祥科技有限责任公司,http:////www.11467.com/changchun/co/74531.htm
长春市齐祥科技有限责任公司的商铺,http://changchun074531.11467.com
山东省临沂市兰山区鹏翔水表厂,http:////www.11467.com/linyi/co/7119.htm
山东省临沂市兰山区鹏翔水表厂的商铺,http://linyi07119.11467.com
郑州光鸣电子电器配套设备有限公司,http:////www.11467.com/zhengzhou/co/79212.htm
郑州光鸣电子电器配套设备有限公司的商铺,http://zhengzhou079212.11467.com
廊坊富鹏五金制品有限公司,http:////www.11467.com/langfang/co/35721.htm
廊坊富鹏五金制品有限公司的商铺,http://langfang035721.11467.com
金坛市三和仪器有限公司,http:////www.11467.com/changzhou/co/152649.htm
金坛市三和仪器有限公司的商铺,http://changzhou0152649.11467.com
山东力创科技有限公司,http:////www.11467.com/laiwu/co/6627.htm
山东力创科技有限公司的商铺,http://laiwu06627.11467.com
鹰潭市东方钟表元件有限公司,http:////www.11467.com/yingtan/co/5197.htm
鹰潭市东方钟表元件有限公司的商铺,http://yingtan05197.11467.com
长沙鑫雄仪器科技有限公司,http:////www.11467.com/changsha/co/78911.htm
长沙鑫雄仪器科技有限公司的商铺,http://changsha078911.11467.com
东莞市常平爱科特试验仪器经营部,http:////www.11467.com/dongguan/co/256442.htm
东莞市常平爱科特试验仪器经营部的商铺,http://dongguan0256442.11467.com
苏州美高立电气有限公司,http:////www.11467.com/suzhou/co/356567.htm
苏州美高立电气有限公司的商铺,http://suzhou0356567.11467.com
吉林省意达自动化设备有限公司,http:////www.11467.com/songyuan/co/15329.htm
吉林省意达自动化设备有限公司的商铺,http://songyuan015329.11467.com
西安奥森测控技术有限公司,http:////www.11467.com/xian/co/95599.htm
西安奥森测控技术有限公司的商铺,http://xian095599.11467.com
深圳市夏瑞科技有限公司,http:////www.11467.com/shenzhen/co/24987.htm
深圳市夏瑞科技有限公司的商铺,http://shenzhen024987.11467.com
深圳市宇泰试验设备有限公司,http:////www.11467.com/shenzhen/co/726700.htm
深圳市宇泰试验设备有限公司的商铺,http://shenzhen0726700.11467.com
深圳市森力普电子有限公司,http:////www.11467.com/shenzhen/co/42055.htm
深圳市森力普电子有限公司的商铺,http://shenzhen042055.11467.com
郑州森鹏电子技术有限公司,http:////www.11467.com/zhengzhou/co/173477.htm
郑州森鹏电子技术有限公司的商铺,http://zhengzhou0173477.11467.com
东莞市石排崇圣线材设备加工店,http:////www.11467.com/dongguan/co/557053.htm
东莞市石排崇圣线材设备加工店的商铺,http://dongguan0557053.11467.com
东莞市精石达仪器有限公司,http:////www.11467.com/dongguan/co/499019.htm
东莞市精石达仪器有限公司的商铺,http://dongguan0499019.11467.com
瑞昌市佳佳机电设备有限公司,http:////www.11467.com/dongguan/co/247045.htm
瑞昌市佳佳机电设备有限公司的商铺,http://dongguan0247045.11467.com
苏州坤宏电子有限公司,http:////www.11467.com/suzhou/co/248948.htm
苏州坤宏电子有限公司的商铺,http://suzhou0248948.11467.com
广州市白云区富强美容仪器厂,http:////www.11467.com/guangzhou/co/475193.htm
广州市白云区富强美容仪器厂的商铺,http://guangzhou0475193.11467.com
宏景电子(芜湖)有限公司,http:////www.11467.com/wuhu/co/19180.htm
宏景电子(芜湖)有限公司的商铺,http://wuhu019180.11467.com
无锡日晞科技有限公司,http:////www.11467.com/wuxi/co/215744.htm
无锡日晞科技有限公司的商铺,http://wuxi0215744.11467.com
杭州顺豪金属制品有限公司,http:////www.11467.com/hangzhou/co/236984.htm
杭州顺豪金属制品有限公司的商铺,http://hangzhou0236984.11467.com
茂名市中德仪表有限公司,http:////www.11467.com/maoming/co/33911.htm
茂名市中德仪表有限公司的商铺,http://maoming033911.11467.com
东莞市塘厦森晨五金制品厂,http:////www.11467.com/dongguan/co/285598.htm
东莞市塘厦森晨五金制品厂的商铺,http://dongguan0285598.11467.com
东莞市鑫泰电子有限公司,http:////www.11467.com/dongguan/co/241438.htm
东莞市鑫泰电子有限公司的商铺,http://dongguan0241438.11467.com
保定市实达称重系统有限公司,http:////www.11467.com/baoding/co/58019.htm
保定市实达称重系统有限公司的商铺,http://baoding058019.11467.com
