天津市比利科技发展有限公司,http:////www.11467.com/tianjin/co/191129.htm
天津市比利科技发展有限公司的商铺,http://tianjin0191129.11467.com
陕西斯达煤矿安全装备有限公司,http:////www.11467.com/xian/co/66167.htm
陕西斯达煤矿安全装备有限公司的商铺,http://xian066167.11467.com
武汉三新电力设备制造有限公司,http:////www.11467.com/wuhan/co/56123.htm
武汉三新电力设备制造有限公司的商铺,http://wuhan056123.11467.com
新乡市新博玻璃石英制品有限公司,http:////www.11467.com/xinxiang/co/22530.htm
新乡市新博玻璃石英制品有限公司的商铺,http://xinxiang022530.11467.com
上海秉恪科教设备有限公司,http:////www.11467.com/shanghai/co/1198706.htm
上海秉恪科教设备有限公司的商铺,http://shanghai01198706.11467.com
河北奥森特科技有限公司,http:////www.11467.com/qiye/93306164.htm
上海肯都自动化仪表有限公司,http:////www.11467.com/shanghai/co/1274371.htm
上海肯都自动化仪表有限公司的商铺,http://shanghai01274371.11467.com
东莞市高升电子精密科技有限公司,http:////www.11467.com/dongguan/co/493187.htm
东莞市高升电子精密科技有限公司的商铺,http://dongguan0493187.11467.com
青岛奥龙星迪检测设备有限公司,http:////www.11467.com/qingdao/co/188579.htm
青岛奥龙星迪检测设备有限公司的商铺,http://qingdao0188579.11467.com
承德市盛科电子有限公司,http:////www.11467.com/chengde/co/23506.htm
承德市盛科电子有限公司的商铺,http://chengde023506.11467.com
株洲市共创科技有限公司,http:////www.11467.com/zhuzhou/co/35216.htm
株洲市共创科技有限公司的商铺,http://zhuzhou035216.11467.com
深圳市湾边贸易有限公司,http:////www.11467.com/shenzhen/co/130037.htm
深圳市湾边贸易有限公司的商铺,http://shenzhen0130037.11467.com
北京聚英翱翔电子有限公司,http:////www.11467.com/beijing/co/406450.htm
北京聚英翱翔电子有限公司的商铺,http://beijing0406450.11467.com
南阳市华业防爆仪表有限公司,http:////www.11467.com/nanyang/co/2232.htm
南阳市华业防爆仪表有限公司的商铺,http://nanyang02232.11467.com
宜昌瑞杰衡器研发有限公司,http:////www.11467.com/yichang/co/45621.htm
宜昌瑞杰衡器研发有限公司的商铺,http://yichang045621.11467.com
武汉拓普联合电力设备有限公司,http:////www.11467.com/wuhan/co/227726.htm
武汉拓普联合电力设备有限公司的商铺,http://wuhan0227726.11467.com
大连东联仪器仪表有限公司,http:////www.11467.com/dalian/co/72954.htm
大连东联仪器仪表有限公司的商铺,http://dalian072954.11467.com
武汉佰力博科技有限公司,http:////www.11467.com/wuhan/co/175861.htm
武汉佰力博科技有限公司的商铺,http://wuhan0175861.11467.com
承德市万吉仪器仪表制造有限公司,http:////www.11467.com/chengde/co/22426.htm
承德市万吉仪器仪表制造有限公司的商铺,http://chengde022426.11467.com
恒商工业设备有限公司苏州销售,http:////www.11467.com/suzhou/co/270142.htm
恒商工业设备有限公司苏州销售的商铺,http://suzhou0270142.11467.com
天津奥特莱科技有限公司,http:////www.11467.com/tianjin/co/216825.htm
天津奥特莱科技有限公司的商铺,http://tianjin0216825.11467.com
吴忠市气动元件厂,http:////www.11467.com/wuzhong/co/6977.htm
吴忠市气动元件厂的商铺,http://wuzhong06977.11467.com
鹤壁市万邦仪表科技有限公司,http:////www.11467.com/hebi/co/14003.htm
鹤壁市万邦仪表科技有限公司的商铺,http://hebi014003.11467.com
济南文腾试验仪器有限公司,http:////www.11467.com/jinan/co/160958.htm
济南文腾试验仪器有限公司的商铺,http://jinan0160958.11467.com
鹤壁市天冠仪器仪表有限公司,http:////www.11467.com/hebi/co/10082.htm
鹤壁市天冠仪器仪表有限公司的商铺,http://hebi010082.11467.com
鹰潭市东方钟表元件有限公司,http:////www.11467.com/yingtan/co/5197.htm
鹰潭市东方钟表元件有限公司的商铺,http://yingtan05197.11467.com
苏州斯文克精密测量设备有限公司,http:////www.11467.com/suzhou/co/315592.htm
苏州斯文克精密测量设备有限公司的商铺,http://suzhou0315592.11467.com
沈阳锐诚高科技发展有限责任公司,http:////www.11467.com/shenyang/co/69415.htm
沈阳锐诚高科技发展有限责任公司的商铺,http://shenyang069415.11467.com
淄博久安电气科技有限公司,http:////www.11467.com/zibo/co/114067.htm
淄博久安电气科技有限公司的商铺,http://zibo0114067.11467.com
吉林省意达自动化设备有限公司,http:////www.11467.com/songyuan/co/15329.htm
吉林省意达自动化设备有限公司的商铺,http://songyuan015329.11467.com
元宝机械设备（乐清)有限公司,http:////www.11467.com/wenzhou/co/264443.htm
元宝机械设备（乐清)有限公司的商铺,http://wenzhou0264443.11467.com
北京中教金源科技有限公司,http:////www.11467.com/beijing/co/313903.htm
北京中教金源科技有限公司的商铺,http://beijing0313903.11467.com
黄山市歙县七贤五金厂,http:////www.11467.com/huangshan/co/14258.htm
黄山市歙县七贤五金厂的商铺,http://huangshan014258.11467.com
重庆斌成机电科技有限公司,http:////www.11467.com/chongqing/co/206541.htm
重庆斌成机电科技有限公司的商铺,http://chongqing0206541.11467.com
西安奥森测控技术有限公司,http:////www.11467.com/xian/co/95599.htm
西安奥森测控技术有限公司的商铺,http://xian095599.11467.com
深圳市森力普电子有限公司,http:////www.11467.com/shenzhen/co/42055.htm
深圳市森力普电子有限公司的商铺,http://shenzhen042055.11467.com
上海辰心仪表有限公司,http:////www.11467.com/shanghai/co/1043290.htm
上海辰心仪表有限公司的商铺,http://shanghai01043290.11467.com
北京浩开科技有限公司,http:////www.11467.com/beijing/co/765121.htm
北京浩开科技有限公司的商铺,http://beijing0765121.11467.com
深圳市环宇光华纳米节能科技有限公司,http:////www.11467.com/shenzhen/co/1060297.htm
深圳市环宇光华纳米节能科技有限公司的商铺,http://shenzhen01060297.11467.com
山东捷成仪表自动化技术有限公司,http:////www.11467.com/zibo/co/119646.htm
山东捷成仪表自动化技术有限公司的商铺,http://zibo0119646.11467.com
无锡日晞科技有限公司,http:////www.11467.com/wuxi/co/215744.htm
无锡日晞科技有限公司的商铺,http://wuxi0215744.11467.com
茂名市中德仪表有限公司,http:////www.11467.com/maoming/co/33911.htm
茂名市中德仪表有限公司的商铺,http://maoming033911.11467.com
北京和利时恒业江苏电表有限公司,http:////www.11467.com/suqian/co/11370.htm
北京和利时恒业江苏电表有限公司的商铺,http://suqian011370.11467.com
山东中煤电器有限公司,http:////www.11467.com/jinan/co/27075.htm
山东中煤电器有限公司的商铺,http://jinan027075.11467.com
保定市实达称重系统有限公司,http:////www.11467.com/baoding/co/58019.htm
保定市实达称重系统有限公司的商铺,http://baoding058019.11467.com
天长市康泰仪表电缆厂,http:////www.11467.com/chuzhou/co/22644.htm
天长市康泰仪表电缆厂的商铺,http://chuzhou022644.11467.com
清远市和诚精密机械有限公司,http:////www.11467.com/qingyuan/co/29085.htm
清远市和诚精密机械有限公司的商铺,http://qingyuan029085.11467.com
开封市盛达水表有限公司,http:////www.11467.com/kaifeng/co/16783.htm
开封市盛达水表有限公司的商铺,http://kaifeng016783.11467.com
上海阿迪仕自动化有限公司,http:////www.11467.com/shanghai/co/1198403.htm
上海阿迪仕自动化有限公司的商铺,http://shanghai01198403.11467.com
长沙卡顿海克尔仪器有限公司,http:////www.11467.com/qiye/6274.htm
三恩驰科技有限公司,http:////www.11467.com/shenzhen/co/1037124.htm
三恩驰科技有限公司的商铺,http://shenzhen01037124.11467.com
沧州力特仪器设备有限公司,http:////www.11467.com/cangzhou/co/40811.htm
沧州力特仪器设备有限公司的商铺,http://cangzhou040811.11467.com
北京恒久科学仪器厂,http:////www.11467.com/beijing/co/487992.htm
北京恒久科学仪器厂的商铺,http://beijing0487992.11467.com
天津世纪奥博有限公司,http:////www.11467.com/tianjin/co/147640.htm
天津世纪奥博有限公司的商铺,http://tianjin0147640.11467.com
佛山霍科自控设备有限公司,http:////www.11467.com/foshan/co/306912.htm
佛山霍科自控设备有限公司的商铺,http://foshan0306912.11467.com
常州领创电气科技有限公司,http:////www.11467.com/changzhou/co/105279.htm
常州领创电气科技有限公司的商铺,http://changzhou0105279.11467.com
纳优科技（北京）有限公司,http:////www.11467.com/jiaxing/co/84680.htm
纳优科技（北京）有限公司的商铺,http://jiaxing084680.11467.com
江苏中能仪表科技有限公司,http:////www.11467.com/huaian/co/41225.htm
江苏中能仪表科技有限公司的商铺,http://huaian041225.11467.com
中山市石岐区精艺仪表厂,http:////www.11467.com/zhongshan/co/2156.htm
中山市石岐区精艺仪表厂的商铺,http://zhongshan02156.11467.com
山东华达仪器仪表有限公司,http:////www.11467.com/liaocheng/co/28003.htm
山东华达仪器仪表有限公司的商铺,http://liaocheng028003.11467.com
潮州市杰创电子配件有限公司,http:////www.11467.com/chaozhou/co/29338.htm
潮州市杰创电子配件有限公司的商铺,http://chaozhou029338.11467.com
丹东亚业射线仪器有限责任公司,http:////www.11467.com/dandong/co/46425.htm
丹东亚业射线仪器有限责任公司的商铺,http://dandong046425.11467.com
郑州三博煤炭测控仪器仪表有限公司,http:////www.11467.com/zhengzhou/co/107415.htm
郑州三博煤炭测控仪器仪表有限公司的商铺,http://zhengzhou0107415.11467.com
沧州首科仪器设备有限公司,http:////www.11467.com/cangzhou/co/40812.htm
沧州首科仪器设备有限公司的商铺,http://cangzhou040812.11467.com
常州市武进区夏溪方能环境试验设备厂,http:////www.11467.com/changzhou/co/105278.htm
常州市武进区夏溪方能环境试验设备厂的商铺,http://changzhou0105278.11467.com
上海实干衡器滚筒秤有限公司,http:////www.11467.com/shanghai/co/1035492.htm
上海实干衡器滚筒秤有限公司的商铺,http://shanghai01035492.11467.com
常州盈鑫仪器仪表有限公司,http:////www.11467.com/changzhou/co/129535.htm
常州盈鑫仪器仪表有限公司的商铺,http://changzhou0129535.11467.com
河北环宇工量具制造有限公司,http:////www.11467.com/cangzhou/co/45901.htm
河北环宇工量具制造有限公司的商铺,http://cangzhou045901.11467.com
宜兴市三维电气制造有限公司,http:////www.11467.com/wuxi/co/245778.htm
宜兴市三维电气制造有限公司的商铺,http://wuxi0245778.11467.com
长沙鸿顶实业开发有限公司,http:////www.11467.com/changsha/co/72100.htm
长沙鸿顶实业开发有限公司的商铺,http://changsha072100.11467.com
天津市灵捷传动技术有限公司,http:////www.11467.com/tianjin/co/16341.htm
天津市灵捷传动技术有限公司的商铺,http://tianjin016341.11467.com
金坛市科析仪器有限公司,http:////www.11467.com/changzhou/co/49572.htm
金坛市科析仪器有限公司的商铺,http://changzhou049572.11467.com
金坛市神科仪器厂,http:////www.11467.com/changzhou/co/150191.htm
金坛市神科仪器厂的商铺,http://changzhou0150191.11467.com
北京木铎英客教育科技发展有限责任公司,http:////www.11467.com/beijing/co/439567.htm
北京木铎英客教育科技发展有限责任公司的商铺,http://beijing0439567.11467.com
长春市倍信光电自控仪器有限公司,http:////www.11467.com/changchun/co/83547.htm
长春市倍信光电自控仪器有限公司的商铺,http://changchun083547.11467.com
保定朗诺不锈钢制品销售有限公司,http:////www.11467.com/baoding/co/74364.htm
保定朗诺不锈钢制品销售有限公司的商铺,http://baoding074364.11467.com
郑州昌原电子设备有限公司,http:////www.11467.com/zhengzhou/co/116078.htm
郑州昌原电子设备有限公司的商铺,http://zhengzhou0116078.11467.com
伊诺斯（亚洲）有限公司,http:////www.11467.com/shanghai/co/1013073.htm
伊诺斯（亚洲）有限公司的商铺,http://shanghai01013073.11467.com
天津天安起重电器有限公司,http:////www.11467.com/tianjin/co/141387.htm
天津天安起重电器有限公司的商铺,http://tianjin0141387.11467.com
东莞市东城研宝电子经营部,http:////www.11467.com/dongguan/co/256440.htm
东莞市东城研宝电子经营部的商铺,http://dongguan0256440.11467.com
常州特邦精密冲件厂,http:////www.11467.com/changzhou/co/85569.htm
常州特邦精密冲件厂的商铺,http://changzhou085569.11467.com
东莞众志检测仪器有限公司,http:////www.11467.com/dongguan/co/413931.htm
东莞众志检测仪器有限公司的商铺,http://dongguan0413931.11467.com
南皮县增泰五金制造有限公司,http:////www.11467.com/cangzhou/co/68108.htm
南皮县增泰五金制造有限公司的商铺,http://cangzhou068108.11467.com
长沙高新开发区佳仪科技有限公司,http:////www.11467.com/changsha/co/78830.htm
长沙高新开发区佳仪科技有限公司的商铺,http://changsha078830.11467.com
河间市天宫玻璃仪器厂,http:////www.11467.com/cangzhou/co/61451.htm
河间市天宫玻璃仪器厂的商铺,http://cangzhou061451.11467.com
广州市兴创力高科技有限公司,http:////www.11467.com/guangzhou/co/316873.htm
广州市兴创力高科技有限公司的商铺,http://guangzhou0316873.11467.com
河北宏业永泰流体机械股份有限公司,http:////www.11467.com/cangzhou/co/48198.htm
河北宏业永泰流体机械股份有限公司的商铺,http://cangzhou048198.11467.com
河南宏博测控技术有限公司,http:////www.11467.com/zhengzhou/co/177632.htm
河南宏博测控技术有限公司的商铺,http://zhengzhou0177632.11467.com
上海昌吉地质仪器有限公司,http:////www.11467.com/shanghai/co/280364.htm
上海昌吉地质仪器有限公司的商铺,http://shanghai0280364.11467.com
西安三泽电子有限公司,http:////www.11467.com/xian/co/63228.htm
西安三泽电子有限公司的商铺,http://xian063228.11467.com
河北优静仪表研发中心,http:////www.11467.com/shijiazhuang/co/108231.htm
河北优静仪表研发中心的商铺,http://shijiazhuang0108231.11467.com
南皮县彤晟金属制品厂,http:////www.11467.com/cangzhou/co/50308.htm
南皮县彤晟金属制品厂的商铺,http://cangzhou050308.11467.com
常州市杜玛刀具有限公司,http:////www.11467.com/changzhou/co/79760.htm
常州市杜玛刀具有限公司的商铺,http://changzhou079760.11467.com
常州市科佳仪表有限公司,http:////www.11467.com/changzhou/co/96865.htm
常州市科佳仪表有限公司的商铺,http://changzhou096865.11467.com
常州市华宇轴承仪器配件厂,http:////www.11467.com/changzhou/co/107623.htm
常州市华宇轴承仪器配件厂的商铺,http://changzhou0107623.11467.com
盐城东信阀门有限公司,http:////www.11467.com/yancheng/co/60943.htm
西安朝熙电子科技有限公司,http:////www.11467.com/xian/co/67205.htm
乐清市景鸿电气有限公司,http:////www.11467.com/wenzhou/co/169264.htm
烟台东方分析仪器 有限公司,http:////www.11467.com/yantai/co/133607.htm
合肥博众水表厂,http:////www.11467.com/hefei/co/103956.htm
淮安特瑞仕测控仪表有限公司,http:////www.11467.com/huaian/co/48493.htm
淮安特瑞仕测控仪表有限公司的商铺,http://huaian048493.11467.com
东莞市卓川电子科技有限公司,http:////www.11467.com/dongguan/co/556412.htm
东莞市卓川电子科技有限公司的商铺,http://dongguan0556412.11467.com
东莞市狮威电器有限公司,http:////www.11467.com/dongguan/co/70989.htm
东莞市狮威电器有限公司的商铺,http://dongguan070989.11467.com
菏泽市鑫源仪器仪表有限公司,http:////www.11467.com/heze/co/2021.htm
菏泽市鑫源仪器仪表有限公司的商铺,http://heze02021.11467.com
菏泽市牡丹区大华仪器有限公司,http:////www.11467.com/heze/co/20415.htm
菏泽市牡丹区大华仪器有限公司的商铺,http://heze020415.11467.com
广州市白云区金美利邦美容美体仪器厂,http:////www.11467.com/guangzhou/co/142335.htm
广州市白云区金美利邦美容美体仪器厂的商铺,http://guangzhou0142335.11467.com
慈溪市掌起镇良搏机械厂,http:////www.11467.com/ningbo/co/98719.htm
慈溪市掌起镇良搏机械厂的商铺,http://ningbo098719.11467.com
杭州筠姆仪表有限公司,http:////www.11467.com/hangzhou/co/391103.htm
杭州筠姆仪表有限公司的商铺,http://hangzhou0391103.11467.com
昆明科隆达光学仪器有限公司,http:////www.11467.com/kunming/co/34322.htm
昆明科隆达光学仪器有限公司的商铺,http://kunming034322.11467.com
福州冠远电子有限公司,http:////www.11467.com/fuzhou/co/144463.htm
福州冠远电子有限公司的商铺,http://fuzhou0144463.11467.com
赣州赛澳科技有限公司,http:////www.11467.com/ganzhou/co/25627.htm
赣州赛澳科技有限公司的商铺,http://ganzhou025627.11467.com
启东市德日激光精密仪器厂,http:////www.11467.com/qidong/co/8982.htm
启东市德日激光精密仪器厂的商铺,http://qidong08982.11467.com
河北省衡水武强县玻璃仪表厂,http:////www.11467.com/nanjing/co/77493.htm
河北省衡水武强县玻璃仪表厂的商铺,http://nanjing077493.11467.com
南京金二平二华二源电子实业有限责任公司,http:////www.11467.com/nanjing/co/77491.htm
南京金二平二华二源电子实业有限责任公司的商铺,http://nanjing077491.11467.com
南京麦哲自动化仪表有限公司,http:////www.11467.com/nanjing/co/1198.htm
南京麦哲自动化仪表有限公司的商铺,http://nanjing01198.11467.com
宁波市鄞州开拓温度计厂,http:////www.11467.com/ningbo/co/98718.htm
宁波市鄞州开拓温度计厂的商铺,http://ningbo098718.11467.com
宁波市鄞州鸿翔温度计厂,http:////www.11467.com/ningbo/co/98721.htm
宁波市鄞州鸿翔温度计厂的商铺,http://ningbo098721.11467.com
四川科学城绵阳海天电器有限责任公司,http:////www.11467.com/mianyang/co/4.htm
四川科学城绵阳海天电器有限责任公司的商铺,http://mianyang04.11467.com
嘉兴市龙茜电子科技有限公司,http:////www.11467.com/jiaxing/co/122623.htm
嘉兴市龙茜电子科技有限公司的商铺,http://jiaxing0122623.11467.com
宁波市北仑区大碶联达仪表厂,http:////www.11467.com/ningbo/co/98723.htm
宁波市北仑区大碶联达仪表厂的商铺,http://ningbo098723.11467.com
宁波余姚市三七市玻璃厂,http:////www.11467.com/ningbo/co/98722.htm
宁波余姚市三七市玻璃厂的商铺,http://ningbo098722.11467.com
霸州市新兴塑料有限公司,http:////www.11467.com/langfang/co/17032.htm
霸州市新兴塑料有限公司的商铺,http://langfang017032.11467.com
东莞市速顺五金科技有限公司,http:////www.11467.com/dongguan/co/556162.htm
东莞市速顺五金科技有限公司的商铺,http://dongguan0556162.11467.com
东莞市雄拓自动化设备有限公司,http:////www.11467.com/dongguan/co/73585.htm
东莞市雄拓自动化设备有限公司的商铺,http://dongguan073585.11467.com
河南联赢仪表有限公司,http:////www.11467.com/pingdingshan/co/26052.htm
河南联赢仪表有限公司的商铺,http://pingdingshan026052.11467.com
武邑衡达水准仪器厂,http:////www.11467.com/hengshui/co/33854.htm
武邑衡达水准仪器厂的商铺,http://hengshui033854.11467.com
东莞市长安忠业焊割器材商店,http:////www.11467.com/dongguan/co/243469.htm
东莞市长安忠业焊割器材商店的商铺,http://dongguan0243469.11467.com
吉林艾浦顿科技有限公司,http:////www.11467.com/jilinshi/co/93287.htm
吉林艾浦顿科技有限公司的商铺,http://jilinshi093287.11467.com
杭州鑫特超声设备有限公司,http:////www.11467.com/hangzhou/co/373339.htm
杭州鑫特超声设备有限公司的商铺,http://hangzhou0373339.11467.com
杭州华维电子称重系统厂,http:////www.11467.com/hangzhou/co/251901.htm
杭州华维电子称重系统厂的商铺,http://hangzhou0251901.11467.com
杭州江南压力表有限公司,http:////www.11467.com/hangzhou/co/391042.htm
杭州江南压力表有限公司的商铺,http://hangzhou0391042.11467.com
佛山市禅城区澜石志达焊接器材经营部,http:////www.11467.com/foshan/co/228351.htm
佛山市禅城区澜石志达焊接器材经营部的商铺,http://foshan0228351.11467.com
广州市创伦电子科技有限公司,http:////www.11467.com/guangzhou/co/458475.htm
广州市创伦电子科技有限公司的商铺,http://guangzhou0458475.11467.com
杭州亿维普管阀件制造有限公司,http:////www.11467.com/hangzhou/co/362692.htm
杭州亿维普管阀件制造有限公司的商铺,http://hangzhou0362692.11467.com
潮安县保德仪器具有限公司,http:////www.11467.com/guangzhou/co/122378.htm
潮安县保德仪器具有限公司的商铺,http://guangzhou0122378.11467.com
杭州驰舜科技有限公司,http:////www.11467.com/hangzhou/co/373376.htm
杭州驰舜科技有限公司的商铺,http://hangzhou0373376.11467.com
广州市可木生物科技有限公司,http:////www.11467.com/guangzhou/co/10186.htm
广州市可木生物科技有限公司的商铺,http://guangzhou010186.11467.com
东莞隆鑫测控科技有限公司,http:////www.11467.com/dongguan/co/477375.htm
东莞隆鑫测控科技有限公司的商铺,http://dongguan0477375.11467.com
佛山市顺德区苏南环试电源设备有限公司,http:////www.11467.com/foshan/co/66747.htm
佛山市顺德区苏南环试电源设备有限公司的商铺,http://foshan066747.11467.com
东莞市韦思仪器科技有限公司,http:////www.11467.com/dongguan/co/488805.htm
东莞市韦思仪器科技有限公司的商铺,http://dongguan0488805.11467.com
广州市圣汉自控设备有限公司,http:////www.11467.com/guangzhou/co/265129.htm
广州市圣汉自控设备有限公司的商铺,http://guangzhou0265129.11467.com
广州永锢壳体五金有限公司,http:////www.11467.com/guangzhou/co/261067.htm
广州永锢壳体五金有限公司的商铺,http://guangzhou0261067.11467.com
四川省丹棱明宏光学有限责任公司,http:////www.11467.com/meishan/co/18424.htm
四川省丹棱明宏光学有限责任公司的商铺,http://meishan018424.11467.com
武强县华兴仪表厂,http:////www.11467.com/hengshui/co/42777.htm
武强县华兴仪表厂的商铺,http://hengshui042777.11467.com
杭州赣鑫电子有限公司,http:////www.11467.com/hangzhou/co/245320.htm
杭州赣鑫电子有限公司的商铺,http://hangzhou0245320.11467.com
杭州友谊仪表元件厂,http:////www.11467.com/hangzhou/co/590.htm
杭州友谊仪表元件厂的商铺,http://hangzhou0590.11467.com
富阳市中瑞电子元件厂,http:////www.11467.com/hangzhou/co/339706.htm
富阳市中瑞电子元件厂的商铺,http://hangzhou0339706.11467.com
广州市宝拓电子科技有限公司,http:////www.11467.com/guangzhou/co/255168.htm
广州市宝拓电子科技有限公司的商铺,http://guangzhou0255168.11467.com
福建省健威液晶科技有限公司,http:////www.11467.com/putian/co/17045.htm
福建省健威液晶科技有限公司的商铺,http://putian017045.11467.com
南京热诚机电设备有限公司,http:////www.11467.com/nanjing/co/49980.htm
南京热诚机电设备有限公司的商铺,http://nanjing049980.11467.com
无锡三能电器有限公司,http:////www.11467.com/wuxi/co/192439.htm
无锡三能电器有限公司的商铺,http://wuxi0192439.11467.com
苏州贝克莱阀门有限公司,http:////www.11467.com/suzhou/co/356279.htm
苏州贝克莱阀门有限公司的商铺,http://suzhou0356279.11467.com
深圳市长旭机械设备有限公司,http:////www.11467.com/shenzhen/co/726697.htm
深圳市长旭机械设备有限公司的商铺,http://shenzhen0726697.11467.com
烟台科大精密实验装备有限公司,http:////www.11467.com/yantai/co/124660.htm
烟台科大精密实验装备有限公司的商铺,http://yantai0124660.11467.com
苏州市联捷真空设备有限公司,http:////www.11467.com/suzhou/co/240199.htm
苏州市联捷真空设备有限公司的商铺,http://suzhou0240199.11467.com
深圳市澳德玛电子科技有限公司,http:////www.11467.com/shenzhen/co/137628.htm
深圳市澳德玛电子科技有限公司的商铺,http://shenzhen0137628.11467.com
镇江东联仪表有限公司,http:////www.11467.com/zhenjiang/co/11854.htm
镇江东联仪表有限公司的商铺,http://zhenjiang011854.11467.com
泰安市山衡衡器有限公司,http:////www.11467.com/taian/co/36896.htm
泰安市山衡衡器有限公司的商铺,http://taian036896.11467.com
苏州益凯盛电子有限公司,http:////www.11467.com/suzhou/co/233182.htm
苏州益凯盛电子有限公司的商铺,http://suzhou0233182.11467.com
无锡市王珏磁钢厂,http:////www.11467.com/wuxi/co/194204.htm
无锡市王珏磁钢厂的商铺,http://wuxi0194204.11467.com
无锡徽科特测控技术有限公司,http:////www.11467.com/wuxi/co/244361.htm
无锡徽科特测控技术有限公司的商铺,http://wuxi0244361.11467.com
珠海精英仪表有限公司,http:////www.11467.com/zhuhai/co/75462.htm
珠海精英仪表有限公司的商铺,http://zhuhai075462.11467.com
武汉市镭亚光电子有限公司,http:////www.11467.com/wuhan/co/81271.htm
武汉市镭亚光电子有限公司的商铺,http://wuhan081271.11467.com
