深圳市晨旭劳保包装连锁商行,http:////www.11467.com/shenzhen/co/291113.htm
深圳市晨旭劳保包装连锁商行的商铺,http://shenzhen0291113.11467.com
北京华安保信息技术有限公司,http:////www.11467.com/beijing/co/400887.htm
圣华盾服饰有限公司,http:////www.11467.com/wuxi/co/259774.htm
圣华盾服饰有限公司的商铺,http://wuxi0259774.11467.com
山东新明玻璃钢制品有限公司,http:////www.11467.com/dezhou/co/66341.htm
山东新明玻璃钢制品有限公司的商铺,http://dezhou066341.11467.com
北京邦麦尔救援设备有限公司,http:////www.11467.com/beijing/co/714161.htm
北京邦麦尔救援设备有限公司的商铺,http://beijing0714161.11467.com
上海欧脉电子科技发展有限公司,http:////www.11467.com/shanghai/co/388839.htm
上海欧脉电子科技发展有限公司的商铺,http://shanghai0388839.11467.com
深圳市澳亚迪电子设备有限公司,http:////www.11467.com/shenzhen/co/144815.htm
深圳市澳亚迪电子设备有限公司的商铺,http://shenzhen0144815.11467.com
上海山容塑料科技有限公司,http:////www.11467.com/shanghai/co/1086207.htm
上海山容塑料科技有限公司的商铺,http://shanghai01086207.11467.com
宝应苏旭电气设备厂,http:////www.11467.com/shuozhou/co/11802.htm
宝应苏旭电气设备厂的商铺,http://shuozhou011802.11467.com
曹君珺(个体经营),http:////www.11467.com/maanshan/co/20369.htm
曹君珺(个体经营)的商铺,http://maanshan020369.11467.com
江苏苏通碳纤维有限公司,http:////www.11467.com/nantong/co/101879.htm
江苏苏通碳纤维有限公司的商铺,http://nantong0101879.11467.com
陕西宏实建设工程有限公司,http:////www.11467.com/xian/co/139958.htm
陕西宏实建设工程有限公司的商铺,http://xian0139958.11467.com
盐城市国泰高新防备有限公司,http:////www.11467.com/yancheng/co/54557.htm
盐城市国泰高新防备有限公司的商铺,http://yancheng054557.11467.com
舟山市汇力绳缆有限公司,http:////www.11467.com/zhoushan/co/17455.htm
舟山市汇力绳缆有限公司的商铺,http://zhoushan017455.11467.com
秦皇岛天恩帐篷有限公司,http:////www.11467.com/qinhuangdao/co/36185.htm
秦皇岛天恩帐篷有限公司的商铺,http://qinhuangdao036185.11467.com
开封市东郊惠河木器厂,http:////www.11467.com/kaifeng/co/15111.htm
开封市东郊惠河木器厂的商铺,http://kaifeng015111.11467.com
荆门众和制衣有限公司,http:////www.11467.com/jingmen/co/14909.htm
荆门众和制衣有限公司的商铺,http://jingmen014909.11467.com
宿迁锦承消防装备有限公司,http:////www.11467.com/suqian/co/11874.htm
宿迁锦承消防装备有限公司的商铺,http://suqian011874.11467.com
泰州市海陵区龙华纺织装备器材厂,http:////www.11467.com/taizhoushi/co/28191.htm
泰州市海陵区龙华纺织装备器材厂的商铺,http://taizhoushi028191.11467.com
石家庄拓达科贸有限公司,http:////www.11467.com/shijiazhuang/co/89112.htm
石家庄拓达科贸有限公司的商铺,http://shijiazhuang089112.11467.com
山西三关安防设备有限公司,http:////www.11467.com/taiyuan/co/98263.htm
山西三关安防设备有限公司的商铺,http://taiyuan098263.11467.com
杨凌天工实业有限公司,http:////www.11467.com/xianyang/co/21649.htm
杨凌天工实业有限公司的商铺,http://xianyang021649.11467.com
天津欧美意科技发展有限责任公司,http:////www.11467.com/tianjin/co/211770.htm
天津欧美意科技发展有限责任公司的商铺,http://tianjin0211770.11467.com
无锡东昊安全装备科技有限公司,http:////www.11467.com/wuxi/co/250008.htm
无锡东昊安全装备科技有限公司的商铺,http://wuxi0250008.11467.com
江西长江化工有限责任公司,http:////www.11467.com/jiujiang/co/20390.htm
江西长江化工有限责任公司的商铺,http://jiujiang020390.11467.com
长春英华科技有限公司,http:////www.11467.com/changchun/co/53824.htm
长春英华科技有限公司的商铺,http://changchun053824.11467.com
深圳市高木安防设备有限公司,http:////www.11467.com/shenzhen/co/287969.htm
深圳市高木安防设备有限公司的商铺,http://shenzhen0287969.11467.com
无锡市东尔电子器材有限公司,http:////www.11467.com/wuxi/co/199170.htm
无锡市东尔电子器材有限公司的商铺,http://wuxi0199170.11467.com
广东兵工安检设备制造有限公司,http:////www.11467.com/shijiazhuang/co/263431.htm
广东兵工安检设备制造有限公司的商铺,http://shijiazhuang0263431.11467.com
北京江南佳信商贸有限公司,http:////www.11467.com/beijing/co/310202.htm
北京江南佳信商贸有限公司的商铺,http://beijing0310202.11467.com
佛山市顺德区顺伟怡帐篷有限公司,http:////www.11467.com/foshan/co/356175.htm
佛山市顺德区顺伟怡帐篷有限公司的商铺,http://foshan0356175.11467.com
南昌永泰防护装备制造有限公司,http:////www.11467.com/nanchang/co/113567.htm
南昌永泰防护装备制造有限公司的商铺,http://nanchang0113567.11467.com
武汉细龙科技有限公司,http:////www.11467.com/wuhan/co/143559.htm
武汉细龙科技有限公司的商铺,http://wuhan0143559.11467.com
武汉法尔丹服装有限公司,http:////www.11467.com/wuhan/co/142139.htm
武汉法尔丹服装有限公司的商铺,http://wuhan0142139.11467.com
靖江市顺兴警用器材制造有限公司,http:////www.11467.com/taizhoushi/co/47423.htm
靖江市顺兴警用器材制造有限公司的商铺,http://taizhoushi047423.11467.com
深圳市舒特帐篷有限公司,http:////www.11467.com/shenzhen/co/299121.htm
深圳市舒特帐篷有限公司的商铺,http://shenzhen0299121.11467.com
王信华(个体经营),http:////www.11467.com/linyi/co/107093.htm
王信华(个体经营)的商铺,http://linyi0107093.11467.com
杭州张氏通和鞋业有限公司,http:////www.11467.com/hangzhou/co/267648.htm
杭州张氏通和鞋业有限公司的商铺,http://hangzhou0267648.11467.com
广州市晨浩旅游用品有限公司,http:////www.11467.com/guangzhou/co/735622.htm
广州市晨浩旅游用品有限公司的商铺,http://guangzhou0735622.11467.com
奥视电子科技（海南）有限公司,http:////www.11467.com/chengmai/co/1745.htm
奥视电子科技（海南）有限公司的商铺,http://chengmai01745.11467.com
徐州国美智能科技工程有限公司,http:////www.11467.com/xuzhou/co/80908.htm
徐州国美智能科技工程有限公司的商铺,http://xuzhou080908.11467.com
佛山市顺德区顺之彩帐篷制品有限公司,http:////www.11467.com/foshan/co/277771.htm
佛山市顺德区顺之彩帐篷制品有限公司的商铺,http://foshan0277771.11467.com
广西南宁赛富帐篷有限责任公司,http:////www.11467.com/nanning/co/86154.htm
广西南宁赛富帐篷有限责任公司的商铺,http://nanning086154.11467.com
新野县民生针棉织厂,http:////www.11467.com/nanyang/co/42011.htm
新野县民生针棉织厂的商铺,http://nanyang042011.11467.com
深圳市飞讯腾科技有限公司,http:////www.11467.com/shenzhen/co/160240.htm
深圳市飞讯腾科技有限公司的商铺,http://shenzhen0160240.11467.com
苏州鸿源特种纤维制品有限公司,http:////www.11467.com/suzhou/co/269419.htm
苏州鸿源特种纤维制品有限公司的商铺,http://suzhou0269419.11467.com
肥城同发商贸有限责任公司,http:////www.11467.com/taian/co/52589.htm
肥城同发商贸有限责任公司的商铺,http://taian052589.11467.com
温州市亿得宝化纤有限公司,http:////www.11467.com/wenzhou/co/237428.htm
温州市亿得宝化纤有限公司的商铺,http://wenzhou0237428.11467.com
北京军缘勤科技有限公司,http:////www.11467.com/qiye/18069.htm
西安立靶科工贸有限公司,http:////www.11467.com/xian/co/60712.htm
广州狼奴户外运动用品有限公司,http:////www.11467.com/guangzhou/co/494615.htm
广州狼奴户外运动用品有限公司的商铺,http://guangzhou0494615.11467.com
上海京军科贸有限公司,http:////www.11467.com/shanghai/co/330511.htm
上海京军科贸有限公司的商铺,http://shanghai0330511.11467.com
深圳市鑫立达宏科技有限公司,http:////www.11467.com/shenzhen/co/287709.htm
深圳市鑫立达宏科技有限公司的商铺,http://shenzhen0287709.11467.com
深圳市联合华仪智能设备有限公司,http:////www.11467.com/shenzhen/co/102806.htm
深圳市联合华仪智能设备有限公司的商铺,http://shenzhen0102806.11467.com
高碑店市白沟万超包装制品厂,http:////www.11467.com/baoding/co/63875.htm
高碑店市白沟万超包装制品厂的商铺,http://baoding063875.11467.com
大连稳盛劳保物资有限公司,http:////www.11467.com/dalian/co/15369.htm
大连稳盛劳保物资有限公司的商铺,http://dalian015369.11467.com
海宁市峰峰皮革制品厂,http:////www.11467.com/jiaxing/co/86974.htm
海宁市峰峰皮革制品厂的商铺,http://jiaxing086974.11467.com
嘉兴市荣盛救生设备有限公司,http:////www.11467.com/jiaxing/co/75155.htm
嘉兴市荣盛救生设备有限公司的商铺,http://jiaxing075155.11467.com
城阳区金海田物资商行,http:////www.11467.com/qingdao/co/100367.htm
城阳区金海田物资商行的商铺,http://qingdao0100367.11467.com
王世庄（个体经营）,http:////www.11467.com/shenyang/co/67805.htm
王世庄（个体经营）的商铺,http://shenyang067805.11467.com
济南军地谊橡胶制品工贸有限公司,http:////www.11467.com/jinan/co/93172.htm
济南军地谊橡胶制品工贸有限公司的商铺,http://jinan093172.11467.com
山东临沂志远塑料篷布厂,http:////www.11467.com/linyi/co/59413.htm
山东临沂志远塑料篷布厂的商铺,http://linyi059413.11467.com
龙杰(福建)光电科技发展有限公司,http:////www.11467.com/longyan/co/22018.htm
龙杰(福建)光电科技发展有限公司的商铺,http://longyan022018.11467.com
广州市众辉通信科技有限公司,http:////www.11467.com/guangzhou/co/458349.htm
广州市众辉通信科技有限公司的商铺,http://guangzhou0458349.11467.com
安徽长江劳保用品有限公司,http:////www.11467.com/hefei/co/82041.htm
安徽长江劳保用品有限公司的商铺,http://hefei082041.11467.com
安徽红星机电科技股份有限公司,http:////www.11467.com/hefei/co/81368.htm
安徽红星机电科技股份有限公司的商铺,http://hefei081368.11467.com
北京中盾宝业安全防护器材有限公司,http:////www.11467.com/beijing/co/97948.htm
北京中盾宝业安全防护器材有限公司的商铺,http://beijing097948.11467.com
漯河高新区重九皮鞋厂,http:////www.11467.com/qingdao/co/83412.htm
漯河高新区重九皮鞋厂的商铺,http://qingdao083412.11467.com
宝鸡市磊宝有色金属制品有限公司,http:////www.11467.com/baoji/co/24462.htm
宝鸡市磊宝有色金属制品有限公司的商铺,http://baoji024462.11467.com
佛山市顺德区伦教圣堡仕运动用品厂,http:////www.11467.com/foshan/co/216597.htm
佛山市顺德区伦教圣堡仕运动用品厂的商铺,http://foshan0216597.11467.com
广州市白云区建达皮具制品厂,http:////www.11467.com/guangzhou/co/161692.htm
广州市白云区建达皮具制品厂的商铺,http://guangzhou0161692.11467.com
杭州轩缘服饰有限公司,http:////www.11467.com/hangzhou/co/370084.htm
杭州轩缘服饰有限公司的商铺,http://hangzhou0370084.11467.com
深圳市广播电视工程有限公司,http:////www.11467.com/shenzhen/co/288059.htm
深圳市广播电视工程有限公司的商铺,http://shenzhen0288059.11467.com
广州生存者体育用品有限公司,http:////www.11467.com/guangzhou/co/430317.htm
广州生存者体育用品有限公司的商铺,http://guangzhou0430317.11467.com
广州龙洲电子科技有限公司,http:////www.11467.com/guangzhou/co/125946.htm
广州龙洲电子科技有限公司的商铺,http://guangzhou0125946.11467.com
广州青龙林服饰有限公司,http:////www.11467.com/guangzhou/co/433307.htm
广州青龙林服饰有限公司的商铺,http://guangzhou0433307.11467.com
浏阳市集里斯必成电子设备厂,http:////www.11467.com/changsha/co/119665.htm
浏阳市集里斯必成电子设备厂的商铺,http://changsha0119665.11467.com
青岛友利惠商贸有限公司,http:////www.11467.com/qingdao/co/98194.htm
青岛友利惠商贸有限公司的商铺,http://qingdao098194.11467.com
深圳市华坤塑胶制品有限公司,http:////www.11467.com/shenzhen/co/563712.htm
深圳市华坤塑胶制品有限公司的商铺,http://shenzhen0563712.11467.com
东莞市大千礼品有限公司,http:////www.11467.com/dongguan/co/319643.htm
东莞市大千礼品有限公司的商铺,http://dongguan0319643.11467.com
成都市鑫宏威野营装备器材有限责任公司,http:////www.11467.com/chengdu/co/62306.htm
成都市鑫宏威野营装备器材有限责任公司的商铺,http://chengdu062306.11467.com
东莞市特顺手袋皮具有限公司,http:////www.11467.com/dongguan/co/411852.htm
东莞市特顺手袋皮具有限公司的商铺,http://dongguan0411852.11467.com
东莞市锐霖实业有限公司,http:////www.11467.com/dongguan/co/503189.htm
东莞市锐霖实业有限公司的商铺,http://dongguan0503189.11467.com
深圳市东帝光电有限公司,http:////www.11467.com/shenzhen/co/762741.htm
深圳市东帝光电有限公司的商铺,http://shenzhen0762741.11467.com
深圳市伟安消防设备有限公司,http:////www.11467.com/shenzhen/co/758338.htm
深圳市伟安消防设备有限公司的商铺,http://shenzhen0758338.11467.com
深圳市微玛安捷电子有限公司,http:////www.11467.com/shenzhen/co/287744.htm
深圳市微玛安捷电子有限公司的商铺,http://shenzhen0287744.11467.com
成都市迤逦服饰有限公司,http:////www.11467.com/chengdu/co/81080.htm
成都市迤逦服饰有限公司的商铺,http://chengdu081080.11467.com
广州市花都区新华力拓光学眼镜厂,http:////www.11467.com/guangzhou/co/307879.htm
广州市花都区新华力拓光学眼镜厂的商铺,http://guangzhou0307879.11467.com
安平县云飞五金丝网制品有限公司,http:////www.11467.com/hengshui/co/33677.htm
安平县云飞五金丝网制品有限公司的商铺,http://hengshui033677.11467.com
佛山市顺德区勒流镇富裕恒勇塑料厂,http:////www.11467.com/foshan/co/221066.htm
佛山市顺德区勒流镇富裕恒勇塑料厂的商铺,http://foshan0221066.11467.com
广州市雅科达旅游用品有限公司,http:////www.11467.com/guangzhou/co/307900.htm
广州市雅科达旅游用品有限公司的商铺,http://guangzhou0307900.11467.com
常州昌博包装材料厂,http:////www.11467.com/changzhou/co/115012.htm
常州昌博包装材料厂的商铺,http://changzhou0115012.11467.com
惠阳侨友劳保特供公司东莞寮步供应站,http:////www.11467.com/dongguan/co/222246.htm
惠阳侨友劳保特供公司东莞寮步供应站的商铺,http://dongguan0222246.11467.com
湖南三才光电信息材料有限公司,http:////www.11467.com/changsha/co/82494.htm
湖南三才光电信息材料有限公司的商铺,http://changsha082494.11467.com
深圳市真功夫安防电子有限公司,http:////www.11467.com/shenzhen/co/790116.htm
深圳市真功夫安防电子有限公司的商铺,http://shenzhen0790116.11467.com
深圳市互信互达科技有限公司,http:////www.11467.com/shenzhen/co/761076.htm
深圳市互信互达科技有限公司的商铺,http://shenzhen0761076.11467.com
深圳市富特隆电波屏蔽材料有限公司,http:////www.11467.com/shenzhen/co/761307.htm
深圳市富特隆电波屏蔽材料有限公司的商铺,http://shenzhen0761307.11467.com
深圳市龙电安防产品有限公司,http:////www.11467.com/shenzhen/co/722054.htm
深圳市龙电安防产品有限公司的商铺,http://shenzhen0722054.11467.com
北京京南军用充气帐篷厂,http:////www.11467.com/beijing/co/338796.htm
北京瑞警腾达安全防范科技有限公司,http:////www.11467.com/beijing/co/623030.htm
苏州葛氏兄弟安全防护用品有限公司,http:////www.11467.com/suzhou/co/354974.htm
苏州葛氏兄弟安全防护用品有限公司的商铺,http://suzhou0354974.11467.com
北京世纪军茂商贸有限公司,http:////www.11467.com/beijing/co/97919.htm
北京世纪军茂商贸有限公司的商铺,http://beijing097919.11467.com
泰州市海陵区苏陈宏泰工艺品厂,http:////www.11467.com/taizhoushi/co/32013.htm
泰州市海陵区苏陈宏泰工艺品厂的商铺,http://taizhoushi032013.11467.com
泰州市开发区领先商贸有限公司,http:////www.11467.com/taizhoushi/co/31821.htm
泰州市开发区领先商贸有限公司的商铺,http://taizhoushi031821.11467.com
新乡市亿佳纺织有限公司,http:////www.11467.com/xinxiang/co/24124.htm
新乡市亿佳纺织有限公司的商铺,http://xinxiang024124.11467.com
泰州市鹏程织造有限公司,http:////www.11467.com/taizhoushi/co/32012.htm
泰州市鹏程织造有限公司的商铺,http://taizhoushi032012.11467.com
厦门市鑫晋元商贸有限公司,http:////www.11467.com/xiamen/co/59547.htm
厦门市鑫晋元商贸有限公司的商铺,http://xiamen059547.11467.com
新乡市鑫源特种纺织品有限责任公司,http:////www.11467.com/xinxiang/co/305.htm
新乡市鑫源特种纺织品有限责任公司的商铺,http://xinxiang0305.11467.com
郑州大本营野营装备有限公司,http:////www.11467.com/zhengzhou/co/123069.htm
郑州大本营野营装备有限公司的商铺,http://zhengzhou0123069.11467.com
北京国奥信达科技有限公司,http:////www.11467.com/beijing/co/114142.htm
北京国奥信达科技有限公司的商铺,http://beijing0114142.11467.com
北京橄榄情劳保用品商店,http:////www.11467.com/beijing/co/650820.htm
北京橄榄情劳保用品商店的商铺,http://beijing0650820.11467.com
北京健妮科技发展有限公司,http:////www.11467.com/beijing/co/114138.htm
北京健妮科技发展有限公司的商铺,http://beijing0114138.11467.com
北京华北战神野营物资有限公司,http:////www.11467.com/beijing/co/584706.htm
北京华北战神野营物资有限公司的商铺,http://beijing0584706.11467.com
北京华中雁商贸有限公司,http:////www.11467.com/beijing/co/652408.htm
北京华中雁商贸有限公司的商铺,http://beijing0652408.11467.com
北京市精诚航科技开发有限责任公司,http:////www.11467.com/beijing/co/563810.htm
北京市精诚航科技开发有限责任公司的商铺,http://beijing0563810.11467.com
北京市朝阳区呼家楼军鑫服装门市部,http:////www.11467.com/beijing/co/114139.htm
北京市朝阳区呼家楼军鑫服装门市部的商铺,http://beijing0114139.11467.com
北京中友伟皓充气帐篷厂,http:////www.11467.com/beijing/co/275186.htm
北京中友伟皓充气帐篷厂的商铺,http://beijing0275186.11467.com
北京拯救者户外装备商贸中心,http:////www.11467.com/beijing/co/561995.htm
北京拯救者户外装备商贸中心的商铺,http://beijing0561995.11467.com
泰州市永正救护装备有限公司,http:////www.11467.com/taizhoushi/co/31549.htm
泰州市永正救护装备有限公司的商铺,http://taizhoushi031549.11467.com
泰州市高港区飞达军训器材厂,http:////www.11467.com/taizhoushi/co/26871.htm
泰州市高港区飞达军训器材厂的商铺,http://taizhoushi026871.11467.com
泰州市安达消防救援器材有限公司,http:////www.11467.com/taizhoushi/co/27090.htm
泰州市安达消防救援器材有限公司的商铺,http://taizhoushi027090.11467.com
泰州市耐特尔绳带有限公司,http:////www.11467.com/taizhoushi/co/28491.htm
泰州市耐特尔绳带有限公司的商铺,http://taizhoushi028491.11467.com
苏州骏华带业有限公司,http:////www.11467.com/suzhou/co/247018.htm
苏州骏华带业有限公司的商铺,http://suzhou0247018.11467.com
山西新华防护器材有限责任公司,http:////www.11467.com/taiyuan/co/99186.htm
山西新华防护器材有限责任公司的商铺,http://taiyuan099186.11467.com
石家庄市裕华区天成帐篷厂,http:////www.11467.com/shijiazhuang/co/83022.htm
石家庄市裕华区天成帐篷厂的商铺,http://shijiazhuang083022.11467.com
新乡市华源护神有限责任公司,http:////www.11467.com/xinxiang/co/24123.htm
新乡市华源护神有限责任公司的商铺,http://xinxiang024123.11467.com
徐州凯特皮具有限公司,http:////www.11467.com/xuzhou/co/57259.htm
徐州凯特皮具有限公司的商铺,http://xuzhou057259.11467.com
广州衣画裳贸易有限公司,http:////www.11467.com/wuhan/co/88271.htm
广州衣画裳贸易有限公司的商铺,http://wuhan088271.11467.com
天成科技开发有限公司 被服装备部,http:////www.11467.com/wuhan/co/70613.htm
天成科技开发有限公司 被服装备部的商铺,http://wuhan070613.11467.com
武汉市硚口区火凤凰服装经销部,http:////www.11467.com/wuhan/co/70626.htm
武汉市硚口区火凤凰服装经销部的商铺,http://wuhan070626.11467.com
泰州市华润纺织品有限公司,http:////www.11467.com/taizhoushi/co/8625.htm
泰州市华润纺织品有限公司的商铺,http://taizhoushi08625.11467.com
武汉恒欣帐蓬制品有限公司,http:////www.11467.com/wuhan/co/88280.htm
武汉恒欣帐蓬制品有限公司的商铺,http://wuhan088280.11467.com
泰州市华威消防救护装备有限公司,http:////www.11467.com/taizhoushi/co/32007.htm
泰州市华威消防救护装备有限公司的商铺,http://taizhoushi032007.11467.com
医药高新区守诚液压机械厂,http:////www.11467.com/taizhoushi/co/51689.htm
医药高新区守诚液压机械厂的商铺,http://taizhoushi051689.11467.com
泰州市天富热工设备制造有限公司,http:////www.11467.com/taizhoushi/co/29815.htm
泰州市天富热工设备制造有限公司的商铺,http://taizhoushi029815.11467.com
江苏吉安警用器材制造有限公司,http:////www.11467.com/taizhoushi/co/51737.htm
江苏吉安警用器材制造有限公司的商铺,http://taizhoushi051737.11467.com
江苏锐盾警用装备制造有限公司,http:////www.11467.com/taizhoushi/co/51715.htm
江苏锐盾警用装备制造有限公司的商铺,http://taizhoushi051715.11467.com
无锡国维电磁屏蔽声学工程设备有限公司,http:////www.11467.com/wuxi/co/175716.htm
无锡国维电磁屏蔽声学工程设备有限公司的商铺,http://wuxi0175716.11467.com
江苏鸿瑞消防器材有限公司,http:////www.11467.com/taizhoushi/co/51602.htm
江苏鸿瑞消防器材有限公司的商铺,http://taizhoushi051602.11467.com
泰州市鑫顺达织造厂,http:////www.11467.com/taizhoushi/co/51720.htm
泰州市鑫顺达织造厂的商铺,http://taizhoushi051720.11467.com
北京恒通信安信息科技有限公司,http:////www.11467.com/beijing/co/416508.htm
北京恒通信安信息科技有限公司的商铺,http://beijing0416508.11467.com
东台市海强安全装备厂,http:////www.11467.com/yancheng/co/80260.htm
东台市海强安全装备厂的商铺,http://yancheng080260.11467.com
芜湖市勇者户外服饰贸易有限公司,http:////www.11467.com/wuhu/co/27803.htm
芜湖市勇者户外服饰贸易有限公司的商铺,http://wuhu027803.11467.com
泰州市杰尔曼消防装备有限公司,http:////www.11467.com/taizhoushi/co/51735.htm
泰州市杰尔曼消防装备有限公司的商铺,http://taizhoushi051735.11467.com
深圳市迅恩科技有限公司,http:////www.11467.com/shenzhen/co/760751.htm
深圳市迅恩科技有限公司的商铺,http://shenzhen0760751.11467.com
栾城县鼎诚帆布制品有限公司,http:////www.11467.com/shijiazhuang/co/139721.htm
栾城县鼎诚帆布制品有限公司的商铺,http://shijiazhuang0139721.11467.com
深圳市真功夫安防电子有限公司,http:////www.11467.com/shenzhen/co/790116.htm
深圳市真功夫安防电子有限公司的商铺,http://shenzhen0790116.11467.com
泰州市鸿雨消防器材有限公司,http:////www.11467.com/taizhoushi/co/28190.htm
泰州市鸿雨消防器材有限公司的商铺,http://taizhoushi028190.11467.com
苏州金鹰特种器具有限公司,http:////www.11467.com/suzhou/co/141439.htm
苏州金鹰特种器具有限公司的商铺,http://suzhou0141439.11467.com
宜丰县正豪木制品厂,http:////www.11467.com/xuzhou/co/82979.htm
宜丰县正豪木制品厂的商铺,http://xuzhou082979.11467.com
郑州天拓润滑油有限公司,http:////www.11467.com/zhengzhou/co/116041.htm
郑州天拓润滑油有限公司的商铺,http://zhengzhou0116041.11467.com
北京军阅科技有限公司,http:////www.11467.com/beijing/co/763546.htm
北京军阅科技有限公司的商铺,http://beijing0763546.11467.com
军地一线文化传播（北京）有限公司,http:////www.11467.com/beijing/co/726330.htm
军地一线文化传播（北京）有限公司的商铺,http://beijing0726330.11467.com
北京信安伟业科技有限公司,http:////www.11467.com/qiye/93352230.htm
北京信安伟业科技有限公司的商铺,http://93352230.b2b.11467.com
上海三力拉链有限公司,http:////www.11467.com/shanghai/co/246909.htm
上海三力拉链有限公司的商铺,http://shanghai0246909.11467.com
上海伊贝纳纺织品有限公司,http:////www.11467.com/shanghai/co/392076.htm
上海伊贝纳纺织品有限公司的商铺,http://shanghai0392076.11467.com
上海燕桥工程塑料有限公司,http:////www.11467.com/shanghai/co/11732.htm
上海燕桥工程塑料有限公司的商铺,http://shanghai011732.11467.com
天津丽泰鞋业有限公司,http:////www.11467.com/tianjin/co/178635.htm
天津丽泰鞋业有限公司的商铺,http://tianjin0178635.11467.com
天津莎梦床上用品有限公司,http:////www.11467.com/tianjin/co/15157.htm
天津莎梦床上用品有限公司的商铺,http://tianjin015157.11467.com
