苏州大方有限公司,http:////www.11467.com/suzhou/co/227068.htm
张家港市合兴新型输送设备有限公司,http:////www.11467.com/suzhou/co/129225.htm
泰安市宏泰矿压仪器仪表有限公司,http:////www.11467.com/taian/co/36484.htm
泰安市优耐矿山机械电子有限公司,http:////www.11467.com/taian/co/52805.htm
泰安市九方矿山设备有限公司,http:////www.11467.com/taian/co/36481.htm
泰安市宏达矿压机械有限公司,http:////www.11467.com/taian/co/36485.htm
山东博达矿业设备有限公司,http:////www.11467.com/taian/co/36872.htm
新泰市晟元水利钻探有限公司,http:////www.11467.com/taian/co/46905.htm
山东科大晨晖电子科技有限公司市场部,http:////www.11467.com/taian/co/36490.htm
山东科技大学丰华电子有限公司,http:////www.11467.com/taian/co/53015.htm
泰安广泓地质钻探有限公司,http:////www.11467.com/taian/co/50377.htm
山西省煤矿物资供应公司,http:////www.11467.com/taiyuan/co/23759.htm
太原普惠阳光机械配件有限公司,http:////www.11467.com/taiyuan/co/96150.htm
山西德恒煤矿综合物探有限责任公司,http:////www.11467.com/taiyuan/co/124540.htm
太原市华安商贸有限公司,http:////www.11467.com/taiyuan/co/96118.htm
太原市科利源机电设备有限公司,http:////www.11467.com/taiyuan/co/55060.htm
山西太原市聚氨酯制品开发有限公司,http:////www.11467.com/taiyuan/co/124541.htm
太原市科探科技有限公司,http:////www.11467.com/taiyuan/co/123271.htm
临海中天水泵厂,http:////www.11467.com/taizhou/co/88115.htm
台州特克机电有限公司,http:////www.11467.com/taizhou/co/105834.htm
泰州市沿江电子机械制造有限公销售部,http:////www.11467.com/taizhoushi/co/29375.htm
江苏曙光石油钻具有限公司销售部,http:////www.11467.com/taizhoushi/co/26108.htm
中国江苏神力集团泰州市兴洲工矿设备有限公司,http:////www.11467.com/taizhoushi/co/29909.htm
泰州市海陵区万佳机械设备经营部,http:////www.11467.com/taizhoushi/co/29340.htm
泰州力扬机械工具有限公司,http:////www.11467.com/taizhoushi/co/30202.htm
金鑫地质机械配件厂,http:////www.11467.com/tangshan/co/57335.htm
河北地矿钻探工程(公司)处,http:////www.11467.com/tangshan/co/75784.htm
宏昕液压机电研究所,http:////www.11467.com/tangshan/co/57509.htm
唐山市亚星机械制造有限公司,http:////www.11467.com/tangshan/co/50990.htm
唐山凯地勘探设备制造有限公司,http:////www.11467.com/tangshan/co/75613.htm
甘肃省核工业机电研究所（核工业207）,http:////www.11467.com/tianshui/co/15828.htm
铜川矿务局地质勘测公司,http:////www.11467.com/tongchuan/co/5643.htm
潍坊百斯特经贸有限公司,http:////www.11467.com/weifang/co/70197.htm
潍坊宏达钻井机械厂,http:////www.11467.com/weifang/co/83215.htm
潍坊德盛经贸有限公司,http:////www.11467.com/weifang/co/69155.htm
薇薇嘟嘟贸易有限公司,http:////www.11467.com/wenzhou/co/140719.htm
浙江华坤地质发展有限公司,http:////www.11467.com/wenzhou/co/140942.htm
胡文学《个体经营》,http:////www.11467.com/wuhan/co/75262.htm
武汉集思导航科技有限公司,http:////www.11467.com/wuhan/co/75261.htm
靖江市庆功耐腐泵阀制造有限公司武汉分公司,http:////www.11467.com/wuhan/co/7787.htm
武汉启城生物技术有限公司,http:////www.11467.com/wuhan/co/77262.htm
武汉德天泰认证咨询有限公司,http:////www.11467.com/wuhan/co/107947.htm
武汉隆科兴非开挖工程有限公司,http:////www.11467.com/wuhan/co/56802.htm
武汉金鄂工具有限公司,http:////www.11467.com/wuhan/co/83292.htm
太平机械（武汉）有限公司,http:////www.11467.com/wuhan/co/53079.htm
武汉时尧科技有限公司,http:////www.11467.com/wuhan/co/52002.htm
武汉基深勘察仪器研究所,http:////www.11467.com/wuhan/co/75242.htm
武汉市超硬磨具磨料厂,http:////www.11467.com/wuhan/co/82202.htm
武汉中大新型超硬材料研制有限公司,http:////www.11467.com/wuhan/co/75241.htm
武汉凯普飞迅商贸有限公司,http:////www.11467.com/wuhan/co/81122.htm
武汉远大桩工机械有限公司,http:////www.11467.com/wuhan/co/40869.htm
武汉市太阁机电设备有限公司,http:////www.11467.com/wuhan/co/75447.htm
芜湖市建华工具有限公司,http:////www.11467.com/wuhu/co/22735.htm
上海开利泵业（集团）有限公司,http:////www.11467.com/wulumuqi/co/88367.htm
西珠铸件厂,http:////www.11467.com/wulumuqi/co/92665.htm
新疆兰泵泵业配套有限公司,http:////www.11467.com/wulumuqi/co/46282.htm
新疆合洋矿业技术开发有限公司,http:////www.11467.com/wulumuqi/co/92224.htm
朱军,http:////www.11467.com/wulumuqi/co/86171.htm
中国鸿图特种钢材股份有限公司,http:////www.11467.com/wulumuqi/co/92664.htm
江苏省无锡市恒源达机械有限公司,http:////www.11467.com/wuxi/co/173537.htm
常州仙龙水泵厂,http:////www.11467.com/wuxi/co/174584.htm
捷成输送机械（无锡）有限公司,http:////www.11467.com/wuxi/co/196150.htm
三林机械法兰有限公司,http:////www.11467.com/wuxi/co/244170.htm
无锡华芝钻探工具有限公司,http:////www.11467.com/wuxi/co/215148.htm
上海利富电机有限公司(无锡办事处),http:////www.11467.com/wuxi/co/175063.htm
无锡金帆钻凿设备有限公司（营业部）,http:////www.11467.com/wuxi/co/190000.htm
无锡环保设备中心,http:////www.11467.com/wuxi/co/195631.htm
无锡海锐特工程机械有限公司营销部,http:////www.11467.com/wuxi/co/190001.htm
无锡金鹰金刚石工具厂,http:////www.11467.com/wuxi/co/40817.htm
无锡宏达起重配件厂,http:////www.11467.com/wuxi/co/177864.htm
宁波德亚塑机无锡分公司,http:////www.11467.com/wuxi/co/174306.htm
江苏六通集团公司,http:////www.11467.com/wuxi/co/195977.htm
江苏昌盛钻井工程服务公司,http:////www.11467.com/wuxi/co/244171.htm
无锡科磊阀业有限公司销售部,http:////www.11467.com/wuxi/co/173245.htm
无锡市钻神工程机械厂,http:////www.11467.com/wuxi/co/23993.htm
无锡市泰克液压气缸厂,http:////www.11467.com/wuxi/co/144245.htm
无锡威马贸易有限公司,http:////www.11467.com/wuxi/co/176414.htm
无锡市锡探实业有限公司,http:////www.11467.com/wuxi/co/125070.htm
无锡市伟悦机械有限公司,http:////www.11467.com/wuxi/co/157078.htm
无锡市新区硕放传波泵业经营部,http:////www.11467.com/wuxi/co/174543.htm
无锡裕源特种门窗有限公司,http:////www.11467.com/wuxi/co/151952.htm
无锡世峰地质矿产钻探工具有限公司,http:////www.11467.com/wuxi/co/188318.htm
无锡通用探矿工具有限公司,http:////www.11467.com/wuxi/co/188643.htm
无锡市玉力液压气动有限公司,http:////www.11467.com/wuxi/co/196862.htm
无锡星海王生化设备有限公司,http:////www.11467.com/wuxi/co/195956.htm
无锡市通达地质探矿机械厂,http:////www.11467.com/wuxi/co/18359.htm
亚龙钻石粉梧州销售部,http:////www.11467.com/wuzhou/co/16432.htm
厦门华天达商贸发展有限公司,http:////www.11467.com/xiamen/co/48361.htm
厦门神话安检仪器有限公司,http:////www.11467.com/xiamen/co/84857.htm
森奈特科技有限责任公司,http:////www.11467.com/xian/co/63826.htm
西安方元能源工程有限责任公司,http:////www.11467.com/xian/co/68548.htm
陕西钻龙钻探机即有限公司,http:////www.11467.com/xian/co/63833.htm
陕西天力钻具制造有限公司,http:////www.11467.com/xian/co/63831.htm
陕西振兴钻探机械制造有限公司,http:////www.11467.com/xian/co/63830.htm
陕西钻龙钻探机具有限公司,http:////www.11467.com/xian/co/123469.htm
沈宏电线电缆有限公司,http:////www.11467.com/xian/co/63841.htm
西安汇兴钻探科技发展有限公司,http:////www.11467.com/xian/co/63806.htm
西安华傲通讯技术有限公司,http:////www.11467.com/xian/co/63804.htm
西安瑞泰电气有限公司,http:////www.11467.com/xian/co/62812.htm
陕西明特网络信息有限公司,http:////www.11467.com/xian/co/46802.htm
陕西圣英科技有限责任公司,http:////www.11467.com/xian/co/49436.htm
陕西华通机械设备有限责任公司,http:////www.11467.com/xian/co/65228.htm
西安博锐钻采机具有限公司,http:////www.11467.com/xian/co/50619.htm
西安凌云钻机具有限公司,http:////www.11467.com/xian/co/63843.htm
西安长庆石油天然气设备制造有限责任公司,http:////www.11467.com/xian/co/64271.htm
西安澳立华勘探技术开发有限公司市场部,http:////www.11467.com/xian/co/63827.htm
陕西科泰应用技术有限公司销售部,http:////www.11467.com/xian/co/49567.htm
河北省深州市强力摩擦材料厂,http:////www.11467.com/xian/co/65416.htm
西安黑马工程机械有限公司,http:////www.11467.com/xian/co/65231.htm
西安特奇特仪器有限公司,http:////www.11467.com/xian/co/63828.htm
西安锐邦钻探机具制造有限公司,http:////www.11467.com/xian/co/47602.htm
西安澳邦钻探设备有限公司市场部,http:////www.11467.com/xian/co/46779.htm
西安特奇特电子有限公司,http:////www.11467.com/xian/co/63829.htm
湖北襄樊岩土工程公司,http:////www.11467.com/xiangfan/co/37428.htm
襄樊市玛欣机电技术有限公司,http:////www.11467.com/xiangfan/co/31196.htm
鄂西北工程勘察总公司,http:////www.11467.com/xiangfan/co/8916.htm
湖南南方电工有限公司,http:////www.11467.com/xiangtan/co/13789.htm
咸宁学院电信学院,http:////www.11467.com/xianning/co/12900.htm
星云建机公司,http:////www.11467.com/xiantao/co/12931.htm
核工业工程机械研究所,http:////www.11467.com/xianyang/co/21580.htm
咸阳市西北地勘物资中心,http:////www.11467.com/xianyang/co/21596.htm
信翊达工程机械有限公司,http:////www.11467.com/xining/co/25622.htm
邢台宝诚橡塑制品有限公司,http:////www.11467.com/xintai/co/39187.htm
邢台雷萨宏业经贸有限公司,http:////www.11467.com/xintai/co/35476.htm
河北山河煤矿密封机械厂,http:////www.11467.com/xintai/co/50493.htm
邢台天之河特种材料制品厂,http:////www.11467.com/xintai/co/32664.htm
河北亚峰橡胶密封件厂,http:////www.11467.com/xintai/co/50492.htm
河北石油机械厂,http:////www.11467.com/xintai/co/34371.htm
河北金钻地质工程有限公司,http:////www.11467.com/xintai/co/34350.htm
新乡市勘察公司,http:////www.11467.com/xinxiang/co/21653.htm
新乡三田电机有限公司销售供应部,http:////www.11467.com/xinxiang/co/22799.htm
巴山机械厂（新乡）540厂,http:////www.11467.com/xinxiang/co/19184.htm
河南师范大学振动机械厂,http:////www.11467.com/xinxiang/co/19871.htm
河南海利华重工科技有限公司,http:////www.11467.com/xinxiang/co/25775.htm
山西冶金岩土工程总公司第二分公司,http:////www.11467.com/xinzhou/co/16629.htm
禹州市巨龙塑料制品有限公司,http:////www.11467.com/xuchang/co/19750.htm
徐州市科信自动化设备厂,http:////www.11467.com/xuzhou/co/38529.htm
徐州金字塔岩土钻掘机械制造有限公司,http:////www.11467.com/xuzhou/co/55486.htm
徐州安德机械设备有限公司,http:////www.11467.com/xuzhou/co/32443.htm
徐州市虹桥光电仪器研究所,http:////www.11467.com/xuzhou/co/4890.htm
江苏省赛摩拉姆齐技术公司,http:////www.11467.com/xuzhou/co/51056.htm
徐州煤矿机电有限公司,http:////www.11467.com/xuzhou/co/55222.htm
徐州惠工机电设备有限公司,http:////www.11467.com/xuzhou/co/55147.htm
江苏赛摩拉姆齐技术公司营销部,http:////www.11467.com/xuzhou/co/51057.htm
徐州承达机械设备有限公司,http:////www.11467.com/xuzhou/co/55593.htm
盐城市给水设备有限公司,http:////www.11467.com/yancheng/co/52224.htm
建湖县汇通再生资源回收有限公司,http:////www.11467.com/yancheng/co/71566.htm
盐城市鹤鹏皮革机械厂,http:////www.11467.com/yancheng/co/46541.htm
江苏纺织机械集团有限公司,http:////www.11467.com/yancheng/co/52323.htm
赛福探伤设备制造有限公司,http:////www.11467.com/yancheng/co/79568.htm
江苏龙达传动有限公司（网络市场开发部）,http:////www.11467.com/yancheng/co/52355.htm
盐都县大冈鸿达机械厂,http:////www.11467.com/yancheng/co/48833.htm
盐城市欧亚机械有限公司,http:////www.11467.com/yancheng/co/47544.htm
盐城市给水设备有限公司(私营),http:////www.11467.com/yancheng/co/52222.htm
盐城闳业机械有限公司销售中心,http:////www.11467.com/yancheng/co/52235.htm
兴化市三邦石油机械厂,http:////www.11467.com/yancheng/co/55231.htm
阳泉南煤集团南庄矿,http:////www.11467.com/yangquan/co/11204.htm
益强组合机床有限公司,http:////www.11467.com/yangzhou/co/82141.htm
扬州市振大机械制造厂,http:////www.11467.com/yangzhou/co/64752.htm
山东烟台稳腾科技有限公司,http:////www.11467.com/yantai/co/119745.htm
烟台市海霸建设机械有限公司,http:////www.11467.com/yantai/co/125405.htm
葛洲坝集团基础公司,http:////www.11467.com/yichang/co/44736.htm
黑旋风工程机械开发有限公司,http:////www.11467.com/yichang/co/49968.htm
宜昌天通泵业有限公司,http:////www.11467.com/yichang/co/312.htm
宁夏煤田地质局机械厂,http:////www.11467.com/yinchuan/co/11643.htm
宁夏和丰汽车贸易有限公司,http:////www.11467.com/yinchuan/co/314.htm
营口天元电器有限公司,http:////www.11467.com/yingkou/co/6873.htm
营口高科密封材料有限公司,http:////www.11467.com/yingkou/co/36952.htm
南京六维物流设备制造厂,http:////www.11467.com/yingtan/co/6993.htm
永州市冷水滩永佳金钢石制品厂,http:////www.11467.com/yongzhou/co/15923.htm
湖南状元集团公司金刚石制品研究所,http:////www.11467.com/yongzhou/co/15926.htm
岳阳中科电气有限公司,http:////www.11467.com/yueyang/co/28030.htm
广西玉林市物资地质供应部,http:////www.11467.com/yulin/co/18199.htm
广州翔华信息技术有限公司（广州）,http:////www.11467.com/yunfu/co/21845.htm
诚信仪器仪表公司,http:////www.11467.com/zaozhuang/co/27035.htm
山东枣庄厚德钻探有限公司,http:////www.11467.com/zaozhuang/co/27219.htm
山东省枣庄巿佳力泵业有限公司,http:////www.11467.com/zaozhuang/co/25656.htm
张家口华菱晟钢商贸有限公司,http:////www.11467.com/zhangjiakou/co/36083.htm
张家口宣化力王潜孔机械有限公司,http:////www.11467.com/zhangjiakou/co/36450.htm
宣化现代采掘机械有限公司,http:////www.11467.com/zhangjiakou/co/23063.htm
友联商业设备公司,http:////www.11467.com/zhangjiakou/co/28338.htm
宣化苏普曼钻潜机械有限公司,http:////www.11467.com/zhangjiakou/co/23527.htm
宣化双盈钻孔机械设备销售处,http:////www.11467.com/zhangjiakou/co/28458.htm
张家口市铭志钻机配件经销部,http:////www.11467.com/zhangjiakou/co/28420.htm
张家口市博宇机械设备制造有限公司业务部,http:////www.11467.com/zhangjiakou/co/28624.htm
天慎机诫修配厂,http:////www.11467.com/zhaoqing/co/31572.htm
肇庆市博大机电设备商行,http:////www.11467.com/zhaoqing/co/29910.htm
世高机械设备有限公司,http:////www.11467.com/zhaoqing/co/31571.htm
广东肇庆市端州区创达机械制造厂,http:////www.11467.com/zhaoqing/co/29916.htm
河南神探电子科技有限公司,http:////www.11467.com/zhengzhou/co/94533.htm
河南黄淮重工机械发展有限公司,http:////www.11467.com/zhengzhou/co/113685.htm
河南诚友煤探钻具公司,http:////www.11467.com/zhengzhou/co/96689.htm
温州博克电子公司河南郑州办事处,http:////www.11467.com/zhengzhou/co/92721.htm
郑州市金水区中远地质机械配件销售部,http:////www.11467.com/zhengzhou/co/148418.htm
郑州建材商品大世界志祥五金商行,http:////www.11467.com/zhengzhou/co/112211.htm
河南省黄淮重工机械有限公司,http:////www.11467.com/zhengzhou/co/114738.htm
郑州裕达重工机械有限公司,http:////www.11467.com/zhengzhou/co/54764.htm
郑州市宇立机械有限公司销售部,http:////www.11467.com/zhengzhou/co/114853.htm
郑州三维仪器有限公司测绘仪器部,http:////www.11467.com/zhengzhou/co/116997.htm
郑州勘察机械厂,http:////www.11467.com/zhengzhou/co/76625.htm
郑州宇锦冶金材料有限公司,http:////www.11467.com/zhengzhou/co/166854.htm
郑州奕隆超硬材料有限公司业务部门,http:////www.11467.com/zhengzhou/co/112213.htm
郑州涵发贸易有限公司,http:////www.11467.com/zhengzhou/co/117649.htm
郑州市凯森矿山机械有限公司,http:////www.11467.com/zhengzhou/co/170999.htm
河南兄弟商贸有限公司,http:////www.11467.com/zhengzhou/co/84860.htm
郑州瑞增超硬材料有限公司,http:////www.11467.com/zhengzhou/co/118148.htm
郑州金泰矿山设备有限公司,http:////www.11467.com/zhengzhou/co/63402.htm
镇江安达机械有限公司,http:////www.11467.com/zhenjiang/co/49771.htm
镇江润泽机电有限公司,http:////www.11467.com/zhenjiang/co/46016.htm
镇江市润州新科林业机械配件厂,http:////www.11467.com/zhenjiang/co/48578.htm
中山融邦科技有限公司,http:////www.11467.com/zhongshan/co/44297.htm
中山市全顺叉车公司,http:////www.11467.com/zhongshan/co/43940.htm
中山市震兴机械有限公司,http:////www.11467.com/zhongshan/co/82428.htm
河南嘉硕矿山配件有限公司,http:////www.11467.com/zhoukou/co/21086.htm
珠海聚晶金刚石企业有限公司,http:////www.11467.com/zhuhai/co/75338.htm
翠利水处理有限公司,http:////www.11467.com/zhuhai/co/65392.htm
珠海京昌宁机电设备有限公司,http:////www.11467.com/zhuhai/co/61941.htm
株洲开拓工具有限公司营销部,http:////www.11467.com/zhuzhou/co/34648.htm
株洲市银光合金材料有限公司,http:////www.11467.com/zhuzhou/co/23207.htm
淄博干事真空泵有限公司,http:////www.11467.com/zibo/co/76679.htm
博山泰丰实业有限公司,http:////www.11467.com/zibo/co/44738.htm
淄博翔宇勘探工程有限责任公司,http:////www.11467.com/zibo/co/64667.htm
淄博恒诚不锈钢铸造有限公司,http:////www.11467.com/zibo/co/74201.htm
山东博山立式泵制造厂,http:////www.11467.com/zibo/co/65560.htm
淄博华新复合材料有限公司,http:////www.11467.com/zibo/co/60874.htm
淄博市博山华基恒业机械有限公司,http:////www.11467.com/zibo/co/62342.htm
淄博卓信真空泵公司,http:////www.11467.com/zibo/co/66811.htm
山东微探机械有限公司,http:////www.11467.com/zibo/co/65442.htm
博山万兴机械设备厂,http:////www.11467.com/zibo/co/77246.htm
金烨机械厂,http:////www.11467.com/zibo/co/78050.htm
自贡雍华金属制造有限公司,http:////www.11467.com/zigong/co/20459.htm
遵义拓特铸锻有限公司,http:////www.11467.com/zunyi/co/4597.htm
北京地信杰科技有限责任公司,http:////www.11467.com/beijing/co/694877.htm
北京地森海科技发展有限责任公司销售部门,http:////www.11467.com/beijing/co/404871.htm
北京第二汽车齿轮厂钻井分厂,http:////www.11467.com/beijing/co/312301.htm
北京大地华龙科技有限责任公司 销售部,http:////www.11467.com/beijing/co/404741.htm
北京地森海科技有限责任公司市场部,http:////www.11467.com/beijing/co/404878.htm
北京吉祥科技有限责任公司,http:////www.11467.com/beijing/co/697400.htm
北京吉祥天地科技有限公司 地质部,http:////www.11467.com/beijing/co/404723.htm
北京地森海有限责任公司,http:////www.11467.com/beijing/co/404724.htm
北京吉祥天地科技有限公司(物探部）,http:////www.11467.com/beijing/co/404738.htm
北京地森海科技发展有限责任公司市场部,http:////www.11467.com/beijing/co/404884.htm
北京地森海科技发展有限公司,http:////www.11467.com/beijing/co/404726.htm
北京吉祥天地物探仪器有限公司,http:////www.11467.com/beijing/co/404730.htm
北京地森海科技发展有限公司（市场部）,http:////www.11467.com/beijing/co/404877.htm
北京吉祥天地科技有限公司总公司,http:////www.11467.com/beijing/co/404718.htm
北京汉德乐贸易有限公司销售部,http:////www.11467.com/beijing/co/102964.htm
北京京泰亨安科技发展有限公司销售部,http:////www.11467.com/beijing/co/103093.htm
北京大地华龙地质仪器厂,http:////www.11467.com/beijing/co/404729.htm
北京吉祥天地科技有限公司物探事业部,http:////www.11467.com/beijing/co/404880.htm
北京欧华联科技有限责任公司销售部,http:////www.11467.com/beijing/co/404721.htm
北京恒智信达商贸有限公司业务部,http:////www.11467.com/beijing/co/102981.htm
-北京华测伟业科技有限公司,http:////www.11467.com/beijing/co/404873.htm
北京神州方圆油气技术有限公司,http:////www.11467.com/beijing/co/404742.htm
北京吉奥工程咨询有限公司,http:////www.11467.com/beijing/co/384073.htm
北京航勘仪器厂,http:////www.11467.com/beijing/co/404870.htm
北京吉祥天地物探有限公司,http:////www.11467.com/beijing/co/697401.htm
北京圣烁科技发展有限公司,http:////www.11467.com/beijing/co/671899.htm
北京天顿工程设备有限公司,http:////www.11467.com/beijing/co/404719.htm
北京天顿物探设备有限公司,http:////www.11467.com/beijing/co/404876.htm
北京天顿工程设备公司,http:////www.11467.com/beijing/co/651284.htm
北京天顿工程设备有限公司物探部,http:////www.11467.com/beijing/co/404879.htm
北京斯通威尔钻探机械有限公司,http:////www.11467.com/beijing/co/609802.htm
北京裕德成科贸有限公司矿业部,http:////www.11467.com/beijing/co/404714.htm
北京裕德成科贸有限公司销售部,http:////www.11467.com/beijing/co/404716.htm
北京中星巨龙贸易有限公司,http:////www.11467.com/beijing/co/103092.htm
北京中原昆仑国际贸易有限公司市场部,http:////www.11467.com/beijing/co/102947.htm
北京中瑞陆海科技有限公司,http:////www.11467.com/beijing/co/697398.htm
北京咏归科技有限公司市场部,http:////www.11467.com/beijing/co/178611.htm
北京天顿工程设备有限责任公司,http:////www.11467.com/beijing/co/404715.htm
美国爱克森国际投资公司,http:////www.11467.com/beijing/co/102967.htm
上海管易机械有限公司,http:////www.11467.com/beijing/co/102979.htm
香港亿诚亚太有限公司北京办事处,http:////www.11467.com/beijing/co/102980.htm
中国地质装备总公司,http:////www.11467.com/beijing/co/81472.htm
圣火电子科技有限公司,http:////www.11467.com/beijing/co/404731.htm
泰盛达钻机配件经销部,http:////www.11467.com/beijing/co/620938.htm
天一指航通讯技术有限公司,http:////www.11467.com/beijing/co/404705.htm
新源志勤科技开发责任有限公司,http:////www.11467.com/beijing/co/694878.htm
北京天一指航通信有限公司,http:////www.11467.com/beijing/co/404713.htm
中科博研新技术研究中心,http:////www.11467.com/beijing/co/404881.htm
中地钻业科技发展(北京)有限公司,http:////www.11467.com/beijing/co/404746.htm
北京市地森海科技发展有限公司,http:////www.11467.com/beijing/co/404725.htm
上海畅潇实业有限公司事业部,http:////www.11467.com/shanghai/co/884492.htm
上海艾都实业有限公司-销售部,http:////www.11467.com/shanghai/co/938464.htm
上海艾都实业有限责任公司,http:////www.11467.com/shanghai/co/938465.htm
巴测(上海)商贸有限公司,http:////www.11467.com/shanghai/co/85036.htm
上海艾成实业有限公司,http:////www.11467.com/shanghai/co/938416.htm
上海艾都实业有限公司销售部,http:////www.11467.com/shanghai/co/938463.htm
上海国金金属材料股份有限公司,http:////www.11467.com/shanghai/co/40476.htm
上海皆战达贸易有限公司销售部,http:////www.11467.com/shanghai/co/40475.htm
上海滩图测绘科技有限公司,http:////www.11467.com/shanghai/co/668379.htm
上海顺吉专业钻井有限公司,http:////www.11467.com/shanghai/co/884494.htm
上海普会信息科技有限公司,http:////www.11467.com/shanghai/co/1039683.htm
上海鹏德商务咨询有限公司,http:////www.11467.com/shanghai/co/668393.htm
上海旭洋软门有限公司市场部,http:////www.11467.com/shanghai/co/518126.htm
上海新世纪园林机械有限公司,http:////www.11467.com/shanghai/co/804602.htm
上海君汉工贸有限公司,http:////www.11467.com/shanghai/co/1010026.htm
石家庄市中地泵业有限公司,http:////www.11467.com/tianjin/co/51024.htm
天津丰达机电产品经营部,http:////www.11467.com/tianjin/co/98996.htm
天津嘉骐金刚石工具厂,http:////www.11467.com/tianjin/co/6956.htm
山东贝莱特空调有限公司天津办事处,http:////www.11467.com/tianjin/co/75251.htm
天津开发区复兴工贸有限公司,http:////www.11467.com/tianjin/co/15645.htm
上海旭洋/君朗曼门业(天津分公司),http:////www.11467.com/tianjin/co/61891.htm
天津汉城夏普环保设备有限公司,http:////www.11467.com/tianjin/co/184120.htm
东方地球物理勘探公司,http:////www.11467.com/tianjin/co/26054.htm
天津市津南区通宁汽车制动泵厂,http:////www.11467.com/tianjin/co/115111.htm
天津市华铎模具厂,http:////www.11467.com/tianjin/co/142292.htm
天津亚盛工贸有限公司,http:////www.11467.com/tianjin/co/86711.htm
造船机电有限公司,http:////www.11467.com/tianjin/co/16510.htm
天津威力千斤顶有限公司,http:////www.11467.com/tianjin/co/117634.htm
天津市盛意兴钢铁贸易有限公司,http:////www.11467.com/tianjin/co/196359.htm
煤炭科学研究总院重庆研究院,http:////www.11467.com/chongqing/co/125206.htm
重庆虎啸机械制造有限公司,http:////www.11467.com/chongqing/co/5713.htm
