佳木斯电机股份有限公司（宁夏分公司）,http:////www.11467.com/yinchuan/co/38269.htm
营口市永邦机械有限公司,http:////www.11467.com/yingkou/co/39394.htm
东泽实业有限公司,http:////www.11467.com/yingkou/co/42488.htm
营口黎明特种泵厂,http:////www.11467.com/yingkou/co/8777.htm
益阳市源泉钻探有限公司,http:////www.11467.com/yiyang/co/22503.htm
益阳市深探电镀金刚石钻头厂,http:////www.11467.com/yiyang/co/18248.htm
永州市冷水滩区非凡金刚石钻头厂,http:////www.11467.com/yongzhou/co/19048.htm
创新金刚石复合片厂,http:////www.11467.com/yongzhou/co/19049.htm
永州市双龙钻头有限公司,http:////www.11467.com/yongzhou/co/19033.htm
湖南省地质矿产勘查开发局四O九队,http:////www.11467.com/yongzhou/co/15925.htm
永州勘力金刚石钻头厂,http:////www.11467.com/yongzhou/co/15921.htm
榆林市东亚商贸有限责任公司,http:////www.11467.com/yulinshi/co/19520.htm
山西华宝金刚石有限公司,http:////www.11467.com/yuncheng/co/8652.htm
关公商务公司,http:////www.11467.com/yuncheng/co/24564.htm
山西龙源矿山泵业有限公司,http:////www.11467.com/yuncheng/co/780.htm
山西省芮城县试压泵厂,http:////www.11467.com/yuncheng/co/13023.htm
宣化旭宏钻采机械有限公司(销售部）,http:////www.11467.com/zhangjiakou/co/28423.htm
河北省蔚县泵业（集团）总公司,http:////www.11467.com/zhangjiakou/co/14359.htm
宣化德力采掘机械有限责任公司,http:////www.11467.com/zhangjiakou/co/23002.htm
张家口市金惠机械有限公司,http:////www.11467.com/zhangjiakou/co/40922.htm
漳州市东方电子有限公司,http:////www.11467.com/zhangzhou/co/2482.htm
喜利得(中国)公司,http:////www.11467.com/zhanjiang/co/41872.htm
先锋钻探公司,http:////www.11467.com/zhanjiang/co/47227.htm
中海石油服务股份有限公司湛江油技测井,http:////www.11467.com/zhanjiang/co/41785.htm
宏基液压气动厂,http:////www.11467.com/zhaoqing/co/30213.htm
河南省贵钢矿山配件厂家,http:////www.11467.com/zhengzhou/co/174794.htm
郑州市中原嵩山机械制造有限公司,http:////www.11467.com/zhengzhou/co/59005.htm
郑州科兴液压配件有限公司,http:////www.11467.com/zhengzhou/co/112859.htm
河南黎明电器厂,http:////www.11467.com/zhengzhou/co/96207.htm
河南省荥阳市马沟机械厂,http:////www.11467.com/zhengzhou/co/86141.htm
广州市金昌金刚石工具公司,http:////www.11467.com/zhengzhou/co/177615.htm
河南宏大地矿公司,http:////www.11467.com/zhengzhou/co/114468.htm
郑州市飓风工贸有限公司,http:////www.11467.com/zhengzhou/co/71436.htm
郑州创新矿山信息技术有限公司,http:////www.11467.com/zhengzhou/co/112494.htm
郑州贝尔电气有限责任公司市场部,http:////www.11467.com/zhengzhou/co/118000.htm
郑州市宏嘉函贸易有限公司,http:////www.11467.com/zhengzhou/co/112212.htm
郑州致元重工有限公司,http:////www.11467.com/zhengzhou/co/114739.htm
炜誉机电设备公司,http:////www.11467.com/zhengzhou/co/119120.htm
智邦电子科技（香港）有限公司华中分公司,http:////www.11467.com/zhengzhou/co/112210.htm
郑州市（东）建材大世界华乐五金商行,http:////www.11467.com/zhengzhou/co/112208.htm
镇江天力工具销售有限公司,http:////www.11467.com/zhenjiang/co/49840.htm
镇江润丰实业有限公司,http:////www.11467.com/zhenjiang/co/49002.htm
镇江永安煤矿机械制造有限公司,http:////www.11467.com/zhenjiang/co/8597.htm
江苏镇江市环宇工具有限公司,http:////www.11467.com/zhenjiang/co/46020.htm
镇江中建轴承有限公司,http:////www.11467.com/zhenjiang/co/12280.htm
捷宝电器有限公司,http:////www.11467.com/zhongshan/co/81894.htm
广东省工程勘察院珠海分院,http:////www.11467.com/zhuhai/co/74646.htm
珠海艾能电气科技有限公司,http:////www.11467.com/zhuhai/co/63922.htm
株洲东方工具有限公司销售部,http:////www.11467.com/zhuzhou/co/33724.htm
株洲市中兴钻探装备科技有限责任公司,http:////www.11467.com/zhuzhou/co/33729.htm
株洲金鼎营质合金有限公司,http:////www.11467.com/zhuzhou/co/33728.htm
双林地质钻探工具店,http:////www.11467.com/zhuzhou/co/33727.htm
淄博圣云硕工贸公司,http:////www.11467.com/zibo/co/66004.htm
周村光大模具加工服务部,http:////www.11467.com/zibo/co/65569.htm
淄川区永祥铸造机械厂,http:////www.11467.com/zibo/co/4696.htm
淄博新理想经贸有限公司,http:////www.11467.com/zibo/co/64788.htm
胜利有限责任公司,http:////www.11467.com/zibo/co/75010.htm
万杰辐射有限公司,http:////www.11467.com/zibo/co/73903.htm
山东电泵股份有限公司淄博潜水电泵厂,http:////www.11467.com/zibo/co/65761.htm
淄博美格新型工具制造厂,http:////www.11467.com/zibo/co/74200.htm
山东东营石油装备有限公司,http:////www.11467.com/zibo/co/73930.htm
金牌泵业公司,http:////www.11467.com/zibo/co/77840.htm
淄博精钲煤矿装备有限公司,http:////www.11467.com/zibo/co/95194.htm
四川省自贡市科信硬质材料有限工司,http:////www.11467.com/zigong/co/21570.htm
自贡市张虔物资商贸有限公司,http:////www.11467.com/zigong/co/17544.htm
四川资阳开源塑料机械有限公司,http:////www.11467.com/ziyang/co/14192.htm
北京必可测公司,http:////www.11467.com/beijing/co/404882.htm
北京彬恒自动化设备有限公司,http:////www.11467.com/beijing/co/103095.htm
北京保青伟业科技公司,http:////www.11467.com/beijing/co/563034.htm
北京大地华龙科技有限责任龙公司,http:////www.11467.com/beijing/co/404888.htm
北京德之高实验室设备有限公司销售部,http:////www.11467.com/beijing/co/217277.htm
北京德天力拓科技有限公司,http:////www.11467.com/beijing/co/694880.htm
北京地森海科技技术发展有限公司,http:////www.11467.com/beijing/co/694879.htm
北京大地华龙科技有限责任公司物探部,http:////www.11467.com/beijing/co/404875.htm
北京吉祥天地科技有限公司物探部,http:////www.11467.com/beijing/co/404739.htm
北京桔灯导航科技发展公司,http:////www.11467.com/beijing/co/404735.htm
北京京通探钻探机械有限公司,http:////www.11467.com/beijing/co/604011.htm
北京吉祥科技有限公司物探部,http:////www.11467.com/beijing/co/404885.htm
北京吉祥天地科技物探仪器有限公司,http:////www.11467.com/beijing/co/404737.htm
北京欧华联科技有限责任公司北京总公司,http:////www.11467.com/beijing/co/102962.htm
北京欧华联科技发展有限公司,http:////www.11467.com/beijing/co/697399.htm
北京欧华联科技有限责任公司,http:////www.11467.com/beijing/co/379611.htm
北京桔灯技术有限公司,http:////www.11467.com/beijing/co/384074.htm
北京桔灯导航科技发展有限公司（市场部）,http:////www.11467.com/beijing/co/404872.htm
北京南方新科技有限公司,http:////www.11467.com/beijing/co/404727.htm
北京睿智石油设备有限公司,http:////www.11467.com/beijing/co/404745.htm
北京盛锋伟业数码科技发展有限公司,http:////www.11467.com/beijing/co/404717.htm
北京圣火科技有限公司,http:////www.11467.com/beijing/co/404736.htm
北京市京核鑫隆科技中心销售部,http:////www.11467.com/beijing/co/404740.htm
北京市南迪瑞科贸公司,http:////www.11467.com/beijing/co/102963.htm
北京鑫磊时代石油技术发展有限公司,http:////www.11467.com/beijing/co/27011.htm
北京远亚公司,http:////www.11467.com/beijing/co/102961.htm
北京天一指航通讯技术公司通讯部,http:////www.11467.com/beijing/co/404733.htm
北京天一指航通讯技术有限公司物探设备销售部,http:////www.11467.com/beijing/co/404734.htm
北京星辉基业电子科技有限公司,http:////www.11467.com/beijing/co/376251.htm
北京中源硅谷科技发展有限公司　客服部,http:////www.11467.com/beijing/co/102965.htm
北京星港卫讯科技发展有限公司销售部,http:////www.11467.com/beijing/co/651261.htm
北京智博联科技有限公司 研发部,http:////www.11467.com/beijing/co/651263.htm
德国PC有限责任公司,http:////www.11467.com/beijing/co/671900.htm
华北油田新技术有限公司,http:////www.11467.com/beijing/co/694881.htm
美国SI仪器公司(中国)技术服务中心,http:////www.11467.com/beijing/co/694882.htm
西班牙EXPALUM公司,http:////www.11467.com/beijing/co/103096.htm
北京中招采信息咨询有限公司,http:////www.11467.com/beijing/co/404747.htm
加拿大威达国际公司北京办事处,http:////www.11467.com/beijing/co/404744.htm
建研地基基础工程有限责任公司,http:////www.11467.com/beijing/co/103094.htm
"(上海,江苏,安徽,浙江)专业全机器打深井公司",http:////www.11467.com/shanghai/co/1048384.htm
感动上中点有限公司,http:////www.11467.com/shanghai/co/1042286.htm
上海荔枝红经贸有限公司,http:////www.11467.com/shanghai/co/1058426.htm
上海吉航实业有限公司/营销部,http:////www.11467.com/shanghai/co/518017.htm
上海恩洲仪器股份公司,http:////www.11467.com/shanghai/co/247569.htm
上海世控精密设备有限公司,http:////www.11467.com/shanghai/co/267553.htm
意大利康利钻杆上海办事处,http:////www.11467.com/shanghai/co/376803.htm
天津光华铸管销售有限公司,http:////www.11467.com/tianjin/co/196961.htm
天津汉城夏普环保设备有限公司设计部,http:////www.11467.com/tianjin/co/186930.htm
天津鼎成高新技术公司,http:////www.11467.com/tianjin/co/99128.htm
天津市格林泵业有限公司销售部,http:////www.11467.com/tianjin/co/99122.htm
天津市春达顺五金交电经销处,http:////www.11467.com/tianjin/co/142226.htm
天津京津塘地热科技开发有限公司,http:////www.11467.com/tianjin/co/159409.htm
欧曼液压装备有限公司,http:////www.11467.com/tianjin/co/75343.htm
天津聚能高压泵有限公司,http:////www.11467.com/tianjin/co/16474.htm
天津市艾都商贸有限公司,http:////www.11467.com/tianjin/co/198347.htm
天津市汉诺精工科技有限公司,http:////www.11467.com/tianjin/co/140901.htm
天津北辰区命运高新技术产品研究所,http:////www.11467.com/tianjin/co/14112.htm
天津渤海装备中成机械制造有限公司,http:////www.11467.com/tianjin/co/26053.htm
捷登亚电缆系统（天津）有限公司,http:////www.11467.com/tianjin/co/34514.htm
香港嘉宏机械有限公司天津公司,http:////www.11467.com/tianjin/co/161346.htm
天津市昊鼎精密机械技术有限公司,http:////www.11467.com/tianjin/co/137814.htm
天津市气动液压设备有限公司,http:////www.11467.com/tianjin/co/98894.htm
伊萨林（天津）国际工贸有限公司,http:////www.11467.com/tianjin/co/75254.htm
天津苏港石油设备有限公司,http:////www.11467.com/tianjin/co/27269.htm
天津市八方伟业科技有限公司,http:////www.11467.com/tianjin/co/6763.htm
天津市水泵厂,http:////www.11467.com/tianjin/co/49306.htm
重庆索普动力机械有限公司,http:////www.11467.com/chongqing/co/52502.htm
重庆新鼎岩土工程有限公司,http:////www.11467.com/chongqing/co/62211.htm
重庆市渝勘钻探有限公司,http:////www.11467.com/chongqing/co/14204.htm
重庆鑫焱机电有限公司,http:////www.11467.com/chongqing/co/125208.htm
福州新城乡勘测设计有限公司,http:////www.11467.com/fuzhou/co/197141.htm
平凉东方不动产勘测规划评估有限公司,http:////www.11467.com/pingliang/co/10360.htm
大安市添翼水利勘测设计有限公司,http:////www.11467.com/baicheng/co/21134.htm
山西浩宇天成电力工程勘测设计有限公司,http:////www.11467.com/taiyuan/co/126353.htm
大同县思源钻探有限公司,http:////www.11467.com/datong/co/20929.htm
彭泽县龙祥勘测服务咨询有限公司,http:////www.11467.com/jiujiang/co/28222.htm
当阳市辉煌电业有限责任公司勘测设计分公司,http:////www.11467.com/yichang/co/54653.htm
湖北弘仁勘测设计有限公司,http:////www.11467.com/huanggang/co/18565.htm
广西泽宇勘测设计有限公司,http:////www.11467.com/yulin/co/22043.htm
日照穿山甲钻探有限公司,http:////www.11467.com/rizhao/co/32237.htm
武汉东昌勘测评估咨询有限公司襄阳分公司,http:////www.11467.com/xiangfan/co/46836.htm
四川永成勘测规划设计有限公司,http:////www.11467.com/guangyuan/co/20060.htm
四川六新勘测规划设计有限公司,http:////www.11467.com/qiye/19161813.htm
山西天地源地质勘测有限公司,http:////www.11467.com/jinzhong/co/28109.htm
莒县锦顺钻探有限公司,http:////www.11467.com/rizhao/co/32367.htm
莒县浩瀚钻探有限公司,http:////www.11467.com/rizhao/co/32418.htm
莒县大山钻探有限公司,http:////www.11467.com/rizhao/co/32428.htm
中水北方勘测设计研究有限责任公司南江分公司,http:////www.11467.com/qiye/19180326.htm
洛阳恒懋钻探服务有限公司,http:////www.11467.com/luoyang/co/66238.htm
福州琦峰勘测规划有限公司,http:////www.11467.com/fuzhou/co/199219.htm
东平县华阳钻探有限公司,http:////www.11467.com/taian/co/60943.htm
海南君和勘测设计有限公司,http:////www.11467.com/haikou/co/5117.htm
承德鸿汇工程勘测设计有限公司,http:////www.11467.com/chengde/co/32805.htm
海南凯琦勘测设计咨询有限公司,http:////www.11467.com/haikou/co/5870.htm
九江新勤地质钻探有限公司,http:////www.11467.com/jiujiang/co/28512.htm
九江立新钻探有限公司,http:////www.11467.com/jiujiang/co/28588.htm
南宁大旋风工程勘测设计有限公司,http:////www.11467.com/nanning/co/92735.htm
莒县源泉钻探有限公司,http:////www.11467.com/rizhao/co/32953.htm
宜昌电力勘测设计院有限公司神农架分公司,http:////www.11467.com/shenlongjia/co/20.htm
湖北今朝勘测设计咨询有限公司,http:////www.11467.com/jingmen/co/17826.htm
石家庄长千勘测技术有限公司,http:////www.11467.com/shijiazhuang/co/168718.htm
天津日福输送设备有限公司,http:////www.11467.com/tianjin/co/300686.htm
天津市皓翔自动门有限公司,http:////www.11467.com/tianjin/co/305321.htm
天津甘泉奥星科地质设备有限公司,http:////www.11467.com/tianjin/co/305323.htm
河南精之图数字勘测有限公司,http:////www.11467.com/xinxiang/co/37775.htm
宿州市军强钻探测量有限公司,http:////www.11467.com/suzhoushi/co/27430.htm
黄石伟业钻探有限公司铜陵分公司,http:////www.11467.com/tongling/co/16779.htm
深圳市爱华勘测工程有限公司湖南分公司,http:////www.11467.com/yueyang/co/39589.htm
中山市水利水电勘测设计咨询有限公司长沙分公司,http:////www.11467.com/changsha/co/141090.htm
株洲城西城建工程勘测设计院有限公司,http:////www.11467.com/zhuzhou/co/42755.htm
四川华旺勘测有限公司金堂分公司,http:////www.11467.com/chengdu/co/256620.htm
四川道宏公路勘测设计有限公司,http:////www.11467.com/bazhong/co/8989.htm
四川新天地勘测设计有限公司,http:////www.11467.com/chengdu/co/257331.htm
莒县顺通钻探有限公司,http:////www.11467.com/rizhao/co/33311.htm
日照连晟钻探有限公司,http:////www.11467.com/rizhao/co/33313.htm
邢台市襄龙钻探有限公司,http:////www.11467.com/xintai/co/62349.htm
江西纬通勘测设计有限公司,http:////www.11467.com/yichun/co/28909.htm
辛集市善智规划勘测有限公司,http:////www.11467.com/shijiazhuang/co/173400.htm
广州晟源电力勘测设计咨询有限公司石家庄分公司,http:////www.11467.com/shijiazhuang/co/174713.htm
重庆山军勘测有限公司,http:////www.11467.com/chongqing/co/224403.htm
重庆中航勘测规划设计有限公司,http:////www.11467.com/chongqing/co/224747.htm
重庆市学秋钻探服务有限责任公司,http:////www.11467.com/chongqing/co/225486.htm
广州云胜工程勘测技术有限公司,http:////www.11467.com/guangzhou/co/525850.htm
珠海鑫安勘测工程有限公司,http:////www.11467.com/zhuhai/co/101576.htm
福建华榕勘测规划有限公司,http:////www.11467.com/fuzhou/co/202041.htm
上海城西城建工程勘测设计院有限公司福建分公司,http:////www.11467.com/fuzhou/co/202218.htm
中山市水利水电勘测设计咨询有限公司湖南分公司,http:////www.11467.com/changsha/co/142921.htm
西安江滨水利水电勘测设计有限公司,http:////www.11467.com/xian/co/132016.htm
长沙市水利水电勘测设计院有限公司,http:////www.11467.com/changsha/co/146104.htm
河南省城建规划勘测设计有限公司新蔡分公司,http:////www.11467.com/qiye/20829037.htm
高邑县同创兴业工程勘测设计有限公司,http:////www.11467.com/shijiazhuang/co/175482.htm
武汉久迈勘测设计有限公司,http:////www.11467.com/wuhan/co/151975.htm
江西省合众勘测规划有限公司进贤分公司,http:////www.11467.com/nanchang/co/119372.htm
邵阳宇盛钻探有限公司,http:////www.11467.com/shaoyang/co/30573.htm
广东中顺送变电勘测设计有限公司,http:////www.11467.com/yangjiang/co/26919.htm
峨眉山大地勘测有限责任公司,http:////www.11467.com/qiye/20992106.htm
深圳市兴才勘测工程有限公司,http:////www.11467.com/shenzhen/co/919309.htm
淮安市水利勘测设计研究院有限公司武汉分公司,http:////www.11467.com/wuhan/co/161408.htm
湖北司南寰宇工程勘测有限公司,http:////www.11467.com/wuhan/co/162427.htm
慈溪市水利建筑勘测设计院有限公司建德分公司,http:////www.11467.com/hangzhou/co/407645.htm
石家庄腾瑞工程勘测设计有限公司,http:////www.11467.com/shijiazhuang/co/187039.htm
新余荣之昇水利水电勘测设计有限责任公司,http:////www.11467.com/xinyu/co/11208.htm
广州市孛特勘测技术科技有限公司岳阳分公司,http:////www.11467.com/yueyang/co/44526.htm
河北资环勘测工程有限公司宽城分公司,http:////www.11467.com/chengde/co/35293.htm
乾县天晟钻探有限公司,http:////www.11467.com/xianyang/co/26057.htm
江西省子午勘测规划有限公司,http:////www.11467.com/nanchang/co/124557.htm
九江恒达勘测服务有限公司,http:////www.11467.com/jiujiang/co/33035.htm
广州市孛特勘测技术科技有限公司黎川分公司,http:////www.11467.com/fuzhoushi/co/23331.htm
陕西德远勘测规划工程有限公司榆林分公司,http:////www.11467.com/yulinshi/co/22732.htm
洛阳市恩熙钻探有限公司,http:////www.11467.com/luoyang/co/70860.htm
阿拉善左旗景珕勘测技术有限责任公司,http:////www.11467.com/alashan/co/2121.htm
四川金秋工程勘测设计有限公司重庆分公司,http:////www.11467.com/chongqing/co/247533.htm
陕西濬川水利勘测设计有限公司,http:////www.11467.com/yanan/co/14321.htm
广州五木勘测科技有限公司,http:////www.11467.com/guangzhou/co/625687.htm
广州市恒景工程勘测技术有限公司,http:////www.11467.com/guangzhou/co/627678.htm
河南省豫北水利勘测设计院杭州分院,http:////www.11467.com/hangzhou/co/417618.htm
洛阳银紫文物钻探服务有限公司,http:////www.11467.com/luoyang/co/71111.htm
庄河市水利建筑勘测设计院瓦房店设计部,http:////www.11467.com/dalian/co/80553.htm
抚顺中滢设计勘测咨询有限公司,http:////www.11467.com/fushun/co/30795.htm
咸阳文博钻探有限公司,http:////www.11467.com/xianyang/co/27104.htm
大连市林海岩土钻探有限公司,http:////www.11467.com/dalian/co/80963.htm
南京聚诚勘测规划设计中心,http:////www.11467.com/nanjing/co/170729.htm
朔州市天海水利钻探有限责任公司,http:////www.11467.com/shuozhou/co/12261.htm
江苏中泰工程勘测有限公司南通分公司,http:////www.11467.com/nantong/co/147085.htm
淮安润淮地质钻探有限公司,http:////www.11467.com/huaian/co/55627.htm
淮安市先科勘测设计有限公司涟水分公司,http:////www.11467.com/huaian/co/55649.htm
河南三农水利勘测设计有限公司,http:////www.11467.com/zhengzhou/co/215824.htm
河南中豫勘测规划技术有限公司,http:////www.11467.com/anyang/co/42485.htm
洛阳宝琛钻探技术服务有限公司,http:////www.11467.com/luoyang/co/71352.htm
河南省城建规划勘测设计有限公司南召分公司,http:////www.11467.com/nanyang/co/50634.htm
武汉和润行勘测设计工程有限责任公司,http:////www.11467.com/wuhan/co/168851.htm
东营市新源工程勘测有限公司,http:////www.11467.com/dongying/co/51790.htm
内江市鸿达交通勘测设计有限责任公司重庆分公司,http:////www.11467.com/chongqing/co/257218.htm
浙江省国土勘测规划有限公司杭州分公司,http:////www.11467.com/hangzhou/co/419030.htm
深圳市爱华勘测工程有限公司临沧分公司,http:////www.11467.com/lincang/co/7180.htm
武汉江朗勘测设计咨询有限公司,http:////www.11467.com/wuhan/co/170792.htm
四川金秋工程勘测设计有限公司凉山州分公司,http:////www.11467.com/liangshan/co/19808.htm
四川金秋工程勘测设计有限公司雅安分公司,http:////www.11467.com/yaan/co/11712.htm
四川洪创勘测有限公司,http:////www.11467.com/qiye/21786955.htm
渭南兴源钻探有限公司,http:////www.11467.com/weinan/co/27149.htm
山东省安顺钻探服务有限公司,http:////www.11467.com/linyi/co/121819.htm
新泰市泉沟镇张三帅钻井队,http:////www.11467.com/taian/co/66693.htm
巨野县恒智土地勘测服务有限公司,http:////www.11467.com/heze/co/53743.htm
扬州众图勘测规划设计有限公司,http:////www.11467.com/yangzhou/co/115671.htm
南京乾润勘测设计服务中心,http:////www.11467.com/nanjing/co/172497.htm
北京地森海科技有限公司成都办事处,http:////www.11467.com/chengdu/co/142246.htm
吉林集安东方机械有限公司,http:////www.11467.com/chifeng/co/22747.htm
晋州市信诚勘探机械厂,http:////www.11467.com/shijiazhuang/co/184442.htm
漳州市新奥光电仪器有限公司,http:////www.11467.com/zhangzhou/co/38275.htm
漳州市新奥光电仪器有限公司的商铺,http://zhangzhou038275.11467.com
东莞市连之新金属检测设备有限公司,http:////www.11467.com/dongguan/co/127287.htm
东莞市连之新金属检测设备有限公司的商铺,http://dongguan0127287.11467.com
无锡市贝安特工程机械制造有限公司,http:////www.11467.com/wuxi/co/243298.htm
无锡市贝安特工程机械制造有限公司的商铺,http://wuxi0243298.11467.com
偃师市城关镇科普电子仪器厂,http:////www.11467.com/luoyang/co/64421.htm
偃师市城关镇科普电子仪器厂的商铺,http://luoyang064421.11467.com
卢龙县立兴钻井机械修造厂,http:////www.11467.com/qinhuangdao/co/39020.htm
卢龙县立兴钻井机械修造厂的商铺,http://qinhuangdao039020.11467.com
广州精星益机械设备有限公司,http:////www.11467.com/guangzhou/co/430092.htm
广州精星益机械设备有限公司的商铺,http://guangzhou0430092.11467.com
晋州市通顺钻具厂,http:////www.11467.com/shijiazhuang/co/161260.htm
晋州市通顺钻具厂的商铺,http://shijiazhuang0161260.11467.com
烟台海山建筑机械有限公司,http:////www.11467.com/yantai/co/123740.htm
烟台海山建筑机械有限公司的商铺,http://yantai0123740.11467.com
郑州衢工机械设备有限公司,http:////www.11467.com/zhengzhou/co/189117.htm
郑州衢工机械设备有限公司的商铺,http://zhengzhou0189117.11467.com
河南省亚龙金刚石制品有限公司,http:////www.11467.com/zhengzhou/co/12283.htm
河南省亚龙金刚石制品有限公司的商铺,http://zhengzhou012283.11467.com
渭南新能科技有限责任公司,http:////www.11467.com/weinan/co/22583.htm
渭南新能科技有限责任公司的商铺,http://weinan022583.11467.com
河北石探机械制造有限责任公司,http:////www.11467.com/shijiazhuang/co/60417.htm
河北石探机械制造有限责任公司的商铺,http://shijiazhuang060417.11467.com
黄石市黄风机械有限公司,http:////www.11467.com/huangshi/co/17011.htm
黄石市黄风机械有限公司的商铺,http://huangshi017011.11467.com
哈尔滨市东方刃具厂,http:////www.11467.com/haerbin/co/41002.htm
哈尔滨市东方刃具厂的商铺,http://haerbin041002.11467.com
河北建勘钻探设备有限公司,http:////www.11467.com/shijiazhuang/co/137645.htm
河北建勘钻探设备有限公司的商铺,http://shijiazhuang0137645.11467.com
湖南状元金刚石制品有限责任公司,http:////www.11467.com/yongzhou/co/15927.htm
湖南状元金刚石制品有限责任公司的商铺,http://yongzhou015927.11467.com
成都市慧鑫诚科技有限责任公司,http:////www.11467.com/chengdu/co/142800.htm
成都市慧鑫诚科技有限责任公司的商铺,http://chengdu0142800.11467.com
焦作市豫信运输机械有限责任公司,http:////www.11467.com/jiaozuo/co/13600.htm
焦作市豫信运输机械有限责任公司的商铺,http://jiaozuo013600.11467.com
聊城国泰机械有限公司,http:////www.11467.com/liaocheng/co/21122.htm
聊城国泰机械有限公司的商铺,http://liaocheng021122.11467.com
双新电器(郑州)制造有限公司,http:////www.11467.com/zhengzhou/co/53066.htm
双新电器(郑州)制造有限公司的商铺,http://zhengzhou053066.11467.com
山东聚龙液压机械有限公司,http:////www.11467.com/linyi/co/112362.htm
山东聚龙液压机械有限公司的商铺,http://linyi0112362.11467.com
北京市地森海科技发展有限责任公司,http:////www.11467.com/beijing/co/404732.htm
北京市地森海科技发展有限责任公司的商铺,http://beijing0404732.11467.com
石家庄德力欧钻探机械有限公司,http:////www.11467.com/shijiazhuang/co/137571.htm
石家庄德力欧钻探机械有限公司的商铺,http://shijiazhuang0137571.11467.com
