广州市环屿钻机厂,http:////www.11467.com/guangzhou/co/660400.htm
广州市环屿钻机厂的商铺,http://guangzhou0660400.11467.com
晋州市信诚勘探机械厂,http:////www.11467.com/shijiazhuang/co/184442.htm
微科斯防水透气科技（东莞）有限公司,http:////www.11467.com/dongguan/co/602332.htm
永康市浩源钻井工程有限公司,http:////www.11467.com/jinhua/co/249329.htm
吉林集安东方机械有限公司,http:////www.11467.com/chifeng/co/22747.htm
山东巨匠机械有限公司钻机分公司,http:////www.11467.com/jining/co/108498.htm
山东巨匠机械有限公司钻机分公司的商铺,http://jining0108498.11467.com
漳州市新奥光电仪器有限公司,http:////www.11467.com/zhangzhou/co/38275.htm
漳州市新奥光电仪器有限公司的商铺,http://zhangzhou038275.11467.com
偃师市城关镇科普电子仪器厂,http:////www.11467.com/luoyang/co/64421.htm
偃师市城关镇科普电子仪器厂的商铺,http://luoyang064421.11467.com
卢龙县立兴钻井机械修造厂,http:////www.11467.com/qinhuangdao/co/39020.htm
卢龙县立兴钻井机械修造厂的商铺,http://qinhuangdao039020.11467.com
晋州市通顺钻具厂,http:////www.11467.com/shijiazhuang/co/161260.htm
晋州市通顺钻具厂的商铺,http://shijiazhuang0161260.11467.com
烟台海山建筑机械有限公司,http:////www.11467.com/yantai/co/123740.htm
烟台海山建筑机械有限公司的商铺,http://yantai0123740.11467.com
郑州衢工机械设备有限公司,http:////www.11467.com/zhengzhou/co/189117.htm
郑州衢工机械设备有限公司的商铺,http://zhengzhou0189117.11467.com
河南省亚龙金刚石制品有限公司,http:////www.11467.com/zhengzhou/co/12283.htm
河南省亚龙金刚石制品有限公司的商铺,http://zhengzhou012283.11467.com
渭南新能科技有限责任公司,http:////www.11467.com/weinan/co/22583.htm
渭南新能科技有限责任公司的商铺,http://weinan022583.11467.com
河北石探机械制造有限责任公司,http:////www.11467.com/shijiazhuang/co/60417.htm
河北石探机械制造有限责任公司的商铺,http://shijiazhuang060417.11467.com
永州市冷水滩区天元超硬钻探工具厂,http:////www.11467.com/yongzhou/co/15924.htm
永州市冷水滩区天元超硬钻探工具厂的商铺,http://yongzhou015924.11467.com
湖南状元金刚石制品有限责任公司,http:////www.11467.com/yongzhou/co/15927.htm
湖南状元金刚石制品有限责任公司的商铺,http://yongzhou015927.11467.com
黄石市黄风机械有限公司,http:////www.11467.com/huangshi/co/17011.htm
黄石市黄风机械有限公司的商铺,http://huangshi017011.11467.com
哈尔滨市东方刃具厂,http:////www.11467.com/haerbin/co/41002.htm
哈尔滨市东方刃具厂的商铺,http://haerbin041002.11467.com
焦作市豫信运输机械有限责任公司,http:////www.11467.com/jiaozuo/co/13600.htm
焦作市豫信运输机械有限责任公司的商铺,http://jiaozuo013600.11467.com
聊城国泰机械有限公司,http:////www.11467.com/liaocheng/co/21122.htm
聊城国泰机械有限公司的商铺,http://liaocheng021122.11467.com
双新电器(郑州)制造有限公司,http:////www.11467.com/zhengzhou/co/53066.htm
双新电器(郑州)制造有限公司的商铺,http://zhengzhou053066.11467.com
山东聚龙液压机械有限公司,http:////www.11467.com/linyi/co/112362.htm
山东聚龙液压机械有限公司的商铺,http://linyi0112362.11467.com
石家庄市德力欧钻探机械有限公司,http:////www.11467.com/baoding/co/79856.htm
石家庄市德力欧钻探机械有限公司的商铺,http://baoding079856.11467.com
北京恩瑞德轴承销售有限公司,http:////www.11467.com/beijing/co/622054.htm
北京恩瑞德轴承销售有限公司的商铺,http://beijing0622054.11467.com
徐州艾维思达钻探机械有限公司,http:////www.11467.com/xuzhou/co/93292.htm
徐州艾维思达钻探机械有限公司的商铺,http://xuzhou093292.11467.com
长沙市清泉机械设备有限公司,http:////www.11467.com/changsha/co/119350.htm
长沙市清泉机械设备有限公司的商铺,http://changsha0119350.11467.com
迁西县振平孔口阀科技有限公司,http:////www.11467.com/tangshan/co/83386.htm
迁西县振平孔口阀科技有限公司的商铺,http://tangshan083386.11467.com
辛集市宇盛齿轮厂,http:////www.11467.com/shijiazhuang/co/161367.htm
辛集市宇盛齿轮厂的商铺,http://shijiazhuang0161367.11467.com
马关奇特电子电器经营部,http:////www.11467.com/wenshan/co/6046.htm
马关奇特电子电器经营部的商铺,http://wenshan06046.11467.com
广州市环屿钻探机械有限公司,http:////www.11467.com/guangzhou/co/434697.htm
广州市环屿钻探机械有限公司的商铺,http://guangzhou0434697.11467.com
南阳市泉润水利工程有限公司,http:////www.11467.com/nanyang/co/31957.htm
南阳市泉润水利工程有限公司的商铺,http://nanyang031957.11467.com
石家庄威力达探矿机械有限公司,http:////www.11467.com/shijiazhuang/co/107925.htm
石家庄威力达探矿机械有限公司的商铺,http://shijiazhuang0107925.11467.com
沈丘县兴达矿山机械厂,http:////www.11467.com/zhoukou/co/18113.htm
沈丘县兴达矿山机械厂的商铺,http://zhoukou018113.11467.com
河北菲克森煤矿机械制造有限公司,http:////www.11467.com/shijiazhuang/co/178720.htm
河北菲克森煤矿机械制造有限公司的商铺,http://shijiazhuang0178720.11467.com
武汉华和机电技术有限公司,http:////www.11467.com/wuhan/co/79699.htm
武汉华和机电技术有限公司的商铺,http://wuhan079699.11467.com
湖南飞碟新材料有限责任公司,http:////www.11467.com/changsha/co/119351.htm
湖南飞碟新材料有限责任公司的商铺,http://changsha0119351.11467.com
长沙红华金属材料有限公司,http:////www.11467.com/changsha/co/81958.htm
长沙红华金属材料有限公司的商铺,http://changsha081958.11467.com
长沙市特源机电科技有限公司,http:////www.11467.com/changsha/co/135393.htm
长沙市特源机电科技有限公司的商铺,http://changsha0135393.11467.com
浙江杭钻机械制造股份有限公司,http:////www.11467.com/hangzhou/co/199542.htm
浙江杭钻机械制造股份有限公司的商铺,http://hangzhou0199542.11467.com
晋州市阳光钻探机械配件厂,http:////www.11467.com/shijiazhuang/co/161368.htm
晋州市阳光钻探机械配件厂的商铺,http://shijiazhuang0161368.11467.com
深圳市铨顺宏科技有限公司,http:////www.11467.com/shenzhen/co/768960.htm
深圳市铨顺宏科技有限公司的商铺,http://shenzhen0768960.11467.com
苏州市苏新探矿工具厂,http:////www.11467.com/suzhou/co/165588.htm
苏州市苏新探矿工具厂的商铺,http://suzhou0165588.11467.com
湖北地大金石地质工具有限公司,http:////www.11467.com/wuhan/co/82443.htm
湖北地大金石地质工具有限公司的商铺,http://wuhan082443.11467.com
长沙探矿机械厂,http:////www.11467.com/changsha/co/28737.htm
长沙探矿机械厂的商铺,http://changsha028737.11467.com
河间市佰纳斯钻井设备有限公司,http:////www.11467.com/cangzhou/co/57990.htm
河间市佰纳斯钻井设备有限公司的商铺,http://cangzhou057990.11467.com
镇江长城注浆设备有限公司,http:////www.11467.com/zhenjiang/co/64009.htm
镇江长城注浆设备有限公司的商铺,http://zhenjiang064009.11467.com
昆明财利植物胶厂,http:////www.11467.com/kunming/co/149455.htm
昆明财利植物胶厂的商铺,http://kunming0149455.11467.com
临城县西孟村打井队,http:////www.11467.com/xintai/co/39105.htm
北京地森海有限公司,http:////www.11467.com/beijing/co/404722.htm
安徽新环能电气股份有限公司,http:////www.11467.com/chuzhou/co/22686.htm
安徽新环能电气股份有限公司的商铺,http://chuzhou022686.11467.com
深圳市欧固德科技有限公司,http:////www.11467.com/shenzhen/co/757822.htm
深圳市欧固德科技有限公司的商铺,http://shenzhen0757822.11467.com
武汉地探科技责任有限公司,http:////www.11467.com/wuhan/co/117851.htm
武汉地探科技责任有限公司的商铺,http://wuhan0117851.11467.com
东莞市连之新金属检测设备有限公司,http:////www.11467.com/dongguan/co/127287.htm
东莞市连之新金属检测设备有限公司的商铺,http://dongguan0127287.11467.com
山东昊洲矿业安全装备有限公司,http:////www.11467.com/taian/co/58976.htm
山东昊洲矿业安全装备有限公司的商铺,http://taian058976.11467.com
潍坊智天工业自控设备有限公司,http:////www.11467.com/weifang/co/93059.htm
潍坊智天工业自控设备有限公司的商铺,http://weifang093059.11467.com
广州精星益机械设备有限公司,http:////www.11467.com/guangzhou/co/430092.htm
广州精星益机械设备有限公司的商铺,http://guangzhou0430092.11467.com
无锡市翊中机械厂,http:////www.11467.com/wuxi/co/195732.htm
无锡市翊中机械厂的商铺,http://wuxi0195732.11467.com
泰州金昌龙机电设备有限公司,http:////www.11467.com/taizhoushi/co/26097.htm
泰州金昌龙机电设备有限公司的商铺,http://taizhoushi026097.11467.com
深圳市山亚仪器仪表有限公司,http:////www.11467.com/shenzhen/co/727850.htm
深圳市山亚仪器仪表有限公司的商铺,http://shenzhen0727850.11467.com
浙江佳成机械有限公司,http:////www.11467.com/quzhou/co/21976.htm
浙江佳成机械有限公司的商铺,http://quzhou021976.11467.com
石家庄市志诚地质工程机械有限公司,http:////www.11467.com/shijiazhuang/co/77884.htm
石家庄市志诚地质工程机械有限公司的商铺,http://shijiazhuang077884.11467.com
泰安市泰山灌浆有限公司水利机械厂,http:////www.11467.com/taian/co/37338.htm
泰安市泰山灌浆有限公司水利机械厂的商铺,http://taian037338.11467.com
南充市锐进机械制造有限公司,http:////www.11467.com/nanchong/co/23885.htm
南充市锐进机械制造有限公司的商铺,http://nanchong023885.11467.com
石家庄大地探测技术有限公司,http:////www.11467.com/shijiazhuang/co/86522.htm
石家庄大地探测技术有限公司的商铺,http://shijiazhuang086522.11467.com
焦作市同凯矿山机械制造有限公司,http:////www.11467.com/jiaozuo/co/257.htm
焦作市同凯矿山机械制造有限公司的商铺,http://jiaozuo0257.11467.com
蒙阴县正云钻机配件厂,http:////www.11467.com/linyi/co/61119.htm
蒙阴县正云钻机配件厂的商铺,http://linyi061119.11467.com
无锡市正圆液压气动有限公司,http:////www.11467.com/wuxi/co/196938.htm
无锡市正圆液压气动有限公司的商铺,http://wuxi0196938.11467.com
无锡市百威机械有限公司,http:////www.11467.com/wuxi/co/196249.htm
无锡市百威机械有限公司的商铺,http://wuxi0196249.11467.com
蒙阴众兴钻探机械有限公司,http:////www.11467.com/linyi/co/62693.htm
蒙阴众兴钻探机械有限公司的商铺,http://linyi062693.11467.com
阳谷三阳钎具有限公司,http:////www.11467.com/liaocheng/co/43077.htm
阳谷三阳钎具有限公司的商铺,http://liaocheng043077.11467.com
湘潭市高鑫粉末冶金设备制造有限公司,http:////www.11467.com/xiangtan/co/24269.htm
湘潭市高鑫粉末冶金设备制造有限公司的商铺,http://xiangtan024269.11467.com
石家庄超达煤矿机械有限公司,http:////www.11467.com/shijiazhuang/co/86624.htm
石家庄超达煤矿机械有限公司的商铺,http://shijiazhuang086624.11467.com
陕西德瑞特工贸有限责任公司,http:////www.11467.com/xian/co/75179.htm
陕西德瑞特工贸有限责任公司的商铺,http://xian075179.11467.com
唐山市丰南区中利石油机械厂,http:////www.11467.com/tangshan/co/53026.htm
唐山市丰南区中利石油机械厂的商铺,http://tangshan053026.11467.com
邢台市巨通机械配件有限公司,http:////www.11467.com/xintai/co/24958.htm
邢台市巨通机械配件有限公司的商铺,http://xintai024958.11467.com
泰安市鼎鑫矿用设备公司,http:////www.11467.com/taian/co/52804.htm
泰安市鼎鑫矿用设备公司的商铺,http://taian052804.11467.com
泰安市泰山大地钻探设备制造厂,http:////www.11467.com/taian/co/36432.htm
泰安市泰山大地钻探设备制造厂的商铺,http://taian036432.11467.com
南京瑞格工程机械有限公司,http:////www.11467.com/nanjing/co/153810.htm
南京瑞格工程机械有限公司的商铺,http://nanjing0153810.11467.com
鞍山市红光地质仪器有限公司,http:////www.11467.com/anshan/co/70637.htm
鞍山市红光地质仪器有限公司的商铺,http://anshan070637.11467.com
兰州三原电子衡器设备有限公司,http:////www.11467.com/lanzhou/co/62344.htm
兰州三原电子衡器设备有限公司的商铺,http://lanzhou062344.11467.com
广州市天河区天平湘衡钻探器材经营部,http:////www.11467.com/guangzhou/co/254066.htm
广州市天河区天平湘衡钻探器材经营部的商铺,http://guangzhou0254066.11467.com
苏州创源化工有限公司,http:////www.11467.com/suzhou/co/313103.htm
苏州创源化工有限公司的商铺,http://suzhou0313103.11467.com
石家庄市钻得快机械设备销售有限公司,http:////www.11467.com/shijiazhuang/co/138884.htm
石家庄市钻得快机械设备销售有限公司的商铺,http://shijiazhuang0138884.11467.com
洛阳三幸工业设备有限公司,http:////www.11467.com/luoyang/co/44039.htm
洛阳三幸工业设备有限公司的商铺,http://luoyang044039.11467.com
巨鹿县长城矿山机械配件有限公司,http:////www.11467.com/xintai/co/42076.htm
巨鹿县长城矿山机械配件有限公司的商铺,http://xintai042076.11467.com
深圳市士百威电子有限公司,http:////www.11467.com/shenzhen/co/722954.htm
深圳市士百威电子有限公司的商铺,http://shenzhen0722954.11467.com
台州市路桥诚达液压设备有限公司,http:////www.11467.com/taizhou/co/105664.htm
台州市路桥诚达液压设备有限公司的商铺,http://taizhou0105664.11467.com
福州华荣勘探工程装备有限公司,http:////www.11467.com/fuzhou/co/168052.htm
福州华荣勘探工程装备有限公司的商铺,http://fuzhou0168052.11467.com
厦门市集美区长运泰安防设备经营部,http:////www.11467.com/xiamen/co/103471.htm
厦门市集美区长运泰安防设备经营部的商铺,http://xiamen0103471.11467.com
北京巴哈尔科技有限公司深圳分公司,http:////www.11467.com/shenzhen/co/760964.htm
北京巴哈尔科技有限公司深圳分公司的商铺,http://shenzhen0760964.11467.com
南通涞沃仪器有限公司,http:////www.11467.com/nantong/co/113430.htm
南通涞沃仪器有限公司的商铺,http://nantong0113430.11467.com
日照力拓钻探有限公司,http:////www.11467.com/rizhao/co/23350.htm
日照力拓钻探有限公司的商铺,http://rizhao023350.11467.com
常州市武进八方机械厂,http:////www.11467.com/changzhou/co/58250.htm
常州市武进八方机械厂的商铺,http://changzhou058250.11467.com
杭州雷辰科技有限公司,http:////www.11467.com/hangzhou/co/390987.htm
杭州雷辰科技有限公司的商铺,http://hangzhou0390987.11467.com
武义恒悦机械制造有限公司,http:////www.11467.com/jinzhou/co/50254.htm
武义恒悦机械制造有限公司的商铺,http://jinzhou050254.11467.com
武汉磐索地勘科技有限公司,http:////www.11467.com/wuhan/co/116953.htm
武汉磐索地勘科技有限公司的商铺,http://wuhan0116953.11467.com
襄阳共存机械制造有限公司,http:////www.11467.com/xiangfan/co/44986.htm
襄阳共存机械制造有限公司的商铺,http://xiangfan044986.11467.com
西安金龙钻探设备有限公司,http:////www.11467.com/xian/co/50233.htm
河北省晋州市冀兴地质机械厂,http:////www.11467.com/shijiazhuang/co/108230.htm
河北汇泰地质探矿机械配件有限公司,http:////www.11467.com/xintai/co/62193.htm
河北汇泰地质探矿机械配件有限公司的商铺,http://xintai062193.11467.com
株洲通达硬质合金厂,http:////www.11467.com/zhuzhou/co/23754.htm
株洲通达硬质合金厂的商铺,http://zhuzhou023754.11467.com
北京吉奥科技有限公司,http:////www.11467.com/beijing/co/763231.htm
北京吉奥科技有限公司的商铺,http://beijing0763231.11467.com
山东聚龙进出口有限公司,http:////www.11467.com/linyi/co/133935.htm
山东聚龙进出口有限公司的商铺,http://linyi0133935.11467.com
上海申生科技有限公司,http:////www.11467.com/shanghai/co/468761.htm
上海申生科技有限公司的商铺,http://shanghai0468761.11467.com
山东淄博全恒泵业科技有限公司,http:////www.11467.com/zibo/co/77142.htm
山东淄博全恒泵业科技有限公司的商铺,http://zibo077142.11467.com
张家口市宣化恒通鑫钻孔机械有限公司,http:////www.11467.com/zhangjiakou/co/28350.htm
张家口市宣化恒通鑫钻孔机械有限公司的商铺,http://zhangjiakou028350.11467.com
天津市天硕伟业钢铁贸易有限公司,http:////www.11467.com/tianjin/co/15646.htm
天津市天硕伟业钢铁贸易有限公司的商铺,http://tianjin015646.11467.com
大连朝胜自动化有限公司,http:////www.11467.com/dalian/co/34475.htm
大连朝胜自动化有限公司的商铺,http://dalian034475.11467.com
山东省地矿物资总公司,http:////www.11467.com/jinan/co/81279.htm
山东省地矿物资总公司的商铺,http://jinan081279.11467.com
沈阳山泰破碎粉磨设备制造有限公司,http:////www.11467.com/shenyang/co/52096.htm
沈阳山泰破碎粉磨设备制造有限公司的商铺,http://shenyang052096.11467.com
山东泰安金岳智信能源科技有限公司,http:////www.11467.com/taian/co/36464.htm
山东泰安金岳智信能源科技有限公司的商铺,http://taian036464.11467.com
蒙阴德沃机械有限公司,http:////www.11467.com/linyi/co/98464.htm
蒙阴德沃机械有限公司的商铺,http://linyi098464.11467.com
天津永广地质装备销售有限公司,http:////www.11467.com/tianjin/co/39251.htm
天津永广地质装备销售有限公司的商铺,http://tianjin039251.11467.com
重庆市耀腾机械制造有限公司,http:////www.11467.com/chongqing/co/125827.htm
重庆市耀腾机械制造有限公司的商铺,http://chongqing0125827.11467.com
河北汇通地质探矿机械有限公司,http:////www.11467.com/shijiazhuang/co/213714.htm
河北汇通地质探矿机械有限公司的商铺,http://shijiazhuang0213714.11467.com
广州市易探探测科技有限公司,http:////www.11467.com/guangzhou/co/511633.htm
广州市易探探测科技有限公司的商铺,http://guangzhou0511633.11467.com
徐州艾维斯达钻探机械有限公司,http:////www.11467.com/xuzhou/co/93297.htm
徐州艾维斯达钻探机械有限公司的商铺,http://xuzhou093297.11467.com
山东华巨机械有限公司分公司,http:////www.11467.com/qiye/93361694.htm
山东华巨机械有限公司分公司的商铺,http://93361694.b2b.11467.com
海宁市钱江勘察机械有限公司,http:////www.11467.com/jiaxing/co/135784.htm
海宁市钱江勘察机械有限公司的商铺,http://jiaxing0135784.11467.com
福州拓纬测绘仪器有限公司,http:////www.11467.com/fuzhou/co/210195.htm
福州拓纬测绘仪器有限公司的商铺,http://fuzhou0210195.11467.com
无锡市东奥有色铸造有限公司,http:////www.11467.com/wuxi/co/194727.htm
无锡市东奥有色铸造有限公司的商铺,http://wuxi0194727.11467.com
禹州市三星塑料制品有限公司,http:////www.11467.com/xuchang/co/25980.htm
禹州市三星塑料制品有限公司的商铺,http://xuchang025980.11467.com
北京品钻科技有限公司,http:////www.11467.com/beijing/co/789563.htm
北京品钻科技有限公司的商铺,http://beijing0789563.11467.com
广州欧杰纳斯机械制造有限公司,http:////www.11467.com/guangzhou/co/459803.htm
广州欧杰纳斯机械制造有限公司的商铺,http://guangzhou0459803.11467.com
泰州市新宇仪器设备厂,http:////www.11467.com/taizhoushi/co/61451.htm
泰州市新宇仪器设备厂的商铺,http://taizhoushi061451.11467.com
大名县祥发钻井有限责任公司,http:////www.11467.com/qiye/20604185.htm
大名县祥发钻井有限责任公司的商铺,http://20604185.b2b.11467.com
如皋市久隆机械制造有限公司,http:////www.11467.com/nantong/co/96000.htm
如皋市久隆机械制造有限公司的商铺,http://nantong096000.11467.com
北京威凯探源机械有限公司,http:////www.11467.com/beijing/co/763391.htm
北京威凯探源机械有限公司的商铺,http://beijing0763391.11467.com
句容恒通导管厂,http:////www.11467.com/zhenjiang/co/65464.htm
句容恒通导管厂的商铺,http://zhenjiang065464.11467.com
河北石探机械制造有限责任公司,http:////www.11467.com/zhongshan/co/117622.htm
河北石探机械制造有限责任公司的商铺,http://zhongshan0117622.11467.com
武义宏途工具制造有限公司,http:////www.11467.com/jinzhou/co/51178.htm
武义宏途工具制造有限公司的商铺,http://jinzhou051178.11467.com
新乡市新锅容器制造有限公司,http:////www.11467.com/xinxiang/co/31834.htm
新乡市新锅容器制造有限公司的商铺,http://xinxiang031834.11467.com
北京圣火大地科技有限公司,http:////www.11467.com/beijing/co/384071.htm
北京圣火大地科技有限公司的商铺,http://beijing0384071.11467.com
郑州华致科技有限责任公司,http:////www.11467.com/qiye/93140563.htm
郑州华致科技有限责任公司的商铺,http://93140563.b2b.11467.com
十堰市金石地质科技有限公司,http:////www.11467.com/shiyan/co/32752.htm
十堰市金石地质科技有限公司,http:////www.11467.com/shiyan/co/32752.htm
昌吉市远辉器材加工厂,http:////www.11467.com/changji/co/12597.htm
洛阳大发考古工具公司销售部,http:////www.11467.com/luoyang/co/53069.htm
利鑫电子科技有限公司,http:////www.11467.com/nanchang/co/100518.htm
来宾市迁江中学,http:////www.11467.com/laibin/co/4204.htm
江苏天明机械集团有限公司,http:////www.11467.com/lianyungang/co/26541.htm
辽源烁华液压机械工程有限公司,http:////www.11467.com/liaoyuan/co/8445.htm
桂林金刚石工业有限公司,http:////www.11467.com/guilin/co/47854.htm
河南绿源新星环保设备有限公司,http:////www.11467.com/hebi/co/10056.htm
鹤壁英华仪器仪表公司,http:////www.11467.com/hebi/co/9762.htm
黑河市卓远经贸有限责任公司,http:////www.11467.com/heihe/co/16087.htm
衡阳伟业冶金矿山机械有限责任公司,http:////www.11467.com/hengyang/co/28529.htm
卢龙县永昌钻井机械厂,http:////www.11467.com/qinhuangdao/co/39047.htm
日照恒盛探矿机械厂,http:////www.11467.com/rizhao/co/17066.htm
河北双龙橡胶有限公司,http:////www.11467.com/baoding/co/32942.htm
飞翼股份有限公司,http:////www.11467.com/changsha/co/121443.htm
常州乙顿液压气动机械制造有限公司,http:////www.11467.com/changzhou/co/56609.htm
北京林克富华技术开发有限公司,http:////www.11467.com/guangzhou/co/249905.htm
广州市嘉特斯机电制造有限公司,http:////www.11467.com/guangzhou/co/275041.htm
广州欧美大地仪器设备有限公司,http:////www.11467.com/guangzhou/co/255559.htm
广州国测数码科技有限公司,http:////www.11467.com/guangzhou/co/245992.htm
哈尔滨欣飞达科技有限公司,http:////www.11467.com/haerbin/co/41055.htm
广西河池市矿山工程有限公司,http:////www.11467.com/hechi/co/11224.htm
湖北首开机械有限公司,http:////www.11467.com/huangshi/co/16341.htm
湖州中联机械制造有限公司,http:////www.11467.com/huzhou/co/50218.htm
济南中正金码科技有限公司,http:////www.11467.com/jinan/co/64096.htm
广西来宾市水务有限责任公司,http:////www.11467.com/laibin/co/3625.htm
连云港市云达建设工程有限公司,http:////www.11467.com/lianyungang/co/28541.htm
连云港黄海机械股份有限公司,http:////www.11467.com/lianyungang/co/43629.htm
辽源市诚发租赁公司,http:////www.11467.com/liaoyuan/co/8369.htm
柳州市威尔姆预应力有限公司,http:////www.11467.com/liuzhou/co/29596.htm
原冰冰（个体经营）,http:////www.11467.com/luoyang/co/53071.htm
黑龙江北方双佳钻采机具有限责任公司,http:////www.11467.com/mudanjiang/co/29803.htm
江苏扬子水文工程有限公司,http:////www.11467.com/nanjing/co/32433.htm
南京鼎阳科技有限公司,http:////www.11467.com/nanjing/co/79139.htm
七台河市天域办公设备有限公司,http:////www.11467.com/qitaihe/co/4228.htm
日照天成钻探有限公司,http:////www.11467.com/rizhao/co/28741.htm
辛集市朗口金钻齿轮加工厂,http:////www.11467.com/shijiazhuang/co/141388.htm
宿迁诚盛探矿工具有限公司,http:////www.11467.com/suqian/co/14943.htm
山西吉安煤矿科技有限公司,http:////www.11467.com/taiyuan/co/106701.htm
遵化科道屯膨润土厂,http:////www.11467.com/tangshan/co/75612.htm
山东骏成机械有限公司,http:////www.11467.com/weifang/co/120122.htm
中国科学院武汉岩土力学研究所,http:////www.11467.com/wuhan/co/69660.htm
武汉江钻工程钻具有限责任公司,http:////www.11467.com/wuhan/co/77124.htm
中国地质大学（武汉）,http:////www.11467.com/wuhan/co/75446.htm
无锡市蓝力机床有限公司,http:////www.11467.com/wuxi/co/41446.htm
西安创安环保科技有限责任公司,http:////www.11467.com/xian/co/95592.htm
中煤科工集团西安研究院,http:////www.11467.com/xian/co/95590.htm
陕西金福科技有限责任公司,http:////www.11467.com/xian/co/48174.htm
西安沃德科技有限责任公司,http:////www.11467.com/xian/co/48933.htm
徐州天地重型机械制造有限公司,http:////www.11467.com/xuzhou/co/44539.htm
徐州森兵勘探机械经销处,http:////www.11467.com/xuzhou/co/63974.htm
