吴江市神州制塑有限公司,http:////www.11467.com/suzhou/co/357167.htm
吴江市神州制塑有限公司的商铺,http://suzhou0357167.11467.com
廊坊美昌保温材料有限公司,http:////www.11467.com/langfang/co/44126.htm
廊坊美昌保温材料有限公司的商铺,http://langfang044126.11467.com
博兴县锦秋办事处喜丰遮蔽膜厂,http:////www.11467.com/lvliang/co/29442.htm
博兴县锦秋办事处喜丰遮蔽膜厂的商铺,http://lvliang029442.11467.com
宿迁鑫程包装有限公司,http:////www.11467.com/suqian/co/10816.htm
宿迁鑫程包装有限公司的商铺,http://suqian010816.11467.com
昆山金品源精密电子有限公司,http:////www.11467.com/suzhou/co/356964.htm
昆山金品源精密电子有限公司的商铺,http://suzhou0356964.11467.com
深圳市万达杰塑料制品有限公司,http:////www.11467.com/shenzhen/co/277708.htm
深圳市万达杰塑料制品有限公司的商铺,http://shenzhen0277708.11467.com
安徽聚美生物科技有限公司,http:////www.11467.com/wuhu/co/32995.htm
安徽聚美生物科技有限公司的商铺,http://wuhu032995.11467.com
西安亚创电子科技有限公司,http:////www.11467.com/xian/co/128029.htm
西安亚创电子科技有限公司的商铺,http://xian0128029.11467.com
中山联发塑料机械有限公司,http:////www.11467.com/zhongshan/co/118867.htm
中山联发塑料机械有限公司的商铺,http://zhongshan0118867.11467.com
淄博金辰塑胶科技有限公司,http:////www.11467.com/zibo/co/93279.htm
淄博金辰塑胶科技有限公司的商铺,http://zibo093279.11467.com
中山市东升镇捷利丰电子辅料制品厂,http:////www.11467.com/xuzhou/co/83010.htm
中山市东升镇捷利丰电子辅料制品厂的商铺,http://xuzhou083010.11467.com
山东菏泽正瑞塑料包装厂,http:////www.11467.com/heze/co/46878.htm
山东菏泽正瑞塑料包装厂的商铺,http://heze046878.11467.com
海宁市许村镇华尔洁靠枕厂,http:////www.11467.com/jiaxing/co/134903.htm
海宁市许村镇华尔洁靠枕厂的商铺,http://jiaxing0134903.11467.com
青岛山海包装制品有限公司,http:////www.11467.com/qingdao/co/188584.htm
青岛山海包装制品有限公司的商铺,http://qingdao0188584.11467.com
广东省普宁市家宝食用包装品有限公司,http:////www.11467.com/guangzhou/co/212963.htm
惠州市惠阳区秋长宝佳利包装材料厂,http:////www.11467.com/huizhou/co/58776.htm
惠州市惠阳区秋长宝佳利包装材料厂的商铺,http://huizhou058776.11467.com
焦作市三羽塑胶有限公司,http:////www.11467.com/jiaozuo/co/21471.htm
焦作市三羽塑胶有限公司的商铺,http://jiaozuo021471.11467.com
汕头市潮南区琰丰包装制品厂,http:////www.11467.com/shantou/co/123286.htm
汕头市潮南区琰丰包装制品厂的商铺,http://shantou0123286.11467.com
惠州宝田塑胶包装有限公司,http:////www.11467.com/huizhou/co/68929.htm
惠州宝田塑胶包装有限公司的商铺,http://huizhou068929.11467.com
惠州市惠强塑料包装有限公司,http:////www.11467.com/huizhou/co/63465.htm
惠州市惠强塑料包装有限公司的商铺,http://huizhou063465.11467.com
沧州沧硕塑业有限公司,http:////www.11467.com/cangzhou/co/39777.htm
沧州沧硕塑业有限公司的商铺,http://cangzhou039777.11467.com
烟台市牟平区盛源塑料有限公司,http:////www.11467.com/yantai/co/127041.htm
烟台市牟平区盛源塑料有限公司的商铺,http://yantai0127041.11467.com
镇江市润州金山包装厂,http:////www.11467.com/zhenjiang/co/5714.htm
镇江市润州金山包装厂的商铺,http://zhenjiang05714.11467.com
江门市蓬江区棠下恒昌塑料薄膜厂,http:////www.11467.com/jiangmen/co/86544.htm
江门市蓬江区棠下恒昌塑料薄膜厂的商铺,http://jiangmen086544.11467.com
烟台市莱山区双达橡塑有限公司,http:////www.11467.com/yantai/co/127042.htm
烟台市莱山区双达橡塑有限公司的商铺,http://yantai0127042.11467.com
惠州市鸿利达包装材料有限公司,http:////www.11467.com/huizhou/co/73791.htm
惠州市鸿利达包装材料有限公司的商铺,http://huizhou073791.11467.com
厦门叁利隆包装材料,http:////www.11467.com/xiamen/co/85029.htm
厦门叁利隆包装材料的商铺,http://xiamen085029.11467.com
苏州新旭缘特殊包装有限公司,http:////www.11467.com/suzhou/co/401917.htm
苏州新旭缘特殊包装有限公司的商铺,http://suzhou0401917.11467.com
东莞市品优薄膜科技有限公司,http:////www.11467.com/dongguan/co/632447.htm
东莞市品优薄膜科技有限公司的商铺,http://dongguan0632447.11467.com
广州荣义装饰材料有限公司,http:////www.11467.com/guangzhou/co/460271.htm
广州荣义装饰材料有限公司的商铺,http://guangzhou0460271.11467.com
合肥市恒达塑业有限公司,http:////www.11467.com/hefei/co/147893.htm
合肥市恒达塑业有限公司的商铺,http://hefei0147893.11467.com
深圳市源杰能科技有限公司,http:////www.11467.com/shenzhen/co/1127796.htm
深圳市源杰能科技有限公司的商铺,http://shenzhen01127796.11467.com
苏州友恒橡塑制品有限公司,http:////www.11467.com/suzhou/co/313098.htm
苏州友恒橡塑制品有限公司的商铺,http://suzhou0313098.11467.com
东莞市纳利光学材料有限公司,http:////www.11467.com/dongguan/co/462764.htm
东莞市纳利光学材料有限公司的商铺,http://dongguan0462764.11467.com
佛山市海溢包装材料有限公司,http:////www.11467.com/foshan/co/345942.htm
佛山市海溢包装材料有限公司的商铺,http://foshan0345942.11467.com
大连塑料研究所有限公司,http:////www.11467.com/dalian/co/34461.htm
大连塑料研究所有限公司的商铺,http://dalian034461.11467.com
焦作群泽塑胶有限公司,http:////www.11467.com/jiaozuo/co/23070.htm
焦作群泽塑胶有限公司的商铺,http://jiaozuo023070.11467.com
中山市大利路精工机械有限公司,http:////www.11467.com/zhongshan/co/42811.htm
中山市大利路精工机械有限公司的商铺,http://zhongshan042811.11467.com
漳州市源杰能包装设备有限公司,http:////www.11467.com/zhangzhou/co/61643.htm
漳州市源杰能包装设备有限公司的商铺,http://zhangzhou061643.11467.com
常熟市美泰包装材料有限公司,http:////www.11467.com/qiye/93197478.htm
常熟市美泰包装材料有限公司的商铺,http://93197478.b2b.11467.com
深圳市百泉河实业有限公司,http:////www.11467.com/shenzhen/co/339671.htm
深圳市百泉河实业有限公司的商铺,http://shenzhen0339671.11467.com
东莞市梁宇胶贴制品有限公司,http:////www.11467.com/dongguan/co/239148.htm
东莞市梁宇胶贴制品有限公司的商铺,http://dongguan0239148.11467.com
东莞市塘厦永丰包装材料行,http:////www.11467.com/dongguan/co/143190.htm
东莞市塘厦永丰包装材料行的商铺,http://dongguan0143190.11467.com
广州惠华包装制品有限公司,http:////www.11467.com/guangzhou/co/210776.htm
广州惠华包装制品有限公司的商铺,http://guangzhou0210776.11467.com
卫辉市永胜塑料制品厂,http:////www.11467.com/xinxiang/co/31364.htm
卫辉市永胜塑料制品厂的商铺,http://xinxiang031364.11467.com
雄县新天华塑业有限公司,http:////www.11467.com/baoding/co/56642.htm
雄县新天华塑业有限公司的商铺,http://baoding056642.11467.com
沧州市隆泰塑料有限公司,http:////www.11467.com/cangzhou/co/45887.htm
沧州市隆泰塑料有限公司的商铺,http://cangzhou045887.11467.com
长沙市远瑞塑胶有限公司,http:////www.11467.com/changsha/co/104300.htm
长沙市远瑞塑胶有限公司的商铺,http://changsha0104300.11467.com
厦门市地隆包装材料有限公司,http:////www.11467.com/xiamen/co/85775.htm
厦门市地隆包装材料有限公司的商铺,http://xiamen085775.11467.com
东莞市开源塑化科技有限公司,http:////www.11467.com/dongguan/co/329591.htm
东莞市开源塑化科技有限公司的商铺,http://dongguan0329591.11467.com
东莞市海野塑胶制品有限公司,http:////www.11467.com/dongguan/co/508501.htm
东莞市海野塑胶制品有限公司的商铺,http://dongguan0508501.11467.com
东莞市旭田包装机械有限公司,http:////www.11467.com/dongguan/co/40173.htm
东莞市旭田包装机械有限公司的商铺,http://dongguan040173.11467.com
东莞市金旺包装材料有限公司,http:////www.11467.com/dongguan/co/323211.htm
东莞市金旺包装材料有限公司的商铺,http://dongguan0323211.11467.com
星子县鑫盛石材厂,http:////www.11467.com/jiujiang/co/22385.htm
星子县鑫盛石材厂的商铺,http://jiujiang022385.11467.com
浙江超然建材有限公司,http:////www.11467.com/quzhou/co/36132.htm
浙江超然建材有限公司的商铺,http://quzhou036132.11467.com
广州市绿原环保材料有限公司,http:////www.11467.com/guangzhou/co/115664.htm
广州市绿原环保材料有限公司的商铺,http://guangzhou0115664.11467.com
杭州新光塑料有限公司,http:////www.11467.com/hangzhou/co/10180.htm
杭州新光塑料有限公司的商铺,http://hangzhou010180.11467.com
浙江九鼎投资集团有限公司,http:////www.11467.com/hangzhou/co/238486.htm
浙江九鼎投资集团有限公司的商铺,http://hangzhou0238486.11467.com
重庆环能轻质建材有限公司,http:////www.11467.com/chongqing/co/344284.htm
重庆环能轻质建材有限公司的商铺,http://chongqing0344284.11467.com
天津澳晨科技有限公司,http:////www.11467.com/tianjin/co/198404.htm
天津澳晨科技有限公司的商铺,http://tianjin0198404.11467.com
浦江县鼎信二手吨袋厂,http:////www.11467.com/jinhua/co/265880.htm
浦江县鼎信二手吨袋厂的商铺,http://jinhua0265880.11467.com
无锡新龙科技有限公司,http:////www.11467.com/qiye/4552.htm
西安盛邦珍珠棉有限公司,http:////www.11467.com/xian/co/95810.htm
石家庄方大包装材料有限公司,http:////www.11467.com/shijiazhuang/co/84039.htm
东莞市永升包装制品有限公司,http:////www.11467.com/dongguan/co/590410.htm
东莞市永升包装制品有限公司的商铺,http://dongguan0590410.11467.com
上海钟田橡塑制品有限公司,http:////www.11467.com/shanghai/co/741784.htm
上海钟田橡塑制品有限公司的商铺,http://shanghai0741784.11467.com
漳州明鑫包装材料有限公司,http:////www.11467.com/zhangzhou/co/61008.htm
漳州明鑫包装材料有限公司的商铺,http://zhangzhou061008.11467.com
扬州三星塑胶有限公司,http:////www.11467.com/yangzhou/co/8209.htm
扬州三星塑胶有限公司的商铺,http://yangzhou08209.11467.com
武汉天利包装有限公司,http:////www.11467.com/wuhan/co/69818.htm
武汉天利包装有限公司的商铺,http://wuhan069818.11467.com
揭阳市玉顺塑料包装有限公司,http:////www.11467.com/jieyang/co/4684.htm
揭阳市玉顺塑料包装有限公司的商铺,http://jieyang04684.11467.com
南宁瑞科冠包装材料有限公司,http:////www.11467.com/nanning/co/63297.htm
南宁瑞科冠包装材料有限公司的商铺,http://nanning063297.11467.com
青岛正通达科技有限公司,http:////www.11467.com/qingdao/co/101486.htm
青岛正通达科技有限公司的商铺,http://qingdao0101486.11467.com
苏州市华瑞包装材料有限公司,http:////www.11467.com/suzhou/co/234448.htm
苏州市华瑞包装材料有限公司的商铺,http://suzhou0234448.11467.com
中山市鑫凯包装科技有限公司,http:////www.11467.com/zhongshan/co/146864.htm
中山市鑫凯包装科技有限公司的商铺,http://zhongshan0146864.11467.com
深圳市强辉鑫科技有限公司,http:////www.11467.com/shenzhen/co/721983.htm
深圳市强辉鑫科技有限公司的商铺,http://shenzhen0721983.11467.com
苏州惠国塑料制品有限公司,http:////www.11467.com/suzhou/co/2342.htm
苏州惠国塑料制品有限公司的商铺,http://suzhou02342.11467.com
南宁市任盛塑料制品厂,http:////www.11467.com/nanning/co/63293.htm
南宁市任盛塑料制品厂的商铺,http://nanning063293.11467.com
微山县瑞鑫包装材料有限公司,http:////www.11467.com/zaozhuang/co/24691.htm
微山县瑞鑫包装材料有限公司的商铺,http://zaozhuang024691.11467.com
杭州萧翔泡沫塑料有限公司,http:////www.11467.com/hangzhou/co/368586.htm
杭州萧翔泡沫塑料有限公司的商铺,http://hangzhou0368586.11467.com
曹县昊天防震包装材料有限公司,http:////www.11467.com/heze/co/23853.htm
曹县昊天防震包装材料有限公司的商铺,http://heze023853.11467.com
深圳市欣佳昱橡塑有限公司,http:////www.11467.com/shenzhen/co/675446.htm
深圳市欣佳昱橡塑有限公司的商铺,http://shenzhen0675446.11467.com
东莞千玖电子科技有限公司,http:////www.11467.com/dongguan/co/603806.htm
东莞千玖电子科技有限公司的商铺,http://dongguan0603806.11467.com
深圳市凯达莱实业有限公司,http:////www.11467.com/shenzhen/co/563596.htm
深圳市凯达莱实业有限公司的商铺,http://shenzhen0563596.11467.com
深圳市慧鑫道隆科技有限公司,http:////www.11467.com/shenzhen/co/526473.htm
深圳市慧鑫道隆科技有限公司的商铺,http://shenzhen0526473.11467.com
温州市宏友铝箔包装材料有限公司,http:////www.11467.com/wenzhou/co/122254.htm
温州市宏友铝箔包装材料有限公司的商铺,http://wenzhou0122254.11467.com
东莞市起源包装材料有限公司,http:////www.11467.com/dongguan/co/567401.htm
东莞市起源包装材料有限公司的商铺,http://dongguan0567401.11467.com
汕头市誉城包装材料有限公司,http:////www.11467.com/shantou/co/179750.htm
汕头市誉城包装材料有限公司的商铺,http://shantou0179750.11467.com
厦门群晖盛工贸有限公司,http:////www.11467.com/xiamen/co/40716.htm
厦门群晖盛工贸有限公司的商铺,http://xiamen040716.11467.com
海南南宝塑料制品有限责任公司,http:////www.11467.com/haikou/co/4973.htm
海南南宝塑料制品有限责任公司的商铺,http://haikou04973.11467.com
江苏爱默生新材料有限公司,http:////www.11467.com/yangzhou/co/34648.htm
江苏爱默生新材料有限公司的商铺,http://yangzhou034648.11467.com
仪征市双友土工合成材料有限公司,http:////www.11467.com/yangzhou/co/106787.htm
仪征市双友土工合成材料有限公司的商铺,http://yangzhou0106787.11467.com
温州市木子镭射包装材料有限公司,http:////www.11467.com/baoding/co/91331.htm
温州市木子镭射包装材料有限公司的商铺,http://baoding091331.11467.com
深圳市龙兴环保袋有限公司,http:////www.11467.com/shenzhen/co/726685.htm
深圳市龙兴环保袋有限公司的商铺,http://shenzhen0726685.11467.com
苏州市锦峰胶粘带厂,http:////www.11467.com/suzhou/co/220276.htm
苏州市锦峰胶粘带厂的商铺,http://suzhou0220276.11467.com
苏州市星辰科技有限公司,http:////www.11467.com/suzhou/co/170629.htm
苏州市星辰科技有限公司的商铺,http://suzhou0170629.11467.com
超然塑胶包装制品(深圳)有限公司,http:////www.11467.com/shenzhen/co/810633.htm
超然塑胶包装制品(深圳)有限公司的商铺,http://shenzhen0810633.11467.com
深圳市创信包装材料科技有限公司,http:////www.11467.com/shenzhen/co/565000.htm
深圳市创信包装材料科技有限公司的商铺,http://shenzhen0565000.11467.com
深圳市富艺包装有限公司,http:////www.11467.com/shenzhen/co/578458.htm
深圳市富艺包装有限公司的商铺,http://shenzhen0578458.11467.com
大城县汇通保温建材有限公司,http:////www.11467.com/langfang/co/47615.htm
大城县汇通保温建材有限公司的商铺,http://langfang047615.11467.com
苍南县永兴复合彩印厂,http:////www.11467.com/baoding/co/91171.htm
苍南县永兴复合彩印厂的商铺,http://baoding091171.11467.com
武汉金川包装环保技术有限公司,http:////www.11467.com/wuhan/co/117963.htm
武汉金川包装环保技术有限公司的商铺,http://wuhan0117963.11467.com
肥城鸿运塑料包装制品有限公司,http:////www.11467.com/taian/co/52539.htm
肥城鸿运塑料包装制品有限公司的商铺,http://taian052539.11467.com
烟台成新塑料制品有限公司,http:////www.11467.com/yantai/co/126969.htm
烟台成新塑料制品有限公司的商铺,http://yantai0126969.11467.com
中山市圣涛塑胶纸品有限公司,http:////www.11467.com/zhongshan/co/135899.htm
中山市圣涛塑胶纸品有限公司的商铺,http://zhongshan0135899.11467.com
中山市盈升塑料包装材料有限公司,http:////www.11467.com/zhongshan/co/61543.htm
中山市盈升塑料包装材料有限公司的商铺,http://zhongshan061543.11467.com
上海博怀化工有限公司,http:////www.11467.com/shanghai/co/526971.htm
上海博怀化工有限公司的商铺,http://shanghai0526971.11467.com
武汉市太行冶金材料有限公司,http:////www.11467.com/wuhan/co/74514.htm
武汉市太行冶金材料有限公司的商铺,http://wuhan074514.11467.com
常州盛迪斯塑料有限公司,http:////www.11467.com/changzhou/co/97386.htm
扬州金丰新材料有限公司,http:////www.11467.com/qiye/8289.htm
上海顺科包装制品有限公司,http:////www.11467.com/qiye/8344.htm
昆山维雅诺包装有限公司,http:////www.11467.com/suzhou/co/315751.htm
东莞市石碣广安包装厂,http:////www.11467.com/dongguan/co/304316.htm
合肥格美塑业包装有限公司,http:////www.11467.com/hefei/co/104205.htm
东莞市台茂电子材料有限公司,http:////www.11467.com/dongguan/co/410754.htm
东莞市台茂电子材料有限公司的商铺,http://dongguan0410754.11467.com
大连金诺塑料制品有限公司,http:////www.11467.com/dalian/co/42327.htm
大连金诺塑料制品有限公司的商铺,http://dalian042327.11467.com
德州天利实业有限公司,http:////www.11467.com/dezhou/co/24774.htm
德州天利实业有限公司的商铺,http://dezhou024774.11467.com
佛山市顺德区龙江镇龙山星宝塑料包装材料厂,http:////www.11467.com/foshan/co/213780.htm
佛山市顺德区龙江镇龙山星宝塑料包装材料厂的商铺,http://foshan0213780.11467.com
佛山市禅城区常用塑料包装厂,http:////www.11467.com/foshan/co/213883.htm
佛山市禅城区常用塑料包装厂的商铺,http://foshan0213883.11467.com
江门市维嘉利鞋材有限公司,http:////www.11467.com/jiangmen/co/95315.htm
江门市维嘉利鞋材有限公司的商铺,http://jiangmen095315.11467.com
佛山市三水区粘之宝包装材料有限公司,http:////www.11467.com/foshan/co/213926.htm
佛山市三水区粘之宝包装材料有限公司的商铺,http://foshan0213926.11467.com
福州环宇包装设计印刷有限公司,http:////www.11467.com/fuzhou/co/7196.htm
福州环宇包装设计印刷有限公司的商铺,http://fuzhou07196.11467.com
长沙德美包装材料有限公司,http:////www.11467.com/changsha/co/89303.htm
长沙德美包装材料有限公司的商铺,http://changsha089303.11467.com
东莞市活鹏实业有限公司,http:////www.11467.com/dongguan/co/225050.htm
东莞市活鹏实业有限公司的商铺,http://dongguan0225050.11467.com
佛山市顺德区祥彩塑料制品有限公司,http:////www.11467.com/foshan/co/213768.htm
佛山市顺德区祥彩塑料制品有限公司的商铺,http://foshan0213768.11467.com
东莞市明明包装材料有限公司,http:////www.11467.com/dongguan/co/267067.htm
东莞市明明包装材料有限公司的商铺,http://dongguan0267067.11467.com
李国强,http:////www.11467.com/dongguan/co/556105.htm
李国强的商铺,http://dongguan0556105.11467.com
东莞市联福电子材料厂,http:////www.11467.com/dongguan/co/142405.htm
东莞市联福电子材料厂的商铺,http://dongguan0142405.11467.com
东莞市尖峰塑胶制品有限公司,http:////www.11467.com/dongguan/co/144169.htm
东莞市尖峰塑胶制品有限公司的商铺,http://dongguan0144169.11467.com
广州市冠龙塑胶电器有限公司,http:////www.11467.com/guangzhou/co/243506.htm
广州市冠龙塑胶电器有限公司的商铺,http://guangzhou0243506.11467.com
陈伟华,http:////www.11467.com/jiangmen/co/82728.htm
陈伟华的商铺,http://jiangmen082728.11467.com
湖州南浔心意包装纸加工厂,http:////www.11467.com/huzhou/co/50497.htm
湖州南浔心意包装纸加工厂的商铺,http://huzhou050497.11467.com
杭州光科新型薄膜有限公司,http:////www.11467.com/hangzhou/co/115649.htm
杭州光科新型薄膜有限公司的商铺,http://hangzhou0115649.11467.com
常州迈赫电子科技有限公司,http:////www.11467.com/changzhou/co/100967.htm
常州迈赫电子科技有限公司的商铺,http://changzhou0100967.11467.com
东莞博永塑胶有限公司,http:////www.11467.com/dongguan/co/490049.htm
东莞博永塑胶有限公司的商铺,http://dongguan0490049.11467.com
东莞市利美包装材料有限公司,http:////www.11467.com/dongguan/co/203751.htm
东莞市利美包装材料有限公司的商铺,http://dongguan0203751.11467.com
陈建荣,http:////www.11467.com/dongguan/co/556935.htm
陈建荣的商铺,http://dongguan0556935.11467.com
蚌埠市易达塑料工业有限公司,http:////www.11467.com/bengbu/co/14835.htm
蚌埠市易达塑料工业有限公司的商铺,http://bengbu014835.11467.com
葛磊,http:////www.11467.com/dongguan/co/412167.htm
葛磊的商铺,http://dongguan0412167.11467.com
东莞市方杰塑胶五金制品有限公司,http:////www.11467.com/dongguan/co/261177.htm
东莞市方杰塑胶五金制品有限公司的商铺,http://dongguan0261177.11467.com
东莞市长安志得包装材料加工厂,http:////www.11467.com/dongguan/co/228829.htm
东莞市长安志得包装材料加工厂的商铺,http://dongguan0228829.11467.com
东莞市塘厦博诚塑料制品厂,http:////www.11467.com/dongguan/co/311053.htm
东莞市塘厦博诚塑料制品厂的商铺,http://dongguan0311053.11467.com
沧县杜生镇华强塑料制品厂,http:////www.11467.com/cangzhou/co/42466.htm
沧县杜生镇华强塑料制品厂的商铺,http://cangzhou042466.11467.com
东莞市长安灿辰包装材料制品厂,http:////www.11467.com/dongguan/co/123981.htm
东莞市长安灿辰包装材料制品厂的商铺,http://dongguan0123981.11467.com
东莞市广圣塑胶有限公司,http:////www.11467.com/dongguan/co/209494.htm
东莞市广圣塑胶有限公司的商铺,http://dongguan0209494.11467.com
广东永盛包装材料有限公司,http:////www.11467.com/guangzhou/co/315757.htm
广东永盛包装材料有限公司的商铺,http://guangzhou0315757.11467.com
杭州贝尔胶粘制品有限公司,http:////www.11467.com/hangzhou/co/212665.htm
杭州贝尔胶粘制品有限公司的商铺,http://hangzhou0212665.11467.com
杭州临安天宏电讯材料有限公司,http:////www.11467.com/hangzhou/co/311658.htm
杭州临安天宏电讯材料有限公司的商铺,http://hangzhou0311658.11467.com
杭州萧山万华塑料制品厂,http:////www.11467.com/hangzhou/co/66985.htm
杭州萧山万华塑料制品厂的商铺,http://hangzhou066985.11467.com
冀州市建业电气设备有限公司,http:////www.11467.com/hengshui/co/34762.htm
冀州市建业电气设备有限公司的商铺,http://hengshui034762.11467.com
江门市蓬江区华汉塑料制品厂有限公司,http:////www.11467.com/jiangmen/co/86550.htm
江门市蓬江区华汉塑料制品厂有限公司的商铺,http://jiangmen086550.11467.com
海宁恒嘉塑胶有限公司,http:////www.11467.com/jiaxing/co/123446.htm
海宁恒嘉塑胶有限公司的商铺,http://jiaxing0123446.11467.com
东莞市徽道硅橡胶制品有限公司,http:////www.11467.com/dongguan/co/414199.htm
东莞市徽道硅橡胶制品有限公司的商铺,http://dongguan0414199.11467.com
河北东兴金属制品有限公司,http:////www.11467.com/cangzhou/co/51190.htm
河北东兴金属制品有限公司的商铺,http://cangzhou051190.11467.com
刘萍,http:////www.11467.com/cangzhou/co/67907.htm
刘萍的商铺,http://cangzhou067907.11467.com
东莞市格林印刷有限公司,http:////www.11467.com/dongguan/co/322504.htm
东莞市格林印刷有限公司的商铺,http://dongguan0322504.11467.com
东莞市瀚东特种纸有限公司,http:////www.11467.com/dongguan/co/199653.htm
东莞市瀚东特种纸有限公司的商铺,http://dongguan0199653.11467.com
东莞市桥头宏河包装材料制品厂,http:////www.11467.com/dongguan/co/329472.htm
东莞市桥头宏河包装材料制品厂的商铺,http://dongguan0329472.11467.com
东莞市至臻塑胶制品有限公司,http:////www.11467.com/dongguan/co/532510.htm
东莞市至臻塑胶制品有限公司的商铺,http://dongguan0532510.11467.com
东莞市塘厦康惠包装材料加工厂,http:////www.11467.com/dongguan/co/141656.htm
东莞市塘厦康惠包装材料加工厂的商铺,http://dongguan0141656.11467.com
东莞市振邦包装机械设备有限公司,http:////www.11467.com/dongguan/co/119482.htm
东莞市振邦包装机械设备有限公司的商铺,http://dongguan0119482.11467.com
佛山市南海新兴利合成纤维有限公司,http:////www.11467.com/foshan/co/28864.htm
佛山市南海新兴利合成纤维有限公司的商铺,http://foshan028864.11467.com
亚化科技(东莞）胶粘制品有限公司,http:////www.11467.com/dongguan/co/118059.htm
亚化科技(东莞）胶粘制品有限公司的商铺,http://dongguan0118059.11467.com
东莞市寮步好理想胶片经营部,http:////www.11467.com/dongguan/co/227395.htm
东莞市寮步好理想胶片经营部的商铺,http://dongguan0227395.11467.com
深圳市翔群达电子材料有限公司,http:////www.11467.com/shenzhen/co/282035.htm
深圳市翔群达电子材料有限公司的商铺,http://shenzhen0282035.11467.com
绍兴市越基机电设备有限公司,http:////www.11467.com/shaoxing/co/74155.htm
