东莞市万祥胶粘制品有限公司,http:////www.11467.com/dongguan/co/549635.htm
东莞市万祥胶粘制品有限公司的商铺,http://dongguan0549635.11467.com
东莞市文义包装材料有限公司,http:////www.11467.com/dongguan/co/479295.htm
东莞市文义包装材料有限公司的商铺,http://dongguan0479295.11467.com
东莞市桥头东越胶袋制品厂,http:////www.11467.com/dongguan/co/557171.htm
东莞市桥头东越胶袋制品厂的商铺,http://dongguan0557171.11467.com
东莞市桥头盛杰包装材料制品厂,http:////www.11467.com/dongguan/co/225774.htm
东莞市桥头盛杰包装材料制品厂的商铺,http://dongguan0225774.11467.com
东莞市塘厦德旺包装材料厂,http:////www.11467.com/dongguan/co/260641.htm
东莞市塘厦德旺包装材料厂的商铺,http://dongguan0260641.11467.com
东莞市雄逸实业有限公司,http:////www.11467.com/dongguan/co/411591.htm
东莞市雄逸实业有限公司的商铺,http://dongguan0411591.11467.com
赣州恒大塑料包装工贸有限公司,http:////www.11467.com/ganzhou/co/26556.htm
赣州恒大塑料包装工贸有限公司的商铺,http://ganzhou026556.11467.com
佛山市禅城区南庄联生塑料五金厂,http:////www.11467.com/foshan/co/213899.htm
佛山市禅城区南庄联生塑料五金厂的商铺,http://foshan0213899.11467.com
福建省福州市添旺塑钢带厂,http:////www.11467.com/fuzhou/co/140273.htm
福建省福州市添旺塑钢带厂的商铺,http://fuzhou0140273.11467.com
佛山市顺德区龙江镇耐锢吹膜包装材料厂,http:////www.11467.com/foshan/co/180308.htm
佛山市顺德区龙江镇耐锢吹膜包装材料厂的商铺,http://foshan0180308.11467.com
佛山市顺德区众明环保包装薄膜有限公司,http:////www.11467.com/foshan/co/257451.htm
佛山市顺德区众明环保包装薄膜有限公司的商铺,http://foshan0257451.11467.com
佛山市顺德区伦教志盛胶粘制品厂,http:////www.11467.com/foshan/co/213833.htm
佛山市顺德区伦教志盛胶粘制品厂的商铺,http://foshan0213833.11467.com
健鸿包装材料公司,http:////www.11467.com/foshan/co/213806.htm
健鸿包装材料公司的商铺,http://foshan0213806.11467.com
君记包装袋厂,http:////www.11467.com/foshan/co/213932.htm
君记包装袋厂的商铺,http://foshan0213932.11467.com
佛山京华电子薄膜科技有限公司,http:////www.11467.com/foshan/co/213978.htm
佛山京华电子薄膜科技有限公司的商铺,http://foshan0213978.11467.com
佛山市禅城区桐心聚氨酯制品厂,http:////www.11467.com/foshan/co/213804.htm
佛山市禅城区桐心聚氨酯制品厂的商铺,http://foshan0213804.11467.com
东兴包装材料有限公司（销售部),http:////www.11467.com/foshan/co/214066.htm
东兴包装材料有限公司（销售部)的商铺,http://foshan0214066.11467.com
佛山市南海区大沥颜峰盛丰塑料厂,http:////www.11467.com/foshan/co/213877.htm
佛山市南海区大沥颜峰盛丰塑料厂的商铺,http://foshan0213877.11467.com
佛山市益昌塑胶实业有限公司,http:////www.11467.com/foshan/co/212981.htm
佛山市益昌塑胶实业有限公司的商铺,http://foshan0212981.11467.com
佛山市三水蓝鲸塑料制品有限公司,http:////www.11467.com/foshan/co/213922.htm
佛山市三水蓝鲸塑料制品有限公司的商铺,http://foshan0213922.11467.com
佛山市顺德区汇创兴包装材料有限公司,http:////www.11467.com/foshan/co/213960.htm
佛山市顺德区汇创兴包装材料有限公司的商铺,http://foshan0213960.11467.com
佛山市南海思盼百货商行,http:////www.11467.com/foshan/co/213756.htm
佛山市南海思盼百货商行的商铺,http://foshan0213756.11467.com
佛山市禅城区龙溪卜包装材料加工厂,http:////www.11467.com/foshan/co/213906.htm
佛山市禅城区龙溪卜包装材料加工厂的商铺,http://foshan0213906.11467.com
福州宏利达塑胶有限公司,http:////www.11467.com/fuzhou/co/16406.htm
福州宏利达塑胶有限公司的商铺,http://fuzhou016406.11467.com
佛山美胶贸易有限公司,http:////www.11467.com/foshan/co/213870.htm
佛山美胶贸易有限公司的商铺,http://foshan0213870.11467.com
佛山市顺德区奇毅龙塑料制品有限公司,http:////www.11467.com/foshan/co/213852.htm
佛山市顺德区奇毅龙塑料制品有限公司的商铺,http://foshan0213852.11467.com
广州市白云区龙归南顺包装材料店,http:////www.11467.com/guangzhou/co/496753.htm
广州市白云区龙归南顺包装材料店的商铺,http://guangzhou0496753.11467.com
佛山市富鑫达电子配件有限公司,http:////www.11467.com/foshan/co/340315.htm
佛山市富鑫达电子配件有限公司的商铺,http://foshan0340315.11467.com
东莞市永兴劳保包装实业有限公司,http:////www.11467.com/dongguan/co/329437.htm
东莞市永兴劳保包装实业有限公司的商铺,http://dongguan0329437.11467.com
佛山市顺德区勒流泽邦塑料厂,http:////www.11467.com/foshan/co/342293.htm
佛山市顺德区勒流泽邦塑料厂的商铺,http://foshan0342293.11467.com
佛山市顺德区伦教志盛达胶粘制品厂,http:////www.11467.com/foshan/co/334272.htm
佛山市顺德区伦教志盛达胶粘制品厂的商铺,http://foshan0334272.11467.com
佛山市南海区大沥万德包装材料商行,http:////www.11467.com/foshan/co/355654.htm
佛山市南海区大沥万德包装材料商行的商铺,http://foshan0355654.11467.com
东莞市扬涛包装材料有限公司,http:////www.11467.com/dongguan/co/410463.htm
东莞市扬涛包装材料有限公司的商铺,http://dongguan0410463.11467.com
佛山市禅城区佛霖包装材料营销中心,http:////www.11467.com/foshan/co/180315.htm
佛山市禅城区佛霖包装材料营销中心的商铺,http://foshan0180315.11467.com
广州晖瑞包装材料有限公司,http:////www.11467.com/guangzhou/co/315762.htm
广州晖瑞包装材料有限公司的商铺,http://guangzhou0315762.11467.com
佛山市顺德区容桂艾高泡棉橡胶制品厂,http:////www.11467.com/foshan/co/224680.htm
佛山市顺德区容桂艾高泡棉橡胶制品厂的商铺,http://foshan0224680.11467.com
佛山市顺德区大良智宏塑料厂,http:////www.11467.com/foshan/co/260256.htm
佛山市顺德区大良智宏塑料厂的商铺,http://foshan0260256.11467.com
佛山市华群保温建材有限公司,http:////www.11467.com/foshan/co/335877.htm
佛山市华群保温建材有限公司的商铺,http://foshan0335877.11467.com
佛山市南海显棉包装材料厂,http:////www.11467.com/foshan/co/355743.htm
佛山市南海显棉包装材料厂的商铺,http://foshan0355743.11467.com
佛山市三水区德信诚塑料包装有限公司,http:////www.11467.com/foshan/co/234115.htm
佛山市三水区德信诚塑料包装有限公司的商铺,http://foshan0234115.11467.com
福州纳海水产有限公司,http:////www.11467.com/fuzhou/co/161320.htm
福州纳海水产有限公司的商铺,http://fuzhou0161320.11467.com
佛山市顺德区勒流镇冲鹤均益塑料包装厂,http:////www.11467.com/foshan/co/355890.htm
佛山市顺德区勒流镇冲鹤均益塑料包装厂的商铺,http://foshan0355890.11467.com
广州美洋包装制品有限公司,http:////www.11467.com/guangzhou/co/64086.htm
广州美洋包装制品有限公司的商铺,http://guangzhou064086.11467.com
闽侯县金源发工贸有限公司,http:////www.11467.com/fuzhou/co/71968.htm
闽侯县金源发工贸有限公司的商铺,http://fuzhou071968.11467.com
佛山市南海三圈包装材料有限公司,http:////www.11467.com/foshan/co/214160.htm
佛山市南海三圈包装材料有限公司的商铺,http://foshan0214160.11467.com
佛山市顺德区双钱塑料制品有限公司,http:////www.11467.com/foshan/co/179839.htm
佛山市顺德区双钱塑料制品有限公司的商铺,http://foshan0179839.11467.com
东莞市旗胜胶粘制品有限公司,http:////www.11467.com/dongguan/co/488841.htm
东莞市旗胜胶粘制品有限公司的商铺,http://dongguan0488841.11467.com
佛山市南海区华欣包装材料厂,http:////www.11467.com/foshan/co/305747.htm
佛山市南海区华欣包装材料厂的商铺,http://foshan0305747.11467.com
佛山市科宇橡塑实业有限公司,http:////www.11467.com/foshan/co/345795.htm
佛山市科宇橡塑实业有限公司的商铺,http://foshan0345795.11467.com
东莞市长安新豪胶粘制品厂,http:////www.11467.com/dongguan/co/461681.htm
东莞市长安新豪胶粘制品厂的商铺,http://dongguan0461681.11467.com
东莞市长安翔展塑胶包装制品厂,http:////www.11467.com/dongguan/co/329420.htm
东莞市长安翔展塑胶包装制品厂的商铺,http://dongguan0329420.11467.com
佛山市南海小塘新景塑料厂,http:////www.11467.com/foshan/co/260349.htm
佛山市南海小塘新景塑料厂的商铺,http://foshan0260349.11467.com
佛山市诚美鞋材有限公司,http:////www.11467.com/foshan/co/235157.htm
佛山市诚美鞋材有限公司的商铺,http://foshan0235157.11467.com
佛山市顺德区大良文昌包装材料有限公司,http:////www.11467.com/foshan/co/260374.htm
佛山市顺德区大良文昌包装材料有限公司的商铺,http://foshan0260374.11467.com
佛山市顺德区嘉美德包装制品有限公司,http:////www.11467.com/foshan/co/351019.htm
佛山市顺德区嘉美德包装制品有限公司的商铺,http://foshan0351019.11467.com
佛山市顺德区锦莠包装制品有限公司,http:////www.11467.com/foshan/co/340943.htm
佛山市顺德区锦莠包装制品有限公司的商铺,http://foshan0340943.11467.com
广州市正优包装材料制品有限公司,http:////www.11467.com/guangzhou/co/24283.htm
广州市正优包装材料制品有限公司的商铺,http://guangzhou024283.11467.com
淮安市楚州区甲一泡沫包装厂,http:////www.11467.com/huaian/co/38270.htm
淮安市楚州区甲一泡沫包装厂的商铺,http://huaian038270.11467.com
惠州市平行线塑胶包装材料有限公司,http:////www.11467.com/huizhou/co/68181.htm
惠州市平行线塑胶包装材料有限公司的商铺,http://huizhou068181.11467.com
港惠塑胶制品（惠州）有限公司,http:////www.11467.com/huizhou/co/73804.htm
港惠塑胶制品（惠州）有限公司的商铺,http://huizhou073804.11467.com
黄山市华意塑料印刷有限公司,http:////www.11467.com/huangshan/co/7378.htm
黄山市华意塑料印刷有限公司的商铺,http://huangshan07378.11467.com
合肥捷诚包装制品有限公司,http:////www.11467.com/hefei/co/88961.htm
合肥捷诚包装制品有限公司的商铺,http://hefei088961.11467.com
杭州鹏发泡沫包装有限公司合肥分公司,http:////www.11467.com/hefei/co/94176.htm
杭州鹏发泡沫包装有限公司合肥分公司的商铺,http://hefei094176.11467.com
广东惠州祥瑞包装材料有限公司,http:////www.11467.com/huizhou/co/58881.htm
广东惠州祥瑞包装材料有限公司的商铺,http://huizhou058881.11467.com
惠州市惠城区鸿发胶袋加工厂,http:////www.11467.com/huizhou/co/73793.htm
惠州市惠城区鸿发胶袋加工厂的商铺,http://huizhou073793.11467.com
江门市晨佳铝塑包装制品有限公司,http:////www.11467.com/jiangmen/co/86552.htm
江门市晨佳铝塑包装制品有限公司的商铺,http://jiangmen086552.11467.com
湖州南浔顺发海绵厂,http:////www.11467.com/huzhou/co/51652.htm
湖州南浔顺发海绵厂的商铺,http://huzhou051652.11467.com
惠州市文辉包装材料有限公司,http:////www.11467.com/huizhou/co/8440.htm
惠州市文辉包装材料有限公司的商铺,http://huizhou08440.11467.com
广州正园包装制品有限公司,http:////www.11467.com/guangzhou/co/210279.htm
广州正园包装制品有限公司的商铺,http://guangzhou0210279.11467.com
广州市白云区黄石行远包装商行,http:////www.11467.com/guangzhou/co/105051.htm
广州市白云区黄石行远包装商行的商铺,http://guangzhou0105051.11467.com
惠州市远恩包装制品有限公司,http:////www.11467.com/huizhou/co/98615.htm
惠州市远恩包装制品有限公司的商铺,http://huizhou098615.11467.com
广州铭商展示用品有限公司,http:////www.11467.com/guangzhou/co/211721.htm
广州铭商展示用品有限公司的商铺,http://guangzhou0211721.11467.com
广州市海珠区欧星五金商行,http:////www.11467.com/guangzhou/co/495589.htm
广州市海珠区欧星五金商行的商铺,http://guangzhou0495589.11467.com
广州源远包装材料有限公司,http:////www.11467.com/guangzhou/co/123069.htm
广州源远包装材料有限公司的商铺,http://guangzhou0123069.11467.com
临安华昊铝箔有限公司,http:////www.11467.com/hangzhou/co/349967.htm
临安华昊铝箔有限公司的商铺,http://hangzhou0349967.11467.com
杭州巨龙包装有限公司,http:////www.11467.com/hangzhou/co/206305.htm
杭州巨龙包装有限公司的商铺,http://hangzhou0206305.11467.com
广州市建琪贸易有限公司,http:////www.11467.com/guangzhou/co/246158.htm
广州市建琪贸易有限公司的商铺,http://guangzhou0246158.11467.com
广州市番禺新达塑料包装制品厂,http:////www.11467.com/guangzhou/co/212191.htm
广州市番禺新达塑料包装制品厂的商铺,http://guangzhou0212191.11467.com
广州市荔湾区艳龙通讯器材商行,http:////www.11467.com/guangzhou/co/238772.htm
广州市荔湾区艳龙通讯器材商行的商铺,http://guangzhou0238772.11467.com
广州邦华塑料有限公司,http:////www.11467.com/guangzhou/co/495096.htm
广州邦华塑料有限公司的商铺,http://guangzhou0495096.11467.com
广州市白云区鑫宏源塑料五金制品厂,http:////www.11467.com/guangzhou/co/491477.htm
广州市白云区鑫宏源塑料五金制品厂的商铺,http://guangzhou0491477.11467.com
广州市康唯包装材料有限公司,http:////www.11467.com/guangzhou/co/207761.htm
广州市康唯包装材料有限公司的商铺,http://guangzhou0207761.11467.com
广州市荔湾区玉成纸品包装厂,http:////www.11467.com/guangzhou/co/496441.htm
广州市荔湾区玉成纸品包装厂的商铺,http://guangzhou0496441.11467.com
广州粤飞包装制品有限公司,http:////www.11467.com/guangzhou/co/268406.htm
广州粤飞包装制品有限公司的商铺,http://guangzhou0268406.11467.com
广州市山孚化工有限公司,http:////www.11467.com/guangzhou/co/210543.htm
广州市山孚化工有限公司的商铺,http://guangzhou0210543.11467.com
杭州艮山电线有限公司,http:////www.11467.com/hangzhou/co/263413.htm
杭州艮山电线有限公司的商铺,http://hangzhou0263413.11467.com
杭州路遥包装材料有限公司,http:////www.11467.com/hangzhou/co/252908.htm
杭州路遥包装材料有限公司的商铺,http://hangzhou0252908.11467.com
杭州亚设清洁用品有限公司,http:////www.11467.com/hangzhou/co/368438.htm
杭州亚设清洁用品有限公司的商铺,http://hangzhou0368438.11467.com
杭州日胜包装有限公司,http:////www.11467.com/hangzhou/co/390924.htm
杭州日胜包装有限公司的商铺,http://hangzhou0390924.11467.com
鹤山市沙坪镇杰洲顺发塑料五金厂,http:////www.11467.com/hebi/co/12740.htm
鹤山市沙坪镇杰洲顺发塑料五金厂的商铺,http://hebi012740.11467.com
桐庐县分水镇喜乐文具厂,http:////www.11467.com/hangzhou/co/349202.htm
桐庐县分水镇喜乐文具厂的商铺,http://hangzhou0349202.11467.com
杭州广谊包装材料有限公司,http:////www.11467.com/hangzhou/co/253942.htm
杭州广谊包装材料有限公司的商铺,http://hangzhou0253942.11467.com
杭州华飞包装材料有限公司,http:////www.11467.com/hangzhou/co/237224.htm
杭州华飞包装材料有限公司的商铺,http://hangzhou0237224.11467.com
杭州晨利纸塑制品有限公司,http:////www.11467.com/hangzhou/co/252358.htm
杭州晨利纸塑制品有限公司的商铺,http://hangzhou0252358.11467.com
富阳恒毅塑业有限公司,http:////www.11467.com/hangzhou/co/272851.htm
富阳恒毅塑业有限公司的商铺,http://hangzhou0272851.11467.com
广州永翔消防设备有限公司,http:////www.11467.com/guangzhou/co/307799.htm
广州永翔消防设备有限公司的商铺,http://guangzhou0307799.11467.com
广州时尚包装材料有限公司,http:////www.11467.com/guangzhou/co/468448.htm
广州时尚包装材料有限公司的商铺,http://guangzhou0468448.11467.com
广州伟荣橡胶制品有限公司,http:////www.11467.com/guangzhou/co/210530.htm
广州伟荣橡胶制品有限公司的商铺,http://guangzhou0210530.11467.com
广州熙沵电子科技有限公司,http:////www.11467.com/guangzhou/co/467184.htm
广州熙沵电子科技有限公司的商铺,http://guangzhou0467184.11467.com
广州市益兴塑胶制品有限公司,http:////www.11467.com/guangzhou/co/266727.htm
广州市益兴塑胶制品有限公司的商铺,http://guangzhou0266727.11467.com
广州剑兴滚塑科技有限公司,http:////www.11467.com/guangzhou/co/469797.htm
广州剑兴滚塑科技有限公司的商铺,http://guangzhou0469797.11467.com
广州市成兴包装材料有限公司,http:////www.11467.com/guangzhou/co/429062.htm
广州市成兴包装材料有限公司的商铺,http://guangzhou0429062.11467.com
广州市海珠区彩宝塑料包装制品厂,http:////www.11467.com/guangzhou/co/220614.htm
广州市海珠区彩宝塑料包装制品厂的商铺,http://guangzhou0220614.11467.com
惠州市惠城区诠欣包装材料经营部,http:////www.11467.com/huizhou/co/23789.htm
惠州市惠城区诠欣包装材料经营部的商铺,http://huizhou023789.11467.com
冀州市乐缘塑料制品经销处,http:////www.11467.com/hengshui/co/42725.htm
冀州市乐缘塑料制品经销处的商铺,http://hengshui042725.11467.com
惠州市美利精密部件有限公司,http:////www.11467.com/huizhou/co/68016.htm
惠州市美利精密部件有限公司的商铺,http://huizhou068016.11467.com
嘉兴市维祥塑料包装有限公司,http:////www.11467.com/jiaxing/co/963.htm
嘉兴市维祥塑料包装有限公司的商铺,http://jiaxing0963.11467.com
嘉兴市南湖区华亿塑料厂,http:////www.11467.com/jiaxing/co/84217.htm
嘉兴市南湖区华亿塑料厂的商铺,http://jiaxing084217.11467.com
嘉兴市林氏塑胶板业有限公司,http:////www.11467.com/jiaxing/co/4059.htm
嘉兴市林氏塑胶板业有限公司的商铺,http://jiaxing04059.11467.com
廊坊中本包装有限公司,http:////www.11467.com/langfang/co/4060.htm
廊坊中本包装有限公司的商铺,http://langfang04060.11467.com
连云港市金恒塑料包装有限公司,http:////www.11467.com/lianyungang/co/27601.htm
连云港市金恒塑料包装有限公司的商铺,http://lianyungang027601.11467.com
河东蘢盛塑业,http:////www.11467.com/linyi/co/66300.htm
河东蘢盛塑业的商铺,http://linyi066300.11467.com
山东临沂宏伟塑胶制品有限公司,http:////www.11467.com/linyi/co/59023.htm
山东临沂宏伟塑胶制品有限公司的商铺,http://linyi059023.11467.com
临沂市正行塑料包装厂,http:////www.11467.com/linyi/co/59067.htm
临沂市正行塑料包装厂的商铺,http://linyi059067.11467.com
云南锐拓保温材料有限公司,http:////www.11467.com/kunming/co/103933.htm
云南锐拓保温材料有限公司的商铺,http://kunming0103933.11467.com
廊坊开发区祥云塑胶包装制品有限公司,http:////www.11467.com/langfang/co/29970.htm
廊坊开发区祥云塑胶包装制品有限公司的商铺,http://langfang029970.11467.com
廊坊市响当当塑料包装制品有限公司,http:////www.11467.com/langfang/co/29996.htm
廊坊市响当当塑料包装制品有限公司的商铺,http://langfang029996.11467.com
江门市新会区双水宏达包装材料行,http:////www.11467.com/jiangmen/co/86549.htm
江门市新会区双水宏达包装材料行的商铺,http://jiangmen086549.11467.com
江门市江海区外海振兴塑料制品厂,http:////www.11467.com/jiangmen/co/86523.htm
江门市江海区外海振兴塑料制品厂的商铺,http://jiangmen086523.11467.com
江门市蓬江区盈昌包装材料厂,http:////www.11467.com/jiangmen/co/89341.htm
江门市蓬江区盈昌包装材料厂的商铺,http://jiangmen089341.11467.com
江门市新会区司前锐昌胶盒包装厂,http:////www.11467.com/jiangmen/co/95325.htm
江门市新会区司前锐昌胶盒包装厂的商铺,http://jiangmen095325.11467.com
嘉兴丰菱塑料制品有限公司,http:////www.11467.com/jiaxing/co/4523.htm
嘉兴丰菱塑料制品有限公司的商铺,http://jiaxing04523.11467.com
揭阳试验区龙强塑料制品厂,http:////www.11467.com/jieyang/co/22973.htm
揭阳试验区龙强塑料制品厂的商铺,http://jieyang022973.11467.com
揭阳市东山区四福塑料有限公司,http:////www.11467.com/jieyang/co/10329.htm
揭阳市东山区四福塑料有限公司的商铺,http://jieyang010329.11467.com
金华市富顺工艺品厂,http:////www.11467.com/jinhua/co/77642.htm
金华市富顺工艺品厂的商铺,http://jinhua077642.11467.com
金华市华泰塑料化工有限公司,http:////www.11467.com/jinhua/co/1715.htm
金华市华泰塑料化工有限公司的商铺,http://jinhua01715.11467.com
金华市金龙塑料包装厂,http:////www.11467.com/jinhua/co/1194.htm
金华市金龙塑料包装厂的商铺,http://jinhua01194.11467.com
朱言美（个体经营）,http:////www.11467.com/jinhua/co/72021.htm
朱言美（个体经营）的商铺,http://jinhua072021.11467.com
兴心日用品厂,http:////www.11467.com/jinhua/co/72051.htm
兴心日用品厂的商铺,http://jinhua072051.11467.com
浙江浦江小汪二手吨袋公司,http:////www.11467.com/jinhua/co/77659.htm
浙江浦江小汪二手吨袋公司的商铺,http://jinhua077659.11467.com
义乌市伟杰塑料挂钩塑料袜钩塑料提手制品厂,http:////www.11467.com/jinhua/co/72035.htm
义乌市伟杰塑料挂钩塑料袜钩塑料提手制品厂的商铺,http://jinhua072035.11467.com
昆明市五华区骏聪科技经营部,http:////www.11467.com/kunming/co/109384.htm
昆明市五华区骏聪科技经营部的商铺,http://kunming0109384.11467.com
王小魁(个体经营),http:////www.11467.com/linyi/co/59087.htm
王小魁(个体经营)的商铺,http://linyi059087.11467.com
洛阳市洛龙区关林许辉土杂商店,http:////www.11467.com/luoyang/co/49263.htm
洛阳市洛龙区关林许辉土杂商店的商铺,http://luoyang049263.11467.com
南昌煌金实业有限公司,http:////www.11467.com/nanchang/co/87095.htm
南昌煌金实业有限公司的商铺,http://nanchang087095.11467.com
南昌金利运通实业有限公司,http:////www.11467.com/nanchang/co/44879.htm
南昌金利运通实业有限公司的商铺,http://nanchang044879.11467.com
南昌集美教学设备有限公司,http:////www.11467.com/nanchang/co/87107.htm
南昌集美教学设备有限公司的商铺,http://nanchang087107.11467.com
聊城汇福元保温材料有限公司,http:////www.11467.com/liaocheng/co/29080.htm
聊城汇福元保温材料有限公司的商铺,http://liaocheng029080.11467.com
文安县翔云模具塑料有限公司,http:////www.11467.com/kunming/co/103958.htm
文安县翔云模具塑料有限公司的商铺,http://kunming0103958.11467.com
廊坊松峰保温材料有限公司,http:////www.11467.com/langfang/co/49241.htm
廊坊松峰保温材料有限公司的商铺,http://langfang049241.11467.com
柳江县雄丰塑料包装袋厂,http:////www.11467.com/liuzhou/co/39665.htm
柳江县雄丰塑料包装袋厂的商铺,http://liuzhou039665.11467.com
连云港市连升包装有限公司,http:////www.11467.com/lianyungang/co/28737.htm
连云港市连升包装有限公司的商铺,http://lianyungang028737.11467.com
深圳市致新包装有限公司,http:////www.11467.com/jiangmen/co/88692.htm
深圳市致新包装有限公司的商铺,http://jiangmen088692.11467.com
江门市蓬江区华景塑料厂,http:////www.11467.com/jiangmen/co/86546.htm
江门市蓬江区华景塑料厂的商铺,http://jiangmen086546.11467.com
江门市江海区荣丰吸塑包装厂,http:////www.11467.com/jiangmen/co/86525.htm
江门市江海区荣丰吸塑包装厂的商铺,http://jiangmen086525.11467.com
临沂市圣鑫塑料包装材料有限公司,http:////www.11467.com/linyi/co/59054.htm
临沂市圣鑫塑料包装材料有限公司的商铺,http://linyi059054.11467.com
嘉善振宇电子有限公司,http:////www.11467.com/jiaxing/co/67505.htm
嘉善振宇电子有限公司的商铺,http://jiaxing067505.11467.com
廊坊富尔达化工建材有限公司,http:////www.11467.com/langfang/co/35648.htm
廊坊富尔达化工建材有限公司的商铺,http://langfang035648.11467.com
大城县华强保温材料有限公司,http:////www.11467.com/langfang/co/42834.htm
大城县华强保温材料有限公司的商铺,http://langfang042834.11467.com
柳州市辰奥保温耐火材料有限公司,http:////www.11467.com/liuzhou/co/47508.htm
柳州市辰奥保温耐火材料有限公司的商铺,http://liuzhou047508.11467.com
洛阳康兰包装有限公司,http:////www.11467.com/luoyang/co/46169.htm
洛阳康兰包装有限公司的商铺,http://luoyang046169.11467.com
茂名市茂南丰收塑料薄膜厂,http:////www.11467.com/maoming/co/31252.htm
茂名市茂南丰收塑料薄膜厂的商铺,http://maoming031252.11467.com
深圳市华新联包装材料有限公司,http:////www.11467.com/jiaxing/co/122823.htm
深圳市华新联包装材料有限公司的商铺,http://jiaxing0122823.11467.com
连云港鼎伦包装有限公司,http:////www.11467.com/lianyungang/co/33015.htm
连云港鼎伦包装有限公司的商铺,http://lianyungang033015.11467.com
临沂市华塑包装制品有限公司,http:////www.11467.com/linyi/co/86704.htm
临沂市华塑包装制品有限公司的商铺,http://linyi086704.11467.com
海宁市杭和包装有限公司,http:////www.11467.com/jiaxing/co/134904.htm
