昆山科索德电子有限公司,http:////www.11467.com/suzhou/co/382202.htm
昆山科索德电子有限公司的商铺,http://suzhou0382202.11467.com
青岛惠天防锈有限公司,http:////www.11467.com/qingdao/co/124154.htm
青岛惠天防锈有限公司的商铺,http://qingdao0124154.11467.com
佛山市顺德区东翊新材料有限公司,http:////www.11467.com/foshan/co/382043.htm
南京荣泰文化传播有限公司,http:////www.11467.com/nanjing/co/66582.htm
深圳市强辉科技有限公司,http:////www.11467.com/shenzhen/co/58227.htm
深圳市强辉科技有限公司的商铺,http://shenzhen058227.11467.com
合肥中丽包装材料有限公司,http:////www.11467.com/hefei/co/164738.htm
合肥中丽包装材料有限公司的商铺,http://hefei0164738.11467.com
威海昊天包装有限公司,http:////www.11467.com/weihai/co/36192.htm
威海昊天包装有限公司的商铺,http://weihai036192.11467.com
东莞市中堂春隆包装材料制品厂,http:////www.11467.com/dongguan/co/482876.htm
东莞市中堂春隆包装材料制品厂的商铺,http://dongguan0482876.11467.com
深圳市晶辉包装材料有限公司,http:////www.11467.com/shenzhen/co/813099.htm
深圳市晶辉包装材料有限公司的商铺,http://shenzhen0813099.11467.com
云南古柏气囊科技股份有限公司,http:////www.11467.com/qujing/co/18913.htm
云南古柏气囊科技股份有限公司的商铺,http://qujing018913.11467.com
陕西惠鑫塑料包装有限公司,http:////www.11467.com/xian/co/95519.htm
陕西惠鑫塑料包装有限公司的商铺,http://xian095519.11467.com
江门市溢采包装制品有限公司,http:////www.11467.com/jiangmen/co/103112.htm
江门市溢采包装制品有限公司的商铺,http://jiangmen0103112.11467.com
雄县东达塑料包装有限公司,http:////www.11467.com/baoding/co/57102.htm
雄县东达塑料包装有限公司的商铺,http://baoding057102.11467.com
博兴县陈户镇华滨塑料厂,http:////www.11467.com/binzhou/co/19654.htm
博兴县陈户镇华滨塑料厂的商铺,http://binzhou019654.11467.com
保定市久旺塑业包装有限公司,http:////www.11467.com/baoding/co/56606.htm
保定市久旺塑业包装有限公司的商铺,http://baoding056606.11467.com
嘉峪关市宏源塑化有限公司,http:////www.11467.com/jiayuguan/co/1702.htm
嘉峪关市宏源塑化有限公司的商铺,http://jiayuguan01702.11467.com
肇庆利达包装材料厂有限公司,http:////www.11467.com/zhaoqing/co/31215.htm
肇庆利达包装材料厂有限公司的商铺,http://zhaoqing031215.11467.com
广州市惠明包装制品厂,http:////www.11467.com/guangzhou/co/432724.htm
广州市惠明包装制品厂的商铺,http://guangzhou0432724.11467.com
江阴市兴事达包装材料厂,http:////www.11467.com/wuxi/co/243575.htm
江阴市兴事达包装材料厂的商铺,http://wuxi0243575.11467.com
安庆市龙意塑业有限公司,http:////www.11467.com/anqing/co/24676.htm
安庆市龙意塑业有限公司的商铺,http://anqing024676.11467.com
平阳县瑞祥包装厂,http:////www.11467.com/jingzhou/co/26563.htm
平阳县瑞祥包装厂的商铺,http://jingzhou026563.11467.com
中山市中粤塑料制品有限公司,http:////www.11467.com/zhongshan/co/61408.htm
中山市中粤塑料制品有限公司的商铺,http://zhongshan061408.11467.com
天津聚联仓储设备有限公司,http:////www.11467.com/tianjin/co/191131.htm
天津聚联仓储设备有限公司的商铺,http://tianjin0191131.11467.com
东莞市三焱电子有限公司,http:////www.11467.com/dongguan/co/557497.htm
东莞市三焱电子有限公司的商铺,http://dongguan0557497.11467.com
郴州市翔华纸业有限公司,http:////www.11467.com/chenzhou/co/19046.htm
郴州市翔华纸业有限公司的商铺,http://chenzhou019046.11467.com
东莞市富兴包装材料有限公司,http:////www.11467.com/dongguan/co/417237.htm
东莞市富兴包装材料有限公司的商铺,http://dongguan0417237.11467.com
鼎泰（黄海）塑料包装材料有限公司威海办事处,http:////www.11467.com/weihai/co/36212.htm
鼎泰（黄海）塑料包装材料有限公司威海办事处的商铺,http://weihai036212.11467.com
东莞市虎门韩中胶粘带制品厂,http:////www.11467.com/dongguan/co/329503.htm
东莞市虎门韩中胶粘带制品厂的商铺,http://dongguan0329503.11467.com
东莞市嘉创包装机械有限公司,http:////www.11467.com/dongguan/co/415492.htm
东莞市嘉创包装机械有限公司的商铺,http://dongguan0415492.11467.com
江门市新会区瑞丰包装材料有限公司,http:////www.11467.com/jiangmen/co/132332.htm
江门市新会区瑞丰包装材料有限公司的商铺,http://jiangmen0132332.11467.com
杭州泽霖包装科技有限公司,http:////www.11467.com/hangzhou/co/368877.htm
杭州泽霖包装科技有限公司的商铺,http://hangzhou0368877.11467.com
厦门峰百塑胶有限公司,http:////www.11467.com/xiamen/co/85446.htm
厦门峰百塑胶有限公司的商铺,http://xiamen085446.11467.com
王志辉,http:////www.11467.com/shijiazhuang/co/161378.htm
王志辉的商铺,http://shijiazhuang0161378.11467.com
廊坊百利特保温建材有限公司,http:////www.11467.com/langfang/co/41398.htm
廊坊百利特保温建材有限公司的商铺,http://langfang041398.11467.com
上海吴敏包装材料有限公司,http:////www.11467.com/shanghai/co/426588.htm
上海吴敏包装材料有限公司的商铺,http://shanghai0426588.11467.com
新乡市运启膜结构有限公司,http:////www.11467.com/xinxiang/co/30014.htm
新乡市运启膜结构有限公司的商铺,http://xinxiang030014.11467.com
东莞市钜益吸塑制品有限公司,http:////www.11467.com/dongguan/co/494636.htm
东莞市钜益吸塑制品有限公司的商铺,http://dongguan0494636.11467.com
东莞市朋盈包装材料有限公司,http:////www.11467.com/dongguan/co/199692.htm
东莞市朋盈包装材料有限公司的商铺,http://dongguan0199692.11467.com
郓城县洪军包装销售中心,http:////www.11467.com/heze/co/43021.htm
郓城县洪军包装销售中心的商铺,http://heze043021.11467.com
武汉力胜兴包装材料有限公司,http:////www.11467.com/wuhan/co/117773.htm
武汉力胜兴包装材料有限公司的商铺,http://wuhan0117773.11467.com
东莞市虹昌包装制品有限公司,http:////www.11467.com/dongguan/co/642376.htm
东莞市虹昌包装制品有限公司的商铺,http://dongguan0642376.11467.com
深圳市品创源实业有限公司,http:////www.11467.com/shenzhen/co/42179.htm
深圳市品创源实业有限公司的商铺,http://shenzhen042179.11467.com
中山市创胜包装材料有限公司,http:////www.11467.com/zhongshan/co/146713.htm
中山市创胜包装材料有限公司的商铺,http://zhongshan0146713.11467.com
青岛恒信塑胶有限公司,http:////www.11467.com/qingdao/co/15478.htm
青岛恒信塑胶有限公司的商铺,http://qingdao015478.11467.com
海盐永大包装材料有限公司,http:////www.11467.com/jiaxing/co/135084.htm
海盐永大包装材料有限公司的商铺,http://jiaxing0135084.11467.com
公司业务销售部,http:////www.11467.com/foshan/co/356316.htm
公司业务销售部的商铺,http://foshan0356316.11467.com
广州恒格塑料制品有限公司,http:////www.11467.com/guangzhou/co/229852.htm
广州恒格塑料制品有限公司的商铺,http://guangzhou0229852.11467.com
东莞市捷鸿包装制品有限公司,http:////www.11467.com/dongguan/co/488435.htm
东莞市捷鸿包装制品有限公司的商铺,http://dongguan0488435.11467.com
怀宁县舒雅棕床垫织造厂,http:////www.11467.com/anqing/co/39558.htm
怀宁县舒雅棕床垫织造厂的商铺,http://anqing039558.11467.com
山东省天惠保温材料有限公司,http:////www.11467.com/dezhou/co/33896.htm
山东省天惠保温材料有限公司的商铺,http://dezhou033896.11467.com
绍兴县海盛镀铝有限公司,http:////www.11467.com/shaoxing/co/77794.htm
深圳市汇多宝实业有限公司,http:////www.11467.com/shenzhen/co/577788.htm
建德市伟东塑料薄膜厂,http:////www.11467.com/hangzhou/co/394436.htm
冠县创新印务有限公司,http:////www.11467.com/liaocheng/co/63284.htm
佛山市南海广一塑薄膜有限公司,http:////www.11467.com/foshan/co/382044.htm
佛山市南海广一塑薄膜有限公司的商铺,http://foshan0382044.11467.com
重庆祥鸿包装材料有限公司,http:////www.11467.com/chongqing/co/277047.htm
重庆祥鸿包装材料有限公司的商铺,http://chongqing0277047.11467.com
庆云县颐福祥塑料制品有限公司,http:////www.11467.com/dezhou/co/72449.htm
庆云县颐福祥塑料制品有限公司的商铺,http://dezhou072449.11467.com
江苏英特派奇包装制品有限公司,http:////www.11467.com/wuxi/co/252667.htm
江苏英特派奇包装制品有限公司的商铺,http://wuxi0252667.11467.com
上海明鹿医化设备有限公司,http:////www.11467.com/neijiang/co/19026.htm
上海明鹿医化设备有限公司的商铺,http://neijiang019026.11467.com
梅州市梅江区金耀包装材料商行,http:////www.11467.com/meizhou/co/23333.htm
梅州市梅江区金耀包装材料商行的商铺,http://meizhou023333.11467.com
金河博塑料制品有限公司,http:////www.11467.com/nanyang/co/30892.htm
金河博塑料制品有限公司的商铺,http://nanyang030892.11467.com
荆州市华泰塑业有限公司,http:////www.11467.com/jingzhou/co/26564.htm
荆州市华泰塑业有限公司的商铺,http://jingzhou026564.11467.com
山东省庆云华威塑料制品有限公司,http:////www.11467.com/lincang/co/6974.htm
山东省庆云华威塑料制品有限公司的商铺,http://lincang06974.11467.com
濮阳绿寰宇化工有限公司,http:////www.11467.com/puyang/co/20199.htm
濮阳绿寰宇化工有限公司的商铺,http://puyang020199.11467.com
秦皇岛茂隆商贸有限公司,http:////www.11467.com/qinhuangdao/co/36271.htm
秦皇岛茂隆商贸有限公司的商铺,http://qinhuangdao036271.11467.com
衢州盛歌贸易有限公司,http:////www.11467.com/quzhou/co/22753.htm
衢州盛歌贸易有限公司的商铺,http://quzhou022753.11467.com
咸阳荣盛电子材料有限公司,http:////www.11467.com/xianyang/co/21477.htm
咸阳荣盛电子材料有限公司的商铺,http://xianyang021477.11467.com
营口经济技术开发区和合塑料制品有限公司,http:////www.11467.com/yingkou/co/42808.htm
营口经济技术开发区和合塑料制品有限公司的商铺,http://yingkou042808.11467.com
岳阳市岳阳楼区洞庭泡沫包装厂,http:////www.11467.com/yueyang/co/32208.htm
岳阳市岳阳楼区洞庭泡沫包装厂的商铺,http://yueyang032208.11467.com
枣庄市薛城区东润包装材料有限公司,http:////www.11467.com/zaozhuang/co/27971.htm
枣庄市薛城区东润包装材料有限公司的商铺,http://zaozhuang027971.11467.com
新余市天宇胶袋制品有限公司,http:////www.11467.com/xinyu/co/6450.htm
新余市天宇胶袋制品有限公司的商铺,http://xinyu06450.11467.com
昌黎县海山泡沫制品有限公司,http:////www.11467.com/qinhuangdao/co/36269.htm
昌黎县海山泡沫制品有限公司的商铺,http://qinhuangdao036269.11467.com
济宁市吉泰工贸有限公司,http:////www.11467.com/jining/co/57135.htm
济宁市吉泰工贸有限公司的商铺,http://jining057135.11467.com
中山市通泽塑料制品有限公司,http:////www.11467.com/zhongshan/co/228949.htm
中山市通泽塑料制品有限公司的商铺,http://zhongshan0228949.11467.com
舟山新利达塑料制品有限公司,http:////www.11467.com/zhoushan/co/17407.htm
舟山新利达塑料制品有限公司的商铺,http://zhoushan017407.11467.com
苏州绿斯达新材料科技有限公司,http:////www.11467.com/suzhou/co/317646.htm
苏州绿斯达新材料科技有限公司的商铺,http://suzhou0317646.11467.com
四川省安岳县红楼塑料厂,http:////www.11467.com/ziyang/co/2500.htm
四川省安岳县红楼塑料厂的商铺,http://ziyang02500.11467.com
东莞市鸿伟包装材料有限公司,http:////www.11467.com/dongguan/co/601160.htm
东莞市鸿伟包装材料有限公司的商铺,http://dongguan0601160.11467.com
佛山市溢通包装制品有限公司,http:////www.11467.com/foshan/co/382037.htm
佛山市溢通包装制品有限公司的商铺,http://foshan0382037.11467.com
宿迁市铨心橡塑制品有限公司,http:////www.11467.com/suqian/co/10814.htm
宿迁市铨心橡塑制品有限公司的商铺,http://suqian010814.11467.com
北京金江鑫海科技能源有限公司,http:////www.11467.com/beijing/co/763402.htm
北京金江鑫海科技能源有限公司的商铺,http://beijing0763402.11467.com
双峰县恒正泡沫制品有限公司,http:////www.11467.com/loudi/co/30714.htm
双峰县恒正泡沫制品有限公司的商铺,http://loudi030714.11467.com
浙江天龙塑业有限公司,http:////www.11467.com/lishui/co/24913.htm
浙江天龙塑业有限公司的商铺,http://lishui024913.11467.com
萍乡市环众包装有限公司,http:////www.11467.com/pingxiang/co/15295.htm
萍乡市环众包装有限公司的商铺,http://pingxiang015295.11467.com
苏州绿斯达科技有限公司,http:////www.11467.com/suzhou/co/357667.htm
苏州绿斯达科技有限公司的商铺,http://suzhou0357667.11467.com
武汉邦立包装制品有限公司,http:////www.11467.com/wuhan/co/149699.htm
武汉邦立包装制品有限公司的商铺,http://wuhan0149699.11467.com
陕西嘉腾塑业有限公司,http:////www.11467.com/xianyang/co/28724.htm
陕西嘉腾塑业有限公司的商铺,http://xianyang028724.11467.com
吴江市神州制塑有限公司,http:////www.11467.com/suzhou/co/357167.htm
吴江市神州制塑有限公司的商铺,http://suzhou0357167.11467.com
廊坊美昌保温材料有限公司,http:////www.11467.com/langfang/co/44126.htm
廊坊美昌保温材料有限公司的商铺,http://langfang044126.11467.com
博兴县锦秋办事处喜丰遮蔽膜厂,http:////www.11467.com/lvliang/co/29442.htm
博兴县锦秋办事处喜丰遮蔽膜厂的商铺,http://lvliang029442.11467.com
宿迁鑫程包装有限公司,http:////www.11467.com/suqian/co/10816.htm
宿迁鑫程包装有限公司的商铺,http://suqian010816.11467.com
昆山金品源精密电子有限公司,http:////www.11467.com/suzhou/co/356964.htm
昆山金品源精密电子有限公司的商铺,http://suzhou0356964.11467.com
深圳市万达杰塑料制品有限公司,http:////www.11467.com/shenzhen/co/277708.htm
深圳市万达杰塑料制品有限公司的商铺,http://shenzhen0277708.11467.com
安徽聚美生物科技有限公司,http:////www.11467.com/wuhu/co/32995.htm
安徽聚美生物科技有限公司的商铺,http://wuhu032995.11467.com
西安亚创电子科技有限公司,http:////www.11467.com/xian/co/128029.htm
西安亚创电子科技有限公司的商铺,http://xian0128029.11467.com
中山联发塑料机械有限公司,http:////www.11467.com/zhongshan/co/118867.htm
中山联发塑料机械有限公司的商铺,http://zhongshan0118867.11467.com
淄博金辰塑胶科技有限公司,http:////www.11467.com/zibo/co/93279.htm
淄博金辰塑胶科技有限公司的商铺,http://zibo093279.11467.com
中山市东升镇捷利丰电子辅料制品厂,http:////www.11467.com/xuzhou/co/83010.htm
中山市东升镇捷利丰电子辅料制品厂的商铺,http://xuzhou083010.11467.com
山东菏泽正瑞塑料包装厂,http:////www.11467.com/heze/co/46878.htm
山东菏泽正瑞塑料包装厂的商铺,http://heze046878.11467.com
海宁市许村镇华尔洁靠枕厂,http:////www.11467.com/jiaxing/co/134903.htm
海宁市许村镇华尔洁靠枕厂的商铺,http://jiaxing0134903.11467.com
青岛山海包装制品有限公司,http:////www.11467.com/qingdao/co/188584.htm
青岛山海包装制品有限公司的商铺,http://qingdao0188584.11467.com
广东省普宁市家宝食用包装品有限公司,http:////www.11467.com/guangzhou/co/212963.htm
惠州市惠阳区秋长宝佳利包装材料厂,http:////www.11467.com/huizhou/co/58776.htm
惠州市惠阳区秋长宝佳利包装材料厂的商铺,http://huizhou058776.11467.com
焦作市三羽塑胶有限公司,http:////www.11467.com/jiaozuo/co/21471.htm
焦作市三羽塑胶有限公司的商铺,http://jiaozuo021471.11467.com
汕头市潮南区琰丰包装制品厂,http:////www.11467.com/shantou/co/123286.htm
汕头市潮南区琰丰包装制品厂的商铺,http://shantou0123286.11467.com
惠州宝田塑胶包装有限公司,http:////www.11467.com/huizhou/co/68929.htm
惠州宝田塑胶包装有限公司的商铺,http://huizhou068929.11467.com
惠州市惠强塑料包装有限公司,http:////www.11467.com/huizhou/co/63465.htm
惠州市惠强塑料包装有限公司的商铺,http://huizhou063465.11467.com
沧州沧硕塑业有限公司,http:////www.11467.com/cangzhou/co/39777.htm
沧州沧硕塑业有限公司的商铺,http://cangzhou039777.11467.com
烟台市牟平区盛源塑料有限公司,http:////www.11467.com/yantai/co/127041.htm
烟台市牟平区盛源塑料有限公司的商铺,http://yantai0127041.11467.com
镇江市润州金山包装厂,http:////www.11467.com/zhenjiang/co/5714.htm
镇江市润州金山包装厂的商铺,http://zhenjiang05714.11467.com
江门市蓬江区棠下恒昌塑料薄膜厂,http:////www.11467.com/jiangmen/co/86544.htm
江门市蓬江区棠下恒昌塑料薄膜厂的商铺,http://jiangmen086544.11467.com
烟台市莱山区双达橡塑有限公司,http:////www.11467.com/yantai/co/127042.htm
烟台市莱山区双达橡塑有限公司的商铺,http://yantai0127042.11467.com
惠州市鸿利达包装材料有限公司,http:////www.11467.com/huizhou/co/73791.htm
惠州市鸿利达包装材料有限公司的商铺,http://huizhou073791.11467.com
厦门叁利隆包装材料,http:////www.11467.com/xiamen/co/85029.htm
厦门叁利隆包装材料的商铺,http://xiamen085029.11467.com
苏州新旭缘特殊包装有限公司,http:////www.11467.com/suzhou/co/401917.htm
苏州新旭缘特殊包装有限公司的商铺,http://suzhou0401917.11467.com
东莞市品优薄膜科技有限公司,http:////www.11467.com/dongguan/co/632447.htm
东莞市品优薄膜科技有限公司的商铺,http://dongguan0632447.11467.com
广州荣义装饰材料有限公司,http:////www.11467.com/guangzhou/co/460271.htm
广州荣义装饰材料有限公司的商铺,http://guangzhou0460271.11467.com
合肥市恒达塑业有限公司,http:////www.11467.com/hefei/co/147893.htm
合肥市恒达塑业有限公司的商铺,http://hefei0147893.11467.com
深圳市源杰能科技有限公司,http:////www.11467.com/shenzhen/co/1127796.htm
深圳市源杰能科技有限公司的商铺,http://shenzhen01127796.11467.com
苏州友恒橡塑制品有限公司,http:////www.11467.com/suzhou/co/313098.htm
苏州友恒橡塑制品有限公司的商铺,http://suzhou0313098.11467.com
东莞市纳利光学材料有限公司,http:////www.11467.com/dongguan/co/462764.htm
东莞市纳利光学材料有限公司的商铺,http://dongguan0462764.11467.com
佛山市海溢包装材料有限公司,http:////www.11467.com/foshan/co/345942.htm
佛山市海溢包装材料有限公司的商铺,http://foshan0345942.11467.com
大连塑料研究所有限公司,http:////www.11467.com/dalian/co/34461.htm
大连塑料研究所有限公司的商铺,http://dalian034461.11467.com
焦作群泽塑胶有限公司,http:////www.11467.com/jiaozuo/co/23070.htm
焦作群泽塑胶有限公司的商铺,http://jiaozuo023070.11467.com
中山市大利路精工机械有限公司,http:////www.11467.com/zhongshan/co/42811.htm
中山市大利路精工机械有限公司的商铺,http://zhongshan042811.11467.com
漳州市源杰能包装设备有限公司,http:////www.11467.com/zhangzhou/co/61643.htm
漳州市源杰能包装设备有限公司的商铺,http://zhangzhou061643.11467.com
常熟市美泰包装材料有限公司,http:////www.11467.com/qiye/93197478.htm
常熟市美泰包装材料有限公司的商铺,http://93197478.b2b.11467.com
深圳市百泉河实业有限公司,http:////www.11467.com/shenzhen/co/339671.htm
深圳市百泉河实业有限公司的商铺,http://shenzhen0339671.11467.com
东莞市梁宇胶贴制品有限公司,http:////www.11467.com/dongguan/co/239148.htm
东莞市梁宇胶贴制品有限公司的商铺,http://dongguan0239148.11467.com
东莞市塘厦永丰包装材料行,http:////www.11467.com/dongguan/co/143190.htm
东莞市塘厦永丰包装材料行的商铺,http://dongguan0143190.11467.com
广州惠华包装制品有限公司,http:////www.11467.com/guangzhou/co/210776.htm
广州惠华包装制品有限公司的商铺,http://guangzhou0210776.11467.com
卫辉市永胜塑料制品厂,http:////www.11467.com/xinxiang/co/31364.htm
卫辉市永胜塑料制品厂的商铺,http://xinxiang031364.11467.com
雄县新天华塑业有限公司,http:////www.11467.com/baoding/co/56642.htm
雄县新天华塑业有限公司的商铺,http://baoding056642.11467.com
沧州市隆泰塑料有限公司,http:////www.11467.com/cangzhou/co/45887.htm
沧州市隆泰塑料有限公司的商铺,http://cangzhou045887.11467.com
长沙市远瑞塑胶有限公司,http:////www.11467.com/changsha/co/104300.htm
长沙市远瑞塑胶有限公司的商铺,http://changsha0104300.11467.com
厦门市地隆包装材料有限公司,http:////www.11467.com/xiamen/co/85775.htm
厦门市地隆包装材料有限公司的商铺,http://xiamen085775.11467.com
东莞市开源塑化科技有限公司,http:////www.11467.com/dongguan/co/329591.htm
东莞市开源塑化科技有限公司的商铺,http://dongguan0329591.11467.com
东莞市海野塑胶制品有限公司,http:////www.11467.com/dongguan/co/508501.htm
东莞市海野塑胶制品有限公司的商铺,http://dongguan0508501.11467.com
东莞市旭田包装机械有限公司,http:////www.11467.com/dongguan/co/40173.htm
东莞市旭田包装机械有限公司的商铺,http://dongguan040173.11467.com
东莞市金旺包装材料有限公司,http:////www.11467.com/dongguan/co/323211.htm
东莞市金旺包装材料有限公司的商铺,http://dongguan0323211.11467.com
星子县鑫盛石材厂,http:////www.11467.com/jiujiang/co/22385.htm
星子县鑫盛石材厂的商铺,http://jiujiang022385.11467.com
浙江超然建材有限公司,http:////www.11467.com/quzhou/co/36132.htm
浙江超然建材有限公司的商铺,http://quzhou036132.11467.com
广州市绿原环保材料有限公司,http:////www.11467.com/guangzhou/co/115664.htm
广州市绿原环保材料有限公司的商铺,http://guangzhou0115664.11467.com
杭州新光塑料有限公司,http:////www.11467.com/hangzhou/co/10180.htm
杭州新光塑料有限公司的商铺,http://hangzhou010180.11467.com
浙江九鼎投资集团有限公司,http:////www.11467.com/hangzhou/co/238486.htm
浙江九鼎投资集团有限公司的商铺,http://hangzhou0238486.11467.com
重庆环能轻质建材有限公司,http:////www.11467.com/chongqing/co/344284.htm
重庆环能轻质建材有限公司的商铺,http://chongqing0344284.11467.com
天津澳晨科技有限公司,http:////www.11467.com/tianjin/co/198404.htm
天津澳晨科技有限公司的商铺,http://tianjin0198404.11467.com
浦江县鼎信二手吨袋厂,http:////www.11467.com/jinhua/co/265880.htm
浦江县鼎信二手吨袋厂的商铺,http://jinhua0265880.11467.com
无锡新龙科技有限公司,http:////www.11467.com/qiye/4552.htm
西安盛邦珍珠棉有限公司,http:////www.11467.com/xian/co/95810.htm
东莞市台茂电子材料有限公司,http:////www.11467.com/dongguan/co/410754.htm
东莞市台茂电子材料有限公司的商铺,http://dongguan0410754.11467.com
大连金诺塑料制品有限公司,http:////www.11467.com/dalian/co/42327.htm
大连金诺塑料制品有限公司的商铺,http://dalian042327.11467.com
德州天利实业有限公司,http:////www.11467.com/dezhou/co/24774.htm
德州天利实业有限公司的商铺,http://dezhou024774.11467.com
佛山市顺德区龙江镇龙山星宝塑料包装材料厂,http:////www.11467.com/foshan/co/213780.htm
佛山市顺德区龙江镇龙山星宝塑料包装材料厂的商铺,http://foshan0213780.11467.com
佛山市禅城区常用塑料包装厂,http:////www.11467.com/foshan/co/213883.htm
佛山市禅城区常用塑料包装厂的商铺,http://foshan0213883.11467.com
江门市维嘉利鞋材有限公司,http:////www.11467.com/jiangmen/co/95315.htm
江门市维嘉利鞋材有限公司的商铺,http://jiangmen095315.11467.com
佛山市三水区粘之宝包装材料有限公司,http:////www.11467.com/foshan/co/213926.htm
佛山市三水区粘之宝包装材料有限公司的商铺,http://foshan0213926.11467.com
福州环宇包装设计印刷有限公司,http:////www.11467.com/fuzhou/co/7196.htm
福州环宇包装设计印刷有限公司的商铺,http://fuzhou07196.11467.com
长沙德美包装材料有限公司,http:////www.11467.com/changsha/co/89303.htm
长沙德美包装材料有限公司的商铺,http://changsha089303.11467.com
东莞市活鹏实业有限公司,http:////www.11467.com/dongguan/co/225050.htm
东莞市活鹏实业有限公司的商铺,http://dongguan0225050.11467.com
佛山市顺德区祥彩塑料制品有限公司,http:////www.11467.com/foshan/co/213768.htm
佛山市顺德区祥彩塑料制品有限公司的商铺,http://foshan0213768.11467.com
东莞市明明包装材料有限公司,http:////www.11467.com/dongguan/co/267067.htm
东莞市明明包装材料有限公司的商铺,http://dongguan0267067.11467.com
李国强,http:////www.11467.com/dongguan/co/556105.htm
李国强的商铺,http://dongguan0556105.11467.com
东莞市联福电子材料厂,http:////www.11467.com/dongguan/co/142405.htm
东莞市联福电子材料厂的商铺,http://dongguan0142405.11467.com
