深圳市宝安区松岗鑫达塑胶经销部的商铺,http://shenzhen0148258.11467.com
深圳市彩弘业袋制品有限公司,http:////www.11467.com/shenzhen/co/148239.htm
深圳市彩弘业袋制品有限公司的商铺,http://shenzhen0148239.11467.com
沈阳四维高聚物塑胶有限公司,http:////www.11467.com/shenyang/co/57936.htm
沈阳四维高聚物塑胶有限公司的商铺,http://shenyang057936.11467.com
恒辉相框五金制品有限公司,http:////www.11467.com/shenzhen/co/148254.htm
恒辉相框五金制品有限公司的商铺,http://shenzhen0148254.11467.com
深圳市安达顺包装制品有限公司,http:////www.11467.com/shenzhen/co/148163.htm
深圳市安达顺包装制品有限公司的商铺,http://shenzhen0148163.11467.com
深圳市佳程包装材料有限公司,http:////www.11467.com/shenzhen/co/148190.htm
深圳市佳程包装材料有限公司的商铺,http://shenzhen0148190.11467.com
深圳市富亿凯包装材料有限公司,http:////www.11467.com/shenzhen/co/142184.htm
深圳市富亿凯包装材料有限公司的商铺,http://shenzhen0142184.11467.com
深圳市诚兴包装器材有限公司,http:////www.11467.com/shenzhen/co/100810.htm
深圳市诚兴包装器材有限公司的商铺,http://shenzhen0100810.11467.com
加美工業公司CANUS INDUSTRIAL CO,http:////www.11467.com/shenzhen/co/148236.htm
加美工業公司CANUS INDUSTRIAL CO的商铺,http://shenzhen0148236.11467.com
深圳市富亿达包装制品有限公司,http:////www.11467.com/shenzhen/co/809252.htm
深圳市富亿达包装制品有限公司的商铺,http://shenzhen0809252.11467.com
深圳市晶鼎科技有限公司,http:////www.11467.com/shenzhen/co/28335.htm
深圳市晶鼎科技有限公司的商铺,http://shenzhen028335.11467.com
深圳市宏拓时尚礼品有限公司,http:////www.11467.com/shenzhen/co/224172.htm
深圳市宏拓时尚礼品有限公司的商铺,http://shenzhen0224172.11467.com
深圳市宏鑫包装材料制品有限公司,http:////www.11467.com/shenzhen/co/770518.htm
深圳市宏鑫包装材料制品有限公司的商铺,http://shenzhen0770518.11467.com
深圳市诚和德包装器材经销部,http:////www.11467.com/shenzhen/co/100814.htm
深圳市诚和德包装器材经销部的商铺,http://shenzhen0100814.11467.com
深圳市宝安区西乡兴发绝缘材料商行,http:////www.11467.com/shenzhen/co/812579.htm
深圳市宝安区西乡兴发绝缘材料商行的商铺,http://shenzhen0812579.11467.com
深圳市光明新区公明阿西迪光电材料经销部,http:////www.11467.com/shenzhen/co/725626.htm
深圳市光明新区公明阿西迪光电材料经销部的商铺,http://shenzhen0725626.11467.com
深圳市赣昌科技有限公司,http:////www.11467.com/shenzhen/co/811175.htm
深圳市赣昌科技有限公司的商铺,http://shenzhen0811175.11467.com
深圳市彩艺镭射材料有限公司,http:////www.11467.com/shenzhen/co/811364.htm
深圳市彩艺镭射材料有限公司的商铺,http://shenzhen0811364.11467.com
深圳市宝安区西乡三正绝缘材料行,http:////www.11467.com/shenzhen/co/387952.htm
深圳市宝安区西乡三正绝缘材料行的商铺,http://shenzhen0387952.11467.com
深圳大洋科技有限公司,http:////www.11467.com/shenzhen/co/543876.htm
深圳大洋科技有限公司的商铺,http://shenzhen0543876.11467.com
深圳市宝安区新安豫翔经营部,http:////www.11467.com/shenzhen/co/433987.htm
深圳市宝安区新安豫翔经营部的商铺,http://shenzhen0433987.11467.com
深圳市金丰强磁铁有限公司,http:////www.11467.com/shenzhen/co/810536.htm
深圳市金丰强磁铁有限公司的商铺,http://shenzhen0810536.11467.com
深圳市红微芯科技有限公司,http:////www.11467.com/shenzhen/co/776587.htm
深圳市红微芯科技有限公司的商铺,http://shenzhen0776587.11467.com
深圳市科利普电子材料有限公司,http:////www.11467.com/shenzhen/co/57696.htm
深圳市科利普电子材料有限公司的商铺,http://shenzhen057696.11467.com
深圳市光明新区公明南聚包装材料经营部,http:////www.11467.com/shenzhen/co/277094.htm
深圳市光明新区公明南聚包装材料经营部的商铺,http://shenzhen0277094.11467.com
深圳市宝安区公明欣旺文具劳保商行,http:////www.11467.com/shenzhen/co/576160.htm
深圳市宝安区公明欣旺文具劳保商行的商铺,http://shenzhen0576160.11467.com
深圳市佰益迅科技有限公司,http:////www.11467.com/shenzhen/co/812692.htm
深圳市佰益迅科技有限公司的商铺,http://shenzhen0812692.11467.com
聚银塑料包装制品（深圳）有限公司,http:////www.11467.com/shenzhen/co/45332.htm
聚银塑料包装制品（深圳）有限公司的商铺,http://shenzhen045332.11467.com
鸿智达包装（深圳）有限公司,http:////www.11467.com/shenzhen/co/278211.htm
鸿智达包装（深圳）有限公司的商铺,http://shenzhen0278211.11467.com
深圳市宝盛达轻胶制品有限公司,http:////www.11467.com/shenzhen/co/722979.htm
深圳市宝盛达轻胶制品有限公司的商铺,http://shenzhen0722979.11467.com
深圳市福田区中电信息时代广场拓华新电子经营部,http:////www.11467.com/shenzhen/co/810787.htm
深圳市福田区中电信息时代广场拓华新电子经营部的商铺,http://shenzhen0810787.11467.com
深圳市宝安区西乡科丽达电子制品厂,http:////www.11467.com/shenzhen/co/723015.htm
深圳市宝安区西乡科丽达电子制品厂的商铺,http://shenzhen0723015.11467.com
深圳市奥特克电子科技有限公司,http:////www.11467.com/shenzhen/co/103633.htm
深圳市奥特克电子科技有限公司的商铺,http://shenzhen0103633.11467.com
深圳市宝安区龙华吉利程粘胶制品厂,http:////www.11467.com/shenzhen/co/285453.htm
深圳市宝安区龙华吉利程粘胶制品厂的商铺,http://shenzhen0285453.11467.com
深圳市博德力铝塑复合包装有限公司,http:////www.11467.com/shenzhen/co/810338.htm
深圳市博德力铝塑复合包装有限公司的商铺,http://shenzhen0810338.11467.com
深圳市国宏包装材料有限公司,http:////www.11467.com/shenzhen/co/278013.htm
深圳市国宏包装材料有限公司的商铺,http://shenzhen0278013.11467.com
深圳市恒利源包装制品有限公司,http:////www.11467.com/shenzhen/co/578260.htm
深圳市恒利源包装制品有限公司的商铺,http://shenzhen0578260.11467.com
深圳市恒兴源包装材料有限公司,http:////www.11467.com/shenzhen/co/805618.htm
深圳市恒兴源包装材料有限公司的商铺,http://shenzhen0805618.11467.com
深圳市飞扬达包装材料有限公司,http:////www.11467.com/shenzhen/co/100803.htm
深圳市飞扬达包装材料有限公司的商铺,http://shenzhen0100803.11467.com
深圳市嘉泰通包装材料有限公司,http:////www.11467.com/shenzhen/co/277652.htm
深圳市嘉泰通包装材料有限公司的商铺,http://shenzhen0277652.11467.com
深圳市北化塑胶有限公司,http:////www.11467.com/shenzhen/co/692271.htm
深圳市北化塑胶有限公司的商铺,http://shenzhen0692271.11467.com
深圳市福田区质高电子销售部,http:////www.11467.com/shenzhen/co/531713.htm
深圳市福田区质高电子销售部的商铺,http://shenzhen0531713.11467.com
深圳市邦盛包装材料有限公司,http:////www.11467.com/shenzhen/co/726675.htm
深圳市邦盛包装材料有限公司的商铺,http://shenzhen0726675.11467.com
深圳市宝安区民治鑫华塑胶材料经营部,http:////www.11467.com/shenzhen/co/271968.htm
深圳市宝安区民治鑫华塑胶材料经营部的商铺,http://shenzhen0271968.11467.com
深圳市恒大泡棉有限公司,http:////www.11467.com/shenzhen/co/757842.htm
深圳市恒大泡棉有限公司的商铺,http://shenzhen0757842.11467.com
深圳市利丰隆包装制品有限公司,http:////www.11467.com/shenzhen/co/723887.htm
深圳市利丰隆包装制品有限公司的商铺,http://shenzhen0723887.11467.com
深圳市聚辉科技有限公司,http:////www.11467.com/shenzhen/co/780463.htm
深圳市聚辉科技有限公司的商铺,http://shenzhen0780463.11467.com
深圳市均尚品包装材料有限公司,http:////www.11467.com/shenzhen/co/278122.htm
深圳市均尚品包装材料有限公司的商铺,http://shenzhen0278122.11467.com
深圳市新博琛包装科技有限公司,http:////www.11467.com/shenzhen/co/148222.htm
深圳市新博琛包装科技有限公司的商铺,http://shenzhen0148222.11467.com
石家庄保尔希塑胶制品有限公司,http:////www.11467.com/shijiazhuang/co/78208.htm
石家庄保尔希塑胶制品有限公司的商铺,http://shijiazhuang078208.11467.com
深圳市福田区三鑫洋电子商行,http:////www.11467.com/shenzhen/co/727245.htm
深圳市福田区三鑫洋电子商行的商铺,http://shenzhen0727245.11467.com
深圳市强辉达轻胶制品有限公司,http:////www.11467.com/shenzhen/co/766148.htm
深圳市强辉达轻胶制品有限公司的商铺,http://shenzhen0766148.11467.com
深圳市荣圣达包装材料有限公司,http:////www.11467.com/shenzhen/co/809468.htm
深圳市荣圣达包装材料有限公司的商铺,http://shenzhen0809468.11467.com
深圳市明鑫泰包装有限公司,http:////www.11467.com/shenzhen/co/809461.htm
深圳市明鑫泰包装有限公司的商铺,http://shenzhen0809461.11467.com
深圳市一中科技有限公司,http:////www.11467.com/shenzhen/co/770925.htm
深圳市一中科技有限公司的商铺,http://shenzhen0770925.11467.com
深圳市文天昊包装材料有限公司,http:////www.11467.com/shenzhen/co/812477.htm
深圳市文天昊包装材料有限公司的商铺,http://shenzhen0812477.11467.com
深圳市龙岗区横岗顺成发吸塑厂,http:////www.11467.com/shenzhen/co/443504.htm
深圳市龙岗区横岗顺成发吸塑厂的商铺,http://shenzhen0443504.11467.com
深圳市龙岗区布吉镇利兴劳保布碎商店,http:////www.11467.com/shenzhen/co/293089.htm
深圳市龙岗区布吉镇利兴劳保布碎商店的商铺,http://shenzhen0293089.11467.com
深圳市龙岗区龙岗正达塑料经营部,http:////www.11467.com/shenzhen/co/299270.htm
深圳市龙岗区龙岗正达塑料经营部的商铺,http://shenzhen0299270.11467.com
深圳市三信纺织品有限公司,http:////www.11467.com/shenzhen/co/578269.htm
深圳市三信纺织品有限公司的商铺,http://shenzhen0578269.11467.com
深圳市时美薄膜有限公司,http:////www.11467.com/shenzhen/co/810839.htm
深圳市时美薄膜有限公司的商铺,http://shenzhen0810839.11467.com
深圳美能包装制品有限公司,http:////www.11467.com/shenzhen/co/103374.htm
深圳美能包装制品有限公司的商铺,http://shenzhen0103374.11467.com
深圳市易洁包装制品有限公司,http:////www.11467.com/shenzhen/co/363490.htm
深圳市易洁包装制品有限公司的商铺,http://shenzhen0363490.11467.com
深圳市东鑫亚特包装制品有限公司,http:////www.11467.com/shenzhen/co/135512.htm
深圳市东鑫亚特包装制品有限公司的商铺,http://shenzhen0135512.11467.com
深圳市万福强实业有限公司,http:////www.11467.com/shenzhen/co/496070.htm
深圳市万福强实业有限公司的商铺,http://shenzhen0496070.11467.com
深圳市泰润包装材料有限公司,http:////www.11467.com/shenzhen/co/765877.htm
深圳市泰润包装材料有限公司的商铺,http://shenzhen0765877.11467.com
深圳市盛宏泰包装材料有限公司,http:////www.11467.com/shenzhen/co/812544.htm
深圳市盛宏泰包装材料有限公司的商铺,http://shenzhen0812544.11467.com
深圳市易嘉易薄膜开关技术有限公司,http:////www.11467.com/shenzhen/co/578642.htm
深圳市易嘉易薄膜开关技术有限公司的商铺,http://shenzhen0578642.11467.com
深圳市恒辉框饰有限公司,http:////www.11467.com/shenzhen/co/764677.htm
深圳市恒辉框饰有限公司的商铺,http://shenzhen0764677.11467.com
深圳市新利佳无纺布包装有限公司,http:////www.11467.com/shenzhen/co/702275.htm
深圳市新利佳无纺布包装有限公司的商铺,http://shenzhen0702275.11467.com
深圳市通宝龙包装材料有限公司,http:////www.11467.com/shenzhen/co/389845.htm
深圳市通宝龙包装材料有限公司的商铺,http://shenzhen0389845.11467.com
深圳市艺兴海棉制品有限公司,http:////www.11467.com/shenzhen/co/680804.htm
深圳市艺兴海棉制品有限公司的商铺,http://shenzhen0680804.11467.com
深圳市宇飞鸿包装材料有限公司,http:////www.11467.com/shenzhen/co/793473.htm
深圳市宇飞鸿包装材料有限公司的商铺,http://shenzhen0793473.11467.com
深圳市吉瑞捷包装制品有限公司,http:////www.11467.com/shenzhen/co/56884.htm
深圳市吉瑞捷包装制品有限公司的商铺,http://shenzhen056884.11467.com
深圳市万兴和包装器材有限公司,http:////www.11467.com/shenzhen/co/103622.htm
深圳市万兴和包装器材有限公司的商铺,http://shenzhen0103622.11467.com
深圳市华创美科技开发有限公司,http:////www.11467.com/shenzhen/co/116937.htm
深圳市华创美科技开发有限公司的商铺,http://shenzhen0116937.11467.com
深圳市蓝绿源科技有限公司,http:////www.11467.com/shenzhen/co/534905.htm
深圳市蓝绿源科技有限公司的商铺,http://shenzhen0534905.11467.com
深圳市联晖环保包装材料有限公司,http:////www.11467.com/shenzhen/co/349283.htm
深圳市联晖环保包装材料有限公司的商铺,http://shenzhen0349283.11467.com
深圳市恒大泡棉有限公司,http:////www.11467.com/shenzhen/co/757842.htm
深圳市恒大泡棉有限公司的商铺,http://shenzhen0757842.11467.com
深圳市蓝飞包装材料有限公司,http:////www.11467.com/shenzhen/co/726657.htm
深圳市蓝飞包装材料有限公司的商铺,http://shenzhen0726657.11467.com
深圳市日月佳包装材料有限公司,http:////www.11467.com/shenzhen/co/104002.htm
深圳市日月佳包装材料有限公司的商铺,http://shenzhen0104002.11467.com
深圳市荣欣达包装制品有限公司,http:////www.11467.com/shenzhen/co/811930.htm
深圳市荣欣达包装制品有限公司的商铺,http://shenzhen0811930.11467.com
深圳市赛鼎实业有限公司,http:////www.11467.com/shenzhen/co/277351.htm
深圳市赛鼎实业有限公司的商铺,http://shenzhen0277351.11467.com
深圳市盛泰包装制品有限公司,http:////www.11467.com/shenzhen/co/763100.htm
深圳市盛泰包装制品有限公司的商铺,http://shenzhen0763100.11467.com
深圳市启迪东业科技有限公司,http:////www.11467.com/shenzhen/co/103269.htm
深圳市启迪东业科技有限公司的商铺,http://shenzhen0103269.11467.com
深圳市坪山新区齐辉包装材料制品厂,http:////www.11467.com/shenzhen/co/809463.htm
深圳市坪山新区齐辉包装材料制品厂的商铺,http://shenzhen0809463.11467.com
深圳市汕潮发贸易有限公司,http:////www.11467.com/shenzhen/co/572225.htm
深圳市汕潮发贸易有限公司的商铺,http://shenzhen0572225.11467.com
深圳市光明新区公明伟丰泡绵制品厂,http:////www.11467.com/shenzhen/co/513991.htm
深圳市光明新区公明伟丰泡绵制品厂的商铺,http://shenzhen0513991.11467.com
深圳市深航塑料包装材料有限公司,http:////www.11467.com/shenzhen/co/277514.htm
深圳市深航塑料包装材料有限公司的商铺,http://shenzhen0277514.11467.com
深圳市鑫锦辉包装材料有限公司,http:////www.11467.com/shenzhen/co/565811.htm
深圳市鑫锦辉包装材料有限公司的商铺,http://shenzhen0565811.11467.com
深圳市鑫隆延科技有限公司,http:////www.11467.com/shenzhen/co/811700.htm
深圳市鑫隆延科技有限公司的商铺,http://shenzhen0811700.11467.com
深圳市永辉达包装制品有限公司,http:////www.11467.com/shenzhen/co/812638.htm
深圳市永辉达包装制品有限公司的商铺,http://shenzhen0812638.11467.com
深圳普菲保护膜有限公司,http:////www.11467.com/shenzhen/co/277926.htm
深圳普菲保护膜有限公司的商铺,http://shenzhen0277926.11467.com
深圳市鑫利祥实业有限公司,http:////www.11467.com/shenzhen/co/422860.htm
深圳市鑫利祥实业有限公司的商铺,http://shenzhen0422860.11467.com
深圳市卓越包装材料有限公司,http:////www.11467.com/shenzhen/co/53909.htm
深圳市卓越包装材料有限公司的商铺,http://shenzhen053909.11467.com
深圳市欣朗视科技有限公司,http:////www.11467.com/shenzhen/co/804739.htm
深圳市欣朗视科技有限公司的商铺,http://shenzhen0804739.11467.com
深圳市新东方包装制品有限公司,http:////www.11467.com/shenzhen/co/812604.htm
深圳市新东方包装制品有限公司的商铺,http://shenzhen0812604.11467.com
正定县金成泡塑制品销售处,http:////www.11467.com/shijiazhuang/co/161309.htm
正定县金成泡塑制品销售处的商铺,http://shijiazhuang0161309.11467.com
武汉鼎峰博晟科技有限公司,http:////www.11467.com/wuhan/co/88624.htm
武汉鼎峰博晟科技有限公司的商铺,http://wuhan088624.11467.com
苏州工业园区鼎立包装材料有限公司,http:////www.11467.com/suzhou/co/14758.htm
苏州工业园区鼎立包装材料有限公司的商铺,http://suzhou014758.11467.com
苏州天控电子科技有限公司,http:////www.11467.com/suzhou/co/227373.htm
苏州天控电子科技有限公司的商铺,http://suzhou0227373.11467.com
铜陵市力辰机械设备制造有限公司,http:////www.11467.com/tongling/co/11262.htm
铜陵市力辰机械设备制造有限公司的商铺,http://tongling011262.11467.com
威海市瀚玉化纺有限公司,http:////www.11467.com/weihai/co/32378.htm
威海市瀚玉化纺有限公司的商铺,http://weihai032378.11467.com
武汉俊塑包装有限公司,http:////www.11467.com/wuhan/co/89440.htm
武汉俊塑包装有限公司的商铺,http://wuhan089440.11467.com
武汉市凯帝塑料制品有限公司,http:////www.11467.com/wuhan/co/70619.htm
武汉市凯帝塑料制品有限公司的商铺,http://wuhan070619.11467.com
武汉双收塑料中空板有限公司,http:////www.11467.com/wuhan/co/74722.htm
武汉双收塑料中空板有限公司的商铺,http://wuhan074722.11467.com
武汉市泰来化工技术开发有限责任公司,http:////www.11467.com/wuhan/co/107744.htm
武汉市泰来化工技术开发有限责任公司的商铺,http://wuhan0107744.11467.com
武汉松仔包装材料厂,http:////www.11467.com/wuhan/co/69811.htm
武汉松仔包装材料厂的商铺,http://wuhan069811.11467.com
潍坊嘉信塑料厂,http:////www.11467.com/weifang/co/86277.htm
潍坊嘉信塑料厂的商铺,http://weifang086277.11467.com
苏州一诺包装有限公司,http:////www.11467.com/suzhou/co/228480.htm
苏州一诺包装有限公司的商铺,http://suzhou0228480.11467.com
苏州嘉俊包装机材有限公司,http:////www.11467.com/suzhou/co/203470.htm
苏州嘉俊包装机材有限公司的商铺,http://suzhou0203470.11467.com
苏州宇宣纸业有限公司,http:////www.11467.com/suzhou/co/220201.htm
苏州宇宣纸业有限公司的商铺,http://suzhou0220201.11467.com
武汉长信塑料包装有限公司,http:////www.11467.com/wuhan/co/89461.htm
武汉长信塑料包装有限公司的商铺,http://wuhan089461.11467.com
潍坊市寒亭区坤达塑料制品厂,http:////www.11467.com/weifang/co/82184.htm
潍坊市寒亭区坤达塑料制品厂的商铺,http://weifang082184.11467.com
武汉东夏塑料制品有限公司,http:////www.11467.com/wuhan/co/89463.htm
武汉东夏塑料制品有限公司的商铺,http://wuhan089463.11467.com
昆山顺富达挤塑模具有限公司,http:////www.11467.com/suzhou/co/313097.htm
昆山顺富达挤塑模具有限公司的商铺,http://suzhou0313097.11467.com
刘超惠(个体经营),http:////www.11467.com/suizhou/co/10199.htm
刘超惠(个体经营)的商铺,http://suizhou010199.11467.com
台州市名科塑业有限公司,http:////www.11467.com/taizhou/co/85089.htm
台州市名科塑业有限公司的商铺,http://taizhou085089.11467.com
武汉同创色母料有限公司,http:////www.11467.com/wuhan/co/69819.htm
武汉同创色母料有限公司的商铺,http://wuhan069819.11467.com
武汉金纬创新工贸有限公司,http:////www.11467.com/wuhan/co/32163.htm
武汉金纬创新工贸有限公司的商铺,http://wuhan032163.11467.com
昆山晨富包装材料有限公司,http:////www.11467.com/suzhou/co/356373.htm
昆山晨富包装材料有限公司的商铺,http://suzhou0356373.11467.com
苏州卓群包装材料有限公司,http:////www.11467.com/suzhou/co/220341.htm
苏州卓群包装材料有限公司的商铺,http://suzhou0220341.11467.com
苏州胜义和包装有限公司,http:////www.11467.com/suzhou/co/234445.htm
苏州胜义和包装有限公司的商铺,http://suzhou0234445.11467.com
苏州市科思佳塑化科技有限公司,http:////www.11467.com/suzhou/co/220266.htm
苏州市科思佳塑化科技有限公司的商铺,http://suzhou0220266.11467.com
苏州杰优包装制品有限公司,http:////www.11467.com/suzhou/co/296355.htm
苏州杰优包装制品有限公司的商铺,http://suzhou0296355.11467.com
台州市路桥信尹包装材料厂,http:////www.11467.com/taizhou/co/85087.htm
台州市路桥信尹包装材料厂的商铺,http://taizhou085087.11467.com
武汉中信和包装有限公司,http:////www.11467.com/wuhan/co/87228.htm
武汉中信和包装有限公司的商铺,http://wuhan087228.11467.com
江阴市璜土新集包装厂,http:////www.11467.com/wuxi/co/249875.htm
江阴市璜土新集包装厂的商铺,http://wuxi0249875.11467.com
江阴市久诺包装材料有限公司,http:////www.11467.com/wuxi/co/247387.htm
江阴市久诺包装材料有限公司的商铺,http://wuxi0247387.11467.com
无锡杰曼科工业设备有限公司,http:////www.11467.com/wuxi/co/237139.htm
无锡杰曼科工业设备有限公司的商铺,http://wuxi0237139.11467.com
无锡市鼎鑫保护膜有限公司,http:////www.11467.com/wuxi/co/202262.htm
无锡市鼎鑫保护膜有限公司的商铺,http://wuxi0202262.11467.com
无锡得力宏泡塑有限公司,http:////www.11467.com/wuxi/co/240123.htm
无锡得力宏泡塑有限公司的商铺,http://wuxi0240123.11467.com
台州市黄岩阿尔发包装薄膜有限公司,http:////www.11467.com/taizhou/co/105544.htm
台州市黄岩阿尔发包装薄膜有限公司的商铺,http://taizhou0105544.11467.com
台州华多塑业有限公司,http:////www.11467.com/taizhou/co/137712.htm
台州华多塑业有限公司的商铺,http://taizhou0137712.11467.com
泰州鑫旺包装材料有限公司,http:////www.11467.com/taizhoushi/co/29211.htm
泰州鑫旺包装材料有限公司的商铺,http://taizhoushi029211.11467.com
泰兴市百和塑料包装制品有限公司,http:////www.11467.com/taizhoushi/co/46222.htm
泰兴市百和塑料包装制品有限公司的商铺,http://taizhoushi046222.11467.com
唐山市丰润区辉运丰达泡沫厂,http:////www.11467.com/tangshan/co/55320.htm
唐山市丰润区辉运丰达泡沫厂的商铺,http://tangshan055320.11467.com
温州国盛包装制品有限公司,http:////www.11467.com/wenzhou/co/136146.htm
温州国盛包装制品有限公司的商铺,http://wenzhou0136146.11467.com
苏州测之杰电子有限公司,http:////www.11467.com/suzhou/co/248454.htm
苏州测之杰电子有限公司的商铺,http://suzhou0248454.11467.com
苏州亿丰胶粘制品有限公司,http:////www.11467.com/suzhou/co/220610.htm
苏州亿丰胶粘制品有限公司的商铺,http://suzhou0220610.11467.com
苏州致合胶粘制品有限公司,http:////www.11467.com/suzhou/co/247659.htm
苏州致合胶粘制品有限公司的商铺,http://suzhou0247659.11467.com
苏州佳硕塑胶包装材料有限公司,http:////www.11467.com/suzhou/co/220990.htm
苏州佳硕塑胶包装材料有限公司的商铺,http://suzhou0220990.11467.com
昆山恒晖诚包装材料有限公司,http:////www.11467.com/suzhou/co/356589.htm
昆山恒晖诚包装材料有限公司的商铺,http://suzhou0356589.11467.com
昆山众磊包装制品有限公司,http:////www.11467.com/suzhou/co/354641.htm
昆山众磊包装制品有限公司的商铺,http://suzhou0354641.11467.com
苏州兴锦诚包装材料有限公司,http:////www.11467.com/suzhou/co/202348.htm
苏州兴锦诚包装材料有限公司的商铺,http://suzhou0202348.11467.com
吴江市和贵纸塑制品厂,http:////www.11467.com/suzhou/co/323604.htm
吴江市和贵纸塑制品厂的商铺,http://suzhou0323604.11467.com
吴江市富达包装材料厂,http:////www.11467.com/suzhou/co/316439.htm
吴江市富达包装材料厂的商铺,http://suzhou0316439.11467.com
苏州永隆包装材料有限公司,http:////www.11467.com/suzhou/co/297210.htm
苏州永隆包装材料有限公司的商铺,http://suzhou0297210.11467.com
扬州博实新材料有限公司,http:////www.11467.com/yangzhou/co/106582.htm
扬州博实新材料有限公司的商铺,http://yangzhou0106582.11467.com
陕西永盛塑业有限公司,http:////www.11467.com/xian/co/59853.htm
陕西永盛塑业有限公司的商铺,http://xian059853.11467.com
中山市永益包装材料有限公司,http:////www.11467.com/zhongshan/co/149109.htm
中山市永益包装材料有限公司的商铺,http://zhongshan0149109.11467.com
中山市黄圃镇三洲五金塑料制品厂,http:////www.11467.com/zhongshan/co/80211.htm
中山市黄圃镇三洲五金塑料制品厂的商铺,http://zhongshan080211.11467.com
郑州百兴塑料制品有限公司,http:////www.11467.com/zhengzhou/co/22470.htm
郑州百兴塑料制品有限公司的商铺,http://zhengzhou022470.11467.com
陕西精辉贸易有限公司,http:////www.11467.com/xian/co/31043.htm
陕西精辉贸易有限公司的商铺,http://xian031043.11467.com
扬州市金鹏软管日化有限公司,http:////www.11467.com/yangzhou/co/9990.htm
