东莞市桥头台鑫包装材料店,http:////www.11467.com/dongguan/co/121888.htm
东莞市桥头台鑫包装材料店的商铺,http://dongguan0121888.11467.com
东莞市长安耀鼎饰品材料经营部,http:////www.11467.com/dongguan/co/410883.htm
东莞市长安耀鼎饰品材料经营部的商铺,http://dongguan0410883.11467.com
南京建康金箔厂,http:////www.11467.com/nanjing/co/12525.htm
南京建康金箔厂的商铺,http://nanjing012525.11467.com
深圳市大彩科技有限公司,http:////www.11467.com/shenzhen/co/762863.htm
深圳市大彩科技有限公司的商铺,http://shenzhen0762863.11467.com
缙云县粤得捷工艺品制品厂,http:////www.11467.com/guangzhou/co/160965.htm
缙云县粤得捷工艺品制品厂的商铺,http://guangzhou0160965.11467.com
西安恒泰软木有限公司,http:////www.11467.com/xian/co/48684.htm
西安恒泰软木有限公司的商铺,http://xian048684.11467.com
汕头市亮彩工艺制品实业有限公司,http:////www.11467.com/shantou/co/127822.htm
汕头市亮彩工艺制品实业有限公司的商铺,http://shantou0127822.11467.com
临沂河东旭丰工艺品厂,http:////www.11467.com/linyi/co/67691.htm
临沂河东旭丰工艺品厂的商铺,http://linyi067691.11467.com
南昌市西湖区唯美艺苑手工艺品店,http:////www.11467.com/nanchang/co/84864.htm
南昌市西湖区唯美艺苑手工艺品店的商铺,http://nanchang084864.11467.com
汕头市澄海区澄华丝叶工艺辅料店,http:////www.11467.com/shantou/co/133920.htm
汕头市澄海区澄华丝叶工艺辅料店的商铺,http://shantou0133920.11467.com
浙江大禾园景园艺有限公司,http:////www.11467.com/hangzhou/co/222305.htm
浙江大禾园景园艺有限公司的商铺,http://hangzhou0222305.11467.com
惠州市惠阳区焕晨贸易有限公司,http:////www.11467.com/huizhou/co/60816.htm
惠州市惠阳区焕晨贸易有限公司的商铺,http://huizhou060816.11467.com
灵寿县鼎鸿矿产品加工厂,http:////www.11467.com/shijiazhuang/co/80777.htm
灵寿县鼎鸿矿产品加工厂的商铺,http://shijiazhuang080777.11467.com
石家庄市桥东区一二三手工珠包批发商行,http:////www.11467.com/shijiazhuang/co/82797.htm
石家庄市桥东区一二三手工珠包批发商行的商铺,http://shijiazhuang082797.11467.com
莆田市涵江区龙标金箔厂,http:////www.11467.com/putian/co/31765.htm
莆田市涵江区龙标金箔厂的商铺,http://putian031765.11467.com
沈阳春恩橡化产品有限公司,http:////www.11467.com/shenyang/co/55092.htm
沈阳春恩橡化产品有限公司的商铺,http://shenyang055092.11467.com
江门市新会区会城建发胶丝厂,http:////www.11467.com/jiangmen/co/84458.htm
江门市新会区会城建发胶丝厂的商铺,http://jiangmen084458.11467.com
中山市古镇台鑫工艺材料部,http:////www.11467.com/dongguan/co/555821.htm
中山市古镇台鑫工艺材料部的商铺,http://dongguan0555821.11467.com
深圳市科晟达贸易有限公司,http:////www.11467.com/shenzhen/co/795737.htm
深圳市科晟达贸易有限公司的商铺,http://shenzhen0795737.11467.com
安溪县凤城新滢藤铁工艺品销售点,http:////www.11467.com/quanzhou/co/147232.htm
安溪县凤城新滢藤铁工艺品销售点的商铺,http://quanzhou0147232.11467.com
广州市晶固胶粘剂有限公司,http:////www.11467.com/guangzhou/co/451695.htm
广州市晶固胶粘剂有限公司的商铺,http://guangzhou0451695.11467.com
广州市番禺区大石晖彩化学产品经营部,http:////www.11467.com/guangzhou/co/431506.htm
广州市番禺区大石晖彩化学产品经营部的商铺,http://guangzhou0431506.11467.com
深圳市龙岗区平湖全顺达筛网经营部,http:////www.11467.com/shenzhen/co/811252.htm
深圳市龙岗区平湖全顺达筛网经营部的商铺,http://shenzhen0811252.11467.com
厦门市双宏体育文化用品有限公司,http:////www.11467.com/xiamen/co/37915.htm
厦门市双宏体育文化用品有限公司的商铺,http://xiamen037915.11467.com
深圳市俊霖技术发展有限公司,http:////www.11467.com/shenzhen/co/153669.htm
深圳市俊霖技术发展有限公司的商铺,http://shenzhen0153669.11467.com
东莞市日彩膜工艺材料有限公司,http:////www.11467.com/dongguan/co/184556.htm
东莞市日彩膜工艺材料有限公司的商铺,http://dongguan0184556.11467.com
东莞市樟木头盛记工艺品经营部,http:////www.11467.com/dongguan/co/183751.htm
东莞市樟木头盛记工艺品经营部的商铺,http://dongguan0183751.11467.com
广州市达添银饰品有限公司,http:////www.11467.com/guangzhou/co/429450.htm
广州市达添银饰品有限公司的商铺,http://guangzhou0429450.11467.com
深圳市达利行工艺制品有限公司,http:////www.11467.com/shenzhen/co/316818.htm
深圳市达利行工艺制品有限公司的商铺,http://shenzhen0316818.11467.com
深圳市龙岗区平湖博顺玻璃钢原料商行,http:////www.11467.com/shenzhen/co/810437.htm
深圳市龙岗区平湖博顺玻璃钢原料商行的商铺,http://shenzhen0810437.11467.com
深圳市龙岗区鑫顺发圣诞工艺商行,http:////www.11467.com/shenzhen/co/224022.htm
深圳市龙岗区鑫顺发圣诞工艺商行的商铺,http://shenzhen0224022.11467.com
石家庄魔码网络科技有限公司,http:////www.11467.com/shijiazhuang/co/154394.htm
石家庄魔码网络科技有限公司的商铺,http://shijiazhuang0154394.11467.com
深圳市尹文陶瓷技术有限公司,http:////www.11467.com/shenzhen/co/369320.htm
深圳市尹文陶瓷技术有限公司的商铺,http://shenzhen0369320.11467.com
深圳市鸿禧创意科技有限公司,http:////www.11467.com/shenzhen/co/254561.htm
深圳市鸿禧创意科技有限公司的商铺,http://shenzhen0254561.11467.com
深圳市迪恒光电有限公司,http:////www.11467.com/shenzhen/co/726496.htm
深圳市迪恒光电有限公司的商铺,http://shenzhen0726496.11467.com
东莞市万江小酷比工艺品材料经营部,http:////www.11467.com/dongguan/co/532621.htm
东莞市万江小酷比工艺品材料经营部的商铺,http://dongguan0532621.11467.com
东莞市英达纺织原料有限公司,http:////www.11467.com/dongguan/co/556329.htm
东莞市英达纺织原料有限公司的商铺,http://dongguan0556329.11467.com
合肥飞鸟纸工艺有限公司,http:////www.11467.com/hefei/co/137401.htm
合肥飞鸟纸工艺有限公司的商铺,http://hefei0137401.11467.com
义乌市青云电子商务有限公司,http:////www.11467.com/hangzhou/co/368977.htm
义乌市青云电子商务有限公司的商铺,http://hangzhou0368977.11467.com
义乌市普道工艺品厂,http:////www.11467.com/jinhua/co/122913.htm
义乌市普道工艺品厂的商铺,http://jinhua0122913.11467.com
连云港天盛草编制品有限公司,http:////www.11467.com/lianyungang/co/40921.htm
连云港天盛草编制品有限公司的商铺,http://lianyungang040921.11467.com
江门市新会区小冈戴灵香厂,http:////www.11467.com/jiangmen/co/84871.htm
江门市新会区小冈戴灵香厂的商铺,http://jiangmen084871.11467.com
深圳市广之研科技有限公司,http:////www.11467.com/shenzhen/co/810397.htm
深圳市广之研科技有限公司的商铺,http://shenzhen0810397.11467.com
深圳市龙岗区龙岗炜康电子粘胶剂商行,http:////www.11467.com/shenzhen/co/604418.htm
深圳市龙岗区龙岗炜康电子粘胶剂商行的商铺,http://shenzhen0604418.11467.com
江苏森豪仕软木有限公司,http:////www.11467.com/nantong/co/138922.htm
江苏森豪仕软木有限公司的商铺,http://nantong0138922.11467.com
深圳市新联振业包装材料有限公司,http:////www.11467.com/shenzhen/co/272675.htm
深圳市新联振业包装材料有限公司的商铺,http://shenzhen0272675.11467.com
深圳市正德行科技有限公司,http:////www.11467.com/shenzhen/co/98300.htm
深圳市正德行科技有限公司的商铺,http://shenzhen098300.11467.com
沭阳县福弟干花工艺品厂,http:////www.11467.com/suqian/co/26823.htm
沭阳县福弟干花工艺品厂的商铺,http://suqian026823.11467.com
深圳市捷超行模具有限公司,http:////www.11467.com/shenzhen/co/223286.htm
深圳市捷超行模具有限公司的商铺,http://shenzhen0223286.11467.com
赤壁市富强工艺厂,http:////www.11467.com/xianning/co/14827.htm
赤壁市富强工艺厂的商铺,http://xianning014827.11467.com
东莞市常平昊艺工艺材料经营部,http:////www.11467.com/dongguan/co/413640.htm
东莞市常平昊艺工艺材料经营部的商铺,http://dongguan0413640.11467.com
惠州市惠城区腾达人造花材料厂,http:////www.11467.com/huizhou/co/51596.htm
惠州市惠城区腾达人造花材料厂的商铺,http://huizhou051596.11467.com
福州恒通铁艺装饰有限公司,http:////www.11467.com/fuzhou/co/144396.htm
福州恒通铁艺装饰有限公司的商铺,http://fuzhou0144396.11467.com
杭州斯彩化工有限公司,http:////www.11467.com/hangzhou/co/222493.htm
杭州斯彩化工有限公司的商铺,http://hangzhou0222493.11467.com
中山市三乡金堡丝花工艺厂,http:////www.11467.com/zhongshan/co/925.htm
中山市三乡金堡丝花工艺厂的商铺,http://zhongshan0925.11467.com
鲍平（个体经营）,http:////www.11467.com/beijing/co/177294.htm
鲍平（个体经营）的商铺,http://beijing0177294.11467.com
北京爱陶乐软陶厂,http:////www.11467.com/beijing/co/305897.htm
北京爱陶乐软陶厂的商铺,http://beijing0305897.11467.com
温州市龙湾蒲州天成制笔厂,http:////www.11467.com/shanghai/co/87664.htm
温州市龙湾蒲州天成制笔厂的商铺,http://shanghai087664.11467.com
天津市宝坻区志贵工艺品厂,http:////www.11467.com/tianjin/co/6404.htm
天津市宝坻区志贵工艺品厂的商铺,http://tianjin06404.11467.com
惠州市富鑫源实业有限公司,http:////www.11467.com/huizhou/co/60800.htm
惠州市富鑫源实业有限公司的商铺,http://huizhou060800.11467.com
北京陶乐思手工材料有限公司,http:////www.11467.com/beijing/co/305867.htm
北京陶乐思手工材料有限公司的商铺,http://beijing0305867.11467.com
深圳市神美嘉科技有限公司,http:////www.11467.com/dongguan/co/607153.htm
深圳市神美嘉科技有限公司的商铺,http://dongguan0607153.11467.com
东阳市康龙工艺材料有限公司,http:////www.11467.com/jinhua/co/147776.htm
东阳市康龙工艺材料有限公司的商铺,http://jinhua0147776.11467.com
深圳市金彩箔业有限公司,http:////www.11467.com/shenzhen/co/1037669.htm
深圳市金彩箔业有限公司的商铺,http://shenzhen01037669.11467.com
中山市沙溪镇佳华工艺印花材料行,http:////www.11467.com/zhongshan/co/61525.htm
中山市沙溪镇佳华工艺印花材料行的商铺,http://zhongshan061525.11467.com
佛山市森美亚复合材料有限公司,http:////www.11467.com/foshan/co/284029.htm
佛山市森美亚复合材料有限公司的商铺,http://foshan0284029.11467.com
许昌市连熙化纤有限公司,http:////www.11467.com/xuchang/co/17058.htm
许昌市连熙化纤有限公司的商铺,http://xuchang017058.11467.com
深圳巨鑫工艺品有限公司,http:////www.11467.com/shenzhen/co/971565.htm
深圳巨鑫工艺品有限公司的商铺,http://shenzhen0971565.11467.com
郑州中昆农业技术开发有限公司,http:////www.11467.com/zhengzhou/co/148040.htm
郑州中昆农业技术开发有限公司的商铺,http://zhengzhou0148040.11467.com
珠海市华纶无纺布有限公司,http:////www.11467.com/zhuhai/co/6091.htm
珠海市华纶无纺布有限公司的商铺,http://zhuhai06091.11467.com
嘉兴市金利雅纺织有限公司,http:////www.11467.com/jiaxing/co/81516.htm
嘉兴市金利雅纺织有限公司的商铺,http://jiaxing081516.11467.com
潮州市永进鞋业有限公司,http:////www.11467.com/chaozhou/co/30379.htm
潮州市永进鞋业有限公司的商铺,http://chaozhou030379.11467.com
深圳市永辉颜料科技有限公司,http:////www.11467.com/dongguan/co/410320.htm
深圳市永辉颜料科技有限公司的商铺,http://dongguan0410320.11467.com
淄博市淄川明硕化工厂,http:////www.11467.com/zibo/co/71532.htm
淄博市淄川明硕化工厂的商铺,http://zibo071532.11467.com
平山镇黄德航工艺制品经营部,http:////www.11467.com/yiyang/co/22887.htm
平山镇黄德航工艺制品经营部的商铺,http://yiyang022887.11467.com
四会市大沙镇奔腾藤业制品厂,http:////www.11467.com/zhaoqing/co/39934.htm
四会市大沙镇奔腾藤业制品厂的商铺,http://zhaoqing039934.11467.com
河北迅强丝网制品有限公司,http:////www.11467.com/hengshui/co/40449.htm
河北迅强丝网制品有限公司的商铺,http://hengshui040449.11467.com
赤壁市楚韵竹制工艺品厂,http:////www.11467.com/xianning/co/14828.htm
赤壁市楚韵竹制工艺品厂的商铺,http://xianning014828.11467.com
广西慧泉投资投资有限公司,http:////www.11467.com/nanning/co/98057.htm
广西慧泉投资投资有限公司的商铺,http://nanning098057.11467.com
句容市百事特复合材料有限公司,http:////www.11467.com/zhenjiang/co/54114.htm
凤凰县宝兴工矿产品经营部,http:////www.11467.com/xianxi/co/8426.htm
安徽省广德县燕子岭天然彩砂有限公司,http:////www.11467.com/xuancheng/co/16033.htm
广西河池圣诞工艺天然材料经营部,http:////www.11467.com/hechi/co/11063.htm
霍柏玲（个体经营）,http:////www.11467.com/heihe/co/18892.htm
彩片假发 格格铺子,http:////www.11467.com/yaan/co/7893.htm
延安丝网花工艺品店,http:////www.11467.com/yanan/co/12504.htm
佛山市顺德区巴德富实业有限公司,http:////www.11467.com/foshan/co/267224.htm
月亮（个体经营）,http:////www.11467.com/dingxi/co/8058.htm
李强《个体经营》,http:////www.11467.com/akesu/co/11061.htm
新屯奇石有限公司,http:////www.11467.com/aletai/co/5922.htm
邱亚琼（个体经营）,http:////www.11467.com/bazhong/co/6642.htm
临江市东江工艺制品有限责任公司,http:////www.11467.com/jilinshi/co/82373.htm
个体经营周燕,http:////www.11467.com/jingmen/co/15047.htm
三创工艺公司,http:////www.11467.com/jixi/co/20583.htm
云南彩沙砂文化传播有限公司,http:////www.11467.com/qujing/co/18437.htm
伊人坊手工饰品公司,http:////www.11467.com/shihezi/co/5493.htm
惠农区锦龙石膏粉厂,http:////www.11467.com/shizuishan/co/9827.htm
思特工艺品制造有限责任公司,http:////www.11467.com/shuangyashang/co/9225.htm
塔城市华砚科技有限责任公司,http:////www.11467.com/tacheng/co/8690.htm
马龙【个体经营】,http:////www.11467.com/tulufan/co/4565.htm
保定市赛恩科技发展有限公司,http:////www.11467.com/baoding/co/60302.htm
兴旺木业加工厂,http:////www.11467.com/baoding/co/81733.htm
湖南天通科技有限公司,http:////www.11467.com/changsha/co/91294.htm
常州市方鑫化工物资有限公司,http:////www.11467.com/changzhou/co/79840.htm
东莞市帝皇金工艺品有限公司,http:////www.11467.com/dongguan/co/167105.htm
东莞日彩工艺品材料有限公司,http:////www.11467.com/dongguan/co/164746.htm
东莞市博力斯玻璃纤维有限公司,http:////www.11467.com/dongguan/co/376495.htm
东莞市长安津华彩工艺材料商行,http:////www.11467.com/dongguan/co/351727.htm
东莞市佰仕特工艺制品有限公司,http:////www.11467.com/dongguan/co/458625.htm
东莞市石碣昌发服装辅料厂,http:////www.11467.com/dongguan/co/491875.htm
东莞市絮彩工艺品有限公司,http:////www.11467.com/dongguan/co/498937.htm
鸿远工艺辅料制品有限公司,http:////www.11467.com/dongguan/co/348328.htm
东莞市新时代金属颜料有限公司,http:////www.11467.com/dongguan/co/168836.htm
赖炳祥（个体经营）,http:////www.11467.com/dongguan/co/168926.htm
广州花盛工艺有限公司,http:////www.11467.com/guangzhou/co/195880.htm
广州飞霸商贸有限公司,http:////www.11467.com/guangzhou/co/470940.htm
广州高立织带饰品企业有限公司,http:////www.11467.com/guangzhou/co/196101.htm
中山市东鑫饰品配件有限公司,http:////www.11467.com/guangzhou/co/340703.htm
陕西汉中市中锐超微粉体材料厂广州办事处,http:////www.11467.com/guangzhou/co/162310.htm
杭州诚征机械有限公司,http:////www.11467.com/hangzhou/co/222414.htm
浙江加摩铝塑工业有限公司,http:////www.11467.com/hangzhou/co/277429.htm
东风汽车有限责任公司,http:////www.11467.com/huizhou/co/61031.htm
河南银城科技股份有限公司,http:////www.11467.com/jiaozuo/co/26596.htm
陋室茗茶业（花草茶）有限公司,http:////www.11467.com/jieyang/co/22254.htm
宏杨家具工艺品有限公司,http:////www.11467.com/jiujiang/co/21025.htm
聊城市东昌府区超琪葫芦工艺品有限公司,http:////www.11467.com/liaocheng/co/27098.htm
刘明,http:////www.11467.com/nanjing/co/56855.htm
福建省建瓯市玉林竹制品有限公司,http:////www.11467.com/nanping/co/40413.htm
福建省亮节工贸有限公司,http:////www.11467.com/nanping/co/40237.htm
南阳市丰源角雕工艺厂,http:////www.11467.com/nanyang/co/2402.htm
香港启发集团龙翔机械厂,http:////www.11467.com/ningbo/co/76686.htm
莆田市秀屿区恒达珠宝饰品有限公司,http:////www.11467.com/putian/co/24480.htm
青岛帝安食品配料有限公司销售部,http:////www.11467.com/qingdao/co/76802.htm
泉州恒兴胶业,http:////www.11467.com/quanzhou/co/95417.htm
伟邦有机硅(福建)有限公司,http:////www.11467.com/quanzhou/co/132751.htm
云南永顺水麻皮厂,http:////www.11467.com/qujing/co/19433.htm
滕发五金工艺玩具制品厂,http:////www.11467.com/shantou/co/133833.htm
汕头市鑫谷实业有限公司,http:////www.11467.com/shantou/co/122703.htm
绍兴市永恒熔炉厂,http:////www.11467.com/shaoxing/co/75867.htm
沈阳拜斯特复合材料有限公司销售部,http:////www.11467.com/shenyang/co/55402.htm
彩嘉科技发展有限公司技术部,http:////www.11467.com/shenzhen/co/607135.htm
深圳金彩箔业有限公司,http:////www.11467.com/shenzhen/co/792686.htm
深圳市龙岗区泛台有机玻璃（压克力）商行,http:////www.11467.com/shenzhen/co/613909.htm
深圳市美佳丽工艺品有限公司,http:////www.11467.com/shenzhen/co/224868.htm
河北顺达房地产投资经纪有限公司,http:////www.11467.com/shijiazhuang/co/81000.htm
龍鑫股份有限公司,http:////www.11467.com/weihai/co/47366.htm
乌马河和合贸易有限公司,http:////www.11467.com/yichunshi/co/16109.htm
黑龙江省伊春市美溪林业局种子公司,http:////www.11467.com/yichunshi/co/16108.htm
上海国韵实业有限公司,http:////www.11467.com/shanghai/co/538955.htm
上海大唐盛隆制冷科技有限公司,http:////www.11467.com/shanghai/co/1099175.htm
东莞市汇欣实业有限公司,http:////www.11467.com/dongguan/co/489222.htm
临沂雪艺柳编有限公司,http:////www.11467.com/linyi/co/94462.htm
东莞中鼎模具硅橡胶有机硅胶材料公司,http:////www.11467.com/dongguan/co/489449.htm
得丰木业有限公司,http:////www.11467.com/jiangmen/co/84616.htm
汶川县岷山金刚砂有限责任公司,http:////www.11467.com/aba/co/4766.htm
安徽安庆景泰蓝工艺厂,http:////www.11467.com/anqing/co/24386.htm
爱心陶陶艺工作室,http:////www.11467.com/anshan/co/70786.htm
赵季雪(个体经营),http:////www.11467.com/anshan/co/73175.htm
华艺工艺品加工厂,http:////www.11467.com/anyang/co/26585.htm
河南工艺加工有限公司,http:////www.11467.com/anyang/co/29281.htm
双龙工艺制品公司,http:////www.11467.com/baise/co/10550.htm
曲阳兴辉石材雕刻有限公司,http:////www.11467.com/baoding/co/80006.htm
新港树脂模具制造公司,http:////www.11467.com/baoding/co/55787.htm
秦麦成（个体经营）,http:////www.11467.com/baoji/co/24509.htm
谷立君（个体经营）,http:////www.11467.com/baoji/co/28645.htm
风翔县吉祥农产品专业合作社,http:////www.11467.com/baoji/co/24552.htm
包头市昆区逸雅阁书画店,http:////www.11467.com/baotou/co/25893.htm
包头懋隆白银饰品有限责任公司,http:////www.11467.com/baotou/co/25841.htm
鲁门工艺品有限公司,http:////www.11467.com/baotou/co/23530.htm
广西北海伍福珍珠养殖场,http:////www.11467.com/beihai/co/14207.htm
西宁市标本制作中心,http:////www.11467.com/benxi/co/28677.htm
富键产品集团有限公司,http:////www.11467.com/shenzhen/co/225506.htm
江西都昌进珍珠贝类有限公司,http:////www.11467.com/shenzhen/co/607646.htm
贸联饰品配件厂,http:////www.11467.com/shenzhen/co/604724.htm
深圳红叶杰液体硅胶有限公司,http:////www.11467.com/shenzhen/co/766524.htm
李梅,http:////www.11467.com/shenzhen/co/726878.htm
华宇工艺制品有限公司,http:////www.11467.com/shenzhen/co/609938.htm
深圳市奥贝迪塑胶电子有限公司,http:////www.11467.com/shenzhen/co/725129.htm
深圳曹氏光大贝壳工艺品有限公司,http:////www.11467.com/shenzhen/co/761110.htm
深圳市彩嘉科技发展有限公司(业务部),http:////www.11467.com/shenzhen/co/238898.htm
深圳市杰华文具有限公司——业务部,http:////www.11467.com/shenzhen/co/235921.htm
深圳市惠轩工艺品有限公司,http:////www.11467.com/shenzhen/co/769992.htm
深圳龙岗区平湖信利植绒经销部,http:////www.11467.com/shenzhen/co/792685.htm
深圳诺奥贸易有限公司,http:////www.11467.com/shenzhen/co/229404.htm
深圳市金盛兴工艺制品有限公司,http:////www.11467.com/shenzhen/co/795014.htm
深圳市华盛康波丽材料有限公司,http:////www.11467.com/shenzhen/co/223875.htm
深圳市龙岗区坪地福合兴织带厂,http:////www.11467.com/shenzhen/co/578219.htm
深圳市絮彩科技有限公司,http:////www.11467.com/shenzhen/co/223911.htm
苏州赛恩灵程机械制造有限公司,http:////www.11467.com/suzhou/co/269682.htm
台州市黄岩杨木夹板有限公司,http:////www.11467.com/taizhou/co/82216.htm
台州市黄岩永大工艺线带有限公司,http:////www.11467.com/taizhou/co/98535.htm
台州市万丰林业有限公司,http:////www.11467.com/taizhou/co/139765.htm
陕西威仕花业有限公司,http:////www.11467.com/xian/co/55239.htm
徐州四方铝业集团有限公司,http:////www.11467.com/xuzhou/co/52971.htm
阳江市杰奇美甲美容制品有限公司,http:////www.11467.com/yangjiang/co/17157.htm
宁夏宏昌房地产开发有限公司,http:////www.11467.com/yinchuan/co/38729.htm
郑州三立科技有限公司水晶系列,http:////www.11467.com/zhengzhou/co/127512.htm
丹阳尊泰光学眼镜有限公司,http:////www.11467.com/zhenjiang/co/64299.htm
项城市王明口金凯利德皮件厂,http:////www.11467.com/zhoukou/co/21181.htm
北京昌琪树脂工艺品厂,http:////www.11467.com/beijing/co/710539.htm
夜郎工艺品综合开发有限公司,http:////www.11467.com/bijie/co/8463.htm
山东省博兴县永祥纸绳厂,http:////www.11467.com/binzhou/co/18610.htm
河南安科电子技术有限公司,http:////www.11467.com/bozhou/co/9052.htm
林金桥（个体经营）,http:////www.11467.com/cangzhou/co/42897.htm
沧州市运西恒泰文印中心,http:////www.11467.com/cangzhou/co/42871.htm
吉林恒德贸易有限公司,http:////www.11467.com/changchun/co/77231.htm
长春市净月勤俭五金工具厂,http:////www.11467.com/changchun/co/70932.htm
梦幻工坊软陶吧,http:////www.11467.com/changchun/co/70790.htm
歧薇结古韵坊,http:////www.11467.com/changchun/co/70666.htm
临澧县鼎盛精铸技术有限责任公司,http:////www.11467.com/changde/co/24188.htm
好朋友文具用品公司,http:////www.11467.com/changde/co/31847.htm
龙阳贝壳加工厂,http:////www.11467.com/changde/co/30803.htm
红湘沙工艺制品有限公司,http:////www.11467.com/changsha/co/91530.htm
长沙平盛巧妙佳佳坊,http:////www.11467.com/changsha/co/91056.htm
长沙礼品有限公司,http:////www.11467.com/changsha/co/121430.htm
长沙美诺农产品贸易有限公司,http:////www.11467.com/changsha/co/76386.htm
福商装饰工艺品有限公司,http:////www.11467.com/changsha/co/76525.htm
湖南花泥画制造工作坊,http:////www.11467.com/changsha/co/76537.htm
黑风侠电脑公司,http:////www.11467.com/changsha/co/75919.htm
湖南远剑景泰蓝蓝工艺制作中心,http:////www.11467.com/changsha/co/76467.htm
潘之光（个体经营）,http:////www.11467.com/changsha/co/76300.htm
轻风逐梦手工作坊,http:////www.11467.com/changsha/co/76217.htm
唐定坤食品有限公司,http:////www.11467.com/changsha/co/76178.htm
常州宏洲光电材料有限公司,http:////www.11467.com/changzhou/co/76926.htm
福莲水晶店,http:////www.11467.com/changzhou/co/94458.htm
江苏省常州市鹏强针纺织品有限公司,http:////www.11467.com/changzhou/co/117456.htm
常州市武进庞氏模具有限公司,http:////www.11467.com/changzhou/co/28508.htm
中国 江苏 常州 轩苑园花艺有限公司,http:////www.11467.com/changzhou/co/94655.htm
潮州市枫溪区仕兴木艺制品厂,http:////www.11467.com/chaozhou/co/27136.htm
广东省潮州市开发区修杰装饰材料厂,http:////www.11467.com/chaozhou/co/26235.htm
潮州星光公司,http:////www.11467.com/chaozhou/co/27074.htm
蓝蝶水晶花艺坊,http:////www.11467.com/chaozhou/co/27094.htm
承德盛京工贸有限公司,http:////www.11467.com/chengde/co/20870.htm
宋艳超（个体经营）,http:////www.11467.com/chengde/co/22062.htm
成都紫鹰商贸有限公司,http:////www.11467.com/chengdu/co/65115.htm
成都创意丝网花艺社有限公司,http:////www.11467.com/chengdu/co/117100.htm
成都市华怡达化工有限责任公司,http:////www.11467.com/chengdu/co/117644.htm
乌鲁木齐市地矿局矿山服务公司,http:////www.11467.com/chengdu/co/88739.htm
