滨州市三利快餐有限公司,http:////www.11467.com/binzhou/co/10166.htm
北京天锄快餐配送中心,http:////www.11467.com/beijing/co/287933.htm
深圳悠顿餐饮文化管理有限公司,http:////www.11467.com/shenzhen/co/1137158.htm
深圳悠顿餐饮文化管理有限公司的商铺,http://shenzhen01137158.11467.com
山东吉满屋餐饮管理咨询有限公司,http:////www.11467.com/jinan/co/157368.htm
山东吉满屋餐饮管理咨询有限公司的商铺,http://jinan0157368.11467.com
济南华客餐饮管理咨询有限公司,http:////www.11467.com/jinan/co/144906.htm
济南华客餐饮管理咨询有限公司的商铺,http://jinan0144906.11467.com
济南草缘食尚有限公司,http:////www.11467.com/jinan/co/157469.htm
济南草缘食尚有限公司的商铺,http://jinan0157469.11467.com
河南西兰阁餐饮服务有限公司,http:////www.11467.com/zhengzhou/co/52636.htm
北京盛世民众餐饮管理有限责任公司,http:////www.11467.com/beijing/co/10867.htm
济南瓦罐香沸酒店管理有限公司,http:////www.11467.com/jinan/co/141135.htm
长沙琰食坊电子商务有限公司,http:////www.11467.com/changsha/co/220561.htm
郑州市金水区马大姐中式快餐店,http:////www.11467.com/zhengzhou/co/254959.htm
信阳市浉河区茉莉学堂中式快餐店第一分店,http:////www.11467.com/xinyang/co/37989.htm
裕华台资味快餐店,http:////www.11467.com/shijiazhuang/co/271520.htm
保定白沟新城乡满客快餐店,http:////www.11467.com/baoding/co/161448.htm
北京阳光永和豆浆快餐有限公司,http:////www.11467.com/beijing/co/632655.htm
上海吉野家快餐有限公司,http:////www.11467.com/shanghai/co/996170.htm
湛江市霞山区饭饭之辈快餐店,http:////www.11467.com/zhanjiang/co/52801.htm
南宁肯德基有限公司,http:////www.11467.com/nanning/co/52896.htm
石狮市稀粥贤快餐厅,http:////www.11467.com/quanzhou/co/117931.htm
深圳市福田区正和丰城市快餐,http:////www.11467.com/shenzhen/co/61205.htm
石家庄市仕豪餐饮有限公司,http:////www.11467.com/shijiazhuang/co/71044.htm
广州真功夫快餐连锁管理有限公司珠海市紫荆分公司,http:////www.11467.com/zhuhai/co/94958.htm
北京福满仓快餐有限公司,http:////www.11467.com/beijing/co/168421.htm
嘉兴好管家餐饮管理有限公司,http:////www.11467.com/jiaxing/co/135299.htm
洛阳颐云餐饮管理服务有限公司,http:////www.11467.com/luoyang/co/69774.htm
驻马店市新东方快餐有限公司,http:////www.11467.com/zhumadian/co/35105.htm
遂溪县遂城喜悦快餐店,http:////www.11467.com/zhanjiang/co/64047.htm
浈江区创记煲仔快餐店,http:////www.11467.com/shaoguan/co/38518.htm
惠州市惠城区尹食无忧快餐店,http:////www.11467.com/huizhou/co/128762.htm
哈尔滨西面来风餐饮管理有限公司,http:////www.11467.com/haerbin/co/75982.htm
广州市天河区东棠杜文波快餐店,http:////www.11467.com/guangzhou/co/685537.htm
惠州市仲恺高新区兰芳快餐店,http:////www.11467.com/huizhou/co/139009.htm
清远市清城区小湘村快餐店,http:////www.11467.com/qingyuan/co/46474.htm
深圳市南山区秦食明月烧味店,http:////www.11467.com/shenzhen/co/1075903.htm
桥西区少雄快餐店,http:////www.11467.com/shijiazhuang/co/232789.htm
揭阳市榕城区小淋快餐店,http:////www.11467.com/jieyang/co/47638.htm
裕华区西点扒王快餐销售店,http:////www.11467.com/shijiazhuang/co/240455.htm
保定市莲池区哈哈仔快餐店,http:////www.11467.com/baoding/co/138037.htm
唐县西部经典牛排快餐店,http:////www.11467.com/baoding/co/138562.htm
驻马店市驿城区金源快餐店,http:////www.11467.com/zhumadian/co/41296.htm
裕华区江源道快餐店,http:////www.11467.com/shijiazhuang/co/246706.htm
保定市莲池区秦岭快餐店,http:////www.11467.com/baoding/co/144535.htm
桥西区点点快餐店,http:////www.11467.com/shijiazhuang/co/254721.htm
元氏县德克士快餐店,http:////www.11467.com/shijiazhuang/co/257663.htm
保定市莲池区猫叔快餐店,http:////www.11467.com/baoding/co/150172.htm
郑州市金水区黑妞快餐坊,http:////www.11467.com/zhengzhou/co/243389.htm
平顶山市新华区真味坊快餐店,http:////www.11467.com/pingdingshan/co/35932.htm
开发区百味轩快餐店,http:////www.11467.com/kaifeng/co/34151.htm
郑州高新区米多面多红梅快餐店,http:////www.11467.com/zhengzhou/co/246412.htm
日照市东港区彤牛麻辣香锅店,http:////www.11467.com/qiye/93037142.htm
曹王镇宇辉快餐桌加工厂,http:////www.11467.com/binzhou/co/41893.htm
长阳美食美客快餐店,http:////www.11467.com/yichang/co/53899.htm
黄冈德尔福商贸有限责任公司步行街快餐店,http:////www.11467.com/huanggang/co/17955.htm
宁洱姐妹快餐店,http:////www.11467.com/puer/co/8298.htm
佛山市三水区乐平镇日粤湘快餐店,http:////www.11467.com/foshan/co/356492.htm
顺德区均安镇半糖主义食店,http:////www.11467.com/foshan/co/357317.htm
海安县绿色快餐有限公司,http:////www.11467.com/nantong/co/140693.htm
百胜餐饮（沈阳）有限公司鞍山分公司,http:////www.11467.com/anshan/co/37072.htm
高唐县宏伟快餐店,http:////www.11467.com/baoding/co/77930.htm
高唐县隆兴快餐宾馆,http:////www.11467.com/baoding/co/78010.htm
保定市吉田家快餐管理有限公司,http:////www.11467.com/baoding/co/76166.htm
蚌埠市天天永和豆浆快餐厅车站店,http:////www.11467.com/bengbu/co/33219.htm
邹平台子火烧,http:////www.11467.com/binzhou/co/33029.htm
滨州经济开发区艺晨快餐店,http:////www.11467.com/binzhou/co/33115.htm
滨州经济开发区恒达快餐店,http:////www.11467.com/binzhou/co/33166.htm
滨州经济开发区黄河园火锅快餐店,http:////www.11467.com/binzhou/co/34414.htm
滨州市滨城区圆圆快餐店,http:////www.11467.com/binzhou/co/32128.htm
滨州市滨城区润泉快餐店,http:////www.11467.com/binzhou/co/32103.htm
滨州市滨城区蔡林记热干面店,http:////www.11467.com/binzhou/co/32603.htm
厦门肯德基有限公司潮州分公司,http:////www.11467.com/chaozhou/co/19974.htm
成都六十度营养快餐有限公司,http:////www.11467.com/chengdu/co/186181.htm
成都市青羊区乔记滇味过桥米线店,http:////www.11467.com/chengdu/co/67221.htm
大连味千餐饮有限公司,http:////www.11467.com/dalian/co/15334.htm
齐河县传承超意兴快餐店,http:////www.11467.com/dezhou/co/46968.htm
平原县金海圆快餐店,http:////www.11467.com/dezhou/co/46798.htm
宁津县麦尚客快餐厅,http:////www.11467.com/dezhou/co/42098.htm
德州市德城区南龙荣食方快餐连锁店,http:////www.11467.com/dezhou/co/47033.htm
东莞市大岭山班长池上快餐店,http:////www.11467.com/dongguan/co/465313.htm
东莞市凤岗裕钦海鲜档,http:////www.11467.com/dongguan/co/485565.htm
东营区有滋有味快餐店,http:////www.11467.com/dongying/co/39884.htm
东营开发区天山快餐店,http:////www.11467.com/dongying/co/41594.htm
东营区文龙川味快餐店,http:////www.11467.com/dongying/co/41642.htm
东营开发区独特快餐店,http:////www.11467.com/dongying/co/41713.htm
东营区福满地快餐店,http:////www.11467.com/dongying/co/40583.htm
东营区成合锅贴铺,http:////www.11467.com/dongying/co/40339.htm
河口区河康小区饶记快餐店,http:////www.11467.com/dongying/co/40369.htm
山东省喜文化和佳乐快餐有限责任公司垦利一店,http:////www.11467.com/dongying/co/38179.htm
河口区河兴小区小新快餐店,http:////www.11467.com/dongying/co/40649.htm
东营区胜凯川味快餐店,http:////www.11467.com/dongying/co/39901.htm
东营区香沅桥过桥米线店,http:////www.11467.com/dongying/co/40300.htm
东营区食全食美快餐店,http:////www.11467.com/dongying/co/40189.htm
山东省喜文化和佳乐快餐有限责任公司,http:////www.11467.com/dongying/co/41543.htm
恩施市巴硒客中式快餐店,http:////www.11467.com/enshi/co/13269.htm
佛山市南海大沥鉴威烧腊快餐店,http:////www.11467.com/foshan/co/333170.htm
佛山市禅城区鸿斌快餐店,http:////www.11467.com/foshan/co/332637.htm
广州真功夫快餐连锁管理有限公司佛山市禅城区大福分店,http:////www.11467.com/foshan/co/322976.htm
广州真功夫快餐连锁管理有限公司南海鸿大广场分店,http:////www.11467.com/foshan/co/335257.htm
广州真功夫快餐连锁管理有限公司佛山禅城汾江分公司,http:////www.11467.com/foshan/co/307613.htm
阜阳市颍州区黄师傅快餐店,http:////www.11467.com/fuyang/co/29868.htm
阜阳市颍州区黄师傅快餐店莲花路分店,http:////www.11467.com/fuyang/co/33184.htm
福州新石山水西餐酒廊有限公司,http:////www.11467.com/fuzhou/co/5907.htm
上海真功夫快餐管理有限公司福州茶亭分店,http:////www.11467.com/fuzhou/co/178013.htm
福州市鼓楼区蓝田快餐店,http:////www.11467.com/fuzhou/co/177400.htm
广州真功夫快餐连锁管理有限公司花都百业分公司,http:////www.11467.com/guangzhou/co/452494.htm
广州真功夫快餐连锁管理有限公司长沙南站分公司,http:////www.11467.com/guangzhou/co/434941.htm
安徽肥西老母鸡快餐有限公司,http:////www.11467.com/hefei/co/112913.htm
合肥市美好快餐配送有限公司,http:////www.11467.com/hefei/co/127800.htm
郓城县快乐一家人快餐店,http:////www.11467.com/heze/co/30416.htm
巨野县万丰镇苏集村顺通快餐部,http:////www.11467.com/heze/co/30259.htm
湖州吴兴土八禄烤吧,http:////www.11467.com/huzhou/co/64512.htm
广州真功夫快餐连锁管理有限公司开平幕沙分公司,http:////www.11467.com/jiangmen/co/110448.htm
桐乡市永洁快餐配送有限公司,http:////www.11467.com/jiaxing/co/111507.htm
济南百思特快餐食品有限公司,http:////www.11467.com/jinan/co/129905.htm
济南四喜居快餐有限责任公司,http:////www.11467.com/jinan/co/3970.htm
晋城市筷子兄弟快餐有限公司,http:////www.11467.com/jincheng/co/22063.htm
济宁永源放心早餐工程有限公司,http:////www.11467.com/jining/co/40207.htm
曲阜市士雷罐罐香过桥米线店,http:////www.11467.com/jining/co/67645.htm
莱芜市莱城区泽瑞快餐店,http:////www.11467.com/laiwu/co/13531.htm
莱芜市玲玲快餐店,http:////www.11467.com/laiwu/co/14410.htm
莱芜市莱城区聚友缘快餐店,http:////www.11467.com/laiwu/co/13465.htm
三河市蓉诚锦绣快餐有限公司,http:////www.11467.com/langfang/co/44060.htm
兰州肯德基有限公司,http:////www.11467.com/lanzhou/co/48898.htm
咸丰县红旺西式快餐,http:////www.11467.com/leshan/co/21374.htm
聊城市东昌府区麻辣时代重庆鸡公堡快餐店,http:////www.11467.com/liaocheng/co/47510.htm
聊城市东昌府区品味非凡快餐店建设路二店,http:////www.11467.com/liaocheng/co/49158.htm
聊城市东昌府区竹壶小居快餐店,http:////www.11467.com/liaocheng/co/49128.htm
聊城市开发区慧鑫快餐厅,http:////www.11467.com/liaocheng/co/46734.htm
临沭县莲连有鱼快餐店,http:////www.11467.com/linyi/co/89835.htm
临沭县雨昊快餐店,http:////www.11467.com/linyi/co/90353.htm
沂南县思味特快餐店,http:////www.11467.com/linyi/co/90412.htm
临沂市兰山区海波快餐店,http:////www.11467.com/linyi/co/90938.htm
临沂市兰山区富茂水饺城,http:////www.11467.com/linyi/co/89968.htm
温州市八仟客快餐厅丽水分店,http:////www.11467.com/lishui/co/30533.htm
马鞍山市王仁和米线店,http:////www.11467.com/maanshan/co/25301.htm
江西裕霖实业有限公司,http:////www.11467.com/nanchang/co/57852.htm
南京小菜一碟快餐管理有限公司,http:////www.11467.com/nanjing/co/131374.htm
南京月季丽华快餐管理有限公司第二分公司,http:////www.11467.com/nanjing/co/135244.htm
南宁市族一新餐饮有限责任公司,http:////www.11467.com/nanning/co/56019.htm
上海真功夫快餐管理有限公司宁波海曙分公司,http:////www.11467.com/ningbo/co/169908.htm
上海真功夫快餐管理有限公司慈溪浒崇路分公司,http:////www.11467.com/ningbo/co/166368.htm
威海经济技术开发区西北人家牛肉面快餐店,http:////www.11467.com/qingdao/co/151653.htm
晋江市陈埭镇常乐基快餐店下村分店,http:////www.11467.com/quanzhou/co/123742.htm
晋江市陈埭镇常乐基西式快餐店福埔分店,http:////www.11467.com/quanzhou/co/120861.htm
晋江市陈埭镇常乐基西式快餐店梅岭分店,http:////www.11467.com/quanzhou/co/124693.htm
长安区金街快餐店,http:////www.11467.com/shijiazhuang/co/130621.htm
苏州市苏通快餐服务有限公司,http:////www.11467.com/suzhou/co/307517.htm
奎屯阿尔泰服务有限责任公司,http:////www.11467.com/tacheng/co/5265.htm
肥城市永丰快餐店,http:////www.11467.com/taian/co/49194.htm
肥城市永顺快餐店,http:////www.11467.com/taian/co/50123.htm
肥城市风味轩快餐店,http:////www.11467.com/taian/co/49852.htm
肥城市缘聚阁快餐店,http:////www.11467.com/taian/co/50196.htm
肥城市鸡祥美味快餐店,http:////www.11467.com/taian/co/50219.htm
肥城市教师村快餐店,http:////www.11467.com/taian/co/49643.htm
肥城市小螺号快餐店,http:////www.11467.com/taian/co/50144.htm
肥城市程记砂锅米线店,http:////www.11467.com/taian/co/50083.htm
肥城市味美斋快餐店,http:////www.11467.com/taian/co/50247.htm
肥城市小城故事快餐店,http:////www.11467.com/taian/co/49366.htm
肥城市奥赛过桥米线店,http:////www.11467.com/taian/co/50201.htm
昌邑市鑫金泉快餐店,http:////www.11467.com/weifang/co/111612.htm
安丘市仕莲快餐店,http:////www.11467.com/weifang/co/109946.htm
寿光市国亮老潍县芥茉鸡快餐店,http:////www.11467.com/weifang/co/110737.htm
诸城市信德快餐店,http:////www.11467.com/weifang/co/109644.htm
坊子区胖仔过桥米线店,http:////www.11467.com/weifang/co/109728.htm
潍坊人民商城名吃朝天锅,http:////www.11467.com/weifang/co/109661.htm
威海经济技术开发区川人川味快餐店,http:////www.11467.com/weihai/co/46325.htm
威海经济技术开发区宝君快餐店,http:////www.11467.com/weihai/co/46514.htm
威海市敬兰风味快餐有限公司,http:////www.11467.com/weihai/co/7740.htm
文登市天福办董文学绿豆饼店,http:////www.11467.com/weihai/co/43619.htm
威海经济技术开发区满街香过桥米线店,http:////www.11467.com/weihai/co/46351.htm
威海经济技术开发区刘记一品香快餐店,http:////www.11467.com/weihai/co/46327.htm
威海经济技术开发区辣妹子米线店,http:////www.11467.com/weihai/co/46480.htm
威海经济技术开发区鑫鑫源快餐店,http:////www.11467.com/weihai/co/46343.htm
文登市和美园快餐店,http:////www.11467.com/weihai/co/43715.htm
荣成市港湾鸿宝快餐店,http:////www.11467.com/weihai/co/44101.htm
威海经济技术开发区聚鑫快餐店,http:////www.11467.com/weihai/co/46374.htm
威海经济技术开发区日月快餐店,http:////www.11467.com/weihai/co/46345.htm
杭州肯德基有限公司龙港龙跃分店,http:////www.11467.com/wenzhou/co/109300.htm
温州市八仟客快餐厅蟠凤分店,http:////www.11467.com/wenzhou/co/190851.htm
武汉钢城兴盛快餐食品有限公司,http:////www.11467.com/wuhan/co/119298.htm
武汉市江夏区红姐快餐店,http:////www.11467.com/wuhan/co/146942.htm
武汉味典快餐有限公司,http:////www.11467.com/wuhan/co/122616.htm
武汉市武昌区楚王爷快餐店,http:////www.11467.com/wuhan/co/148761.htm
无锡市开源现代快餐有限公司,http:////www.11467.com/wuxi/co/51078.htm
无锡市新康洁快餐有限责任公司,http:////www.11467.com/wuxi/co/242280.htm
陕西亚太宇工贸有限责任公司,http:////www.11467.com/xian/co/43287.htm
辉县市千帆快餐服务有限公司,http:////www.11467.com/xinxiang/co/30423.htm
徐州市艾大米国人快餐管理有限公司,http:////www.11467.com/xuzhou/co/69470.htm
龙口市黄城博士小区原白快餐店,http:////www.11467.com/yantai/co/149236.htm
福山区和事佬过桥米线店,http:////www.11467.com/yantai/co/150309.htm
秭归县茅坪镇国富快餐店,http:////www.11467.com/yichang/co/53382.htm
宜都市煲你满意快餐店,http:////www.11467.com/yichang/co/49018.htm
宜都市陆城客顺铁板烧店,http:////www.11467.com/yichang/co/51820.htm
远安县鸣凤镇铁板烧店,http:////www.11467.com/yichang/co/52038.htm
滕州市善园嘴嘴香时尚自助涮烤吧,http:////www.11467.com/zaozhuang/co/34631.htm
河南阿庆嫂实业有限公司,http:////www.11467.com/zhengzhou/co/81035.htm
广州真功夫快餐连锁管理有限公司中山小榄广源分公司,http:////www.11467.com/zhongshan/co/130438.htm
舟山市定海区必达快餐店,http:////www.11467.com/zhoushan/co/24188.htm
珠海市拱北夏湾乙峰快餐店,http:////www.11467.com/zhuhai/co/7832.htm
张店柳泉路乔波超意兴快餐店,http:////www.11467.com/zibo/co/96692.htm
桓台县城区逍客快餐店,http:////www.11467.com/zibo/co/96539.htm
博山城西乐士奇快餐厅,http:////www.11467.com/zibo/co/97401.htm
北京海俊峰快餐连锁有限公司厂洼店,http:////www.11467.com/beijing/co/450678.htm
北京惠众新欣快餐有限公司,http:////www.11467.com/beijing/co/165018.htm
北京龙城丽华快餐有限公司,http:////www.11467.com/beijing/co/36594.htm
北京午点快餐有限公司,http:////www.11467.com/beijing/co/164741.htm
北京正点快餐有限责任公司,http:////www.11467.com/beijing/co/349655.htm
马兰拉面快餐连锁有限责任公司,http:////www.11467.com/beijing/co/36664.htm
北京老家快餐有限责任公司,http:////www.11467.com/beijing/co/557459.htm
上海地盛餐饮管理有限公司,http:////www.11467.com/shanghai/co/261409.htm
上海急先锋中式快餐有限公司,http:////www.11467.com/shanghai/co/253730.htm
福记联合（上海）餐饮有限公司,http:////www.11467.com/shanghai/co/605857.htm
上海康胜快餐有限公司,http:////www.11467.com/shanghai/co/984436.htm
上海相见诚快餐合作公司,http:////www.11467.com/shanghai/co/234068.htm
上海谊兵快餐有限责任公司,http:////www.11467.com/shanghai/co/985720.htm
上海小杨餐饮发展有限公司,http:////www.11467.com/shanghai/co/261434.htm
上海新志快餐有限公司松江分公司,http:////www.11467.com/shanghai/co/900864.htm
上海真功夫快餐管理有限公司沪闵路分公司,http:////www.11467.com/shanghai/co/1026944.htm
上海浩民快餐服务有限公司,http:////www.11467.com/shanghai/co/356172.htm
河东区宇德快餐店,http:////www.11467.com/tianjin/co/66434.htm
阜阳市稻谷香快餐有限公司,http:////www.11467.com/fuyang/co/37780.htm
蚌埠市牛兄牛弟快餐店珠园分店,http:////www.11467.com/bengbu/co/38242.htm
息县天禾快餐店,http:////www.11467.com/xinyang/co/25921.htm
重庆市万盛经开区宽芳快餐店,http:////www.11467.com/chongqing/co/216856.htm
包头市尚骨精汤饸饹面有限公司,http:////www.11467.com/baotou/co/31743.htm
开平市三埠亿盈丰烧鹅快餐店,http:////www.11467.com/jiangmen/co/125086.htm
大连保税区正源餐饮管理服务中心,http:////www.11467.com/dalian/co/76051.htm
衡东县必旺客中式快餐店,http:////www.11467.com/hengyang/co/36738.htm
合肥市振华快餐有限公司重庆分公司,http:////www.11467.com/chongqing/co/244442.htm
芝罘区良君快餐店,http:////www.11467.com/yantai/co/180153.htm
滨州市沾化区羊汤无忌快餐店,http:////www.11467.com/binzhou/co/53335.htm
弥勒市红芬快餐店,http:////www.11467.com/honghe/co/20582.htm
吴川市黄坡禄记快餐店,http:////www.11467.com/zhanjiang/co/75542.htm
吴川市黄坡洪记快餐店,http:////www.11467.com/zhanjiang/co/77985.htm
雅山（北京）国际快餐连锁管理有限公司,http:////www.11467.com/qiye/23596924.htm
中山市沙溪镇七星切鸡烧味快餐店,http:////www.11467.com/zhongshan/co/217562.htm
重庆市合川区米可可快餐店,http:////www.11467.com/chongqing/co/314878.htm
连平县城深井烧鹅王快餐店,http:////www.11467.com/heyuan/co/36640.htm
中山市港口镇颖霞食店,http:////www.11467.com/zhongshan/co/226869.htm
深圳市秦记餐饮有限公司,http:////www.11467.com/shenzhen/co/1102486.htm
涞水县包大大快餐店,http:////www.11467.com/baoding/co/149458.htm
重庆市硒米饭快餐有限责任公司,http:////www.11467.com/chongqing/co/334031.htm
重庆玉脍丝莼快餐有限公司,http:////www.11467.com/chongqing/co/334946.htm
武义县熟溪街道祥新快餐店,http:////www.11467.com/jinhua/co/263372.htm
北京多利亚快餐有限公司,http:////www.11467.com/qiye/29536708.htm
合肥市蜀山区晋家门餐馆,http:////www.11467.com/qiye/29557629.htm
合肥市蜀山区蓉李记餐馆,http:////www.11467.com/qiye/29557677.htm
合肥市蜀山区湘之味餐馆,http:////www.11467.com/qiye/29557689.htm
合肥市蜀山区韩悦烤肉餐馆,http:////www.11467.com/qiye/29557690.htm
鸠江区陀陀妈快餐店,http:////www.11467.com/qiye/29648923.htm
合肥市蒸不同快餐店,http:////www.11467.com/qiye/29664534.htm
广德县随意点中式快餐店,http:////www.11467.com/qiye/29757746.htm
六安市金安区郭记餐馆,http:////www.11467.com/qiye/29907286.htm
阜阳市颍州区阿香快餐店,http:////www.11467.com/qiye/29938354.htm
北京新莲快餐有限公司,http:////www.11467.com/qiye/29957962.htm
北京鼎盛飘香快餐店,http:////www.11467.com/qiye/29962488.htm
乳山市武家餐馆,http:////www.11467.com/qiye/60229798.htm
乳山市东海滋味养生餐馆,http:////www.11467.com/qiye/60229913.htm
吐鲁番市马翠萍丸子快餐店,http:////www.11467.com/qiye/60240297.htm
安丘市生之源快餐店,http:////www.11467.com/qiye/60877454.htm
安丘市槐树岭餐馆,http:////www.11467.com/qiye/60983929.htm
七台河市桃山区迟家二嫂嫂子面快餐店,http:////www.11467.com/qiye/62283183.htm
龙口市黄城青辉餐馆,http:////www.11467.com/qiye/62760468.htm
龙口市黄城新悦快餐店,http:////www.11467.com/qiye/62964230.htm
吐鲁番市潇湘阁餐馆,http:////www.11467.com/qiye/63932083.htm
龙口市黄城福来顺快餐店,http:////www.11467.com/qiye/63989684.htm
安丘市洋洋快餐店,http:////www.11467.com/qiye/65008923.htm
龙口市黄城康宝快餐店,http:////www.11467.com/qiye/65086318.htm
安丘市味香村快餐厅泰华店,http:////www.11467.com/qiye/65189012.htm
北海市海城区阿皇仔烧腊快餐店长青路分店,http:////www.11467.com/qiye/65508390.htm
灵川县康师傅老公鸡餐馆,http:////www.11467.com/qiye/65681221.htm
滨州市滨城区滋美特中式快餐店,http:////www.11467.com/qiye/65722524.htm
哈尔滨市呼兰区新食客快餐店,http:////www.11467.com/qiye/66408947.htm
市南区聚鑫丰快餐店,http:////www.11467.com/qiye/66784693.htm
安丘市欣福湾快餐店,http:////www.11467.com/qiye/66929594.htm
市中区梁昌武餐馆,http:////www.11467.com/qiye/67357284.htm
伊宁县萨哈尔快餐厅,http:////www.11467.com/qiye/67900277.htm
龙口市东莱松岚好再来快餐部,http:////www.11467.com/qiye/67957153.htm
龙口市黄城恒康快餐,http:////www.11467.com/qiye/67996977.htm
龙口市黄城晨阳快餐,http:////www.11467.com/qiye/67996978.htm
乳山市红兵快餐厅,http:////www.11467.com/qiye/68073160.htm
张店过桥缘快餐店铝城店,http:////www.11467.com/qiye/68074819.htm
乳山市徐家镇欣荣餐馆,http:////www.11467.com/qiye/68376268.htm
七台河市桃山区孺子牛餐馆,http:////www.11467.com/qiye/68603987.htm
武修老乡餐馆,http:////www.11467.com/qiye/68649260.htm
沂南县高升餐馆,http:////www.11467.com/qiye/68759542.htm
安丘市庆海快餐店,http:////www.11467.com/qiye/69430493.htm
博兴县锦秋街道学院快餐店,http:////www.11467.com/qiye/69456759.htm
龙口市黄城华英餐馆,http:////www.11467.com/qiye/69484889.htm
济宁开发区新民餐馆,http:////www.11467.com/qiye/69691059.htm
龙口市黄城味口好米线快餐店,http:////www.11467.com/qiye/69774840.htm
嘉祥县城区全统永和豆浆快餐店,http:////www.11467.com/qiye/69820704.htm
安丘市徐记餐馆,http:////www.11467.com/qiye/71344989.htm
安丘市麦乐滋西式快餐店,http:////www.11467.com/qiye/71641171.htm
龙口市黄城红福快餐店,http:////www.11467.com/qiye/71800900.htm
枣庄市市中区宏发餐馆,http:////www.11467.com/qiye/72156353.htm
安丘市海波餐馆,http:////www.11467.com/qiye/72329977.htm
龙口市黄城福疆餐馆,http:////www.11467.com/qiye/72549191.htm
东平县商老庄乡潭坑涯鑫洁快餐部,http:////www.11467.com/qiye/72884747.htm
济宁市任城区多禾快餐店,http:////www.11467.com/qiye/72885163.htm
商河县竹香园快餐店,http:////www.11467.com/qiye/73052292.htm
承德市承房供热综合经营公司佳惠快餐部,http:////www.11467.com/chengde/co/867.htm
百胜餐饮（武汉）有限公司成都必胜客盐市口店,http:////www.11467.com/chengdu/co/71241.htm
百胜餐饮（武汉）有限公司成都必胜客春熙店,http:////www.11467.com/chengdu/co/71240.htm
成都奇香居餐饮连销有限公司,http:////www.11467.com/chengdu/co/51330.htm
成都市锦江区板凳抄手店,http:////www.11467.com/chengdu/co/66908.htm
成都市顺心快餐食品有限公司,http:////www.11467.com/chengdu/co/175490.htm
成都芊谷美味快餐有限公司,http:////www.11467.com/chengdu/co/214822.htm
成都食圣餐饮连锁管理有限公司,http:////www.11467.com/chengdu/co/69956.htm
成都市武侯区盛达快餐店,http:////www.11467.com/chengdu/co/189073.htm
成都万康快餐管理有限公司,http:////www.11467.com/chengdu/co/184238.htm
成都市武侯区一点味中式快餐科华店,http:////www.11467.com/chengdu/co/189230.htm
