社旗县粮食局城郊粮油付产品经营中心食为天快餐,http:////www.11467.com/nanyang/co/17210.htm
宁波海曙四方客美食有限公司,http:////www.11467.com/ningbo/co/41092.htm
宁波市卡萨布兰卡饮食有限公司,http:////www.11467.com/ningbo/co/61716.htm
宁波东钱湖旅游度假区向阳渔港酒店有限公司,http:////www.11467.com/ningbo/co/41671.htm
慈溪市古塘华骏快餐店,http:////www.11467.com/ningbo/co/176614.htm
宁波市海曙鑫兴餐厅,http:////www.11467.com/ningbo/co/46684.htm
宁波市鄞州古林诗羚快餐店,http:////www.11467.com/ningbo/co/166834.htm
宁波市鄞州古林爱心餐厅,http:////www.11467.com/ningbo/co/49789.htm
宁波市鄞州锦辉大酒店,http:////www.11467.com/ningbo/co/50635.htm
宁波采易得餐饮服务有限公司,http:////www.11467.com/ningbo/co/41280.htm
宁波又一村餐饮有限公司慈溪城东餐厅,http:////www.11467.com/ningbo/co/62086.htm
宁波市味一早餐食品有限公司西河馆,http:////www.11467.com/ningbo/co/48805.htm
宁波市鄞州下应匆忙客快餐店,http:////www.11467.com/ningbo/co/202206.htm
宁波市鄞州五乡奔山鲜快餐店,http:////www.11467.com/ningbo/co/167867.htm
宁波江东好来多美食店,http:////www.11467.com/ningbo/co/53976.htm
宁波市鄞州下应长富餐厅,http:////www.11467.com/ningbo/co/63313.htm
宁波市鄞州瞻岐阿玲快餐店,http:////www.11467.com/ningbo/co/171131.htm
浙江麦当劳餐厅食品有限公司宁波农工商餐厅,http:////www.11467.com/ningbo/co/43861.htm
宁波市镇海阳光餐饮服务有限公司海曙兴宁桥店,http:////www.11467.com/ningbo/co/60522.htm
宁波市北仑区新碶加一友快餐店,http:////www.11467.com/ningbo/co/166819.htm
宁波市江东德胜餐饮发展有限公司,http:////www.11467.com/ningbo/co/58073.htm
宁波市北仑扬城中式快餐店,http:////www.11467.com/ningbo/co/144834.htm
宁波市海曙顺旺基灵桥路美食馆,http:////www.11467.com/ningbo/co/49520.htm
宁波市海曙小平头饭店,http:////www.11467.com/ningbo/co/46597.htm
宁波市江东兴欣餐饮店,http:////www.11467.com/ningbo/co/56335.htm
宁德地区佳佳基美食有限公司,http:////www.11467.com/ningde/co/22796.htm
宁德市肯佳基美食有限公司,http:////www.11467.com/ningde/co/22920.htm
霞浦县吉来客中式快餐店东吾分店,http:////www.11467.com/ningde/co/33366.htm
霞浦县吉来客中式快餐店,http:////www.11467.com/ningde/co/33195.htm
福鼎市太姥山爱莱客中式快餐店,http:////www.11467.com/ningde/co/32913.htm
霞浦县一谷一粒中式快餐店,http:////www.11467.com/ningde/co/35168.htm
福鼎市白琳镇中环快餐店,http:////www.11467.com/ningde/co/31125.htm
上杭县古田镇影院快餐店,http:////www.11467.com/ningde/co/31482.htm
古田县鸿威快餐店,http:////www.11467.com/ningde/co/32303.htm
古田县志辉快餐店,http:////www.11467.com/ningde/co/32457.htm
攀枝花市东区昆然快餐店,http:////www.11467.com/panzhihua/co/2452.htm
萍乡市芦溪纸质快餐盒厂,http:////www.11467.com/pingxiang/co/4963.htm
莆田市秀屿区亦家中式快餐店,http:////www.11467.com/putian/co/37060.htm
莆田市荔城区邱林快餐店,http:////www.11467.com/putian/co/43145.htm
莆田市荔城区食汇快餐店,http:////www.11467.com/putian/co/40799.htm
莆田市城厢区丽琴阿敏早餐快餐店,http:////www.11467.com/putian/co/44734.htm
黔东南州麦德士餐饮有限公司,http:////www.11467.com/qiandongnan/co/10215.htm
都匀铁路福利公司饮食部,http:////www.11467.com/qiannan/co/8387.htm
青岛市新恒益实业发展总公司大众快餐店,http:////www.11467.com/qingdao/co/4551.htm
威海经济技术开发区雅汇快餐店,http:////www.11467.com/qingdao/co/151654.htm
威海经济技术开发区正好的过桥米线店,http:////www.11467.com/qingdao/co/151661.htm
威海经济技术开发区旺洋快餐店,http:////www.11467.com/qingdao/co/151656.htm
威海经济技术开发区利君快餐店,http:////www.11467.com/qingdao/co/151655.htm
青岛万和春商贸有限公司第一快餐店,http:////www.11467.com/qingdao/co/7881.htm
青岛新尚餐饮有限公司南京路分店,http:////www.11467.com/qingdao/co/47826.htm
青岛万和春商贸有限公司第二快餐店,http:////www.11467.com/qingdao/co/135023.htm
青岛大柳树饮食娱乐有限公司大柳树快餐店,http:////www.11467.com/qingdao/co/135599.htm
青岛老友记快餐有限公司,http:////www.11467.com/qingdao/co/130069.htm
青岛名都投资有限公司快餐配送分公司,http:////www.11467.com/qingdao/co/138357.htm
青岛新干线快餐食品有限公司,http:////www.11467.com/qingdao/co/144814.htm
威海经济技术开发区好食刻快餐店,http:////www.11467.com/qingdao/co/151651.htm
威海经济技术开发区韩香客快餐店,http:////www.11467.com/qingdao/co/151662.htm
青岛万和春商贸有限公司第三快餐店,http:////www.11467.com/qingdao/co/9427.htm
青岛红屋快餐食品有限公司闽江路分店,http:////www.11467.com/qingdao/co/144851.htm
清新县太和镇泽民大排档,http:////www.11467.com/qingyuan/co/7344.htm
北京老家快餐有限责任公司秦皇岛第一分公司,http:////www.11467.com/qinhuangdao/co/2935.htm
秦皇岛华联商城控股股份有限公司快餐城,http:////www.11467.com/qinhuangdao/co/2928.htm
北京老家快餐有限责任公司秦皇岛第二分公司,http:////www.11467.com/qinhuangdao/co/2936.htm
秦皇岛市海港区福寿德快餐店,http:////www.11467.com/qinhuangdao/co/2923.htm
秦皇岛市龙凤红木家具艺品有限公司快餐分公司,http:////www.11467.com/qinhuangdao/co/2931.htm
秦皇岛市麦哈姆快餐有限公司,http:////www.11467.com/qinhuangdao/co/2941.htm
秦皇岛开发区华盛快餐店,http:////www.11467.com/qinhuangdao/co/2501.htm
秦皇岛市岗升快餐有限公司,http:////www.11467.com/qinhuangdao/co/2938.htm
秦皇岛市海港燃料总公司综合商场澎润美味快餐,http:////www.11467.com/qinhuangdao/co/2921.htm
秦皇岛市北戴河区招大排档,http:////www.11467.com/qinhuangdao/co/13924.htm
秦皇岛马兰拉面快餐连锁有限责任公司,http:////www.11467.com/qinhuangdao/co/2929.htm
秦皇岛市同盛快餐有限公司,http:////www.11467.com/qinhuangdao/co/2926.htm
秦皇岛马兰拉面快餐连锁有限责任公司太阳城连锁店,http:////www.11467.com/qinhuangdao/co/2925.htm
秦皇岛市天天海鲜大排档,http:////www.11467.com/qinhuangdao/co/2924.htm
秦皇岛市同盛快餐有限公司秦皇岛分公司,http:////www.11467.com/qinhuangdao/co/11022.htm
海猫大排档,http:////www.11467.com/qinzhou/co/3314.htm
齐齐哈尔市百花园市场百花快餐综合服务部,http:////www.11467.com/qiqihaer/co/11671.htm
齐齐哈尔市龙沙区麦肯姆快餐店,http:////www.11467.com/qiqihaer/co/194.htm
齐齐哈尔市铁锋区金山快餐馆,http:////www.11467.com/qiqihaer/co/11694.htm
齐齐哈尔市齐站快餐部,http:////www.11467.com/qiqihaer/co/11787.htm
安溪县安德堡餐饮有限公司,http:////www.11467.com/quanzhou/co/75228.htm
丰泽区津津有味快餐店,http:////www.11467.com/quanzhou/co/136814.htm
丰泽区多味快餐店,http:////www.11467.com/quanzhou/co/138232.htm
安溪县凤城安德堡快餐厅,http:////www.11467.com/quanzhou/co/75353.htm
鲤城区赣川快餐店,http:////www.11467.com/quanzhou/co/134364.htm
晋江市安海闽家快餐店,http:////www.11467.com/quanzhou/co/137848.htm
德化县阿美快餐店,http:////www.11467.com/quanzhou/co/134424.htm
德化县友和快餐店,http:////www.11467.com/quanzhou/co/140108.htm
晋江市青阳镇赖小姑饮食店,http:////www.11467.com/quanzhou/co/77077.htm
晋江市罗山美乐快餐店,http:////www.11467.com/quanzhou/co/135867.htm
泉州市丰泽碧娥海鲜美食排档,http:////www.11467.com/quanzhou/co/6991.htm
南安市洪濑镇蒸师傅快餐店,http:////www.11467.com/quanzhou/co/144724.htm
晋江市陈埭镇常乐基西式快餐店英墩分店,http:////www.11467.com/quanzhou/co/122863.htm
泉州市驴仔大排档餐饮有限公司,http:////www.11467.com/quanzhou/co/2349.htm
晋江市梅岭振炎快餐店,http:////www.11467.com/quanzhou/co/144614.htm
晋江市青阳大山农家快餐店,http:////www.11467.com/quanzhou/co/135876.htm
天源食品（泉州）有限公司东湖分店,http:////www.11467.com/quanzhou/co/66852.htm
厦门肯德基有限公司石狮石光分店,http:////www.11467.com/quanzhou/co/66918.htm
鲤城区永和快餐店,http:////www.11467.com/quanzhou/co/144706.htm
石狮市锦丰快餐店,http:////www.11467.com/quanzhou/co/134198.htm
泉州洋葱头餐饮有限公司,http:////www.11467.com/quanzhou/co/88123.htm
石狮市壹加壹快餐店,http:////www.11467.com/quanzhou/co/134357.htm
晋江市灵源刚记牛肉快餐店,http:////www.11467.com/quanzhou/co/137749.htm
南安市仑苍洪双河快餐店,http:////www.11467.com/quanzhou/co/138914.htm
晋江市陈埭镇常乐基西式快餐店磁灶分店,http:////www.11467.com/quanzhou/co/141184.htm
晋江市陈埭镇常乐基西式快餐店乌桥分店,http:////www.11467.com/quanzhou/co/140801.htm
衢州市浙工大浙西分校后勤服务有限公司,http:////www.11467.com/quzhou/co/16357.htm
杭州肯德基有限公司衢州东方分店,http:////www.11467.com/quzhou/co/17006.htm
日照市岚山区龙润海鲜快餐店,http:////www.11467.com/rizhao/co/23713.htm
日照市东港区华莱士快餐店,http:////www.11467.com/rizhao/co/29457.htm
北京康康快餐娱乐有限公司日照百货大楼分公司,http:////www.11467.com/rizhao/co/18344.htm
永安市李庆财快餐店,http:////www.11467.com/sanming/co/38257.htm
明溪县永恒快餐店,http:////www.11467.com/sanming/co/37274.htm
三明市电影公司麦肯姆西式快餐店,http:////www.11467.com/sanming/co/1180.htm
虞城县有意思快餐店,http:////www.11467.com/shangqiu/co/21392.htm
横峰县匆食客快餐连锁店,http:////www.11467.com/shangrao/co/27540.htm
汕头市龙湖区海鸥快餐店,http:////www.11467.com/shantou/co/2331.htm
汕头市龙湖区金饭碗量贩式快餐店,http:////www.11467.com/shantou/co/151815.htm
汕头市龙湖区金霞诚福快餐店,http:////www.11467.com/shantou/co/2456.htm
海丰县城海众猪脚快餐店,http:////www.11467.com/shanwei/co/18715.htm
浈江区快乐麦肯西式快餐店,http:////www.11467.com/shaoguan/co/29593.htm
杭州肯德基有限公司上虞解放分店,http:////www.11467.com/shaoxing/co/43809.htm
上虞市崧厦镇小龙快餐店,http:////www.11467.com/shaoxing/co/103197.htm
绍兴市越城金兴小吃店,http:////www.11467.com/shaoxing/co/63142.htm
新昌县大市聚镇小三快餐店,http:////www.11467.com/shaoxing/co/125630.htm
诸暨市城北来顺心快餐店,http:////www.11467.com/shaoxing/co/125692.htm
诸暨市新味来快餐店艮塔分店,http:////www.11467.com/shaoxing/co/105965.htm
辽宁合兴快餐有限公司,http:////www.11467.com/shenyang/co/4747.htm
辽宁合兴快餐有限公司维华店,http:////www.11467.com/shenyang/co/11877.htm
辽宁合兴快餐有限公司中街店,http:////www.11467.com/shenyang/co/4746.htm
辽宁合兴快餐有限公司沈阳中华路冰淇淋店,http:////www.11467.com/shenyang/co/99145.htm
辽宁合兴快餐有限公司乐购店,http:////www.11467.com/shenyang/co/9907.htm
辽宁合兴快餐有限公司北站店,http:////www.11467.com/shenyang/co/4749.htm
沈阳市家食乐豆浆餐饮中心,http:////www.11467.com/shenyang/co/37009.htm
沈阳市流星餐饮有限公司,http:////www.11467.com/shenyang/co/40812.htm
沈阳市沈河区金秀源春饼店,http:////www.11467.com/shenyang/co/41803.htm
沈阳市速源快餐食品配送中心,http:////www.11467.com/shenyang/co/94831.htm
沈阳市食神营养快餐有限公司,http:////www.11467.com/shenyang/co/41501.htm
沈阳市沈河区郭太餐吧,http:////www.11467.com/shenyang/co/41776.htm
沈阳金融商贸开发区唯植曼快餐屋,http:////www.11467.com/shenyang/co/34597.htm
沈阳兴凯商贸有限责任公司,http:////www.11467.com/shenyang/co/49039.htm
沈阳市鑫哈哈快餐服务管理有限责任公司,http:////www.11467.com/shenyang/co/92831.htm
沈阳顶好快餐有限公司南京街专卖店,http:////www.11467.com/shenyang/co/393.htm
北京时新餐饮有限公司朝阳区霄云路店,http:////www.11467.com/shenyang/co/19756.htm
百胜餐饮（沈阳）有限公司肯德基保工店,http:////www.11467.com/shenyang/co/19781.htm
沈阳西咪营养餐配送有限公司,http:////www.11467.com/shenyang/co/41999.htm
沈阳尚岛餐饮有限公司,http:////www.11467.com/shenyang/co/40301.htm
百胜餐饮（沈阳）有限公司肯德基顺城店,http:////www.11467.com/shenyang/co/19775.htm
沈阳市御手熏酱风味快餐店,http:////www.11467.com/shenyang/co/43229.htm
沈阳比萨利亚餐饮有限公司,http:////www.11467.com/shenyang/co/30861.htm
沈阳多多益膳食品有限公司第一分公司,http:////www.11467.com/shenyang/co/29332.htm
深圳赛百味餐饮发展有限公司,http:////www.11467.com/shenzhen/co/86924.htm
深圳市宝安区伟旺中西快餐店,http:////www.11467.com/shenzhen/co/34935.htm
深圳市福田区广玉兰快餐店,http:////www.11467.com/shenzhen/co/95628.htm
深圳市福田区肥仔海鲜大排档,http:////www.11467.com/shenzhen/co/8782.htm
深圳市福田区美食客来,http:////www.11467.com/shenzhen/co/61448.htm
深圳市宝安区石岩哈麦基汉堡餐厅,http:////www.11467.com/shenzhen/co/92479.htm
深圳市福田区新福临快餐店,http:////www.11467.com/shenzhen/co/60782.htm
深圳市花溪王快餐有限公司,http:////www.11467.com/shenzhen/co/8791.htm
深圳市红食坊餐饮有限公司,http:////www.11467.com/shenzhen/co/8870.htm
深圳市罗湖区怡点心西餐厅,http:////www.11467.com/shenzhen/co/80967.htm
深圳市南山区嘉维咖啡厅,http:////www.11467.com/shenzhen/co/77239.htm
深圳市千味园食品实业有限公司溪头分店,http:////www.11467.com/shenzhen/co/75750.htm
深圳市罗湖区李记潮汕快餐店,http:////www.11467.com/shenzhen/co/85555.htm
温州市瓯海新桥八方来客快餐店,http:////www.11467.com/wenzhou/co/206231.htm
温州市八仟客快餐厅双屿分店,http:////www.11467.com/wenzhou/co/200646.htm
乐清市四都左原快餐店,http:////www.11467.com/wenzhou/co/192334.htm
温州市瓯海新桥显辉快餐店,http:////www.11467.com/wenzhou/co/206238.htm
温州市梧埏华记快餐店,http:////www.11467.com/wenzhou/co/31486.htm
杭州肯德基有限公司温州时代分店,http:////www.11467.com/wenzhou/co/109304.htm
温州市麦德鲜快餐咨询服务有限公司,http:////www.11467.com/wenzhou/co/12065.htm
永嘉县江北品面快餐店,http:////www.11467.com/wenzhou/co/234733.htm
浙江美丽基餐饮有限公司,http:////www.11467.com/wenzhou/co/112238.htm
武汉东湖新技术开发区啦咪快餐店,http:////www.11467.com/wuhan/co/120808.htm
武汉市东西湖威子平价快餐厅,http:////www.11467.com/wuhan/co/122750.htm
武汉东湖新技术开发区蔡林记热干面小吃店,http:////www.11467.com/wuhan/co/121747.htm
武汉市百年快餐服务有限责任公司常青花园分公司,http:////www.11467.com/wuhan/co/18418.htm
武汉市蔡甸区好吃吖快餐店,http:////www.11467.com/wuhan/co/122027.htm
武汉市绿色世界经贸发展有限公司,http:////www.11467.com/wuhan/co/46106.htm
武汉帕蒙豪斯餐饮有限公司,http:////www.11467.com/wuhan/co/35442.htm
武汉市江汉区二十一飞翔餐厅,http:////www.11467.com/wuhan/co/37916.htm
武汉东湖新技术开发区好记快餐厅,http:////www.11467.com/wuhan/co/122980.htm
武汉市佳兴快餐管理有限公司,http:////www.11467.com/wuhan/co/136796.htm
武汉市飞天猪饮食有限公司,http:////www.11467.com/wuhan/co/39330.htm
乌鲁木齐市肯拉姆餐饮有限公司,http:////www.11467.com/wulumuqi/co/60502.htm
乌鲁木齐县西域快餐店,http:////www.11467.com/wulumuqi/co/10098.htm
新疆肯德基有限公司,http:////www.11467.com/wulumuqi/co/52417.htm
胡秀华,http:////www.11467.com/wulumuqi/co/39795.htm
乌鲁木齐市水磨沟区时尚餐饮服务中心,http:////www.11467.com/wulumuqi/co/84934.htm
新疆星源工贸有限公司,http:////www.11467.com/wulumuqi/co/42799.htm
新疆亚克西餐饮娱乐有限公司,http:////www.11467.com/wulumuqi/co/10065.htm
新疆百花村快餐连锁经营有限责任公司北门分店,http:////www.11467.com/wulumuqi/co/10057.htm
新疆纺织工业（集团）公司职工技协技术服务部佳味快餐馆,http:////www.11467.com/wulumuqi/co/35294.htm
江阴市澄江镇澄北麦克汉姆快餐店,http:////www.11467.com/wuxi/co/71756.htm
江阴市澄江镇澄南咸饭快餐馆,http:////www.11467.com/wuxi/co/71778.htm
无锡明珠快餐有限公司,http:////www.11467.com/wuxi/co/51105.htm
无锡瑞德联帮快餐服务有限公司,http:////www.11467.com/wuxi/co/51089.htm
无锡市北塘区吴越快餐店,http:////www.11467.com/wuxi/co/19720.htm
无锡市滨湖区华庄飘香快餐店,http:////www.11467.com/wuxi/co/51148.htm
无锡市呱呱乐味快餐店,http:////www.11467.com/wuxi/co/19689.htm
无锡市北塘区温岭快餐店,http:////www.11467.com/wuxi/co/8157.htm
无锡丽华快餐管理有限公司人民东路分公司,http:////www.11467.com/wuxi/co/14768.htm
无锡远东快餐有限公司,http:////www.11467.com/wuxi/co/25156.htm
江阴汉德思堡快餐有限公司,http:////www.11467.com/wuxi/co/71842.htm
无锡市蠡园快得乐快餐公司,http:////www.11467.com/wuxi/co/1805.htm
无锡市郊区广益富兴饮食店,http:////www.11467.com/wuxi/co/117470.htm
无锡市崇安区宏财点心店,http:////www.11467.com/wuxi/co/135277.htm
无锡市美杰思快餐有限公司,http:////www.11467.com/wuxi/co/51045.htm
无锡丽华快餐管理有限公司太湖分公司,http:////www.11467.com/wuxi/co/234879.htm
江苏蛟桥商场股份有限公司,http:////www.11467.com/wuxi/co/115270.htm
无锡市金苹果快餐店,http:////www.11467.com/wuxi/co/51042.htm
无锡丽华快餐管理有限公司五爱分公司,http:////www.11467.com/wuxi/co/14766.htm
无锡市另贰快餐店,http:////www.11467.com/wuxi/co/8200.htm
无锡市金喜徕快餐店,http:////www.11467.com/wuxi/co/51046.htm
无锡市郊区晓玲饮食店,http:////www.11467.com/wuxi/co/124912.htm
无锡市金谷快餐店,http:////www.11467.com/wuxi/co/51069.htm
无锡市奥林速食行,http:////www.11467.com/wuxi/co/141401.htm
无锡市华蓓丽快餐店,http:////www.11467.com/wuxi/co/132446.htm
无锡市吉事快餐有限公司,http:////www.11467.com/wuxi/co/51079.htm
无锡市南长区美味达快餐店,http:////www.11467.com/wuxi/co/14738.htm
无锡市立顿快餐店,http:////www.11467.com/wuxi/co/51129.htm
无锡市保利登快餐有限公司,http:////www.11467.com/wuxi/co/51051.htm
无锡市新远快餐部,http:////www.11467.com/wuxi/co/25155.htm
无锡市新区永利快餐店,http:////www.11467.com/wuxi/co/51081.htm
无锡市雪月亮快餐有限公司,http:////www.11467.com/wuxi/co/51133.htm
江阴市澄江镇澄北池上便当快餐店,http:////www.11467.com/wuxi/co/71775.htm
无锡市小中快餐店,http:////www.11467.com/wuxi/co/157574.htm
无锡市新洁快餐有限公司,http:////www.11467.com/wuxi/co/158468.htm
无锡市香馥西餐店,http:////www.11467.com/wuxi/co/19747.htm
无锡中金餐快餐有限公司,http:////www.11467.com/wuxi/co/239346.htm
无锡市森淼快餐店,http:////www.11467.com/wuxi/co/51130.htm
无锡市中禾快餐有限公司,http:////www.11467.com/wuxi/co/149638.htm
众诚快餐店,http:////www.11467.com/wuxi/co/8160.htm
无锡市亿万快餐店,http:////www.11467.com/wuxi/co/51047.htm
无锡市天利营养快餐有限公司,http:////www.11467.com/wuxi/co/158967.htm
无锡市郊区纺机浜居委餐馆,http:////www.11467.com/wuxi/co/118093.htm
无锡市郊区蓝天快餐店,http:////www.11467.com/wuxi/co/51085.htm
无锡市郊区开源现代快餐,http:////www.11467.com/wuxi/co/51043.htm
无锡市郊区芦庄超王记点心店,http:////www.11467.com/wuxi/co/123439.htm
无锡市新区溢发快餐社,http:////www.11467.com/wuxi/co/153977.htm
无锡招商城好来吃快餐店,http:////www.11467.com/wuxi/co/19695.htm
梧州市蒙地卡罗西餐咖啡吧,http:////www.11467.com/wuzhou/co/44.htm
广西梧州前程贸易有限公司三合饮食店,http:////www.11467.com/wuzhou/co/14508.htm
梧州金苑西餐咖啡店,http:////www.11467.com/wuzhou/co/18.htm
梧州市河中饮食店,http:////www.11467.com/wuzhou/co/11625.htm
梧州市桂梧大排档,http:////www.11467.com/wuzhou/co/1487.htm
梧州市第二果品食杂公司坚记饮食店,http:////www.11467.com/wuzhou/co/11940.htm
梧州市副食杂货公司文澜饮食店,http:////www.11467.com/wuzhou/co/11497.htm
厦门市湖里区凤海酒家,http:////www.11467.com/xiamen/co/15367.htm
厦门市湖里区特香味餐厅,http:////www.11467.com/xiamen/co/15596.htm
厦门市湖里区厦航港餐厅,http:////www.11467.com/xiamen/co/15625.htm
厦门豪享来餐饮娱乐有限公司莲花南路分店,http:////www.11467.com/xiamen/co/21823.htm
厦门无名子餐饮有限公司思明分店,http:////www.11467.com/xiamen/co/15272.htm
厦门南粥北面餐饮管理有限公司,http:////www.11467.com/xiamen/co/21265.htm
陕西韩流商务交流有限公司韩式泡菜料理快餐店,http:////www.11467.com/xian/co/100256.htm
陕西恒易斯远餐饮管理有限公司临潼欧克壹佰快餐店,http:////www.11467.com/xian/co/116270.htm
陕西东方商贸公司大排档,http:////www.11467.com/xian/co/21728.htm
陕西松茂食品餐饮有限公司东门分店,http:////www.11467.com/xian/co/38585.htm
陕西松茂食品餐饮有限公司交大分店,http:////www.11467.com/xian/co/38586.htm
西安市华福利尔快餐管理有限公司,http:////www.11467.com/xian/co/116672.htm
陕西乐乐快餐食品公司,http:////www.11467.com/xian/co/16217.htm
百胜餐饮（武汉）有限公司襄樊樊城店,http:////www.11467.com/xiangfan/co/32843.htm
襄阳大华餐饮服务有限公司,http:////www.11467.com/xiangfan/co/26513.htm
湖南麦当劳（餐厅食品）有限公司湘潭车站路餐厅,http:////www.11467.com/xiangtan/co/13788.htm
咸阳食鱼族餐饮有限公司,http:////www.11467.com/xianyang/co/19631.htm
咸阳川奇王小火锅有限公司,http:////www.11467.com/xianyang/co/17756.htm
咸阳鸿鸿川菜馆,http:////www.11467.com/xianyang/co/17982.htm
咸阳久福林小火锅店,http:////www.11467.com/xianyang/co/17614.htm
咸阳秦源矿产开发公司,http:////www.11467.com/xianyang/co/19771.htm
咸阳顺风餐饮有限公司,http:////www.11467.com/xianyang/co/16647.htm
应城市丁是丁卯是卯中式快餐店,http:////www.11467.com/xiaogan/co/20928.htm
锡林浩特市蒙鑫快餐店,http:////www.11467.com/xilinguole/co/880.htm
乌兰浩特市华峰快餐部,http:////www.11467.com/xingan/co/1961.htm
乌兰浩特市红光工贸总公司北强快餐部,http:////www.11467.com/xingan/co/1978.htm
青海海天餐饮有限公司,http:////www.11467.com/xining/co/15862.htm
邢台矿业（集团）有限责任公司君见来快餐馆,http:////www.11467.com/xintai/co/4723.htm
邢台市桥东麦香那西式快餐店,http:////www.11467.com/xintai/co/1250.htm
邢台市桥东胖三快餐总店,http:////www.11467.com/xintai/co/1244.htm
邢台市君见来商贸有限责任公司君见来快餐店,http:////www.11467.com/xintai/co/4781.htm
清河县我家有喜快餐店,http:////www.11467.com/xintai/co/54157.htm
信阳市浉河区威信海鲜饺子馆,http:////www.11467.com/xinyang/co/14768.htm
麦肯姆快餐信阳连锁店,http:////www.11467.com/xinyang/co/4115.htm
南昌肯德基有限公司新余胜利店,http:////www.11467.com/xinyu/co/5981.htm
景洪东风豪豪快餐店,http:////www.11467.com/xishuangbanna/co/4083.htm
勐腊县勐仑新云早晚点店,http:////www.11467.com/xishuangbanna/co/3890.htm
禹州市通达实业发展有限公司,http:////www.11467.com/xuchang/co/11477.htm
许昌向日葵餐饮有限公司,http:////www.11467.com/xuchang/co/15167.htm
邳州市方圆快餐店,http:////www.11467.com/xuzhou/co/26186.htm
徐州市六乃喜面食快餐店,http:////www.11467.com/xuzhou/co/12785.htm
徐州市巴比快餐配送中心,http:////www.11467.com/xuzhou/co/73477.htm
沛县“优易思”冷热饮食连锁店（加盟）,http:////www.11467.com/xuzhou/co/48971.htm
徐州市云龙区季祥快餐店,http:////www.11467.com/xuzhou/co/6247.htm
大屯煤电公司铁路大众快餐部,http:////www.11467.com/xuzhou/co/17968.htm
新沂市丰达商业贸易有限公司天添旺大排档,http:////www.11467.com/xuzhou/co/24098.htm
四川雅安天河快餐有限公司,http:////www.11467.com/yaan/co/644.htm
延安阳光有限公司麦哈姆快餐店,http:////www.11467.com/yanan/co/7798.htm
延安市宝塔区粮园快餐店,http:////www.11467.com/yanan/co/7796.htm
安图原野快餐盒厂,http:////www.11467.com/yanbian/co/21621.htm
珲春市婷婷快餐店,http:////www.11467.com/yanbian/co/13914.htm
延吉市丰茂餐饮有限公司河南分店,http:////www.11467.com/yanbian/co/34715.htm
苏州肯德基有限公司盐城盐阜店,http:////www.11467.com/yancheng/co/42502.htm
盐城市城区城中盛和餐饮帅王,http:////www.11467.com/yancheng/co/50835.htm
射阳县真新鲜放心早餐服务部,http:////www.11467.com/yancheng/co/35629.htm
盐城永源放心早餐工程有限责任公司,http:////www.11467.com/yancheng/co/43595.htm
盐城市亭湖区城北兴旺快餐店,http:////www.11467.com/yancheng/co/1827.htm
盐城家佳味快餐有限公司,http:////www.11467.com/yancheng/co/69624.htm
阜宁县秦淮人家美食排挡,http:////www.11467.com/yancheng/co/31665.htm
盐城晶三和娱乐有限公司,http:////www.11467.com/yancheng/co/49876.htm
