桂林市七星区福铁富传统风味饮食店,http:////www.11467.com/guilin/co/37447.htm
桂林市七星区新新米粉店,http:////www.11467.com/guilin/co/32910.htm
桂林市赛尔商贸有限公司,http:////www.11467.com/guilin/co/30184.htm
桂林市高新区得月楼,http:////www.11467.com/guilin/co/33663.htm
桂林市山吧佬山味馆,http:////www.11467.com/guilin/co/30284.htm
桂林市叠彩区四海春大排档,http:////www.11467.com/guilin/co/2258.htm
桂林市临桂白果老鸭店,http:////www.11467.com/guilin/co/36929.htm
桂林市七星区福源快餐米粉店,http:////www.11467.com/guilin/co/10839.htm
桂林市金华实业公司好运餐馆,http:////www.11467.com/guilin/co/31669.htm
桂林市紫蔷薇饮食店,http:////www.11467.com/guilin/co/39590.htm
贵阳市白云区云峰餐馆,http:////www.11467.com/guiyang/co/67325.htm
贵州金鼎隆泰实业有限公司,http:////www.11467.com/guiyang/co/32752.htm
雷记粉面快餐店,http:////www.11467.com/guiyang/co/18981.htm
贵阳佳胜新技术发展有限责任公司食品分公司,http:////www.11467.com/guiyang/co/58323.htm
黑龙江农垦寒舍美丽华西式简餐,http:////www.11467.com/haerbin/co/1961.htm
哈尔滨市南岗区鑫乐园快餐食品屋,http:////www.11467.com/haerbin/co/68846.htm
哈尔滨老都一处餐饮有限责任公司快餐店,http:////www.11467.com/haerbin/co/8972.htm
哈尔滨市南岗区小羊羔烧烤店,http:////www.11467.com/haerbin/co/38471.htm
哈密矿务局医院食堂,http:////www.11467.com/hami/co/2536.htm
峰峰矿区工商联经贸公司牛肉快餐店,http:////www.11467.com/handan/co/12017.htm
邯郸市邯山区财达快餐店,http:////www.11467.com/handan/co/927.htm
邯郸市复兴区金麦穗快餐面加工中心,http:////www.11467.com/handan/co/9520.htm
邯郸市常青新兴快餐部,http:////www.11467.com/handan/co/5150.htm
邯郸市马兰拉面快餐有限责任公司,http:////www.11467.com/handan/co/930.htm
杭州大福海餐饮有限公司,http:////www.11467.com/hangzhou/co/173455.htm
富阳市富春街道阿义快餐店,http:////www.11467.com/hangzhou/co/357314.htm
富阳市富春街道海平快餐店,http:////www.11467.com/hangzhou/co/389588.htm
杭州和田快餐有限公司,http:////www.11467.com/hangzhou/co/182573.htm
杭州经济技术开发区和风快餐部,http:////www.11467.com/hangzhou/co/5130.htm
杭州宏祥点心店,http:////www.11467.com/hangzhou/co/178551.htm
杭州肯德基有限公司庆春分店,http:////www.11467.com/hangzhou/co/184113.htm
杭州经济技术开发区超人快餐有限公司,http:////www.11467.com/hangzhou/co/5131.htm
杭州城站公交快餐供应站,http:////www.11467.com/hangzhou/co/13718.htm
杭州好又快餐饮有限公司,http:////www.11467.com/hangzhou/co/56255.htm
杭州城站公交快餐供应站古荡分店,http:////www.11467.com/hangzhou/co/56251.htm
杭州市滨江区银波快餐店,http:////www.11467.com/hangzhou/co/389554.htm
杭州海威和中式快餐有限公司,http:////www.11467.com/hangzhou/co/321193.htm
杭州小是小餐饮管理有限公司,http:////www.11467.com/hangzhou/co/166097.htm
杭州福进贸易有限公司餐饮分公司,http:////www.11467.com/hangzhou/co/149147.htm
杭州森悠悠餐饮有限公司,http:////www.11467.com/hangzhou/co/195583.htm
杭州金穗子餐饮管理有限公司第一分公司,http:////www.11467.com/hangzhou/co/194282.htm
杭州萧山瓜沥伟忠快餐店,http:////www.11467.com/hangzhou/co/323851.htm
杭州新川味观火锅店庆春分店,http:////www.11467.com/hangzhou/co/167203.htm
杭州萧山宁围镇志勤快餐店,http:////www.11467.com/hangzhou/co/365735.htm
杭州萧山北干郑正敏快餐店,http:////www.11467.com/hangzhou/co/376984.htm
杭州萧山北干徕得堡中式快餐店,http:////www.11467.com/hangzhou/co/315778.htm
深圳市裕荣泰贸易有限公司杭州未来世界分公司,http:////www.11467.com/hangzhou/co/171786.htm
余杭市乔司新街月礼美食楼,http:////www.11467.com/hangzhou/co/130769.htm
天津金尔泰商贸有限公司至味斋快餐部,http:////www.11467.com/hangzhou/co/312382.htm
浙江梅苑快餐有限公司,http:////www.11467.com/hangzhou/co/56250.htm
浙江康福餐饮有限公司,http:////www.11467.com/hangzhou/co/199764.htm
杭州萧山衙前洪戚公快餐店,http:////www.11467.com/hangzhou/co/366118.htm
杭州市拱墅区杨明饮食店,http:////www.11467.com/hangzhou/co/155506.htm
杭州众大快餐有限公司,http:////www.11467.com/hangzhou/co/165141.htm
上海真功夫快餐管理有限公司杭州艮山西路分公司,http:////www.11467.com/hangzhou/co/348936.htm
杭州市上城区朋谊林快餐店,http:////www.11467.com/hangzhou/co/321331.htm
杭州市上城区澳华快餐店,http:////www.11467.com/hangzhou/co/13704.htm
杭州余杭区朱特儿快餐店,http:////www.11467.com/hangzhou/co/132239.htm
杭州萧山宁围镇湘莱快餐店,http:////www.11467.com/hangzhou/co/376987.htm
汉台区水晶抄手快餐部,http:////www.11467.com/hanzhong/co/3411.htm
合肥市包河区新世纪快餐店,http:////www.11467.com/hefei/co/61352.htm
合肥市亚乐餐饮有限责任公司东亚快餐新瑞祺店,http:////www.11467.com/hefei/co/115065.htm
合肥三棵树简餐饮品店,http:////www.11467.com/hefei/co/520.htm
合肥市亚乐餐饮有限责任公司东亚快餐站西路店,http:////www.11467.com/hefei/co/129014.htm
合肥奥凯特快餐服务有限责任公司,http:////www.11467.com/hefei/co/16292.htm
合肥市蜀山区维客快餐店,http:////www.11467.com/hefei/co/118722.htm
合肥新太阳快餐管理有限公司,http:////www.11467.com/hefei/co/111146.htm
合肥东方快车餐饮服务有限公司,http:////www.11467.com/hefei/co/51754.htm
合肥中市区战友快餐店,http:////www.11467.com/hefei/co/16281.htm
衡水一佳味快餐有限公司,http:////www.11467.com/hengshui/co/28302.htm
巨野县徐龙祥快餐店,http:////www.11467.com/heze/co/39166.htm
巨野县龙固镇泮顺快餐店,http:////www.11467.com/heze/co/31123.htm
菏泽市牡丹区必乐客快餐店,http:////www.11467.com/heze/co/39653.htm
菏泽市牡丹区煲堂快餐店,http:////www.11467.com/heze/co/39748.htm
曹县普连集镇金秋快餐店,http:////www.11467.com/heze/co/38343.htm
曹县曹城办事处张记快餐店,http:////www.11467.com/heze/co/30768.htm
曹县长荣快餐制品厂,http:////www.11467.com/heze/co/7492.htm
菏泽市牡丹区双味快餐店,http:////www.11467.com/heze/co/39035.htm
菏泽市牡丹区都市麻辣烫快餐店,http:////www.11467.com/heze/co/29780.htm
菏泽开发区和兴中式快餐店,http:////www.11467.com/heze/co/33153.htm
曹县青菏街道办事处祥东快餐店,http:////www.11467.com/heze/co/30712.htm
泸西县文兰餐饮店,http:////www.11467.com/honghe/co/17007.htm
建水县王建国快餐店,http:////www.11467.com/honghe/co/18856.htm
盱眙县彼德堡快餐店,http:////www.11467.com/huaian/co/13590.htm
宿迁市金太隆美食休闲有限公司,http:////www.11467.com/huaian/co/32522.htm
淮安市香喷喷美食管理有限公司香喷喷小吃城,http:////www.11467.com/huaian/co/27930.htm
长沙肯德基有限公司怀化鹤洲店,http:////www.11467.com/huaihua/co/14362.htm
淮南市阿旺饮食娱乐有限责任公司,http:////www.11467.com/huainan/co/13434.htm
淮南市绿源快餐厂,http:////www.11467.com/huainan/co/5952.htm
铁山区大兵快餐,http:////www.11467.com/huangshi/co/19494.htm
黄石港区金如意快餐店,http:////www.11467.com/huangshi/co/19816.htm
黄石市天天快餐有限责任公司,http:////www.11467.com/huangshi/co/79.htm
黄石天上人间中西餐饮有限责任公司天上人间茶楼,http:////www.11467.com/huangshi/co/78.htm
内蒙古青泰快餐店,http:////www.11467.com/huhehaote/co/1921.htm
柏塘镇平茜饮食大排档,http:////www.11467.com/huizhou/co/13871.htm
惠州市红蔷薇西餐酒廊,http:////www.11467.com/huizhou/co/3207.htm
园洲镇忠记饮食大排档,http:////www.11467.com/huizhou/co/13869.htm
惠东县大岭镇祥平快餐店,http:////www.11467.com/huizhou/co/98764.htm
惠城区明辉餐馆,http:////www.11467.com/huizhou/co/27677.htm
葫芦岛市瓜尔佳实业有限公司,http:////www.11467.com/huludao/co/36833.htm
营口东北小肥羊龙港分店,http:////www.11467.com/huludao/co/40668.htm
湖州市龙泉街道飞鱼快餐店,http:////www.11467.com/huzhou/co/544.htm
上海必胜客有限公司湖州凤凰时代店,http:////www.11467.com/huzhou/co/69765.htm
湖州凤凰街道旺福记中式快餐餐饮店,http:////www.11467.com/huzhou/co/63956.htm
杭州肯德基有限公司湖州凤凰店,http:////www.11467.com/huzhou/co/44378.htm
佳木斯市原笼包子铺,http:////www.11467.com/jiamusi/co/29752.htm
佳木斯百佳快餐有限公司,http:////www.11467.com/jiamusi/co/4143.htm
永新县快食尚中式快餐店,http:////www.11467.com/jian/co/18741.htm
永新县顺旺客中式快餐店,http:////www.11467.com/jian/co/20555.htm
焦作市解放区赵记烩面堂,http:////www.11467.com/jiaozuo/co/14725.htm
海宁市硖石昌达快餐部,http:////www.11467.com/jiaxing/co/24937.htm
平湖市海天配餐有限公司,http:////www.11467.com/jiaxing/co/77424.htm
嘉兴市城南合力快餐火锅店,http:////www.11467.com/jiaxing/co/512.htm
杭州肯德基有限公司嘉善农工商分店,http:////www.11467.com/jiaxing/co/54257.htm
上海青鹤洞餐饮服务有限公司嘉兴分公司,http:////www.11467.com/jiaxing/co/51825.htm
杭州肯德基有限公司桐乡分店,http:////www.11467.com/jiaxing/co/54264.htm
嘉兴市细咪斋快餐店细咪斋分店,http:////www.11467.com/jiaxing/co/518.htm
吉林市昌邑区聚缘快餐店,http:////www.11467.com/jilinshi/co/1272.htm
吉林市科力快餐部,http:////www.11467.com/jilinshi/co/25145.htm
吉林市肯德利快餐有限公司,http:////www.11467.com/jilinshi/co/15321.htm
吉林市东北亚经贸发展有限公司,http:////www.11467.com/jilinshi/co/52799.htm
吉林市船营区美食源营养快餐配送有限公司,http:////www.11467.com/jilinshi/co/94945.htm
北京康康快餐娱乐有限公司济南贵和分公司,http:////www.11467.com/jinan/co/3810.htm
济南第一建材厂德望快餐部,http:////www.11467.com/jinan/co/15505.htm
济南金德利快餐连锁总公司金德利第一快餐店,http:////www.11467.com/jinan/co/22987.htm
北京真功夫快餐连锁管理有限公司济南分公司,http:////www.11467.com/jinan/co/119550.htm
北京康康快餐娱乐有限公司济南银座分公司,http:////www.11467.com/jinan/co/3955.htm
北京康康快餐娱乐有限公司济南泉城分公司,http:////www.11467.com/jinan/co/3979.htm
济南第一建材厂群力快餐店,http:////www.11467.com/jinan/co/15520.htm
济南六乃喜快餐连锁山大路有限公司,http:////www.11467.com/jinan/co/3812.htm
山东利山快餐店,http:////www.11467.com/jinan/co/3840.htm
济南市历下区龙凤快餐店,http:////www.11467.com/jinan/co/3951.htm
山东马兰拉面快餐连锁有限公司,http:////www.11467.com/jinan/co/3850.htm
山东金德利新时代快餐食品有限公司二七南路粮油食品店,http:////www.11467.com/jinan/co/129901.htm
山东金德利集团槐荫快餐连锁有限责任公司南辛庄粮油食品店,http:////www.11467.com/jinan/co/116045.htm
山东金德利集团历下快餐连锁有限责任公司大明湖路粮油食品店,http:////www.11467.com/jinan/co/117438.htm
山东出版快餐有限公司,http:////www.11467.com/jinan/co/15490.htm
山东金德利新时代快餐食品有限公司佛山苑粮油食品店,http:////www.11467.com/jinan/co/129847.htm
东平姜仔鸭时尚涮快餐有限责任公司济南分公司,http:////www.11467.com/jinan/co/116678.htm
济南佳家快餐专递有限责任公司,http:////www.11467.com/jinan/co/29682.htm
山东山青科技开发公司快餐店,http:////www.11467.com/jinan/co/3806.htm
济南合力快餐有限公司天工分店,http:////www.11467.com/jinan/co/22981.htm
济南合力快餐有限公司,http:////www.11467.com/jinan/co/3809.htm
济南市中超意兴快餐店,http:////www.11467.com/jinan/co/15509.htm
山东博瑞顾问公司快餐娱乐分公司,http:////www.11467.com/jinan/co/3945.htm
山东金德利集团历下快餐连锁有限责任公司佛山苑粮油食品店,http:////www.11467.com/jinan/co/129939.htm
济南合力快餐有限公司花园路分店,http:////www.11467.com/jinan/co/3957.htm
山西富景实业股份有限公司富景快餐厅,http:////www.11467.com/jincheng/co/21822.htm
泽州县巴公天天娱乐有限公司,http:////www.11467.com/jincheng/co/13963.htm
荆门市龙泉北门餐馆,http:////www.11467.com/jingmen/co/11776.htm
百胜餐饮（武汉）有限公司荆州北京路分店,http:////www.11467.com/jingzhou/co/16480.htm
金华市婺城区百盈佳快餐厅,http:////www.11467.com/jinhua/co/105221.htm
义乌市回头客快餐店,http:////www.11467.com/jinhua/co/108319.htm
上海必胜客有限公司义乌富泰店,http:////www.11467.com/jinhua/co/134310.htm
上海必胜客有限公司兰溪人民北路店,http:////www.11467.com/jinhua/co/129015.htm
义乌市逢客来快餐店,http:////www.11467.com/jinhua/co/107281.htm
横店集团东阳乐惠快餐有限公司,http:////www.11467.com/jinhua/co/27503.htm
东阳市丰香园美食林,http:////www.11467.com/jinhua/co/43464.htm
义乌市人人快餐有限公司,http:////www.11467.com/jinhua/co/18717.htm
浦江县速食缘快餐店,http:////www.11467.com/jinhua/co/107493.htm
济宁博纳餐饮娱乐有限责任公司,http:////www.11467.com/jining/co/42663.htm
梁山县天赐福快餐,http:////www.11467.com/jining/co/79145.htm
济宁军供福利快餐楼,http:////www.11467.com/jining/co/2151.htm
青岛肯德基有限公司邹城分公司,http:////www.11467.com/jining/co/31385.htm
济宁市红泰快餐店,http:////www.11467.com/jining/co/6051.htm
济宁市任城区朝霞快餐店,http:////www.11467.com/jining/co/79271.htm
泗水县泗张镇伟克快餐店,http:////www.11467.com/jining/co/67063.htm
微山县鲁桥来友快餐店,http:////www.11467.com/jining/co/79480.htm
泗水县泗河办鸿鑫快餐店,http:////www.11467.com/jining/co/67531.htm
济宁市任城区麦克汉姆超然快餐店,http:////www.11467.com/jining/co/7796.htm
太原六味斋好主妇餐饮有限公司榆次蕴华街快餐店,http:////www.11467.com/jinzhong/co/25795.htm
锦州市机动车靠垫厂美食王快餐城分店,http:////www.11467.com/jinzhou/co/919.htm
南昌肯德基有限公司九江浔阳路分店,http:////www.11467.com/jiujiang/co/12267.htm
喀什市白金餐饮有限责任公司,http:////www.11467.com/kashi/co/5661.htm
克拉玛依区守斌烤鸭店,http:////www.11467.com/kelamayi/co/6111.htm
昆钢兴达物业管理有限公司阳光餐厅,http:////www.11467.com/kunming/co/96531.htm
昆明东瓯快餐服务有限公司,http:////www.11467.com/kunming/co/8957.htm
嵩明职教园区曹记西式快餐店,http:////www.11467.com/kunming/co/132407.htm
昆明市五华区丁秀芝快餐店,http:////www.11467.com/kunming/co/83892.htm
昆明浪漫一生牛排西餐有限公司,http:////www.11467.com/kunming/co/20359.htm
昆明义通达建材经贸有限公司馨苑快餐,http:////www.11467.com/kunming/co/8956.htm
滇黔桂石油物探公司科研所,http:////www.11467.com/kunming/co/78041.htm
土桥小锅米线店,http:////www.11467.com/kunming/co/78523.htm
莱芜市莱城区友利快餐店,http:////www.11467.com/laiwu/co/13657.htm
莱芜市莱城区琼浆阁快餐店,http:////www.11467.com/laiwu/co/16082.htm
莱芜市莱城区晨晨快餐店,http:////www.11467.com/laiwu/co/13542.htm
莱芜市莱城区来士客西式快餐吕花园店,http:////www.11467.com/laiwu/co/13456.htm
三河市蓝星特快餐饮有限公司,http:////www.11467.com/langfang/co/20185.htm
廊坊市北门外麦肯姆快餐店,http:////www.11467.com/langfang/co/1080.htm
大城县津保路卓凯饺子馆,http:////www.11467.com/langfang/co/24849.htm
廊坊市广阳区银河北路家乡粥屋,http:////www.11467.com/langfang/co/25551.htm
华北石油管理局油气井测试公司,http:////www.11467.com/langfang/co/24463.htm
甘肃秦昆油气勘探高新技术开发中心,http:////www.11467.com/lanzhou/co/39926.htm
兰州先锋餐饮管理有限公司,http:////www.11467.com/lanzhou/co/46737.htm
兰州马子禄牛肉面有限责任公司,http:////www.11467.com/lanzhou/co/44117.htm
兰州老树村餐饮有限责任公司天元大排档,http:////www.11467.com/lanzhou/co/7803.htm
兰州市张掖路甜食店,http:////www.11467.com/lanzhou/co/45253.htm
兰州伯顿西餐有限公司,http:////www.11467.com/lanzhou/co/7801.htm
中国篮星化学清洗总公司快餐分公司,http:////www.11467.com/lanzhou/co/24032.htm
巴中市李老大饮食文化有限公司,http:////www.11467.com/leshan/co/11399.htm
西昌迪尼斯实业有限责任公司,http:////www.11467.com/liangshan/co/12588.htm
连云港市连云家家乐食品休闲世界,http:////www.11467.com/lianyungang/co/19345.htm
连云港中意食品有限公司,http:////www.11467.com/lianyungang/co/18391.htm
连云港市胜茜日月人快餐店,http:////www.11467.com/lianyungang/co/38870.htm
连云港市徐明人日月人快餐店,http:////www.11467.com/lianyungang/co/38871.htm
茌平县冯屯镇一家快餐店,http:////www.11467.com/liaocheng/co/53468.htm
冠县东博快餐店,http:////www.11467.com/liaocheng/co/55252.htm
阳谷县博济桥办事处博济路阿利茄汁面快餐店,http:////www.11467.com/liaocheng/co/55012.htm
阳谷县邵楼乡村情快餐店,http:////www.11467.com/liaocheng/co/55638.htm
阳谷县侨润办事处谷山路顺心快餐店,http:////www.11467.com/liaocheng/co/55262.htm
阳谷县狮子楼办事处狮子楼路苗颖竹荪鹅快餐店,http:////www.11467.com/liaocheng/co/54653.htm
阳谷县侨润办事处黄山路根据地大院快餐店,http:////www.11467.com/liaocheng/co/55238.htm
聊城市开发区蒋官屯如意快餐,http:////www.11467.com/liaocheng/co/49104.htm
聊城市开发区聊城大学高新集团经营开发中心枫叶红快餐店,http:////www.11467.com/liaocheng/co/49236.htm
阳谷县侨润办事处燕山路金都快餐店,http:////www.11467.com/liaocheng/co/53667.htm
茌平县丽云肉夹馍快餐店,http:////www.11467.com/liaocheng/co/53674.htm
聊城市东昌府区连明快餐店,http:////www.11467.com/liaocheng/co/54713.htm
聊城市开发区品味非凡快餐店,http:////www.11467.com/liaocheng/co/47197.htm
高唐县潘佳驴肉中式快餐店（官道街路西）,http:////www.11467.com/liaocheng/co/54903.htm
莘县莘信苑快餐店,http:////www.11467.com/liaocheng/co/47012.htm
东阿县铜城瓦缸快餐部,http:////www.11467.com/liaocheng/co/55741.htm
辽宁合兴快餐有限公司辽阳荣华吉野家店,http:////www.11467.com/liaoyang/co/25112.htm
辽阳市白塔区品豪台北快餐店,http:////www.11467.com/liaoyang/co/737.htm
沧源县班老永顺快餐店,http:////www.11467.com/lincang/co/6548.htm
耿马小兴快餐店,http:////www.11467.com/lincang/co/6322.htm
双江桂仙早晚点店,http:////www.11467.com/lincang/co/6804.htm
临汾市尧都区明鑫川味居,http:////www.11467.com/linfen/co/26496.htm
临汾市球迷大酒店有限公司,http:////www.11467.com/linfen/co/25590.htm
临汾市尧都区米嘻尔西餐馆,http:////www.11467.com/linfen/co/311.htm
临汾市三晋小拉面有限责任公司,http:////www.11467.com/linfen/co/25632.htm
北京康康快餐娱乐有限公司临沂银座分公司,http:////www.11467.com/linyi/co/80039.htm
苍山县福音快餐店,http:////www.11467.com/linyi/co/102204.htm
罗庄区梁子快餐店,http:////www.11467.com/linyi/co/101701.htm
罗庄区金生德克萨斯清真快餐店,http:////www.11467.com/linyi/co/101699.htm
河东区永泽快餐店,http:////www.11467.com/linyi/co/102886.htm
蒙阴县三民快餐店,http:////www.11467.com/linyi/co/102950.htm
蒙阴县德众快餐店,http:////www.11467.com/linyi/co/90998.htm
临沂市兰山区阿香米线快餐店,http:////www.11467.com/linyi/co/102901.htm
平邑县百度沸瓦罐滋补快餐店,http:////www.11467.com/linyi/co/89635.htm
日照海达餐饮有限公司,http:////www.11467.com/linyi/co/43696.htm
临沂市兰山区春天快餐店,http:////www.11467.com/linyi/co/102431.htm
日照市好朋友餐饮城,http:////www.11467.com/linyi/co/45109.htm
临沂市兰山区佐丰源粤式风味快餐店,http:////www.11467.com/linyi/co/90909.htm
临沂批发城朱世鹏快餐店,http:////www.11467.com/linyi/co/90043.htm
临沂批发城金磊快餐店,http:////www.11467.com/linyi/co/94071.htm
临沂市兰山区立前快餐店,http:////www.11467.com/linyi/co/89697.htm
临沂市兰山区润凡快餐店,http:////www.11467.com/linyi/co/94056.htm
温州市八仟客快餐厅丽水第二分店,http:////www.11467.com/lishui/co/30798.htm
丽水市食全食美美食中心快餐外卖配送部,http:////www.11467.com/lishui/co/17625.htm
丽水市新薪百盛中式快餐店,http:////www.11467.com/lishui/co/30983.htm
丽水市侯氏胖仔美食有限公司,http:////www.11467.com/lishui/co/18407.htm
六安市好朋友豆浆餐饮有限公司,http:////www.11467.com/liuan/co/12981.htm
舒城县城关镇包天下快餐飞霞名居加盟店,http:////www.11467.com/liuan/co/21439.htm
六安市裕隆快餐服务有限公司,http:////www.11467.com/liuan/co/381.htm
六盘水列检所康德公司,http:////www.11467.com/liupanshui/co/8283.htm
柳州市中南运输有限责任公司中南食堂,http:////www.11467.com/liuzhou/co/26872.htm
柳州市雅洁快餐店,http:////www.11467.com/liuzhou/co/7852.htm
柳州铁路第一快餐馆,http:////www.11467.com/liuzhou/co/7859.htm
柳州市顶尖快餐店公园服装分店,http:////www.11467.com/liuzhou/co/45335.htm
柳州市大自然美食阁,http:////www.11467.com/liuzhou/co/25327.htm
柳州民航商贸公司餐饮部,http:////www.11467.com/liuzhou/co/22439.htm
柳州市柳南区树阮饮食店,http:////www.11467.com/liuzhou/co/23189.htm
柳州市鱼峰区红智饮食店,http:////www.11467.com/liuzhou/co/26450.htm
柳州市交通经贸公司快餐部,http:////www.11467.com/liuzhou/co/7853.htm
柳州球友运动食堂,http:////www.11467.com/liuzhou/co/22665.htm
柳州市随便吃汤店友谊三分店,http:////www.11467.com/liuzhou/co/30796.htm
上杭县好味客快餐店,http:////www.11467.com/longyan/co/28298.htm
长汀县濯田享吃堡快餐店,http:////www.11467.com/longyan/co/27538.htm
武平县丽雯快餐店,http:////www.11467.com/longyan/co/27730.htm
新罗区笑莉快餐店,http:////www.11467.com/longyan/co/27813.htm
长沙肯德基有限公司娄底长青店,http:////www.11467.com/loudi/co/12577.htm
河南高速公路发展有限责任公司洛阳服务区,http:////www.11467.com/luoyang/co/25376.htm
南宁市永新区幸运星快餐店,http:////www.11467.com/nanning/co/13321.htm
南宁市小丑快餐店,http:////www.11467.com/nanning/co/4612.htm
南宁顺达汽车运输经贸公司爱华饮食店,http:////www.11467.com/nanning/co/56157.htm
南宁市玲莉餐饮有限公司思贤店,http:////www.11467.com/nanning/co/45242.htm
南宁市渔人港美食有限公司,http:////www.11467.com/nanning/co/55248.htm
南宁市新城区新竹企业服务站新光快餐店,http:////www.11467.com/nanning/co/4640.htm
南宁市族一新餐饮有限责任公司二分公司,http:////www.11467.com/nanning/co/56020.htm
南宁市康利华实业公司美心快餐二分店,http:////www.11467.com/nanning/co/1088.htm
南宁肯德基有限公司南宁七星店,http:////www.11467.com/nanning/co/52897.htm
南宁市玲莉餐饮有限公司民族店,http:////www.11467.com/nanning/co/45241.htm
南宁市城北区哈哈快餐店,http:////www.11467.com/nanning/co/13317.htm
南宁市隆中轩快餐店,http:////www.11467.com/nanning/co/1106.htm
南宁市东葛路苑友饮食店,http:////www.11467.com/nanning/co/51199.htm
南宁市荷塘月色西餐酒廊有限公司,http:////www.11467.com/nanning/co/4655.htm
南宁古西餐饮服务有限公司,http:////www.11467.com/nanning/co/4614.htm
南宁市玲莉餐饮有限公司园湖店,http:////www.11467.com/nanning/co/45243.htm
南平市佳家乐快餐冷饮厅,http:////www.11467.com/nanping/co/1378.htm
邵武市洪墩镇懒洋洋快餐店,http:////www.11467.com/nanping/co/38797.htm
南平市延平李好大排档,http:////www.11467.com/nanping/co/1380.htm
南平市东山综合厂东山饮食店,http:////www.11467.com/nanping/co/27171.htm
南平市东山综合厂大嘴美餐小吃店,http:////www.11467.com/nanping/co/27170.htm
松溪县香菇城快餐小炒店,http:////www.11467.com/nanping/co/41089.htm
邵武市瓦罐香沸快餐店,http:////www.11467.com/nanping/co/41974.htm
武夷山市大风车美食园,http:////www.11467.com/nanping/co/23483.htm
建瓯市壹家人快餐店,http:////www.11467.com/nanping/co/42749.htm
南平市延平区光盛老菜馆,http:////www.11467.com/nanping/co/28761.htm
南通市崇川城西桥头堡快餐店,http:////www.11467.com/nantong/co/485.htm
南通市港闸区喜多多快餐店,http:////www.11467.com/nantong/co/13476.htm
南通市速达快餐公司,http:////www.11467.com/nantong/co/460.htm
南通市杰利经营部,http:////www.11467.com/nantong/co/77030.htm
海门市海门镇大同街服务部快餐馆,http:////www.11467.com/nantong/co/49800.htm
苏州肯德基有限公司南通人民店,http:////www.11467.com/nantong/co/100948.htm
苏州肯德基有限公司如东店,http:////www.11467.com/nantong/co/100954.htm
南通开发区园园快餐店,http:////www.11467.com/nantong/co/503.htm
如皋市彭氏米线馆,http:////www.11467.com/nantong/co/64101.htm
南阳金汉丰商厦快餐部,http:////www.11467.com/nanyang/co/1660.htm
