东莞市虎门爱特园塑胶五金制品厂,http:////www.11467.com/dongguan/co/482982.htm
东莞市虎门爱特园塑胶五金制品厂的商铺,http://dongguan0482982.11467.com
广州金师五金塑胶有限公司,http:////www.11467.com/guangzhou/co/178388.htm
广州金师五金塑胶有限公司的商铺,http://guangzhou0178388.11467.com
广州凡特电子科技有限公司,http:////www.11467.com/guangzhou/co/496533.htm
广州凡特电子科技有限公司的商铺,http://guangzhou0496533.11467.com
广州市亚琪皮具有限公司,http:////www.11467.com/guangzhou/co/211087.htm
广州市亚琪皮具有限公司的商铺,http://guangzhou0211087.11467.com
广州市番禺区客至皮具厂,http:////www.11467.com/guangzhou/co/169340.htm
广州市番禺区客至皮具厂的商铺,http://guangzhou0169340.11467.com
广州市越秀区宏星工艺品商行,http:////www.11467.com/guangzhou/co/131157.htm
广州市越秀区宏星工艺品商行的商铺,http://guangzhou0131157.11467.com
枣强县大营镇世超皮毛厂,http:////www.11467.com/hengshui/co/34433.htm
枣强县大营镇世超皮毛厂的商铺,http://hengshui034433.11467.com
惠州市惠城区温馨家园微型园艺礼品批发店,http:////www.11467.com/huizhou/co/60833.htm
惠州市惠城区温馨家园微型园艺礼品批发店的商铺,http://huizhou060833.11467.com
佛山市南海思泊金属制品厂,http:////www.11467.com/guangzhou/co/194834.htm
佛山市南海思泊金属制品厂的商铺,http://guangzhou0194834.11467.com
梧州市澳域饰品厂,http:////www.11467.com/foshan/co/190287.htm
梧州市澳域饰品厂的商铺,http://foshan0190287.11467.com
广州市白云区华明工艺制品厂,http:////www.11467.com/guangzhou/co/319677.htm
广州市白云区华明工艺制品厂的商铺,http://guangzhou0319677.11467.com
广州市番禺区石壁泓锐工艺品厂,http:////www.11467.com/guangzhou/co/455645.htm
广州市番禺区石壁泓锐工艺品厂的商铺,http://guangzhou0455645.11467.com
广州市番禺区石壁利杨工艺品厂,http:////www.11467.com/guangzhou/co/496575.htm
广州市番禺区石壁利杨工艺品厂的商铺,http://guangzhou0496575.11467.com
东莞市恒亮胶贴制品有限公司,http:////www.11467.com/dongguan/co/256948.htm
东莞市恒亮胶贴制品有限公司的商铺,http://dongguan0256948.11467.com
佛山市南海区里水吉行风针织厂,http:////www.11467.com/foshan/co/331496.htm
佛山市南海区里水吉行风针织厂的商铺,http://foshan0331496.11467.com
广州市品俊电子有限公司,http:////www.11467.com/guangzhou/co/455627.htm
广州市品俊电子有限公司的商铺,http://guangzhou0455627.11467.com
广州市白云区彩宏织带饰品厂,http:////www.11467.com/guangzhou/co/161785.htm
广州市白云区彩宏织带饰品厂的商铺,http://guangzhou0161785.11467.com
广州市番禺区石壁多茂工艺品厂,http:////www.11467.com/guangzhou/co/429432.htm
广州市番禺区石壁多茂工艺品厂的商铺,http://guangzhou0429432.11467.com
广州熙沵电子科技有限公司,http:////www.11467.com/guangzhou/co/467184.htm
广州熙沵电子科技有限公司的商铺,http://guangzhou0467184.11467.com
广州市越秀区诺莹饰品行,http:////www.11467.com/guangzhou/co/161847.htm
广州市越秀区诺莹饰品行的商铺,http://guangzhou0161847.11467.com
广州市白云区唐人皮具厂,http:////www.11467.com/guangzhou/co/286097.htm
广州市白云区唐人皮具厂的商铺,http://guangzhou0286097.11467.com
南京悦本数码科技有限公司,http:////www.11467.com/nanjing/co/88635.htm
南京悦本数码科技有限公司的商铺,http://nanjing088635.11467.com
临沂天芝工艺品有限公司,http:////www.11467.com/linyi/co/60431.htm
临沂天芝工艺品有限公司的商铺,http://linyi060431.11467.com
深圳市硅丰电子有限公司,http:////www.11467.com/shenzhen/co/144131.htm
深圳市硅丰电子有限公司的商铺,http://shenzhen0144131.11467.com
深圳市好印象首饰行,http:////www.11467.com/shenzhen/co/151319.htm
深圳市好印象首饰行的商铺,http://shenzhen0151319.11467.com
深圳市比利通达电子科技有限公司,http:////www.11467.com/shenzhen/co/144174.htm
深圳市比利通达电子科技有限公司的商铺,http://shenzhen0144174.11467.com
深圳市福田区远望源通讯市场博亚通信行,http:////www.11467.com/shenzhen/co/144160.htm
深圳市福田区远望源通讯市场博亚通信行的商铺,http://shenzhen0144160.11467.com
嘉兴市秀城区新丰镇兴晟塑胶制品厂,http:////www.11467.com/jiaxing/co/62755.htm
嘉兴市秀城区新丰镇兴晟塑胶制品厂的商铺,http://jiaxing062755.11467.com
深圳市飞创达通讯科技有限公司,http:////www.11467.com/shenzhen/co/150505.htm
深圳市飞创达通讯科技有限公司的商铺,http://shenzhen0150505.11467.com
南京雨田商贸信息有限公司,http:////www.11467.com/nanjing/co/103237.htm
南京雨田商贸信息有限公司的商铺,http://nanjing0103237.11467.com
深圳市嘉源盛模具有限公司,http:////www.11467.com/shenzhen/co/333484.htm
深圳市嘉源盛模具有限公司的商铺,http://shenzhen0333484.11467.com
深圳市保时雅科技有限公司,http:////www.11467.com/shenzhen/co/728904.htm
深圳市保时雅科技有限公司的商铺,http://shenzhen0728904.11467.com
化州市中垌镇大通珠饰工艺厂,http:////www.11467.com/maoming/co/40106.htm
化州市中垌镇大通珠饰工艺厂的商铺,http://maoming040106.11467.com
深圳孛索皮具制品有限公司,http:////www.11467.com/shenzhen/co/363754.htm
深圳孛索皮具制品有限公司的商铺,http://shenzhen0363754.11467.com
义乌市优润贸易有限公司,http:////www.11467.com/jinhua/co/121587.htm
义乌市优润贸易有限公司的商铺,http://jinhua0121587.11467.com
深圳市福田区和合同盛电子商行,http:////www.11467.com/shenzhen/co/811049.htm
深圳市福田区和合同盛电子商行的商铺,http://shenzhen0811049.11467.com
义乌市彼微诗饰品配件商行,http:////www.11467.com/jinhua/co/121492.htm
义乌市彼微诗饰品配件商行的商铺,http://jinhua0121492.11467.com
高新区白石陶瓷经销部,http:////www.11467.com/jingdezhen/co/13659.htm
高新区白石陶瓷经销部的商铺,http://jingdezhen013659.11467.com
深圳克龙科技有限公司,http:////www.11467.com/shenzhen/co/769134.htm
深圳克龙科技有限公司的商铺,http://shenzhen0769134.11467.com
深圳市飞达塑胶制品有限公司,http:////www.11467.com/shenzhen/co/391409.htm
深圳市飞达塑胶制品有限公司的商铺,http://shenzhen0391409.11467.com
深圳市鸿润鑫科技有限公司,http:////www.11467.com/shenzhen/co/226680.htm
深圳市鸿润鑫科技有限公司的商铺,http://shenzhen0226680.11467.com
深圳市彩途工艺品有限公司,http:////www.11467.com/shenzhen/co/254197.htm
深圳市彩途工艺品有限公司的商铺,http://shenzhen0254197.11467.com
深圳市迪菲帆科技有限公司,http:////www.11467.com/shenzhen/co/723411.htm
深圳市迪菲帆科技有限公司的商铺,http://shenzhen0723411.11467.com
义乌市萌发百货贸易商行,http:////www.11467.com/jinhua/co/121574.htm
义乌市萌发百货贸易商行的商铺,http://jinhua0121574.11467.com
深圳市弼牛五金制造有限公司,http:////www.11467.com/shenzhen/co/196874.htm
深圳市弼牛五金制造有限公司的商铺,http://shenzhen0196874.11467.com
深圳市佰艺德五金塑胶制品有限公司,http:////www.11467.com/shenzhen/co/142510.htm
深圳市佰艺德五金塑胶制品有限公司的商铺,http://shenzhen0142510.11467.com
深圳市劲美隆电子有限公司,http:////www.11467.com/shenzhen/co/725171.htm
深圳市劲美隆电子有限公司的商铺,http://shenzhen0725171.11467.com
深圳市光明新区公明阿西迪光电材料经销部,http:////www.11467.com/shenzhen/co/725626.htm
深圳市光明新区公明阿西迪光电材料经销部的商铺,http://shenzhen0725626.11467.com
深圳市澳达斯电子科技有限公司,http:////www.11467.com/shenzhen/co/757417.htm
深圳市澳达斯电子科技有限公司的商铺,http://shenzhen0757417.11467.com
深圳市邦兴橡塑五金科技有限公司,http:////www.11467.com/shenzhen/co/768339.htm
深圳市邦兴橡塑五金科技有限公司的商铺,http://shenzhen0768339.11467.com
汕头市澄海区陈航五金商行,http:////www.11467.com/shantou/co/152056.htm
汕头市澄海区陈航五金商行的商铺,http://shantou0152056.11467.com
深圳市昌德自动化设备有限公司,http:////www.11467.com/shenzhen/co/723158.htm
深圳市昌德自动化设备有限公司的商铺,http://shenzhen0723158.11467.com
深圳市比克特科技有限公司,http:////www.11467.com/shenzhen/co/184792.htm
深圳市比克特科技有限公司的商铺,http://shenzhen0184792.11467.com
深圳市福田区曼哈数码广场棒棒哥通讯产品商行,http:////www.11467.com/shenzhen/co/811221.htm
深圳市福田区曼哈数码广场棒棒哥通讯产品商行的商铺,http://shenzhen0811221.11467.com
深圳市宝安区福永颖创达礼品厂,http:////www.11467.com/shenzhen/co/254267.htm
深圳市宝安区福永颖创达礼品厂的商铺,http://shenzhen0254267.11467.com
深圳市晨上光电有限公司,http:////www.11467.com/shenzhen/co/810996.htm
深圳市晨上光电有限公司的商铺,http://shenzhen0810996.11467.com
深圳市德宇工艺饰品有限公司,http:////www.11467.com/shenzhen/co/238191.htm
深圳市德宇工艺饰品有限公司的商铺,http://shenzhen0238191.11467.com
深圳华南海洋包装制品有限公司,http:////www.11467.com/shenzhen/co/368820.htm
深圳华南海洋包装制品有限公司的商铺,http://shenzhen0368820.11467.com
深圳邦卡优数码科技有限公司,http:////www.11467.com/shenzhen/co/785656.htm
深圳邦卡优数码科技有限公司的商铺,http://shenzhen0785656.11467.com
陈晓鑫,http:////www.11467.com/shenzhen/co/727193.htm
陈晓鑫的商铺,http://shenzhen0727193.11467.com
都昌县梅沙贝制品加工厂,http:////www.11467.com/jiujiang/co/24386.htm
都昌县梅沙贝制品加工厂的商铺,http://jiujiang024386.11467.com
福建省德化拓方陶瓷有限公司,http:////www.11467.com/quanzhou/co/147111.htm
福建省德化拓方陶瓷有限公司的商铺,http://quanzhou0147111.11467.com
汕头市澄海区圣保丽服饰工艺厂,http:////www.11467.com/shantou/co/152136.htm
汕头市澄海区圣保丽服饰工艺厂的商铺,http://shantou0152136.11467.com
深圳市和联盛塑胶制品有限公司,http:////www.11467.com/shenzhen/co/729214.htm
深圳市和联盛塑胶制品有限公司的商铺,http://shenzhen0729214.11467.com
深圳市宝骏塑胶制品有限公司,http:////www.11467.com/shenzhen/co/806929.htm
深圳市宝骏塑胶制品有限公司的商铺,http://shenzhen0806929.11467.com
深圳市福田区宇杰高科电子商行,http:////www.11467.com/shenzhen/co/722665.htm
深圳市福田区宇杰高科电子商行的商铺,http://shenzhen0722665.11467.com
深圳市锦瑞塑胶制品有限公司,http:////www.11467.com/shenzhen/co/225169.htm
深圳市锦瑞塑胶制品有限公司的商铺,http://shenzhen0225169.11467.com
深圳市吉泰塑胶手袋有限公司,http:////www.11467.com/shenzhen/co/796609.htm
深圳市吉泰塑胶手袋有限公司的商铺,http://shenzhen0796609.11467.com
深圳市成丰天顺科技发展有限公司,http:////www.11467.com/shenzhen/co/729205.htm
深圳市成丰天顺科技发展有限公司的商铺,http://shenzhen0729205.11467.com
深圳市奥利特橡塑制品厂,http:////www.11467.com/shenzhen/co/221917.htm
深圳市奥利特橡塑制品厂的商铺,http://shenzhen0221917.11467.com
深圳市广盈饰品开发有限公司,http:////www.11467.com/shenzhen/co/774545.htm
深圳市广盈饰品开发有限公司的商铺,http://shenzhen0774545.11467.com
深圳市衡特电子衡器有限公司,http:////www.11467.com/shenzhen/co/807485.htm
深圳市衡特电子衡器有限公司的商铺,http://shenzhen0807485.11467.com
深圳市新时尚电子有限公司,http:////www.11467.com/shenzhen/co/761181.htm
深圳市新时尚电子有限公司的商铺,http://shenzhen0761181.11467.com
深圳市福田区三鑫洋电子商行,http:////www.11467.com/shenzhen/co/727245.htm
深圳市福田区三鑫洋电子商行的商铺,http://shenzhen0727245.11467.com
深圳市天德鑫科技有限公司,http:////www.11467.com/shenzhen/co/281121.htm
深圳市天德鑫科技有限公司的商铺,http://shenzhen0281121.11467.com
深圳市华荣涵科技有限公司,http:////www.11467.com/shenzhen/co/811854.htm
深圳市华荣涵科技有限公司的商铺,http://shenzhen0811854.11467.com
深圳市鑫万美科技有限公司,http:////www.11467.com/shenzhen/co/329190.htm
深圳市鑫万美科技有限公司的商铺,http://shenzhen0329190.11467.com
深圳市鑫华上皮具制品有限公司,http:////www.11467.com/shenzhen/co/256564.htm
深圳市鑫华上皮具制品有限公司的商铺,http://shenzhen0256564.11467.com
深圳市光明新区公明世新荣礼品制造厂,http:////www.11467.com/shenzhen/co/724958.htm
深圳市光明新区公明世新荣礼品制造厂的商铺,http://shenzhen0724958.11467.com
深圳市航宇光电科技有限公司,http:////www.11467.com/shenzhen/co/723040.htm
深圳市航宇光电科技有限公司的商铺,http://shenzhen0723040.11467.com
深圳凯毅电子通讯有限公司,http:////www.11467.com/shenzhen/co/722659.htm
深圳凯毅电子通讯有限公司的商铺,http://shenzhen0722659.11467.com
深圳市森鑫科技有限公司,http:////www.11467.com/shenzhen/co/533295.htm
深圳市森鑫科技有限公司的商铺,http://shenzhen0533295.11467.com
深圳市科泰利科技有限公司,http:////www.11467.com/shenzhen/co/764533.htm
深圳市科泰利科技有限公司的商铺,http://shenzhen0764533.11467.com
深圳市和一创展科技有限公司,http:////www.11467.com/shenzhen/co/723523.htm
深圳市和一创展科技有限公司的商铺,http://shenzhen0723523.11467.com
深圳市鑫川碧科技有限公司,http:////www.11467.com/shenzhen/co/353039.htm
深圳市鑫川碧科技有限公司的商铺,http://shenzhen0353039.11467.com
深圳市雀莹工艺品有限公司,http:////www.11467.com/shenzhen/co/764634.htm
深圳市雀莹工艺品有限公司的商铺,http://shenzhen0764634.11467.com
深圳市兴怡轩科技有限公司,http:////www.11467.com/shenzhen/co/809407.htm
深圳市兴怡轩科技有限公司的商铺,http://shenzhen0809407.11467.com
深圳市坪山新区同辉五金加工制品厂,http:////www.11467.com/shenzhen/co/152584.htm
深圳市坪山新区同辉五金加工制品厂的商铺,http://shenzhen0152584.11467.com
深圳市勤利丰科技有限公司,http:////www.11467.com/shenzhen/co/680303.htm
深圳市勤利丰科技有限公司的商铺,http://shenzhen0680303.11467.com
深圳市思派硅胶电子有限公司,http:////www.11467.com/shenzhen/co/224579.htm
深圳市思派硅胶电子有限公司的商铺,http://shenzhen0224579.11467.com
深圳市鑫凯鑫实业有限公司,http:////www.11467.com/shenzhen/co/225035.htm
深圳市鑫凯鑫实业有限公司的商铺,http://shenzhen0225035.11467.com
深圳市康乐通信器材批发市场学而通讯行,http:////www.11467.com/shenzhen/co/586738.htm
深圳市康乐通信器材批发市场学而通讯行的商铺,http://shenzhen0586738.11467.com
深圳市蓝邦数码有限公司,http:////www.11467.com/shenzhen/co/811288.htm
深圳市蓝邦数码有限公司的商铺,http://shenzhen0811288.11467.com
深圳市欧卡沃塑胶电子有限公司,http:////www.11467.com/shenzhen/co/800062.htm
深圳市欧卡沃塑胶电子有限公司的商铺,http://shenzhen0800062.11467.com
深圳市鹏博软件技术有限公司,http:////www.11467.com/shenzhen/co/722754.htm
深圳市鹏博软件技术有限公司的商铺,http://shenzhen0722754.11467.com
深圳市盛艺达有机玻璃工艺制品有限公司,http:////www.11467.com/shenzhen/co/810618.htm
深圳市盛艺达有机玻璃工艺制品有限公司的商铺,http://shenzhen0810618.11467.com
深圳市跃烽科技有限公司,http:////www.11467.com/shenzhen/co/805123.htm
深圳市跃烽科技有限公司的商铺,http://shenzhen0805123.11467.com
深圳市浩易博礼品有限公司,http:////www.11467.com/shenzhen/co/811730.htm
深圳市浩易博礼品有限公司的商铺,http://shenzhen0811730.11467.com
深圳市仕宏科技有限公司,http:////www.11467.com/shenzhen/co/809528.htm
深圳市仕宏科技有限公司的商铺,http://shenzhen0809528.11467.com
深圳市索佳达数码科技有限公司,http:////www.11467.com/shenzhen/co/253868.htm
深圳市索佳达数码科技有限公司的商铺,http://shenzhen0253868.11467.com
深圳市合信精通科技有限公司,http:////www.11467.com/shenzhen/co/779039.htm
深圳市合信精通科技有限公司的商铺,http://shenzhen0779039.11467.com
深圳市源艺坊工艺品有限公司,http:////www.11467.com/shenzhen/co/224017.htm
深圳市源艺坊工艺品有限公司的商铺,http://shenzhen0224017.11467.com
深圳泰科橡胶有限公司,http:////www.11467.com/shenzhen/co/496562.htm
深圳泰科橡胶有限公司的商铺,http://shenzhen0496562.11467.com
深圳市永泰顺手袋箱包厂,http:////www.11467.com/shenzhen/co/726645.htm
深圳市永泰顺手袋箱包厂的商铺,http://shenzhen0726645.11467.com
深圳市振远工艺品有限公司,http:////www.11467.com/shenzhen/co/152596.htm
深圳市振远工艺品有限公司的商铺,http://shenzhen0152596.11467.com
深圳市泰乐工艺品有限公司,http:////www.11467.com/shenzhen/co/223982.htm
深圳市泰乐工艺品有限公司的商铺,http://shenzhen0223982.11467.com
深圳市全铭祥科技有限公司,http:////www.11467.com/shenzhen/co/782119.htm
深圳市全铭祥科技有限公司的商铺,http://shenzhen0782119.11467.com
深圳市谦龙威科技有限公司,http:////www.11467.com/shenzhen/co/805968.htm
深圳市谦龙威科技有限公司的商铺,http://shenzhen0805968.11467.com
深圳市福田区新金光明电子商行,http:////www.11467.com/shenzhen/co/810943.htm
深圳市福田区新金光明电子商行的商铺,http://shenzhen0810943.11467.com
深圳市凯运发橡胶制品有限公司,http:////www.11467.com/shenzhen/co/224758.htm
深圳市凯运发橡胶制品有限公司的商铺,http://shenzhen0224758.11467.com
深圳娜安丽礼品有限公司,http:////www.11467.com/shenzhen/co/793770.htm
深圳娜安丽礼品有限公司的商铺,http://shenzhen0793770.11467.com
深圳欧莱仕数码科技有限公司,http:////www.11467.com/shenzhen/co/336256.htm
深圳欧莱仕数码科技有限公司的商铺,http://shenzhen0336256.11467.com
深圳市佳冠捷科技有限公司,http:////www.11467.com/shenzhen/co/725907.htm
深圳市佳冠捷科技有限公司的商铺,http://shenzhen0725907.11467.com
深圳市璟峰有机玻璃有限公司,http:////www.11467.com/shenzhen/co/421079.htm
深圳市璟峰有机玻璃有限公司的商铺,http://shenzhen0421079.11467.com
深圳市宇迪织带礼品有限公司,http:////www.11467.com/shenzhen/co/764635.htm
深圳市宇迪织带礼品有限公司的商铺,http://shenzhen0764635.11467.com
深圳市怡嘉淇科技有限公司,http:////www.11467.com/shenzhen/co/278072.htm
深圳市怡嘉淇科技有限公司的商铺,http://shenzhen0278072.11467.com
深圳市旺胜通塑胶五金制品有限公司,http:////www.11467.com/shenzhen/co/464724.htm
深圳市旺胜通塑胶五金制品有限公司的商铺,http://shenzhen0464724.11467.com
深圳市鑫隆延科技有限公司,http:////www.11467.com/shenzhen/co/811700.htm
深圳市鑫隆延科技有限公司的商铺,http://shenzhen0811700.11467.com
深圳市铭丰兴五金工艺制品有限公司,http:////www.11467.com/shenzhen/co/760734.htm
深圳市铭丰兴五金工艺制品有限公司的商铺,http://shenzhen0760734.11467.com
深圳市凯瑞阳科技有限公司,http:////www.11467.com/shenzhen/co/278060.htm
深圳市凯瑞阳科技有限公司的商铺,http://shenzhen0278060.11467.com
深圳市顺特尔科技发展有限公司,http:////www.11467.com/shenzhen/co/625958.htm
深圳市顺特尔科技发展有限公司的商铺,http://shenzhen0625958.11467.com
河北日伊丰达绒毛加工有限公司,http:////www.11467.com/xintai/co/50076.htm
河北日伊丰达绒毛加工有限公司的商铺,http://xintai050076.11467.com
中山市东凤镇文荣工艺礼品厂,http:////www.11467.com/zhongshan/co/70759.htm
中山市东凤镇文荣工艺礼品厂的商铺,http://zhongshan070759.11467.com
天津市宝坻区利宝祥瑞琉璃工艺品厂,http:////www.11467.com/tianjin/co/6402.htm
天津市宝坻区利宝祥瑞琉璃工艺品厂的商铺,http://tianjin06402.11467.com
天津市晟诺自行车有限公司,http:////www.11467.com/tianjin/co/14296.htm
天津市晟诺自行车有限公司的商铺,http://tianjin014296.11467.com
肇庆市美宝实业有限公司,http:////www.11467.com/zhaoqing/co/30976.htm
肇庆市美宝实业有限公司的商铺,http://zhaoqing030976.11467.com
中山市东凤镇国蔷电脑打印经营部,http:////www.11467.com/zhongshan/co/73529.htm
中山市东凤镇国蔷电脑打印经营部的商铺,http://zhongshan073529.11467.com
东莞市瑞钏玻璃工艺品有限公司,http:////www.11467.com/dongguan/co/164443.htm
东莞市瑞钏玻璃工艺品有限公司的商铺,http://dongguan0164443.11467.com
东莞市禄祥塑胶制品有限公司,http:////www.11467.com/dongguan/co/164293.htm
东莞市禄祥塑胶制品有限公司的商铺,http://dongguan0164293.11467.com
佛山市南海区平洲利达工艺厂,http:////www.11467.com/foshan/co/213805.htm
佛山市南海区平洲利达工艺厂的商铺,http://foshan0213805.11467.com
佛山市顺德区源冠金属制品有限公司,http:////www.11467.com/foshan/co/5937.htm
佛山市顺德区源冠金属制品有限公司的商铺,http://foshan05937.11467.com
广州市白云区粤雅工艺品厂,http:////www.11467.com/guangzhou/co/142161.htm
广州市白云区粤雅工艺品厂的商铺,http://guangzhou0142161.11467.com
广州市荔湾区佳濠电子产品商行,http:////www.11467.com/guangzhou/co/161499.htm
广州市荔湾区佳濠电子产品商行的商铺,http://guangzhou0161499.11467.com
深圳市盛航光电有限公司,http:////www.11467.com/shenzhen/co/316590.htm
深圳市盛航光电有限公司的商铺,http://shenzhen0316590.11467.com
深圳市周氏精密模切制品有限公司,http:////www.11467.com/shenzhen/co/724872.htm
深圳市周氏精密模切制品有限公司的商铺,http://shenzhen0724872.11467.com
东莞市沙田英捷雕刻饰品厂,http:////www.11467.com/dongguan/co/275664.htm
东莞市沙田英捷雕刻饰品厂的商铺,http://dongguan0275664.11467.com
苏州益本电子材料有限公司,http:////www.11467.com/suzhou/co/248556.htm
苏州益本电子材料有限公司的商铺,http://suzhou0248556.11467.com
平和县奇特工艺品店,http:////www.11467.com/dongguan/co/410689.htm
平和县奇特工艺品店的商铺,http://dongguan0410689.11467.com
佛山市南海区山盛五金模具厂,http:////www.11467.com/foshan/co/356044.htm
佛山市南海区山盛五金模具厂的商铺,http://foshan0356044.11467.com
深圳市众力工艺品有限公司,http:////www.11467.com/shenzhen/co/243665.htm
深圳市众力工艺品有限公司的商铺,http://shenzhen0243665.11467.com
苏州迈杰克电子有限公司,http:////www.11467.com/suzhou/co/269175.htm
苏州迈杰克电子有限公司的商铺,http://suzhou0269175.11467.com
深圳市天银光电科技有限公司,http:////www.11467.com/shenzhen/co/813228.htm
深圳市天银光电科技有限公司的商铺,http://shenzhen0813228.11467.com
深圳市喜丽康硅胶制品有限公司,http:////www.11467.com/shenzhen/co/811299.htm
深圳市喜丽康硅胶制品有限公司的商铺,http://shenzhen0811299.11467.com
深圳市艾玛奇科技有限公司,http:////www.11467.com/shenzhen/co/778473.htm
深圳市艾玛奇科技有限公司的商铺,http://shenzhen0778473.11467.com
深圳市中鼎硅胶制品有限公司,http:////www.11467.com/shenzhen/co/206698.htm
深圳市中鼎硅胶制品有限公司的商铺,http://shenzhen0206698.11467.com
深圳市深勤业塑胶五金制品厂,http:////www.11467.com/shenzhen/co/506202.htm
深圳市深勤业塑胶五金制品厂的商铺,http://shenzhen0506202.11467.com
深圳市新东泰包装制品有限公司,http:////www.11467.com/shenzhen/co/811390.htm
深圳市新东泰包装制品有限公司的商铺,http://shenzhen0811390.11467.com
深圳市鑫光亮电子有限公司,http:////www.11467.com/shenzhen/co/235612.htm
深圳市鑫光亮电子有限公司的商铺,http://shenzhen0235612.11467.com
东莞市高埗凯迪橡胶制品厂,http:////www.11467.com/dongguan/co/556799.htm
东莞市高埗凯迪橡胶制品厂的商铺,http://dongguan0556799.11467.com
深圳市中伟星通手袋制品有限公司,http:////www.11467.com/shenzhen/co/223843.htm
深圳市中伟星通手袋制品有限公司的商铺,http://shenzhen0223843.11467.com
中山市横栏镇金艺玻璃工艺加工店,http:////www.11467.com/zhongshan/co/58598.htm
中山市横栏镇金艺玻璃工艺加工店的商铺,http://zhongshan058598.11467.com
中山市东凤镇同利工艺制品厂,http:////www.11467.com/zhongshan/co/53615.htm
中山市东凤镇同利工艺制品厂的商铺,http://zhongshan053615.11467.com
天津市红桥区蒙奇奇玩具商行,http:////www.11467.com/tianjin/co/195853.htm
天津市红桥区蒙奇奇玩具商行的商铺,http://tianjin0195853.11467.com
中山市横栏镇上合金属制品厂,http:////www.11467.com/zhongshan/co/144714.htm
中山市横栏镇上合金属制品厂的商铺,http://zhongshan0144714.11467.com
