青州市古香画框厂,http:////www.11467.com/weifang/co/116826.htm
青州市古香画框厂的商铺,http://weifang0116826.11467.com
中山市尼雅金属制品有限公司,http:////www.11467.com/zhongshan/co/53552.htm
中山市尼雅金属制品有限公司的商铺,http://zhongshan053552.11467.com
湖南通大自动化供水设备有限公司,http:////www.11467.com/changsha/co/85754.htm
湖南通大自动化供水设备有限公司的商铺,http://changsha085754.11467.com
莱阳市明星艺术品有限公司,http:////www.11467.com/yantai/co/133945.htm
莱阳市明星艺术品有限公司的商铺,http://yantai0133945.11467.com
盐城市颐达工艺品有限公司,http:////www.11467.com/yancheng/co/58028.htm
盐城市颐达工艺品有限公司的商铺,http://yancheng058028.11467.com
苏州工业园区六丰线带有限公司,http:////www.11467.com/suzhou/co/11371.htm
苏州工业园区六丰线带有限公司的商铺,http://suzhou011371.11467.com
深圳市彤达塑胶有限公司,http:////www.11467.com/shenzhen/co/144309.htm
深圳市彤达塑胶有限公司的商铺,http://shenzhen0144309.11467.com
佛山弘泰数码科技有限公司,http:////www.11467.com/foshan/co/305357.htm
佛山弘泰数码科技有限公司的商铺,http://foshan0305357.11467.com
双鸭山市烽烨粮油贸易有限责任公司,http:////www.11467.com/dalian/co/54849.htm
双鸭山市烽烨粮油贸易有限责任公司的商铺,http://dalian054849.11467.com
东莞市大岭山达德五金加工厂,http:////www.11467.com/dongguan/co/164438.htm
东莞市大岭山达德五金加工厂的商铺,http://dongguan0164438.11467.com
洪漫(个体经营),http:////www.11467.com/chaozhou/co/30414.htm
洪漫(个体经营)的商铺,http://chaozhou030414.11467.com
张 妮（个体经营）,http:////www.11467.com/chaozhou/co/26117.htm
张 妮（个体经营）的商铺,http://chaozhou026117.11467.com
义乌市树峰制袋厂（上海办事处）,http:////www.11467.com/shanghai/co/35862.htm
义乌市树峰制袋厂（上海办事处）的商铺,http://shanghai035862.11467.com
宜盛手工艺品厂,http:////www.11467.com/weihai/co/29029.htm
宜盛手工艺品厂的商铺,http://weihai029029.11467.com
漳州市炎达钟表有限公司,http:////www.11467.com/zhangzhou/co/39674.htm
漳州市炎达钟表有限公司的商铺,http://zhangzhou039674.11467.com
兰州凯文雕塑公司,http:////www.11467.com/lanzhou/co/73338.htm
兰州凯文雕塑公司的商铺,http://lanzhou073338.11467.com
东莞市启原实业公司,http:////www.11467.com/dongguan/co/489003.htm
东莞市启原实业公司的商铺,http://dongguan0489003.11467.com
东莞市大象电子科技有限公司,http:////www.11467.com/dongguan/co/572048.htm
东莞市大象电子科技有限公司的商铺,http://dongguan0572048.11467.com
苏州高新区金忠玉雕厂,http:////www.11467.com/suzhou/co/217221.htm
苏州高新区金忠玉雕厂的商铺,http://suzhou0217221.11467.com
广州市乾森电子科技有限公司,http:////www.11467.com/guangzhou/co/428501.htm
广州市乾森电子科技有限公司的商铺,http://guangzhou0428501.11467.com
中正铜雕工艺品厂,http:////www.11467.com/baoding/co/64116.htm
中正铜雕工艺品厂的商铺,http://baoding064116.11467.com
河南省长葛市喜洋洋礼炮厂,http:////www.11467.com/xuchang/co/19254.htm
河南省长葛市喜洋洋礼炮厂的商铺,http://xuchang019254.11467.com
东莞市博翔塑胶制品有限公司,http:////www.11467.com/dongguan/co/146238.htm
东莞市博翔塑胶制品有限公司的商铺,http://dongguan0146238.11467.com
深圳市至尚旺达科技有限公司,http:////www.11467.com/shenzhen/co/811078.htm
深圳市至尚旺达科技有限公司的商铺,http://shenzhen0811078.11467.com
王敏,http:////www.11467.com/shenzhen/co/219438.htm
王敏的商铺,http://shenzhen0219438.11467.com
温州国盛包装制品有限公司,http:////www.11467.com/baoding/co/91195.htm
温州国盛包装制品有限公司的商铺,http://baoding091195.11467.com
中山市东凤镇俊辉饰品礼品厂,http:////www.11467.com/zhongshan/co/53540.htm
中山市东凤镇俊辉饰品礼品厂的商铺,http://zhongshan053540.11467.com
成都市金堂县红旗花炮厂,http:////www.11467.com/chengdu/co/142872.htm
成都市金堂县红旗花炮厂的商铺,http://chengdu0142872.11467.com
厦门杂货铺工艺坊有限公司,http:////www.11467.com/xiamen/co/85918.htm
厦门杂货铺工艺坊有限公司的商铺,http://xiamen085918.11467.com
融科汇讯股份有限公司,http:////www.11467.com/shenzhen/co/612949.htm
融科汇讯股份有限公司的商铺,http://shenzhen0612949.11467.com
东莞恒华光学制品有限公司,http:////www.11467.com/dongguan/co/414575.htm
东莞恒华光学制品有限公司的商铺,http://dongguan0414575.11467.com
沧州鑫裕达建筑机械有限公司,http:////www.11467.com/cangzhou/co/56446.htm
沧州鑫裕达建筑机械有限公司的商铺,http://cangzhou056446.11467.com
苍南普尔工艺品有限公司,http:////www.11467.com/baoding/co/91225.htm
苍南普尔工艺品有限公司的商铺,http://baoding091225.11467.com
涿州市金雅玉器厂,http:////www.11467.com/baoding/co/38143.htm
涿州市金雅玉器厂的商铺,http://baoding038143.11467.com
阳江市金峰花城织带工艺有限公司,http:////www.11467.com/shenzhen/co/723654.htm
阳江市金峰花城织带工艺有限公司的商铺,http://shenzhen0723654.11467.com
深圳市星派电子有限公司,http:////www.11467.com/shenzhen/co/224578.htm
深圳市星派电子有限公司的商铺,http://shenzhen0224578.11467.com
中山市小榄镇新巢工艺品厂,http:////www.11467.com/zhongshan/co/146925.htm
中山市小榄镇新巢工艺品厂的商铺,http://zhongshan0146925.11467.com
威海韩城名饰贸易有限公司,http:////www.11467.com/weihai/co/29030.htm
威海韩城名饰贸易有限公司的商铺,http://weihai029030.11467.com
北京智膜科技有限公司,http:////www.11467.com/beijing/co/761832.htm
北京智膜科技有限公司的商铺,http://beijing0761832.11467.com
苍南县龙港孟达塑料饰品工艺厂,http:////www.11467.com/baoding/co/91302.htm
苍南县龙港孟达塑料饰品工艺厂的商铺,http://baoding091302.11467.com
苍南县雯创铝塑制品厂,http:////www.11467.com/baoding/co/91324.htm
苍南县雯创铝塑制品厂的商铺,http://baoding091324.11467.com
苍南县龙港港通塑料制品加工厂,http:////www.11467.com/baoding/co/91354.htm
苍南县龙港港通塑料制品加工厂的商铺,http://baoding091354.11467.com
深圳市翔鑫金羽塑胶有限公司,http:////www.11467.com/shenzhen/co/809270.htm
深圳市翔鑫金羽塑胶有限公司的商铺,http://shenzhen0809270.11467.com
深圳市亚利韦科技有限公司,http:////www.11467.com/shenzhen/co/253450.htm
深圳市亚利韦科技有限公司的商铺,http://shenzhen0253450.11467.com
深圳市愚道印刷有限公司,http:////www.11467.com/shenzhen/co/723010.htm
深圳市愚道印刷有限公司的商铺,http://shenzhen0723010.11467.com
东莞锐铭金属制品有限公司,http:////www.11467.com/dongguan/co/540182.htm
东莞锐铭金属制品有限公司的商铺,http://dongguan0540182.11467.com
东莞市博利五金饰品有限公司,http:////www.11467.com/dongguan/co/72581.htm
东莞市博利五金饰品有限公司的商铺,http://dongguan072581.11467.com
东莞家源五金制品厂,http:////www.11467.com/dongguan/co/414813.htm
东莞家源五金制品厂的商铺,http://dongguan0414813.11467.com
深圳市特思德激光设备有限公司,http:////www.11467.com/qiye/7119.htm
浙江越光工艺品有限公司,http:////www.11467.com/shaoxing/co/81227.htm
东莞市塘厦惠通包装制品厂,http:////www.11467.com/dongguan/co/260542.htm
东莞市塘厦惠通包装制品厂的商铺,http://dongguan0260542.11467.com
东莞市高埗伟翔五金工艺品加工店,http:////www.11467.com/dongguan/co/164258.htm
东莞市高埗伟翔五金工艺品加工店的商铺,http://dongguan0164258.11467.com
东莞市亿享体育用品有限公司,http:////www.11467.com/dongguan/co/164184.htm
东莞市亿享体育用品有限公司的商铺,http://dongguan0164184.11467.com
东莞市永昌美工艺品有限公司,http:////www.11467.com/dongguan/co/164321.htm
东莞市永昌美工艺品有限公司的商铺,http://dongguan0164321.11467.com
东莞市寮步金成工艺品厂,http:////www.11467.com/dongguan/co/164649.htm
东莞市寮步金成工艺品厂的商铺,http://dongguan0164649.11467.com
东莞市寮步鸿兴玩具厂,http:////www.11467.com/dongguan/co/164718.htm
东莞市寮步鸿兴玩具厂的商铺,http://dongguan0164718.11467.com
东莞市虎门宏泽礼品包装厂,http:////www.11467.com/dongguan/co/164287.htm
东莞市虎门宏泽礼品包装厂的商铺,http://dongguan0164287.11467.com
东莞市石排玖捷玩具厂,http:////www.11467.com/dongguan/co/164581.htm
东莞市石排玖捷玩具厂的商铺,http://dongguan0164581.11467.com
东莞市天悦工艺品有限公司,http:////www.11467.com/dongguan/co/164304.htm
东莞市天悦工艺品有限公司的商铺,http://dongguan0164304.11467.com
东莞市长安明悦五金饰品店,http:////www.11467.com/dongguan/co/164606.htm
东莞市长安明悦五金饰品店的商铺,http://dongguan0164606.11467.com
东莞市厚街华茂织带厂,http:////www.11467.com/dongguan/co/164508.htm
东莞市厚街华茂织带厂的商铺,http://dongguan0164508.11467.com
东莞市樟木头吉华工艺厂,http:////www.11467.com/dongguan/co/164432.htm
东莞市樟木头吉华工艺厂的商铺,http://dongguan0164432.11467.com
福晋五金饰品公司,http:////www.11467.com/dongguan/co/164612.htm
福晋五金饰品公司的商铺,http://dongguan0164612.11467.com
深圳市龙岗区平湖广盈达五金行,http:////www.11467.com/dongguan/co/164467.htm
深圳市龙岗区平湖广盈达五金行的商铺,http://dongguan0164467.11467.com
东莞市金鑫商标厂,http:////www.11467.com/dongguan/co/164652.htm
东莞市金鑫商标厂的商铺,http://dongguan0164652.11467.com
东莞市黄江恒富玩具配件制品厂,http:////www.11467.com/dongguan/co/200149.htm
东莞市黄江恒富玩具配件制品厂的商铺,http://dongguan0200149.11467.com
东莞市石排明艺工艺品厂,http:////www.11467.com/dongguan/co/164692.htm
东莞市石排明艺工艺品厂的商铺,http://dongguan0164692.11467.com
东莞市淼森塑料电子有限公司,http:////www.11467.com/dongguan/co/500963.htm
东莞市淼森塑料电子有限公司的商铺,http://dongguan0500963.11467.com
东莞市百兆塑胶制品有限公司,http:////www.11467.com/dongguan/co/143700.htm
东莞市百兆塑胶制品有限公司的商铺,http://dongguan0143700.11467.com
东莞市中鼎会计咨询有限公司,http:////www.11467.com/dongguan/co/488553.htm
东莞市中鼎会计咨询有限公司的商铺,http://dongguan0488553.11467.com
东莞亿涛五金饰品有限公司,http:////www.11467.com/dongguan/co/487641.htm
东莞亿涛五金饰品有限公司的商铺,http://dongguan0487641.11467.com
东莞市寮步佳和橡塑配件加工厂,http:////www.11467.com/dongguan/co/556454.htm
东莞市寮步佳和橡塑配件加工厂的商铺,http://dongguan0556454.11467.com
东莞市金色星辰饰品有限公司,http:////www.11467.com/dongguan/co/183575.htm
东莞市金色星辰饰品有限公司的商铺,http://dongguan0183575.11467.com
东莞市金来塑胶有限公司,http:////www.11467.com/dongguan/co/72072.htm
东莞市金来塑胶有限公司的商铺,http://dongguan072072.11467.com
东莞市厦商电子有限公司,http:////www.11467.com/dongguan/co/413986.htm
东莞市厦商电子有限公司的商铺,http://dongguan0413986.11467.com
东莞市高埗好又达塑胶制品经营部,http:////www.11467.com/dongguan/co/488197.htm
东莞市高埗好又达塑胶制品经营部的商铺,http://dongguan0488197.11467.com
东莞市伊莱凯商贸有限公司,http:////www.11467.com/dongguan/co/506411.htm
东莞市伊莱凯商贸有限公司的商铺,http://dongguan0506411.11467.com
东莞市谢岗宏泰五金饰品厂,http:////www.11467.com/dongguan/co/411837.htm
东莞市谢岗宏泰五金饰品厂的商铺,http://dongguan0411837.11467.com
东莞市万江小酷比工艺品材料经营部,http:////www.11467.com/dongguan/co/532621.htm
东莞市万江小酷比工艺品材料经营部的商铺,http://dongguan0532621.11467.com
东莞市圆美精密电子有限公司,http:////www.11467.com/dongguan/co/501494.htm
东莞市圆美精密电子有限公司的商铺,http://dongguan0501494.11467.com
东莞市三赢贸易有限公司,http:////www.11467.com/dongguan/co/411847.htm
东莞市三赢贸易有限公司的商铺,http://dongguan0411847.11467.com
东莞市石排尚美塑胶礼品厂,http:////www.11467.com/dongguan/co/410784.htm
东莞市石排尚美塑胶礼品厂的商铺,http://dongguan0410784.11467.com
东莞市鑫锋日用品有限公司,http:////www.11467.com/dongguan/co/410419.htm
东莞市鑫锋日用品有限公司的商铺,http://dongguan0410419.11467.com
东莞市清溪威德利包装材料厂,http:////www.11467.com/dongguan/co/201261.htm
东莞市清溪威德利包装材料厂的商铺,http://dongguan0201261.11467.com
东莞市沙田冠昌绳带厂,http:////www.11467.com/dongguan/co/184799.htm
东莞市沙田冠昌绳带厂的商铺,http://dongguan0184799.11467.com
东莞市梦想塑胶五金制品有限公司,http:////www.11467.com/dongguan/co/184002.htm
东莞市梦想塑胶五金制品有限公司的商铺,http://dongguan0184002.11467.com
东莞市嘉一运动用品有限公司,http:////www.11467.com/dongguan/co/496555.htm
东莞市嘉一运动用品有限公司的商铺,http://dongguan0496555.11467.com
东莞市金灿运动用品有限公司,http:////www.11467.com/dongguan/co/556591.htm
东莞市金灿运动用品有限公司的商铺,http://dongguan0556591.11467.com
东莞市汇捷皮具制品有限公司,http:////www.11467.com/dongguan/co/555734.htm
东莞市汇捷皮具制品有限公司的商铺,http://dongguan0555734.11467.com
东莞市厚街祺盛磁铁厂,http:////www.11467.com/dongguan/co/511414.htm
东莞市厚街祺盛磁铁厂的商铺,http://dongguan0511414.11467.com
东莞市盛飞真空设备有限公司,http:////www.11467.com/dongguan/co/126112.htm
东莞市盛飞真空设备有限公司的商铺,http://dongguan0126112.11467.com
东莞市朋友礼品制品厂,http:////www.11467.com/dongguan/co/472868.htm
东莞市朋友礼品制品厂的商铺,http://dongguan0472868.11467.com
东莞市塘厦德旺包装材料厂,http:////www.11467.com/dongguan/co/260641.htm
东莞市塘厦德旺包装材料厂的商铺,http://dongguan0260641.11467.com
东莞市永美塑胶制品有限公司,http:////www.11467.com/dongguan/co/76329.htm
东莞市永美塑胶制品有限公司的商铺,http://dongguan076329.11467.com
东莞市展恒织带有限公司,http:////www.11467.com/dongguan/co/146185.htm
东莞市展恒织带有限公司的商铺,http://dongguan0146185.11467.com
东莞市谢岗精拓五金饰品厂,http:////www.11467.com/dongguan/co/164138.htm
东莞市谢岗精拓五金饰品厂的商铺,http://dongguan0164138.11467.com
东莞市翔驰塑胶电子有限公司,http:////www.11467.com/dongguan/co/475269.htm
东莞市翔驰塑胶电子有限公司的商铺,http://dongguan0475269.11467.com
东莞市兴旺发硅胶制品有限公司,http:////www.11467.com/dongguan/co/479771.htm
东莞市兴旺发硅胶制品有限公司的商铺,http://dongguan0479771.11467.com
东莞市维度自动化设备有限公司,http:////www.11467.com/dongguan/co/184166.htm
东莞市维度自动化设备有限公司的商铺,http://dongguan0184166.11467.com
东莞市劲荣电子有限公司,http:////www.11467.com/dongguan/co/355217.htm
东莞市劲荣电子有限公司的商铺,http://dongguan0355217.11467.com
佛山市三水区白坭镇永健兴五金加工部,http:////www.11467.com/foshan/co/214008.htm
佛山市三水区白坭镇永健兴五金加工部的商铺,http://foshan0214008.11467.com
众兴硅橡胶制品厂,http:////www.11467.com/dongguan/co/164535.htm
众兴硅橡胶制品厂的商铺,http://dongguan0164535.11467.com
东莞市伟众杰五金饰品有限公司,http:////www.11467.com/dongguan/co/164305.htm
东莞市伟众杰五金饰品有限公司的商铺,http://dongguan0164305.11467.com
东莞新光百葳饰品有限公司,http:////www.11467.com/dongguan/co/164495.htm
东莞新光百葳饰品有限公司的商铺,http://dongguan0164495.11467.com
东莞市长安闪耀五金饰品厂,http:////www.11467.com/dongguan/co/164300.htm
东莞市长安闪耀五金饰品厂的商铺,http://dongguan0164300.11467.com
立玛品牌发展有限公司,http:////www.11467.com/dongguan/co/164391.htm
立玛品牌发展有限公司的商铺,http://dongguan0164391.11467.com
东莞市长安文宸五金饰品经营部,http:////www.11467.com/dongguan/co/164207.htm
东莞市长安文宸五金饰品经营部的商铺,http://dongguan0164207.11467.com
东莞市高埗传航之舟塑胶礼品经营部,http:////www.11467.com/dongguan/co/164880.htm
东莞市高埗传航之舟塑胶礼品经营部的商铺,http://dongguan0164880.11467.com
盛源五金饰品经营部,http:////www.11467.com/dongguan/co/164342.htm
盛源五金饰品经营部的商铺,http://dongguan0164342.11467.com
东莞市厚街裕宏织带厂,http:////www.11467.com/dongguan/co/174220.htm
东莞市厚街裕宏织带厂的商铺,http://dongguan0174220.11467.com
佛山市南海竣豪有机玻璃工艺厂,http:////www.11467.com/foshan/co/209253.htm
佛山市南海竣豪有机玻璃工艺厂的商铺,http://foshan0209253.11467.com
福州诚丽服饰有限公司,http:////www.11467.com/fuzhou/co/151628.htm
福州诚丽服饰有限公司的商铺,http://fuzhou0151628.11467.com
福州艺益滴塑工艺制品厂,http:////www.11467.com/fuzhou/co/136060.htm
福州艺益滴塑工艺制品厂的商铺,http://fuzhou0136060.11467.com
广州丝泊工艺制品有限公司,http:////www.11467.com/foshan/co/209062.htm
广州丝泊工艺制品有限公司的商铺,http://foshan0209062.11467.com
诚冠通信公司,http:////www.11467.com/guangzhou/co/161264.htm
诚冠通信公司的商铺,http://guangzhou0161264.11467.com
广州番禺博峰缘塑胶制品厂,http:////www.11467.com/guangzhou/co/161223.htm
广州番禺博峰缘塑胶制品厂的商铺,http://guangzhou0161223.11467.com
广东省佛山市亚非拉塑胶电子厂,http:////www.11467.com/guangzhou/co/161095.htm
广东省佛山市亚非拉塑胶电子厂的商铺,http://guangzhou0161095.11467.com
广州欧普特皮具制造有限公司,http:////www.11467.com/guangzhou/co/161282.htm
广州欧普特皮具制造有限公司的商铺,http://guangzhou0161282.11467.com
广州市白云区亿艺织带工艺厂,http:////www.11467.com/guangzhou/co/160995.htm
广州市白云区亿艺织带工艺厂的商铺,http://guangzhou0160995.11467.com
广州市丰盛皮具手袋厂,http:////www.11467.com/guangzhou/co/160988.htm
广州市丰盛皮具手袋厂的商铺,http://guangzhou0160988.11467.com
广州市晴晴动漫礼品有限公司,http:////www.11467.com/guangzhou/co/161293.htm
广州市晴晴动漫礼品有限公司的商铺,http://guangzhou0161293.11467.com
广州市欧迪瑞饰品有限公司,http:////www.11467.com/guangzhou/co/161326.htm
广州市欧迪瑞饰品有限公司的商铺,http://guangzhou0161326.11467.com
广州市荔湾区华鲨通讯器材商行,http:////www.11467.com/guangzhou/co/243323.htm
广州市荔湾区华鲨通讯器材商行的商铺,http://guangzhou0243323.11467.com
佛山市洋和电池有限公司,http:////www.11467.com/foshan/co/8728.htm
佛山市洋和电池有限公司的商铺,http://foshan08728.11467.com
广州格田塑料制品有限公司,http:////www.11467.com/guangzhou/co/245510.htm
广州格田塑料制品有限公司的商铺,http://guangzhou0245510.11467.com
广州市番禺区石壁靓靓工艺品厂,http:////www.11467.com/guangzhou/co/428807.htm
广州市番禺区石壁靓靓工艺品厂的商铺,http://guangzhou0428807.11467.com
佛山市南海区里水三丰塑料制品厂,http:////www.11467.com/foshan/co/342658.htm
佛山市南海区里水三丰塑料制品厂的商铺,http://foshan0342658.11467.com
东莞市友昌包装材料有限公司,http:////www.11467.com/dongguan/co/264690.htm
东莞市友昌包装材料有限公司的商铺,http://dongguan0264690.11467.com
佛山市南海晶沙五金饰品有限公司,http:////www.11467.com/foshan/co/190281.htm
佛山市南海晶沙五金饰品有限公司的商铺,http://foshan0190281.11467.com
佛山市劲日电子科技有限公司,http:////www.11467.com/foshan/co/355864.htm
佛山市劲日电子科技有限公司的商铺,http://foshan0355864.11467.com
广州凡特电子科技有限公司,http:////www.11467.com/guangzhou/co/496533.htm
广州凡特电子科技有限公司的商铺,http://guangzhou0496533.11467.com
广州金师五金塑胶有限公司,http:////www.11467.com/guangzhou/co/178388.htm
广州金师五金塑胶有限公司的商铺,http://guangzhou0178388.11467.com
东莞市虎门爱特园塑胶五金制品厂,http:////www.11467.com/dongguan/co/482982.htm
东莞市虎门爱特园塑胶五金制品厂的商铺,http://dongguan0482982.11467.com
广州市番禺区石壁鸿吉工艺品厂,http:////www.11467.com/guangzhou/co/455639.htm
广州市番禺区石壁鸿吉工艺品厂的商铺,http://guangzhou0455639.11467.com
广州市亚琪皮具有限公司,http:////www.11467.com/guangzhou/co/211087.htm
广州市亚琪皮具有限公司的商铺,http://guangzhou0211087.11467.com
广州市品俊电子有限公司,http:////www.11467.com/guangzhou/co/455627.htm
广州市品俊电子有限公司的商铺,http://guangzhou0455627.11467.com
广州市番禺区石壁多茂工艺品厂,http:////www.11467.com/guangzhou/co/429432.htm
广州市番禺区石壁多茂工艺品厂的商铺,http://guangzhou0429432.11467.com
广州华廉机电设备有限公司,http:////www.11467.com/guangzhou/co/110384.htm
广州华廉机电设备有限公司的商铺,http://guangzhou0110384.11467.com
东莞市恒亮胶贴制品有限公司,http:////www.11467.com/dongguan/co/256948.htm
东莞市恒亮胶贴制品有限公司的商铺,http://dongguan0256948.11467.com
东莞市长安新豪胶粘制品厂,http:////www.11467.com/dongguan/co/461681.htm
东莞市长安新豪胶粘制品厂的商铺,http://dongguan0461681.11467.com
怡業股份有限公司 COMART CORP,http:////www.11467.com/dongguan/co/164317.htm
怡業股份有限公司 COMART CORP的商铺,http://dongguan0164317.11467.com
东莞市凤岗恒隆塑胶包装厂,http:////www.11467.com/dongguan/co/184179.htm
东莞市凤岗恒隆塑胶包装厂的商铺,http://dongguan0184179.11467.com
东莞市恩爵保护膜材料有限公司,http:////www.11467.com/dongguan/co/488464.htm
东莞市恩爵保护膜材料有限公司的商铺,http://dongguan0488464.11467.com
东莞市冉峰塑胶制品有限公司,http:////www.11467.com/dongguan/co/493928.htm
东莞市冉峰塑胶制品有限公司的商铺,http://dongguan0493928.11467.com
梧州市澳域饰品厂,http:////www.11467.com/foshan/co/190287.htm
梧州市澳域饰品厂的商铺,http://foshan0190287.11467.com
广州市番禺区石壁利杨工艺品厂,http:////www.11467.com/guangzhou/co/496575.htm
广州市番禺区石壁利杨工艺品厂的商铺,http://guangzhou0496575.11467.com
广州市白云区华明工艺制品厂,http:////www.11467.com/guangzhou/co/319677.htm
广州市白云区华明工艺制品厂的商铺,http://guangzhou0319677.11467.com
广州市番禺区石壁泓锐工艺品厂,http:////www.11467.com/guangzhou/co/455645.htm
广州市番禺区石壁泓锐工艺品厂的商铺,http://guangzhou0455645.11467.com
佛山市南海思泊金属制品厂,http:////www.11467.com/guangzhou/co/194834.htm
佛山市南海思泊金属制品厂的商铺,http://guangzhou0194834.11467.com
佛山市南海区里水吉行风针织厂,http:////www.11467.com/foshan/co/331496.htm
佛山市南海区里水吉行风针织厂的商铺,http://foshan0331496.11467.com
蓬江区立世工艺行,http:////www.11467.com/jiangmen/co/88970.htm
蓬江区立世工艺行的商铺,http://jiangmen088970.11467.com
江门市蓬江区凤彩工艺厂,http:////www.11467.com/jiangmen/co/3597.htm
江门市蓬江区凤彩工艺厂的商铺,http://jiangmen03597.11467.com
杭州鑫晴玩具有限公司,http:////www.11467.com/hangzhou/co/222322.htm
杭州鑫晴玩具有限公司的商铺,http://hangzhou0222322.11467.com
合肥偶像动漫饰品有限公司,http:////www.11467.com/hefei/co/84808.htm
合肥偶像动漫饰品有限公司的商铺,http://hefei084808.11467.com
广州市白云区纤芊织带工艺厂,http:////www.11467.com/guangzhou/co/161023.htm
广州市白云区纤芊织带工艺厂的商铺,http://guangzhou0161023.11467.com
广州市番禺区大石新姿工艺品经营部,http:////www.11467.com/guangzhou/co/161029.htm
广州市番禺区大石新姿工艺品经营部的商铺,http://guangzhou0161029.11467.com
惠州市惠城区浩峰五金厂,http:////www.11467.com/huizhou/co/62155.htm
惠州市惠城区浩峰五金厂的商铺,http://huizhou062155.11467.com
惠东县平山镇新迪玩具厂,http:////www.11467.com/huizhou/co/59168.htm
惠东县平山镇新迪玩具厂的商铺,http://huizhou059168.11467.com
博罗县石湾镇银华电子厂,http:////www.11467.com/huizhou/co/65021.htm
博罗县石湾镇银华电子厂的商铺,http://huizhou065021.11467.com
江门市蓬江区荷塘远大木器工艺厂,http:////www.11467.com/jiangmen/co/84454.htm
江门市蓬江区荷塘远大木器工艺厂的商铺,http://jiangmen084454.11467.com
