巩义市美奇工贸有限公司,http:////www.11467.com/zhengzhou/co/259424.htm
巩义市美奇工贸有限公司的商铺,http://zhengzhou0259424.11467.com
潍坊兴亚工贸有限公司,http:////www.11467.com/weifang/co/173898.htm
潍坊兴亚工贸有限公司的商铺,http://weifang0173898.11467.com
长春理晶光电材料有限公司,http:////www.11467.com/changchun/co/69438.htm
长春理晶光电材料有限公司的商铺,http://changchun069438.11467.com
天津市津港化工有限公司,http:////www.11467.com/tianjin/co/190249.htm
天津市津港化工有限公司的商铺,http://tianjin0190249.11467.com
天津金泽国际贸易有限公司,http:////www.11467.com/tianjin/co/75771.htm
天津金泽国际贸易有限公司的商铺,http://tianjin075771.11467.com
天津市安庆精细化工有限公司,http:////www.11467.com/tianjin/co/37449.htm
天津市安庆精细化工有限公司的商铺,http://tianjin037449.11467.com
天津市塘沽恒利化工厂,http:////www.11467.com/tianjin/co/158842.htm
天津市塘沽恒利化工厂的商铺,http://tianjin0158842.11467.com
天津市鑫源化工有限公司,http:////www.11467.com/tianjin/co/190308.htm
天津市鑫源化工有限公司的商铺,http://tianjin0190308.11467.com
四川省思域化工有限公司,http:////www.11467.com/chengdu/co/133.htm
四川省思域化工有限公司的商铺,http://chengdu0133.11467.com
天津天井化工商贸有限公司,http:////www.11467.com/tianjin/co/50521.htm
天津天井化工商贸有限公司的商铺,http://tianjin050521.11467.com
潍坊西贝嘉化工有限公司,http:////www.11467.com/weifang/co/141615.htm
潍坊西贝嘉化工有限公司的商铺,http://weifang0141615.11467.com
天津市赢达稀贵化学试剂厂,http:////www.11467.com/tianjin/co/45841.htm
天津市赢达稀贵化学试剂厂的商铺,http://tianjin045841.11467.com
太原市鑫玉峰化工厂,http:////www.11467.com/qiye/90217666.htm
太原市鑫玉峰化工厂的商铺,http://90217666.b2b.11467.com
四川什邡红石化工有限责任公司,http:////www.11467.com/qiye/93423223.htm
四川什邡红石化工有限责任公司的商铺,http://93423223.b2b.11467.com
郑州育才磷酸盐化工厂,http:////www.11467.com/qiye/93434150.htm
郑州育才磷酸盐化工厂的商铺,http://93434150.b2b.11467.com
石家庄杏远化工科技有限公司,http:////www.11467.com/qiye/93105422.htm
石家庄杏远化工科技有限公司的商铺,http://93105422.b2b.11467.com
保定市保利瑞合环保科技有限公司,http:////www.11467.com/qiye/93161054.htm
保定市保利瑞合环保科技有限公司的商铺,http://93161054.b2b.11467.com
黄骅市中盛化工产品有限公司,http:////www.11467.com/qiye/93166962.htm
黄骅市中盛化工产品有限公司的商铺,http://93166962.b2b.11467.com
漳浦县联发铝土矿有限公司,http:////www.11467.com/zhangzhou/co/8879.htm
漳浦县联发铝土矿有限公司的商铺,http://zhangzhou08879.11467.com
天津市北辰区泰星化工厂,http:////www.11467.com/tianjin/co/9446.htm
天津市北辰区泰星化工厂的商铺,http://tianjin09446.11467.com
沈阳红山化工原料有限公司,http:////www.11467.com/shenyang/co/75860.htm
沈阳红山化工原料有限公司的商铺,http://shenyang075860.11467.com
金怡凯科技（深圳）有限公司,http:////www.11467.com/shenzhen/co/758293.htm
金怡凯科技（深圳）有限公司的商铺,http://shenzhen0758293.11467.com
杭州恒庆化工有限公司,http:////www.11467.com/hangzhou/co/312627.htm
杭州恒庆化工有限公司的商铺,http://hangzhou0312627.11467.com
佛山市南海中博化工原料贸易部,http:////www.11467.com/foshan/co/478981.htm
佛山市南海中博化工原料贸易部的商铺,http://foshan0478981.11467.com
顶新方解石厂,http:////www.11467.com/hechi/co/11552.htm
广西巴马盈峰矿业发展有限公司,http:////www.11467.com/hechi/co/11531.htm
常宁市华兴冶化实业有限责任公司,http:////www.11467.com/hengyang/co/28556.htm
