东莞市锦石服饰有限公司,http:////www.11467.com/dongguan/co/194112.htm
玉林市福绵管理区唐悦服装厂,http:////www.11467.com/yulin/co/22662.htm
玉林市福绵管理区唐悦服装厂的商铺,http://yulin022662.11467.com
山东尚雅劳保用品有限公司,http:////www.11467.com/qiye/93169210.htm
山东尚雅劳保用品有限公司的商铺,http://93169210.b2b.11467.com
深圳市联合服装有限公司,http:////www.11467.com/shenzhen/co/765087.htm
深圳市联合服装有限公司的商铺,http://shenzhen0765087.11467.com
北京千百度服装有限公司,http:////www.11467.com/beijing/co/40791.htm
北京千百度服装有限公司的商铺,http://beijing040791.11467.com
日照市东港区锦绣工艺品厂,http:////www.11467.com/rizhao/co/13776.htm
日照市东港区锦绣工艺品厂的商铺,http://rizhao013776.11467.com
苏州铭辉塑胶机械有限公司,http:////www.11467.com/suzhou/co/238934.htm
苏州铭辉塑胶机械有限公司的商铺,http://suzhou0238934.11467.com
孙晓娟(个体经营),http:////www.11467.com/wulanchabu/co/5480.htm
孙晓娟(个体经营)的商铺,http://wulanchabu05480.11467.com
际华三五一二皮革服装有限公司,http:////www.11467.com/lanzhou/co/65698.htm
际华三五一二皮革服装有限公司的商铺,http://lanzhou065698.11467.com
南通兴产服饰有限公司,http:////www.11467.com/nantong/co/7255.htm
南通兴产服饰有限公司的商铺,http://nantong07255.11467.com
齐齐哈尔市龙沙区猫塔塔手绘鞋店,http:////www.11467.com/qiqihaer/co/58041.htm
齐齐哈尔市龙沙区猫塔塔手绘鞋店的商铺,http://qiqihaer058041.11467.com
晋江市亿翔服饰制造有限公司,http:////www.11467.com/quanzhou/co/98184.htm
晋江市亿翔服饰制造有限公司的商铺,http://quanzhou098184.11467.com
安徽意迈电子商务有限公司,http:////www.11467.com/chizhou/co/8287.htm
安徽意迈电子商务有限公司的商铺,http://chizhou08287.11467.com
重庆市莱雅服饰有限公司,http:////www.11467.com/chongqing/co/175624.htm
重庆市莱雅服饰有限公司的商铺,http://chongqing0175624.11467.com
仙桃市琪福防护用品有限公司,http:////www.11467.com/xiantao/co/14185.htm
仙桃市琪福防护用品有限公司的商铺,http://xiantao014185.11467.com
湖南莎丽袜业股份有限公司,http:////www.11467.com/yiyang/co/17847.htm
湖南莎丽袜业股份有限公司的商铺,http://yiyang017847.11467.com
郑州杏苑服装有限公司,http:////www.11467.com/zhengzhou/co/5636.htm
郑州杏苑服装有限公司的商铺,http://zhengzhou05636.11467.com
珠海市亿翔贸易有限公司,http:////www.11467.com/zhuhai/co/69792.htm
珠海市亿翔贸易有限公司的商铺,http://zhuhai069792.11467.com
浙江三十秋服饰有限公司,http:////www.11467.com/jiaxing/co/82349.htm
浙江三十秋服饰有限公司的商铺,http://jiaxing082349.11467.com
沈阳华尔泰洗涤设备有限公司,http:////www.11467.com/shenyang/co/70491.htm
沈阳华尔泰洗涤设备有限公司的商铺,http://shenyang070491.11467.com
李智,http:////www.11467.com/guangzhou/co/495638.htm
李智的商铺,http://guangzhou0495638.11467.com
海丰县城东腾躍服饰批发部,http:////www.11467.com/shanwei/co/34154.htm
海丰县城东腾躍服饰批发部的商铺,http://shanwei034154.11467.com
田岛刺绣机械（中国）有限公司,http:////www.11467.com/huizhou/co/82087.htm
田岛刺绣机械（中国）有限公司的商铺,http://huizhou082087.11467.com
保定市雷运商贸有限公司,http:////www.11467.com/baoding/co/78994.htm
保定市雷运商贸有限公司的商铺,http://baoding078994.11467.com
广州白云龙归文德五金厂,http:////www.11467.com/guangzhou/co/161108.htm
广州白云龙归文德五金厂的商铺,http://guangzhou0161108.11467.com
福州涟影贸易有限公司,http:////www.11467.com/fuzhou/co/139172.htm
福州涟影贸易有限公司的商铺,http://fuzhou0139172.11467.com
诸暨金生康纺织科技有限公司,http:////www.11467.com/shaoxing/co/118476.htm
诸暨金生康纺织科技有限公司的商铺,http://shaoxing0118476.11467.com
台州市路桥鑫来针织厂,http:////www.11467.com/taizhou/co/83932.htm
台州市路桥鑫来针织厂的商铺,http://taizhou083932.11467.com
常熟好梦莱家纺有限公司,http:////www.11467.com/suzhou/co/357021.htm
常熟好梦莱家纺有限公司的商铺,http://suzhou0357021.11467.com
义乌市恬韵服饰有限公司,http:////www.11467.com/lianyungang/co/44699.htm
义乌市恬韵服饰有限公司的商铺,http://lianyungang044699.11467.com
东莞市企石永合服装辅料厂,http:////www.11467.com/dongguan/co/556816.htm
东莞市企石永合服装辅料厂的商铺,http://dongguan0556816.11467.com
广州市宏名纺织品有限公司,http:////www.11467.com/guangzhou/co/195439.htm
广州市宏名纺织品有限公司的商铺,http://guangzhou0195439.11467.com
清河县永强服装店,http:////www.11467.com/xintai/co/57394.htm
清河县永强服装店的商铺,http://xintai057394.11467.com
上海飞鹰实业有限公司,http:////www.11467.com/shanghai/co/84013.htm
上海飞鹰实业有限公司的商铺,http://shanghai084013.11467.com
保定白沟新城美派商贸有限公司,http:////www.11467.com/baoding/co/82248.htm
保定白沟新城美派商贸有限公司的商铺,http://baoding082248.11467.com
河南天曼服饰有限公司,http:////www.11467.com/nanyang/co/38293.htm
河南天曼服饰有限公司的商铺,http://nanyang038293.11467.com
湖州织里云尚儿童装厂,http:////www.11467.com/huzhou/co/56218.htm
湖州织里云尚儿童装厂的商铺,http://huzhou056218.11467.com
仙桃市鼎成无纺布制品有限公司,http:////www.11467.com/xiantao/co/14042.htm
仙桃市鼎成无纺布制品有限公司的商铺,http://xiantao014042.11467.com
长沙市雨花区海亨制帽厂,http:////www.11467.com/changsha/co/118769.htm
长沙市雨花区海亨制帽厂的商铺,http://changsha0118769.11467.com
保定白沟新城尼彩箱包商行,http:////www.11467.com/baoding/co/91337.htm
保定白沟新城尼彩箱包商行的商铺,http://baoding091337.11467.com
王丹丹,http:////www.11467.com/guangzhou/co/432235.htm
王丹丹的商铺,http://guangzhou0432235.11467.com
大连神华荣时装有限公司,http:////www.11467.com/dalian/co/13058.htm
大连神华荣时装有限公司的商铺,http://dalian013058.11467.com
东莞市石碣恒利电脑绣花厂,http:////www.11467.com/dongguan/co/184178.htm
东莞市石碣恒利电脑绣花厂的商铺,http://dongguan0184178.11467.com
武汉睿思琪服饰有限公司,http:////www.11467.com/wuhan/co/210246.htm
武汉睿思琪服饰有限公司的商铺,http://wuhan0210246.11467.com
济南华海制衣有限公司,http:////www.11467.com/jinan/co/90603.htm
上海文霞服饰有限公司,http:////www.11467.com/shanghai/co/305931.htm
广州市雅蓝制服有限公司,http:////www.11467.com/guangzhou/co/430941.htm
郑州豫绣绣花厂,http:////www.11467.com/zhengzhou/co/148626.htm
东莞市富怡电脑机械有限公司,http:////www.11467.com/dongguan/co/93484.htm
辅导费非官方非官方更广泛,http:////www.11467.com/zibo/co/93202.htm
辅导费非官方非官方更广泛的商铺,http://zibo093202.11467.com
东莞市合力激光设备有限公司,http:////www.11467.com/dongguan/co/138636.htm
东莞市合力激光设备有限公司的商铺,http://dongguan0138636.11467.com
江门市蓬江区凤彩工艺厂,http:////www.11467.com/jiangmen/co/3597.htm
江门市蓬江区凤彩工艺厂的商铺,http://jiangmen03597.11467.com
东莞市长安富顺饰品加工店,http:////www.11467.com/dongguan/co/164520.htm
东莞市长安富顺饰品加工店的商铺,http://dongguan0164520.11467.com
东莞市虎门希贝儿服饰商行,http:////www.11467.com/dongguan/co/174289.htm
东莞市虎门希贝儿服饰商行的商铺,http://dongguan0174289.11467.com
徐世继 （个体经营）,http:////www.11467.com/changchun/co/71454.htm
徐世继 （个体经营）的商铺,http://changchun071454.11467.com
潮州市湘桥区雅尔琪工艺厂,http:////www.11467.com/chaozhou/co/27624.htm
潮州市湘桥区雅尔琪工艺厂的商铺,http://chaozhou027624.11467.com
潮州市瑞格工艺绣品有限公司,http:////www.11467.com/chaozhou/co/18493.htm
潮州市瑞格工艺绣品有限公司的商铺,http://chaozhou018493.11467.com
潮州市对外加工装配服务公司,http:////www.11467.com/chaozhou/co/19124.htm
潮州市对外加工装配服务公司的商铺,http://chaozhou019124.11467.com
北雅服饰配件厂,http:////www.11467.com/chaozhou/co/27656.htm
北雅服饰配件厂的商铺,http://chaozhou027656.11467.com
長兆企業有限公司LONG TRILLION ENT,http:////www.11467.com/dongguan/co/146250.htm
長兆企業有限公司LONG TRILLION ENT的商铺,http://dongguan0146250.11467.com
红色古都绿色实业发展公司,http:////www.11467.com/foshan/co/209198.htm
红色古都绿色实业发展公司的商铺,http://foshan0209198.11467.com
生辉衣架厂,http:////www.11467.com/foshan/co/208976.htm
生辉衣架厂的商铺,http://foshan0208976.11467.com
淮安市楚州区淮城镇仁和毛巾厂,http:////www.11467.com/huaian/co/35288.htm
淮安市楚州区淮城镇仁和毛巾厂的商铺,http://huaian035288.11467.com
内蒙古古歌手绘羊绒围巾厂,http:////www.11467.com/huhehaote/co/23795.htm
内蒙古古歌手绘羊绒围巾厂的商铺,http://huhehaote023795.11467.com
上海厚升贸易有限公司,http:////www.11467.com/huhehaote/co/24874.htm
上海厚升贸易有限公司的商铺,http://huhehaote024874.11467.com
惠州新丰艺品有限公司,http:////www.11467.com/huizhou/co/62310.htm
惠州新丰艺品有限公司的商铺,http://huizhou062310.11467.com
亿彩服装辅料厂,http:////www.11467.com/huzhou/co/48889.htm
亿彩服装辅料厂的商铺,http://huzhou048889.11467.com
桐乡市科创针织服饰有限公司,http:////www.11467.com/jiaxing/co/82338.htm
桐乡市科创针织服饰有限公司的商铺,http://jiaxing082338.11467.com
嘉兴亿航贸易有限公司,http:////www.11467.com/jiaxing/co/81478.htm
嘉兴亿航贸易有限公司的商铺,http://jiaxing081478.11467.com
佛山市美尊服饰有限公司,http:////www.11467.com/foshan/co/209136.htm
佛山市美尊服饰有限公司的商铺,http://foshan0209136.11467.com
佛山市南海祥瀚五金制品厂,http:////www.11467.com/foshan/co/208969.htm
佛山市南海祥瀚五金制品厂的商铺,http://foshan0208969.11467.com
陆丽红（个体经营）,http:////www.11467.com/jiaxing/co/82389.htm
陆丽红（个体经营）的商铺,http://jiaxing082389.11467.com
杭州轩缘服饰有限公司,http:////www.11467.com/hangzhou/co/370084.htm
杭州轩缘服饰有限公司的商铺,http://hangzhou0370084.11467.com
东莞市百兆塑胶制品有限公司,http:////www.11467.com/dongguan/co/143700.htm
东莞市百兆塑胶制品有限公司的商铺,http://dongguan0143700.11467.com
东莞市雅易运动用品有限公司,http:////www.11467.com/dongguan/co/488731.htm
东莞市雅易运动用品有限公司的商铺,http://dongguan0488731.11467.com
广州凡丽合衣贸易有限公司,http:////www.11467.com/guangzhou/co/429206.htm
广州凡丽合衣贸易有限公司的商铺,http://guangzhou0429206.11467.com
广州市天河红雨舞蹈用品贸易有限公司,http:////www.11467.com/guangzhou/co/468085.htm
广州市天河红雨舞蹈用品贸易有限公司的商铺,http://guangzhou0468085.11467.com
尹艳曦（个体经营）,http:////www.11467.com/guilin/co/42684.htm
尹艳曦（个体经营）的商铺,http://guilin042684.11467.com
东莞市长安鑫美工艺制品厂,http:////www.11467.com/dongguan/co/556585.htm
东莞市长安鑫美工艺制品厂的商铺,http://dongguan0556585.11467.com
苍南县夫车马帽饰厂,http:////www.11467.com/baoding/co/91427.htm
苍南县夫车马帽饰厂的商铺,http://baoding091427.11467.com
东莞市微星净化科技有限公司,http:////www.11467.com/dongguan/co/504475.htm
东莞市微星净化科技有限公司的商铺,http://dongguan0504475.11467.com
佛山市南海区桂城新潮艺绣品厂,http:////www.11467.com/foshan/co/356008.htm
佛山市南海区桂城新潮艺绣品厂的商铺,http://foshan0356008.11467.com
广州市白云区联兴烫画厂,http:////www.11467.com/guangzhou/co/479559.htm
广州市白云区联兴烫画厂的商铺,http://guangzhou0479559.11467.com
广州市花都区新华润欣帽类加工厂,http:////www.11467.com/guangzhou/co/488886.htm
广州市花都区新华润欣帽类加工厂的商铺,http://guangzhou0488886.11467.com
广州市海珠区众帮压花厂,http:////www.11467.com/guangzhou/co/195700.htm
广州市海珠区众帮压花厂的商铺,http://guangzhou0195700.11467.com
广州名帛服饰有限公司,http:////www.11467.com/guangzhou/co/495701.htm
广州名帛服饰有限公司的商铺,http://guangzhou0495701.11467.com
广州市咪咪皮具有限公司,http:////www.11467.com/guangzhou/co/462861.htm
广州市咪咪皮具有限公司的商铺,http://guangzhou0462861.11467.com
广州市海珠区琶际服饰加工厂,http:////www.11467.com/guangzhou/co/488545.htm
广州市海珠区琶际服饰加工厂的商铺,http://guangzhou0488545.11467.com
广州市骆宾王皮具有限公司,http:////www.11467.com/guangzhou/co/195277.htm
广州市骆宾王皮具有限公司的商铺,http://guangzhou0195277.11467.com
广州酷康服装辅料有限公司,http:////www.11467.com/guangzhou/co/465641.htm
广州酷康服装辅料有限公司的商铺,http://guangzhou0465641.11467.com
顺德区均安镇淼然服装工艺加工厂,http:////www.11467.com/foshan/co/355605.htm
顺德区均安镇淼然服装工艺加工厂的商铺,http://foshan0355605.11467.com
深圳普信亮舟网络科技有限公司,http:////www.11467.com/guangzhou/co/494722.htm
深圳普信亮舟网络科技有限公司的商铺,http://guangzhou0494722.11467.com
芜湖县六郎镇以琳皮具厂,http:////www.11467.com/guangzhou/co/488812.htm
芜湖县六郎镇以琳皮具厂的商铺,http://guangzhou0488812.11467.com
东莞市长安勤宽五金饰品厂,http:////www.11467.com/dongguan/co/488500.htm
东莞市长安勤宽五金饰品厂的商铺,http://dongguan0488500.11467.com
东莞市虎门程强针织花边店,http:////www.11467.com/dongguan/co/174571.htm
东莞市虎门程强针织花边店的商铺,http://dongguan0174571.11467.com
东莞市荣泰制帽厂,http:////www.11467.com/dongguan/co/412915.htm
东莞市荣泰制帽厂的商铺,http://dongguan0412915.11467.com
东莞市茶山龙辉服装辅料加工店,http:////www.11467.com/dongguan/co/274731.htm
东莞市茶山龙辉服装辅料加工店的商铺,http://dongguan0274731.11467.com
桐庐县横村镇意冉针织厂,http:////www.11467.com/hangzhou/co/232721.htm
桐庐县横村镇意冉针织厂的商铺,http://hangzhou0232721.11467.com
平湖市极地户外服饰有限公司,http:////www.11467.com/jiaxing/co/115932.htm
平湖市极地户外服饰有限公司的商铺,http://jiaxing0115932.11467.com
桐乡市天元皮草有限公司,http:////www.11467.com/jiaxing/co/122772.htm
桐乡市天元皮草有限公司的商铺,http://jiaxing0122772.11467.com
义乌市桂冠箱包有限公司,http:////www.11467.com/jinhua/co/144227.htm
义乌市桂冠箱包有限公司的商铺,http://jinhua0144227.11467.com
烟台鲁东水产有限公司,http:////www.11467.com/yantai/co/121921.htm
烟台鲁东水产有限公司的商铺,http://yantai0121921.11467.com
郑晓壮（个体经营）,http:////www.11467.com/zhenjiang/co/47461.htm
郑晓壮（个体经营）的商铺,http://zhenjiang047461.11467.com
内蒙古中禾绒毛纺织有限公司,http:////www.11467.com/beijing/co/308247.htm
内蒙古中禾绒毛纺织有限公司的商铺,http://beijing0308247.11467.com
衡阳市遨宇运动用品有限公司,http:////www.11467.com/hengyang/co/25523.htm
衡阳市遨宇运动用品有限公司的商铺,http://hengyang025523.11467.com
王培香(个体经营),http:////www.11467.com/yangzhou/co/79104.htm
王培香(个体经营)的商铺,http://yangzhou079104.11467.com
扬州爱凤凰工艺礼品有限公司,http:////www.11467.com/yangzhou/co/79805.htm
扬州爱凤凰工艺礼品有限公司的商铺,http://yangzhou079805.11467.com
扬州一诺玩具礼品有限公司,http:////www.11467.com/yangzhou/co/80538.htm
扬州一诺玩具礼品有限公司的商铺,http://yangzhou080538.11467.com
合肥市青帝鞋业有限公司,http:////www.11467.com/hefei/co/86203.htm
合肥市青帝鞋业有限公司的商铺,http://hefei086203.11467.com
上海贸世实业有限公司,http:////www.11467.com/shanghai/co/246549.htm
上海贸世实业有限公司的商铺,http://shanghai0246549.11467.com
莱州新艺服装辅料有限公司上海分公司,http:////www.11467.com/shanghai/co/936182.htm
莱州新艺服装辅料有限公司上海分公司的商铺,http://shanghai0936182.11467.com
上海望东服装辅料有限公司,http:////www.11467.com/shanghai/co/246571.htm
上海望东服装辅料有限公司的商铺,http://shanghai0246571.11467.com
上海骏松服装有限公司,http:////www.11467.com/shanghai/co/36437.htm
上海骏松服装有限公司的商铺,http://shanghai036437.11467.com
天津鲲鹏翔宇服饰科技有限公司,http:////www.11467.com/tianjin/co/61186.htm
天津鲲鹏翔宇服饰科技有限公司的商铺,http://tianjin061186.11467.com
重庆市沙坪坝区逸海制衣厂,http:////www.11467.com/chongqing/co/124688.htm
重庆市沙坪坝区逸海制衣厂的商铺,http://chongqing0124688.11467.com
上海亚宇帽业服饰有限公司,http:////www.11467.com/shanghai/co/83841.htm
上海亚宇帽业服饰有限公司的商铺,http://shanghai083841.11467.com
义乌市侃圣电子商务商行,http:////www.11467.com/jinhua/co/160633.htm
义乌市侃圣电子商务商行的商铺,http://jinhua0160633.11467.com
中山市天韵服饰有限公司,http:////www.11467.com/zhongshan/co/169702.htm
中山市天韵服饰有限公司的商铺,http://zhongshan0169702.11467.com
深圳市龙岗区瑞创服饰辅料行,http:////www.11467.com/shenzhen/co/1101993.htm
深圳市龙岗区瑞创服饰辅料行的商铺,http://shenzhen01101993.11467.com
杭州天骄户外用品有限公司,http:////www.11467.com/hangzhou/co/391193.htm
杭州天骄户外用品有限公司的商铺,http://hangzhou0391193.11467.com
苍南县蔓丽珊服装加工厂,http:////www.11467.com/hangzhou/co/390919.htm
苍南县蔓丽珊服装加工厂的商铺,http://hangzhou0390919.11467.com
上海奥纬娜服饰有限公司,http:////www.11467.com/shanghai/co/833032.htm
上海奥纬娜服饰有限公司的商铺,http://shanghai0833032.11467.com
杭州百升贸易有限公司,http:////www.11467.com/hangzhou/co/370106.htm
杭州百升贸易有限公司的商铺,http://hangzhou0370106.11467.com
上海航兴电脑绣品有限公司,http:////www.11467.com/shanghai/co/37132.htm
上海航兴电脑绣品有限公司的商铺,http://shanghai037132.11467.com
上海芊睿贸易有限公司,http:////www.11467.com/shanghai/co/735795.htm
上海芊睿贸易有限公司的商铺,http://shanghai0735795.11467.com
富阳市思雅服装材料有限公司,http:////www.11467.com/hangzhou/co/391213.htm
富阳市思雅服装材料有限公司的商铺,http://hangzhou0391213.11467.com
上海溪想商贸有限公司,http:////www.11467.com/hangzhou/co/391257.htm
上海溪想商贸有限公司的商铺,http://hangzhou0391257.11467.com
中山市利华时服装材料贸易有限公司,http:////www.11467.com/foshan/co/156281.htm
中山市利华时服装材料贸易有限公司的商铺,http://foshan0156281.11467.com
广州市白云区联欢皮具制品厂,http:////www.11467.com/guangzhou/co/455372.htm
广州市白云区联欢皮具制品厂的商铺,http://guangzhou0455372.11467.com
广州市海珠区浩霆服装厂,http:////www.11467.com/guangzhou/co/489263.htm
广州市海珠区浩霆服装厂的商铺,http://guangzhou0489263.11467.com
广州多亿体育用品有限公司,http:////www.11467.com/guangzhou/co/496296.htm
广州多亿体育用品有限公司的商铺,http://guangzhou0496296.11467.com
广州市铂均商贸有限公司,http:////www.11467.com/guangzhou/co/495938.htm
广州市铂均商贸有限公司的商铺,http://guangzhou0495938.11467.com
广州市花都区狮岭威廉皮具厂,http:////www.11467.com/guangzhou/co/496428.htm
广州市花都区狮岭威廉皮具厂的商铺,http://guangzhou0496428.11467.com
东莞市虎门火啦服饰店,http:////www.11467.com/dongguan/co/533140.htm
东莞市虎门火啦服饰店的商铺,http://dongguan0533140.11467.com
大城县军敏皮革有限公司,http:////www.11467.com/hengshui/co/42748.htm
大城县军敏皮革有限公司的商铺,http://hengshui042748.11467.com
界首市海福皮具店,http:////www.11467.com/guangzhou/co/496420.htm
界首市海福皮具店的商铺,http://guangzhou0496420.11467.com
青岛鑫泰来商贸有限公司,http:////www.11467.com/zhongshan/co/117838.htm
青岛鑫泰来商贸有限公司的商铺,http://zhongshan0117838.11467.com
东莞市英之杰服饰有限公司,http:////www.11467.com/dongguan/co/46036.htm
东莞市英之杰服饰有限公司的商铺,http://dongguan046036.11467.com
涿州市卡丹西奴皮具销售中心,http:////www.11467.com/baoding/co/91685.htm
涿州市卡丹西奴皮具销售中心的商铺,http://baoding091685.11467.com
广州安缇仕箱包有限公司,http:////www.11467.com/guangzhou/co/455379.htm
广州安缇仕箱包有限公司的商铺,http://guangzhou0455379.11467.com
广州宇森服饰有限公司,http:////www.11467.com/guangzhou/co/495926.htm
广州宇森服饰有限公司的商铺,http://guangzhou0495926.11467.com
深圳市风靡全球服装有限公司,http:////www.11467.com/guangzhou/co/495473.htm
深圳市风靡全球服装有限公司的商铺,http://guangzhou0495473.11467.com
广州守秀服饰有限公司,http:////www.11467.com/guangzhou/co/489165.htm
广州守秀服饰有限公司的商铺,http://guangzhou0489165.11467.com
广州舞韵贸易有限公司,http:////www.11467.com/guangzhou/co/465774.htm
广州舞韵贸易有限公司的商铺,http://guangzhou0465774.11467.com
黄锦昭（个体经营）,http:////www.11467.com/guangzhou/co/495457.htm
黄锦昭（个体经营）的商铺,http://guangzhou0495457.11467.com
黄钦杰(个体经营),http:////www.11467.com/guangzhou/co/495463.htm
黄钦杰(个体经营)的商铺,http://guangzhou0495463.11467.com
上海新洪洋国际贸易有限公司,http:////www.11467.com/shanghai/co/512712.htm
上海新洪洋国际贸易有限公司的商铺,http://shanghai0512712.11467.com
广州市花都区狮岭鹏辉皮具厂,http:////www.11467.com/guangzhou/co/511607.htm
广州市花都区狮岭鹏辉皮具厂的商铺,http://guangzhou0511607.11467.com
东莞市塘厦裕铨鞋帽手袋加工厂,http:////www.11467.com/dongguan/co/615479.htm
东莞市塘厦裕铨鞋帽手袋加工厂的商铺,http://dongguan0615479.11467.com
兴华印花厂,http:////www.11467.com/qiye/41670.htm
惠州市惠城区金泰五金厂,http:////www.11467.com/huizhou/co/69249.htm
惠州市惠城区金泰五金厂的商铺,http://huizhou069249.11467.com
广州莉亚服饰有限公司,http:////www.11467.com/qiye/93220291.htm
广州莉亚服饰有限公司的商铺,http://93220291.b2b.11467.com
深圳市顺创服装印花工艺有限公司,http:////www.11467.com/qiye/93080794.htm
深圳市顺创服装印花工艺有限公司的商铺,http://93080794.b2b.11467.com
诸暨市富士达帽业服饰有限公司,http:////www.11467.com/shaoxing/co/26132.htm
诸暨市富士达帽业服饰有限公司的商铺,http://shaoxing026132.11467.com
保定白沟新城语莱箱包销售处,http:////www.11467.com/baoding/co/91492.htm
保定白沟新城语莱箱包销售处的商铺,http://baoding091492.11467.com
深圳恒实琥珀珠宝有限公司,http:////www.11467.com/shenzhen/co/809213.htm
深圳恒实琥珀珠宝有限公司的商铺,http://shenzhen0809213.11467.com
深圳市禾生洋行工艺品材料商行,http:////www.11467.com/shenzhen/co/539377.htm
深圳市禾生洋行工艺品材料商行的商铺,http://shenzhen0539377.11467.com
鹤山市沙坪胜利激光加工店,http:////www.11467.com/jiangmen/co/140149.htm
鹤山市沙坪胜利激光加工店的商铺,http://jiangmen0140149.11467.com
诸暨市淘宠宠物用品网店,http:////www.11467.com/shaoxing/co/127244.htm
诸暨市淘宠宠物用品网店的商铺,http://shaoxing0127244.11467.com
北京捷特工贸有限公司,http:////www.11467.com/beijing/co/221368.htm
北京捷特工贸有限公司的商铺,http://beijing0221368.11467.com
泗县万昌工艺箱包厂,http:////www.11467.com/suzhoushi/co/25700.htm
泗县万昌工艺箱包厂的商铺,http://suzhoushi025700.11467.com
西安市新城区钟神秀手工编织经销部,http:////www.11467.com/xian/co/128007.htm
西安市新城区钟神秀手工编织经销部的商铺,http://xian0128007.11467.com
扬州龙欣服饰制品有限公司,http:////www.11467.com/yangzhou/co/90025.htm
太康县兰秀商贸有限公司,http:////www.11467.com/zhoukou/co/18096.htm
深圳市卓妮服饰有限公司,http:////www.11467.com/shenzhen/co/254141.htm
辛集市梦娜皮草经销处,http:////www.11467.com/shijiazhuang/co/108453.htm
兴城市凯瑞达制衣有限公司,http:////www.11467.com/huludao/co/44406.htm
名锐运动时尚用品有限公司,http:////www.11467.com/laibin/co/4131.htm
北京利融科技有限公司,http:////www.11467.com/liaoyuan/co/8312.htm
泸州市江阳区飞天韵舞美服饰工作室,http:////www.11467.com/luzhou/co/16995.htm
品格國際貿易有限公司PINGER INTERNAT,http:////www.11467.com/putian/co/27603.htm
