广州起秀化妆品有限公司,http:////www.11467.com/guangzhou/co/347773.htm
天津同仁科技股份有限公司,http:////www.11467.com/tianjin/co/161688.htm
深圳冠联达网络科技有限公司,http:////www.11467.com/shenzhen/co/852195.htm
香港圣润精细日化有限公司,http:////www.11467.com/zhumadian/co/34090.htm
广州美佳日化用品有限公司,http:////www.11467.com/guangzhou/co/699175.htm
广州美佳日化用品有限公司的商铺,http://guangzhou0699175.11467.com
广州立众洗涤原料有限公司,http:////www.11467.com/guangzhou/co/141986.htm
广州立众洗涤原料有限公司的商铺,http://guangzhou0141986.11467.com
广东中鹏化工有限公司,http:////www.11467.com/guangzhou/co/9819.htm
广东中鹏化工有限公司的商铺,http://guangzhou09819.11467.com
广州杨森生物科技有限公司,http:////www.11467.com/guangzhou/co/431970.htm
广州杨森生物科技有限公司的商铺,http://guangzhou0431970.11467.com
襄樊东方鑫鑫化工有限公司,http:////www.11467.com/xiangfan/co/40938.htm
襄樊东方鑫鑫化工有限公司的商铺,http://xiangfan040938.11467.com
新乡市卫滨区发成美容美发用品经营部,http:////www.11467.com/xinxiang/co/20276.htm
新乡市卫滨区发成美容美发用品经营部的商铺,http://xinxiang020276.11467.com
张掖市甘州区嘉人联合日化商贸部,http:////www.11467.com/zhangye/co/9026.htm
张掖市甘州区嘉人联合日化商贸部的商铺,http://zhangye09026.11467.com
王正艳（个体经营）,http:////www.11467.com/shihezi/co/5444.htm
王正艳（个体经营）的商铺,http://shihezi05444.11467.com
大武口区惠林发屋,http:////www.11467.com/shizuishan/co/9521.htm
大武口区惠林发屋的商铺,http://shizuishan09521.11467.com
广州首邦化妆品有限公司,http:////www.11467.com/guangzhou/co/148444.htm
广州首邦化妆品有限公司的商铺,http://guangzhou0148444.11467.com
杭州绢第纺织品有限公司,http:////www.11467.com/hangzhou/co/224593.htm
杭州绢第纺织品有限公司的商铺,http://hangzhou0224593.11467.com
惠州市恒威包装制品有限公司,http:////www.11467.com/huizhou/co/73790.htm
惠州市恒威包装制品有限公司的商铺,http://huizhou073790.11467.com
纪露露（个体经营）,http:////www.11467.com/chuzhou/co/20704.htm
纪露露（个体经营）的商铺,http://chuzhou020704.11467.com
广州市金达柏化妆品有限公司,http:////www.11467.com/guangzhou/co/142369.htm
广州市金达柏化妆品有限公司的商铺,http://guangzhou0142369.11467.com
广州市靓鑫精细化工有限公司,http:////www.11467.com/guangzhou/co/142123.htm
广州市靓鑫精细化工有限公司的商铺,http://guangzhou0142123.11467.com
奥丽雅日用化妆品（马鞍山）有限公司,http:////www.11467.com/maanshan/co/20404.htm
奥丽雅日用化妆品（马鞍山）有限公司的商铺,http://maanshan020404.11467.com
广州市强哥化妆品有限公司,http:////www.11467.com/guangzhou/co/554028.htm
广州市强哥化妆品有限公司的商铺,http://guangzhou0554028.11467.com
郑州养发斯特生物科技有限公司,http:////www.11467.com/zhengzhou/co/175173.htm
郑州养发斯特生物科技有限公司的商铺,http://zhengzhou0175173.11467.com
深圳市唐风采假发制品有限公司,http:////www.11467.com/shenzhen/co/853565.htm
深圳市唐风采假发制品有限公司的商铺,http://shenzhen0853565.11467.com
深圳市晟华源贸易有限公司,http:////www.11467.com/shenzhen/co/1137724.htm
深圳市晟华源贸易有限公司的商铺,http://shenzhen01137724.11467.com
广州市明澄雅日用化工有限公司,http:////www.11467.com/guangzhou/co/141693.htm
广州市明澄雅日用化工有限公司的商铺,http://guangzhou0141693.11467.com
墨神育发液有限公司,http:////www.11467.com/zhengzhou/co/148968.htm
墨神育发液有限公司的商铺,http://zhengzhou0148968.11467.com
湖南康尔佳医药有限公司,http:////www.11467.com/changsha/co/101767.htm
湖南康尔佳医药有限公司的商铺,http://changsha0101767.11467.com
深圳市美源科技有限公司,http:////www.11467.com/shenzhen/co/778814.htm
深圳市美源科技有限公司的商铺,http://shenzhen0778814.11467.com
邹平山江贸易有限公司,http:////www.11467.com/binzhou/co/55687.htm
邹平山江贸易有限公司的商铺,http://binzhou055687.11467.com
深圳市强民丰商贸有限公司,http:////www.11467.com/shenzhen/co/969208.htm
深圳市强民丰商贸有限公司的商铺,http://shenzhen0969208.11467.com
广州花之王化工有限公司,http:////www.11467.com/qiye/9126.htm
广州花之王化工有限公司的商铺,http://9126.b2b.11467.com
广州市芊彩化妆品有限公司,http:////www.11467.com/guangzhou/co/158556.htm
广州市芊彩化妆品有限公司的商铺,http://guangzhou0158556.11467.com
安阳市殷都区德鑫商行,http:////www.11467.com/anyang/co/43507.htm
安阳市殷都区德鑫商行的商铺,http://anyang043507.11467.com
李国强,http:////www.11467.com/dongguan/co/556105.htm
李国强的商铺,http://dongguan0556105.11467.com
李新华,http:////www.11467.com/guangzhou/co/431766.htm
李新华的商铺,http://guangzhou0431766.11467.com
广州威的日用品有限公司,http:////www.11467.com/guangzhou/co/462335.htm
广州威的日用品有限公司的商铺,http://guangzhou0462335.11467.com
陆雪（个体经营）,http:////www.11467.com/linyi/co/106996.htm
陆雪（个体经营）的商铺,http://linyi0106996.11467.com
乔凤云(个体经营),http:////www.11467.com/linyi/co/107029.htm
乔凤云(个体经营)的商铺,http://linyi0107029.11467.com
洛阳经济开发区兴隆日化商行,http:////www.11467.com/luoyang/co/59677.htm
洛阳经济开发区兴隆日化商行的商铺,http://luoyang059677.11467.com
苏州源泰润化工有限公司,http:////www.11467.com/suzhou/co/356509.htm
苏州源泰润化工有限公司的商铺,http://suzhou0356509.11467.com
厦门尹蔻贸易有限公司,http:////www.11467.com/xiamen/co/93011.htm
厦门尹蔻贸易有限公司的商铺,http://xiamen093011.11467.com
上海章华保健化妆品有限公司,http:////www.11467.com/shanghai/co/784175.htm
上海章华保健化妆品有限公司的商铺,http://shanghai0784175.11467.com
广州市良朋日用化工有限公司,http:////www.11467.com/guangzhou/co/91056.htm
广州市良朋日用化工有限公司的商铺,http://guangzhou091056.11467.com
广州兰序生物科技有限公司,http:////www.11467.com/guangzhou/co/753059.htm
广州兰序生物科技有限公司的商铺,http://guangzhou0753059.11467.com
广州博黎森贸易有限公司,http:////www.11467.com/guangzhou/co/745094.htm
广州博黎森贸易有限公司的商铺,http://guangzhou0745094.11467.com
广州可珂珂宠物用品有限公司,http:////www.11467.com/guangzhou/co/683364.htm
广州可珂珂宠物用品有限公司的商铺,http://guangzhou0683364.11467.com
广州市德馨蜡制品有限公司,http:////www.11467.com/guangzhou/co/430716.htm
广州市德馨蜡制品有限公司的商铺,http://guangzhou0430716.11467.com
常州市宏业有机硅有限公司,http:////www.11467.com/changzhou/co/92029.htm
常州市宏业有机硅有限公司的商铺,http://changzhou092029.11467.com
东莞市润孚化妆品有限公司,http:////www.11467.com/dongguan/co/145905.htm
东莞市润孚化妆品有限公司的商铺,http://dongguan0145905.11467.com
广州市东智盟生物科技有限公司,http:////www.11467.com/guangzhou/co/430463.htm
广州市东智盟生物科技有限公司的商铺,http://guangzhou0430463.11467.com
广州斯瑞泰假发制品有限公司,http:////www.11467.com/guangzhou/co/468930.htm
广州斯瑞泰假发制品有限公司的商铺,http://guangzhou0468930.11467.com
广州尚洁洗涤用品有限公司,http:////www.11467.com/guangzhou/co/454746.htm
广州尚洁洗涤用品有限公司的商铺,http://guangzhou0454746.11467.com
广州市柯美化妆品有限公司,http:////www.11467.com/guangzhou/co/142363.htm
广州市柯美化妆品有限公司的商铺,http://guangzhou0142363.11467.com
广州市碧欧化妆品有限公司,http:////www.11467.com/guangzhou/co/144891.htm
广州市碧欧化妆品有限公司的商铺,http://guangzhou0144891.11467.com
广州市白云区圣迪雅化妆品厂,http:////www.11467.com/guangzhou/co/142050.htm
广州市白云区圣迪雅化妆品厂的商铺,http://guangzhou0142050.11467.com
广州花语精细化工有限公司,http:////www.11467.com/guangzhou/co/141874.htm
广州花语精细化工有限公司的商铺,http://guangzhou0141874.11467.com
广州酷必乐商贸有限公司,http:////www.11467.com/guangzhou/co/147719.htm
广州酷必乐商贸有限公司的商铺,http://guangzhou0147719.11467.com
广州阿斯猫贸易化妆品有限公司,http:////www.11467.com/guangzhou/co/145702.htm
广州阿斯猫贸易化妆品有限公司的商铺,http://guangzhou0145702.11467.com
广州市和美丰沐足用品有限公司,http:////www.11467.com/guangzhou/co/141903.htm
广州市和美丰沐足用品有限公司的商铺,http://guangzhou0141903.11467.com
广州宝洁日化批发行,http:////www.11467.com/guangzhou/co/142323.htm
广州宝洁日化批发行的商铺,http://guangzhou0142323.11467.com
严锦兰(个体经营),http:////www.11467.com/chaoyang/co/24950.htm
严锦兰(个体经营)的商铺,http://chaoyang024950.11467.com
广州蓓斯特美发用品公司,http:////www.11467.com/guangzhou/co/141810.htm
广州蓓斯特美发用品公司的商铺,http://guangzhou0141810.11467.com
佛山市南海东田洋实业有限公司,http:////www.11467.com/guangzhou/co/142966.htm
佛山市南海东田洋实业有限公司的商铺,http://guangzhou0142966.11467.com
广州华诚发品有限公司,http:////www.11467.com/guangzhou/co/142394.htm
广州华诚发品有限公司的商铺,http://guangzhou0142394.11467.com
广州颜诺化妆品有限公司,http:////www.11467.com/guangzhou/co/142127.htm
广州颜诺化妆品有限公司的商铺,http://guangzhou0142127.11467.com
广州市汉邦化妆品有限公司,http:////www.11467.com/guangzhou/co/141891.htm
广州市汉邦化妆品有限公司的商铺,http://guangzhou0141891.11467.com
广州市美郎美发美容用品商行,http:////www.11467.com/guangzhou/co/142286.htm
广州市美郎美发美容用品商行的商铺,http://guangzhou0142286.11467.com
广州天天日化用品有限公司,http:////www.11467.com/guangzhou/co/142262.htm
广州天天日化用品有限公司的商铺,http://guangzhou0142262.11467.com
蚌埠市中区宏丽化妆品经营部,http:////www.11467.com/bengbu/co/26568.htm
蚌埠市中区宏丽化妆品经营部的商铺,http://bengbu026568.11467.com
常德市创新化工科技有限公司,http:////www.11467.com/changde/co/30628.htm
常德市创新化工科技有限公司的商铺,http://changde030628.11467.com
信达日化有限公司,http:////www.11467.com/guangzhou/co/142278.htm
信达日化有限公司的商铺,http://guangzhou0142278.11467.com
上海天馨化妆品有限公司,http:////www.11467.com/shanghai/co/833162.htm
上海天馨化妆品有限公司的商铺,http://shanghai0833162.11467.com
佛山市南海区泰卓化工科技有限公司,http:////www.11467.com/foshan/co/329180.htm
佛山市南海区泰卓化工科技有限公司的商铺,http://foshan0329180.11467.com
广州美当家化妆品有限公司,http:////www.11467.com/guangzhou/co/141344.htm
广州美当家化妆品有限公司的商铺,http://guangzhou0141344.11467.com
东莞市长安冠耀日用品店,http:////www.11467.com/dongguan/co/337138.htm
东莞市长安冠耀日用品店的商铺,http://dongguan0337138.11467.com
东莞市虎门智耀贸易有限公司,http:////www.11467.com/dongguan/co/456511.htm
东莞市虎门智耀贸易有限公司的商铺,http://dongguan0456511.11467.com
广州市越秀区绿芳洲纺织品经营部,http:////www.11467.com/guangzhou/co/141602.htm
广州市越秀区绿芳洲纺织品经营部的商铺,http://guangzhou0141602.11467.com
东莞市启裕电子有限公司,http:////www.11467.com/dongguan/co/263162.htm
东莞市启裕电子有限公司的商铺,http://dongguan0263162.11467.com
王春霞,http:////www.11467.com/shenzhen/co/812831.htm
王春霞的商铺,http://shenzhen0812831.11467.com
陕西博业科技发展有限公司,http:////www.11467.com/xian/co/78102.htm
陕西博业科技发展有限公司的商铺,http://xian078102.11467.com
广州天斯秀尔化妆品有限公司,http:////www.11467.com/guangzhou/co/467801.htm
广州天斯秀尔化妆品有限公司的商铺,http://guangzhou0467801.11467.com
广州市白云区三元里恋尚化妆品商行,http:////www.11467.com/guangzhou/co/494934.htm
广州市白云区三元里恋尚化妆品商行的商铺,http://guangzhou0494934.11467.com
广州市白云区梦飞诗化妆品厂,http:////www.11467.com/guangzhou/co/48694.htm
广州市白云区梦飞诗化妆品厂的商铺,http://guangzhou048694.11467.com
石首市七六美妆商行,http:////www.11467.com/dongguan/co/556100.htm
石首市七六美妆商行的商铺,http://dongguan0556100.11467.com
东莞市中豪优美实业有限公司,http:////www.11467.com/dongguan/co/471375.htm
东莞市中豪优美实业有限公司的商铺,http://dongguan0471375.11467.com
佛山市南海区狮山科誉新材料有限公司,http:////www.11467.com/foshan/co/202013.htm
佛山市南海区狮山科誉新材料有限公司的商铺,http://foshan0202013.11467.com
广州市恒雅化妆品有限公司,http:////www.11467.com/guangzhou/co/132891.htm
广州市恒雅化妆品有限公司的商铺,http://guangzhou0132891.11467.com
广州柯友化工产品有限公司,http:////www.11467.com/guangzhou/co/458086.htm
广州柯友化工产品有限公司的商铺,http://guangzhou0458086.11467.com
广州市一龙日用化学品有限公司,http:////www.11467.com/guangzhou/co/132889.htm
广州市一龙日用化学品有限公司的商铺,http://guangzhou0132889.11467.com
广州市白云区自然日用化妆品厂,http:////www.11467.com/guangzhou/co/132897.htm
广州市白云区自然日用化妆品厂的商铺,http://guangzhou0132897.11467.com
广州德妆化妆品有限公司,http:////www.11467.com/guangzhou/co/486777.htm
广州德妆化妆品有限公司的商铺,http://guangzhou0486777.11467.com
广州市鸿飞经贸发展有限公司,http:////www.11467.com/guangzhou/co/378437.htm
广州市鸿飞经贸发展有限公司的商铺,http://guangzhou0378437.11467.com
广州市百圣贸易有限公司,http:////www.11467.com/guangzhou/co/226588.htm
广州市百圣贸易有限公司的商铺,http://guangzhou0226588.11467.com
广州蓝黛化妆品有限公司,http:////www.11467.com/guangzhou/co/345755.htm
广州蓝黛化妆品有限公司的商铺,http://guangzhou0345755.11467.com
广州阿凡达生物科技有限公司,http:////www.11467.com/guangzhou/co/460764.htm
广州阿凡达生物科技有限公司的商铺,http://guangzhou0460764.11467.com
西安红妆商贸有限责任公司,http:////www.11467.com/xian/co/52314.htm
西安红妆商贸有限责任公司的商铺,http://xian052314.11467.com
周建,http:////www.11467.com/guangzhou/co/431964.htm
周建的商铺,http://guangzhou0431964.11467.com
贵州祈颜化妆品公司,http:////www.11467.com/guiyang/co/69273.htm
广州市汉娜发制品有限公司,http:////www.11467.com/guangzhou/co/466620.htm
深圳美格天化生物科技有限公司,http:////www.11467.com/shenzhen/co/729370.htm
韓國大巨(國際)集團有限公司KOREA DAJU,http:////www.11467.com/guangzhou/co/141838.htm
韓國大巨(國際)集團有限公司KOREA DAJU的商铺,http://guangzhou0141838.11467.com
奇芳国际（沈阳）化妆品有限公司,http:////www.11467.com/shenyang/co/53473.htm
奇芳国际（沈阳）化妆品有限公司的商铺,http://shenyang053473.11467.com
山西琪利美业有限公司,http:////www.11467.com/taiyuan/co/92656.htm
山西琪利美业有限公司的商铺,http://taiyuan092656.11467.com
沈阳福尔丝贸易有限公司,http:////www.11467.com/shenyang/co/52646.htm
沈阳福尔丝贸易有限公司的商铺,http://shenyang052646.11467.com
衢州市美姿婷化妆品有限公司,http:////www.11467.com/quzhou/co/20734.htm
衢州市美姿婷化妆品有限公司的商铺,http://quzhou020734.11467.com
绍兴市越城区美专化妆品店,http:////www.11467.com/shaoxing/co/74852.htm
绍兴市越城区美专化妆品店的商铺,http://shaoxing074852.11467.com
深圳市泰丰盛日用品有限公司,http:////www.11467.com/shenzhen/co/150337.htm
深圳市泰丰盛日用品有限公司的商铺,http://shenzhen0150337.11467.com
石家庄格美香精香料有限公司,http:////www.11467.com/shijiazhuang/co/93860.htm
石家庄格美香精香料有限公司的商铺,http://shijiazhuang093860.11467.com
广州市鑫锦化妆品有限公司,http:////www.11467.com/guangzhou/co/142106.htm
广州市鑫锦化妆品有限公司的商铺,http://guangzhou0142106.11467.com
广州映金日化有限公司,http:////www.11467.com/guangzhou/co/142279.htm
广州映金日化有限公司的商铺,http://guangzhou0142279.11467.com
张 浩（个体经营）,http:////www.11467.com/guangzhou/co/142322.htm
张 浩（个体经营）的商铺,http://guangzhou0142322.11467.com
广州市朗怡日用化工有限公司,http:////www.11467.com/guangzhou/co/142227.htm
广州市朗怡日用化工有限公司的商铺,http://guangzhou0142227.11467.com
广州市佳佳利化妆品有限公司,http:////www.11467.com/guangzhou/co/142303.htm
广州市佳佳利化妆品有限公司的商铺,http://guangzhou0142303.11467.com
惠州市王氏商贸有限公司,http:////www.11467.com/huizhou/co/59617.htm
惠州市王氏商贸有限公司的商铺,http://huizhou059617.11467.com
兰州阿依莎海娜粉批发商行,http:////www.11467.com/lanzhou/co/64649.htm
兰州阿依莎海娜粉批发商行的商铺,http://lanzhou064649.11467.com
连云港市谭笑日用化学品厂,http:////www.11467.com/lianyungang/co/26738.htm
连云港市谭笑日用化学品厂的商铺,http://lianyungang026738.11467.com
临沂圣骐日化有限公司,http:////www.11467.com/linyi/co/1995.htm
临沂圣骐日化有限公司的商铺,http://linyi01995.11467.com
安秀日化有限公司,http:////www.11467.com/luoyang/co/44931.htm
安秀日化有限公司的商铺,http://luoyang044931.11467.com
萍乡市融顺商贸有限公司,http:////www.11467.com/pingxiang/co/10948.htm
萍乡市融顺商贸有限公司的商铺,http://pingxiang010948.11467.com
李达鹏（个体经营）,http:////www.11467.com/guangzhou/co/141967.htm
李达鹏（个体经营）的商铺,http://guangzhou0141967.11467.com
新瑞龙日化(福建)有限公司,http:////www.11467.com/quanzhou/co/94414.htm
新瑞龙日化(福建)有限公司的商铺,http://quanzhou094414.11467.com
香港汉丰(国际)化妆品有限公司,http:////www.11467.com/guangzhou/co/142222.htm
香港汉丰(国际)化妆品有限公司的商铺,http://guangzhou0142222.11467.com
广州市白云区广士隆日用化妆品原料商行,http:////www.11467.com/guangzhou/co/141776.htm
广州市白云区广士隆日用化妆品原料商行的商铺,http://guangzhou0141776.11467.com
临沂市宝韵化妆品有限公司,http:////www.11467.com/linyi/co/7219.htm
临沂市宝韵化妆品有限公司的商铺,http://linyi07219.11467.com
新疆白尔纳商贸有限公司,http:////www.11467.com/wulumuqi/co/89278.htm
新疆白尔纳商贸有限公司的商铺,http://wulumuqi089278.11467.com
深圳市惟道贸易有限公司,http:////www.11467.com/shenzhen/co/778875.htm
深圳市惟道贸易有限公司的商铺,http://shenzhen0778875.11467.com
杭州菁美贸易有限公司,http:////www.11467.com/hangzhou/co/310870.htm
杭州菁美贸易有限公司的商铺,http://hangzhou0310870.11467.com
金华市玛雅饰品有限公司,http:////www.11467.com/jinhua/co/84084.htm
金华市玛雅饰品有限公司的商铺,http://jinhua084084.11467.com
深圳港易国际进出口贸易有限公司,http:////www.11467.com/shenzhen/co/811312.htm
深圳港易国际进出口贸易有限公司的商铺,http://shenzhen0811312.11467.com
广州市番禺区张日日用品商行,http:////www.11467.com/guangzhou/co/429171.htm
广州市番禺区张日日用品商行的商铺,http://guangzhou0429171.11467.com
广州市闻风起商贸有限公司,http:////www.11467.com/guangzhou/co/430708.htm
广州市闻风起商贸有限公司的商铺,http://guangzhou0430708.11467.com
广州市源然生物科技有限公司,http:////www.11467.com/guangzhou/co/495697.htm
广州市源然生物科技有限公司的商铺,http://guangzhou0495697.11467.com
杭州发派贸易有限公司,http:////www.11467.com/hangzhou/co/175272.htm
杭州发派贸易有限公司的商铺,http://hangzhou0175272.11467.com
焦秋美(个体经营),http:////www.11467.com/qingdao/co/124268.htm
焦秋美(个体经营)的商铺,http://qingdao0124268.11467.com
刘公帅(个体经营),http:////www.11467.com/linyi/co/106901.htm
刘公帅(个体经营)的商铺,http://linyi0106901.11467.com
南京顿苏商贸有限公司,http:////www.11467.com/nanjing/co/154427.htm
南京顿苏商贸有限公司的商铺,http://nanjing0154427.11467.com
广东世邦美容美发用品公司,http:////www.11467.com/qingyuan/co/21894.htm
广东世邦美容美发用品公司的商铺,http://qingyuan021894.11467.com
济南亮洁洗涤剂有限公司,http:////www.11467.com/jinan/co/69961.htm
济南亮洁洗涤剂有限公司的商铺,http://jinan069961.11467.com
合肥亮彩日化有限公司,http:////www.11467.com/hefei/co/82669.htm
合肥亮彩日化有限公司的商铺,http://hefei082669.11467.com
昆明市官渡区爱丽美化妆品商行,http:////www.11467.com/guangzhou/co/494964.htm
昆明市官渡区爱丽美化妆品商行的商铺,http://guangzhou0494964.11467.com
广州喆喆进出口有限公司,http:////www.11467.com/guangzhou/co/495705.htm
广州喆喆进出口有限公司的商铺,http://guangzhou0495705.11467.com
吴江市永康塑业有限公司,http:////www.11467.com/suzhou/co/269231.htm
吴江市永康塑业有限公司的商铺,http://suzhou0269231.11467.com
乌鲁木齐丝路皇朝商贸有限公司,http:////www.11467.com/wulumuqi/co/103624.htm
乌鲁木齐丝路皇朝商贸有限公司的商铺,http://wulumuqi0103624.11467.com
武汉智鑫医药有限公司,http:////www.11467.com/wuhan/co/60244.htm
武汉智鑫医药有限公司的商铺,http://wuhan060244.11467.com
苏州市奥朗德生物科技有限公司,http:////www.11467.com/suzhou/co/300620.htm
苏州市奥朗德生物科技有限公司的商铺,http://suzhou0300620.11467.com
广州市聚馨堂化妆品有限公司,http:////www.11467.com/guangzhou/co/142347.htm
广州市聚馨堂化妆品有限公司的商铺,http://guangzhou0142347.11467.com
义乌市罗曼丝假发厂,http:////www.11467.com/jinhua/co/122923.htm
义乌市罗曼丝假发厂的商铺,http://jinhua0122923.11467.com
义乌市亚尔娜假发有限公司,http:////www.11467.com/jinhua/co/124322.htm
义乌市亚尔娜假发有限公司的商铺,http://jinhua0124322.11467.com
廊坊市西域百川商贸有限公司,http:////www.11467.com/langfang/co/41150.htm
廊坊市西域百川商贸有限公司的商铺,http://langfang041150.11467.com
余姚市环亚照明科技有限公司,http:////www.11467.com/ningbo/co/196012.htm
余姚市环亚照明科技有限公司的商铺,http://ningbo0196012.11467.com
广州焱盛日化有限公司,http:////www.11467.com/guangzhou/co/696903.htm
广州焱盛日化有限公司的商铺,http://guangzhou0696903.11467.com
广州艾尚日用品有限公司,http:////www.11467.com/guangzhou/co/699526.htm
广州艾尚日用品有限公司的商铺,http://guangzhou0699526.11467.com
广州佳琪日化有限公司,http:////www.11467.com/guangzhou/co/744938.htm
广州佳琪日化有限公司的商铺,http://guangzhou0744938.11467.com
广州莎莎化妆品制造有限公司,http:////www.11467.com/guangzhou/co/553955.htm
广州莎莎化妆品制造有限公司的商铺,http://guangzhou0553955.11467.com
洪成勇（个体经营）,http:////www.11467.com/beijing/co/177427.htm
洪成勇（个体经营）的商铺,http://beijing0177427.11467.com
梧州市雅德日用化工厂,http:////www.11467.com/wuzhou/co/15573.htm
梧州市雅德日用化工厂的商铺,http://wuzhou015573.11467.com
重庆奇洁日用品有限公司,http:////www.11467.com/chongqing/co/159446.htm
重庆奇洁日用品有限公司的商铺,http://chongqing0159446.11467.com
广州亿佳日化用品有限公司,http:////www.11467.com/guangzhou/co/144807.htm
广州亿佳日化用品有限公司的商铺,http://guangzhou0144807.11467.com
遵义市发郎中养发护发有限责任公司,http:////www.11467.com/zunyi/co/21116.htm
遵义市发郎中养发护发有限责任公司的商铺,http://zunyi021116.11467.com
北京华夏伍洋经贸有限公司,http:////www.11467.com/beijing/co/252907.htm
北京华夏伍洋经贸有限公司的商铺,http://beijing0252907.11467.com
张中祥（个体经营）,http:////www.11467.com/beijing/co/304421.htm
张中祥（个体经营）的商铺,http://beijing0304421.11467.com
田振水(个体经营),http:////www.11467.com/beijing/co/24782.htm
田振水(个体经营)的商铺,http://beijing024782.11467.com
上海麦腾实业有限公司,http:////www.11467.com/shanghai/co/468217.htm
上海麦腾实业有限公司的商铺,http://shanghai0468217.11467.com
上海感博酒店用品有限公司,http:////www.11467.com/shanghai/co/933237.htm
上海感博酒店用品有限公司的商铺,http://shanghai0933237.11467.com
上海琨泓国际贸易有限公司,http:////www.11467.com/shanghai/co/733852.htm
