佛山市千万间家居电子商务有限公司,http:////www.11467.com/foshan/co/479174.htm
佛山市千万间家居电子商务有限公司的商铺,http://foshan0479174.11467.com
杭州萧山思迈尔卫浴洁具厂,http:////www.11467.com/hangzhou/co/391266.htm
杭州萧山思迈尔卫浴洁具厂的商铺,http://hangzhou0391266.11467.com
佛山市恒美钢业有限公司,http:////www.11467.com/foshan/co/340235.htm
佛山市恒美钢业有限公司的商铺,http://foshan0340235.11467.com
安徽省宣城市唐标洁具有限公司,http:////www.11467.com/xuancheng/co/21085.htm
安徽省宣城市唐标洁具有限公司的商铺,http://xuancheng021085.11467.com
潮州市枫溪汉健陶瓷厂,http:////www.11467.com/chaozhou/co/9163.htm
潮州市枫溪汉健陶瓷厂的商铺,http://chaozhou09163.11467.com
安徽省安庆市瑞景洁具有限公司,http:////www.11467.com/anqing/co/24514.htm
安徽省安庆市瑞景洁具有限公司的商铺,http://anqing024514.11467.com
佛山市顺德区雅加斯厨柜有限公司,http:////www.11467.com/foshan/co/355852.htm
佛山市顺德区雅加斯厨柜有限公司的商铺,http://foshan0355852.11467.com
佛山市顺德区维蒂尼卫浴有限公司,http:////www.11467.com/foshan/co/412039.htm
佛山市顺德区维蒂尼卫浴有限公司的商铺,http://foshan0412039.11467.com
扬州市安华建材装饰销售部,http:////www.11467.com/yangzhou/co/90239.htm
扬州市安华建材装饰销售部的商铺,http://yangzhou090239.11467.com
佛山兰泊卫浴有限公司,http:////www.11467.com/foshan/co/307167.htm
佛山兰泊卫浴有限公司的商铺,http://foshan0307167.11467.com
佛山市顺德区品酷浴室家具有限公司,http:////www.11467.com/foshan/co/305387.htm
佛山市顺德区品酷浴室家具有限公司的商铺,http://foshan0305387.11467.com
杭州宝尊厨卫科技有限公司,http:////www.11467.com/hangzhou/co/498887.htm
杭州宝尊厨卫科技有限公司的商铺,http://hangzhou0498887.11467.com
长葛浴室柜厂家许昌汇优商贸有限公司,http:////www.11467.com/xuchang/co/38855.htm
长葛浴室柜厂家许昌汇优商贸有限公司的商铺,http://xuchang038855.11467.com
临沂艺全家居制品有限公司,http:////www.11467.com/linyi/co/135024.htm
临沂艺全家居制品有限公司的商铺,http://linyi0135024.11467.com
佛山市兰泊卫浴有限公司,http:////www.11467.com/foshan/co/306947.htm
佛山市兰泊卫浴有限公司的商铺,http://foshan0306947.11467.com
南安市佐蒙卫浴洁具有限公司,http:////www.11467.com/quanzhou/co/120084.htm
南安市佐蒙卫浴洁具有限公司的商铺,http://quanzhou0120084.11467.com
杭州金竹宝地板有限公司,http:////www.11467.com/hangzhou/co/222306.htm
杭州金竹宝地板有限公司的商铺,http://hangzhou0222306.11467.com
佛山市亮顺厨卫有限公司,http:////www.11467.com/foshan/co/355848.htm
佛山市亮顺厨卫有限公司的商铺,http://foshan0355848.11467.com
佛山市典盈家具有限公司,http:////www.11467.com/foshan/co/356060.htm
佛山市典盈家具有限公司的商铺,http://foshan0356060.11467.com
佛山市海洁卫浴有限公司,http:////www.11467.com/foshan/co/338032.htm
佛山市海洁卫浴有限公司的商铺,http://foshan0338032.11467.com
广东佛山第洛可欧式浴室柜公司,http:////www.11467.com/foshan/co/307309.htm
广东佛山第洛可欧式浴室柜公司的商铺,http://foshan0307309.11467.com
杭州合为卫浴有限公司,http:////www.11467.com/hangzhou/co/563258.htm
杭州合为卫浴有限公司的商铺,http://hangzhou0563258.11467.com
郑州建材凤凰城艾尔蓝特洁具商行,http:////www.11467.com/zhengzhou/co/189149.htm
郑州建材凤凰城艾尔蓝特洁具商行的商铺,http://zhengzhou0189149.11467.com
无锡市新区卡尼尔橱柜加工场,http:////www.11467.com/wuxi/co/243372.htm
无锡市新区卡尼尔橱柜加工场的商铺,http://wuxi0243372.11467.com
绍兴宜居云卫浴有限公司,http:////www.11467.com/shaoxing/co/154671.htm
绍兴宜居云卫浴有限公司的商铺,http://shaoxing0154671.11467.com
杭州索菲雅卫浴洁具厂,http:////www.11467.com/hangzhou/co/315659.htm
杭州索菲雅卫浴洁具厂的商铺,http://hangzhou0315659.11467.com
平湖百利吉洁具有限公司,http:////www.11467.com/jiaxing/co/123302.htm
平湖百利吉洁具有限公司的商铺,http://jiaxing0123302.11467.com
邱炜儒（个体经营）,http:////www.11467.com/chaozhou/co/36194.htm
邱炜儒（个体经营）的商铺,http://chaozhou036194.11467.com
佛山市益佰卫浴有限公司,http:////www.11467.com/foshan/co/65771.htm
佛山市益佰卫浴有限公司的商铺,http://foshan065771.11467.com
东莞市森磊简尚实业有限公司,http:////www.11467.com/dongguan/co/556825.htm
东莞市森磊简尚实业有限公司的商铺,http://dongguan0556825.11467.com
佛山市南海区艾达五金工艺制品厂,http:////www.11467.com/foshan/co/356115.htm
佛山市南海区艾达五金工艺制品厂的商铺,http://foshan0356115.11467.com
广州市宏邦家具有限公司,http:////www.11467.com/guangzhou/co/495943.htm
广州市宏邦家具有限公司的商铺,http://guangzhou0495943.11467.com
佛山市顺德区乐从镇丰林装饰家具厂,http:////www.11467.com/foshan/co/192566.htm
佛山市顺德区乐从镇丰林装饰家具厂的商铺,http://foshan0192566.11467.com
佛山市南海意轩厨卫科技有限公司,http:////www.11467.com/foshan/co/341776.htm
佛山市南海意轩厨卫科技有限公司的商铺,http://foshan0341776.11467.com
杭州爵士卫浴有限公司,http:////www.11467.com/hangzhou/co/351614.htm
杭州爵士卫浴有限公司的商铺,http://hangzhou0351614.11467.com
浙江木之森家居用品有限公司,http:////www.11467.com/jinhua/co/121819.htm
浙江木之森家居用品有限公司的商铺,http://jinhua0121819.11467.com
陈燕玔(个体经营),http:////www.11467.com/mianyang/co/48799.htm
陈燕玔(个体经营)的商铺,http://mianyang048799.11467.com
郑泽伟(个体经营),http:////www.11467.com/mianyang/co/48801.htm
郑泽伟(个体经营)的商铺,http://mianyang048801.11467.com
庄曼曼(个体经营),http:////www.11467.com/mianyang/co/48870.htm
庄曼曼(个体经营)的商铺,http://mianyang048870.11467.com
杭州时脉卫浴有限公司,http:////www.11467.com/hangzhou/co/370029.htm
杭州时脉卫浴有限公司的商铺,http://hangzhou0370029.11467.com
武汉市洪辉商贸有限公司,http:////www.11467.com/wuhan/co/126977.htm
武汉市洪辉商贸有限公司的商铺,http://wuhan0126977.11467.com
佛山市伊莎贝尔卫浴有限公司,http:////www.11467.com/foshan/co/10530.htm
佛山市伊莎贝尔卫浴有限公司的商铺,http://foshan010530.11467.com
佛山市佳橱世家家具有限公司,http:////www.11467.com/foshan/co/328895.htm
佛山市佳橱世家家具有限公司的商铺,http://foshan0328895.11467.com
佛山市禅城区英菲凯勒建材销售中心,http:////www.11467.com/foshan/co/356134.htm
佛山市禅城区英菲凯勒建材销售中心的商铺,http://foshan0356134.11467.com
佛山市南海博威玻璃工艺品有限公司,http:////www.11467.com/foshan/co/349979.htm
佛山市南海博威玻璃工艺品有限公司的商铺,http://foshan0349979.11467.com
南安市新华水暖卫浴有限公司,http:////www.11467.com/baoding/co/91313.htm
南安市新华水暖卫浴有限公司的商铺,http://baoding091313.11467.com
泉州市牧泉水暖工贸有限公司,http:////www.11467.com/baoding/co/91312.htm
泉州市牧泉水暖工贸有限公司的商铺,http://baoding091312.11467.com
深圳市嘉瑞轩装饰材料有限公司,http:////www.11467.com/shenzhen/co/1036921.htm
深圳市嘉瑞轩装饰材料有限公司的商铺,http://shenzhen01036921.11467.com
九江心安建材有限公司,http:////www.11467.com/jiujiang/co/22395.htm
佛山市天泉卫浴有限公司,http:////www.11467.com/foshan/co/306745.htm
佛山市伽美卫浴有限公司,http:////www.11467.com/qiye/93082659.htm
佛山市伽美卫浴有限公司的商铺,http://93082659.b2b.11467.com
佛山市南海大沥嘉华创成玻璃制品厂,http:////www.11467.com/foshan/co/209126.htm
佛山市南海大沥嘉华创成玻璃制品厂的商铺,http://foshan0209126.11467.com
佛山市南海区紫光阁卫浴洁具厂,http:////www.11467.com/foshan/co/223176.htm
佛山市南海区紫光阁卫浴洁具厂的商铺,http://foshan0223176.11467.com
湖州合鼎建材有限公司,http:////www.11467.com/huzhou/co/47547.htm
湖州合鼎建材有限公司的商铺,http://huzhou047547.11467.com
沈阳欣思豪洁具贸易有限公司,http:////www.11467.com/shenyang/co/60181.htm
沈阳欣思豪洁具贸易有限公司的商铺,http://shenyang060181.11467.com
厦门中宇龙洁具有限公司,http:////www.11467.com/xiamen/co/56650.htm
厦门中宇龙洁具有限公司的商铺,http://xiamen056650.11467.com
北京永乐美家家居装饰有限公司,http:////www.11467.com/beijing/co/110414.htm
北京永乐美家家居装饰有限公司的商铺,http://beijing0110414.11467.com
铝掌柜装饰材料有限公司,http:////www.11467.com/zhongshan/co/213056.htm
铝掌柜装饰材料有限公司的商铺,http://zhongshan0213056.11467.com
南安市仑苍永牧洁具厂,http:////www.11467.com/quanzhou/co/120673.htm
南安市仑苍永牧洁具厂的商铺,http://quanzhou0120673.11467.com
南安闽冠建材有限公司,http:////www.11467.com/quanzhou/co/147207.htm
南安闽冠建材有限公司的商铺,http://quanzhou0147207.11467.com
广州番禺海得丽清洁用品厂,http:////www.11467.com/guangzhou/co/142206.htm
广州番禺海得丽清洁用品厂的商铺,http://guangzhou0142206.11467.com
佛山市禅城区尚宝品汇卫浴销售部,http:////www.11467.com/foshan/co/355960.htm
佛山市禅城区尚宝品汇卫浴销售部的商铺,http://foshan0355960.11467.com
深圳市好卫帮装饰工程服务有限公司,http:////www.11467.com/shenzhen/co/983894.htm
深圳市好卫帮装饰工程服务有限公司的商铺,http://shenzhen0983894.11467.com
临沂群海商贸有限公司,http:////www.11467.com/linyi/co/132566.htm
临沂群海商贸有限公司的商铺,http://linyi0132566.11467.com
开平市旺佳卫浴洁具有限公司,http:////www.11467.com/tangshan/co/83382.htm
开平市旺佳卫浴洁具有限公司的商铺,http://tangshan083382.11467.com
深圳市中宏建材有限公司,http:////www.11467.com/shenzhen/co/809190.htm
深圳市中宏建材有限公司的商铺,http://shenzhen0809190.11467.com
泉州富贵山卫浴有限公司,http:////www.11467.com/quanzhou/co/130405.htm
泉州富贵山卫浴有限公司的商铺,http://quanzhou0130405.11467.com
温州伟佳装饰工程有限公司,http:////www.11467.com/lishui/co/38704.htm
温州伟佳装饰工程有限公司的商铺,http://lishui038704.11467.com
杭州依倩洁具有限公司,http:////www.11467.com/hangzhou/co/216639.htm
杭州依倩洁具有限公司的商铺,http://hangzhou0216639.11467.com
杭州萧山飞乐卫浴洁具厂,http:////www.11467.com/hangzhou/co/351032.htm
杭州萧山飞乐卫浴洁具厂的商铺,http://hangzhou0351032.11467.com
杭州美婷卫浴洁具厂,http:////www.11467.com/hangzhou/co/254159.htm
杭州美婷卫浴洁具厂的商铺,http://hangzhou0254159.11467.com
芜湖迦美展柜有限公司,http:////www.11467.com/wuhu/co/39125.htm
芜湖迦美展柜有限公司的商铺,http://wuhu039125.11467.com
杭州舒彤卫浴家私有限公司,http:////www.11467.com/hangzhou/co/526566.htm
杭州舒彤卫浴家私有限公司的商铺,http://hangzhou0526566.11467.com
长葛市荣依德卫浴销售部,http:////www.11467.com/xuchang/co/42316.htm
长葛市荣依德卫浴销售部的商铺,http://xuchang042316.11467.com
湘阴县谊润家居制品厂,http:////www.11467.com/qiye/93080687.htm
湘阴县谊润家居制品厂的商铺,http://93080687.b2b.11467.com
中山市邦典卫浴有限公司,http:////www.11467.com/zhongshan/co/225546.htm
中山市邦典卫浴有限公司的商铺,http://zhongshan0225546.11467.com
杭州萧山洁翔卫浴洁具厂,http:////www.11467.com/hangzhou/co/279115.htm
杭州萧山洁翔卫浴洁具厂的商铺,http://hangzhou0279115.11467.com
广州飞天建材科技有限公司,http:////www.11467.com/guangzhou/co/495334.htm
广州飞天建材科技有限公司的商铺,http://guangzhou0495334.11467.com
佛山市禅城区金海浪洁具厂,http:////www.11467.com/foshan/co/249484.htm
佛山市禅城区金海浪洁具厂的商铺,http://foshan0249484.11467.com
佛山市威欧斯卫浴有限公司,http:////www.11467.com/foshan/co/247386.htm
佛山市威欧斯卫浴有限公司的商铺,http://foshan0247386.11467.com
邱欣鹏(个体经营),http:////www.11467.com/chaozhou/co/36205.htm
邱欣鹏(个体经营)的商铺,http://chaozhou036205.11467.com
佛山市迈澳卫浴有限公司,http:////www.11467.com/foshan/co/320653.htm
佛山市迈澳卫浴有限公司的商铺,http://foshan0320653.11467.com
佛山市南海蓝翔卫浴制品厂,http:////www.11467.com/foshan/co/340100.htm
佛山市南海蓝翔卫浴制品厂的商铺,http://foshan0340100.11467.com
佛山市南海区罗村华朗洁具有限公司,http:////www.11467.com/foshan/co/356133.htm
佛山市南海区罗村华朗洁具有限公司的商铺,http://foshan0356133.11467.com
绍兴市汇鑫装潢材料有限公司,http:////www.11467.com/shaoxing/co/127257.htm
绍兴市汇鑫装潢材料有限公司的商铺,http://shaoxing0127257.11467.com
沈阳格林凯晨家具制造有限公司,http:////www.11467.com/shenyang/co/100921.htm
沈阳格林凯晨家具制造有限公司的商铺,http://shenyang0100921.11467.com
深圳市罗湖区超凡家居广场卡迪工艺品店,http:////www.11467.com/shenzhen/co/809191.htm
深圳市罗湖区超凡家居广场卡迪工艺品店的商铺,http://shenzhen0809191.11467.com
秦道卫浴有限公司,http:////www.11467.com/chaozhou/co/32085.htm
杭州全嘉厨卫科技有限公司,http:////www.11467.com/hangzhou/co/429187.htm
杭州全嘉厨卫科技有限公司的商铺,http://hangzhou0429187.11467.com
杭州拜伦卫浴有限公司,http:////www.11467.com/nanyang/co/34205.htm
杭州轩琳卫浴五金有限公司,http:////www.11467.com/nanyang/co/34206.htm
宋贞（个体经营）,http:////www.11467.com/quzhou/co/25010.htm
安徽明乐卫浴有限公司,http:////www.11467.com/suzhoushi/co/18999.htm
台州市路桥红苹果橱柜厂,http:////www.11467.com/taizhou/co/105084.htm
温州奥顿轻工实业有限公司,http:////www.11467.com/wenzhou/co/168729.htm
亚比亚卫浴有限公司,http:////www.11467.com/wenzhou/co/168947.htm
安徽省宣城市天成洁具有限公司,http:////www.11467.com/xuancheng/co/21017.htm
龙腾木器加工厂,http:////www.11467.com/yingkou/co/44033.htm
成都艾丽斯洁具有限公司,http:////www.11467.com/chengdu/co/140891.htm
平湖市新埭镇新奥丽诚洁具厂,http:////www.11467.com/jiaxing/co/91946.htm
保定鼎沃商贸有限公司,http:////www.11467.com/baoding/co/79385.htm
内蒙古达建建筑劳务有限公司,http:////www.11467.com/baotou/co/27829.htm
武进区横山桥松奥橱柜厂,http:////www.11467.com/changzhou/co/150818.htm
潮州市厘米陶瓷制作厂,http:////www.11467.com/chaozhou/co/35598.htm
潮安县古巷镇淘美易陶瓷厂,http:////www.11467.com/chaozhou/co/35027.htm
皇朝卫浴(香港)集团有限公司,http:////www.11467.com/chaozhou/co/35572.htm
香港尚斯特卫浴实业有限公司,http:////www.11467.com/chaozhou/co/35409.htm
潮安县凤塘杰生陶瓷厂,http:////www.11467.com/chaozhou/co/10425.htm
潮州市冠宇陶瓷实业有限公司,http:////www.11467.com/chaozhou/co/32672.htm
潮州市欧尔曼卫浴有限公司,http:////www.11467.com/chaozhou/co/35797.htm
承德市宏大机电建材有限公司,http:////www.11467.com/chengde/co/23425.htm
四川帝王洁具股份有限公司,http:////www.11467.com/chengdu/co/213250.htm
东莞市正朗建材有限公司,http:////www.11467.com/dongguan/co/305613.htm
佛山南海驭圣金属制品厂,http:////www.11467.com/foshan/co/340104.htm
佛山市禅城区蓝涛玻璃卫浴制品厂,http:////www.11467.com/foshan/co/304443.htm
佛山市古丽多卫浴有限公司,http:////www.11467.com/foshan/co/247576.htm
佛山森美卫浴洁具有限公司,http:////www.11467.com/foshan/co/340894.htm
佛山华兴卫浴洁具有限公司,http:////www.11467.com/foshan/co/339868.htm
佛山市法恩洁具有限公司,http:////www.11467.com/foshan/co/11010.htm
佛山市德皇卫浴洁具有限公司,http:////www.11467.com/foshan/co/344205.htm
佛山市禅城区索依仕卫浴厂,http:////www.11467.com/foshan/co/245365.htm
佛山佳美卫浴有限公司,http:////www.11467.com/foshan/co/338747.htm
佛山市南海区罗村雅滨斯洁具厂,http:////www.11467.com/foshan/co/342566.htm
佛山市顺德区美典厨柜有限公司,http:////www.11467.com/foshan/co/192600.htm
佛山市心海雅歌卫浴公司,http:////www.11467.com/foshan/co/341948.htm
佛山市三水粤山装饰实业有限公司,http:////www.11467.com/foshan/co/190443.htm
佛山市上欧陶瓷卫浴实业有限公司,http:////www.11467.com/foshan/co/299847.htm
佛山市桑尼亚卫浴洁具有限公司:陈国海(个体经营),http:////www.11467.com/foshan/co/296440.htm
佛山市顺德区尊美卫浴制造有限公司,http:////www.11467.com/foshan/co/303763.htm
广东伟星卫浴洁具有限公司,http:////www.11467.com/foshan/co/341996.htm
佛山市赛维尔进出口有限公司,http:////www.11467.com/foshan/co/342563.htm
沙和亚卫浴有限公司,http:////www.11467.com/foshan/co/344647.htm
欧佰林洁具厂,http:////www.11467.com/foshan/co/347415.htm
赣州必达工程电子信息商行,http:////www.11467.com/ganzhou/co/29794.htm
太空铝材浴室柜赣州总代理有限公司,http:////www.11467.com/ganzhou/co/32067.htm
合肥红树林电子科技有限公司,http:////www.11467.com/hefei/co/131858.htm
广东惠丰瓷业有限公司,http:////www.11467.com/huhehaote/co/29216.htm
金诺尔洁具厂,http:////www.11467.com/jingzhou/co/29000.htm
唐山市路南浩森卫橱洁具厂,http:////www.11467.com/tangshan/co/63076.htm
安徽皮皮王家佳厨浴有限公司,http:////www.11467.com/xuancheng/co/21093.htm
江苏省金湖艺佳洁具有限公司,http:////www.11467.com/yichang/co/47953.htm
吴进东（个体经营）,http:////www.11467.com/yinchuan/co/42333.htm
营口市站前区田华柜业,http:////www.11467.com/yingkou/co/44040.htm
新意家卫浴有限公司,http:////www.11467.com/yueyang/co/34531.htm
广东爱丽斯洁具经营部,http:////www.11467.com/zhaoqing/co/39876.htm
郑州建材水暖洁具批发中心乐佳卫浴商行,http:////www.11467.com/zhengzhou/co/147281.htm
中山市伟莎卫浴有限公司,http:////www.11467.com/zhongshan/co/147304.htm
亚日家具厂,http:////www.11467.com/ziyang/co/12313.htm
德立洁具有限公司北京分部,http:////www.11467.com/beijing/co/696480.htm
成华区旭升洁具厂,http:////www.11467.com/chengdu/co/273019.htm
杭州新贝卫浴有限公司,http:////www.11467.com/hangzhou/co/312030.htm
著陶洁具有限公司,http:////www.11467.com/chaozhou/co/34958.htm
复得科技有限公司,http:////www.11467.com/changchun/co/82839.htm
吉林省菲时特暖通工程有限公司,http:////www.11467.com/changchun/co/93035.htm
常州盛德家具有限公司,http:////www.11467.com/changzhou/co/93017.htm
东鹏卫浴(国际)控股有限公司,http:////www.11467.com/chaozhou/co/35132.htm
潮州市百诗特有限公司,http:////www.11467.com/chaozhou/co/31628.htm
潮安县古巷镇博陶陶瓷洁具厂,http:////www.11467.com/chaozhou/co/35021.htm
潮安县古巷镇嘉达丽陶瓷厂,http:////www.11467.com/chaozhou/co/18335.htm
潮安县古巷格丽斯工艺陶瓷厂,http:////www.11467.com/chaozhou/co/11015.htm
潮州市澳陶卫浴有限公司,http:////www.11467.com/chaozhou/co/36091.htm
广东省潮安县尚尼卫浴有限公司,http:////www.11467.com/chaozhou/co/35479.htm
广东省潮州市旗盾陶瓷实业有限公司,http:////www.11467.com/chaozhou/co/31652.htm
广东申牧王卫浴有限公司,http:////www.11467.com/chaozhou/co/35134.htm
潮州市马丁·欧雅卫浴经营部,http:////www.11467.com/chaozhou/co/35514.htm
绿帆盆柜厂,http:////www.11467.com/chaozhou/co/31626.htm
潮安县彩塘镇文利不锈钢制品厂,http:////www.11467.com/chaozhou/co/8893.htm
广东雅泰达陶瓷实业有限公司,http:////www.11467.com/chaozhou/co/35573.htm
宾利卫浴有限公司,http:////www.11467.com/chaozhou/co/35245.htm
佛山市禅城区奔祺卫浴厂专营店,http:////www.11467.com/foshan/co/342134.htm
佛山兴朗卫浴有限公司,http:////www.11467.com/foshan/co/339779.htm
名扬凤凰石工艺厂,http:////www.11467.com/foshan/co/344806.htm
诺雅卫浴厂,http:////www.11467.com/foshan/co/338754.htm
广州市番禺广林制品有限公司,http:////www.11467.com/guangzhou/co/480575.htm
广州舒莎卫浴有限公司,http:////www.11467.com/guangzhou/co/459263.htm
杭州安邦卫浴有限公司销售部,http:////www.11467.com/hangzhou/co/306935.htm
杭州旺杰卫浴洁具厂,http:////www.11467.com/hangzhou/co/306251.htm
杭州萧山豪丽卫浴洁具厂,http:////www.11467.com/hangzhou/co/307960.htm
杭州萧山党山芳明卫浴厂,http:////www.11467.com/hangzhou/co/306717.htm
杭州银浪卫浴有限公司,http:////www.11467.com/hangzhou/co/260404.htm
杭州洁仕达卫浴有限公司,http:////www.11467.com/hangzhou/co/69945.htm
杭州英联洁具设备有限公司,http:////www.11467.com/hangzhou/co/123461.htm
杭州乐派卫浴有限公司,http:////www.11467.com/hangzhou/co/232735.htm
杭州舜弘卫浴有限公司,http:////www.11467.com/hangzhou/co/308552.htm
安徽徽尚卫浴洁具有限公司,http:////www.11467.com/hefei/co/132382.htm
合肥市禧丰卫浴五金有限公司,http:////www.11467.com/hefei/co/131755.htm
惠州市顺天翔实业有限公司,http:////www.11467.com/huizhou/co/62656.htm
南通朗浩家居有限公司,http:////www.11467.com/nantong/co/137730.htm
浙江雅馨卫浴有限公司,http:////www.11467.com/shaoxing/co/120165.htm
平湖威博电气科技有限公司,http:////www.11467.com/shenyang/co/96775.htm
台州韩斯顿厨卫用品厂,http:////www.11467.com/taizhou/co/137351.htm
埃飞灵卫浴科技有限公司,http:////www.11467.com/taizhou/co/139113.htm
英国英皇卫浴有限公司,http:////www.11467.com/taizhou/co/139450.htm
温州市杜拉维特卫浴有限公司,http:////www.11467.com/wenzhou/co/168722.htm
优达(中国)有限公司,http:////www.11467.com/xiamen/co/95466.htm
安徽皮皮王家佳橱浴有限公司,http:////www.11467.com/xuancheng/co/19754.htm
烟台家都装饰设计有限公司,http:////www.11467.com/yantai/co/153273.htm
河南樱花乐卫洁具有限公司总代理,http:////www.11467.com/zhengzhou/co/172624.htm
桑诺投资(上海)股份有限公司,http:////www.11467.com/shanghai/co/1046056.htm
安庆市徽豪卫浴徽豪浴室柜厂,http:////www.11467.com/anqing/co/44646.htm
英尼尔卫浴有限公司,http:////www.11467.com/chaozhou/co/31955.htm
潮州市潮韵陶瓷有限公司,http:////www.11467.com/chaozhou/co/35253.htm
潮安县凤塘顺通瓷厂,http:////www.11467.com/chaozhou/co/10328.htm
广东柏扉步整体卫浴有限公司,http:////www.11467.com/chaozhou/co/35538.htm
金牌卫浴(意大利)陶瓷实业有限公司,http:////www.11467.com/chaozhou/co/35015.htm
卫浴厂家 广东马可圣地卫浴有限公司,http:////www.11467.com/chaozhou/co/35122.htm
阔箭卫浴实业有限公司,http:////www.11467.com/chaozhou/co/35335.htm
潮州市枫溪源盛陶瓷制作厂,http:////www.11467.com/chaozhou/co/141.htm
香港神爵陶瓷有限公司,http:////www.11467.com/chaozhou/co/35138.htm
广东省金帝尊洁具有限公司,http:////www.11467.com/chaozhou/co/36015.htm
乐陶卫浴有限公司,http:////www.11467.com/chaozhou/co/35033.htm
樱花卫浴(台湾)集团控股有限公司,http:////www.11467.com/chaozhou/co/35128.htm
潮安县居易瓷业有限公司,http:////www.11467.com/chaozhou/co/35403.htm
广东奥丽拉卫浴公司,http:////www.11467.com/chaozhou/co/35901.htm
潮州市诺贝尔卫浴(西班牙)陶瓷实业有限公司,http:////www.11467.com/chaozhou/co/35258.htm
潮安县植如建筑陶瓷有限公司,http:////www.11467.com/chaozhou/co/31621.htm
潮安县凤塘西和利兴瓷厂,http:////www.11467.com/chaozhou/co/10365.htm
潮安县美质陶瓷有限公司,http:////www.11467.com/chaozhou/co/35310.htm
名盛卫浴有限公司,http:////www.11467.com/chaozhou/co/31870.htm
潮州市和事达卫浴制作有限公司,http:////www.11467.com/chaozhou/co/35597.htm
潮安县凤塘镇鸿美洁具厂,http:////www.11467.com/chaozhou/co/32413.htm
潮安县东强陶瓷厂,http:////www.11467.com/chaozhou/co/10438.htm
美隆陶瓷实业有限公司,http:////www.11467.com/chaozhou/co/35126.htm
意大利凯博卫浴有限公司,http:////www.11467.com/chaozhou/co/35035.htm
香港东鹏卫浴实业有限公司,http:////www.11467.com/chaozhou/co/35213.htm
鹰卫浴(西班牙)新乐股份有限公司,http:////www.11467.com/chaozhou/co/35325.htm
淇园卫浴设备有限公司,http:////www.11467.com/chaozhou/co/35037.htm
成都巅峰洁具有限公司,http:////www.11467.com/chengdu/co/138515.htm
成都百居益卫浴家俬有限公司,http:////www.11467.com/chengdu/co/216462.htm
成都富丽源洁具有限公司,http:////www.11467.com/chengdu/co/139839.htm
成都新森洁具厂,http:////www.11467.com/chengdu/co/140635.htm
成都市馨韵玻璃制品厂,http:////www.11467.com/chengdu/co/139685.htm
成都大众洁具有限公司,http:////www.11467.com/chengdu/co/138514.htm
岚风（香港）卫浴股份有限公司,http:////www.11467.com/chengdu/co/141108.htm
