东莞市智扬运动制品有限公司,http:////www.11467.com/dongguan/co/487038.htm
东莞市智扬运动制品有限公司的商铺,http://dongguan0487038.11467.com
北京大倪体育设备有限公司,http:////www.11467.com/beijing/co/789421.htm
北京大倪体育设备有限公司的商铺,http://beijing0789421.11467.com
东莞市博凯纺织品有限公司,http:////www.11467.com/dongguan/co/462559.htm
东莞市博凯纺织品有限公司的商铺,http://dongguan0462559.11467.com
嘉峪关市飞天游乐设备有限公司,http:////www.11467.com/jiayuguan/co/1772.htm
嘉峪关市飞天游乐设备有限公司的商铺,http://jiayuguan01772.11467.com
扬州樱花工贸有限公司,http:////www.11467.com/hanzhong/co/23219.htm
扬州樱花工贸有限公司的商铺,http://hanzhong023219.11467.com
佛山市顺德区翔顺宏运动器材有限公司,http:////www.11467.com/foshan/co/216608.htm
佛山市顺德区翔顺宏运动器材有限公司的商铺,http://foshan0216608.11467.com
江门市蓬江区洛尹体育用品有限公司,http:////www.11467.com/jiangmen/co/84908.htm
江门市蓬江区洛尹体育用品有限公司的商铺,http://jiangmen084908.11467.com
嘉兴市隆鑫碳纤维制品有限公司,http:////www.11467.com/jiaxing/co/86568.htm
嘉兴市隆鑫碳纤维制品有限公司的商铺,http://jiaxing086568.11467.com
南昌向上轮滑有限公司,http:////www.11467.com/nanchang/co/95709.htm
南昌向上轮滑有限公司的商铺,http://nanchang095709.11467.com
威海晶瑞化工科技有限公司,http:////www.11467.com/weihai/co/32564.htm
威海晶瑞化工科技有限公司的商铺,http://weihai032564.11467.com
阳江市宝田五金制品有限公司,http:////www.11467.com/yangjiang/co/17417.htm
阳江市宝田五金制品有限公司的商铺,http://yangjiang017417.11467.com
珠海市高远体育用品有限公司,http:////www.11467.com/zhuhai/co/71324.htm
珠海市高远体育用品有限公司的商铺,http://zhuhai071324.11467.com
福州开发区飞雁体育用品有限公司,http:////www.11467.com/fuzhou/co/137205.htm
福州开发区飞雁体育用品有限公司的商铺,http://fuzhou0137205.11467.com
赛迪（中国）运动用品有限公司,http:////www.11467.com/dongguan/co/172321.htm
赛迪（中国）运动用品有限公司的商铺,http://dongguan0172321.11467.com
广州市海酷运动器材有限公司,http:////www.11467.com/guangzhou/co/435959.htm
广州市海酷运动器材有限公司的商铺,http://guangzhou0435959.11467.com
菏泽市牡丹区兴发木业有限公司,http:////www.11467.com/heze/co/18587.htm
菏泽市牡丹区兴发木业有限公司的商铺,http://heze018587.11467.com
广州市荔湾区永兴顺文体用品商行,http:////www.11467.com/guangzhou/co/496326.htm
广州市荔湾区永兴顺文体用品商行的商铺,http://guangzhou0496326.11467.com
广州谨泓体育用品有限公司,http:////www.11467.com/guangzhou/co/495850.htm
广州谨泓体育用品有限公司的商铺,http://guangzhou0495850.11467.com
东莞市腾虎鞋业有限公司,http:////www.11467.com/dongguan/co/615934.htm
东莞市腾虎鞋业有限公司的商铺,http://dongguan0615934.11467.com
广州市飞利文体用品有限公司,http:////www.11467.com/guangzhou/co/496456.htm
广州市飞利文体用品有限公司的商铺,http://guangzhou0496456.11467.com
广州青龙林服饰有限公司,http:////www.11467.com/guangzhou/co/433307.htm
广州青龙林服饰有限公司的商铺,http://guangzhou0433307.11467.com
东莞市大千礼品有限公司,http:////www.11467.com/dongguan/co/319643.htm
东莞市大千礼品有限公司的商铺,http://dongguan0319643.11467.com
东莞市百威运动用品有限公司,http:////www.11467.com/dongguan/co/188947.htm
东莞市百威运动用品有限公司的商铺,http://dongguan0188947.11467.com
江门市盛鑫充气玩具制品有限公司,http:////www.11467.com/jiangmen/co/84445.htm
江门市盛鑫充气玩具制品有限公司的商铺,http://jiangmen084445.11467.com
广州市飓风体育用品有限公司,http:////www.11467.com/guangzhou/co/216059.htm
广州市飓风体育用品有限公司的商铺,http://guangzhou0216059.11467.com
东莞市锦明运动器材有限公司,http:////www.11467.com/dongguan/co/556471.htm
东莞市锦明运动器材有限公司的商铺,http://dongguan0556471.11467.com
东莞市久诺贸易有限公司,http:////www.11467.com/dongguan/co/411495.htm
东莞市久诺贸易有限公司的商铺,http://dongguan0411495.11467.com
武义鼎新休闲用品有限公司,http:////www.11467.com/jinzhou/co/49722.htm
武义鼎新休闲用品有限公司的商铺,http://jinzhou049722.11467.com
奥普乐体育运动（北京）有限公司,http:////www.11467.com/beijing/co/763229.htm
奥普乐体育运动（北京）有限公司的商铺,http://beijing0763229.11467.com
雪梦都（北京）体育文化有限公司,http:////www.11467.com/beijing/co/765051.htm
雪梦都（北京）体育文化有限公司的商铺,http://beijing0765051.11467.com
广东森海运动用品有限公司,http:////www.11467.com/foshan/co/361616.htm
广东森海运动用品有限公司的商铺,http://foshan0361616.11467.com
东阳市包达电子有限公司,http:////www.11467.com/jinhua/co/124123.htm
东阳市包达电子有限公司的商铺,http://jinhua0124123.11467.com
广州市博顿运动手套有限公司,http:////www.11467.com/guangzhou/co/125374.htm
广州市博顿运动手套有限公司的商铺,http://guangzhou0125374.11467.com
广州龙威体育用品有限公司,http:////www.11467.com/guangzhou/co/216015.htm
广州龙威体育用品有限公司的商铺,http://guangzhou0216015.11467.com
广州游骑兵户外用品有限公司,http:////www.11467.com/guangzhou/co/488773.htm
广州游骑兵户外用品有限公司的商铺,http://guangzhou0488773.11467.com
广州市花都区狮岭丽特皮具厂,http:////www.11467.com/guangzhou/co/496270.htm
广州市花都区狮岭丽特皮具厂的商铺,http://guangzhou0496270.11467.com
东莞市纬球电气科技有限公司,http:////www.11467.com/dongguan/co/491778.htm
东莞市纬球电气科技有限公司的商铺,http://dongguan0491778.11467.com
东莞市科之源印刷品有限公司,http:////www.11467.com/dongguan/co/204373.htm
东莞市科之源印刷品有限公司的商铺,http://dongguan0204373.11467.com
东莞市寮步万丰海绵厂,http:////www.11467.com/dongguan/co/409994.htm
东莞市寮步万丰海绵厂的商铺,http://dongguan0409994.11467.com
东莞市寮步欣龙运动用品厂,http:////www.11467.com/dongguan/co/319690.htm
东莞市寮步欣龙运动用品厂的商铺,http://dongguan0319690.11467.com
东莞市利昂塑胶制品有限公司,http:////www.11467.com/dongguan/co/410636.htm
东莞市利昂塑胶制品有限公司的商铺,http://dongguan0410636.11467.com
任丘市信德塑料制品有限公司,http:////www.11467.com/cangzhou/co/46200.htm
任丘市信德塑料制品有限公司的商铺,http://cangzhou046200.11467.com
大连新活力商贸有限公司,http:////www.11467.com/dalian/co/66008.htm
大连新活力商贸有限公司的商铺,http://dalian066008.11467.com
东莞利成珍珠绵制品有限公司,http:////www.11467.com/dongguan/co/111438.htm
东莞利成珍珠绵制品有限公司的商铺,http://dongguan0111438.11467.com
东莞市力维升碳纤维制品科技有限公司,http:////www.11467.com/dongguan/co/313374.htm
东莞市力维升碳纤维制品科技有限公司的商铺,http://dongguan0313374.11467.com
东莞市奕利运动用品有限公司,http:////www.11467.com/dongguan/co/481720.htm
东莞市奕利运动用品有限公司的商铺,http://dongguan0481720.11467.com
东莞市冠世运动用品有限公司,http:////www.11467.com/dongguan/co/410399.htm
东莞市冠世运动用品有限公司的商铺,http://dongguan0410399.11467.com
广州市益佳光学技术有限公司,http:////www.11467.com/guangzhou/co/112541.htm
广州市益佳光学技术有限公司的商铺,http://guangzhou0112541.11467.com
深圳市南土信达科技有限公司,http:////www.11467.com/dongguan/co/557365.htm
深圳市南土信达科技有限公司的商铺,http://dongguan0557365.11467.com
慈溪市永大轴承有限公司,http:////www.11467.com/qiye/12616.htm
天津康体亿佰健身器材销售有限公司,http:////www.11467.com/tianjin/co/282379.htm
天津康体亿佰健身器材销售有限公司的商铺,http://tianjin0282379.11467.com
徐州市奥赛体育策划有限公司,http:////www.11467.com/xuzhou/co/57909.htm
徐州市奥赛体育策划有限公司的商铺,http://xuzhou057909.11467.com
厦门喜力来五金制品有限公司,http:////www.11467.com/xiamen/co/90487.htm
厦门喜力来五金制品有限公司的商铺,http://xiamen090487.11467.com
黑龙江义航经贸有限公司,http:////www.11467.com/haerbin/co/51823.htm
黑龙江义航经贸有限公司的商铺,http://haerbin051823.11467.com
泉州市新力嘉体育用品有限公司,http:////www.11467.com/quanzhou/co/98129.htm
泉州市新力嘉体育用品有限公司的商铺,http://quanzhou098129.11467.com
厦门顺特复合材料制品有限公司,http:////www.11467.com/xiamen/co/70107.htm
厦门顺特复合材料制品有限公司的商铺,http://xiamen070107.11467.com
西安市长安区中盛复合材料制品厂,http:////www.11467.com/xian/co/58055.htm
西安市长安区中盛复合材料制品厂的商铺,http://xian058055.11467.com
威海市环翠区红阳加工厂,http:////www.11467.com/weihai/co/33922.htm
威海市环翠区红阳加工厂的商铺,http://weihai033922.11467.com
珠海来福佳体育器材有限公司,http:////www.11467.com/zhuhai/co/71652.htm
珠海来福佳体育器材有限公司的商铺,http://zhuhai071652.11467.com
漳州市高杰仕碳纤维制品有限公司,http:////www.11467.com/zhangzhou/co/21824.htm
漳州市高杰仕碳纤维制品有限公司的商铺,http://zhangzhou021824.11467.com
临沂批发城鹰酷体育用品批发商行,http:////www.11467.com/linyi/co/107026.htm
临沂批发城鹰酷体育用品批发商行的商铺,http://linyi0107026.11467.com
至尊塑胶（深圳）有限公司,http:////www.11467.com/shenzhen/co/812069.htm
至尊塑胶（深圳）有限公司的商铺,http://shenzhen0812069.11467.com
唐山艾丽运动防护用具有限公司,http:////www.11467.com/tangshan/co/55565.htm
唐山艾丽运动防护用具有限公司的商铺,http://tangshan055565.11467.com
北京冰雪双威力体育设施有限公司,http:////www.11467.com/beijing/co/128584.htm
北京冰雪双威力体育设施有限公司的商铺,http://beijing0128584.11467.com
天津浩天津华鞋业有限公司,http:////www.11467.com/tianjin/co/17621.htm
天津浩天津华鞋业有限公司的商铺,http://tianjin017621.11467.com
上海微壹电气有限公司,http:////www.11467.com/shanghai/co/1037291.htm
上海微壹电气有限公司的商铺,http://shanghai01037291.11467.com
高辉林（个体经营）,http:////www.11467.com/linyi/co/55280.htm
高辉林（个体经营）的商铺,http://linyi055280.11467.com
深圳市格萨塑胶制品有限公司,http:////www.11467.com/shenzhen/co/673746.htm
深圳市格萨塑胶制品有限公司的商铺,http://shenzhen0673746.11467.com
武义欧飞运动器械有限公司,http:////www.11467.com/jinzhou/co/49917.htm
武义欧飞运动器械有限公司的商铺,http://jinzhou049917.11467.com
石家庄爱雪户外商贸有限公司,http:////www.11467.com/shijiazhuang/co/161412.htm
石家庄爱雪户外商贸有限公司的商铺,http://shijiazhuang0161412.11467.com
深圳市阿凡达体育用品有限公司,http:////www.11467.com/shenzhen/co/810888.htm
深圳市阿凡达体育用品有限公司的商铺,http://shenzhen0810888.11467.com
深圳市富国寰宇车业有限公司,http:////www.11467.com/shenzhen/co/811123.htm
深圳市富国寰宇车业有限公司的商铺,http://shenzhen0811123.11467.com
江都区富民宝国体育器材厂,http:////www.11467.com/yangzhou/co/109083.htm
江都区富民宝国体育器材厂的商铺,http://yangzhou0109083.11467.com
清投智能（北京）科技股份有限公司,http:////www.11467.com/beijing/co/789473.htm
清投智能（北京）科技股份有限公司的商铺,http://beijing0789473.11467.com
徐州福诺商贸有限公司,http:////www.11467.com/xuzhou/co/59897.htm
徐州福诺商贸有限公司的商铺,http://xuzhou059897.11467.com
扬州富贵羊体育用品有限公司,http:////www.11467.com/yangzhou/co/109067.htm
扬州富贵羊体育用品有限公司的商铺,http://yangzhou0109067.11467.com
深圳市普欧体育户外用品有限公司,http:////www.11467.com/shenzhen/co/811757.htm
深圳市普欧体育户外用品有限公司的商铺,http://shenzhen0811757.11467.com
永康市狂风体育用品厂,http:////www.11467.com/jinhua/co/123435.htm
永康市狂风体育用品厂的商铺,http://jinhua0123435.11467.com
文安县源特塑料厂,http:////www.11467.com/langfang/co/53472.htm
文安县源特塑料厂的商铺,http://langfang053472.11467.com
卫理高尔夫制品(惠州)有限公司,http:////www.11467.com/huizhou/co/33664.htm
卫理高尔夫制品(惠州)有限公司的商铺,http://huizhou033664.11467.com
深圳飞雪运动用品有限公司,http:////www.11467.com/shenzhen/co/537207.htm
深圳飞雪运动用品有限公司的商铺,http://shenzhen0537207.11467.com
深圳市鸿昇实业有限公司,http:////www.11467.com/shenzhen/co/267062.htm
深圳市鸿昇实业有限公司的商铺,http://shenzhen0267062.11467.com
深圳鸿冠运动器材有限责任公司,http:////www.11467.com/shenzhen/co/1107880.htm
深圳鸿冠运动器材有限责任公司的商铺,http://shenzhen01107880.11467.com
开原市天奥自动化装备有限公司,http:////www.11467.com/tieling/co/34999.htm
开原市天奥自动化装备有限公司的商铺,http://tieling034999.11467.com
珠海印象网络科技有限公司,http:////www.11467.com/zhuhai/co/66468.htm
珠海印象网络科技有限公司的商铺,http://zhuhai066468.11467.com
无锡西陵工控技术有限公司,http:////www.11467.com/wuxi/co/191072.htm
无锡西陵工控技术有限公司的商铺,http://wuxi0191072.11467.com
人人合鞋业公司,http:////www.11467.com/fangchenggang/co/6497.htm
广州市蒙特莱运动器材有限公司,http:////www.11467.com/guangzhou/co/202034.htm
王得亮(个体经营),http:////www.11467.com/heihe/co/18948.htm
要溜一起溜轮滑俱乐部,http:////www.11467.com/huangshi/co/17762.htm
吉林省冰雪器材有限公司,http:////www.11467.com/jilinshi/co/80406.htm
广州市密度炫舞轮滑俱乐部,http:////www.11467.com/jingmen/co/15178.htm
邵阳县金龙溜冰鞋厂,http:////www.11467.com/shaoyang/co/25139.htm
巢湖市公路局,http:////www.11467.com/maanshan/co/20736.htm
晨辉新能源投资公司,http:////www.11467.com/qiqihaer/co/59293.htm
雪狼体育器材厂,http:////www.11467.com/qiqihaer/co/59261.htm
冰魂体育器材厂,http:////www.11467.com/qiqihaer/co/59239.htm
狮子头俱乐部,http:////www.11467.com/shuozhou/co/8403.htm
厦门宝佳旺儿童用品有限公司,http:////www.11467.com/xiamen/co/38048.htm
熊险峰（个体经营）,http:////www.11467.com/chongqing/co/199761.htm
长沙风火轮轮滑俱乐部,http:////www.11467.com/changsha/co/119272.htm
东莞南城亨通溜冰鞋厂,http:////www.11467.com/dongguan/co/507541.htm
常平卓和塑胶绳带有限公司,http:////www.11467.com/dongguan/co/491881.htm
东莞三马运动器材有限公司,http:////www.11467.com/dongguan/co/493829.htm
东莞市大岭山迅成五金加工厂（销售部）,http:////www.11467.com/dongguan/co/363787.htm
东莞比尔捷运动用品厂,http:////www.11467.com/dongguan/co/498424.htm
东莞市德立实业有限公司,http:////www.11467.com/dongguan/co/366400.htm
东莞市健源精密五金有限公司,http:////www.11467.com/dongguan/co/306025.htm
东莞市南城亨通溜冰鞋厂,http:////www.11467.com/dongguan/co/365755.htm
东莞市常平源恩织带厂,http:////www.11467.com/dongguan/co/174179.htm
华聚(巴斯道）塑化科技有限公司,http:////www.11467.com/dongguan/co/365934.htm
东莞市精伦实业有限公司,http:////www.11467.com/dongguan/co/280499.htm
东莞市锦致皮革有限公司,http:////www.11467.com/dongguan/co/491880.htm
高登泰塑胶制品有限公司,http:////www.11467.com/dongguan/co/494313.htm
先锋运动用品有限公司,http:////www.11467.com/dongguan/co/365822.htm
佛山市顺德区强健新启运动器材有限公司,http:////www.11467.com/foshan/co/276754.htm
佛山市顺德区红刚实业有限公司,http:////www.11467.com/foshan/co/188934.htm
中圆塑胶有限公司,http:////www.11467.com/fuzhou/co/154259.htm
广州市番禺科航脚轮厂,http:////www.11467.com/guangzhou/co/375782.htm
广州市邦士度眼镜有限公司,http:////www.11467.com/guangzhou/co/468214.htm
广州乐顺水上用品有限公司,http:////www.11467.com/guangzhou/co/459748.htm
兴海物流有限公司,http:////www.11467.com/guiyang/co/83060.htm
哈尔滨利亚德实业有限公司,http:////www.11467.com/haerbin/co/71275.htm
黑龙江滑雪旅游用品公司,http:////www.11467.com/haerbin/co/70809.htm
中国哈尔滨良雪滑雪旅游用品公司,http:////www.11467.com/haerbin/co/71354.htm
杭州朗斯体育用品有限公司,http:////www.11467.com/hangzhou/co/110966.htm
永康欧瑞工贸有限公司,http:////www.11467.com/hangzhou/co/294317.htm
江门盈通塑胶制品有限公司,http:////www.11467.com/jiangmen/co/114558.htm
江门市江海区业伟成机械厂,http:////www.11467.com/jiangmen/co/64724.htm
开平道源塑胶制品有限公司,http:////www.11467.com/jiangmen/co/114109.htm
永康市飞达工贸有限公司,http:////www.11467.com/jinhua/co/127554.htm
永康腾洲工贸有限公司,http:////www.11467.com/jinhua/co/123436.htm
永康市艾利卡斯滑雪用品厂,http:////www.11467.com/jinhua/co/123437.htm
浙江省永康市江南富宝日用五金厂,http:////www.11467.com/jinhua/co/127017.htm
浙江武义九洲车业有限公司,http:////www.11467.com/jinhua/co/127795.htm
武义合力健身器材有限公司,http:////www.11467.com/jinzhou/co/49573.htm
山东国威轴承有限公司,http:////www.11467.com/liaocheng/co/50455.htm
宁海泰索户外用品有限公司,http:////www.11467.com/ningbo/co/194306.htm
青岛百益服装有限公司,http:////www.11467.com/qingdao/co/155545.htm
绍兴恒力铝业有限公司业务部2,http:////www.11467.com/shaoxing/co/119015.htm
川盛塑胶制品（深圳）有限公司,http:////www.11467.com/shenzhen/co/239652.htm
深圳精英假日体育发展有限公司,http:////www.11467.com/shenzhen/co/659092.htm
深圳市德尔制冷设备工程有限公司,http:////www.11467.com/shenzhen/co/779527.htm
深圳市德青科技有限公司,http:////www.11467.com/shenzhen/co/423057.htm
深圳市速盈物流有限公司,http:////www.11467.com/shenzhen/co/770542.htm
狮子头单排滑轮俱乐部,http:////www.11467.com/shuozhou/co/8398.htm
温州柏元经贸有限公司,http:////www.11467.com/wenzhou/co/86486.htm
珠海市纳源通信设备有限公司,http:////www.11467.com/zhuhai/co/66082.htm
北京冷山体育发展有限公司,http:////www.11467.com/beijing/co/180182.htm
北京乔波冰雪世界体育发展有限公司,http:////www.11467.com/beijing/co/699224.htm
宣城市劲炫轮滑俱乐部,http:////www.11467.com/xuancheng/co/21216.htm
保定市锦邦玮辉商贸有限公司,http:////www.11467.com/baoding/co/65668.htm
保定野牦牛箱包制造有限公司,http:////www.11467.com/baoding/co/85633.htm
自由轮滑经销公司,http:////www.11467.com/baotou/co/25832.htm
长春市自游人户外运动俱乐部,http:////www.11467.com/changchun/co/78434.htm
湖南长沙晶星物资贸易公司,http:////www.11467.com/changsha/co/119273.htm
米高轮滑公司,http:////www.11467.com/changsha/co/94893.htm
意凌商业公司,http:////www.11467.com/changsha/co/94810.htm
塔克堡商贸有限公司,http:////www.11467.com/changsha/co/121844.htm
菲尔体育用品商行,http:////www.11467.com/changzhou/co/119366.htm
劲道体育用品公司(西南办事处),http:////www.11467.com/chengdu/co/123855.htm
成都荣伟儿童娱乐运动用品商行,http:////www.11467.com/chengdu/co/123480.htm
四川风之子轮滑俱乐部,http:////www.11467.com/chengdu/co/124206.htm
龙卷风轮滑俱乐部,http:////www.11467.com/chenzhou/co/20103.htm
承达体育用品有限公司,http:////www.11467.com/dongguan/co/366229.htm
宝龙溜冰鞋厂,http:////www.11467.com/dongguan/co/364593.htm
承达运动用品有限公司\亚星商贸有限公司,http:////www.11467.com/dongguan/co/364102.htm
东莞恒美粘扣带制品厂,http:////www.11467.com/dongguan/co/238418.htm
东莞康博复材科技有限公司采购部,http:////www.11467.com/dongguan/co/363177.htm
奥兴速滑体育器材厂,http:////www.11467.com/dongguan/co/363579.htm
东莞市蔡坤包装材料有限公司,http:////www.11467.com/dongguan/co/490080.htm
赤剑体育用品有限公司,http:////www.11467.com/dongguan/co/364727.htm
东莞市大岭山宏盛玩具制品厂,http:////www.11467.com/dongguan/co/410654.htm
东莞力星轮滑鞋厂,http:////www.11467.com/dongguan/co/365296.htm
东莞市奥兴速滑体育器材厂,http:////www.11467.com/dongguan/co/366169.htm
东莞市东城友成溜冰鞋经营部,http:////www.11467.com/dongguan/co/365989.htm
东莞市富宏运动器材有限公司,http:////www.11467.com/dongguan/co/471524.htm
东莞劲道体育用品有限公司,http:////www.11467.com/dongguan/co/364409.htm
东莞劲霸贸易公司,http:////www.11467.com/dongguan/co/363446.htm
东莞市昌泰鞋业有限公司,http:////www.11467.com/dongguan/co/147775.htm
东莞市厚街奥兴运动用品加工店,http:////www.11467.com/dongguan/co/363062.htm
大佳五金塑胶有限公司市场部,http:////www.11467.com/shenzhen/co/657300.htm
深圳市宝安区鸿华玩具厂,http:////www.11467.com/shenzhen/co/673574.htm
深圳市宝佳利运动器材有限公司,http:////www.11467.com/shenzhen/co/287791.htm
深圳市精责模具制品有限公司,http:////www.11467.com/shenzhen/co/493804.htm
深圳市世纪创业贸易有限公司,http:////www.11467.com/shenzhen/co/796642.htm
快乐无极限轮滑公司,http:////www.11467.com/suizhou/co/11396.htm
威海晶瑞塑胶科技有限公司,http:////www.11467.com/weihai/co/47097.htm
温州市瓯海大利来鞋业有限公司,http:////www.11467.com/wenzhou/co/30716.htm
无锡安芬针织手套有限公司,http:////www.11467.com/wuxi/co/91285.htm
上海晋飞复合材料科技有限公司,http:////www.11467.com/xiangfan/co/39219.htm
营口深港实业发展有限公司,http:////www.11467.com/yingkou/co/38208.htm
佛山市智趣之星体育用品有限公司中山代理,http:////www.11467.com/zhongshan/co/149900.htm
中山市高信塑胶有限公司,http:////www.11467.com/zhongshan/co/41161.htm
洋紫荆油墨有限公司,http:////www.11467.com/zhongshan/co/147349.htm
中山市鸿顺运动器材实业有限公司,http:////www.11467.com/zhongshan/co/103246.htm
北京市雪娟冰上游乐设备有限公司,http:////www.11467.com/beijing/co/699223.htm
浙江赛邦实业股份有限公司,http:////www.11467.com/shanghai/co/1044248.htm
重庆能马科技有限公司,http:////www.11467.com/chongqing/co/204592.htm
天津康乐产业有限公司,http:////www.11467.com/tianjin/co/306563.htm
东莞市劲速极限轮滑俱乐部,http:////www.11467.com/dongguan/co/365948.htm
东莞市力星运动用品有限公司,http:////www.11467.com/dongguan/co/494310.htm
东莞市寶虹塑胶五金电子制品厂深圳销售处,http:////www.11467.com/dongguan/co/505474.htm
东莞市强飞溜冰鞋厂,http:////www.11467.com/dongguan/co/504320.htm
东莞市广康塑胶五金有限公司,http:////www.11467.com/dongguan/co/366440.htm
东莞市森菲运动用品有限公司,http:////www.11467.com/dongguan/co/471250.htm
东莞市金豹溜冰鞋厂,http:////www.11467.com/dongguan/co/364203.htm
东莞市厚街顺亨运动用品经营部,http:////www.11467.com/dongguan/co/71395.htm
东莞市东城英凯迈运动用品制造厂,http:////www.11467.com/dongguan/co/552019.htm
东莞市特迅运动器材有限公司,http:////www.11467.com/dongguan/co/363421.htm
东莞市石碣宝虹自行车厂,http:////www.11467.com/dongguan/co/144181.htm
东莞市石碣信兴电子厂,http:////www.11467.com/dongguan/co/7621.htm
东莞市寮步金虎溜冰鞋厂,http:////www.11467.com/dongguan/co/366422.htm
东莞市尼基运动用品有限公司,http:////www.11467.com/dongguan/co/412600.htm
东莞市沙田恒宇体育用品厂,http:////www.11467.com/dongguan/co/366443.htm
东莞市英商泓美股份有限公司,http:////www.11467.com/dongguan/co/364518.htm
东莞市海纳特塑料制品厂,http:////www.11467.com/dongguan/co/491883.htm
东莞市清月体育用品厂,http:////www.11467.com/dongguan/co/415582.htm
东莞市昭富碳纤维制品有限公司,http:////www.11467.com/dongguan/co/184528.htm
东莞市桦龙玩具制品厂,http:////www.11467.com/dongguan/co/458349.htm
东莞市黄江佳诚纺织品厂,http:////www.11467.com/dongguan/co/491936.htm
东莞市展奇商贸有限公司,http:////www.11467.com/dongguan/co/491884.htm
富成溜冰鞋厂,http:////www.11467.com/dongguan/co/365031.htm
东莞市中良电子塑胶制品厂,http:////www.11467.com/dongguan/co/366203.htm
东莞市厚街浩动体育用品店,http:////www.11467.com/dongguan/co/363424.htm
鸿兴纺织有限公司,http:////www.11467.com/dongguan/co/505473.htm
皇龙鞋业有限公司,http:////www.11467.com/dongguan/co/494315.htm
东莞市劲道体育用品有限公司,http:////www.11467.com/dongguan/co/491878.htm
