圣华盾防护科技股份有限公司,http:////www.11467.com/wuxi/co/274943.htm
圣华盾防护科技股份有限公司的商铺,http://wuxi0274943.11467.com
广州衣库服饰定制有限公司,http:////www.11467.com/qiye/93173820.htm
广州衣库服饰定制有限公司的商铺,http://93173820.b2b.11467.com
惠州宇晟服饰有限公司,http:////www.11467.com/huizhou/co/163383.htm
惠州宇晟服饰有限公司的商铺,http://huizhou0163383.11467.com
北京嘉日盛装服装有限公司,http:////www.11467.com/beijing/co/213301.htm
北京嘉日盛装服装有限公司的商铺,http://beijing0213301.11467.com
云南派头服饰有限公司,http:////www.11467.com/kunming/co/149385.htm
云南派头服饰有限公司的商铺,http://kunming0149385.11467.com
青岛英超标志服有限公司,http:////www.11467.com/laixi/co/1904.htm
青岛英超标志服有限公司的商铺,http://laixi01904.11467.com
安徽护航智能科技服饰有限公司,http:////www.11467.com/qiye/93078493.htm
安徽护航智能科技服饰有限公司的商铺,http://93078493.b2b.11467.com
哈尔滨威尔特制衣厂,http:////www.11467.com/haerbin/co/75998.htm
哈尔滨威尔特制衣厂的商铺,http://haerbin075998.11467.com
广州努瑞服饰有限公司,http:////www.11467.com/guangzhou/co/730517.htm
广州努瑞服饰有限公司的商铺,http://guangzhou0730517.11467.com
长沙市合美职业服饰有限公司,http:////www.11467.com/changsha/co/211503.htm
长沙市合美职业服饰有限公司的商铺,http://changsha0211503.11467.com
广州跃势生物科技股份有限公司,http:////www.11467.com/guangzhou/co/745539.htm
广州跃势生物科技股份有限公司的商铺,http://guangzhou0745539.11467.com
江阴永创服装经营部,http:////www.11467.com/wuxi/co/274585.htm
江阴永创服装经营部的商铺,http://wuxi0274585.11467.com
广州东森制衣有限公司,http:////www.11467.com/guangzhou/co/660720.htm
广州东森制衣有限公司的商铺,http://guangzhou0660720.11467.com
深圳工衣服装厂,http:////www.11467.com/shenzhen/co/1003611.htm
深圳工衣服装厂的商铺,http://shenzhen01003611.11467.com
泉州佳人白领服装有限公司,http:////www.11467.com/quanzhou/co/169628.htm
泉州佳人白领服装有限公司的商铺,http://quanzhou0169628.11467.com
济南三千玉帛有限公司,http:////www.11467.com/qiye/93439930.htm
济南三千玉帛有限公司的商铺,http://93439930.b2b.11467.com
台州市椒江梦好服饰有限公司,http:////www.11467.com/taizhou/co/210133.htm
台州市椒江梦好服饰有限公司的商铺,http://taizhou0210133.11467.com
厦门市湖里区适众服装经营部,http:////www.11467.com/xiamen/co/202766.htm
厦门市湖里区适众服装经营部的商铺,http://xiamen0202766.11467.com
安徽雨豹防雨服饰有限公司,http:////www.11467.com/hefei/co/164909.htm
安徽雨豹防雨服饰有限公司的商铺,http://hefei0164909.11467.com
深圳市银河碳工科技有限公司,http:////www.11467.com/shenzhen/co/1137978.htm
深圳市银河碳工科技有限公司的商铺,http://shenzhen01137978.11467.com
周口丰顺服装厂,http:////www.11467.com/zhoukou/co/31785.htm
周口丰顺服装厂的商铺,http://zhoukou031785.11467.com
昆山嘉颖服饰有限公司,http:////www.11467.com/suzhou/co/320886.htm
昆山嘉颖服饰有限公司的商铺,http://suzhou0320886.11467.com
东莞市三郎服饰有限公司,http:////www.11467.com/dongguan/co/614798.htm
东莞市三郎服饰有限公司的商铺,http://dongguan0614798.11467.com
山东临沂晨升服装厂,http:////www.11467.com/linyi/co/133803.htm
山东临沂晨升服装厂的商铺,http://linyi0133803.11467.com
舟伊木槿服饰成都有限公司,http:////www.11467.com/qiye/93069973.htm
舟伊木槿服饰成都有限公司的商铺,http://93069973.b2b.11467.com
江西康意服饰股份有限公司,http:////www.11467.com/ganzhou/co/57639.htm
江西康意服饰股份有限公司的商铺,http://ganzhou057639.11467.com
江苏龙图腾服装有限公司,http:////www.11467.com/zhenjiang/co/72049.htm
江苏龙图腾服装有限公司的商铺,http://zhenjiang072049.11467.com
湖北爱依儿电子科技有限公司,http:////www.11467.com/xianning/co/18211.htm
杭州硕盾服饰有限公司,http:////www.11467.com/hangzhou/co/531445.htm
长沙迈联电子商务有限公司,http:////www.11467.com/qiye/93071072.htm
沙市区天裁职业服饰制作厂,http:////www.11467.com/qiye/93079093.htm
西安华宏盛世服装有限责任公司,http:////www.11467.com/qiye/93080617.htm
江阴市奥前纺织有限公司,http:////www.11467.com/qiye/93104462.htm
武汉亮地服饰有限责任公司,http:////www.11467.com/wuhan/co/208532.htm
广州市春寅服饰有限公司,http:////www.11467.com/guangzhou/co/696655.htm
东莞市雅昕服装有限公司,http:////www.11467.com/dongguan/co/616252.htm
开封市开发区德康劳保百货商行,http:////www.11467.com/kaifeng/co/26568.htm
上海鸿统服饰有限公司,http:////www.11467.com/shanghai/co/1161803.htm
石家庄一江服饰有限公司,http:////www.11467.com/qiye/93321880.htm
景洪迪迪户外劳保店,http:////www.11467.com/qiye/93338271.htm
