高碑店市达奥新型建材有限公司的商铺,http://baoding0111487.11467.com
兰陵晟泰支架厂,http:////www.11467.com/linyi/co/128025.htm
兰陵晟泰支架厂的商铺,http://linyi0128025.11467.com
施必达（大连）新材料科技有限公司,http:////www.11467.com/dalian/co/81127.htm
施必达（大连）新材料科技有限公司的商铺,http://dalian081127.11467.com
焦作市众云耐酸瓷业有限公司,http:////www.11467.com/jiaozuo/co/37030.htm
焦作市众云耐酸瓷业有限公司的商铺,http://jiaozuo037030.11467.com
高新技术产业开发区渝磊建材厂,http:////www.11467.com/chongqing/co/319081.htm
高新技术产业开发区渝磊建材厂的商铺,http://chongqing0319081.11467.com
大连恒众鑫建筑材料有限公司,http:////www.11467.com/dalian/co/81296.htm
大连恒众鑫建筑材料有限公司的商铺,http://dalian081296.11467.com
德州美居装饰材料有限公司,http:////www.11467.com/dezhou/co/71403.htm
德州美居装饰材料有限公司的商铺,http://dezhou071403.11467.com
大城县大广安欧瑞保温材料销售部,http:////www.11467.com/langfang/co/69087.htm
大城县大广安欧瑞保温材料销售部的商铺,http://langfang069087.11467.com
合肥景恒园林景观工程有限公司,http:////www.11467.com/hefei/co/152158.htm
合肥景恒园林景观工程有限公司的商铺,http://hefei0152158.11467.com
枣强县斯玻特玻璃钢有限公司,http:////www.11467.com/hengshui/co/52796.htm
枣强县斯玻特玻璃钢有限公司的商铺,http://hengshui052796.11467.com
郑州共创陶瓷材料有限公司,http:////www.11467.com/zhengzhou/co/203555.htm
郑州共创陶瓷材料有限公司的商铺,http://zhengzhou0203555.11467.com
苏州爵悦建材有限公司,http:////www.11467.com/suzhou/co/357840.htm
苏州爵悦建材有限公司的商铺,http://suzhou0357840.11467.com
北京万建吉业建材有限公司,http:////www.11467.com/beijing/co/763554.htm
北京万建吉业建材有限公司的商铺,http://beijing0763554.11467.com
北京华研鑫泰科技有限公司,http:////www.11467.com/beijing/co/761939.htm
北京华研鑫泰科技有限公司的商铺,http://beijing0761939.11467.com
东莞市花满堂园林绿化公司,http:////www.11467.com/dongguan/co/558174.htm
东莞市花满堂园林绿化公司的商铺,http://dongguan0558174.11467.com
南京丽格玻璃钢有限公司,http:////www.11467.com/nanjing/co/171875.htm
南京丽格玻璃钢有限公司的商铺,http://nanjing0171875.11467.com
四川富登电梯制造有限公司,http:////www.11467.com/guangan/co/17781.htm
四川富登电梯制造有限公司的商铺,http://guangan017781.11467.com
西安加固灌浆料技术有限公司,http:////www.11467.com/xian/co/130938.htm
西安加固灌浆料技术有限公司的商铺,http://xian0130938.11467.com
珠海市华美隔热材料有限公司,http:////www.11467.com/zhuhai/co/110648.htm
珠海市华美隔热材料有限公司的商铺,http://zhuhai0110648.11467.com
北京瑞晟特建材有限公司,http:////www.11467.com/beijing/co/761114.htm
北京瑞晟特建材有限公司的商铺,http://beijing0761114.11467.com
北京顺建兴业混凝土外加剂工程技术有限公司,http:////www.11467.com/beijing/co/761177.htm
北京顺建兴业混凝土外加剂工程技术有限公司的商铺,http://beijing0761177.11467.com
建云建筑工程加固有限公司,http:////www.11467.com/shanghai/co/1198402.htm
建云建筑工程加固有限公司的商铺,http://shanghai01198402.11467.com
大连中建新合工程技术有限公司,http:////www.11467.com/dalian/co/81107.htm
大连中建新合工程技术有限公司的商铺,http://dalian081107.11467.com
大连恒众鑫新型建筑材料有限公司,http:////www.11467.com/dalian/co/81190.htm
大连恒众鑫新型建筑材料有限公司的商铺,http://dalian081190.11467.com
北京东方容大洁净技术发展有限公司,http:////www.11467.com/beijing/co/762135.htm
北京东方容大洁净技术发展有限公司的商铺,http://beijing0762135.11467.com
北京万吉建业建材有限公司销售部,http:////www.11467.com/beijing/co/762299.htm
北京万吉建业建材有限公司销售部的商铺,http://beijing0762299.11467.com
张家港市凤凰镇港口荣腾耐火保温材料经营部,http:////www.11467.com/suzhou/co/393927.htm
张家港市凤凰镇港口荣腾耐火保温材料经营部的商铺,http://suzhou0393927.11467.com
上海腾军建筑有限公司,http:////www.11467.com/shanghai/co/1124308.htm
上海腾军建筑有限公司的商铺,http://shanghai01124308.11467.com
大城县宇正化工建材有限公司,http:////www.11467.com/langfang/co/69047.htm
大城县宇正化工建材有限公司的商铺,http://langfang069047.11467.com
南京凯利德装饰材料有限公司,http:////www.11467.com/nanjing/co/184830.htm
南京凯利德装饰材料有限公司的商铺,http://nanjing0184830.11467.com
辽源市东北特种门窗厂,http:////www.11467.com/siping/co/19567.htm
辽源市东北特种门窗厂的商铺,http://siping019567.11467.com
枣强县创达玻璃钢制品厂,http:////www.11467.com/hengshui/co/81680.htm
枣强县创达玻璃钢制品厂的商铺,http://hengshui081680.11467.com
河北永创复合材料有限公司,http:////www.11467.com/hengshui/co/84272.htm
河北永创复合材料有限公司的商铺,http://hengshui084272.11467.com
河南宏恩园林绿化工程有限公司,http:////www.11467.com/zhengzhou/co/264034.htm
河南宏恩园林绿化工程有限公司的商铺,http://zhengzhou0264034.11467.com
上海横禄特钢有限公司,http:////www.11467.com/shanghai/co/1286704.htm
上海横禄特钢有限公司的商铺,http://shanghai01286704.11467.com
甘肃东方信达物资有限公司,http:////www.11467.com/lanzhou/co/95875.htm
甘肃东方信达物资有限公司的商铺,http://lanzhou095875.11467.com
北京北海建材集团有限公司,http:////www.11467.com/beijing/co/789578.htm
北京北海建材集团有限公司的商铺,http://beijing0789578.11467.com
甘肃胜龙工程材料有限公司,http:////www.11467.com/qiye/93150179.htm
甘肃胜龙工程材料有限公司的商铺,http://93150179.b2b.11467.com
北京德瑞兴科技有限公司,http:////www.11467.com/beijing/co/765084.htm
北京德瑞兴科技有限公司的商铺,http://beijing0765084.11467.com
西安远华新型材料有限公司,http:////www.11467.com/xian/co/177642.htm
西安远华新型材料有限公司的商铺,http://xian0177642.11467.com
南通大和防腐工程有限公司,http:////www.11467.com/nantong/co/101329.htm
南通大和防腐工程有限公司的商铺,http://nantong0101329.11467.com
临沂强龙滤料建材有限公司,http:////www.11467.com/linyi/co/61815.htm
临沂强龙滤料建材有限公司的商铺,http://linyi061815.11467.com
新疆金鼎彩云膜结构工程有限公司,http:////www.11467.com/qiye/93381819.htm
新疆金鼎彩云膜结构工程有限公司的商铺,http://93381819.b2b.11467.com
武汉长江加固技术有限公司,http:////www.11467.com/wuhan/co/84909.htm
武汉长江加固技术有限公司的商铺,http://wuhan084909.11467.com
廊坊鑫大保温有限公司,http:////www.11467.com/langfang/co/93232.htm
廊坊鑫大保温有限公司的商铺,http://langfang093232.11467.com
深圳市恒悦达建筑材料有限公司,http:////www.11467.com/shenzhen/co/705144.htm
深圳市恒悦达建筑材料有限公司的商铺,http://shenzhen0705144.11467.com
高和新区渝磊建材厂,http:////www.11467.com/chongqing/co/342373.htm
高和新区渝磊建材厂的商铺,http://chongqing0342373.11467.com
北京喜卡复合材料科技有限公司,http:////www.11467.com/beijing/co/789512.htm
北京喜卡复合材料科技有限公司的商铺,http://beijing0789512.11467.com
徐州恒科装配式建筑有限公司,http:////www.11467.com/qiye/93350291.htm
徐州恒科装配式建筑有限公司的商铺,http://93350291.b2b.11467.com
北京伟宏建筑工程有限公司,http:////www.11467.com/beijing/co/764227.htm
北京伟宏建筑工程有限公司的商铺,http://beijing0764227.11467.com
大连格润特建材有限公司,http:////www.11467.com/dalian/co/66089.htm
大连格润特建材有限公司的商铺,http://dalian066089.11467.com
河北四通玻璃钢有限公司,http:////www.11467.com/hengshui/co/24788.htm
河北四通玻璃钢有限公司的商铺,http://hengshui024788.11467.com
重庆超级工长建材有限公司,http:////www.11467.com/qiye/93451941.htm
重庆超级工长建材有限公司的商铺,http://93451941.b2b.11467.com
云南南浆建筑材料有限公司,http:////www.11467.com/qiye/93196446.htm
云南南浆建筑材料有限公司的商铺,http://93196446.b2b.11467.com
山东天地大建材科技有限公司河南办,http:////www.11467.com/zhengzhou/co/148864.htm
山东天地大建材科技有限公司河南办的商铺,http://zhengzhou0148864.11467.com
东莞市斯易机电设备有限公司,http:////www.11467.com/dongguan/co/636810.htm
东莞市斯易机电设备有限公司的商铺,http://dongguan0636810.11467.com
大连志恒众鑫工程建筑材料有限公司,http:////www.11467.com/dalian/co/81356.htm
大连志恒众鑫工程建筑材料有限公司的商铺,http://dalian081356.11467.com
湖南水泥花盆模具厂,http:////www.11467.com/changsha/co/226331.htm
湖南水泥花盆模具厂的商铺,http://changsha0226331.11467.com
上海康信实业有限公司,http:////www.11467.com/shanghai/co/1304895.htm
上海康信实业有限公司的商铺,http://shanghai01304895.11467.com
南京巨泰隆新型建材有限公司,http:////www.11467.com/nanjing/co/185041.htm
南京巨泰隆新型建材有限公司的商铺,http://nanjing0185041.11467.com
北京博楷建材有限公司,http:////www.11467.com/beijing/co/764632.htm
北京博楷建材有限公司的商铺,http://beijing0764632.11467.com
山东兴茂源防辐射材料有限公司,http:////www.11467.com/liaocheng/co/76976.htm
山东兴茂源防辐射材料有限公司的商铺,http://liaocheng076976.11467.com
南昌市唯垦实业有限公司,http:////www.11467.com/dongguan/co/641849.htm
南昌市唯垦实业有限公司的商铺,http://dongguan0641849.11467.com
深圳草木景观装饰工程有限公司,http:////www.11467.com/shenzhen/co/1128971.htm
深圳草木景观装饰工程有限公司的商铺,http://shenzhen01128971.11467.com
安平县安麦斯金属丝网制品有限公司,http:////www.11467.com/hengshui/co/37361.htm
安平县安麦斯金属丝网制品有限公司的商铺,http://hengshui037361.11467.com
福建奥泰利工程技术有限公司销售部,http:////www.11467.com/fuzhou/co/211590.htm
福建奥泰利工程技术有限公司销售部的商铺,http://fuzhou0211590.11467.com
湖南宏钢机械有限公司,http:////www.11467.com/changsha/co/223173.htm
湖南宏钢机械有限公司的商铺,http://changsha0223173.11467.com
卡玛贝拉（北京）科技有限公司,http:////www.11467.com/zhengzhou/co/272146.htm
卡玛贝拉（北京）科技有限公司的商铺,http://zhengzhou0272146.11467.com
上海恰融材料科技有限公司,http:////www.11467.com/shanghai/co/1286765.htm
上海恰融材料科技有限公司的商铺,http://shanghai01286765.11467.com
苏州阳城篷业工程有限公司,http:////www.11467.com/suzhou/co/356991.htm
苏州阳城篷业工程有限公司的商铺,http://suzhou0356991.11467.com
宁波高新区威康新材料有限公司,http:////www.11467.com/ningbo/co/192158.htm
宁波高新区威康新材料有限公司的商铺,http://ningbo0192158.11467.com
东莞市汉丰木业有限公司,http:////www.11467.com/dongguan/co/556256.htm
东莞市汉丰木业有限公司的商铺,http://dongguan0556256.11467.com
枣强县新宇玻璃钢制品厂,http:////www.11467.com/hengshui/co/42957.htm
枣强县新宇玻璃钢制品厂的商铺,http://hengshui042957.11467.com
合元镁环保节能建筑专业隔热瓦有限公司,http:////www.11467.com/foshan/co/306765.htm
上海道柯特沥青科技有限公司,http:////www.11467.com/shanghai/co/219273.htm
许昌瑞泰保温材料有限公司,http:////www.11467.com/xuchang/co/19203.htm
黑龙江省千亚建设集团有限公司,http:////www.11467.com/haerbin/co/62428.htm
保护罩大全,http:////www.11467.com/kaifeng/co/16774.htm
石家庄鹿恒建材有限公司,http:////www.11467.com/shijiazhuang/co/108016.htm
山东东成建材有限公司,http:////www.11467.com/zibo/co/118759.htm
山东东成建材有限公司的商铺,http://zibo0118759.11467.com
廊坊谦宏路桥材料有限公司,http:////www.11467.com/qiye/93196503.htm
廊坊谦宏路桥材料有限公司的商铺,http://93196503.b2b.11467.com
枣强县燕航复合材料厂,http:////www.11467.com/qiye/93119031.htm
枣强县燕航复合材料厂的商铺,http://93119031.b2b.11467.com
青岛鼎稳涂装工程有限公司,http:////www.11467.com/qingdao/co/188603.htm
青岛鼎稳涂装工程有限公司的商铺,http://qingdao0188603.11467.com
北京启德贸易中心,http:////www.11467.com/beijing/co/326709.htm
北京启德贸易中心的商铺,http://beijing0326709.11467.com
重庆罗明建材有限公司,http:////www.11467.com/chongqing/co/99434.htm
重庆罗明建材有限公司的商铺,http://chongqing099434.11467.com
淄博国美建材有限公司,http:////www.11467.com/zibo/co/80985.htm
淄博国美建材有限公司的商铺,http://zibo080985.11467.com
湖北鸿洋新型建材有限公司,http:////www.11467.com/qiye/93193390.htm
湖北鸿洋新型建材有限公司的商铺,http://93193390.b2b.11467.com
无锡绿宝塑木科技有限公司,http:////www.11467.com/qiye/93133571.htm
无锡绿宝塑木科技有限公司的商铺,http://93133571.b2b.11467.com
上饶市速航防护器材有限公司,http:////www.11467.com/qiye/93137407.htm
上饶市速航防护器材有限公司的商铺,http://93137407.b2b.11467.com
成都阿尔声学建材有限公司,http:////www.11467.com/chengdu/co/262617.htm
成都阿尔声学建材有限公司的商铺,http://chengdu0262617.11467.com
贵州欧易佳建材有限公司,http:////www.11467.com/qiye/93179951.htm
贵州欧易佳建材有限公司的商铺,http://93179951.b2b.11467.com
博野县成浩玻璃钢制品销售有限公司,http:////www.11467.com/qiye/93426514.htm
博野县成浩玻璃钢制品销售有限公司的商铺,http://93426514.b2b.11467.com
重庆筑牛建筑工程有限公司,http:////www.11467.com/qiye/93112134.htm
重庆筑牛建筑工程有限公司的商铺,http://93112134.b2b.11467.com
陕西德力陶瓷新材料有限公司,http:////www.11467.com/qiye/93204580.htm
陕西德力陶瓷新材料有限公司的商铺,http://93204580.b2b.11467.com
射阳顺泰木业有限公司,http:////www.11467.com/yancheng/co/16967.htm
射阳顺泰木业有限公司的商铺,http://yancheng016967.11467.com
重庆钰灵物资有限公司,http:////www.11467.com/chongqing/co/208207.htm
重庆钰灵物资有限公司的商铺,http://chongqing0208207.11467.com
北京奥泰利新技术有限公司,http:////www.11467.com/beijing/co/32784.htm
北京奥泰利新技术有限公司的商铺,http://beijing032784.11467.com
邯郸市吉溶金属制品有限公司,http:////www.11467.com/handan/co/83004.htm
邯郸市吉溶金属制品有限公司的商铺,http://handan083004.11467.com
湖北和之源园林市政工程有限公司,http:////www.11467.com/wuhan/co/227752.htm
湖北和之源园林市政工程有限公司的商铺,http://wuhan0227752.11467.com
淄博金宇钢结构有限公司,http:////www.11467.com/zibo/co/88900.htm
淄博金宇钢结构有限公司的商铺,http://zibo088900.11467.com
郑州益源耐火材料有限公司,http:////www.11467.com/zhengzhou/co/148565.htm
郑州益源耐火材料有限公司的商铺,http://zhengzhou0148565.11467.com
沈阳图南机房设备销售有限公司,http:////www.11467.com/shenyang/co/101015.htm
沈阳图南机房设备销售有限公司的商铺,http://shenyang0101015.11467.com
山东九曲圣基建材有限公司,http:////www.11467.com/yantai/co/170086.htm
山东九曲圣基建材有限公司的商铺,http://yantai0170086.11467.com
上海苏世冷气工程有限公司,http:////www.11467.com/shanghai/co/1039545.htm
上海苏世冷气工程有限公司的商铺,http://shanghai01039545.11467.com
天津易恩特暖通科技有限公司,http:////www.11467.com/tianjin/co/202819.htm
天津易恩特暖通科技有限公司的商铺,http://tianjin0202819.11467.com
张家港市阿斯科建材工业有限公司,http:////www.11467.com/suzhou/co/122853.htm
张家港市阿斯科建材工业有限公司的商铺,http://suzhou0122853.11467.com
锡山区中盾碳晶电热垫厂,http:////www.11467.com/wuxi/co/249859.htm
锡山区中盾碳晶电热垫厂的商铺,http://wuxi0249859.11467.com
无锡市盛特碳纤维制品有限公司,http:////www.11467.com/wuxi/co/249815.htm
无锡市盛特碳纤维制品有限公司的商铺,http://wuxi0249815.11467.com
厦门翔昀实验室设备有限公司,http:////www.11467.com/xiamen/co/10990.htm
厦门翔昀实验室设备有限公司的商铺,http://xiamen010990.11467.com
宣城市煌铭建筑材料加工厂,http:////www.11467.com/xuancheng/co/21108.htm
江苏新锐现代建材有限公司,http:////www.11467.com/xuzhou/co/63840.htm
晶通塑胶(厦门)有限公司,http:////www.11467.com/xiamen/co/78907.htm
无锡市三森焊管型钢有限公司,http:////www.11467.com/wuxi/co/213878.htm
赤峰运升玻璃制品有限责任公司,http:////www.11467.com/wulanchabu/co/6220.htm
巴中市承益建筑材料加工厂,http:////www.11467.com/bazhong/co/6932.htm
大同铸石工业(集团)有限责任公司,http:////www.11467.com/datong/co/15888.htm
鄂尔多斯市蒙星建筑材料有限责任公司,http:////www.11467.com/eerduosi/co/8909.htm
中铁大桥局集团第三工程有限公司,http:////www.11467.com/guangzhou/co/427024.htm
黄冈市华窑中浩窑炉有限公司,http:////www.11467.com/huanggang/co/14697.htm
内蒙古泰格尔建筑技术发展有限责任公司,http:////www.11467.com/huhehaote/co/29347.htm
内蒙古新青山玻璃工贸有限公司,http:////www.11467.com/huhehaote/co/29281.htm
长兴李家巷雅兴建材厂,http:////www.11467.com/huzhou/co/55931.htm
焦作市金宇化建有限公司,http:////www.11467.com/jiaozuo/co/22980.htm
酒泉市金池生物科技有限责任公司,http:////www.11467.com/jiuquan/co/11302.htm
迁安长城道路设施有限公司,http:////www.11467.com/qianan/co/3726.htm
秦皇岛合力预应力钢绞线有限公司,http:////www.11467.com/qinhuangdao/co/38784.htm
日照市宏祥纤维科技开发有限公司,http:////www.11467.com/rizhao/co/16876.htm
河南永煤碳纤维有限公司,http:////www.11467.com/shangqiu/co/17872.htm
商丘市宏达商贸有限公司,http:////www.11467.com/shangqiu/co/17860.htm
山西省华辉采钢板有限公司,http:////www.11467.com/ankang/co/13609.htm
鞍山浙商新型建材科技有限公司,http:////www.11467.com/anshan/co/74919.htm
鞍山方园建材厂,http:////www.11467.com/anshan/co/74961.htm
百色市永盛玻璃纤维加工场,http:////www.11467.com/baise/co/12187.htm
安徽首文碳纤维有限公司,http:////www.11467.com/bengbu/co/29960.htm
蚌埠市巨臣特种玻璃厂,http:////www.11467.com/bengbu/co/29860.htm
腾飞玻璃钢制品有限公司,http:////www.11467.com/bengbu/co/29925.htm
阚龙（个体经营）,http:////www.11467.com/benxi/co/30439.htm
本溪北台钢铁集团供销处,http:////www.11467.com/benxi/co/30454.htm
长春倍诺海涂料有限公司,http:////www.11467.com/changchun/co/83227.htm
长沙市芙蓉区汾阳堂郭家防水材料经营部,http:////www.11467.com/changsha/co/104331.htm
安徽和县斯美德新型建筑材料厂,http:////www.11467.com/chaohu/co/14604.htm
北京新诺安粉末聚合物有限公司,http:////www.11467.com/chaoyang/co/26468.htm
宁波金美亚池州管桩有限公司（销管部）,http:////www.11467.com/chizhou/co/9285.htm
大连现代玻璃钢制品有限公司,http:////www.11467.com/dalian/co/65194.htm
大连天勤世纪模板工程有限公司,http:////www.11467.com/dalian/co/65230.htm
辽宁省丹东市海天粘合剂厂,http:////www.11467.com/dandong/co/48592.htm
宏拓玻璃钢制品厂,http:////www.11467.com/daqing/co/42488.htm
大庆个体经营,http:////www.11467.com/daqing/co/42439.htm
大庆市萨尔图区新天地装饰材料商店,http:////www.11467.com/daqing/co/42479.htm
大庆市福顺玻璃钢制品厂,http:////www.11467.com/daqing/co/42566.htm
苍穹（个体）,http:////www.11467.com/daqing/co/42612.htm
大同市盛泰铸石工业有限公司,http:////www.11467.com/datong/co/15925.htm
彩新玻璃钢环艺制品厂,http:////www.11467.com/datong/co/15952.htm
大同北方铸石有限责任公司,http:////www.11467.com/datong/co/15948.htm
大同市盛泰铸石工业有限公司销售部,http:////www.11467.com/datong/co/15871.htm
泽昱JM建膜达州分公司,http:////www.11467.com/dazhou/co/17809.htm
德阳诚意商贸有限公司,http:////www.11467.com/deyang/co/33003.htm
东营胜鑫机电有限责任公司,http:////www.11467.com/dongying/co/32382.htm
东营天固公司,http:////www.11467.com/dongying/co/32427.htm
山东省东营中志灌浆料有限公司,http:////www.11467.com/dongying/co/32389.htm
鄂尔多斯亚欣碳纤维有限公司,http:////www.11467.com/eerduosi/co/9088.htm
阜阳市新端沼气有限公司,http:////www.11467.com/fuyang/co/27927.htm
安徽省阜阳市鑫翰建材有限责任公司,http:////www.11467.com/fuyang/co/27928.htm
安徽阜阳鑫翰建材有限公司,http:////www.11467.com/fuyang/co/27857.htm
安徽合肥恒华管桩有限公司,http:////www.11467.com/fuyang/co/27968.htm
江西鑫华新型建材有限公司,http:////www.11467.com/fuzhoushi/co/17016.htm
江西省抚州市鼎靓新型轻质环保建材有限公司,http:////www.11467.com/fuzhoushi/co/17006.htm
广西华美建材公司 桂林办事处,http:////www.11467.com/guilin/co/47737.htm
上海佳德丽防滑防护科技有限公司（桂林分部）,http:////www.11467.com/guilin/co/47746.htm
贵州巴图加固工程技术有限公司,http:////www.11467.com/guiyang/co/77894.htm
贵州辉煌实业,http:////www.11467.com/guiyang/co/77765.htm
宁夏华丽联合节能房屋制造开发有限公司,http:////www.11467.com/yinchuan/co/42470.htm
营口市西市区大伟玻璃丝布厂,http:////www.11467.com/yingkou/co/43932.htm
中卫市长河建筑材料加工厂,http:////www.11467.com/zhongwei/co/2093.htm
中卫市长河建筑材料加工厂,http:////www.11467.com/zhongwei/co/2094.htm
珠海路安建筑材料有限公司,http:////www.11467.com/zhuhai/co/87193.htm
株洲高新技术开发区大智新型建筑材料研究所,http:////www.11467.com/zhuzhou/co/37310.htm
遵义公路管理局,http:////www.11467.com/zunyi/co/22846.htm
武汉科丝力纤维制造有限公司,http:////www.11467.com/wuhan/co/169587.htm
路桥建设公司,http:////www.11467.com/guiyang/co/77825.htm
贵州能环生态科技开发有限公司,http:////www.11467.com/guiyang/co/77886.htm
哈尔滨市南岗区隆翔装饰材料经销处,http:////www.11467.com/haerbin/co/61593.htm
衡水金维建筑材料有限公司,http:////www.11467.com/hengshui/co/26604.htm
湖南建华管桩有限公司供应部,http:////www.11467.com/hengyang/co/28350.htm
建华管桩有限公司湖南公司,http:////www.11467.com/hengyang/co/28432.htm
衡阳高新产业开发区崇龙建材厂,http:////www.11467.com/hengyang/co/28361.htm
平桂管理区黄田飞鹰膨胀剂厂,http:////www.11467.com/hezhou/co/5885.htm
怀化中铁物资有限公司,http:////www.11467.com/huaihua/co/20063.htm
淮南若金化学锚固技术研究所,http:////www.11467.com/huainan/co/16797.htm
安徽顺辉集团有限公司,http:////www.11467.com/huainan/co/16791.htm
新美石料加工厂,http:////www.11467.com/huainan/co/16817.htm
时代加固材料有限公司,http:////www.11467.com/huangshan/co/14159.htm
湖北润和科技发展有限公司,http:////www.11467.com/huangshi/co/18425.htm
特种建材经营部<砂浆宝.砂浆王.岩砂晶.防水粉,http:////www.11467.com/huangshi/co/18484.htm
晋绥星外加剂厂,http:////www.11467.com/huhehaote/co/29210.htm
呼和浩特浦发钢结构加固有限公司,http:////www.11467.com/huhehaote/co/29465.htm
呼和浩特市晋绥星外加剂厂,http:////www.11467.com/huhehaote/co/29283.htm
北京中建建材公司呼市建材厂,http:////www.11467.com/huhehaote/co/29367.htm
金昌市亨通工贸有限责任公司,http:////www.11467.com/jinchang/co/4981.htm
晋城市英德门窗装潢有限公司,http:////www.11467.com/jincheng/co/18323.htm
山西省晋城市和盛工贸有限公司,http:////www.11467.com/jincheng/co/18351.htm
荆门市掇刀自强石膏有限公司,http:////www.11467.com/jingmen/co/15836.htm
高山玻璃钢制品厂,http:////www.11467.com/jingmen/co/15808.htm
湖北荆门市安兴异型塑胶制品厂,http:////www.11467.com/jingmen/co/15843.htm
荆门市东宝区高山玻璃钢制品厂,http:////www.11467.com/jingmen/co/15850.htm
高山玻璃钢制品厂,http:////www.11467.com/jingmen/co/15809.htm
荆门精艺装饰有限公司,http:////www.11467.com/jingmen/co/15870.htm
锦州金通特钢有限公司,http:////www.11467.com/jinzhou/co/45574.htm
九江市三和沃克尔陶瓷科技有限公司（销售部）,http:////www.11467.com/jiujiang/co/22337.htm
云龙防腐保温公司,http:////www.11467.com/kaifeng/co/16648.htm
开封金明区振华窑业维修中心,http:////www.11467.com/kaifeng/co/16670.htm
齐力预应力有限公司,http:////www.11467.com/kaifeng/co/16629.htm
莱芜市汶河化工有限公司,http:////www.11467.com/laiwu/co/9621.htm
张建成（个体 经营）,http:////www.11467.com/langfang/co/35370.htm
