河南省中冠建材销售有限公司,http:////www.11467.com/zhengzhou/co/203952.htm
河南省中冠建材销售有限公司的商铺,http://zhengzhou0203952.11467.com
成都展帆新型建材有限公司,http:////www.11467.com/chengdu/co/272988.htm
成都展帆新型建材有限公司的商铺,http://chengdu0272988.11467.com
常州双捷建筑材料有限公司,http:////www.11467.com/changzhou/co/159384.htm
常州双捷建筑材料有限公司的商铺,http://changzhou0159384.11467.com
南京曼卡特科技有限公司,http:////www.11467.com/nanjing/co/109115.htm
南京曼卡特科技有限公司的商铺,http://nanjing0109115.11467.com
嘉兴雅港装饰材料有限公司,http:////www.11467.com/jiaxing/co/183709.htm
嘉兴雅港装饰材料有限公司的商铺,http://jiaxing0183709.11467.com
天津市英和房屋加固拆除工程有限责任公司,http:////www.11467.com/tianjin/co/147311.htm
深圳市方德建材有限责任公司,http:////www.11467.com/shenzhen/co/887513.htm
长沙力鹰建材有限公司,http:////www.11467.com/changsha/co/188294.htm
长沙力鹰建材有限公司的商铺,http://changsha0188294.11467.com
安平县巨松金属丝网制品有限公司,http:////www.11467.com/hengshui/co/75404.htm
安平县巨松金属丝网制品有限公司的商铺,http://hengshui075404.11467.com
吉林恒源乐家科技有限公司,http:////www.11467.com/changchun/co/110818.htm
吉林恒源乐家科技有限公司的商铺,http://changchun0110818.11467.com
卡本复合材料（上海）有限公司,http:////www.11467.com/shanghai/co/1284147.htm
卡本复合材料（上海）有限公司的商铺,http://shanghai01284147.11467.com
陕西斯温格建材有限公司,http:////www.11467.com/xian/co/130767.htm
陕西斯温格建材有限公司的商铺,http://xian0130767.11467.com
焦作市普霖克环保材料有限公司,http:////www.11467.com/jiaozuo/co/23086.htm
焦作市普霖克环保材料有限公司的商铺,http://jiaozuo023086.11467.com
安平县朗诗丝网制品厂,http:////www.11467.com/hengshui/co/90533.htm
安平县朗诗丝网制品厂的商铺,http://hengshui090533.11467.com
陕西珂誉达建材有限公司,http:////www.11467.com/xian/co/177648.htm
陕西珂誉达建材有限公司的商铺,http://xian0177648.11467.com
四会市中辉建材制品厂,http:////www.11467.com/zhaoqing/co/68845.htm
四会市中辉建材制品厂的商铺,http://zhaoqing068845.11467.com
常州市吉美管业有限公司经营部,http:////www.11467.com/changzhou/co/169087.htm
常州市吉美管业有限公司经营部的商铺,http://changzhou0169087.11467.com
安平县宇植昊丝网制品厂,http:////www.11467.com/hengshui/co/24633.htm
安平县宇植昊丝网制品厂的商铺,http://hengshui024633.11467.com
济南保源隆新型建材有限公司,http:////www.11467.com/jinan/co/158867.htm
济南保源隆新型建材有限公司的商铺,http://jinan0158867.11467.com
哈尔滨乐施科技有限公司,http:////www.11467.com/haerbin/co/57832.htm
哈尔滨乐施科技有限公司的商铺,http://haerbin057832.11467.com
重庆典晶特装饰建材有限公司,http:////www.11467.com/chongqing/co/277069.htm
重庆典晶特装饰建材有限公司的商铺,http://chongqing0277069.11467.com
山东拓达建筑材料有限公司,http:////www.11467.com/jinan/co/153672.htm
山东拓达建筑材料有限公司的商铺,http://jinan0153672.11467.com
广西仿真茅草瓦制造有限公司,http:////www.11467.com/shenzhen/co/1102357.htm
广西仿真茅草瓦制造有限公司的商铺,http://shenzhen01102357.11467.com
东莞迪固建筑加固材料有限公司,http:////www.11467.com/dongguan/co/632335.htm
东莞迪固建筑加固材料有限公司的商铺,http://dongguan0632335.11467.com
湖南钢绞线销售有限公司,http:////www.11467.com/changsha/co/211499.htm
湖南钢绞线销售有限公司的商铺,http://changsha0211499.11467.com
北京中德新亚贵州金泰诺建筑材料有限公司,http:////www.11467.com/guiyang/co/89488.htm
北京中德新亚贵州金泰诺建筑材料有限公司的商铺,http://guiyang089488.11467.com
晋州市三羊欧式构件厂,http:////www.11467.com/shijiazhuang/co/289630.htm
晋州市三羊欧式构件厂的商铺,http://shijiazhuang0289630.11467.com
河北好声音环保科技有限公司,http:////www.11467.com/shijiazhuang/co/186773.htm
河北好声音环保科技有限公司的商铺,http://shijiazhuang0186773.11467.com
成都诚毅建材有限公司,http:////www.11467.com/chengdu/co/255202.htm
成都诚毅建材有限公司的商铺,http://chengdu0255202.11467.com
江西中硕化工有限责任公司,http:////www.11467.com/nanchang/co/131864.htm
江西中硕化工有限责任公司的商铺,http://nanchang0131864.11467.com
北京固特加源新技术有限公司,http:////www.11467.com/beijing/co/753312.htm
北京固特加源新技术有限公司的商铺,http://beijing0753312.11467.com
河南杰克利玻璃钢有限公司,http:////www.11467.com/anyang/co/41859.htm
河南杰克利玻璃钢有限公司的商铺,http://anyang041859.11467.com
无锡宏瑜钢格板有限公司,http:////www.11467.com/wuxi/co/274636.htm
无锡宏瑜钢格板有限公司的商铺,http://wuxi0274636.11467.com
江苏安逸热能科技股份有限公司,http:////www.11467.com/wuxi/co/276938.htm
江苏安逸热能科技股份有限公司的商铺,http://wuxi0276938.11467.com
淄博上光经贸有限公司,http:////www.11467.com/zibo/co/118754.htm
淄博上光经贸有限公司的商铺,http://zibo0118754.11467.com
广东鼎新高新科技股份有限公司,http:////www.11467.com/huizhou/co/162671.htm
广东鼎新高新科技股份有限公司的商铺,http://huizhou0162671.11467.com
山东鸿星新材料科技有限公司,http:////www.11467.com/binzhou/co/56096.htm
山东鸿星新材料科技有限公司的商铺,http://binzhou056096.11467.com
淄博正大建材科技有限公司,http:////www.11467.com/zibo/co/118756.htm
淄博正大建材科技有限公司的商铺,http://zibo0118756.11467.com
辽宁中车轨道交通装备有限公司,http:////www.11467.com/liaoyang/co/25774.htm
辽宁中车轨道交通装备有限公司的商铺,http://liaoyang025774.11467.com
天津市蓟县顺发水泥板制品厂,http:////www.11467.com/tianjin/co/266164.htm
天津市蓟县顺发水泥板制品厂的商铺,http://tianjin0266164.11467.com
福州明辉装饰材料有限公司,http:////www.11467.com/fuzhou/co/206742.htm
福州明辉装饰材料有限公司的商铺,http://fuzhou0206742.11467.com
北京华夏润达技术有限公司,http:////www.11467.com/beijing/co/753288.htm
北京华夏润达技术有限公司的商铺,http://beijing0753288.11467.com
广州市鹏城建筑加固材料有限公司,http:////www.11467.com/guangzhou/co/512310.htm
广州市鹏城建筑加固材料有限公司的商铺,http://guangzhou0512310.11467.com
广东宝通玻璃钢有限公司,http:////www.11467.com/huizhou/co/80876.htm
广东宝通玻璃钢有限公司的商铺,http://huizhou080876.11467.com
临沂方圆建筑模板厂,http:////www.11467.com/linyi/co/109538.htm
临沂方圆建筑模板厂的商铺,http://linyi0109538.11467.com
天津市通顺盛钢管有限公司,http:////www.11467.com/tianjin/co/211787.htm
天津市通顺盛钢管有限公司的商铺,http://tianjin0211787.11467.com
河南鑫通科技有限公司,http:////www.11467.com/anyang/co/41465.htm
河南鑫通科技有限公司的商铺,http://anyang041465.11467.com
石家庄三羊装饰材料有限公司,http:////www.11467.com/shijiazhuang/co/235255.htm
石家庄三羊装饰材料有限公司的商铺,http://shijiazhuang0235255.11467.com
南京亚当斯建材科技有限公司,http:////www.11467.com/nanjing/co/187128.htm
南京亚当斯建材科技有限公司的商铺,http://nanjing0187128.11467.com
常州市横林制冷设备有限公司兰分公司,http:////www.11467.com/changzhou/co/173275.htm
常州市横林制冷设备有限公司兰分公司的商铺,http://changzhou0173275.11467.com
北京德昌伟业建筑工程技术有限公司,http:////www.11467.com/beijing/co/691057.htm
北京德昌伟业建筑工程技术有限公司的商铺,http://beijing0691057.11467.com
河北嘉固碳纤维技术有限公司,http:////www.11467.com/langfang/co/91801.htm
河北嘉固碳纤维技术有限公司的商铺,http://langfang091801.11467.com
重庆振硕科技有限公司,http:////www.11467.com/chongqing/co/335280.htm
重庆振硕科技有限公司的商铺,http://chongqing0335280.11467.com
青岛卓能达建筑科技有限公司,http:////www.11467.com/qingdao/co/194195.htm
青岛卓能达建筑科技有限公司的商铺,http://qingdao0194195.11467.com
河北神博建材有限公司,http:////www.11467.com/shijiazhuang/co/274959.htm
河北神博建材有限公司的商铺,http://shijiazhuang0274959.11467.com
宏祥新材料股份有限公司,http:////www.11467.com/dezhou/co/49526.htm
宏祥新材料股份有限公司的商铺,http://dezhou049526.11467.com
中山市三乡镇信驰防水补强工程部,http:////www.11467.com/zhongshan/co/117287.htm
中山市三乡镇信驰防水补强工程部的商铺,http://zhongshan0117287.11467.com
哈尔滨三和新型建筑材料开发有限公司,http:////www.11467.com/haerbin/co/69090.htm
哈尔滨三和新型建筑材料开发有限公司的商铺,http://haerbin069090.11467.com
郑州渲润护栏有限公司,http:////www.11467.com/zhengzhou/co/115679.htm
郑州渲润护栏有限公司的商铺,http://zhengzhou0115679.11467.com
湖南固力工程新材料有限责任公司,http:////www.11467.com/changsha/co/99192.htm
湖南固力工程新材料有限责任公司的商铺,http://changsha099192.11467.com
开封市中材新型建材有限责任公司,http:////www.11467.com/kaifeng/co/13755.htm
开封市中材新型建材有限责任公司的商铺,http://kaifeng013755.11467.com
广东松本绿色新材股份有限公司,http:////www.11467.com/guangzhou/co/512327.htm
广东松本绿色新材股份有限公司的商铺,http://guangzhou0512327.11467.com
济南拓达建材有限公司,http:////www.11467.com/jinan/co/133297.htm
济南拓达建材有限公司的商铺,http://jinan0133297.11467.com
南京速倍尔新材料有限公司,http:////www.11467.com/nanjing/co/115513.htm
南京速倍尔新材料有限公司的商铺,http://nanjing0115513.11467.com
淮安市澳森特种建材有限公司,http:////www.11467.com/huaian/co/40861.htm
淮安市澳森特种建材有限公司的商铺,http://huaian040861.11467.com
广西中德新亚建筑技术有限公司,http:////www.11467.com/nanning/co/99120.htm
广西中德新亚建筑技术有限公司的商铺,http://nanning099120.11467.com
郑州松茂建材有限公司,http:////www.11467.com/zhengzhou/co/210862.htm
郑州松茂建材有限公司的商铺,http://zhengzhou0210862.11467.com
湖南省岳阳远博新型材料科技有限公司,http:////www.11467.com/yueyang/co/34557.htm
湖南省岳阳远博新型材料科技有限公司的商铺,http://yueyang034557.11467.com
河北燕舞防爆电器有限公司,http:////www.11467.com/hengshui/co/35807.htm
河北燕舞防爆电器有限公司的商铺,http://hengshui035807.11467.com
河南省新盛建筑节能装饰有限公司,http:////www.11467.com/xinxiang/co/31890.htm
河南省新盛建筑节能装饰有限公司的商铺,http://xinxiang031890.11467.com
河北建研材料技术有限公司,http:////www.11467.com/shijiazhuang/co/106272.htm
河北建研材料技术有限公司的商铺,http://shijiazhuang0106272.11467.com
唐山万城建材有限公司,http:////www.11467.com/tangshan/co/63509.htm
唐山万城建材有限公司的商铺,http://tangshan063509.11467.com
湖北宝源装饰材料有限公司,http:////www.11467.com/dongguan/co/488847.htm
湖北宝源装饰材料有限公司的商铺,http://dongguan0488847.11467.com
济南财通建材有限公司,http:////www.11467.com/jinan/co/133218.htm
济南财通建材有限公司的商铺,http://jinan0133218.11467.com
白山市和一硅藻科技有限公司,http:////www.11467.com/baishan/co/14218.htm
白山市和一硅藻科技有限公司的商铺,http://baishan014218.11467.com
深圳市暖暖电热有限公司,http:////www.11467.com/shenzhen/co/820538.htm
深圳市暖暖电热有限公司的商铺,http://shenzhen0820538.11467.com
扬州优比特不锈钢热压模板有限公司,http:////www.11467.com/yangzhou/co/118912.htm
扬州优比特不锈钢热压模板有限公司的商铺,http://yangzhou0118912.11467.com
黑龙江中古建筑节能科技股份有限公司,http:////www.11467.com/haerbin/co/61740.htm
黑龙江中古建筑节能科技股份有限公司的商铺,http://haerbin061740.11467.com
深圳市龙岗区布吉镇坂田方圳玻璃钢商行,http:////www.11467.com/shenzhen/co/48330.htm
深圳市龙岗区布吉镇坂田方圳玻璃钢商行的商铺,http://shenzhen048330.11467.com
河南鸿彪科技有限公司,http:////www.11467.com/zhengzhou/co/174035.htm
河南鸿彪科技有限公司的商铺,http://zhengzhou0174035.11467.com
郑州豪德制冷设备有限公司,http:////www.11467.com/zhengzhou/co/176469.htm
郑州豪德制冷设备有限公司的商铺,http://zhengzhou0176469.11467.com
太仓顺峰体育用品有限公司,http:////www.11467.com/suzhou/co/356613.htm
太仓顺峰体育用品有限公司的商铺,http://suzhou0356613.11467.com
大城县汇通保温建材有限公司,http:////www.11467.com/langfang/co/47615.htm
大城县汇通保温建材有限公司的商铺,http://langfang047615.11467.com
富阳市富新耐火材料有限公司,http:////www.11467.com/hangzhou/co/142128.htm
富阳市富新耐火材料有限公司的商铺,http://hangzhou0142128.11467.com
杭州金盟道路设施有限公司,http:////www.11467.com/hangzhou/co/144171.htm
杭州金盟道路设施有限公司的商铺,http://hangzhou0144171.11467.com
佛山市华步防护产品科技有限公司,http:////www.11467.com/foshan/co/235622.htm
佛山市华步防护产品科技有限公司的商铺,http://foshan0235622.11467.com
广州市富滋雅装饰材料有限公司,http:////www.11467.com/guangzhou/co/479786.htm
广州市富滋雅装饰材料有限公司的商铺,http://guangzhou0479786.11467.com
大连腾辉新型建材有限公司,http:////www.11467.com/dalian/co/63691.htm
大连腾辉新型建材有限公司的商铺,http://dalian063691.11467.com
武汉科兹热能技术有限公司,http:////www.11467.com/wuhan/co/141319.htm
武汉科兹热能技术有限公司的商铺,http://wuhan0141319.11467.com
沧州威斯泰脚手架有限公司,http:////www.11467.com/cangzhou/co/46022.htm
沧州威斯泰脚手架有限公司的商铺,http://cangzhou046022.11467.com
天津源拓模板有限公司,http:////www.11467.com/tianjin/co/155928.htm
天津源拓模板有限公司的商铺,http://tianjin0155928.11467.com
天津高德建材科技有限公司,http:////www.11467.com/tianjin/co/180802.htm
天津高德建材科技有限公司的商铺,http://tianjin0180802.11467.com
江苏金舍建材科技有限公司,http:////www.11467.com/suzhou/co/268949.htm
江苏金舍建材科技有限公司的商铺,http://suzhou0268949.11467.com
南通强固复合材料有限公司,http:////www.11467.com/nantong/co/112937.htm
南通强固复合材料有限公司的商铺,http://nantong0112937.11467.com
山东绿森塑木复合材料有限公司,http:////www.11467.com/linyi/co/76927.htm
山东绿森塑木复合材料有限公司的商铺,http://linyi076927.11467.com
赫隆新能源科技(上海)有限公司,http:////www.11467.com/shanghai/co/1040072.htm
赫隆新能源科技(上海)有限公司的商铺,http://shanghai01040072.11467.com
黑龙江炫欧装饰工程有限公司,http:////www.11467.com/haerbin/co/76109.htm
黑龙江炫欧装饰工程有限公司的商铺,http://haerbin076109.11467.com
上海巧力建筑科技有限公司,http:////www.11467.com/shanghai/co/747703.htm
山东保佳建筑材料有限公司,http:////www.11467.com/dezhou/co/38315.htm
上海安叶制冷工程设备有限公司,http:////www.11467.com/shanghai/co/1051125.htm
成都华千基业有限公司,http:////www.11467.com/chengdu/co/142900.htm
成都华千基业有限公司的商铺,http://chengdu0142900.11467.com
信阳市平桥区新天地保温材料厂,http:////www.11467.com/xinyang/co/18636.htm
信阳市平桥区新天地保温材料厂的商铺,http://xinyang018636.11467.com
北京凯建昌盛工程技术有限公司,http:////www.11467.com/beijing/co/588259.htm
北京凯建昌盛工程技术有限公司的商铺,http://beijing0588259.11467.com
山东泽瑞科技有限公司,http:////www.11467.com/dongying/co/32826.htm
山东泽瑞科技有限公司的商铺,http://dongying032826.11467.com
长春弘圣新型建筑材料有限公司,http:////www.11467.com/changchun/co/83278.htm
长春弘圣新型建筑材料有限公司的商铺,http://changchun083278.11467.com
北京鑫汉天诚建筑工程技术有限公司,http:////www.11467.com/beijing/co/588275.htm
北京鑫汉天诚建筑工程技术有限公司的商铺,http://beijing0588275.11467.com
广州大帅建筑材料有限公司,http:////www.11467.com/guangzhou/co/433528.htm
广州大帅建筑材料有限公司的商铺,http://guangzhou0433528.11467.com
鑫勃企业浙江销售公司,http:////www.11467.com/jiaxing/co/94307.htm
鑫勃企业浙江销售公司的商铺,http://jiaxing094307.11467.com
天津建特建材有限公司,http:////www.11467.com/tianjin/co/38855.htm
天津建特建材有限公司的商铺,http://tianjin038855.11467.com
北京华千联合投资管理有限公司,http:////www.11467.com/beijing/co/33320.htm
北京华千联合投资管理有限公司的商铺,http://beijing033320.11467.com
枣庄市正邦新型建材有限公司,http:////www.11467.com/zaozhuang/co/31342.htm
枣庄市正邦新型建材有限公司的商铺,http://zaozhuang031342.11467.com
青岛永固工程加固有限公司,http:////www.11467.com/qingdao/co/125228.htm
青岛永固工程加固有限公司的商铺,http://qingdao0125228.11467.com
双利雨篷厂,http:////www.11467.com/hangzhou/co/368591.htm
双利雨篷厂的商铺,http://hangzhou0368591.11467.com
北京十木科技加固材料有限公司,http:////www.11467.com/beijing/co/226860.htm
北京十木科技加固材料有限公司的商铺,http://beijing0226860.11467.com
上海佳乐碳纤维制品有限公司,http:////www.11467.com/shanghai/co/898769.htm
上海佳乐碳纤维制品有限公司的商铺,http://shanghai0898769.11467.com
大连北方华千建材有限公司,http:////www.11467.com/dalian/co/66297.htm
大连北方华千建材有限公司的商铺,http://dalian066297.11467.com
桐乡市蒙泰增强复合材料有限公司,http:////www.11467.com/jiaxing/co/92542.htm
桐乡市蒙泰增强复合材料有限公司的商铺,http://jiaxing092542.11467.com
成都华千基业建材有限公司,http:////www.11467.com/chengdu/co/176458.htm
成都华千基业建材有限公司的商铺,http://chengdu0176458.11467.com
青岛华千建材有限公司,http:////www.11467.com/qingdao/co/125453.htm
青岛华千建材有限公司的商铺,http://qingdao0125453.11467.com
广州中坚装饰工程有限公司,http:////www.11467.com/guangzhou/co/434138.htm
广州中坚装饰工程有限公司的商铺,http://guangzhou0434138.11467.com
四川锦程新复合材料有限公司,http:////www.11467.com/chengdu/co/142675.htm
四川锦程新复合材料有限公司的商铺,http://chengdu0142675.11467.com
河北金顺保温建材,http:////www.11467.com/langfang/co/35771.htm
河北金顺保温建材的商铺,http://langfang035771.11467.com
日照市维长综合麻刀厂,http:////www.11467.com/rizhao/co/17088.htm
日照市维长综合麻刀厂的商铺,http://rizhao017088.11467.com
佛山市禅城区蓝山卫浴厂,http:////www.11467.com/foshan/co/307056.htm
佛山市禅城区蓝山卫浴厂的商铺,http://foshan0307056.11467.com
北京十木科技有限有限公司,http:////www.11467.com/beijing/co/226958.htm
北京十木科技有限有限公司的商铺,http://beijing0226958.11467.com
广州大帅建筑材料技术有限公司销售部,http:////www.11467.com/guangzhou/co/421132.htm
广州大帅建筑材料技术有限公司销售部的商铺,http://guangzhou0421132.11467.com
河南省新密市永安锚喷材料有限公司,http:////www.11467.com/zhengzhou/co/149416.htm
河南省新密市永安锚喷材料有限公司的商铺,http://zhengzhou0149416.11467.com
河北华美玻璃棉制品有限公司,http:////www.11467.com/langfang/co/40292.htm
河北华美玻璃棉制品有限公司的商铺,http://langfang040292.11467.com
上海元睿装饰有限公司,http:////www.11467.com/shanghai/co/336983.htm
上海元睿装饰有限公司的商铺,http://shanghai0336983.11467.com
东莞市木林森软木制品厂,http:////www.11467.com/dongguan/co/415402.htm
东莞市木林森软木制品厂的商铺,http://dongguan0415402.11467.com
南昌立德尔玻璃钢格栅公司,http:////www.11467.com/nanchang/co/100734.htm
南昌立德尔玻璃钢格栅公司的商铺,http://nanchang0100734.11467.com
北京奥泰利新技术有限公司河北分公司,http:////www.11467.com/shijiazhuang/co/108777.htm
北京奥泰利新技术有限公司河北分公司的商铺,http://shijiazhuang0108777.11467.com
中山富莱德建筑加固工程有限公司,http:////www.11467.com/zhongshan/co/118853.htm
中山富莱德建筑加固工程有限公司的商铺,http://zhongshan0118853.11467.com
北京金易宏达有限公司,http:////www.11467.com/beijing/co/33219.htm
北京金易宏达有限公司的商铺,http://beijing033219.11467.com
杭州自动扶梯制造有限公司,http:////www.11467.com/hangzhou/co/312290.htm
杭州自动扶梯制造有限公司的商铺,http://hangzhou0312290.11467.com
厦门铭诚膜有限公,http:////www.11467.com/xiamen/co/85415.htm
厦门铭诚膜有限公的商铺,http://xiamen085415.11467.com
天津会昌风貌建筑装饰有限公司,http:////www.11467.com/tianjin/co/180799.htm
天津会昌风貌建筑装饰有限公司的商铺,http://tianjin0180799.11467.com
武汉航华玻璃科技有限公司,http:////www.11467.com/wuhan/co/117863.htm
武汉航华玻璃科技有限公司的商铺,http://wuhan0117863.11467.com
北京十木科技贸易有限公司,http:////www.11467.com/beijing/co/226968.htm
北京十木科技贸易有限公司的商铺,http://beijing0226968.11467.com
滁州安达建材有限公司,http:////www.11467.com/chuzhou/co/22690.htm
滁州安达建材有限公司的商铺,http://chuzhou022690.11467.com
上海露菲斯实业有限公司,http:////www.11467.com/shanghai/co/811501.htm
上海露菲斯实业有限公司的商铺,http://shanghai0811501.11467.com
大城县华阳聚氨酯有限公司,http:////www.11467.com/langfang/co/36200.htm
大城县华阳聚氨酯有限公司的商铺,http://langfang036200.11467.com
冀州市奥卓复合材料科技有限公司,http:////www.11467.com/hengshui/co/33379.htm
东奥不锈钢门花厂,http:////www.11467.com/liuan/co/16136.htm
江苏好泡建材新技术有限公司,http:////www.11467.com/changzhou/co/129725.htm
苏州傲威新型建材有限公司南宁分公司,http:////www.11467.com/nanning/co/79072.htm
苏州市工业园区舒美雨篷厂,http:////www.11467.com/suzhou/co/269923.htm
合肥市鑫艺苑装饰材料工艺厂,http:////www.11467.com/hefei/co/38155.htm
郑州渲润彩铝护栏有限公司,http:////www.11467.com/zhengzhou/co/148690.htm
日照市维长麻纤维综合有限公司,http:////www.11467.com/rizhao/co/13692.htm
东莞市乐嘉文模具钢材有限公司	,http:////www.11467.com/dongguan/co/508582.htm
东莞市乐嘉文模具钢材有限公司	的商铺,http://dongguan0508582.11467.com
德美建筑材料有限责任公司,http:////www.11467.com/beijing/co/690618.htm
德美建筑材料有限责任公司的商铺,http://beijing0690618.11467.com
北京华坚恒固工程技术研究有限公司,http:////www.11467.com/beijing/co/690862.htm
北京华坚恒固工程技术研究有限公司的商铺,http://beijing0690862.11467.com
青岛科瑞升经贸有限公司,http:////www.11467.com/qingdao/co/153510.htm
青岛科瑞升经贸有限公司的商铺,http://qingdao0153510.11467.com
北京佳合天成新技术有限公司,http:////www.11467.com/beijing/co/691866.htm
北京佳合天成新技术有限公司的商铺,http://beijing0691866.11467.com
天津华千建材有限公司,http:////www.11467.com/tianjin/co/196169.htm
天津华千建材有限公司的商铺,http://tianjin0196169.11467.com
佛山市南海区大沥众盈塑料型材厂,http:////www.11467.com/foshan/co/209341.htm
佛山市南海区大沥众盈塑料型材厂的商铺,http://foshan0209341.11467.com
湖北奥东新型装饰材料开发有限公司,http:////www.11467.com/ezhou/co/10959.htm
湖北奥东新型装饰材料开发有限公司的商铺,http://ezhou010959.11467.com
长沙市特种玻璃钢有限公司,http:////www.11467.com/changsha/co/82075.htm
长沙市特种玻璃钢有限公司的商铺,http://changsha082075.11467.com
淄博宗宝耐火材料商行,http:////www.11467.com/zibo/co/97875.htm
淄博宗宝耐火材料商行的商铺,http://zibo097875.11467.com
常州市豪骏复合材料有限公司,http:////www.11467.com/changzhou/co/102161.htm
常州市豪骏复合材料有限公司的商铺,http://changzhou0102161.11467.com
吉运佳（天津）进出口有限公司,http:////www.11467.com/tianjin/co/195965.htm
吉运佳（天津）进出口有限公司的商铺,http://tianjin0195965.11467.com
献县精瑞建材仪器厂,http:////www.11467.com/cangzhou/co/54287.htm
献县精瑞建材仪器厂的商铺,http://cangzhou054287.11467.com
广州市佳丽福建材有限公司,http:////www.11467.com/guangzhou/co/421849.htm
