宁波恒盾日用品制造有限公司,http:////www.11467.com/ningbo/co/93900.htm
宁波恒盾日用品制造有限公司的商铺,http://ningbo093900.11467.com
郑州童朔游乐设备有限公司,http:////www.11467.com/zhengzhou/co/191812.htm
郑州童朔游乐设备有限公司的商铺,http://zhengzhou0191812.11467.com
厦门惠拓动漫科技有限公司,http:////www.11467.com/xiamen/co/93658.htm
厦门惠拓动漫科技有限公司的商铺,http://xiamen093658.11467.com
惠州市惠阳区秋长亿兆工艺品厂,http:////www.11467.com/huizhou/co/62307.htm
惠州市惠阳区秋长亿兆工艺品厂的商铺,http://huizhou062307.11467.com
汕头市澄海区维楠格塑胶实业有限公司,http:////www.11467.com/shantou/co/141212.htm
汕头市澄海区维楠格塑胶实业有限公司的商铺,http://shantou0141212.11467.com
邯郸市丛台区北方雕塑艺术工作室,http:////www.11467.com/handan/co/49266.htm
邯郸市丛台区北方雕塑艺术工作室的商铺,http://handan049266.11467.com
惠州市惠阳区新圩晟泰防滑材料制品加工厂,http:////www.11467.com/huizhou/co/66189.htm
惠州市惠阳区新圩晟泰防滑材料制品加工厂的商铺,http://huizhou066189.11467.com
汕头市澄海区莲下联丰塑胶制品厂,http:////www.11467.com/shantou/co/141053.htm
汕头市澄海区莲下联丰塑胶制品厂的商铺,http://shantou0141053.11467.com
汕头市澄海区兴达隆塑料制品厂,http:////www.11467.com/shantou/co/140896.htm
汕头市澄海区兴达隆塑料制品厂的商铺,http://shantou0140896.11467.com
扬州市维扬区三鹰玩具礼品商行,http:////www.11467.com/yangzhou/co/87700.htm
扬州市维扬区三鹰玩具礼品商行的商铺,http://yangzhou087700.11467.com
镇江市天元玩具制造有限责任公司,http:////www.11467.com/zhenjiang/co/47496.htm
镇江市天元玩具制造有限责任公司的商铺,http://zhenjiang047496.11467.com
铁岭市电子设备制造有限公司,http:////www.11467.com/tieling/co/3004.htm
铁岭市电子设备制造有限公司的商铺,http://tieling03004.11467.com
潍坊市坊子区九龙街办金龙风筝厂,http:////www.11467.com/weifang/co/89403.htm
潍坊市坊子区九龙街办金龙风筝厂的商铺,http://weifang089403.11467.com
杭州甲骨舞美设计有限公司,http:////www.11467.com/hangzhou/co/226790.htm
杭州甲骨舞美设计有限公司的商铺,http://hangzhou0226790.11467.com
郑州乐儿美游乐设备有限公司,http:////www.11467.com/zhengzhou/co/220273.htm
郑州乐儿美游乐设备有限公司的商铺,http://zhengzhou0220273.11467.com
广州市枫采贸易有限公司,http:////www.11467.com/guangzhou/co/66782.htm
广州市枫采贸易有限公司的商铺,http://guangzhou066782.11467.com
广州晴枫电子有限公司,http:////www.11467.com/guangzhou/co/239884.htm
广州晴枫电子有限公司的商铺,http://guangzhou0239884.11467.com
深圳万润科技股份有限公司,http:////www.11467.com/shenzhen/co/346900.htm
深圳万润科技股份有限公司的商铺,http://shenzhen0346900.11467.com
安阳市高安模型有限公司,http:////www.11467.com/anyang/co/43499.htm
安阳市高安模型有限公司的商铺,http://anyang043499.11467.com
北京高乐迪玩具有限公司,http:////www.11467.com/beijing/co/716830.htm
北京高乐迪玩具有限公司的商铺,http://beijing0716830.11467.com
苏州福龙游乐设备有限公司,http:////www.11467.com/suzhou/co/206402.htm
苏州福龙游乐设备有限公司的商铺,http://suzhou0206402.11467.com
广州市番禺区新造礼南五金机械厂,http:////www.11467.com/guangzhou/co/272818.htm
广州市番禺区新造礼南五金机械厂的商铺,http://guangzhou0272818.11467.com
东莞市广升胶类玩具制品厂,http:////www.11467.com/dongguan/co/413239.htm
东莞市广升胶类玩具制品厂的商铺,http://dongguan0413239.11467.com
广州杰信检验技术服务有限公司,http:////www.11467.com/guangzhou/co/701685.htm
广州杰信检验技术服务有限公司的商铺,http://guangzhou0701685.11467.com
广州市佳胜动漫科技有限公司,http:////www.11467.com/guangzhou/co/512503.htm
广州市佳胜动漫科技有限公司的商铺,http://guangzhou0512503.11467.com
青岛国阳儿童游乐设备有限公司,http:////www.11467.com/qingdao/co/172867.htm
青岛国阳儿童游乐设备有限公司的商铺,http://qingdao0172867.11467.com
广西南宁嘉贝爱游乐设备有限公司,http:////www.11467.com/nanning/co/98055.htm
广西南宁嘉贝爱游乐设备有限公司的商铺,http://nanning098055.11467.com
东莞市新科源化工有限公司,http:////www.11467.com/dongguan/co/271723.htm
东莞市新科源化工有限公司的商铺,http://dongguan0271723.11467.com
贵州好美味食品开发有限公司,http:////www.11467.com/guiyang/co/67934.htm
贵州好美味食品开发有限公司的商铺,http://guiyang067934.11467.com
北京君艺铭音乐器销售中心,http:////www.11467.com/beijing/co/439386.htm
北京君艺铭音乐器销售中心的商铺,http://beijing0439386.11467.com
郑州爱可多游乐园设备有限公司,http:////www.11467.com/zhengzhou/co/216199.htm
郑州爱可多游乐园设备有限公司的商铺,http://zhengzhou0216199.11467.com
常州市资昊模具厂,http:////www.11467.com/changzhou/co/148002.htm
常州市资昊模具厂的商铺,http://changzhou0148002.11467.com
东莞市晋力磁铁有限公司,http:////www.11467.com/dongguan/co/498730.htm
东莞市晋力磁铁有限公司的商铺,http://dongguan0498730.11467.com
东莞市品凯电子器材有限公司,http:////www.11467.com/dongguan/co/128418.htm
东莞市品凯电子器材有限公司的商铺,http://dongguan0128418.11467.com
广州市吉普超声波电子设备有限公司,http:////www.11467.com/guangzhou/co/107562.htm
广州市吉普超声波电子设备有限公司的商铺,http://guangzhou0107562.11467.com
广州市新点气模制品有限公司,http:////www.11467.com/guangzhou/co/496344.htm
广州市新点气模制品有限公司的商铺,http://guangzhou0496344.11467.com
佛山市南海友达宠物用品有限公司,http:////www.11467.com/foshan/co/356002.htm
佛山市南海友达宠物用品有限公司的商铺,http://foshan0356002.11467.com
广州妙华国际贸易有限公司,http:////www.11467.com/guangzhou/co/220023.htm
广州妙华国际贸易有限公司的商铺,http://guangzhou0220023.11467.com
曲阳万硕雕塑品有限公司,http:////www.11467.com/baoding/co/82159.htm
曲阳万硕雕塑品有限公司的商铺,http://baoding082159.11467.com
石家庄儿童沙天然海沙厂,http:////www.11467.com/shijiazhuang/co/108515.htm
石家庄儿童沙天然海沙厂的商铺,http://shijiazhuang0108515.11467.com
长颈鹿美语苏州校,http:////www.11467.com/suzhou/co/312933.htm
长颈鹿美语苏州校的商铺,http://suzhou0312933.11467.com
温州欧奇电子有限公司,http:////www.11467.com/wenzhou/co/164967.htm
温州欧奇电子有限公司的商铺,http://wenzhou0164967.11467.com
厦门闻达兴贸易有限公司,http:////www.11467.com/xiamen/co/48255.htm
厦门闻达兴贸易有限公司的商铺,http://xiamen048255.11467.com
南京威鼎机械设备有限公司,http:////www.11467.com/nanjing/co/154205.htm
南京威鼎机械设备有限公司的商铺,http://nanjing0154205.11467.com
郑州决明子批发中心,http:////www.11467.com/zhengzhou/co/264071.htm
郑州决明子批发中心的商铺,http://zhengzhou0264071.11467.com
唐山大拇指幼儿园,http:////www.11467.com/tangshan/co/63282.htm
国际商务酒店有限公司,http:////www.11467.com/yangzhou/co/89938.htm
国际商务酒店管理公司,http:////www.11467.com/yangzhou/co/89939.htm
国际酒店管理公司,http:////www.11467.com/yangzhou/co/89940.htm
广州易东电子科技有限公司,http:////www.11467.com/guangzhou/co/432629.htm
郑州市长虹游乐机械设备有限公司,http:////www.11467.com/zhengzhou/co/171583.htm
郑州市长虹游乐机械设备有限公司的商铺,http://zhengzhou0171583.11467.com
上海杰宣科教设备有限公司,http:////www.11467.com/shanghai/co/1132127.htm
上海杰宣科教设备有限公司的商铺,http://shanghai01132127.11467.com
荥阳市昊童游乐设备销售部,http:////www.11467.com/zhengzhou/co/220351.htm
荥阳市昊童游乐设备销售部的商铺,http://zhengzhou0220351.11467.com
荥阳市金狮王子游乐机械厂,http:////www.11467.com/zhengzhou/co/209831.htm
荥阳市金狮王子游乐机械厂的商铺,http://zhengzhou0209831.11467.com
重庆市渝中区灵物阁水族馆,http:////www.11467.com/chongqing/co/195190.htm
重庆市渝中区灵物阁水族馆的商铺,http://chongqing0195190.11467.com
郑州虎威游艺公司,http:////www.11467.com/zhengzhou/co/137924.htm
郑州虎威游艺公司的商铺,http://zhengzhou0137924.11467.com
扬州瑞鼎工艺品有限公司,http:////www.11467.com/yangzhou/co/10314.htm
扬州瑞鼎工艺品有限公司的商铺,http://yangzhou010314.11467.com
扬州天晟橡塑制品有限公司,http:////www.11467.com/yangzhou/co/78168.htm
扬州天晟橡塑制品有限公司的商铺,http://yangzhou078168.11467.com
东莞市奥纳模型制品有限公司,http:////www.11467.com/dongguan/co/164322.htm
东莞市奥纳模型制品有限公司的商铺,http://dongguan0164322.11467.com
汕头市澄海区锦盛塑胶玩具厂,http:////www.11467.com/shantou/co/141110.htm
汕头市澄海区锦盛塑胶玩具厂的商铺,http://shantou0141110.11467.com
汕头市澄海区益凯玩具厂,http:////www.11467.com/shantou/co/141292.htm
汕头市澄海区益凯玩具厂的商铺,http://shantou0141292.11467.com
汕头市澄海区广益意新电子玩具厂,http:////www.11467.com/shantou/co/141178.htm
汕头市澄海区广益意新电子玩具厂的商铺,http://shantou0141178.11467.com
汕头市万代玩具礼品有限公司,http:////www.11467.com/shantou/co/133938.htm
汕头市万代玩具礼品有限公司的商铺,http://shantou0133938.11467.com
汕头市澄海区莲下诚德塑料制品厂,http:////www.11467.com/shantou/co/137352.htm
汕头市澄海区莲下诚德塑料制品厂的商铺,http://shantou0137352.11467.com
汕头市协群玩具厂,http:////www.11467.com/shantou/co/141278.htm
汕头市协群玩具厂的商铺,http://shantou0141278.11467.com
汕头市澄海区博希玩具厂,http:////www.11467.com/shantou/co/137336.htm
汕头市澄海区博希玩具厂的商铺,http://shantou0137336.11467.com
北京文达玩具有限责任公司,http:////www.11467.com/beijing/co/187362.htm
北京文达玩具有限责任公司的商铺,http://beijing0187362.11467.com
北京永诚信通贸易有限公司,http:////www.11467.com/beijing/co/398937.htm
北京永诚信通贸易有限公司的商铺,http://beijing0398937.11467.com
澄海悦乐玩具批发有限公司,http:////www.11467.com/shantou/co/168495.htm
澄海悦乐玩具批发有限公司的商铺,http://shantou0168495.11467.com
驻马店驿城区国龙玩具厂,http:////www.11467.com/zhumadian/co/37985.htm
驻马店驿城区国龙玩具厂的商铺,http://zhumadian037985.11467.com
汕头市澄海区雅艺室内装饰设计工作室,http:////www.11467.com/shantou/co/152122.htm
汕头市澄海区雅艺室内装饰设计工作室的商铺,http://shantou0152122.11467.com
邢台市宝康自行车有限公司,http:////www.11467.com/xintai/co/39192.htm
邢台市宝康自行车有限公司的商铺,http://xintai039192.11467.com
深圳市恒易拓塑胶模具有限公司,http:////www.11467.com/shenzhen/co/810102.htm
深圳市恒易拓塑胶模具有限公司的商铺,http://shenzhen0810102.11467.com
汕头市澄海区智多星玩具礼品有限公司,http:////www.11467.com/shantou/co/117829.htm
汕头市澄海区智多星玩具礼品有限公司的商铺,http://shantou0117829.11467.com
佛山市南海区国庭童车商行,http:////www.11467.com/foshan/co/280499.htm
佛山市南海区国庭童车商行的商铺,http://foshan0280499.11467.com
东莞市德利压铸科技有限公司,http:////www.11467.com/dongguan/co/299327.htm
东莞市德利压铸科技有限公司的商铺,http://dongguan0299327.11467.com
汕头市澄海区华元工艺玩具厂,http:////www.11467.com/shantou/co/149978.htm
汕头市澄海区华元工艺玩具厂的商铺,http://shantou0149978.11467.com
中山市东升镇金多达橡胶制品厂,http:////www.11467.com/zhongshan/co/134997.htm
中山市东升镇金多达橡胶制品厂的商铺,http://zhongshan0134997.11467.com
荥阳祥宝游乐设备厂,http:////www.11467.com/zhengzhou/co/220270.htm
荥阳祥宝游乐设备厂的商铺,http://zhengzhou0220270.11467.com
深圳大成游乐设备有限公司,http:////www.11467.com/shenzhen/co/861171.htm
深圳大成游乐设备有限公司的商铺,http://shenzhen0861171.11467.com
绍兴县柯桥信销玩具店,http:////www.11467.com/shaoxing/co/127054.htm
绍兴县柯桥信销玩具店的商铺,http://shaoxing0127054.11467.com
深圳市遨蓝镜业有限公司,http:////www.11467.com/shenzhen/co/316438.htm
深圳市遨蓝镜业有限公司的商铺,http://shenzhen0316438.11467.com
深圳市宝安区新安宝创达电子经营部,http:////www.11467.com/shenzhen/co/389884.htm
深圳市宝安区新安宝创达电子经营部的商铺,http://shenzhen0389884.11467.com
深圳市致鑫泰环保胶粘制品有限公司,http:////www.11467.com/shenzhen/co/765324.htm
深圳市致鑫泰环保胶粘制品有限公司的商铺,http://shenzhen0765324.11467.com
永嘉县望迪游乐设备有限公司,http:////www.11467.com/wenzhou/co/213176.htm
永嘉县望迪游乐设备有限公司的商铺,http://wenzhou0213176.11467.com
东莞市东政化工有限公司,http:////www.11467.com/shenzhen/co/588956.htm
东莞市东政化工有限公司的商铺,http://shenzhen0588956.11467.com
深圳市华奥斯科技发展有限公司,http:////www.11467.com/shenzhen/co/812211.htm
深圳市华奥斯科技发展有限公司的商铺,http://shenzhen0812211.11467.com
广东永达利工贸有限公司,http:////www.11467.com/guangzhou/co/72829.htm
广东永达利工贸有限公司的商铺,http://guangzhou072829.11467.com
广州市越秀区志童玩具商行,http:////www.11467.com/guangzhou/co/390255.htm
广州市越秀区志童玩具商行的商铺,http://guangzhou0390255.11467.com
泉州市维士格机绣制品有限公司,http:////www.11467.com/quanzhou/co/139795.htm
泉州市维士格机绣制品有限公司的商铺,http://quanzhou0139795.11467.com
广州神童教育科技有限公司,http:////www.11467.com/guangzhou/co/432354.htm
广州神童教育科技有限公司的商铺,http://guangzhou0432354.11467.com
东莞市一佳玩具有限公司,http:////www.11467.com/dongguan/co/537591.htm
东莞市一佳玩具有限公司的商铺,http://dongguan0537591.11467.com
汕头市澄海区煜成塑料玩具厂,http:////www.11467.com/shantou/co/115679.htm
汕头市澄海区煜成塑料玩具厂的商铺,http://shantou0115679.11467.com
上虞市思睿伞业有限公司,http:////www.11467.com/shaoxing/co/110350.htm
上虞市思睿伞业有限公司的商铺,http://shaoxing0110350.11467.com
深圳市茂得林电子科技有限公司,http:////www.11467.com/shenzhen/co/224923.htm
深圳市茂得林电子科技有限公司的商铺,http://shenzhen0224923.11467.com
深圳市尊雷电子有限公司,http:////www.11467.com/shenzhen/co/381028.htm
深圳市尊雷电子有限公司的商铺,http://shenzhen0381028.11467.com
深圳市宝安区大浪诚润丝印移印器材经营部,http:////www.11467.com/shenzhen/co/105261.htm
深圳市宝安区大浪诚润丝印移印器材经营部的商铺,http://shenzhen0105261.11467.com
武汉川崎电子水泵制造有限公司,http:////www.11467.com/wuhan/co/116989.htm
武汉川崎电子水泵制造有限公司的商铺,http://wuhan0116989.11467.com
深圳市新乐美成人玩具有限公司,http:////www.11467.com/shenzhen/co/757879.htm
深圳市新乐美成人玩具有限公司的商铺,http://shenzhen0757879.11467.com
潮州市潮安区庵埠镇万彩玩具厂,http:////www.11467.com/chaozhou/co/49968.htm
潮州市潮安区庵埠镇万彩玩具厂的商铺,http://chaozhou049968.11467.com
信阳市浉河区方炜日常生活用品店,http:////www.11467.com/xinyang/co/40353.htm
信阳市浉河区方炜日常生活用品店的商铺,http://xinyang040353.11467.com
广州童声童色文化发展有限公司,http:////www.11467.com/guangzhou/co/745708.htm
广州童声童色文化发展有限公司的商铺,http://guangzhou0745708.11467.com
深圳市强流明光电有限公司,http:////www.11467.com/shenzhen/co/906284.htm
深圳市强流明光电有限公司的商铺,http://shenzhen0906284.11467.com
汕头市北北创意玩具有限公司,http:////www.11467.com/qiye/93172601.htm
汕头市北北创意玩具有限公司的商铺,http://93172601.b2b.11467.com
键乐宝电子玩具厂,http:////www.11467.com/shantou/co/144468.htm
郑州三乐玩具有限公司,http:////www.11467.com/zhengzhou/co/153774.htm
新疆自治区阿克苏地区阿拉尔市农大小市场三毛书屋,http:////www.11467.com/akesu/co/11297.htm
益天(个体经营),http:////www.11467.com/chizhou/co/8967.htm
东莞市塘厦彩润塑胶制品厂,http:////www.11467.com/dongguan/co/440930.htm
东莞祯时塑胶制品有限公司,http:////www.11467.com/dongguan/co/496241.htm
东莞市信源包装材料有限公司,http:////www.11467.com/dongguan/co/199537.htm
佛山市南海松岗鸿劲电池厂,http:////www.11467.com/guangzhou/co/288386.htm
广东飞轮科技实业有限公司,http:////www.11467.com/guangzhou/co/390171.htm
广州市奥奇气模广告有限公司,http:////www.11467.com/guangzhou/co/375757.htm
李兵,http:////www.11467.com/guangzhou/co/431705.htm
杭州琴侣工贸有限公司,http:////www.11467.com/hangzhou/co/292154.htm
河南鹤壁女裤专卖店,http:////www.11467.com/hebi/co/9646.htm
乘骑企业有限公司（台资）,http:////www.11467.com/hebi/co/9636.htm
盛林贸易有限公司,http:////www.11467.com/jincheng/co/18103.htm
湖北荆州创意工作室,http:////www.11467.com/jingzhou/co/28302.htm
浙江义乌苏文玩具有限公司,http:////www.11467.com/jinhua/co/127103.htm
海乐园工艺品有限公司,http:////www.11467.com/jinhua/co/123910.htm
个人经营/范佳丽,http:////www.11467.com/leshan/co/20765.htm
山西昌达铜乐器有限公司,http:////www.11467.com/lvliang/co/13909.htm
吕梁市抗旱技术服务部,http:////www.11467.com/lvliang/co/13901.htm
南京雨乐玩具有限公司南充分公司,http:////www.11467.com/nanchong/co/25401.htm
纯真玩具有限公司,http:////www.11467.com/nanyang/co/38656.htm
宁波东钱湖旅游度假区艾美保健品有限公司,http:////www.11467.com/ningbo/co/132395.htm
顶级中国巴哥犬繁殖基地,http:////www.11467.com/panjin/co/25297.htm
青岛裕隆工艺品有限公司,http:////www.11467.com/qingdao/co/124543.htm
虞城县新星工贸有限公司,http:////www.11467.com/shangqiu/co/18019.htm
澄海海隆达玩具厂,http:////www.11467.com/shantou/co/139187.htm
汕头市澄海区腾悦海棉厂,http:////www.11467.com/shantou/co/141250.htm
广东省汕头市澄海区ICAC贸易有限公司,http:////www.11467.com/shantou/co/151004.htm
汕头市龙佳玩具厂,http:////www.11467.com/shantou/co/151002.htm
汕头市东源轻工机械厂有限公司,http:////www.11467.com/shantou/co/76129.htm
绍兴市老台门鲁迅故里青年旅舍有限公司,http:////www.11467.com/shaoxing/co/86916.htm
抚顺合鼎电子玩具厂,http:////www.11467.com/shenyang/co/96779.htm
华联包装机械深圳销售公司,http:////www.11467.com/shenzhen/co/764548.htm
广东省深圳市龙华镇理想抄数设计公司,http:////www.11467.com/shenzhen/co/782744.htm
德亿诚印刷包装有限公司,http:////www.11467.com/shenzhen/co/764550.htm
美奇扭蛋玩具贸易（深圳）有限公司采购部,http:////www.11467.com/shenzhen/co/674784.htm
深圳宏盛龙腾电子有限公司,http:////www.11467.com/shenzhen/co/672109.htm
深圳市手足情文化艺术有限公司,http:////www.11467.com/shenzhen/co/764627.htm
天利煤矿电控设备有限公司,http:////www.11467.com/shuangyashang/co/9520.htm
康健塑料玩具厂,http:////www.11467.com/taizhou/co/101332.htm
永嘉戴尔乐教玩具厂,http:////www.11467.com/wenzhou/co/220154.htm
扬州天马玩具有限公司,http:////www.11467.com/yangzhou/co/87697.htm
金斗年【个体经营】,http:////www.11467.com/yuxi/co/16403.htm
王远澡(个体经营),http:////www.11467.com/zhangjiajie/co/8195.htm
广州宏雅贸易有限公司,http:////www.11467.com/guangzhou/co/130886.htm
温州爱思特集团有限公司,http:////www.11467.com/wenzhou/co/215945.htm
郑州金阳光玩具厂,http:////www.11467.com/zhengzhou/co/170785.htm
安阳桓睿仿真食品模型厂,http:////www.11467.com/anyang/co/36003.htm
福强儿童拨浪鼓制作厂,http:////www.11467.com/baoding/co/61805.htm
保定市南市区华阳五金商店,http:////www.11467.com/baoding/co/58614.htm
唐县天龙工艺品厂,http:////www.11467.com/baoding/co/80266.htm
容城县三禾玩具厂,http:////www.11467.com/baoding/co/64635.htm
长沙福豪工艺品贸易有限公司,http:////www.11467.com/changsha/co/54130.htm
常州帝帆散热电器有限公司,http:////www.11467.com/changzhou/co/143042.htm
潮安县雅利来食品有限公司,http:////www.11467.com/chaozhou/co/11750.htm
成都乐驰玩具厂,http:////www.11467.com/chengdu/co/129255.htm
瑞欣贸易有限公司,http:////www.11467.com/chengdu/co/129561.htm
郴州飞跃玩具贸易有限公司,http:////www.11467.com/chenzhou/co/23124.htm
大连阿波罗玩具有限公司,http:////www.11467.com/dalian/co/59916.htm
佳奇三维立体工作室,http:////www.11467.com/dandong/co/47947.htm
成都樱花鞋业,http:////www.11467.com/deyang/co/32565.htm
爱贝贝玩具销售公司,http:////www.11467.com/dezhou/co/49698.htm
寶信實業有限公司,http:////www.11467.com/dongguan/co/373180.htm
东莞昌明印刷有限公司,http:////www.11467.com/dongguan/co/11861.htm
东莞佳儿童用品有限公司,http:////www.11467.com/dongguan/co/371587.htm
东莞凤岗林茂搪胶玩具厂,http:////www.11467.com/dongguan/co/191651.htm
东莞东贸五金塑胶制品有限公司,http:////www.11467.com/dongguan/co/371429.htm
东莞世界纸品玩具制造有限公司,http:////www.11467.com/dongguan/co/419565.htm
东莞市爱歌母婴用品有限公司,http:////www.11467.com/dongguan/co/522740.htm
东莞市广发橡胶制品有限公司,http:////www.11467.com/dongguan/co/366439.htm
东莞市寮步宏晴灯饰配件厂,http:////www.11467.com/dongguan/co/410315.htm
东莞市寮步鸿海玻璃制品厂,http:////www.11467.com/dongguan/co/256436.htm
东莞市虎门金若祥植绒布商店,http:////www.11467.com/dongguan/co/323732.htm
东莞市塘厦虎印文具店,http:////www.11467.com/dongguan/co/27829.htm
东莞市石排华创电子材料厂,http:////www.11467.com/dongguan/co/173581.htm
东莞市天晶实业有限公司,http:////www.11467.com/dongguan/co/411551.htm
东莞市石排建立塑料加工店,http:////www.11467.com/dongguan/co/371403.htm
东莞市显泰塑胶五金实业有限公司,http:////www.11467.com/dongguan/co/426180.htm
东莞市沙田腾智手袋材料店,http:////www.11467.com/dongguan/co/218091.htm
东莞市志尚实业有限公司,http:////www.11467.com/dongguan/co/412797.htm
东莞市志远卡通服装有限公司,http:////www.11467.com/dongguan/co/371871.htm
揭西县卡斯特粘合剂厂,http:////www.11467.com/shenzhen/co/138527.htm
深圳市科达兴数码科技有限公司,http:////www.11467.com/shenzhen/co/333506.htm
深圳市宏盛龙腾电子有限公司（销售部）,http:////www.11467.com/shenzhen/co/671655.htm
中国广东深圳龙岗恒兴昌折叠凳厂,http:////www.11467.com/shenzhen/co/670677.htm
苏州南霸保健品有限公司,http:////www.11467.com/suzhou/co/314693.htm
苏州市嘉乐威企业发展有限公司,http:////www.11467.com/suzhou/co/259257.htm
平阳县瑞华工艺品厂,http:////www.11467.com/wenzhou/co/216365.htm
童童玩具有限公司销售部,http:////www.11467.com/wuxi/co/207785.htm
扬州福臻玩具有限公司,http:////www.11467.com/yangzhou/co/106764.htm
华豫游乐设备厂,http:////www.11467.com/zhengzhou/co/171494.htm
北京东方爱婴商贸有限公司,http:////www.11467.com/beijing/co/132777.htm
上海光乐玩具制造有限公司,http:////www.11467.com/shanghai/co/809636.htm
安徽创奇乐智能游乐设备有限公司,http:////www.11467.com/hefei/co/161476.htm
东莞志威塑胶五金玩具厂,http:////www.11467.com/dongguan/co/372045.htm
东莞市轩昂电子科技有限公司,http:////www.11467.com/dongguan/co/372792.htm
东莞市旺成动漫制品有限公司,http:////www.11467.com/dongguan/co/478703.htm
家寶玩具制品有限公司,http:////www.11467.com/dongguan/co/371908.htm
虎印印章制品有限公司,http:////www.11467.com/dongguan/co/373183.htm
零起点毛绒玩具有限公司,http:////www.11467.com/dongguan/co/372941.htm
鸿业电子厂,http:////www.11467.com/dongguan/co/373084.htm
嘉豪玩具制衣有限公司,http:////www.11467.com/dongguan/co/372926.htm
色士龙国际贸易香港有限公司,http:////www.11467.com/dongguan/co/372585.htm
東莞市中堂鎮集裘玩具制衣廠,http:////www.11467.com/dongguan/co/373338.htm
二甲硅油树脂雕塑材料厂,http:////www.11467.com/dongguan/co/372613.htm
盛发立塑胶玩具制品有限公司（诚立厂）,http:////www.11467.com/dongguan/co/371276.htm
艺嘉电子制品厂开发部,http:////www.11467.com/dongguan/co/372380.htm
生利文具厂,http:////www.11467.com/dongguan/co/372595.htm
宏贸运动用品有限公司 业务部,http:////www.11467.com/dongguan/co/372329.htm
