邓州市罗庄莲花神佛像工艺厂,http:////www.11467.com/qiye/93451685.htm
邓州市罗庄莲花神佛像工艺厂的商铺,http://93451685.b2b.11467.com
济宁市创达标牌制作有限公司,http:////www.11467.com/jining/co/47408.htm
秦皇岛市天耀玻璃有限公司,http:////www.11467.com/qinhuangdao/co/39023.htm
秦皇岛市天耀玻璃有限公司的商铺,http://qinhuangdao039023.11467.com
商丘市时代创新工业科技服务有限公司,http:////www.11467.com/shangqiu/co/16361.htm
商丘市时代创新工业科技服务有限公司的商铺,http://shangqiu016361.11467.com
阳东县祥兴美容用具制品有限公司,http:////www.11467.com/yangjiang/co/18391.htm
阳东县祥兴美容用具制品有限公司的商铺,http://yangjiang018391.11467.com
北京京冠卓艺商贸中心,http:////www.11467.com/beijing/co/24622.htm
北京京冠卓艺商贸中心的商铺,http://beijing024622.11467.com
江门保利派玻璃制品有限公司,http:////www.11467.com/jiangmen/co/82441.htm
江门保利派玻璃制品有限公司的商铺,http://jiangmen082441.11467.com
河间市博宇玻璃制品厂,http:////www.11467.com/cangzhou/co/42615.htm
河间市博宇玻璃制品厂的商铺,http://cangzhou042615.11467.com
东莞市万江汇展有机玻璃工艺品厂,http:////www.11467.com/dongguan/co/164442.htm
东莞市万江汇展有机玻璃工艺品厂的商铺,http://dongguan0164442.11467.com
安徽飞翔玻璃制造有限公司,http:////www.11467.com/bengbu/co/28572.htm
安徽飞翔玻璃制造有限公司的商铺,http://bengbu028572.11467.com
江门市江海区金达玻璃文化有限公司,http:////www.11467.com/jiangmen/co/84459.htm
江门市江海区金达玻璃文化有限公司的商铺,http://jiangmen084459.11467.com
广州市皆利贸易有限公司,http:////www.11467.com/guangzhou/co/161437.htm
广州市皆利贸易有限公司的商铺,http://guangzhou0161437.11467.com
安徽金冠玻璃有限责任公司,http:////www.11467.com/huaibei/co/12919.htm
安徽金冠玻璃有限责任公司的商铺,http://huaibei012919.11467.com
沈阳市昌昊玻璃制品有限公司,http:////www.11467.com/shenyang/co/17874.htm
沈阳市昌昊玻璃制品有限公司的商铺,http://shenyang017874.11467.com
泉州市鲤城区宏鑫玻璃工艺商行,http:////www.11467.com/quanzhou/co/95393.htm
泉州市鲤城区宏鑫玻璃工艺商行的商铺,http://quanzhou095393.11467.com
南昌昌雅有机玻璃制品厂,http:////www.11467.com/nanchang/co/93641.htm
南昌昌雅有机玻璃制品厂的商铺,http://nanchang093641.11467.com
陕宛电子经营部,http:////www.11467.com/nanyang/co/30209.htm
陕宛电子经营部的商铺,http://nanyang030209.11467.com
四川遂宁市华晶玻璃有限公司,http:////www.11467.com/suining/co/2869.htm
四川遂宁市华晶玻璃有限公司的商铺,http://suining02869.11467.com
梧州市瑞丰祥珠宝经营部,http:////www.11467.com/wuzhou/co/17055.htm
梧州市瑞丰祥珠宝经营部的商铺,http://wuzhou017055.11467.com
梧州市鑫煌宝石工艺加工行,http:////www.11467.com/wuzhou/co/16917.htm
梧州市鑫煌宝石工艺加工行的商铺,http://wuzhou016917.11467.com
邢台艺林玻璃制品有限公司,http:////www.11467.com/xintai/co/33223.htm
邢台艺林玻璃制品有限公司的商铺,http://xintai033223.11467.com
漳州顺圆盛佛具有限公司,http:////www.11467.com/zhangzhou/co/37255.htm
漳州顺圆盛佛具有限公司的商铺,http://zhangzhou037255.11467.com
徐州鸿源玻璃科技有限公司,http:////www.11467.com/xuzhou/co/58970.htm
徐州鸿源玻璃科技有限公司的商铺,http://xuzhou058970.11467.com
河间市天艺德工艺玻璃制品厂,http:////www.11467.com/cangzhou/co/125345.htm
河间市天艺德工艺玻璃制品厂的商铺,http://cangzhou0125345.11467.com
安徽发强玻璃有限责任公司,http:////www.11467.com/huainan/co/987.htm
安徽发强玻璃有限责任公司的商铺,http://huainan0987.11467.com
惠州市奇盛玻璃镜制品有限公司,http:////www.11467.com/huizhou/co/81903.htm
惠州市奇盛玻璃镜制品有限公司的商铺,http://huizhou081903.11467.com
昆山市新思维精密自动化设备有限公司,http:////www.11467.com/suzhou/co/314707.htm
昆山市新思维精密自动化设备有限公司的商铺,http://suzhou0314707.11467.com
义乌黑夜烟具商行,http:////www.11467.com/jinhua/co/212271.htm
义乌黑夜烟具商行的商铺,http://jinhua0212271.11467.com
安徽省宣城恒泰钢化玻璃制品有限公司,http:////www.11467.com/xuancheng/co/19857.htm
安徽省宣城恒泰钢化玻璃制品有限公司的商铺,http://xuancheng019857.11467.com
阳江卓越有机玻璃制品有限公司,http:////www.11467.com/yangjiang/co/17163.htm
阳江卓越有机玻璃制品有限公司的商铺,http://yangjiang017163.11467.com
江苏宏康玻璃制品有限公司,http:////www.11467.com/xuzhou/co/80514.htm
江苏宏康玻璃制品有限公司的商铺,http://xuzhou080514.11467.com
广州精汇琉璃工艺品有限公司,http:////www.11467.com/guangzhou/co/701843.htm
广州精汇琉璃工艺品有限公司的商铺,http://guangzhou0701843.11467.com
蚌埠数驰橡塑科技有限公司,http:////www.11467.com/bengbu/co/35803.htm
蚌埠数驰橡塑科技有限公司的商铺,http://bengbu035803.11467.com
常州惟德展示展览器材有限公司,http:////www.11467.com/yangzhou/co/109051.htm
常州惟德展示展览器材有限公司的商铺,http://yangzhou0109051.11467.com
山东创丰玻璃制品有限公司,http:////www.11467.com/zibo/co/117281.htm
山东创丰玻璃制品有限公司的商铺,http://zibo0117281.11467.com
徐州宾朋包装制品有限公司,http:////www.11467.com/xuzhou/co/78590.htm
徐州宾朋包装制品有限公司的商铺,http://xuzhou078590.11467.com
日照大创塑料制品有限公司,http:////www.11467.com/rizhao/co/11901.htm
日照大创塑料制品有限公司的商铺,http://rizhao011901.11467.com
深圳市戴梦妮宝来科技有限公司,http:////www.11467.com/shenzhen/co/774938.htm
深圳市戴梦妮宝来科技有限公司的商铺,http://shenzhen0774938.11467.com
盘锦六喜贸易有限公司,http:////www.11467.com/panjin/co/14188.htm
盘锦六喜贸易有限公司的商铺,http://panjin014188.11467.com
湘潭市松山仪器有限公司,http:////www.11467.com/xiangtan/co/26512.htm
湘潭市松山仪器有限公司的商铺,http://xiangtan026512.11467.com
山西上卓玻璃制品有限公司,http:////www.11467.com/taiyuan/co/106808.htm
山西上卓玻璃制品有限公司的商铺,http://taiyuan0106808.11467.com
东莞市锐创有机玻璃有限公司,http:////www.11467.com/dongguan/co/414517.htm
东莞市锐创有机玻璃有限公司的商铺,http://dongguan0414517.11467.com
徐州尚澳玻璃制品有限公司,http:////www.11467.com/xuzhou/co/63927.htm
徐州尚澳玻璃制品有限公司的商铺,http://xuzhou063927.11467.com
广州雅颜清照化妆品有限公司,http:////www.11467.com/guangzhou/co/494663.htm
广州雅颜清照化妆品有限公司的商铺,http://guangzhou0494663.11467.com
蚌埠馨宇佳贸易有限公司,http:////www.11467.com/bengbu/co/35753.htm
蚌埠馨宇佳贸易有限公司的商铺,http://bengbu035753.11467.com
郓城县盛树包装厂,http:////www.11467.com/heze/co/43023.htm
郓城县盛树包装厂的商铺,http://heze043023.11467.com
曹广英(个体经营),http:////www.11467.com/linyi/co/106941.htm
曹广英(个体经营)的商铺,http://linyi0106941.11467.com
平阳县恩泽工艺品厂,http:////www.11467.com/wenzhou/co/170311.htm
平阳县恩泽工艺品厂的商铺,http://wenzhou0170311.11467.com
泉州一品工坊玻璃制品有限公司,http:////www.11467.com/quanzhou/co/125406.htm
泉州一品工坊玻璃制品有限公司的商铺,http://quanzhou0125406.11467.com
南京方向标礼品有限公司,http:////www.11467.com/nanjing/co/92959.htm
徐州天一玻璃制品有限公司,http:////www.11467.com/xuzhou/co/58151.htm
徐州天一玻璃制品有限公司的商铺,http://xuzhou058151.11467.com
莱芜市阳光玻璃有限公司,http:////www.11467.com/laiwu/co/6404.htm
莱芜市阳光玻璃有限公司的商铺,http://laiwu06404.11467.com
杭州顾得工艺品有限公司,http:////www.11467.com/hangzhou/co/222391.htm
杭州顾得工艺品有限公司的商铺,http://hangzhou0222391.11467.com
徐州前进玻璃瓶厂,http:////www.11467.com/xuzhou/co/20165.htm
徐州前进玻璃瓶厂的商铺,http://xuzhou020165.11467.com
宿迁市中健玻璃工艺有限公司,http:////www.11467.com/suqian/co/10341.htm
宿迁市中健玻璃工艺有限公司的商铺,http://suqian010341.11467.com
威海丽生玻璃制品有限公司,http:////www.11467.com/weihai/co/29016.htm
威海丽生玻璃制品有限公司的商铺,http://weihai029016.11467.com
芜湖市皖申玻璃有限公司,http:////www.11467.com/wuhu/co/21206.htm
芜湖市皖申玻璃有限公司的商铺,http://wuhu021206.11467.com
杭州笕桥木材市场何氏木材经营部,http:////www.11467.com/hangzhou/co/222380.htm
杭州笕桥木材市场何氏木材经营部的商铺,http://hangzhou0222380.11467.com
闻喜县晋鑫玻璃制品有限责任公司,http:////www.11467.com/guangzhou/co/161494.htm
闻喜县晋鑫玻璃制品有限责任公司的商铺,http://guangzhou0161494.11467.com
闻喜县新天玻璃器皿制造厂,http:////www.11467.com/guangzhou/co/161323.htm
闻喜县新天玻璃器皿制造厂的商铺,http://guangzhou0161323.11467.com
江西省华宏化工有限公司,http:////www.11467.com/nanchang/co/66461.htm
江西省华宏化工有限公司的商铺,http://nanchang066461.11467.com
蚌埠市成兴玻璃制品有限公司,http:////www.11467.com/bengbu/co/26475.htm
蚌埠市成兴玻璃制品有限公司的商铺,http://bengbu026475.11467.com
蚌埠市龙淮玻璃器皿有限公司,http:////www.11467.com/bengbu/co/26440.htm
蚌埠市龙淮玻璃器皿有限公司的商铺,http://bengbu026440.11467.com
沧州金凯玻璃工艺有限公司,http:////www.11467.com/cangzhou/co/5889.htm
沧州金凯玻璃工艺有限公司的商铺,http://cangzhou05889.11467.com
东莞市塘厦恒拓五金制品厂,http:////www.11467.com/dongguan/co/169039.htm
东莞市塘厦恒拓五金制品厂的商铺,http://dongguan0169039.11467.com
盐城市佳田工艺品有限公司,http:////www.11467.com/yancheng/co/58030.htm
盐城市佳田工艺品有限公司的商铺,http://yancheng058030.11467.com
枣庄市锦华镀膜玻璃有限公司,http:////www.11467.com/zaozhuang/co/833.htm
枣庄市锦华镀膜玻璃有限公司的商铺,http://zaozhuang0833.11467.com
珠海市信豪工艺有限公司,http:////www.11467.com/zhuhai/co/25622.htm
珠海市信豪工艺有限公司的商铺,http://zhuhai025622.11467.com
淄博汉唐有机玻璃有限公司,http:////www.11467.com/zibo/co/82261.htm
淄博汉唐有机玻璃有限公司的商铺,http://zibo082261.11467.com
山东淄博宝祥玻璃有限公司,http:////www.11467.com/zibo/co/82253.htm
山东淄博宝祥玻璃有限公司的商铺,http://zibo082253.11467.com
北京博达川工贸有限公司,http:////www.11467.com/beijing/co/603720.htm
北京博达川工贸有限公司的商铺,http://beijing0603720.11467.com
北京精创坊工艺制品有限公司,http:////www.11467.com/beijing/co/623736.htm
北京精创坊工艺制品有限公司的商铺,http://beijing0623736.11467.com
上海品正工贸有限公司,http:////www.11467.com/shanghai/co/424518.htm
上海品正工贸有限公司的商铺,http://shanghai0424518.11467.com
阜宁县益林华艺玻璃制品厂,http:////www.11467.com/yancheng/co/14638.htm
阜宁县益林华艺玻璃制品厂的商铺,http://yancheng014638.11467.com
嘉兴市成泰镜业有限公司,http:////www.11467.com/jiaxing/co/80400.htm
嘉兴市成泰镜业有限公司的商铺,http://jiaxing080400.11467.com
江门市蓬江区永运工艺制品厂有限公司,http:////www.11467.com/jiangmen/co/3673.htm
江门市蓬江区永运工艺制品厂有限公司的商铺,http://jiangmen03673.11467.com
廊坊志同玻璃微珠有限公司,http:////www.11467.com/langfang/co/47320.htm
廊坊志同玻璃微珠有限公司的商铺,http://langfang047320.11467.com
东莞市丰华亚克力镜片工艺有限公司,http:////www.11467.com/dongguan/co/184353.htm
东莞市丰华亚克力镜片工艺有限公司的商铺,http://dongguan0184353.11467.com
福建柏盛日用品有限公司,http:////www.11467.com/fuzhou/co/86566.htm
福建柏盛日用品有限公司的商铺,http://fuzhou086566.11467.com
沙河市沙贝尔玻璃有限公司,http:////www.11467.com/xintai/co/39405.htm
沙河市沙贝尔玻璃有限公司的商铺,http://xintai039405.11467.com
徐州天艺制盖有限公司,http:////www.11467.com/xuzhou/co/54186.htm
徐州天艺制盖有限公司的商铺,http://xuzhou054186.11467.com
仪征汇鑫玻璃钢有限公司,http:////www.11467.com/yangzhou/co/106327.htm
仪征汇鑫玻璃钢有限公司的商铺,http://yangzhou0106327.11467.com
徐州瑞泰玻璃瓶厂,http:////www.11467.com/xuzhou/co/34233.htm
徐州瑞泰玻璃瓶厂的商铺,http://xuzhou034233.11467.com
广州德琅菲玻璃有限公司,http:////www.11467.com/guangzhou/co/488548.htm
广州德琅菲玻璃有限公司的商铺,http://guangzhou0488548.11467.com
东莞市赛达玻璃制品有限公司,http:////www.11467.com/dongguan/co/412597.htm
东莞市赛达玻璃制品有限公司的商铺,http://dongguan0412597.11467.com
佛山市广佛塑胶实业有限公司,http:////www.11467.com/foshan/co/346203.htm
佛山市广佛塑胶实业有限公司的商铺,http://foshan0346203.11467.com
广州市艺攀玻璃工艺品有限公司,http:////www.11467.com/guangzhou/co/459141.htm
广州市艺攀玻璃工艺品有限公司的商铺,http://guangzhou0459141.11467.com
广州游氏货架有限公司,http:////www.11467.com/guangzhou/co/457585.htm
广州游氏货架有限公司的商铺,http://guangzhou0457585.11467.com
广州楚香工艺品有限公司,http:////www.11467.com/guangzhou/co/495237.htm
广州楚香工艺品有限公司的商铺,http://guangzhou0495237.11467.com
广州市谭禧工艺品有限公司,http:////www.11467.com/guangzhou/co/429111.htm
广州市谭禧工艺品有限公司的商铺,http://guangzhou0429111.11467.com
广州智森精品有限公司,http:////www.11467.com/guangzhou/co/161120.htm
广州智森精品有限公司的商铺,http://guangzhou0161120.11467.com
山东能源机械集团有限公司,http:////www.11467.com/baoding/co/91421.htm
山东能源机械集团有限公司的商铺,http://baoding091421.11467.com
南皮县金龙水银开关厂,http:////www.11467.com/cangzhou/co/46163.htm
南皮县金龙水银开关厂的商铺,http://cangzhou046163.11467.com
东莞市润滨实业有限公司,http:////www.11467.com/dongguan/co/488790.htm
东莞市润滨实业有限公司的商铺,http://dongguan0488790.11467.com
东莞市恒佳玻璃制品有限公司,http:////www.11467.com/dongguan/co/498135.htm
东莞市恒佳玻璃制品有限公司的商铺,http://dongguan0498135.11467.com
常州罗尔刚家居用品有限公司,http:////www.11467.com/changzhou/co/92976.htm
常州罗尔刚家居用品有限公司的商铺,http://changzhou092976.11467.com
深圳市骄阳展示用品有限公司,http:////www.11467.com/shenzhen/co/722210.htm
深圳市骄阳展示用品有限公司的商铺,http://shenzhen0722210.11467.com
深圳市金福嘉工艺品有限公司,http:////www.11467.com/shenzhen/co/728999.htm
深圳市金福嘉工艺品有限公司的商铺,http://shenzhen0728999.11467.com
深圳市天道琉璃工艺品有限公司,http:////www.11467.com/shenzhen/co/224201.htm
深圳市天道琉璃工艺品有限公司的商铺,http://shenzhen0224201.11467.com
建湖县君豪玻璃制品厂,http:////www.11467.com/yancheng/co/78554.htm
建湖县君豪玻璃制品厂的商铺,http://yancheng078554.11467.com
安徽省蚌埠晶盛家用器皿有限公司,http:////www.11467.com/bengbu/co/26750.htm
安徽省蚌埠晶盛家用器皿有限公司的商铺,http://bengbu026750.11467.com
广州市新稀冶金化工有限公司,http:////www.11467.com/guangzhou/co/91885.htm
广州市新稀冶金化工有限公司的商铺,http://guangzhou091885.11467.com
东莞市尖峰玻璃制品厂,http:////www.11467.com/dongguan/co/12480.htm
东莞市尖峰玻璃制品厂的商铺,http://dongguan012480.11467.com
众邦立体光栅材料厂,http:////www.11467.com/hebi/co/8358.htm
众邦立体光栅材料厂的商铺,http://hebi08358.11467.com
蚌埠市佳振玻璃制品厂,http:////www.11467.com/bengbu/co/26476.htm
蚌埠市佳振玻璃制品厂的商铺,http://bengbu026476.11467.com
东莞市大朗锦绣服装辅料店,http:////www.11467.com/dongguan/co/174403.htm
东莞市大朗锦绣服装辅料店的商铺,http://dongguan0174403.11467.com
潮州市枫溪区华辰陶瓷制作厂,http:////www.11467.com/chaozhou/co/25262.htm
潮州市枫溪区华辰陶瓷制作厂的商铺,http://chaozhou025262.11467.com
佛山市南海万诚玻璃工艺厂,http:////www.11467.com/foshan/co/208986.htm
佛山市南海万诚玻璃工艺厂的商铺,http://foshan0208986.11467.com
东莞市长安丽传水钻饰品商行,http:////www.11467.com/dongguan/co/164420.htm
东莞市长安丽传水钻饰品商行的商铺,http://dongguan0164420.11467.com
东莞市万江雁鹏化玻器材经营部,http:////www.11467.com/dongguan/co/164454.htm
东莞市万江雁鹏化玻器材经营部的商铺,http://dongguan0164454.11467.com
龙南县新辉工艺品厂,http:////www.11467.com/dongguan/co/164158.htm
龙南县新辉工艺品厂的商铺,http://dongguan0164158.11467.com
海洋明瑞玻璃工艺厂,http:////www.11467.com/dongguan/co/164273.htm
海洋明瑞玻璃工艺厂的商铺,http://dongguan0164273.11467.com
潮州市新伟成实业有限公司,http:////www.11467.com/chaozhou/co/26136.htm
潮州市新伟成实业有限公司的商铺,http://chaozhou026136.11467.com
大连蓝创玻璃制品有限公司,http:////www.11467.com/dalian/co/39118.htm
大连蓝创玻璃制品有限公司的商铺,http://dalian039118.11467.com
东莞市东城豪文玻璃商行,http:////www.11467.com/dongguan/co/164514.htm
东莞市东城豪文玻璃商行的商铺,http://dongguan0164514.11467.com
蚌埠市飞跃玻璃器皿有限公司,http:////www.11467.com/bengbu/co/26752.htm
蚌埠市飞跃玻璃器皿有限公司的商铺,http://bengbu026752.11467.com
蚌埠市鑫业玻璃器皿有限公司,http:////www.11467.com/bengbu/co/26478.htm
蚌埠市鑫业玻璃器皿有限公司的商铺,http://bengbu026478.11467.com
蚌埠市前力玻璃制品厂,http:////www.11467.com/bengbu/co/26751.htm
蚌埠市前力玻璃制品厂的商铺,http://bengbu026751.11467.com
东莞市和溢印刷有限公司,http:////www.11467.com/dongguan/co/164701.htm
东莞市和溢印刷有限公司的商铺,http://dongguan0164701.11467.com
东莞市樟木头美德利电子辅料经营部,http:////www.11467.com/dongguan/co/164602.htm
东莞市樟木头美德利电子辅料经营部的商铺,http://dongguan0164602.11467.com
东莞市凯鸿包装制品厂,http:////www.11467.com/dongguan/co/491143.htm
东莞市凯鸿包装制品厂的商铺,http://dongguan0491143.11467.com
盐城缤纷饰品厂,http:////www.11467.com/yancheng/co/61059.htm
盐城缤纷饰品厂的商铺,http://yancheng061059.11467.com
东莞联兴亚克力厂,http:////www.11467.com/dongguan/co/413848.htm
东莞联兴亚克力厂的商铺,http://dongguan0413848.11467.com
东莞丰华有机玻璃厂,http:////www.11467.com/dongguan/co/413849.htm
东莞丰华有机玻璃厂的商铺,http://dongguan0413849.11467.com
东莞丰华亚克力镜片材料有限公司,http:////www.11467.com/dongguan/co/413850.htm
东莞丰华亚克力镜片材料有限公司的商铺,http://dongguan0413850.11467.com
长春赫特经贸有限责任公司,http:////www.11467.com/changchun/co/70637.htm
长春赫特经贸有限责任公司的商铺,http://changchun070637.11467.com
东莞市精锋玻璃制品有限公司,http:////www.11467.com/dongguan/co/488273.htm
东莞市精锋玻璃制品有限公司的商铺,http://dongguan0488273.11467.com
东莞市嘉顺手袋配件有限公司,http:////www.11467.com/dongguan/co/147940.htm
东莞市嘉顺手袋配件有限公司的商铺,http://dongguan0147940.11467.com
东光县立恒制镜厂,http:////www.11467.com/cangzhou/co/67934.htm
东光县立恒制镜厂的商铺,http://cangzhou067934.11467.com
天津市武清区安妮琉璃工艺品厂,http:////www.11467.com/tianjin/co/180756.htm
天津市武清区安妮琉璃工艺品厂的商铺,http://tianjin0180756.11467.com
河北碧海佳玉玻璃工艺制品有限公司,http:////www.11467.com/cangzhou/co/60966.htm
河北碧海佳玉玻璃工艺制品有限公司的商铺,http://cangzhou060966.11467.com
西安钢化玻璃有限公司,http:////www.11467.com/xian/co/95884.htm
西安钢化玻璃有限公司的商铺,http://xian095884.11467.com
淄博振华玻璃制品有限公司,http:////www.11467.com/zibo/co/93361.htm
淄博振华玻璃制品有限公司的商铺,http://zibo093361.11467.com
佛山市南海区乐赢工艺厂,http:////www.11467.com/foshan/co/248362.htm
佛山市南海区乐赢工艺厂的商铺,http://foshan0248362.11467.com
蔡志想(个体经营),http:////www.11467.com/cangzhou/co/67744.htm
蔡志想(个体经营)的商铺,http://cangzhou067744.11467.com
蚌埠晶盛家用器皿有限公司,http:////www.11467.com/bengbu/co/26791.htm
蚌埠晶盛家用器皿有限公司的商铺,http://bengbu026791.11467.com
湖北武汉鱼缸定做有限公司,http:////www.11467.com/wuhan/co/117760.htm
湖北武汉鱼缸定做有限公司的商铺,http://wuhan0117760.11467.com
鹤壁市开发区众邦立体光栅材料厂,http:////www.11467.com/hebi/co/10116.htm
鹤壁市开发区众邦立体光栅材料厂的商铺,http://hebi010116.11467.com
深圳市欣博辉工艺制品有限公司,http:////www.11467.com/shenzhen/co/782896.htm
深圳市欣博辉工艺制品有限公司的商铺,http://shenzhen0782896.11467.com
东莞市大岭山艺新有机玻璃加工店,http:////www.11467.com/dongguan/co/185704.htm
东莞市大岭山艺新有机玻璃加工店的商铺,http://dongguan0185704.11467.com
东莞市慧立方雕塑艺术有限公司,http:////www.11467.com/dongguan/co/506439.htm
东莞市慧立方雕塑艺术有限公司的商铺,http://dongguan0506439.11467.com
东莞市东城鸿源玻璃制品加工厂,http:////www.11467.com/dongguan/co/465123.htm
东莞市东城鸿源玻璃制品加工厂的商铺,http://dongguan0465123.11467.com
东莞市亮彩水族用品有限公司,http:////www.11467.com/dongguan/co/491932.htm
东莞市亮彩水族用品有限公司的商铺,http://dongguan0491932.11467.com
东莞市石排茂鑫玻璃镜业制品厂,http:////www.11467.com/dongguan/co/556055.htm
东莞市石排茂鑫玻璃镜业制品厂的商铺,http://dongguan0556055.11467.com
东莞市常平智胜工艺制品厂,http:////www.11467.com/dongguan/co/490096.htm
东莞市常平智胜工艺制品厂的商铺,http://dongguan0490096.11467.com
东莞市樟木头嘉美镜片销售部,http:////www.11467.com/dongguan/co/491503.htm
东莞市樟木头嘉美镜片销售部的商铺,http://dongguan0491503.11467.com
佛山市顺德区粤源轩家具有限公司,http:////www.11467.com/foshan/co/338072.htm
佛山市顺德区粤源轩家具有限公司的商铺,http://foshan0338072.11467.com
佛山万光照明工程有限公司,http:////www.11467.com/foshan/co/262910.htm
佛山万光照明工程有限公司的商铺,http://foshan0262910.11467.com
孙海洋（个体经营）,http:////www.11467.com/dalian/co/65967.htm
安徽鑫一达玻璃制品有限公司,http:////www.11467.com/bengbu/co/30011.htm
广州好格极工艺品有限公司,http:////www.11467.com/guangzhou/co/495210.htm
广州好格极工艺品有限公司的商铺,http://guangzhou0495210.11467.com
广州市鸿鼎景观设计工程有限公司,http:////www.11467.com/guangzhou/co/478177.htm
广州市鸿鼎景观设计工程有限公司的商铺,http://guangzhou0478177.11467.com
杭州豪曼装饰品有限公司,http:////www.11467.com/hangzhou/co/222421.htm
杭州豪曼装饰品有限公司的商铺,http://hangzhou0222421.11467.com
惠州市惠城区福欣喷砂加工厂,http:////www.11467.com/huizhou/co/57688.htm
惠州市惠城区福欣喷砂加工厂的商铺,http://huizhou057688.11467.com
惠州市惠城区陈江拓维艺术玻璃厂,http:////www.11467.com/huizhou/co/64634.htm
惠州市惠城区陈江拓维艺术玻璃厂的商铺,http://huizhou064634.11467.com
深圳市佳迈兴电子材料有限公司,http:////www.11467.com/shenzhen/co/812168.htm
深圳市佳迈兴电子材料有限公司的商铺,http://shenzhen0812168.11467.com
泉州市丰泽北峰聚益美工厂,http:////www.11467.com/quanzhou/co/83297.htm
泉州市丰泽北峰聚益美工厂的商铺,http://quanzhou083297.11467.com
广州鸿丰模特道具有限公司销售部,http:////www.11467.com/jiangmen/co/84492.htm
广州鸿丰模特道具有限公司销售部的商铺,http://jiangmen084492.11467.com
蒋拥明（个体经营）,http:////www.11467.com/jiangmen/co/84443.htm
蒋拥明（个体经营）的商铺,http://jiangmen084443.11467.com
临沂茂鑫杯业商行,http:////www.11467.com/linyi/co/67702.htm
临沂茂鑫杯业商行的商铺,http://linyi067702.11467.com
桐庐高翔金峰玻璃仪器厂,http:////www.11467.com/hangzhou/co/222372.htm
桐庐高翔金峰玻璃仪器厂的商铺,http://hangzhou0222372.11467.com
广州英杰玻璃镜业有限公司,http:////www.11467.com/guangzhou/co/161009.htm
广州英杰玻璃镜业有限公司的商铺,http://guangzhou0161009.11467.com
史登科(个体经营）,http:////www.11467.com/guangzhou/co/161501.htm
