新乡市新博玻璃石英制品有限公司,http:////www.11467.com/xinxiang/co/22530.htm
新乡市新博玻璃石英制品有限公司的商铺,http://xinxiang022530.11467.com
鹿泉区汇海玻璃经销处,http:////www.11467.com/qiye/93356527.htm
秦皇岛市天耀玻璃有限公司,http:////www.11467.com/qinhuangdao/co/39023.htm
秦皇岛市天耀玻璃有限公司的商铺,http://qinhuangdao039023.11467.com
湛江市炜明钢化玻璃有限公司,http:////www.11467.com/zhanjiang/co/44265.htm
湛江市炜明钢化玻璃有限公司的商铺,http://zhanjiang044265.11467.com
承德新羲玻璃技术有限公司,http:////www.11467.com/chengde/co/34725.htm
承德新羲玻璃技术有限公司的商铺,http://chengde034725.11467.com
广州市恒誉玻璃瓶电镀烤漆有限公司,http:////www.11467.com/guangzhou/co/506869.htm
广州市恒誉玻璃瓶电镀烤漆有限公司的商铺,http://guangzhou0506869.11467.com
秦皇岛温尔工贸有限公司,http:////www.11467.com/qinhuangdao/co/35827.htm
秦皇岛温尔工贸有限公司的商铺,http://qinhuangdao035827.11467.com
蚌埠朝阳玻璃机械有限公司,http:////www.11467.com/bengbu/co/26306.htm
蚌埠朝阳玻璃机械有限公司的商铺,http://bengbu026306.11467.com
南京新富瑞玻璃实业有限公司,http:////www.11467.com/nanjing/co/90152.htm
南京新富瑞玻璃实业有限公司的商铺,http://nanjing090152.11467.com
秦皇岛世海达益玻璃进出口有限公司,http:////www.11467.com/qinhuangdao/co/36270.htm
秦皇岛世海达益玻璃进出口有限公司的商铺,http://qinhuangdao036270.11467.com
徐州鸿源玻璃科技有限公司,http:////www.11467.com/xuzhou/co/58970.htm
徐州鸿源玻璃科技有限公司的商铺,http://xuzhou058970.11467.com
济宁市恒久光电有限公司,http:////www.11467.com/jining/co/47679.htm
济宁市恒久光电有限公司的商铺,http://jining047679.11467.com
东阿县鼎盛玻璃球有限公司,http:////www.11467.com/liaocheng/co/26493.htm
东阿县鼎盛玻璃球有限公司的商铺,http://liaocheng026493.11467.com
蚌埠市龙淮玻璃器皿有限公司,http:////www.11467.com/bengbu/co/26440.htm
蚌埠市龙淮玻璃器皿有限公司的商铺,http://bengbu026440.11467.com
承德市吉福特玻璃礼品有限责任公司,http:////www.11467.com/chengde/co/19089.htm
承德市吉福特玻璃礼品有限责任公司的商铺,http://chengde019089.11467.com
佛山市禅城区华兴科业钢化玻璃厂,http:////www.11467.com/foshan/co/219488.htm
佛山市禅城区华兴科业钢化玻璃厂的商铺,http://foshan0219488.11467.com
安徽浙安玻璃有限公司,http:////www.11467.com/hefei/co/82336.htm
安徽浙安玻璃有限公司的商铺,http://hefei082336.11467.com
上海玻晶光学元件有限公司,http:////www.11467.com/shanghai/co/1275052.htm
上海玻晶光学元件有限公司的商铺,http://shanghai01275052.11467.com
洛阳霞光水族技术玻璃有限公司,http:////www.11467.com/luoyang/co/9351.htm
洛阳霞光水族技术玻璃有限公司的商铺,http://luoyang09351.11467.com
南昌市晶思特玻璃有限公司,http:////www.11467.com/nanchang/co/86415.htm
南昌市晶思特玻璃有限公司的商铺,http://nanchang086415.11467.com
连云港连信石英科技有限公司,http:////www.11467.com/lianyungang/co/28364.htm
连云港连信石英科技有限公司的商铺,http://lianyungang028364.11467.com
美枫实业有限公司,http:////www.11467.com/daqing/co/39317.htm
美枫实业有限公司的商铺,http://daqing039317.11467.com
安徽省宣城恒泰钢化玻璃制品有限公司,http:////www.11467.com/xuancheng/co/19857.htm
安徽省宣城恒泰钢化玻璃制品有限公司的商铺,http://xuancheng019857.11467.com
东莞市诚卓光电科技有限公司,http:////www.11467.com/dongguan/co/70204.htm
东莞市诚卓光电科技有限公司的商铺,http://dongguan070204.11467.com
江阴泰榕镀膜玻璃有限公司,http:////www.11467.com/wuxi/co/274364.htm
江阴泰榕镀膜玻璃有限公司的商铺,http://wuxi0274364.11467.com
齐齐哈尔恒盛玻璃制品加工有限公司,http:////www.11467.com/qiqihaer/co/67364.htm
齐齐哈尔恒盛玻璃制品加工有限公司的商铺,http://qiqihaer067364.11467.com
江苏宏康玻璃制品有限公司,http:////www.11467.com/xuzhou/co/80514.htm
江苏宏康玻璃制品有限公司的商铺,http://xuzhou080514.11467.com
连云港海盛石英科技有限公司,http:////www.11467.com/lianyungang/co/20688.htm
连云港海盛石英科技有限公司的商铺,http://lianyungang020688.11467.com
聊城市开发区晟普诺新能源有限公司,http:////www.11467.com/liaocheng/co/39060.htm
聊城市开发区晟普诺新能源有限公司的商铺,http://liaocheng039060.11467.com
深圳市金成展示制品有限公司,http:////www.11467.com/shenzhen/co/258171.htm
深圳市金成展示制品有限公司的商铺,http://shenzhen0258171.11467.com
深圳市燎原玻璃有限公司,http:////www.11467.com/shenzhen/co/390339.htm
深圳市燎原玻璃有限公司的商铺,http://shenzhen0390339.11467.com
广州市婼雅玻璃制品有限公司,http:////www.11467.com/guangzhou/co/433739.htm
广州市婼雅玻璃制品有限公司的商铺,http://guangzhou0433739.11467.com
徐州宾朋包装制品有限公司,http:////www.11467.com/xuzhou/co/78590.htm
徐州宾朋包装制品有限公司的商铺,http://xuzhou078590.11467.com
广州市艺攀玻璃工艺品有限公司,http:////www.11467.com/guangzhou/co/459141.htm
广州市艺攀玻璃工艺品有限公司的商铺,http://guangzhou0459141.11467.com
上海多林化工科技有限公司,http:////www.11467.com/foshan/co/212087.htm
上海多林化工科技有限公司的商铺,http://foshan0212087.11467.com
福建省好自然建材有限公司,http:////www.11467.com/fuzhou/co/139153.htm
福建省好自然建材有限公司的商铺,http://fuzhou0139153.11467.com
广州德琅菲玻璃有限公司,http:////www.11467.com/guangzhou/co/488548.htm
广州德琅菲玻璃有限公司的商铺,http://guangzhou0488548.11467.com
东莞市赛达玻璃制品有限公司,http:////www.11467.com/dongguan/co/412597.htm
东莞市赛达玻璃制品有限公司的商铺,http://dongguan0412597.11467.com
东莞市灯锋光学科技有限公司,http:////www.11467.com/dongguan/co/499328.htm
东莞市灯锋光学科技有限公司的商铺,http://dongguan0499328.11467.com
徐州尚澳玻璃制品有限公司,http:////www.11467.com/xuzhou/co/63927.htm
徐州尚澳玻璃制品有限公司的商铺,http://xuzhou063927.11467.com
东海县昊天石英玻璃制品有限公司,http:////www.11467.com/lianyungang/co/33083.htm
东海县昊天石英玻璃制品有限公司的商铺,http://lianyungang033083.11467.com
东莞市凤岗天昊磨料经营部,http:////www.11467.com/dongguan/co/385261.htm
东莞市凤岗天昊磨料经营部的商铺,http://dongguan0385261.11467.com
东莞市鑫华玻璃工艺制品有限公司,http:////www.11467.com/dongguan/co/411751.htm
东莞市鑫华玻璃工艺制品有限公司的商铺,http://dongguan0411751.11467.com
山东郓城瑞升玻璃有限公司,http:////www.11467.com/heze/co/34173.htm
山东郓城瑞升玻璃有限公司的商铺,http://heze034173.11467.com
郓城县亿昌包装有限公司,http:////www.11467.com/heze/co/43016.htm
郓城县亿昌包装有限公司的商铺,http://heze043016.11467.com
大庆百横玻璃制品有限公司,http:////www.11467.com/daqing/co/45708.htm
大庆百横玻璃制品有限公司的商铺,http://daqing045708.11467.com
恒昌光学玻璃电染颜色制品厂,http:////www.11467.com/shenzhen/co/1003754.htm
恒昌光学玻璃电染颜色制品厂的商铺,http://shenzhen01003754.11467.com
上海星鲨玻璃科技有限公司,http:////www.11467.com/shanghai/co/898279.htm
大连海达玻璃集团有限公司,http:////www.11467.com/dalian/co/66170.htm
安徽泓湖玻璃有限公司,http:////www.11467.com/hefei/co/154658.htm
安徽泓湖玻璃有限公司的商铺,http://hefei0154658.11467.com
苏州水之恋水族制品厂,http:////www.11467.com/suzhou/co/218279.htm
苏州水之恋水族制品厂的商铺,http://suzhou0218279.11467.com
东莞市寮步月光烫画厂,http:////www.11467.com/dongguan/co/410537.htm
东莞市寮步月光烫画厂的商铺,http://dongguan0410537.11467.com
徐州天一玻璃制品有限公司,http:////www.11467.com/xuzhou/co/58151.htm
徐州天一玻璃制品有限公司的商铺,http://xuzhou058151.11467.com
重庆宝兴玻璃制品有限公司,http:////www.11467.com/chongqing/co/41839.htm
重庆宝兴玻璃制品有限公司的商铺,http://chongqing041839.11467.com
唐山澳晶陶瓷有限公司,http:////www.11467.com/tangshan/co/53735.htm
唐山澳晶陶瓷有限公司的商铺,http://tangshan053735.11467.com
秦皇岛市奥弘玻璃有限公司,http:////www.11467.com/qinhuangdao/co/33397.htm
秦皇岛市奥弘玻璃有限公司的商铺,http://qinhuangdao033397.11467.com
佛山市南海万诚玻璃工艺厂,http:////www.11467.com/foshan/co/208986.htm
佛山市南海万诚玻璃工艺厂的商铺,http://foshan0208986.11467.com
蚌埠市鹏飞工艺玻璃器皿厂,http:////www.11467.com/bengbu/co/26438.htm
蚌埠市鹏飞工艺玻璃器皿厂的商铺,http://bengbu026438.11467.com
长春久盛光电有限公司,http:////www.11467.com/changchun/co/76481.htm
长春久盛光电有限公司的商铺,http://changchun076481.11467.com
徐州宏达玻璃制瓶有限公司,http:////www.11467.com/xuzhou/co/51864.htm
徐州宏达玻璃制瓶有限公司的商铺,http://xuzhou051864.11467.com
上海兰泽装饰玻璃有限公司,http:////www.11467.com/shanghai/co/802888.htm
上海兰泽装饰玻璃有限公司的商铺,http://shanghai0802888.11467.com
佛山市顺德区北滘镇顺明丰玻璃工艺制品厂,http:////www.11467.com/foshan/co/6647.htm
佛山市顺德区北滘镇顺明丰玻璃工艺制品厂的商铺,http://foshan06647.11467.com
沈阳市泰普玻璃制品厂,http:////www.11467.com/shenyang/co/56856.htm
沈阳市泰普玻璃制品厂的商铺,http://shenyang056856.11467.com
东莞市虎门虎悦五金加工店,http:////www.11467.com/dongguan/co/410591.htm
东莞市虎门虎悦五金加工店的商铺,http://dongguan0410591.11467.com
东莞市彩润数码印花科技有限公司,http:////www.11467.com/dongguan/co/551274.htm
东莞市彩润数码印花科技有限公司的商铺,http://dongguan0551274.11467.com
厦门益唯特玻璃有限公司,http:////www.11467.com/xiamen/co/93081.htm
厦门益唯特玻璃有限公司的商铺,http://xiamen093081.11467.com
厦门永益耐高温玻璃厂,http:////www.11467.com/xiamen/co/86053.htm
厦门永益耐高温玻璃厂的商铺,http://xiamen086053.11467.com
深圳建明广告有限公司,http:////www.11467.com/shenzhen/co/756962.htm
深圳建明广告有限公司的商铺,http://shenzhen0756962.11467.com
东莞市精锋玻璃制品有限公司,http:////www.11467.com/dongguan/co/488273.htm
东莞市精锋玻璃制品有限公司的商铺,http://dongguan0488273.11467.com
佛山市顺德区伦教海诚达玻璃机械配件店,http:////www.11467.com/foshan/co/184863.htm
佛山市顺德区伦教海诚达玻璃机械配件店的商铺,http://foshan0184863.11467.com
沙河市沙贝尔玻璃有限公司,http:////www.11467.com/xintai/co/39405.htm
沙河市沙贝尔玻璃有限公司的商铺,http://xintai039405.11467.com
北京华翔博源玻璃有限公司,http:////www.11467.com/beijing/co/85239.htm
北京华翔博源玻璃有限公司的商铺,http://beijing085239.11467.com
东莞市万江晶亮玻璃加工厂,http:////www.11467.com/dongguan/co/313312.htm
东莞市万江晶亮玻璃加工厂的商铺,http://dongguan0313312.11467.com
东光县立恒制镜厂,http:////www.11467.com/cangzhou/co/67934.htm
东光县立恒制镜厂的商铺,http://cangzhou067934.11467.com
天长市金桥分析仪器厂,http:////www.11467.com/chuzhou/co/30335.htm
天长市金桥分析仪器厂的商铺,http://chuzhou030335.11467.com
沧州市新华区锡鑫焊接材料经销处,http:////www.11467.com/cangzhou/co/68016.htm
沧州市新华区锡鑫焊接材料经销处的商铺,http://cangzhou068016.11467.com
河间市双民玻璃制品有限公司,http:////www.11467.com/cangzhou/co/46477.htm
河间市双民玻璃制品有限公司的商铺,http://cangzhou046477.11467.com
众邦立体材料厂,http:////www.11467.com/hebi/co/11514.htm
众邦立体材料厂的商铺,http://hebi011514.11467.com
东莞市恒和昌玻璃有限公司,http:////www.11467.com/dongguan/co/187304.htm
东莞市恒和昌玻璃有限公司的商铺,http://dongguan0187304.11467.com
东莞市万江新裕玻璃经营部,http:////www.11467.com/dongguan/co/410317.htm
东莞市万江新裕玻璃经营部的商铺,http://dongguan0410317.11467.com
东莞市常平久翔玻璃加工厂,http:////www.11467.com/dongguan/co/330841.htm
东莞市常平久翔玻璃加工厂的商铺,http://dongguan0330841.11467.com
东莞市新越激光雕刻有限公司,http:////www.11467.com/dongguan/co/457531.htm
东莞市新越激光雕刻有限公司的商铺,http://dongguan0457531.11467.com
徐州瑞泰玻璃瓶厂,http:////www.11467.com/xuzhou/co/34233.htm
徐州瑞泰玻璃瓶厂的商铺,http://xuzhou034233.11467.com
深圳市美杰有机玻璃制品有限公司,http:////www.11467.com/shenzhen/co/260766.htm
深圳市美杰有机玻璃制品有限公司的商铺,http://shenzhen0260766.11467.com
深圳市伟旭丞玻璃有限公司,http:////www.11467.com/shenzhen/co/723293.htm
深圳市伟旭丞玻璃有限公司的商铺,http://shenzhen0723293.11467.com
通州区兴东镇亿诺玻璃工艺厂,http:////www.11467.com/nantong/co/147575.htm
通州区兴东镇亿诺玻璃工艺厂的商铺,http://nantong0147575.11467.com
东莞市晶宏玻璃制品有限公司,http:////www.11467.com/dongguan/co/339668.htm
东莞市晶宏玻璃制品有限公司的商铺,http://dongguan0339668.11467.com
东莞市大岭山威泰玻璃厂,http:////www.11467.com/dongguan/co/183612.htm
东莞市大岭山威泰玻璃厂的商铺,http://dongguan0183612.11467.com
东莞市加孚润滑油科技有限公司,http:////www.11467.com/dongguan/co/459139.htm
东莞市加孚润滑油科技有限公司的商铺,http://dongguan0459139.11467.com
东莞市石排树颖塑胶制品厂,http:////www.11467.com/dongguan/co/542865.htm
东莞市石排树颖塑胶制品厂的商铺,http://dongguan0542865.11467.com
东莞市田旺光电贸易有限公司,http:////www.11467.com/dongguan/co/184810.htm
东莞市田旺光电贸易有限公司的商铺,http://dongguan0184810.11467.com
佛山市玻联玻璃工艺有限公司,http:////www.11467.com/foshan/co/333897.htm
佛山市玻联玻璃工艺有限公司的商铺,http://foshan0333897.11467.com
佛山市南海品益有机玻璃制品有限公司,http:////www.11467.com/foshan/co/306354.htm
佛山市南海品益有机玻璃制品有限公司的商铺,http://foshan0306354.11467.com
佛山市禅城区新房子窗饰道轨制品厂,http:////www.11467.com/foshan/co/247233.htm
佛山市禅城区新房子窗饰道轨制品厂的商铺,http://foshan0247233.11467.com
锦州市古塔区仁合石英玻璃仪器厂,http:////www.11467.com/jinzhou/co/45686.htm
锦州市古塔区仁合石英玻璃仪器厂的商铺,http://jinzhou045686.11467.com
河间市阿凡提工艺玻璃制品有限公司,http:////www.11467.com/cangzhou/co/62917.htm
河间市阿凡提工艺玻璃制品有限公司的商铺,http://cangzhou062917.11467.com
东莞市东城鸿源玻璃制品加工厂,http:////www.11467.com/dongguan/co/465123.htm
东莞市东城鸿源玻璃制品加工厂的商铺,http://dongguan0465123.11467.com
上海兴艺有机玻璃制品厂,http:////www.11467.com/shanghai/co/735925.htm
安阳市北关区海伦眼镜店,http:////www.11467.com/anyang/co/32302.htm
荆州市亿晶光电科技有限公司,http:////www.11467.com/jingzhou/co/29095.htm
徐州恒发玻璃制品有限公司,http:////www.11467.com/xuzhou/co/54196.htm
徐州恒发玻璃制品有限公司的商铺,http://xuzhou054196.11467.com
扬州奇特玻璃有限公司,http:////www.11467.com/yangzhou/co/79055.htm
扬州奇特玻璃有限公司的商铺,http://yangzhou079055.11467.com
烟台爱润经贸有限公司,http:////www.11467.com/yantai/co/121912.htm
烟台爱润经贸有限公司的商铺,http://yantai0121912.11467.com
太原聚豪伟业商贸有限公司,http:////www.11467.com/taiyuan/co/98115.htm
太原聚豪伟业商贸有限公司的商铺,http://taiyuan098115.11467.com
佛山市顺德区容桂鸿福玻璃制品厂,http:////www.11467.com/foshan/co/209045.htm
佛山市顺德区容桂鸿福玻璃制品厂的商铺,http://foshan0209045.11467.com
广州英杰玻璃镜业有限公司,http:////www.11467.com/guangzhou/co/161009.htm
广州英杰玻璃镜业有限公司的商铺,http://guangzhou0161009.11467.com
惠州市宝昱工艺制品有限公司,http:////www.11467.com/huizhou/co/62318.htm
惠州市宝昱工艺制品有限公司的商铺,http://huizhou062318.11467.com
江门市蓬江区力高玻璃制品有限公司,http:////www.11467.com/jiangmen/co/85649.htm
江门市蓬江区力高玻璃制品有限公司的商铺,http://jiangmen085649.11467.com
锦州市凌河区振兴石英玻璃仪器厂,http:////www.11467.com/jinzhou/co/8644.htm
锦州市凌河区振兴石英玻璃仪器厂的商铺,http://jinzhou08644.11467.com
绵阳市游仙区鸿鑫精加工厂,http:////www.11467.com/mianyang/co/21812.htm
绵阳市游仙区鸿鑫精加工厂的商铺,http://mianyang021812.11467.com
秦皇岛耀盛玻璃有限公司,http:////www.11467.com/qinhuangdao/co/5205.htm
秦皇岛耀盛玻璃有限公司的商铺,http://qinhuangdao05205.11467.com
秦皇岛开发区明昊特种玻璃有限公司,http:////www.11467.com/qinhuangdao/co/82.htm
秦皇岛开发区明昊特种玻璃有限公司的商铺,http://qinhuangdao082.11467.com
秦皇岛市大龙建材有限公司,http:////www.11467.com/qinhuangdao/co/30307.htm
秦皇岛市大龙建材有限公司的商铺,http://qinhuangdao030307.11467.com
沈阳市铁西区海益玻璃经销部,http:////www.11467.com/shenyang/co/55635.htm
沈阳市铁西区海益玻璃经销部的商铺,http://shenyang055635.11467.com
大丰市百美医疗器械有限公司,http:////www.11467.com/yancheng/co/54182.htm
大丰市百美医疗器械有限公司的商铺,http://yancheng054182.11467.com
深圳市金利华铭板科技有限公司,http:////www.11467.com/shenzhen/co/148285.htm
深圳市金利华铭板科技有限公司的商铺,http://shenzhen0148285.11467.com
深圳市朗视光学有限公司,http:////www.11467.com/shenzhen/co/148068.htm
深圳市朗视光学有限公司的商铺,http://shenzhen0148068.11467.com
秦皇岛永恒艺术玻璃加工有限公司,http:////www.11467.com/qinhuangdao/co/34190.htm
秦皇岛永恒艺术玻璃加工有限公司的商铺,http://qinhuangdao034190.11467.com
深圳晶天宇光电科技有限公司,http:////www.11467.com/shenzhen/co/726738.htm
深圳晶天宇光电科技有限公司的商铺,http://shenzhen0726738.11467.com
合肥瑶海区雅格工艺玻璃经营部,http:////www.11467.com/hefei/co/86190.htm
合肥瑶海区雅格工艺玻璃经营部的商铺,http://hefei086190.11467.com
武强县科析仪器仪表厂,http:////www.11467.com/hengshui/co/31944.htm
武强县科析仪器仪表厂的商铺,http://hengshui031944.11467.com
深圳市亮彩宏五交化商行,http:////www.11467.com/shenzhen/co/417912.htm
深圳市亮彩宏五交化商行的商铺,http://shenzhen0417912.11467.com
秦皇岛宇森玻璃改裁有限公司,http:////www.11467.com/qinhuangdao/co/34188.htm
秦皇岛宇森玻璃改裁有限公司的商铺,http://qinhuangdao034188.11467.com
深圳市鼎鑫盛光学科技有限公司,http:////www.11467.com/shenzhen/co/254409.htm
深圳市鼎鑫盛光学科技有限公司的商铺,http://shenzhen0254409.11467.com
深圳市鑫晨时代科技有限公司,http:////www.11467.com/shenzhen/co/810639.htm
深圳市鑫晨时代科技有限公司的商铺,http://shenzhen0810639.11467.com
福清合诚玻璃有限公司,http:////www.11467.com/fuzhou/co/180791.htm
福清合诚玻璃有限公司的商铺,http://fuzhou0180791.11467.com
杭州市下城区冰点制冷设备维修部,http:////www.11467.com/hangzhou/co/391050.htm
杭州市下城区冰点制冷设备维修部的商铺,http://hangzhou0391050.11467.com
深圳市安泉科技有限公司,http:////www.11467.com/shenzhen/co/227670.htm
深圳市安泉科技有限公司的商铺,http://shenzhen0227670.11467.com
盐城市盐都区兴福玻璃仪器厂,http:////www.11467.com/yancheng/co/55226.htm
盐城市盐都区兴福玻璃仪器厂的商铺,http://yancheng055226.11467.com
徐州尚礼礼品有限公司,http:////www.11467.com/xuzhou/co/63706.htm
徐州尚礼礼品有限公司的商铺,http://xuzhou063706.11467.com
秦皇岛狮腾玻璃有限公司,http:////www.11467.com/qinhuangdao/co/34197.htm
秦皇岛狮腾玻璃有限公司的商铺,http://qinhuangdao034197.11467.com
杭州精鼎玻璃制品有限公司,http:////www.11467.com/hangzhou/co/232918.htm
杭州精鼎玻璃制品有限公司的商铺,http://hangzhou0232918.11467.com
杭州旭冉科技有限公司,http:////www.11467.com/hangzhou/co/238494.htm
杭州旭冉科技有限公司的商铺,http://hangzhou0238494.11467.com
深圳市宝安区龙华长鸿玻璃表面加工厂,http:////www.11467.com/shenzhen/co/745326.htm
深圳市宝安区龙华长鸿玻璃表面加工厂的商铺,http://shenzhen0745326.11467.com
沙河市光锐钢化玻璃制品厂,http:////www.11467.com/xintai/co/53368.htm
沙河市光锐钢化玻璃制品厂的商铺,http://xintai053368.11467.com
徐州悦达玻璃制品有限公司,http:////www.11467.com/xuzhou/co/82917.htm
徐州悦达玻璃制品有限公司的商铺,http://xuzhou082917.11467.com
深圳市星光光电有限公司,http:////www.11467.com/shenzhen/co/316550.htm
深圳市星光光电有限公司的商铺,http://shenzhen0316550.11467.com
苏州市吴中区长桥金旺玻璃店,http:////www.11467.com/suzhou/co/269374.htm
苏州市吴中区长桥金旺玻璃店的商铺,http://suzhou0269374.11467.com
苏州市沧浪区国洋门窗经营部,http:////www.11467.com/suzhou/co/356586.htm
苏州市沧浪区国洋门窗经营部的商铺,http://suzhou0356586.11467.com
苏州市吴中区玻璃制品厂,http:////www.11467.com/suzhou/co/25664.htm
苏州市吴中区玻璃制品厂的商铺,http://suzhou025664.11467.com
厦门帝陀商贸有限公司,http:////www.11467.com/xiamen/co/103451.htm
厦门帝陀商贸有限公司的商铺,http://xiamen0103451.11467.com
深圳市恒通利达货架有限公司,http:////www.11467.com/shenzhen/co/810900.htm
深圳市恒通利达货架有限公司的商铺,http://shenzhen0810900.11467.com
深圳市诚隆玻璃有限公司,http:////www.11467.com/shenzhen/co/771090.htm
深圳市诚隆玻璃有限公司的商铺,http://shenzhen0771090.11467.com
深圳市合诚特种玻璃制品有限公司,http:////www.11467.com/shenzhen/co/254730.htm
深圳市合诚特种玻璃制品有限公司的商铺,http://shenzhen0254730.11467.com
凯吉斯金刚石（广州）有限公司,http:////www.11467.com/guangzhou/co/112811.htm
凯吉斯金刚石（广州）有限公司的商铺,http://guangzhou0112811.11467.com
广州市白云区钟落潭重友玻璃机械厂,http:////www.11467.com/guangzhou/co/107842.htm
广州市白云区钟落潭重友玻璃机械厂的商铺,http://guangzhou0107842.11467.com
广州市荔湾区瑞阳化玻仪器经营部,http:////www.11467.com/guangzhou/co/246591.htm
广州市荔湾区瑞阳化玻仪器经营部的商铺,http://guangzhou0246591.11467.com
郓城策美包装有限公司,http:////www.11467.com/heze/co/30972.htm
郓城策美包装有限公司的商铺,http://heze030972.11467.com
福建省健威液晶科技有限公司,http:////www.11467.com/putian/co/17045.htm
福建省健威液晶科技有限公司的商铺,http://putian017045.11467.com
固安县恒远工贸有限公司,http:////www.11467.com/langfang/co/45780.htm
固安县恒远工贸有限公司的商铺,http://langfang045780.11467.com
青岛欧盛玻璃技术有限公司,http:////www.11467.com/qingdao/co/188483.htm
青岛欧盛玻璃技术有限公司的商铺,http://qingdao0188483.11467.com
深圳昊迪森科技有限公司,http:////www.11467.com/shenzhen/co/1137932.htm
深圳昊迪森科技有限公司的商铺,http://shenzhen01137932.11467.com
深圳市泽亮玻璃有限公司,http:////www.11467.com/shenzhen/co/150590.htm
深圳市泽亮玻璃有限公司的商铺,http://shenzhen0150590.11467.com
锦州碧合石英玻璃有限责任公司,http:////www.11467.com/jinzhou/co/14269.htm
锦州碧合石英玻璃有限责任公司的商铺,http://jinzhou014269.11467.com
漳州昇亚电子产品有限公司,http:////www.11467.com/zhangzhou/co/21587.htm
漳州昇亚电子产品有限公司的商铺,http://zhangzhou021587.11467.com
中山市恒溢精密模具有限公司,http:////www.11467.com/zhongshan/co/83289.htm
中山市恒溢精密模具有限公司的商铺,http://zhongshan083289.11467.com
珠海市易达玻璃装饰有限公司,http:////www.11467.com/zhuhai/co/69795.htm
珠海市易达玻璃装饰有限公司的商铺,http://zhuhai069795.11467.com
北京东奥玻璃厂,http:////www.11467.com/beijing/co/215016.htm
北京东奥玻璃厂的商铺,http://beijing0215016.11467.com
北京意飞尔艺术玻璃销售中心,http:////www.11467.com/beijing/co/214982.htm
北京意飞尔艺术玻璃销售中心的商铺,http://beijing0214982.11467.com
北京张三新视觉水族用品有限公司,http:////www.11467.com/beijing/co/619666.htm
北京张三新视觉水族用品有限公司的商铺,http://beijing0619666.11467.com
