深圳冠联达网络科技有限公司,http:////www.11467.com/shenzhen/co/852195.htm
松原市绿茚日用化妆品有限公司,http:////www.11467.com/songyuan/co/15097.htm
松原市绿茚日用化妆品有限公司的商铺,http://songyuan015097.11467.com
广州珈蓝生物科技有限公司,http:////www.11467.com/qiye/93159642.htm
广州珈蓝生物科技有限公司的商铺,http://93159642.b2b.11467.com
西峰区舒雪日化商行,http:////www.11467.com/qingyang/co/10683.htm
西峰区舒雪日化商行的商铺,http://qingyang010683.11467.com
广州天玺生物科技有限公司,http:////www.11467.com/guangzhou/co/132868.htm
广州天玺生物科技有限公司的商铺,http://guangzhou0132868.11467.com
深圳市芳香国度化妆品有限公司,http:////www.11467.com/shenzhen/co/731489.htm
深圳市芳香国度化妆品有限公司的商铺,http://shenzhen0731489.11467.com
东方古韵化妆品有限公司,http:////www.11467.com/guigang/co/7723.htm
东方古韵化妆品有限公司的商铺,http://guigang07723.11467.com
乌鲁木齐任风行贸易有限公司,http:////www.11467.com/wulumuqi/co/100193.htm
乌鲁木齐任风行贸易有限公司的商铺,http://wulumuqi0100193.11467.com
西安世珍生物技术有限责任公司,http:////www.11467.com/xian/co/85325.htm
西安世珍生物技术有限责任公司的商铺,http://xian085325.11467.com
黄山弈舟生物科技有限公司,http:////www.11467.com/huangshan/co/12463.htm
黄山弈舟生物科技有限公司的商铺,http://huangshan012463.11467.com
惠州市恒威包装制品有限公司,http:////www.11467.com/huizhou/co/73790.htm
惠州市恒威包装制品有限公司的商铺,http://huizhou073790.11467.com
佳木斯环科科技开发有限公司,http:////www.11467.com/jiamusi/co/32725.htm
佳木斯环科科技开发有限公司的商铺,http://jiamusi032725.11467.com
施帮玉(个体经营),http:////www.11467.com/luzhou/co/16655.htm
施帮玉(个体经营)的商铺,http://luzhou016655.11467.com
奥丽雅日用化妆品（马鞍山）有限公司,http:////www.11467.com/maanshan/co/20404.htm
奥丽雅日用化妆品（马鞍山）有限公司的商铺,http://maanshan020404.11467.com
浙江省湖州市南浔苏洋进出口贸易有限公司,http:////www.11467.com/huzhou/co/56163.htm
浙江省湖州市南浔苏洋进出口贸易有限公司的商铺,http://huzhou056163.11467.com
郴州丹姿日用化妆品商行,http:////www.11467.com/chenzhou/co/19008.htm
郴州丹姿日用化妆品商行的商铺,http://chenzhou019008.11467.com
袁玉松(个体经营),http:////www.11467.com/chuzhou/co/20701.htm
袁玉松(个体经营)的商铺,http://chuzhou020701.11467.com
纪露露（个体经营）,http:////www.11467.com/chuzhou/co/20704.htm
纪露露（个体经营）的商铺,http://chuzhou020704.11467.com
孙建平（个体户）,http:////www.11467.com/datong/co/13891.htm
孙建平（个体户）的商铺,http://datong013891.11467.com
鞍山市红丽化妆品有限公司,http:////www.11467.com/anshan/co/70876.htm
鞍山市红丽化妆品有限公司的商铺,http://anshan070876.11467.com
包头市鹿大贸易有限责任公司,http:////www.11467.com/baotou/co/24214.htm
包头市鹿大贸易有限责任公司的商铺,http://baotou024214.11467.com
广州市金达柏化妆品有限公司,http:////www.11467.com/guangzhou/co/142369.htm
广州市金达柏化妆品有限公司的商铺,http://guangzhou0142369.11467.com
宿州市埇桥区松园化妆品店,http:////www.11467.com/suzhoushi/co/17764.htm
宿州市埇桥区松园化妆品店的商铺,http://suzhoushi017764.11467.com
舟山市景轲贸易有限公司,http:////www.11467.com/zhoushan/co/17027.htm
舟山市景轲贸易有限公司的商铺,http://zhoushan017027.11467.com
驻马店市御医堂保健品有限公司,http:////www.11467.com/zhumadian/co/22206.htm
驻马店市御医堂保健品有限公司的商铺,http://zhumadian022206.11467.com
赵翠梅（个体经营）,http:////www.11467.com/jinzhong/co/21933.htm
赵翠梅（个体经营）的商铺,http://jinzhong021933.11467.com
广州市韩朵化妆品有限公司,http:////www.11467.com/qiye/93201247.htm
广州市韩朵化妆品有限公司的商铺,http://93201247.b2b.11467.com
广东梵大集团有限公司,http:////www.11467.com/qiye/92241433.htm
广东梵大集团有限公司的商铺,http://92241433.b2b.11467.com
刘玉峰,http:////www.11467.com/bozhou/co/8619.htm
刘玉峰的商铺,http://bozhou08619.11467.com
王星（个体）,http:////www.11467.com/lijiang/co/4334.htm
王星（个体）的商铺,http://lijiang04334.11467.com
东莞市旭显电子材料有限公司,http:////www.11467.com/shenzhen/co/758450.htm
东莞市旭显电子材料有限公司的商铺,http://shenzhen0758450.11467.com
上海苗和润化妆品有限公司,http:////www.11467.com/shanghai/co/1066230.htm
上海苗和润化妆品有限公司的商铺,http://shanghai01066230.11467.com
广州市婼雅玻璃制品有限公司,http:////www.11467.com/guangzhou/co/433739.htm
广州市婼雅玻璃制品有限公司的商铺,http://guangzhou0433739.11467.com
南京金星化妆品美容有限公司,http:////www.11467.com/nanjing/co/115440.htm
南京金星化妆品美容有限公司的商铺,http://nanjing0115440.11467.com
普宁市流沙优伊服装经营部,http:////www.11467.com/jieyang/co/32090.htm
普宁市流沙优伊服装经营部的商铺,http://jieyang032090.11467.com
陆雪（个体经营）,http:////www.11467.com/linyi/co/106996.htm
陆雪（个体经营）的商铺,http://linyi0106996.11467.com
安徽富坤贸易有限公司,http:////www.11467.com/hefei/co/100226.htm
安徽富坤贸易有限公司的商铺,http://hefei0100226.11467.com
上海恩地化妆品科技有限公司,http:////www.11467.com/suzhou/co/313742.htm
上海恩地化妆品科技有限公司的商铺,http://suzhou0313742.11467.com
广州至纯化妆品有限公司,http:////www.11467.com/guangzhou/co/433211.htm
广州至纯化妆品有限公司的商铺,http://guangzhou0433211.11467.com
聊城市蒂婷生物科技有限公司,http:////www.11467.com/qiye/93304730.htm
聊城市蒂婷生物科技有限公司的商铺,http://93304730.b2b.11467.com
广州颜玉生物科技有限公司,http:////www.11467.com/qiye/93305283.htm
广州颜玉生物科技有限公司的商铺,http://93305283.b2b.11467.com
深圳市龙华新区观澜文辉塑胶制品厂,http:////www.11467.com/shenzhen/co/847963.htm
深圳市龙华新区观澜文辉塑胶制品厂的商铺,http://shenzhen0847963.11467.com
扬州名典旅游用品厂,http:////www.11467.com/yangzhou/co/108933.htm
扬州名典旅游用品厂的商铺,http://yangzhou0108933.11467.com
厦门市思明区银拾字美容店,http:////www.11467.com/xiamen/co/93167.htm
厦门市思明区银拾字美容店的商铺,http://xiamen093167.11467.com
广州市康蓉科技有限公司,http:////www.11467.com/guangzhou/co/132849.htm
广州市康蓉科技有限公司的商铺,http://guangzhou0132849.11467.com
泉州国之丽赛恩斯美容有限公司,http:////www.11467.com/quanzhou/co/129772.htm
泉州国之丽赛恩斯美容有限公司的商铺,http://quanzhou0129772.11467.com
杭州沐神电子商务有限公司,http:////www.11467.com/hangzhou/co/368558.htm
杭州沐神电子商务有限公司的商铺,http://hangzhou0368558.11467.com
张宝珠(个体经营),http:////www.11467.com/linyi/co/107062.htm
张宝珠(个体经营)的商铺,http://linyi0107062.11467.com
林森生物科技有限公司,http:////www.11467.com/shenzhen/co/721506.htm
广州阳诚化妆品批发,http:////www.11467.com/guangzhou/co/432794.htm
福建绿植源生化科技有限公司,http:////www.11467.com/fuzhou/co/161362.htm
福建绿植源生化科技有限公司的商铺,http://fuzhou0161362.11467.com
广州市欧佩化妆品有限公司,http:////www.11467.com/guangzhou/co/554204.htm
广州市欧佩化妆品有限公司的商铺,http://guangzhou0554204.11467.com
陕西森弗高科实业有限公司,http:////www.11467.com/xian/co/85298.htm
陕西森弗高科实业有限公司的商铺,http://xian085298.11467.com
安庆一枝梅化工有限责任公司,http:////www.11467.com/anqing/co/27638.htm
安庆一枝梅化工有限责任公司的商铺,http://anqing027638.11467.com
广东中鹏化工有限公司,http:////www.11467.com/guangzhou/co/9819.htm
广东中鹏化工有限公司的商铺,http://guangzhou09819.11467.com
佛山市瑞信无纺布有限公司,http:////www.11467.com/foshan/co/216912.htm
佛山市瑞信无纺布有限公司的商铺,http://foshan0216912.11467.com
大连保税区联合博泰生物技术有限公司,http:////www.11467.com/dalian/co/37187.htm
大连保税区联合博泰生物技术有限公司的商铺,http://dalian037187.11467.com
深圳市茱莉化妆品有限公司,http:////www.11467.com/shenzhen/co/809617.htm
深圳市茱莉化妆品有限公司的商铺,http://shenzhen0809617.11467.com
福建片仔癀化妆品有限公司,http:////www.11467.com/zhangzhou/co/36939.htm
福建片仔癀化妆品有限公司的商铺,http://zhangzhou036939.11467.com
珠海市时代经典化妆品有限公司,http:////www.11467.com/zhuhai/co/67093.htm
珠海市时代经典化妆品有限公司的商铺,http://zhuhai067093.11467.com
长春敏家保健科技有限公司,http:////www.11467.com/changchun/co/69884.htm
长春敏家保健科技有限公司的商铺,http://changchun069884.11467.com
安庆市新东方物贸有限责任公司,http:////www.11467.com/anqing/co/24027.htm
安庆市新东方物贸有限责任公司的商铺,http://anqing024027.11467.com
广州多琳凯无纺布制品有限公司,http:////www.11467.com/guangzhou/co/142968.htm
广州多琳凯无纺布制品有限公司的商铺,http://guangzhou0142968.11467.com
广州华良化工有限公司,http:////www.11467.com/guangzhou/co/142252.htm
广州华良化工有限公司的商铺,http://guangzhou0142252.11467.com
广州市欧丽源化妆品有限公司,http:////www.11467.com/guangzhou/co/144909.htm
广州市欧丽源化妆品有限公司的商铺,http://guangzhou0144909.11467.com
辽宁柞蚕丝绸科学研究院有限责任公司,http:////www.11467.com/dandong/co/2825.htm
辽宁柞蚕丝绸科学研究院有限责任公司的商铺,http://dandong02825.11467.com
深圳市优联盛世贸易有限公司,http:////www.11467.com/shenzhen/co/723860.htm
深圳市优联盛世贸易有限公司的商铺,http://shenzhen0723860.11467.com
吉林市康宏化工有限公司,http:////www.11467.com/guangzhou/co/142334.htm
吉林市康宏化工有限公司的商铺,http://guangzhou0142334.11467.com
广州市强哥化妆品有限公司,http:////www.11467.com/guangzhou/co/554028.htm
广州市强哥化妆品有限公司的商铺,http://guangzhou0554028.11467.com
南京立青贸易有限公司,http:////www.11467.com/changzhou/co/152627.htm
南京立青贸易有限公司的商铺,http://changzhou0152627.11467.com
广州净派保洁消毒用品有限公司,http:////www.11467.com/guangzhou/co/472346.htm
广州净派保洁消毒用品有限公司的商铺,http://guangzhou0472346.11467.com
广州蓝姿化妆品有限公司,http:////www.11467.com/guangzhou/co/142384.htm
广州蓝姿化妆品有限公司的商铺,http://guangzhou0142384.11467.com
李国强,http:////www.11467.com/dongguan/co/556105.htm
李国强的商铺,http://dongguan0556105.11467.com
驻马店市晨钟生物科技有限公司,http:////www.11467.com/zhumadian/co/15021.htm
驻马店市晨钟生物科技有限公司的商铺,http://zhumadian015021.11467.com
广州菲比化妆品有限公司,http:////www.11467.com/guangzhou/co/455337.htm
广州菲比化妆品有限公司的商铺,http://guangzhou0455337.11467.com
广州芊植本草化妆品有限公司,http:////www.11467.com/guangzhou/co/495173.htm
广州芊植本草化妆品有限公司的商铺,http://guangzhou0495173.11467.com
广州迷纱化妆品有限公司,http:////www.11467.com/guangzhou/co/457395.htm
广州迷纱化妆品有限公司的商铺,http://guangzhou0457395.11467.com
广州市今生有约美容连锁企业有限公司,http:////www.11467.com/guangzhou/co/141339.htm
广州市今生有约美容连锁企业有限公司的商铺,http://guangzhou0141339.11467.com
广州市良朋日用化工有限公司,http:////www.11467.com/guangzhou/co/91056.htm
广州市良朋日用化工有限公司的商铺,http://guangzhou091056.11467.com
杭州鼎荣电气设备有限公司,http:////www.11467.com/hangzhou/co/251666.htm
杭州鼎荣电气设备有限公司的商铺,http://hangzhou0251666.11467.com
广东松泰兴化妆品有限公司,http:////www.11467.com/shantou/co/151733.htm
广东松泰兴化妆品有限公司的商铺,http://shantou0151733.11467.com
深圳市景年商贸有限公司,http:////www.11467.com/shenzhen/co/578210.htm
深圳市景年商贸有限公司的商铺,http://shenzhen0578210.11467.com
广州市极萃娇源生物制造有限公司,http:////www.11467.com/qiye/27171075.htm
广州市极萃娇源生物制造有限公司的商铺,http://27171075.b2b.11467.com
苏州源泰润化工有限公司,http:////www.11467.com/suzhou/co/356509.htm
苏州源泰润化工有限公司的商铺,http://suzhou0356509.11467.com
阿芝国际化妆品（广州）有限公司,http:////www.11467.com/qiye/93180193.htm
阿芝国际化妆品（广州）有限公司的商铺,http://93180193.b2b.11467.com
郑州市中一美容有限公司,http:////www.11467.com/zhengzhou/co/199152.htm
郑州市中一美容有限公司的商铺,http://zhengzhou0199152.11467.com
广州恒芳生物科技有限公司,http:////www.11467.com/guangzhou/co/668562.htm
广州恒芳生物科技有限公司的商铺,http://guangzhou0668562.11467.com
桂林妍姿商贸有限公司,http:////www.11467.com/guilin/co/53044.htm
桂林妍姿商贸有限公司的商铺,http://guilin053044.11467.com
石家庄惠众科技有限公司,http:////www.11467.com/shijiazhuang/co/91690.htm
石家庄惠众科技有限公司的商铺,http://shijiazhuang091690.11467.com
广州市东智盟生物科技有限公司,http:////www.11467.com/guangzhou/co/430463.htm
广州市东智盟生物科技有限公司的商铺,http://guangzhou0430463.11467.com
深圳市安诺日化用品有限公司,http:////www.11467.com/shenzhen/co/87751.htm
深圳市安诺日化用品有限公司的商铺,http://shenzhen087751.11467.com
广州市蝶澜化妆品有限公司,http:////www.11467.com/guangzhou/co/142332.htm
广州市蝶澜化妆品有限公司的商铺,http://guangzhou0142332.11467.com
广州市德馨蜡制品有限公司,http:////www.11467.com/guangzhou/co/430716.htm
广州市德馨蜡制品有限公司的商铺,http://guangzhou0430716.11467.com
广州雅颜清照化妆品有限公司,http:////www.11467.com/guangzhou/co/494663.htm
广州雅颜清照化妆品有限公司的商铺,http://guangzhou0494663.11467.com
佛山市玫伊兰日用品有限公司,http:////www.11467.com/foshan/co/338082.htm
佛山市玫伊兰日用品有限公司的商铺,http://foshan0338082.11467.com
东莞市润孚化妆品有限公司,http:////www.11467.com/dongguan/co/145905.htm
东莞市润孚化妆品有限公司的商铺,http://dongguan0145905.11467.com
福州阳光丽人化妆品有限公司,http:////www.11467.com/guangzhou/co/471821.htm
福州阳光丽人化妆品有限公司的商铺,http://guangzhou0471821.11467.com
常州海仁堂生物科技有限公司,http:////www.11467.com/changzhou/co/147783.htm
常州海仁堂生物科技有限公司的商铺,http://changzhou0147783.11467.com
常州市宏业有机硅有限公司,http:////www.11467.com/changzhou/co/92029.htm
常州市宏业有机硅有限公司的商铺,http://changzhou092029.11467.com
陕西华润实业公司,http:////www.11467.com/xian/co/33168.htm
东莞宏其纺织染整助剂厂有限公司,http:////www.11467.com/dongguan/co/398525.htm
东莞宏其纺织染整助剂厂有限公司的商铺,http://dongguan0398525.11467.com
廊坊中科环保产品有限公司,http:////www.11467.com/langfang/co/36085.htm
廊坊中科环保产品有限公司的商铺,http://langfang036085.11467.com
青岛浩隆鑫工贸有限公司,http:////www.11467.com/qingdao/co/125113.htm
青岛浩隆鑫工贸有限公司的商铺,http://qingdao0125113.11467.com
爱茉莉化妆品（上海）有限公司,http:////www.11467.com/shanghai/co/268657.htm
爱茉莉化妆品（上海）有限公司的商铺,http://shanghai0268657.11467.com
扬州利尔康日化有限公司,http:////www.11467.com/yangzhou/co/10026.htm
扬州利尔康日化有限公司的商铺,http://yangzhou010026.11467.com
扬州市华鑫旅游用品厂,http:////www.11467.com/yangzhou/co/77094.htm
扬州市华鑫旅游用品厂的商铺,http://yangzhou077094.11467.com
广州市欧帝化工科技有限公司,http:////www.11467.com/guangzhou/co/434497.htm
广州市欧帝化工科技有限公司的商铺,http://guangzhou0434497.11467.com
广西金红果农业综合开发有限公司,http:////www.11467.com/nanning/co/59069.htm
广西金红果农业综合开发有限公司的商铺,http://nanning059069.11467.com
南宁创新科技医药技术有限公司,http:////www.11467.com/nanning/co/59251.htm
南宁创新科技医药技术有限公司的商铺,http://nanning059251.11467.com
浙江泰康生物科技有限公司,http:////www.11467.com/quzhou/co/20774.htm
浙江泰康生物科技有限公司的商铺,http://quzhou020774.11467.com
深圳市尤美化妆品公司,http:////www.11467.com/shenzhen/co/207435.htm
深圳市尤美化妆品公司的商铺,http://shenzhen0207435.11467.com
扬州凯来旅游用品有限公司,http:////www.11467.com/yangzhou/co/77139.htm
扬州凯来旅游用品有限公司的商铺,http://yangzhou077139.11467.com
漳州美皇日化有限公司,http:////www.11467.com/zhangzhou/co/36968.htm
漳州美皇日化有限公司的商铺,http://zhangzhou036968.11467.com
扬州市正太旅游用品有限公司,http:////www.11467.com/yangzhou/co/77211.htm
扬州市正太旅游用品有限公司的商铺,http://yangzhou077211.11467.com
沈阳爱华化妆品有限公司,http:////www.11467.com/shenyang/co/29179.htm
沈阳爱华化妆品有限公司的商铺,http://shenyang029179.11467.com
深圳市泉兴科技有限公司,http:////www.11467.com/shenzhen/co/730025.htm
深圳市泉兴科技有限公司的商铺,http://shenzhen0730025.11467.com
广州市承跃贸易有限公司,http:////www.11467.com/guangzhou/co/433466.htm
广州市承跃贸易有限公司的商铺,http://guangzhou0433466.11467.com
艾美艾门生物工程科技有限公司,http:////www.11467.com/dongguan/co/414941.htm
艾美艾门生物工程科技有限公司的商铺,http://dongguan0414941.11467.com
艾美·艾门生物工程科技有限公司,http:////www.11467.com/dongguan/co/415006.htm
艾美·艾门生物工程科技有限公司的商铺,http://dongguan0415006.11467.com
青岛奇丽科技有限公司,http:////www.11467.com/qingdao/co/141464.htm
青岛奇丽科技有限公司的商铺,http://qingdao0141464.11467.com
淄博禄庭商贸有限公司,http:////www.11467.com/zibo/co/81418.htm
淄博禄庭商贸有限公司的商铺,http://zibo081418.11467.com
深圳市润东来科技有限公司,http:////www.11467.com/shenzhen/co/327867.htm
深圳市润东来科技有限公司的商铺,http://shenzhen0327867.11467.com
深圳市必联电子有限公司,http:////www.11467.com/shenzhen/co/194168.htm
深圳市必联电子有限公司的商铺,http://shenzhen0194168.11467.com
广州市志闻美延化妆品有限公司,http:////www.11467.com/guangzhou/co/457179.htm
广州市志闻美延化妆品有限公司的商铺,http://guangzhou0457179.11467.com
潍坊市绿丰源化工有限公司,http:////www.11467.com/weifang/co/21541.htm
潍坊市绿丰源化工有限公司的商铺,http://weifang021541.11467.com
广州市大荣精细化工有限公司,http:////www.11467.com/guangzhou/co/432899.htm
广州市大荣精细化工有限公司的商铺,http://guangzhou0432899.11467.com
巩义市蓝润滤材有限公司,http:////www.11467.com/zhengzhou/co/149387.htm
巩义市蓝润滤材有限公司的商铺,http://zhengzhou0149387.11467.com
汕头市威仕达化妆品有限公司,http:////www.11467.com/shantou/co/115871.htm
汕头市威仕达化妆品有限公司的商铺,http://shantou0115871.11467.com
广州市睿业贸易有限公司,http:////www.11467.com/guangzhou/co/455018.htm
广州市睿业贸易有限公司的商铺,http://guangzhou0455018.11467.com
广州英桐生物科技有限公司,http:////www.11467.com/guangzhou/co/149581.htm
广州英桐生物科技有限公司的商铺,http://guangzhou0149581.11467.com
陕西博业科技发展有限公司,http:////www.11467.com/xian/co/78102.htm
陕西博业科技发展有限公司的商铺,http://xian078102.11467.com
珠海天鹰经贸有限公司,http:////www.11467.com/zhuhai/co/66806.htm
珠海天鹰经贸有限公司的商铺,http://zhuhai066806.11467.com
北京中韩时尚科技有限公司,http:////www.11467.com/beijing/co/328223.htm
北京中韩时尚科技有限公司的商铺,http://beijing0328223.11467.com
珠海国佳高分子新材料有限公司,http:////www.11467.com/zhuhai/co/69812.htm
珠海国佳高分子新材料有限公司的商铺,http://zhuhai069812.11467.com
徐州市美晨浴业用品开发有限公司,http:////www.11467.com/xuzhou/co/52183.htm
徐州市美晨浴业用品开发有限公司的商铺,http://xuzhou052183.11467.com
泰安市东岳康宁经贸有限公司,http:////www.11467.com/taian/co/45257.htm
泰安市东岳康宁经贸有限公司的商铺,http://taian045257.11467.com
武汉俊琳美容管理有限公司,http:////www.11467.com/wuhan/co/141738.htm
武汉俊琳美容管理有限公司的商铺,http://wuhan0141738.11467.com
增城市铭峰实业有限公司,http:////www.11467.com/guangzhou/co/494882.htm
增城市铭峰实业有限公司的商铺,http://guangzhou0494882.11467.com
黄敏,http:////www.11467.com/guangzhou/co/177085.htm
黄敏的商铺,http://guangzhou0177085.11467.com
广州市嘉美化妆品有限公司,http:////www.11467.com/guangzhou/co/132848.htm
广州市嘉美化妆品有限公司的商铺,http://guangzhou0132848.11467.com
浙江省乐泰胶水销售有限公司,http:////www.11467.com/dongguan/co/488236.htm
浙江省乐泰胶水销售有限公司的商铺,http://dongguan0488236.11467.com
广州市白云区三元里爱莎侬化妆品商行,http:////www.11467.com/guangzhou/co/131837.htm
广州市白云区三元里爱莎侬化妆品商行的商铺,http://guangzhou0131837.11467.com
杭州高琦香精化妆品有限公司,http:////www.11467.com/hangzhou/co/30314.htm
杭州高琦香精化妆品有限公司的商铺,http://hangzhou030314.11467.com
汕头市澄海区金俊工贸有限公司,http:////www.11467.com/shantou/co/115869.htm
汕头市澄海区金俊工贸有限公司的商铺,http://shantou0115869.11467.com
河北省石家庄市比度克,http:////www.11467.com/shijiazhuang/co/108522.htm
河北省石家庄市比度克的商铺,http://shijiazhuang0108522.11467.com
迷奇圣道化妆品店,http:////www.11467.com/wulumuqi/co/100288.htm
迷奇圣道化妆品店的商铺,http://wulumuqi0100288.11467.com
深州市宝安区松岗老中医化妆品祛痘祛斑专卖店,http:////www.11467.com/shenzhen/co/725317.htm
深州市宝安区松岗老中医化妆品祛痘祛斑专卖店的商铺,http://shenzhen0725317.11467.com
浙江省湖州市苏洋进出口贸易有限公司,http:////www.11467.com/huzhou/co/56162.htm
美丽时尚妆容化妆品批发,http:////www.11467.com/wenzhou/co/169704.htm
威海三福进出口有限公司,http:////www.11467.com/weihai/co/36181.htm
临沂市兰山区绿森化工有限公司,http:////www.11467.com/linyi/co/106839.htm
临沂市兰山区绿森化工有限公司的商铺,http://linyi0106839.11467.com
南京捷尔达清洗剂厂,http:////www.11467.com/nanjing/co/4906.htm
南京捷尔达清洗剂厂的商铺,http://nanjing04906.11467.com
杨忠克（个体经营）,http:////www.11467.com/nanjing/co/90156.htm
杨忠克（个体经营）的商铺,http://nanjing090156.11467.com
梁冰军(个体经营),http:////www.11467.com/nanning/co/59206.htm
梁冰军(个体经营)的商铺,http://nanning059206.11467.com
南宁东桑西移丝绸有限公司,http:////www.11467.com/nanning/co/60892.htm
南宁东桑西移丝绸有限公司的商铺,http://nanning060892.11467.com
苏州永安商贸有限公司,http:////www.11467.com/suzhou/co/245530.htm
苏州永安商贸有限公司的商铺,http://suzhou0245530.11467.com
随州贝葛化妆品有限公司,http:////www.11467.com/suizhou/co/6302.htm
随州贝葛化妆品有限公司的商铺,http://suizhou06302.11467.com
深圳市联发航贸易有限公司,http:////www.11467.com/shenzhen/co/150043.htm
深圳市联发航贸易有限公司的商铺,http://shenzhen0150043.11467.com
深圳市泰丰盛日用品有限公司,http:////www.11467.com/shenzhen/co/150337.htm
深圳市泰丰盛日用品有限公司的商铺,http://shenzhen0150337.11467.com
石家庄格美香精香料有限公司,http:////www.11467.com/shijiazhuang/co/93860.htm
石家庄格美香精香料有限公司的商铺,http://shijiazhuang093860.11467.com
南宁顶杰经贸有限责任公司,http:////www.11467.com/nanning/co/46591.htm
南宁顶杰经贸有限责任公司的商铺,http://nanning046591.11467.com
衢州竹韵炭业有限公司,http:////www.11467.com/quzhou/co/21743.htm
衢州竹韵炭业有限公司的商铺,http://quzhou021743.11467.com
葛冬生（个体经营）,http:////www.11467.com/rizhao/co/12170.htm
葛冬生（个体经营）的商铺,http://rizhao012170.11467.com
汕头市德康药品商场,http:////www.11467.com/shantou/co/6398.htm
汕头市德康药品商场的商铺,http://shantou06398.11467.com
