玉林市玉州区日庆童车经营部,http:////www.11467.com/yulin/co/19626.htm
玉林市玉州区日庆童车经营部的商铺,http://yulin019626.11467.com
芜湖市宝艺游乐科技设备有限公司,http:////www.11467.com/wuhu/co/24164.htm
芜湖市宝艺游乐科技设备有限公司的商铺,http://wuhu024164.11467.com
句容巨鸣自行车有限公司,http:////www.11467.com/zhenjiang/co/63904.htm
句容巨鸣自行车有限公司的商铺,http://zhenjiang063904.11467.com
汕头市澄海区汇业玩具有限公司,http:////www.11467.com/jinhua/co/81654.htm
汕头市澄海区汇业玩具有限公司的商铺,http://jinhua081654.11467.com
步步高贸易珠海有限公司,http:////www.11467.com/zhuhai/co/85676.htm
步步高贸易珠海有限公司的商铺,http://zhuhai085676.11467.com
汕头市金平区川野自行车有限公司东厦分公司,http:////www.11467.com/shantou/co/144003.htm
汕头市金平区川野自行车有限公司东厦分公司的商铺,http://shantou0144003.11467.com
郑州迪乐美科贸有限公司,http:////www.11467.com/zhengzhou/co/149204.htm
郑州迪乐美科贸有限公司的商铺,http://zhengzhou0149204.11467.com
安徽呵宝儿童用品有限公司,http:////www.11467.com/hefei/co/99580.htm
安徽呵宝儿童用品有限公司的商铺,http://hefei099580.11467.com
深圳锦程玩具制品有限公司,http:////www.11467.com/shenzhen/co/672928.htm
深圳锦程玩具制品有限公司的商铺,http://shenzhen0672928.11467.com
刘建芳,http:////www.11467.com/heze/co/20511.htm
刘建芳的商铺,http://heze020511.11467.com
浙江永康银杏五金厂,http:////www.11467.com/jinhua/co/81665.htm
浙江永康银杏五金厂的商铺,http://jinhua081665.11467.com
义乌市贝贝童车商行,http:////www.11467.com/jinhua/co/81402.htm
义乌市贝贝童车商行的商铺,http://jinhua081402.11467.com
徐金春（个体经营）,http:////www.11467.com/linyi/co/71037.htm
徐金春（个体经营）的商铺,http://linyi071037.11467.com
华亿(福建)妇幼用品有限公司,http:////www.11467.com/quanzhou/co/98835.htm
华亿(福建)妇幼用品有限公司的商铺,http://quanzhou098835.11467.com
泉州市凯睿五金机电有限公司,http:////www.11467.com/quanzhou/co/111119.htm
泉州市凯睿五金机电有限公司的商铺,http://quanzhou0111119.11467.com
东营翔宇童车有限公司,http:////www.11467.com/dongying/co/31138.htm
东营翔宇童车有限公司的商铺,http://dongying031138.11467.com
河北邢台广宗小贝贝童车厂,http:////www.11467.com/xintai/co/37697.htm
河北邢台广宗小贝贝童车厂的商铺,http://xintai037697.11467.com
汕头市礼诚玩具有限公司,http:////www.11467.com/shantou/co/141090.htm
汕头市礼诚玩具有限公司的商铺,http://shantou0141090.11467.com
雅诚玩具礼品厂,http:////www.11467.com/shantou/co/141025.htm
雅诚玩具礼品厂的商铺,http://shantou0141025.11467.com
绍兴市金童车业有限公司,http:////www.11467.com/shaoxing/co/7015.htm
绍兴市金童车业有限公司的商铺,http://shaoxing07015.11467.com
枣庄市禹铭童车有限公司,http:////www.11467.com/zaozhuang/co/29300.htm
枣庄市禹铭童车有限公司的商铺,http://zaozhuang029300.11467.com
平乡县海龙童车厂,http:////www.11467.com/xintai/co/37696.htm
平乡县海龙童车厂的商铺,http://xintai037696.11467.com
唐河县大华机械设备有限公司,http:////www.11467.com/nanyang/co/29565.htm
唐河县大华机械设备有限公司的商铺,http://nanyang029565.11467.com
安徽酷豆丁儿童用品有限公司,http:////www.11467.com/liuan/co/14702.htm
安徽酷豆丁儿童用品有限公司的商铺,http://liuan014702.11467.com
佛山市顺德区精恒弹簧实业有限公司,http:////www.11467.com/foshan/co/67649.htm
佛山市顺德区精恒弹簧实业有限公司的商铺,http://foshan067649.11467.com
盐城悦亚机械设备有限公司,http:////www.11467.com/yancheng/co/30011.htm
盐城悦亚机械设备有限公司的商铺,http://yancheng030011.11467.com
邢台圣欧自行车制造有限公司,http:////www.11467.com/xintai/co/39195.htm
邢台圣欧自行车制造有限公司的商铺,http://xintai039195.11467.com
上海申花玩具(宿州)有限公司,http:////www.11467.com/suzhoushi/co/18698.htm
上海申花玩具(宿州)有限公司的商铺,http://suzhoushi018698.11467.com
广州市花都区凯尔特自行车厂,http:////www.11467.com/guangzhou/co/495999.htm
广州市花都区凯尔特自行车厂的商铺,http://guangzhou0495999.11467.com
长沙市国林医疗器械有限公司,http:////www.11467.com/changsha/co/85191.htm
长沙市国林医疗器械有限公司的商铺,http://changsha085191.11467.com
汕头市贝乐星电子商务有限公司,http:////www.11467.com/shantou/co/150318.htm
汕头市贝乐星电子商务有限公司的商铺,http://shantou0150318.11467.com
邢台明洲自行车配件有限公司,http:////www.11467.com/xintai/co/39125.htm
邢台明洲自行车配件有限公司的商铺,http://xintai039125.11467.com
米莱奇儿童用品（武汉）有限公司,http:////www.11467.com/wuhan/co/201232.htm
米莱奇儿童用品（武汉）有限公司的商铺,http://wuhan0201232.11467.com
珠海嘉拓婴儿用品有限公司,http:////www.11467.com/zhuhai/co/85860.htm
珠海嘉拓婴儿用品有限公司的商铺,http://zhuhai085860.11467.com
揭东曲溪乐融融五金制品厂,http:////www.11467.com/jieyang/co/35981.htm
揭东曲溪乐融融五金制品厂的商铺,http://jieyang035981.11467.com
邢台春美童车制造有限公司,http:////www.11467.com/xintai/co/40756.htm
邢台春美童车制造有限公司的商铺,http://xintai040756.11467.com
晋江市康贝斯贸易有限公司,http:////www.11467.com/quanzhou/co/123098.htm
晋江市康贝斯贸易有限公司的商铺,http://quanzhou0123098.11467.com
邱县福腾儿童玩具经销处,http:////www.11467.com/handan/co/75650.htm
邱县福腾儿童玩具经销处的商铺,http://handan075650.11467.com
武义踏雪无痕休闲用品有限公司,http:////www.11467.com/jinhua/co/121840.htm
武义踏雪无痕休闲用品有限公司的商铺,http://jinhua0121840.11467.com
邢台上梅工贸有限公司,http:////www.11467.com/xintai/co/39191.htm
邢台上梅工贸有限公司的商铺,http://xintai039191.11467.com
邢台市康贝儿童用品有限公司,http:////www.11467.com/xintai/co/57673.htm
邢台市康贝儿童用品有限公司的商铺,http://xintai057673.11467.com
平乡县强顺童车厂,http:////www.11467.com/xintai/co/57649.htm
平乡县强顺童车厂的商铺,http://xintai057649.11467.com
上海鑫磊娜童车配件有限公司,http:////www.11467.com/shanghai/co/448465.htm
上海鑫磊娜童车配件有限公司的商铺,http://shanghai0448465.11467.com
南京南易电子科技有限公司,http:////www.11467.com/nanjing/co/160211.htm
南京南易电子科技有限公司的商铺,http://nanjing0160211.11467.com
杭州艾贝斯儿童用品有限公司,http:////www.11467.com/hangzhou/co/371956.htm
杭州艾贝斯儿童用品有限公司的商铺,http://hangzhou0371956.11467.com
宁波睿宝婴童用品有限公司,http:////www.11467.com/ningbo/co/195545.htm
宁波睿宝婴童用品有限公司的商铺,http://ningbo0195545.11467.com
福建省英氏儿童用品有限公司,http:////www.11467.com/ningde/co/35350.htm
福建省英氏儿童用品有限公司的商铺,http://ningde035350.11467.com
佛山市火图腾商贸有限公司,http:////www.11467.com/foshan/co/69054.htm
佛山市火图腾商贸有限公司的商铺,http://foshan069054.11467.com
平乡县亚力鞍座厂,http:////www.11467.com/xintai/co/57655.htm
平乡县亚力鞍座厂的商铺,http://xintai057655.11467.com
汕头市澄海区广航达工艺玩具厂,http:////www.11467.com/shantou/co/115687.htm
汕头市澄海区广航达工艺玩具厂的商铺,http://shantou0115687.11467.com
深圳市全成弹簧五金有限公司,http:////www.11467.com/shenzhen/co/790379.htm
深圳市全成弹簧五金有限公司的商铺,http://shenzhen0790379.11467.com
广州市力博贸易发展有限公司,http:////www.11467.com/guangzhou/co/161451.htm
广州市力博贸易发展有限公司的商铺,http://guangzhou0161451.11467.com
东莞市鲲鹏机械有限公司,http:////www.11467.com/dongguan/co/468691.htm
东莞市鲲鹏机械有限公司的商铺,http://dongguan0468691.11467.com
汕头市澄海区集乐玩具厂,http:////www.11467.com/shantou/co/135887.htm
汕头市澄海区集乐玩具厂的商铺,http://shantou0135887.11467.com
崇川区美尚婴童用品销售中心,http:////www.11467.com/nantong/co/140588.htm
崇川区美尚婴童用品销售中心的商铺,http://nantong0140588.11467.com
汕头市澄海区星宇工艺玩具有限公司,http:////www.11467.com/shantou/co/140902.htm
汕头市澄海区星宇工艺玩具有限公司的商铺,http://shantou0140902.11467.com
汕头市澄海区亨力实业有限公司,http:////www.11467.com/shantou/co/141081.htm
汕头市澄海区亨力实业有限公司的商铺,http://shantou0141081.11467.com
陈耀付（个体经营）,http:////www.11467.com/shantou/co/141169.htm
陈耀付（个体经营）的商铺,http://shantou0141169.11467.com
汕头市澄海区创宇玩具厂,http:////www.11467.com/shantou/co/137348.htm
汕头市澄海区创宇玩具厂的商铺,http://shantou0137348.11467.com
金辉玩具实业有限公司,http:////www.11467.com/shantou/co/141032.htm
金辉玩具实业有限公司的商铺,http://shantou0141032.11467.com
旭瑞儿童用品厂,http:////www.11467.com/liaocheng/co/35106.htm
旭瑞儿童用品厂的商铺,http://liaocheng035106.11467.com
佛山市南海区丹灶得宝兴箱包玩具厂,http:////www.11467.com/foshan/co/214136.htm
佛山市南海区丹灶得宝兴箱包玩具厂的商铺,http://foshan0214136.11467.com
成都市金牛区吉祥蝴蝶童车批发部,http:////www.11467.com/chengdu/co/129683.htm
成都市金牛区吉祥蝴蝶童车批发部的商铺,http://chengdu0129683.11467.com
东莞市澳奇精品模型玩具有限公司,http:////www.11467.com/dongguan/co/164619.htm
东莞市澳奇精品模型玩具有限公司的商铺,http://dongguan0164619.11467.com
深圳市锦阳誉弹簧五金制造有限公司,http:////www.11467.com/shenzhen/co/146957.htm
深圳市锦阳誉弹簧五金制造有限公司的商铺,http://shenzhen0146957.11467.com
深圳市志远科技发展有限公司,http:////www.11467.com/shenzhen/co/723318.htm
深圳市志远科技发展有限公司的商铺,http://shenzhen0723318.11467.com
东莞市江胜实业有限公司,http:////www.11467.com/dongguan/co/127971.htm
东莞市江胜实业有限公司的商铺,http://dongguan0127971.11467.com
汕头市澄海区万利源玩具商行,http:////www.11467.com/shantou/co/151964.htm
汕头市澄海区万利源玩具商行的商铺,http://shantou0151964.11467.com
深圳市龙岗区布吉小牛牛玩具行,http:////www.11467.com/shenzhen/co/652834.htm
深圳市龙岗区布吉小牛牛玩具行的商铺,http://shenzhen0652834.11467.com
汕头市澄海区智多星玩具礼品有限公司,http:////www.11467.com/shantou/co/117829.htm
汕头市澄海区智多星玩具礼品有限公司的商铺,http://shantou0117829.11467.com
东莞市寮步楠翔五金制品厂,http:////www.11467.com/dongguan/co/306431.htm
东莞市寮步楠翔五金制品厂的商铺,http://dongguan0306431.11467.com
邢台市宝康自行车有限公司,http:////www.11467.com/xintai/co/39192.htm
邢台市宝康自行车有限公司的商铺,http://xintai039192.11467.com
揭阳市东山区嘉豪五金工艺制品厂,http:////www.11467.com/jieyang/co/27491.htm
揭阳市东山区嘉豪五金工艺制品厂的商铺,http://jieyang027491.11467.com
曲周县志申力车配件厂,http:////www.11467.com/handan/co/68429.htm
曲周县志申力车配件厂的商铺,http://handan068429.11467.com
广州市越秀区林立玩具经营部,http:////www.11467.com/guangzhou/co/390214.htm
广州市越秀区林立玩具经营部的商铺,http://guangzhou0390214.11467.com
慈溪市贝之家儿童用品有限公司,http:////www.11467.com/ningbo/co/192599.htm
慈溪市贝之家儿童用品有限公司的商铺,http://ningbo0192599.11467.com
东莞市虎门盛海布料经营部,http:////www.11467.com/dongguan/co/556430.htm
东莞市虎门盛海布料经营部的商铺,http://dongguan0556430.11467.com
汕头市海之宝贸易有限公司,http:////www.11467.com/shantou/co/144044.htm
汕头市海之宝贸易有限公司的商铺,http://shantou0144044.11467.com
深圳市龙岗区信成玩具商行,http:////www.11467.com/shenzhen/co/674577.htm
深圳市龙岗区信成玩具商行的商铺,http://shenzhen0674577.11467.com
河北昊恒自行车制造有限公司,http:////www.11467.com/xintai/co/56018.htm
河北昊恒自行车制造有限公司的商铺,http://xintai056018.11467.com
汕头市民信制衣有限公司,http:////www.11467.com/shantou/co/148855.htm
汕头市民信制衣有限公司的商铺,http://shantou0148855.11467.com
绍兴县柯桥信销玩具店,http:////www.11467.com/shaoxing/co/127054.htm
绍兴县柯桥信销玩具店的商铺,http://shaoxing0127054.11467.com
广州市富可士商贸有限公司,http:////www.11467.com/guangzhou/co/495851.htm
广州市富可士商贸有限公司的商铺,http://guangzhou0495851.11467.com
平湖欣尚贸易有限公司,http:////www.11467.com/jiaxing/co/115309.htm
平湖欣尚贸易有限公司的商铺,http://jiaxing0115309.11467.com
汕头市澄海区新沃玩具商行,http:////www.11467.com/shantou/co/152167.htm
汕头市澄海区新沃玩具商行的商铺,http://shantou0152167.11467.com
深圳市豪族自行车有限公司,http:////www.11467.com/shenzhen/co/311738.htm
深圳市豪族自行车有限公司的商铺,http://shenzhen0311738.11467.com
汕头市澄海区澳航玩具厂,http:////www.11467.com/shantou/co/149795.htm
汕头市澄海区澳航玩具厂的商铺,http://shantou0149795.11467.com
平乡县恒捷自行车零件厂,http:////www.11467.com/xintai/co/39428.htm
平乡县恒捷自行车零件厂的商铺,http://xintai039428.11467.com
昆山锐志机电科技有限公司,http:////www.11467.com/suzhou/co/313111.htm
昆山锐志机电科技有限公司的商铺,http://suzhou0313111.11467.com
太仓鸣飞塑业有限公司,http:////www.11467.com/suzhou/co/356638.htm
太仓鸣飞塑业有限公司的商铺,http://suzhou0356638.11467.com
台州市台纱塑业有限公司,http:////www.11467.com/taizhou/co/78834.htm
台州市台纱塑业有限公司的商铺,http://taizhou078834.11467.com
西安永利科技发展有限公司,http:////www.11467.com/xian/co/72743.htm
西安永利科技发展有限公司的商铺,http://xian072743.11467.com
汕头市全盛玩具有限公司,http:////www.11467.com/shantou/co/117786.htm
汕头市全盛玩具有限公司的商铺,http://shantou0117786.11467.com
汕头市澄海区天狼星玩具厂,http:////www.11467.com/shantou/co/140040.htm
汕头市澄海区天狼星玩具厂的商铺,http://shantou0140040.11467.com
深圳市宝安区沙井永盛兴童车商行,http:////www.11467.com/shenzhen/co/757833.htm
深圳市宝安区沙井永盛兴童车商行的商铺,http://shenzhen0757833.11467.com
广州市番禺区钟村威健自行车店,http:////www.11467.com/guangzhou/co/495651.htm
广州市番禺区钟村威健自行车店的商铺,http://guangzhou0495651.11467.com
合肥市爱伢伢母婴用品有限公司,http:////www.11467.com/hefei/co/112873.htm
合肥市爱伢伢母婴用品有限公司的商铺,http://hefei0112873.11467.com
广州童时童地玩具有限公司,http:////www.11467.com/guangzhou/co/429836.htm
广州童时童地玩具有限公司的商铺,http://guangzhou0429836.11467.com
上海鹿鹿童车有限公司,http:////www.11467.com/shanghai/co/1034731.htm
上海鹿鹿童车有限公司的商铺,http://shanghai01034731.11467.com
长沙三扬电气机械有限公司,http:////www.11467.com/changsha/co/121449.htm
长沙三扬电气机械有限公司的商铺,http://changsha0121449.11467.com
宁波市江东颖贝儿童用品有限公司,http:////www.11467.com/ningbo/co/132970.htm
宁波市江东颖贝儿童用品有限公司的商铺,http://ningbo0132970.11467.com
郑州来宾儿童用品有限公司,http:////www.11467.com/zhengzhou/co/137922.htm
郑州来宾儿童用品有限公司的商铺,http://zhengzhou0137922.11467.com
平乡县飞虎气筒制造厂,http:////www.11467.com/xintai/co/39361.htm
平乡县飞虎气筒制造厂的商铺,http://xintai039361.11467.com
南京市鼓楼区妈咪宝日用百货商行,http:////www.11467.com/nanjing/co/160129.htm
南京市鼓楼区妈咪宝日用百货商行的商铺,http://nanjing0160129.11467.com
郑州市中原好宝宝童车厂,http:////www.11467.com/zhengzhou/co/137921.htm
郑州市中原好宝宝童车厂的商铺,http://zhengzhou0137921.11467.com
东莞市东坑隆信木业制品厂,http:////www.11467.com/dongguan/co/164371.htm
东莞市东坑隆信木业制品厂的商铺,http://dongguan0164371.11467.com
嘉善巨威紧固件有限公司,http:////www.11467.com/jiaxing/co/83883.htm
嘉善巨威紧固件有限公司的商铺,http://jiaxing083883.11467.com
邢台恒鹏车业有限公司,http:////www.11467.com/xintai/co/39233.htm
邢台恒鹏车业有限公司的商铺,http://xintai039233.11467.com
郑州源泰塑料制品有限公司,http:////www.11467.com/zhengzhou/co/264332.htm
郑州源泰塑料制品有限公司的商铺,http://zhengzhou0264332.11467.com
广州派卡其文化传播有限公司,http:////www.11467.com/guangzhou/co/753067.htm
广州派卡其文化传播有限公司的商铺,http://guangzhou0753067.11467.com
义乌市帕川电子商务商行,http:////www.11467.com/jinhua/co/231473.htm
义乌市帕川电子商务商行的商铺,http://jinhua0231473.11467.com
邢台乐智儿童玩具制造有限公司,http:////www.11467.com/xintai/co/103802.htm
邢台乐智儿童玩具制造有限公司的商铺,http://xintai0103802.11467.com
邢台市洋洲自行车零件有限公司,http:////www.11467.com/xintai/co/57530.htm
邢台市洋洲自行车零件有限公司的商铺,http://xintai057530.11467.com
汕头市澄海区西西玩具有限公司,http:////www.11467.com/shantou/co/144079.htm
汕头市澄海区西西玩具有限公司的商铺,http://shantou0144079.11467.com
佛山市南海区国庭童车商行,http:////www.11467.com/foshan/co/280499.htm
佛山市南海区国庭童车商行的商铺,http://foshan0280499.11467.com
芜湖市宝艺游乐设备公司,http:////www.11467.com/wuhu/co/36763.htm
芜湖市宝艺游乐设备公司的商铺,http://wuhu036763.11467.com
上海利纯信息科技有限公司,http:////www.11467.com/shanghai/co/1284081.htm
上海利纯信息科技有限公司的商铺,http://shanghai01284081.11467.com
深圳大成游乐设备有限公司,http:////www.11467.com/shenzhen/co/861171.htm
深圳大成游乐设备有限公司的商铺,http://shenzhen0861171.11467.com
佛山市宜林科技贸易有限公司,http:////www.11467.com/foshan/co/356085.htm
佛山市宜林科技贸易有限公司的商铺,http://foshan0356085.11467.com
东莞市民迪贸易有限公司,http:////www.11467.com/dongguan/co/516143.htm
东莞市民迪贸易有限公司的商铺,http://dongguan0516143.11467.com
汕头市金平区丽海日用品商行,http:////www.11467.com/shantou/co/151992.htm
汕头市金平区丽海日用品商行的商铺,http://shantou0151992.11467.com
平乡县飞龙童车厂,http:////www.11467.com/xintai/co/39452.htm
平乡县飞龙童车厂的商铺,http://xintai039452.11467.com
平乡县广鑫车业有限公司,http:////www.11467.com/xintai/co/57412.htm
平乡县广鑫车业有限公司的商铺,http://xintai057412.11467.com
平乡县老张自行车配件门市,http:////www.11467.com/xintai/co/57463.htm
平乡县老张自行车配件门市的商铺,http://xintai057463.11467.com
江山市兴盛木制品厂,http:////www.11467.com/quzhou/co/36119.htm
江山市兴盛木制品厂的商铺,http://quzhou036119.11467.com
广宗县小博士童车厂,http:////www.11467.com/xintai/co/57674.htm
广宗县小博士童车厂的商铺,http://xintai057674.11467.com
杭州津美思辰动漫有限公司,http:////www.11467.com/hangzhou/co/391307.htm
杭州津美思辰动漫有限公司的商铺,http://hangzhou0391307.11467.com
佛山尚益信息科技有限公司,http:////www.11467.com/qiye/93066631.htm
佛山尚益信息科技有限公司的商铺,http://93066631.b2b.11467.com
武汉万家心儿童用品有限公司,http:////www.11467.com/wuhan/co/150677.htm
武汉万家心儿童用品有限公司的商铺,http://wuhan0150677.11467.com
中山市家力宝五金制品有限公司,http:////www.11467.com/zhongshan/co/104814.htm
中山市家力宝五金制品有限公司的商铺,http://zhongshan0104814.11467.com
中山市东升镇源旭塑料五金制品厂,http:////www.11467.com/zhongshan/co/118253.htm
中山市东升镇源旭塑料五金制品厂的商铺,http://zhongshan0118253.11467.com
汕头市澄海区耀德塑胶制品厂,http:////www.11467.com/shantou/co/149381.htm
汕头市澄海区耀德塑胶制品厂的商铺,http://shantou0149381.11467.com
厦门欣新一代商贸有限公司,http:////www.11467.com/xiamen/co/103455.htm
厦门欣新一代商贸有限公司的商铺,http://xiamen0103455.11467.com
泉州市源界网络科技有限公司,http:////www.11467.com/quanzhou/co/147203.htm
泉州市源界网络科技有限公司的商铺,http://quanzhou0147203.11467.com
中山市慧婴宝儿童用品有限公司,http:////www.11467.com/zhongshan/co/146928.htm
中山市东区骏侨日用品贸易行,http:////www.11467.com/zhongshan/co/111023.htm
中山市东升镇童乐日用制品厂,http:////www.11467.com/zhongshan/co/111019.htm
宁波环球娃娃婴童用品有限公司,http:////www.11467.com/ningbo/co/29575.htm
河南鹤壁市淇滨区黄河路爱宝贝童装店,http:////www.11467.com/hebi/co/9641.htm
骑乐溶溶五金自行车行,http:////www.11467.com/hezhou/co/5517.htm
贸广儿童用品批发部,http:////www.11467.com/jian/co/16567.htm
零玖健身器材有限公司,http:////www.11467.com/jian/co/16580.htm
贝迪童车经营部,http:////www.11467.com/jincheng/co/18114.htm
紫怡童车童床专卖店,http:////www.11467.com/anshun/co/8606.htm
董金丽（个体经营）,http:////www.11467.com/baoshan/co/9713.htm
恒达童车批发部,http:////www.11467.com/datong/co/15405.htm
明门(中国)幼童用品有限公司,http:////www.11467.com/dongguan/co/148845.htm
丁党龙童车行,http:////www.11467.com/erlianhaote/co/823.htm
国柱(个体经商),http:////www.11467.com/guigang/co/6786.htm
小陈童车玩具店,http:////www.11467.com/guyuan/co/5794.htm
余月（个体经营）,http:////www.11467.com/anshun/co/8613.htm
承德市双滦区酷贝玩具超市,http:////www.11467.com/chengde/co/23047.htm
锐途童车贸易有限公司,http:////www.11467.com/guangzhou/co/465229.htm
贵港蓝星婴儿用品有限公司,http:////www.11467.com/guigang/co/6778.htm
陈红儿童车商店,http:////www.11467.com/huludao/co/43820.htm
荆门鑫鸿商贸有限公司,http:////www.11467.com/jingmen/co/15422.htm
爱国玩具童车商行,http:////www.11467.com/jingzhou/co/28296.htm
李秀锋（个体经营）,http:////www.11467.com/jixi/co/20767.htm
红河儿童车行,http:////www.11467.com/laibin/co/4444.htm
硕士儿童用品有限公司,http:////www.11467.com/leshan/co/20760.htm
刘九如（个体经营）,http:////www.11467.com/linfen/co/32607.htm
童车玩具批发公司,http:////www.11467.com/linxia/co/6753.htm
王省伟（个体经营）,http:////www.11467.com/linyi/co/71043.htm
安徽六安酷豆丁儿童用品有限公司,http:////www.11467.com/liuan/co/15797.htm
王焱个体经营,http:////www.11467.com/liuan/co/15798.htm
神通童车销售公司,http:////www.11467.com/liuan/co/15794.htm
湖南娄底大业日用制品厂,http:////www.11467.com/loudi/co/18278.htm
周沪江（个体经营）,http:////www.11467.com/loudi/co/18283.htm
漯河市电子商行,http:////www.11467.com/luohe/co/18198.htm
海玲数码有限公司,http:////www.11467.com/luzhou/co/18252.htm
冯伟涛（个体经营）,http:////www.11467.com/mudanjiang/co/49220.htm
龙开春（个体经营）,http:////www.11467.com/nanchong/co/25387.htm
南充鑫新贸易公司,http:////www.11467.com/nanchong/co/25376.htm
正润公司业务代销点,http:////www.11467.com/nanchong/co/25393.htm
飞翔学生用品公司,http:////www.11467.com/nanchong/co/25389.htm
包巧红（个体经营）,http:////www.11467.com/quzhou/co/23943.htm
三明市五星车行贸易有限公司,http:////www.11467.com/sanming/co/31806.htm
郑雪梅（个体经营）,http:////www.11467.com/sanming/co/31809.htm
吴永清（个体经营）,http:////www.11467.com/shiyan/co/30942.htm
贝贝童鞋有效公司,http:////www.11467.com/shizuishan/co/9981.htm
黑龙江省绥化市美美儿童健身器公司,http:////www.11467.com/suihua/co/14656.htm
翟开平（个体经营）,http:////www.11467.com/suining/co/9253.htm
天真童车有限公司,http:////www.11467.com/suining/co/9244.htm
安徽宿州好孩子童车店,http:////www.11467.com/suzhoushi/co/18681.htm
上海明晶贸易宿州有限公司,http:////www.11467.com/suzhoushi/co/18685.htm
中飞儿童用品有限公司,http:////www.11467.com/suzhoushi/co/18697.htm
台州市黄岩源源塑模机械有限公司,http:////www.11467.com/taizhou/co/101329.htm
叶杏花(个体经营),http:////www.11467.com/taizhou/co/101336.htm
贵州铜仁电信分公司线务站,http:////www.11467.com/tongren/co/7690.htm
梧州创新思维婴幼产品有限公司,http:////www.11467.com/wuzhou/co/17362.htm
赵恒江（个体经营）,http:////www.11467.com/xiantao/co/14756.htm
