香港华夏风实业公司,http:////www.11467.com/dongguan/co/414664.htm
香港华夏风实业公司的商铺,http://dongguan0414664.11467.com
香港华夏风实业有限公司,http:////www.11467.com/dongguan/co/415122.htm
香港华夏风实业有限公司的商铺,http://dongguan0415122.11467.com
东莞市桥头桥峰印刷厂,http:////www.11467.com/dongguan/co/10882.htm
东莞市桥头桥峰印刷厂的商铺,http://dongguan010882.11467.com
广州丹哪文体用品有限公司,http:////www.11467.com/guangzhou/co/161570.htm
广州丹哪文体用品有限公司的商铺,http://guangzhou0161570.11467.com
广州市番禺区桥南利彩玩具厂,http:////www.11467.com/guangzhou/co/161384.htm
广州市番禺区桥南利彩玩具厂的商铺,http://guangzhou0161384.11467.com
嘉兴市南湖纸品纸箱厂,http:////www.11467.com/jiaxing/co/3472.htm
嘉兴市南湖纸品纸箱厂的商铺,http://jiaxing03472.11467.com
上海汤革实业有限公司,http:////www.11467.com/shanghai/co/1014454.htm
上海汤革实业有限公司的商铺,http://shanghai01014454.11467.com
深圳市宝安区观澜博雅兴文具经营部,http:////www.11467.com/shenzhen/co/728035.htm
深圳市宝安区观澜博雅兴文具经营部的商铺,http://shenzhen0728035.11467.com
饶志珍(个体经营),http:////www.11467.com/jinhua/co/80101.htm
饶志珍(个体经营)的商铺,http://jinhua080101.11467.com
上海奇智文体用品有限公司,http:////www.11467.com/jinhua/co/80100.htm
上海奇智文体用品有限公司的商铺,http://jinhua080100.11467.com
温州市科升文具有限公司,http:////www.11467.com/shaoxing/co/81725.htm
温州市科升文具有限公司的商铺,http://shaoxing081725.11467.com
沈阳市亮美文化传媒策划有限公司,http:////www.11467.com/shenyang/co/56041.htm
沈阳市亮美文化传媒策划有限公司的商铺,http://shenyang056041.11467.com
唐山奇佳包装有限公司,http:////www.11467.com/tangshan/co/38421.htm
唐山奇佳包装有限公司的商铺,http://tangshan038421.11467.com
珠海市新金业彩色印务有限公司,http:////www.11467.com/zhuhai/co/8294.htm
珠海市新金业彩色印务有限公司的商铺,http://zhuhai08294.11467.com
浙江金谷包装印刷有限公司,http:////www.11467.com/shanghai/co/683579.htm
浙江金谷包装印刷有限公司的商铺,http://shanghai0683579.11467.com
东莞市花城丰林文具有限公司,http:////www.11467.com/dongguan/co/164479.htm
东莞市花城丰林文具有限公司的商铺,http://dongguan0164479.11467.com
深圳市大江南皮具制品有限公司,http:////www.11467.com/shenzhen/co/729877.htm
深圳市大江南皮具制品有限公司的商铺,http://shenzhen0729877.11467.com
探伟文具礼品有限公司,http:////www.11467.com/nanjing/co/114845.htm
探伟文具礼品有限公司的商铺,http://nanjing0114845.11467.com
深圳市利博文具厂,http:////www.11467.com/shenzhen/co/731252.htm
深圳市利博文具厂的商铺,http://shenzhen0731252.11467.com
成都八百里广告传播有限公司,http:////www.11467.com/chengdu/co/2584.htm
成都八百里广告传播有限公司的商铺,http://chengdu02584.11467.com
广东圣鹿太平洋文化用品有限公司,http:////www.11467.com/guangzhou/co/23392.htm
广东圣鹿太平洋文化用品有限公司的商铺,http://guangzhou023392.11467.com
广州天灏包装有限公司,http:////www.11467.com/guangzhou/co/433208.htm
广州天灏包装有限公司的商铺,http://guangzhou0433208.11467.com
苏州探伟文具礼品有限公司,http:////www.11467.com/suzhou/co/270299.htm
苏州探伟文具礼品有限公司的商铺,http://suzhou0270299.11467.com
白荣氽（个体经营户）,http:////www.11467.com/wenzhou/co/169241.htm
白荣氽（个体经营户）的商铺,http://wenzhou0169241.11467.com
东莞市卓越办公用品有限公司,http:////www.11467.com/dongguan/co/421603.htm
东莞市卓越办公用品有限公司的商铺,http://dongguan0421603.11467.com
深圳市钲昊印刷有限公司,http:////www.11467.com/shenzhen/co/272277.htm
深圳市钲昊印刷有限公司的商铺,http://shenzhen0272277.11467.com
浙江得力佳文具有限公司,http:////www.11467.com/taizhou/co/99910.htm
浙江得力佳文具有限公司的商铺,http://taizhou099910.11467.com
昆山印汉纸品有限公司,http:////www.11467.com/suzhou/co/398560.htm
昆山印汉纸品有限公司的商铺,http://suzhou0398560.11467.com
广州领豪文具有限公司,http:////www.11467.com/guangzhou/co/455504.htm
广州领豪文具有限公司的商铺,http://guangzhou0455504.11467.com
苏州至尊礼品有限公司,http:////www.11467.com/suzhou/co/270194.htm
苏州至尊礼品有限公司的商铺,http://suzhou0270194.11467.com
香港华夏风皮具有限公司,http:////www.11467.com/dongguan/co/415445.htm
香港华夏风皮具有限公司的商铺,http://dongguan0415445.11467.com
汕头市华立文具纸品印刷厂,http:////www.11467.com/shantou/co/144439.htm
汕头市华立文具纸品印刷厂的商铺,http://shantou0144439.11467.com
东莞市虎门宝达文具贸易部,http:////www.11467.com/dongguan/co/337231.htm
东莞市虎门宝达文具贸易部的商铺,http://dongguan0337231.11467.com
苍南县温鑫工艺礼品有限公司,http:////www.11467.com/baoding/co/91417.htm
苍南县温鑫工艺礼品有限公司的商铺,http://baoding091417.11467.com
深圳市金典文化用品有限公司,http:////www.11467.com/shenzhen/co/66163.htm
深圳市金典文化用品有限公司的商铺,http://shenzhen066163.11467.com
广州市杰卓印务有限公司,http:////www.11467.com/guangzhou/co/455430.htm
广州市杰卓印务有限公司的商铺,http://guangzhou0455430.11467.com
贵阳文丰贸易有限责任公司,http:////www.11467.com/guiyang/co/66956.htm
贵阳文丰贸易有限责任公司的商铺,http://guiyang066956.11467.com
苍南克斌制袋厂,http:////www.11467.com/baoding/co/91232.htm
苍南克斌制袋厂的商铺,http://baoding091232.11467.com
苍南县春天文具厂,http:////www.11467.com/baoding/co/91341.htm
苍南县春天文具厂的商铺,http://baoding091341.11467.com
苍南县振锐工艺礼品厂,http:////www.11467.com/wenzhou/co/216186.htm
苍南县振锐工艺礼品厂的商铺,http://wenzhou0216186.11467.com
苍南县龙港宝利惠文具用品厂,http:////www.11467.com/baoding/co/91187.htm
苍南县龙港宝利惠文具用品厂的商铺,http://baoding091187.11467.com
苏州市笑之源礼品有限公司,http:////www.11467.com/suzhou/co/300082.htm
苏州市笑之源礼品有限公司的商铺,http://suzhou0300082.11467.com
平阳县卓越文具经营部,http:////www.11467.com/wenzhou/co/169247.htm
平阳县卓越文具经营部的商铺,http://wenzhou0169247.11467.com
温州平阳县豪佳印业,http:////www.11467.com/wenzhou/co/169242.htm
温州平阳县豪佳印业的商铺,http://wenzhou0169242.11467.com
青岛广源办公用品有限公司,http:////www.11467.com/qingdao/co/151776.htm
青岛广源办公用品有限公司的商铺,http://qingdao0151776.11467.com
上海卓寻印务技术有限公司,http:////www.11467.com/shanghai/co/1046506.htm
上海卓寻印务技术有限公司的商铺,http://shanghai01046506.11467.com
苍南县嘉诚文具厂,http:////www.11467.com/wenzhou/co/218629.htm
苍南县嘉诚文具厂的商铺,http://wenzhou0218629.11467.com
苍南县苍彩文具经营部,http:////www.11467.com/wenzhou/co/161287.htm
苍南县苍彩文具经营部的商铺,http://wenzhou0161287.11467.com
温州平阳县豪佳印业,http:////www.11467.com/wenzhou/co/169242.htm
上海汤革实业有限公司销售部,http:////www.11467.com/shanghai/co/326257.htm
苏州市平江区摩漫城亚平日用品店,http:////www.11467.com/suzhou/co/269186.htm
苏州市平江区摩漫城亚平日用品店的商铺,http://suzhou0269186.11467.com
嘉兴市南湖区东栅卓越文体商店,http:////www.11467.com/jiaxing/co/81013.htm
嘉兴市南湖区东栅卓越文体商店的商铺,http://jiaxing081013.11467.com
苍南县金乡冠好文化用品厂,http:////www.11467.com/jinhua/co/80091.htm
苍南县金乡冠好文化用品厂的商铺,http://jinhua080091.11467.com
呼和浩特市新城区得仕办公用品经销部,http:////www.11467.com/huhehaote/co/27436.htm
呼和浩特市新城区得仕办公用品经销部的商铺,http://huhehaote027436.11467.com
临沂鑫旺文具纸品商行,http:////www.11467.com/linyi/co/68847.htm
临沂鑫旺文具纸品商行的商铺,http://linyi068847.11467.com
泉州市明德文具包装有限公司,http:////www.11467.com/quanzhou/co/2838.htm
泉州市明德文具包装有限公司的商铺,http://quanzhou02838.11467.com
三明市华博印刷有限公司,http:////www.11467.com/sanming/co/17620.htm
三明市华博印刷有限公司的商铺,http://sanming017620.11467.com
汕头市海洋集文具实业有限公司,http:////www.11467.com/shantou/co/135305.htm
汕头市海洋集文具实业有限公司的商铺,http://shantou0135305.11467.com
汕头市金平区伟岁文具厂,http:////www.11467.com/shantou/co/135317.htm
汕头市金平区伟岁文具厂的商铺,http://shantou0135317.11467.com
临沂市亚美纸品印务有限公司,http:////www.11467.com/linyi/co/68851.htm
临沂市亚美纸品印务有限公司的商铺,http://linyi068851.11467.com
临沂凯得晟纸品有限公司,http:////www.11467.com/linyi/co/68838.htm
临沂凯得晟纸品有限公司的商铺,http://linyi068838.11467.com
深圳市安顺纸品包装有限公司,http:////www.11467.com/shenzhen/co/148169.htm
深圳市安顺纸品包装有限公司的商铺,http://shenzhen0148169.11467.com
深圳市丰茂手袋皮具有限公司,http:////www.11467.com/shenzhen/co/149288.htm
深圳市丰茂手袋皮具有限公司的商铺,http://shenzhen0149288.11467.com
深圳市福田区旭东文具行,http:////www.11467.com/shenzhen/co/149356.htm
深圳市福田区旭东文具行的商铺,http://shenzhen0149356.11467.com
广州金亿利文具有限公司,http:////www.11467.com/shijiazhuang/co/82813.htm
广州金亿利文具有限公司的商铺,http://shijiazhuang082813.11467.com
深圳市罗湖区百众文具市场文联文具行,http:////www.11467.com/shenzhen/co/723190.htm
深圳市罗湖区百众文具市场文联文具行的商铺,http://shenzhen0723190.11467.com
汕头市金平区新华岁文具厂,http:////www.11467.com/shantou/co/135314.htm
汕头市金平区新华岁文具厂的商铺,http://shantou0135314.11467.com
临沂市华天印务有限公司,http:////www.11467.com/linyi/co/7172.htm
临沂市华天印务有限公司的商铺,http://linyi07172.11467.com
廊坊市旭日源印务有限公司,http:////www.11467.com/langfang/co/29968.htm
廊坊市旭日源印务有限公司的商铺,http://langfang029968.11467.com
GIFT-I,http:////www.11467.com/qingdao/co/108428.htm
GIFT-I的商铺,http://qingdao0108428.11467.com
深圳孛索皮具制品有限公司,http:////www.11467.com/shenzhen/co/363754.htm
深圳孛索皮具制品有限公司的商铺,http://shenzhen0363754.11467.com
绍兴县帝凡贸易有限公司,http:////www.11467.com/shaoxing/co/126972.htm
绍兴县帝凡贸易有限公司的商铺,http://shaoxing0126972.11467.com
苏州富恒商贸有限公司,http:////www.11467.com/suzhou/co/177768.htm
苏州富恒商贸有限公司的商铺,http://suzhou0177768.11467.com
深圳市华宇鑫皮具制品有限公司,http:////www.11467.com/shenzhen/co/810586.htm
深圳市华宇鑫皮具制品有限公司的商铺,http://shenzhen0810586.11467.com
深圳市飞达塑胶制品有限公司,http:////www.11467.com/shenzhen/co/391409.htm
深圳市飞达塑胶制品有限公司的商铺,http://shenzhen0391409.11467.com
义乌市城加市百货贸易有限公司,http:////www.11467.com/jinhua/co/83905.htm
义乌市城加市百货贸易有限公司的商铺,http://jinhua083905.11467.com
深圳市金源彩印刷设计有限公司,http:////www.11467.com/shenzhen/co/278057.htm
深圳市金源彩印刷设计有限公司的商铺,http://shenzhen0278057.11467.com
深圳市协和兴五金塑胶制品有限公司,http:////www.11467.com/shenzhen/co/277594.htm
深圳市协和兴五金塑胶制品有限公司的商铺,http://shenzhen0277594.11467.com
苍南县正森印刷厂,http:////www.11467.com/wenzhou/co/220351.htm
苍南县正森印刷厂的商铺,http://wenzhou0220351.11467.com
苍南县金狮印刷厂,http:////www.11467.com/wenzhou/co/135998.htm
苍南县金狮印刷厂的商铺,http://wenzhou0135998.11467.com
鲜真综合文具(深圳)有限公司,http:////www.11467.com/shenzhen/co/648303.htm
鲜真综合文具(深圳)有限公司的商铺,http://shenzhen0648303.11467.com
深圳市伟艺时尚礼品有限公司,http:////www.11467.com/shenzhen/co/592678.htm
深圳市伟艺时尚礼品有限公司的商铺,http://shenzhen0592678.11467.com
深圳市思派硅胶电子有限公司,http:////www.11467.com/shenzhen/co/224579.htm
深圳市思派硅胶电子有限公司的商铺,http://shenzhen0224579.11467.com
深圳市美恩达科技有限公司,http:////www.11467.com/shenzhen/co/149310.htm
深圳市美恩达科技有限公司的商铺,http://shenzhen0149310.11467.com
深圳市美好光声电子制品厂,http:////www.11467.com/shenzhen/co/224377.htm
深圳市美好光声电子制品厂的商铺,http://shenzhen0224377.11467.com
深圳市明臻文具有限公司,http:////www.11467.com/shenzhen/co/648892.htm
深圳市明臻文具有限公司的商铺,http://shenzhen0648892.11467.com
兰州雪马贸易有限责任公司,http:////www.11467.com/lanzhou/co/61504.htm
兰州雪马贸易有限责任公司的商铺,http://lanzhou061504.11467.com
临沂市汉邦纸业有限公司,http:////www.11467.com/linyi/co/66829.htm
临沂市汉邦纸业有限公司的商铺,http://linyi066829.11467.com
临沂华信文化用品有限公司,http:////www.11467.com/linyi/co/58981.htm
临沂华信文化用品有限公司的商铺,http://linyi058981.11467.com
湖州康山街道博卡电脑经营部,http:////www.11467.com/huzhou/co/71310.htm
湖州康山街道博卡电脑经营部的商铺,http://huzhou071310.11467.com
宁波北仑永旭塑料工贸有限公司,http:////www.11467.com/ningbo/co/193542.htm
宁波北仑永旭塑料工贸有限公司的商铺,http://ningbo0193542.11467.com
深圳市五环文具有限公司,http:////www.11467.com/shenzhen/co/643663.htm
深圳市五环文具有限公司的商铺,http://shenzhen0643663.11467.com
深圳三田五金制品有限公司,http:////www.11467.com/shenzhen/co/253608.htm
深圳三田五金制品有限公司的商铺,http://shenzhen0253608.11467.com
深圳市大明印刷有限公司,http:////www.11467.com/shenzhen/co/277560.htm
深圳市大明印刷有限公司的商铺,http://shenzhen0277560.11467.com
深圳市锦瑞塑胶制品有限公司,http:////www.11467.com/shenzhen/co/225169.htm
深圳市锦瑞塑胶制品有限公司的商铺,http://shenzhen0225169.11467.com
深圳市翔和印刷有限公司,http:////www.11467.com/shenzhen/co/651813.htm
深圳市翔和印刷有限公司的商铺,http://shenzhen0651813.11467.com
苍南县金乡隆昇皮具厂,http:////www.11467.com/wenzhou/co/217422.htm
苍南县金乡隆昇皮具厂的商铺,http://wenzhou0217422.11467.com
苍南县龙港博朗文具用品厂,http:////www.11467.com/wenzhou/co/217427.htm
苍南县龙港博朗文具用品厂的商铺,http://wenzhou0217427.11467.com
平阳县欧克皮具厂,http:////www.11467.com/wenzhou/co/217421.htm
平阳县欧克皮具厂的商铺,http://wenzhou0217421.11467.com
平阳县铭希文具厂,http:////www.11467.com/wenzhou/co/169893.htm
平阳县铭希文具厂的商铺,http://wenzhou0169893.11467.com
阳江市杰斐包装材料有限公司,http:////www.11467.com/yangjiang/co/13709.htm
阳江市杰斐包装材料有限公司的商铺,http://yangjiang013709.11467.com
苍南县丽杰皮具有限公司,http:////www.11467.com/wenzhou/co/280006.htm
苍南县丽杰皮具有限公司的商铺,http://wenzhou0280006.11467.com
东莞市唐风皮具实业有限公司,http:////www.11467.com/dongguan/co/557808.htm
东莞市唐风皮具实业有限公司的商铺,http://dongguan0557808.11467.com
北京益高永业商贸中心,http:////www.11467.com/beijing/co/30246.htm
北京益高永业商贸中心的商铺,http://beijing030246.11467.com
上海源辉文具厂,http:////www.11467.com/shanghai/co/809150.htm
上海源辉文具厂的商铺,http://shanghai0809150.11467.com
上海鑫谷办公用品有限公司,http:////www.11467.com/shanghai/co/683596.htm
上海鑫谷办公用品有限公司的商铺,http://shanghai0683596.11467.com
上海特璐依经贸有限公司,http:////www.11467.com/shanghai/co/88345.htm
上海特璐依经贸有限公司的商铺,http://shanghai088345.11467.com
上海联博统达文具有限公司,http:////www.11467.com/shanghai/co/1014582.htm
上海联博统达文具有限公司的商铺,http://shanghai01014582.11467.com
上海冬子文具礼品有限公司,http:////www.11467.com/shanghai/co/326327.htm
上海冬子文具礼品有限公司的商铺,http://shanghai0326327.11467.com
上海畅豪文化用品有限公司,http:////www.11467.com/shanghai/co/1014561.htm
上海畅豪文化用品有限公司的商铺,http://shanghai01014561.11467.com
上海贝壳文具礼品有限公司,http:////www.11467.com/shanghai/co/1014579.htm
上海贝壳文具礼品有限公司的商铺,http://shanghai01014579.11467.com
上海柏冠文具有限公司,http:////www.11467.com/shanghai/co/987920.htm
上海柏冠文具有限公司的商铺,http://shanghai0987920.11467.com
上海麦浪文化用品有限公司,http:////www.11467.com/shanghai/co/74255.htm
上海麦浪文化用品有限公司的商铺,http://shanghai074255.11467.com
上海键翔印务有限公司,http:////www.11467.com/shanghai/co/1014581.htm
上海键翔印务有限公司的商铺,http://shanghai01014581.11467.com
上海辉畅贸易有限公司,http:////www.11467.com/shanghai/co/1014566.htm
上海辉畅贸易有限公司的商铺,http://shanghai01014566.11467.com
厦门市翔安区翔富美五金加工厂,http:////www.11467.com/xiamen/co/68486.htm
厦门市翔安区翔富美五金加工厂的商铺,http://xiamen068486.11467.com
邢台尚品礼坊商贸有限公司,http:////www.11467.com/xintai/co/33225.htm
邢台尚品礼坊商贸有限公司的商铺,http://xintai033225.11467.com
成都市金牛区皓博文化用品批发部,http:////www.11467.com/chengdu/co/120943.htm
成都市金牛区皓博文化用品批发部的商铺,http://chengdu0120943.11467.com
天津市华敏文化用品销售中心,http:////www.11467.com/tianjin/co/99624.htm
天津市华敏文化用品销售中心的商铺,http://tianjin099624.11467.com
淄博明德玻璃有限公司,http:////www.11467.com/zibo/co/79864.htm
淄博明德玻璃有限公司的商铺,http://zibo079864.11467.com
上海锦顺文教用品有限公司,http:////www.11467.com/shanghai/co/743805.htm
上海锦顺文教用品有限公司的商铺,http://shanghai0743805.11467.com
上海康晋文化用品有限公司,http:////www.11467.com/shanghai/co/683581.htm
上海康晋文化用品有限公司的商铺,http://shanghai0683581.11467.com
镇江市金星印刷有限责任公司,http:////www.11467.com/zhenjiang/co/1839.htm
镇江市金星印刷有限责任公司的商铺,http://zhenjiang01839.11467.com
苏州精本堂文具礼品有限公司,http:////www.11467.com/suzhou/co/358104.htm
苏州精本堂文具礼品有限公司的商铺,http://suzhou0358104.11467.com
东莞市唐风皮具有限公司,http:////www.11467.com/dongguan/co/639409.htm
东莞市唐风皮具有限公司的商铺,http://dongguan0639409.11467.com
东莞市厚街广荣文具有限公司,http:////www.11467.com/dongguan/co/639494.htm
东莞市厚街广荣文具有限公司的商铺,http://dongguan0639494.11467.com
广东省深圳市佳佳文具有限公司,http:////www.11467.com/shenzhen/co/983290.htm
广东省深圳市佳佳文具有限公司的商铺,http://shenzhen0983290.11467.com
河南金林市场永信文具商行,http:////www.11467.com/zhengzhou/co/131709.htm
河南金林市场永信文具商行的商铺,http://zhengzhou0131709.11467.com
应城市君成石膏制品厂,http:////www.11467.com/xiaogan/co/5508.htm
应城市君成石膏制品厂的商铺,http://xiaogan05508.11467.com
鸿邮包装（常州）有限公司,http:////www.11467.com/changzhou/co/152969.htm
鸿邮包装（常州）有限公司的商铺,http://changzhou0152969.11467.com
浙江中佳文具有限公司,http:////www.11467.com/wenzhou/co/163002.htm
浙江中佳文具有限公司的商铺,http://wenzhou0163002.11467.com
温州市科升文具有限公司,http:////www.11467.com/wenzhou/co/162420.htm
温州市科升文具有限公司的商铺,http://wenzhou0162420.11467.com
上海逸度文具有限公司,http:////www.11467.com/shanghai/co/1065239.htm
上海逸度文具有限公司的商铺,http://shanghai01065239.11467.com
上海丕丕文具有限公司,http:////www.11467.com/shanghai/co/1107557.htm
上海丕丕文具有限公司的商铺,http://shanghai01107557.11467.com
平阳县吉彩文具厂,http:////www.11467.com/wenzhou/co/342932.htm
平阳县吉彩文具厂的商铺,http://wenzhou0342932.11467.com
东莞市荣悦商贸有限公司,http:////www.11467.com/dongguan/co/601352.htm
东莞市荣悦商贸有限公司的商铺,http://dongguan0601352.11467.com
平阳县舒君文具厂,http:////www.11467.com/wenzhou/co/267740.htm
平阳县舒君文具厂的商铺,http://wenzhou0267740.11467.com
东莞市企石赛卡奴皮具制品厂,http:////www.11467.com/dongguan/co/572498.htm
东莞市企石赛卡奴皮具制品厂的商铺,http://dongguan0572498.11467.com
天津市津强纸业有限公司,http:////www.11467.com/tianjin/co/102144.htm
天津市津强纸业有限公司的商铺,http://tianjin0102144.11467.com
东莞市厚街广荣文具制品厂,http:////www.11467.com/dongguan/co/557571.htm
东莞市厚街广荣文具制品厂的商铺,http://dongguan0557571.11467.com
上海威传实业有限公司,http:////www.11467.com/shanghai/co/1035127.htm
上海威传实业有限公司的商铺,http://shanghai01035127.11467.com
中山市小榄镇菊雅文具店,http:////www.11467.com/zhongshan/co/153160.htm
中山市小榄镇菊雅文具店的商铺,http://zhongshan0153160.11467.com
温州市今艺印业有限公司,http:////www.11467.com/wenzhou/co/217419.htm
温州市今艺印业有限公司的商铺,http://wenzhou0217419.11467.com
温州市心河文具有限公司,http:////www.11467.com/wenzhou/co/220319.htm
温州市心河文具有限公司的商铺,http://wenzhou0220319.11467.com
平阳县精点文具用品厂,http:////www.11467.com/wenzhou/co/219508.htm
平阳县精点文具用品厂的商铺,http://wenzhou0219508.11467.com
广州市跃强文化用品有限公司营销中心,http:////www.11467.com/guangzhou/co/434053.htm
广州市跃强文化用品有限公司营销中心的商铺,http://guangzhou0434053.11467.com
苍南县龙港信隆印业有限公司,http:////www.11467.com/baoding/co/91436.htm
苍南县龙港信隆印业有限公司的商铺,http://baoding091436.11467.com
苍南县华昊文具有限公司,http:////www.11467.com/wenzhou/co/219552.htm
苍南县华昊文具有限公司的商铺,http://wenzhou0219552.11467.com
广东圣鹿太平洋文化用品公司,http:////www.11467.com/guangzhou/co/362326.htm
临沂鑫达办公文具,http:////www.11467.com/linyi/co/77167.htm
杭州市下城区厚道礼品经营部,http:////www.11467.com/hangzhou/co/222348.htm
杭州市下城区厚道礼品经营部的商铺,http://hangzhou0222348.11467.com
江门市蓬江区科创摄影器材经营部,http:////www.11467.com/jiangmen/co/82156.htm
江门市蓬江区科创摄影器材经营部的商铺,http://jiangmen082156.11467.com
汕头市易得利文具实业有限公司,http:////www.11467.com/shantou/co/135323.htm
汕头市易得利文具实业有限公司的商铺,http://shantou0135323.11467.com
深圳市东进皮具有限公司,http:////www.11467.com/shenzhen/co/149588.htm
深圳市东进皮具有限公司的商铺,http://shenzhen0149588.11467.com
北京琦钰科技发展有限公司,http:////www.11467.com/beijing/co/126091.htm
北京琦钰科技发展有限公司的商铺,http://beijing0126091.11467.com
北京南天昊科贸有限责任公司,http:////www.11467.com/beijing/co/122995.htm
北京南天昊科贸有限责任公司的商铺,http://beijing0122995.11467.com
临沂批发城晨辉文化用品商行,http:////www.11467.com/linyi/co/107027.htm
临沂批发城晨辉文化用品商行的商铺,http://linyi0107027.11467.com
临沂市佳冠文具有限公司,http:////www.11467.com/linyi/co/66831.htm
临沂市佳冠文具有限公司的商铺,http://linyi066831.11467.com
嘉兴市秀城区兰生文化总汇有限责任公司,http:////www.11467.com/jiaxing/co/71920.htm
嘉兴市秀城区兰生文化总汇有限责任公司的商铺,http://jiaxing071920.11467.com
佛山市南海区友腾酒店用品厂,http:////www.11467.com/foshan/co/214010.htm
佛山市南海区友腾酒店用品厂的商铺,http://foshan0214010.11467.com
广州宝臣文化用品有限公司,http:////www.11467.com/guangzhou/co/161250.htm
广州宝臣文化用品有限公司的商铺,http://guangzhou0161250.11467.com
贵阳立兴会计账册印刷厂,http:////www.11467.com/guiyang/co/70354.htm
贵阳立兴会计账册印刷厂的商铺,http://guiyang070354.11467.com
义乌市温龙电子商务商行,http:////www.11467.com/jinhua/co/121704.htm
义乌市温龙电子商务商行的商铺,http://jinhua0121704.11467.com
苏州悦行户外用品有限公司,http:////www.11467.com/suzhou/co/309190.htm
苏州悦行户外用品有限公司的商铺,http://suzhou0309190.11467.com
陶水珍(个体经营),http:////www.11467.com/guangzhou/co/495388.htm
