广州市创笙演出器材有限公司,http:////www.11467.com/guangzhou/co/464775.htm
广州市明道桁架有限公司,http:////www.11467.com/guangzhou/co/461780.htm
淮北弘轩文化艺术传播有限公司,http:////www.11467.com/huaibei/co/13861.htm
东海县牛山镇七彩照明电器厂,http:////www.11467.com/lianyungang/co/33149.htm
马鞍山新起点科技有限公司,http:////www.11467.com/maanshan/co/20899.htm
广西南宁众美文化传媒有限公司,http:////www.11467.com/nanning/co/86964.htm
青岛达琪信息工程有限公司,http:////www.11467.com/qingdao/co/55155.htm
广西南宁明酷营销策划有限公司,http:////www.11467.com/nanning/co/85955.htm
杨文杰(个体经营),http:////www.11467.com/bayannaoer/co/4848.htm
湖南长沙智博节能自动化有限公司,http:////www.11467.com/changsha/co/121303.htm
成都明华音响灯光工程公司,http:////www.11467.com/chengdu/co/214950.htm
四川银屏科技有限公司(中国区域),http:////www.11467.com/chengdu/co/215052.htm
大同市恒达伟业科技有限公司,http:////www.11467.com/datong/co/15422.htm
佛山市民间艺术文化发展有限公司,http:////www.11467.com/foshan/co/306880.htm
广州励丰文化科技股份有限公司,http:////www.11467.com/guangzhou/co/460656.htm
广州海越灯光音响工程有限公司,http:////www.11467.com/guangzhou/co/461749.htm
河北华美光电子有限公司,http:////www.11467.com/beijing/co/701784.htm
深圳市拓明光电科技有限公司,http:////www.11467.com/shenzhen/co/787205.htm
新疆石河子天娱文化传媒有限公司,http:////www.11467.com/shihezi/co/6016.htm
阿鄚罗技术有限公司,http:////www.11467.com/wulanchabu/co/6039.htm
深圳市格明科技有限公司,http:////www.11467.com/shenzhen/co/764010.htm
深圳市大成美雅灯光音响技术有限公司,http:////www.11467.com/shenzhen/co/319517.htm
丽晶文化传播有限公司,http:////www.11467.com/xiaogan/co/20590.htm
西宁玛钿音响工程公司,http:////www.11467.com/xining/co/26825.htm
深圳市鑫彩光电有限公司,http:////www.11467.com/shenzhen/co/360659.htm
河北安基拖链制造有限公司,http:////www.11467.com/cangzhou/co/58706.htm
东莞市捷和光电有限公司,http:////www.11467.com/dongguan/co/479599.htm
东莞演出器材设备物料租凭有限公司,http:////www.11467.com/dongguan/co/508268.htm
汩罗市钰锋光电科技有限公司,http:////www.11467.com/foshan/co/339587.htm
广州漫美帝灯光设备有限公司,http:////www.11467.com/guangzhou/co/302506.htm
广州市超崴演出器材有限公司,http:////www.11467.com/guangzhou/co/477808.htm
广州番禺巨丰音响设备厂,http:////www.11467.com/guangzhou/co/390258.htm
广州格靓灯光厂(广州日格科技有限公司),http:////www.11467.com/guangzhou/co/464173.htm
广州市白云区石井美莱特舞台灯光设备厂,http:////www.11467.com/guangzhou/co/457819.htm
广州市白云区迦美舞台灯光设备厂,http:////www.11467.com/guangzhou/co/466544.htm
广州亚基贸易有限公司,http:////www.11467.com/guangzhou/co/479104.htm
广州市天河王牌灯饰经营部,http:////www.11467.com/guangzhou/co/28510.htm
广州万锐照明设备有限公司,http:////www.11467.com/guangzhou/co/461776.htm
广州市鑫王音响科技有限公司,http:////www.11467.com/guangzhou/co/458575.htm
广州星典光电科技有限公司,http:////www.11467.com/guangzhou/co/458677.htm
涌泉舞台灯光设备厂,http:////www.11467.com/guangzhou/co/470886.htm
广州世轩电声有限公司,http:////www.11467.com/guangzhou/co/479101.htm
广州桁架舞台音响设备厂,http:////www.11467.com/guangzhou/co/479106.htm
广州恒沅舞台灯光音响设备有限公司,http:////www.11467.com/guangzhou/co/229789.htm
梦豪舞台灯光器材厂,http:////www.11467.com/guangzhou/co/457462.htm
广州鑫达舞台灯光设备有限公司,http:////www.11467.com/guangzhou/co/479102.htm
广州市域声音响电子设备厂,http:////www.11467.com/guangzhou/co/469513.htm
上海东方音响器材有限公司,http:////www.11467.com/guangzhou/co/476390.htm
杭州华艺音响工程有限公司,http:////www.11467.com/hangzhou/co/182085.htm
江门市兰普灯饰电器有限公司,http:////www.11467.com/jiangmen/co/112965.htm
济南尚诚景观设计有限公司,http:////www.11467.com/jinan/co/134772.htm
霸州市煎茶铺华影五金制品厂,http:////www.11467.com/langfang/co/47745.htm
深圳市恒利信电子有限公司,http:////www.11467.com/shenzhen/co/551324.htm
深圳市鸿亚演艺器材租赁有限公司,http:////www.11467.com/shenzhen/co/780441.htm
深圳市秀骑士科技有限公司,http:////www.11467.com/shenzhen/co/782384.htm
深圳市新泽宇音响科技有限公司,http:////www.11467.com/shenzhen/co/763993.htm
香港雷色光电科技有限公司,http:////www.11467.com/shenzhen/co/770795.htm
泰兴市创新舞台设备有限公司深圳办,http:////www.11467.com/shenzhen/co/763982.htm
深圳美讯电子有限公司,http:////www.11467.com/shenzhen/co/42211.htm
十堰市聚城科技工程有限公司,http:////www.11467.com/shiyan/co/32732.htm
厦门市八佰度音响设备有限公司,http:////www.11467.com/xiamen/co/10292.htm
厦门海之声电子有限公司,http:////www.11467.com/xiamen/co/95831.htm
厦门湃声电子科技有限公司,http:////www.11467.com/xiamen/co/59189.htm
西安市碑林区精密弹性元件厂,http:////www.11467.com/xian/co/122947.htm
中山市古镇光色灯饰电器厂,http:////www.11467.com/zhongshan/co/144479.htm
中山市索迪照明电器有限公司,http:////www.11467.com/zhongshan/co/141554.htm
中山伊丽纳光电照明有限公司,http:////www.11467.com/zhongshan/co/149636.htm
北京瑞鸿舞台幕布有限公司,http:////www.11467.com/beijing/co/700721.htm
北京合力兄弟灯光音响租赁技术有限公司,http:////www.11467.com/beijing/co/701815.htm
北京世纪金铭文化传播有限公司,http:////www.11467.com/beijing/co/708866.htm
上海碟杰文化传播有限公司,http:////www.11467.com/shanghai/co/1041223.htm
清荫智能遮阳技术(重庆)有限公司,http:////www.11467.com/chongqing/co/205729.htm
武汉风采演艺器材有限公司,http:////www.11467.com/wuhan/co/175916.htm
潜江市征服舞台艺术创作有限公司,http:////www.11467.com/qianjiang/co/913.htm
长沙赛科科技有限公司,http:////www.11467.com/changsha/co/120991.htm
湖南秀缘演出器材租赁公司,http:////www.11467.com/changsha/co/121593.htm
常州武进区邹区音响经营部,http:////www.11467.com/changzhou/co/149084.htm
成都炎兴自动化工程有限公司,http:////www.11467.com/chengdu/co/213015.htm
博毅国际礼品有限公司,http:////www.11467.com/dongguan/co/497104.htm
东莞市茶山悦鑫五金塑胶制品厂,http:////www.11467.com/dongguan/co/422552.htm
东莞市奇峰音响器材工程有限公司,http:////www.11467.com/dongguan/co/68496.htm
东莞拓闪光电有限公司,http:////www.11467.com/dongguan/co/374029.htm
佛山传美庆典展览物料出租有限公司,http:////www.11467.com/foshan/co/340271.htm
广州得志电子科技有限公司,http:////www.11467.com/guangzhou/co/299014.htm
广州建生舞台设备有限公司业务部,http:////www.11467.com/guangzhou/co/391017.htm
广州科励舞台幕布有限公司,http:////www.11467.com/guangzhou/co/461777.htm
广州飞科舞台设备有限公司,http:////www.11467.com/guangzhou/co/464770.htm
广州利茂机械有限公司,http:////www.11467.com/guangzhou/co/461774.htm
广州凯星达舞台灯光科技有限公司,http:////www.11467.com/guangzhou/co/457780.htm
广州市博焱舞台灯光设备厂,http:////www.11467.com/guangzhou/co/461858.htm
创新铝制品有限公司,http:////www.11467.com/guangzhou/co/460617.htm
广州市番禺区沙湾合创五金厂,http:////www.11467.com/guangzhou/co/461762.htm
广州市博威专业音响有限公司,http:////www.11467.com/guangzhou/co/457067.htm
广州东方红舞台设备有限公司,http:////www.11467.com/guangzhou/co/476101.htm
广州神通数码科技公司(商务部),http:////www.11467.com/guangzhou/co/393733.htm
佰城音响有限公司,http:////www.11467.com/guangzhou/co/473291.htm
广州市东方红舞台特效设备厂,http:////www.11467.com/guangzhou/co/464754.htm
广州君韵辉音响设备有限公司,http:////www.11467.com/guangzhou/co/461759.htm
广州市白云区嘉森音箱电器厂,http:////www.11467.com/guangzhou/co/461760.htm
广州璟辉舞台灯光设备厂,http:////www.11467.com/guangzhou/co/461872.htm
广州市白云区恒源舞台灯光设备厂,http:////www.11467.com/guangzhou/co/458578.htm
广州金武士音响有限公司,http:////www.11467.com/guangzhou/co/476377.htm
广州市白云区信光达舞台灯光设备厂,http:////www.11467.com/guangzhou/co/458576.htm
广州市白云区石井友之诚舞台铝架设备厂,http:////www.11467.com/guangzhou/co/457480.htm
广州市白云区石井欧朗舞台灯光音响设备厂,http:////www.11467.com/guangzhou/co/461836.htm
广州市白云区石井锦声音响销售部,http:////www.11467.com/guangzhou/co/458571.htm
广州明浩电子科技有限公司,http:////www.11467.com/guangzhou/co/458559.htm
广州市海珠区先马电子厂,http:////www.11467.com/guangzhou/co/230816.htm
广州市凯世达舞台灯光厂,http:////www.11467.com/guangzhou/co/471499.htm
广州美欣视讯电子设备有限公司,http:////www.11467.com/guangzhou/co/464774.htm
广州市欧尔派舞台灯光设备有限公司,http:////www.11467.com/guangzhou/co/458574.htm
广州旻彩电子舞台灯光设备厂,http:////www.11467.com/guangzhou/co/473293.htm
广州市声功电子有限公司,http:////www.11467.com/guangzhou/co/458577.htm
广州宏升舞台灯光设备厂,http:////www.11467.com/guangzhou/co/471562.htm
广州市辉煌(国际)音响有限公司,http:////www.11467.com/guangzhou/co/468834.htm
广州市亚美舞台灯光音响设备厂(原雅利斯舞台灯光设备厂),http:////www.11467.com/guangzhou/co/461763.htm
广州市德美灯控设备厂,http:////www.11467.com/guangzhou/co/480391.htm
广州市乐匠电子有限公司,http:////www.11467.com/guangzhou/co/463835.htm
广州市白云区石井亿通舞台灯光设备厂,http:////www.11467.com/guangzhou/co/458572.htm
广州市鑫之瑞音响设备有限公司,http:////www.11467.com/guangzhou/co/469514.htm
广州镭盛舞台设备有限公司,http:////www.11467.com/guangzhou/co/263826.htm
广州耀纳舞台道具有限公司,http:////www.11467.com/guangzhou/co/464762.htm
广州国财舞台灯光设备厂,http:////www.11467.com/guangzhou/co/461764.htm
广州市美仕乐音响器材厂,http:////www.11467.com/guangzhou/co/461769.htm
广州卫凯电子科技有限公司,http:////www.11467.com/guangzhou/co/471492.htm
广州市白云区石井新奇乐舞台灯光设备厂,http:////www.11467.com/guangzhou/co/458588.htm
广州市白云区新市伟宝雷电机厂,http:////www.11467.com/guangzhou/co/461761.htm
广州维升舞台灯光设备有限公司,http:////www.11467.com/guangzhou/co/464769.htm
广州田美舞台灯光设备有限公司,http:////www.11467.com/guangzhou/co/461778.htm
浩天舞台设备有限公司,http:////www.11467.com/guangzhou/co/458583.htm
香港帝音美国际集团有限公司,http:////www.11467.com/guangzhou/co/461765.htm
利祥国际物流广州分公司,http:////www.11467.com/guangzhou/co/466545.htm
广州市众诚演出器材有限公司,http:////www.11467.com/guangzhou/co/257998.htm
广州市番禺恒声音响有限公司,http:////www.11467.com/guangzhou/co/468814.htm
探月舞台灯光有限公司,http:////www.11467.com/guangzhou/co/474893.htm
广州市MBA专业音响(中国)有限公司,http:////www.11467.com/guangzhou/co/467308.htm
艺铖灯光音响设备厂,http:////www.11467.com/guangzhou/co/394025.htm
上海天道启科电子有限公司,http:////www.11467.com/guangzhou/co/470885.htm
广州市坚盾防火材料用品厂,http:////www.11467.com/guangzhou/co/473297.htm
黄伟明,http:////www.11467.com/guiyang/co/76094.htm
杭州卡威电子有限公司,http:////www.11467.com/hangzhou/co/293220.htm
杭州蓝顿照明科技有限公司,http:////www.11467.com/hangzhou/co/294275.htm
杭州仁宏展览用品有限公司,http:////www.11467.com/hangzhou/co/294293.htm
安徽合肥弹簧舞台制作有限公司,http:////www.11467.com/hefei/co/133264.htm
合肥音响租赁公司,http:////www.11467.com/hefei/co/133112.htm
合肥鑫杰克舞台机械技术有限公司,http:////www.11467.com/hefei/co/133385.htm
安徽杰克舞台灯光音响设备有限公司,http:////www.11467.com/hefei/co/133113.htm
影响力文化传媒(内蒙古)有限公司,http:////www.11467.com/huhehaote/co/33805.htm
百声音响器材厂,http:////www.11467.com/jiangmen/co/114883.htm
江门市蓬江区久三灯饰有限公司,http:////www.11467.com/jiangmen/co/112681.htm
济南红声音响器材有限公司,http:////www.11467.com/jinan/co/135119.htm
山东S’AGAPO艺术策划责任有限公司,http:////www.11467.com/jinan/co/136458.htm
江苏光耀演艺装饰工程有限公司驻济南办事处,http:////www.11467.com/jinan/co/135121.htm
济南传承广告传媒有限公司,http:////www.11467.com/jinan/co/138004.htm
燕郊起点广告传媒广告有限公司,http:////www.11467.com/langfang/co/47024.htm
兴鑫桁架厂(个体经营),http:////www.11467.com/langfang/co/48793.htm
兰州昊丰光电科技工程有限责任公司,http:////www.11467.com/lanzhou/co/80307.htm
兰州锋尚文化艺术有限公司,http:////www.11467.com/lanzhou/co/80442.htm
洛阳恒鑫达电子科贸有限公司,http:////www.11467.com/luoyang/co/60071.htm
南京东汇传播拓展有限公司,http:////www.11467.com/nanjing/co/155651.htm
南京一生有你文化传播有限公司,http:////www.11467.com/nanjing/co/153892.htm
南宁市锦业舞台灯光音响租赁有限公司,http:////www.11467.com/nanning/co/87323.htm
南宁众美演出租赁公司,http:////www.11467.com/nanning/co/86963.htm
宁波启发电子有限公司,http:////www.11467.com/ningbo/co/133582.htm
濮阳生活向导广告有限公司,http:////www.11467.com/puyang/co/24205.htm
青岛佰睿会展服务有限公司,http:////www.11467.com/qingdao/co/154752.htm
汕头纳博科技有限公司,http:////www.11467.com/shantou/co/150817.htm
韶关市分众庆典礼仪有限公司,http:////www.11467.com/shaoguan/co/29363.htm
曙光疏通LED设备公司,http:////www.11467.com/shenyang/co/96623.htm
大普激光科技深圳有限公司,http:////www.11467.com/shenzhen/co/680017.htm
极速光电有限公司,http:////www.11467.com/shenzhen/co/766339.htm
上骏有限公司,http:////www.11467.com/shenzhen/co/761708.htm
深圳森林文化传播有限公司,http:////www.11467.com/shenzhen/co/776080.htm
深圳晶华舞台灯光音响实业有限公司,http:////www.11467.com/shenzhen/co/676981.htm
美力时照明有限公司,http:////www.11467.com/shenzhen/co/760811.htm
深圳市极信邦光电科技有限公司,http:////www.11467.com/shenzhen/co/804824.htm
深圳市和平动力科技有限公司,http:////www.11467.com/shenzhen/co/785729.htm
深圳市声韵音响灯光设备有限公司,http:////www.11467.com/shenzhen/co/796084.htm
深圳市齐普光电子有限公司市场1部,http:////www.11467.com/shenzhen/co/677919.htm
深圳艺林文化传播有限公司,http:////www.11467.com/shenzhen/co/675893.htm
深圳市中映良品文化传播有限公司,http:////www.11467.com/shenzhen/co/778551.htm
周氏舞台灯光有限公司,http:////www.11467.com/shenzhen/co/774225.htm
深圳市8E传媒科技有限公司,http:////www.11467.com/shenzhen/co/769273.htm
鹿泉市恒洁物业保洁有限公司,http:////www.11467.com/shijiazhuang/co/138096.htm
苏州博皇电子有限公司,http:////www.11467.com/suzhou/co/223484.htm
苏州市歌舞团,http:////www.11467.com/suzhou/co/6490.htm
太原友和航空箱厂,http:////www.11467.com/taiyuan/co/124838.htm
泰州四通自动技术有限公司,http:////www.11467.com/taizhoushi/co/49394.htm
泰兴市佳宇舞台机械厂,http:////www.11467.com/taizhoushi/co/49395.htm
河北帅康座椅有限公司,http:////www.11467.com/wuhan/co/60806.htm
武汉楚天互动科技有限公司,http:////www.11467.com/wuhan/co/60829.htm
湖北龙行天下文化传播有限公司,http:////www.11467.com/wuhan/co/142970.htm
楷励縯藝器材有限公司,http:////www.11467.com/xiamen/co/96366.htm
厦门雄音视听工程有限公司,http:////www.11467.com/xiamen/co/75367.htm
厦门源恩安意演出设备有限公司,http:////www.11467.com/xiamen/co/75731.htm
西安先创智能系统有限公司,http:////www.11467.com/xian/co/121521.htm
晟通(郑州)礼仪策划有限公司,http:////www.11467.com/zhengzhou/co/178519.htm
郑州中派文化传播有限公司,http:////www.11467.com/zhengzhou/co/176065.htm
珠海市欢庆文化传播有限公司,http:////www.11467.com/zhuhai/co/98901.htm
北京东方盛隆科技有限公司,http:////www.11467.com/beijing/co/703918.htm
北京顶典视听服务有限公司,http:////www.11467.com/beijing/co/710471.htm
北京金华博光科技有限责任公司,http:////www.11467.com/beijing/co/711750.htm
北京瑞鹏佳音灯光音响科技发展有限公司 销售部,http:////www.11467.com/beijing/co/564954.htm
北京九重文化传播有限公司,http:////www.11467.com/beijing/co/133504.htm
北京九天辉煌舞台灯光音响租赁公司,http:////www.11467.com/beijing/co/700716.htm
北京丰华瑞尔舞台幕布有限公司,http:////www.11467.com/beijing/co/698873.htm
北京瑞捷荣邦灯光音响设备有限公司,http:////www.11467.com/beijing/co/713818.htm
北京时尚百联电器有限责任公司,http:////www.11467.com/beijing/co/705270.htm
北京同创伟业文化公司,http:////www.11467.com/beijing/co/711412.htm
北京伟丰声光电设备工程有限公司,http:////www.11467.com/beijing/co/708864.htm
北京天蓝北方乐器有限公司,http:////www.11467.com/beijing/co/692173.htm
北京瑞安特广播电视开发公司,http:////www.11467.com/beijing/co/134543.htm
北京利达文艺商贸有限公司,http:////www.11467.com/beijing/co/703917.htm
北京中展恒远商务会展服务有限公司,http:////www.11467.com/beijing/co/703915.htm
北京海芒星音响灯光设备租赁公司,http:////www.11467.com/beijing/co/701715.htm
北京中视文化发展有限公司,http:////www.11467.com/beijing/co/713819.htm
上海轩悦视听设备有限公司北京分公司,http:////www.11467.com/beijing/co/706021.htm
聚艺会诚舞台设备(北京)有限公司,http:////www.11467.com/beijing/co/702427.htm
北京市诚信佳彩舞台幕布有限公司,http:////www.11467.com/beijing/co/700717.htm
中奥舞台特效设备有限公司,http:////www.11467.com/beijing/co/326218.htm
上海迪杏科技有限公司,http:////www.11467.com/shanghai/co/1048570.htm
上海奥雄视听传媒服务有限公司,http:////www.11467.com/shanghai/co/1039942.htm
上海火盛电子有限公司,http:////www.11467.com/shanghai/co/809668.htm
上海旗瑞舞台设备工程有限公司,http:////www.11467.com/shanghai/co/1050701.htm
陕西省舞台美术学会,http:////www.11467.com/xian/co/41133.htm
兰州鑫龙国际文化艺术传播有限公司,http:////www.11467.com/lanzhou/co/74026.htm
太原亿嘉传媒文化有限公司,http:////www.11467.com/taiyuan/co/108651.htm
山西省飞思莱文化传媒有限公司,http:////www.11467.com/taiyuan/co/108652.htm
壹号活动策划有限公司,http:////www.11467.com/shenzhen/co/757052.htm
保定狼牙山传媒有限公司,http:////www.11467.com/baoding/co/78939.htm
广州市番禺区丰名音响设备厂,http:////www.11467.com/guangzhou/co/429856.htm
杰克舞台有限公司,http:////www.11467.com/hefei/co/131596.htm
广州雅淇光电光电设备有限公司,http:////www.11467.com/guangzhou/co/456563.htm
海口天众文化传媒有限公司,http:////www.11467.com/haikou/co/4394.htm
深圳市大恒汇通信息技术有限公司,http:////www.11467.com/shenzhen/co/760276.htm
广州锦宏演出器材有限公司,http:////www.11467.com/guangzhou/co/483184.htm
安徽合肥新球文化传媒有限公司,http:////www.11467.com/hefei/co/134081.htm
东莞市炫熠文化传播有限公司,http:////www.11467.com/dongguan/co/557555.htm
鞍山鼎峰视听舞台灯光音响演出器材租赁公司,http:////www.11467.com/anshan/co/78569.htm
高碑店市再创环视箱包有限责任公司,http:////www.11467.com/baoding/co/80277.htm
包头市东河区幸福鸟喜庆礼仪店,http:////www.11467.com/baotou/co/26747.htm
中亚联食用蜗牛有限公司,http:////www.11467.com/changchun/co/96562.htm
长沙鸿鑫会展演艺设备租赁公司,http:////www.11467.com/changsha/co/120012.htm
湖南捷成演艺器材服务有限公司,http:////www.11467.com/changsha/co/121895.htm
长沙诚哲机电设备有限公司,http:////www.11467.com/changsha/co/59195.htm
长沙福豪工艺品贸易有限公司,http:////www.11467.com/changsha/co/54130.htm
长沙炫艺电子科技有限公司,http:////www.11467.com/changsha/co/120631.htm
长沙恒捷光电设备有限公司,http:////www.11467.com/changsha/co/130755.htm
长沙恒晟礼仪服务有限公司,http:////www.11467.com/changsha/co/121817.htm
湖南明和灯光有限公司,http:////www.11467.com/changsha/co/98220.htm
长沙永丽舞台科技有限公司,http:////www.11467.com/changsha/co/97919.htm
常州海翔光电科技有限公司,http:////www.11467.com/changzhou/co/152317.htm
常州市武进区牛塘常宁照明电器厂,http:////www.11467.com/changzhou/co/114415.htm
上海旗瑞舞台设备工程有限公司,http:////www.11467.com/shanghai/co/1050701.htm
上海轩悦视听设备有限公司,http:////www.11467.com/shanghai/co/331368.htm
上海锐屏电子科技有限公司,http:////www.11467.com/shanghai/co/1044956.htm
天津水木年华文化传媒有限公司,http:////www.11467.com/tianjin/co/200565.htm
蓝色圣火(天津)广告有限公司,http:////www.11467.com/tianjin/co/197084.htm
中国阔众广告文化传媒(重庆)有限责任公司,http:////www.11467.com/chongqing/co/205306.htm
武汉东灿电子有限公司,http:////www.11467.com/wuhan/co/150468.htm
青岛创业人广告有限公司,http:////www.11467.com/qingdao/co/176273.htm
广州市腾中视听设备有限公司,http:////www.11467.com/guangzhou/co/701475.htm
广州申禾舞台灯光设备有限责任公司,http:////www.11467.com/guangzhou/co/716291.htm
郑州陆彬文化传播有限公司,http:////www.11467.com/zhengzhou/co/149128.htm
广州宵上舞台道具厂,http:////www.11467.com/guangzhou/co/433692.htm
天津市盛世礼仪庆典策划公司,http:////www.11467.com/tianjin/co/77125.htm
安驰灯光科技有限公司,http:////www.11467.com/guangzhou/co/433803.htm
济宁庆典公司,http:////www.11467.com/jining/co/56662.htm
贵阳拓龙科技有限公司,http:////www.11467.com/guiyang/co/78441.htm
托克托县九月青春礼仪策划部,http:////www.11467.com/huhehaote/co/29726.htm
广州艺博音响设备有限公司,http:////www.11467.com/guangzhou/co/434248.htm
顺德区容桂浩声音响器材店,http:////www.11467.com/foshan/co/307145.htm
安阳大树传媒有限公司,http:////www.11467.com/anyang/co/32389.htm
广西流星雨文虎传播有限公司,http:////www.11467.com/nanning/co/79269.htm
辽宁旭声拼装舞台厂,http:////www.11467.com/chaoyang/co/28065.htm
成都川娱舞美设计制作有限公司,http:////www.11467.com/chengdu/co/214617.htm
成都市全能音响灯光演艺工程公司,http:////www.11467.com/chengdu/co/130552.htm
成都众播会展服务有限公司,http:////www.11467.com/chengdu/co/214250.htm
成都培丰舞台机械有限公司,http:////www.11467.com/chengdu/co/214748.htm
成都毅景庆典礼仪商务有限公司,http:////www.11467.com/chengdu/co/130652.htm
成都展望智能科技发展有限公司,http:////www.11467.com/chengdu/co/214034.htm
金牛区敦帝舞台灯光经营部,http:////www.11467.com/chengdu/co/111512.htm
天地豪情文化演艺有限公司,http:////www.11467.com/chengdu/co/129988.htm
大连炫彩光电传媒有限公司,http:////www.11467.com/dalian/co/60194.htm
大连新起点文化传播有限公司,http:////www.11467.com/dalian/co/73560.htm
大连新时代复膜厂,http:////www.11467.com/dalian/co/37091.htm
宏达喜缘婚庆庆典公司,http:////www.11467.com/dezhou/co/50729.htm
东莞市奥斯卡文化传播有限公司,http:////www.11467.com/dongguan/co/498019.htm
东莞晶典灯饰五金有限公司,http:////www.11467.com/dongguan/co/314237.htm
东莞市茶山朋欣电子制品厂,http:////www.11467.com/dongguan/co/457547.htm
东莞深绿节能科技有限公司,http:////www.11467.com/dongguan/co/494975.htm
东莞市概念光电科技有限公司,http:////www.11467.com/dongguan/co/124655.htm
东莞璟品科技有限公司,http:////www.11467.com/dongguan/co/373654.htm
东莞市博尔影视设备有限公司,http:////www.11467.com/dongguan/co/373515.htm
东莞市大众礼仪庆典策划演出公司,http:////www.11467.com/dongguan/co/374308.htm
东莞市慧海广告设备有限公司,http:////www.11467.com/dongguan/co/505219.htm
东莞市盛唐文化传播有限公司,http:////www.11467.com/dongguan/co/373668.htm
东莞市新娱文化传播有限公司,http:////www.11467.com/dongguan/co/492377.htm
东莞市华仕文化传播有限公司,http:////www.11467.com/dongguan/co/373898.htm
东莞展晨航空箱制品厂,http:////www.11467.com/dongguan/co/320283.htm
东莞市乐业五金有限公司,http:////www.11467.com/dongguan/co/72371.htm
东莞市桐林电子科技有限公司,http:////www.11467.com/dongguan/co/314830.htm
东莞市演出礼仪服务有限公司,http:////www.11467.com/dongguan/co/500574.htm
东莞视讯设备租赁有限公司,http:////www.11467.com/dongguan/co/374377.htm
