广州品缘演出器材有限公司,http:////www.11467.com/guangzhou/co/390353.htm
广州品缘演出器材有限公司的商铺,http://guangzhou0390353.11467.com
杭州英韬科技有限公司,http:////www.11467.com/hangzhou/co/238820.htm
杭州英韬科技有限公司的商铺,http://hangzhou0238820.11467.com
北京星光艺美舞台幕布有限公司,http:////www.11467.com/beijing/co/763839.htm
北京星光艺美舞台幕布有限公司的商铺,http://beijing0763839.11467.com
南京光亚文化传媒有限公司,http:////www.11467.com/nanjing/co/160473.htm
南京光亚文化传媒有限公司的商铺,http://nanjing0160473.11467.com
钦州市钦南区光美电子元件厂,http:////www.11467.com/qinzhou/co/9052.htm
钦州市钦南区光美电子元件厂的商铺,http://qinzhou09052.11467.com
南昌天豪灯光音响设备租赁有限公司,http:////www.11467.com/nanchang/co/142763.htm
南昌天豪灯光音响设备租赁有限公司的商铺,http://nanchang0142763.11467.com
广州市番禺石基众展亿缘音响设备厂,http:////www.11467.com/guangzhou/co/511883.htm
广州市番禺石基众展亿缘音响设备厂的商铺,http://guangzhou0511883.11467.com
赣州百佳科技发展有限公司,http:////www.11467.com/ganzhou/co/28193.htm
赣州百佳科技发展有限公司的商铺,http://ganzhou028193.11467.com
南昌柒星灯光音响演艺工程有限公司,http:////www.11467.com/nanchang/co/135973.htm
南昌柒星灯光音响演艺工程有限公司的商铺,http://nanchang0135973.11467.com
广州闻信展览服务有限公司,http:////www.11467.com/guangzhou/co/460658.htm
广州闻信展览服务有限公司的商铺,http://guangzhou0460658.11467.com
东莞市盛艺文化传播有限公司,http:////www.11467.com/dongguan/co/415323.htm
东莞市盛艺文化传播有限公司的商铺,http://dongguan0415323.11467.com
南京彩炫声灯光有限公司,http:////www.11467.com/nanjing/co/115251.htm
南京彩炫声灯光有限公司的商铺,http://nanjing0115251.11467.com
南昌鑫悦灯光音响视频租赁有限公司,http:////www.11467.com/nanchang/co/128822.htm
南昌鑫悦灯光音响视频租赁有限公司的商铺,http://nanchang0128822.11467.com
南昌甲骨文化传媒有限公司,http:////www.11467.com/nanchang/co/128803.htm
南昌甲骨文化传媒有限公司的商铺,http://nanchang0128803.11467.com
济南大荣商贸有限公司,http:////www.11467.com/jinan/co/149050.htm
济南大荣商贸有限公司的商铺,http://jinan0149050.11467.com
广东鼎誉舞台设备有限公司,http:////www.11467.com/zhaoqing/co/34385.htm
广东鼎誉舞台设备有限公司的商铺,http://zhaoqing034385.11467.com
广州市汇展电子科技有限公司,http:////www.11467.com/guangzhou/co/429026.htm
广州市汇展电子科技有限公司的商铺,http://guangzhou0429026.11467.com
北京乐思文化传播有限公司,http:////www.11467.com/beijing/co/145734.htm
北京乐思文化传播有限公司的商铺,http://beijing0145734.11467.com
珠海市仟艺文化传播有限公司,http:////www.11467.com/zhuhai/co/89350.htm
珠海市仟艺文化传播有限公司的商铺,http://zhuhai089350.11467.com
深圳市帝狼光电有限公司,http:////www.11467.com/shenzhen/co/545481.htm
深圳市帝狼光电有限公司的商铺,http://shenzhen0545481.11467.com
南昌菲凡视听科技有限公司,http:////www.11467.com/nanchang/co/142085.htm
南昌菲凡视听科技有限公司的商铺,http://nanchang0142085.11467.com
深圳市源广浩电子有限公司,http:////www.11467.com/shenzhen/co/224438.htm
深圳市源广浩电子有限公司的商铺,http://shenzhen0224438.11467.com
盐城市科通电子有限公司,http:////www.11467.com/yancheng/co/61019.htm
盐城市科通电子有限公司的商铺,http://yancheng061019.11467.com
广州夜铭烽舞台灯光设备有限公司,http:////www.11467.com/guangzhou/co/701923.htm
广州夜铭烽舞台灯光设备有限公司的商铺,http://guangzhou0701923.11467.com
济宁市最好演出庆典公司,http:////www.11467.com/jining/co/90417.htm
济宁市最好演出庆典公司的商铺,http://jining090417.11467.com
德阳市伊怡文化传媒有限公司,http:////www.11467.com/deyang/co/33164.htm
德阳市伊怡文化传媒有限公司的商铺,http://deyang033164.11467.com
北京金华冠舞台幕布设计制作有限公司,http:////www.11467.com/beijing/co/331290.htm
北京金华冠舞台幕布设计制作有限公司的商铺,http://beijing0331290.11467.com
北京中艺视听设备有限公司,http:////www.11467.com/beijing/co/331337.htm
北京中艺视听设备有限公司的商铺,http://beijing0331337.11467.com
霸州市煎茶铺诚诚展览展示器材厂,http:////www.11467.com/langfang/co/45987.htm
霸州市煎茶铺诚诚展览展示器材厂的商铺,http://langfang045987.11467.com
南昌盛恒广告传媒有限公司,http:////www.11467.com/nanchang/co/107558.htm
南昌盛恒广告传媒有限公司的商铺,http://nanchang0107558.11467.com
珠海市普创电子科技有限公司,http:////www.11467.com/zhuhai/co/99575.htm
珠海市普创电子科技有限公司的商铺,http://zhuhai099575.11467.com
北京勒沃时代文化发展有限公司,http:////www.11467.com/beijing/co/748257.htm
北京勒沃时代文化发展有限公司的商铺,http://beijing0748257.11467.com
深圳市途格世纪科技有限公司,http:////www.11467.com/shenzhen/co/952598.htm
深圳市途格世纪科技有限公司的商铺,http://shenzhen0952598.11467.com
无锡市乐进电子电器有限公司,http:////www.11467.com/wuxi/co/55635.htm
无锡市乐进电子电器有限公司的商铺,http://wuxi055635.11467.com
恩平市艾思特电声器材厂,http:////www.11467.com/jiangmen/co/115255.htm
恩平市艾思特电声器材厂的商铺,http://jiangmen0115255.11467.com
南京双响炮焰火燃放有限公司,http:////www.11467.com/nanjing/co/60780.htm
南京双响炮焰火燃放有限公司的商铺,http://nanjing060780.11467.com
彭水县辉煌演出器材租赁有限公司,http:////www.11467.com/chongqing/co/316452.htm
彭水县辉煌演出器材租赁有限公司的商铺,http://chongqing0316452.11467.com
成都猫蒲文化传播有限公司,http:////www.11467.com/chengdu/co/287498.htm
成都猫蒲文化传播有限公司的商铺,http://chengdu0287498.11467.com
郑州伍嘉文化传播有限公司,http:////www.11467.com/zhengzhou/co/272152.htm
郑州伍嘉文化传播有限公司的商铺,http://zhengzhou0272152.11467.com
湖南瑞鑫文化传媒有限公司,http:////www.11467.com/changsha/co/104361.htm
湖南瑞鑫文化传媒有限公司的商铺,http://changsha0104361.11467.com
济南艺达舞台设备,http:////www.11467.com/jinan/co/114177.htm
济南艺达舞台设备的商铺,http://jinan0114177.11467.com
罗氏云鹏国际文化传媒（北京）有限公司,http:////www.11467.com/wuhan/co/117491.htm
罗氏云鹏国际文化传媒（北京）有限公司的商铺,http://wuhan0117491.11467.com
智森联合（北京）舞台工程技术有限公司,http:////www.11467.com/beijing/co/655514.htm
智森联合（北京）舞台工程技术有限公司的商铺,http://beijing0655514.11467.com
吉林省维恩电子设备有限公司,http:////www.11467.com/changchun/co/105266.htm
吉林省维恩电子设备有限公司的商铺,http://changchun0105266.11467.com
广州市晨宇灯光设备有限公司,http:////www.11467.com/guangzhou/co/469542.htm
广州市晨宇灯光设备有限公司的商铺,http://guangzhou0469542.11467.com
霸州市煎茶铺李留伟展架销售部,http:////www.11467.com/langfang/co/53477.htm
霸州市煎茶铺李留伟展架销售部的商铺,http://langfang053477.11467.com
杭州金兔灯饰有限公司,http:////www.11467.com/hangzhou/co/368552.htm
杭州金兔灯饰有限公司的商铺,http://hangzhou0368552.11467.com
合肥薇拉领秀文化传媒有限公司,http:////www.11467.com/hefei/co/152172.htm
合肥薇拉领秀文化传媒有限公司的商铺,http://hefei0152172.11467.com
柳州伟宸文化传媒有限责任公司,http:////www.11467.com/liuzhou/co/44788.htm
东莞市大典广告有限公司,http:////www.11467.com/dongguan/co/413744.htm
榆林市千佳名汇琴行有限公司,http:////www.11467.com/yulinshi/co/19760.htm
榆林市千佳名汇琴行有限公司的商铺,http://yulinshi019760.11467.com
南昌明月风光会展服务有限公司,http:////www.11467.com/nanchang/co/100443.htm
南昌明月风光会展服务有限公司的商铺,http://nanchang0100443.11467.com
石家庄市新华区华美楼广播器材商行,http:////www.11467.com/shijiazhuang/co/84350.htm
石家庄市新华区华美楼广播器材商行的商铺,http://shijiazhuang084350.11467.com
天津市永耀电光源有限公司,http:////www.11467.com/tianjin/co/124551.htm
天津市永耀电光源有限公司的商铺,http://tianjin0124551.11467.com
中山市美立电器有限公司,http:////www.11467.com/zhongshan/co/80091.htm
中山市美立电器有限公司的商铺,http://zhongshan080091.11467.com
中山市欧曼科技照明有限公司,http:////www.11467.com/zhongshan/co/72451.htm
中山市欧曼科技照明有限公司的商铺,http://zhongshan072451.11467.com
湖北火之舞视听传媒有限公司,http:////www.11467.com/wuhan/co/213138.htm
湖北火之舞视听传媒有限公司的商铺,http://wuhan0213138.11467.com
东莞市智行企业品牌策划有限公司,http:////www.11467.com/dongguan/co/605765.htm
东莞市智行企业品牌策划有限公司的商铺,http://dongguan0605765.11467.com
南昌天美灯光音响演出工程公司,http:////www.11467.com/nanchang/co/115226.htm
南昌天美灯光音响演出工程公司的商铺,http://nanchang0115226.11467.com
深圳市福田区颖辰锋电子经营部,http:////www.11467.com/shenzhen/co/430755.htm
深圳市福田区颖辰锋电子经营部的商铺,http://shenzhen0430755.11467.com
铜仁市碧江区丰辉庆典传播服务中心,http:////www.11467.com/qiye/93168042.htm
铜仁市碧江区丰辉庆典传播服务中心的商铺,http://93168042.b2b.11467.com
深圳市希尔光学技术有限公司,http:////www.11467.com/shenzhen/co/316761.htm
深圳市希尔光学技术有限公司的商铺,http://shenzhen0316761.11467.com
嘉兴杰捷文化传播有限公司,http:////www.11467.com/jiaxing/co/92389.htm
嘉兴杰捷文化传播有限公司的商铺,http://jiaxing092389.11467.com
中山市声华音响制造厂,http:////www.11467.com/zhongshan/co/195145.htm
中山市声华音响制造厂的商铺,http://zhongshan0195145.11467.com
深圳市狮宝电子科技有限公司,http:////www.11467.com/shenzhen/co/814793.htm
深圳市狮宝电子科技有限公司的商铺,http://shenzhen0814793.11467.com
成都市凯歌演艺设备有限公司,http:////www.11467.com/chengdu/co/223367.htm
成都市凯歌演艺设备有限公司的商铺,http://chengdu0223367.11467.com
深圳市蒙特科技有限公司,http:////www.11467.com/shenzhen/co/547555.htm
深圳市蒙特科技有限公司的商铺,http://shenzhen0547555.11467.com
上海星东文化传媒有限公司,http:////www.11467.com/shanghai/co/1042565.htm
上海星东文化传媒有限公司的商铺,http://shanghai01042565.11467.com
上海声艺文化传播有限公司,http:////www.11467.com/shanghai/co/1057177.htm
上海声艺文化传播有限公司的商铺,http://shanghai01057177.11467.com
深圳市宇泰尔科技有限公司,http:////www.11467.com/shenzhen/co/812127.htm
深圳市宇泰尔科技有限公司的商铺,http://shenzhen0812127.11467.com
深圳市光匠怡高光电有限公司,http:////www.11467.com/shenzhen/co/810502.htm
深圳市光匠怡高光电有限公司的商铺,http://shenzhen0810502.11467.com
杭州恒普科技有限公司,http:////www.11467.com/hangzhou/co/248005.htm
杭州恒普科技有限公司的商铺,http://hangzhou0248005.11467.com
福州先拓电子技术有限公司,http:////www.11467.com/fuzhou/co/147883.htm
福州先拓电子技术有限公司的商铺,http://fuzhou0147883.11467.com
广州市白云区良顺音响器材厂,http:////www.11467.com/guangzhou/co/393665.htm
广州市白云区良顺音响器材厂的商铺,http://guangzhou0393665.11467.com
北京视赢达科技有限公司,http:////www.11467.com/beijing/co/107144.htm
北京视赢达科技有限公司的商铺,http://beijing0107144.11467.com
广州市耀纳舞台道具有限公司,http:////www.11467.com/guangzhou/co/432384.htm
广州市耀纳舞台道具有限公司的商铺,http://guangzhou0432384.11467.com
深圳市天元节保技术有限公司,http:////www.11467.com/shenzhen/co/549263.htm
深圳市天元节保技术有限公司的商铺,http://shenzhen0549263.11467.com
深圳市祖科光源科技有限公司,http:////www.11467.com/shenzhen/co/545573.htm
深圳市祖科光源科技有限公司的商铺,http://shenzhen0545573.11467.com
山东倾影电子科技有限公司,http:////www.11467.com/qiye/93431818.htm
山东倾影电子科技有限公司的商铺,http://93431818.b2b.11467.com
广州昊景演出器材有限公司,http:////www.11467.com/guangzhou/co/433041.htm
广州昊景演出器材有限公司的商铺,http://guangzhou0433041.11467.com
北京金石天顺贸易有限公司,http:////www.11467.com/beijing/co/690916.htm
北京金石天顺贸易有限公司的商铺,http://beijing0690916.11467.com
佛山市南海区汇东汇金属制品厂,http:////www.11467.com/foshan/co/231462.htm
佛山市南海区汇东汇金属制品厂的商铺,http://foshan0231462.11467.com
泰州市舞台机械幕布设备厂,http:////www.11467.com/taizhoushi/co/34964.htm
泰州市舞台机械幕布设备厂的商铺,http://taizhoushi034964.11467.com
重庆知赛科技有限公司,http:////www.11467.com/chongqing/co/127890.htm
重庆知赛科技有限公司的商铺,http://chongqing0127890.11467.com
广州市白云区石井胜远灯光音响设备厂,http:////www.11467.com/guangzhou/co/461834.htm
广州市白云区石井胜远灯光音响设备厂的商铺,http://guangzhou0461834.11467.com
石狮市金时达钟表工艺有限公司,http:////www.11467.com/guangzhou/co/285984.htm
石狮市金时达钟表工艺有限公司的商铺,http://guangzhou0285984.11467.com
广州广奥篷房实业有限公司,http:////www.11467.com/guangzhou/co/458582.htm
广州广奥篷房实业有限公司的商铺,http://guangzhou0458582.11467.com
深圳市正祥盛光电科技有限公司,http:////www.11467.com/shenzhen/co/394060.htm
深圳市正祥盛光电科技有限公司的商铺,http://shenzhen0394060.11467.com
深圳飞龙达文化传播有限公司,http:////www.11467.com/shenzhen/co/722017.htm
长春市剑平文化传媒有限公司,http:////www.11467.com/changchun/co/83233.htm
金世通工贸有限公司,http:////www.11467.com/xian/co/95546.htm
贵州爱丽丝乐器批发部,http:////www.11467.com/guiyang/co/78360.htm
上海金泽广告公司,http:////www.11467.com/shanghai/co/948987.htm
星耀舞台灯光音响设备有限公司,http:////www.11467.com/dongguan/co/409816.htm
广州翼维舞台设备科技有限公司,http:////www.11467.com/guangzhou/co/464759.htm
宁波静海文化传媒有限公司,http:////www.11467.com/qiye/27259.htm
北京市卓越庆典会展公司,http:////www.11467.com/beijing/co/145380.htm
佛山市荣海盛演艺器材有限公司,http:////www.11467.com/foshan/co/306505.htm
广州市弘裕电子有限公司,http:////www.11467.com/guangzhou/co/394282.htm
深圳市雷克演出器材有限公司,http:////www.11467.com/shenzhen/co/893631.htm
上海今森检测设备有限公司,http:////www.11467.com/shanghai/co/180741.htm
上海今森检测设备有限公司的商铺,http://shanghai0180741.11467.com
北京中艺寰宇文化传播有限公司,http:////www.11467.com/beijing/co/691533.htm
北京中艺寰宇文化传播有限公司的商铺,http://beijing0691533.11467.com
无锡科瑞得金属制品有限公司,http:////www.11467.com/wuxi/co/241704.htm
无锡科瑞得金属制品有限公司的商铺,http://wuxi0241704.11467.com
潮州市开发区树伟电器配件厂,http:////www.11467.com/chaozhou/co/27642.htm
潮州市开发区树伟电器配件厂的商铺,http://chaozhou027642.11467.com
佛山市南海区优仕朗照明厂,http:////www.11467.com/foshan/co/219532.htm
佛山市南海区优仕朗照明厂的商铺,http://foshan0219532.11467.com
广州市得宝利舞台烟机设备厂,http:////www.11467.com/guangzhou/co/433431.htm
广州市得宝利舞台烟机设备厂的商铺,http://guangzhou0433431.11467.com
清苑县清苑路瑞鑫电子设备厂,http:////www.11467.com/baoding/co/91620.htm
清苑县清苑路瑞鑫电子设备厂的商铺,http://baoding091620.11467.com
广州市天望文化传播有限公司,http:////www.11467.com/guangzhou/co/455518.htm
广州市天望文化传播有限公司的商铺,http://guangzhou0455518.11467.com
广州宵上舞台设备有限公司,http:////www.11467.com/guangzhou/co/432714.htm
广州宵上舞台设备有限公司的商铺,http://guangzhou0432714.11467.com
佛山市顺德区华登文化传播有限公司,http:////www.11467.com/foshan/co/355680.htm
佛山市顺德区华登文化传播有限公司的商铺,http://foshan0355680.11467.com
兰州三丰灯光音响工程有限公司,http:////www.11467.com/lanzhou/co/73342.htm
兰州三丰灯光音响工程有限公司的商铺,http://lanzhou073342.11467.com
保定市致峰影像器材有限公司,http:////www.11467.com/baoding/co/65559.htm
保定市致峰影像器材有限公司的商铺,http://baoding065559.11467.com
广州天望舞台桁架搭建公司,http:////www.11467.com/guangzhou/co/433935.htm
广州天望舞台桁架搭建公司的商铺,http://guangzhou0433935.11467.com
北京市家骏伟业科贸中心,http:////www.11467.com/beijing/co/690384.htm
北京市家骏伟业科贸中心的商铺,http://beijing0690384.11467.com
班德实业有限限公司,http:////www.11467.com/guangzhou/co/455121.htm
班德实业有限限公司的商铺,http://guangzhou0455121.11467.com
宁波美秀文化传播有限公司,http:////www.11467.com/ningbo/co/192156.htm
宁波美秀文化传播有限公司的商铺,http://ningbo0192156.11467.com
上海泽睿文化传播有限公司,http:////www.11467.com/shanghai/co/539199.htm
上海泽睿文化传播有限公司的商铺,http://shanghai0539199.11467.com
广州市东铭电子科技有限公司,http:////www.11467.com/guangzhou/co/242793.htm
广州市东铭电子科技有限公司的商铺,http://guangzhou0242793.11467.com
常州海陆照明电器有限公司,http:////www.11467.com/changzhou/co/98668.htm
常州海陆照明电器有限公司的商铺,http://changzhou098668.11467.com
广州市白云区宏中视听设备厂,http:////www.11467.com/guangzhou/co/158168.htm
广州市白云区宏中视听设备厂的商铺,http://guangzhou0158168.11467.com
广州凯夏音响设备有限公司,http:////www.11467.com/guangzhou/co/272972.htm
广州凯夏音响设备有限公司的商铺,http://guangzhou0272972.11467.com
东莞市欧贝伦通讯电子有限公司,http:////www.11467.com/dongguan/co/477138.htm
东莞市欧贝伦通讯电子有限公司的商铺,http://dongguan0477138.11467.com
南昌辰音建材有限公司,http:////www.11467.com/nanchang/co/107880.htm
南昌辰音建材有限公司的商铺,http://nanchang0107880.11467.com
武汉百思爱德营销策划有限公司,http:////www.11467.com/wuhan/co/117855.htm
武汉百思爱德营销策划有限公司的商铺,http://wuhan0117855.11467.com
北京川京科技开发有限公司销售部,http:////www.11467.com/beijing/co/331087.htm
北京川京科技开发有限公司销售部的商铺,http://beijing0331087.11467.com
重庆丰生礼仪服务有限公司,http:////www.11467.com/chongqing/co/55417.htm
重庆丰生礼仪服务有限公司的商铺,http://chongqing055417.11467.com
广州小白架子工程部,http:////www.11467.com/guangzhou/co/434159.htm
广州小白架子工程部的商铺,http://guangzhou0434159.11467.com
武汉百思爱德营销策划有限公司,http:////www.11467.com/wuhan/co/117840.htm
武汉百思爱德营销策划有限公司的商铺,http://wuhan0117840.11467.com
成都通创演艺器材租赁部,http:////www.11467.com/chengdu/co/142925.htm
成都通创演艺器材租赁部的商铺,http://chengdu0142925.11467.com
保定市艺术团（国有专业院团）,http:////www.11467.com/baoding/co/66062.htm
保定市艺术团（国有专业院团）的商铺,http://baoding066062.11467.com
广州市美鸾灯饰有限公司,http:////www.11467.com/qiye/241453.htm
广州市美鸾灯饰有限公司的商铺,http://241453.b2b.11467.com
前飞传媒有限公司,http:////www.11467.com/hefei/co/131352.htm
前飞传媒有限公司的商铺,http://hefei0131352.11467.com
东莞市樟木头国艺铝合金制品厂,http:////www.11467.com/dongguan/co/492571.htm
东莞市樟木头国艺铝合金制品厂的商铺,http://dongguan0492571.11467.com
东莞市崧茂机电设备有限公司,http:////www.11467.com/dongguan/co/125719.htm
东莞市崧茂机电设备有限公司的商铺,http://dongguan0125719.11467.com
河北万里舞台幕布有限公司,http:////www.11467.com/cangzhou/co/59455.htm
河北万里舞台幕布有限公司的商铺,http://cangzhou059455.11467.com
长沙市雨花区丰羽气模厂,http:////www.11467.com/changsha/co/98377.htm
长沙市雨花区丰羽气模厂的商铺,http://changsha098377.11467.com
广州科声电子科技有限公司,http:////www.11467.com/guangzhou/co/464696.htm
广州科声电子科技有限公司的商铺,http://guangzhou0464696.11467.com
佛山市顺德区又晖家具有限公司,http:////www.11467.com/foshan/co/193126.htm
佛山市顺德区又晖家具有限公司的商铺,http://foshan0193126.11467.com
广州市恒名电子有限公司,http:////www.11467.com/guangzhou/co/302432.htm
广州市恒名电子有限公司的商铺,http://guangzhou0302432.11467.com
广州市百立达音响有限公司,http:////www.11467.com/guangzhou/co/125947.htm
广州市百立达音响有限公司的商铺,http://guangzhou0125947.11467.com
广州市欧堡演出器材有限公司,http:////www.11467.com/guangzhou/co/257948.htm
广州市欧堡演出器材有限公司的商铺,http://guangzhou0257948.11467.com
广州丹盾电子有限公司,http:////www.11467.com/guangzhou/co/451422.htm
广州丹盾电子有限公司的商铺,http://guangzhou0451422.11467.com
广州胜高电子科技有限公司,http:////www.11467.com/guangzhou/co/216049.htm
广州胜高电子科技有限公司的商铺,http://guangzhou0216049.11467.com
北京华艺嘉韵演出公司,http:////www.11467.com/beijing/co/331102.htm
西安艺文广告文化传播有限公司,http:////www.11467.com/xian/co/95912.htm
重庆丰生礼仪服务有限公司,http:////www.11467.com/cqjiangbei/co/12817.htm
灯光音响出租,http:////www.11467.com/changzhou/co/129710.htm
广州鑫硕文化传播有限公司,http:////www.11467.com/guangzhou/co/433073.htm
沈阳恒瑞德舞台设备有限公司,http:////www.11467.com/shenyang/co/81250.htm
合肥新球文化传媒有限公司,http:////www.11467.com/hefei/co/44339.htm
深圳市皓景源光电有限公司,http:////www.11467.com/shenzhen/co/390681.htm
深圳市皓景源光电有限公司的商铺,http://shenzhen0390681.11467.com
蓬江区福莱特电子灯饰厂,http:////www.11467.com/jiangmen/co/94474.htm
蓬江区福莱特电子灯饰厂的商铺,http://jiangmen094474.11467.com
南京大成会展服务有限公司,http:////www.11467.com/nanjing/co/103234.htm
南京大成会展服务有限公司的商铺,http://nanjing0103234.11467.com
泰州市南洋舞台设备有限公司,http:////www.11467.com/taizhoushi/co/33549.htm
泰州市南洋舞台设备有限公司的商铺,http://taizhoushi033549.11467.com
武汉天马时代广告传媒有限公司,http:////www.11467.com/wuhan/co/78569.htm
武汉天马时代广告传媒有限公司的商铺,http://wuhan078569.11467.com
深圳艾威瑞科技有限公司,http:////www.11467.com/shenzhen/co/793858.htm
深圳艾威瑞科技有限公司的商铺,http://shenzhen0793858.11467.com
深圳市盛航光电有限公司,http:////www.11467.com/shenzhen/co/316590.htm
深圳市盛航光电有限公司的商铺,http://shenzhen0316590.11467.com
深圳市东兴威电机有限公司,http:////www.11467.com/shenzhen/co/483127.htm
深圳市东兴威电机有限公司的商铺,http://shenzhen0483127.11467.com
深圳市瑞广兴电子有限公司,http:////www.11467.com/shenzhen/co/810846.htm
深圳市瑞广兴电子有限公司的商铺,http://shenzhen0810846.11467.com
深圳市力宝兴业电子有限公司,http:////www.11467.com/shenzhen/co/722278.htm
深圳市力宝兴业电子有限公司的商铺,http://shenzhen0722278.11467.com
深圳市华格礼仪策划有限公司,http:////www.11467.com/shenzhen/co/19013.htm
深圳市华格礼仪策划有限公司的商铺,http://shenzhen019013.11467.com
深圳市春达鑫光电有限公司,http:////www.11467.com/shenzhen/co/810374.htm
深圳市春达鑫光电有限公司的商铺,http://shenzhen0810374.11467.com
深圳市恒之光科技有限公司,http:////www.11467.com/shenzhen/co/316754.htm
深圳市恒之光科技有限公司的商铺,http://shenzhen0316754.11467.com
汕头市金平区大千音频数码店,http:////www.11467.com/shantou/co/152145.htm
汕头市金平区大千音频数码店的商铺,http://shantou0152145.11467.com
深圳市响亮电子科技有限公司,http:////www.11467.com/shenzhen/co/728963.htm
深圳市响亮电子科技有限公司的商铺,http://shenzhen0728963.11467.com
深圳市鑫流明照明科技有限公司,http:////www.11467.com/shenzhen/co/812175.htm
深圳市鑫流明照明科技有限公司的商铺,http://shenzhen0812175.11467.com
