南昌市西湖区久其电脑经营部,http:////www.11467.com/nanchang/co/17947.htm
南昌市西湖区鑫源电脑配件经营部,http:////www.11467.com/nanchang/co/17998.htm
南昌市科技大市场明德电脑经营部,http:////www.11467.com/nanchang/co/18177.htm
南昌市西湖区南林电脑经营部,http:////www.11467.com/nanchang/co/18025.htm
南昌市西湖区新速达电脑配件经营部,http:////www.11467.com/nanchang/co/17950.htm
南昌市东湖凯信电脑经营部,http:////www.11467.com/nanchang/co/5123.htm
南昌市西湖区大丰电脑服务部,http:////www.11467.com/nanchang/co/17977.htm
南昌雄鹰科技实业有限公司电脑经营部,http:////www.11467.com/nanchang/co/17936.htm
南昌市西湖区华证电脑经营部,http:////www.11467.com/nanchang/co/18023.htm
南昌市西湖区胜浪电脑经营部,http:////www.11467.com/nanchang/co/18068.htm
南昌市西湖区氏和电脑配件经营部,http:////www.11467.com/nanchang/co/17928.htm
南昌市西湖区兴达电脑服务部,http:////www.11467.com/nanchang/co/17992.htm
南昌市星河电脑经营部,http:////www.11467.com/nanchang/co/18017.htm
南昌日新电脑销售有限公司,http:////www.11467.com/nanchang/co/30558.htm
南昌市西湖区汇利达电脑经营部,http:////www.11467.com/nanchang/co/18010.htm
南昌市文化宫海鸥电脑销售中心,http:////www.11467.com/nanchang/co/5132.htm
南昌市西湖区鸿达软件服务部,http:////www.11467.com/nanchang/co/17939.htm
南昌市西湖区汇通电脑经营部,http:////www.11467.com/nanchang/co/18007.htm
南昌市西湖区旺达电脑经营部,http:////www.11467.com/nanchang/co/18465.htm
南昌市西湖区至恒电脑经营部,http:////www.11467.com/nanchang/co/17948.htm
南昌市西湖区金邦电脑配件经营部,http:////www.11467.com/nanchang/co/18012.htm
南昌市郊青云谱华宇电脑销售部,http:////www.11467.com/nanchang/co/24058.htm
南昌市西湖区佳华电脑经营部,http:////www.11467.com/nanchang/co/18076.htm
南昌市西湖区泷鑫电脑经营部,http:////www.11467.com/nanchang/co/17953.htm
南昌市文化宫电脑城通大电脑经营部,http:////www.11467.com/nanchang/co/5092.htm
顺庆区正洋电脑服务部,http:////www.11467.com/nanchong/co/366.htm
江宁区开发区爱博电脑经营部,http:////www.11467.com/nanjing/co/14713.htm
南宁市蓝威电脑经营部,http:////www.11467.com/nanning/co/9101.htm
南宁市佳隆讯电脑经营部,http:////www.11467.com/nanning/co/9065.htm
南宁市时空电脑网络耗材经营部电子广场分部,http:////www.11467.com/nanning/co/9047.htm
南宁市万福电脑网络耗材经营部,http:////www.11467.com/nanning/co/9020.htm
南宁市纵横电脑耗材经营部,http:////www.11467.com/nanning/co/9033.htm
南宁桑地计算机软件销售有限公司,http:////www.11467.com/nanning/co/9071.htm
南宁市育龙电脑经营部,http:////www.11467.com/nanning/co/9035.htm
南宁市智迪电脑经营部,http:////www.11467.com/nanning/co/9050.htm
南宁市新格电脑销售部,http:////www.11467.com/nanning/co/9060.htm
南宁市意峰电脑经营部,http:////www.11467.com/nanning/co/9054.htm
南宁市星湖路浙能电脑配件经营部,http:////www.11467.com/nanning/co/9067.htm
南宁市雄达电脑耗材经营部,http:////www.11467.com/nanning/co/9061.htm
南宁市迅佳印刷电脑服务部,http:////www.11467.com/nanning/co/9027.htm
南宁市德佳电脑打印机耗材经营部,http:////www.11467.com/nanning/co/9066.htm
南宁市申正电脑服务部,http:////www.11467.com/nanning/co/9023.htm
南宁市雅龙电脑经营部,http:////www.11467.com/nanning/co/9052.htm
南宁市多澜爱能打印机耗材经营部,http:////www.11467.com/nanning/co/9051.htm
南宁市微想电脑经营部,http:////www.11467.com/nanning/co/9069.htm
南平市延平区天极电脑商行,http:////www.11467.com/nanping/co/2051.htm
南平市延平区天蓝办公耗材经营部,http:////www.11467.com/nanping/co/2068.htm
南平市延平区延城电脑商行,http:////www.11467.com/nanping/co/2067.htm
南平市延平区星阳光电脑商行,http:////www.11467.com/nanping/co/2052.htm
南平市延平区欣众电脑商行,http:////www.11467.com/nanping/co/2078.htm
南平市延平区新大软件服务部,http:////www.11467.com/nanping/co/2040.htm
南平市延平区先行电脑经营部,http:////www.11467.com/nanping/co/2079.htm
建瓯市飞翔鸟电脑商行,http:////www.11467.com/nanping/co/16377.htm
邵武市海翔电脑商行,http:////www.11467.com/nanping/co/12387.htm
南平市延平区宇通电脑商行,http:////www.11467.com/nanping/co/2072.htm
福建省南平市明太电脑销售有限公司,http:////www.11467.com/nanping/co/2049.htm
南平市延平区缤纷电脑配件经营部,http:////www.11467.com/nanping/co/2074.htm
福建省建瓯市福鑫物资有限公司电脑销售分公司,http:////www.11467.com/nanping/co/16376.htm
南平市延平区登峰电脑经营部,http:////www.11467.com/nanping/co/2069.htm
南平市延平区立新电脑商行,http:////www.11467.com/nanping/co/2076.htm
南平市延平区振兴电脑商行,http:////www.11467.com/nanping/co/2057.htm
南平市延平区创源电脑商行,http:////www.11467.com/nanping/co/2070.htm
南平市信达电脑经营部,http:////www.11467.com/nanping/co/2050.htm
南平市延平区百姓电脑经营部,http:////www.11467.com/nanping/co/2073.htm
南通市八仙城午未电脑经营部,http:////www.11467.com/nantong/co/9724.htm
南通电脑市场业诚电脑经营部,http:////www.11467.com/nantong/co/9728.htm
南通市八仙城大宇电脑商行,http:////www.11467.com/nantong/co/9779.htm
南通市崇川区世杰电脑服务部,http:////www.11467.com/nantong/co/9720.htm
南通市崇川城东鑫成电脑服务部,http:////www.11467.com/nantong/co/9752.htm
南通市崇川区兴成电脑经营部,http:////www.11467.com/nantong/co/9732.htm
南通市崇川城南千禧电脑经营部,http:////www.11467.com/nantong/co/9739.htm
南通市崇川区鼎立电脑商行,http:////www.11467.com/nantong/co/9664.htm
南通忠正电脑销售有限公司,http:////www.11467.com/nantong/co/9730.htm
启东市宁远电脑销售有限公司,http:////www.11467.com/nantong/co/29521.htm
海门市星空电脑经营部,http:////www.11467.com/nantong/co/50701.htm
南通市崇川区八仙城联讯电脑经营部,http:////www.11467.com/nantong/co/9765.htm
启东市思腾电脑经营部,http:////www.11467.com/nantong/co/29567.htm
海安县畅想电脑经营部,http:////www.11467.com/nantong/co/19650.htm
海安县新三维电脑经营部,http:////www.11467.com/nantong/co/19670.htm
如皋市如城镇昆鹏电脑经营部,http:////www.11467.com/nantong/co/36574.htm
南通市崇川区鸿光紫润电脑销售部,http:////www.11467.com/nantong/co/9727.htm
南通市崇川区尖峰电脑服务部,http:////www.11467.com/nantong/co/9772.htm
通州市金沙镇鑫新电脑服务部,http:////www.11467.com/nantong/co/43457.htm
南通市崇川区恒宇电脑商行,http:////www.11467.com/nantong/co/9742.htm
如东县掘港镇日晖电脑经营部,http:////www.11467.com/nantong/co/23710.htm
启东市鸿飞电脑经营部,http:////www.11467.com/nantong/co/29517.htm
内江市中区金碟电脑经营部,http:////www.11467.com/neijiang/co/8120.htm
威员县恒隆耗材经营部,http:////www.11467.com/neijiang/co/4207.htm
宁波市镇海甬京电脑经营部,http:////www.11467.com/ningbo/co/9682.htm
宁德市三惠贸易有限公司电脑经营部,http:////www.11467.com/ningde/co/80.htm
宁德市蕉城区新华夏软件服务部,http:////www.11467.com/ningde/co/1551.htm
屏南县时代电脑经营部,http:////www.11467.com/ningde/co/5314.htm
宁德市蕉城区蕉南狮普电脑经营部,http:////www.11467.com/ningde/co/1552.htm
宁德市蕉城区科讯电脑经营部,http:////www.11467.com/ningde/co/1554.htm
宁德市蕉城区蕉北澳科电脑经营部,http:////www.11467.com/ningde/co/1553.htm
攀枝花市东区远征电脑经营部,http:////www.11467.com/panzhihua/co/1688.htm
攀枝花市东区长信电脑经营部,http:////www.11467.com/panzhihua/co/1685.htm
攀枝花市东区正中信电脑耗材经营部,http:////www.11467.com/panzhihua/co/1700.htm
攀枝花市鸿创电脑经营部,http:////www.11467.com/panzhihua/co/1652.htm
攀枝花市广天电脑经营部,http:////www.11467.com/panzhihua/co/1627.htm
攀枝花市志航电脑经营部,http:////www.11467.com/panzhihua/co/1630.htm
兴达电脑经营部,http:////www.11467.com/panzhihua/co/1698.htm
科峰电脑经营部,http:////www.11467.com/panzhihua/co/1663.htm
希望软件经营部,http:////www.11467.com/panzhihua/co/1687.htm
攀枝花市常泰电脑经营部,http:////www.11467.com/panzhihua/co/1690.htm
盐边县天恒电脑经营部,http:////www.11467.com/panzhihua/co/6782.htm
攀枝花市东区希望软件经营部,http:////www.11467.com/panzhihua/co/1695.htm
攀枝花市瑞腾电脑经营部,http:////www.11467.com/panzhihua/co/1632.htm
萍乡市腾飞电脑服务部,http:////www.11467.com/pingxiang/co/1173.htm
萍乡市亿能科技电脑经营部,http:////www.11467.com/pingxiang/co/1146.htm
萍乡科源科技电脑经营部,http:////www.11467.com/pingxiang/co/1174.htm
萍乡市九州软件服务部,http:////www.11467.com/pingxiang/co/1172.htm
萍乡市乐德网络电脑销售中心,http:////www.11467.com/pingxiang/co/1144.htm
城厢区天慧电脑耗材经营部,http:////www.11467.com/putian/co/3442.htm
濮阳市中原路天恒电脑服务部,http:////www.11467.com/puyang/co/1134.htm
濮阳市中原路唯依电脑服务部,http:////www.11467.com/puyang/co/1130.htm
贵州振盈东科技有限公司,http:////www.11467.com/qiandongnan/co/3568.htm
天柱县佳源电脑经营部,http:////www.11467.com/qiandongnan/co/3818.htm
都匀佳鑫科技商贸有限公司,http:////www.11467.com/qiannan/co/520.htm
都匀国岛信息网络科技有限责任公司,http:////www.11467.com/qiannan/co/518.htm
黔南州熙睿科工贸有限责任公司,http:////www.11467.com/qiannan/co/515.htm
安龙县第一电脑经营部,http:////www.11467.com/qianxinan/co/2455.htm
青岛金宇电脑经营部,http:////www.11467.com/qingdao/co/17679.htm
山海关科艺电脑服务部,http:////www.11467.com/qinhuangdao/co/10700.htm
秦皇岛市万灵电脑销售有限公司,http:////www.11467.com/qinhuangdao/co/1382.htm
秦皇岛市兴安实业公司电脑服务部,http:////www.11467.com/qinhuangdao/co/1381.htm
山海关铁路医院天兴电脑服务部,http:////www.11467.com/qinhuangdao/co/10699.htm
秦皇岛市银河物资经销公司电脑服务部,http:////www.11467.com/qinhuangdao/co/1379.htm
秦皇岛市海港区齐立电脑经营部,http:////www.11467.com/qinhuangdao/co/1375.htm
秦皇岛市教育旅行社园丁电脑服务部,http:////www.11467.com/qinhuangdao/co/1380.htm
秦皇岛市房地产电脑服务部,http:////www.11467.com/qinhuangdao/co/1354.htm
昌黎县金和通电脑销售有限责任公司,http:////www.11467.com/qinhuangdao/co/16497.htm
秦皇岛市通昌图文有限公司电脑服务部,http:////www.11467.com/qinhuangdao/co/1367.htm
秦皇岛渤海电脑经营部,http:////www.11467.com/qinhuangdao/co/1376.htm
秦皇岛市企业技术改造管理协会电脑经营部,http:////www.11467.com/qinhuangdao/co/1378.htm
南方电脑经营部,http:////www.11467.com/qinzhou/co/1147.htm
齐齐哈尔市可欣电脑商行,http:////www.11467.com/qiqihaer/co/14492.htm
齐齐哈尔市富拉尔基区易达电脑经营部,http:////www.11467.com/qiqihaer/co/18505.htm
泉州鲤城奥通电脑商行,http:////www.11467.com/quanzhou/co/4210.htm
深圳市福田区望辉电脑服务部,http:////www.11467.com/shenzhen/co/14215.htm
深圳市福田区鑫兴办公设备经营部,http:////www.11467.com/shenzhen/co/14333.htm
深圳市红朝阳办公设备有限公司,http:////www.11467.com/shenzhen/co/13923.htm
深圳赛格电子市场奥格威展销柜,http:////www.11467.com/shenzhen/co/14555.htm
深圳赛格电子市场明炎商柜,http:////www.11467.com/shenzhen/co/14302.htm
深圳市福田区新浪源电子经营部,http:////www.11467.com/shenzhen/co/14177.htm
深圳市龙岗区龙岗镇深港办公设备商行,http:////www.11467.com/shenzhen/co/49902.htm
深圳市南山区威发办公用品店,http:////www.11467.com/shenzhen/co/29585.htm
深圳市鹏翼展办公设备有限公司,http:////www.11467.com/shenzhen/co/14157.htm
深圳市赛博宏大通讯市场凯华电脑展销部,http:////www.11467.com/shenzhen/co/14173.htm
深圳市赛博宏大电子通讯市场中柏电脑经营部,http:////www.11467.com/shenzhen/co/13956.htm
深圳市赛博宏大数码通讯市场盈科数码经营部,http:////www.11467.com/shenzhen/co/13974.htm
深圳市赛格电子市场威特展销部,http:////www.11467.com/shenzhen/co/14526.htm
深圳市旭帆文具用品有限公司,http:////www.11467.com/shenzhen/co/14265.htm
深圳市日成数码科技有限公司,http:////www.11467.com/shenzhen/co/29562.htm
深圳市银河电子贸易行,http:////www.11467.com/shenzhen/co/14296.htm
深圳市五星办公用品经营部,http:////www.11467.com/shenzhen/co/891.htm
深圳市鑫明泰科技有限公司,http:////www.11467.com/shenzhen/co/14028.htm
深圳市龙岗区坪山镇友盟电脑商行,http:////www.11467.com/shenzhen/co/49575.htm
深圳市盐田区恒年科技电脑配件专卖店,http:////www.11467.com/shenzhen/co/55421.htm
深圳市中资源数码机电有限公司,http:////www.11467.com/shenzhen/co/877.htm
深圳市祥利明科技有限公司,http:////www.11467.com/shenzhen/co/29582.htm
深圳市兴德科实业有限公司后海分公司,http:////www.11467.com/shenzhen/co/29622.htm
深圳市永安乐办公设备有限公司,http:////www.11467.com/shenzhen/co/14026.htm
深圳市永安创新办公设备有限公司,http:////www.11467.com/shenzhen/co/13856.htm
深圳市盈信达数码科技有限公司,http:////www.11467.com/shenzhen/co/14253.htm
石河子市阳光电脑服务部,http:////www.11467.com/shihezi/co/722.htm
河北博达物业公司知音软件专卖店,http:////www.11467.com/shijiazhuang/co/16516.htm
栾城县东明电脑服务部,http:////www.11467.com/shijiazhuang/co/31621.htm
石家庄桥东中亚电脑经营部,http:////www.11467.com/shijiazhuang/co/12100.htm
石家庄广元软件销售有限公司,http:////www.11467.com/shijiazhuang/co/16514.htm
石家庄市长安区科技开发公司桥东软件销售部,http:////www.11467.com/shijiazhuang/co/12098.htm
石家庄开发区联众电脑销售中心,http:////www.11467.com/shijiazhuang/co/1042.htm
石家庄博文电脑销售服务中心,http:////www.11467.com/shijiazhuang/co/1044.htm
石家庄市桥西东里第三产业管理站清心阁电脑经营部,http:////www.11467.com/shijiazhuang/co/16517.htm
石家庄市桥西区联信电脑软件经营部,http:////www.11467.com/shijiazhuang/co/16500.htm
石家庄市桥西区蓝色海洋计算机销售部,http:////www.11467.com/shijiazhuang/co/16518.htm
平山县万思帝电脑经营部,http:////www.11467.com/shijiazhuang/co/40452.htm
石家庄市长安华瑞电脑服务部,http:////www.11467.com/shijiazhuang/co/6934.htm
十堰市通神电脑服务部,http:////www.11467.com/shiyan/co/1420.htm
十堰市公园路金盛电脑经营部,http:////www.11467.com/shiyan/co/1422.htm
四平电力实业总公司电脑服务部,http:////www.11467.com/siping/co/937.htm
四平市铁西区求知电脑经营部,http:////www.11467.com/siping/co/942.htm
松原市宁江区顺通计算机销售维修中心,http:////www.11467.com/songyuan/co/1804.htm
沭阳县振江电脑服务部,http:////www.11467.com/suqian/co/2975.htm
宿迁市宿城区秦志电脑经营部,http:////www.11467.com/suqian/co/690.htm
常熟市东升计算机销售有限责任公司,http:////www.11467.com/suzhou/co/47557.htm
常熟市沙家浜镇北电电脑销售店,http:////www.11467.com/suzhou/co/47421.htm
常熟市协安电脑商行,http:////www.11467.com/suzhou/co/47554.htm
昆山市开发区科恒电脑商行,http:////www.11467.com/suzhou/co/75367.htm
常熟市圆周电脑服务部,http:////www.11467.com/suzhou/co/47536.htm
苏州工业园区娄葑乡联合电脑服务部,http:////www.11467.com/suzhou/co/13004.htm
昆山市玉山镇科隆电脑服务部,http:////www.11467.com/suzhou/co/75344.htm
苏州工业园区娄葑镇嘉华喷绘耗材经营部,http:////www.11467.com/suzhou/co/13002.htm
苏州高新区博学软件服务部,http:////www.11467.com/suzhou/co/23350.htm
昆山市锦溪镇新天地电脑服务部,http:////www.11467.com/suzhou/co/75361.htm
昆山市玉山镇英迈电脑商行,http:////www.11467.com/suzhou/co/75368.htm
苏州市双利电脑商行,http:////www.11467.com/suzhou/co/4240.htm
太仓市城厢镇新四海电脑商行,http:////www.11467.com/suzhou/co/100268.htm
吴江市松陵镇顺昌电子电脑经营部,http:////www.11467.com/suzhou/co/91464.htm
昆山市玉山镇宏光电脑经营服务部,http:////www.11467.com/suzhou/co/75341.htm
苏州市沧浪区科捷电脑耗材经营部,http:////www.11467.com/suzhou/co/4256.htm
苏州市沧浪区福日电脑销售中心,http:////www.11467.com/suzhou/co/4235.htm
苏州市沧浪区硕明电脑经营部,http:////www.11467.com/suzhou/co/4244.htm
吴江市松陵镇太阳岛电脑软件服务部,http:////www.11467.com/suzhou/co/91437.htm
吴江市松陵镇铨力耗材经营部,http:////www.11467.com/suzhou/co/91423.htm
吴江市松陵镇东升电脑耗材经营部,http:////www.11467.com/suzhou/co/91435.htm
苏州市沧浪区创奇电脑经营部,http:////www.11467.com/suzhou/co/4231.htm
苏州市沧浪区三邦电脑服务部,http:////www.11467.com/suzhou/co/4167.htm
吴县市木渎千禧电脑服务部,http:////www.11467.com/suzhou/co/37257.htm
张家港市乘航龙彦电脑服务部,http:////www.11467.com/suzhou/co/56207.htm
苏州新区红枫电脑经营服务部,http:////www.11467.com/suzhou/co/23349.htm
张家港市杨舍东城江海电脑服务部,http:////www.11467.com/suzhou/co/56135.htm
吴江市横扇镇菀坪亦荣电脑经营部,http:////www.11467.com/suzhou/co/91442.htm
苏州友通数码港华园电脑经营部,http:////www.11467.com/suzhou/co/18125.htm
苏州友通数码港迅大电脑经营部,http:////www.11467.com/suzhou/co/18126.htm
苏州友通数码港金易电脑经营部,http:////www.11467.com/suzhou/co/17909.htm
苏州索思电脑经营部,http:////www.11467.com/suzhou/co/3927.htm
吴江市震泽飞腾电脑服务部,http:////www.11467.com/suzhou/co/91431.htm
张家港市港区恒通电脑服务部,http:////www.11467.com/suzhou/co/56206.htm
张家港市塘桥蓝天电脑经营服务部,http:////www.11467.com/suzhou/co/56129.htm
张家港市杨舍晶合大众软件专卖店,http:////www.11467.com/suzhou/co/56136.htm
张家港市杨舍企鹅电脑服务部,http:////www.11467.com/suzhou/co/56209.htm
张家港市杨舍西城鑫龙电脑销售部,http:////www.11467.com/suzhou/co/56176.htm
张家港市拥友电脑经营部,http:////www.11467.com/suzhou/co/56166.htm
吴县市麟龙电脑销售有限公司,http:////www.11467.com/suzhou/co/37259.htm
太原市河西区皓月电脑服务部,http:////www.11467.com/taiyuan/co/6628.htm
太原市迎泽天健连邦软件专卖店,http:////www.11467.com/taiyuan/co/20705.htm
太原迅达电脑服务部,http:////www.11467.com/taiyuan/co/6526.htm
台州市椒江通用软件经营部,http:////www.11467.com/taizhou/co/3617.htm
温岭市太平新世纪电脑经营部,http:////www.11467.com/taizhou/co/36607.htm
仙居县拓普电脑服务部,http:////www.11467.com/taizhou/co/26912.htm
靖江市孤山志鸿电脑商行,http:////www.11467.com/taizhoushi/co/14163.htm
泰州市海陵区天兰电脑商行,http:////www.11467.com/taizhoushi/co/4049.htm
靖江市恒欣计算机销售有限公司,http:////www.11467.com/taizhoushi/co/14162.htm
靖江市靖城靖福电脑商行,http:////www.11467.com/taizhoushi/co/14152.htm
泰兴市佳信电脑经营部,http:////www.11467.com/taizhoushi/co/18684.htm
泰州市海陵区紫君电脑耗材店,http:////www.11467.com/taizhoushi/co/4050.htm
唐山市路南东方电脑经营服务部,http:////www.11467.com/tangshan/co/1226.htm
唐山市路南通达电脑经营部,http:////www.11467.com/tangshan/co/5991.htm
唐山路南合众电脑经营服务部,http:////www.11467.com/tangshan/co/1252.htm
丰南市创智电脑服务部,http:////www.11467.com/tangshan/co/15873.htm
唐山市高新技术开发区阳森计算机销售处,http:////www.11467.com/tangshan/co/6003.htm
迁安市科达电脑服务部,http:////www.11467.com/tangshan/co/36263.htm
唐山一中计算机网络工程开发中心电脑销售部,http:////www.11467.com/tangshan/co/1216.htm
唐山市路北海洋电脑服务部,http:////www.11467.com/tangshan/co/5990.htm
开滦林西矿凯琳电脑服务部,http:////www.11467.com/tangshan/co/11388.htm
唐山市新区奥特电脑经营部,http:////www.11467.com/tangshan/co/18785.htm
天水市秦城区立创计算机销售中心,http:////www.11467.com/tianshui/co/2365.htm
昌图县昌图镇凯鸥电脑服务部,http:////www.11467.com/tieling/co/12078.htm
铁岭市银州区天合科技电脑销售中心,http:////www.11467.com/tieling/co/4690.htm
威海扬帆电脑销售有限公司,http:////www.11467.com/weihai/co/6759.htm
渭南市顺达电脑经营部,http:////www.11467.com/weinan/co/109.htm
温州市鹿城天视电脑经营部,http:////www.11467.com/wenzhou/co/20955.htm
芜湖市明远电脑经营部,http:////www.11467.com/wuhu/co/1413.htm
乌鲁木齐市粤港电脑配件经营部,http:////www.11467.com/wulumuqi/co/27660.htm
乌鲁木齐市联海电脑商行,http:////www.11467.com/wulumuqi/co/27666.htm
乌鲁木齐市沙依巴克区飞驰电脑销售部,http:////www.11467.com/wulumuqi/co/27665.htm
乌鲁木齐宏鑫贸易商行众和电脑经营部,http:////www.11467.com/wulumuqi/co/31930.htm
乌鲁木齐市仁达讯电脑服务部,http:////www.11467.com/wulumuqi/co/1949.htm
乌鲁木齐市同心俱进软件服务部,http:////www.11467.com/wulumuqi/co/1938.htm
江阴市璜土三强电脑服务部,http:////www.11467.com/wuxi/co/73309.htm
江阴市澄江镇澄南新世纪电脑商行,http:////www.11467.com/wuxi/co/73270.htm
江阴市周庄华晶电脑经营部,http:////www.11467.com/wuxi/co/73328.htm
无锡市北塘区金方诚业电脑配件商行,http:////www.11467.com/wuxi/co/19782.htm
无锡市北塘区大唐电脑经营部,http:////www.11467.com/wuxi/co/19777.htm
无锡市崇安区海融电子软件经营部梦之岛分部,http:////www.11467.com/wuxi/co/15428.htm
无锡市崇安区万佳电脑服务部,http:////www.11467.com/wuxi/co/9106.htm
无锡市明峰电脑经营部,http:////www.11467.com/wuxi/co/19835.htm
无锡市海普电脑服务部,http:////www.11467.com/wuxi/co/53251.htm
无锡市南长区拓扑电脑经营部,http:////www.11467.com/wuxi/co/15421.htm
无锡市南长区国凌电脑经营部,http:////www.11467.com/wuxi/co/15427.htm
无锡市南长区达华电脑经营部,http:////www.11467.com/wuxi/co/15425.htm
无锡市南长区宏为电脑经营部,http:////www.11467.com/wuxi/co/15442.htm
无锡市南长区华杰电脑经营部,http:////www.11467.com/wuxi/co/15457.htm
无锡市南长区美达电脑经营部,http:////www.11467.com/wuxi/co/15440.htm
无锡市北塘区盛北电脑服务部,http:////www.11467.com/wuxi/co/2694.htm
无锡市北塘区同心电脑经营部,http:////www.11467.com/wuxi/co/19781.htm
无锡市南长区倍斯特电脑经营部,http:////www.11467.com/wuxi/co/15420.htm
无锡市凯丰电脑经营部,http:////www.11467.com/wuxi/co/19832.htm
无锡市南长区超导电脑经营部,http:////www.11467.com/wuxi/co/15424.htm
无锡市南长区傲天电脑经营部,http:////www.11467.com/wuxi/co/15379.htm
无锡市南长区康利达电脑经营部,http:////www.11467.com/wuxi/co/15474.htm
无锡市南长区力特电脑经营部,http:////www.11467.com/wuxi/co/2699.htm
无锡市蒙恬电脑经营部,http:////www.11467.com/wuxi/co/19839.htm
无锡市美科电脑经营部,http:////www.11467.com/wuxi/co/19844.htm
无锡市南长区大成电脑经营部,http:////www.11467.com/wuxi/co/15431.htm
无锡市南长区世和电脑经营部,http:////www.11467.com/wuxi/co/15446.htm
无锡市南长区四维电脑经营部,http:////www.11467.com/wuxi/co/2743.htm
无锡市南长区金河田电脑经营部,http:////www.11467.com/wuxi/co/15479.htm
无锡市南长区中联电脑经营部,http:////www.11467.com/wuxi/co/15481.htm
无锡市先导电脑经营部,http:////www.11467.com/wuxi/co/19834.htm
无锡市南长区巨鼎电脑经营部,http:////www.11467.com/wuxi/co/15456.htm
无锡市郊区黄巷洪军电脑服务部,http:////www.11467.com/wuxi/co/53345.htm
无锡市南长区并行电脑经营部,http:////www.11467.com/wuxi/co/15448.htm
无锡市南长区恒宇电脑经营部,http:////www.11467.com/wuxi/co/15433.htm
无锡市瑞福电脑经营部,http:////www.11467.com/wuxi/co/19842.htm
无锡市弘亨电脑耗材经营部,http:////www.11467.com/wuxi/co/9107.htm
锡山市东亭天马电脑经营部,http:////www.11467.com/wuxi/co/31726.htm
宜兴市新世纪电脑配件经营部,http:////www.11467.com/wuxi/co/86871.htm
无锡市新柯碟业电脑经营部,http:////www.11467.com/wuxi/co/15382.htm
无锡市新华强电脑经营部,http:////www.11467.com/wuxi/co/19773.htm
无锡招商城劝业场联众电子电脑经营部,http:////www.11467.com/wuxi/co/2710.htm
无锡市南长区新红日电脑经营部,http:////www.11467.com/wuxi/co/15383.htm
无锡市南长区西恩西电脑服务部,http:////www.11467.com/wuxi/co/15437.htm
无锡市南长区欣月电脑经营部,http:////www.11467.com/wuxi/co/15769.htm
无锡市南长区新志同电脑经营部,http:////www.11467.com/wuxi/co/15438.htm
