中山市西区鹏宏电脑配件经营部,http:////www.11467.com/zhongshan/co/17269.htm
中山市西区鹏宏电脑配件经营部的商铺,http://zhongshan017269.11467.com
上海汉诺通讯技术有限公司,http:////www.11467.com/shanghai/co/125894.htm
上海汉诺通讯技术有限公司的商铺,http://shanghai0125894.11467.com
四会市城中区创轩电脑经营部,http:////www.11467.com/zhaoqing/co/13101.htm
汕头市龙湖区珠池博域行,http:////www.11467.com/shantou/co/320.htm
贵阳康恒贸易有限公司,http:////www.11467.com/guiyang/co/14064.htm
塔里木运输公司劳动服务公司电脑服务部,http:////www.11467.com/akesu/co/3208.htm
鞍山市铁东东盛电脑商行,http:////www.11467.com/anshan/co/7687.htm
鞍山市铁东创世电脑商行,http:////www.11467.com/anshan/co/7695.htm
鞍山市铁东格林电脑经营部,http:////www.11467.com/anshan/co/7718.htm
鞍山市铁东龙昌电脑商行,http:////www.11467.com/anshan/co/7376.htm
鞍山市铁东作为科技电脑商行,http:////www.11467.com/anshan/co/7410.htm
鞍山市铁东三维电脑商行,http:////www.11467.com/anshan/co/7411.htm
鞍山市铁东蓝点电脑商行,http:////www.11467.com/anshan/co/7713.htm
海城市海州区至丞电脑商行,http:////www.11467.com/anshan/co/32200.htm
鞍山市铁东天利电脑商行,http:////www.11467.com/anshan/co/7739.htm
鞍山市铁东星龙电脑商行,http:////www.11467.com/anshan/co/7395.htm
安顺志诚科技有限责任公司,http:////www.11467.com/anshun/co/14.htm
安顺华宇办公设备有限责任公司,http:////www.11467.com/anshun/co/16.htm
安阳连邦软件专卖店,http:////www.11467.com/anyang/co/2421.htm
安阳市专博远电脑经营部,http:////www.11467.com/anyang/co/2403.htm
田东县海伦电脑经营部,http:////www.11467.com/baise/co/1835.htm
百色市迅捷电脑服务部,http:////www.11467.com/baise/co/302.htm
百色市锐达电脑商行,http:////www.11467.com/baise/co/2602.htm
保定市新市区万能软件销售服务部,http:////www.11467.com/baoding/co/2714.htm
保定市英捷财务软件销售有限公司,http:////www.11467.com/baoding/co/2689.htm
保定市新市区世纪同辉电脑经营部,http:////www.11467.com/baoding/co/2692.htm
保定市新市区纪星电脑服务部,http:////www.11467.com/baoding/co/2675.htm
保定高开区鼎立电脑销售部,http:////www.11467.com/baoding/co/2665.htm
德阳开发区浪潮软件经营部,http:////www.11467.com/deyang/co/1904.htm
福州仓山许佳电脑服务部,http:////www.11467.com/fuzhou/co/28993.htm
广州市升维办公设备有限公司,http:////www.11467.com/guangzhou/co/31097.htm
贵州耐威盖特科技有限公司,http:////www.11467.com/guiyang/co/763.htm
贵阳北佳信息技术有限公司,http:////www.11467.com/guiyang/co/30363.htm
贵阳旭美特商贸有限公司,http:////www.11467.com/guiyang/co/30286.htm
贵州航洋数码科技有限公司,http:////www.11467.com/guiyang/co/28393.htm
贵州通泰科技发展有限责任公司,http:////www.11467.com/guiyang/co/14228.htm
贵阳威科理想办公设备有限公司,http:////www.11467.com/guiyang/co/30291.htm
惠州市万星科技有限公司,http:////www.11467.com/huizhou/co/2935.htm
汾阳市晨邦电脑销售有限公司,http:////www.11467.com/lvliang/co/9824.htm
绵阳城区天星电脑耗材经营部,http:////www.11467.com/mianyang/co/6277.htm
衢州市柯城金龙电脑经营部,http:////www.11467.com/quzhou/co/1442.htm
武汉市江汉区新潮电脑经营部,http:////www.11467.com/wuhan/co/4822.htm
苏尼特右旗翔宇电脑,http:////www.11467.com/xilinguole/co/4248.htm
玉州区三普电脑经营部,http:////www.11467.com/yulin/co/1871.htm
中山市伯龙电脑科技有限公司,http:////www.11467.com/zhongshan/co/17259.htm
中山市天乐听力技术有限公司,http:////www.11467.com/zhongshan/co/17284.htm
上海亚光书刊电脑经营部,http:////www.11467.com/shanghai/co/232321.htm
天津市河西区博泰电脑服务部,http:////www.11467.com/tianjin/co/81169.htm
东莞市网娱电脑安防工程有限公司,http:////www.11467.com/qiye/93338136.htm
遵义市红花岗区奥神网络服务部,http:////www.11467.com/zunyi/co/85.htm
保定通信实业有限公司计算机销售维修中心,http:////www.11467.com/baoding/co/2664.htm
保定市信助计算机销售有限公司,http:////www.11467.com/baoding/co/6551.htm
保定高新区天和计算机销售服务中心,http:////www.11467.com/baoding/co/3110.htm
保定高新区阳光电脑经营部,http:////www.11467.com/baoding/co/3113.htm
保定市新天地电脑服务部,http:////www.11467.com/baoding/co/6549.htm
保定市北市区四正电脑服务部,http:////www.11467.com/baoding/co/6561.htm
保定市北市区金手指电脑服务部,http:////www.11467.com/baoding/co/6563.htm
保定高新区金迪路万达电脑服务部,http:////www.11467.com/baoding/co/3114.htm
保定市南市区凯盛电脑销售部,http:////www.11467.com/baoding/co/11189.htm
保定市南市区新众电脑经营部,http:////www.11467.com/baoding/co/11175.htm
高碑店市高碑店自强电脑服务部,http:////www.11467.com/baoding/co/44006.htm
保定市新市区聚友电脑服务部,http:////www.11467.com/baoding/co/2691.htm
保定市奥维百特通用财务软件销售有限公司分公司,http:////www.11467.com/baoding/co/2669.htm
保定市众维电脑销售有限公司,http:////www.11467.com/baoding/co/2667.htm
保定市南市区蓝羽羚电脑经营部,http:////www.11467.com/baoding/co/11183.htm
定兴县飞达电脑服务部,http:////www.11467.com/baoding/co/20596.htm
徐水县向导电脑销售部,http:////www.11467.com/baoding/co/18378.htm
保定市北市区华中计算机销售部,http:////www.11467.com/baoding/co/6554.htm
定兴县万博电脑服务部,http:////www.11467.com/baoding/co/20608.htm
保定市万达电脑销售股份合作公司,http:////www.11467.com/baoding/co/2676.htm
保定市北市区远景电脑销售部,http:////www.11467.com/baoding/co/6555.htm
保定市北市区天域电脑服务部,http:////www.11467.com/baoding/co/6553.htm
保定市财信电脑销售中心,http:////www.11467.com/baoding/co/6562.htm
保定连邦软件有限公司连邦软件专卖店,http:////www.11467.com/baoding/co/2668.htm
保定市奥维百特通用财务软件销售有限公司,http:////www.11467.com/baoding/co/2693.htm
保定市南市区明辉电脑耗材经营部,http:////www.11467.com/baoding/co/11211.htm
保定市北市区伟业计算机销售中心,http:////www.11467.com/baoding/co/6583.htm
保定市技术交易事务所万达电脑服务部,http:////www.11467.com/baoding/co/2671.htm
容城县讯捷电脑销售有限公司,http:////www.11467.com/baoding/co/24302.htm
陇县新蓝电脑经营部,http:////www.11467.com/baoji/co/12205.htm
宝鸡县鼎德利电脑商行,http:////www.11467.com/baoji/co/7433.htm
包头市科苑电脑经营部,http:////www.11467.com/baotou/co/10678.htm
包头用电安装公司双灵电脑服务部,http:////www.11467.com/baotou/co/16020.htm
包头市青山区飞达电脑服务部,http:////www.11467.com/baotou/co/16010.htm
包头市飞洋物资有限责任公司电脑服务部,http:////www.11467.com/baotou/co/10676.htm
内蒙古磴口县三益电脑经营中心,http:////www.11467.com/bayannaoer/co/1302.htm
新疆巴州新世纪电脑商行,http:////www.11467.com/bayinguoleng/co/2717.htm
水利部淮河水利委员会博达电脑销售服务中心,http:////www.11467.com/bengbu/co/2137.htm
本溪市平山区海纳电脑销售中心,http:////www.11467.com/benxi/co/2245.htm
本溪市明山区佳博电脑商行,http:////www.11467.com/benxi/co/11237.htm
本溪市明山区世纪电脑商行,http:////www.11467.com/benxi/co/11239.htm
本溪市天成软件销售中心,http:////www.11467.com/benxi/co/2260.htm
蒙城县科海电脑销售有限责任公司,http:////www.11467.com/bozhou/co/6670.htm
沧州市运东弛洋电脑服务部,http:////www.11467.com/cangzhou/co/403.htm
任丘市方园电脑服务部,http:////www.11467.com/cangzhou/co/22058.htm
沧州市北斗计算机销售服务中心,http:////www.11467.com/cangzhou/co/2413.htm
常德市武陵区文建电脑经营部,http:////www.11467.com/changde/co/2180.htm
长沙商艺电脑服务部,http:////www.11467.com/changsha/co/8207.htm
长沙市芙蓉区金方正电脑商行,http:////www.11467.com/changsha/co/8264.htm
长沙市芙蓉区三达电脑商行,http:////www.11467.com/changsha/co/8260.htm
长沙市雨花区新世纪电脑商行,http:////www.11467.com/changsha/co/34077.htm
长沙市芙蓉区比特瑞旺电脑经营部,http:////www.11467.com/changsha/co/7572.htm
长沙市岳麓区流星电脑销售部,http:////www.11467.com/changsha/co/20608.htm
长沙市岳麓区鑫软软件销售服务商行,http:////www.11467.com/changsha/co/20605.htm
长沙市芙蓉区新干线电脑经营部,http:////www.11467.com/changsha/co/7543.htm
长沙市芙蓉区怡海电脑经营部,http:////www.11467.com/changsha/co/8397.htm
常州市天宁区联合电脑销售部,http:////www.11467.com/changzhou/co/3784.htm
常州市天宁区雨润电脑销售部,http:////www.11467.com/changzhou/co/3759.htm
常州市常图电脑服务部,http:////www.11467.com/changzhou/co/8844.htm
常州市天胜电脑经营部,http:////www.11467.com/changzhou/co/3727.htm
常州市电子产品交易市场（维多电脑经营部）,http:////www.11467.com/changzhou/co/3809.htm
金坛市城西新华电脑耗材经营部,http:////www.11467.com/changzhou/co/47610.htm
常州市武进区横山希望电脑服务部,http:////www.11467.com/changzhou/co/23867.htm
常州市启发电脑经营部,http:////www.11467.com/changzhou/co/3794.htm
常州佳诺电脑服务部,http:////www.11467.com/changzhou/co/8871.htm
常州市文化宫广场（凌云电脑服务部）,http:////www.11467.com/changzhou/co/3764.htm
常州市佳友计算机销售服务部,http:////www.11467.com/changzhou/co/8869.htm
常州市郊区红梅环宇电脑服务部,http:////www.11467.com/changzhou/co/4113.htm
常州市五星西城电脑服务部,http:////www.11467.com/changzhou/co/8873.htm
常州市新浪电脑销售有限公司,http:////www.11467.com/changzhou/co/8892.htm
常州市仁华电脑服务部,http:////www.11467.com/changzhou/co/3775.htm
常州新区科艺电脑服务部,http:////www.11467.com/changzhou/co/15816.htm
常州市钟楼区丹泓电脑经营部,http:////www.11467.com/changzhou/co/8883.htm
常州市铭志电脑经营部,http:////www.11467.com/changzhou/co/3807.htm
常州市戚墅堰金龙电脑服务部,http:////www.11467.com/changzhou/co/12756.htm
常州市天欣电脑服务部,http:////www.11467.com/changzhou/co/23865.htm
常州市郊区茶山嘉博电脑服务部,http:////www.11467.com/changzhou/co/15804.htm
江苏华康物资供销公司连邦软件专卖店,http:////www.11467.com/changzhou/co/885.htm
常州市郊区博科软件经营部,http:////www.11467.com/changzhou/co/15807.htm
常州市郊区超达电脑经营部,http:////www.11467.com/changzhou/co/15817.htm
武进市湖塘天运电脑服务部,http:////www.11467.com/changzhou/co/23863.htm
常州市郊区大众电脑经营部,http:////www.11467.com/changzhou/co/15827.htm
金坛市骏敏电脑经营部,http:////www.11467.com/changzhou/co/47583.htm
金坛市金城小亚电脑服务部,http:////www.11467.com/changzhou/co/47630.htm
常州市郊区八达电脑经营部,http:////www.11467.com/changzhou/co/15828.htm
溧阳市溧城名大电脑服务部,http:////www.11467.com/changzhou/co/40411.htm
武进市政平乡创新电脑服务部,http:////www.11467.com/changzhou/co/23875.htm
常州市扬帆电脑经营部,http:////www.11467.com/changzhou/co/3816.htm
巢湖市居巢区七喜电脑经营部,http:////www.11467.com/chaohu/co/1049.htm
巢湖市居巢区锐锋电脑经营部,http:////www.11467.com/chaohu/co/1052.htm
巢湖市居巢区新华教育电脑服务部,http:////www.11467.com/chaohu/co/1051.htm
巢湖市居巢区同方电脑服务部,http:////www.11467.com/chaohu/co/1048.htm
凌源市联合大众电脑销售服务中心,http:////www.11467.com/chaoyang/co/13843.htm
潮安县庵埠镇腾胜电脑商行,http:////www.11467.com/chaozhou/co/13375.htm
承德市弘历电脑软件专卖店,http:////www.11467.com/chengde/co/209.htm
平泉县广视电脑商行,http:////www.11467.com/chengde/co/9390.htm
承德医学院技术产业开发部新在线电脑服务部,http:////www.11467.com/chengde/co/208.htm
承德慧源电脑商行,http:////www.11467.com/chengde/co/207.htm
承德市粮食运输贸易公司天成电脑服务部,http:////www.11467.com/chengde/co/206.htm
承德市银发科技电脑经营部,http:////www.11467.com/chengde/co/210.htm
成都市武侯区盈翔电脑经营部,http:////www.11467.com/chengdu/co/20429.htm
成都市武侯区金路科技电脑经营部,http:////www.11467.com/chengdu/co/20370.htm
成都市武侯区永捷电脑经营部,http:////www.11467.com/chengdu/co/20042.htm
成都市武侯区基楷电脑经营部,http:////www.11467.com/chengdu/co/20405.htm
成都市金牛区信诺办公耗材经营部,http:////www.11467.com/chengdu/co/13077.htm
武侯区联创耗材经营部,http:////www.11467.com/chengdu/co/20399.htm
成都市武侯区七喜华大电脑经营部,http:////www.11467.com/chengdu/co/20393.htm
青羊区凌飞电脑经营部,http:////www.11467.com/chengdu/co/6447.htm
成都市武侯区慧恒达电脑经营部,http:////www.11467.com/chengdu/co/20377.htm
赤峰市红山区东方红电脑经营部,http:////www.11467.com/chifeng/co/4119.htm
赤峰正天电脑经营部,http:////www.11467.com/chifeng/co/4097.htm
赤峰大地电脑经营部,http:////www.11467.com/chifeng/co/4117.htm
赤峰电力关联总公司清河电脑经营部,http:////www.11467.com/chifeng/co/4124.htm
楚雄诚信电脑经营部,http:////www.11467.com/chuxiong/co/628.htm
大理市富尔电脑耗材经营部,http:////www.11467.com/dali/co/7237.htm
大理铭锐电脑经营部,http:////www.11467.com/dali/co/7243.htm
丹东市元宝区杰科电脑经营部,http:////www.11467.com/dandong/co/2460.htm
丹东市振兴区正圆电脑服务部,http:////www.11467.com/dandong/co/10446.htm
丹东市元宝区超越电脑经营部,http:////www.11467.com/dandong/co/2462.htm
大庆市萨尔图区佳序电脑商行,http:////www.11467.com/daqing/co/4921.htm
大庆市萨尔图区星原电脑商行,http:////www.11467.com/daqing/co/4916.htm
大同市青少年社会服务中心智星电脑服务部,http:////www.11467.com/datong/co/2574.htm
呼玛县志诚电脑服务部,http:////www.11467.com/daxinganling/co/2022.htm
达州市华联电脑经营部,http:////www.11467.com/dazhou/co/1614.htm
达州市双诚电脑商行,http:////www.11467.com/dazhou/co/1579.htm
芒市科贸电脑经营部,http:////www.11467.com/dehong/co/280.htm
瑞丽市联众电脑经营部,http:////www.11467.com/dehong/co/829.htm
德阳劲源电脑经营部,http:////www.11467.com/deyang/co/2019.htm
广汉市星期九电脑耗材经营部,http:////www.11467.com/deyang/co/13105.htm
德阳市区信达电脑经营部,http:////www.11467.com/deyang/co/1916.htm
德阳市区资讯电脑服务部,http:////www.11467.com/deyang/co/1917.htm
德阳市区星思维电脑经营部,http:////www.11467.com/deyang/co/1901.htm
东莞市长安金创电脑软件经营部,http:////www.11467.com/dongguan/co/34376.htm
东莞市长安海欧电脑耗材经营部,http:////www.11467.com/dongguan/co/34394.htm
东莞市东城大同电脑经营部,http:////www.11467.com/dongguan/co/34309.htm
东莞市骏亿贸易有限公司,http:////www.11467.com/dongguan/co/33741.htm
东莞市东城金财软件经营部,http:////www.11467.com/dongguan/co/34315.htm
东莞市长安天昊电脑经营部,http:////www.11467.com/dongguan/co/34370.htm
东莞市清溪金音电脑经营部,http:////www.11467.com/dongguan/co/33871.htm
东莞市清溪同利电脑服务部,http:////www.11467.com/dongguan/co/34491.htm
东莞市东城比马电脑经营部,http:////www.11467.com/dongguan/co/34393.htm
东莞市虎门鸿迅电脑经营部,http:////www.11467.com/dongguan/co/33993.htm
东莞市常平昌诚电脑经营部,http:////www.11467.com/dongguan/co/34331.htm
东莞市石碣安捷利电脑经营部,http:////www.11467.com/dongguan/co/33713.htm
东莞市石碣东华电脑耗材店,http:////www.11467.com/dongguan/co/34058.htm
东莞市石碣方舟电脑经营部,http:////www.11467.com/dongguan/co/34068.htm
东莞市石碣恒星电脑经营部,http:////www.11467.com/dongguan/co/34028.htm
东莞市莞城永利电脑配件经营部,http:////www.11467.com/dongguan/co/34063.htm
东莞市莞城纵谊横电脑经营部,http:////www.11467.com/dongguan/co/33800.htm
东莞市南城中成电脑经营部,http:////www.11467.com/dongguan/co/33682.htm
东莞市南城恒信电脑经营部,http:////www.11467.com/dongguan/co/34074.htm
东莞市塘厦信力电脑软件经营部,http:////www.11467.com/dongguan/co/33719.htm
东莞市黄江华盛电脑经营部,http:////www.11467.com/dongguan/co/34503.htm
东莞市中派电子科技开发有限公司虎门电脑销售部,http:////www.11467.com/dongguan/co/34308.htm
东莞市虎门盈科电脑经营部,http:////www.11467.com/dongguan/co/34409.htm
东莞市樟木头鸿志电脑经营部,http:////www.11467.com/dongguan/co/33791.htm
东莞市石碣名网互联电脑网络软件服务部,http:////www.11467.com/dongguan/co/34073.htm
东莞市莞城安信德电脑商行,http:////www.11467.com/dongguan/co/33787.htm
东莞市莞城瑞佛电脑经营部,http:////www.11467.com/dongguan/co/34026.htm
东莞市莞城金迪电脑耗材经营部,http:////www.11467.com/dongguan/co/34414.htm
东莞市石碣赛博电脑经营部,http:////www.11467.com/dongguan/co/33700.htm
东莞市莞城汇通电脑配件经营部,http:////www.11467.com/dongguan/co/34499.htm
东莞市莞城合成电脑经营部,http:////www.11467.com/dongguan/co/34335.htm
东莞市莞城昱通电脑经营部,http:////www.11467.com/dongguan/co/34000.htm
东莞市莞城鹏扬电脑配件经营部,http:////www.11467.com/dongguan/co/33796.htm
东莞市莞城维康科技电脑经营部,http:////www.11467.com/dongguan/co/34330.htm
东莞市莞城青松电脑经营部,http:////www.11467.com/dongguan/co/34492.htm
广东丰德科技有限公司东莞分公司,http:////www.11467.com/dongguan/co/33734.htm
东莞市企石科海电脑耗材店,http:////www.11467.com/dongguan/co/34339.htm
东莞市莞城嘉瑞电脑经营部,http:////www.11467.com/dongguan/co/34085.htm
东莞市莞城龙源电脑经营部,http:////www.11467.com/dongguan/co/34082.htm
东莞市莞城伟仕达电脑销售服务部,http:////www.11467.com/dongguan/co/34367.htm
东莞市莞城协腾电脑经营部,http:////www.11467.com/dongguan/co/34368.htm
达拉特旗星河电脑销售有限公司,http:////www.11467.com/eerduosi/co/2761.htm
杭锦旗奋成电脑商行,http:////www.11467.com/eerduosi/co/6062.htm
恩施自治州康强科技发展有限公司电脑经营部,http:////www.11467.com/enshi/co/295.htm
佛山市城区达先电脑服务部,http:////www.11467.com/foshan/co/590.htm
佛山市城区锐讯电脑商行,http:////www.11467.com/foshan/co/589.htm
佛山市禅城区富粤电脑经营部,http:////www.11467.com/foshan/co/609.htm
佛山市禅城区华之盛电脑服务部,http:////www.11467.com/foshan/co/987.htm
佛山市凯德迅贸易有限公司,http:////www.11467.com/foshan/co/641.htm
佛山市南海区松岗信博电脑服务部,http:////www.11467.com/foshan/co/20922.htm
佛山市禅城区创博电脑经营部,http:////www.11467.com/foshan/co/618.htm
佛山市禅城区盈想电脑经营部,http:////www.11467.com/foshan/co/630.htm
佛山市禅城区玉全电子电脑经营部,http:////www.11467.com/foshan/co/9589.htm
佛山市城区业成电子电脑经营部,http:////www.11467.com/foshan/co/583.htm
佛山市时代电脑服务部,http:////www.11467.com/foshan/co/528.htm
佛山市顺德区大良鼎星电脑经营部,http:////www.11467.com/foshan/co/626.htm
佛山市禅城区创辉煌电脑经营部,http:////www.11467.com/foshan/co/608.htm
佛山市禅城区芳联电脑经营部,http:////www.11467.com/foshan/co/628.htm
佛山市南海区罗村蓝梦电脑经营部,http:////www.11467.com/foshan/co/36564.htm
佛山市新阳光电脑经营部,http:////www.11467.com/foshan/co/599.htm
佛山市城区怡通电脑经营部,http:////www.11467.com/foshan/co/642.htm
佛山市腾飞电脑经营部,http:////www.11467.com/foshan/co/603.htm
佛山市城区毅创电脑经营部,http:////www.11467.com/foshan/co/533.htm
佛山市石湾区文化经济发展公司超跃电脑服务部,http:////www.11467.com/foshan/co/584.htm
佛山市石湾区文化经济发展公司龙腾电脑服务部,http:////www.11467.com/foshan/co/570.htm
佛山市明龙电脑经营部,http:////www.11467.com/foshan/co/551.htm
佛山市顺德区大良弘图电脑经营部,http:////www.11467.com/foshan/co/617.htm
佛山市顺德区容桂技邦电脑经营部,http:////www.11467.com/foshan/co/666.htm
南海桂城振威电脑商行,http:////www.11467.com/foshan/co/20920.htm
佛山市胜源电脑经营部,http:////www.11467.com/foshan/co/530.htm
南海市桂城城区友讯电脑经营部,http:////www.11467.com/foshan/co/20934.htm
南海市桂城鼎业电脑经营部,http:////www.11467.com/foshan/co/36935.htm
顺德市大良区安腾电脑经营部,http:////www.11467.com/foshan/co/57694.htm
顺德市大良区先达腾飞电脑经营部,http:////www.11467.com/foshan/co/57606.htm
抚顺市大众商城金信电脑经营部,http:////www.11467.com/fushun/co/5471.htm
抚顺市新抚佳和电脑商行,http:////www.11467.com/fushun/co/5518.htm
抚顺市新抚科诚电脑耗材经销部,http:////www.11467.com/fushun/co/5516.htm
抚顺市新抚福斯特电脑耗材经销部,http:////www.11467.com/fushun/co/5517.htm
阜新市海州区乐凯电脑商行,http:////www.11467.com/fuxin/co/2731.htm
阜新市海州区微星电脑经营部,http:////www.11467.com/fuxin/co/2762.htm
阜阳市颍州区办公用品耗材经营部,http:////www.11467.com/fuyang/co/1943.htm
福州市开发区创佳电脑服务部,http:////www.11467.com/fuzhou/co/31941.htm
金创科技电脑经营部,http:////www.11467.com/ganzi/co/460.htm
广安经济技术开发区金蝶软件服务部,http:////www.11467.com/guangan/co/8558.htm
广元市城区联众电脑经营部,http:////www.11467.com/guangyuan/co/236.htm
广元市城区浩远电脑门市部,http:////www.11467.com/guangyuan/co/243.htm
广元市城区晶纬科技电脑经营部,http:////www.11467.com/guangyuan/co/253.htm
广元市城区九天科技电脑经营部,http:////www.11467.com/guangyuan/co/232.htm
广元市城区新奔腾电脑经营部,http:////www.11467.com/guangyuan/co/247.htm
北京直信创邺数码科技有限公司广州分公司,http:////www.11467.com/guangzhou/co/2703.htm
广东财利隆电子发展有限公司,http:////www.11467.com/guangzhou/co/43337.htm
广东省信息工程有限公司营业部,http:////www.11467.com/guangzhou/co/2717.htm
广东福山电脑经营部,http:////www.11467.com/guangzhou/co/31491.htm
广东富士电脑商行,http:////www.11467.com/guangzhou/co/31411.htm
福建实达电脑设备有限公司广州客户服务部,http:////www.11467.com/guangzhou/co/2715.htm
北京金捷诺科技有限公司广州分公司,http:////www.11467.com/guangzhou/co/31498.htm
广州市柏沣数码科技有限公司,http:////www.11467.com/guangzhou/co/62282.htm
广东派尔贸易有限公司,http:////www.11467.com/guangzhou/co/43344.htm
北京新潮讯捷信息技术有限公司广州分公司,http:////www.11467.com/guangzhou/co/31430.htm
广州市东向商业机器有限公司,http:////www.11467.com/guangzhou/co/11390.htm
广东远光软件股份有限公司广州分公司,http:////www.11467.com/guangzhou/co/31261.htm
广州市白云区亿顺经营部,http:////www.11467.com/guangzhou/co/43341.htm
广州市临豪风贸易有限公司,http:////www.11467.com/guangzhou/co/31468.htm
北京方正世纪信息系统有限公司广州分公司,http:////www.11467.com/guangzhou/co/31074.htm
北京康泰世通科技发展有限公司广州分公司,http:////www.11467.com/guangzhou/co/2709.htm
广州市番禺区市桥沙头德添电子商行,http:////www.11467.com/guangzhou/co/54903.htm
广州市铿达通讯器材有限公司,http:////www.11467.com/guangzhou/co/59787.htm
广州市正道润同科技有限公司天河电脑城专卖店,http:////www.11467.com/guangzhou/co/31262.htm
广州市天河天明电脑专卖店,http:////www.11467.com/guangzhou/co/31258.htm
广州天河骏驰电脑经营部,http:////www.11467.com/guangzhou/co/31237.htm
广州市安禺贸易有限公司,http:////www.11467.com/guangzhou/co/54883.htm
广州市天河金虎电脑商行,http:////www.11467.com/guangzhou/co/30656.htm
广州市天河佳德隆办公设备商行,http:////www.11467.com/guangzhou/co/31480.htm
广州市天河超翔电脑经营部,http:////www.11467.com/guangzhou/co/31381.htm
广州市天河隆宇电子商行,http:////www.11467.com/guangzhou/co/31503.htm
广州市正道润同科技有限公司颐高专卖店,http:////www.11467.com/guangzhou/co/31507.htm
广州市智硕网络科技有限公司,http:////www.11467.com/guangzhou/co/31056.htm
广州市天河晨博电脑经营部,http:////www.11467.com/guangzhou/co/31420.htm
广州市天河力生经营部,http:////www.11467.com/guangzhou/co/31326.htm
广州市天河康恩博电脑经营部,http:////www.11467.com/guangzhou/co/31254.htm
广州市天河区科技思成电脑经营部,http:////www.11467.com/guangzhou/co/31213.htm
南京远志资讯科技开发有限公司广州分公司,http:////www.11467.com/guangzhou/co/30649.htm
广西平南县平泰电子电脑商行,http:////www.11467.com/guigang/co/3556.htm
