中山市东区新阳电脑商行,http:////www.11467.com/zhongshan/co/17196.htm
中山市三角镇龙科电脑经营部,http:////www.11467.com/zhongshan/co/17487.htm
中山市东区中江电脑商行,http:////www.11467.com/zhongshan/co/17073.htm
中山市西区高歌电脑商行,http:////www.11467.com/zhongshan/co/17245.htm
中山市石岐区浪之潮软件商行,http:////www.11467.com/zhongshan/co/17479.htm
中山市西区卡域科技电脑经营部,http:////www.11467.com/zhongshan/co/17250.htm
中山市北区讯联电脑商行,http:////www.11467.com/zhongshan/co/17141.htm
中山市石岐盈家电脑商行,http:////www.11467.com/zhongshan/co/17146.htm
中山市西区新港电脑商行,http:////www.11467.com/zhongshan/co/17283.htm
中山市西区智慧电脑商行,http:////www.11467.com/zhongshan/co/17090.htm
中山市中区东华电脑商行,http:////www.11467.com/zhongshan/co/17447.htm
中山市石岐跨世纪电脑经营部,http:////www.11467.com/zhongshan/co/17121.htm
中山市东升镇兴隆电脑商行,http:////www.11467.com/zhongshan/co/17252.htm
中山市东区华辉电脑商行,http:////www.11467.com/zhongshan/co/17265.htm
中山市西区利通电脑经营部,http:////www.11467.com/zhongshan/co/17136.htm
中山市联艺网络技术开发有限公司,http:////www.11467.com/zhongshan/co/17094.htm
中山市中区东方电脑经营部,http:////www.11467.com/zhongshan/co/17286.htm
中山市石岐区盈科电脑经营部,http:////www.11467.com/zhongshan/co/17476.htm
中山市小榄镇天朗电脑配件商行,http:////www.11467.com/zhongshan/co/17162.htm
中山市西区宏天电脑商行,http:////www.11467.com/zhongshan/co/17131.htm
中山市石岐天城网络电脑商行,http:////www.11467.com/zhongshan/co/17254.htm
中山市石岐区博格电脑商行,http:////www.11467.com/zhongshan/co/17498.htm
中山市腾通电子通信有限公司,http:////www.11467.com/zhongshan/co/17167.htm
中山市小榄镇三和电脑服务部,http:////www.11467.com/zhongshan/co/17172.htm
中山市宇天网络技术有限公司,http:////www.11467.com/zhongshan/co/17448.htm
中山市西区虹鑫电脑商行,http:////www.11467.com/zhongshan/co/17197.htm
周口地区石油总公司索达电脑服务部,http:////www.11467.com/zhoukou/co/1947.htm
珠海市香洲高杰电脑经营部,http:////www.11467.com/zhuhai/co/2057.htm
珠海市红旗新圆新电脑服务部,http:////www.11467.com/zhuhai/co/23614.htm
珠海市香洲狼豪电脑耗材经营部,http:////www.11467.com/zhuhai/co/1482.htm
珠海市香洲兰欣电脑经营部,http:////www.11467.com/zhuhai/co/2051.htm
珠海市斗门区东方盈彩办公耗材经销部,http:////www.11467.com/zhuhai/co/23612.htm
珠海市香洲新博通电脑经营部,http:////www.11467.com/zhuhai/co/2075.htm
珠海市香洲立方电脑经营部,http:////www.11467.com/zhuhai/co/1435.htm
珠海市拱北嘉兴电脑经营部,http:////www.11467.com/zhuhai/co/1478.htm
珠海市华基伟业电脑经营中心,http:////www.11467.com/zhuhai/co/2047.htm
珠海华盈贸易发展有限公司,http:////www.11467.com/zhuhai/co/2058.htm
珠海市香洲区金雕电脑经营部,http:////www.11467.com/zhuhai/co/1989.htm
驻马店高新区创联电脑经营部,http:////www.11467.com/zhumadian/co/10514.htm
株洲市芦淞区鸿基电脑经营部,http:////www.11467.com/zhuzhou/co/4696.htm
株洲市天元区新闻路达慧图文耗材经营部,http:////www.11467.com/zhuzhou/co/8450.htm
山东桓台凯旋电脑销售服务有限公司,http:////www.11467.com/zibo/co/33916.htm
山东铝业公司鲁中实业贸易公司物资供销公司颐丰电脑经营部,http:////www.11467.com/zibo/co/9380.htm
张店北极光软件经营部,http:////www.11467.com/zibo/co/9361.htm
张店科奥电脑商行,http:////www.11467.com/zibo/co/9357.htm
淄博齐赛科技市场永安电脑商行,http:////www.11467.com/zibo/co/8801.htm
自贡市汇东新区华威电脑经营部,http:////www.11467.com/zigong/co/2256.htm
自贡市汇东新区正兴软件经营部,http:////www.11467.com/zigong/co/2241.htm
自贡市汇东新区众谊电脑耗材经营部,http:////www.11467.com/zigong/co/2242.htm
自贡市汇东新区友联电脑经营部,http:////www.11467.com/zigong/co/2220.htm
自贡市东盛机电设备有限公司电脑经营部,http:////www.11467.com/zigong/co/2175.htm
自贡市自流井区兴欣耗材经营部,http:////www.11467.com/zigong/co/2262.htm
遵义恒天科技有限责任公司,http:////www.11467.com/zunyi/co/3765.htm
遵义市瑞麒科技开发有限责任公司,http:////www.11467.com/zunyi/co/61.htm
桐梓县智桥电脑城,http:////www.11467.com/zunyi/co/6641.htm
遵义联正科技有限责任公司,http:////www.11467.com/zunyi/co/3760.htm
遵义普力科技服务有限公司,http:////www.11467.com/zunyi/co/3767.htm
遵义市诚馨信息网络开发有限公司,http:////www.11467.com/zunyi/co/3823.htm
遵义连邦科技发展有限责任公司,http:////www.11467.com/zunyi/co/3753.htm
遵义市红花岗区网事如风网络信息服务部,http:////www.11467.com/zunyi/co/87.htm
遵义市红花岗区奔腾网络信息服务部,http:////www.11467.com/zunyi/co/64.htm
遵义市红花岗区纵横网络信息服务部,http:////www.11467.com/zunyi/co/42.htm
遵义市飞碟网络信息服务部,http:////www.11467.com/zunyi/co/3766.htm
遵义市红花岗区先锋网络信息服务部,http:////www.11467.com/zunyi/co/40.htm
遵义博成科贸有限公司,http:////www.11467.com/zunyi/co/3752.htm
遵义正强商贸有限责任公司,http:////www.11467.com/zunyi/co/3754.htm
遵义市科大办公设备有限责任公司,http:////www.11467.com/zunyi/co/3798.htm
北京安信杰科计算机销售中心,http:////www.11467.com/beijing/co/498932.htm
北京东方瑞达软件销售有限公司,http:////www.11467.com/beijing/co/372207.htm
北京百盟电脑销售中心,http:////www.11467.com/beijing/co/296510.htm
北京金山顶尖科贸有限公司计算机销售二部,http:////www.11467.com/beijing/co/372172.htm
北京恒正达计算机销售有限责任公司,http:////www.11467.com/beijing/co/372157.htm
北京华日天成计算机销售中心,http:////www.11467.com/beijing/co/559986.htm
北京华旗资讯科技发展有限公司计算机销售分公司,http:////www.11467.com/beijing/co/372163.htm
北京连邦软件股份有限公司软件销售第八分店,http:////www.11467.com/beijing/co/372166.htm
北京美杰克软件销售有限公司,http:////www.11467.com/beijing/co/372125.htm
北京康飞达计算机销售中心,http:////www.11467.com/beijing/co/372137.htm
北京惠华通达电脑经营部,http:////www.11467.com/beijing/co/372205.htm
北京市康培达电脑经营部,http:////www.11467.com/beijing/co/76799.htm
北京市拼安电脑销售部,http:////www.11467.com/beijing/co/195709.htm
北京龙腾飞计算机销售中心,http:////www.11467.com/beijing/co/680657.htm
北京市海淀区乐琪电脑服务部,http:////www.11467.com/beijing/co/372159.htm
北京通海利电脑服务部,http:////www.11467.com/beijing/co/9420.htm
北京金力青计算机销售中心,http:////www.11467.com/beijing/co/372210.htm
北京市巨前商贸公司电脑销售部,http:////www.11467.com/beijing/co/372214.htm
北京市凯丰振达电脑销售部,http:////www.11467.com/beijing/co/602125.htm
北京天弓力量软件销售中心,http:////www.11467.com/beijing/co/647436.htm
北京市宏宝昌兴电脑经营部,http:////www.11467.com/beijing/co/372127.htm
北京市真朋贸易公司计算机销售中心,http:////www.11467.com/beijing/co/372142.htm
北京市四方三阳电脑经营部,http:////www.11467.com/beijing/co/559994.htm
北京鑫起点计算机销售中心,http:////www.11467.com/beijing/co/296524.htm
北京翔阳腾飞电脑销售部,http:////www.11467.com/beijing/co/476389.htm
北京万全联众电脑销售中心,http:////www.11467.com/beijing/co/9302.htm
北京燕山天潮电脑销售中心,http:////www.11467.com/beijing/co/265177.htm
北京市智远创新计算机销售有限公司,http:////www.11467.com/beijing/co/76742.htm
北京燕山方舟计算机软件经营部,http:////www.11467.com/beijing/co/265176.htm
北京燕山中意电脑销售部,http:////www.11467.com/beijing/co/265179.htm
北京市昌平县金诺电脑销售服务部,http:////www.11467.com/beijing/co/9422.htm
北京市昌平县深蓝电脑经营部,http:////www.11467.com/beijing/co/9303.htm
北京仁和拓林电脑销售中心,http:////www.11467.com/beijing/co/576137.htm
北京天际行星软件销售有限责任公司,http:////www.11467.com/beijing/co/76752.htm
广州市上奇科技有限公司北京计算机销售分公司,http:////www.11467.com/beijing/co/372199.htm
翰林汇软件产业有限公司北京计算机销售分公司,http:////www.11467.com/beijing/co/372145.htm
北京市晓民电脑服务部,http:////www.11467.com/beijing/co/669472.htm
北京亚立信电脑销售中心,http:////www.11467.com/beijing/co/372191.htm
北京智翔健坤计算机销售部,http:////www.11467.com/beijing/co/476399.htm
上海飞翔电脑商行,http:////www.11467.com/shanghai/co/918614.htm
上海长拓空油压自动化工程有限公司,http:////www.11467.com/shanghai/co/461352.htm
上海地久信息电脑经营部,http:////www.11467.com/shanghai/co/232142.htm
上海富贵电脑经营部,http:////www.11467.com/shanghai/co/625598.htm
上海华楹计算机销售有限公司,http:////www.11467.com/shanghai/co/402733.htm
上海复兴电脑经营部,http:////www.11467.com/shanghai/co/232343.htm
上海超梦电脑销售部,http:////www.11467.com/shanghai/co/952958.htm
上海彬原信息科技有限公司分公司,http:////www.11467.com/shanghai/co/69286.htm
上海博精计算机销售有限公司分公司,http:////www.11467.com/shanghai/co/402717.htm
上海博精计算机销售有限公司,http:////www.11467.com/shanghai/co/402716.htm
上海鸣亚电脑商行美罗分行,http:////www.11467.com/shanghai/co/918704.htm
上海蓝络贸易有限公司,http:////www.11467.com/shanghai/co/918648.htm
上海开心岛计算机销售有限公司,http:////www.11467.com/shanghai/co/993249.htm
上海虹昱网络科技发展有限公司长宁分公司,http:////www.11467.com/shanghai/co/69103.htm
宁波波导销售有限公司上海分公司,http:////www.11467.com/shanghai/co/720275.htm
上海恒志信息技术有限公司宝山路经营部,http:////www.11467.com/shanghai/co/3078.htm
上海康劲计算机配件有限公司徐汇分公司,http:////www.11467.com/shanghai/co/918716.htm
上海嘉定春冈电脑服务部,http:////www.11467.com/shanghai/co/254873.htm
上海呈欣电脑销售有限公司,http:////www.11467.com/shanghai/co/125892.htm
上海浦东新区东上海电脑市场伴日电脑配件经营部,http:////www.11467.com/shanghai/co/625484.htm
上海南方富申实业有限公司电脑服务部,http:////www.11467.com/shanghai/co/232350.htm
上海沪友科技发展有限公司长宁分公司,http:////www.11467.com/shanghai/co/69102.htm
奉贤县南桥镇经纬电脑商行,http:////www.11467.com/shanghai/co/125905.htm
广东飞讯信息技术有限公司上海分公司,http:////www.11467.com/shanghai/co/69172.htm
上海耕源经贸发展有限公司分公司,http:////www.11467.com/shanghai/co/773774.htm
上海礼人电脑服务部,http:////www.11467.com/shanghai/co/254874.htm
上海上微电脑经营部,http:////www.11467.com/shanghai/co/69118.htm
上海林芹电脑服务部,http:////www.11467.com/shanghai/co/254882.htm
上海杰恩普超声设备有限公司长宁分公司,http:////www.11467.com/shanghai/co/69290.htm
上海捷尼通讯器材商行一分店,http:////www.11467.com/shanghai/co/471634.htm
上海普罗电脑销售有限公司,http:////www.11467.com/shanghai/co/720298.htm
上海虹口美好电脑服务部,http:////www.11467.com/shanghai/co/194553.htm
上海市闵行区虹桥镇兰兰电脑服务部,http:////www.11467.com/shanghai/co/471629.htm
上海水手计算机销售有限公司,http:////www.11467.com/shanghai/co/952976.htm
上海金磊电脑服务部,http:////www.11467.com/shanghai/co/952960.htm
上海网威电脑经营部,http:////www.11467.com/shanghai/co/993260.htm
上海盛荣电脑服务部,http:////www.11467.com/shanghai/co/720303.htm
上海陶齐电脑服务部,http:////www.11467.com/shanghai/co/471647.htm
上海石化运欣实业发展中心电脑经营部,http:////www.11467.com/shanghai/co/402745.htm
上海嘉定智远电脑服务部,http:////www.11467.com/shanghai/co/254872.htm
上海润昌电脑销售有限公司,http:////www.11467.com/shanghai/co/952968.htm
上海雪原电脑服务部,http:////www.11467.com/shanghai/co/471631.htm
上海布衣电脑销售有限公司,http:////www.11467.com/shanghai/co/837912.htm
上海市徐汇区维格计算机销售部,http:////www.11467.com/shanghai/co/918632.htm
上海市徐汇区蔚晨电器电脑经营部,http:////www.11467.com/shanghai/co/918651.htm
上海市徐汇区伟红电脑经营部,http:////www.11467.com/shanghai/co/918627.htm
上海讯正电脑设备有限公司,http:////www.11467.com/shanghai/co/952949.htm
上海玺辰网拓网络系统有限公司长宁分公司,http:////www.11467.com/shanghai/co/69296.htm
上海仙联电脑销售有限公司第一分公司,http:////www.11467.com/shanghai/co/720232.htm
上海昕佳电脑销售有限公司,http:////www.11467.com/shanghai/co/125901.htm
上海欣矢机电设备有限公司,http:////www.11467.com/shanghai/co/838085.htm
上海新晨教育软件服务部,http:////www.11467.com/shanghai/co/993236.htm
上海申俊电脑销售有限公司,http:////www.11467.com/shanghai/co/125888.htm
上海申柳电子器材有限公司,http:////www.11467.com/shanghai/co/232324.htm
上海市崇明县东华电脑经营部,http:////www.11467.com/shanghai/co/101308.htm
浦东新区歇浦街道沪东电脑配件经营部,http:////www.11467.com/shanghai/co/625494.htm
上海奕青电脑销售有限公司,http:////www.11467.com/shanghai/co/125904.htm
普陀区大中电脑经营部,http:////www.11467.com/shanghai/co/720314.htm
普陀区岗岗电脑配件经营部,http:////www.11467.com/shanghai/co/720308.htm
上海奕晨办公设备服务部,http:////www.11467.com/shanghai/co/3053.htm
普陀区申光电脑配件经营部,http:////www.11467.com/shanghai/co/720307.htm
普陀区就业电脑服务部,http:////www.11467.com/shanghai/co/720309.htm
上海怡高科技服务有限公司长宁分公司,http:////www.11467.com/shanghai/co/69094.htm
上海祥胜工贸有限公司电脑经营部,http:////www.11467.com/shanghai/co/69099.htm
上海兴易电脑销售有限公司,http:////www.11467.com/shanghai/co/952967.htm
上海行者办公设备有限公司,http:////www.11467.com/shanghai/co/125908.htm
北京东方正龙数字技术有限公司上海分公司,http:////www.11467.com/shanghai/co/918723.htm
上海市徐汇区联横计算机经营部,http:////www.11467.com/shanghai/co/918650.htm
上海市松江区松江镇豪特电脑经营部,http:////www.11467.com/shanghai/co/837911.htm
上海新翔电脑商行,http:////www.11467.com/shanghai/co/918676.htm
上海市松江区仓桥镇仓城电脑服务部,http:////www.11467.com/shanghai/co/837995.htm
上海新世纪教育软件服务部,http:////www.11467.com/shanghai/co/69124.htm
上海市松江区恒科电脑经营部,http:////www.11467.com/shanghai/co/837984.htm
上海新星电脑经营部,http:////www.11467.com/shanghai/co/194548.htm
上海新秀电脑销售有限公司,http:////www.11467.com/shanghai/co/720296.htm
上海易达通信公司浦东分部,http:////www.11467.com/shanghai/co/625487.htm
上海悦耳助听器经营部,http:////www.11467.com/shanghai/co/3069.htm
上海溶汇数码科技有限公司唐山路分公司,http:////www.11467.com/shanghai/co/194522.htm
上海泽天电脑销售有限公司,http:////www.11467.com/shanghai/co/773703.htm
上海骏豪电脑服务部,http:////www.11467.com/shanghai/co/625627.htm
普陀区欣伟电脑服务部,http:////www.11467.com/shanghai/co/720266.htm
青浦赵巷惠众电脑商行,http:////www.11467.com/shanghai/co/773741.htm
艺龙网信息技术（北京）有限公司上海分公司,http:////www.11467.com/shanghai/co/232160.htm
上海质标商贸有限公司,http:////www.11467.com/shanghai/co/125884.htm
上海屯金电脑经营部,http:////www.11467.com/shanghai/co/461353.htm
上海易达通信公司长寿路分公司,http:////www.11467.com/shanghai/co/993284.htm
上海屹高实业有限公司电脑经营部,http:////www.11467.com/shanghai/co/69197.htm
上海易达通信公司普陀分部,http:////www.11467.com/shanghai/co/720231.htm
上海易达通信公司莘庄分部,http:////www.11467.com/shanghai/co/471633.htm
上海好格电脑软件销售有限公司,http:////www.11467.com/shanghai/co/773710.htm
上海市杨浦区良业电脑服务部,http:////www.11467.com/shanghai/co/952867.htm
上海市杨浦区英科电脑服务部,http:////www.11467.com/shanghai/co/952963.htm
上海市闸北区三师电脑服务部,http:////www.11467.com/shanghai/co/993248.htm
上海是友电脑销售有限公司,http:////www.11467.com/shanghai/co/402693.htm
宁河县卢勇电脑服务部,http:////www.11467.com/tianjin/co/152148.htm
天津市大港区凯强电脑经营部,http:////www.11467.com/tianjin/co/25164.htm
天津市河西区永晨电脑销售服务中心,http:////www.11467.com/tianjin/co/81137.htm
天津市东丽区庆杰电脑服务部,http:////www.11467.com/tianjin/co/34081.htm
天津市西青区星源电脑商行,http:////www.11467.com/tianjin/co/182794.htm
天津市河北区翼尖电脑服务部,http:////www.11467.com/tianjin/co/47526.htm
天津市大港区昊天电脑商行,http:////www.11467.com/tianjin/co/21816.htm
天津市创和电脑销售服务中心,http:////www.11467.com/tianjin/co/157665.htm
天津市蓟县新鹏飞电脑服务部,http:////www.11467.com/tianjin/co/121223.htm
天津市津南区瑞邦电脑耗材经营部,http:////www.11467.com/tianjin/co/112134.htm
天津市南开区元和电脑经营部,http:////www.11467.com/tianjin/co/129128.htm
天津市河西区智君计算机销售中心,http:////www.11467.com/tianjin/co/81170.htm
天津市大港区致尚电脑经营部,http:////www.11467.com/tianjin/co/21811.htm
天津市塘沽区天华科技电脑耗材经营部,http:////www.11467.com/tianjin/co/157741.htm
天津市静海县隆基电脑经营部,http:////www.11467.com/tianjin/co/104657.htm
北碚和平电脑服务部,http:////www.11467.com/chongqing/co/9866.htm
巫山县巫峡镇永久电脑服务部,http:////www.11467.com/chongqing/co/152792.htm
潼南县冲击波电脑经营部,http:////www.11467.com/chongqing/co/134796.htm
重庆市高新技术产业开发区三彩电脑经营部,http:////www.11467.com/chongqing/co/70670.htm
重庆市高新技术产业开发区逆扬电脑经营部,http:////www.11467.com/chongqing/co/70683.htm
重庆市高新技术产业开发区雄飞电脑经营部,http:////www.11467.com/chongqing/co/70783.htm
重庆市高新技术产业开发区皓天电脑经营部,http:////www.11467.com/chongqing/co/70652.htm
重庆市高新技术产业开发区联讯嘉电脑商行,http:////www.11467.com/chongqing/co/70747.htm
重庆市沙坪坝区腾旭电脑经营部,http:////www.11467.com/chongqing/co/119818.htm
马尔康青春电脑服务部,http:////www.11467.com/aba/co/1894.htm
圣达电脑销售维修中心,http:////www.11467.com/aba/co/1919.htm
阿坝州鼎新电脑商行,http:////www.11467.com/aba/co/1921.htm
阿坝州农行职工技术协会服务公司电脑服务部,http:////www.11467.com/aba/co/1920.htm
汶川印业股份合作公司常想电脑经营站,http:////www.11467.com/aba/co/243.htm
拜城县常青电脑服务部,http:////www.11467.com/akesu/co/4815.htm
阿克苏地区金峰实业总公司人民商厦电脑经营部,http:////www.11467.com/akesu/co/332.htm
阿拉善盟深蓝电脑服务部,http:////www.11467.com/alashan/co/1494.htm
阿拉善左旗世维电脑服务部,http:////www.11467.com/alashan/co/632.htm
阿拉善左旗世维电脑服务部网吧,http:////www.11467.com/alashan/co/633.htm
重庆市高新技术产业开发区美格电脑经营部,http:////www.11467.com/chongqing/co/70590.htm
重庆市高新区讯都电脑经营部,http:////www.11467.com/chongqing/co/70741.htm
忠州镇畅想电脑服务部,http:////www.11467.com/chongqing/co/199494.htm
重庆市高新区中源电脑经营部,http:////www.11467.com/chongqing/co/70716.htm
重庆市高新技术产业开发区科屹电脑经营部,http:////www.11467.com/chongqing/co/70606.htm
重庆市高新技术产业开发区乾成电脑经营部,http:////www.11467.com/chongqing/co/71657.htm
重庆市高新技术产业开发区福海电脑经营部,http:////www.11467.com/chongqing/co/71610.htm
重庆市高新技术产业开发区新蓝电脑服务部,http:////www.11467.com/chongqing/co/70642.htm
重庆市高新技术产业开发区阳光大道电脑经营部,http:////www.11467.com/chongqing/co/70756.htm
重庆竞达电脑经营部,http:////www.11467.com/chongqing/co/2855.htm
重庆海州电脑耗材经营中心,http:////www.11467.com/chongqing/co/70699.htm
重庆市高新技术产业开发区安渝电脑经营部,http:////www.11467.com/chongqing/co/70882.htm
重庆市高新技术产业开发区金士登电脑经营部,http:////www.11467.com/chongqing/co/71613.htm
重庆市高新技术产业开发区赛众电脑经营部,http:////www.11467.com/chongqing/co/70656.htm
重庆市高新技术产业开发区怡泰电脑经营部,http:////www.11467.com/chongqing/co/70622.htm
重庆市高新技术产业开发区启智电脑经营部,http:////www.11467.com/chongqing/co/70775.htm
重庆市高新区龙海电脑经营部,http:////www.11467.com/chongqing/co/70677.htm
重庆市九龙坡区星宇电脑经营部,http:////www.11467.com/chongqing/co/70715.htm
重庆高新区隆鑫达电脑经营部,http:////www.11467.com/chongqing/co/70730.htm
重庆市大渡口区创越鑫电脑配件经营部,http:////www.11467.com/chongqing/co/21410.htm
重庆高新区同德电脑经营部,http:////www.11467.com/chongqing/co/70792.htm
重庆市渝中区秉信云坊电脑经营部,http:////www.11467.com/chongqing/co/184123.htm
重庆市渝中区创腾电脑商行,http:////www.11467.com/chongqing/co/184107.htm
重庆市渝中区凌海电脑经营部,http:////www.11467.com/chongqing/co/183759.htm
重庆市渝中区园通电脑经营部,http:////www.11467.com/chongqing/co/184139.htm
重庆市南岸区思亚电脑经营部,http:////www.11467.com/chongqing/co/95371.htm
重庆市高新技术产业开发区鸿锦电脑经营部,http:////www.11467.com/chongqing/co/70803.htm
重庆市高新技术产业开发区欧亚电脑商行,http:////www.11467.com/chongqing/co/70653.htm
重庆市高新技术产业开发区环宇电脑经营部,http:////www.11467.com/chongqing/co/70600.htm
忠县忠州镇金鹏电脑服务部,http:////www.11467.com/chongqing/co/199493.htm
重庆勤天科技有限公司计算机销售分公司,http:////www.11467.com/chongqing/co/119545.htm
重庆市万州区天城创杰电脑商行,http:////www.11467.com/chongqing/co/139132.htm
重庆市沙坪坝区铭响电脑经营部,http:////www.11467.com/chongqing/co/119543.htm
重庆市江北区观音桥逸兴电脑经营部,http:////www.11467.com/chongqing/co/47128.htm
重庆市渝中区联发电脑经营部,http:////www.11467.com/chongqing/co/182968.htm
上海南汇博导电脑服务部,http:////www.11467.com/shnanhui/co/16195.htm
上海宏鸣电脑服务部,http:////www.11467.com/shnanhui/co/16216.htm
上海玛萨电脑商行,http:////www.11467.com/shnanhui/co/16235.htm
上海东彭电脑商行,http:////www.11467.com/shnanhui/co/16166.htm
中山云杉软件有限公司,http:////www.11467.com/qiye/93081745.htm
阿勒泰市三联电脑服务部,http:////www.11467.com/aletai/co/3376.htm
安康市天启电脑服务部,http:////www.11467.com/ankang/co/7569.htm
安庆市振华电脑服务部,http:////www.11467.com/anqing/co/2444.htm
安庆市远东贸易公司虹普电脑软件经营部,http:////www.11467.com/anqing/co/10636.htm
安庆市华迅电脑经营部,http:////www.11467.com/anqing/co/2454.htm
桐城市新华书店电脑商行,http:////www.11467.com/anqing/co/15039.htm
安庆市恒威耗材经营部,http:////www.11467.com/anqing/co/10637.htm
安庆市实达电脑服务部,http:////www.11467.com/anqing/co/3705.htm
鞍山市铁东区通达电脑商行,http:////www.11467.com/anshan/co/7412.htm
鞍山市铁东思辉电脑服务部,http:////www.11467.com/anshan/co/7767.htm
鞍山四隆广场新世纪电脑商行,http:////www.11467.com/anshan/co/7742.htm
鞍山市中新电脑经营部,http:////www.11467.com/anshan/co/7338.htm
鞍山市铁东博达电脑商行,http:////www.11467.com/anshan/co/7733.htm
鞍山市铁东发联电脑商行,http:////www.11467.com/anshan/co/7397.htm
鞍山市铁东永安电脑商行,http:////www.11467.com/anshan/co/7693.htm
鞍山市铁东区新金创想电脑商行,http:////www.11467.com/anshan/co/7373.htm
鞍钢附企技术中心综合开发公司电脑经营部,http:////www.11467.com/anshan/co/7717.htm
海城市海州区海影电脑销售中心,http:////www.11467.com/anshan/co/32211.htm
鞍山市铁东一方电脑商行,http:////www.11467.com/anshan/co/7375.htm
鞍山市铁东亿通电脑商行,http:////www.11467.com/anshan/co/7407.htm
鞍山市铁东智达电脑商行,http:////www.11467.com/anshan/co/7682.htm
鞍山市铁东博技电脑商行,http:////www.11467.com/anshan/co/7381.htm
鞍山市铁东区志诚电脑商行,http:////www.11467.com/anshan/co/7414.htm
鞍山市铁东金方舟电脑经营部,http:////www.11467.com/anshan/co/7372.htm
鞍山市铁东明日电脑商行,http:////www.11467.com/anshan/co/7365.htm
鞍山市铁东区山南复印电脑服务部,http:////www.11467.com/anshan/co/7369.htm
