无锡市千禧电脑经营部,http:////www.11467.com/wuxi/co/19852.htm
无锡市南长区方齐电脑经营部,http:////www.11467.com/wuxi/co/15405.htm
宜兴市宜城同创电脑销售部,http:////www.11467.com/wuxi/co/86988.htm
宜兴市信谊电脑商行,http:////www.11467.com/wuxi/co/86858.htm
无锡市南长区虬腾电脑经营部,http:////www.11467.com/wuxi/co/15480.htm
无锡市银峰电脑商行,http:////www.11467.com/wuxi/co/19840.htm
宜兴市宜城镇宏天电脑经营部,http:////www.11467.com/wuxi/co/86878.htm
无锡市南长区迪斯科电脑经营部,http:////www.11467.com/wuxi/co/15460.htm
无锡市南长区和事通电脑经营部,http:////www.11467.com/wuxi/co/15764.htm
无锡市南长区宏达电脑经营部,http:////www.11467.com/wuxi/co/15760.htm
无锡市南长区华圆电脑经营部,http:////www.11467.com/wuxi/co/15471.htm
无锡市云天电脑经营部,http:////www.11467.com/wuxi/co/19837.htm
无锡市南长区维信电脑经营部,http:////www.11467.com/wuxi/co/15453.htm
无锡市源诚电脑经营服务部,http:////www.11467.com/wuxi/co/15423.htm
无锡市郊区南站海源电脑配件经营部,http:////www.11467.com/wuxi/co/53265.htm
无锡市南长区兴四方软件专卖店,http:////www.11467.com/wuxi/co/15683.htm
无锡市奇天电脑商行,http:////www.11467.com/wuxi/co/15766.htm
无锡市南长区红日电脑经营部,http:////www.11467.com/wuxi/co/2697.htm
网乐电脑经营部,http:////www.11467.com/wuzhou/co/5620.htm
梧州市科创电脑服务部,http:////www.11467.com/wuzhou/co/3590.htm
梧州市科讯电脑经营部,http:////www.11467.com/wuzhou/co/3507.htm
梧州市龙腾电脑配件经营部,http:////www.11467.com/wuzhou/co/3600.htm
苍梧县新思维电脑经营部,http:////www.11467.com/wuzhou/co/5619.htm
梧州市金飞电脑服务部,http:////www.11467.com/wuzhou/co/3612.htm
梧州市科信电脑服务部,http:////www.11467.com/wuzhou/co/8850.htm
梧州市超锋电脑服务部,http:////www.11467.com/wuzhou/co/3587.htm
广西梧州永安计算机软件开发有限公司电脑经营部,http:////www.11467.com/wuzhou/co/3601.htm
梧州市众志电脑服务部,http:////www.11467.com/wuzhou/co/8865.htm
梧州市信毅电脑经营部,http:////www.11467.com/wuzhou/co/3605.htm
梧州市宏基电脑经营部,http:////www.11467.com/wuzhou/co/3611.htm
梧州市新优电脑经营部,http:////www.11467.com/wuzhou/co/3613.htm
岑溪市晨网电脑经营部,http:////www.11467.com/wuzhou/co/8545.htm
梧州市恒得利电脑经营部,http:////www.11467.com/wuzhou/co/3602.htm
梧州市新域电脑经营部,http:////www.11467.com/wuzhou/co/3592.htm
梧州市鹰飞灿电脑经营部,http:////www.11467.com/wuzhou/co/3603.htm
梧州市永道电脑经营部,http:////www.11467.com/wuzhou/co/3596.htm
湘潭市雨湖区力高达电脑耗材经营部,http:////www.11467.com/xiangtan/co/2755.htm
咸阳明博电脑销售服务有限公司,http:////www.11467.com/xianyang/co/10881.htm
锡林郭勒盟联达电脑销售有限责任公司,http:////www.11467.com/xilinguole/co/71.htm
西宁杰创计算机销售有限公司,http:////www.11467.com/xining/co/6345.htm
邢台市金属回收总公司金苑电脑经营服务部,http:////www.11467.com/xintai/co/4566.htm
沙河市蓝精灵电脑服务部,http:////www.11467.com/xintai/co/23293.htm
邢台市新华书店电脑经营部,http:////www.11467.com/xintai/co/4565.htm
平乡县新发电脑销售有限公司,http:////www.11467.com/xintai/co/17251.htm
邢台市好朋友电脑服务部,http:////www.11467.com/xintai/co/4562.htm
邢台市桥西区科通电脑经营服务部,http:////www.11467.com/xintai/co/4608.htm
邢台巨人电脑销售中心,http:////www.11467.com/xintai/co/4559.htm
邢台市桥西海华电脑经营部,http:////www.11467.com/xintai/co/4564.htm
邢台市鸿阳电脑经营部,http:////www.11467.com/xintai/co/10132.htm
信阳市浉河区欣诚电脑服务部,http:////www.11467.com/xinyang/co/4816.htm
信阳市农业机械总公司伟程电脑销售中心,http:////www.11467.com/xinyang/co/3389.htm
忻州市万达电脑经营部,http:////www.11467.com/xinzhou/co/46.htm
鄢陵县联想电脑服务部,http:////www.11467.com/xuchang/co/4174.htm
丰县银兴电脑销售服务中心,http:////www.11467.com/xuzhou/co/16407.htm
徐州市海燕电脑经营部,http:////www.11467.com/xuzhou/co/7089.htm
徐州市矿务局通信电脑服务部,http:////www.11467.com/xuzhou/co/805.htm
徐州市艺隆电脑服务部,http:////www.11467.com/xuzhou/co/3930.htm
徐州新视野电脑销售有限公司,http:////www.11467.com/xuzhou/co/16387.htm
徐州市大众电脑经营部,http:////www.11467.com/xuzhou/co/7078.htm
徐州市鑫业大电脑经营部,http:////www.11467.com/xuzhou/co/7334.htm
徐州市云龙区永基办公设备耗材经营部,http:////www.11467.com/xuzhou/co/7145.htm
新沂市城南怡维电脑服务部,http:////www.11467.com/xuzhou/co/24489.htm
徐州市云龙区呈祥电脑经营部,http:////www.11467.com/xuzhou/co/7091.htm
徐州市飞翔大世界电脑服务部,http:////www.11467.com/xuzhou/co/3926.htm
沛县大屯矿区海诚电脑服务部,http:////www.11467.com/xuzhou/co/18294.htm
新沂市扬名电脑商行,http:////www.11467.com/xuzhou/co/24480.htm
徐州市合力电脑经营部,http:////www.11467.com/xuzhou/co/7142.htm
徐州市奕宇电脑销售中心,http:////www.11467.com/xuzhou/co/7122.htm
徐州实佳电脑销售有限公司,http:////www.11467.com/xuzhou/co/26468.htm
丰县丰联电脑销售服务中心,http:////www.11467.com/xuzhou/co/16386.htm
沛县大屯矿区科达电脑服务部,http:////www.11467.com/xuzhou/co/18339.htm
徐州矿务局粤海贸易发展公司迅达电脑服务部,http:////www.11467.com/xuzhou/co/810.htm
邳州市彭派电脑销售有限公司,http:////www.11467.com/xuzhou/co/26467.htm
徐州港务局职工技协服务站金鹏电脑经营部,http:////www.11467.com/xuzhou/co/3927.htm
徐州市鹏达电脑经营部,http:////www.11467.com/xuzhou/co/7152.htm
房产电脑服务部,http:////www.11467.com/yanbian/co/5015.htm
滨海县东坎镇中天电脑门市部,http:////www.11467.com/yancheng/co/12659.htm
盐城市城区城中勇恒电脑耗材经营部,http:////www.11467.com/yancheng/co/3707.htm
建湖县建湖镇长城电脑服务部,http:////www.11467.com/yancheng/co/19348.htm
盐城市青衿电脑销售服务中心,http:////www.11467.com/yancheng/co/3850.htm
盐城市城区城中新华海电脑销售部,http:////www.11467.com/yancheng/co/3815.htm
盐城市城区城东朗昆电脑经营部,http:////www.11467.com/yancheng/co/3699.htm
盐城市城区城东思科电脑经营部,http:////www.11467.com/yancheng/co/3833.htm
射阳杰华电脑商行,http:////www.11467.com/yancheng/co/16712.htm
盐城市城区城东科希电脑经营部,http:////www.11467.com/yancheng/co/3855.htm
盐城市城区城中金博触摸式电脑经营部,http:////www.11467.com/yancheng/co/3693.htm
盐城市城区城中蓝点科技电脑经营部,http:////www.11467.com/yancheng/co/3674.htm
盐城市城区城中富强电脑服务部,http:////www.11467.com/yancheng/co/522.htm
盐城市城区城中三杰电脑服务部,http:////www.11467.com/yancheng/co/520.htm
盐城招商场创世纪电脑服务部,http:////www.11467.com/yancheng/co/3853.htm
盐城市城区城东电子电脑销售门市,http:////www.11467.com/yancheng/co/3851.htm
盐城市城区城东科强电脑经营部,http:////www.11467.com/yancheng/co/3703.htm
射阳县创新电脑销售中心,http:////www.11467.com/yancheng/co/16715.htm
建湖县建湖镇科技世纪电脑经营部,http:////www.11467.com/yancheng/co/19346.htm
盐城市城区城东中天科技电脑销售部,http:////www.11467.com/yancheng/co/3824.htm
滨海县精英电脑服务部,http:////www.11467.com/yancheng/co/12684.htm
大丰市机电产品供应公司电脑经营部,http:////www.11467.com/yancheng/co/26414.htm
射阳县合德镇科技电脑经营部,http:////www.11467.com/yancheng/co/16714.htm
阜宁县神舟电脑销售有限公司,http:////www.11467.com/yancheng/co/14270.htm
滨海县海溢电脑服务部,http:////www.11467.com/yancheng/co/12683.htm
盐城市亭湖区城北旭成电脑经营部,http:////www.11467.com/yancheng/co/3708.htm
东台市台城晨虹电脑经营部,http:////www.11467.com/yancheng/co/22796.htm
滨海县东坎镇江海电脑经营部,http:////www.11467.com/yancheng/co/12661.htm
盐城市城区城南联众电脑经营部,http:////www.11467.com/yancheng/co/3845.htm
阳江市佳龙办公设备有限公司,http:////www.11467.com/yangjiang/co/1378.htm
宝应县百叶电脑耗材经营部,http:////www.11467.com/yangzhou/co/16259.htm
宝应县安宜镇天赐电脑服务部,http:////www.11467.com/yangzhou/co/16346.htm
宝应县安宜镇志成电脑服务部,http:////www.11467.com/yangzhou/co/16345.htm
宝应县华源电脑服务部,http:////www.11467.com/yangzhou/co/16337.htm
宝应县科达电脑耗材经营部,http:////www.11467.com/yangzhou/co/16334.htm
宝应县安宜镇西湖电脑经营部,http:////www.11467.com/yangzhou/co/16344.htm
高邮市经纬实业公司东进电脑服务部,http:////www.11467.com/yangzhou/co/23480.htm
高邮市联想电源电脑经营部,http:////www.11467.com/yangzhou/co/23384.htm
江都市引江电脑服务部,http:////www.11467.com/yangzhou/co/27988.htm
江都市新区元通电脑耗材经营部,http:////www.11467.com/yangzhou/co/27802.htm
江都市真武镇新境界电脑服务部,http:////www.11467.com/yangzhou/co/27990.htm
扬州市广陵区金智文电脑配件经营部,http:////www.11467.com/yangzhou/co/3168.htm
扬州市广陵区鹏宏电脑经营部,http:////www.11467.com/yangzhou/co/3670.htm
江都市江都镇云波电脑销售部,http:////www.11467.com/yangzhou/co/28005.htm
扬州市广陵区威龙电脑服务部,http:////www.11467.com/yangzhou/co/728.htm
邗江县蒋王欣荣电脑服务部,http:////www.11467.com/yangzhou/co/7165.htm
江都市环宇电脑销售服务部,http:////www.11467.com/yangzhou/co/27807.htm
江都市一方电脑经营部,http:////www.11467.com/yangzhou/co/27989.htm
江都市耐达电脑耗材经营部,http:////www.11467.com/yangzhou/co/27994.htm
扬州市广陵区美驰电脑服务部,http:////www.11467.com/yangzhou/co/3176.htm
扬州市广陵区超频电脑服务部,http:////www.11467.com/yangzhou/co/3665.htm
扬州市广陵区维海电脑经营部,http:////www.11467.com/yangzhou/co/3167.htm
江都市江都镇恒通电脑经营部,http:////www.11467.com/yangzhou/co/27999.htm
扬州市广陵区永太电脑服务部,http:////www.11467.com/yangzhou/co/726.htm
扬州市东方医药经营公司电脑经营部,http:////www.11467.com/yangzhou/co/735.htm
扬州市广陵区文友电脑服务部,http:////www.11467.com/yangzhou/co/3179.htm
江都市新同方电脑销售有限公司,http:////www.11467.com/yangzhou/co/28002.htm
扬州市广陵区海燕电脑服务部,http:////www.11467.com/yangzhou/co/3175.htm
扬州市广陵区通联电脑经营部,http:////www.11467.com/yangzhou/co/732.htm
江都市花荡镇光宇电脑服务部,http:////www.11467.com/yangzhou/co/27792.htm
扬州市广陵区一鸣电脑经营部,http:////www.11467.com/yangzhou/co/3680.htm
扬州市广陵区中联电脑经营部,http:////www.11467.com/yangzhou/co/3169.htm
扬州市广陵区紫光电脑经营部,http:////www.11467.com/yangzhou/co/734.htm
仪征易特电脑经营部,http:////www.11467.com/yangzhou/co/20265.htm
高邮市先锋电脑经营部,http:////www.11467.com/yangzhou/co/23367.htm
扬州市郊区双桥树人电脑服务部,http:////www.11467.com/yangzhou/co/12672.htm
扬州市郊区希望电脑经营部,http:////www.11467.com/yangzhou/co/722.htm
南京瑞得电气公司扬州电脑经营部,http:////www.11467.com/yangzhou/co/737.htm
扬州市广陵区慧友电脑经营部,http:////www.11467.com/yangzhou/co/733.htm
仪征市真州镇清源电脑经营部,http:////www.11467.com/yangzhou/co/20270.htm
扬州市新城唯佳电脑服务部,http:////www.11467.com/yangzhou/co/12676.htm
扬州市新城英科电脑配件经营部,http:////www.11467.com/yangzhou/co/12678.htm
扬州亿嘉电脑销售有限公司,http:////www.11467.com/yangzhou/co/3186.htm
扬州新城创意电脑服务部,http:////www.11467.com/yangzhou/co/12670.htm
扬州新城永鑫电脑配件经营部,http:////www.11467.com/yangzhou/co/12675.htm
扬州市广陵区傲翔电脑经营部,http:////www.11467.com/yangzhou/co/3631.htm
扬州市广陵区骏马电脑服务部,http:////www.11467.com/yangzhou/co/3187.htm
扬州市大众传播实业公司电脑经营部,http:////www.11467.com/yangzhou/co/679.htm
扬州市广陵区唯鼎计算机销售部,http:////www.11467.com/yangzhou/co/3630.htm
仪征市金海洋电脑经营部,http:////www.11467.com/yangzhou/co/20269.htm
扬州市广陵区飞云电脑经营部,http:////www.11467.com/yangzhou/co/3677.htm
扬州市广陵区佳业电脑配件经营部,http:////www.11467.com/yangzhou/co/3679.htm
扬州新城区永泰电脑经营部,http:////www.11467.com/yangzhou/co/729.htm
扬州市新城长虹电脑服务部,http:////www.11467.com/yangzhou/co/506.htm
扬州市新城金贸电脑商行,http:////www.11467.com/yangzhou/co/12673.htm
扬州市广陵区超翔电脑配件商行,http:////www.11467.com/yangzhou/co/3683.htm
扬州市广陵区蓝豹电脑经营部,http:////www.11467.com/yangzhou/co/3178.htm
扬州市广陵区华创电脑经营部,http:////www.11467.com/yangzhou/co/3666.htm
扬州市广陵区山力电脑经营部,http:////www.11467.com/yangzhou/co/3685.htm
扬州市广陵区悦来风电脑配件经营部,http:////www.11467.com/yangzhou/co/3181.htm
扬州市郊区安信电脑经营部,http:////www.11467.com/yangzhou/co/3185.htm
扬州光学电脑经营部,http:////www.11467.com/yangzhou/co/3667.htm
仪征市真州镇俊杰电脑经营部,http:////www.11467.com/yangzhou/co/20261.htm
扬州市广陵区海潮电脑服务部,http:////www.11467.com/yangzhou/co/3171.htm
扬州市郊区东方电脑服务部,http:////www.11467.com/yangzhou/co/3681.htm
扬州市广陵区长朝电脑经营部,http:////www.11467.com/yangzhou/co/3625.htm
扬州市广陵区创新电脑服务部,http:////www.11467.com/yangzhou/co/3674.htm
扬州市广陵区梦想家电脑软件经营部,http:////www.11467.com/yangzhou/co/3628.htm
江都市江都镇新生电脑经营部,http:////www.11467.com/yangzhou/co/28004.htm
扬州市邗江建设区艺恒电脑配件经营部,http:////www.11467.com/yangzhou/co/7147.htm
扬州市广陵区麦恩电脑经营部,http:////www.11467.com/yangzhou/co/3656.htm
扬州市郊区毓贤电脑耗材经营部,http:////www.11467.com/yangzhou/co/12674.htm
扬州市广陵区金龙电脑服务部,http:////www.11467.com/yangzhou/co/3170.htm
扬州市广陵区超越电脑经营部,http:////www.11467.com/yangzhou/co/3657.htm
扬州市广陵区远大电脑服务部,http:////www.11467.com/yangzhou/co/752.htm
扬州市邗江区兴宇电脑耗材经营部,http:////www.11467.com/yangzhou/co/7166.htm
高邮市万通电脑服务部,http:////www.11467.com/yangzhou/co/23386.htm
扬州市广陵区新达电脑服务部,http:////www.11467.com/yangzhou/co/3682.htm
扬州市城北奔腾电脑服务部,http:////www.11467.com/yangzhou/co/730.htm
扬州市广陵区求实电脑经营部,http:////www.11467.com/yangzhou/co/3629.htm
扬州市新城联众计算机销售部,http:////www.11467.com/yangzhou/co/3668.htm
扬州新城新龙电脑服务部,http:////www.11467.com/yangzhou/co/12661.htm
高邮市时代电脑经营部,http:////www.11467.com/yangzhou/co/23484.htm
扬州市萌芽经济信息咨询服务公司电脑服务部,http:////www.11467.com/yangzhou/co/3184.htm
扬州市江隆世纪电脑经营部,http:////www.11467.com/yangzhou/co/3663.htm
扬州市邗江建设区同创电脑服务部,http:////www.11467.com/yangzhou/co/7152.htm
仪征市真州镇天腾电脑经营部,http:////www.11467.com/yangzhou/co/20218.htm
扬州市双桥飞腾电脑服务部,http:////www.11467.com/yangzhou/co/721.htm
扬州市振华电脑经营部电脑誊印社,http:////www.11467.com/yangzhou/co/3672.htm
扬州新城柳湖电脑服务部,http:////www.11467.com/yangzhou/co/3159.htm
扬州新城区英特电脑经营部,http:////www.11467.com/yangzhou/co/720.htm
扬州市新城源海电脑经营部,http:////www.11467.com/yangzhou/co/12677.htm
扬州市振华电脑经营部,http:////www.11467.com/yangzhou/co/3671.htm
烟台市芝罘瑞星电脑经营部,http:////www.11467.com/yantai/co/16058.htm
烟台市芝罘天翔电脑耕耘耗材经营部,http:////www.11467.com/yantai/co/16062.htm
宜宾市翠屏区腾达电脑经营部,http:////www.11467.com/yibin/co/3853.htm
宜宾市翠屏区云祥电脑经营部,http:////www.11467.com/yibin/co/3857.htm
宜宾市翠屏区维德电脑经营部,http:////www.11467.com/yibin/co/3889.htm
屏山县鑫茂电脑商行,http:////www.11467.com/yibin/co/13092.htm
宜宾市翠屏区兴盛电脑经营部一门市,http:////www.11467.com/yibin/co/3855.htm
宜宾市翠屏区锦林电脑耗材经营部,http:////www.11467.com/yibin/co/3856.htm
宜宾市翠屏区力天电脑经营部,http:////www.11467.com/yibin/co/423.htm
宜宾市翠屏区劲松电脑经营部,http:////www.11467.com/yibin/co/3891.htm
宜宾市翠屏区海添电脑耗材经营部,http:////www.11467.com/yibin/co/3871.htm
宜宾市翠屏区科捷电脑经营部,http:////www.11467.com/yibin/co/3769.htm
宜宾市翠屏区盛量电脑经营部,http:////www.11467.com/yibin/co/3888.htm
宜昌市西陵区心成电脑耗材经营部,http:////www.11467.com/yichang/co/1715.htm
宜昌市西陵区博大电脑经营部,http:////www.11467.com/yichang/co/1700.htm
宜昌市伍家岗区郑氏电脑软件经营部,http:////www.11467.com/yichang/co/10433.htm
宜昌市宇光电脑销售有限公司,http:////www.11467.com/yichang/co/1560.htm
宜昌市西陵区凯德电脑经营部,http:////www.11467.com/yichang/co/6404.htm
宜昌市西陵区开创电脑耗材经营部,http:////www.11467.com/yichang/co/1706.htm
宜昌市伍家区东方电脑经营部,http:////www.11467.com/yichang/co/10431.htm
宜昌市伍家岗区迅捷电脑经营部,http:////www.11467.com/yichang/co/1703.htm
葛洲坝河海电脑服务部,http:////www.11467.com/yichang/co/6364.htm
盖州市熊岳创天电脑商行,http:////www.11467.com/yingkou/co/19176.htm
营口经济技术开发区新日电脑销售中心,http:////www.11467.com/yingkou/co/10971.htm
营口经济技术开发区仙通电脑销售中心,http:////www.11467.com/yingkou/co/10977.htm
营口电子市场宏达电脑经营部,http:////www.11467.com/yingkou/co/5086.htm
岳阳市岳阳楼区国通电脑商行,http:////www.11467.com/yueyang/co/9299.htm
岳阳市岳阳楼区天天电脑经营部,http:////www.11467.com/yueyang/co/1193.htm
岳阳市岳阳楼区三和电脑经营部,http:////www.11467.com/yueyang/co/4430.htm
岳阳经济技术开发区华翔电脑配件经营部,http:////www.11467.com/yueyang/co/1180.htm
岳阳市岳阳楼区意达数码科技电脑经营部,http:////www.11467.com/yueyang/co/1190.htm
岳阳市岳阳楼区华众电脑经营部,http:////www.11467.com/yueyang/co/1183.htm
岳阳市岳阳楼区星园电脑经营部,http:////www.11467.com/yueyang/co/9268.htm
岳阳经济技术开发区万科电脑商行,http:////www.11467.com/yueyang/co/1170.htm
岳阳市云溪区新浪潮电脑经营部,http:////www.11467.com/yueyang/co/5836.htm
岳阳市岳阳楼区宏盛电脑经营部,http:////www.11467.com/yueyang/co/4445.htm
玉林市广益利电脑经营部,http:////www.11467.com/yulin/co/1939.htm
容县容城金山电脑服务部,http:////www.11467.com/yulin/co/4376.htm
玉林市华瑞电脑经营部,http:////www.11467.com/yulin/co/1920.htm
玉林市山立电脑经营部,http:////www.11467.com/yulin/co/1882.htm
北流市联邦电脑经营部,http:////www.11467.com/yulin/co/8191.htm
广西农业物资仪器设备玉林超级电脑商行,http:////www.11467.com/yulin/co/1938.htm
玉州区宏邦电脑配件经营部,http:////www.11467.com/yulin/co/1935.htm
玉林市荧光电脑经营部,http:////www.11467.com/yulin/co/1958.htm
兴业县石南百全电脑网络耗材经营部,http:////www.11467.com/yulin/co/6877.htm
玉林市政龙电脑销售服务部,http:////www.11467.com/yulin/co/1942.htm
玉林市玉州区创明电脑经营部,http:////www.11467.com/yulin/co/1908.htm
玉州区金网电脑销售部,http:////www.11467.com/yulin/co/1943.htm
玉州区恒运科技电脑经营部,http:////www.11467.com/yulin/co/1941.htm
玉林市玉州区科保电脑经营部,http:////www.11467.com/yulin/co/1946.htm
榆林市鑫革计算机销售有限责任公司,http:////www.11467.com/yulinshi/co/252.htm
云浮市云城金山电脑服务部,http:////www.11467.com/yunfu/co/667.htm
云浮市云城区新时代电脑经营部,http:////www.11467.com/yunfu/co/2596.htm
红星电脑软件专营店,http:////www.11467.com/yuxi/co/1927.htm
滕州市惠普电脑销售部,http:////www.11467.com/zaozhuang/co/13045.htm
宣化县对外开放委员会计计算机销售中心,http:////www.11467.com/zhangjiakou/co/9140.htm
张家口市桥东鑫昕科隆电脑服务部,http:////www.11467.com/zhangjiakou/co/219.htm
张家口市迪安特电脑销售有限公司,http:////www.11467.com/zhangjiakou/co/3772.htm
张家口市桥西区裕兴电脑销售中心,http:////www.11467.com/zhangjiakou/co/3774.htm
赤城县科信电脑服务部,http:////www.11467.com/zhangjiakou/co/19787.htm
张家口市桥西区晨光电脑服务部,http:////www.11467.com/zhangjiakou/co/3775.htm
张家口市桥西区互通电脑经营服务中心,http:////www.11467.com/zhangjiakou/co/3779.htm
平和飞时电脑经营部,http:////www.11467.com/zhangzhou/co/15403.htm
漳州市天河电子科技中心联想电脑销售部,http:////www.11467.com/zhangzhou/co/2937.htm
漳州市芗城育恒电脑商行,http:////www.11467.com/zhangzhou/co/2936.htm
湛江市赤坎区佳庆电脑经营部,http:////www.11467.com/zhanjiang/co/2245.htm
湛江市坡头区南调开心电脑服务部,http:////www.11467.com/zhanjiang/co/11463.htm
封开县江口镇粤江电脑商行,http:////www.11467.com/zhaoqing/co/10515.htm
肇庆市江滨世森电脑商行,http:////www.11467.com/zhaoqing/co/9042.htm
肇庆市端州区文通电脑经营部,http:////www.11467.com/zhaoqing/co/9052.htm
高要市新世纪电脑服务部,http:////www.11467.com/zhaoqing/co/9044.htm
高要市世纪电脑服务部,http:////www.11467.com/zhaoqing/co/9043.htm
肇庆市端州区蔚蓝电脑商行,http:////www.11467.com/zhaoqing/co/9054.htm
昭通市东士电脑服务部,http:////www.11467.com/zhaotong/co/5411.htm
昭通市昭阳区志诚电脑经营部,http:////www.11467.com/zhaotong/co/771.htm
昭通市昭阳区新方圆电脑经营部,http:////www.11467.com/zhaotong/co/769.htm
昭通市昭阳区西部创铭电脑经营部,http:////www.11467.com/zhaotong/co/770.htm
昭通市昭阳区指南针电脑配件经营部,http:////www.11467.com/zhaotong/co/5410.htm
郑州东软金算盘软件销售有限公司,http:////www.11467.com/zhengzhou/co/704.htm
郑州市金水区豪派电脑经营部,http:////www.11467.com/zhengzhou/co/29206.htm
丹阳市致远微电脑服务部,http:////www.11467.com/zhenjiang/co/19884.htm
镇江市润州区通用软件服务部,http:////www.11467.com/zhenjiang/co/6296.htm
句容市华阳镇创新电脑服务部,http:////www.11467.com/zhenjiang/co/26085.htm
镇江市京口腾飞科技电脑服务部,http:////www.11467.com/zhenjiang/co/1186.htm
扬中市温馨电脑服务部,http:////www.11467.com/zhenjiang/co/23443.htm
丹徒县金日电脑经营部,http:////www.11467.com/zhenjiang/co/10117.htm
扬中市三茅镇阳光森林电脑服务部,http:////www.11467.com/zhenjiang/co/23437.htm
扬中市三茅镇方圆电脑经营部,http:////www.11467.com/zhenjiang/co/23508.htm
丹徒县汇鑫电脑服务部,http:////www.11467.com/zhenjiang/co/1192.htm
句容市创维电脑服务部,http:////www.11467.com/zhenjiang/co/26082.htm
句容市华阳镇恒信电脑耗材经营部,http:////www.11467.com/zhenjiang/co/25967.htm
扬中市今世缘电脑服务部,http:////www.11467.com/zhenjiang/co/23428.htm
扬中市新坝镇世纪电脑服务部,http:////www.11467.com/zhenjiang/co/23445.htm
丹徒县伟业电脑经营部,http:////www.11467.com/zhenjiang/co/1191.htm
丹徒县汇金电脑服务部,http:////www.11467.com/zhenjiang/co/10125.htm
镇江市京口信业电脑服务部,http:////www.11467.com/zhenjiang/co/1194.htm
镇江市京口汇金电脑服务部,http:////www.11467.com/zhenjiang/co/10133.htm
扬中市创智电脑服务部,http:////www.11467.com/zhenjiang/co/23442.htm
京口区正峰电脑销售部,http:////www.11467.com/zhenjiang/co/1193.htm
扬中市正达电脑服务部,http:////www.11467.com/zhenjiang/co/23439.htm
丹阳市云阳镇路遥电脑经营部,http:////www.11467.com/zhenjiang/co/19896.htm
镇江市润州区宝塔诚信电脑耗材经营部,http:////www.11467.com/zhenjiang/co/6351.htm
扬中市兴隆镇零点电脑服务部,http:////www.11467.com/zhenjiang/co/23441.htm
扬中市新飞电脑服务部,http:////www.11467.com/zhenjiang/co/23444.htm
丹阳市云阳镇万事达电脑经营部,http:////www.11467.com/zhenjiang/co/19887.htm
扬中市超人电脑服务部,http:////www.11467.com/zhenjiang/co/23467.htm
镇江新区方兴园电脑销售有限公司,http:////www.11467.com/zhenjiang/co/1184.htm
镇江市京口区华业电脑经营部,http:////www.11467.com/zhenjiang/co/1188.htm
镇江市京口区科软电脑经营部,http:////www.11467.com/zhenjiang/co/1182.htm
扬中市八桥镇新世纪电脑服务部,http:////www.11467.com/zhenjiang/co/23446.htm
中山火炬开发区粤星电脑经营部,http:////www.11467.com/zhongshan/co/17282.htm
