太仓市神州化工防腐设备有限公司的商铺,http://suzhou0272690.11467.com
沈阳海洋轻型软管有限公司,http:////www.11467.com/shenyang/co/33177.htm
沈阳海洋轻型软管有限公司的商铺,http://shenyang033177.11467.com
苏州市金星铸造机械有限公司,http:////www.11467.com/suzhou/co/227534.htm
苏州市金星铸造机械有限公司的商铺,http://suzhou0227534.11467.com
许昌中煤机械制造有限公司,http:////www.11467.com/xuchang/co/10871.htm
许昌中煤机械制造有限公司的商铺,http://xuchang010871.11467.com
张家港路润机械有限公司,http:////www.11467.com/suzhou/co/319232.htm
张家港路润机械有限公司的商铺,http://suzhou0319232.11467.com
无锡市麦杰机械工程有限公司,http:////www.11467.com/wuxi/co/90548.htm
无锡市麦杰机械工程有限公司的商铺,http://wuxi090548.11467.com
深圳市鑫速风盛科技有限公司,http:////www.11467.com/shenzhen/co/784328.htm
深圳市鑫速风盛科技有限公司的商铺,http://shenzhen0784328.11467.com
河南兴达机械有限公司,http:////www.11467.com/zhengzhou/co/92546.htm
河南兴达机械有限公司的商铺,http://zhengzhou092546.11467.com
无锡市瑞莱电器有限公司,http:////www.11467.com/wuxi/co/215043.htm
无锡市瑞莱电器有限公司的商铺,http://wuxi0215043.11467.com
厦门兴力顺机电设备有限公司,http:////www.11467.com/xiamen/co/103437.htm
厦门兴力顺机电设备有限公司的商铺,http://xiamen0103437.11467.com
苏州运普自动化设备有限公司,http:////www.11467.com/suzhou/co/319939.htm
苏州运普自动化设备有限公司的商铺,http://suzhou0319939.11467.com
沈阳沈起技术工程有限责任公司,http:////www.11467.com/shenyang/co/64957.htm
沈阳沈起技术工程有限责任公司的商铺,http://shenyang064957.11467.com
郑州传诚机械设备有限公司,http:////www.11467.com/zhengzhou/co/173346.htm
郑州传诚机械设备有限公司的商铺,http://zhengzhou0173346.11467.com
新乡市振英机械设备有限公司,http:////www.11467.com/xinxiang/co/32504.htm
新乡市振英机械设备有限公司的商铺,http://xinxiang032504.11467.com
扬州博力机电设备有限公司,http:////www.11467.com/yangzhou/co/89837.htm
扬州博力机电设备有限公司的商铺,http://yangzhou089837.11467.com
泰州翔铭空调设备有限公司,http:////www.11467.com/taizhoushi/co/48498.htm
泰州翔铭空调设备有限公司的商铺,http://taizhoushi048498.11467.com
深圳市鸿冠电机有限公司,http:////www.11467.com/shenzhen/co/165719.htm
深圳市鸿冠电机有限公司的商铺,http://shenzhen0165719.11467.com
深圳市福升电机有限公司,http:////www.11467.com/shenzhen/co/111497.htm
深圳市福升电机有限公司的商铺,http://shenzhen0111497.11467.com
太仓双雄化工设备有限公司,http:////www.11467.com/suzhou/co/314467.htm
太仓双雄化工设备有限公司的商铺,http://suzhou0314467.11467.com
郑州朗科机械设备制造有限公司,http:////www.11467.com/zhengzhou/co/177127.htm
郑州朗科机械设备制造有限公司的商铺,http://zhengzhou0177127.11467.com
宜昌市捷力输送机械有限公司,http:////www.11467.com/yichang/co/36290.htm
宜昌市捷力输送机械有限公司的商铺,http://yichang036290.11467.com
诸暨市陶朱降温设备有限公司,http:////www.11467.com/shaoxing/co/103166.htm
诸暨市陶朱降温设备有限公司的商铺,http://shaoxing0103166.11467.com
河南大起重型机械集团有限公司,http:////www.11467.com/xinxiang/co/32692.htm
河南大起重型机械集团有限公司的商铺,http://xinxiang032692.11467.com
厦门市阳江机械有限公司,http:////www.11467.com/xiamen/co/16763.htm
厦门市阳江机械有限公司的商铺,http://xiamen016763.11467.com
无锡市嘉鑫带业有限公司,http:////www.11467.com/wuxi/co/244658.htm
无锡市嘉鑫带业有限公司的商铺,http://wuxi0244658.11467.com
沈阳金晨伟业冷暖设备有限公司,http:////www.11467.com/shenyang/co/81128.htm
沈阳金晨伟业冷暖设备有限公司的商铺,http://shenyang081128.11467.com
深圳市盛仕达电子有限公司,http:////www.11467.com/shenzhen/co/477616.htm
深圳市盛仕达电子有限公司的商铺,http://shenzhen0477616.11467.com
苏州永和诚风机工业有限公司,http:////www.11467.com/suzhou/co/236987.htm
苏州永和诚风机工业有限公司的商铺,http://suzhou0236987.11467.com
张家港市盛运机械有限公司,http:////www.11467.com/suzhou/co/313140.htm
张家港市盛运机械有限公司的商铺,http://suzhou0313140.11467.com
太原衢机矿山机电设备销售有限公司,http:////www.11467.com/taiyuan/co/97956.htm
太原衢机矿山机电设备销售有限公司的商铺,http://taiyuan097956.11467.com
山西巨龙风机有限公司,http:////www.11467.com/yuncheng/co/9560.htm
山西巨龙风机有限公司的商铺,http://yuncheng09560.11467.com
河南宇恒机械制造有限公司,http:////www.11467.com/zhengzhou/co/114089.htm
河南宇恒机械制造有限公司的商铺,http://zhengzhou0114089.11467.com
河南省化工机械制造有限公司,http:////www.11467.com/zhengzhou/co/112671.htm
河南省化工机械制造有限公司的商铺,http://zhengzhou0112671.11467.com
深圳市杰升达机械有限公司,http:////www.11467.com/shenzhen/co/828182.htm
深圳市杰升达机械有限公司的商铺,http://shenzhen0828182.11467.com
吉林市恺盛机械设备有限公司,http:////www.11467.com/jilinshi/co/82286.htm
吉林市恺盛机械设备有限公司的商铺,http://jilinshi082286.11467.com
宿迁中智机械制造有限公司,http:////www.11467.com/suqian/co/14983.htm
阜城县同创输送机械厂,http:////www.11467.com/hengshui/co/26873.htm
阜城县同创输送机械厂的商铺,http://hengshui026873.11467.com
桓台县果里鸿超机械厂,http:////www.11467.com/zibo/co/74799.htm
桓台县果里鸿超机械厂的商铺,http://zibo074799.11467.com
吴江市元荡电梯配件有限公司,http:////www.11467.com/suzhou/co/401402.htm
吴江市元荡电梯配件有限公司的商铺,http://suzhou0401402.11467.com
中山市小榄镇勉创输送设备厂,http:////www.11467.com/zhongshan/co/76172.htm
中山市小榄镇勉创输送设备厂的商铺,http://zhongshan076172.11467.com
佛山市隆韦制冷设备有限公司,http:////www.11467.com/foshan/co/182931.htm
佛山市隆韦制冷设备有限公司的商铺,http://foshan0182931.11467.com
义马华曦机械有限责任公司,http:////www.11467.com/sanmenxia/co/7727.htm
义马华曦机械有限责任公司的商铺,http://sanmenxia07727.11467.com
东莞市群达工业自动化有限公司,http:////www.11467.com/dongguan/co/293274.htm
东莞市群达工业自动化有限公司的商铺,http://dongguan0293274.11467.com
湖州正力物流设备有限公司,http:////www.11467.com/huzhou/co/56159.htm
湖州正力物流设备有限公司的商铺,http://huzhou056159.11467.com
珠海市恒冠自动化设备有限公司,http:////www.11467.com/zhuhai/co/63876.htm
珠海市恒冠自动化设备有限公司的商铺,http://zhuhai063876.11467.com
上海伯岭机电工程有限公司,http:////www.11467.com/shanghai/co/811323.htm
上海伯岭机电工程有限公司的商铺,http://shanghai0811323.11467.com
中山火炬开发区安平机械厂,http:////www.11467.com/zhongshan/co/81465.htm
中山火炬开发区安平机械厂的商铺,http://zhongshan081465.11467.com
中山市诺本输送设备有限公司,http:////www.11467.com/zhongshan/co/81900.htm
中山市诺本输送设备有限公司的商铺,http://zhongshan081900.11467.com
山东顺通风机有限公司,http:////www.11467.com/zibo/co/76424.htm
山东顺通风机有限公司的商铺,http://zibo076424.11467.com
珠海市贝林加油设备有限公司,http:////www.11467.com/zhongshan/co/73908.htm
珠海市贝林加油设备有限公司的商铺,http://zhongshan073908.11467.com
天津顺耐工业皮带有限公司,http:////www.11467.com/tianjin/co/98209.htm
天津顺耐工业皮带有限公司的商铺,http://tianjin098209.11467.com
泊头市首创环保设备有限公司,http:////www.11467.com/cangzhou/co/80097.htm
泊头市首创环保设备有限公司的商铺,http://cangzhou080097.11467.com
上海姚琴机械制造有限公司,http:////www.11467.com/shanghai/co/1079352.htm
上海姚琴机械制造有限公司的商铺,http://shanghai01079352.11467.com
新河县盛源水利机械销售中心,http:////www.11467.com/xintai/co/34421.htm
新河县盛源水利机械销售中心的商铺,http://xintai034421.11467.com
无锡市胜业通风设备厂,http:////www.11467.com/wuxi/co/214735.htm
无锡市胜业通风设备厂的商铺,http://wuxi0214735.11467.com
淄博润泰机械有限责任公司,http:////www.11467.com/zibo/co/65372.htm
淄博润泰机械有限责任公司的商铺,http://zibo065372.11467.com
弗佑自动化科技有限公司,http:////www.11467.com/panjin/co/25704.htm
弗佑自动化科技有限公司的商铺,http://panjin025704.11467.com
中山市东升镇汇发五金设备厂,http:////www.11467.com/zhongshan/co/152757.htm
中山市东升镇汇发五金设备厂的商铺,http://zhongshan0152757.11467.com
重庆帝隆工业皮带,http:////www.11467.com/chongqing/co/81021.htm
重庆帝隆工业皮带的商铺,http://chongqing081021.11467.com
上海龙广包装流水线有限公司,http:////www.11467.com/shanghai/co/898226.htm
上海龙广包装流水线有限公司的商铺,http://shanghai0898226.11467.com
湖州久瑞物流机械有限公司,http:////www.11467.com/huzhou/co/56086.htm
湖州久瑞物流机械有限公司的商铺,http://huzhou056086.11467.com
广东三合环保通风设备有限公司,http:////www.11467.com/foshan/co/379053.htm
广东三合环保通风设备有限公司的商铺,http://foshan0379053.11467.com
上海精朝机械工程有限公司,http:////www.11467.com/shanghai/co/800656.htm
上海精朝机械工程有限公司的商铺,http://shanghai0800656.11467.com
太仓国特金属制品有限公司,http:////www.11467.com/qiye/20074.htm
太仓国特金属制品有限公司的商铺,http://20074.b2b.11467.com
河北冀州启闭机厂,http:////www.11467.com/hengshui/co/66820.htm
河北冀州启闭机厂的商铺,http://hengshui066820.11467.com
冀州高田海河水利机械厂,http:////www.11467.com/hengshui/co/70654.htm
冀州高田海河水利机械厂的商铺,http://hengshui070654.11467.com
中山市坚成输送设备有限公司,http:////www.11467.com/zhongshan/co/117707.htm
中山市坚成输送设备有限公司的商铺,http://zhongshan0117707.11467.com
河北圣禹水工机械有限公司,http:////www.11467.com/xintai/co/64742.htm
河北圣禹水工机械有限公司的商铺,http://xintai064742.11467.com
东莞市智特自动化科技有限公司,http:////www.11467.com/dongguan/co/558605.htm
东莞市智特自动化科技有限公司的商铺,http://dongguan0558605.11467.com
东莞市顺财意实业有限公司,http:////www.11467.com/dongguan/co/601446.htm
东莞市顺财意实业有限公司的商铺,http://dongguan0601446.11467.com
沧州衡泰重工机械制造有限公司,http:////www.11467.com/cangzhou/co/95249.htm
沧州衡泰重工机械制造有限公司的商铺,http://cangzhou095249.11467.com
北京康博兴业货架有限公司,http:////www.11467.com/beijing/co/712351.htm
北京康博兴业货架有限公司的商铺,http://beijing0712351.11467.com
中山市威耐仕润滑油有限公司,http:////www.11467.com/zhongshan/co/143507.htm
中山市威耐仕润滑油有限公司的商铺,http://zhongshan0143507.11467.com
东莞市大岭山顺财意五金制品厂,http:////www.11467.com/dongguan/co/409695.htm
东莞市大岭山顺财意五金制品厂的商铺,http://dongguan0409695.11467.com
淄博市博山万通机械厂,http:////www.11467.com/zibo/co/62078.htm
淄博市博山万通机械厂的商铺,http://zibo062078.11467.com
东莞市捷进电机有限公司,http:////www.11467.com/dongguan/co/559387.htm
东莞市捷进电机有限公司的商铺,http://dongguan0559387.11467.com
湖南开元机械工业有限公司,http:////www.11467.com/hengyang/co/52302.htm
湖南开元机械工业有限公司的商铺,http://hengyang052302.11467.com
东莞市泓源机械传到设备有限公司,http:////www.11467.com/dongguan/co/413919.htm
广州市博诚输送设备有限公司,http:////www.11467.com/guangzhou/co/432872.htm
东莞市蓝昊通风降温设备有限公司,http:////www.11467.com/qiye/1524.htm
宁波振浩自动化设备有限公司,http:////www.11467.com/ningbo/co/195764.htm
河北艾尔法机床附件有限公司,http:////www.11467.com/cangzhou/co/62324.htm
上海祎强输送设备有限公司,http:////www.11467.com/shanghai/co/169507.htm
杭州创聚曼机电设备有限公司,http:////www.11467.com/hangzhou/co/311071.htm
杭州创聚曼机电设备有限公司的商铺,http://hangzhou0311071.11467.com
福州冠人环保科技有限公司,http:////www.11467.com/fuzhou/co/161862.htm
福州冠人环保科技有限公司的商铺,http://fuzhou0161862.11467.com
上海豪雍机械设备有限公司,http:////www.11467.com/shanghai/co/1047144.htm
上海豪雍机械设备有限公司的商铺,http://shanghai01047144.11467.com
德州瑞德通风设备加工厂,http:////www.11467.com/dezhou/co/38510.htm
德州瑞德通风设备加工厂的商铺,http://dezhou038510.11467.com
浙江东方机电有限公司,http:////www.11467.com/wenzhou/co/219739.htm
浙江东方机电有限公司的商铺,http://wenzhou0219739.11467.com
新乡市百盛机械有限公司,http:////www.11467.com/xinxiang/co/22154.htm
新乡市百盛机械有限公司的商铺,http://xinxiang022154.11467.com
青州市润华温控设备有限公司,http:////www.11467.com/weifang/co/96063.htm
青州市润华温控设备有限公司的商铺,http://weifang096063.11467.com
昆嘉机床附件（上海）有限公司,http:////www.11467.com/shanghai/co/330850.htm
昆嘉机床附件（上海）有限公司的商铺,http://shanghai0330850.11467.com
无锡诚鑫达机电成套设备有限公司,http:////www.11467.com/wuxi/co/189135.htm
无锡诚鑫达机电成套设备有限公司的商铺,http://wuxi0189135.11467.com
山东金德空调设备有限公司,http:////www.11467.com/dezhou/co/38502.htm
山东金德空调设备有限公司的商铺,http://dezhou038502.11467.com
上海章嘉自动化设备有限公司,http:////www.11467.com/shanghai/co/822029.htm
上海章嘉自动化设备有限公司的商铺,http://shanghai0822029.11467.com
无锡市升金源机械厂,http:////www.11467.com/wuxi/co/189145.htm
无锡市升金源机械厂的商铺,http://wuxi0189145.11467.com
青岛百特工业皮带有限公司,http:////www.11467.com/qingdao/co/93913.htm
青岛百特工业皮带有限公司的商铺,http://qingdao093913.11467.com
郑州自动化装备有限公司,http:////www.11467.com/zhengzhou/co/169775.htm
郑州自动化装备有限公司的商铺,http://zhengzhou0169775.11467.com
常州林涛机械有限公司,http:////www.11467.com/changzhou/co/147823.htm
常州林涛机械有限公司的商铺,http://changzhou0147823.11467.com
深圳市宝安区沙井豪鹏塑胶机械厂,http:////www.11467.com/dongguan/co/555402.htm
深圳市宝安区沙井豪鹏塑胶机械厂的商铺,http://dongguan0555402.11467.com
徐州微衡能源设备有限公司,http:////www.11467.com/xuzhou/co/55258.htm
徐州微衡能源设备有限公司的商铺,http://xuzhou055258.11467.com
泊头市聚友机械设备有限公司,http:////www.11467.com/cangzhou/co/61609.htm
泊头市聚友机械设备有限公司的商铺,http://cangzhou061609.11467.com
新乡市三峰化工设备有限公司,http:////www.11467.com/xinxiang/co/32599.htm
新乡市三峰化工设备有限公司的商铺,http://xinxiang032599.11467.com
巩义市旺达机械厂,http:////www.11467.com/zhengzhou/co/171824.htm
巩义市旺达机械厂的商铺,http://zhengzhou0171824.11467.com
深州市顺利机械制造厂,http:////www.11467.com/hengshui/co/27263.htm
深州市顺利机械制造厂的商铺,http://hengshui027263.11467.com
东莞市力丰自动化设备有限公司,http:////www.11467.com/dongguan/co/415243.htm
东莞市力丰自动化设备有限公司的商铺,http://dongguan0415243.11467.com
石家庄尚卓机电设备有限公司,http:////www.11467.com/shijiazhuang/co/108700.htm
石家庄尚卓机电设备有限公司的商铺,http://shijiazhuang0108700.11467.com
宁津县兴华输送设备厂,http:////www.11467.com/dezhou/co/49360.htm
宁津县兴华输送设备厂的商铺,http://dezhou049360.11467.com
佛山黄朝机械制造有限公司,http:////www.11467.com/foshan/co/345465.htm
佛山黄朝机械制造有限公司的商铺,http://foshan0345465.11467.com
景县星光橡塑制品有限公司,http:////www.11467.com/hengshui/co/34680.htm
景县星光橡塑制品有限公司的商铺,http://hengshui034680.11467.com
潍坊坤达机械有限公司,http:////www.11467.com/weifang/co/117350.htm
潍坊坤达机械有限公司的商铺,http://weifang0117350.11467.com
新河县水星水工机械厂,http:////www.11467.com/xintai/co/39535.htm
新河县水星水工机械厂的商铺,http://xintai039535.11467.com
山东先罗输送机械有限公司,http:////www.11467.com/zaozhuang/co/36721.htm
山东先罗输送机械有限公司的商铺,http://zaozhuang036721.11467.com
湖州吴兴佳明输送机械厂,http:////www.11467.com/huzhou/co/66709.htm
湖州吴兴佳明输送机械厂的商铺,http://huzhou066709.11467.com
潍坊杰瑞达机械有限公司,http:////www.11467.com/weifang/co/93056.htm
潍坊杰瑞达机械有限公司的商铺,http://weifang093056.11467.com
重庆瑞满自动化设备有限公司,http:////www.11467.com/chongqing/co/204480.htm
重庆瑞满自动化设备有限公司的商铺,http://chongqing0204480.11467.com
山东生建重工有限公司,http:////www.11467.com/zibo/co/96226.htm
山东生建重工有限公司的商铺,http://zibo096226.11467.com
广州市超顺输送设备有限公司,http:////www.11467.com/guangzhou/co/434467.htm
广州市超顺输送设备有限公司的商铺,http://guangzhou0434467.11467.com
泰安开发区康泰塑业有限公司,http:////www.11467.com/taian/co/41837.htm
泰安开发区康泰塑业有限公司的商铺,http://taian041837.11467.com
柯索压缩机（上海）有限公司济南办事处,http:////www.11467.com/shanghai/co/898446.htm
柯索压缩机（上海）有限公司济南办事处的商铺,http://shanghai0898446.11467.com
连云港苏港石化设备有限公司,http:////www.11467.com/lianyungang/co/33176.htm
连云港苏港石化设备有限公司的商铺,http://lianyungang033176.11467.com
深圳市威信尔机电有限公司,http:////www.11467.com/shenzhen/co/757099.htm
深圳市威信尔机电有限公司的商铺,http://shenzhen0757099.11467.com
新乡市鼎盛振动设备有限公司,http:////www.11467.com/xinxiang/co/32130.htm
新乡市鼎盛振动设备有限公司的商铺,http://xinxiang032130.11467.com
保定恒耐橡胶机带制造有限公司,http:////www.11467.com/qiye/181058.htm
保定恒耐橡胶机带制造有限公司的商铺,http://181058.b2b.11467.com
杭州捷宇扬自动化设备有限公司,http:////www.11467.com/hangzhou/co/368590.htm
杭州捷宇扬自动化设备有限公司的商铺,http://hangzhou0368590.11467.com
东莞市巨大精密机械有限公司,http:////www.11467.com/dongguan/co/234788.htm
东莞市巨大精密机械有限公司的商铺,http://dongguan0234788.11467.com
上海传卡机械设备有限公司,http:////www.11467.com/shanghai/co/1035958.htm
上海传卡机械设备有限公司的商铺,http://shanghai01035958.11467.com
青岛腾跃自动化设备有限责任公司,http:////www.11467.com/qingdao/co/152136.htm
青岛腾跃自动化设备有限责任公司的商铺,http://qingdao0152136.11467.com
沈阳安胜工业皮带有限公司,http:////www.11467.com/shenyang/co/60845.htm
沈阳安胜工业皮带有限公司的商铺,http://shenyang060845.11467.com
山东先罗专业新型建材设备供应商,http:////www.11467.com/zaozhuang/co/30773.htm
山东先罗专业新型建材设备供应商的商铺,http://zaozhuang030773.11467.com
泊头市盛康环保机械有限公司,http:////www.11467.com/cangzhou/co/46533.htm
泊头市盛康环保机械有限公司的商铺,http://cangzhou046533.11467.com
东莞市常平长承五金经营部,http:////www.11467.com/huizhou/co/96666.htm
东莞市常平长承五金经营部的商铺,http://huizhou096666.11467.com
鹤壁市钰盛矿山机械设备有限公司,http:////www.11467.com/hebi/co/11518.htm
鹤壁市钰盛矿山机械设备有限公司的商铺,http://hebi011518.11467.com
沧州宇泰输送机械有限公司,http:////www.11467.com/cangzhou/co/61365.htm
沧州宇泰输送机械有限公司的商铺,http://cangzhou061365.11467.com
盐山县金航机床附件销售处,http:////www.11467.com/cangzhou/co/67820.htm
盐山县金航机床附件销售处的商铺,http://cangzhou067820.11467.com
蠡县华都橡胶机带有限公司,http:////www.11467.com/baoding/co/80407.htm
蠡县华都橡胶机带有限公司的商铺,http://baoding080407.11467.com
常州欧朋干燥设备有限公司,http:////www.11467.com/changzhou/co/102232.htm
常州欧朋干燥设备有限公司的商铺,http://changzhou0102232.11467.com
沧州市东骏机械配件有限公司,http:////www.11467.com/cangzhou/co/57370.htm
沧州市东骏机械配件有限公司的商铺,http://cangzhou057370.11467.com
常州市范众干燥设备有限公司,http:////www.11467.com/changzhou/co/79825.htm
常州市范众干燥设备有限公司的商铺,http://changzhou079825.11467.com
湖南省常德通用压缩机有限公司,http:////www.11467.com/changde/co/3675.htm
湖南省常德通用压缩机有限公司的商铺,http://changde03675.11467.com
长沙机床厂机械刨床厂,http:////www.11467.com/changsha/co/28048.htm
长沙机床厂机械刨床厂的商铺,http://changsha028048.11467.com
常州步群干燥设备有限公司,http:////www.11467.com/changzhou/co/140111.htm
常州步群干燥设备有限公司的商铺,http://changzhou0140111.11467.com
盐山县华夏机床附件有限公司,http:////www.11467.com/cangzhou/co/58136.htm
盐山县华夏机床附件有限公司的商铺,http://cangzhou058136.11467.com
沧县渤海机械厂,http:////www.11467.com/cangzhou/co/38971.htm
沧县渤海机械厂的商铺,http://cangzhou038971.11467.com
长沙永风风机制造有限公司,http:////www.11467.com/changsha/co/84877.htm
长沙永风风机制造有限公司的商铺,http://changsha084877.11467.com
沧州市嘉力内燃机配件有限公司,http:////www.11467.com/cangzhou/co/41291.htm
沧州市嘉力内燃机配件有限公司的商铺,http://cangzhou041291.11467.com
安庆市宜风环保科技有限公司,http:////www.11467.com/anqing/co/23881.htm
安庆市宜风环保科技有限公司的商铺,http://anqing023881.11467.com
常州艾布纳机械有限公司,http:////www.11467.com/changzhou/co/105223.htm
常州艾布纳机械有限公司的商铺,http://changzhou0105223.11467.com
沧州金鑫数控机床配件制造有限公司,http:////www.11467.com/cangzhou/co/45969.htm
沧州金鑫数控机床配件制造有限公司的商铺,http://cangzhou045969.11467.com
黄骅市胜禹水工机械有限公司,http:////www.11467.com/cangzhou/co/46448.htm
黄骅市胜禹水工机械有限公司的商铺,http://cangzhou046448.11467.com
鞍山市昌盛空压机有限公司,http:////www.11467.com/anshan/co/68969.htm
鞍山市昌盛空压机有限公司的商铺,http://anshan068969.11467.com
马鞍山新东方重工机械科技有限公司,http:////www.11467.com/anshan/co/78954.htm
马鞍山新东方重工机械科技有限公司的商铺,http://anshan078954.11467.com
沧州衡泰环保机械制造有限公司,http:////www.11467.com/cangzhou/co/61420.htm
沧州衡泰环保机械制造有限公司的商铺,http://cangzhou061420.11467.com
沧州鑫泰兴数控机床附件有限公司,http:////www.11467.com/cangzhou/co/67930.htm
沧州鑫泰兴数控机床附件有限公司的商铺,http://cangzhou067930.11467.com
清苑县中天电子设备厂,http:////www.11467.com/baoding/co/79582.htm
清苑县中天电子设备厂的商铺,http://baoding079582.11467.com
海兴县宏盛体育器材厂,http:////www.11467.com/cangzhou/co/41037.htm
海兴县宏盛体育器材厂的商铺,http://cangzhou041037.11467.com
沧州纵横机械制造有限公司,http:////www.11467.com/cangzhou/co/45862.htm
沧州纵横机械制造有限公司的商铺,http://cangzhou045862.11467.com
沧州瑞丰电器制造有限公司,http:////www.11467.com/cangzhou/co/58902.htm
沧州瑞丰电器制造有限公司的商铺,http://cangzhou058902.11467.com
盐山县昊坤机械制造有限公司,http:////www.11467.com/cangzhou/co/46447.htm
盐山县昊坤机械制造有限公司的商铺,http://cangzhou046447.11467.com
新泰市裕鑫工矿机械有限公司,http:////www.11467.com/baoding/co/91297.htm
新泰市裕鑫工矿机械有限公司的商铺,http://baoding091297.11467.com
包头市东河区聚仙橡胶制品经销部,http:////www.11467.com/baotou/co/23466.htm
包头市东河区聚仙橡胶制品经销部的商铺,http://baotou023466.11467.com
长沙绿盟机械有限公司,http:////www.11467.com/changsha/co/119362.htm
长沙绿盟机械有限公司的商铺,http://changsha0119362.11467.com
常州金宇环保设备有限公司,http:////www.11467.com/changzhou/co/49373.htm
常州金宇环保设备有限公司的商铺,http://changzhou049373.11467.com
常州杰奥自动化设备有限公司,http:////www.11467.com/changzhou/co/88363.htm
常州杰奥自动化设备有限公司的商铺,http://changzhou088363.11467.com
