常州市晨威机械有限公司,http:////www.11467.com/changzhou/co/87978.htm
常州市晨威机械有限公司的商铺,http://changzhou087978.11467.com
广州擎川机电设备有限公司,http:////www.11467.com/guangzhou/co/67402.htm
广州擎川机电设备有限公司的商铺,http://guangzhou067402.11467.com
深圳市佳联自动化设备有限公司,http:////www.11467.com/shenzhen/co/732495.htm
深圳市佳联自动化设备有限公司的商铺,http://shenzhen0732495.11467.com
鹤壁市中汇通用机械有限公司,http:////www.11467.com/hebi/co/8865.htm
鹤壁市中汇通用机械有限公司的商铺,http://hebi08865.11467.com
宁津县鑫星网带机械厂,http:////www.11467.com/dezhou/co/38438.htm
宁津县鑫星网带机械厂的商铺,http://dezhou038438.11467.com
福安市源诚电机有限公司,http:////www.11467.com/ningde/co/30240.htm
福安市源诚电机有限公司的商铺,http://ningde030240.11467.com
牡丹江市东安区应达风机经销处,http:////www.11467.com/mudanjiang/co/48280.htm
牡丹江市东安区应达风机经销处的商铺,http://mudanjiang048280.11467.com
鹤壁市北方通用机械制造有限公司,http:////www.11467.com/hebi/co/8772.htm
鹤壁市北方通用机械制造有限公司的商铺,http://hebi08772.11467.com
鹤壁市三元煤化机械有限公司,http:////www.11467.com/hebi/co/8742.htm
鹤壁市三元煤化机械有限公司的商铺,http://hebi08742.11467.com
吉林省白山泵业机械有限责任公司,http:////www.11467.com/baishan/co/11224.htm
吉林省白山泵业机械有限责任公司的商铺,http://baishan011224.11467.com
江西博杰自动化设备有限公司,http:////www.11467.com/jian/co/15298.htm
江西博杰自动化设备有限公司的商铺,http://jian015298.11467.com
焦作三岛输送机械有限公司,http:////www.11467.com/jiaozuo/co/14010.htm
焦作三岛输送机械有限公司的商铺,http://jiaozuo014010.11467.com
承德天意输送机械制造有限公司,http:////www.11467.com/chengde/co/21911.htm
承德天意输送机械制造有限公司的商铺,http://chengde021911.11467.com
大理先锋科技发展有限公司,http:////www.11467.com/dali/co/12199.htm
大理先锋科技发展有限公司的商铺,http://dali012199.11467.com
鹤壁天惠通用设备有限公司,http:////www.11467.com/hebi/co/8763.htm
鹤壁天惠通用设备有限公司的商铺,http://hebi08763.11467.com
武穴市恒星铸造机械厂,http:////www.11467.com/huanggang/co/16491.htm
武穴市恒星铸造机械厂的商铺,http://huanggang016491.11467.com
广州市增城润财锅炉配件经营部,http:////www.11467.com/guangzhou/co/433709.htm
广州市增城润财锅炉配件经营部的商铺,http://guangzhou0433709.11467.com
佛山市禅城区双核隔膜泵设备厂,http:////www.11467.com/foshan/co/335329.htm
佛山市禅城区双核隔膜泵设备厂的商铺,http://foshan0335329.11467.com
石城县宝山矿山设备有限公司,http:////www.11467.com/ganzhou/co/31973.htm
石城县宝山矿山设备有限公司的商铺,http://ganzhou031973.11467.com
郴州市湘闽真空砖机厂,http:////www.11467.com/chenzhou/co/19336.htm
郴州市湘闽真空砖机厂的商铺,http://chenzhou019336.11467.com
阜城县华瑞机械制造有限公司,http:////www.11467.com/hengshui/co/42718.htm
阜城县华瑞机械制造有限公司的商铺,http://hengshui042718.11467.com
河北恒辉玻璃钢有限公司,http:////www.11467.com/hengshui/co/34123.htm
河北恒辉玻璃钢有限公司的商铺,http://hengshui034123.11467.com
宁津县星海网链厂,http:////www.11467.com/dezhou/co/59975.htm
宁津县星海网链厂的商铺,http://dezhou059975.11467.com
宁津县捷迅网带机械有限公司,http:////www.11467.com/dezhou/co/51173.htm
宁津县捷迅网带机械有限公司的商铺,http://dezhou051173.11467.com
新河县弘鑫水工机械厂,http:////www.11467.com/xintai/co/39537.htm
新河县弘鑫水工机械厂的商铺,http://xintai039537.11467.com
青岛鑫诚达自动化设备有限公司,http:////www.11467.com/qingdao/co/151838.htm
青岛鑫诚达自动化设备有限公司的商铺,http://qingdao0151838.11467.com
杭州冠昱升输送机械设备有限公司,http:////www.11467.com/hangzhou/co/312082.htm
杭州冠昱升输送机械设备有限公司的商铺,http://hangzhou0312082.11467.com
山东省宁津县鑫发网链厂,http:////www.11467.com/dezhou/co/38479.htm
山东省宁津县鑫发网链厂的商铺,http://dezhou038479.11467.com
东光县盛强机电设备有限公司,http:////www.11467.com/cangzhou/co/46648.htm
东光县盛强机电设备有限公司的商铺,http://cangzhou046648.11467.com
开封豫龙胶带有限公司,http:////www.11467.com/kaifeng/co/13752.htm
开封豫龙胶带有限公司的商铺,http://kaifeng013752.11467.com
缙云县吉祥机械制造厂,http:////www.11467.com/lishui/co/26289.htm
缙云县吉祥机械制造厂的商铺,http://lishui026289.11467.com
焦作市科佳制动器有限公司,http:////www.11467.com/jiaozuo/co/23069.htm
焦作市科佳制动器有限公司的商铺,http://jiaozuo023069.11467.com
诸暨市大唐宏远合力机械厂,http:////www.11467.com/shaoxing/co/118153.htm
诸暨市大唐宏远合力机械厂的商铺,http://shaoxing0118153.11467.com
宁津县万力食品网带厂,http:////www.11467.com/dezhou/co/38456.htm
宁津县万力食品网带厂的商铺,http://dezhou038456.11467.com
浩宇输送机械制造厂,http:////www.11467.com/dezhou/co/49650.htm
浩宇输送机械制造厂的商铺,http://dezhou049650.11467.com
北京冀鑫运来机械科技有限公司,http:////www.11467.com/hengshui/co/42864.htm
北京冀鑫运来机械科技有限公司的商铺,http://hengshui042864.11467.com
洛阳力企管业有限公司,http:////www.11467.com/luoyang/co/60064.htm
洛阳力企管业有限公司的商铺,http://luoyang060064.11467.com
介休市城区定阳气力输送机厂,http:////www.11467.com/jinzhong/co/27919.htm
介休市城区定阳气力输送机厂的商铺,http://jinzhong027919.11467.com
赣州科力机械设备有限公司,http:////www.11467.com/ganzhou/co/35686.htm
赣州科力机械设备有限公司的商铺,http://ganzhou035686.11467.com
河北保定宏联机械有限公司,http:////www.11467.com/baoding/co/78977.htm
河北保定宏联机械有限公司的商铺,http://baoding078977.11467.com
宁津县金利链网厂,http:////www.11467.com/dezhou/co/60022.htm
宁津县金利链网厂的商铺,http://dezhou060022.11467.com
常州市沛阳自动化设备有限公司,http:////www.11467.com/changzhou/co/152706.htm
常州市沛阳自动化设备有限公司的商铺,http://changzhou0152706.11467.com
惠州市鑫钰实业有限公司,http:////www.11467.com/huizhou/co/88232.htm
惠州市鑫钰实业有限公司的商铺,http://huizhou088232.11467.com
深圳市宝安区沙井美佳华五金塑胶厂,http:////www.11467.com/jiangmen/co/116784.htm
深圳市宝安区沙井美佳华五金塑胶厂的商铺,http://jiangmen0116784.11467.com
深圳市怡拓通讯技术有限公司,http:////www.11467.com/shenzhen/co/813431.htm
深圳市怡拓通讯技术有限公司的商铺,http://shenzhen0813431.11467.com
宿迁市宇杰机械制造有限公司,http:////www.11467.com/suqian/co/23852.htm
宿迁市宇杰机械制造有限公司的商铺,http://suqian023852.11467.com
南京华大环保设备有限公司,http:////www.11467.com/nanjing/co/115034.htm
南京华大环保设备有限公司的商铺,http://nanjing0115034.11467.com
山东柳工混凝土设备有限公司,http:////www.11467.com/linyi/co/94209.htm
山东柳工混凝土设备有限公司的商铺,http://linyi094209.11467.com
枣强县化工防腐设备厂,http:////www.11467.com/hengshui/co/27109.htm
枣强县化工防腐设备厂的商铺,http://hengshui027109.11467.com
五原县复兴村四格农机制造厂,http:////www.11467.com/bayannaoer/co/5102.htm
五原县复兴村四格农机制造厂的商铺,http://bayannaoer05102.11467.com
北京富拓达机械有限公司,http:////www.11467.com/beijing/co/707387.htm
北京富拓达机械有限公司的商铺,http://beijing0707387.11467.com
太仓丰亿化工防腐设备厂,http:////www.11467.com/suzhou/co/272818.htm
太仓丰亿化工防腐设备厂的商铺,http://suzhou0272818.11467.com
巩义市机械厂,http:////www.11467.com/zhengzhou/co/173315.htm
巩义市机械厂的商铺,http://zhengzhou0173315.11467.com
锟恒起重机械(上海)有限公司,http:////www.11467.com/shanghai/co/1147149.htm
锟恒起重机械(上海)有限公司的商铺,http://shanghai01147149.11467.com
青岛海之星环保设备有限公司,http:////www.11467.com/qingdao/co/186193.htm
青岛海之星环保设备有限公司的商铺,http://qingdao0186193.11467.com
无锡星纬激光科技有限公司,http:////www.11467.com/wuxi/co/252640.htm
无锡星纬激光科技有限公司的商铺,http://wuxi0252640.11467.com
宁津县威诺网链机械制造有限公司,http:////www.11467.com/dezhou/co/71636.htm
宁津县威诺网链机械制造有限公司的商铺,http://dezhou071636.11467.com
保定浩发输送机械制造有限公司,http:////www.11467.com/baoding/co/158792.htm
保定浩发输送机械制造有限公司的商铺,http://baoding0158792.11467.com
成都壹欣餐饮管理责任有限公司,http:////www.11467.com/chengdu/co/285808.htm
成都壹欣餐饮管理责任有限公司的商铺,http://chengdu0285808.11467.com
新乡市蒲东机械有限公司,http:////www.11467.com/xinxiang/co/32064.htm
新乡市蒲东机械有限公司的商铺,http://xinxiang032064.11467.com
盐山县通泰机械制造有限公司,http:////www.11467.com/cangzhou/co/92393.htm
盐山县通泰机械制造有限公司的商铺,http://cangzhou092393.11467.com
重庆市凯斐商贸有限公司,http:////www.11467.com/chongqing/co/206335.htm
重庆市凯斐商贸有限公司的商铺,http://chongqing0206335.11467.com
新河县远航水利机械厂,http:////www.11467.com/xintai/co/76062.htm
新河县远航水利机械厂的商铺,http://xintai076062.11467.com
咸阳元通风机制造有限公司,http:////www.11467.com/xianyang/co/23313.htm
咸阳元通风机制造有限公司的商铺,http://xianyang023313.11467.com
新乡市升基利设备制造有限公司,http:////www.11467.com/xinxiang/co/19815.htm
新乡市升基利设备制造有限公司的商铺,http://xinxiang019815.11467.com
江苏宇科环保科技有限公司,http:////www.11467.com/taizhoushi/co/51630.htm
江苏宇科环保科技有限公司的商铺,http://taizhoushi051630.11467.com
芜湖豪缘合金有限公司,http:////www.11467.com/wuhu/co/22692.htm
芜湖豪缘合金有限公司的商铺,http://wuhu022692.11467.com
铁岭市恒誉建筑材料有限公司,http:////www.11467.com/tieling/co/31528.htm
铁岭市恒誉建筑材料有限公司的商铺,http://tieling031528.11467.com
西安交大流体压缩国家工程中心咸阳风机厂,http:////www.11467.com/xianyang/co/21727.htm
西安交大流体压缩国家工程中心咸阳风机厂的商铺,http://xianyang021727.11467.com
咸阳凯达机电设备制造有限公司,http:////www.11467.com/xianyang/co/21826.htm
咸阳凯达机电设备制造有限公司的商铺,http://xianyang021826.11467.com
浙江正林机械制造有限公司,http:////www.11467.com/zhoushan/co/17990.htm
浙江正林机械制造有限公司的商铺,http://zhoushan017990.11467.com
湖南省米兰特种压缩机有限公司,http:////www.11467.com/xiangtan/co/24553.htm
湖南省米兰特种压缩机有限公司的商铺,http://xiangtan024553.11467.com
厦门东斯南机械设备有限公司,http:////www.11467.com/xiamen/co/93108.htm
厦门东斯南机械设备有限公司的商铺,http://xiamen093108.11467.com
郑州庆林机械设备有限公司,http:////www.11467.com/zhengzhou/co/224728.htm
郑州庆林机械设备有限公司的商铺,http://zhengzhou0224728.11467.com
沛哲机械（上海）有限公司,http:////www.11467.com/shanghai/co/800648.htm
沛哲机械（上海）有限公司的商铺,http://shanghai0800648.11467.com
曲阜汇达农林机械设备有限公司,http:////www.11467.com/jining/co/107271.htm
曲阜汇达农林机械设备有限公司的商铺,http://jining0107271.11467.com
鹤壁市兰大通用机械有限公司,http:////www.11467.com/hebi/co/8864.htm
鹤壁市兰大通用机械有限公司的商铺,http://hebi08864.11467.com
无锡中粮工程科技有限公司,http:////www.11467.com/wuxi/co/249772.htm
无锡中粮工程科技有限公司的商铺,http://wuxi0249772.11467.com
靖江市新民空调设备厂,http:////www.11467.com/taizhoushi/co/48389.htm
靖江市新民空调设备厂的商铺,http://taizhoushi048389.11467.com
徐州基石称重有限公司,http:////www.11467.com/xuzhou/co/92167.htm
徐州基石称重有限公司的商铺,http://xuzhou092167.11467.com
宁津正德输送设备有限公司,http:////www.11467.com/dezhou/co/72250.htm
宁津正德输送设备有限公司的商铺,http://dezhou072250.11467.com
上海上乾机械自动化有限公司,http:////www.11467.com/shanghai/co/1260402.htm
上海上乾机械自动化有限公司的商铺,http://shanghai01260402.11467.com
荣泰机床附件制造有限公司,http:////www.11467.com/cangzhou/co/98409.htm
荣泰机床附件制造有限公司的商铺,http://cangzhou098409.11467.com
靖江市艾肯空调设备有限公司,http:////www.11467.com/taizhoushi/co/48353.htm
靖江市艾肯空调设备有限公司的商铺,http://taizhoushi048353.11467.com
上海承乐机械设备有限公司,http:////www.11467.com/shanghai/co/800439.htm
上海承乐机械设备有限公司的商铺,http://shanghai0800439.11467.com
张掖市昆冈玉源建材有限责任公司,http:////www.11467.com/zhangye/co/9169.htm
张掖市昆冈玉源建材有限责任公司的商铺,http://zhangye09169.11467.com
深圳市迈恩工业技术有限公司,http:////www.11467.com/shenzhen/co/373751.htm
深圳市迈恩工业技术有限公司的商铺,http://shenzhen0373751.11467.com
力博重工科技股份有限公司,http:////www.11467.com/taian/co/53118.htm
力博重工科技股份有限公司的商铺,http://taian053118.11467.com
新区文描华通风设备经营部,http:////www.11467.com/wuxi/co/249951.htm
新区文描华通风设备经营部的商铺,http://wuxi0249951.11467.com
上海澜兴制药机械有限公司,http:////www.11467.com/shanghai/co/1274835.htm
上海澜兴制药机械有限公司的商铺,http://shanghai01274835.11467.com
上海先成机械设备有限公司,http:////www.11467.com/shanghai/co/654983.htm
上海先成机械设备有限公司的商铺,http://shanghai0654983.11467.com
扬州市致宝机械有限公司,http:////www.11467.com/yangzhou/co/109093.htm
扬州市致宝机械有限公司的商铺,http://yangzhou0109093.11467.com
宁波意德西专用设备科技有限公司,http:////www.11467.com/cixi/co/30266.htm
宁波意德西专用设备科技有限公司的商铺,http://cixi030266.11467.com
章丘鸿广机械有限公司,http:////www.11467.com/jinan/co/146115.htm
章丘鸿广机械有限公司的商铺,http://jinan0146115.11467.com
江阴市力仁机械制造有限公司,http:////www.11467.com/wuxi/co/243437.htm
江阴市力仁机械制造有限公司的商铺,http://wuxi0243437.11467.com
乌鲁木齐斯凯偙机电设备有限公司,http:////www.11467.com/wulumuqi/co/103641.htm
乌鲁木齐斯凯偙机电设备有限公司的商铺,http://wulumuqi0103641.11467.com
武汉市蔡甸区森华机电经营部,http:////www.11467.com/wuhan/co/117531.htm
武汉市蔡甸区森华机电经营部的商铺,http://wuhan0117531.11467.com
湘潭市恒欣实业有限公司,http:////www.11467.com/xiangtan/co/24265.htm
湘潭市恒欣实业有限公司的商铺,http://xiangtan024265.11467.com
新乡市牧野区金鼎机械厂,http:////www.11467.com/xinxiang/co/31257.htm
新乡市牧野区金鼎机械厂的商铺,http://xinxiang031257.11467.com
天津正拓机械设备有限公司,http:////www.11467.com/tianjin/co/211838.htm
天津正拓机械设备有限公司的商铺,http://tianjin0211838.11467.com
沈阳铭坤输送设备有限公司,http:////www.11467.com/qiye/93201672.htm
沈阳铭坤输送设备有限公司的商铺,http://93201672.b2b.11467.com
河南省黄河防爆起重机有限公司,http:////www.11467.com/xinxiang/co/13164.htm
河南省黄河防爆起重机有限公司的商铺,http://xinxiang013164.11467.com
广州市天地利金属制品有限公司,http:////www.11467.com/guangzhou/co/434098.htm
广州市天地利金属制品有限公司的商铺,http://guangzhou0434098.11467.com
佛山市巨石集尘机器有限公司,http:////www.11467.com/foshan/co/341186.htm
佛山市巨石集尘机器有限公司的商铺,http://foshan0341186.11467.com
东莞市清溪五星通用机械设备厂,http:////www.11467.com/dongguan/co/481800.htm
东莞市清溪五星通用机械设备厂的商铺,http://dongguan0481800.11467.com
石城县富仁达矿山设备厂,http:////www.11467.com/ganzhou/co/34943.htm
石城县富仁达矿山设备厂的商铺,http://ganzhou034943.11467.com
泊头市迈特水泥机械有限公司,http:////www.11467.com/cangzhou/co/61905.htm
泊头市迈特水泥机械有限公司的商铺,http://cangzhou061905.11467.com
枣强县强盛玻璃钢制品厂,http:////www.11467.com/hengshui/co/27198.htm
枣强县强盛玻璃钢制品厂的商铺,http://hengshui027198.11467.com
安徽省阜阳市速发机械有限责任公司,http:////www.11467.com/fuyang/co/24719.htm
安徽省阜阳市速发机械有限责任公司的商铺,http://fuyang024719.11467.com
河南东盛压缩机有限公司,http:////www.11467.com/jiaozuo/co/21112.htm
河南东盛压缩机有限公司的商铺,http://jiaozuo021112.11467.com
鹤壁市鑫盈通用振动机械有限公司,http:////www.11467.com/hebi/co/8781.htm
鹤壁市鑫盈通用振动机械有限公司的商铺,http://hebi08781.11467.com
淄博特迅输送机械设备有限公司,http:////www.11467.com/zibo/co/104877.htm
淄博特迅输送机械设备有限公司的商铺,http://zibo0104877.11467.com
新乡市科豪机械设备有限公司,http:////www.11467.com/xinxiang/co/32125.htm
新乡市科豪机械设备有限公司的商铺,http://xinxiang032125.11467.com
河南省英大机械制造有限公司,http:////www.11467.com/xinxiang/co/32595.htm
河南省英大机械制造有限公司的商铺,http://xinxiang032595.11467.com
石家庄赛佰特科技有限公司,http:////www.11467.com/shijiazhuang/co/76743.htm
石家庄赛佰特科技有限公司的商铺,http://shijiazhuang076743.11467.com
东莞市横沥亿佐五金店,http:////www.11467.com/dongguan/co/555834.htm
东莞市横沥亿佐五金店的商铺,http://dongguan0555834.11467.com
河南高峰重工机械有限公司,http:////www.11467.com/zhengzhou/co/148202.htm
河南高峰重工机械有限公司的商铺,http://zhengzhou0148202.11467.com
深圳市华清机电设备有限公司,http:////www.11467.com/shenzhen/co/495032.htm
深圳市华清机电设备有限公司的商铺,http://shenzhen0495032.11467.com
上海冠猴输送设备有限公司,http:////www.11467.com/shanghai/co/309358.htm
上海冠猴输送设备有限公司的商铺,http://shanghai0309358.11467.com
福州市仓山区祥发环保设备经营部,http:////www.11467.com/fuzhou/co/131510.htm
福州市仓山区祥发环保设备经营部的商铺,http://fuzhou0131510.11467.com
广州启山制冷设备有限公司,http:////www.11467.com/guangzhou/co/458045.htm
广州启山制冷设备有限公司的商铺,http://guangzhou0458045.11467.com
广州市星科机电设备有限公司,http:////www.11467.com/guangzhou/co/457256.htm
广州市星科机电设备有限公司的商铺,http://guangzhou0457256.11467.com
杭州德尔风机设备有限公司,http:////www.11467.com/hangzhou/co/206952.htm
杭州德尔风机设备有限公司的商铺,http://hangzhou0206952.11467.com
株洲市三江建材机械制造有限公司,http:////www.11467.com/zhuzhou/co/33923.htm
株洲市三江建材机械制造有限公司的商铺,http://zhuzhou033923.11467.com
扬州利尔达自动化设备有限公司,http:////www.11467.com/yangzhou/co/106967.htm
扬州利尔达自动化设备有限公司的商铺,http://yangzhou0106967.11467.com
广东恒鑫智能装备股份有限公司,http:////www.11467.com/zhongshan/co/188036.htm
广东恒鑫智能装备股份有限公司的商铺,http://zhongshan0188036.11467.com
新乡市天丰振动机械有限公司,http:////www.11467.com/xinxiang/co/26775.htm
新乡市天丰振动机械有限公司的商铺,http://xinxiang026775.11467.com
徐州逐日测控科技有限公司,http:////www.11467.com/xuzhou/co/82975.htm
徐州逐日测控科技有限公司的商铺,http://xuzhou082975.11467.com
东莞市佛尔盛机电科技有限公司,http:////www.11467.com/dongguan/co/119314.htm
东莞市佛尔盛机电科技有限公司的商铺,http://dongguan0119314.11467.com
东莞市佰力机械配件有限公司,http:////www.11467.com/dongguan/co/492775.htm
东莞市佰力机械配件有限公司的商铺,http://dongguan0492775.11467.com
浙江金风节能建材有限公司,http:////www.11467.com/shaoxing/co/127159.htm
浙江金风节能建材有限公司的商铺,http://shaoxing0127159.11467.com
江门市新会区翔威风机设备有限公司,http:////www.11467.com/jiangmen/co/116714.htm
江门市新会区翔威风机设备有限公司的商铺,http://jiangmen0116714.11467.com
东莞市北驼输送带有限公司,http:////www.11467.com/dongguan/co/139468.htm
东莞市北驼输送带有限公司的商铺,http://dongguan0139468.11467.com
常州蒙特环境科技有限公司,http:////www.11467.com/changzhou/co/149042.htm
常州蒙特环境科技有限公司的商铺,http://changzhou0149042.11467.com
郑州华宏机械设备有限公司,http:////www.11467.com/zhengzhou/co/112670.htm
郑州华宏机械设备有限公司的商铺,http://zhengzhou0112670.11467.com
广州市鸿汇环保科技有限公司,http:////www.11467.com/guangzhou/co/27188.htm
广州市鸿汇环保科技有限公司的商铺,http://guangzhou027188.11467.com
广州市新护神光电子科技有限公司,http:////www.11467.com/guangzhou/co/457582.htm
广州市新护神光电子科技有限公司的商铺,http://guangzhou0457582.11467.com
广州鑫中航机电设备有限公司,http:////www.11467.com/guangzhou/co/247351.htm
广州鑫中航机电设备有限公司的商铺,http://guangzhou0247351.11467.com
广州隆邦自动化控制设备有限公司,http:////www.11467.com/guangzhou/co/460892.htm
广州隆邦自动化控制设备有限公司的商铺,http://guangzhou0460892.11467.com
王兆合(个体经营),http:////www.11467.com/hengshui/co/42941.htm
王兆合(个体经营)的商铺,http://hengshui042941.11467.com
武汉市中林园林有限公司,http:////www.11467.com/wuhan/co/53046.htm
武汉市中林园林有限公司的商铺,http://wuhan053046.11467.com
淄博凯智贸易有限公司,http:////www.11467.com/zibo/co/93101.htm
淄博凯智贸易有限公司的商铺,http://zibo093101.11467.com
泊头昊天环保机械设备有限公司,http:////www.11467.com/cangzhou/co/87614.htm
泊头昊天环保机械设备有限公司的商铺,http://cangzhou087614.11467.com
厦门南方天鹅压缩机有限公司,http:////www.11467.com/xiamen/co/24781.htm
厦门南方天鹅压缩机有限公司的商铺,http://xiamen024781.11467.com
苏州双祺自动化设备有限公司,http:////www.11467.com/suzhou/co/237435.htm
苏州双祺自动化设备有限公司的商铺,http://suzhou0237435.11467.com
杭州神扇电子有限公司,http:////www.11467.com/hangzhou/co/391417.htm
杭州神扇电子有限公司的商铺,http://hangzhou0391417.11467.com
济南奥美联亚工矿设备有限公司,http:////www.11467.com/jinan/co/81708.htm
济南奥美联亚工矿设备有限公司的商铺,http://jinan081708.11467.com
于跃玉(个体经营),http:////www.11467.com/linyi/co/107108.htm
于跃玉(个体经营)的商铺,http://linyi0107108.11467.com
广州市越秀区广信机电工程公司,http:////www.11467.com/guangzhou/co/117580.htm
广州市越秀区广信机电工程公司的商铺,http://guangzhou0117580.11467.com
东莞市世翔精密机械制造有限公司,http:////www.11467.com/dongguan/co/414459.htm
东莞市世翔精密机械制造有限公司的商铺,http://dongguan0414459.11467.com
深圳市金鸿达传动设备有限公司,http:////www.11467.com/shenzhen/co/121303.htm
深圳市金鸿达传动设备有限公司的商铺,http://shenzhen0121303.11467.com
新乡市永清筛分机械有限公司,http:////www.11467.com/xinxiang/co/19402.htm
新乡市永清筛分机械有限公司的商铺,http://xinxiang019402.11467.com
河北商祺环保科技有限公司,http:////www.11467.com/hengshui/co/29330.htm
河北商祺环保科技有限公司的商铺,http://hengshui029330.11467.com
青岛奥贝机械有限公司,http:////www.11467.com/qingdao/co/68726.htm
青岛奥贝机械有限公司的商铺,http://qingdao068726.11467.com
泰州雪旺制冷设备有限公司,http:////www.11467.com/taizhoushi/co/26287.htm
泰州雪旺制冷设备有限公司的商铺,http://taizhoushi026287.11467.com
泰安市鲁中锅炉成套设备有限公司,http:////www.11467.com/taian/co/25649.htm
泰安市鲁中锅炉成套设备有限公司的商铺,http://taian025649.11467.com
苏州众力仪表有限公司,http:////www.11467.com/suzhou/co/239403.htm
苏州众力仪表有限公司的商铺,http://suzhou0239403.11467.com
上海旻峰电力设备有限公司,http:////www.11467.com/shanghai/co/247623.htm
上海旻峰电力设备有限公司的商铺,http://shanghai0247623.11467.com
苏州斯锐奇机器人有限公司,http:////www.11467.com/suzhou/co/404898.htm
