北京金都泰拓冶金技术研究有限公司,http:////www.11467.com/beijing/co/695445.htm
北京市昌益和机械制造有限责任公司,http:////www.11467.com/beijing/co/517545.htm
北京鑫汇胜达水利机械有限公司,http:////www.11467.com/beijing/co/709351.htm
湖州骏豪输送设备有限公司,http:////www.11467.com/beijing/co/697955.htm
北京航天实华化工设备有限公司,http:////www.11467.com/beijing/co/698212.htm
上海柏定信息科技有限公司,http:////www.11467.com/shanghai/co/1057950.htm
上海宝偶自动化系统设备有限公司 销售部,http:////www.11467.com/shanghai/co/804688.htm
上海富大胶带制品有限公司,http:////www.11467.com/shanghai/co/214905.htm
上海麦科贸易发展有限公司（销售部 ）,http:////www.11467.com/shanghai/co/668821.htm
上海凯睿达机电设备有限公司,http:////www.11467.com/shanghai/co/668810.htm
康和商事株式会社,http:////www.11467.com/shanghai/co/1010078.htm
上海康科传动设备有限公司,http:////www.11467.com/shanghai/co/1054977.htm
上海龙士路桥机械设备有限公司,http:////www.11467.com/shanghai/co/1050214.htm
上海科茸传动输送设备有限公司,http:////www.11467.com/shanghai/co/1052486.htm
上海科茸塑料链条链板有限公司,http:////www.11467.com/shanghai/co/1052485.htm
上海科茸输送配件有限公司,http:////www.11467.com/shanghai/co/1052911.htm
上海千始输送带有限公司,http:////www.11467.com/shanghai/co/1045197.htm
上海纽创机械电子有限公司 业务三部,http:////www.11467.com/shanghai/co/1052798.htm
上海民生机械设备有限公司,http:////www.11467.com/shanghai/co/1051570.htm
上海泰格尔机械设备有限公司,http:////www.11467.com/shanghai/co/1055021.htm
上海西古自动化设备公司,http:////www.11467.com/shanghai/co/884668.htm
上海伟声输送机械设备有限公司,http:////www.11467.com/shanghai/co/317173.htm
上海昂睿实业有限公司,http:////www.11467.com/shanghai/co/1055022.htm
秦华自动化设备(上海)有限公司,http:////www.11467.com/shanghai/co/1054598.htm
上海珏鑫机电工程有限公司,http:////www.11467.com/shanghai/co/804734.htm
苏州大力神起重运输机械制造有限公司,http:////www.11467.com/shanghai/co/804683.htm
上海装车机厂,http:////www.11467.com/shanghai/co/1051573.htm
上海佐尔链条有限公司,http:////www.11467.com/shanghai/co/1051572.htm
先进完美的输送机械(西古)有限公司,http:////www.11467.com/shanghai/co/1048165.htm
上海珍笑塑料链条有限公司,http:////www.11467.com/shanghai/co/1053965.htm
扎巴科(上海)包装机械有限公司,http:////www.11467.com/shanghai/co/1055019.htm
上海禹鼎设备电子有限公司,http:////www.11467.com/shanghai/co/1055023.htm
上海瓦纳自动化设备有限公司,http:////www.11467.com/shanghai/co/1048759.htm
上海珍笑输送设备(实业)有限公司,http:////www.11467.com/shanghai/co/1057709.htm
上海益梓机械设备有限公司,http:////www.11467.com/shanghai/co/1048756.htm
上海何氏实业有限公司PET塑料瓶剥标机,http:////www.11467.com/shanghai/co/1051541.htm
天津市轻工装备研究所,http:////www.11467.com/tianjin/co/136461.htm
安徽省桐城市皖中输送设备制造有限公司,http:////www.11467.com/anqing/co/25054.htm
桐城市神力输送设备有限公司,http:////www.11467.com/anqing/co/35657.htm
鞍山市兴达实业公司,http:////www.11467.com/anshan/co/43181.htm
鞍钢矿山附企工业尼龙厂营销部,http:////www.11467.com/anshan/co/70634.htm
鞍钢民企二炼钢福利厂,http:////www.11467.com/anshan/co/41894.htm
荣成市电机厂鞍山经销处,http:////www.11467.com/anshan/co/10750.htm
鞍山市腾鳌特区东源建材机械厂,http:////www.11467.com/anshan/co/36079.htm
林州市宏润工矿配件有限责任公司,http:////www.11467.com/anyang/co/35887.htm
汤阴县泰山缓冲设备有限公司,http:////www.11467.com/anyang/co/36149.htm
志远通讯有限公司,http:////www.11467.com/anyang/co/26644.htm
河南昌达粮油输送机械厂,http:////www.11467.com/anyang/co/27832.htm
林州市众鑫机械工业有限公司,http:////www.11467.com/anyang/co/36893.htm
广西百色锦华机械有限公司,http:////www.11467.com/baise/co/10901.htm
广西百色市富昌机械工程有限责任公司,http:////www.11467.com/baise/co/10918.htm
保定华瑞橡胶有限公司,http:////www.11467.com/baoding/co/80409.htm
高碑店市京津风机厂,http:////www.11467.com/baoding/co/44333.htm
河北博傲橡胶制品有限公司（销售部）,http:////www.11467.com/baoding/co/57512.htm
河北阜城县输送机厂,http:////www.11467.com/baoding/co/57565.htm
保定川宇橡胶机带制造有限公司,http:////www.11467.com/baoding/co/88837.htm
保定宏泰管式输送机械制造有限公司,http:////www.11467.com/baoding/co/63751.htm
保定亚华橡胶有限公司,http:////www.11467.com/baoding/co/34770.htm
保定东翔橡胶机带制造有限公司,http:////www.11467.com/baoding/co/89701.htm
保定京德风机制造有限公司,http:////www.11467.com/baoding/co/82255.htm
河北瑞元丰橡胶有限公司,http:////www.11467.com/baoding/co/81595.htm
保定鑫达输送设备有限公司,http:////www.11467.com/baoding/co/81042.htm
保定橡六胶带有限公司,http:////www.11467.com/baoding/co/80408.htm
河北华安橡胶公司业务科,http:////www.11467.com/baoding/co/57517.htm
河北蠡县天合输送设备有限公司,http:////www.11467.com/baoding/co/80131.htm
保定东亿橡胶机带有限公司,http:////www.11467.com/baoding/co/81043.htm
华日橡胶有限公司,http:////www.11467.com/baoding/co/81338.htm
博野县鑫达托辊厂,http:////www.11467.com/baoding/co/81041.htm
高碑店市力达风机厂,http:////www.11467.com/baoding/co/44283.htm
河北顺达胶带有限公司,http:////www.11467.com/baoding/co/80626.htm
涿州市粮油机械厂,http:////www.11467.com/baoding/co/37733.htm
博野县民兴橡胶厂,http:////www.11467.com/baoding/co/79910.htm
恒隆轴承公司,http:////www.11467.com/baotou/co/24623.htm
裕丰良友粮机厂,http:////www.11467.com/baotou/co/24624.htm
北海市恒力通风机制造有限公司,http:////www.11467.com/beihai/co/14685.htm
蚌埠市恒力压缩机有限公司,http:////www.11467.com/bengbu/co/27764.htm
本溪东远输送机配件厂,http:////www.11467.com/benxi/co/28992.htm
兄弟矿山运输实业有限公司,http:////www.11467.com/benxi/co/29005.htm
潍坊千源盐化设备有限公司,http:////www.11467.com/binzhou/co/20189.htm
山东省博兴县雅康食品设备厂,http:////www.11467.com/binzhou/co/35775.htm
亳州市宏丰供水设备有限公司,http:////www.11467.com/bozhou/co/8871.htm
河北通达机床附件有限公司,http:////www.11467.com/cangzhou/co/60163.htm
河北诚鑫数控机械附件有限公司,http:////www.11467.com/cangzhou/co/45782.htm
河北省盐山县源发输送机械厂,http:////www.11467.com/cangzhou/co/58782.htm
盐山博达输送机械制造厂,http:////www.11467.com/cangzhou/co/56294.htm
任丘市富鑫链轮齿轮有限公司,http:////www.11467.com/cangzhou/co/60839.htm
河北鑫恒兴机床附件制造有限公司,http:////www.11467.com/cangzhou/co/61967.htm
沧州富盛新型机床附件制造有限公司,http:////www.11467.com/cangzhou/co/41154.htm
沧州市华恒钢管有限公司销售部,http:////www.11467.com/cangzhou/co/61033.htm
盐山县东风矿山机械制造有限公司,http:////www.11467.com/cangzhou/co/49666.htm
盐山县凯利达管件有限公司,http:////www.11467.com/cangzhou/co/56296.htm
泊头盛康环保有限公司,http:////www.11467.com/cangzhou/co/60170.htm
盐山云辉机床护罩有限公司,http:////www.11467.com/cangzhou/co/58754.htm
沧州赛达机床部件有限公司,http:////www.11467.com/cangzhou/co/58750.htm
沧州祥瑞机床设备公司,http:////www.11467.com/cangzhou/co/59271.htm
河北衡水华鑫机床附件公司,http:////www.11467.com/cangzhou/co/41566.htm
河北渤海输送设备有限公司,http:////www.11467.com/cangzhou/co/40437.htm
沧州博川数控设备防护用品有限公司,http:////www.11467.com/cangzhou/co/58108.htm
山东宏晟机床附件有限公司,http:////www.11467.com/cangzhou/co/62490.htm
沧州华宝机械制造有限公司销售部,http:////www.11467.com/cangzhou/co/58764.htm
沧州天锐速控机床附件制造有限公司,http:////www.11467.com/cangzhou/co/45860.htm
黄骅市中意玻璃钢厂,http:////www.11467.com/cangzhou/co/46451.htm
沧州精创精密机床附件有限公司,http:////www.11467.com/cangzhou/co/62638.htm
海河传动齿轮厂,http:////www.11467.com/cangzhou/co/60169.htm
沧州市弘晨管道装备有限公司,http:////www.11467.com/cangzhou/co/47165.htm
沧州金鑫数控机床配件制造有限公司业务部,http:////www.11467.com/cangzhou/co/45861.htm
盐山县凯顺输送机械设备有限公司,http:////www.11467.com/cangzhou/co/56045.htm
盐山县凯玉输送机械设备制造厂,http:////www.11467.com/cangzhou/co/59286.htm
泊头市鸿海油泵制造厂,http:////www.11467.com/cangzhou/co/62493.htm
沧州市东方拖链制造有限公司销售部,http:////www.11467.com/cangzhou/co/41584.htm
东浩机床附件有限公司,http:////www.11467.com/cangzhou/co/58710.htm
盐山县盛钢输送机械有限公司,http:////www.11467.com/cangzhou/co/59753.htm
任丘市金鑫齿轮厂,http:////www.11467.com/cangzhou/co/59752.htm
泊头顺祥环保设备有限公司,http:////www.11467.com/cangzhou/co/61342.htm
沧州恒信机械制造有限公司-销售部,http:////www.11467.com/cangzhou/co/41580.htm
河北华尧吉通机械设备制造有限公司,http:////www.11467.com/cangzhou/co/49655.htm
张九尧（个体经营）,http:////www.11467.com/cangzhou/co/45781.htm
河北朋诚环保科技有限公司,http:////www.11467.com/cangzhou/co/62267.htm
泊头市荣昌实型铸造厂,http:////www.11467.com/cangzhou/co/50524.htm
华夏机床附件有限公司,http:////www.11467.com/cangzhou/co/62641.htm
河北泊头捷宇石油管道设备有限公司,http:////www.11467.com/cangzhou/co/61228.htm
河北沧州环保除尘设备有限公司,http:////www.11467.com/cangzhou/co/58647.htm
沧州鑫源泰钢管集团有限公司,http:////www.11467.com/cangzhou/co/40431.htm
长春市宽城日杂经销部,http:////www.11467.com/changchun/co/68549.htm
长春东北输送设备制造有限公司销售部,http:////www.11467.com/changchun/co/73420.htm
绿园区金德粮机设备制造厂,http:////www.11467.com/changchun/co/69255.htm
长春市源森汽车塑料件厂,http:////www.11467.com/changchun/co/73421.htm
长春市元头机械有限公司,http:////www.11467.com/changchun/co/73362.htm
常德常通空压机厂,http:////www.11467.com/changde/co/188.htm
湖南若达机械科技有限公司,http:////www.11467.com/changde/co/31251.htm
常德市空压机总厂（常通压缩机厂）,http:////www.11467.com/changde/co/31189.htm
长沙赛普尔自动化工程设备有限公司技术部,http:////www.11467.com/changsha/co/69814.htm
长沙市九合机电成套设备有限公司,http:////www.11467.com/changsha/co/84925.htm
长沙欧耀电器科技有限公司,http:////www.11467.com/changsha/co/132178.htm
长沙荣亮机电设备有限公司,http:////www.11467.com/changsha/co/84934.htm
长沙市星航机械有限公司,http:////www.11467.com/changsha/co/114388.htm
长沙辽富电梯有限公司　销售部,http:////www.11467.com/changsha/co/82332.htm
长沙市雨花区湘盛空压机经营部,http:////www.11467.com/changsha/co/86247.htm
长沙市鑫圭机电贸易有限公司,http:////www.11467.com/changsha/co/118011.htm
长沙市雨花区华湘机械厂,http:////www.11467.com/changsha/co/82327.htm
湖南力普吉实业有限公司,http:////www.11467.com/changsha/co/82195.htm
长沙双赢罗茨鼓风机有限责任公司,http:////www.11467.com/changsha/co/121722.htm
长沙爱铮压缩机有限公司,http:////www.11467.com/changsha/co/121612.htm
长沙信然机电有限公司,http:////www.11467.com/changsha/co/120271.htm
长沙市曾祥环保设备有限公司,http:////www.11467.com/changsha/co/104277.htm
长沙市湖大石水气力设备厂,http:////www.11467.com/changsha/co/82194.htm
长沙盛隆机械有限公司东北分公司,http:////www.11467.com/changsha/co/82335.htm
长沙美一环保节能设备有限公司,http:////www.11467.com/changsha/co/82202.htm
湖南省长沙鸿雁实业有限公司,http:////www.11467.com/changsha/co/81907.htm
金石装修公司,http:////www.11467.com/changsha/co/82330.htm
华泰重工制造有限公司,http:////www.11467.com/changsha/co/82329.htm
长沙川菱电梯配件有限公司,http:////www.11467.com/changsha/co/82333.htm
湖南翔宏机电设备有限公司,http:////www.11467.com/changsha/co/82213.htm
山西易通集团有限公司,http:////www.11467.com/changzhi/co/26132.htm
长治市星海机械制造有限公司,http:////www.11467.com/changzhi/co/26122.htm
山西凤凰胶带有限公司销售部,http:////www.11467.com/changzhi/co/26118.htm
长治市潞安合力机械有限责任公司,http:////www.11467.com/changzhi/co/17957.htm
常州欧顿电子自控设备有限公司(干燥设备分公司）,http:////www.11467.com/changzhou/co/102238.htm
常州迈鸿机电设备有限公司,http:////www.11467.com/changzhou/co/106821.htm
常州佳王精密机械有限公司,http:////www.11467.com/changzhou/co/102242.htm
常州飞雪冷冻设备有限公司,http:////www.11467.com/changzhou/co/105361.htm
常州艾达液位科技有限公司,http:////www.11467.com/changzhou/co/52798.htm
常州蓝港大件起重运输有限公司,http:////www.11467.com/changzhou/co/149478.htm
常州徽腾机械制造有限公司,http:////www.11467.com/changzhou/co/147749.htm
常州恒明环境科技有限公司,http:////www.11467.com/changzhou/co/89670.htm
常州市武进依科表面技术有限公司,http:////www.11467.com/changzhou/co/59484.htm
常州市新安水利风机有限公司,http:////www.11467.com/changzhou/co/90255.htm
常州瑞博机械有限公司,http:////www.11467.com/changzhou/co/102067.htm
常州市金葵花机械有限公司,http:////www.11467.com/changzhou/co/88642.htm
常州市腾鸿机械有限公司,http:////www.11467.com/changzhou/co/109902.htm
常州市浩诺电子设备厂,http:////www.11467.com/changzhou/co/33019.htm
常州市苏风机械厂,http:////www.11467.com/changzhou/co/80253.htm
常州市艾尔兰特传动机械有限公司,http:////www.11467.com/changzhou/co/129568.htm
常州正隆科技有限公司,http:////www.11467.com/changzhou/co/88004.htm
常州展飞机房设备厂,http:////www.11467.com/changzhou/co/121374.htm
常州中达科技有限公司,http:////www.11467.com/changzhou/co/102071.htm
常州巴斯汀传动科技有限公司,http:////www.11467.com/changzhou/co/151496.htm
常州市元涛机械制造厂,http:////www.11467.com/changzhou/co/88664.htm
常州市康安环保设备有限公司,http:////www.11467.com/changzhou/co/17623.htm
常州市新力压铸有限公司,http:////www.11467.com/changzhou/co/86193.htm
常州市嘉文环保设备有限公司,http:////www.11467.com/changzhou/co/89621.htm
江苏吉福机械制造有限公司,http:////www.11467.com/changzhou/co/89184.htm
常州市南江减速机有限公司,http:////www.11467.com/changzhou/co/62099.htm
常州贵鼎机电贸易有限公司,http:////www.11467.com/changzhou/co/88893.htm
湖州普新机械厂常州公司,http:////www.11467.com/changzhou/co/102241.htm
常州谐瑞机械有限公司,http:////www.11467.com/changzhou/co/149124.htm
常州瑞光喷雾化器厂,http:////www.11467.com/changzhou/co/102246.htm
东莞市长安鑫隆机械设备经营部,http:////www.11467.com/dongguan/co/29857.htm
东莞锋利盛机电有限公司(销售部),http:////www.11467.com/dongguan/co/127530.htm
东莞宏扬机电有限公司,http:////www.11467.com/dongguan/co/119008.htm
东莞市超煜风机有限公司,http:////www.11467.com/dongguan/co/414136.htm
东莞建佳电机有限公司,http:////www.11467.com/dongguan/co/272544.htm
东莞市搏金自动化机电设备有限公司,http:////www.11467.com/dongguan/co/534390.htm
东莞市高泰塑料制品有限公司,http:////www.11467.com/dongguan/co/472142.htm
东莞市茶山星日塑胶模具厂,http:////www.11467.com/dongguan/co/396857.htm
东莞市华强制冷设备工厂,http:////www.11467.com/dongguan/co/127232.htm
东莞市福特合金工具有限公司（业务部）,http:////www.11467.com/dongguan/co/298062.htm
东莞东正机械有限公司,http:////www.11467.com/dongguan/co/234097.htm
东莞市大岭山爱动力工业皮带厂,http:////www.11467.com/dongguan/co/187171.htm
东莞市达昌冷冻机电工程有限公司,http:////www.11467.com/dongguan/co/131485.htm
大和田塑胶机械实业有限公司,http:////www.11467.com/dongguan/co/249006.htm
东莞市厚街庆科自动化设备厂,http:////www.11467.com/dongguan/co/121613.htm
东莞市长安丛博自动化设备厂,http:////www.11467.com/dongguan/co/123381.htm
东莞市格美制冷设备有限公司,http:////www.11467.com/dongguan/co/120690.htm
东莞市冠捷机电有限公司,http:////www.11467.com/dongguan/co/356178.htm
东莞市巨椿五金机械有限公司,http:////www.11467.com/dongguan/co/234791.htm
东莞市萨尼艾气体设备有限公司,http:////www.11467.com/dongguan/co/503548.htm
东莞市坤盛精密机械有限公司,http:////www.11467.com/dongguan/co/479565.htm
东莞市清溪镇鑫旺卷闸门维修店,http:////www.11467.com/dongguan/co/234105.htm
东莞市三洋电梯有限公司深圳分公司,http:////www.11467.com/dongguan/co/506738.htm
东莞市美途电机科技有限公司,http:////www.11467.com/dongguan/co/134018.htm
东莞市敏欣机电有限公司,http:////www.11467.com/dongguan/co/129627.htm
东莞市黄江闽龙空压机经营部,http:////www.11467.com/dongguan/co/129729.htm
东莞市耐能机电设备有限公司,http:////www.11467.com/dongguan/co/459354.htm
东莞市铭通塑胶机械有限公司（营业部）,http:////www.11467.com/dongguan/co/120616.htm
东莞市南城汇志自动化设备经营部,http:////www.11467.com/dongguan/co/292400.htm
东莞市辉力机械设备有限公司,http:////www.11467.com/dongguan/co/234018.htm
东莞市升展机电设备有限公司,http:////www.11467.com/dongguan/co/439229.htm
东莞市石碣东泰五金机电经营部,http:////www.11467.com/dongguan/co/272181.htm
东莞市万江风雅空调设备经营部,http:////www.11467.com/dongguan/co/72414.htm
东莞市万江平达皮带经营部,http:////www.11467.com/dongguan/co/126926.htm
东莞市台德机械制造有限公司,http:////www.11467.com/dongguan/co/295068.htm
东莞市大朗嵘兴机械设备行,http:////www.11467.com/dongguan/co/131032.htm
东莞市塘厦佑华五金机械厂（河南郑州办事处）,http:////www.11467.com/dongguan/co/279684.htm
东莞市塘厦硕宝空压机经营店,http:////www.11467.com/dongguan/co/62892.htm
东莞市裕本机械有限公司,http:////www.11467.com/dongguan/co/492310.htm
东莞市海威通用机械设备有限公司,http:////www.11467.com/dongguan/co/413044.htm
东莞市新研工业材料有限公司,http:////www.11467.com/dongguan/co/303632.htm
东莞市鑫伸自动化机械设备有限公司,http:////www.11467.com/dongguan/co/234760.htm
东莞市万江久井锅炉配件经营部,http:////www.11467.com/dongguan/co/241329.htm
东莞市日达致机电设备有限公司,http:////www.11467.com/dongguan/co/129575.htm
东莞市锐勤机械有限公司,http:////www.11467.com/dongguan/co/131028.htm
东莞市台瑞高精密机电有限公司,http:////www.11467.com/dongguan/co/133670.htm
东莞市建华精密机械有限公司业务部,http:////www.11467.com/dongguan/co/234784.htm
东莞市顺宇实业有限公司,http:////www.11467.com/dongguan/co/459554.htm
东莞市雅进自动化设备有限公司,http:////www.11467.com/dongguan/co/481704.htm
东莞市硕普机电设备有限公司,http:////www.11467.com/dongguan/co/127454.htm
江门市江海区携成机械有限公司,http:////www.11467.com/guangzhou/co/104275.htm
广州伟创风机制造有限公司,http:////www.11467.com/guangzhou/co/466224.htm
广州市广众空气压缩机有限公司,http:////www.11467.com/guangzhou/co/47716.htm
聆月塑胶机械厂,http:////www.11467.com/guangzhou/co/104337.htm
广州市珑鼎环保设备有限公司,http:////www.11467.com/guangzhou/co/111449.htm
广州翔鹰进出口有限公司,http:////www.11467.com/guangzhou/co/122195.htm
灵克科技（广州）有限公司,http:////www.11467.com/guangzhou/co/50850.htm
广州众昊机械设备有限公司销售部,http:////www.11467.com/guangzhou/co/279134.htm
温岭市松龙机电有限公司,http:////www.11467.com/guangzhou/co/432134.htm
广州宇跃自动化设备有限公司,http:////www.11467.com/guangzhou/co/67413.htm
广州市越秀区好丞风机电设备经营部,http:////www.11467.com/guangzhou/co/270095.htm
广州毓成汽车配件有限公司,http:////www.11467.com/guangzhou/co/234928.htm
广州市中浪机械科技有限公司,http:////www.11467.com/guangzhou/co/108858.htm
肇庆高迪空调设备有限公司,http:////www.11467.com/guangzhou/co/269806.htm
深圳市风顺机电设备有限公司,http:////www.11467.com/guangzhou/co/115218.htm
同创机械设备公司,http:////www.11467.com/guangzhou/co/248452.htm
广州市卓远机械有限公司,http:////www.11467.com/guangzhou/co/480048.htm
新锋自动化物流设备有限公司,http:////www.11467.com/guangzhou/co/278115.htm
广州市轩晟工业皮带有限公司,http:////www.11467.com/guangzhou/co/247790.htm
陕西皇城集团驻华南办事处,http:////www.11467.com/guangzhou/co/269925.htm
贵州朗之昆科技有限公司,http:////www.11467.com/guiyang/co/82841.htm
黑龙江比泽尔冷冻设备有限公司,http:////www.11467.com/haerbin/co/63117.htm
杭州风动工具制造有限公司,http:////www.11467.com/hangzhou/co/40079.htm
杭州长润空压机设备有限公司,http:////www.11467.com/hangzhou/co/212312.htm
杭州福来机械配件有限公司,http:////www.11467.com/hangzhou/co/205912.htm
杭州共和汽车链传动有限公司,http:////www.11467.com/hangzhou/co/264947.htm
杭州华航风机有限公司,http:////www.11467.com/hangzhou/co/254605.htm
杭州大力机电设备有限公司,http:////www.11467.com/hangzhou/co/173022.htm
杭州彩虹橡胶制品有限公司,http:////www.11467.com/hangzhou/co/207839.htm
杭州余安机械设备工程有限公司,http:////www.11467.com/hangzhou/co/246427.htm
杭州合力橡胶有限公司,http:////www.11467.com/hangzhou/co/246917.htm
杭州金狮机械有限公司塘栖分公司,http:////www.11467.com/hangzhou/co/209092.htm
杭州临安力达机械有限责任公司,http:////www.11467.com/hangzhou/co/144405.htm
杭州萧山所前世业五金机械经营部,http:////www.11467.com/hangzhou/co/310669.htm
杭州星友机械设备有限公司,http:////www.11467.com/hangzhou/co/208867.htm
杭州宏达机械工业有限公司,http:////www.11467.com/hangzhou/co/179064.htm
杭州灵格气体设备有限公司,http:////www.11467.com/hangzhou/co/185902.htm
杭州三峡机电有限公司,http:////www.11467.com/hangzhou/co/207553.htm
杭州康尼电梯有限公司,http:////www.11467.com/hangzhou/co/246936.htm
浙江旭鹏机械有限公司,http:////www.11467.com/hangzhou/co/251853.htm
杭州雷旭机械有限公司,http:////www.11467.com/hangzhou/co/256249.htm
杭州市宏伟涂装环保设备有限公司,http:////www.11467.com/hangzhou/co/294957.htm
杭州紫光风机有限公司,http:////www.11467.com/hangzhou/co/79576.htm
杭州硕实机械有限公司,http:////www.11467.com/hangzhou/co/249156.htm
浙江江南轻纺机电有限公司,http:////www.11467.com/hangzhou/co/206241.htm
杭州日欣建筑安装工程有限公司,http:////www.11467.com/hangzhou/co/254504.htm
杭州余杭区临平广成五金机电商行,http:////www.11467.com/hangzhou/co/209681.htm
上海林慧新能源科技有限公司,http:////www.11467.com/hanzhong/co/23404.htm
鹤壁市普晨振动机械有限责任公司,http:////www.11467.com/hebi/co/8756.htm
合肥乐瀚工业皮带有限公司,http:////www.11467.com/hefei/co/79897.htm
合肥市弘诚盛机械设备有限公司,http:////www.11467.com/hefei/co/119584.htm
金百饰丝网工艺制品公司,http:////www.11467.com/hengshui/co/19170.htm
河北省冀州市冀鑫水利机械厂销售部,http:////www.11467.com/hengshui/co/19103.htm
衡水奥隆液压橡塑制品有限公司业务部,http:////www.11467.com/hengshui/co/18870.htm
河北巨鑫输送工程有限公司,http:////www.11467.com/hengshui/co/33834.htm
河北远东输送机械有限公司,http:////www.11467.com/hengshui/co/22066.htm
衡阳永和机械设备有限公司,http:////www.11467.com/hengyang/co/26378.htm
深圳市宝安区顺昌机电设备商行,http:////www.11467.com/huizhou/co/71148.htm
湖州信盛机械设备有限公司,http:////www.11467.com/huzhou/co/50569.htm
吴兴齐威机械加工厂,http:////www.11467.com/huzhou/co/63290.htm
湖州艺高机械制造有限公司,http:////www.11467.com/huzhou/co/46709.htm
湖州城区南新五金加工厂,http:////www.11467.com/huzhou/co/50241.htm
湖州亚力机械设备有限公司,http:////www.11467.com/huzhou/co/67023.htm
湖州德马铃木工业设备有限公司,http:////www.11467.com/huzhou/co/50343.htm
江门市新会区会城宏正五金服务店,http:////www.11467.com/jiangmen/co/81514.htm
蓬江区环通机电经营部,http:////www.11467.com/jiangmen/co/114136.htm
焦作市新立康输送机械有限公司,http:////www.11467.com/jiaozuo/co/13277.htm
嘉兴市东安高分子材料有限公司,http:////www.11467.com/jiaxing/co/92363.htm
