衡阳睿焱机械科技有限公司的商铺,http://yiyang022681.11467.com
西安诺亚机电有限公司,http:////www.11467.com/xian/co/46937.htm
西安诺亚机电有限公司的商铺,http://xian046937.11467.com
厦门海斯顿工贸有限公司,http:////www.11467.com/xiamen/co/12524.htm
厦门海斯顿工贸有限公司的商铺,http://xiamen012524.11467.com
徐州新力建材机械制造厂,http:////www.11467.com/xuzhou/co/46352.htm
徐州新力建材机械制造厂的商铺,http://xuzhou046352.11467.com
新乡市汇鑫矿山设备有限公司,http:////www.11467.com/xinxiang/co/21824.htm
新乡市汇鑫矿山设备有限公司的商铺,http://xinxiang021824.11467.com
盐城汇鸿供水设备有限公司,http:////www.11467.com/yancheng/co/78598.htm
盐城汇鸿供水设备有限公司的商铺,http://yancheng078598.11467.com
烟台市福山区金华振动盘机械厂,http:////www.11467.com/yantai/co/125106.htm
烟台市福山区金华振动盘机械厂的商铺,http://yantai0125106.11467.com
漳州市将帅工业设备有限公司,http:////www.11467.com/zhangzhou/co/43908.htm
漳州市将帅工业设备有限公司的商铺,http://zhangzhou043908.11467.com
郑州同昌机械设备有限公司,http:////www.11467.com/zhengzhou/co/148051.htm
郑州同昌机械设备有限公司的商铺,http://zhengzhou0148051.11467.com
郑州圣特机械制造有限公司,http:////www.11467.com/zhengzhou/co/174223.htm
郑州圣特机械制造有限公司的商铺,http://zhengzhou0174223.11467.com
郑州利科洗涤设备有限公司,http:////www.11467.com/zhengzhou/co/94814.htm
郑州利科洗涤设备有限公司的商铺,http://zhengzhou094814.11467.com
郑州市金水区浙兴达机电商行,http:////www.11467.com/zhengzhou/co/118386.htm
郑州市金水区浙兴达机电商行的商铺,http://zhengzhou0118386.11467.com
郑州山河路桥重型机械有限公司,http:////www.11467.com/zhengzhou/co/93533.htm
郑州山河路桥重型机械有限公司的商铺,http://zhengzhou093533.11467.com
郑州鑫盛复合肥设备有限公司,http:////www.11467.com/zhengzhou/co/151015.htm
郑州鑫盛复合肥设备有限公司的商铺,http://zhengzhou0151015.11467.com
珠海市丰力机电有限公司,http:////www.11467.com/zhuhai/co/98046.htm
珠海市丰力机电有限公司的商铺,http://zhuhai098046.11467.com
淄博钰强机械厂,http:////www.11467.com/zibo/co/76087.htm
淄博钰强机械厂的商铺,http://zibo076087.11467.com
朝阳格林重型机械科技有限公司,http:////www.11467.com/beijing/co/145569.htm
朝阳格林重型机械科技有限公司的商铺,http://beijing0145569.11467.com
珠海市正成机械加工厂,http:////www.11467.com/zhuhai/co/63946.htm
珠海市正成机械加工厂的商铺,http://zhuhai063946.11467.com
中山凯正电子设备有限公司,http:////www.11467.com/zhongshan/co/81464.htm
中山凯正电子设备有限公司的商铺,http://zhongshan081464.11467.com
淄博佳昊电动滚筒有限公司,http:////www.11467.com/zibo/co/76517.htm
淄博佳昊电动滚筒有限公司的商铺,http://zibo076517.11467.com
中山市嘉誉电子电器有限公司,http:////www.11467.com/zhongshan/co/81259.htm
中山市嘉誉电子电器有限公司的商铺,http://zhongshan081259.11467.com
淄博市博山宏发机械厂,http:////www.11467.com/zibo/co/62314.htm
淄博市博山宏发机械厂的商铺,http://zibo062314.11467.com
中山市坦洲镇冠立机械设备商行,http:////www.11467.com/zhongshan/co/81293.htm
中山市坦洲镇冠立机械设备商行的商铺,http://zhongshan081293.11467.com
中山市古镇环海五金设备厂,http:////www.11467.com/zhongshan/co/74015.htm
中山市古镇环海五金设备厂的商铺,http://zhongshan074015.11467.com
淄博金龙机械有限责任公司,http:////www.11467.com/zibo/co/74457.htm
淄博金龙机械有限责任公司的商铺,http://zibo074457.11467.com
淄博银丰机械有限公司,http:////www.11467.com/zibo/co/74450.htm
淄博银丰机械有限公司的商铺,http://zibo074450.11467.com
中山市小榄镇奥力电器厂,http:////www.11467.com/zhongshan/co/81221.htm
中山市小榄镇奥力电器厂的商铺,http://zhongshan081221.11467.com
镇江顺风机械有限公司,http:////www.11467.com/zhenjiang/co/40695.htm
镇江顺风机械有限公司的商铺,http://zhenjiang040695.11467.com
镇江宏洋起重机械有限公司,http:////www.11467.com/zhenjiang/co/49732.htm
镇江宏洋起重机械有限公司的商铺,http://zhenjiang049732.11467.com
镇江东昇机械有限公司,http:////www.11467.com/zhenjiang/co/46091.htm
镇江东昇机械有限公司的商铺,http://zhenjiang046091.11467.com
上海市浦东新区川沙新镇智成建材商店,http:////www.11467.com/zhongshan/co/74011.htm
上海市浦东新区川沙新镇智成建材商店的商铺,http://zhongshan074011.11467.com
淄博强力电动滚筒有限公司,http:////www.11467.com/zibo/co/74323.htm
淄博强力电动滚筒有限公司的商铺,http://zibo074323.11467.com
临淄区朱台镇旭升风机厂,http:////www.11467.com/zibo/co/76423.htm
临淄区朱台镇旭升风机厂的商铺,http://zibo076423.11467.com
辉力机械设备有限公司,http:////www.11467.com/shanghai/co/317099.htm
辉力机械设备有限公司的商铺,http://shanghai0317099.11467.com
上海峰辉物流设备有限公司,http:////www.11467.com/shanghai/co/1057708.htm
上海峰辉物流设备有限公司的商铺,http://shanghai01057708.11467.com
淄博星硕机械制造有限公司,http:////www.11467.com/zibo/co/66861.htm
淄博星硕机械制造有限公司的商铺,http://zibo066861.11467.com
郑州建基机械设备有限公司,http:////www.11467.com/zhengzhou/co/148407.htm
郑州建基机械设备有限公司的商铺,http://zhengzhou0148407.11467.com
镇江天创机械有限公司,http:////www.11467.com/zhenjiang/co/26694.htm
镇江天创机械有限公司的商铺,http://zhenjiang026694.11467.com
中山市叁迪输送设备有限公司,http:////www.11467.com/zhongshan/co/43498.htm
中山市叁迪输送设备有限公司的商铺,http://zhongshan043498.11467.com
上海采扬塑料制品有限公司,http:////www.11467.com/shanghai/co/1052800.htm
上海采扬塑料制品有限公司的商铺,http://shanghai01052800.11467.com
中山市固莱尔机电设备有限公司,http:////www.11467.com/zhongshan/co/43620.htm
中山市固莱尔机电设备有限公司的商铺,http://zhongshan043620.11467.com
中山市国中输送设备制造厂,http:////www.11467.com/zhongshan/co/143661.htm
中山市国中输送设备制造厂的商铺,http://zhongshan0143661.11467.com
淄博市博山鸿达特种电机厂,http:////www.11467.com/zibo/co/18517.htm
淄博市博山鸿达特种电机厂的商铺,http://zibo018517.11467.com
淄博爱拓商贸有限公司,http:////www.11467.com/zibo/co/90465.htm
淄博爱拓商贸有限公司的商铺,http://zibo090465.11467.com
中山市小浪底五金电器有限公司,http:////www.11467.com/zhongshan/co/45337.htm
中山市小浪底五金电器有限公司的商铺,http://zhongshan045337.11467.com
中山市东升镇汇创输送带厂,http:////www.11467.com/zhongshan/co/44015.htm
中山市东升镇汇创输送带厂的商铺,http://zhongshan044015.11467.com
淄博市周村永昌风机厂,http:////www.11467.com/zibo/co/27976.htm
淄博市周村永昌风机厂的商铺,http://zibo027976.11467.com
中山市联跃通风设备有限公司,http:////www.11467.com/zhongshan/co/41174.htm
中山市联跃通风设备有限公司的商铺,http://zhongshan041174.11467.com
上海帝顿机械设备有限公司,http:////www.11467.com/shanghai/co/1044511.htm
上海帝顿机械设备有限公司的商铺,http://shanghai01044511.11467.com
淄博新华风机有限公司,http:////www.11467.com/zibo/co/27692.htm
淄博新华风机有限公司的商铺,http://zibo027692.11467.com
淄博鲁泽矿山机械有限公司,http:////www.11467.com/zibo/co/66401.htm
淄博鲁泽矿山机械有限公司的商铺,http://zibo066401.11467.com
上海徽灿自动化科技有限公司,http:////www.11467.com/shanghai/co/1065544.htm
上海徽灿自动化科技有限公司的商铺,http://shanghai01065544.11467.com
中山市铭创自动化设备有限公司,http:////www.11467.com/zhongshan/co/152717.htm
中山市铭创自动化设备有限公司的商铺,http://zhongshan0152717.11467.com
淄博市博山区聚兴电动滚筒厂,http:////www.11467.com/zibo/co/62706.htm
淄博市博山区聚兴电动滚筒厂的商铺,http://zibo062706.11467.com
淄博市博山瑞昌建材设备厂,http:////www.11467.com/zibo/co/15082.htm
淄博市博山瑞昌建材设备厂的商铺,http://zibo015082.11467.com
株洲翔龙塑业有限公司,http:////www.11467.com/zhuzhou/co/34260.htm
株洲翔龙塑业有限公司的商铺,http://zhuzhou034260.11467.com
中山市华东输送机械制造有限公司,http:////www.11467.com/zhongshan/co/74014.htm
中山市华东输送机械制造有限公司的商铺,http://zhongshan074014.11467.com
郑州誉利机电设备有限公司,http:////www.11467.com/zhengzhou/co/148043.htm
郑州誉利机电设备有限公司的商铺,http://zhengzhou0148043.11467.com
上海酷控工业自动化设备有限公司,http:////www.11467.com/shanghai/co/1237504.htm
上海酷控工业自动化设备有限公司的商铺,http://shanghai01237504.11467.com
天津市乐基电动滚筒有限公司,http:////www.11467.com/tianjin/co/255418.htm
天津市乐基电动滚筒有限公司的商铺,http://tianjin0255418.11467.com
宁津县庆泽网带机械有限公司,http:////www.11467.com/dezhou/co/72345.htm
宁津县庆泽网带机械有限公司的商铺,http://dezhou072345.11467.com
宁津县顺鑫网链输送机械有限公司,http:////www.11467.com/dezhou/co/64514.htm
宁津县顺鑫网链输送机械有限公司的商铺,http://dezhou064514.11467.com
保定占伟机械设备制造有限公司,http:////www.11467.com/baoding/co/109792.htm
保定占伟机械设备制造有限公司的商铺,http://baoding0109792.11467.com
沧州鑫润环保设备制造有限公司,http:////www.11467.com/cangzhou/co/90604.htm
沧州鑫润环保设备制造有限公司的商铺,http://cangzhou090604.11467.com
重庆库斯特机电设备有限公司,http:////www.11467.com/chongqing/co/324857.htm
重庆库斯特机电设备有限公司的商铺,http://chongqing0324857.11467.com
南京金熙旺酒店设备部门有限公司,http:////www.11467.com/nanjing/co/184755.htm
南京金熙旺酒店设备部门有限公司的商铺,http://nanjing0184755.11467.com
上海众严机电科技有限公司,http:////www.11467.com/shanghai/co/1274421.htm
上海众严机电科技有限公司的商铺,http://shanghai01274421.11467.com
上海卉肯传动系统有限公司,http:////www.11467.com/shanghai/co/1178938.htm
上海卉肯传动系统有限公司的商铺,http://shanghai01178938.11467.com
新乡市振升机械设备有限公司,http:////www.11467.com/xinxiang/co/48197.htm
新乡市振升机械设备有限公司的商铺,http://xinxiang048197.11467.com
河北吉迈特机床附件制造有限公司,http:////www.11467.com/cangzhou/co/119374.htm
河北吉迈特机床附件制造有限公司的商铺,http://cangzhou0119374.11467.com
湖州齐威机械设备有限公司,http:////www.11467.com/huzhou/co/74425.htm
湖州齐威机械设备有限公司的商铺,http://huzhou074425.11467.com
上海兆语实业有限公司,http:////www.11467.com/shanghai/co/1259958.htm
上海兆语实业有限公司的商铺,http://shanghai01259958.11467.com
南京市然熙达餐饮设备有限公司,http:////www.11467.com/nanjing/co/184691.htm
南京市然熙达餐饮设备有限公司的商铺,http://nanjing0184691.11467.com
沧州英杰机械制造有限公司销售部,http:////www.11467.com/cangzhou/co/100002.htm
沧州英杰机械制造有限公司销售部的商铺,http://cangzhou0100002.11467.com
保定川宇橡胶输送带制造有限公司,http:////www.11467.com/baoding/co/111634.htm
保定川宇橡胶输送带制造有限公司的商铺,http://baoding0111634.11467.com
上海千始输送设备有限公司,http:////www.11467.com/shanghai/co/1161634.htm
上海千始输送设备有限公司的商铺,http://shanghai01161634.11467.com
上海千始皮带设备有限公司,http:////www.11467.com/shanghai/co/1259937.htm
上海千始皮带设备有限公司的商铺,http://shanghai01259937.11467.com
河北庄禹水利机械有限公司,http:////www.11467.com/xintai/co/103183.htm
河北庄禹水利机械有限公司的商铺,http://xintai0103183.11467.com
南京金熙旺酒店设备责任有限公司,http:////www.11467.com/nanjing/co/184705.htm
南京金熙旺酒店设备责任有限公司的商铺,http://nanjing0184705.11467.com
南京市金熙旺酒店设备责任有限公司,http:////www.11467.com/nanjing/co/184734.htm
南京市金熙旺酒店设备责任有限公司的商铺,http://nanjing0184734.11467.com
长兴正力物流机械有限公司,http:////www.11467.com/huzhou/co/80174.htm
长兴正力物流机械有限公司的商铺,http://huzhou080174.11467.com
沧州骏驰环保设备有限公司,http:////www.11467.com/cangzhou/co/101398.htm
沧州骏驰环保设备有限公司的商铺,http://cangzhou0101398.11467.com
扬州治远环保设备有限公司,http:////www.11467.com/qiye/22245618.htm
扬州治远环保设备有限公司的商铺,http://22245618.b2b.11467.com
江阴华尔威机械有限公司,http:////www.11467.com/wuxi/co/274752.htm
江阴华尔威机械有限公司的商铺,http://wuxi0274752.11467.com
佛山市加德纳机械配件有限公司汕头分公司,http:////www.11467.com/shantou/co/173996.htm
佛山市加德纳机械配件有限公司汕头分公司的商铺,http://shantou0173996.11467.com
临安紅焱机械链条有限公司,http:////www.11467.com/hangzhou/co/436430.htm
临安紅焱机械链条有限公司的商铺,http://hangzhou0436430.11467.com
广东汇利兴精工科技机械有限公司,http:////www.11467.com/dongguan/co/613724.htm
广东汇利兴精工科技机械有限公司的商铺,http://dongguan0613724.11467.com
西安三德机械自动化设备有限公司,http:////www.11467.com/xian/co/154892.htm
西安三德机械自动化设备有限公司的商铺,http://xian0154892.11467.com
安徽吸粮机技术研发中心,http:////www.11467.com/fuyang/co/39735.htm
安徽吸粮机技术研发中心的商铺,http://fuyang039735.11467.com
沈阳汇嶐电力设备有限公司,http:////www.11467.com/shenyang/co/107430.htm
沈阳汇嶐电力设备有限公司的商铺,http://shenyang0107430.11467.com
成都合唯机械设备有限公司,http:////www.11467.com/chengdu/co/283202.htm
成都合唯机械设备有限公司的商铺,http://chengdu0283202.11467.com
河北省泊头市冀兴机械有限公司,http:////www.11467.com/beijing/co/762563.htm
河北省泊头市冀兴机械有限公司的商铺,http://beijing0762563.11467.com
上海嵘翔实业有限公司,http:////www.11467.com/shanghai/co/1274750.htm
上海嵘翔实业有限公司的商铺,http://shanghai01274750.11467.com
济南华工液压机械有限公司,http:////www.11467.com/jinan/co/150135.htm
济南华工液压机械有限公司的商铺,http://jinan0150135.11467.com
重庆市金铮自动冲压设备有限公司,http:////www.11467.com/chongqing/co/276971.htm
重庆市金铮自动冲压设备有限公司的商铺,http://chongqing0276971.11467.com
宜都首运机械有限公司,http:////www.11467.com/yichang/co/59469.htm
宜都首运机械有限公司的商铺,http://yichang059469.11467.com
东莞市起鑫自动化科技有限公司,http:////www.11467.com/dongguan/co/615289.htm
东莞市起鑫自动化科技有限公司的商铺,http://dongguan0615289.11467.com
山东泽宇重工科技有限公司,http:////www.11467.com/jinan/co/142307.htm
山东泽宇重工科技有限公司的商铺,http://jinan0142307.11467.com
广州旺美游乐设备有限公司,http:////www.11467.com/guangzhou/co/634028.htm
广州旺美游乐设备有限公司的商铺,http://guangzhou0634028.11467.com
永年县河北铺树宏输送机配件门市,http:////www.11467.com/handan/co/103664.htm
永年县河北铺树宏输送机配件门市的商铺,http://handan0103664.11467.com
河北占禹水利机械有限公司,http:////www.11467.com/qiye/23942261.htm
河北占禹水利机械有限公司的商铺,http://23942261.b2b.11467.com
冀州市强禹水利机械厂,http:////www.11467.com/hengshui/co/66827.htm
冀州市强禹水利机械厂的商铺,http://hengshui066827.11467.com
上海威梓机械设备有限公司,http:////www.11467.com/shanghai/co/1217392.htm
上海威梓机械设备有限公司的商铺,http://shanghai01217392.11467.com
江西长龙泵业有限责任公司,http:////www.11467.com/xinyu/co/13406.htm
江西长龙泵业有限责任公司的商铺,http://xinyu013406.11467.com
杭州顺光自动化设备有限公司,http:////www.11467.com/hangzhou/co/450407.htm
杭州顺光自动化设备有限公司的商铺,http://hangzhou0450407.11467.com
南京雅酷传动设备有限公司,http:////www.11467.com/nanjing/co/184776.htm
南京雅酷传动设备有限公司的商铺,http://nanjing0184776.11467.com
南京金熙旺酒店设备有限公司销售部,http:////www.11467.com/nanjing/co/184829.htm
南京金熙旺酒店设备有限公司销售部的商铺,http://nanjing0184829.11467.com
成都川东华宇自动化科技有限公司,http:////www.11467.com/chengdu/co/283067.htm
河南省恩邦机械设备有限公司,http:////www.11467.com/xinxiang/co/60660.htm
河南省恩邦机械设备有限公司的商铺,http://xinxiang060660.11467.com
河北建岭输送机械制造有限公司,http:////www.11467.com/hengshui/co/86107.htm
河北建岭输送机械制造有限公司的商铺,http://hengshui086107.11467.com
新乡市通鸣机械设备有限公司,http:////www.11467.com/qiye/93078056.htm
新乡市通鸣机械设备有限公司的商铺,http://93078056.b2b.11467.com
大连奥森电梯有限公司,http:////www.11467.com/dalian/co/83585.htm
大连奥森电梯有限公司的商铺,http://dalian083585.11467.com
无锡七窍商贸有限公司,http:////www.11467.com/wuxi/co/275883.htm
无锡七窍商贸有限公司的商铺,http://wuxi0275883.11467.com
深圳市祥丰自动化设备有限公司,http:////www.11467.com/shenzhen/co/733426.htm
深圳市祥丰自动化设备有限公司的商铺,http://shenzhen0733426.11467.com
上海韩亚给水环保设备厂,http:////www.11467.com/shanghai/co/247590.htm
上海韩亚给水环保设备厂的商铺,http://shanghai0247590.11467.com
大连福瑞达科技有限公司,http:////www.11467.com/dalian/co/24500.htm
大连福瑞达科技有限公司的商铺,http://dalian024500.11467.com
青岛兴达利峰机械设备有限公司,http:////www.11467.com/qingdao/co/124451.htm
青岛兴达利峰机械设备有限公司的商铺,http://qingdao0124451.11467.com
鞍山托林顿轴承有限公司,http:////www.11467.com/anshan/co/70454.htm
鞍山托林顿轴承有限公司的商铺,http://anshan070454.11467.com
湖南港建输送设备有限公司,http:////www.11467.com/changsha/co/85193.htm
湖南港建输送设备有限公司的商铺,http://changsha085193.11467.com
莱川机械科技（昆山)有限公司,http:////www.11467.com/suzhou/co/404118.htm
莱川机械科技（昆山)有限公司的商铺,http://suzhou0404118.11467.com
广州市耐欧机械设备有限公司,http:////www.11467.com/guangzhou/co/753165.htm
广州市耐欧机械设备有限公司的商铺,http://guangzhou0753165.11467.com
山东宁津县浩宇输送机械制造厂,http:////www.11467.com/dezhou/co/73023.htm
山东宁津县浩宇输送机械制造厂的商铺,http://dezhou073023.11467.com
宁津正捷网链输送设备有限公司,http:////www.11467.com/dezhou/co/73419.htm
宁津正捷网链输送设备有限公司的商铺,http://dezhou073419.11467.com
苏州市相城区黄桥福尔鑫自动化设备厂,http:////www.11467.com/suzhou/co/404247.htm
苏州市相城区黄桥福尔鑫自动化设备厂的商铺,http://suzhou0404247.11467.com
东莞市邵鑫智能自动化有限公司,http:////www.11467.com/qiye/93312952.htm
东莞市邵鑫智能自动化有限公司的商铺,http://93312952.b2b.11467.com
南京新晟旺机器设备有限公司,http:////www.11467.com/nanjing/co/184987.htm
南京新晟旺机器设备有限公司的商铺,http://nanjing0184987.11467.com
四川省德阳市旌宏机器制造有限公司,http:////www.11467.com/deyang/co/19405.htm
四川省德阳市旌宏机器制造有限公司的商铺,http://deyang019405.11467.com
东莞市东城炫锋电子商行,http:////www.11467.com/dongguan/co/139472.htm
东莞市东城炫锋电子商行的商铺,http://dongguan0139472.11467.com
东莞市瑞社机电设备工程有限公司,http:////www.11467.com/dongguan/co/468945.htm
东莞市瑞社机电设备工程有限公司的商铺,http://dongguan0468945.11467.com
青岛橡一输送带有限公司,http:////www.11467.com/qingdao/co/191472.htm
青岛橡一输送带有限公司的商铺,http://qingdao0191472.11467.com
东莞市道滘波进通风设备经营部,http:////www.11467.com/dongguan/co/533757.htm
东莞市道滘波进通风设备经营部的商铺,http://dongguan0533757.11467.com
东莞市黄江美联自动化设备厂,http:////www.11467.com/dongguan/co/641920.htm
东莞市黄江美联自动化设备厂的商铺,http://dongguan0641920.11467.com
武汉安风机械设备有限公司,http:////www.11467.com/qiye/93376036.htm
武汉安风机械设备有限公司的商铺,http://93376036.b2b.11467.com
东莞市东孜五金机械有限公司,http:////www.11467.com/dongguan/co/278043.htm
东莞市东孜五金机械有限公司的商铺,http://dongguan0278043.11467.com
潍坊金达自动化设备有限公司,http:////www.11467.com/weifang/co/176293.htm
潍坊金达自动化设备有限公司的商铺,http://weifang0176293.11467.com
宁波杰士特自动化科技有限公司,http:////www.11467.com/ningbo/co/232277.htm
宁波杰士特自动化科技有限公司的商铺,http://ningbo0232277.11467.com
泊头市海红蕊机械设备制造有限公司,http:////www.11467.com/cangzhou/co/128732.htm
泊头市海红蕊机械设备制造有限公司的商铺,http://cangzhou0128732.11467.com
东莞市石碣鑫兴振动盘设备厂,http:////www.11467.com/dongguan/co/554602.htm
东莞市石碣鑫兴振动盘设备厂的商铺,http://dongguan0554602.11467.com
常州市岗机自动化设备有限公司,http:////www.11467.com/qiye/93314133.htm
常州市岗机自动化设备有限公司的商铺,http://93314133.b2b.11467.com
台州优亿自动化科技有限公司,http:////www.11467.com/qiye/93311615.htm
台州优亿自动化科技有限公司的商铺,http://93311615.b2b.11467.com
东莞市东弘环保工程有限公司,http:////www.11467.com/dongguan/co/556602.htm
东莞市东弘环保工程有限公司的商铺,http://dongguan0556602.11467.com
东莞市长安锐巧机械设备经营部,http:////www.11467.com/dongguan/co/513164.htm
东莞市长安锐巧机械设备经营部的商铺,http://dongguan0513164.11467.com
济宁千盛网络科技有限公司,http:////www.11467.com/jining/co/108085.htm
济宁千盛网络科技有限公司的商铺,http://jining0108085.11467.com
哈尔滨迅治电梯有限公司,http:////www.11467.com/haerbin/co/77462.htm
哈尔滨迅治电梯有限公司的商铺,http://haerbin077462.11467.com
上海鑫爵五金机械厂,http:////www.11467.com/shanghai/co/1304922.htm
上海鑫爵五金机械厂的商铺,http://shanghai01304922.11467.com
深圳市宝安区沙井志业机械设备厂,http:////www.11467.com/dongguan/co/556235.htm
深圳市宝安区沙井志业机械设备厂的商铺,http://dongguan0556235.11467.com
新乡市良工机械设备有限公司,http:////www.11467.com/xinxiang/co/57439.htm
新乡市良工机械设备有限公司的商铺,http://xinxiang057439.11467.com
北京海科康威科技有限公司,http:////www.11467.com/beijing/co/765030.htm
北京海科康威科技有限公司的商铺,http://beijing0765030.11467.com
宁津县英信网带网链厂,http:////www.11467.com/dezhou/co/50444.htm
宁津县英信网带网链厂的商铺,http://dezhou050444.11467.com
东莞市培鑫机电设备有限公司,http:////www.11467.com/dongguan/co/297596.htm
东莞市培鑫机电设备有限公司的商铺,http://dongguan0297596.11467.com
东莞市科冠机电有限公司,http:////www.11467.com/dongguan/co/256557.htm
东莞市科冠机电有限公司的商铺,http://dongguan0256557.11467.com
盐山县首昂输送机械有限公司,http:////www.11467.com/qiye/93081462.htm
盐山县首昂输送机械有限公司的商铺,http://93081462.b2b.11467.com
镇江式丹徒风机厂,http:////www.11467.com/zhenjiang/co/72883.htm
镇江式丹徒风机厂的商铺,http://zhenjiang072883.11467.com
东莞市神工自动化设备有限公司,http:////www.11467.com/dongguan/co/120412.htm
成都鑫明通起重吊装有限公司,http:////www.11467.com/chengdu/co/211765.htm
东莞永圣机械设备有限公司,http:////www.11467.com/shenzhen/co/372747.htm
西安腾宋机电设备有限公司,http:////www.11467.com/xian/co/95655.htm
天津斯巴克斯机电有限公司,http:////www.11467.com/tianjin/co/13997.htm
惠州市康普斯机电设备有限公司,http:////www.11467.com/huizhou/co/57896.htm
惠州市康普斯机电设备有限公司的商铺,http://huizhou057896.11467.com
汕头市金明电器有限公司,http:////www.11467.com/shantou/co/11039.htm
汕头市金明电器有限公司的商铺,http://shantou011039.11467.com
贵阳远大风机制造有限公司,http:////www.11467.com/guiyang/co/18221.htm
贵阳远大风机制造有限公司的商铺,http://guiyang018221.11467.com
