天津三英焊业股份有限公司,http://www.11467.com/tianjin/co/179148.htm
山东郓城宏东挂车制造有限公司,http://www.11467.com/jining/co/92513.htm
四川锦航汽车销售有限公司,http://www.11467.com/chengdu/co/142759.htm
重庆凯尔国际冷链物流发展有限公司,http://www.11467.com/chongqing/co/266566.htm
瓦房店广浩冶金轴承制造有限公司,http://www.11467.com/changzhou/co/110669.htm
南昌弘达齿轮有限公司,http://www.11467.com/nanchang/co/89471.htm
南通唯耀铁链有限公司,http://www.11467.com/nantong/co/107551.htm
无锡市万利达冷弯型钢有限公司,http://www.11467.com/wuxi/co/199992.htm
深圳市宏伟盛科技有限公司,http://www.11467.com/shenzhen/co/806083.htm
镇江依诺电子材料有限公司,http://www.11467.com/zhenjiang/co/49591.htm
茂名市恒泰交通设施有限公司,http://www.11467.com/maoming/co/40139.htm
深圳市科斯特工业设备有限公司,http://www.11467.com/shenzhen/co/311429.htm
北京通祥弘伟物流有限公司,http://www.11467.com/beijing/co/726144.htm
江苏汇力起重装备有限公司,http://www.11467.com/taizhoushi/co/48594.htm
南京东亨力鼎汽车尾板有限公司,http://www.11467.com/nanjing/co/82167.htm
滁州市明亮机械制造有限公司,http://www.11467.com/chuzhou/co/22604.htm
深圳市永致诚科技有限公司,http://www.11467.com/shenzhen/co/137218.htm
深圳市鼎汇工业设备有限公司,http://www.11467.com/shenzhen/co/724640.htm
安阳市德力专用汽车有限公司,http://www.11467.com/anyang/co/40828.htm
抚州顺诚交通设施有限公司,http://www.11467.com/fuzhoushi/co/28593.htm
河南省小红侠货运有限公司,http://www.11467.com/qiye/93132726.htm
苏州麦哈仓储设备有限公司,http://www.11467.com/suzhou/co/317219.htm
金华市贝特工贸有限公司,http://www.11467.com/jinhua/co/121799.htm
佛山市顺德区瑞仕拓运动用品有限公司,http://www.11467.com/foshan/co/306314.htm
冠县鸿孚交通设施有限公司,http://www.11467.com/liaocheng/co/75490.htm
上海启波物流有限公司,http://www.11467.com/shanghai/co/526314.htm
杭州华宇电瓶车有限公司,http://www.11467.com/hangzhou/co/181923.htm
常州市武进第二造船有限公司,http://www.11467.com/changzhou/co/97886.htm
天津市全顺搬家公司,http://www.11467.com/tianjin/co/64962.htm
青岛龙华物流有限公司,http://www.11467.com/qingdao/co/99665.htm
客到部有限责任公司,http://www.11467.com/shanghai/co/220194.htm
清河县泰瑞汽车配件有限公司,http://www.11467.com/xintai/co/56545.htm
深圳市恒通利达货架有限公司,http://www.11467.com/shenzhen/co/810900.htm
深圳市博胜五金制品有限公司,http://www.11467.com/shenzhen/co/304609.htm
江门新会德邦物流有限公司,http://www.11467.com/jiangmen/co/102945.htm
微山县顺风旅游客渡有限公司,http://www.11467.com/jining/co/56416.htm
鑫柯电子衡器维修公司,http://www.11467.com/datong/co/16215.htm
油罐电动葫芦石油焊罐专用环链电动葫芦专业生产有限公司,http://www.11467.com/baoding/co/63882.htm
洛阳昊陆公路设施有限公司,http://www.11467.com/luoyang/co/53202.htm
沛县翔驰挂车有限公司,http://www.11467.com/xuzhou/co/83315.htm
深圳市祥邦物流有限公司,http://www.11467.com/shenzhen/co/145934.htm
呼和浩特市天正农牧业有限公司,http://www.11467.com/huhehaote/co/25201.htm
天津市威美克自行车有限公司,http://www.11467.com/tianjin/co/9773.htm
四川久强科技有限公司,http://www.11467.com/chengdu/co/277518.htm
山东中化物流有限公司,http://www.11467.com/rizhao/co/39190.htm
威海天航游艇有限公司,http://www.11467.com/qiye/93079364.htm
随州盛远专用汽车销售有限公司,http://www.11467.com/suizhou/co/12433.htm
深圳市奔达科技有限公司,http://www.11467.com/shenzhen/co/757819.htm
江西固久金属制品有限公司,http://www.11467.com/yichun/co/44434.htm
无锡中凯交通设施工程有限公司,http://www.11467.com/wuxi/co/274948.htm
河北三国电动车有限公司,http://www.11467.com/langfang/co/28511.htm
清河县创力华钢绳有限公司,http://www.11467.com/xintai/co/24680.htm
淮安沪佳车业科技有限公司,http://www.11467.com/huaian/co/52824.htm
山东交通设施有限公司,http://www.11467.com/liaocheng/co/71913.htm
冠县第二运输有限责任公司,http://www.11467.com/liaocheng/co/58945.htm
常州亿昶道路安全设施有限公司,http://www.11467.com/changzhou/co/169095.htm
广州万隆华江物流有限公司,http://www.11467.com/dongguan/co/590009.htm
淮北路宝车业有限公司,http://www.11467.com/huaibei/co/12979.htm
衡水中铁建工程橡胶有限责任公司,http://www.11467.com/hengshui/co/15.htm
常州泰勒维克今创电子有限公司,http://www.11467.com/changzhou/co/98215.htm
向红信息有限公司,http://www.11467.com/dingxi/co/8004.htm
广东天元印刷有限公司,http://www.11467.com/dongguan/co/410390.htm
溧水县同兴机械有限公司,http://www.11467.com/nanjing/co/115192.htm
南京飞洋汽车电子有限责任公司,http://www.11467.com/nanjing/co/68539.htm
青岛聚隆昌机械设备有限公司,http://www.11467.com/qingdao/co/157157.htm
福建振宝机械有限公司,http://www.11467.com/quanzhou/co/130740.htm
衢州市鑫宏土工格栅有限公司,http://www.11467.com/quzhou/co/25075.htm
深圳市德镒盟电子有限公司,http://www.11467.com/shenzhen/co/450022.htm
徐州市天龙厨卫有限公司,http://www.11467.com/xuzhou/co/81946.htm
浙江半岛船业有限公司,http://www.11467.com/zhoushan/co/17466.htm
株洲齿轮有限责任公司,http://www.11467.com/zhuzhou/co/35051.htm
济南佰盛气动液压工程有限公司,http://www.11467.com/jinan/co/139739.htm
江西制氧机有限公司,http://www.11467.com/jiujiang/co/21263.htm
黑龙江省龙城专用车有限公司,http://www.11467.com/jixi/co/20364.htm
湖北大力专汽车制造有限公司,http://www.11467.com/suizhou/co/10558.htm
苏州雄大电机有限公司,http://www.11467.com/suzhou/co/206212.htm
厦门宏硕工贸有限公司,http://www.11467.com/xiamen/co/27626.htm
襄阳新中昌专用车有限公司,http://www.11467.com/xiangfan/co/44030.htm
湘潭时代线束有限公司,http://www.11467.com/xiangtan/co/28584.htm
广州方海交通设备有限公司,http://www.11467.com/guangzhou/co/456487.htm
佛山市南海永兴货运代理有限公司,http://www.11467.com/foshan/co/355452.htm
北京晴天彩虹文化用品有限公司,http://www.11467.com/beijing/co/710481.htm
沅陵县辰鑫运输有限公司,http://www.11467.com/huaihua/co/22341.htm
讯科科技有限公司,http://www.11467.com/anshan/co/74249.htm
安阳三和铁路器材有限公司,http://www.11467.com/anyang/co/26464.htm
吉林省凯罗帝晟木业有限公司,http://www.11467.com/changchun/co/72536.htm
常州市沪力起重机械有限公司,http://www.11467.com/changzhou/co/19546.htm
江苏理想工程材料有限公司,http://www.11467.com/changzhou/co/98250.htm
江苏足迹涂料有限公司,http://www.11467.com/changzhou/co/150373.htm
常州远洋贝米尔车业有限公司,http://www.11467.com/changzhou/co/43162.htm
江苏八达园林建设有限公司,http://www.11467.com/changzhou/co/114506.htm
常州市晨群铝业有限公司,http://www.11467.com/changzhou/co/129177.htm
成都新辉瑞达实业有限公司,http://www.11467.com/chengdu/co/141948.htm
成都市生元铁路物资有限公司,http://www.11467.com/chengdu/co/96618.htm
成都市众联诚商贸有限公司,http://www.11467.com/chengdu/co/111612.htm
德州市金鹏运输有限公司,http://www.11467.com/dezhou/co/33002.htm
东莞市正泰运输服务有限公司,http://www.11467.com/dongguan/co/79081.htm
山东东方曼商用车有限公司,http://www.11467.com/dongying/co/29571.htm
杭州森巴克车业有限公司,http://www.11467.com/hangzhou/co/240135.htm
衡水中杰金属制品有限公司,http://www.11467.com/hengshui/co/32593.htm
渤海船舶重工有限责任公司,http://www.11467.com/huludao/co/39280.htm
中国重型汽车集团济南大可汽车改装有限公司,http://www.11467.com/jinan/co/18856.htm
金华市恒新电梯配套有限公司,http://www.11467.com/jinhua/co/83019.htm
锦州博宇铁路设备有限公司,http://www.11467.com/jinzhou/co/43897.htm
南京煜飞科技有限公司,http://www.11467.com/nanjing/co/114921.htm
齐齐哈尔富铁轨枕有限公司,http://www.11467.com/qiqihaer/co/58472.htm
深圳市盛达辉物流有限公司,http://www.11467.com/shenzhen/co/299112.htm
苏州昇达光电科技有限公司,http://www.11467.com/suzhou/co/225758.htm
唐山市鑫康达钢铁有限公司,http://www.11467.com/tangshan/co/21011.htm
无锡市浦尚精密机械有限公司,http://www.11467.com/wuxi/co/174625.htm
陕西欧舒特汽车股份有限公司,http://www.11467.com/xian/co/18875.htm
烟台科大汽车设备有限公司,http://www.11467.com/yantai/co/123324.htm
聚鑫六轴五联动科技有限公司,http://www.11467.com/yongzhou/co/19034.htm
镇江市申茂机械有限公司,http://www.11467.com/zhenjiang/co/47999.htm
淄博现宇塑料有限公司,http://www.11467.com/zibo/co/71706.htm
上海飞机制造有限公司,http://www.11467.com/shanghai/co/1006582.htm
天津奥斯达电梯有限公司,http://www.11467.com/tianjin/co/187759.htm
易路达自行车(天津)有限公司,http://www.11467.com/tianjin/co/198410.htm
天津中远汽车贸易有限公司,http://www.11467.com/tianjin/co/88630.htm
山东盛润汽车有限公司,http://www.11467.com/jining/co/92330.htm
天津晟源秸秆模压制品有限公司,http://www.11467.com/tianjin/co/304470.htm
梁山宝华专用汽车制造有限公司,http://www.11467.com/jining/co/93980.htm
天津市天之星车业有限公司,http://www.11467.com/tianjin/co/308676.htm
成都银兆商贸有限公司,http://www.11467.com/chengdu/co/96456.htm
四川银河钢结构工程有限公司,http://www.11467.com/chengdu/co/81032.htm
大连天恒工程公司,http://www.11467.com/dalian/co/51136.htm
大连亿泽货运代理有限公司,http://www.11467.com/dalian/co/43722.htm
山东武城路达筑路机械有限公司,http://www.11467.com/dezhou/co/33004.htm
东莞市寮步吊车叉车服务公司,http://www.11467.com/dongguan/co/209602.htm
东莞景大精密橡胶工业有限公司,http://www.11467.com/dongguan/co/287976.htm
东莞市东溪纸业有限公司,http://www.11467.com/dongguan/co/7123.htm
东莞市鑫路翔改性沥青有限公司,http://www.11467.com/dongguan/co/66326.htm
东莞市万联仓储设备有限公司,http://www.11467.com/dongguan/co/73117.htm
东莞欣瑞精密模具有限公司,http://www.11467.com/dongguan/co/510199.htm
深圳市诚和昌实业有限公司,http://www.11467.com/dongguan/co/224712.htm
东升有限责任公司部门,http://www.11467.com/dongying/co/29745.htm
湖北鄂钢驰久钢板弹簧有限公司-市场部,http://www.11467.com/ezhou/co/10729.htm
佛山市南海区平洲平稳工业区佳美达自行车有限公司,http://www.11467.com/foshan/co/255779.htm
佛山市联运车队有限公司,http://www.11467.com/foshan/co/255669.htm
佛山市南海拓基木业有限公司,http://www.11467.com/foshan/co/219248.htm
广东天任车料有限公司,http://www.11467.com/foshan/co/242501.htm
广东佛山市新力电梯有限公司,http://www.11467.com/foshan/co/218058.htm
广州市泽日电梯设备有限公司,http://www.11467.com/foshan/co/301296.htm
江西贛州联合加工公司,http://www.11467.com/ganzhou/co/26736.htm
广梅汕铁路有限责任公司,http://www.11467.com/guangzhou/co/73581.htm
广州洛民塑料有限公司香港部,http://www.11467.com/guangzhou/co/302994.htm
广州市宝德利理容器材有限公司,http://www.11467.com/guangzhou/co/231994.htm
广州市山通货运代理有限公司,http://www.11467.com/guangzhou/co/224224.htm
广州市运力汽车运输有限公司（运力车厢厂）,http://www.11467.com/guangzhou/co/302624.htm
广州市盛兴科技有限公司_,http://www.11467.com/guangzhou/co/244858.htm
广州重元金属制品有限公司,http://www.11467.com/guangzhou/co/304645.htm
广州友联塑料纺织器材有限公司,http://www.11467.com/guangzhou/co/294303.htm
扬州市新天河绳业有限公司,http://www.11467.com/guangzhou/co/431438.htm
圆通速递有限公司广州分公司,http://www.11467.com/guangzhou/co/125455.htm
广州信晟货运代理有限公司（业务部）,http://www.11467.com/guangzhou/co/221979.htm
贵州维络交通科技有限公司,http://www.11467.com/guiyang/co/82888.htm
永年县凯旺电力金具有限公司,http://www.11467.com/handan/co/63370.htm
杭州佳丽奇车业有限公司,http://www.11467.com/hangzhou/co/213194.htm
杭州诺亚机械有限公司,http://www.11467.com/hangzhou/co/310755.htm
沃尔德体育用品有限公司,http://www.11467.com/hangzhou/co/240826.htm
杭州中瑞科技有限公司,http://www.11467.com/hangzhou/co/265027.htm
合肥创新汽车运输服务有限公司,http://www.11467.com/hefei/co/47518.htm
合肥昌河汽车有限责任公司,http://www.11467.com/hefei/co/5383.htm
衡水永信钢波纹涵管有限公司,http://www.11467.com/hengshui/co/41785.htm
衡水金驰蓄电池有限公司,http://www.11467.com/hengshui/co/20762.htm
河北衡水恒洋工程橡胶有限公司,http://www.11467.com/hengshui/co/20750.htm
山东金达挂车制造有限公司,http://www.11467.com/heze/co/34216.htm
山东大运汽车有限公司,http://www.11467.com/heze/co/34111.htm
富成达货运公司,http://www.11467.com/huizhou/co/64242.htm
嘉兴市亿亨机械设备有限公司,http://www.11467.com/jiaxing/co/84528.htm
山东恒新源机电化工设备制造有限公司,http://www.11467.com/jining/co/73807.htm
兰州新开元工程科技有限公司,http://www.11467.com/lanzhou/co/66321.htm
东敏玻璃钢制品公司,http://www.11467.com/lianyungang/co/29439.htm
山东凯迪捷专用车制造有限公司,http://www.11467.com/linyi/co/82040.htm
江苏苏海汽车贸易有限公司,http://www.11467.com/nanjing/co/69652.htm
南京赛福特汽车服务有限公司,http://www.11467.com/nanjing/co/24552.htm
吉宝(南通)船厂有限公司,http://www.11467.com/nantong/co/105174.htm
南通通盛船舶制造有限公司,http://www.11467.com/nantong/co/107993.htm
宁波市鄞州金琦瑞工艺品有限公司,http://www.11467.com/ningbo/co/86231.htm
福安市马头造船有限责任公司,http://www.11467.com/ningde/co/7347.htm
芳胜轮胎有限责任公司,http://www.11467.com/puyang/co/19646.htm
鸿达机械化工程有限公司,http://www.11467.com/qingdao/co/86228.htm
青岛海发船舶修配有限公司,http://www.11467.com/qingdao/co/84944.htm
青岛陆港市政工程有限公司,http://www.11467.com/qingdao/co/85878.htm
青岛和平国际贸易有限公司,http://www.11467.com/qingdao/co/86226.htm
沈阳奥迪斯流体技术有限责任公司,http://www.11467.com/shenyang/co/98496.htm
沈阳福全汽车半挂车维修有限公司,http://www.11467.com/shenyang/co/58792.htm
沈阳广捷货运代理有限公司业务部,http://www.11467.com/shenyang/co/59266.htm
深圳市创兴科电子公司,http://www.11467.com/shenzhen/co/300526.htm
深圳亨丰塑化材料有限公司（销售部）,http://www.11467.com/shenzhen/co/429347.htm
深圳市奥林士达自行车有限公司,http://www.11467.com/shenzhen/co/87715.htm
深圳博宇恒科技有限公司,http://www.11467.com/shenzhen/co/553810.htm
深圳市恒宇祥五金塑胶制品有限公司,http://www.11467.com/shenzhen/co/427624.htm
深圳市飞恒集装箱服务有限公司,http://www.11467.com/shenzhen/co/726554.htm
深圳市军辉国际贸易有限公司业务部,http://www.11467.com/shenzhen/co/312729.htm
深圳市快安捷国际速递有限公司,http://www.11467.com/shenzhen/co/552131.htm
深圳市凯拓精密模型有限公司,http://www.11467.com/shenzhen/co/789158.htm
深圳市敏实工业有限公司,http://www.11467.com/shenzhen/co/299314.htm
深圳市龙汇海实业有限公司,http://www.11467.com/shenzhen/co/113019.htm
深圳市迈瑞特电路科技有限公司(销售部),http://www.11467.com/shenzhen/co/306353.htm
深圳市展翔兴科技有限公司-业务部,http://www.11467.com/shenzhen/co/555171.htm
深圳市裕达通电子有限公司,http://www.11467.com/shenzhen/co/128324.htm
深圳市众聚达电子有限公司,http://www.11467.com/shenzhen/co/802941.htm
深圳市祥业实业有限公司,http://www.11467.com/shenzhen/co/310260.htm
深圳市万兆成机械设备有限公司,http://www.11467.com/shenzhen/co/801058.htm
深圳市神州龙物流公司,http://www.11467.com/shenzhen/co/301431.htm
深圳市致富商住集装箱有限公司,http://www.11467.com/shenzhen/co/779902.htm
兴华冠科技有限公司,http://www.11467.com/shenzhen/co/311574.htm
香港杰淇实业有限公司,http://www.11467.com/shenzhen/co/311807.htm
腾飞精密五金有限公司,http://www.11467.com/shenzhen/co/797097.htm
忆博通数码科技有限公司,http://www.11467.com/shenzhen/co/299724.htm
随州市盛星机械有限公司,http://www.11467.com/suizhou/co/8177.htm
湖北驰馭专用汽车贸易有限公司,http://www.11467.com/suizhou/co/7402.htm
湖北大力股份有限公司,http://www.11467.com/suizhou/co/7422.htm
随州天力汽车有限公司,http://www.11467.com/suizhou/co/11231.htm
湖北楚胜专用汽车有限公司 销售部,http://www.11467.com/suizhou/co/7074.htm
苏州恒野仓储物流设备有限公司,http://www.11467.com/suzhou/co/292828.htm
苏州昂鼎机械科技有限公司,http://www.11467.com/suzhou/co/269627.htm
苏州恒昇货运有限公司,http://www.11467.com/suzhou/co/296404.htm
苏州百捷物流有限公司,http://www.11467.com/suzhou/co/298980.htm
苏州市凯迪运输有限公司,http://www.11467.com/suzhou/co/223108.htm
苏州和平叉车有限公司,http://www.11467.com/suzhou/co/246181.htm
苏州市万利汽车货运有限公司,http://www.11467.com/suzhou/co/222671.htm
苏州市慧通塑胶有限公司.,http://www.11467.com/suzhou/co/222266.htm
苏州星科网络通信技术有限公司,http://www.11467.com/suzhou/co/223000.htm
浙江荣新工贸有限公司贸易部,http://www.11467.com/taizhou/co/86020.htm
靖江市海艺装饰材料有限公司,http://www.11467.com/taizhoushi/co/46183.htm
江苏蓝枫实业有限公司,http://www.11467.com/taizhoushi/co/30302.htm
唐山市路南彭氏工贸有限公司,http://www.11467.com/tangshan/co/75697.htm
民祥经贸有限公司,http://www.11467.com/weifang/co/82577.htm
威海天乘华轮特种带芯有限公司,http://www.11467.com/weihai/co/30319.htm
湖北坤海实业有限公司,http://www.11467.com/wuhan/co/146594.htm
安徽 芜湖 振华科技工业有限公司,http://www.11467.com/wuhu/co/22463.htm
江苏徐州富豪电动车有限公司,http://www.11467.com/wuxi/co/185642.htm
无锡发发车业有限公司,http://www.11467.com/wuxi/co/24689.htm
无锡益明蜂窝科技公司,http://www.11467.com/wuxi/co/185357.htm
无锡爱立特车业有限公司,http://www.11467.com/wuxi/co/178225.htm
无锡市飞越车业有限公司,http://www.11467.com/wuxi/co/24223.htm
无锡华利雅机车有限公司,http://www.11467.com/wuxi/co/143049.htm
无锡苏粤快运有限公司,http://www.11467.com/wuxi/co/200583.htm
厦门市长三角物流有限公司,http://www.11467.com/xiamen/co/42422.htm
厦门九利投资咨询有限公司,http://www.11467.com/xiamen/co/57837.htm
西安华盈科技有限公司销售部,http://www.11467.com/xian/co/72806.htm
襄樊市宝天机电设备有限公司,http://www.11467.com/xiangfan/co/31980.htm
河北邢久科技车业有限公司,http://www.11467.com/xintai/co/33905.htm
邢台美捷车业有限公司,http://www.11467.com/xintai/co/50518.htm
河南省新飞专用汽车有限公司,http://www.11467.com/xinxiang/co/21247.htm
万鸿车业有限公司,http://www.11467.com/xuchang/co/23315.htm
许昌瑞安电气设备有限公司,http://www.11467.com/xuchang/co/23178.htm
扬州清通散热器有限公司,http://www.11467.com/yangzhou/co/98824.htm
扬州航海附件有限公司,http://www.11467.com/yangzhou/co/81568.htm
宜昌市世纪旅行咨询有限公司,http://www.11467.com/yichang/co/34565.htm
镇江广普电器贸易有限公司,http://www.11467.com/zhenjiang/co/47943.htm
中山市东康生活电器有限公司-销售部,http://www.11467.com/zhongshan/co/63286.htm
舟山捷达船舶机械有限公司,http://www.11467.com/zhoushan/co/17467.htm
舟山市鑫亚船舶修造有限公司,http://www.11467.com/zhoushan/co/5280.htm
珠海亦家运输代理服务有限公司,http://www.11467.com/zhuhai/co/63866.htm
淄博赛优科技发展有限公司,http://www.11467.com/zibo/co/72845.htm
北京军电物资供应有限公司,http://www.11467.com/beijing/co/216307.htm
北京中瑞科技有限公司,http://www.11467.com/beijing/co/711419.htm
新国线运输集团北京京汉运输有限公司,http://www.11467.com/beijing/co/310665.htm
中环动力(北京)重型汽车有限公司,http://www.11467.com/beijing/co/592983.htm
上海恒贝包装材料有限公司,http://www.11467.com/shanghai/co/666015.htm
山东汶上谦诚木业有限公司上海直销处,http://www.11467.com/shanghai/co/315642.htm
上海成瑞集装箱服务有限公司,http://www.11467.com/shanghai/co/44741.htm
上海凌虹金属表面处理有限公司（浦西）,http://www.11467.com/shanghai/co/937534.htm
上海三斯自行车有限公司 加工经营部,http://www.11467.com/shanghai/co/666596.htm
上海聚欣工贸有限公司,http://www.11467.com/shanghai/co/804041.htm
安阳市宏泰铁路器材有限责任公司,http://www.11467.com/anyang/co/26466.htm
安阳奥丰车业有限责任公司,http://www.11467.com/anyang/co/28624.htm
沧州市信合集装箱制造有限公司,http://www.11467.com/cangzhou/co/61628.htm
中国上海精翔塑胶模具有限公司,http://www.11467.com/shanghai/co/315664.htm
上海易汇机械有限公司,http://www.11467.com/shanghai/co/315753.htm
天津君浩轴承有限公司,http://www.11467.com/tianjin/co/197208.htm
天津市固孚特机械设备科技有限公司,http://www.11467.com/tianjin/co/200244.htm
天津市津南区立达车队有限公司,http://www.11467.com/tianjin/co/162135.htm
天津华泰输送机有限公司,http://www.11467.com/tianjin/co/6882.htm
天津俊联船舶海洋工程技术有限公司,http://www.11467.com/tianjin/co/163160.htm
天津比尔莱斯运动器材有限公司国贸部,http://www.11467.com/tianjin/co/35647.htm
天津市枚霖自行车制造有限公司,http://www.11467.com/tianjin/co/180779.htm
天津市桐旺电动车业公司,http://www.11467.com/tianjin/co/15361.htm
江苏华耀机械有限公司,http://www.11467.com/tianjin/co/140300.htm
天津中交博迈科海洋船舶重工有限公司,http://www.11467.com/tianjin/co/162290.htm
天津市波音电动车有限公司,http://www.11467.com/tianjin/co/187861.htm
天津昊通工贸有限公司,http://www.11467.com/tianjin/co/15381.htm
天津市美跃工贸有限公司,http://www.11467.com/tianjin/co/178777.htm
中法合资天津劳尔工业有限公司,http://www.11467.com/tianjin/co/35735.htm
天津易豪自行车有限公司,http://www.11467.com/tianjin/co/301712.htm
茂名市茂南龙行天下物流有限公司,http://www.11467.com/maoming/co/44120.htm
广州鲁通物流公司,http://www.11467.com/guangzhou/co/550600.htm
广东顺德运群车业有限公司,http://www.11467.com/guangzhou/co/564697.htm
天津新华昌运输设备有限公司,http://www.11467.com/tianjin/co/305907.htm
中科华夏动力（天津）科技发展有限公司,http://www.11467.com/tianjin/co/308674.htm
天津润昆国际货运有限公司,http://www.11467.com/tianjin/co/308675.htm
天津联兴达自行车配件制造有限公司,http://www.11467.com/tianjin/co/308677.htm
上海中善物流有限公司,http://www.11467.com/shanghai/co/1115626.htm
广州市亿汇物流有限公司,http://www.11467.com/guangzhou/co/533884.htm
深圳市桂丰腾冠智能交通工程有限公司,http://www.11467.com/shenzhen/co/826675.htm
大连百顺搬家服务公司,http://www.11467.com/dalian/co/81183.htm
江西华通交通设施有限公司,http://www.11467.com/jiujiang/co/32738.htm
上海悦玺商贸有限公司,http://www.11467.com/shanghai/co/1161304.htm
和达土石方有限公司,http://www.11467.com/yongzhou/co/30776.htm
徐州沛县翔驰挂车有限公司,http://www.11467.com/xuzhou/co/91946.htm
山东特种专用车销售有限公司,http://www.11467.com/jinan/co/156984.htm
贵州冀星路桥材料有限公司,http://www.11467.com/zunyi/co/27389.htm
中山新荣程物流有限公司,http://www.11467.com/zhongshan/co/233442.htm
山西潞安矿业集团慈林山煤业有限公司青源型煤厂,http://www.11467.com/changzhi/co/26004.htm
常州市皇盛电气有限公司,http://www.11467.com/changzhou/co/148678.htm
阳平商贸有限公司,http://www.11467.com/changzhou/co/98496.htm
中贵货运公司,http://www.11467.com/chengdu/co/96600.htm
大连博通汽车俱乐部有限公司,http://www.11467.com/dalian/co/43205.htm
大连今冈船务有限公司,http://www.11467.com/dalian/co/43502.htm
大庆市紫杉运输有限责任公司,http://www.11467.com/daqing/co/39593.htm
山东金大路车业有限公司,http://www.11467.com/dezhou/co/32998.htm
东莞市顺成塑胶制品有限公司,http://www.11467.com/dongguan/co/478733.htm
金翔配送运输有限公司,http://www.11467.com/dongguan/co/210984.htm
日本电产日新香港有限公司,http://www.11467.com/dongguan/co/214404.htm
通天货运服务代理公司,http://www.11467.com/dongguan/co/210480.htm
