佛山运时达汽车配件有限公司,http://www.11467.com/foshan/co/217862.htm
钛美建设铝业有限公司,http://www.11467.com/foshan/co/218644.htm
福州精铖广告有限公司,http://www.11467.com/fuzhou/co/142194.htm
福州小东洋远输公司,http://www.11467.com/fuzhou/co/141310.htm
广州禾昌模具制造有限公司,http://www.11467.com/guangzhou/co/222310.htm
广州华冶钢材加工有限公司业务部,http://www.11467.com/guangzhou/co/240413.htm
广州联发自动变速箱有限公司,http://www.11467.com/guangzhou/co/303817.htm
广州诚泽机电设备有限公司,http://www.11467.com/guangzhou/co/228314.htm
广州市城际电子科技有限公司,http://www.11467.com/guangzhou/co/101003.htm
广州创科交通设施有限公司 市场部,http://www.11467.com/guangzhou/co/222298.htm
广州市华盛公司,http://www.11467.com/guangzhou/co/304732.htm
天津大田运输服务有限公司广州分公司,http://www.11467.com/guangzhou/co/223589.htm
桂林携联电子传媒有限公司销售部,http://www.11467.com/guilin/co/43059.htm
邯郸市日新汽车配件有限公司,http://www.11467.com/handan/co/54903.htm
杭州杭帅车业有限公司,http://www.11467.com/hangzhou/co/241709.htm
杭州安心搬家公司,http://www.11467.com/hangzhou/co/241181.htm
杭州运威轮胎有限公司,http://www.11467.com/hangzhou/co/243964.htm
杭州余杭宇通货运有限公司,http://www.11467.com/hangzhou/co/133247.htm
杭州天渡贸易有限公司(萧山),http://www.11467.com/hangzhou/co/240407.htm
浙江海联电子有限公司,http://www.11467.com/hangzhou/co/247664.htm
安徽顺丰贸易有限责任公司,http://www.11467.com/hefei/co/87789.htm
安徽科信玻璃钢有限公司,http://www.11467.com/hefei/co/2332.htm
中国储业国际汽车美容公司,http://www.11467.com/hefei/co/88089.htm
成武县禾海车业有限公司,http://www.11467.com/heze/co/42066.htm
内蒙古高等级公路建设开发有限公司,http://www.11467.com/huhehaote/co/25236.htm
内蒙古华伟商贸有限公司,http://www.11467.com/huhehaote/co/25257.htm
顺发机械公司,http://www.11467.com/huizhou/co/66581.htm
嘉兴海洲工贸有限公司,http://www.11467.com/jiaxing/co/83286.htm
嘉兴市英恒机械设备有限公司,http://www.11467.com/jiaxing/co/84527.htm
吉林市吉通科技有限公司,http://www.11467.com/jilinshi/co/78699.htm
济南利君轮胎销售有限公司销售部,http://www.11467.com/jinan/co/78634.htm
济南申通工贸有限公司,http://www.11467.com/jinan/co/78209.htm
梁上华信专用汽车有限公司,http://www.11467.com/jining/co/48336.htm
山东济宁圣泰笼具有限公司,http://www.11467.com/jining/co/48289.htm
山东省梁山县通宇挂车制造有限公司,http://www.11467.com/jining/co/48347.htm
晋中市泰泽科技有限公司,http://www.11467.com/jinzhong/co/22152.htm
河北宏远货架制造有限公司,http://www.11467.com/langfang/co/30433.htm
连云港市锦宇装饰工程有限公司,http://www.11467.com/lianyungang/co/29376.htm
沂水亿特塑料制品有限公司,http://www.11467.com/linyi/co/95252.htm
柳州桂通精密铸造有限公司,http://www.11467.com/liuzhou/co/10159.htm
海鑫（福建）投资有限公司,http://www.11467.com/longyan/co/20731.htm
洛阳恒路交通安全设施有限公司,http://www.11467.com/luoyang/co/46422.htm
齐车集团牡丹江齐兴铸业有限公司,http://www.11467.com/mudanjiang/co/48065.htm
南京金阳光电子有限公司,http://www.11467.com/nanjing/co/54898.htm
南京华讯机械制造有限公司,http://www.11467.com/nanjing/co/105987.htm
南京南江船业有限公司,http://www.11467.com/nanjing/co/69215.htm
南京英豪车辆制造有限公司,http://www.11467.com/nanjing/co/28433.htm
青岛远洋同舟汽配有限公司,http://www.11467.com/qingdao/co/1778.htm
环球物品贸易公司,http://www.11467.com/qingdao/co/99442.htm
青岛海立泰新型复合材料有限公司（市场部）,http://www.11467.com/qingdao/co/86430.htm
泉州市精梭贸易有限公司,http://www.11467.com/quanzhou/co/99997.htm
泉州华洲水果公司,http://www.11467.com/quanzhou/co/99814.htm
日照万盛港业公司,http://www.11467.com/rizhao/co/12323.htm
萬同（ManyTop）集团有限公司,http://www.11467.com/shantou/co/129097.htm
沈阳金达运输有限公司,http://www.11467.com/shenyang/co/58737.htm
沈阳笛威交通科技有限公司,http://www.11467.com/shenyang/co/67333.htm
沈阳冰熊冷藏车销售有限公司,http://www.11467.com/shenyang/co/97899.htm
保路仕电动自行车有限公司,http://www.11467.com/shenzhen/co/311468.htm
嘉驰兴贸易有限公司,http://www.11467.com/shenzhen/co/315527.htm
深圳市华鹏飞实业有限公司,http://www.11467.com/shenzhen/co/551949.htm
深圳安捷森通讯科技有限公司市场部,http://www.11467.com/shenzhen/co/146569.htm
深圳市联力拓实业有限公司业务/销售部,http://www.11467.com/shenzhen/co/554793.htm
深圳市星控科技有限公司,http://www.11467.com/shenzhen/co/431201.htm
深圳市深深达海洋工程服务有限公司,http://www.11467.com/shenzhen/co/506892.htm
香港盈飞国际快递有限公司,http://www.11467.com/shenzhen/co/146139.htm
深圳市协富科技有限公司,http://www.11467.com/shenzhen/co/316226.htm
信航物流发展有限公司,http://www.11467.com/shenzhen/co/789281.htm
石家庄市源于自我实业有限公司,http://www.11467.com/shijiazhuang/co/85158.htm
石家庄顺途交通设施贸易有限公司,http://www.11467.com/shijiazhuang/co/155314.htm
石家庄明奥德贸易有限公司,http://www.11467.com/shijiazhuang/co/85287.htm
佳宸精密机械有限公司,http://www.11467.com/suzhou/co/323019.htm
苏州华婷特种电镀有限公司业务部,http://www.11467.com/suzhou/co/222492.htm
苏州海宏精密科技有限公司,http://www.11467.com/suzhou/co/223145.htm
苏州工业园区禾田精密钣金有限公司(市场),http://www.11467.com/suzhou/co/208839.htm
苏州市粤星汽车运输有限公司,http://www.11467.com/suzhou/co/170335.htm
苏州快马电动车辆有限公司,http://www.11467.com/suzhou/co/223328.htm
苏州凯朗德金属科技有限公司,http://www.11467.com/suzhou/co/355934.htm
太仓井泉金属制品有限公司,http://www.11467.com/suzhou/co/97136.htm
中电科技特种装备有限公司,http://www.11467.com/taiyuan/co/95408.htm
兴泰船务公司,http://www.11467.com/taizhoushi/co/31734.htm
唐山伟创电气有限公司,http://www.11467.com/tangshan/co/53452.htm
湖北荆东高速公路建设开发有限公司,http://www.11467.com/wuhan/co/26135.htm
新疆花岗石材公司,http://www.11467.com/wulumuqi/co/51018.htm
新疆正和车辆制造有限公司,http://www.11467.com/wulumuqi/co/91558.htm
无锡鼎诚包装制品有限公司,http://www.11467.com/wuxi/co/185132.htm
无锡市万钰电动车业有限公司,http://www.11467.com/wuxi/co/24092.htm
青岛宝悦电动车有限公司无锡分公司,http://www.11467.com/wuxi/co/200401.htm
陕西西安越龙货运公司,http://www.11467.com/xian/co/61677.htm
高级汽车技术信息服务有限公司,http://www.11467.com/xian/co/61664.htm
河北省日升拉线有限公司,http://www.11467.com/xintai/co/50642.htm
河南省新乡市丰收车业有限公司,http://www.11467.com/xinxiang/co/21222.htm
河南亚飞重工机械有限公司,http://www.11467.com/xinxiang/co/31415.htm
信阳安达货运物流运输公司,http://www.11467.com/xinyang/co/23195.htm
雨杰木业有限公司,http://www.11467.com/xuancheng/co/19964.htm
烟台昌恒货运代理有限公司,http://www.11467.com/yantai/co/59433.htm
营口银鸥交通机械制造有限责任公司,http://www.11467.com/yingkou/co/40613.htm
山东枣庄市高品汽车养护有限公司,http://www.11467.com/zaozhuang/co/26849.htm
郑州天达铁道科技有限公司,http://www.11467.com/zhengzhou/co/56646.htm
郑州爱特浩思电子信息技术有限公司,http://www.11467.com/zhengzhou/co/109820.htm
郑州中邦轮胎有限公司,http://www.11467.com/zhengzhou/co/110411.htm
镇江市通达路面养护工程有限公司,http://www.11467.com/zhenjiang/co/48055.htm
宅急送快运有限公司中山分公司,http://www.11467.com/zhongshan/co/63236.htm
珠海市永通汽车用品有限公司总部,http://www.11467.com/zhuhai/co/71677.htm
珠海波利马塑胶制品有限公司销售部门,http://www.11467.com/zhuhai/co/72025.htm
株洲九方装备公司,http://www.11467.com/zhuzhou/co/33486.htm
株洲市恒辉铁路机电配件有限公司,http://www.11467.com/zhuzhou/co/26536.htm
资阳南车电力机车有限责任公司,http://www.11467.com/ziyang/co/10722.htm
北京爱迪时尚科技公司,http://www.11467.com/beijing/co/98909.htm
北京金翔贸易公司,http://www.11467.com/beijing/co/100169.htm
北京路路国际贸易公司,http://www.11467.com/beijing/co/220341.htm
北京京润四方科技有限公司,http://www.11467.com/beijing/co/310883.htm
北京天海大发金属表面技术有限公司,http://www.11467.com/beijing/co/220255.htm
北京易仟亿航空服务有限公司,http://www.11467.com/beijing/co/216427.htm
北京中翔欣平运输有限公司,http://www.11467.com/beijing/co/517501.htm
伊捷瑞技术开发公司,http://www.11467.com/beijing/co/401533.htm
应天海乐科技发展有限公司,http://www.11467.com/beijing/co/401831.htm
合吉(上海)贸易有限公司,http://www.11467.com/shanghai/co/162678.htm
上海永新木业有限公司,http://www.11467.com/shanghai/co/666315.htm
上海中集专用车有限公司,http://www.11467.com/shanghai/co/39597.htm
安仕达车业有限公司,http://www.11467.com/tianjin/co/179533.htm
天津马鲁雅斯管路公司,http://www.11467.com/tianjin/co/35681.htm
天津富利特自行车有限公司,http://www.11467.com/tianjin/co/15221.htm
天津领翔科技有限公司,http://www.11467.com/tianjin/co/17000.htm
天津市海湾电动车有限公司,http://www.11467.com/tianjin/co/140398.htm
天津卡希玛健身用品有限公司,http://www.11467.com/tianjin/co/184437.htm
天津塔松活塞制造有限公司,http://www.11467.com/tianjin/co/15306.htm
天津市通美自行车有限公司,http://www.11467.com/tianjin/co/34411.htm
天津开发区宝鑫工贸有限公司,http://www.11467.com/tianjin/co/162214.htm
天津远东工贸有限公司,http://www.11467.com/tianjin/co/35554.htm
天意电动车自行车有限公司,http://www.11467.com/tianjin/co/15287.htm
天津斯伯丁车业有限公司,http://www.11467.com/tianjin/co/15211.htm
沈阳利鑫元汽车服务有限公司,http://www.11467.com/shenyang/co/101732.htm
天津市爱派科技有限公司,http://www.11467.com/tianjin/co/301707.htm
天津宏震齿轮有限公司,http://www.11467.com/tianjin/co/301711.htm
Everlube & E/M 涂层技术服务有限公司,http://www.11467.com/tianjin/co/305906.htm
渤海钻探第二固井公司,http://www.11467.com/tianjin/co/308678.htm
营口凯捷物流有限公司,http://www.11467.com/yingkou/co/48067.htm
上海浩运国际货物运输代理有限公司,http://www.11467.com/shanghai/co/1198424.htm
安阳驰程厢体有限公司,http://www.11467.com/anyang/co/28645.htm
佛山市顺德区骋风厢体制造有限公司,http://www.11467.com/foshan/co/306825.htm
武义金利成进出口有限公司,http://www.11467.com/jinzhou/co/46750.htm
绍兴市雅克汽配有限公司,http://www.11467.com/shaoxing/co/6986.htm
厦门英盛玻璃钢制品有限公司,http://www.11467.com/xiamen/co/56.htm
临澧县宏志引线经营有限公司,http://www.11467.com/changde/co/47446.htm
常州市亚益盛车厢制造有限公司,http://www.11467.com/changzhou/co/174821.htm
郑州绿野物流有限公司,http://www.11467.com/shanghai/co/1305403.htm
天津三英焊业股份有限公司,http://www.11467.com/tianjin/co/179148.htm
天津市威美克自行车有限公司,http://www.11467.com/tianjin/co/9773.htm
无锡市万利达冷弯型钢有限公司,http://www.11467.com/wuxi/co/199992.htm
瓦房店广浩冶金轴承制造有限公司,http://www.11467.com/changzhou/co/110669.htm
呼和浩特市天正农牧业有限公司,http://www.11467.com/huhehaote/co/25201.htm
南昌弘达齿轮有限公司,http://www.11467.com/nanchang/co/89471.htm
南通唯耀铁链有限公司,http://www.11467.com/nantong/co/107551.htm
深圳市祥邦物流有限公司,http://www.11467.com/shenzhen/co/145934.htm
深圳市宏伟盛科技有限公司,http://www.11467.com/shenzhen/co/806083.htm
镇江依诺电子材料有限公司,http://www.11467.com/zhenjiang/co/49591.htm
深圳市科斯特工业设备有限公司,http://www.11467.com/shenzhen/co/311429.htm
江苏汇力起重装备有限公司,http://www.11467.com/taizhoushi/co/48594.htm
南京东亨力鼎汽车尾板有限公司,http://www.11467.com/nanjing/co/82167.htm
滁州市明亮机械制造有限公司,http://www.11467.com/chuzhou/co/22604.htm
深圳市永致诚科技有限公司,http://www.11467.com/shenzhen/co/137218.htm
深圳市鼎汇工业设备有限公司,http://www.11467.com/shenzhen/co/724640.htm
安阳市德力专用汽车有限公司,http://www.11467.com/anyang/co/40828.htm
苏州麦哈仓储设备有限公司,http://www.11467.com/suzhou/co/317219.htm
河北三国电动车有限公司,http://www.11467.com/langfang/co/28511.htm
亿安交通设施有限公司,http://www.11467.com/jinan/co/113843.htm
佛山市顺德区瑞仕拓运动用品有限公司,http://www.11467.com/foshan/co/306314.htm
深圳市奔达科技有限公司,http://www.11467.com/shenzhen/co/757819.htm
清河县创力华钢绳有限公司,http://www.11467.com/xintai/co/24680.htm
清河县泰瑞汽车配件有限公司,http://www.11467.com/xintai/co/56545.htm
榆林市隆泰通水泥制品有限公司,http://www.11467.com/yulinshi/co/28874.htm
深圳市恒通利达货架有限公司,http://www.11467.com/shenzhen/co/810900.htm
深圳市博胜五金制品有限公司,http://www.11467.com/shenzhen/co/304609.htm
杭州华宇电瓶车有限公司,http://www.11467.com/hangzhou/co/181923.htm
常州市武进第二造船有限公司,http://www.11467.com/changzhou/co/97886.htm
淮安沪佳车业科技有限公司,http://www.11467.com/huaian/co/52824.htm
黑龙江省龙城专用车有限公司,http://www.11467.com/jixi/co/20364.htm
溧水县同兴机械有限公司,http://www.11467.com/nanjing/co/115192.htm
衡水中铁建工程橡胶有限责任公司,http://www.11467.com/hengshui/co/15.htm
湖北大力专汽车制造有限公司,http://www.11467.com/suizhou/co/10558.htm
苏州雄大电机有限公司,http://www.11467.com/suzhou/co/206212.htm
衢州市鑫宏土工格栅有限公司,http://www.11467.com/quzhou/co/25075.htm
深圳市德镒盟电子有限公司,http://www.11467.com/shenzhen/co/450022.htm
厦门宏硕工贸有限公司,http://www.11467.com/xiamen/co/27626.htm
浙江半岛船业有限公司,http://www.11467.com/zhoushan/co/17466.htm
苏州市先金属加工有限公司,http://www.11467.com/suzhou/co/356148.htm
讯科科技有限公司,http://www.11467.com/anshan/co/74249.htm
安阳三和铁路器材有限公司,http://www.11467.com/anyang/co/26464.htm
常州市沪力起重机械有限公司,http://www.11467.com/changzhou/co/19546.htm
江苏足迹涂料有限公司,http://www.11467.com/changzhou/co/150373.htm
常州远洋贝米尔车业有限公司,http://www.11467.com/changzhou/co/43162.htm
常州市晨群铝业有限公司,http://www.11467.com/changzhou/co/129177.htm
东莞市寮步吊车叉车服务公司,http://www.11467.com/dongguan/co/209602.htm
东莞景大精密橡胶工业有限公司,http://www.11467.com/dongguan/co/287976.htm
东莞市鑫路翔改性沥青有限公司,http://www.11467.com/dongguan/co/66326.htm
东莞市万联仓储设备有限公司,http://www.11467.com/dongguan/co/73117.htm
深圳市诚和昌实业有限公司,http://www.11467.com/dongguan/co/224712.htm
广东天元印刷有限公司,http://www.11467.com/dongguan/co/410390.htm
山东东方曼商用车有限公司,http://www.11467.com/dongying/co/29571.htm
广东天任车料有限公司,http://www.11467.com/foshan/co/242501.htm
广州市泽日电梯设备有限公司,http://www.11467.com/foshan/co/301296.htm
广州市宝德利理容器材有限公司,http://www.11467.com/guangzhou/co/231994.htm
杭州森巴克车业有限公司,http://www.11467.com/hangzhou/co/240135.htm
衡水中杰金属制品有限公司,http://www.11467.com/hengshui/co/32593.htm
锦州博宇铁路设备有限公司,http://www.11467.com/jinzhou/co/43897.htm
江西制氧机有限公司,http://www.11467.com/jiujiang/co/21263.htm
南京煜飞科技有限公司,http://www.11467.com/nanjing/co/114921.htm
福建振宝机械有限公司,http://www.11467.com/quanzhou/co/130740.htm
深圳市盛达辉物流有限公司,http://www.11467.com/shenzhen/co/299112.htm
苏州昇达光电科技有限公司,http://www.11467.com/suzhou/co/225758.htm
唐山市鑫康达钢铁有限公司,http://www.11467.com/tangshan/co/21011.htm
无锡市浦尚精密机械有限公司,http://www.11467.com/wuxi/co/174625.htm
陕西欧舒特汽车股份有限公司,http://www.11467.com/xian/co/18875.htm
襄阳新中昌专用车有限公司,http://www.11467.com/xiangfan/co/44030.htm
湘潭时代线束有限公司,http://www.11467.com/xiangtan/co/28584.htm
烟台科大汽车设备有限公司,http://www.11467.com/yantai/co/123324.htm
淄博现宇塑料有限公司,http://www.11467.com/zibo/co/71706.htm
天津奥斯达电梯有限公司,http://www.11467.com/tianjin/co/187759.htm
易路达自行车(天津)有限公司,http://www.11467.com/tianjin/co/198410.htm
天津中远汽车贸易有限公司,http://www.11467.com/tianjin/co/88630.htm
山东盛润汽车有限公司,http://www.11467.com/jining/co/92330.htm
天津晟源秸秆模压制品有限公司,http://www.11467.com/tianjin/co/304470.htm
梁山宝华专用汽车制造有限公司,http://www.11467.com/jining/co/93980.htm
天津市天之星车业有限公司,http://www.11467.com/tianjin/co/308676.htm
广州万隆华江物流有限公司,http://www.11467.com/dongguan/co/590009.htm
广州市山通货运代理有限公司,http://www.11467.com/guangzhou/co/224224.htm
广州市盛兴科技有限公司_,http://www.11467.com/guangzhou/co/244858.htm
广州友联塑料纺织器材有限公司,http://www.11467.com/guangzhou/co/294303.htm
扬州市新天河绳业有限公司,http://www.11467.com/guangzhou/co/431438.htm
圆通速递有限公司广州分公司,http://www.11467.com/guangzhou/co/125455.htm
广州信晟货运代理有限公司（业务部）,http://www.11467.com/guangzhou/co/221979.htm
贵州维络交通科技有限公司,http://www.11467.com/guiyang/co/82888.htm
永年县凯旺电力金具有限公司,http://www.11467.com/handan/co/63370.htm
杭州诺亚机械有限公司,http://www.11467.com/hangzhou/co/310755.htm
杭州中瑞科技有限公司,http://www.11467.com/hangzhou/co/265027.htm
合肥创新汽车运输服务有限公司,http://www.11467.com/hefei/co/47518.htm
衡水永信钢波纹涵管有限公司,http://www.11467.com/hengshui/co/41785.htm
河北衡水恒洋工程橡胶有限公司,http://www.11467.com/hengshui/co/20750.htm
山东金达挂车制造有限公司,http://www.11467.com/heze/co/34216.htm
嘉兴市亿亨机械设备有限公司,http://www.11467.com/jiaxing/co/84528.htm
山东凯迪捷专用车制造有限公司,http://www.11467.com/linyi/co/82040.htm
福安市马头造船有限责任公司,http://www.11467.com/ningde/co/7347.htm
深圳亨丰塑化材料有限公司（销售部）,http://www.11467.com/shenzhen/co/429347.htm
深圳市卜全车料有限公司,http://www.11467.com/shenzhen/co/268620.htm
深圳市奥林士达自行车有限公司,http://www.11467.com/shenzhen/co/87715.htm
深圳市恒宇祥五金塑胶制品有限公司,http://www.11467.com/shenzhen/co/427624.htm
深圳市飞恒集装箱服务有限公司,http://www.11467.com/shenzhen/co/726554.htm
深圳市凯拓精密模型有限公司,http://www.11467.com/shenzhen/co/789158.htm
深圳市龙汇海实业有限公司,http://www.11467.com/shenzhen/co/113019.htm
深圳市众聚达电子有限公司,http://www.11467.com/shenzhen/co/802941.htm
深圳市神州龙物流公司,http://www.11467.com/shenzhen/co/301431.htm
深圳市致富商住集装箱有限公司,http://www.11467.com/shenzhen/co/779902.htm
兴华冠科技有限公司,http://www.11467.com/shenzhen/co/311574.htm
随州市盛星机械有限公司,http://www.11467.com/suizhou/co/8177.htm
随州天力汽车有限公司,http://www.11467.com/suizhou/co/11231.htm
湖北楚胜专用汽车有限公司 销售部,http://www.11467.com/suizhou/co/7074.htm
苏州恒野仓储物流设备有限公司,http://www.11467.com/suzhou/co/292828.htm
苏州昂鼎机械科技有限公司,http://www.11467.com/suzhou/co/269627.htm
苏州恒昇货运有限公司,http://www.11467.com/suzhou/co/296404.htm
苏州百捷物流有限公司,http://www.11467.com/suzhou/co/298980.htm
苏州和平叉车有限公司,http://www.11467.com/suzhou/co/246181.htm
苏州市万利汽车货运有限公司,http://www.11467.com/suzhou/co/222671.htm
苏州星科网络通信技术有限公司,http://www.11467.com/suzhou/co/223000.htm
靖江市海艺装饰材料有限公司,http://www.11467.com/taizhoushi/co/46183.htm
江苏蓝枫实业有限公司,http://www.11467.com/taizhoushi/co/30302.htm
安阳市宏泰铁路器材有限责任公司,http://www.11467.com/anyang/co/26466.htm
沧州市信合集装箱制造有限公司,http://www.11467.com/cangzhou/co/61628.htm
东莞市顺成塑胶制品有限公司,http://www.11467.com/dongguan/co/478733.htm
福州精铖广告有限公司,http://www.11467.com/fuzhou/co/142194.htm
广州华冶钢材加工有限公司业务部,http://www.11467.com/guangzhou/co/240413.htm
广州诚泽机电设备有限公司,http://www.11467.com/guangzhou/co/228314.htm
天津大田运输服务有限公司广州分公司,http://www.11467.com/guangzhou/co/223589.htm
邯郸市日新汽车配件有限公司,http://www.11467.com/handan/co/54903.htm
杭州杭帅车业有限公司,http://www.11467.com/hangzhou/co/241709.htm
杭州运威轮胎有限公司,http://www.11467.com/hangzhou/co/243964.htm
杭州余杭宇通货运有限公司,http://www.11467.com/hangzhou/co/133247.htm
浙江海联电子有限公司,http://www.11467.com/hangzhou/co/247664.htm
安徽科信玻璃钢有限公司,http://www.11467.com/hefei/co/2332.htm
成武县禾海车业有限公司,http://www.11467.com/heze/co/42066.htm
内蒙古高等级公路建设开发有限公司,http://www.11467.com/huhehaote/co/25236.htm
顺发机械公司,http://www.11467.com/huizhou/co/66581.htm
嘉兴市英恒机械设备有限公司,http://www.11467.com/jiaxing/co/84527.htm
晋中市泰泽科技有限公司,http://www.11467.com/jinzhong/co/22152.htm
安徽 芜湖 振华科技工业有限公司,http://www.11467.com/wuhu/co/22463.htm
无锡发发车业有限公司,http://www.11467.com/wuxi/co/24689.htm
无锡爱立特车业有限公司,http://www.11467.com/wuxi/co/178225.htm
无锡市飞越车业有限公司,http://www.11467.com/wuxi/co/24223.htm
无锡华利雅机车有限公司,http://www.11467.com/wuxi/co/143049.htm
厦门市长三角物流有限公司,http://www.11467.com/xiamen/co/42422.htm
厦门九利投资咨询有限公司,http://www.11467.com/xiamen/co/57837.htm
襄樊市宝天机电设备有限公司,http://www.11467.com/xiangfan/co/31980.htm
邢台美捷车业有限公司,http://www.11467.com/xintai/co/50518.htm
万鸿车业有限公司,http://www.11467.com/xuchang/co/23315.htm
扬州清通散热器有限公司,http://www.11467.com/yangzhou/co/98824.htm
扬州航海附件有限公司,http://www.11467.com/yangzhou/co/81568.htm
珠海亦家运输代理服务有限公司,http://www.11467.com/zhuhai/co/63866.htm
淄博品捷机电设备有限公司营销部,http://www.11467.com/zibo/co/81181.htm
天津君浩轴承有限公司,http://www.11467.com/tianjin/co/197208.htm
天津市固孚特机械设备科技有限公司,http://www.11467.com/tianjin/co/200244.htm
天津市津南区立达车队有限公司,http://www.11467.com/tianjin/co/162135.htm
天津华泰输送机有限公司,http://www.11467.com/tianjin/co/6882.htm
天津俊联船舶海洋工程技术有限公司,http://www.11467.com/tianjin/co/163160.htm
天津市枚霖自行车制造有限公司,http://www.11467.com/tianjin/co/180779.htm
天津昊通工贸有限公司,http://www.11467.com/tianjin/co/15381.htm
天津易豪自行车有限公司,http://www.11467.com/tianjin/co/301712.htm
茂名市茂南龙行天下物流有限公司,http://www.11467.com/maoming/co/44120.htm
天津新华昌运输设备有限公司,http://www.11467.com/tianjin/co/305907.htm
中科华夏动力（天津）科技发展有限公司,http://www.11467.com/tianjin/co/308674.htm
天津润昆国际货运有限公司,http://www.11467.com/tianjin/co/308675.htm
天津联兴达自行车配件制造有限公司,http://www.11467.com/tianjin/co/308677.htm
珠海明航船舶修造有限公司,http://www.11467.com/zhuhai/co/98414.htm
佛山市顺德区骋风厢体制造有限公司,http://www.11467.com/foshan/co/306825.htm
武义金利成进出口有限公司,http://www.11467.com/jinzhou/co/46750.htm
沂水亿特塑料制品有限公司,http://www.11467.com/linyi/co/95252.htm
柳州桂通精密铸造有限公司,http://www.11467.com/liuzhou/co/10159.htm
海鑫（福建）投资有限公司,http://www.11467.com/longyan/co/20731.htm
南京金阳光电子有限公司,http://www.11467.com/nanjing/co/54898.htm
南京华讯机械制造有限公司,http://www.11467.com/nanjing/co/105987.htm
南京英豪车辆制造有限公司,http://www.11467.com/nanjing/co/28433.htm
萬同（ManyTop）集团有限公司,http://www.11467.com/shantou/co/129097.htm
