绍兴市雅克汽配有限公司,http://www.11467.com/shaoxing/co/6986.htm
沈阳冰熊冷藏车销售有限公司,http://www.11467.com/shenyang/co/97899.htm
深圳市星控科技有限公司,http://www.11467.com/shenzhen/co/431201.htm
深圳市深深达海洋工程服务有限公司,http://www.11467.com/shenzhen/co/506892.htm
信航物流发展有限公司,http://www.11467.com/shenzhen/co/789281.htm
石家庄顺途交通设施贸易有限公司,http://www.11467.com/shijiazhuang/co/155314.htm
石家庄明奥德贸易有限公司,http://www.11467.com/shijiazhuang/co/85287.htm
苏州凯朗德金属科技有限公司,http://www.11467.com/suzhou/co/355934.htm
太仓井泉金属制品有限公司,http://www.11467.com/suzhou/co/97136.htm
唐山伟创电气有限公司,http://www.11467.com/tangshan/co/53452.htm
无锡鼎诚包装制品有限公司,http://www.11467.com/wuxi/co/185132.htm
无锡市万钰电动车业有限公司,http://www.11467.com/wuxi/co/24092.htm
河北省日升拉线有限公司,http://www.11467.com/xintai/co/50642.htm
河南亚飞重工机械有限公司,http://www.11467.com/xinxiang/co/31415.htm
信阳安达货运物流运输公司,http://www.11467.com/xinyang/co/23195.htm
营口银鸥交通机械制造有限责任公司,http://www.11467.com/yingkou/co/40613.htm
郑州中邦轮胎有限公司,http://www.11467.com/zhengzhou/co/110411.htm
株洲市恒辉铁路机电配件有限公司,http://www.11467.com/zhuzhou/co/26536.htm
北京吉北顺发汽车车厢有限公司,http://www.11467.com/beijing/co/478469.htm
天津领翔科技有限公司,http://www.11467.com/tianjin/co/17000.htm
天津市通美自行车有限公司,http://www.11467.com/tianjin/co/34411.htm
天津再创工贸有限公司,http://www.11467.com/tianjin/co/25880.htm
重庆道生科技有限公司,http://www.11467.com/chongqing/co/124704.htm
沈阳利鑫元汽车服务有限公司,http://www.11467.com/shenyang/co/101732.htm
天津市爱派科技有限公司,http://www.11467.com/tianjin/co/301707.htm
天津宏震齿轮有限公司,http://www.11467.com/tianjin/co/301711.htm
Everlube & E/M 涂层技术服务有限公司,http://www.11467.com/tianjin/co/305906.htm
渤海钻探第二固井公司,http://www.11467.com/tianjin/co/308678.htm
山西省晋中路桥技术集团有限公司,http://www.11467.com/qiye/93081748.htm
厦门英盛玻璃钢制品有限公司,http://www.11467.com/xiamen/co/56.htm
