无锡市许栗旺绿色食品有限公司,http://www.11467.com/qiye/93196542.htm
山东百枣纲目生物科技有限公司,http://www.11467.com/dezhou/co/49341.htm
东莞市中立食品有限公司,http://www.11467.com/dongguan/co/53702.htm
济南燕山食品有限公司,http://www.11467.com/jinan/co/41992.htm
广西福民食品有限责任公司,http://www.11467.com/dongguan/co/409612.htm
广东趣园食品有限公司,http://www.11467.com/qingyuan/co/23741.htm
四川岭地农业有限公司,http://www.11467.com/dazhou/co/17600.htm
长沙市雨花区瑞兆华食品有限公司,http://www.11467.com/changsha/co/135318.htm
四川罗城牛肉食品有限公司,http://www.11467.com/leshan/co/20648.htm
龙海香德利食品有限公司,http://www.11467.com/zhangzhou/co/47575.htm
安徽省池州九华野葫芦开发有限责任公司,http://www.11467.com/chizhou/co/7000.htm
内蒙古大牧场食品有限责任公司,http://www.11467.com/chifeng/co/23352.htm
沧州宏宇枣业有限公司,http://www.11467.com/cangzhou/co/43737.htm
洛阳甜咸斋食品有限公司,http://www.11467.com/luoyang/co/51090.htm
广西南宁市好聪仔食品有限公司,http://www.11467.com/nanning/co/74446.htm
莆田市海帝食品有限公司,http://www.11467.com/putian/co/33474.htm
惠州泰元食品农牧有限公司,http://www.11467.com/huizhou/co/78359.htm
黑龙江乾润食品有限责任公司,http://www.11467.com/haerbin/co/56198.htm
合肥徽之皇食品集团有限公司,http://www.11467.com/hefei/co/98128.htm
呼和浩特市乳清香食品有限责任公司,http://www.11467.com/huhehaote/co/28330.htm
珠海市鸿锐食品有限公司,http://www.11467.com/zhuhai/co/85671.htm
安徽强立文具有限公司,http://www.11467.com/chaohu/co/14071.htm
滨州绿福园食品有限公司,http://www.11467.com/binzhou/co/22775.htm
蚌埠市金旺食品有限公司,http://www.11467.com/bengbu/co/24702.htm
厦门珍鲜食品有限公司,http://www.11467.com/xiamen/co/74868.htm
哈尔滨祺宝食品有限公司,http://www.11467.com/haerbin/co/57819.htm
上海卡桑国际贸易有限公司,http://www.11467.com/siping/co/32094.htm
劲家庄（惠州）健康食品有限公司,http://www.11467.com/huizhou/co/110335.htm
湖南省南一门南北特食品有限公司,http://www.11467.com/changsha/co/165880.htm
安庆可牛食品有限责任公司,http://www.11467.com/anqing/co/26357.htm
深圳市微品龙记技术管理有限公司,http://www.11467.com/shenzhen/co/1087073.htm
深圳可颂食品有限公司,http://www.11467.com/shenzhen/co/814968.htm
新疆雪山果园食品有限公司,http://www.11467.com/changji/co/13545.htm
广州华琳食品有限公司,http://www.11467.com/guangzhou/co/434498.htm
大兴安岭百盛蓝莓科技开发有限公司,http://www.11467.com/daxinganling/co/4051.htm
江西齐云山食品有限公司,http://www.11467.com/ganzhou/co/5828.htm
广东绿活食品有限公司,http://www.11467.com/jieyang/co/31119.htm
曲靖市麒麟区禽蛋副食品有限公司,http://www.11467.com/qujing/co/18629.htm
桂林市六顺食品有限公司,http://www.11467.com/guilin/co/51645.htm
东营市志达食品机械有限公司,http://www.11467.com/dongying/co/41445.htm
山东东阿生力源阿胶生物工程有限公司,http://www.11467.com/liaocheng/co/73552.htm
珠海浩亿达贸易有限公司,http://www.11467.com/zhuhai/co/85667.htm
贵州旭阳食品(集团)有限公司,http://www.11467.com/zunyi/co/25056.htm
北京泊之利乐国际商贸有限公司,http://www.11467.com/beijing/co/765141.htm
海獭（平潭）跨境电子商务有限公司,http://www.11467.com/fuzhou/co/211727.htm
江西乔家栅食品有限公司,http://www.11467.com/nanchang/co/22450.htm
珠海元朗食品有限公司,http://www.11467.com/zhuhai/co/84632.htm
枣庄市金威远食品有限公司,http://www.11467.com/zaozhuang/co/29245.htm
伊春市晨松山特产品有限公司,http://www.11467.com/yichunshi/co/16427.htm
通辽市草原旭日食品有限责任公司,http://www.11467.com/tongliao/co/9827.htm
阿克苏天疆红枣业有限公司,http://www.11467.com/akesu/co/11289.htm
漯河市东方食品有限公司,http://www.11467.com/luohe/co/18183.htm
新疆木扎提国际贸易有限公司,http://www.11467.com/akesu/co/11284.htm
新疆联捷果业有限公司,http://www.11467.com/tulufan/co/4776.htm
新疆西域盛达果蔬开发有限公司,http://www.11467.com/tulufan/co/4572.htm
潍坊市百味佳商贸有限公司,http://www.11467.com/weifang/co/89299.htm
潍坊正泓食品有限公司,http://www.11467.com/weifang/co/89308.htm
威海家晓食品坊有限公司,http://www.11467.com/weihai/co/34717.htm
西安帆顺商贸有限公司,http://www.11467.com/xian/co/85319.htm
宣城市超港食品连锁经营有限责任公司,http://www.11467.com/xuancheng/co/13061.htm
枣庄益尔山食品有限公司,http://www.11467.com/zaozhuang/co/26386.htm
张家界茅岩河绿色食品有限公司,http://www.11467.com/zhangjiajie/co/8187.htm
舟山市海利远洋渔业有限公司,http://www.11467.com/zhoushan/co/18739.htm
浙江明珠海洋食品有限公司,http://www.11467.com/zhoushan/co/19022.htm
舟山市普陀锦业水产有限公司,http://www.11467.com/zhoushan/co/17316.htm
湖北孝威食品有限公司,http://www.11467.com/xiaogan/co/122.htm
吉林省麒鸣牧业集团有限责任公司,http://www.11467.com/liaoyuan/co/8664.htm
漳州市同裕食品有限公司,http://www.11467.com/zhangzhou/co/40828.htm
富源鼎盛(北京）餐饮管理有限公司,http://www.11467.com/beijing/co/752547.htm
遂宁雅客食品有限公司,http://www.11467.com/suining/co/9237.htm
西安市山美食品有限公司,http://www.11467.com/xian/co/85324.htm
南宁岭南生物科技有限责任公司,http://www.11467.com/nanning/co/29034.htm
南宁市如润商贸有限责任公司,http://www.11467.com/nanning/co/74460.htm
义乌市同乐食品有限公司,http://www.11467.com/jinhua/co/81399.htm
南宁市北龙餐饮有限公司,http://www.11467.com/nanning/co/86280.htm
广州市艺帆集团展览服务有限公司,http://www.11467.com/guangzhou/co/432626.htm
自贡市刀刀爽食品有限公司,http://www.11467.com/zigong/co/22532.htm
枣庄市永兴板栗加工有限公司,http://www.11467.com/zaozhuang/co/47857.htm
芜湖市大徐瓜子食品有限公司,http://www.11467.com/wuhu/co/24479.htm
库车渤商电子商务有限公司,http://www.11467.com/akesu/co/11963.htm
宁夏青铜峡市清真食品有限责任公司,http://www.11467.com/wuzhong/co/8551.htm
上海市塬园贸易投资有限公司,http://www.11467.com/shanghai/co/252126.htm
泸州野植珍食品有限公司,http://www.11467.com/luzhou/co/16992.htm
巴彦淖尔市尚合尚品商贸有限公司,http://www.11467.com/bayannaoer/co/5099.htm
承德市鹰手营子矿区宏运达食品有限公司,http://www.11467.com/chengde/co/22888.htm
巴彦淖尔杞园养生食品有限公司,http://www.11467.com/bayannaoer/co/4832.htm
鹤壁市阔佬食品有限公司,http://www.11467.com/hebi/co/9634.htm
合肥永宝商贸有限公司,http://www.11467.com/hefei/co/99577.htm
开封市金明区汇宝生活用品有限公司,http://www.11467.com/kaifeng/co/16059.htm
四川省旌晶食品有限公司,http://www.11467.com/deyang/co/32391.htm
桂林市桂丰园食品有限公司,http://www.11467.com/guilin/co/46485.htm
东营哲瀚商贸有限责任公司,http://www.11467.com/dongying/co/31079.htm
安徽顶呱呱食品有限公司,http://www.11467.com/fuyang/co/27265.htm
保山市董氏莲藕产品开发有限责任公司,http://www.11467.com/baoshan/co/9707.htm
包头市优先贸易有限公司,http://www.11467.com/baotou/co/26680.htm
包头市美洋圣加食品有限公司,http://www.11467.com/baotou/co/26677.htm
沧州利波食品有限公司,http://www.11467.com/cangzhou/co/43738.htm
沧州枣盟食品有限公司,http://www.11467.com/cangzhou/co/43389.htm
滨州市四方工贸有限公司,http://www.11467.com/binzhou/co/22779.htm
沧州诚鑫食品有限公司,http://www.11467.com/cangzhou/co/43364.htm
桐城市兄弟食品有限公司,http://www.11467.com/anqing/co/26722.htm
丹东嘉河食品有限公司,http://www.11467.com/dandong/co/47938.htm
济宁鑫瑞和鑫商贸有限公司,http://www.11467.com/jining/co/53127.htm
沧州福道食品有限公司,http://www.11467.com/cangzhou/co/43740.htm
嘉兴飞度电子商务有限公司,http://www.11467.com/jiaxing/co/134900.htm
龙泽食品有限公司（销售部）,http://www.11467.com/chifeng/co/23622.htm
承德亿美达食品有限公司,http://www.11467.com/chengde/co/21943.htm
杭州姚生记食品有限公司,http://www.11467.com/hangzhou/co/41441.htm
大兴安岭奇真森林蓝莓有限公司,http://www.11467.com/daxinganling/co/4052.htm
菏泽田园食品有限公司,http://www.11467.com/heze/co/23800.htm
广州酒家集团利口福食品有限公司,http://www.11467.com/guangzhou/co/382282.htm
长沙市南北特产副食品公司食品厂,http://www.11467.com/changsha/co/96433.htm
莆田市天赐食品有限公司,http://www.11467.com/putian/co/32691.htm
山东莱州大家乐食品有限公司,http://www.11467.com/qingdao/co/111654.htm
泉州六洲食品有限公司,http://www.11467.com/quanzhou/co/113748.htm
广西南宁真食尚贸易有限公司,http://www.11467.com/nanning/co/79015.htm
新疆牧马人干果批发有限公司,http://www.11467.com/shihezi/co/6002.htm
通辽市易美联商贸有限公司,http://www.11467.com/tongliao/co/10137.htm
通辽市邢佳食品有限责任公司,http://www.11467.com/tongliao/co/9793.htm
吐鲁番柯氏果业有限公司,http://www.11467.com/tulufan/co/4821.htm
广西南宁环泰食品有限公司,http://www.11467.com/nanning/co/74427.htm
浙江龙游真萃食品有限公司,http://www.11467.com/quzhou/co/23920.htm
东方实创实业有限公司,http://www.11467.com/shangqiu/co/17231.htm
通辽草原义成食品有限公司,http://www.11467.com/tongliao/co/9828.htm
汕尾市中宇数码教育电子有限公司,http://www.11467.com/shanwei/co/9319.htm
吕梁飘香食品有限公司,http://www.11467.com/lvliang/co/10727.htm
福建省南安市腾光食品有限公司,http://www.11467.com/quanzhou/co/111105.htm
南昌南翔贸易有限责任公司,http://www.11467.com/nanchang/co/95712.htm
东莞华美食品有限公司,http://www.11467.com/shenzhen/co/664531.htm
苏州优尔食品有限公司,http://www.11467.com/suzhou/co/27355.htm
绵阳市川奇食品有限公司,http://www.11467.com/mianyang/co/37522.htm
乐山市蜀晨食品有限公司,http://www.11467.com/leshan/co/20746.htm
四川翔风科技有限公司,http://www.11467.com/mianyang/co/46476.htm
深圳市顺香食品有限公司,http://www.11467.com/shenzhen/co/569626.htm
绵阳市鑫联展商贸有限责任公司,http://www.11467.com/mianyang/co/37539.htm
日照海通食品有限公司,http://www.11467.com/rizhao/co/15341.htm
泉州市南强食品配料有限公司,http://www.11467.com/quanzhou/co/147254.htm
南昌市欧风食品有限公司,http://www.11467.com/nanchang/co/96972.htm
福建省远山农业发展有限责任公司,http://www.11467.com/longyan/co/31151.htm
日照恒丰食品有限公司,http://www.11467.com/rizhao/co/15340.htm
广州市广御园食品有限公司,http://www.11467.com/guangzhou/co/557976.htm
上海谷钰行实业有限公司,http://www.11467.com/shanghai/co/1148318.htm
梧州市鸳鸯江食品有限公司*,http://www.11467.com/wuzhou/co/17347.htm
伊春华诚山特产品有限责任公司,http://www.11467.com/yichunshi/co/16436.htm
徐州鑫语石季食品有限公司,http://www.11467.com/xuzhou/co/60842.htm
驻马店市百家好农副产品有限公司,http://www.11467.com/zhumadian/co/23679.htm
吐鲁番市博士德果脯工贸有限公司,http://www.11467.com/tulufan/co/4852.htm
河南怡人堂清真食品有限公司,http://www.11467.com/zhoukou/co/17173.htm
伊春市森骄山特产品有限责任公司,http://www.11467.com/yichunshi/co/14471.htm
山东潍坊香禾食品有限公司,http://www.11467.com/weifang/co/89288.htm
舟山市帅鱼食品有限公司,http://www.11467.com/zhoushan/co/18796.htm
舟山瑞升海洋食品有限公司,http://www.11467.com/zhoushan/co/18721.htm
舟山市老舟山海洋生物科技有限公司,http://www.11467.com/zhoushan/co/19004.htm
宜宾市老龙沟食品有限公司,http://www.11467.com/yibin/co/24544.htm
乌兰察布市集宁平成不老神食品有限责任公司,http://www.11467.com/wulanchabu/co/6029.htm
旺达新疆特产食品有限公司（销售部）,http://www.11467.com/wulumuqi/co/97529.htm
河北富岗食品有限责任公司,http://www.11467.com/xintai/co/37587.htm
舟山市定海新视界信息科技有限公司,http://www.11467.com/zhoushan/co/19023.htm
枣庄红石榴娃食品饮料有限公司,http://www.11467.com/zaozhuang/co/29233.htm
河南三淳商贸有限公司,http://www.11467.com/zhengzhou/co/187920.htm
珠海市永瑞食品有限公司,http://www.11467.com/zhuhai/co/85670.htm
北京富亿农板栗有限公司,http://www.11467.com/beijing/co/481480.htm
吐鲁番市英俊农产品有限责任公司,http://www.11467.com/tulufan/co/4583.htm
漳州国阳食品有限公司,http://www.11467.com/zhangzhou/co/40819.htm
山东一品堂胶业有限公司,http://www.11467.com/liaocheng/co/60346.htm
珠海市澳诚贸易有限公司,http://www.11467.com/zhuhai/co/85669.htm
益阳市资阳区优多客食品有限公司,http://www.11467.com/yiyang/co/19295.htm
义乌市悦礼食品有限公司,http://www.11467.com/jinhua/co/175478.htm
徐州宾朋包装制品有限公司,http://www.11467.com/xuzhou/co/78590.htm
乌鲁木齐市和顺达商贸有限公司,http://www.11467.com/wulumuqi/co/103172.htm
福建欧瑞园食品有限公司,http://www.11467.com/zhangzhou/co/47649.htm
霍城县五彩河谷农业开发有限公司,http://www.11467.com/yili/co/12480.htm
宁夏鑫颢博达科技有限公司,http://www.11467.com/yinchuan/co/44388.htm
乌鲁木齐金土果源食品有限公司,http://www.11467.com/wulumuqi/co/103171.htm
徐州美康缘食品科技有限公司,http://www.11467.com/xuzhou/co/63835.htm
苏州口水娃食品有限公司,http://www.11467.com/shanghai/co/744624.htm
马鞍山牧牛湖水产品有限公司,http://www.11467.com/fuyang/co/27183.htm
东莞市晋盛商缘商贸有限公司,http://www.11467.com/dongguan/co/642377.htm
湖南省华文食品有限公司,http://www.11467.com/yueyang/co/37050.htm
贺州市芬芳果蔬食品有限公司,http://www.11467.com/hezhou/co/5503.htm
河南谷力佳食品有限公司,http://www.11467.com/jiaozuo/co/22151.htm
桂林沁漓贸易有限公司,http://www.11467.com/guilin/co/46487.htm
包头市越八电子商务有限责任公司,http://www.11467.com/baotou/co/26683.htm
龙海市顺兴食品有限公司,http://www.11467.com/zhangzhou/co/40824.htm
珠海经济特区佳荣食品有限公司,http://www.11467.com/zhuhai/co/10633.htm
笑哈哈食品(阳江)有限公司,http://www.11467.com/yangjiang/co/17776.htm
石家庄双彤工贸有限公司,http://www.11467.com/shijiazhuang/co/100031.htm
厦门如远贸易有限公司,http://www.11467.com/xiamen/co/179940.htm
烟台海和食品有限公司,http://www.11467.com/yantai/co/23109.htm
怀化市贵龙食品有限公司,http://www.11467.com/huaihua/co/19579.htm
安徽福怡嘉生物科技有限公司,http://www.11467.com/hefei/co/84817.htm
上海佐塞网络科技有限公司,http://www.11467.com/shanghai/co/1260172.htm
山东喜洋洋食品有限公司,http://www.11467.com/zaozhuang/co/29236.htm
吐鲁番市葡香食品有限公司,http://www.11467.com/tulufan/co/4641.htm
宜昌云首农业科技开发有限公司,http://www.11467.com/yichang/co/53477.htm
湖南欧比佳营养食品有限公司,http://www.11467.com/changsha/co/118738.htm
中粮屯河（北京）营销有限公司,http://www.11467.com/qiye/29719905.htm
广西贺州市富翔贸易有限公司,http://www.11467.com/hezhou/co/4938.htm
广州淳源健康科技有限公司,http://www.11467.com/guangzhou/co/738634.htm
深圳玩嗨皮科技有限公司,http://www.11467.com/shenzhen/co/1123479.htm
苏州市苏太太食品有限公司,http://www.11467.com/suzhou/co/257648.htm
烟台兴雅食品有限公司,http://www.11467.com/baishan/co/11905.htm
广东皇礼城实业有限公司,http://www.11467.com/zhaoqing/co/68837.htm
深圳市佳味源贸易有限公司,http://www.11467.com/shenzhen/co/1136994.htm
深圳市七十三度网络科技有限公司,http://www.11467.com/shenzhen/co/1137131.htm
贵州西点贸易有限公司,http://www.11467.com/guiyang/co/90804.htm
绿保(营口)魔芋食品有限公司,http://www.11467.com/yingkou/co/47616.htm
泰山真好吃食品有限公司,http://www.11467.com/taian/co/68790.htm
沧州梦仲思食品有限公司,http://www.11467.com/cangzhou/co/56644.htm
济南金晔食品有限公司,http://www.11467.com/jinan/co/35480.htm
河源市创始人农业发展有限公司,http://www.11467.com/heyuan/co/8628.htm
温州桥亮食品有限公司,http://www.11467.com/wenzhou/co/342960.htm
广西南宁品亚商贸有限公司,http://www.11467.com/nanning/co/89866.htm
江苏沃顿食品有限公司,http://www.11467.com/zhenjiang/co/72045.htm
深圳市创嘉电子商贸有限公司,http://www.11467.com/shenzhen/co/1135859.htm
广汉腾祥食品有限公司,http://www.11467.com/deyang/co/40039.htm
广州市新天行食品有限公司,http://www.11467.com/guangzhou/co/494627.htm
成都宏昌食品有限公司,http://www.11467.com/chengdu/co/27166.htm
湖北吉利食品有限公司,http://www.11467.com/wuhan/co/26183.htm
丹东元一海产精制品有限公司,http://www.11467.com/dandong/co/29630.htm
佛山市品维纸业有限公司,http://www.11467.com/foshan/co/214096.htm
福州百洲食品有限公司,http://www.11467.com/fuzhou/co/156734.htm
福州味开心食品有限公司,http://www.11467.com/fuzhou/co/156749.htm
合肥七哥食品有限责任公司,http://www.11467.com/hefei/co/86210.htm
江门高迪食品有限公司,http://www.11467.com/jiangmen/co/698.htm
江门美其香食品有限公司,http://www.11467.com/jiangmen/co/81426.htm
云南泰华食品有限公司,http://www.11467.com/kunming/co/28472.htm
自贡市天花井食品有限公司,http://www.11467.com/zigong/co/486.htm
东莞市丰熙食品有限公司,http://www.11467.com/dongguan/co/164254.htm
无锡市奥里香食品有限公司,http://www.11467.com/wuxi/co/17550.htm
黄骅市天丰生态食品有限公司,http://www.11467.com/cangzhou/co/51308.htm
广州市天腊皇贸易有限公司,http://www.11467.com/guangzhou/co/386960.htm
扎兰屯市森通食品开发有限责任公司,http://www.11467.com/hulunbeier/co/18043.htm
深圳市瑞利来实业有限公司,http://www.11467.com/shenzhen/co/627017.htm
广州食笑园餐饮管理有限公司,http://www.11467.com/guangzhou/co/699366.htm
上海佰味轩食品有限公司,http://www.11467.com/shanghai/co/771912.htm
河南远山自然农业有限公司,http://www.11467.com/nantong/co/138649.htm
东莞市华美食品有限公司,http://www.11467.com/dongguan/co/49315.htm
福建省晋江市益利发食品有限公司,http://www.11467.com/quanzhou/co/129717.htm
漯河市禾平食品有限责任公司,http://www.11467.com/luohe/co/18756.htm
福州市晋安区海福贸易有限公司,http://www.11467.com/fuzhou/co/156742.htm
广州欧逸品商贸有限公司,http://www.11467.com/guangzhou/co/495357.htm
广西南宁市日日升食品有限公司,http://www.11467.com/nanning/co/94739.htm
湖南省俏嘴巴食品有限公司,http://www.11467.com/yiyang/co/21225.htm
岳阳市必应商贸有限公司,http://www.11467.com/yueyang/co/38595.htm
襄阳百乐庭食品有限公司,http://www.11467.com/xiangfan/co/52757.htm
广州市名花香料有限公司,http://www.11467.com/guangzhou/co/52803.htm
福州市仓山区九华贸易有限公司,http://www.11467.com/fuzhou/co/195998.htm
北京市香村园食品有限责任公司,http://www.11467.com/beijing/co/691217.htm
常州嘴馋了信息科技有限公司,http://www.11467.com/changzhou/co/147759.htm
厦门香客电子商务有限公司,http://www.11467.com/xiamen/co/103458.htm
阿马蒂亚(上海)食品有限公司,http://www.11467.com/wulumuqi/co/103627.htm
兰州瓜牛商贸有限公司,http://www.11467.com/lanzhou/co/85747.htm
临沂市六兄弟食品商贸有限公司,http://www.11467.com/liaocheng/co/34470.htm
杭州唐纳兹食品有限公司,http://www.11467.com/hangzhou/co/291751.htm
甘肃毅源农副土特产有限公司,http://www.11467.com/lanzhou/co/73040.htm
泉州洛江绿宝绿色食品有限公司,http://www.11467.com/quanzhou/co/7974.htm
宁夏宁安堡土特产品有限公司,http://www.11467.com/yinchuan/co/34497.htm
厦门盈利轩实业有限公司,http://www.11467.com/xiamen/co/62241.htm
绍兴大师美术用品有限公司,http://www.11467.com/shaoxing/co/14580.htm
浙江东如食品有限公司,http://www.11467.com/jinhua/co/81391.htm
江苏华联食品有限公司,http://www.11467.com/huaian/co/36507.htm
杭州陆龙海产食品有限公司,http://www.11467.com/hangzhou/co/222429.htm
南宁市越前食品添加剂有限责任公司,http://www.11467.com/nanning/co/22545.htm
烟台腾达除氧剂有限公司,http://www.11467.com/yantai/co/105803.htm
漳州市香之味食品有限公司,http://www.11467.com/zhangzhou/co/37254.htm
珠海派森食品有限公司,http://www.11467.com/zhuhai/co/10689.htm
诠德美商贸有限公司,http://www.11467.com/beijing/co/132620.htm
上海潮乡源食品有限公司,http://www.11467.com/shanghai/co/809592.htm
连云港光裕永食品配料有限公司,http://www.11467.com/lianyungang/co/30563.htm
广东荣诚食品有限公司,http://www.11467.com/shantou/co/137267.htm
厦门圣王生物科技有限公司,http://www.11467.com/xiamen/co/74762.htm
日照市汇利水产有限公司,http://www.11467.com/rizhao/co/367.htm
江苏弘宇农业股份有限公司,http://www.11467.com/wuxi/co/239810.htm
深圳市特乐福实业有限公司,http://www.11467.com/shenzhen/co/224098.htm
益阳市口味王槟榔有限责任公司,http://www.11467.com/yiyang/co/16058.htm
禾谷实业（上海）有限公司,http://www.11467.com/shanghai/co/1065465.htm
厦门欣长隆商贸有限公司,http://www.11467.com/xiamen/co/103091.htm
靖江市佳宇食品有限公司,http://www.11467.com/taizhoushi/co/45690.htm
广西南宁五六易宝商贸有限公司,http://www.11467.com/nanning/co/89868.htm
南阳市果然风情实业有限公司,http://www.11467.com/nanyang/co/37541.htm
杭州鼎松食品有限公司,http://www.11467.com/hangzhou/co/390897.htm
嘉兴御厨食品有限公司,http://www.11467.com/jiaxing/co/121794.htm
临洮三江马铃薯制品（集团）有限责任公司,http://www.11467.com/lanzhou/co/42821.htm
杭州亚历蒂斯进出口有限公司,http://www.11467.com/hangzhou/co/310938.htm
临安市林泰食品有限公司,http://www.11467.com/hangzhou/co/369503.htm
南京东照杰贸易有限公司,http://www.11467.com/nanjing/co/37598.htm
兴化市联富食品有限公司,http://www.11467.com/taizhoushi/co/8250.htm
武汉德瑞森工贸有限公司,http://www.11467.com/wuhan/co/149668.htm
西安丹鹤食品有限公司,http://www.11467.com/xian/co/58241.htm
西安天威食品有限公司,http://www.11467.com/xian/co/84585.htm
郑州利扬食品有限公司,http://www.11467.com/zhengzhou/co/185552.htm
宁夏中宁县旭彤枸杞开发有限公司,http://www.11467.com/zhongwei/co/2132.htm
珠海澳凼食品有限公司,http://www.11467.com/zhuhai/co/84418.htm
旺兴食品（漳州）有限公司,http://www.11467.com/zhangzhou/co/57242.htm
重庆康名士商贸有限公司,http://www.11467.com/chongqing/co/123742.htm
广州华亚展览服务有限公司,http://www.11467.com/guangzhou/co/428560.htm
宁波东申贸易有限公司,http://www.11467.com/ningbo/co/144341.htm
厦门鑫嘉元生物科技有限公司,http://www.11467.com/xiamen/co/118778.htm
上海米大妈食品有限公司,http://www.11467.com/shanghai/co/894040.htm
福建万得福食品有限公司,http://www.11467.com/zhangzhou/co/47577.htm
广州市番泰行贸易有限公司,http://www.11467.com/guangzhou/co/161271.htm
上海青林食品有限公司,http://www.11467.com/shanghai/co/226822.htm
优润食品销售（上海）有限公司,http://www.11467.com/shanghai/co/49551.htm
天津市黑金刚食品有限公司,http://www.11467.com/tianjin/co/26649.htm
重庆香香投资咨询有限公司,http://www.11467.com/chongqing/co/54508.htm
重庆永吉食品开发有限公司,http://www.11467.com/chongqing/co/127015.htm
重庆小燕子食品有限公司,http://www.11467.com/chongqing/co/1083.htm
重庆豪杰食品有限公司,http://www.11467.com/chongqing/co/170748.htm
蒙特食品有限公司,http://www.11467.com/tongliao/co/10140.htm
长沙美又康食品有限公司,http://www.11467.com/changsha/co/104153.htm
新疆绿清源枣业有限公司,http://www.11467.com/zhengzhou/co/149096.htm
徐州润升食品有限公司,http://www.11467.com/xuzhou/co/63911.htm
苏州枫御源餐饮管理有限公司,http://www.11467.com/suzhou/co/270317.htm
北京京创腾翔科技有限公司,http://www.11467.com/beijing/co/331038.htm
广州市业德贸易有限公司,http://www.11467.com/qiye/24692.htm
宝食街国际食品有限公司,http://www.11467.com/shenzhen/co/725153.htm
沈阳新南洋食品公司,http://www.11467.com/shenyang/co/81301.htm
四川省老九门食品有限公司,http://www.11467.com/nanchong/co/31970.htm
天津市永康食品有限公司,http://www.11467.com/tianjin/co/100892.htm
情香枣业有限公司,http://www.11467.com/jinhua/co/84146.htm
厦门唯美思食品有限公司,http://www.11467.com/xiamen/co/92952.htm
