无锡好滋味食品商贸有限公司,http://www.11467.com/wuxi/co/215457.htm
青岛随行乐商贸有限公司,http://www.11467.com/qingdao/co/125105.htm
深圳市瑞盈莱贸易有限公司,http://www.11467.com/shenzhen/co/730953.htm
上海名迪食品有限公司,http://www.11467.com/shanghai/co/894405.htm
威海鹏得利食品有限公司,http://www.11467.com/weihai/co/36159.htm
蓬安县姚麻花食品有限公司,http://www.11467.com/nanchong/co/25785.htm
深圳共盛贸易有限公司,http://www.11467.com/shenzhen/co/721933.htm
浙江利江食品有限公司,http://www.11467.com/jiaxing/co/124294.htm
广州市络普信息技术有限公司,http://www.11467.com/guangzhou/co/432284.htm
南阳市新田园农产品有限公司,http://www.11467.com/nanyang/co/34220.htm
徐州市优加星食品有限公司,http://www.11467.com/xuzhou/co/63890.htm
厦门丰利达餐饮管理有限公司,http://www.11467.com/xiamen/co/93071.htm
常德市鼎城区老夫子食品有限公司,http://www.11467.com/changde/co/19056.htm
上海顶能食品科技有限公司,http://www.11467.com/shanghai/co/894379.htm
沭阳县建波食品有限公司,http://www.11467.com/suqian/co/25387.htm
湖南省益侬文化发展有限公司,http://www.11467.com/changsha/co/97509.htm
长沙长仔食品有限公司,http://www.11467.com/changsha/co/95066.htm
潍坊市欧麦尔食品有限公司,http://www.11467.com/weifang/co/116999.htm
长沙市宇典食品贸易有限公司,http://www.11467.com/changsha/co/97575.htm
保定大正食品有限公司,http://www.11467.com/baoding/co/1709.htm
长春赢顺商贸有限公司,http://www.11467.com/changchun/co/69387.htm
亨得利商贸有限公司,http://www.11467.com/shanghai/co/1034674.htm
成都同乐食品商贸批发公司,http://www.11467.com/chengdu/co/211868.htm
深圳市亚美园实业有限公司,http://www.11467.com/shenzhen/co/667645.htm
阿克苏谢立夫农产品有限公司,http://www.11467.com/akesu/co/11964.htm
广西南宁当享贸易有限公司,http://www.11467.com/qiye/182502.htm
湖南润生保健食品有限公司,http://www.11467.com/changde/co/36355.htm
北京睿胜优品商业有限公司,http://www.11467.com/beijing/co/164252.htm
上海瑟维斯进出口清关公司,http://www.11467.com/shanghai/co/1026053.htm
博野县果农食品有限公司,http://www.11467.com/baoding/co/70708.htm
上海毅臣广告有限公司,http://www.11467.com/shanghai/co/811506.htm
天津卤菜店加盟卤菜技术学习有限公司,http://www.11467.com/tianjin/co/195939.htm
面之家食品深圳有限公司,http://www.11467.com/shenzhen/co/760019.htm
济南那滋味食品有限公司,http://www.11467.com/jinan/co/133278.htm
深圳东亚进口食品有限公司,http://www.11467.com/shenzhen/co/732487.htm
厦门东沃贸易有限公司,http://www.11467.com/xiamen/co/92808.htm
长沙德辰文化传播有限公司,http://www.11467.com/changsha/co/130056.htm
白银东辰商贸有限公司,http://www.11467.com/baiyin/co/6345.htm
南宁市欧诺贸易有限责任公司,http://www.11467.com/nanning/co/85978.htm
常州市蒋记食品有限公司,http://www.11467.com/changzhou/co/31246.htm
烟台市弘祥食品科技有限公司,http://www.11467.com/yantai/co/154646.htm
广州贪吃猫商贸有限公司,http://www.11467.com/guangzhou/co/455283.htm
大连育明食品有限公司,http://www.11467.com/dalian/co/59849.htm
大连江能海产品有限公司,http://www.11467.com/dalian/co/42324.htm
大连众市商贸有限公司,http://www.11467.com/dalian/co/59748.htm
成都喜悦商贸有限责任公司,http://www.11467.com/chengdu/co/129210.htm
成都蜀香食品有限公司,http://www.11467.com/chengdu/co/124516.htm
辽宁北方食品有限公司,http://www.11467.com/dalian/co/58488.htm
星之语贸易有限公司,http://www.11467.com/fuzhou/co/154307.htm
森福(福州)食品有限公司,http://www.11467.com/fuzhou/co/156849.htm
广州市互达食品贸易有限公司,http://www.11467.com/guangzhou/co/161562.htm
成都市吉香僖食品有限公司,http://www.11467.com/chengdu/co/129073.htm
大连平和食品有限公司,http://www.11467.com/dalian/co/39111.htm
大理百里园生态食品发展有限公司,http://www.11467.com/dali/co/12990.htm
河北百味生物科技有限公司,http://www.11467.com/handan/co/68206.htm
鄂州市梁子岛水特产工贸有限公司,http://www.11467.com/ezhou/co/5436.htm
广州黄万贸易有限公司,http://www.11467.com/guangzhou/co/319529.htm
广州尚食坊食品贸易有限公司,http://www.11467.com/guangzhou/co/496333.htm
广州市傲蕾贸易有限公司,http://www.11467.com/guangzhou/co/491356.htm
大连鑫洋食品有限公司,http://www.11467.com/dalian/co/1096.htm
大连亿美味商贸有限公司,http://www.11467.com/dalian/co/75824.htm
四川尚品云香餐饮管理有限公司,http://www.11467.com/chengdu/co/236161.htm
广州市协昌进出口贸易有限公司,http://www.11467.com/guangzhou/co/429830.htm
宁夏中宁县金河枸杞开发有限公司,http://www.11467.com/guangyuan/co/19785.htm
广州市禾骏贸易有限公司,http://www.11467.com/guangzhou/co/386697.htm
广州大白鲨商业有限公司,http://www.11467.com/guangzhou/co/169644.htm
广州市南一进出口贸易有限公司,http://www.11467.com/guangzhou/co/387097.htm
郴州市年年有东江鱼特色食品制造有限公司,http://www.11467.com/chenzhou/co/20196.htm
大连连途国际贸易有限公司,http://www.11467.com/dalian/co/57306.htm
大连科信伟业机电设备有限公司,http://www.11467.com/dalian/co/35133.htm
东莞市华美食品公司,http://www.11467.com/dongguan/co/366995.htm
广州市金友食品有限公司,http://www.11467.com/guangzhou/co/455678.htm
广州市爵仕食品有限公司,http://www.11467.com/guangzhou/co/459858.htm
济南顺发食品有限责任公司,http://www.11467.com/jinan/co/104223.htm
临沂富春食品有限公司,http://www.11467.com/linyi/co/2114.htm
沂水金行东海食品有限公司,http://www.11467.com/linyi/co/70742.htm
临沂来利食品有限公司,http://www.11467.com/linyi/co/2137.htm
绵阳平政食品有限公司,http://www.11467.com/mianyang/co/1800.htm
金华市金露火腿食品有限公司,http://www.11467.com/jinhua/co/80739.htm
云南省通海斯贝佳食品有限公司,http://www.11467.com/kunming/co/103134.htm
湖州奥奇食品有限公司,http://www.11467.com/huzhou/co/52876.htm
江门市新会大有酱园食品有限公司,http://www.11467.com/jiangmen/co/85653.htm
杭州梦里网络科技有限公司,http://www.11467.com/hangzhou/co/222202.htm
合肥史义兴食品有限责任公司,http://www.11467.com/hefei/co/4106.htm
淮安市科苑渔业发展有限公司,http://www.11467.com/huaian/co/3169.htm
江苏老侯珍禽食品有限公司,http://www.11467.com/huaian/co/36225.htm
呼和浩特市草原升升吉食品有限责任公司,http://www.11467.com/huhehaote/co/28301.htm
连云港赶海人商贸有限公司,http://www.11467.com/lianyungang/co/31067.htm
兰州嘉年华食品有限公司,http://www.11467.com/lanzhou/co/70808.htm
济南雅奇客食品有限公司,http://www.11467.com/jinan/co/104246.htm
浙江五芳斋实业股份有限公司,http://www.11467.com/jiaxing/co/60454.htm
杭州尚农食品有限公司,http://www.11467.com/hangzhou/co/289927.htm
昆明鑫淅淋商贸有限公司,http://www.11467.com/kunming/co/121749.htm
建德市农家宝食品有限公司,http://www.11467.com/hangzhou/co/369496.htm
湖州易强食品有限公司,http://www.11467.com/huzhou/co/27196.htm
梅河口市裕峰林珍食品有限公司,http://www.11467.com/jilinshi/co/82343.htm
湖州中恒食品有限公司,http://www.11467.com/huzhou/co/56903.htm
衢州市宝贺商贸有限公司,http://www.11467.com/jinhua/co/121809.htm
临安土宝食品有限公司,http://www.11467.com/hangzhou/co/291995.htm
泉州市天顺食品机械有限公司,http://www.11467.com/quanzhou/co/92732.htm
南京尊诚食品有限公司,http://www.11467.com/nanjing/co/19002.htm
南京乐创投资管理有限公司,http://www.11467.com/nanjing/co/101683.htm
汕头市大同食品实业有限公司,http://www.11467.com/shantou/co/136323.htm
汕头市乐柏福食品有限公司,http://www.11467.com/shantou/co/137275.htm
汕头市正东食品有限公司,http://www.11467.com/shantou/co/133958.htm
汕头市丹顿食品有限公司,http://www.11467.com/shantou/co/2668.htm
三明市天一食品有限责任公司,http://www.11467.com/sanming/co/31795.htm
三明市闽发食品有限公司,http://www.11467.com/sanming/co/16956.htm
山东沙土食品工业有限公司,http://www.11467.com/qingdao/co/114205.htm
青岛海元素食品有限公司,http://www.11467.com/qingdao/co/114276.htm
晋江市美好时光食品有限公司,http://www.11467.com/quanzhou/co/111062.htm
汕头市非凡食品有限公司,http://www.11467.com/shantou/co/133923.htm
如东正雄贸易有限公司,http://www.11467.com/nanjing/co/101695.htm
南京佳盛炒货食品有限公司,http://www.11467.com/nanjing/co/114631.htm
安溪思泓茶业有限公司,http://www.11467.com/quanzhou/co/133230.htm
福建省古田县人本贸易有限公司,http://www.11467.com/ningde/co/36157.htm
南京建德食品有限公司,http://www.11467.com/nanjing/co/101663.htm
南通新浪海苔食品有限公司,http://www.11467.com/nantong/co/33150.htm
南通佶庆商贸有限公司,http://www.11467.com/nantong/co/104080.htm
南京三义食品有限公司,http://www.11467.com/nanjing/co/4818.htm
汕头市澄海区金筷子食品有限公司,http://www.11467.com/shantou/co/137286.htm
日照金增商贸有限公司,http://www.11467.com/rizhao/co/24987.htm
南京可易得机械设备有限公司,http://www.11467.com/nanjing/co/114716.htm
秦皇岛燕山板栗食品有限公司,http://www.11467.com/qingyang/co/12338.htm
钦州市桂钦食品有限责任公司,http://www.11467.com/qinzhou/co/3427.htm
霞浦县一然水产有限公司,http://www.11467.com/ningde/co/29561.htm
西峡县福莱尔航空食品有限公司,http://www.11467.com/nanyang/co/36620.htm
宁波渔传生物科技有限公司,http://www.11467.com/ningbo/co/193502.htm
广西南宁和雅商贸有限责任公司,http://www.11467.com/nanning/co/61110.htm
南宁市森者食品有限公司,http://www.11467.com/nanning/co/86645.htm
海门泽雅化工有限公司,http://www.11467.com/nantong/co/140572.htm
太原云儿贸易有限公司,http://www.11467.com/taiyuan/co/102843.htm
石家庄凌峰农副产品开发有限公司,http://www.11467.com/shijiazhuang/co/100045.htm
乌鲁木齐全得利工贸有限公司,http://www.11467.com/wulumuqi/co/65344.htm
武汉香芝斋绿色食品有限公司,http://www.11467.com/wuhan/co/103944.htm
绿大地果品批发商贸有限公司,http://www.11467.com/wulumuqi/co/97506.htm
石家庄盛中祥贸易有限公司,http://www.11467.com/shijiazhuang/co/100033.htm
沈阳市山山伟业商贸有限公司,http://www.11467.com/shenyang/co/74747.htm
沈阳张记食品有限公司,http://www.11467.com/shenyang/co/74748.htm
锦州今明未电子商务有限公司,http://www.11467.com/shenyang/co/57470.htm
深圳市丰达进出口有限公司,http://www.11467.com/shenzhen/co/341.htm
苏州市百龄麦食品有限公司,http://www.11467.com/suzhou/co/1538.htm
山西迪乐福食品有限责任公司,http://www.11467.com/taiyuan/co/102835.htm
太原红昌龙商贸有限公司,http://www.11467.com/taiyuan/co/102838.htm
苏州市胥城食品添加剂有限责任公司,http://www.11467.com/suzhou/co/4947.htm
武汉七好食品有限公司,http://www.11467.com/wuhan/co/103930.htm
深圳安琪月饼有限公司,http://www.11467.com/shenzhen/co/668906.htm
武汉春泽楚城商贸有限公司,http://www.11467.com/wuhan/co/141236.htm
沈阳好吉利商贸有限公司,http://www.11467.com/shenyang/co/33351.htm
武汉君仪行商贸有限公司,http://www.11467.com/wuhan/co/63161.htm
深圳市海内贸易有限公司,http://www.11467.com/shenzhen/co/758381.htm
深圳市江汇工贸有限公司,http://www.11467.com/shenzhen/co/794403.htm
深圳市森派电子科技有限公司,http://www.11467.com/shenzhen/co/778469.htm
深圳市华旺进出口有限公司,http://www.11467.com/shenzhen/co/810770.htm
芜湖市鑫资冠商贸有限公司,http://www.11467.com/wuhu/co/35298.htm
武汉大东门水产贸易有限公司,http://www.11467.com/wuhan/co/103222.htm
宜昌华尔食品有限责任公司,http://www.11467.com/yichang/co/22204.htm
湛江市煌佳食品有限公司,http://www.11467.com/zhanjiang/co/41239.htm
厦门金伯莱进出口有限公司,http://www.11467.com/xiamen/co/74532.htm
西安美和食品有限责任公司,http://www.11467.com/xian/co/1632.htm
厦门良一食品有限公司,http://www.11467.com/xiamen/co/70122.htm
福建省旷野食品有限公司,http://www.11467.com/xiamen/co/74687.htm
新疆金果王商贸有限责任公司,http://www.11467.com/wulumuqi/co/97487.htm
新疆赵氏特产批发有限公司,http://www.11467.com/wulumuqi/co/97526.htm
雨禾天然物产有限公司,http://www.11467.com/wulumuqi/co/97483.htm
新疆水花果品有限责任公司,http://www.11467.com/wulumuqi/co/97246.htm
宁夏沃福百瑞生物食品工程有限公司,http://www.11467.com/yinchuan/co/35412.htm
枣庄市乔升源食品有限公司,http://www.11467.com/zaozhuang/co/14433.htm
漳州市向华工贸有限公司,http://www.11467.com/zhangzhou/co/21499.htm
信阳市金星贸易有限公司,http://www.11467.com/xinyang/co/15255.htm
徐州市彭宇食品有限公司,http://www.11467.com/xuzhou/co/5566.htm
珠海市裕高经贸有限公司,http://www.11467.com/zhuhai/co/85665.htm
扬州美瑞食品有限公司,http://www.11467.com/yangzhou/co/79111.htm
漳州市天合商贸有限公司,http://www.11467.com/zhangzhou/co/54804.htm
平顶山市秦新民食品有限公司,http://www.11467.com/zhengzhou/co/137258.htm
厦门市闽之未食品有限公司,http://www.11467.com/xiamen/co/5935.htm
无锡聚味达餐饮管理有限公司,http://www.11467.com/wuxi/co/249745.htm
郑州郑亚化工产品有限公司,http://www.11467.com/zhengzhou/co/188889.htm
河南百路升商贸有限公司,http://www.11467.com/zhengzhou/co/189060.htm
漳州市龙文区南荣工贸有限公司,http://www.11467.com/zhangzhou/co/28625.htm
新疆东盛康博食品有限公司,http://www.11467.com/wulumuqi/co/97505.htm
襄阳三珍食品有限公司,http://www.11467.com/xiangfan/co/189.htm
厦门茗雨轩贸易有限公司,http://www.11467.com/xiamen/co/9043.htm
厦门金兴能进出口有限公司,http://www.11467.com/xiamen/co/103454.htm
新疆泰格尔商贸有限公司,http://www.11467.com/wulumuqi/co/93554.htm
漳浦县吉利食品有限公司,http://www.11467.com/zhangzhou/co/43397.htm
肇庆市端州区品美贸易有限公司,http://www.11467.com/zhaoqing/co/40466.htm
北京佳翊鑫旺食品有限公司,http://www.11467.com/beijing/co/286516.htm
中山市马顿贸易有限公司,http://www.11467.com/zhongshan/co/148844.htm
北京蒙原旭日商贸有限公司,http://www.11467.com/beijing/co/180560.htm
北京红楼宫食品有限公司,http://www.11467.com/beijing/co/569877.htm
北京尚荣佳缘贸易有限责任公司,http://www.11467.com/beijing/co/30541.htm
北京曦誉信国际商贸有限公司,http://www.11467.com/beijing/co/673021.htm
北京兴盛银石贸易有限公司,http://www.11467.com/beijing/co/252910.htm
果来香果品有限责任公司,http://www.11467.com/beijing/co/252524.htm
上海佳世强商贸有限公司,http://www.11467.com/shanghai/co/686050.htm
上海冠宇食品有限公司,http://www.11467.com/shanghai/co/894383.htm
上海科研食品合作公司,http://www.11467.com/shanghai/co/809319.htm
上海绿鸣商贸有限公司,http://www.11467.com/shanghai/co/894433.htm
上海今阳食品销售有限公司,http://www.11467.com/shanghai/co/49544.htm
天津理洋泽机电设备有限公司,http://www.11467.com/tianjin/co/137243.htm
天津市百品汇商贸有限公司,http://www.11467.com/tianjin/co/74018.htm
天津市盛方金源商贸有限责任公司,http://www.11467.com/tianjin/co/187751.htm
天津市英特食品有限公司,http://www.11467.com/tianjin/co/184020.htm
天津市美华食品有限公司,http://www.11467.com/tianjin/co/109880.htm
重庆福汇来商贸有限公司,http://www.11467.com/chongqing/co/100257.htm
重庆市世湖圆食品有限公司,http://www.11467.com/chongqing/co/149145.htm
上海如源食品有限公司,http://www.11467.com/shanghai/co/167717.htm
聚河贸易（上海）有限公司,http://www.11467.com/shanghai/co/89199.htm
北京盈新源食品有限公司,http://www.11467.com/beijing/co/488302.htm
上海远健贸易有限公司,http://www.11467.com/shanghai/co/744353.htm
上海来鸿食品有限公司,http://www.11467.com/shanghai/co/16937.htm
广州同喜食品有限公司,http://www.11467.com/tianjin/co/37860.htm
上海圣宁实业有限公司,http://www.11467.com/shanghai/co/1035136.htm
北京嘉诚商贸公司,http://www.11467.com/beijing/co/30538.htm
沃斯葳(北京)贸易有限公司,http://www.11467.com/beijing/co/180561.htm
北京一品食品有限公司,http://www.11467.com/beijing/co/591683.htm
上海地珍实业有限公司,http://www.11467.com/shanghai/co/1055633.htm
上海惠羲龙贸易有限公司,http://www.11467.com/shanghai/co/1058142.htm
烨悦(上海)贸易有限公司,http://www.11467.com/shanghai/co/1052288.htm
北京莲顺食品有限公司,http://www.11467.com/beijing/co/569945.htm
北京西贝田园贸易有限公司,http://www.11467.com/beijing/co/431491.htm
上海振新企业发展公司,http://www.11467.com/shanghai/co/251178.htm
烟台盛旭电子商务有限公司,http://www.11467.com/yantai/co/178134.htm
赤峰市瓜子张食品有限责任公司,http://www.11467.com/chifeng/co/27233.htm
南京喜壳哥电子商务有限公司,http://www.11467.com/nanjing/co/160538.htm
娄底市谷泰食品有限责任公司,http://www.11467.com/loudi/co/23332.htm
石家庄君恩商贸有限公司,http://www.11467.com/shijiazhuang/co/188996.htm
海南南国食品实业股份有限公司,http://www.11467.com/haikou/co/4991.htm
北京中钜铖国际贸易有限公司上海分公司,http://www.11467.com/shanghai/co/1067143.htm
广州赛冠贸易有限公司,http://www.11467.com/guangzhou/co/642189.htm
广西北部湾正祥天瑞国际贸易有限公司,http://www.11467.com/beihai/co/18347.htm
海阳市思远食品有限公司,http://www.11467.com/yantai/co/170707.htm
河南怡鹭食品有限公司,http://www.11467.com/xinyang/co/32759.htm
浙江多安心电子商务有限公司,http://www.11467.com/huzhou/co/86725.htm
山东金枣网络科技有限公司,http://www.11467.com/tianjin/co/247057.htm
太原鹏志食品有限公司,http://www.11467.com/taiyuan/co/129490.htm
常州百客旺食品有限公司,http://www.11467.com/changzhou/co/162747.htm
大连乐渔海洋食品有限公司,http://www.11467.com/dalian/co/78341.htm
陕西安康高新岭南印象电子商务有限公司,http://www.11467.com/ankang/co/16678.htm
济南聚优食品有限公司,http://www.11467.com/jinan/co/157107.htm
深圳福士进口食品有限公司,http://www.11467.com/shenzhen/co/1037658.htm
海南保亭椰泽坊食品有限公司,http://www.11467.com/baoting/co/10.htm
河南麦得隆食品有限公司,http://www.11467.com/xinyang/co/29785.htm
深圳市盈钰食品有限公司,http://www.11467.com/shenzhen/co/1100617.htm
河南好品味果品有限公司,http://www.11467.com/zhumadian/co/39109.htm
合肥百安特商贸有限公司,http://www.11467.com/hefei/co/161425.htm
临颍县麦食香食品有限公司,http://www.11467.com/luohe/co/27174.htm
济南解馋牛排牛骨煲餐饮有限公司,http://www.11467.com/jinan/co/157039.htm
厦门裕星宏贸易有限公司,http://www.11467.com/xiamen/co/175266.htm
深圳海基贸易有限公司,http://www.11467.com/shenzhen/co/1087349.htm
临渭区明森食品有限公司,http://www.11467.com/weinan/co/24637.htm
海口万家绿农产品有限公司,http://www.11467.com/haikou/co/4368.htm
重庆市七源食品有限公司,http://www.11467.com/chongqing/co/80215.htm
陕西大荔沙苑黄花有限责任公司,http://www.11467.com/weinan/co/25175.htm
新干天恒贸易有限公司,http://www.11467.com/tianjin/co/306728.htm
欧雅餐饮管理有限公司,http://www.11467.com/guangzhou/co/511544.htm
新兴县荔园食品有限公司,http://www.11467.com/yunfu/co/36991.htm
河南一生何求商贸有限公司,http://www.11467.com/zhengzhou/co/220363.htm
东莞爱文网络科技有限公司,http://www.11467.com/dongguan/co/605961.htm
衢州市乐有有人参科技有限公司,http://www.11467.com/quzhou/co/37757.htm
德州建新食品有限公司,http://www.11467.com/dezhou/co/9375.htm
大连方云食品有限公司,http://www.11467.com/dalian/co/1361.htm
福州开开食品有限公司,http://www.11467.com/fuzhou/co/17253.htm
福州汉妮食品有限公司,http://www.11467.com/fuzhou/co/136065.htm
抚州农海实业有限公司,http://www.11467.com/fuzhoushi/co/16715.htm
贵阳吉品风味食品有限公司,http://www.11467.com/guiyang/co/70070.htm
南宁市好友缘国宴饭店有限公司,http://www.11467.com/nanning/co/98512.htm
福建全味食品有限公司,http://www.11467.com/fuzhou/co/211663.htm
福州金棒棒食品有限公司,http://www.11467.com/fuzhou/co/156817.htm
北京鑫源盛博餐饮管理有限公司,http://www.11467.com/beijing/co/790070.htm
北京EPY宴会服务有限公司,http://www.11467.com/beijing/co/627687.htm
满洲里市爱林商贸有限公司,http://www.11467.com/qiye/93087468.htm
宁波亿彩购跨境电子商务有限公司江北分公司,http://www.11467.com/ningbo/co/232286.htm
吐鲁番市新果度果业有限公司,http://www.11467.com/tulufan/co/5086.htm
珠海横琴普文贸易有限公司,http://www.11467.com/guangzhou/co/494709.htm
上海杰士客食品有限公司,http://www.11467.com/shanghai/co/538715.htm
青岛东鹏食品有限公司,http://www.11467.com/qingdao/co/125315.htm
广州市民晟贸易有限公司,http://www.11467.com/guangzhou/co/494960.htm
北京市圣路行科贸发展有限公司,http://www.11467.com/beijing/co/145406.htm
上海梯傲生物科技有限公司,http://www.11467.com/shanghai/co/1305108.htm
绥芬河无疆经贸有限公司,http://www.11467.com/mudanjiang/co/52177.htm
笨浣熊电子商务（深圳）有限公司,http://www.11467.com/shenzhen/co/1128346.htm
常州市周氏伟业食品有限公司,http://www.11467.com/changzhou/co/31355.htm
英吉沙盛世疆南电子商务有限公司,http://www.11467.com/kashi/co/9322.htm
佛山市南海区洪味食品有限公司,http://www.11467.com/foshan/co/473059.htm
沁阳市程果电子商务有限公司,http://www.11467.com/jiaozuo/co/42903.htm
上海群海网络信息技术有限公司,http://www.11467.com/guangzhou/co/495220.htm
广州樱都贸易有限公司,http://www.11467.com/guangzhou/co/473997.htm
阳西县品诺生物科技有限公司,http://www.11467.com/guangzhou/co/496556.htm
新疆美德福商贸有限公司,http://www.11467.com/wulumuqi/co/97224.htm
南京伊百客投资管理有限公司,http://www.11467.com/nanjing/co/157070.htm
天津市杜杜食品有限公司,http://www.11467.com/tianjin/co/110151.htm
广州古古香餐饮企业管理有限公司,http://www.11467.com/guangzhou/co/432916.htm
商丘灵动电子商务有限公司,http://www.11467.com/shangqiu/co/47147.htm
开平市绿色攻略贸易有限公司,http://www.11467.com/jiangmen/co/166909.htm
无锡市腾业信息咨询服务有限公司,http://www.11467.com/wuxi/co/178749.htm
汕头市喜悦健康食品有限公司,http://www.11467.com/shantou/co/40547.htm
临沂市泰沂食品有限责任公司,http://www.11467.com/linyi/co/9949.htm
昆明伊仕达食品有限公司,http://www.11467.com/kunming/co/253.htm
西昌市鑫力油脂食品有限公司,http://www.11467.com/kunming/co/116739.htm
呼和浩特市钱毅食品有限责任公司,http://www.11467.com/huhehaote/co/27974.htm
呼和浩特市阿希泰食品有限公司,http://www.11467.com/huhehaote/co/16959.htm
湖州茂业食品有限公司,http://www.11467.com/huzhou/co/1037.htm
青岛东晨食品有限公司,http://www.11467.com/qingdao/co/6768.htm
山西嘉荣农业科技开发有限公司,http://www.11467.com/taiyuan/co/102832.htm
厦门市澎澎食品有限公司,http://www.11467.com/xiamen/co/74747.htm
烟台阿来利食品有限公司,http://www.11467.com/yantai/co/120929.htm
汕头市味奇食品有限公司,http://www.11467.com/shantou/co/133939.htm
郑州同创益生食品有限公司,http://www.11467.com/zhengzhou/co/3960.htm
中山市百花园食品有限公司,http://www.11467.com/zhongshan/co/1144.htm
贵阳金熊猫食品添加剂有限责任公司,http://www.11467.com/guiyang/co/1333.htm
呼和浩特市伊品天香食品有限公司,http://www.11467.com/huhehaote/co/27636.htm
沈阳和润轻工实业有限公司,http://www.11467.com/shenyang/co/52412.htm
菏泽米娃娃食品有限公司,http://www.11467.com/heze/co/22365.htm
云南信威食品有限公司,http://www.11467.com/kunming/co/116586.htm
银川丝路明珠商贸有限公司,http://www.11467.com/yinchuan/co/44385.htm
深圳市高美食品有限公司,http://www.11467.com/shenzhen/co/809456.htm
深圳市仙之宝食品有限公司,http://www.11467.com/shenzhen/co/667019.htm
霞浦闽东海水产有限公司,http://www.11467.com/ningde/co/2148.htm
郑州禾森商贸有限公司,http://www.11467.com/zhengzhou/co/182335.htm
郑州淘枣王商贸有限公司,http://www.11467.com/zhengzhou/co/188882.htm
广东旺通食品有限公司,http://www.11467.com/yangjiang/co/7153.htm
厦门福中味食品有限公司,http://www.11467.com/xiamen/co/103419.htm
