辽宁省阜新市诚实房屋维修有限公司,http://www.11467.com/fuxin/co/16833.htm
安徽古井实业发展有限公司,http://www.11467.com/fuyang/co/27987.htm
创新雕塑有限责任公司,http://www.11467.com/fuyang/co/27849.htm
安徽开天装饰工程有限公司,http://www.11467.com/fuyang/co/27823.htm
江西新正大烟塔技术有限公司,http://www.11467.com/fuzhoushi/co/17002.htm
抚州市伟顺装饰工程公司,http://www.11467.com/fuzhoushi/co/17029.htm
中安通达海外劳务合作公司,http://www.11467.com/fuzhoushi/co/17036.htm
四川天润房地产开发有限公司,http://www.11467.com/guangyuan/co/17111.htm
桂林建安监理公司,http://www.11467.com/guilin/co/47636.htm
新嘉源装饰有限公司,http://www.11467.com/guilin/co/47685.htm
贵州奇美装饰工程有限公司,http://www.11467.com/guiyang/co/77693.htm
贵州艾嘉雅庭装饰有限公司,http://www.11467.com/guiyang/co/77972.htm
贵州至誉建筑装饰工程有限责任公司,http://www.11467.com/guiyang/co/78026.htm
香港志翔建筑装饰工程公司,http://www.11467.com/guiyang/co/77772.htm
贵州省建三公司第四分公司,http://www.11467.com/guiyang/co/77775.htm
贵阳家装登高梯有限公司,http://www.11467.com/guiyang/co/78063.htm
贵州卓信房地产公司,http://www.11467.com/guiyang/co/77707.htm
红阳建材租赁公司,http://www.11467.com/guiyang/co/77948.htm
汇粤装饰有限公司,http://www.11467.com/guiyang/co/77840.htm
贵阳旗旌装饰有限公司,http://www.11467.com/guiyang/co/78079.htm
山东大汉建筑机械有限公司贵州销售部,http://www.11467.com/guiyang/co/77654.htm
贵阳佳饰家装饰工程有限公司,http://www.11467.com/guiyang/co/77798.htm
贵阳市佳百利建材有限公司,http://www.11467.com/guiyang/co/78103.htm
贵州建工集团第七建筑工程公司装饰分公司,http://www.11467.com/guiyang/co/77922.htm
新疆华海工程有限公司,http://www.11467.com/hami/co/4975.htm
杭州邮都装饰工程有限公司,http://www.11467.com/hangzhou/co/308000.htm
江西建工第四建筑有限责任公司,http://www.11467.com/hangzhou/co/308977.htm
腾飞装饰装潢有限公司,http://www.11467.com/hanzhong/co/23187.htm
东易日盛家居装饰集团股份有限公司石家庄分公司,http://www.11467.com/shijiazhuang/co/106693.htm
山西省朔州市恒泰昌商贸有限公司,http://www.11467.com/shuozhou/co/8614.htm
盘锦铭城建筑安装工程有限公司,http://www.11467.com/panjin/co/25628.htm
攀枝花市豪思佳居装饰工程有限公司,http://www.11467.com/panzhihua/co/16927.htm
平顶山居正建材有限责任公司,http://www.11467.com/pingdingshan/co/20086.htm
平顶山市东方家园装饰工程有限公司,http://www.11467.com/pingdingshan/co/20147.htm
平顶山市星宇装饰公司,http://www.11467.com/pingdingshan/co/20092.htm
萍乡大诚至盛装饰工程有限公司,http://www.11467.com/pingxiang/co/13159.htm
河南长兴设备防护公司,http://www.11467.com/puyang/co/21389.htm
濮阳市正方装饰工程有限公司,http://www.11467.com/puyang/co/21408.htm
濮阳市房地产开发公司,http://www.11467.com/puyang/co/21418.htm
青岛福瀛建设集团有限公司,http://www.11467.com/qingdao/co/123031.htm
庆阳晨阳物业管理有限公司,http://www.11467.com/qingyang/co/10658.htm
庆阳市鹏凌装饰工程有限公司,http://www.11467.com/qingyang/co/10646.htm
艺景装饰公司,http://www.11467.com/qingyang/co/10667.htm
新居源装饰有限公司,http://www.11467.com/qingyuan/co/24319.htm
秦皇岛金潭建筑装饰工程有限公司,http://www.11467.com/qinhuangdao/co/38622.htm
秦皇岛龙辉涂料有限公司,http://www.11467.com/qinhuangdao/co/38754.htm
秦皇岛市隆铭土木工程有限公司,http://www.11467.com/qinhuangdao/co/38623.htm
钦州华成投资公司,http://www.11467.com/qinzhou/co/8965.htm
中铁二十三局二公司,http://www.11467.com/qiqihaer/co/60064.htm
曲靖家佳乐装饰工程有限公司,http://www.11467.com/qujing/co/18844.htm
曲靖市天源房地产开发有限公司,http://www.11467.com/qujing/co/18874.htm
衢州市俞氏塑木复合建材有限公司,http://www.11467.com/quzhou/co/24899.htm
日照远大园林绿化工程有限公司1,http://www.11467.com/rizhao/co/16617.htm
彬缘信息公司,http://www.11467.com/rizhao/co/16861.htm
日照祥艺装饰有限公司,http://www.11467.com/rizhao/co/16535.htm
日照金亨建筑工程公司,http://www.11467.com/rizhao/co/16551.htm
日照鼎业工贸有限公司,http://www.11467.com/rizhao/co/16742.htm
山东宝磊建筑装饰工程有限公司,http://www.11467.com/rizhao/co/16672.htm
日照市华普机械有限公司，业务部,http://www.11467.com/rizhao/co/16581.htm
日照市深岚矿业发展有限公司,http://www.11467.com/rizhao/co/16683.htm
商丘市安泰工程公司,http://www.11467.com/shangqiu/co/17855.htm
建宏装饰有限公司,http://www.11467.com/shangqiu/co/17804.htm
上饶西市建筑公司,http://www.11467.com/shangrao/co/23410.htm
上饶润江房地产资讯有限公司,http://www.11467.com/shangrao/co/23338.htm
韶关泉晟实业发展有限公司,http://www.11467.com/shaoguan/co/26080.htm
韶关市万路防腐工程有限公司,http://www.11467.com/shaoguan/co/26111.htm
广东爱得威建设（集团）股份有限公司,http://www.11467.com/shenzhen/co/715674.htm
深圳市华典装饰工程有限公司,http://www.11467.com/shenzhen/co/714323.htm
深圳市洪涛装饰股份有限公司,http://www.11467.com/shenzhen/co/718272.htm
深圳市新永丰工业发展有限公司,http://www.11467.com/shenzhen/co/254073.htm
松原市建设工程有限公司,http://www.11467.com/songyuan/co/15811.htm
绥化市奥博建筑装饰工程有限公司,http://www.11467.com/suihua/co/14815.htm
湖北随州市皮蛋装饰工程有限公司,http://www.11467.com/suizhou/co/10426.htm
小云装饰公司,http://www.11467.com/suizhou/co/10397.htm
江苏江中集团有限公司,http://www.11467.com/suzhou/co/266936.htm
苏州市华丽美登装饰装璜有限公司,http://www.11467.com/suzhou/co/183300.htm
斐斐电脑公司,http://www.11467.com/suzhoushi/co/19036.htm
山西晋中建设集团直属十分公司,http://www.11467.com/taiyuan/co/105766.htm
天水市麦积区桥南建材市场名门装饰公司,http://www.11467.com/tianshui/co/16423.htm
万豪装饰有限公司,http://www.11467.com/tongliao/co/10102.htm
华鑫贸易有限贸易公司,http://www.11467.com/tongling/co/13014.htm
铜陵新浪装饰公司,http://www.11467.com/tongling/co/13008.htm
威海市金豪装饰工程有限公司,http://www.11467.com/weihai/co/35836.htm
威海新坤装饰公司,http://www.11467.com/weihai/co/35964.htm
威海今诺建设项目管理公司,http://www.11467.com/weihai/co/35889.htm
威海鑫碧淼装饰有限公司,http://www.11467.com/weihai/co/35953.htm
利风建筑有限公司,http://www.11467.com/weinan/co/22551.htm
内蒙乌海新发建材租赁公司,http://www.11467.com/wuhai/co/4351.htm
乌海市羽家装饰工程有限责任公司,http://www.11467.com/wuhai/co/4342.htm
武汉市傅友建设集团有限公司,http://www.11467.com/wuhan/co/114742.htm
乌兰察布市联建陆桥开发有限责任公司,http://www.11467.com/wulanchabu/co/6259.htm
新疆北新建设工程有限公司,http://www.11467.com/wulumuqi/co/99868.htm
远翔劳务公司,http://www.11467.com/wulumuqi/co/99898.htm
广西梧州市桦达安装工程有限公司,http://www.11467.com/wuzhou/co/17581.htm
梧州瑞丰园林绿化工程有限公司,http://www.11467.com/wuzhou/co/17576.htm
厦门市港龙装修工程有限公司,http://www.11467.com/xiamen/co/38434.htm
安利房屋拆迁有限责任公司,http://www.11467.com/xiangfan/co/40745.htm
童氏企业责任有限公司,http://www.11467.com/xianning/co/13641.htm
咸宁市三友房地产有限公司,http://www.11467.com/xianning/co/13649.htm
仙桃楚天源门窗装饰公司,http://www.11467.com/xiantao/co/15245.htm
孝感市华鑫凿井有限公司,http://www.11467.com/xiaogan/co/20822.htm
立志装饰公司,http://www.11467.com/xiaogan/co/20807.htm
青海建设工程装饰分公司,http://www.11467.com/xining/co/27559.htm
信阳市伟业装饰公司,http://www.11467.com/xinyang/co/20486.htm
河南恒昌房地产开发有限公司,http://www.11467.com/xinyang/co/20417.htm
信阳华威建筑公司,http://www.11467.com/xinyang/co/20499.htm
迪美装饰公司,http://www.11467.com/xinzhou/co/17523.htm
东莞市德森装饰设计工程有限公司,http://www.11467.com/dongguan/co/550817.htm
广州市亚卓展览服务有限公司,http://www.11467.com/guangzhou/co/419466.htm
广州市盛洲地基基础工程有限公司,http://www.11467.com/guangzhou/co/69412.htm
广州市陆益建筑材料有限公司,http://www.11467.com/guangzhou/co/90643.htm
杭州长和装饰工程有限公司,http://www.11467.com/hangzhou/co/307584.htm
杭州久城装饰工程有限公司,http://www.11467.com/hangzhou/co/306282.htm
杭州兰利装饰有限公司,http://www.11467.com/hangzhou/co/306458.htm
杭州正源室内装饰有限公司,http://www.11467.com/hangzhou/co/16911.htm
浙江省长城建设集团股份有限公司,http://www.11467.com/hangzhou/co/199061.htm
安徽智磊商业展柜装饰工程有限公司,http://www.11467.com/hefei/co/132275.htm
江门市贵兴装饰工程有限公司,http://www.11467.com/jiangmen/co/5745.htm
吉化集团吉林市北方建设有限责任公司,http://www.11467.com/jilinshi/co/14411.htm
济南建工总承包集团有限公司,http://www.11467.com/jinan/co/111632.htm
廊坊华宇创新科技有限公司,http://www.11467.com/langfang/co/28603.htm
河南一博板业有限公司,http://www.11467.com/luoyang/co/52597.htm
南京大明文化实业有限责任公司,http://www.11467.com/nanjing/co/111819.htm
南京国豪装饰安装工程有限公司,http://www.11467.com/nanjing/co/112643.htm
南宁浩尊会展服务有限公司,http://www.11467.com/nanning/co/78215.htm
青岛海都装饰装潢有限公司,http://www.11467.com/qingdao/co/13033.htm
清远市海泰房地产开发有限公司,http://www.11467.com/qingyuan/co/24243.htm
清远市华韵装饰设计有限公司,http://www.11467.com/qingyuan/co/27454.htm
沈阳新饰家装饰工程有限公司,http://www.11467.com/shenyang/co/5911.htm
沈阳三洋电梯有限公司安装分公司,http://www.11467.com/shenyang/co/79392.htm
深圳新艺华建筑装饰工程有限公司,http://www.11467.com/shenzhen/co/716448.htm
河北云顶土木工程有限公司,http://www.11467.com/shijiazhuang/co/106605.htm
河北正信建筑装饰工程有限公司,http://www.11467.com/shijiazhuang/co/2024.htm
石家庄一建建设集团有限公司,http://www.11467.com/shijiazhuang/co/106519.htm
苏州绿地装饰工程有限公司,http://www.11467.com/suzhou/co/311074.htm
中基建设有限公司,http://www.11467.com/suzhou/co/268233.htm
深圳市文业装饰工程有限公司,http://www.11467.com/wuhan/co/115577.htm
武汉盛堂装饰工程有限公司,http://www.11467.com/wuhan/co/14671.htm
武汉江城基础工程有限公司,http://www.11467.com/wuhan/co/32444.htm
武汉鑫亿家房地产顾问有限公司,http://www.11467.com/wuhan/co/114671.htm
武汉创世业建筑工程有限责任公司,http://www.11467.com/wuhan/co/115453.htm
烟台开发区双鹏建筑装饰有限公司,http://www.11467.com/yantai/co/2157.htm
宜昌天元一品装饰工程有限公司,http://www.11467.com/yichang/co/8104.htm
河南东方建设集团发展有限公司,http://www.11467.com/zhengzhou/co/146932.htm
中山市新锐装饰设计工程有限公司,http://www.11467.com/zhongshan/co/141198.htm
北京东方泰洋装饰工程有限公司,http://www.11467.com/beijing/co/191498.htm
北京富天玺建筑工程有限公司,http://www.11467.com/beijing/co/181052.htm
北京建工一建工程建设有限公司,http://www.11467.com/beijing/co/663739.htm
湖南德成建设工程有限公司,http://www.11467.com/changde/co/32878.htm
新疆中哈联国际贸易有限公司,http://www.11467.com/changji/co/13009.htm
成都烨华涂装工程有限公司,http://www.11467.com/chengdu/co/49187.htm
四川奥菲克斯建设工程有限公司,http://www.11467.com/chengdu/co/139914.htm
四川省中普建设有限公司,http://www.11467.com/chengdu/co/141129.htm
江苏飞龙装饰工程有限公司,http://www.11467.com/chifeng/co/24216.htm
大连兴达玻璃钢有限公司,http://www.11467.com/dalian/co/64399.htm
北京宜美家园建筑装饰工程有限公司安徽分公司,http://www.11467.com/hefei/co/161608.htm
广州市橙家装饰工程有限公司,http://www.11467.com/guangzhou/co/699745.htm
郑州地安防滑防护科技有限公司,http://www.11467.com/zhengzhou/co/226196.htm
北京新洲伟业装饰有限公司保定分公司,http://www.11467.com/baoding/co/143915.htm
润铭实业（深圳）有限公司,http://www.11467.com/shenzhen/co/1102414.htm
四平市展艺装饰工程有限公司,http://www.11467.com/siping/co/36603.htm
惠州市恒乐基装饰有限公司,http://www.11467.com/huizhou/co/162160.htm
十堰星梦想装饰工程有限公司,http://www.11467.com/shiyan/co/37859.htm
广西广马电梯设备有限公司,http://www.11467.com/yulin/co/23473.htm
祁阳业之峰日盛装饰工程有限公司,http://www.11467.com/yongzhou/co/34924.htm
湖南长沙金空间装饰实业有限公司,http://www.11467.com/changsha/co/223153.htm
石家庄乐活居装饰工程有限公司,http://www.11467.com/shijiazhuang/co/265967.htm
全椒万华装饰工程有限公司,http://www.11467.com/chuzhou/co/38888.htm
北京天道酬勤物业管理有限公司,http://www.11467.com/beijing/co/143034.htm
北京忠信博艺建筑装饰有限公司,http://www.11467.com/beijing/co/329524.htm
国都建设（集团）有限公司,http://www.11467.com/beijing/co/330595.htm
河南华都建设发展集团有限公司,http://www.11467.com/beijing/co/225761.htm
博洛尼旗舰装饰装修工程(北京)有限公司,http://www.11467.com/beijing/co/143385.htm
上海宝元化学建材有限公司,http://www.11467.com/shanghai/co/169271.htm
大华（集团）有限公司,http://www.11467.com/shanghai/co/26955.htm
上海成铭建筑工程有限公司,http://www.11467.com/shanghai/co/478920.htm
上海月恒建筑装饰工程有限公司,http://www.11467.com/shanghai/co/978815.htm
南通建工集团股份有限公司,http://www.11467.com/tianjin/co/147381.htm
重庆华发装修工程有限公司,http://www.11467.com/chongqing/co/195675.htm
重庆广怀实业（集团）有限公司,http://www.11467.com/chongqing/co/13635.htm
金戈马（北京）信息技术有限公司,http://www.11467.com/beijing/co/715892.htm
太原业之峰诺华装饰有限公司,http://www.11467.com/taiyuan/co/126254.htm
南京骐客网络有限公司,http://www.11467.com/nanjing/co/160358.htm
河南宜佳装饰工程有限公司,http://www.11467.com/kaifeng/co/24976.htm
普定县兴隆装饰工程有限责任公司,http://www.11467.com/anshun/co/9591.htm
黑龙江洞瀛汇建筑材料经销有限公司,http://www.11467.com/haerbin/co/72655.htm
成都欧概装饰设计有限公司,http://www.11467.com/chengdu/co/258553.htm
汕头市创兴建筑装饰工程有限公司,http://www.11467.com/shantou/co/154777.htm
天水城市人家装饰有限公司,http://www.11467.com/tianshui/co/18508.htm
长沙凯健建筑咨询有限公司,http://www.11467.com/changsha/co/154804.htm
贵阳远华建筑装饰工程有限公司,http://www.11467.com/guiyang/co/86633.htm
江苏诚海智能科技有限公司,http://www.11467.com/nanjing/co/170076.htm
双城市北方金属艺术装饰公司,http://www.11467.com/haerbin/co/75350.htm
深圳宏钰堂建筑装饰工程有限公司郑州分公司,http://www.11467.com/zhengzhou/co/216248.htm
四川本意空间建筑装饰有限公司,http://www.11467.com/chengdu/co/282998.htm
重庆建工第三建设有限责任公司,http://www.11467.com/chongqing/co/266577.htm
郑州中道展览展示服务有限公司,http://www.11467.com/zhengzhou/co/222816.htm
吉首苹果装饰设计工程有限公司,http://www.11467.com/xianxi/co/15682.htm
湖南汇智装饰工程有限公司,http://www.11467.com/changsha/co/192930.htm
北京爱江山国际装饰工程有限公司,http://www.11467.com/beijing/co/762470.htm
河南艺尚建筑装饰工程有限公司,http://www.11467.com/zhengzhou/co/225949.htm
成都面对面装饰工程有限公司,http://www.11467.com/chengdu/co/283756.htm
青岛宏达建筑装潢工程总公司,http://www.11467.com/qingdao/co/123288.htm
浙江环宇建设集团有限公司,http://www.11467.com/shaoxing/co/53044.htm
沈阳万荣装饰材料有限公司,http://www.11467.com/shenyang/co/79946.htm
沈阳帧帝三维建筑艺术有限公司,http://www.11467.com/shenyang/co/79950.htm
沈阳果实装饰工程有限公司,http://www.11467.com/shenyang/co/80652.htm
广东省台山市鸿坚建筑工程有限公司宝安分公司,http://www.11467.com/shenzhen/co/38810.htm
广东五华二建工程有限公司深圳分公司防水补漏服务部,http://www.11467.com/shenzhen/co/717903.htm
深圳市龙岗区江生防水补漏公司,http://www.11467.com/shenzhen/co/718693.htm
深圳市金雅颂钢结构有限公司,http://www.11467.com/shenzhen/co/783562.htm
深圳市名雕装饰工程有限公司,http://www.11467.com/shenzhen/co/718465.htm
深圳市鑫辉装饰工程有限公司,http://www.11467.com/shenzhen/co/716672.htm
深圳瑞华建设有限公司采购部,http://www.11467.com/shenzhen/co/720136.htm
深圳市中大建设集团有限公司,http://www.11467.com/shenzhen/co/711110.htm
苏州广奕置业开发有限公司,http://www.11467.com/suzhou/co/266733.htm
苏州日月幕墙装饰工程有限公司,http://www.11467.com/suzhou/co/267402.htm
中建四局第六建筑工程有限公司,http://www.11467.com/suzhou/co/267393.htm
苏州二建建筑集团有限公司,http://www.11467.com/suzhou/co/267232.htm
山西新弘祺房地产开发有限公司,http://www.11467.com/taiyuan/co/23472.htm
浙江东运建设股份有限公司质安科,http://www.11467.com/taizhou/co/105097.htm
江苏天龙建设工程有限公司,http://www.11467.com/taizhoushi/co/34635.htm
潍坊方程工程有限公司,http://www.11467.com/weifang/co/92313.htm
潍坊市华能置业有限公司,http://www.11467.com/weifang/co/92731.htm
威海市水利岩土工程有限公司,http://www.11467.com/weihai/co/9514.htm
华彩房屋装饰有限公司,http://www.11467.com/wenzhou/co/169013.htm
武汉市美多尼装饰材料有限公司,http://www.11467.com/wuhan/co/116481.htm
武汉华乐地产拓展有限公司,http://www.11467.com/wuhan/co/114764.htm
湖北鼎元建筑装饰工程有限公司,http://www.11467.com/wuhan/co/14699.htm
芜湖市绿庄工业技术有限责任公司,http://www.11467.com/wuhu/co/17748.htm
常熟市宝华建筑装璜材料有限公司无锡分公司,http://www.11467.com/wuxi/co/42492.htm
厦门市彩家装饰工程有限公司,http://www.11467.com/xiamen/co/82243.htm
厦门都市名殿家居工程有限公司[家装部],http://www.11467.com/xiamen/co/83830.htm
厦门鹭苑翔龙装饰工程有限公司,http://www.11467.com/xiamen/co/83600.htm
厦门华丽新工程发展有限公司,http://www.11467.com/xiamen/co/81625.htm
陕西欣宇装修装饰有限公司,http://www.11467.com/xian/co/10292.htm
西安飞机工业装饰装修工程股份有限公司,http://www.11467.com/xian/co/45670.htm
冬霞装修公司,http://www.11467.com/xian/co/94053.htm
中铁十一局集团第一工程有限公司,http://www.11467.com/xiangfan/co/32502.htm
徐州泰隆建筑工程有限公司,http://www.11467.com/xuzhou/co/62977.htm
江苏省千秋高空建修防腐有限公司,http://www.11467.com/yancheng/co/54649.htm
扬州三布纺织有限公司,http://www.11467.com/yangzhou/co/79541.htm
山东鼎盛建筑安装有限公司,http://www.11467.com/yantai/co/133195.htm
河南水利建筑工程有限公司,http://www.11467.com/zhengzhou/co/31013.htm
河南省博大工程管理有限公司,http://www.11467.com/zhengzhou/co/145382.htm
中建七局安装工程公司,http://www.11467.com/zhengzhou/co/146681.htm
郑州天恒建筑劳务分包有限公司,http://www.11467.com/zhengzhou/co/56714.htm
江苏中强钢结构有限公司,http://www.11467.com/zhenjiang/co/59589.htm
珠海柏雅暖通设备有限公司,http://www.11467.com/zhuhai/co/6305.htm
北京广庭泽业建筑装饰公司,http://www.11467.com/beijing/co/144259.htm
北京东方巨龙金属制品有限公司,http://www.11467.com/beijing/co/226254.htm
北京宏福钢结构工程有限公司,http://www.11467.com/beijing/co/32809.htm
北京宏达装饰工程有限公司,http://www.11467.com/beijing/co/141808.htm
北京宏扬恒艺装饰装修有限公司,http://www.11467.com/beijing/co/330166.htm
北京思创蓝石建设有限公司,http://www.11467.com/beijing/co/142917.htm
北京腾达兴盛轻钢彩板有限公司,http://www.11467.com/beijing/co/626793.htm
北京合创国际建筑装饰工程有限公司,http://www.11467.com/beijing/co/626967.htm
北京昭德投资有限公司,http://www.11467.com/beijing/co/143763.htm
北京青龙宝鼎装饰装潢有限公司,http://www.11467.com/beijing/co/225582.htm
北京智达世通装饰工程有限公司,http://www.11467.com/beijing/co/438006.htm
雷鼎金刚装饰工程有限公司,http://www.11467.com/beijing/co/141514.htm
东阳市盛达建筑工程有限公司,http://www.11467.com/beijing/co/329048.htm
厦门恒日贸易有限公司,http://www.11467.com/beijing/co/142607.htm
北京泽辉建筑装饰工程有限公司,http://www.11467.com/beijing/co/438468.htm
中铁建设集团有限公司,http://www.11467.com/beijing/co/142451.htm
上海德超科贸有限公司,http://www.11467.com/shanghai/co/978750.htm
红阳建设集团有限公司,http://www.11467.com/shanghai/co/747144.htm
上海划云建筑装饰工程有限公司,http://www.11467.com/shanghai/co/921336.htm
上海朗益装饰工程有限公司,http://www.11467.com/shanghai/co/948427.htm
上海龙宇建设股份有限公司,http://www.11467.com/shanghai/co/251960.htm
上海劲嘉建材科技有限公司,http://www.11467.com/shanghai/co/268093.htm
上海江河幕墙系统工程有限公司-采购供应中心,http://www.11467.com/shanghai/co/897379.htm
上海交通建设总承包有限公司,http://www.11467.com/shanghai/co/692177.htm
上海市第四建筑有限公司,http://www.11467.com/shanghai/co/691676.htm
上海灵鹫石材有限公司,http://www.11467.com/shanghai/co/329637.htm
上海鹭城建筑幕墙工程有限公司,http://www.11467.com/shanghai/co/848133.htm
上海鹭盛装潢工程有限公司,http://www.11467.com/shanghai/co/811013.htm
上海润迅建筑装饰工程有限公司,http://www.11467.com/shanghai/co/537211.htm
上海欣进建筑装饰工程有限公司,http://www.11467.com/shanghai/co/220001.htm
中铁十八局集团有限公司,http://www.11467.com/shanghai/co/428944.htm
中交第三航务工程局有限公司,http://www.11467.com/shanghai/co/948691.htm
仕行（上海）建筑装饰工程有限公司,http://www.11467.com/shanghai/co/329727.htm
上海奥邦装饰设计有限公司,http://www.11467.com/shanghai/co/670511.htm
上海中深建筑装饰工程有限公司,http://www.11467.com/shanghai/co/53018.htm
上海淑慧装饰材料有限公司,http://www.11467.com/shanghai/co/691828.htm
天津长飞装饰有限公司生产销售部,http://www.11467.com/tianjin/co/118711.htm
重庆华欧装饰工程有限公司,http://www.11467.com/chongqing/co/55281.htm
重庆威廉建筑装饰工程有限公司,http://www.11467.com/chongqing/co/171319.htm
东莞市凌云空调控制有限公司,http://www.11467.com/dongguan/co/557778.htm
广州市番禺石基汇思创意空间装饰公司,http://www.11467.com/guangzhou/co/511502.htm
昆明创艺装饰有限公司,http://www.11467.com/kunming/co/134198.htm
珠海佐恩鸿祺建筑装饰工程有限公司,http://www.11467.com/zhuhai/co/100403.htm
山东宏昌彩钢有限公司,http://www.11467.com/binzhou/co/44357.htm
天津市升明工贸有限公司,http://www.11467.com/tianjin/co/304556.htm
江西省雄基建设集团有限公司,http://www.11467.com/nanchang/co/120694.htm
四川利丰软膜天花装饰工程有限公司,http://www.11467.com/chengdu/co/141697.htm
宁波北仑暮晨装饰设计工程公司,http://www.11467.com/ningbo/co/144240.htm
洛阳市同盟文化传播有限公司,http://www.11467.com/luoyang/co/53220.htm
苏州伍合力新工程材料有限公司,http://www.11467.com/suzhou/co/270263.htm
南京积木装饰公司,http://www.11467.com/nanjing/co/115395.htm
石家庄檀捷建材商贸有限公司,http://www.11467.com/shijiazhuang/co/108738.htm
威海市白桦林装饰工程有限公司,http://www.11467.com/weihai/co/36184.htm
北京海纳科艺沙盘模型设计有限公司,http://www.11467.com/beijing/co/33275.htm
山东建功置业有限公司,http://www.11467.com/jinan/co/114778.htm
江西省中兴建筑企业有限公司余干分公司,http://www.11467.com/shangrao/co/23479.htm
北京市九洲知音公司,http://www.11467.com/beijing/co/714779.htm
烟台科瑞装饰设计工程有限公司,http://www.11467.com/yantai/co/28374.htm
许昌阳光广告装饰工程公司,http://www.11467.com/xuchang/co/19250.htm
北京卡米富恒数字科技有限公司,http://www.11467.com/beijing/co/716670.htm
深圳市瑞德钢结构工程有限公司,http://www.11467.com/shenzhen/co/815115.htm
合肥建树装饰工程有限公司,http://www.11467.com/hefei/co/145793.htm
北京广佳建筑装饰股份有限公司,http://www.11467.com/beijing/co/717002.htm
杭州南辉装饰有限公司,http://www.11467.com/hangzhou/co/391889.htm
