洛阳名洲装饰工程有限公司,http://www.11467.com/luoyang/co/70183.htm
烟台市广来建筑装饰设计工程有限公司,http://www.11467.com/yantai/co/178551.htm
上海贯驭企业管理咨询有限公司,http://www.11467.com/shanghai/co/1259797.htm
呼和浩特城市人家装饰工程有限公司,http://www.11467.com/huhehaote/co/36137.htm
重庆启腾百年装饰设计工程有限公司,http://www.11467.com/chongqing/co/277014.htm
安徽山水装饰空间有限责任公司,http://www.11467.com/hefei/co/152536.htm
安平县润熙丝网制品有限公司,http://www.11467.com/hengshui/co/62038.htm
武汉亿万基市政土石方工程有限公司,http://www.11467.com/wuhan/co/182832.htm
成都美谦电梯装潢设计有限公司,http://www.11467.com/chengdu/co/283335.htm
成都幸福魔方装饰工程有限公司,http://www.11467.com/chengdu/co/285523.htm
株洲泥巴公社装饰工程有限公司,http://www.11467.com/zhuzhou/co/57258.htm
广州市翔顺建筑工程有限公司,http://www.11467.com/guangzhou/co/696971.htm
中尚世纪装饰工程有限公司,http://www.11467.com/tianjin/co/237461.htm
天津森威装饰工程有限公司,http://www.11467.com/tianjin/co/237455.htm
深圳市艺路发装饰设计工程有限公司,http://www.11467.com/changsha/co/192883.htm
重庆四方恒红装饰建材有限公司,http://www.11467.com/chongqing/co/297457.htm
重庆市戈承建筑加固工程有限公司,http://www.11467.com/chongqing/co/277004.htm
上海国业建筑装饰工程有限公司,http://www.11467.com/shanghai/co/1260240.htm
廊坊鑫昊远高空作业车租赁公司,http://www.11467.com/langfang/co/71478.htm
四川香馨景观园林有限公司,http://www.11467.com/chengdu/co/274915.htm
上海茸惠装饰工程有限公司,http://www.11467.com/shanghai/co/1217221.htm
深圳市传奇艺术设计有限公司,http://www.11467.com/shenzhen/co/983257.htm
香港古兰建筑工程有限公司,http://www.11467.com/chengdu/co/283953.htm
成都建筑材料有限公司,http://www.11467.com/chengdu/co/274560.htm
惠州市大海装饰工程有限公司,http://www.11467.com/huizhou/co/117700.htm
四川省其高暖通设备有限公司,http://www.11467.com/chengdu/co/283039.htm
四川大美建筑装饰工程有限公司,http://www.11467.com/chengdu/co/283269.htm
曲阜万泰建筑装饰有限公司,http://www.11467.com/jining/co/105660.htm
宝鸡锦轩装饰工程有限公司,http://www.11467.com/baoji/co/36261.htm
北京诚优佳装饰工程有限公司,http://www.11467.com/beijing/co/762222.htm
江西振耀劳务施工队有限公司,http://www.11467.com/ganzhou/co/49880.htm
天远密云建筑装潢公司,http://www.11467.com/beijing/co/761978.htm
内江老李装修有限公司,http://www.11467.com/neijiang/co/26454.htm
贵州贵阳阔达装饰工程有限公司,http://www.11467.com/guiyang/co/89379.htm
绵阳玩美装饰有限公司,http://www.11467.com/mianyang/co/53519.htm
装修先生装饰工程设计有限公司,http://www.11467.com/shaoyang/co/40095.htm
深圳市山海天装饰工程有限公司,http://www.11467.com/shenzhen/co/983802.htm
北京市高度国际工程装饰设计有限公司,http://www.11467.com/beijing/co/763566.htm
北京城市人家装饰有限公司徐州分公司,http://www.11467.com/xuzhou/co/91967.htm
山西永旭建筑装饰有限公司,http://www.11467.com/yuncheng/co/33877.htm
北京装修代管服务公司,http://www.11467.com/beijing/co/763131.htm
吉林省北方基础工程检测有限公司,http://www.11467.com/changchun/co/110841.htm
南昌美优居装饰工程有限公司,http://www.11467.com/nanchang/co/140741.htm
云南银桥装饰工程有限公司,http://www.11467.com/kunming/co/149241.htm
济南天锐装修公司,http://www.11467.com/jinan/co/156482.htm
西安玖骏装饰工程有限公司,http://www.11467.com/xian/co/160435.htm
福州大自然木结构工程有限公司,http://www.11467.com/fuzhou/co/161935.htm
山东新天宇建设安装集团有限公司,http://www.11467.com/liaocheng/co/39231.htm
福州钧泽景观工程有限公司,http://www.11467.com/fuzhou/co/161928.htm
安平县夏博丝网制品有限公司,http://www.11467.com/hengshui/co/27383.htm
兰州澳迪雅装饰材料有限公司,http://www.11467.com/lanzhou/co/73237.htm
上海华宇实业发展有限公司,http://www.11467.com/shanghai/co/539099.htm
青岛景建工贸制造有限公司,http://www.11467.com/qingdao/co/125206.htm
兰州大有玻璃钢通风设备有限公司,http://www.11467.com/lanzhou/co/73280.htm
无锡黑木耳装饰装潢有限公司,http://www.11467.com/wuxi/co/214083.htm
廊坊市恒通伟业防腐制品有限公司,http://www.11467.com/langfang/co/36119.htm
湖北省环艺园林工程有限公司,http://www.11467.com/wuhan/co/117766.htm
北京恒昌艺美装饰有限公司,http://www.11467.com/beijing/co/627853.htm
青岛世佳拆除有限公司,http://www.11467.com/qingdao/co/125252.htm
烟台昊明胶业幕墙材料有限公司,http://www.11467.com/yantai/co/133974.htm
上海艺极楼梯杭州公司,http://www.11467.com/hangzhou/co/306893.htm
兰州华龙建筑工程有限公司,http://www.11467.com/lanzhou/co/73229.htm
青岛正洪塑业有限公司,http://www.11467.com/qingdao/co/118226.htm
天津市锐虎体育设施有限公司,http://www.11467.com/tianjin/co/93102.htm
泉州宏明装饰公司,http://www.11467.com/quanzhou/co/114160.htm
合肥沐风装饰工程有限公司,http://www.11467.com/hefei/co/104431.htm
厦门金装盛世装饰工程有限公司,http://www.11467.com/xiamen/co/85553.htm
哈尔滨辉煌脚手架有限公司,http://www.11467.com/haerbin/co/62431.htm
厦门雨心防水服务有限公司,http://www.11467.com/xiamen/co/85728.htm
东莞市春满人间装饰有限公司德阳分公司,http://www.11467.com/deyang/co/33174.htm
杭州凯雅装修公司,http://www.11467.com/hangzhou/co/312186.htm
衡水标准钢筋连接设备有限公司,http://www.11467.com/hengshui/co/33389.htm
扬州汇景装饰工程有限公司,http://www.11467.com/yangzhou/co/90066.htm
深圳艺嘉装饰工程有限公司,http://www.11467.com/shenzhen/co/730632.htm
山西红马甲家政有限公司,http://www.11467.com/taiyuan/co/106840.htm
北京腾达阁楼制作搭建公司,http://www.11467.com/beijing/co/565699.htm
福州大川装饰工程有限公司,http://www.11467.com/fuzhou/co/161974.htm
扬州天风建筑工程有限公司,http://www.11467.com/yangzhou/co/90081.htm
湖北大冶古建园林工程有限公司,http://www.11467.com/huangshi/co/18546.htm
长春城市人家装饰有限公司盛世分公司,http://www.11467.com/changchun/co/83347.htm
烟台开门红装饰工程有限公司,http://www.11467.com/yantai/co/133922.htm
深圳市雅琪装饰设计有限公司,http://www.11467.com/shenzhen/co/720066.htm
哈尔滨市平安拆除加固工程公司,http://www.11467.com/haerbin/co/62448.htm
深圳市原像空间室内设计公司,http://www.11467.com/shenzhen/co/712047.htm
姜堰市巅峰装饰工程有限公司,http://www.11467.com/taizhoushi/co/35104.htm
天津武清艺美鸿装饰公司,http://www.11467.com/tianjin/co/180771.htm
广州圈点陈设艺术设计有限公司,http://www.11467.com/guangzhou/co/432937.htm
广州朋克装饰工程有限公司,http://www.11467.com/guangzhou/co/432965.htm
河南非凡贴金箔工艺公司,http://www.11467.com/zhengzhou/co/148925.htm
康格隔间墙技术有限公司,http://www.11467.com/zhengzhou/co/148934.htm
上海日俊建筑装潢设计有限公司,http://www.11467.com/shanghai/co/538904.htm
成都品味家装饰有限公司,http://www.11467.com/chengdu/co/142901.htm
福建省顺通管件有限公司,http://www.11467.com/quanzhou/co/114234.htm
河北省衡水华工建工程橡胶有限公司,http://www.11467.com/hengshui/co/27403.htm
霸州市富友达商贸有限责任公司,http://www.11467.com/langfang/co/36171.htm
兰州东林装饰材料有限公司,http://www.11467.com/lanzhou/co/73322.htm
厦门市卫康隆工贸发展有限公司,http://www.11467.com/xiamen/co/86059.htm
重庆壹川装饰设计工程有限公司,http://www.11467.com/chongqing/co/171420.htm
青岛恒雅居装饰工程有限公司,http://www.11467.com/qingdao/co/125272.htm
江苏海龙水下工程有限公司,http://www.11467.com/yancheng/co/61164.htm
东莞市盈通体育用品有限公司,http://www.11467.com/dongguan/co/415164.htm
广州宏纳装饰材料有限公司,http://www.11467.com/guangzhou/co/446193.htm
陕西大汉龙腾科技公司,http://www.11467.com/xian/co/120823.htm
石家庄盛宇建筑工程有限公司,http://www.11467.com/shijiazhuang/co/108767.htm
浙江迪生实业有限公司安徽办事处,http://www.11467.com/hefei/co/104566.htm
厦门市鹭工机电工程有限公司,http://www.11467.com/xiamen/co/85748.htm
青岛半岛人家装饰工程有限公司,http://www.11467.com/qingdao/co/151808.htm
福州市仓山区金盾防水工程有限公司,http://www.11467.com/fuzhou/co/162157.htm
青岛市宏图防腐木景观公司,http://www.11467.com/qingdao/co/151692.htm
天方净化工程有限公司,http://www.11467.com/jinan/co/133185.htm
青岛宏图防腐木景观有限公司,http://www.11467.com/qingdao/co/151718.htm
石家庄鑫雨建筑有限公司,http://www.11467.com/shijiazhuang/co/112302.htm
石家庄金鼎建筑工程有限公司,http://www.11467.com/shijiazhuang/co/108769.htm
北京远达建筑工程有限公司,http://www.11467.com/beijing/co/565717.htm
东莞新鑫无尘净化工程有限公司,http://www.11467.com/dongguan/co/488101.htm
山东艺云彩绘装饰有限公司,http://www.11467.com/liaocheng/co/49292.htm
郑州君安装饰工程有限公司,http://www.11467.com/zhengzhou/co/169871.htm
杭州闵天装饰设计有限公司,http://www.11467.com/hangzhou/co/363499.htm
青岛宇隆暖通设备有限公司,http://www.11467.com/qingdao/co/125249.htm
重庆华科室内设计有限公司,http://www.11467.com/chongqing/co/55454.htm
重庆飞强建筑工程有限公司德阳分公司,http://www.11467.com/deyang/co/37337.htm
北京龙云鼎天软膜装饰有限公司,http://www.11467.com/beijing/co/232677.htm
广州市鑫洋装饰工程有限公司,http://www.11467.com/guangzhou/co/435955.htm
成都耐迪斯装饰有限公司,http://www.11467.com/chengdu/co/142920.htm
苏州柯维达环境工程有限公司,http://www.11467.com/suzhou/co/270761.htm
河南大铭装饰设计工程公司,http://www.11467.com/zhengzhou/co/153604.htm
福州兴科达建筑技术开发有限公司,http://www.11467.com/fuzhou/co/162001.htm
重庆开林商务信息咨询有限公司南宁分公司,http://www.11467.com/nanning/co/85964.htm
向前禹岑装饰工程有限公司,http://www.11467.com/shenyang/co/96375.htm
江苏省千秋高空建筑防腐有限公司,http://www.11467.com/qingdao/co/151877.htm
温州源艺装饰有限公司,http://www.11467.com/wenzhou/co/170607.htm
扬州天丰高空建筑维修有限公司,http://www.11467.com/yangzhou/co/90217.htm
扬州天丰高空建筑防腐维修有限公司,http://www.11467.com/yangzhou/co/90109.htm
烟台中成装饰工程有限公司,http://www.11467.com/yantai/co/133984.htm
山东帝豪高分子材料有限公司,http://www.11467.com/jining/co/56772.htm
上海贵申装潢材料有限公司,http://www.11467.com/shanghai/co/512725.htm
深圳市新荣新装饰工程有限公司,http://www.11467.com/shenzhen/co/715686.htm
江西省现代装潢公司华赣家具厂,http://www.11467.com/nanchang/co/13811.htm
成都春满人间装饰有限公司,http://www.11467.com/chengdu/co/245024.htm
上海依港装潢工程有限公司,http://www.11467.com/shanghai/co/1016499.htm
北京东方九龙轻钢结构房屋有限公司,http://www.11467.com/beijing/co/33045.htm
遵义金龙节能排烟气道有限公司,http://www.11467.com/shanghai/co/41757.htm
苏州灿宇新型装饰建材有限公司,http://www.11467.com/suzhou/co/356587.htm
徐州久泰膜结构停车棚有限公司,http://www.11467.com/xuzhou/co/54781.htm
南昌碧水深蓝环境工程有限公司,http://www.11467.com/nanchang/co/108262.htm
北京蓝邦华测科技有限公司,http://www.11467.com/beijing/co/701882.htm
武汉美缝剂建材有限公司,http://www.11467.com/wuhan/co/150495.htm
北京筑博拆除加固有限公司,http://www.11467.com/beijing/co/715809.htm
上海鉴道实业有限公司,http://www.11467.com/shanghai/co/537649.htm
天水佳艺园林建设有限责任公司,http://www.11467.com/tianshui/co/9821.htm
南昌市永恒建筑工程机械有限公司,http://www.11467.com/nanchang/co/39048.htm
杭州卡恩新型建材有限公司,http://www.11467.com/hangzhou/co/369089.htm
苏州东菱空调机电工程有限公司,http://www.11467.com/suzhou/co/205562.htm
深圳友好居装饰工程有限公司,http://www.11467.com/shenzhen/co/717104.htm
禹州市恒翔压滤机有限公司,http://www.11467.com/xuchang/co/22892.htm
上海宏躬建筑工程有限公司,http://www.11467.com/shanghai/co/378948.htm
深圳市瑞盈福科技有限公司,http://www.11467.com/shenzhen/co/814137.htm
北京杨诚旧房翻新装修公司,http://www.11467.com/beijing/co/716049.htm
深圳市维度空间设计有限公司,http://www.11467.com/shenzhen/co/813661.htm
蒙阴学成能源有限公司,http://www.11467.com/linyi/co/82117.htm
深圳市金雅庭装饰工程有限公司,http://www.11467.com/shenzhen/co/757754.htm
南昌华特化工有限公司,http://www.11467.com/nanchang/co/100488.htm
杭州蓝马艺术砂岩有限公司,http://www.11467.com/hangzhou/co/302792.htm
中山市尚美佳装饰材料有限公司,http://www.11467.com/zhongshan/co/135382.htm
深圳市合盈建材有限公司,http://www.11467.com/shenzhen/co/771075.htm
湖南莱蒙达智能家居有限公司,http://www.11467.com/changsha/co/138334.htm
上海雅豪金属制品有限公司,http://www.11467.com/shanghai/co/53762.htm
苏州瑞祥居整体住宅系统有限公司,http://www.11467.com/suzhou/co/300210.htm
西安中野环保科技有限公司,http://www.11467.com/xian/co/92588.htm
北京安基建业工程技术有限公司,http://www.11467.com/beijing/co/226400.htm
徐州宝鼎门窗工程有限公司,http://www.11467.com/xuzhou/co/78599.htm
河南瑞隆建设有限公司,http://www.11467.com/zhengzhou/co/185458.htm
杭州木都景观工程有限公司,http://www.11467.com/hangzhou/co/311004.htm
杭州元隆建筑工程有限公司,http://www.11467.com/hangzhou/co/209314.htm
深圳市纬业装饰有限公司,http://www.11467.com/shenzhen/co/811451.htm
深圳市理想空间装饰工程有限公司,http://www.11467.com/shenzhen/co/715131.htm
深圳市一品红装饰设计工程有限公司,http://www.11467.com/shenzhen/co/865848.htm
上海佰贞建筑装饰工程有限公司,http://www.11467.com/shanghai/co/1067425.htm
淮安市三易居装饰工程有限公司,http://www.11467.com/huaian/co/55874.htm
四川世典鸿图装饰设计工装公司,http://www.11467.com/chengdu/co/252790.htm
江苏鋭腾科技有限公司,http://www.11467.com/wuxi/co/250250.htm
上海朝阳建筑装饰工程有限公司,http://www.11467.com/shanghai/co/1066609.htm
佛山市咏卓装饰工程有限公司,http://www.11467.com/foshan/co/362740.htm
武汉韩美时代纳米科技有限公司,http://www.11467.com/wuhan/co/156301.htm
河北正浩地板有限公司,http://www.11467.com/cangzhou/co/89583.htm
上海锡美电梯装潢（西安）分公司,http://www.11467.com/xian/co/150654.htm
深圳市深邦装饰设计工程有限公司,http://www.11467.com/shenzhen/co/941899.htm
北京德昌伟业建筑有限公司,http://www.11467.com/beijing/co/716055.htm
武汉锐逸同行空调技术有限公司,http://www.11467.com/wuhan/co/155587.htm
上海锡美电梯装潢有限公司（西北）分公司,http://www.11467.com/xian/co/132903.htm
苏州华锦装饰工程有限公司,http://www.11467.com/suzhou/co/374815.htm
佛山市名庭五金制品有限公司,http://www.11467.com/foshan/co/479082.htm
深圳市墙艺师傅装饰有限公司,http://www.11467.com/shenzhen/co/916071.htm
巩义市明工起重设备贸易有限公司,http://www.11467.com/zhengzhou/co/201027.htm
北京优易特建筑设计咨询有限公司,http://www.11467.com/beijing/co/760727.htm
北京市中奥世纪装饰工程设计有限公司,http://www.11467.com/beijing/co/760258.htm
上海官昕建筑工程有限公司,http://www.11467.com/shanghai/co/1134568.htm
佛山市中信搭棚工程公司,http://www.11467.com/zhuhai/co/102492.htm
上海代办资质有限公司,http://www.11467.com/shanghai/co/1078831.htm
北京鹏飞工程技术公司,http://www.11467.com/beijing/co/716801.htm
四川瑞联精工装饰设计工程有限责任公司,http://www.11467.com/chengdu/co/258577.htm
天津华锋脚手架吊篮有限公司,http://www.11467.com/taizhou/co/146578.htm
上海祥靓建筑装饰工程有限公司,http://www.11467.com/shanghai/co/1067003.htm
合肥统领水电安装有限公司,http://www.11467.com/hefei/co/144466.htm
宁波甬港装修公司,http://www.11467.com/ningbo/co/231440.htm
深圳市中建正工安装工程公司,http://www.11467.com/shenzhen/co/983294.htm
广州永逸装饰设计公司,http://www.11467.com/guangzhou/co/633958.htm
温州市夏禹装饰有限公司,http://www.11467.com/wenzhou/co/272639.htm
无锡市顺和智能工程有限公司,http://www.11467.com/wuxi/co/263269.htm
北京九文鱼装饰设计有限公司,http://www.11467.com/beijing/co/760639.htm
温州龙图阁装饰工程有限公司,http://www.11467.com/wenzhou/co/238725.htm
广州市饰必美电梯装饰有限公司,http://www.11467.com/guangzhou/co/571897.htm
青岛德信筑家配套工程有限公司,http://www.11467.com/qingdao/co/177198.htm
驻马店美欣装饰工程有限公司,http://www.11467.com/zhumadian/co/33075.htm
山东济南格兴经贸有限公司,http://www.11467.com/jinan/co/141684.htm
秦庭墙绘设计有限公司,http://www.11467.com/xiaogan/co/22812.htm
杭州雷奥电梯配套工程有限公司,http://www.11467.com/hangzhou/co/391772.htm
陕西实鸿装饰工程有限公司,http://www.11467.com/xian/co/132882.htm
北京远大外墙装饰工程有限公司,http://www.11467.com/beijing/co/717170.htm
广东星艺装饰集团浙江金华有限公司舟山分公司,http://www.11467.com/zhoushan/co/27811.htm
洛阳天俊装饰公司,http://www.11467.com/luoyang/co/69762.htm
淮安市明唐商贸有限公司,http://www.11467.com/huaian/co/52890.htm
武汉弘正建筑装饰工程有限公司,http://www.11467.com/wuhan/co/201226.htm
滨州市厚泽工贸有限公司,http://www.11467.com/binzhou/co/55116.htm
大连德信空气净化工程有限公司,http://www.11467.com/dalian/co/81070.htm
北京中升环境装饰设计有限公司,http://www.11467.com/beijing/co/761630.htm
上海荣耀建筑装饰工程有限公司,http://www.11467.com/shanghai/co/1217556.htm
汉中景华时代装饰有限公司,http://www.11467.com/hanzhong/co/27165.htm
北京双大伟业科技发展有限公司销售服务分公司,http://www.11467.com/beijing/co/763225.htm
重庆天怡美装饰有限公司,http://www.11467.com/chongqing/co/297502.htm
北京鸿艺装饰有限责任公司,http://www.11467.com/beijing/co/762512.htm
清远市智德水电安装公司,http://www.11467.com/qingyuan/co/40052.htm
东莞市恒富钢结构有限公司,http://www.11467.com/dongguan/co/614877.htm
四川巧涂防腐保温工程有限公司,http://www.11467.com/chengdu/co/283162.htm
莱芜市开拓园林景观工程有限公司,http://www.11467.com/laiwu/co/18600.htm
河南德昌装饰设计工程有限公司,http://www.11467.com/zhengzhou/co/224832.htm
东莞市文艺装饰工程有限公司,http://www.11467.com/dongguan/co/615410.htm
重庆惠怡宝科技有限公司,http://www.11467.com/chongqing/co/296821.htm
苏州唐盛园艺建筑装饰工程有限公司,http://www.11467.com/suzhou/co/393968.htm
吉林省铬铧实业有限公司,http://www.11467.com/changchun/co/110838.htm
四川甲子文化体育工程有限公司成都总部,http://www.11467.com/chengdu/co/283915.htm
深圳市中南防水装饰设计有限公司,http://www.11467.com/shenzhen/co/1003841.htm
天津市达发脚手架有限公司,http://www.11467.com/tianjin/co/252585.htm
湛江墨雕装饰设计工程有限公司,http://www.11467.com/zhanjiang/co/83890.htm
广州市信科装饰工程有限公司,http://www.11467.com/guangzhou/co/693068.htm
柏拉图室内外效果图公司,http://www.11467.com/lianyungang/co/49651.htm
厦门振华装饰公司,http://www.11467.com/xiamen/co/139316.htm
河南中凯科学工业有限责任公司,http://www.11467.com/zhengzhou/co/224467.htm
江西省丛一楼装饰工程有限公司新余分公司,http://www.11467.com/xinyu/co/13404.htm
哈密起明装饰有限公司,http://www.11467.com/hami/co/5312.htm
楚雄恒艺装饰工程有限公司,http://www.11467.com/chuxiong/co/16145.htm
乌鲁木齐鸿源美筑装饰设计有限公司,http://www.11467.com/wulumuqi/co/105500.htm
四川天盛世家装饰工程有限公司,http://www.11467.com/meishan/co/20378.htm
西安亚格自动门有限公司,http://www.11467.com/xian/co/154930.htm
河南郑州绿之城电梯装饰有限公司,http://www.11467.com/zhengzhou/co/220366.htm
常州东豪装饰有限公司,http://www.11467.com/changzhou/co/165632.htm
深圳市卓恒装饰设计工程有限公司,http://www.11467.com/shenzhen/co/1037123.htm
昌乐洪武防腐保温工程有限公司,http://www.11467.com/weifang/co/172566.htm
山东六顺保温工程有限公司,http://www.11467.com/weifang/co/172592.htm
石家庄金秋装饰工程有限公司,http://www.11467.com/shijiazhuang/co/204809.htm
北京盛华宇阳建筑装饰工程设计有限公司,http://www.11467.com/beijing/co/762193.htm
北京余力而成建筑工程有限公司,http://www.11467.com/beijing/co/761808.htm
中山市鼎沛建设工程有限公司,http://www.11467.com/zhongshan/co/203576.htm
深圳市装吧装饰设计有限公司,http://www.11467.com/shenzhen/co/1101945.htm
西安唐源装修装饰工程有限公司,http://www.11467.com/xian/co/167764.htm
廊坊市美天建筑有限公司,http://www.11467.com/langfang/co/84897.htm
商丘市永红预制构件有限公司,http://www.11467.com/shangqiu/co/34450.htm
保定市海龙装饰工程有限公司,http://www.11467.com/baoding/co/131862.htm
宿迁锐云建筑劳务有限公司,http://www.11467.com/suqian/co/31394.htm
西安鼎腾尚雅建筑装饰工程有限公司,http://www.11467.com/xian/co/167450.htm
石家庄北洪建筑工程有限公司,http://www.11467.com/shijiazhuang/co/108766.htm
潍坊佰宜居装饰工程有限公司,http://www.11467.com/weifang/co/10499.htm
深圳市饰帮装饰设计工程有限公司,http://www.11467.com/shenzhen/co/732443.htm
新兴县三盛装饰材料有限公司,http://www.11467.com/yunfu/co/29426.htm
惠州市富士邦涂装工程有限公司,http://www.11467.com/huizhou/co/41353.htm
莱芜市汶水源土工合成材料有限公司,http://www.11467.com/laiwu/co/7206.htm
成都四季舒适家暖通设备有限公司,http://www.11467.com/qiye/93319057.htm
广州市柏溢装饰工程有限公司,http://www.11467.com/guangzhou/co/425947.htm
广东天域金箔工程有限公司,http://www.11467.com/dongguan/co/488840.htm
保山江津桥南装饰工程有限责任公司,http://www.11467.com/qiye/92584852.htm
深圳市恒丰建材有限公司,http://www.11467.com/shenzhen/co/723861.htm
华油蓝桥建筑装饰有限公司,http://www.11467.com/cangzhou/co/45737.htm
浙江峥杰建筑科技有限公司,http://www.11467.com/qiye/93189482.htm
杭州富阳方士装饰材料有限公司,http://www.11467.com/hangzhou/co/324469.htm
河南天堃工程咨询有限公司,http://www.11467.com/zhengzhou/co/147883.htm
河南中远滑模技术有限公司,http://www.11467.com/zhengzhou/co/148621.htm
天津力创室内设计有限公司,http://www.11467.com/qiye/93056581.htm
北京陆达专业工程打孔公司,http://www.11467.com/beijing/co/565714.htm
佛山市昊时建材有限公司,http://www.11467.com/foshan/co/355876.htm
颍上县新空间装饰有限公司,http://www.11467.com/qiye/93321116.htm
山东易晟元汗蒸设备有限公司,http://www.11467.com/qiye/90679363.htm
广东鲸点新材料科技有限公司,http://www.11467.com/qiye/93215775.htm
富途成型科技（苏州）有限公司,http://www.11467.com/qiye/93321259.htm
广州富源石材翻新护理有限公司,http://www.11467.com/guangzhou/co/468487.htm
监利县术写室内设计有限公司,http://www.11467.com/qiye/93081932.htm
安徽金杰装饰工程有限公司,http://www.11467.com/qiye/93137268.htm
上海璟渠电梯装潢有限公司,http://www.11467.com/qiye/93146785.htm
贵州盛世豪庭装修工程有限公司,http://www.11467.com/qiye/93154543.htm
什邡尚来装饰有限公司,http://www.11467.com/qiye/93188769.htm
东莞市百强装饰有限公司,http://www.11467.com/dongguan/co/474676.htm
标卓现代装饰工程有限公司,http://www.11467.com/chengdu/co/211887.htm
上海优鸿装饰设计有限公司,http://www.11467.com/shanghai/co/1035678.htm
中集建筑装潢集团公司,http://www.11467.com/shanghai/co/693688.htm
深圳市雅美居装饰设计工程有限公司,http://www.11467.com/shenzhen/co/724903.htm
上海基昱建筑装饰工程有限公司,http://www.11467.com/shanghai/co/536145.htm
怀化市东升房屋拆迁有限责任公司,http://www.11467.com/huaihua/co/20114.htm
赤峰金三优装饰有限公司,http://www.11467.com/chifeng/co/24372.htm
湖州颖隆建设工程有限公司,http://www.11467.com/huzhou/co/56173.htm
安新诚信铝塑门窗有限公司,http://www.11467.com/baoding/co/63605.htm
杭州候鸟之家地暖有限公司,http://www.11467.com/hangzhou/co/310610.htm
