绍兴县翔宇塑胶制品有限公司,http://www.11467.com/shaoxing/co/79158.htm
金华市金腾橡塑化工科技有限公司,http://www.11467.com/jinhua/co/75076.htm
安徽金门工贸有限公司枞阳热熔胶厂,http://www.11467.com/hefei/co/92373.htm
惠州市百程精密工业有限公司,http://www.11467.com/huizhou/co/44210.htm
嘉兴市富兴塑业机械有限公司,http://www.11467.com/jiaxing/co/65580.htm
嘉兴市杰森金属制品有限公司,http://www.11467.com/jiaxing/co/80553.htm
泉州市丰泽百源塑料制品有限公司,http://www.11467.com/quanzhou/co/98145.htm
沈阳鑫顺隆塑胶制品有限公司,http://www.11467.com/shenyang/co/55100.htm
深圳市巨贤塑胶制品有限公司,http://www.11467.com/shenzhen/co/278424.htm
景县华宇橡塑化工铸造有限公司,http://www.11467.com/hengshui/co/28703.htm
湖州良辰塑业有限公司,http://www.11467.com/huzhou/co/49940.htm
杭州三正橡胶有限公司,http://www.11467.com/jiaxing/co/135002.htm
广州市国良橡胶制品有限公司,http://www.11467.com/guangzhou/co/406688.htm
广州市威明橡胶制品有限公司,http://www.11467.com/guangzhou/co/488152.htm
嘉兴市裕鑫塑料五金有限公司,http://www.11467.com/jiaxing/co/9522.htm
深圳市精雅诚工业设备有限公司,http://www.11467.com/shenzhen/co/498585.htm
深圳市太阳雨展示制品有限公司,http://www.11467.com/shenzhen/co/253398.htm
深圳市伟恒塑胶制品有限公司,http://www.11467.com/shenzhen/co/224699.htm
深圳市永晨五金塑胶制品有限公司,http://www.11467.com/shenzhen/co/731139.htm
深圳市创煊工艺制品有限公司,http://www.11467.com/shenzhen/co/792697.htm
深圳市联通达塑料有限公司,http://www.11467.com/shenzhen/co/144436.htm
宁波市鄞州恒维塑胶有限公司,http://www.11467.com/ningbo/co/136754.htm
太仓市乐丰工贸有限公司,http://www.11467.com/shaoxing/co/119745.htm
日照博通塑胶有限公司,http://www.11467.com/rizhao/co/23490.htm
临沂万用塑料制品有限公司,http://www.11467.com/linyi/co/73181.htm
临沂市鲁军耐特塑料有限公司,http://www.11467.com/linyi/co/72755.htm
广州市天虹气模制品有限公司,http://www.11467.com/guangzhou/co/131810.htm
深圳市康泰五金塑胶有限公司,http://www.11467.com/shenzhen/co/810361.htm
深圳市金捷成科技有限公司,http://www.11467.com/shenzhen/co/427950.htm
安平县森旺丝网制造有限公司,http://www.11467.com/hengshui/co/34599.htm
上海顺硕塑料制品有限公司,http://www.11467.com/shanghai/co/1260339.htm
中山市京域五金塑料制品有限公司,http://www.11467.com/zhongshan/co/72010.htm
武汉天龙中南橡胶有限公司,http://www.11467.com/wuhan/co/75955.htm
厦门尚记塑胶有限公司,http://www.11467.com/xiamen/co/2111.htm
北京富华塑业有限公司,http://www.11467.com/beijing/co/212805.htm
天津捷瑞康工贸有限公司,http://www.11467.com/tianjin/co/117081.htm
厦门远城硅橡胶制品有限公司,http://www.11467.com/xiamen/co/2176.htm
河北汇特塑业有限公司,http://www.11467.com/shijiazhuang/co/84030.htm
新疆瑞德祥商贸有限公司,http://www.11467.com/wulumuqi/co/90786.htm
镇江市天瑞机电设备有限公司,http://www.11467.com/zhenjiang/co/40425.htm
青鸟科盛达塑料机械有限公司,http://www.11467.com/qingdao/co/188558.htm
陕西杰通工贸有限公司,http://www.11467.com/xian/co/62540.htm
佛山市南海专高模具有限公司,http://www.11467.com/foshan/co/424228.htm
济宁市华奕工贸有限公司营销部,http://www.11467.com/jining/co/104977.htm
常州尚泰海绵有限公司,http://www.11467.com/changzhou/co/165604.htm
诸城天仕利塑业有限公司,http://www.11467.com/weifang/co/157075.htm
鼎沣晟化工科技有限公司,http://www.11467.com/guangzhou/co/506862.htm
浙江东丽塑料有限公司贸易部,http://www.11467.com/wenzhou/co/238629.htm
深圳市臻创矽橡胶科技有限公司,http://www.11467.com/shenzhen/co/983984.htm
常州隆飞塑业有限公司,http://www.11467.com/changzhou/co/155942.htm
无锡飞宏精密模塑有限公司,http://www.11467.com/wuxi/co/201193.htm
鑫久同材料包装有限公司,http://www.11467.com/shenzhen/co/814707.htm
安平县渌顺丝网制品有限公司,http://www.11467.com/hengshui/co/72699.htm
东莞市欧尚新电子材料有限公司,http://www.11467.com/dongguan/co/615494.htm
北京世宇冷链科技有限公司,http://www.11467.com/beijing/co/762113.htm
衡水市昊通工程橡胶有限公司,http://www.11467.com/hengshui/co/66824.htm
聊城鸿运塑料包装有限公司,http://www.11467.com/liaocheng/co/74499.htm
中山茂凯工业有限公司,http://www.11467.com/zhongshan/co/99608.htm
中山市小可铝制品有限公司,http://www.11467.com/zhongshan/co/134424.htm
苏州美嘉达塑胶有限公司,http://www.11467.com/suzhou/co/243248.htm
泰安市格瑞土工材料有限公司,http://www.11467.com/taian/co/41539.htm
中山市业升塑料五金制品有限公司,http://www.11467.com/zhongshan/co/152856.htm
济南青峻包装制品有限公司,http://www.11467.com/jinan/co/153590.htm
淄博鸿烨上勤塑胶有限公司,http://www.11467.com/zibo/co/117769.htm
广州华州吸塑制品有限公司,http://www.11467.com/guangzhou/co/697016.htm
苏州毅豪兴精密模具有限公司,http://www.11467.com/suzhou/co/400919.htm
上海川塑高分子材料有限公司,http://www.11467.com/shanghai/co/1161309.htm
河北新好家塑钢橱柜板材公司,http://www.11467.com/baoding/co/99183.htm
深圳市华成鑫塑胶模具有限公司,http://www.11467.com/shenzhen/co/865306.htm
泰安星辉塑料有限公司,http://www.11467.com/taian/co/51251.htm
昆山鑫盛塑料工业有限公司,http://www.11467.com/suzhou/co/319714.htm
哈尔滨天晨塑料包装制品有限公司,http://www.11467.com/haerbin/co/71533.htm
杭州富阳市宏泰管业有限公司,http://www.11467.com/hangzhou/co/100398.htm
杭州方盛塑料制品有限公司,http://www.11467.com/hangzhou/co/298021.htm
合肥吉比斯橡塑五金科技有限公司,http://www.11467.com/hefei/co/138169.htm
长兴盛世达塑胶有限公司,http://www.11467.com/huzhou/co/67253.htm
浙江中义家具有限公司,http://www.11467.com/huzhou/co/67387.htm
嘉兴市申豪塑胶有限公司,http://www.11467.com/jiaxing/co/82470.htm
广东永汇塑胶实业有限公司,http://www.11467.com/jieyang/co/31323.htm
廊坊市柏莹包装制品有限公司,http://www.11467.com/langfang/co/47590.htm
山东莘县莘冠塑料制品有限公司,http://www.11467.com/liaocheng/co/51016.htm
南京琛晨塑料包装有限公司,http://www.11467.com/nanjing/co/66560.htm
宁波大收塑料制品有限公司,http://www.11467.com/ningbo/co/119371.htm
慈溪市实发塑业有限公司,http://www.11467.com/ningbo/co/193578.htm
宁波市鄞州前进实业公司,http://www.11467.com/ningbo/co/137246.htm
青岛世林新海绵有限公司,http://www.11467.com/qingdao/co/118352.htm
青岛宏泰盛橡胶制品有限公司,http://www.11467.com/qingdao/co/9706.htm
泉州精达皮塑五金工艺有限公司,http://www.11467.com/quanzhou/co/5261.htm
泉州金山扣具有限公司,http://www.11467.com/quanzhou/co/112013.htm
深圳市华林环保橡塑制品有限公司（业务部）,http://www.11467.com/shenzhen/co/699611.htm
十堰跨宇贸易有限公司,http://www.11467.com/shiyan/co/23616.htm
苏州迅盛塑胶电器有限公司,http://www.11467.com/suzhou/co/319491.htm
中山霖扬塑料有限公司,http://www.11467.com/zhongshan/co/26809.htm
上海乔治费歇尔亚大塑料管件制品有限公司,http://www.11467.com/shanghai/co/810178.htm
深圳市奥杰尼硅胶科技有限公司,http://www.11467.com/shenzhen/co/815497.htm
上海群鹿塑胶制品有限公司,http://www.11467.com/shanghai/co/1198379.htm
昆山桂缘电子有限公司,http://www.11467.com/suzhou/co/357329.htm
汤阴县三有工程橡塑制品有限公司,http://www.11467.com/anyang/co/10523.htm
常州市小河镇日昕橡塑制品有限公司,http://www.11467.com/changzhou/co/123995.htm
东莞市鸿来工程塑料有限公司,http://www.11467.com/chenzhou/co/20864.htm
东莞市腾丰塑料制造有限公司,http://www.11467.com/dongguan/co/86266.htm
东莞市华亮塑料科技有限公司,http://www.11467.com/dongguan/co/491091.htm
东莞市言胜塑胶电子有限公司,http://www.11467.com/dongguan/co/411744.htm
东莞大同塑料制品有限公司,http://www.11467.com/dongguan/co/22125.htm
东莞雅域实业有限公司（注塑部）,http://www.11467.com/dongguan/co/393604.htm
广东东莞锦绣塑胶机械有限公司,http://www.11467.com/dongguan/co/397336.htm
佛山市盛鹏塑料制品有限公司,http://www.11467.com/foshan/co/291070.htm
广州市蔼洋塑料工业有限公司,http://www.11467.com/guangzhou/co/126392.htm
广州南良橡胶制品有限公司,http://www.11467.com/guangzhou/co/404530.htm
广州兴杭塑胶制品有限公司,http://www.11467.com/guangzhou/co/429040.htm
江门景隆橡塑有限公司,http://www.11467.com/jiangmen/co/86670.htm
深圳市优兴塑胶制品有限公司,http://www.11467.com/shenzhen/co/759735.htm
恩科塑胶制品有限公司,http://www.11467.com/guangzhou/co/457015.htm
东莞市奥普实业投资有限公司,http://www.11467.com/dongguan/co/555632.htm
厦门仕搏橡塑科技有限公司,http://www.11467.com/xiamen/co/103404.htm
安徽省光明塑业有限公司,http://www.11467.com/anqing/co/27012.htm
安徽金新塑业有限公司,http://www.11467.com/anqing/co/35848.htm
桐城市龙松包装有限公司,http://www.11467.com/anqing/co/35824.htm
安阳市恒盛泡沫制品有限公司,http://www.11467.com/anyang/co/36387.htm
北京喜洋洋包装材料有限公司,http://www.11467.com/baoding/co/81286.htm
任丘市好兄弟体育器材配件有限公司,http://www.11467.com/cangzhou/co/46353.htm
沧州市精美注塑有限公司,http://www.11467.com/cangzhou/co/44940.htm
沧州市东海公司,http://www.11467.com/cangzhou/co/44877.htm
深圳市佳富达包装制品有限公司,http://www.11467.com/shenzhen/co/789570.htm
深圳市君逸彩工艺品有限公司,http://www.11467.com/shenzhen/co/235322.htm
深圳市聚亿胶袋有限公司,http://www.11467.com/shenzhen/co/40513.htm
石家庄远大实业有限公司,http://www.11467.com/shijiazhuang/co/103653.htm
苏州汉丰新材料股份有限公司,http://www.11467.com/suzhou/co/317047.htm
苏州聚益塑料制品有限公司,http://www.11467.com/suzhou/co/274337.htm
吴江市苏沪软管包装有限公司,http://www.11467.com/suzhou/co/319713.htm
苏州鑫艺门窗有限公司,http://www.11467.com/suzhou/co/263722.htm
潍坊中石科技有限公司,http://www.11467.com/weifang/co/83481.htm
寿光市东海塑料包装有限公司,http://www.11467.com/weifang/co/118085.htm
温州市通联橡塑管件有限公司,http://www.11467.com/wenzhou/co/166997.htm
芜湖蓝博塑胶有限公司,http://www.11467.com/wuhu/co/2855.htm
无锡第二塑料厂有限公司,http://www.11467.com/wuxi/co/185512.htm
江苏立华塑料制品有限公司,http://www.11467.com/xuzhou/co/81455.htm
营口华隆塑料制品有限公司,http://www.11467.com/yingkou/co/42374.htm
淄博博瑞塑胶制品有限公司,http://www.11467.com/zibo/co/39606.htm
上海菱达斯橡胶扶手有限公司,http://www.11467.com/shanghai/co/535022.htm
上海斯瑞聚合体科技有限公司,http://www.11467.com/shanghai/co/746422.htm
上海统笙塑胶制品有限公司,http://www.11467.com/shanghai/co/896249.htm
天津华涛汽车塑料饰件有限公司,http://www.11467.com/tianjin/co/18840.htm
长春星达热缩科技有限公司,http://www.11467.com/changchun/co/81049.htm
常州纳威尔塑业有限公司,http://www.11467.com/changzhou/co/115626.htm
常州鼎尚电器配件有限公司,http://www.11467.com/changzhou/co/146183.htm
常州东木橡塑制品有限公司,http://www.11467.com/changzhou/co/76518.htm
常州市四叶草塑料有限公司,http://www.11467.com/changzhou/co/124073.htm
常州市炜发塑业有限公司,http://www.11467.com/changzhou/co/124062.htm
常州裕禾橡塑有限公司,http://www.11467.com/changzhou/co/123607.htm
常州市盛浩电器有限公司,http://www.11467.com/changzhou/co/123488.htm
常州新天地塑料公司,http://www.11467.com/changzhou/co/124091.htm
苏州欧创塑胶材料有限公司(业务部),http://www.11467.com/changzhou/co/123660.htm
四川省新都三益翻胎有限公司销售部,http://www.11467.com/chengdu/co/134105.htm
大连洋鑫塑料制品有限公司制造部,http://www.11467.com/dalian/co/62360.htm
天津新辉润滑油有限公司大连办事处,http://www.11467.com/dalian/co/62339.htm
丰疆商贸有限公司,http://www.11467.com/dandong/co/48304.htm
东莞和达365塑胶制品有限公司,http://www.11467.com/dongguan/co/387033.htm
东莞佳信橡塑有限公司,http://www.11467.com/dongguan/co/388436.htm
东莞市高瞻海绵制品有限公司,http://www.11467.com/dongguan/co/73778.htm
东莞市奥迪利塑胶原料有限公司,http://www.11467.com/dongguan/co/156722.htm
东莞欧艾姆化工有限公司,http://www.11467.com/dongguan/co/16600.htm
东莞杰宏硅橡胶有限公司（业务部0,http://www.11467.com/dongguan/co/395686.htm
东莞建设扣具(泉州)有限公司,http://www.11467.com/dongguan/co/387133.htm
东莞富森五金制品有限公司,http://www.11467.com/dongguan/co/20892.htm
保利盛塑料（东莞）有限公司,http://www.11467.com/dongguan/co/116791.htm
东莞市恒彩塑胶颜料有限公司(业务部),http://www.11467.com/dongguan/co/392013.htm
东莞市合昌机电有限公司销售部,http://www.11467.com/dongguan/co/394310.htm
东莞市嘉乐颖实业有限公司,http://www.11467.com/dongguan/co/154058.htm
东莞市升辉鞋材有限公司,http://www.11467.com/dongguan/co/392916.htm
东莞市升辉鞋材有限公司,http://www.11467.com/dongguan/co/392917.htm
东莞市益扬高分子材料有限公司,http://www.11467.com/dongguan/co/410909.htm
东莞市如江包装制品有限公司,http://www.11467.com/dongguan/co/478108.htm
东莞市双羽塑料制品有限公司,http://www.11467.com/dongguan/co/385612.htm
东莞双立塑业有限公司（销售部）,http://www.11467.com/dongguan/co/395777.htm
东莞贤林橡塑制品有限公司-市场部,http://www.11467.com/dongguan/co/394541.htm
广东裕丰塑胶制品有限公司,http://www.11467.com/dongguan/co/396267.htm
上海派瑞特塑业有限公司东莞分公司,http://www.11467.com/dongguan/co/393004.htm
上海派瑞特塑业有限公司（东莞分公司）,http://www.11467.com/dongguan/co/389335.htm
東莞市通美塑料有限公司,http://www.11467.com/dongguan/co/396467.htm
恒业复模公司,http://www.11467.com/dongguan/co/392996.htm
宏兴塑胶五金制品公司,http://www.11467.com/dongguan/co/393228.htm
东莞市新昊坤五金橡塑制品有限公司,http://www.11467.com/dongguan/co/385731.htm
祥盛五金塑胶制品公司,http://www.11467.com/dongguan/co/394558.htm
盛发塑胶电子有限公司,http://www.11467.com/dongguan/co/394284.htm
盛欣模具科技有限公司,http://www.11467.com/dongguan/co/393311.htm
业成塑料制品有限公司,http://www.11467.com/dongguan/co/396510.htm
禾吉塑料有限公司,http://www.11467.com/dongguan/co/389380.htm
伟诚再生资源回收有限公司,http://www.11467.com/dongguan/co/395989.htm
联丰实业公司销售部,http://www.11467.com/dongguan/co/395330.htm
宏立基实业有限公司,http://www.11467.com/dongguan/co/390893.htm
佛山市南海朗利塑料精工有限公司,http://www.11467.com/foshan/co/289220.htm
佛山市高明雅士杰塑料模具有限公司,http://www.11467.com/foshan/co/290620.htm
佛山市南海齐粤塑胶有限公司,http://www.11467.com/foshan/co/227314.htm
佛山市亿特环保科技有限公司除味销售部,http://www.11467.com/foshan/co/290173.htm
佛山市顺德区宜兴电子电器有限公司,http://www.11467.com/foshan/co/291139.htm
佛山市顺德区兴业塑胶五金制品有限公司,http://www.11467.com/foshan/co/301939.htm
佛山市德瑞新塑料有限公司,http://www.11467.com/foshan/co/290799.htm
佛山市顺德区枫明装饰材料有限公司,http://www.11467.com/foshan/co/252867.htm
佛山市顺德区谷丰家具材料实业有限公司,http://www.11467.com/foshan/co/291108.htm
佛山市顺德区丽固威塑料实业有限公司,http://www.11467.com/foshan/co/209146.htm
佛山市三水兆丰和塑料制品有限公司,http://www.11467.com/foshan/co/213896.htm
佛山市文汇办公用品有限公司,http://www.11467.com/foshan/co/67282.htm
顺德市华塑龙塑料实业有限公司,http://www.11467.com/foshan/co/138498.htm
南海新新鞋材有限公司,http://www.11467.com/foshan/co/290548.htm
福州优的塑胶颜料有限公司,http://www.11467.com/fuzhou/co/158603.htm
福州华荣五金电器有限公司,http://www.11467.com/fuzhou/co/133280.htm
鼎斯睿商务礼品公司,http://www.11467.com/guangzhou/co/406223.htm
广州佳得塑胶制品有限公司,http://www.11467.com/guangzhou/co/478976.htm
广东省维特塑料有限公司,http://www.11467.com/guangzhou/co/404220.htm
广州市创永装饰材料有限公司,http://www.11467.com/guangzhou/co/276849.htm
广州品文塑料制品有限公司,http://www.11467.com/guangzhou/co/406705.htm
佛山市顺德区东生塑料有限公司,http://www.11467.com/guangzhou/co/406745.htm
广州龙睿橡胶制品有限公司,http://www.11467.com/guangzhou/co/405002.htm
广州市金锋实业有限公司,http://www.11467.com/guangzhou/co/47545.htm
嘉兴市瑞丰塑料有限公司销售部,http://www.11467.com/jiaxing/co/90655.htm
广东省揭阳市义恒信鞋业有限公司,http://www.11467.com/jieyang/co/26948.htm
义乌市新爱塑料包装有限公司,http://www.11467.com/jinhua/co/128061.htm
和嘉塑业有限公司,http://www.11467.com/jinhua/co/82321.htm
山东讯达科技发展有限公司市场部,http://www.11467.com/jining/co/53883.htm
莒南县万翔塑料制品有限公司,http://www.11467.com/linyi/co/96313.htm
莒南县金力包装材料有限公司,http://www.11467.com/linyi/co/94620.htm
临沂东立塑业有限公司,http://www.11467.com/linyi/co/72722.htm
临沂海利丰制绳有限公司,http://www.11467.com/linyi/co/73140.htm
临沂桐诚塑料包装有限公司,http://www.11467.com/linyi/co/96648.htm
山东力扬工贸有限公司青岛办事处,http://www.11467.com/linyi/co/72886.htm
南京大奇化工有限公司,http://www.11467.com/nanjing/co/106712.htm
南京华体塑胶有限公司营销部,http://www.11467.com/nanjing/co/107392.htm
南京宝菱塑料制袋有限公司,http://www.11467.com/nanjing/co/25071.htm
南宁市广发商贸有限责任公司,http://www.11467.com/nanning/co/76221.htm
南宁市广发商贸有限责任公司,http://www.11467.com/nanning/co/76220.htm
南通兴隆塑料有限公司,http://www.11467.com/nantong/co/22368.htm
新野速特印刷包装有限公司,http://www.11467.com/nanyang/co/38504.htm
宁波北仑茂诚工贸有限公司,http://www.11467.com/ningbo/co/138314.htm
宁波景逸塑胶有限公司(营销部）,http://www.11467.com/ningbo/co/136241.htm
宁波鄞州艾迪凯工贸有限公司,http://www.11467.com/ningbo/co/137496.htm
宁波市鄞州区勤业工贸有限公司,http://www.11467.com/ningbo/co/138104.htm
宁波市鄞州康宁科业工艺品有限公司（厂部）,http://www.11467.com/ningbo/co/136412.htm
宁波市鄞州迈斯特机械有限公司(业务部）,http://www.11467.com/ningbo/co/137827.htm
宁波英格塑料制品有限公司 销售部,http://www.11467.com/ningbo/co/136517.htm
宁波市鄞州同德卫生敷料有限公司 销售部,http://www.11467.com/ningbo/co/137681.htm
浙江宁海橡塑贸易有限公司,http://www.11467.com/ningbo/co/137988.htm
宁波江北三恒工贸有限公司,http://www.11467.com/ningbo/co/137194.htm
台湾爱之福有限公司,http://www.11467.com/ningbo/co/137799.htm
宁波市和美塑业有限公司,http://www.11467.com/ningbo/co/136707.htm
宁波欣荣塑业有限公司,http://www.11467.com/ningbo/co/138115.htm
富尔(宁德)工贸有限公司,http://www.11467.com/ningde/co/24718.htm
濮阳市新长源塑业有限公司,http://www.11467.com/puyang/co/24226.htm
韩国towrold贸易有限公司青岛分公司,http://www.11467.com/qingdao/co/117633.htm
青岛大宏华塑胶有限公司（销售部门）,http://www.11467.com/qingdao/co/118324.htm
青岛吉耐电子塑胶工业有限公司采购部,http://www.11467.com/qingdao/co/117577.htm
青岛鼎昌工贸有限公司,http://www.11467.com/qingdao/co/56321.htm
泉州鲤城锦美万达塑胶有限公司（业务部）,http://www.11467.com/quanzhou/co/111895.htm
泉州海燕塑胶有限公司业务部,http://www.11467.com/quanzhou/co/111942.htm
泉州长源箱包有限公司,http://www.11467.com/quanzhou/co/112044.htm
日照鑫汇橡塑有限公司,http://www.11467.com/rizhao/co/16021.htm
日照鑫汇橡塑有限公司,http://www.11467.com/rizhao/co/16022.htm
日照天恩塑胶有限公司,http://www.11467.com/rizhao/co/13519.htm
汕头市汇佳塑胶包装制品有限公司,http://www.11467.com/shantou/co/129323.htm
汕头市郭氏旭光实业有限公司,http://www.11467.com/shantou/co/142595.htm
汕头市凯地贸易有限公司,http://www.11467.com/shantou/co/147167.htm
恒昌磁电有限公司,http://www.11467.com/shantou/co/142063.htm
汕头市鸿星塑料饰品实业有限公司,http://www.11467.com/shantou/co/115312.htm
沈阳大顺石化有限公司,http://www.11467.com/shenyang/co/77166.htm
沈阳市金吉祥工贸有限公司,http://www.11467.com/shenyang/co/77208.htm
安泰香港电子股份有限公司,http://www.11467.com/shenzhen/co/692588.htm
大镛科技（深圳）有限公司简介,http://www.11467.com/shenzhen/co/692420.htm
军辉塑胶制品有限公司,http://www.11467.com/shenzhen/co/696828.htm
华川科技有限公司,http://www.11467.com/shenzhen/co/697275.htm
绅晟电子有限公司业务,http://www.11467.com/shenzhen/co/698784.htm
深圳编织纤维袋回收公司,http://www.11467.com/shenzhen/co/693217.htm
瑞福来富友电子有限公司,http://www.11467.com/shenzhen/co/700076.htm
坚利达塑胶制品（深圳）有限公司,http://www.11467.com/shenzhen/co/699123.htm
米莱实业有限公司,http://www.11467.com/shenzhen/co/695585.htm
峰盟塑胶(深圳) 有限公司,http://www.11467.com/shenzhen/co/695382.htm
深圳锦格电子塑胶有限公司,http://www.11467.com/shenzhen/co/694784.htm
利德化工有限公司,http://www.11467.com/shenzhen/co/694427.htm
深圳利源模具公司,http://www.11467.com/shenzhen/co/695731.htm
深圳朗信电子科技有限公司,http://www.11467.com/shenzhen/co/697003.htm
深圳科益光电材料有限公司（市场部）,http://www.11467.com/shenzhen/co/699881.htm
深圳合兴塑胶制品有限公司,http://www.11467.com/shenzhen/co/698097.htm
深圳恒昌塑胶五金制品有限公司,http://www.11467.com/shenzhen/co/696818.htm
鸿运发塑胶制品(深圳)有限公司,http://www.11467.com/shenzhen/co/694024.htm
深圳市彩信有限公司(销售部),http://www.11467.com/shenzhen/co/693534.htm
深圳分享文具有限公司,http://www.11467.com/shenzhen/co/692498.htm
深圳市长旺塑胶制造有限公司,http://www.11467.com/shenzhen/co/699599.htm
深圳市昌硕机械有限公司,http://www.11467.com/shenzhen/co/33033.htm
深圳市高质科技有限公司,http://www.11467.com/shenzhen/co/694739.htm
深圳市广海大橡塑有限公司,http://www.11467.com/shenzhen/co/64194.htm
深圳市诚馨电子有限公司,http://www.11467.com/shenzhen/co/698740.htm
深圳市曼尔维塑胶五金制品有限公司,http://www.11467.com/shenzhen/co/253716.htm
深圳市尚想产品开发有限公司,http://www.11467.com/shenzhen/co/696915.htm
深圳市华茂通塑料包装有限公司,http://www.11467.com/shenzhen/co/277443.htm
深圳市伟利橡塑制品有限公司,http://www.11467.com/shenzhen/co/287686.htm
宁国市欧泰橡塑制品有限公司,http://www.11467.com/xuancheng/co/27458.htm
阜宁县万通隧道材料有限公司,http://www.11467.com/yancheng/co/78299.htm
滕勇实业有限公司,http://www.11467.com/yantai/co/131853.htm
枣庄诚宇经贸发展有限公司,http://www.11467.com/zaozhuang/co/29850.htm
台州敦华塑料模具公司,http://www.11467.com/taizhou/co/102357.htm
台州韦戈尔工贸有限公司,http://www.11467.com/taizhou/co/103716.htm
威海玉都塑料制口有限公司,http://www.11467.com/weihai/co/35219.htm
苍南正于包装有限公司,http://www.11467.com/wenzhou/co/217559.htm
温州市众人木业（木皮）有限公司,http://www.11467.com/wenzhou/co/166961.htm
蘇州品基電子科技有限公司武漢辦事處,http://www.11467.com/wuhan/co/109497.htm
芜湖寅晨塑业有限公司,http://www.11467.com/wuhu/co/24781.htm
无锡市吉城工业皮带有限公司,http://www.11467.com/wuxi/co/211181.htm
无锡市海博精密橡塑制品有限公司销售部,http://www.11467.com/wuxi/co/210969.htm
无锡吉象橡塑机械有限公司,http://www.11467.com/wuxi/co/211257.htm
宜兴市森泰塑胶有限公司,http://www.11467.com/wuxi/co/228999.htm
福建利鑫塑胶工业有限公司,http://www.11467.com/xiamen/co/78895.htm
厦门文锦鑫工贸有限公司生产部,http://www.11467.com/xiamen/co/78681.htm
西安力扬塑料制品有限公司,http://www.11467.com/xian/co/88669.htm
仙桃康华佳利塑料制品有限公司,http://www.11467.com/xiantao/co/14.htm
微山县立统包装材料有限公司,http://www.11467.com/zaozhuang/co/24565.htm
美商贸易公司郑州代表处,http://www.11467.com/zhengzhou/co/141257.htm
