北京诚信飞驰塑胶有限公司郑州分店,http://www.11467.com/zhengzhou/co/141185.htm
郑州万方工贸有限公司,http://www.11467.com/zhengzhou/co/141293.htm
郑州鸿志塑料制品销售有限公司,http://www.11467.com/zhengzhou/co/75778.htm
镇江市永森新材料有限公司,http://www.11467.com/zhenjiang/co/63616.htm
中山市富威吸塑包装有限公司,http://www.11467.com/zhongshan/co/150511.htm
金利宝膠粘制品有限公司,http://www.11467.com/zhongshan/co/113686.htm
中山市兴华建业包装制品有限公司,http://www.11467.com/zhongshan/co/61481.htm
中山市三英塑料制品有限公司,http://www.11467.com/zhongshan/co/27694.htm
中山市金杰塑胶制品有限公司,http://www.11467.com/zhongshan/co/113131.htm
孟发泳池配件有限公司,http://www.11467.com/zhuhai/co/86993.htm
淄博经纬塑编有限公司,http://www.11467.com/zibo/co/98689.htm
北京凡钥科技有限公司,http://www.11467.com/beijing/co/587559.htm
北京金时路科技发展有限公司,http://www.11467.com/beijing/co/327641.htm
北京绿寰宇化工有限公司,http://www.11467.com/beijing/co/327583.htm
北京市聚华兴联科技有限公司,http://www.11467.com/beijing/co/224571.htm
北京兄奕橡塑制品有限公司,http://www.11467.com/beijing/co/626153.htm
北京朗驰新星塑业有限公司,http://www.11467.com/beijing/co/224568.htm
上海创元防水布有限公司,http://www.11467.com/shanghai/co/689358.htm
上海兰昊塑胶有限责任公司,http://www.11467.com/shanghai/co/428526.htm
上海美端精密机件有限公司,http://www.11467.com/shanghai/co/786855.htm
南通旭洋橡塑有限公司上海分公司,http://www.11467.com/shanghai/co/689043.htm
上海龙其塑料制品有限公司,http://www.11467.com/shanghai/co/846816.htm
上海联大海绵有限公司,http://www.11467.com/shanghai/co/484187.htm
上海国岑交通设施工程有限公司工程部,http://www.11467.com/shanghai/co/535343.htm
上海东嵩家居用品有限公司外贸部,http://www.11467.com/shanghai/co/688969.htm
上海奇盈橡塑工艺制品有限公司生产部,http://www.11467.com/shanghai/co/534980.htm
上海奇康生物科技有限公司,http://www.11467.com/shanghai/co/534876.htm
上海三孚新型建材有限公司,http://www.11467.com/shanghai/co/810292.htm
上海亭利物资回收有限公司,http://www.11467.com/shanghai/co/328505.htm
上海遐欣塑胶模具有限公司业务部,http://www.11467.com/shanghai/co/328321.htm
桐城市健力塑料包装有限公司,http://www.11467.com/anqing/co/35769.htm
安庆橡塑公司,http://www.11467.com/anqing/co/27025.htm
保定市新创电塑有限公司,http://www.11467.com/baoding/co/62475.htm
上海欣运塑胶制品有限公司销售部,http://www.11467.com/shanghai/co/896179.htm
上海易通密封件有限公司,http://www.11467.com/shanghai/co/282957.htm
深圳亿洲建材有限公司上海办事处,http://www.11467.com/shanghai/co/89925.htm
上海彤晨化工有限公司,http://www.11467.com/shanghai/co/517751.htm
上海浦东毛根工贸有限公司,http://www.11467.com/shanghai/co/689159.htm
天津市源马塑料制品有限公司,http://www.11467.com/tianjin/co/190590.htm
荆州精塑塑料制品加工公司,http://www.11467.com/jingzhou/co/31283.htm
佛山市顺德区华悦塑料制品有限公司,http://www.11467.com/foshan/co/361512.htm
长沙市振通管业有限公司,http://www.11467.com/changsha/co/139505.htm
衡水中桥橡胶制品有限公司,http://www.11467.com/hengshui/co/45933.htm
天津市九华塑料制品有限责任公司,http://www.11467.com/tianjin/co/307228.htm
天津市泰成塑胶有限公司,http://www.11467.com/tianjin/co/307229.htm
中山市光云塑胶制品有限公司,http://www.11467.com/zhongshan/co/154418.htm
广州市赞晨塑胶科技有限公司,http://www.11467.com/guangzhou/co/581739.htm
浙江杭州力豪塑料制品有限公司,http://www.11467.com/hangzhou/co/391692.htm
江苏金霸环境技术股份有限公司,http://www.11467.com/wuxi/co/250284.htm
德州市睿彩颜料色母有限公司,http://www.11467.com/dezhou/co/63384.htm
厦门市德力达硅橡胶制品有限公司,http://www.11467.com/xiamen/co/119587.htm
上海绪腾机电科技有限公司,http://www.11467.com/shanghai/co/1131594.htm
张家港鸿源网业有限公司,http://www.11467.com/suzhou/co/393764.htm
苏州普乐特模型科技有限公司,http://www.11467.com/suzhou/co/398574.htm
武汉市凯帝塑料包装防护品有限公司,http://www.11467.com/wuhan/co/191140.htm
浙江鸿雁塑胶有限公司,http://www.11467.com/hangzhou/co/462798.htm
廊坊塔斯克科技有限公司,http://www.11467.com/langfang/co/78762.htm
贵阳精坤塑业制品有限公司,http://www.11467.com/guiyang/co/89496.htm
东莞市都弘塑胶电子有限公司,http://www.11467.com/dongguan/co/626259.htm
盐城市正中橡塑制品有限公司,http://www.11467.com/yancheng/co/89364.htm
宁国市玉东塑料制品有限责任公司,http://www.11467.com/xuancheng/co/32847.htm
聊城成美塑业有限公司,http://www.11467.com/qiye/93124805.htm
台州赟明建设工程有限公司,http://www.11467.com/qiye/93133926.htm
清河县凯森橡塑制品有限公司,http://www.11467.com/qiye/93321904.htm
沧州东源塑料制品有限公司,http://www.11467.com/cangzhou/co/44888.htm
GHL国际有限公司长沙办事处,http://www.11467.com/changsha/co/100061.htm
常州软门帘顺风化工建材有限公司,http://www.11467.com/changzhou/co/124161.htm
森瑞（常州）橡塑制品有限公司销售部,http://www.11467.com/changzhou/co/102082.htm
常州康尔佳塑胶器材有限公司,http://www.11467.com/changzhou/co/77663.htm
常州仟佰塑料制品有限公司,http://www.11467.com/changzhou/co/123887.htm
成都飞腾豪美塑胶有限公司,http://www.11467.com/chengdu/co/22621.htm
成都市鸿康玻钢股份有限公司,http://www.11467.com/chengdu/co/133675.htm
成都市麒蓉科技有限公司,http://www.11467.com/chengdu/co/47623.htm
大连金怡塑胶制品有限公司,http://www.11467.com/dalian/co/62082.htm
加拿大利津国际股份有限公司,http://www.11467.com/dalian/co/62204.htm
长江塑胶原料有限公司,http://www.11467.com/dongguan/co/386204.htm
东莞全田塑胶制品有限公司,http://www.11467.com/dongguan/co/21290.htm
东莞汩天实业有限公司,http://www.11467.com/dongguan/co/391799.htm
东莞坚利塑胶制品有限公司,http://www.11467.com/dongguan/co/111140.htm
东莞金力硅橡胶有限公司,http://www.11467.com/dongguan/co/387696.htm
东莞普立万氯乙烯聚合体有限公司,http://www.11467.com/dongguan/co/215527.htm
东莞凯钛塑胶制品有限公司,http://www.11467.com/dongguan/co/199945.htm
东莞市明红硅材料有限公司,http://www.11467.com/dongguan/co/460596.htm
东莞市理中展示用品有限公司,http://www.11467.com/dongguan/co/68549.htm
东莞东晟贸易有限公司,http://www.11467.com/dongguan/co/385840.htm
东莞就记塑胶钮扣有限公司,http://www.11467.com/dongguan/co/111301.htm
东莞市金运塑胶助剂有限公司,http://www.11467.com/dongguan/co/390224.htm
东莞市青峰实业有限公司(塘厦青峰),http://www.11467.com/dongguan/co/390095.htm
东莞市东和塑胶电子有限公司,http://www.11467.com/dongguan/co/393172.htm
东莞市创富事业有限公司,http://www.11467.com/dongguan/co/386449.htm
东莞市同诚塑胶有限公司,http://www.11467.com/dongguan/co/389751.htm
东莞市新研工业材料有限公司（业务部）,http://www.11467.com/dongguan/co/391438.htm
东莞市全纬塑胶制品有限公司,http://www.11467.com/dongguan/co/238520.htm
东莞市行者鞋业有限公司,http://www.11467.com/dongguan/co/522114.htm
东莞市旭昱五金塑胶制品有限公司,http://www.11467.com/dongguan/co/468018.htm
东莞市宏冠橡胶制品有限公司,http://www.11467.com/dongguan/co/314926.htm
东莞万志塑胶制品有限公司,http://www.11467.com/dongguan/co/183987.htm
華社電子科技有限公司,http://www.11467.com/dongguan/co/388716.htm
明士达(香港)有限公司,http://www.11467.com/dongguan/co/390686.htm
杰美塑料制品公司,http://www.11467.com/dongguan/co/385652.htm
建昇塑胶制品有限公司,http://www.11467.com/dongguan/co/394618.htm
广东天行塑料有限公司,http://www.11467.com/dongguan/co/390955.htm
東莞市巨一科技有限公司,http://www.11467.com/dongguan/co/388584.htm
可丰欣業股份有限公司,http://www.11467.com/dongguan/co/391683.htm
优威王电子塑胶五金有限公司,http://www.11467.com/dongguan/co/385533.htm
龙华颜料有限公司,http://www.11467.com/dongguan/co/395006.htm
顺达电工胶带有限公司,http://www.11467.com/dongguan/co/392831.htm
聲寶塑料制品有限公司,http://www.11467.com/dongguan/co/394639.htm
永聚塑胶有限公司,http://www.11467.com/dongguan/co/386436.htm
永年硅胶制品有限公司,http://www.11467.com/dongguan/co/395359.htm
毅诚塑胶电子五金实业有限公司,http://www.11467.com/dongguan/co/385455.htm
盛涵精密塑胶制品有限公司,http://www.11467.com/dongguan/co/393957.htm
合盛塑胶有限公司,http://www.11467.com/dongguan/co/391463.htm
群福塑胶制品有限公司,http://www.11467.com/dongguan/co/392780.htm
恒昇纽扣饰品制品有限公司,http://www.11467.com/dongguan/co/394142.htm
广东省东莞市振中塑胶有限公司,http://www.11467.com/dongguan/co/386721.htm
利华手板模型制作公司,http://www.11467.com/dongguan/co/392394.htm
华隆塑胶制品有限公司,http://www.11467.com/dongguan/co/394202.htm
佛山市南海区富圣塑料制品有限公司,http://www.11467.com/foshan/co/260238.htm
安华塑料五金制品有限公司,http://www.11467.com/foshan/co/289767.htm
佛山高明亿龙塑胶工业有限公司,http://www.11467.com/foshan/co/288532.htm
佛山市格雷亚特实业有限公司 销售部,http://www.11467.com/foshan/co/289749.htm
佛山市顺德区德芙迪实业有限公司业务部,http://www.11467.com/foshan/co/290214.htm
佛山市顺德区固特朗实业有限公司,http://www.11467.com/foshan/co/236257.htm
佛山欧力达塑胶模具有限公司,http://www.11467.com/foshan/co/290841.htm
佛山市顺德华悦塑料制品有限公司,http://www.11467.com/foshan/co/289985.htm
海洲电器塑料五金制品有限公司,http://www.11467.com/foshan/co/288409.htm
顺德容桂康途鞋材有限公司,http://www.11467.com/foshan/co/289131.htm
佛山市南海区立洋装饰材料有限公司,http://www.11467.com/foshan/co/288434.htm
骏盈塑料制品有限公司,http://www.11467.com/foshan/co/290670.htm
佛山市顺德区利达塑料制品有限公司,http://www.11467.com/foshan/co/346350.htm
森硕业塑胶五金制品有限公司,http://www.11467.com/foshan/co/290091.htm
顺德海电实业有限公司,http://www.11467.com/foshan/co/290441.htm
福州惠嘉清洁用品有限公司销售部,http://www.11467.com/fuzhou/co/158323.htm
福州三威橡塑化工有限公司（生产部）,http://www.11467.com/fuzhou/co/158545.htm
天福塑革有限公司,http://www.11467.com/fuzhou/co/158526.htm
福州旺强模具公司,http://www.11467.com/fuzhou/co/158552.htm
福州闽一鞋业有限公司,http://www.11467.com/fuzhou/co/25968.htm
广州迪亚纳国际贸易有限公司,http://www.11467.com/guangzhou/co/405042.htm
德联塑料制品有限公司,http://www.11467.com/guangzhou/co/406007.htm
广州yongdebao公司,http://www.11467.com/guangzhou/co/406287.htm
广州贝士特橡胶 塑料有限公司,http://www.11467.com/guangzhou/co/403167.htm
广州市奥杰斯日用品有限公司贸易部,http://www.11467.com/guangzhou/co/405186.htm
广州市宏业塑胶制品有限公司,http://www.11467.com/guangzhou/co/405926.htm
广州市龙飞塑业有限公司,http://www.11467.com/guangzhou/co/405460.htm
广州赛能冷藏科技有限公司销售部,http://www.11467.com/guangzhou/co/403705.htm
广州全兴塑料模具有限公司,http://www.11467.com/guangzhou/co/404045.htm
广州瑞星化工贸易有限公司,http://www.11467.com/guangzhou/co/403414.htm
广州市惠丰回力胶有限公司,http://www.11467.com/guangzhou/co/404612.htm
广州市亚泰实业有限公司,http://www.11467.com/guangzhou/co/403558.htm
威海都程塑料有限公司,http://www.11467.com/jimo/co/8879.htm
济南民兴帘业有限公司,http://www.11467.com/jinan/co/108283.htm
金华市大不同工具有限公司,http://www.11467.com/jinhua/co/54900.htm
山东济宁华斯立塑料制品公司,http://www.11467.com/jining/co/53929.htm
西安优派日化有限公司昆明分公司,http://www.11467.com/kunming/co/118759.htm
永清县康达橡塑有限公司,http://www.11467.com/langfang/co/27857.htm
廊坊市宇鹏塑料制品有限公司,http://www.11467.com/langfang/co/34674.htm
文安县天恒再生资源有限公司,http://www.11467.com/langfang/co/52597.htm
临沂飞仑塑料制品有限公司,http://www.11467.com/linyi/co/91377.htm
沂水盛隆塑料制品有限公司,http://www.11467.com/linyi/co/87108.htm
朋达塑业公司,http://www.11467.com/linyi/co/72848.htm
鑫富临塑化有限公司,http://www.11467.com/linyi/co/73034.htm
山东临沂盛达塑胶制品有限公司,http://www.11467.com/linyi/co/72906.htm
上海双龙塑料有限公司,http://www.11467.com/linyi/co/72941.htm
浙江宏胜贸易有限公司,http://www.11467.com/lishui/co/25862.htm
鸿泰塑料有限公司,http://www.11467.com/maoming/co/33270.htm
吗的贸易有限公司,http://www.11467.com/nanjing/co/107599.htm
南通博锐精密橡塑技术有限公司 营销,http://www.11467.com/nantong/co/111497.htm
宏大包装海安有限公司,http://www.11467.com/nantong/co/138572.htm
南通友星机电有限公司,http://www.11467.com/nantong/co/111507.htm
南通鹏远实业有限公司,http://www.11467.com/nantong/co/111613.htm
蓝科国际有限公司,http://www.11467.com/ningbo/co/137996.htm
宁波杰利塑业有限公司,http://www.11467.com/ningbo/co/12058.htm
宁波市鄞州宝翎塑业有限公司,http://www.11467.com/ningbo/co/130391.htm
宁波市鄞州克鲁格工具有限公司,http://www.11467.com/ningbo/co/136521.htm
余姚市奥邦塑模实业有限公司,http://www.11467.com/ningbo/co/137639.htm
宁波名灿塑料有限公司业务部,http://www.11467.com/ningbo/co/137888.htm
福建省莆田鑫辉塑胶有限公司,http://www.11467.com/putian/co/33829.htm
青岛松美国际贸易有限公司,http://www.11467.com/qingdao/co/117612.htm
毕马可机械电子(青岛)有限公司,http://www.11467.com/qingdao/co/81670.htm
凯纳特实业有限公司,http://www.11467.com/qingdao/co/118461.htm
青岛怡丰电子有限公司,http://www.11467.com/qingdao/co/118612.htm
青岛崇元塑料有限公司,http://www.11467.com/qingdao/co/13689.htm
青岛永茂塑胶有限公司,http://www.11467.com/qingdao/co/117766.htm
泉州天海贸易有限公司,http://www.11467.com/quanzhou/co/112127.htm
侨艺鞋材有限公司,http://www.11467.com/quanzhou/co/50336.htm
泉州市鲤城区华顺塑胶有限公司,http://www.11467.com/quanzhou/co/51690.htm
瑞祥商贸公司,http://www.11467.com/quanzhou/co/111903.htm
日照博林包装有限公司,http://www.11467.com/rizhao/co/15933.htm
汕头市泰鑫制品实业有限公司,http://www.11467.com/shantou/co/142464.htm
南方塑胶制品有限公司,http://www.11467.com/shantou/co/142238.htm
汕头市美新塑胶有限公司,http://www.11467.com/shantou/co/142396.htm
汕头市尼格塑胶有限公司,http://www.11467.com/shantou/co/142181.htm
汕头市灿成工艺玩具实业有限公司,http://www.11467.com/shantou/co/141926.htm
绍兴市凯迪塑料建筑材料有限公司,http://www.11467.com/shaoxing/co/83060.htm
嵊州市鸿强文具礼品有限公司,http://www.11467.com/shaoxing/co/124121.htm
宁波三和壳体公司 沈阳办,http://www.11467.com/shenyang/co/77112.htm
沈阳大同北泰注塑有限公司,http://www.11467.com/shenyang/co/76943.htm
沈阳市诺亚数码立体科技有限公司,http://www.11467.com/shenyang/co/77102.htm
沈阳东北橡塑材料有限公司,http://www.11467.com/shenyang/co/77239.htm
崇达实业公司,http://www.11467.com/shenzhen/co/693490.htm
东方骏实业有限公司,http://www.11467.com/shenzhen/co/694136.htm
动力塑胶模具有限公司,http://www.11467.com/shenzhen/co/693291.htm
佳盈塑胶模具制造(深圳)有限公司,http://www.11467.com/shenzhen/co/694831.htm
金泰塑胶五金制品有限公司,http://www.11467.com/shenzhen/co/692463.htm
华键矽胶科技（深圳）有限公司2,http://www.11467.com/shenzhen/co/694239.htm
洛华发展有限公司,http://www.11467.com/shenzhen/co/696445.htm
深圳得金贸易公司,http://www.11467.com/shenzhen/co/696653.htm
乔丰塑胶实业有限公司坑梓销售部,http://www.11467.com/shenzhen/co/699596.htm
艾文斯塑料(深圳)有限公司,http://www.11467.com/shenzhen/co/693410.htm
深圳利达贸易有限责任公司,http://www.11467.com/shenzhen/co/696758.htm
深圳峰盟塑膠有限公司,http://www.11467.com/shenzhen/co/698194.htm
金海洋经贸有限公司上海办事处,http://www.11467.com/shenzhen/co/694527.htm
三荣塑胶制品有限公司,http://www.11467.com/shenzhen/co/694923.htm
立联实业有限公司,http://www.11467.com/shenzhen/co/693290.htm
欧科塑胶制品（深圳）有限公司,http://www.11467.com/shenzhen/co/565623.htm
焯锋香港有限公司,http://www.11467.com/shenzhen/co/695872.htm
深圳华维塑胶制品有限公司,http://www.11467.com/shenzhen/co/697288.htm
深圳市奥德康实业有限公司营销部,http://www.11467.com/shenzhen/co/694702.htm
深圳市汇升隆塑胶模具有限公司,http://www.11467.com/shenzhen/co/697265.htm
奇浩塑胶模具五金有限公司,http://www.11467.com/shenzhen/co/151204.htm
深圳市佳佑模具制品有限公司外贸部,http://www.11467.com/shenzhen/co/694614.htm
深圳市宏盛发塑胶模具有限公司业务1,http://www.11467.com/shenzhen/co/692525.htm
深圳市宏明吸塑制品有限公司,http://www.11467.com/shenzhen/co/695922.htm
深圳市九九一实业有限公司,http://www.11467.com/shenzhen/co/696133.htm
深圳市昆仑兴塑胶制品有限公司（业务部）,http://www.11467.com/shenzhen/co/696675.htm
深圳市创金达塑胶有限公司,http://www.11467.com/shenzhen/co/697077.htm
深圳市濠新实业有限公司,http://www.11467.com/shenzhen/co/698870.htm
深圳市琪琪贸易有限公司,http://www.11467.com/shenzhen/co/694777.htm
深圳市绅晟电子有限公司yw,http://www.11467.com/shenzhen/co/694378.htm
深圳市鑫富莱科技有限公司,http://www.11467.com/shenzhen/co/697476.htm
深圳市南大洋塑胶有限公司市场部,http://www.11467.com/shenzhen/co/695174.htm
深圳市俊凯实业有限公司市场部,http://www.11467.com/shenzhen/co/694736.htm
深圳市台骐电子有限公司/采购部,http://www.11467.com/shenzhen/co/697949.htm
深圳市永联电子有限公司,http://www.11467.com/shenzhen/co/699116.htm
深圳市雨佳田实业发展有限公司营业部,http://www.11467.com/shenzhen/co/698609.htm
深圳田丰盛实业有限公司,http://www.11467.com/shenzhen/co/491382.htm
浙江黄岩康亿丰塑业有限公司,http://www.11467.com/taizhou/co/103377.htm
东远国际贸易有限公司台州办事处,http://www.11467.com/taizhou/co/103756.htm
中天塑业有限公司外协部,http://www.11467.com/taizhou/co/103390.htm
东远国际贸易有限公司台州办事处,http://www.11467.com/taizhou/co/103755.htm
泰州市海陵区飞意达塑料制品有限公司,http://www.11467.com/taizhoushi/co/46906.htm
泰州市汇丰工业皮带有限公司销售部,http://www.11467.com/taizhoushi/co/34002.htm
山东布莱森国际贸易有限公司,http://www.11467.com/weifang/co/90678.htm
潍坊昌达包装保温材料有限公司,http://www.11467.com/weifang/co/120281.htm
高密塑字公司,http://www.11467.com/weifang/co/90698.htm
潍坊盛泰塑胶有限公司业务部,http://www.11467.com/weifang/co/90715.htm
普利兹包装有限公司,http://www.11467.com/weifang/co/90871.htm
威海双平塑料制品有限公司,http://www.11467.com/weihai/co/35155.htm
威海三益电子有限公司,http://www.11467.com/weihai/co/35142.htm
高翔模具有限公司,http://www.11467.com/wenzhou/co/166746.htm
浙江宏泰电器有限公司，销售七部,http://www.11467.com/wenzhou/co/166705.htm
温州市博海塑料有限公司,http://www.11467.com/wenzhou/co/166778.htm
钱通二手编织袋贸易有限公司,http://www.11467.com/wuhan/co/109262.htm
上海捷诺电子有限公司（销售部）,http://www.11467.com/wuhan/co/109160.htm
上海捷诺电子有限公司（武汉分公司）,http://www.11467.com/wuhan/co/109156.htm
武汉欧建塑胶有限公司,http://www.11467.com/wuhan/co/109305.htm
新疆金创益道路设施有限公司,http://www.11467.com/wulumuqi/co/98540.htm
模艺（无锡）塑料有限公司,http://www.11467.com/wuxi/co/210925.htm
无锡高云塑料制品有限公司,http://www.11467.com/wuxi/co/218196.htm
无锡市科京塑业制品有限公司,http://www.11467.com/wuxi/co/249444.htm
天航电机配件有限公司,http://www.11467.com/wuxi/co/211129.htm
无锡市凌燕模具机械有限公司,http://www.11467.com/wuxi/co/56301.htm
无锡市红叶塑钢有限公司,http://www.11467.com/wuxi/co/211067.htm
无锡中良橡胶有限公司,http://www.11467.com/wuxi/co/211308.htm
华尔达(厦门)塑胶有限公司研发部,http://www.11467.com/xiamen/co/78530.htm
隆台廈門塑膠公司,http://www.11467.com/xiamen/co/77924.htm
厦门港光塑胶工业有限公司业务部,http://www.11467.com/xiamen/co/78580.htm
厦门嘉晖塑料制品有限公司,http://www.11467.com/xiamen/co/78602.htm
厦门树容工贸有限公司业务部门,http://www.11467.com/xiamen/co/78564.htm
厦门世洁塑料制品有限公司业务部,http://www.11467.com/xiamen/co/78740.htm
厦门金汤模具有限公司客服部,http://www.11467.com/xiamen/co/78404.htm
漳州东力工贸公司驻厦办事处,http://www.11467.com/xiamen/co/78261.htm
厦门浦天贸易有限公司,http://www.11467.com/xiamen/co/8032.htm
厦门豪法佳塑胶制品有限公司,http://www.11467.com/xiamen/co/77877.htm
厦门震鸣工贸有限公司,http://www.11467.com/xiamen/co/78843.htm
廈門市锦润塑膠有限公司,http://www.11467.com/xiamen/co/78864.htm
新乡市德诚塑业有限公司,http://www.11467.com/xinxiang/co/27533.htm
盐城登冕塑业有限公司,http://www.11467.com/yancheng/co/19889.htm
江苏盐城市龙龙塑业有限公司,http://www.11467.com/yancheng/co/59660.htm
宏达橡胶制品公司,http://www.11467.com/yangzhou/co/88412.htm
琼花高科股份有限公司,http://www.11467.com/yangzhou/co/88385.htm
广和塑料有限公司,http://www.11467.com/yantai/co/131683.htm
烟台诚和塑业有限公司,http://www.11467.com/yantai/co/131675.htm
烟台市福山文源塑料包装有限公司,http://www.11467.com/yantai/co/19938.htm
宜昌市新天利塑胶彩印包装有限公司,http://www.11467.com/yichang/co/47430.htm
宜昌市华都科技有限公司,http://www.11467.com/yichang/co/36046.htm
益阳市衡丰塑业有限公司,http://www.11467.com/yiyang/co/10563.htm
容成塑膠（福建）有限公司,http://www.11467.com/zhangzhou/co/41103.htm
无锡市美盛图文展示有限公司,http://www.11467.com/zhenjiang/co/48585.htm
镇江荣发塑料制品有限公司,http://www.11467.com/zhenjiang/co/53119.htm
丹阳市汇力橡塑制品有限公司,http://www.11467.com/zhenjiang/co/62007.htm
中山市浚华电器有限公司,http://www.11467.com/zhongshan/co/28351.htm
中山市韩老大磁电实业有限公司,http://www.11467.com/zhongshan/co/113004.htm
中山市钰山硅胶制品有限公司(春燕电子厂）,http://www.11467.com/zhongshan/co/113631.htm
兴华五金塑料制品有限公司,http://www.11467.com/zhongshan/co/113482.htm
中山市长能五金塑料制品有限公司,http://www.11467.com/zhongshan/co/46443.htm
山东齐鲁塑编集团股份有限公司销售部,http://www.11467.com/zibo/co/89233.htm
山东蓝帆塑胶股份有限公司内贸部,http://www.11467.com/zibo/co/89298.htm
山东淄博蒙信塑胶有限公司,http://www.11467.com/zibo/co/89216.htm
玉环康诺医疗用品有限公司,http://www.11467.com/qingyang/co/12418.htm
潮安县雅琪塑胶制品有限公司,http://www.11467.com/shantou/co/97370.htm
苏州恒江塑料制品有限公司,http://www.11467.com/suzhou/co/223260.htm
中山市飞恒脚轮有限公司,http://www.11467.com/zhongshan/co/78053.htm
北京庭杰塑胶制品有限公司,http://www.11467.com/beijing/co/582747.htm
诸城市日昇塑胶制品有限公司,http://www.11467.com/weifang/co/145422.htm
