四川省永达装饰公司巴中分公司,http://www.11467.com/bazhong/co/6295.htm
随州市强强防水有限公司,http://www.11467.com/suizhou/co/6913.htm
常州助建信息咨询服务有限公司,http://www.11467.com/changzhou/co/128162.htm
深圳美亚精品楼梯有限公司,http://www.11467.com/shenzhen/co/712029.htm
山西重宝实业有限公司,http://www.11467.com/taiyuan/co/44581.htm
成都市安建教育咨询有限公司高新区分公司,http://www.11467.com/qiye/93419819.htm
肇庆一品红装修公司,http://www.11467.com/zhaoqing/co/34239.htm
陕西泰戈尔环保科技有限公司,http://www.11467.com/xian/co/48685.htm
宁波海曙尺度装饰工程有限公司,http://www.11467.com/ningbo/co/205488.htm
苏州隆峰景观园林工程有限公司,http://www.11467.com/suzhou/co/404524.htm
上海聚赛空间设计有限公司,http://www.11467.com/shanghai/co/1305377.htm
北京华工环境工程有限公司,http://www.11467.com/qiye/93451517.htm
邹城市润盛建工有限公司,http://www.11467.com/qiye/93311451.htm
福州市富才声学发展有限公司,http://www.11467.com/qiye/93084272.htm
重庆言田门业有限公司,http://www.11467.com/chongqing/co/209859.htm
北京润元装饰有限公司,http://www.11467.com/beijing/co/759251.htm
广西星测科技有限公司,http://www.11467.com/nanning/co/99106.htm
广州不惑净化科技有限公司,http://www.11467.com/guangzhou/co/735501.htm
浙江正烨消防检测有限公司,http://www.11467.com/hangzhou/co/462817.htm
武汉科福建材科技有限公司,http://www.11467.com/wuhan/co/227735.htm
厦门霹誉贸易有限公司,http://www.11467.com/qiye/93437175.htm
天津威澜建筑工程有限公司,http://www.11467.com/tianjin/co/266174.htm
上海绪虎实业有限公司,http://www.11467.com/shanghai/co/1259979.htm
上海筑净净化工程有限公司,http://www.11467.com/shanghai/co/108260.htm
长治市满堂红室内设计工程有限公司,http://www.11467.com/changzhi/co/34383.htm
南京致存景观工程有限公司,http://www.11467.com/nanjing/co/187080.htm
南京百味装饰工程有限公司,http://www.11467.com/qiye/93171579.htm
深圳市合盈幕墙装饰设计工程有限公司,http://www.11467.com/qiye/93322965.htm
苏州恒泰建材装饰有限公司,http://www.11467.com/qiye/93132746.htm
和平县蓝图设计有限公司,http://www.11467.com/qiye/93079490.htm
四川森迪建筑装饰工程设计有限公司,http://www.11467.com/chengdu/co/285614.htm
江阴海青建筑保温材料有限公司,http://www.11467.com/wuxi/co/249741.htm
深圳市卓美防护工程有限公司,http://www.11467.com/shenzhen/co/811761.htm
重庆优乐淘相音装饰工程有限公司,http://www.11467.com/chongqing/co/289710.htm
东莞豪丰环保公司,http://www.11467.com/dongguan/co/615997.htm
祁阳县新星建筑劳务有限公司,http://www.11467.com/yongzhou/co/20448.htm
广州市隆盛装修工程有限公司,http://www.11467.com/guangzhou/co/511536.htm
天津中天鼎盛金属穿线管有限公司,http://www.11467.com/tianjin/co/218167.htm
陕西写意建筑装饰设计咨询有限公司,http://www.11467.com/xian/co/154891.htm
四川三欣建筑劳务有限公司,http://www.11467.com/chengdu/co/283033.htm
广州市奇维屋装饰工程有限公司,http://www.11467.com/guangzhou/co/745187.htm
南京顺河防水工程有限公司,http://www.11467.com/nanjing/co/185015.htm
佛山顺兴建筑材料出售有限公司,http://www.11467.com/foshan/co/472722.htm
安徽日辰装饰工程有限公司,http://www.11467.com/suzhoushi/co/35407.htm
苏州圣都家居有限公司,http://www.11467.com/suzhou/co/404374.htm
泰州则盛吊装科技有限公司,http://www.11467.com/taizhoushi/co/63591.htm
杭州意修建筑装饰有限公司,http://www.11467.com/hangzhou/co/108819.htm
上海财务代理有限公司,http://www.11467.com/shanghai/co/220217.htm
杭州浩瀚装饰工程有限公司,http://www.11467.com/hangzhou/co/111049.htm
沈阳北轩装饰工程有限公司,http://www.11467.com/fushun/co/27763.htm
齐河路建公路工程有限公司,http://www.11467.com/dezhou/co/71365.htm
北京创意优家家居装饰有限公司,http://www.11467.com/beijing/co/626918.htm
珠海安装工程有限公司,http://www.11467.com/zhuhai/co/89255.htm
北京中广恒丰装饰工程有限公司,http://www.11467.com/beijing/co/565679.htm
深圳海金装饰工程有限公司,http://www.11467.com/shenzhen/co/781850.htm
烟台科瑞装饰设计工程有限公司,http://www.11467.com/yantai/co/28374.htm
北京中外建建筑设计有限公司深圳分公司,http://www.11467.com/shenzhen/co/733258.htm
广西华行建工有限责任公司,http://www.11467.com/beihai/co/16190.htm
广西兴地建设工程有限公司,http://www.11467.com/beihai/co/16236.htm
四川锦都恒缘实业有限公司粮仓预应力拱板施工项目部,http://www.11467.com/dazhou/co/17792.htm
抚顺森隆达木业有限公司,http://www.11467.com/fushun/co/27819.htm
保定市东豪装饰工程有限公司,http://www.11467.com/baoding/co/119821.htm
新疆佰德益建材有限公司,http://www.11467.com/wulumuqi/co/105496.htm
北京大业美家家居装饰有限公司成都分公司,http://www.11467.com/chengdu/co/283625.htm
泰安市聚和装饰有限公司,http://www.11467.com/taian/co/68694.htm
北京匠状元装饰有限公司,http://www.11467.com/beijing/co/764692.htm
武汉明禾佳装饰有限公司,http://www.11467.com/wuhan/co/228491.htm
东易日盛家居装饰集团股份有限公司合肥分公司,http://www.11467.com/qiye/27457817.htm
山西紫苹果装饰工程有限公司,http://www.11467.com/qiye/27581654.htm
贵州鼎鼎日盛装饰工程有限公司,http://www.11467.com/guiyang/co/90695.htm
烟台鸿图华业装饰工程有限公司威海分公司,http://www.11467.com/weihai/co/62586.htm
湖南牛魔王装饰施工有限公司,http://www.11467.com/changsha/co/244818.htm
贵州七然晋立装饰工程有限公司,http://www.11467.com/anshun/co/11667.htm
陕西远景工程有限公司,http://www.11467.com/hanzhong/co/23196.htm
菏泽家煌装饰工程有限公司,http://www.11467.com/heze/co/23473.htm
内蒙古昌德装饰有限责任公司,http://www.11467.com/huhehaote/co/29457.htm
开封腾通住宅建设公司,http://www.11467.com/kaifeng/co/16659.htm
通州建总集团有限公司,http://www.11467.com/qinzhou/co/8970.htm
南安市贝斯泰石业有限公司,http://www.11467.com/quanzhou/co/113613.htm
山东视野装饰工程有限公司,http://www.11467.com/rizhao/co/16820.htm
湖北卓越集团建设有限公司,http://www.11467.com/shiyan/co/31311.htm
苏州佳丰装饰工程有限公司,http://www.11467.com/suzhou/co/15875.htm
山西龙盛达装饰工程有限公司,http://www.11467.com/taiyuan/co/105738.htm
唐山君业耐火保温材料有限公司,http://www.11467.com/tangshan/co/61865.htm
威海福满堂装饰有限公司,http://www.11467.com/weihai/co/36094.htm
内蒙古长城建安公司,http://www.11467.com/wuhai/co/4357.htm
无锡王兴幕墙装饰工程有限公司,http://www.11467.com/wuxi/co/27943.htm
肇庆邦丽建材实业有限公司,http://www.11467.com/zhaoqing/co/34390.htm
株洲美居乐装饰工程有限公司,http://www.11467.com/zhuzhou/co/37300.htm
祥瑞装饰有限公司,http://www.11467.com/rizhao/co/32054.htm
尚层装饰（北京）有限公司成都分公司,http://www.11467.com/chengdu/co/266007.htm
洛阳市超凡装潢设计工程有限公司,http://www.11467.com/luoyang/co/67270.htm
福州尊鹏王建材有限公司,http://www.11467.com/fuzhou/co/160814.htm
四川虹润建设有限公司,http://www.11467.com/guangyuan/co/17145.htm
深圳市宝安建筑工程有限公司,http://www.11467.com/guilin/co/47657.htm
上海波涛装饰集团宝鸡分公司,http://www.11467.com/baoji/co/28722.htm
深圳宏源防水材料有限公司,http://www.11467.com/shenzhen/co/729999.htm
保定华茂房地产开发有限公司,http://www.11467.com/baoding/co/12271.htm
重庆兄弟装饰公司,http://www.11467.com/chongqing/co/195888.htm
苏州美之峰装饰工程有限公司,http://www.11467.com/suzhou/co/270621.htm
江苏华瑞装饰工程有限公司,http://www.11467.com/nanjing/co/115511.htm
烟台艺树装饰设计有限公司,http://www.11467.com/yantai/co/134028.htm
深圳市天科建筑设计有限公司,http://www.11467.com/shenzhen/co/731690.htm
内蒙古点金路有限公司,http://www.11467.com/huhehaote/co/29746.htm
北京筑建远景装饰设计有限公司,http://www.11467.com/beijing/co/164076.htm
广州晶科建材有限公司,http://www.11467.com/guangzhou/co/454975.htm
东莞市领贤装饰设计工程有限公司,http://www.11467.com/dongguan/co/488996.htm
咸阳城市人家装饰有限公司蓝郡分公司,http://www.11467.com/xianyang/co/24590.htm
安康市南婷装饰工程有限公司,http://www.11467.com/ankang/co/13592.htm
吉林雨润地华置业有限公司,http://www.11467.com/baishan/co/11834.htm
北海馨平广洋房地产开发有限公司,http://www.11467.com/beihai/co/16209.htm
蚌埠艺家装饰有限责任公司,http://www.11467.com/bengbu/co/29915.htm
本溪東方管業有限公司,http://www.11467.com/benxi/co/30362.htm
大连皓翔装饰工程有限公司,http://www.11467.com/benxi/co/30417.htm
湖南中正工程建设咨询有限公司,http://www.11467.com/changde/co/32902.htm
泥巴公社装饰设计工程有限公司,http://www.11467.com/changsha/co/120832.htm
成都山之石装饰工程有限责任公司,http://www.11467.com/chengdu/co/141288.htm
上浙江海桐高新工程技术有限公司,http://www.11467.com/chizhou/co/9253.htm
楚雄中艺装饰工程有限公司,http://www.11467.com/chuxiong/co/13337.htm
大连豪之英物业管理有限公司,http://www.11467.com/dalian/co/65437.htm
大庆三易节能墙体制造有限公司,http://www.11467.com/daqing/co/42458.htm
大庆三塔建筑安装有限公司,http://www.11467.com/daqing/co/42602.htm
大同影音工程装饰公司,http://www.11467.com/datong/co/15822.htm
德阳日艺盛装饰工程有限公司业务部,http://www.11467.com/deyang/co/33030.htm
东营境远艺砼有限公司,http://www.11467.com/dongying/co/32511.htm
山东省东营市绿森商务信息咨询服务有限公司,http://www.11467.com/dongying/co/32402.htm
美丽的家装饰公司,http://www.11467.com/dongying/co/32301.htm
鄂尔多斯市蒙星建筑材料有限公司,http://www.11467.com/eerduosi/co/9094.htm
恩施房产网加盟有限公司,http://www.11467.com/enshi/co/13069.htm
鄂州三洋脚手架租赁公司,http://www.11467.com/ezhou/co/12543.htm
中油抚顺工程建设有限公司三分公司工程三队,http://www.11467.com/fushun/co/27800.htm
阜阳市超亿房地产开发有限公司,http://www.11467.com/fuyang/co/27960.htm
安徽甲方装饰设计有限公司,http://www.11467.com/hefei/co/188323.htm
重庆港宏装饰设计工程有限公司,http://www.11467.com/chongqing/co/344358.htm
安徽恒业建设工程有限公司,http://www.11467.com/fuyang/co/27840.htm
安徽宏天装饰有限责任公司,http://www.11467.com/fuyang/co/27842.htm
合肥海恒项目管理有限公司,http://www.11467.com/fuyang/co/27976.htm
三泰建筑装饰工程有限公司,http://www.11467.com/fuyang/co/27944.htm
四川盛源建筑安装工程公司,http://www.11467.com/guangyuan/co/17128.htm
中铁八局集团第三工程有限公司（物设部）,http://www.11467.com/guiyang/co/77884.htm
贵州曦梦装饰材料有限公司,http://www.11467.com/guiyang/co/78062.htm
贵州弘筑园林古建装饰工程有限公司,http://www.11467.com/guiyang/co/77796.htm
贵州易和建筑装饰工程有限公司,http://www.11467.com/guiyang/co/77845.htm
贵州元度家居汇建材有限责任公司,http://www.11467.com/guiyang/co/82836.htm
贵州省贵阳市好温馨装饰有限公司,http://www.11467.com/guiyang/co/77918.htm
哈尔滨金欧金属装饰品制造有限公司,http://www.11467.com/haerbin/co/61612.htm
杭州金展金属材料有限公司,http://www.11467.com/hangzhou/co/310100.htm
杭州浙创景观工程有限公司,http://www.11467.com/hangzhou/co/310087.htm
汉中市耀林拆除有限责任公司,http://www.11467.com/hanzhong/co/23144.htm
河南省鹤壁市飞达装饰有限公司,http://www.11467.com/hebi/co/9976.htm
鹤壁市泰隆市政工程有限公司,http://www.11467.com/hebi/co/9982.htm
百胜建筑装饰装璜有限公司,http://www.11467.com/heihe/co/19124.htm
美艺装饰传播有限公司,http://www.11467.com/hengyang/co/28415.htm
河源长鸿房地产有限公司,http://www.11467.com/heyuan/co/14891.htm
河源市源城区富来居装饰公司,http://www.11467.com/heyuan/co/14959.htm
广东省吴川市建筑工程公司河源项目部,http://www.11467.com/heyuan/co/14992.htm
深圳市鵬利裝飾設計工程有限公司河源分公司,http://www.11467.com/heyuan/co/14890.htm
麗景裝飾集團河源分公司,http://www.11467.com/heyuan/co/14915.htm
尚品装饰公司,http://www.11467.com/heze/co/23684.htm
菏泽金鼎置业有限公司,http://www.11467.com/heze/co/23412.htm
南通宏华建筑安装公司淮北分公司,http://www.11467.com/huaibei/co/14221.htm
淮南腾飞锚固材料有限公司,http://www.11467.com/huainan/co/16844.htm
淮南市厚普房地产开发有限公司,http://www.11467.com/huainan/co/16802.htm
内蒙古泉华建筑加固拆除有限公司,http://www.11467.com/huhehaote/co/29419.htm
虹腾建筑机械设备有限公司,http://www.11467.com/huhehaote/co/29432.htm
北京建磊国际装饰工程股份有限公司内蒙古办事处,http://www.11467.com/huhehaote/co/29384.htm
内蒙古鑫富豪木业有限公司,http://www.11467.com/huhehaote/co/29341.htm
唯盛装饰材料有限责任公司,http://www.11467.com/huhehaote/co/29552.htm
呼和浩特虹腾建筑机械有限公司,http://www.11467.com/huhehaote/co/29487.htm
内蒙古鄂尔多斯集团久大房地产开发有限公司,http://www.11467.com/huhehaote/co/29411.htm
唯盛装饰材料有限责任公司,http://www.11467.com/huhehaote/co/29553.htm
呼伦贝尔市海源经贸有限公司,http://www.11467.com/hulunbeier/co/17747.htm
佳木斯力生建筑施工公司,http://www.11467.com/jiamusi/co/34093.htm
南星装饰工程有限公司,http://www.11467.com/jingdezhen/co/12980.htm
中达建筑设备租赁有限公司,http://www.11467.com/jingmen/co/15854.htm
湖北省兴业建材有限公司,http://www.11467.com/jingmen/co/15877.htm
九江宜居装饰工程公司,http://www.11467.com/jiujiang/co/22330.htm
广西省桂林市九洲置业发展有限公司,http://www.11467.com/kaifeng/co/16627.htm
云南吉星装饰工程有限公司,http://www.11467.com/kunming/co/121510.htm
山东三山建筑有限公司,http://www.11467.com/laiwu/co/9467.htm
莱芜市恒阳暖通科技有限公司,http://www.11467.com/laiwu/co/9500.htm
雅典装饰工程公司,http://www.11467.com/lanzhou/co/72635.htm
帝尔诺商贸有限公司,http://www.11467.com/lanzhou/co/72472.htm
兰州闰程商贸有限公司,http://www.11467.com/lanzhou/co/72579.htm
月亮装饰公司,http://www.11467.com/liuan/co/16106.htm
龙岩联荣钢构工程有限公司,http://www.11467.com/longyan/co/23462.htm
方圆饰业工程公司,http://www.11467.com/lvliang/co/14140.htm
四川合力钢结构工程有限公司,http://www.11467.com/meishan/co/14607.htm
广东梅州市竹子贸易有限公司,http://www.11467.com/meizhou/co/23956.htm
南充市载德装饰工程有限公司,http://www.11467.com/nanchong/co/25695.htm
南京金箔集团宝玉工艺有限公司,http://www.11467.com/nanjing/co/66497.htm
福建省南平市永盛市政工程设备有限公司业务部,http://www.11467.com/nanping/co/36131.htm
盘锦市明丰装饰工程有限公司,http://www.11467.com/panjin/co/25582.htm
绿色家园装饰公司,http://www.11467.com/panzhihua/co/16916.htm
平顶山市旭轮装饰工程有限公司业务部,http://www.11467.com/pingdingshan/co/20119.htm
河南省建工集团房地产开发有限公司,http://www.11467.com/pingdingshan/co/20083.htm
濮阳油田管道疏通水暖安装公司,http://www.11467.com/puyang/co/21410.htm
青岛福赢建设集团有限公司,http://www.11467.com/qingdao/co/124558.htm
河北众人成建筑工程有限责任公司,http://www.11467.com/qinhuangdao/co/38669.htm
秦皇岛天河人工环境科技有限公司天河铝塑板厂,http://www.11467.com/qinhuangdao/co/38628.htm
秦皇岛冼明防水工程有限公司,http://www.11467.com/qinhuangdao/co/38563.htm
曲靖安厦房地产集团有限公司,http://www.11467.com/qujing/co/18868.htm
日照和风保温节能装饰工程有限公司,http://www.11467.com/rizhao/co/16676.htm
日照市金河装饰工程有限公司,http://www.11467.com/rizhao/co/16609.htm
山东视野模型有限公司,http://www.11467.com/rizhao/co/16898.htm
三明梅列装修公司,http://www.11467.com/sanming/co/32112.htm
丹凤县丁茂装饰建筑有限公司,http://www.11467.com/shangluo/co/8554.htm
商丘市隆鑫玻璃安装有限公司,http://www.11467.com/shangqiu/co/17807.htm
广东省优赢建筑脚手架有限公司,http://www.11467.com/shanwei/co/9573.htm
广州华睿玻璃有限公司韶关分部,http://www.11467.com/shaoguan/co/26089.htm
广东省优赢集团建筑脚手架有限公司,http://www.11467.com/shaoguan/co/26108.htm
广东省开平市优赢建筑脚手架有限公司（韶关销售部）,http://www.11467.com/shaoguan/co/26149.htm
深圳市宝鹰建设集团股份有限公司,http://www.11467.com/shenzhen/co/718228.htm
东风汽车工业工程公司,http://www.11467.com/shiyan/co/31347.htm
十堰市宏海华装饰材料有限公司,http://www.11467.com/shiyan/co/31308.htm
绥化市第一件材有限公司,http://www.11467.com/suihua/co/14816.htm
四川遂宁全力劳务建设有限公司,http://www.11467.com/suining/co/9400.htm
湖北省随州市中房集团开发公司,http://www.11467.com/suizhou/co/10460.htm
随州市大时代建筑装饰工程有限公司,http://www.11467.com/suizhou/co/10461.htm
宿州市泗绩装饰工程有限公司,http://www.11467.com/suzhoushi/co/18983.htm
宿州市永宏房地产开发有限公司,http://www.11467.com/suzhoushi/co/19047.htm
中煤第三建设集团有限责任公司,http://www.11467.com/suzhoushi/co/19001.htm
北京宜美家园建筑装饰工程有限公司山西分公司,http://www.11467.com/taiyuan/co/36427.htm
太原市晋锋建筑安装有限公司,http://www.11467.com/taiyuan/co/105750.htm
台州亿恒装饰有限公司,http://www.11467.com/taizhou/co/105044.htm
唐山远望幕墙装饰工程有限公司,http://www.11467.com/tangshan/co/63002.htm
唐山嘉艺建材有限公司,http://www.11467.com/tangshan/co/62946.htm
辽宁省铁岭市腾艺装修工程有限责任公司,http://www.11467.com/tieling/co/32032.htm
吉林恒诚建筑安装有限公司,http://www.11467.com/tonghua/co/32098.htm
通辽泛华置业有限公司,http://www.11467.com/tongliao/co/10072.htm
贵州名城房地产开发有限公司,http://www.11467.com/tongren/co/7780.htm
山东威海三龙防水物洁有限公司,http://www.11467.com/weihai/co/35861.htm
威海利海家居有限公司,http://www.11467.com/weihai/co/35911.htm
中铁十局第二工程有限公司,http://www.11467.com/weinan/co/22554.htm
新利建筑有限公司,http://www.11467.com/weinan/co/22547.htm
宏大专业钻孔公司,http://www.11467.com/wuhai/co/4333.htm
梧州市合工建筑公司,http://www.11467.com/wuzhou/co/17614.htm
安徽 宿州市防腐安装有限公司陕西办事处,http://www.11467.com/xianyang/co/23173.htm
湖北楚雄建筑工程有限公司,http://www.11467.com/xiaogan/co/20809.htm
西宁海马.隆升装饰工程有限公司,http://www.11467.com/xining/co/27615.htm
青海鸿祥建设工程有限公司,http://www.11467.com/xining/co/27592.htm
信阳市舒心装饰工程有限公司,http://www.11467.com/xinyang/co/20400.htm
新余贝盟装饰工程有限公司,http://www.11467.com/xinyu/co/7952.htm
城市人家装饰公司业务部,http://www.11467.com/xinzhou/co/17484.htm
河南许昌宏运房屋改造公司,http://www.11467.com/xuchang/co/19084.htm
福怡装饰工程有限公司,http://www.11467.com/yantai/co/133422.htm
烟台吉宇装饰有限责任公司,http://www.11467.com/yantai/co/28348.htm
天恩装饰工程有限责任公司,http://www.11467.com/yichang/co/47817.htm
宜昌市天恩装饰有限责任公司,http://www.11467.com/yichang/co/47840.htm
湖北益通建设工程有限责任公司,http://www.11467.com/yichang/co/47802.htm
宜春鑫型保温隔热防水材料有限公司,http://www.11467.com/yichun/co/21718.htm
宁夏青云建筑劳务分包有限公司,http://www.11467.com/yinchuan/co/42555.htm
银川地康专业水电暖改造公司,http://www.11467.com/yinchuan/co/42410.htm
营口汇通数控机械有限公司,http://www.11467.com/yingkou/co/44056.htm
益阳乾元模板有限公司,http://www.11467.com/yiyang/co/19855.htm
岳阳顺发装饰工程有限公司,http://www.11467.com/yueyang/co/34530.htm
山西宏夏工程第一有限公司,http://www.11467.com/yuncheng/co/26182.htm
深圳市大田洋实业有限公司,http://www.11467.com/yunfu/co/25996.htm
高迪大理石马赛克有限公司,http://www.11467.com/yunfu/co/26460.htm
深圳粤源装饰工程有限公司,http://www.11467.com/yunfu/co/26141.htm
广州盾海投资有限公司,http://www.11467.com/yunfu/co/26139.htm
玉溪汇溪建筑工程有限公司,http://www.11467.com/yuxi/co/16586.htm
欢颜装饰工程有限公司,http://www.11467.com/zhangye/co/9645.htm
沈阳中元伟业建筑装饰工程有限公司,http://www.11467.com/shenyang/co/81498.htm
深圳天阳防水防腐有限公司,http://www.11467.com/guangzhou/co/433907.htm
石家庄建港企业管理咨询有限公司,http://www.11467.com/shijiazhuang/co/112258.htm
贵州省安顺市经济技术开发区兴城建筑工程公司,http://www.11467.com/anshun/co/8786.htm
吉林白山金城园林古建筑工程有限公司,http://www.11467.com/baishan/co/11836.htm
白银市瑞丰装修工程有限公司,http://www.11467.com/baiyin/co/5260.htm
包头市伟仕达有限责任公司,http://www.11467.com/baotou/co/27905.htm
包头市兴新防水工程有限公司,http://www.11467.com/baotou/co/27735.htm
内蒙古华宇装饰工程有限责任公司,http://www.11467.com/baotou/co/27795.htm
百花不锈钢公司,http://www.11467.com/bayannaoer/co/5090.htm
广源建筑公司,http://www.11467.com/bayannaoer/co/5085.htm
广西北海市乃大贸易有限公司,http://www.11467.com/beihai/co/16196.htm
安徽省蚌埠市建筑建材有限公司,http://www.11467.com/bengbu/co/29969.htm
安徽蚌埠创新装饰公司,http://www.11467.com/bengbu/co/29883.htm
华新装饰公司,http://www.11467.com/benxi/co/30376.htm
贵州省毕节金鹰建材公司,http://www.11467.com/bijie/co/8877.htm
山东省洪润建设有限公司,http://www.11467.com/binzhou/co/24624.htm
滨州市建材有限公司,http://www.11467.com/binzhou/co/24681.htm
世杰装修工程有限公司,http://www.11467.com/changde/co/32934.htm
湖南长大建设集团股份有限公司,http://www.11467.com/changsha/co/61859.htm
巢湖三维装饰有限责任公司,http://www.11467.com/chaohu/co/14637.htm
巢湖市海仕达装饰工程有限公司,http://www.11467.com/chaohu/co/14605.htm
中建安装装饰工程有限公司,http://www.11467.com/chengde/co/23446.htm
秋浦建筑公司,http://www.11467.com/chizhou/co/9268.htm
丹东威圣建筑工程有限公司,http://www.11467.com/dandong/co/48709.htm
丹东中方基础工程有限公司,http://www.11467.com/dandong/co/48609.htm
丹东市天辰建设工程有限公司,http://www.11467.com/dandong/co/48690.htm
溪石集团丹东发展有限公司,http://www.11467.com/dandong/co/48624.htm
佰阳建设集团有限公司,http://www.11467.com/dandong/co/48639.htm
玉龙装饰公司,http://www.11467.com/dandong/co/48648.htm
大庆市红岗区鸿博小咸建筑装饰工程有限公司,http://www.11467.com/daqing/co/42457.htm
天艺阁装饰工程公司,http://www.11467.com/daqing/co/42598.htm
黑龙江省大庆市无极装饰工程有限公司,http://www.11467.com/daqing/co/42517.htm
鑫艺达装饰公司,http://www.11467.com/datong/co/15896.htm
大同宏旭商贸公司,http://www.11467.com/datong/co/15881.htm
大同云岗防腐抗磨有限责任公司,http://www.11467.com/datong/co/15814.htm
老郑工程公司,http://www.11467.com/datong/co/15942.htm
安徽圣颜装饰工程有限公司,http://www.11467.com/qiye/93187278.htm
广州云合装饰工程设计有限公司,http://www.11467.com/qiye/93222318.htm
太原市齐家典尚装饰工程有限公司,http://www.11467.com/qiye/93436168.htm
雅格装饰有限责任公司,http://www.11467.com/dazhou/co/17786.htm
德阳四方装饰工程有限公司,http://www.11467.com/deyang/co/33012.htm
华西建筑公司,http://www.11467.com/deyang/co/33022.htm
东营市庄典装饰有限公司,http://www.11467.com/dongying/co/32392.htm
东营兴友新型保温建材公司,http://www.11467.com/dongying/co/32531.htm
鄂尔多斯市睿智达房地产开发有限责任公司,http://www.11467.com/eerduosi/co/9049.htm
中天建设集团内蒙第四分公司,http://www.11467.com/eerduosi/co/9096.htm
梦达建筑公司,http://www.11467.com/eerduosi/co/9077.htm
内蒙古鄂尔多斯谊达建设投资有限公司,http://www.11467.com/eerduosi/co/9067.htm
鄂尔多斯市益正钢结构工程有限责任公司,http://www.11467.com/eerduosi/co/9086.htm
抚顺市外建监理咨询有限责任公司,http://www.11467.com/fushun/co/27915.htm
北方神马集团房地产开发股份有限公司,http://www.11467.com/fushun/co/27811.htm
抚顺诚实石化项目管理有限公司,http://www.11467.com/fushun/co/27788.htm
