广东华鼎建筑工程有限公司,http://www.11467.com/foshan/co/374312.htm
太仓万和建设工程投资咨询有限公司,http://www.11467.com/suzhou/co/358159.htm
山东金润建设咨询有限公司,http://www.11467.com/zibo/co/112665.htm
江苏裕祥装饰工程有限公司,http://www.11467.com/yangzhou/co/115288.htm
重庆市拙林园林景观设计有限公司,http://www.11467.com/yichang/co/56993.htm
天津市鹏腾伟业金属贸易有限公司,http://www.11467.com/tianjin/co/217551.htm
上海锡美电梯装饰工程有限公司,http://www.11467.com/chongqing/co/242304.htm
成都豪美佳装饰工程有限公司,http://www.11467.com/chengdu/co/274944.htm
安徽省建弘装饰工程有限公司,http://www.11467.com/hefei/co/152169.htm
广西雅庭集团装饰有限公司,http://www.11467.com/guigang/co/9275.htm
山东良工建筑劳务有限公司,http://www.11467.com/jinan/co/153381.htm
辽宁三合建筑工程有限公司,http://www.11467.com/liaoyang/co/25576.htm
成都欧馨居装饰工程有限责任公司,http://www.11467.com/chengdu/co/283099.htm
广州市奇利金属制品有限公司,http://www.11467.com/guangzhou/co/683279.htm
大连尚品原创装饰设计工程有限公司,http://www.11467.com/dalian/co/81108.htm
云南八方加固工程有限公司,http://www.11467.com/kunming/co/148126.htm
临沂市安顺拆除有限公司,http://www.11467.com/linyi/co/132580.htm
北京凯弘堂装饰工程有限公司,http://www.11467.com/beijing/co/763919.htm
无锡百度空间装饰装潢有限公司,http://www.11467.com/wuxi/co/274392.htm
成都创美家装饰工程有限公司,http://www.11467.com/chengdu/co/285696.htm
湖北河美家装饰工程有限公司,http://www.11467.com/wuhan/co/210878.htm
恩施巴城土寨仿古建筑有限公司,http://www.11467.com/enshi/co/18937.htm
宁夏福泰精工装饰工程有限公司,http://www.11467.com/yinchuan/co/45284.htm
重庆创品教育信息咨询有限公司,http://www.11467.com/chongqing/co/335346.htm
北京九创装饰工程有限公司,http://www.11467.com/beijing/co/789321.htm
山东鲁公大宅装饰工程有限公司,http://www.11467.com/qiye/27474507.htm
南京嘉怡装饰设计有限公司,http://www.11467.com/qiye/27499235.htm
深圳市龙翔设计景观工程有限公司,http://www.11467.com/shenzhen/co/1138058.htm
成都玉玲珑装饰工程有限公司,http://www.11467.com/beijing/co/790104.htm
北京丛林枫尚建筑装饰工程有限公司,http://www.11467.com/beijing/co/790377.htm
