天津君歌舜尧分子蒸馏设备有限公司,http://www.11467.com/tianjin/co/196378.htm
天津市盛世达水处理设备有限公司,http://www.11467.com/tianjin/co/300145.htm
东莞市广锋塑料机械有限公司,http://www.11467.com/dongguan/co/492592.htm
广东太安伊侨气体设备有限公司,http://www.11467.com/dongguan/co/492591.htm
容亮空压机设备有限公司,http://www.11467.com/dongguan/co/510944.htm
东莞市绿环(赣东)塑料机械有限公司,http://www.11467.com/dongguan/co/495102.htm
东莞市瑞邦制氮净化设备有限公司,http://www.11467.com/dongguan/co/273023.htm
东莞市虎门威政机械配件有限公司,http://www.11467.com/dongguan/co/232015.htm
和利电镀设备工程公司,http://www.11467.com/dongguan/co/128630.htm
佛山汉维机电科技有限公司,http://www.11467.com/foshan/co/225611.htm
广东省佛山市嘉瑞达科技有限公司,http://www.11467.com/foshan/co/243728.htm
顺德市均安镇永涛金属制品有限公司,http://www.11467.com/foshan/co/44706.htm
淮安市科宇机械有限公司,http://www.11467.com/fuzhou/co/161294.htm
广州大辉渔业设备有限公司,http://www.11467.com/guangzhou/co/468588.htm
广州圣智慧展精密滤清器有限公司,http://www.11467.com/guangzhou/co/279832.htm
广州市苏泰空调有限公司,http://www.11467.com/guangzhou/co/246150.htm
广州创集科技开发有限公司,http://www.11467.com/guangzhou/co/276882.htm
贵州明程伟业机械设备有限公司,http://www.11467.com/guiyang/co/83319.htm
邯郸派瑞气体设备有限公司,http://www.11467.com/handan/co/50616.htm
富阳天奥空分设备有限公司,http://www.11467.com/hangzhou/co/372499.htm
杭州贝特过滤机有限公司,http://www.11467.com/hangzhou/co/140122.htm
杭州杭氧股份有限公司,http://www.11467.com/hangzhou/co/246473.htm
杭州富阳天奥空分设备有限公司,http://www.11467.com/hangzhou/co/370808.htm
杭州富江过滤机有限公司,http://www.11467.com/hangzhou/co/207658.htm
杭州爱斐尔机电有限公司,http://www.11467.com/hangzhou/co/371808.htm
富阳瑞德气体设备有限公司(工程部),http://www.11467.com/hangzhou/co/371433.htm
杭州纳瑞建材有限公司,http://www.11467.com/hangzhou/co/207676.htm
杭州福斯达实业集团有限公司,http://www.11467.com/hangzhou/co/254789.htm
杭州嘉美净化设备有限公司江西办事处,http://www.11467.com/hangzhou/co/369762.htm
杭州科达过滤机械有限公司,http://www.11467.com/hangzhou/co/207678.htm
杭州萧山商业机械有限公司,http://www.11467.com/hangzhou/co/255464.htm
杭州欧凯膜技术有限公司,http://www.11467.com/hangzhou/co/207673.htm
临安汉克森过滤设备有限公司,http://www.11467.com/hangzhou/co/209090.htm
杭州凯宏膜技术有限公司,http://www.11467.com/hangzhou/co/193982.htm
杭州银星机械有限公司,http://www.11467.com/hangzhou/co/167385.htm
杭州环天空分设备有限公司,http://www.11467.com/hangzhou/co/181322.htm
浙江贝尔通信集团有限责任公司,http://www.11467.com/hangzhou/co/140276.htm
杭州盈达容器工程有限公司,http://www.11467.com/hangzhou/co/246540.htm
杭州科旺压滤机有限公司,http://www.11467.com/hangzhou/co/259063.htm
浙江南化防腐设备有限公司,http://www.11467.com/hangzhou/co/246392.htm
浙江金鸟压滤机有限公司,http://www.11467.com/hangzhou/co/207946.htm
杭州天和超滤设备有限公司,http://www.11467.com/hangzhou/co/159579.htm
杭州志力不锈钢设备有限公司,http://www.11467.com/hangzhou/co/311035.htm
安徽飞龙灌溉技术有限公司,http://www.11467.com/hefei/co/80253.htm
安徽省合肥万宝光电科技有限公司,http://www.11467.com/hefei/co/131733.htm
合肥市光科色选机械有限公司,http://www.11467.com/hefei/co/121590.htm
九鑫过滤有限公司,http://www.11467.com/hengshui/co/33775.htm
阜城县腾飞压滤机有限公司,http://www.11467.com/hengshui/co/19093.htm
安平县裕隆丝网制品有限公司,http://www.11467.com/hengshui/co/34703.htm
衡水金旺压滤机有限公司,http://www.11467.com/hengshui/co/33726.htm
河北亿利金属网制品有限公司,http://www.11467.com/hengshui/co/18846.htm
河北安平实烨金属制业有限公司,http://www.11467.com/hengshui/co/35463.htm
安平县正兴网业制造有限公司,http://www.11467.com/hengshui/co/33739.htm
淮北中德矿山机器有限公司,http://www.11467.com/huaibei/co/12484.htm
内蒙古大华制冷设备有限公司,http://www.11467.com/huhehaote/co/33903.htm
惠州鸿达水处理设备有限公司,http://www.11467.com/huizhou/co/97135.htm
湖州核宏机械有限公司,http://www.11467.com/huzhou/co/46880.htm
湖州核源机械设备有限公司,http://www.11467.com/huzhou/co/50919.htm
湖州核汇机械有限公司,http://www.11467.com/huzhou/co/27524.htm
湖州天源机械有限公司,http://www.11467.com/huzhou/co/42777.htm
揭阳市义发机械有限公司,http://www.11467.com/jieyang/co/31687.htm
上海信然压缩机有限公司山东办事处,http://www.11467.com/jinan/co/139570.htm
兰溪市永丰机械(台湾)有限公司,http://www.11467.com/jinhua/co/126129.htm
义乌嘉能科技设备有限公司,http://www.11467.com/jinhua/co/124840.htm
力扬环保节能设备制造公司,http://www.11467.com/jining/co/73934.htm
山东鹏达二手化工油脂设备购销公司,http://www.11467.com/jining/co/72326.htm
山东梁山华润油脂化工设备购销有限公司,http://www.11467.com/jining/co/74360.htm
九江富士通空压机有限公司,http://www.11467.com/jiujiang/co/19212.htm
九江市康普斯节能设备有限公司,http://www.11467.com/jiujiang/co/24400.htm
开封鹏远玻璃纤维制品有限公司,http://www.11467.com/kaifeng/co/11679.htm
开封市东风空分设备有限公司,http://www.11467.com/kaifeng/co/12424.htm
云南蜀玺风机制造有限公司,http://www.11467.com/kunming/co/128200.htm
山东莱芜煤矿机械有限公司,http://www.11467.com/laiwu/co/6841.htm
莱芜瑞源节水灌溉器材有限公司,http://www.11467.com/laiwu/co/15209.htm
兰州慧宇环保设备有限公司,http://www.11467.com/lanzhou/co/63878.htm
四川省西昌市锦旺机械设备有限公司,http://www.11467.com/liangshan/co/17526.htm
江苏旷丰重工机械有限公司,http://www.11467.com/lianyungang/co/43898.htm
连云港杰特化工机械有限公司,http://www.11467.com/lianyungang/co/28413.htm
连云港市东邦化工机械有限公司,http://www.11467.com/lianyungang/co/41375.htm
聊城空压机销售有限公司,http://www.11467.com/liaocheng/co/49645.htm
山东省聊城市科威化工仪器有限公司,http://www.11467.com/liaocheng/co/28900.htm
辽阳双联离心机公司,http://www.11467.com/liaoyang/co/15564.htm
山东山宝机械设备销售有限公司,http://www.11467.com/linyi/co/61655.htm
浙江天宇环保设备有限公司,http://www.11467.com/lishui/co/23043.htm
浙江丽峰化工机械有限公司,http://www.11467.com/lishui/co/35332.htm
柳州市恒一环保科技有限公司,http://www.11467.com/liuzhou/co/38139.htm
柳州蓓蒂芬科技有限公司,http://www.11467.com/liuzhou/co/46548.htm
南京鸿瑞特种陶瓷有限公司,http://www.11467.com/nanjing/co/82497.htm
陕西纳通机械科技有限公司,http://www.11467.com/xian/co/123898.htm
特灵空调西安销售服务公司,http://www.11467.com/xian/co/124982.htm
西安超滤化工有限责任公司,http://www.11467.com/xian/co/70584.htm
西安健科新技术开发有限公司,http://www.11467.com/xian/co/121716.htm
湖南融通离心机有限公司公司,http://www.11467.com/xiangtan/co/24139.htm
湖南新湘液机械设备有限公司,http://www.11467.com/xiangtan/co/28169.htm
湘潭裕丰离心机有限公司,http://www.11467.com/xiangtan/co/23005.htm
新乡市新良科技筛分设备有限公司,http://www.11467.com/xinxiang/co/19452.htm
新乡市坤丰振动设备有限公司,http://www.11467.com/xinxiang/co/31513.htm
新乡市玖鼎机械有限公司,http://www.11467.com/xinxiang/co/23217.htm
新乡市耐尔特振动设备有限公司,http://www.11467.com/xinxiang/co/31408.htm
新振机械有限公司,http://www.11467.com/xinxiang/co/32500.htm
新乡市迅达机械制造股份有限公司,http://www.11467.com/xinxiang/co/21674.htm
新乡市乔山机械设备有限公司,http://www.11467.com/xinxiang/co/19544.htm
新乡市平原电力设备有限公司,http://www.11467.com/xinxiang/co/21542.htm
河南玉忠机械制造有限公司,http://www.11467.com/xinxiang/co/23238.htm
新乡市日欣净化设备有限公司,http://www.11467.com/xinxiang/co/23246.htm
新乡市宏源振动有限责任公司,http://www.11467.com/xinxiang/co/32299.htm
河南金源公司,http://www.11467.com/xinxiang/co/32501.htm
河南新乡市鑫盛工矿机械有限公司,http://www.11467.com/xinxiang/co/19310.htm
盐城利隆环保技术有限公司,http://www.11467.com/yancheng/co/50002.htm
江苏丰强气动设备有限公司,http://www.11467.com/yancheng/co/79388.htm
大丰市中承沼气能源设备有限公司,http://www.11467.com/yancheng/co/78994.htm
江苏信博化工机械有限公司,http://www.11467.com/yancheng/co/52146.htm
江苏鑫东方环保设备科技有限公司,http://www.11467.com/yangzhou/co/107383.htm
江苏迈安德食品机械有限公司,http://www.11467.com/yangzhou/co/76266.htm
扬州华鑫水处理设备有限公司,http://www.11467.com/yangzhou/co/89733.htm
烟台一新祥宇机械有限公司,http://www.11467.com/yantai/co/155626.htm
江苏巨能机械有限公司,http://www.11467.com/yichun/co/23872.htm
江西诚志生物工程有限公司,http://www.11467.com/yingtan/co/3738.htm
河南省达兰科技有限公司,http://www.11467.com/zhengzhou/co/178044.htm
河南海纳博大科技有限公司,http://www.11467.com/zhengzhou/co/112222.htm
河南巩义市三环机械有限公司,http://www.11467.com/zhengzhou/co/179058.htm
河南精工机械制造有限公司,http://www.11467.com/zhengzhou/co/178358.htm
河南世邦重工机械有限公司,http://www.11467.com/zhengzhou/co/94947.htm
中国铝业股份有限公司河南分公司,http://www.11467.com/zhengzhou/co/53942.htm
郑州精华实业有限公司业务部,http://www.11467.com/zhengzhou/co/94564.htm
镇江市大港顺达汽车运输有限公司,http://www.11467.com/zhenjiang/co/35307.htm
镇江三三贸易有限公司,http://www.11467.com/zhenjiang/co/48599.htm
黑马医学仪器有限公司,http://www.11467.com/zhuhai/co/73710.htm
河南省确山县丰橙机械有限公司,http://www.11467.com/zhumadian/co/26384.htm
厦门翼发节能环保有限公司,http://www.11467.com/xiamen/co/94484.htm
上海泽定机电设备有限公司,http://www.11467.com/shanghai/co/1045149.htm
上海众翱实业有限公司,http://www.11467.com/shanghai/co/1050193.htm
上海何氏实业有限公司PET塑料瓶剥标机,http://www.11467.com/shanghai/co/1051541.htm
天津森烁科贸有限公司,http://www.11467.com/tianjin/co/89506.htm
天津凯美特化工科技有限公司,http://www.11467.com/tianjin/co/137550.htm
天津市大陆制氢设备有限公司,http://www.11467.com/tianjin/co/109613.htm
天津博瑞康机械制造有限公司销售部,http://www.11467.com/tianjin/co/15658.htm
石嘴山市迎圣工贸有限公司,http://www.11467.com/shizuishan/co/10886.htm
江苏淮海石油机械有限公司,http://www.11467.com/yancheng/co/81490.htm
天津市创举科技有限公司,http://www.11467.com/tianjin/co/300666.htm
乌海市弘日环保科技有限责任公司,http://www.11467.com/wuhai/co/5465.htm
固安县品铭滤清器制造有限公司,http://www.11467.com/langfang/co/58442.htm
新乡市高服机械股份有限公司,http://www.11467.com/qiye/23603048.htm
北昌君控（北京）科技有限公司郑州分公司,http://www.11467.com/zhengzhou/co/259401.htm
河南科亿滤布有限公司,http://www.11467.com/xuchang/co/41691.htm
新乡市大汉自动机械有限公司,http://www.11467.com/xinxiang/co/26982.htm
新乡市硕方机械有限公司,http://www.11467.com/xinxiang/co/31350.htm
青州昌达机械设备有限公司,http://www.11467.com/weifang/co/117391.htm
中国重庆恒光滤油机制造有限公司,http://www.11467.com/chongqing/co/208056.htm
中视博大机电设备租赁公司,http://www.11467.com/chengdu/co/241981.htm
烟台一新祥宇机床辅机有限公司,http://www.11467.com/yantai/co/167640.htm
安徽省潜山县徐峰刷业刷业有限公司,http://www.11467.com/anqing/co/23899.htm
鞍山大地矿山机械有限公司,http://www.11467.com/anshan/co/72034.htm
海城市鼎信通风环保设备有限公司,http://www.11467.com/anshan/co/35832.htm
鞍山东大校友科技开发有限公司,http://www.11467.com/anshan/co/53174.htm
鞍山市金钢碳纤维复合材料有限公司,http://www.11467.com/anshan/co/69628.htm
同辉科技有限公司销售部,http://www.11467.com/anshan/co/72053.htm
淄博太极工业搪瓷有限公司 销售,http://www.11467.com/zibo/co/74035.htm
淄博源丰达工贸有限公司,http://www.11467.com/zibo/co/74033.htm
淄博化工设备有限公司,http://www.11467.com/zibo/co/98295.htm
北京鸡鸭脱毛机有限公司,http://www.11467.com/beijing/co/703488.htm
北京华清大地环保科技发展有限公司产品部,http://www.11467.com/beijing/co/697940.htm
北京普瑞沃特科技发展有限公司,http://www.11467.com/beijing/co/713199.htm
北京思博盈动科技有限公司,http://www.11467.com/beijing/co/695421.htm
北京太光节能技术有限公司,http://www.11467.com/beijing/co/84172.htm
北京吉睿科技有限公司,http://www.11467.com/beijing/co/703490.htm
北京怡美通德科技发展有限公司,http://www.11467.com/beijing/co/384069.htm
无锡上佳生物科技有限公司北京办事处,http://www.11467.com/beijing/co/701931.htm
汉谟机械(上海)有限公司,http://www.11467.com/shanghai/co/1045159.htm
上海斐兰气动工程有限公司,http://www.11467.com/shanghai/co/1057678.htm
上海海萨实业有限公司,http://www.11467.com/shanghai/co/1050192.htm
欧拉法(上海)实业有限公司,http://www.11467.com/shanghai/co/1045151.htm
上海医分仪器制造有限公司,http://www.11467.com/shanghai/co/1039217.htm
滑县宇发铝塑分离设备有限公司,http://www.11467.com/anyang/co/36813.htm
安阳市福士德重型机械有限责任公司,http://www.11467.com/anyang/co/26134.htm
安阳商祺网络有限责任公司,http://www.11467.com/anyang/co/27783.htm
高碑店市开拓精密仪器制造有限责任公司,http://www.11467.com/baoding/co/80649.htm
保定市莱特起重设备有限公司,http://www.11467.com/baoding/co/56888.htm
宝鸡国泰金属有限公司,http://www.11467.com/baoji/co/30880.htm
宝鸡华琪金属复合材料有限公司,http://www.11467.com/baoji/co/30740.htm
宝鸡华泰金属技术发展有限责任公司,http://www.11467.com/baoji/co/25086.htm
宝鸡宝冶钛镍制造有限责任公司销售部,http://www.11467.com/baoji/co/25864.htm
内蒙古天福风机有限公司,http://www.11467.com/baotou/co/14320.htm
内蒙古包钢重菱锅炉制造有限公司,http://www.11467.com/baotou/co/24652.htm
蚌埠轻化药机有限责任公司,http://www.11467.com/bengbu/co/27480.htm
蚌埠华阳机械装备制造有限公司,http://www.11467.com/bengbu/co/27479.htm
蚌埠市振强制药化工机械有限公司,http://www.11467.com/bengbu/co/27481.htm
山东省全兴厨业有限公司,http://www.11467.com/binzhou/co/35029.htm
滨州市金山网业有限公司,http://www.11467.com/binzhou/co/35821.htm
鑫磊筛网有限公司,http://www.11467.com/binzhou/co/20115.htm
泊头巨峰机械制造有限公司,http://www.11467.com/cangzhou/co/61935.htm
沧州中油钻采设备有限公司,http://www.11467.com/cangzhou/co/38496.htm
沧州中油固控设备有限公司,http://www.11467.com/cangzhou/co/38441.htm
张家港中南化工机械有限公司,http://www.11467.com/cangzhou/co/40336.htm
沧州华沧钻采设备有限公司,http://www.11467.com/cangzhou/co/38512.htm
泊头市福润橡塑有限公司,http://www.11467.com/cangzhou/co/60620.htm
沧州彗星石油机械有限公司,http://www.11467.com/cangzhou/co/40337.htm
新兴化工设备公司,http://www.11467.com/cangzhou/co/60462.htm
沧州乾丰环保器材有限公司,http://www.11467.com/cangzhou/co/62705.htm
泊头市亿保机械有限公司,http://www.11467.com/cangzhou/co/55374.htm
沧州市中油华沧石油设备制造有限公司,http://www.11467.com/cangzhou/co/40335.htm
沧州市求精水处理设备有限公司,http://www.11467.com/cangzhou/co/41449.htm
沧州市狮城水处理设备有限公司,http://www.11467.com/cangzhou/co/38688.htm
华油飞达装备有限公司,http://www.11467.com/cangzhou/co/40338.htm
吉林省新禾科技开发有限公司,http://www.11467.com/changchun/co/65778.htm
长春市可立尔生物技术工程有限公司,http://www.11467.com/changchun/co/53334.htm
长春市金宇科技有限公司销售部,http://www.11467.com/changchun/co/73277.htm
长春鸿旺机械筛板有限公司,http://www.11467.com/changchun/co/75003.htm
长沙迈佳森仪器设备有限公司,http://www.11467.com/changsha/co/82038.htm
长沙高新技术开发区湘麓离心机有限公司,http://www.11467.com/changsha/co/70709.htm
长沙弘扬化玻仪器有限公司,http://www.11467.com/changsha/co/82061.htm
湖南长沙华泰重工制造有限公司,http://www.11467.com/changsha/co/81995.htm
湖南楚惟机械有限公司营销部,http://www.11467.com/changsha/co/71256.htm
长沙市鑫奥仪器仪表有限公司销售部,http://www.11467.com/changsha/co/82039.htm
长沙骏逸实验仪器有限公司,http://www.11467.com/changsha/co/82036.htm
东莞纳金机械有限公司长沙办事处,http://www.11467.com/changsha/co/121236.htm
株洲森美新材料有限责任销售公司,http://www.11467.com/changsha/co/120567.htm
湖南星科科学仪器有限公司网络部,http://www.11467.com/changsha/co/70153.htm
湘仪离心机仪器有限公司,http://www.11467.com/changsha/co/82031.htm
湘仪仪器有限公司,http://www.11467.com/changsha/co/82032.htm
湖南凯达科学仪器有限公司,http://www.11467.com/changsha/co/101867.htm
专业生产离心机公司,http://www.11467.com/changsha/co/82026.htm
长沙锦隆创投仪器有限公司,http://www.11467.com/changsha/co/72044.htm
湖南湘智离心机有限公司,http://www.11467.com/changsha/co/82024.htm
三湘空调环保工程技术开发有限公司（长沙市环保陶瓷机械厂）,http://www.11467.com/changsha/co/70702.htm
湖南盛业土工材料制造有限公司,http://www.11467.com/changsha/co/86302.htm
湖南湘仪离心机仪器有限公司,http://www.11467.com/changsha/co/82023.htm
湖南沪康离心机有限公司上海分公司,http://www.11467.com/changsha/co/82035.htm
湖南省凯达科学仪器有限公司,http://www.11467.com/changsha/co/82045.htm
湖南赛特湘仪离心机仪器有限公司,http://www.11467.com/changsha/co/19614.htm
长治同方锅炉压力容器技术服务有限公司（屯留分公司）,http://www.11467.com/changzhi/co/27069.htm
常州化工设备有限公司成套工程部,http://www.11467.com/changzhou/co/101668.htm
常州市天瑞干燥设备有限公司,http://www.11467.com/changzhou/co/88499.htm
常州市创瑞液压设备有限公司,http://www.11467.com/changzhou/co/110232.htm
常州市天顺振动设备有限公司,http://www.11467.com/changzhou/co/110253.htm
常州李能机械设备有限公司,http://www.11467.com/changzhou/co/88943.htm
常州佳业药化设备有限公司,http://www.11467.com/changzhou/co/78016.htm
常州宏骏商贸有限公司,http://www.11467.com/changzhou/co/101784.htm
常州市奥特橡塑制品有限公司,http://www.11467.com/changzhou/co/53524.htm
常州市恒亮离心机制造有限公司,http://www.11467.com/changzhou/co/101786.htm
常州湖磨抛光磨具制造有限公司,http://www.11467.com/changzhou/co/129324.htm
常州市科隆化工有限公司,http://www.11467.com/changzhou/co/101653.htm
常州市英智机械有限公司,http://www.11467.com/changzhou/co/57276.htm
常州市武进金城发酵机械有限公司,http://www.11467.com/changzhou/co/56768.htm
溧阳市维泽飞腾过滤设备有限公司,http://www.11467.com/changzhou/co/150283.htm
常州市武进山河机械有限公司,http://www.11467.com/changzhou/co/88638.htm
常州信诺化工有限公司,http://www.11467.com/changzhou/co/121348.htm
常州市凯航仪器有限公司,http://www.11467.com/changzhou/co/148240.htm
金坛市华峰仪器有限公司,http://www.11467.com/changzhou/co/49419.htm
常州市唯科机电设备有限公司,http://www.11467.com/changzhou/co/149925.htm
常州祥晃通风电器设备有限公司,http://www.11467.com/changzhou/co/20099.htm
常州市恒源干燥设备有限公司,http://www.11467.com/changzhou/co/55448.htm
溧阳市旭能过滤设备有限公司,http://www.11467.com/changzhou/co/151100.htm
常州恒亮离心机有限公司,http://www.11467.com/changzhou/co/101787.htm
北京欣惠泽奥科技有限公司,http://www.11467.com/chaoyang/co/26243.htm
承德达纯净化设备制造有限公司,http://www.11467.com/chengde/co/28658.htm
长沙湘麓离心机仪器有限公司成都办事处,http://www.11467.com/chengdu/co/100314.htm
成都凯成工程技术有限公司市场部,http://www.11467.com/chengdu/co/100321.htm
成都天保水电设备有限公司,http://www.11467.com/chengdu/co/100318.htm
成都孙源通用设备有限公司,http://www.11467.com/chengdu/co/100317.htm
成都荣冠科技有限公司,http://www.11467.com/chengdu/co/234961.htm
四川亚连科技有限责任公司销售部,http://www.11467.com/chengdu/co/100327.htm
四川润来博尔控制仪表有限公司,http://www.11467.com/chengdu/co/215491.htm
湖南星科科学仪器有限公司（西南办事处）,http://www.11467.com/chengdu/co/100320.htm
宽宝环保设备有限公司成都办,http://www.11467.com/chengdu/co/100312.htm
成都富凯机电设备有限公司,http://www.11467.com/chengdu/co/214289.htm
杭州宝诺空分设备有限公司成都办事处,http://www.11467.com/chengdu/co/100324.htm
味多食品公司,http://www.11467.com/chengdu/co/100322.htm
四川省化工建设总公司第九分公司,http://www.11467.com/chengdu/co/100325.htm
湘麓离心机仪器有限公司成都办事处,http://www.11467.com/chengdu/co/100316.htm
四川一脉科技有限公司,http://www.11467.com/chengdu/co/100326.htm
赤峰粤峰商贸有限公司,http://www.11467.com/chifeng/co/22684.htm
大连瑞田国际贸易有限公司,http://www.11467.com/dalian/co/45110.htm
大连嘉兴医疗器械有限公司,http://www.11467.com/dalian/co/45112.htm
大连成冬机械有限公司,http://www.11467.com/dalian/co/69041.htm
大连瑞田科技开发有限公司,http://www.11467.com/dalian/co/45109.htm
大连创新钰泉环保设备有限公司,http://www.11467.com/dalian/co/35398.htm
凤城市东宁动力有限公司,http://www.11467.com/dandong/co/51533.htm
凤城市宏伟过滤设备有限公司,http://www.11467.com/dandong/co/23467.htm
丹东金鼎压缩机有限公司,http://www.11467.com/dandong/co/45338.htm
辽宁省丹东市工业锅炉有限公司,http://www.11467.com/dandong/co/46483.htm
北京华油惠普公司,http://www.11467.com/daqing/co/39830.htm
大庆开发区三春节能技术有限公司,http://www.11467.com/daqing/co/24375.htm
山东陵县华龙化纤有限公司,http://www.11467.com/dezhou/co/49811.htm
山东建亚机械设备有限公司,http://www.11467.com/dezhou/co/50797.htm
碧海贸易有限公司,http://www.11467.com/dongguan/co/232014.htm
长沙高新开发区湘麓离心机仪器有限公司（广东）办事处,http://www.11467.com/dongguan/co/232318.htm
长天精密设备有限公司,http://www.11467.com/dongguan/co/505866.htm
东莞晨怡节能设备有限公司,http://www.11467.com/dongguan/co/129882.htm
宝雅研磨公司,http://www.11467.com/dongguan/co/232208.htm
宝雅研磨有限公司,http://www.11467.com/dongguan/co/232176.htm
东莞凯特滤清器制造有限公司,http://www.11467.com/dongguan/co/294538.htm
德克贝尔空气过滤器(东莞)有限公司,http://www.11467.com/dongguan/co/232199.htm
东莞三众机械有限公司西南办,http://www.11467.com/dongguan/co/495100.htm
东莞市百惠浦净水设备有限公司,http://www.11467.com/dongguan/co/477381.htm
东莞美高电热机械有限公司,http://www.11467.com/dongguan/co/500675.htm
东莞市奥拜斯机械有限公司,http://www.11467.com/dongguan/co/245640.htm
东莞海涛机械有限公司,http://www.11467.com/dongguan/co/499033.htm
东莞市长安联茂机电设备有限公司,http://www.11467.com/dongguan/co/232323.htm
诚信抛光材料有限公司,http://www.11467.com/dongguan/co/232320.htm
东莞市东城区皓威滤清器有限公司,http://www.11467.com/dongguan/co/374754.htm
东莞市绿洲水处理设备工程有限公司,http://www.11467.com/dongguan/co/296138.htm
东莞市利韬过滤材料有限公司,http://www.11467.com/dongguan/co/412208.htm
东莞市东南电镀器材有限公司,http://www.11467.com/dongguan/co/127513.htm
东莞市科冠电子有限公司,http://www.11467.com/dongguan/co/215466.htm
东莞市常涞净水设备有限公司,http://www.11467.com/dongguan/co/479025.htm
东莞军健滤清器有限公司,http://www.11467.com/dongguan/co/524586.htm
东莞市嘉明环保技术有限公司,http://www.11467.com/dongguan/co/294838.htm
东莞市萨尼艾气体设备有限公司,http://www.11467.com/dongguan/co/503548.htm
东莞市清新滤材有限公司,http://www.11467.com/dongguan/co/32487.htm
东莞市汇盛机械设备有限公司,http://www.11467.com/dongguan/co/412341.htm
