宝鸡市天河钛业有限责任公司营销部,http://www.11467.com/baoji/co/25865.htm
上海浪潮机器有限公司,http://www.11467.com/haerbin/co/41719.htm
杭州安易机电设备有限公司,http://www.11467.com/hangzhou/co/208755.htm
杭州环球净化设备有限公司,http://www.11467.com/hangzhou/co/8763.htm
杭州凯德空分设备有限公司,http://www.11467.com/hangzhou/co/193934.htm
杭州鼎岳空分设备有限公司,http://www.11467.com/hangzhou/co/369032.htm
杭州宝诺空分设备有限公司,http://www.11467.com/hangzhou/co/313372.htm
安徽中科中佳科学仪器有限公司,http://www.11467.com/hefei/co/80304.htm
合肥世杰膜工程有限责任公司,http://www.11467.com/hefei/co/62624.htm
衡水海江压滤机集团有限公司,http://www.11467.com/hengshui/co/22151.htm
浙江晶泉水处理设备有限公司,http://www.11467.com/huzhou/co/46872.htm
开封华瑞化工新材料股份有限公司,http://www.11467.com/kaifeng/co/20023.htm
浙江三联环保机械设备有限公司,http://www.11467.com/lishui/co/26172.htm
北京艺创阀门制造有限公司,http://www.11467.com/nanjing/co/81070.htm
南京绿岛机械设备有限公司,http://www.11467.com/nanjing/co/154842.htm
韶关市绿昇环保工程设备有限公司,http://www.11467.com/shaoguan/co/23593.htm
浙江双杰铜业有限公司,http://www.11467.com/shaoxing/co/119779.htm
浙江金海环境技术股份有限公司,http://www.11467.com/shaoxing/co/118997.htm
深圳今日丰科技电子有限公司,http://www.11467.com/shenzhen/co/784301.htm
河北润港环保科技有限公司,http://www.11467.com/shijiazhuang/co/140369.htm
晟迪欧电子科技有限公司苏州分公司,http://www.11467.com/suzhou/co/203692.htm
苏州浩中环保设备有限公司,http://www.11467.com/suzhou/co/204550.htm
苏州艾唯尔气体设备有限公司,http://www.11467.com/suzhou/co/237596.htm
苏州龙峰钛镍设备有限公司,http://www.11467.com/suzhou/co/226951.htm
苏州星亿机械有限公司,http://www.11467.com/suzhou/co/317514.htm
武汉新概念农业机械设备制造有限公司,http://www.11467.com/wuhan/co/143798.htm
无锡超亚环保设备有限公司,http://www.11467.com/wuxi/co/243743.htm
无锡艺高罗杰水处理有限公司,http://www.11467.com/wuxi/co/174815.htm
无锡市华峰气体分离设备有限公司,http://www.11467.com/wuxi/co/188509.htm
三达膜科技(厦门)有限公司,http://www.11467.com/xiamen/co/25464.htm
厦门市鑫达隆机械设备有限公司,http://www.11467.com/xiamen/co/26122.htm
新乡市雷诚机械有限责任公司,http://www.11467.com/xinxiang/co/19441.htm
新乡市红阳油脂工程技术有限公司,http://www.11467.com/xinxiang/co/19203.htm
新乡市天河流体净化有限公司,http://www.11467.com/xinxiang/co/19570.htm
禹州市星和化工设备有限公司,http://www.11467.com/xuchang/co/22881.htm
扬州润明轻工机械有限公司,http://www.11467.com/yangzhou/co/75010.htm
扬州永辉纺织科技有限公司,http://www.11467.com/yangzhou/co/89840.htm
烟台艾格瑞过滤技术有限公司,http://www.11467.com/yantai/co/119829.htm
肇庆市正大化工机械设备有限公司,http://www.11467.com/zhaoqing/co/31604.htm
广东振华电器有限公司,http://www.11467.com/zhongshan/co/104042.htm
中山华钰有色冶金材料有限公司,http://www.11467.com/zhongshan/co/23783.htm
中山市易达自动化设备有限公司,http://www.11467.com/zhongshan/co/117557.htm
星慧过滤设备有限公司,http://www.11467.com/shanghai/co/745715.htm
天津科林泰克科技有限公司,http://www.11467.com/tianjin/co/140904.htm
天津君歌舜尧分子蒸馏设备有限公司,http://www.11467.com/tianjin/co/196378.htm
天津市盛世达水处理设备有限公司,http://www.11467.com/tianjin/co/300145.htm
阜城县腾飞压滤机有限公司,http://www.11467.com/hengshui/co/19093.htm
衡水金旺压滤机有限公司,http://www.11467.com/hengshui/co/33726.htm
河北亿利金属网制品有限公司,http://www.11467.com/hengshui/co/18846.htm
安平县正兴网业制造有限公司,http://www.11467.com/hengshui/co/33739.htm
淮北中德矿山机器有限公司,http://www.11467.com/huaibei/co/12484.htm
惠州鸿达水处理设备有限公司,http://www.11467.com/huizhou/co/97135.htm
湖州核宏机械有限公司,http://www.11467.com/huzhou/co/46880.htm
湖州核源机械设备有限公司,http://www.11467.com/huzhou/co/50919.htm
湖州核汇机械有限公司,http://www.11467.com/huzhou/co/27524.htm
湖州天源机械有限公司,http://www.11467.com/huzhou/co/42777.htm
九江富士通空压机有限公司,http://www.11467.com/jiujiang/co/19212.htm
开封鹏远玻璃纤维制品有限公司,http://www.11467.com/kaifeng/co/11679.htm
山东莱芜煤矿机械有限公司,http://www.11467.com/laiwu/co/6841.htm
莱芜瑞源节水灌溉器材有限公司,http://www.11467.com/laiwu/co/15209.htm
兰州慧宇环保设备有限公司,http://www.11467.com/lanzhou/co/63878.htm
连云港市东邦化工机械有限公司,http://www.11467.com/lianyungang/co/41375.htm
山东省聊城市科威化工仪器有限公司,http://www.11467.com/liaocheng/co/28900.htm
辽阳双联离心机公司,http://www.11467.com/liaoyang/co/15564.htm
山东山宝机械设备销售有限公司,http://www.11467.com/linyi/co/61655.htm
浙江天宇环保设备有限公司,http://www.11467.com/lishui/co/23043.htm
浙江丽峰化工机械有限公司,http://www.11467.com/lishui/co/35332.htm
柳州市恒一环保科技有限公司,http://www.11467.com/liuzhou/co/38139.htm
南京鸿瑞特种陶瓷有限公司,http://www.11467.com/nanjing/co/82497.htm
巨能机械(中国)有限公司,http://www.11467.com/nanjing/co/82502.htm
江苏万力机械股份有限公司,http://www.11467.com/nantong/co/137831.htm
南通华顺达人造板机械有限公司,http://www.11467.com/nantong/co/113399.htm
萍乡市东星塑业有限公司,http://www.11467.com/pingxiang/co/11618.htm
萍乡市长虹陶瓷有限责任公司,http://www.11467.com/pingxiang/co/11874.htm
徐州华超矿山设备有限公司,http://www.11467.com/qingyang/co/15559.htm
秦皇岛领航水处理有限公司,http://www.11467.com/qinhuangdao/co/35702.htm
秦皇岛市福安水处理设备有限公司,http://www.11467.com/qinhuangdao/co/45912.htm
泉州市东绿环保科技有限公司,http://www.11467.com/quanzhou/co/131796.htm
沈阳永鑫益实验仪器销售有限公司,http://www.11467.com/shenyang/co/98001.htm
迪沃普气体设备有限公司,http://www.11467.com/shenzhen/co/100402.htm
深圳市盛世鑫五金制品有限公司,http://www.11467.com/shenzhen/co/725814.htm
深圳市源振能制冷设备技术有限公司,http://www.11467.com/shenzhen/co/503415.htm
安平县红旗金属丝网制品有限公司 外贸部,http://www.11467.com/shijiazhuang/co/90277.htm
石家庄新生丽阳化工机械有限责任公司,http://www.11467.com/shijiazhuang/co/90148.htm
石家庄市星岛环保设备有限公司,http://www.11467.com/shijiazhuang/co/9479.htm
石家庄德众制药装备有限公司,http://www.11467.com/shijiazhuang/co/86837.htm
苏州克莱尔环保科技有限公司,http://www.11467.com/suzhou/co/174579.htm
苏州通立机械有限公司,http://www.11467.com/suzhou/co/162344.htm
苏州珀西瓦尔实验设备有限公司,http://www.11467.com/suzhou/co/318574.htm
宏硕净化设备有限公司,http://www.11467.com/suzhou/co/315683.htm
苏州制氧机有限责任公司,http://www.11467.com/suzhou/co/164836.htm
苏州盛泰过滤器有限公司,http://www.11467.com/suzhou/co/205273.htm
苏州思创科技有限公司,http://www.11467.com/suzhou/co/161825.htm
张家港市创力机械有限公司,http://www.11467.com/suzhou/co/316489.htm
张家港市蓝鸟机械有限公司,http://www.11467.com/suzhou/co/131481.htm
苏州优耐特机械制造有限公司-市场研发部,http://www.11467.com/suzhou/co/203888.htm
张家港市南南科技有限公司,http://www.11467.com/suzhou/co/226966.htm
苏州市创新净化有限公司,http://www.11467.com/suzhou/co/186232.htm
张家港市华孚实业有限公司,http://www.11467.com/suzhou/co/128622.htm
张家港市金腾化工机械制造有限公司,http://www.11467.com/suzhou/co/132909.htm
苏州市新高金属设备制造有限公司技术部,http://www.11467.com/suzhou/co/226965.htm
太原市三田机电设备有限公司,http://www.11467.com/taiyuan/co/74082.htm
泰州市嘉靖电力机械设备有限公司,http://www.11467.com/taizhoushi/co/26454.htm
江苏百新环境工程有限公司,http://www.11467.com/taizhoushi/co/50286.htm
铜陵市灵芝电器有限公司,http://www.11467.com/tongling/co/11409.htm
武汉奥威斯环保机电设备有限公司,http://www.11467.com/wuhan/co/34155.htm
武汉守望环保有限公司,http://www.11467.com/wuhan/co/53829.htm
芜湖通来萨普压缩机有限公司,http://www.11467.com/wuhu/co/32458.htm
江苏省宜兴非金属化工机械厂有限公司,http://www.11467.com/wuxi/co/247843.htm
无锡环宇装备科技有限公司,http://www.11467.com/wuxi/co/188853.htm
温州博强离心机科技有限公司,http://www.11467.com/wuxi/co/244199.htm
江苏高博机械有限公司,http://www.11467.com/wuxi/co/245519.htm
江苏德克环保设备有限公司,http://www.11467.com/wuxi/co/35391.htm
无锡市龙吉通风机械有限公司,http://www.11467.com/wuxi/co/174320.htm
无锡市华尔泰机械制造有限公司,http://www.11467.com/wuxi/co/197040.htm
无锡市金银花通用设备有限公司,http://www.11467.com/wuxi/co/244597.htm
无锡安和净化设备有限公司,http://www.11467.com/wuxi/co/175564.htm
无锡中瑞空分设备有限公司,http://www.11467.com/wuxi/co/245125.htm
宜兴市晨阳化工机械有限公司,http://www.11467.com/wuxi/co/244730.htm
无锡市兴麟染整环保有限公司,http://www.11467.com/wuxi/co/153343.htm
无锡市鑫盛换热器制造有限公司,http://www.11467.com/wuxi/co/154400.htm
无锡市科伟达洗净科技有限公司,http://www.11467.com/wuxi/co/174937.htm
无锡市雪浪铆焊厂有限公司,http://www.11467.com/wuxi/co/173217.htm
厦门市鸿帆科技开发有限公司,http://www.11467.com/xiamen/co/16248.htm
厦门Hehoo Tech.有限公司,http://www.11467.com/xiamen/co/25717.htm
厦门宝珩工贸有限公司,http://www.11467.com/xiamen/co/26360.htm
厦门海维尔自动化设备有限公司,http://www.11467.com/xiamen/co/52436.htm
厦门翼发节能环保有限公司,http://www.11467.com/xiamen/co/94484.htm
西安超滤化工有限责任公司,http://www.11467.com/xian/co/70584.htm
西安健科新技术开发有限公司,http://www.11467.com/xian/co/121716.htm
湖南新湘液机械设备有限公司,http://www.11467.com/xiangtan/co/28169.htm
湘潭裕丰离心机有限公司,http://www.11467.com/xiangtan/co/23005.htm
新乡市新良科技筛分设备有限公司,http://www.11467.com/xinxiang/co/19452.htm
新乡市玖鼎机械有限公司,http://www.11467.com/xinxiang/co/23217.htm
新振机械有限公司,http://www.11467.com/xinxiang/co/32500.htm
新乡市迅达机械制造股份有限公司,http://www.11467.com/xinxiang/co/21674.htm
宝鸡国泰金属有限公司,http://www.11467.com/baoji/co/30880.htm
宝鸡宝冶钛镍制造有限责任公司销售部,http://www.11467.com/baoji/co/25864.htm
内蒙古天福风机有限公司,http://www.11467.com/baotou/co/14320.htm
内蒙古包钢重菱锅炉制造有限公司,http://www.11467.com/baotou/co/24652.htm
蚌埠华阳机械装备制造有限公司,http://www.11467.com/bengbu/co/27479.htm
蚌埠市振强制药化工机械有限公司,http://www.11467.com/bengbu/co/27481.htm
泊头巨峰机械制造有限公司,http://www.11467.com/cangzhou/co/61935.htm
沧州中油钻采设备有限公司,http://www.11467.com/cangzhou/co/38496.htm
沧州中油固控设备有限公司,http://www.11467.com/cangzhou/co/38441.htm
沧州华沧钻采设备有限公司,http://www.11467.com/cangzhou/co/38512.htm
泊头市福润橡塑有限公司,http://www.11467.com/cangzhou/co/60620.htm
沧州彗星石油机械有限公司,http://www.11467.com/cangzhou/co/40337.htm
沧州乾丰环保器材有限公司,http://www.11467.com/cangzhou/co/62705.htm
泊头市亿保机械有限公司,http://www.11467.com/cangzhou/co/55374.htm
沧州市求精水处理设备有限公司,http://www.11467.com/cangzhou/co/41449.htm
沧州市狮城水处理设备有限公司,http://www.11467.com/cangzhou/co/38688.htm
华油飞达装备有限公司,http://www.11467.com/cangzhou/co/40338.htm
吉林省新禾科技开发有限公司,http://www.11467.com/changchun/co/65778.htm
长春市可立尔生物技术工程有限公司,http://www.11467.com/changchun/co/53334.htm
长春市金宇科技有限公司销售部,http://www.11467.com/changchun/co/73277.htm
长春鸿旺机械筛板有限公司,http://www.11467.com/changchun/co/75003.htm
长沙迈佳森仪器设备有限公司,http://www.11467.com/changsha/co/82038.htm
长沙高新技术开发区湘麓离心机有限公司,http://www.11467.com/changsha/co/70709.htm
长沙弘扬化玻仪器有限公司,http://www.11467.com/changsha/co/82061.htm
湖南楚惟机械有限公司营销部,http://www.11467.com/changsha/co/71256.htm
长沙市鑫奥仪器仪表有限公司销售部,http://www.11467.com/changsha/co/82039.htm
长沙骏逸实验仪器有限公司,http://www.11467.com/changsha/co/82036.htm
湖南凯达实业有限公司,http://www.11467.com/changsha/co/99125.htm
湖南星科科学仪器有限公司网络部,http://www.11467.com/changsha/co/70153.htm
湖南凯达科学仪器有限公司,http://www.11467.com/changsha/co/101867.htm
长沙锦隆创投仪器有限公司,http://www.11467.com/changsha/co/72044.htm
三湘空调环保工程技术开发有限公司（长沙市环保陶瓷机械厂）,http://www.11467.com/changsha/co/70702.htm
湖南沪康离心机有限公司上海分公司,http://www.11467.com/changsha/co/82035.htm
湖南赛特湘仪离心机仪器有限公司,http://www.11467.com/changsha/co/19614.htm
长治同方锅炉压力容器技术服务有限公司（屯留分公司）,http://www.11467.com/changzhi/co/27069.htm
常州化工设备有限公司成套工程部,http://www.11467.com/changzhou/co/101668.htm
常州市天瑞干燥设备有限公司,http://www.11467.com/changzhou/co/88499.htm
常州市创瑞液压设备有限公司,http://www.11467.com/changzhou/co/110232.htm
宝雅研磨有限公司,http://www.11467.com/dongguan/co/232176.htm
东莞凯特滤清器制造有限公司,http://www.11467.com/dongguan/co/294538.htm
东莞市百惠浦净水设备有限公司,http://www.11467.com/dongguan/co/477381.htm
东莞市奥拜斯机械有限公司,http://www.11467.com/dongguan/co/245640.htm
东莞市长安联茂机电设备有限公司,http://www.11467.com/dongguan/co/232323.htm
东莞市东城区皓威滤清器有限公司,http://www.11467.com/dongguan/co/374754.htm
东莞市绿洲水处理设备工程有限公司,http://www.11467.com/dongguan/co/296138.htm
东莞市利韬过滤材料有限公司,http://www.11467.com/dongguan/co/412208.htm
东莞市东南电镀器材有限公司,http://www.11467.com/dongguan/co/127513.htm
东莞市科冠电子有限公司,http://www.11467.com/dongguan/co/215466.htm
东莞市常涞净水设备有限公司,http://www.11467.com/dongguan/co/479025.htm
东莞军健滤清器有限公司,http://www.11467.com/dongguan/co/524586.htm
东莞市嘉明环保技术有限公司,http://www.11467.com/dongguan/co/294838.htm
东莞市萨尼艾气体设备有限公司,http://www.11467.com/dongguan/co/503548.htm
东莞市清新滤材有限公司,http://www.11467.com/dongguan/co/32487.htm
东莞市汇盛机械设备有限公司,http://www.11467.com/dongguan/co/412341.htm
东莞市山友过滤器有限公司,http://www.11467.com/dongguan/co/69144.htm
东莞市博盈环保设备有限公司,http://www.11467.com/dongguan/co/355198.htm
东莞市天仕力金属探测设备有限公司,http://www.11467.com/dongguan/co/70370.htm
东莞市图锐机电有限公司,http://www.11467.com/dongguan/co/479283.htm
东莞市裕本机械有限公司,http://www.11467.com/dongguan/co/492310.htm
东莞市兆宇环保机械设备有限公司,http://www.11467.com/dongguan/co/74301.htm
东莞市瑞邦制氮净化设备有限公司(东莞制氮净化设备),http://www.11467.com/dongguan/co/232324.htm
东莞市信旭塑料机械有限公司,http://www.11467.com/dongguan/co/119442.htm
东莞市硕宝工业设备有限公司,http://www.11467.com/dongguan/co/287873.htm
东莞市泽晟研磨机械设备有限公司,http://www.11467.com/dongguan/co/271461.htm
东莞市虹升机电设备有限公司,http://www.11467.com/dongguan/co/130982.htm
东莞市超科机械设备有限公司,http://www.11467.com/dongguan/co/246697.htm
东莞市中远环保科技有限公司,http://www.11467.com/dongguan/co/496856.htm
环鑫机械有限公司,http://www.11467.com/dongguan/co/510935.htm
吉田塑胶机械有限公司（营销部）,http://www.11467.com/dongguan/co/118155.htm
江泉水处理设备有限公司,http://www.11467.com/dongguan/co/127772.htm
科宏机电设备有限公司,http://www.11467.com/dongguan/co/382103.htm
東莞普達機械設備有限公司,http://www.11467.com/dongguan/co/121136.htm
东莞五星机械有限公司,http://www.11467.com/dongguan/co/128949.htm
深圳市汇通机电设备有限公司东莞分公司一部,http://www.11467.com/dongguan/co/132830.htm
东莞市艺峰五金有限公司,http://www.11467.com/dongguan/co/133289.htm
双净水处理设备公司,http://www.11467.com/dongguan/co/377766.htm
金立电镀设备有限公司,http://www.11467.com/dongguan/co/294817.htm
金久顺贸易公司,http://www.11467.com/dongguan/co/232315.htm
东莞市宇博净化科技有限公司,http://www.11467.com/dongguan/co/130572.htm
广饶县联谊化工有限责任公司,http://www.11467.com/dongying/co/12675.htm
佛山市高明冠宇机械厂有限公司,http://www.11467.com/foshan/co/305805.htm
佛山市嘉瑞达科技有限公司,http://www.11467.com/foshan/co/113089.htm
佛山市洪鹏化工设备制造有限公司,http://www.11467.com/foshan/co/226054.htm
佛山市嘉瑞达科技有限公司销售部,http://www.11467.com/foshan/co/184073.htm
佛山安赛机械设备有限公司,http://www.11467.com/foshan/co/181632.htm
佛山市森德磁性材料有限公司,http://www.11467.com/foshan/co/337116.htm
佛山市意纺联机械有限公司,http://www.11467.com/foshan/co/186579.htm
佛山市华洋陶瓷仪器有限公司,http://www.11467.com/foshan/co/225581.htm
佛山市顺德德力海水淡化设备有限公司,http://www.11467.com/foshan/co/181719.htm
广东晨光贸易有限公司,http://www.11467.com/foshan/co/226077.htm
新乡市恒宇机械有限公司,http://www.11467.com/foshan/co/243669.htm
广东华南特种气体研究所有限公司工程部,http://www.11467.com/foshan/co/240469.htm
广州神能机电设备有限公司,http://www.11467.com/foshan/co/234470.htm
华南理工大学科技开发有限公司服务部,http://www.11467.com/foshan/co/243661.htm
金银河机械设备有限公司,http://www.11467.com/foshan/co/243743.htm
佛山市顺德区联科益达贸易有限公司,http://www.11467.com/foshan/co/268028.htm
宽宝环保设备有限公司销售部,http://www.11467.com/foshan/co/183017.htm
康之田压力容器制造有限公司,http://www.11467.com/foshan/co/225580.htm
（合资）抚顺隆基磁电设备有限公司,http://www.11467.com/fushun/co/25059.htm
彩虹丝网有限公司,http://www.11467.com/fuxin/co/16033.htm
福建朗宇环保科技有限公司,http://www.11467.com/fuzhou/co/181099.htm
福州福岛微纳技术开发有限公司,http://www.11467.com/fuzhou/co/111949.htm
福州好利特水处理工程有限公司,http://www.11467.com/fuzhou/co/112632.htm
福州嘉意裕进出口有限公司,http://www.11467.com/fuzhou/co/143008.htm
江西气体压缩机有限公司,http://www.11467.com/ganzhou/co/528.htm
长沙湘麓离心机有限公司广州办事处,http://www.11467.com/guangzhou/co/270358.htm
广州汉粤净化科技有限公司,http://www.11467.com/guangzhou/co/115260.htm
广州科络电器有限公司,http://www.11467.com/guangzhou/co/280325.htm
广州立派机械有限公司,http://www.11467.com/guangzhou/co/246160.htm
广东洁康环保水处理材料有限公司,http://www.11467.com/guangzhou/co/112278.htm
广东吊车出租公司,http://www.11467.com/guangzhou/co/478478.htm
广东威龙化工原料有限公司,http://www.11467.com/guangzhou/co/246028.htm
广州滨一塑料机械设备有限公司-销售部(新加坡密佳达),http://www.11467.com/guangzhou/co/246267.htm
广州多卡斯机械有限公司,http://www.11467.com/guangzhou/co/246270.htm
广州航丰环保设备科技有限公司,http://www.11467.com/guangzhou/co/477185.htm
广州气虹空气分离设备有限公司,http://www.11467.com/guangzhou/co/110855.htm
广州气虹空气分离设备有限公司(营销部）,http://www.11467.com/guangzhou/co/246281.htm
广州海离子力宝珍科技有限公司,http://www.11467.com/guangzhou/co/484136.htm
广州市思诺兰迪科技有限公司,http://www.11467.com/guangzhou/co/115596.htm
广州市金岳川电镀设备有限公司,http://www.11467.com/guangzhou/co/458189.htm
广州畅驰机电设备有限公司,http://www.11467.com/guangzhou/co/112116.htm
广州市伸展环保设备有限公司,http://www.11467.com/guangzhou/co/121891.htm
广州市绿森环保设备有限公司,http://www.11467.com/guangzhou/co/115354.htm
广州强业机械有限公司,http://www.11467.com/guangzhou/co/271678.htm
广州市奇正机械（商贸）有限公司,http://www.11467.com/guangzhou/co/111034.htm
广州市海欣电子科技有限公司,http://www.11467.com/guangzhou/co/217736.htm
广州市新路程商贸有限公司,http://www.11467.com/guangzhou/co/473531.htm
广州万冠制药设备有限公司,http://www.11467.com/guangzhou/co/106909.htm
广州峻祺实验仪器有限公司,http://www.11467.com/guangzhou/co/229959.htm
广州无疆环保泥水分离设备有限公司,http://www.11467.com/guangzhou/co/113323.htm
广州特锶源水处理设备有限公司,http://www.11467.com/guangzhou/co/127497.htm
广州威浪游泳池设备有限公司,http://www.11467.com/guangzhou/co/280331.htm
广州维通工业气体气体有限公司,http://www.11467.com/guangzhou/co/270396.htm
广州维通工业气体技术有限公司(销售部),http://www.11467.com/guangzhou/co/270430.htm
广州致诚贸易发展有限公司,http://www.11467.com/guangzhou/co/466146.htm
广州市尤德生物科技有限公司,http://www.11467.com/guangzhou/co/246277.htm
广州市维胜气体分离设备有限公司业务部,http://www.11467.com/guangzhou/co/115244.htm
广州市维通工业气体技术有限公司销售部门,http://www.11467.com/guangzhou/co/246289.htm
广州市维通工业气体技术有限公司销售处,http://www.11467.com/guangzhou/co/276139.htm
广州普瑞特水处理技术开发有限公司,http://www.11467.com/guangzhou/co/463815.htm
广州市珑鼎环保设备有限公司,http://www.11467.com/guangzhou/co/111449.htm
广州贴心购物网络有限公司,http://www.11467.com/guangzhou/co/105113.htm
上海九鼎钟业有限公司微波事业部,http://www.11467.com/guangzhou/co/106927.htm
广州永通机电科技维修公司,http://www.11467.com/guangzhou/co/246274.htm
秦皇岛欧路化工机械有限公司广州办,http://www.11467.com/guangzhou/co/280290.htm
深圳市东方阳光科技有限公司,http://www.11467.com/guangzhou/co/246269.htm
广州市番禺成昌五金机械有限公司,http://www.11467.com/guangzhou/co/280238.htm
广州市雷子克电气设备有限公司,http://www.11467.com/guangzhou/co/90015.htm
施诺斯工业设备有限公司,http://www.11467.com/guangzhou/co/476044.htm
新桥贸易公司广州采购处,http://www.11467.com/guangzhou/co/281778.htm
广州市兴威电镀设备有限公司,http://www.11467.com/guangzhou/co/270798.htm
广州市维通工业气体有限公司,http://www.11467.com/guangzhou/co/113203.htm
河北龙潭泵业有限责任公司,http://www.11467.com/handan/co/27407.htm
杭州迪沃普空分设备有限公司,http://www.11467.com/hangzhou/co/205757.htm
杭州德伟机械设备有限公司,http://www.11467.com/hangzhou/co/127893.htm
杭州格恩特过滤机有限公司,http://www.11467.com/hangzhou/co/207914.htm
杭州埃诺水处理有限公司,http://www.11467.com/hangzhou/co/147482.htm
杭州海泰液压制造有限公司,http://www.11467.com/hangzhou/co/176175.htm
杭州超源筛网有限公司,http://www.11467.com/hangzhou/co/207974.htm
杭州和锦科技有限公司,http://www.11467.com/hangzhou/co/303972.htm
杭州海阔机械设备有限公司,http://www.11467.com/hangzhou/co/370421.htm
杭州科力化工设备有限公司销售部,http://www.11467.com/hangzhou/co/259148.htm
杭州防腐设备有限公司,http://www.11467.com/hangzhou/co/147993.htm
杭州埃诺过滤器材有限公司.,http://www.11467.com/hangzhou/co/259226.htm
杭州高桥磁电设备有限公司（销售部）,http://www.11467.com/hangzhou/co/249245.htm
杭州华东计量科技有限公司,http://www.11467.com/hangzhou/co/253789.htm
杭州科力化工设备有限公司,http://www.11467.com/hangzhou/co/31208.htm
杭州仕嘉净化设备有限公司,http://www.11467.com/hangzhou/co/208863.htm
杭州盛唐跃通木工机械有限公司,http://www.11467.com/hangzhou/co/255402.htm
杭州宏众环保设备有限公司,http://www.11467.com/hangzhou/co/259062.htm
富阳瑞德气体设备有限公司营销五部,http://www.11467.com/hangzhou/co/246472.htm
杭州胜港电器有限公司,http://www.11467.com/hangzhou/co/70513.htm
