苏州匠奇环保科技有限公司,http://www.11467.com/suzhou/co/401884.htm
巩义市全兴滤材工业有限公司,http://www.11467.com/zhengzhou/co/225395.htm
新乡市乐尔过滤器有限公司,http://www.11467.com/xinxiang/co/42252.htm
濮阳市沪康医疗设备有限公司,http://www.11467.com/puyang/co/29323.htm
温县绿捷环保机械有限公司,http://www.11467.com/qiye/93120172.htm
廊坊滤神科技有限公司,http://www.11467.com/langfang/co/76776.htm
丹东天皓净化材料有限公司,http://www.11467.com/dandong/co/39640.htm
深圳市普尔膜科技有限公司,http://www.11467.com/shenzhen/co/1088177.htm
滑县隆泰环保设备科技有限公司,http://www.11467.com/anyang/co/42589.htm
浙江博源铸钢篮式过滤器有限公司,http://www.11467.com/wenzhou/co/370463.htm
佛山市滤之杰环保科技有限公司,http://www.11467.com/qiye/93216152.htm
登封市豫鑫水处理有限公司,http://www.11467.com/zhengzhou/co/270883.htm
广西友邦过滤机有限公司,http://www.11467.com/nanning/co/58033.htm
新乡市东振机械制造有限公司,http://www.11467.com/xinxiang/co/22085.htm
绍兴市搏盛机械科技有限公司,http://www.11467.com/shaoxing/co/135138.htm
烟台诚博机械科技有限公司,http://www.11467.com/yantai/co/174127.htm
吉林市万滤工贸有限公司,http://www.11467.com/jilinshi/co/79371.htm
重庆英睿尔科技有限公司,http://www.11467.com/chongqing/co/344331.htm
石家庄赛佰特科技有限公司,http://www.11467.com/shijiazhuang/co/76743.htm
江苏颂赞环保设备有限公司,http://www.11467.com/yancheng/co/90605.htm
新乡市鹤田机械有限公司,http://www.11467.com/xinxiang/co/48204.htm
山东枣庄佰伦实业有限公司,http://www.11467.com/zaozhuang/co/50810.htm
苏州网艺德丝网制品有限公司,http://www.11467.com/suzhou/co/377155.htm
富阳凯合空分设备有限公司,http://www.11467.com/hangzhou/co/370420.htm
广州德膜科技有限公司,http://www.11467.com/guangzhou/co/745520.htm
岳阳县杨茂石英砂滤料有限公司,http://www.11467.com/yueyang/co/6647.htm
深圳市佳莱净化技术有限公司,http://www.11467.com/shenzhen/co/118052.htm
新乡市天丰振动机械有限公司,http://www.11467.com/xinxiang/co/26775.htm
新昌县康利德制冷配件有限公司,http://www.11467.com/shaoxing/co/120244.htm
深圳市帝富莱科技有限公司,http://www.11467.com/shenzhen/co/1003847.htm
江苏久吾高科技股份有限公司,http://www.11467.com/qiye/26694860.htm
禹州市迪博压滤机责任有限公司,http://www.11467.com/xuchang/co/31720.htm
郑州市通达氧应用开发有限公司,http://www.11467.com/zhengzhou/co/60420.htm
成都扶郎花科技有限公司,http://www.11467.com/chengdu/co/289077.htm
广西甘兰净水处理材料有限公司,http://www.11467.com/nanning/co/98524.htm
深圳市深度环保科技有限公司,http://www.11467.com/shenzhen/co/1089306.htm
青岛百精金检技术有限公司,http://www.11467.com/qingdao/co/153039.htm
无锡市凡宇水处理机械制造有限公司,http://www.11467.com/wuxi/co/129524.htm
安平县盛帆金属制品有限公司,http://www.11467.com/hengshui/co/90183.htm
江苏森磊环保材料有限公司,http://www.11467.com/yancheng/co/60730.htm
北京弘祥隆生物技术股份有限公司,http://www.11467.com/beijing/co/439427.htm
江苏阜升环保集团有限公司,http://www.11467.com/yancheng/co/78290.htm
辽阳天兴离心机有限公司,http://www.11467.com/liaoyang/co/25603.htm
无锡八德石化装备有限公司,http://www.11467.com/wuxi/co/188482.htm
东莞市通泰机电设备有限公司,http://www.11467.com/dongguan/co/127969.htm
江苏华曼冶金机械制造有限公司,http://www.11467.com/foshan/co/355748.htm
东莞市天元圣宝净化工程有限公司,http://www.11467.com/dongguan/co/129717.htm
广州市丰源化工机械有限公司,http://www.11467.com/guangzhou/co/111836.htm
广州市炬芯过滤材料科技有限公司,http://www.11467.com/guangzhou/co/699314.htm
新乡市华航滤清器有限公司,http://www.11467.com/xinxiang/co/23323.htm
无锡市大洲机械制造有限公司,http://www.11467.com/wuxi/co/214789.htm
沧州市宏力石油机械制造有限公司,http://www.11467.com/cangzhou/co/38445.htm
烟台德奥机械设备有限公司,http://www.11467.com/yantai/co/119351.htm
新乡市天瑞液压设备有限公司,http://www.11467.com/xinxiang/co/38434.htm
东莞市智胜净化技术有限公司,http://www.11467.com/dongguan/co/294866.htm
东莞市德克贝尔环境系统有限公司,http://www.11467.com/dongguan/co/109950.htm
江苏泰利达实业有限公司,http://www.11467.com/yancheng/co/52472.htm
佛山市南海区振大铝材机电设备有限公司,http://www.11467.com/foshan/co/355949.htm
深圳市斗方科技有限公司,http://www.11467.com/shenzhen/co/826891.htm
东莞市桦达空调净化设备安装有限公司,http://www.11467.com/dongguan/co/510943.htm
东莞市润源水处理设备有限公司,http://www.11467.com/dongguan/co/131493.htm
新乡市鼎丰专业振动机械有限公司,http://www.11467.com/xinxiang/co/19471.htm
广州市八通混合器有限公司,http://www.11467.com/guangzhou/co/104515.htm
广州坤灵净化科技有限公司,http://www.11467.com/guangzhou/co/433278.htm
佛山市优霸机械设备有限公司,http://www.11467.com/foshan/co/180077.htm
佛山市天云筛网有限公司,http://www.11467.com/foshan/co/11621.htm
无锡市中达离心机械有限公司,http://www.11467.com/wuxi/co/193825.htm
常州市新力干燥设备有限公司,http://www.11467.com/changzhou/co/88300.htm
东莞市新宝空气动力设备有限公司,http://www.11467.com/dongguan/co/540271.htm
新乡市君昌机械设备有限公司,http://www.11467.com/xinxiang/co/27037.htm
福建武夷俊威净化科技有限公司,http://www.11467.com/nanping/co/45569.htm
上海丛和过滤设备有限公司,http://www.11467.com/shanghai/co/1046703.htm
新乡市利星机械有限公司,http://www.11467.com/xinxiang/co/38441.htm
东莞市新宝空压机有限公司,http://www.11467.com/dongguan/co/63077.htm
广州权拿气动设备有限公司,http://www.11467.com/guangzhou/co/247358.htm
新乡市振泰机械有限公司,http://www.11467.com/xinxiang/co/32773.htm
东莞市缔辉泡棉有限公司,http://www.11467.com/dongguan/co/22256.htm
新乡市振威筛分机械有限公司,http://www.11467.com/xinxiang/co/26850.htm
东莞市华科净化工程有限公司,http://www.11467.com/dongguan/co/240558.htm
东莞市竞泽五金有限公司,http://www.11467.com/dongguan/co/475914.htm
河南德玛隆滤器设备有限公司,http://www.11467.com/zhengzhou/co/171970.htm
北京博瑞康洁工程技术有限公司,http://www.11467.com/beijing/co/692676.htm
杭州恒科环保技术有限公司,http://www.11467.com/hangzhou/co/182374.htm
苏州常青环保设备有限公司,http://www.11467.com/suzhou/co/204201.htm
启东昆仑机电制造有限公司,http://www.11467.com/nantong/co/137147.htm
杭州聚科空分设备制造有限公司,http://www.11467.com/hangzhou/co/371804.htm
山东高新机械设备有限公司,http://www.11467.com/jining/co/71737.htm
乐山市净源水处理设备有限公司,http://www.11467.com/leshan/co/19336.htm
苏州华普压缩机贸易有限公司,http://www.11467.com/suzhou/co/236716.htm
唐山市博大环境工程机械有限公司,http://www.11467.com/tangshan/co/1505.htm
唐山鑫凯科技有限公司,http://www.11467.com/tangshan/co/56523.htm
深圳市钐合五金机械有限公司,http://www.11467.com/shenzhen/co/485036.htm
江苏华璨光电科技有限公司,http://www.11467.com/nantong/co/137687.htm
湖州核旭机械有限公司,http://www.11467.com/huzhou/co/46854.htm
苏州市金星铸造机械有限公司,http://www.11467.com/suzhou/co/227534.htm
苏州新瑞净化设备有限公司,http://www.11467.com/suzhou/co/204557.htm
启东江润液压润滑设备有限公司,http://www.11467.com/nantong/co/107213.htm
秦皇岛恒达特种玻璃纤维有限公司,http://www.11467.com/qinhuangdao/co/5853.htm
杭州环龙过滤设备有限公司,http://www.11467.com/hangzhou/co/381804.htm
合源工業有限公司,http://www.11467.com/jiangmen/co/116792.htm
青州市东方环保机械制造有限公司,http://www.11467.com/weifang/co/117584.htm
诸城市金双联机械有限公司,http://www.11467.com/weifang/co/118188.htm
太仓市宏泽化工防腐设备有限公司,http://www.11467.com/suzhou/co/314447.htm
深圳市海鑫净化设备有限公司,http://www.11467.com/shenzhen/co/111523.htm
广州市滨一塑料机械设备有限公司,http://www.11467.com/guangzhou/co/103074.htm
浙江丽水凯达环保设备有限公司,http://www.11467.com/lishui/co/23048.htm
张家港市永氟龙防腐科技有限公司,http://www.11467.com/suzhou/co/322347.htm
张家港市锐腾机械制造有限公司,http://www.11467.com/suzhou/co/326003.htm
浙江得威德滤料有限公司,http://www.11467.com/suzhou/co/320419.htm
深圳市得纯环保科技有限公司,http://www.11467.com/shenzhen/co/810363.htm
连云港市运发矿山机械有限公司,http://www.11467.com/lianyungang/co/43635.htm
广州市乾沣桑拿泳池设备有限公司,http://www.11467.com/guangzhou/co/280319.htm
张家港市九洲特种离心机制造有限公司,http://www.11467.com/suzhou/co/133488.htm
广州惠临空气分离设备有限公司,http://www.11467.com/guangzhou/co/104530.htm
深圳市立源信电子科技有限公司,http://www.11467.com/shenzhen/co/369471.htm
河北弘高环境工程有限公司,http://www.11467.com/shijiazhuang/co/143068.htm
深圳市冠洁环保滤材配件有限公司,http://www.11467.com/shenzhen/co/503563.htm
江苏沪江离心机制造有限公司,http://www.11467.com/suzhou/co/322639.htm
廊坊世纪蓝天过滤科技有限公司,http://www.11467.com/langfang/co/35651.htm
杭州金盾机电发展有限公司,http://www.11467.com/hangzhou/co/189821.htm
杭州创艺拖链有限公司,http://www.11467.com/hangzhou/co/255706.htm
济南天世豪商贸有限公司,http://www.11467.com/jinan/co/114220.htm
杭州恒滤压滤机有限公司,http://www.11467.com/hangzhou/co/259061.htm
杭州仁源过滤机械有限公司,http://www.11467.com/hangzhou/co/353226.htm
福建省邵武德龙机械制造有限公司,http://www.11467.com/nanping/co/40278.htm
江苏同康特种活性炭纤维面料有限公司,http://www.11467.com/nantong/co/136650.htm
苏州苏和通风设备制造有限公司,http://www.11467.com/suzhou/co/316258.htm
张家港市恒通机械有限公司,http://www.11467.com/suzhou/co/315285.htm
深圳市飞仕达机械设备有限公司,http://www.11467.com/shenzhen/co/725617.htm
无锡市中瑞空分设备有限公司,http://www.11467.com/wuxi/co/188504.htm
山东中智乔重工有限公司,http://www.11467.com/weifang/co/169715.htm
巩义市盘龙净水填料有限公司,http://www.11467.com/zhengzhou/co/224697.htm
安陆市天星粮油机械设备有限公司,http://www.11467.com/xiaogan/co/13398.htm
佛山市顺德区玖恒电器有限公司,http://www.11467.com/foshan/co/66729.htm
惠州市昇日丰过滤器材有限公司,http://www.11467.com/huizhou/co/121430.htm
江苏方华阀门充灌设备有限公司,http://www.11467.com/zhenjiang/co/34235.htm
河南科帆矿山设备有限公司,http://www.11467.com/zhengzhou/co/175353.htm
郑州恒科机械有限公司,http://www.11467.com/zhengzhou/co/169885.htm
新乡市天成振动机械有限公司,http://www.11467.com/xinxiang/co/19418.htm
扬州通扬化工设备有限公司,http://www.11467.com/yangzhou/co/13941.htm
河南大山矿山机械有限公司,http://www.11467.com/zhengzhou/co/114097.htm
邢台市华威化淀设备有限公司,http://www.11467.com/xintai/co/25053.htm
郑州森淼机械设备有限公司,http://www.11467.com/zhengzhou/co/189004.htm
厦门金纶科技有限公司,http://www.11467.com/xiamen/co/55069.htm
西安天厚电子技术有限责任公司,http://www.11467.com/xian/co/48277.htm
陕西屹达空压机有限公司,http://www.11467.com/xian/co/48602.htm
无锡市博雅达石化装备有限公司,http://www.11467.com/wuxi/co/188541.htm
无锡庆鑫粉体设备有限公司,http://www.11467.com/wuxi/co/197000.htm
镇江市科瑞制样设备有限公司,http://www.11467.com/zhenjiang/co/36879.htm
新乡市豫龙振动机械有限公司,http://www.11467.com/xinxiang/co/19814.htm
天津市瑞博一诺环境科技有限公司,http://www.11467.com/tianjin/co/16483.htm
天津市万峰净化设备有限公司,http://www.11467.com/tianjin/co/6221.htm
上海知正离心机有限公司,http://www.11467.com/shanghai/co/668459.htm
新乡市俱进机电有限公司,http://www.11467.com/xinxiang/co/20093.htm
陕西燎原净化设备有限公司,http://www.11467.com/xian/co/48601.htm
厦门兴力顺机电设备有限公司,http://www.11467.com/xiamen/co/103437.htm
西安常仪仪器设备有限公司,http://www.11467.com/xian/co/123559.htm
天津市灵捷传动技术有限公司,http://www.11467.com/tianjin/co/16341.htm
上海冠尊动力传动有限公司,http://www.11467.com/shanghai/co/1051540.htm
无锡雷蒙特环保设备有限公司,http://www.11467.com/wuxi/co/215430.htm
总丰过滤技术（苏州）有限公司,http://www.11467.com/suzhou/co/385909.htm
无锡明燕集团有限公司,http://www.11467.com/wuxi/co/188448.htm
新乡市华源电力精密滤油机有限公司,http://www.11467.com/xinxiang/co/19578.htm
上海玲硕实业有限公司,http://www.11467.com/shanghai/co/1040213.htm
北京鼎昊源科技有限公司,http://www.11467.com/beijing/co/709740.htm
苏州田楼化工设备有限公司,http://www.11467.com/suzhou/co/394016.htm
肇庆市端州区丰蕾机械设备制造有限公司,http://www.11467.com/zhaoqing/co/39663.htm
江苏雷蒙环境工程有限公司,http://www.11467.com/zhongshan/co/117619.htm
盐城共创电热设备有限公司,http://www.11467.com/yancheng/co/56374.htm
厦门华最灌溉设备科技有限公司,http://www.11467.com/xiamen/co/94077.htm
宜兴市鹰鹏水处理设备有限公司,http://www.11467.com/wuxi/co/245735.htm
滕州市建企洗煤机械制造有限公司,http://www.11467.com/zaozhuang/co/33612.htm
巩义市瑞德仪器设备有限公司,http://www.11467.com/zhengzhou/co/177111.htm
北京莱比信科技发展有限公司,http://www.11467.com/beijing/co/620921.htm
常州市博盈干燥设备有限公司,http://www.11467.com/changzhou/co/89010.htm
河南华北化工装备有限公司,http://www.11467.com/anyang/co/22051.htm
东莞市东隆环保科技有限公司,http://www.11467.com/dongguan/co/556894.htm
长沙凯胜空压机有限公司,http://www.11467.com/changsha/co/60483.htm
湖南海康仪器仪表有限公司,http://www.11467.com/changsha/co/18560.htm
盐山县华夏机床附件有限公司,http://www.11467.com/cangzhou/co/58136.htm
常州润华电器有限公司,http://www.11467.com/changzhou/co/152810.htm
东莞市东博水处理设备有限公司,http://www.11467.com/dongguan/co/195459.htm
大连普瑞科尔科技有限公司,http://www.11467.com/dalian/co/35705.htm
常州市海旭机械工具有限公司,http://www.11467.com/changzhou/co/110235.htm
常州市中亚化工环保设备有限公司,http://www.11467.com/changzhou/co/110219.htm
宝鸡市百运恒通液压流体技术有限责任公司,http://www.11467.com/baoji/co/24164.htm
盐山县盛威机械制造有限公司,http://www.11467.com/cangzhou/co/45796.htm
长沙天创化工工贸有限公司,http://www.11467.com/changsha/co/81994.htm
丹东新龙净化材料有限公司,http://www.11467.com/dandong/co/39995.htm
巢湖市奇盛金属表面技术有限公司,http://www.11467.com/chaohu/co/13366.htm
泊头市春晖环保设备有限公司,http://www.11467.com/cangzhou/co/57394.htm
安平县方达金属丝网制品有限公司,http://www.11467.com/hengshui/co/27428.htm
沧州纵横机械制造有限公司,http://www.11467.com/cangzhou/co/45862.htm
常州铭协机械有限公司,http://www.11467.com/changzhou/co/129146.htm
长沙绿盟机械有限公司,http://www.11467.com/changsha/co/119362.htm
东莞市栋源喷雾净化设备有限公司,http://www.11467.com/dongguan/co/513227.htm
长沙综仪生物科技有限公司,http://www.11467.com/changsha/co/121053.htm
长沙顺泽矿冶机械制造有限公司,http://www.11467.com/changsha/co/86234.htm
常州市武进东方塑料机械有限公司,http://www.11467.com/changzhou/co/88778.htm
东莞市碧瑞贸易有限公司,http://www.11467.com/dongguan/co/411628.htm
长沙湘平科技发展有限公司,http://www.11467.com/dongguan/co/232316.htm
东莞市东立泵业有限公司,http://www.11467.com/dongguan/co/472317.htm
常州碧源卓越泳池设备有限公司,http://www.11467.com/changzhou/co/91716.htm
长沙市湘能滤油机制造有限公司,http://www.11467.com/changsha/co/121772.htm
马鞍山市白云环保设备有限公司,http://www.11467.com/anshan/co/78963.htm
东莞市三比过滤器材有限公司,http://www.11467.com/dongguan/co/295682.htm
广州科栢实验器材有限公司,http://www.11467.com/guangzhou/co/280329.htm
广州蓝灵水族设备有限公司,http://www.11467.com/guangzhou/co/431081.htm
广州精星益机械设备有限公司,http://www.11467.com/guangzhou/co/430092.htm
东莞市勇承五金机械制造有限公司,http://www.11467.com/dongguan/co/164440.htm
东莞市锦华水处理设备有限公司,http://www.11467.com/dongguan/co/555799.htm
东莞市林昌制冷机电设备有限公司,http://www.11467.com/dongguan/co/438971.htm
广州玖田贸易有限公司,http://www.11467.com/guangzhou/co/276886.htm
福州八方联众科学仪器有限公司,http://www.11467.com/fuzhou/co/187337.htm
东莞市华仕威水处理器材有限公司,http://www.11467.com/dongguan/co/295165.htm
广州市川特过滤器材有限公司,http://www.11467.com/guangzhou/co/280254.htm
广州创迪机电科技有限公司,http://www.11467.com/guangzhou/co/276739.htm
东莞市佰鸿净化设备有限公司,http://www.11467.com/dongguan/co/478548.htm
东莞市承兴机电设备有限公司,http://www.11467.com/dongguan/co/414137.htm
广州绿世界环保设备有限公司,http://www.11467.com/guangzhou/co/433279.htm
广州碧毅水处理设备有限公司,http://www.11467.com/guangzhou/co/429750.htm
东莞市荣亮空压设备有限公司,http://www.11467.com/dongguan/co/469846.htm
佛山市鑫涛机器有限公司,http://www.11467.com/dongguan/co/127970.htm
福州鸿兴化工设备有限公司,http://www.11467.com/fuzhou/co/131480.htm
固安中滤过滤科技有限公司,http://www.11467.com/guangzhou/co/247422.htm
广州欧澌源环保科技有限公司,http://www.11467.com/guangzhou/co/495631.htm
佛山市顺德区智博燃烧机制造有限公司,http://www.11467.com/foshan/co/243642.htm
东莞市台瑞机电有限公司,http://www.11467.com/dongguan/co/134092.htm
东莞市盈亚机械设备有限公司,http://www.11467.com/dongguan/co/488833.htm
东莞市怡强机械有限公司,http://www.11467.com/dongguan/co/497196.htm
广州力川泵业有限公司,http://www.11467.com/guangzhou/co/111181.htm
广州大浪水上乐园设备有限公司,http://www.11467.com/guangzhou/co/280322.htm
广州巨盟金属制品有限公司,http://www.11467.com/guangzhou/co/496306.htm
东莞市伸展五金机械有限公司,http://www.11467.com/dongguan/co/127521.htm
东莞市石大净化设备有限公司,http://www.11467.com/dongguan/co/277380.htm
东莞市富拓液压机电有限公司,http://www.11467.com/dongguan/co/551503.htm
东莞市嘉欣机电设备有限公司,http://www.11467.com/dongguan/co/131048.htm
广州龙辉龙滤网有限公司,http://www.11467.com/guangzhou/co/115574.htm
广州博美克机械设备有限公司,http://www.11467.com/guangzhou/co/246328.htm
广州市源锘电子科技有限公司,http://www.11467.com/guangzhou/co/106478.htm
安平县以勒丝网制品有限公司,http://www.11467.com/hengshui/co/33778.htm
广州宇星机械设备有限公司,http://www.11467.com/guangzhou/co/110679.htm
合肥新都仪表有限公司,http://www.11467.com/hefei/co/80302.htm
临安新磊机电设备有限公司,http://www.11467.com/hangzhou/co/377216.htm
杭州圣泉过滤机有限公司,http://www.11467.com/hangzhou/co/207928.htm
杭州强源过滤设备有限公司,http://www.11467.com/hangzhou/co/380941.htm
杭州圣安流体设备有限公司,http://www.11467.com/hangzhou/co/257008.htm
杭州龙舒过滤设备有限公司,http://www.11467.com/hangzhou/co/374199.htm
杭州力诺机械设备有限公司,http://www.11467.com/hangzhou/co/209076.htm
广州市纬颐环保设备有限公司,http://www.11467.com/guangzhou/co/460290.htm
杭州昊天膜科技有限公司,http://www.11467.com/hangzhou/co/374331.htm
杭州通亚过滤机有限公司,http://www.11467.com/hangzhou/co/114262.htm
广州市珂力压缩空气系统工程有限公司,http://www.11467.com/guangzhou/co/495787.htm
杭州鲸王压滤机有限公司,http://www.11467.com/hangzhou/co/207652.htm
杭州临安天城机电有限公司,http://www.11467.com/hangzhou/co/311350.htm
安平县康美隆金属网业有限公司,http://www.11467.com/hengshui/co/19341.htm
杭州坤源过滤机械有限公司,http://www.11467.com/hangzhou/co/206799.htm
广州市绿达环保机械有限公司,http://www.11467.com/guangzhou/co/111423.htm
广州市浩立生物科技有限公司,http://www.11467.com/guangzhou/co/246268.htm
广州市元达制药设备有限公司,http://www.11467.com/guangzhou/co/110680.htm
杭州日康净化设备有限公司,http://www.11467.com/hangzhou/co/99805.htm
河北荣鹰金属网有限公司,http://www.11467.com/hengshui/co/31379.htm
安平县鑫亨丝网制品有限公司,http://www.11467.com/hengshui/co/33708.htm
杭州盛尔气体设备有限公司,http://www.11467.com/hangzhou/co/390997.htm
广州市建琪贸易有限公司,http://www.11467.com/guangzhou/co/246158.htm
广州市尔泉净水设备有限公司,http://www.11467.com/guangzhou/co/207488.htm
广州乾通机电有限公司,http://www.11467.com/guangzhou/co/245607.htm
杭州大衡滤布有限公司,http://www.11467.com/hangzhou/co/259106.htm
杭州道纳膜科技有限公司,http://www.11467.com/hangzhou/co/207506.htm
杭州佳都环保科技有限公司,http://www.11467.com/hangzhou/co/311278.htm
杭州吉腾机械有限公司,http://www.11467.com/hangzhou/co/312990.htm
杭州远然科技有限公司,http://www.11467.com/hangzhou/co/369033.htm
杭州科利德化工机械有限公司,http://www.11467.com/hangzhou/co/31214.htm
杭州天源气超滤设备工程有限公司,http://www.11467.com/hangzhou/co/154419.htm
广州市旺明水之乐设计咨询有限公司,http://www.11467.com/guangzhou/co/246149.htm
广州市雷子克电气机械有限公司,http://www.11467.com/guangzhou/co/472853.htm
杭州晨希过滤机有限公司,http://www.11467.com/hangzhou/co/207870.htm
上海必特数码科技有限公司,http://www.11467.com/guangzhou/co/121844.htm
湘潭市三银离心机有限公司,http://www.11467.com/xiangtan/co/24143.htm
青州市雷特重工机械制造有限公司,http://www.11467.com/weifang/co/120338.htm
无锡碧水蓝环保科技有限公司,http://www.11467.com/wuxi/co/243894.htm
新乡市绿声通用机械设备制造有限公司,http://www.11467.com/xinxiang/co/30146.htm
西安永兴食品药化机械有限公司,http://www.11467.com/xian/co/47459.htm
江阴市新安粉体设备有限公司,http://www.11467.com/wuxi/co/249767.htm
潍坊川泰机械有限公司,http://www.11467.com/weifang/co/117617.htm
武汉大禹磁处理开发有限公司,http://www.11467.com/wuhan/co/33939.htm
无锡市海卓力克液压机械有限公司,http://www.11467.com/wuxi/co/197009.htm
杭州金龙过滤机有限公司湖南办事处,http://www.11467.com/xiangtan/co/23059.htm
新乡市恒鑫通用设备有限公司,http://www.11467.com/xinxiang/co/23244.htm
新乡市晶宝机械有限公司,http://www.11467.com/xinxiang/co/19357.htm
厦门市冠德机械有限公司,http://www.11467.com/xiamen/co/52440.htm
襄樊市仪骏波微电子设备有限公司,http://www.11467.com/xiangfan/co/35896.htm
武汉巨风机械有限公司,http://www.11467.com/wuhan/co/83239.htm
陕西星瑞航天科技发展有限责任公司,http://www.11467.com/xian/co/48060.htm
无锡维迪机械有限公司,http://www.11467.com/wuxi/co/196485.htm
无锡市润邦液压件制造有限公司,http://www.11467.com/wuxi/co/196917.htm
唐山市益涛机械设备制造有限公司,http://www.11467.com/tangshan/co/56577.htm
芜湖市洁源净化器材有限责任公司,http://www.11467.com/wuhu/co/20726.htm
宜兴市光阳化工设备有限公司,http://www.11467.com/wuxi/co/78888.htm
新乡市启航过滤筛分机械有限公司,http://www.11467.com/xinxiang/co/23432.htm
江阴市日月机械有限公司,http://www.11467.com/wuxi/co/243938.htm
世凌弘翔（厦门）空气分离设备有限公司,http://www.11467.com/xiamen/co/46820.htm
湘潭市特种电机厂有限公司,http://www.11467.com/xiangtan/co/22960.htm
新乡永达实业有限公司,http://www.11467.com/xinxiang/co/19599.htm
南宫市汇和气体设备有限公司,http://www.11467.com/xintai/co/49912.htm
青州市江河沙矿机械有限公司,http://www.11467.com/xiamen/co/95595.htm
无锡千诺机械设备有限公司,http://www.11467.com/wuxi/co/246326.htm
无锡市恒康环保机械有限公司,http://www.11467.com/wuxi/co/118128.htm
江阴市科力机械有限公司,http://www.11467.com/wuxi/co/243788.htm
无锡市恒盛净化空调有限公司,http://www.11467.com/wuxi/co/33215.htm
无锡市舒航机械科技有限公司,http://www.11467.com/wuxi/co/214919.htm
