宜兴市新裕耐火材料有限公司,http://www.11467.com/wuxi/co/84198.htm
邢台市诺伯荣工贸有限公司,http://www.11467.com/xintai/co/35980.htm
巩义市帝鑫净化材料有限公司,http://www.11467.com/zhengzhou/co/173066.htm
郑州鑫和机器制造有限公司,http://www.11467.com/zhengzhou/co/118752.htm
烟台市东海环保科技开发有限责任公司,http://www.11467.com/yantai/co/113305.htm
新乡市诺狮振动机械有限公司,http://www.11467.com/xinxiang/co/30517.htm
盐城市双久空分设备阀门有限公司,http://www.11467.com/yancheng/co/8294.htm
新乡市豫成振动机械有限公司,http://www.11467.com/xinxiang/co/22091.htm
盐城市同成环保设备有限公司,http://www.11467.com/yancheng/co/52748.htm
烟台亿源数控机床附件有限公司,http://www.11467.com/yantai/co/125758.htm
肇庆市建信电子机械工程有限公司复盛空压机经营部,http://www.11467.com/zhaoqing/co/32032.htm
新乡县新振机械有限公司,http://www.11467.com/xinxiang/co/19086.htm
新乡市大唐机械制造有限公司,http://www.11467.com/xinxiang/co/19437.htm
新乡平原液压有限公司,http://www.11467.com/xinxiang/co/19794.htm
新乡市明洋筛分机械有限公司,http://www.11467.com/xinxiang/co/23455.htm
新乡市龙杰机械设备有限公司,http://www.11467.com/xinxiang/co/19447.htm
新乡市首创机械有限公司,http://www.11467.com/xinxiang/co/19436.htm
新乡市三魁除尘设备有限公司,http://www.11467.com/xinxiang/co/19729.htm
新乡市元亨机械有限公司,http://www.11467.com/xinxiang/co/23326.htm
新乡市春晖振动滤业有限公司,http://www.11467.com/xinxiang/co/23218.htm
烟台利丰机械有限公司,http://www.11467.com/yantai/co/123680.htm
江苏春光汽车配件有限公司,http://www.11467.com/yancheng/co/56759.htm
新乡市驰豫超声设备有限公司,http://www.11467.com/xinxiang/co/31400.htm
郑州华膜水处理器材有限公司,http://www.11467.com/zhengzhou/co/175411.htm
盐城索兰机电设备有限公司,http://www.11467.com/yancheng/co/76902.htm
盐城海源节能环保设备有限公司,http://www.11467.com/yancheng/co/73127.htm
营口富纪自动化仪表有限公司,http://www.11467.com/yingkou/co/46562.htm
盐城市奇联电力设备有限公司,http://www.11467.com/yancheng/co/57072.htm
禹州市东龙化工机械有限公司,http://www.11467.com/xuchang/co/5720.htm
盐城市淮宇供热设备有限公司,http://www.11467.com/yancheng/co/60764.htm
新乡市宏升机械有限公司,http://www.11467.com/xinxiang/co/19869.htm
新乡市斯维科振动筛分机械有限公司,http://www.11467.com/xinxiang/co/19469.htm
新乡市盛祥物贸有限公司,http://www.11467.com/xinxiang/co/19442.htm
新乡市巴山螺套有限公司,http://www.11467.com/xinxiang/co/23180.htm
新乡市龙安机械有限公司,http://www.11467.com/xinxiang/co/19817.htm
广德世博合成碳材料有限公司,http://www.11467.com/xuancheng/co/11849.htm
禹州市宏兴源过滤设备有限公司,http://www.11467.com/xuchang/co/22375.htm
老松(新乡)机械有限公司,http://www.11467.com/xinxiang/co/19267.htm
获嘉县三江机械制造有限公司,http://www.11467.com/xinxiang/co/30894.htm
新乡市恒鑫液压机械制造有限公司,http://www.11467.com/xinxiang/co/6963.htm
新乡市牧野区小虫机械有限公司,http://www.11467.com/xinxiang/co/22153.htm
安平县浩港金属丝网制品有限公司,http://www.11467.com/hengshui/co/60886.htm
郑州三禾水处理材料有限公司,http://www.11467.com/zhengzhou/co/222897.htm
廊坊舜天过滤设备有限公司,http://www.11467.com/langfang/co/84888.htm
东莞市协达环保机械有限公司,http://www.11467.com/dongguan/co/558566.htm
固安县禹都过滤设备有限公司,http://www.11467.com/langfang/co/55802.htm
固安县万泽过滤设备有限公司,http://www.11467.com/langfang/co/71508.htm
义乌市离鑫环保设备有限公司,http://www.11467.com/jinhua/co/185670.htm
巩义市启达水处理材料有限公司,http://www.11467.com/qiye/22250603.htm
济宁力扬环保设备制造有限公司,http://www.11467.com/jining/co/105000.htm
青州科大矿砂机械公司,http://www.11467.com/weifang/co/156189.htm
惠州市腾旺环境科技有限公司,http://www.11467.com/huizhou/co/116425.htm
河北威远过滤设备有限公司,http://www.11467.com/langfang/co/81365.htm
天津沃泰克环保科技有限公司,http://www.11467.com/tianjin/co/302232.htm
河北金悦能源科技开发有限公司,http://www.11467.com/hengshui/co/79464.htm
北京安泰瑞科科技有限公司,http://www.11467.com/beijing/co/724099.htm
新乡德亚过滤设备有限公司,http://www.11467.com/xinxiang/co/44123.htm
上海予卓仪器有限公司,http://www.11467.com/shanghai/co/1217311.htm
永恒滤清器制造有限公司,http://www.11467.com/langfang/co/61657.htm
新乡市巴山筛分机械有限公司,http://www.11467.com/xinxiang/co/39566.htm
固安县隆信过滤器有限公司,http://www.11467.com/langfang/co/74089.htm
东莞特洛伊新能源有限公司,http://www.11467.com/dongguan/co/615990.htm
浙江杰能环保科技设备有限公司销售部,http://www.11467.com/jinhua/co/212250.htm
广西速洁净水材料有限公司,http://www.11467.com/nanning/co/98022.htm
苏州维德姆设备科技有限公司,http://www.11467.com/suzhou/co/381957.htm
浙江天台丰顿滤料有限公司,http://www.11467.com/qiye/22747092.htm
徐州瑞欧聚氨酯有限公司,http://www.11467.com/xuzhou/co/91888.htm
新乡市新久振动机械有限公司销售部,http://www.11467.com/xinxiang/co/41510.htm
北京时代北利离心机有限公司销售部,http://www.11467.com/beijing/co/716693.htm
安平县大乐丝网制品有限公司,http://www.11467.com/hengshui/co/52564.htm
河南中谦机械有限公司,http://www.11467.com/xinxiang/co/57687.htm
江苏东旺环保科技有限公司,http://www.11467.com/yancheng/co/84963.htm
河南省中冶铸业有限公司,http://www.11467.com/xinxiang/co/41134.htm
巩义市碧之源净水材料销售有限公司,http://www.11467.com/zhengzhou/co/241314.htm
河南蓝达水处理材料有限公司,http://www.11467.com/zhengzhou/co/241738.htm
西安华膜水处理设备有限公司,http://www.11467.com/xian/co/167695.htm
巩义市千山水处理材料有限公司,http://www.11467.com/zhengzhou/co/251351.htm
江苏奥凯环境技术有限公司,http://www.11467.com/taizhoushi/co/62186.htm
廊坊拓盈过滤器有限公司,http://www.11467.com/langfang/co/94983.htm
河南润淋滤水材料有限公司,http://www.11467.com/zhengzhou/co/244371.htm
北京中平建实验设备有限公司,http://www.11467.com/beijing/co/763836.htm
天津允公同创科技有限公司,http://www.11467.com/tianjin/co/252603.htm
郑州朋来仪器有限公司,http://www.11467.com/zhengzhou/co/226111.htm
抚顺市博晖产业滤布有限公司,http://www.11467.com/fushun/co/30847.htm
张家港市创格机械科技有限公司,http://www.11467.com/zhangjiajie/co/13293.htm
无锡欧科过滤设备有限公司,http://www.11467.com/wuxi/co/274655.htm
广州芯博士科技有限公司,http://www.11467.com/guangzhou/co/696679.htm
诸城市耀邦机械有限公司,http://www.11467.com/qiye/23568502.htm
河南恒泰滤材有限公司,http://www.11467.com/zhengzhou/co/234025.htm
诸城市佳美食品机械有限公司,http://www.11467.com/weifang/co/173428.htm
广州强迪净化科技有限公司,http://www.11467.com/guangzhou/co/696621.htm
广州浚尔工业设备有限公司,http://www.11467.com/guangzhou/co/699275.htm
青州同辉环保机械有限公司,http://www.11467.com/weifang/co/173739.htm
广州地一过滤设备有限公司,http://www.11467.com/guangzhou/co/701374.htm
巩义浩程净水材料有限公司,http://www.11467.com/zhengzhou/co/236859.htm
广州永程科学设备有限公司,http://www.11467.com/guangzhou/co/699692.htm
浙江天台斯佰林滤料有限公司,http://www.11467.com/taizhou/co/180324.htm
福州鼎瞻净化设备有限公司,http://www.11467.com/fuzhou/co/211384.htm
杭州富阳柏奥气体设备有限公司,http://www.11467.com/hangzhou/co/497784.htm
广州来鑫净化科技有限公司,http://www.11467.com/guangzhou/co/701413.htm
河南利美特机械有限公司,http://www.11467.com/xinxiang/co/50397.htm
苏州奋力净化科技有限公司,http://www.11467.com/suzhou/co/401268.htm
江苏国源环保设备有限公司,http://www.11467.com/yancheng/co/89382.htm
新乡市飞鸿净化设备有限公司,http://www.11467.com/xinxiang/co/50382.htm
巩义市龙祥净水材料有限公司,http://www.11467.com/zhengzhou/co/226142.htm
济南九州雁医疗科技有限公司,http://www.11467.com/jinan/co/156840.htm
深圳英克涞思科技有限公司,http://www.11467.com/shenzhen/co/1087086.htm
昆山华滤环保科技有限公司,http://www.11467.com/suzhou/co/400308.htm
台州天净滤料有限公司,http://www.11467.com/taizhou/co/176365.htm
河北瑞泰环保科技有限公司,http://www.11467.com/qiye/23355882.htm
盐城市晴天环保滤材有限公司,http://www.11467.com/yancheng/co/89370.htm
大连艺昂实业有限公司,http://www.11467.com/dalian/co/81237.htm
中山斯科特净化过滤制品有限公司,http://www.11467.com/zhongshan/co/217327.htm
巩义市明源净水材料有限公司,http://www.11467.com/zhengzhou/co/226209.htm
杭州唐维过滤器材有限公司,http://www.11467.com/hangzhou/co/493126.htm
广州绿净丰空气净化设备有限公司,http://www.11467.com/guangzhou/co/701384.htm
深圳心义环保科技有限责任公司,http://www.11467.com/shenzhen/co/1102662.htm
无锡市蓝星压力容器有限公司,http://www.11467.com/wuxi/co/193762.htm
惠州市康普斯机电设备有限公司,http://www.11467.com/huizhou/co/57896.htm
鹤壁市博亚仪器设备有限公司,http://www.11467.com/hebi/co/8706.htm
新乡市山林滤清器有限公司,http://www.11467.com/xinxiang/co/23154.htm
无锡市鑫燕粉体机械有限公司,http://www.11467.com/wuxi/co/190373.htm
磐安恒远制氮机有限公司,http://www.11467.com/jinhua/co/115522.htm
新乡市豫北振动机械有限公司,http://www.11467.com/xinxiang/co/22337.htm
丽水市恒力离心机械设备有限公司,http://www.11467.com/lishui/co/14416.htm
南通市澳通环保滤材有限公司,http://www.11467.com/nantong/co/85060.htm
杭州南方顶麒机电设备有限公司,http://www.11467.com/hangzhou/co/212191.htm
杭州顺源过滤机械有限公司,http://www.11467.com/hangzhou/co/371270.htm
新乡市嘉顺机械制造有限公司,http://www.11467.com/xinxiang/co/32300.htm
苏州纯尔净化科技有限公司,http://www.11467.com/suzhou/co/292344.htm
杭州中茗实业有限公司,http://www.11467.com/hangzhou/co/164705.htm
杭州欧源压滤机有限公司,http://www.11467.com/hangzhou/co/388021.htm
新乡市众通振动机械有限公司,http://www.11467.com/xinxiang/co/22087.htm
上虞市禹顺机械设备有限公司,http://www.11467.com/shaoxing/co/110535.htm
吴江市金华净化钢构工程有限公司,http://www.11467.com/suzhou/co/356916.htm
平阳三鑫传动机械制造有限公司,http://www.11467.com/wenzhou/co/224018.htm
安丘市科隆机械有限公司,http://www.11467.com/weifang/co/118000.htm
深圳市永金电镀设备有限公司,http://www.11467.com/shenzhen/co/58271.htm
杭州菲特设备制造有限公司,http://www.11467.com/hangzhou/co/148262.htm
杭州溢达机电制造有限公司,http://www.11467.com/hangzhou/co/209142.htm
宜兴市益益环保设备有限公司,http://www.11467.com/wuxi/co/79355.htm
无锡市同维机电制造有限公司,http://www.11467.com/wuxi/co/55075.htm
宜兴市四环水处理设备有限公司,http://www.11467.com/wuxi/co/171603.htm
杭州舜德机械有限公司,http://www.11467.com/hangzhou/co/259164.htm
安平县恒源五金网业制品有限公司,http://www.11467.com/hengshui/co/28543.htm
深圳市恒邦滤清器制品有限公司,http://www.11467.com/shenzhen/co/505107.htm
南京慧城水处理设备有限公司,http://www.11467.com/nanjing/co/114878.htm
张家港市吉宇机械制造有限公司,http://www.11467.com/suzhou/co/315284.htm
温州益兴压力容器有限公司,http://www.11467.com/wenzhou/co/169573.htm
嘉宇实业（上海）有限公司,http://www.11467.com/shanghai/co/1305056.htm
安平县德佑金属丝网制品有限公司,http://www.11467.com/qiye/93060922.htm
佛山市朋昌化工机械有限公司,http://www.11467.com/qiye/240510.htm
徐州恒铭机械设备有限公司,http://www.11467.com/xuzhou/co/28743.htm
固安县盛诺过滤设备制造有限公司,http://www.11467.com/qiye/93316509.htm
廊坊倍达通过滤设备有限公司,http://www.11467.com/qiye/93161174.htm
天津市盛金缘商贸有限公司,http://www.11467.com/tianjin/co/26244.htm
新乡市德普瑞滤清器有限公司,http://www.11467.com/xinxiang/co/23155.htm
新乡市恒源过滤设备有限公司,http://www.11467.com/xinxiang/co/19696.htm
北京市北氧特种气体研究所有限公司,http://www.11467.com/beijing/co/617984.htm
天津市金杯压缩机净化设备有限公司,http://www.11467.com/tianjin/co/137551.htm
河北佳鑫粉碎机有限公司,http://www.11467.com/handan/co/77778.htm
永清县骏驰滤清器有限公司,http://www.11467.com/qiye/93311694.htm
上海索斐亚环保科技有限公司,http://www.11467.com/shanghai/co/1047108.htm
张家港市碧鹰离心机有限公司,http://www.11467.com/qiye/23344710.htm
霸州市康诚过滤设备有限公司,http://www.11467.com/qiye/93350784.htm
安平县以乐丝网制品有限公司,http://www.11467.com/qiye/93192071.htm
苏州盟迪气体设备有限公司,http://www.11467.com/qiye/93316417.htm
苏州硕强电子机械有限公司,http://www.11467.com/suzhou/co/341391.htm
北京源通盛元科技有限公司,http://www.11467.com/beijing/co/763254.htm
北京信科科技有限责任公司,http://www.11467.com/beijing/co/761784.htm
大连知远机电有限公司,http://www.11467.com/dalian/co/69389.htm
新乡市秀朗微孔过滤设备有限公司,http://www.11467.com/qiye/93434434.htm
潍坊中威环保科技有限公司,http://www.11467.com/weifang/co/177167.htm
安平县速强丝网制品有限公司,http://www.11467.com/qiye/93022925.htm
安平县雅威以勒以勒丝网制品有限公司,http://www.11467.com/qiye/93369666.htm
无锡亚泰精密气缸管制造有限公司,http://www.11467.com/wuxi/co/196809.htm
河南东瑞机械制造有限公司,http://www.11467.com/zhengzhou/co/163898.htm
淄博市博山精伟窑炉技术有限公司,http://www.11467.com/zibo/co/62472.htm
淄博鑫玖化工设备有限公司,http://www.11467.com/zibo/co/38063.htm
濮阳市东升科贸有限公司,http://www.11467.com/puyang/co/30557.htm
张家港市谱发机械制造有限公司,http://www.11467.com/suzhou/co/385783.htm
天津润捷科技发展有限公司,http://www.11467.com/tianjin/co/198620.htm
大龙兴创实验仪器(北京)有限公司,http://www.11467.com/beijing/co/697843.htm
湘潭市红日过滤设备有限公司,http://www.11467.com/xiangtan/co/26560.htm
湖南中源欣创科技有限公司,http://www.11467.com/xiangtan/co/26561.htm
苏州新思气体系统有限公司,http://www.11467.com/suzhou/co/205628.htm
昆明台鑫环保设备有限公司,http://www.11467.com/kunming/co/121830.htm
鹤壁金能机械有限公司,http://www.11467.com/hebi/co/10062.htm
长沙市凌志环保设备有限公司,http://www.11467.com/changsha/co/70016.htm
湖南星科科学仪器有限公司,http://www.11467.com/changsha/co/21905.htm
"湖南赛特湘仪离心机仪器有限公司,",http://www.11467.com/changsha/co/82041.htm
湖南湘仪实验室仪器开发有限公司,http://www.11467.com/changsha/co/119307.htm
常州化工设备有限公司,http://www.11467.com/changzhou/co/91934.htm
常州新德冷机有限公司,http://www.11467.com/changzhou/co/150607.htm
北京诚茂兴业科技发展有限公司,http://www.11467.com/dalian/co/63870.htm
大连必全机械制造有限公司,http://www.11467.com/dalian/co/45093.htm
东莞市东正塑胶机械制造有限公司,http://www.11467.com/dongguan/co/503550.htm
东莞市康谱斯机电设备有限公司,http://www.11467.com/dongguan/co/130393.htm
信易发电热机械有限公司,http://www.11467.com/dongguan/co/504740.htm
星宇饰品材料有限公司,http://www.11467.com/dongguan/co/497323.htm
广州和菱机电设备有限公司,http://www.11467.com/guangzhou/co/460859.htm
上海浪潮机器有限公司,http://www.11467.com/haerbin/co/41719.htm
杭州奥盛仪器有限公司,http://www.11467.com/hangzhou/co/374226.htm
杭州富阳市耀顺机械设备有限公司,http://www.11467.com/hangzhou/co/373083.htm
杭州安易机电设备有限公司,http://www.11467.com/hangzhou/co/208755.htm
辽阳药化设备制造有限公司,http://www.11467.com/liaoyang/co/22542.htm
辽阳新福制药机械有限公司,http://www.11467.com/liaoyang/co/22537.htm
辽阳信诺国际贸易有限公司,http://www.11467.com/liaoyang/co/22528.htm
辽阳银轩制药机械有限公司,http://www.11467.com/liaoyang/co/22665.htm
辽阳祥隆制药机械有限公司经营部,http://www.11467.com/liaoyang/co/22535.htm
疗养龙达制药机械有限公司,http://www.11467.com/liaoyang/co/22536.htm
辽阳中联制药机械有限公司业务部,http://www.11467.com/liaoyang/co/22539.htm
辽宁省辽阳市银轩制药机械公司,http://www.11467.com/liaoyang/co/23370.htm
福建省绿能环保科技有限公司,http://www.11467.com/quanzhou/co/131089.htm
泉州市鸿新彩色印刷有限公司,http://www.11467.com/quanzhou/co/131821.htm
浙江万金机械有限公司,http://www.11467.com/shaoxing/co/93605.htm
深圳市威正净化技术有限公司,http://www.11467.com/shenzhen/co/111638.htm
深圳市中兴新通讯设备有限公司,http://www.11467.com/shenzhen/co/110271.htm
苏州台合达环保设备有限公司,http://www.11467.com/suzhou/co/314485.htm
苏州东菱振动试验仪器有限公司,http://www.11467.com/suzhou/co/319988.htm
安徽神牛振动筛控股有限公司,http://www.11467.com/suzhoushi/co/18722.htm
山西省污水处理有限公司,http://www.11467.com/taiyuan/co/23865.htm
武汉艾科滤膜技术有限公司,http://www.11467.com/wuhan/co/56636.htm
厦门鲲扬膜科技有限公司,http://www.11467.com/xiamen/co/84648.htm
湘潭林海机械制造有限公司,http://www.11467.com/xiangtan/co/22966.htm
新乡宏达冶金振动设备有限公司,http://www.11467.com/xinxiang/co/19264.htm
宜昌英汉超声电气有限公司,http://www.11467.com/yichang/co/40893.htm
北京吉天仪器有限公司,http://www.11467.com/beijing/co/103034.htm
上海霏润机械设备有限公司,http://www.11467.com/shanghai/co/1048735.htm
上海神农机械有限公司,http://www.11467.com/shanghai/co/1042807.htm
杭州环球净化设备有限公司,http://www.11467.com/hangzhou/co/8763.htm
杭州凯德空分设备有限公司,http://www.11467.com/hangzhou/co/193934.htm
杭州鼎岳空分设备有限公司,http://www.11467.com/hangzhou/co/369032.htm
杭州宝诺空分设备有限公司,http://www.11467.com/hangzhou/co/313372.htm
杭州优埃基空分有限公司,http://www.11467.com/hangzhou/co/369765.htm
杭州瑞科气体设备有限公司,http://www.11467.com/hangzhou/co/373347.htm
安徽中科中佳科学仪器有限公司,http://www.11467.com/hefei/co/80304.htm
合肥世杰膜工程有限责任公司,http://www.11467.com/hefei/co/62624.htm
衡水海江压滤机集团有限公司,http://www.11467.com/hengshui/co/22151.htm
浙江晶泉水处理设备有限公司,http://www.11467.com/huzhou/co/46872.htm
开封开利空分设备有限公司,http://www.11467.com/kaifeng/co/14610.htm
开封华瑞化工新材料股份有限公司,http://www.11467.com/kaifeng/co/20023.htm
廊坊金峰源石油设备有限公司,http://www.11467.com/langfang/co/48235.htm
浙江三联环保机械设备有限公司,http://www.11467.com/lishui/co/26172.htm
河南洛阳昱发机械有限公司,http://www.11467.com/luoyang/co/60040.htm
北京艺创阀门制造有限公司,http://www.11467.com/nanjing/co/81070.htm
南京绿岛机械设备有限公司,http://www.11467.com/nanjing/co/154842.htm
湖州市星星研磨有限公司(宁波办事处),http://www.11467.com/ningbo/co/195788.htm
河南商丘新达机械有限公司,http://www.11467.com/shangqiu/co/20993.htm
韶关市绿昇环保工程设备有限公司,http://www.11467.com/shaoguan/co/23593.htm
浙江双杰铜业有限公司,http://www.11467.com/shaoxing/co/119779.htm
浙江金海环境技术股份有限公司,http://www.11467.com/shaoxing/co/118997.htm
深圳今日丰科技电子有限公司,http://www.11467.com/shenzhen/co/784301.htm
河北润港环保科技有限公司,http://www.11467.com/shijiazhuang/co/140369.htm
江苏牡丹离心机制造有限公司,http://www.11467.com/suzhou/co/317515.htm
晟迪欧电子科技有限公司苏州分公司,http://www.11467.com/suzhou/co/203692.htm
苏州浩中环保设备有限公司,http://www.11467.com/suzhou/co/204550.htm
苏州艾唯尔气体设备有限公司,http://www.11467.com/suzhou/co/237596.htm
苏州龙峰钛镍设备有限公司,http://www.11467.com/suzhou/co/226951.htm
苏州星亿机械有限公司,http://www.11467.com/suzhou/co/317514.htm
山东联盛重工机械公司,http://www.11467.com/weifang/co/120491.htm
武汉新概念农业机械设备制造有限公司,http://www.11467.com/wuhan/co/143798.htm
无锡超亚环保设备有限公司,http://www.11467.com/wuxi/co/243743.htm
无锡艺高罗杰水处理有限公司,http://www.11467.com/wuxi/co/174815.htm
无锡市华峰气体分离设备有限公司,http://www.11467.com/wuxi/co/188509.htm
三达膜科技(厦门)有限公司,http://www.11467.com/xiamen/co/25464.htm
厦门市鑫达隆机械设备有限公司,http://www.11467.com/xiamen/co/26122.htm
厦门峻成商贸发展有限公司,http://www.11467.com/xiamen/co/94551.htm
新乡市雷诚机械有限责任公司,http://www.11467.com/xinxiang/co/19441.htm
新乡市平原工业滤器有限公司,http://www.11467.com/xinxiang/co/22939.htm
新乡市红阳油脂工程技术有限公司,http://www.11467.com/xinxiang/co/19203.htm
河南新乡宏源振动筛分机械有限公司,http://www.11467.com/xinxiang/co/31577.htm
新乡市天河流体净化有限公司,http://www.11467.com/xinxiang/co/19570.htm
禹州市星和化工设备有限公司,http://www.11467.com/xuchang/co/22881.htm
辽宁鞍山市佳利鑫螺杆空压机公司,http://www.11467.com/anshan/co/78559.htm
白银广利制剂(厂)有限公司,http://www.11467.com/baiyin/co/4727.htm
宝鸡飞天环保隔墙板材有限公司,http://www.11467.com/baoji/co/31005.htm
宝鸡市天河钛业有限责任公司营销部,http://www.11467.com/baoji/co/25865.htm
泊头市阀门煤气化工设备制造有限责任公司,http://www.11467.com/cangzhou/co/21516.htm
湖南绿步科技有限责任公司,http://www.11467.com/changsha/co/121014.htm
宁波市鄞州金长江水处理设备有限公司,http://www.11467.com/changsha/co/70621.htm
长沙久信科技有限公司,http://www.11467.com/changsha/co/67035.htm
常州诺德佳诚压缩机有限公司,http://www.11467.com/changzhou/co/106826.htm
常州市特威电气自动化系统有限公司,http://www.11467.com/changzhou/co/110249.htm
溧阳市昆仑容器制造有限公司,http://www.11467.com/changzhou/co/65277.htm
常州新宇干燥设备有限公司,http://www.11467.com/changzhou/co/110225.htm
江苏正基仪器有限公司,http://www.11467.com/changzhou/co/148996.htm
常州市智阳机械设备有限公司,http://www.11467.com/changzhou/co/150318.htm
常州百亨输送设备有限公司,http://www.11467.com/changzhou/co/148695.htm
北京志成红运设备租赁公司,http://www.11467.com/chengdu/co/216889.htm
成都克密斯机械制造有限公司,http://www.11467.com/chengdu/co/216198.htm
成都市伟城制冷设备工程有限公司,http://www.11467.com/chengdu/co/213256.htm
上海雅荣生化设备仪器有限公司,http://www.11467.com/chengdu/co/214651.htm
大连霖联机械设备有限公司,http://www.11467.com/dalian/co/45123.htm
大连丽泰精密机械有限公司,http://www.11467.com/dalian/co/73646.htm
浙江慈溪达峰圆珠笔散件有限公司,http://www.11467.com/dezhou/co/49757.htm
鼎祥通用机械设备有限公司,http://www.11467.com/dongguan/co/497219.htm
东莞市绿之地环保设备有限公司,http://www.11467.com/dongguan/co/497220.htm
东莞市金丰环保机械有限公司,http://www.11467.com/dongguan/co/502165.htm
东莞市天图环保科技有限公司,http://www.11467.com/dongguan/co/411271.htm
江苏金玉投资发展有限公司,http://www.11467.com/xuzhou/co/81785.htm
扬州润明轻工机械有限公司,http://www.11467.com/yangzhou/co/75010.htm
扬州永辉纺织科技有限公司,http://www.11467.com/yangzhou/co/89840.htm
烟台艾格瑞过滤技术有限公司,http://www.11467.com/yantai/co/119829.htm
肇庆市正大化工机械设备有限公司,http://www.11467.com/zhaoqing/co/31604.htm
广东振华电器有限公司,http://www.11467.com/zhongshan/co/104042.htm
中山华钰有色冶金材料有限公司,http://www.11467.com/zhongshan/co/23783.htm
中山市易达自动化设备有限公司,http://www.11467.com/zhongshan/co/117557.htm
北京祥鹄科技发展有限公司,http://www.11467.com/beijing/co/701932.htm
上海宁杭机械设备有限公司,http://www.11467.com/shanghai/co/1037528.htm
上海瑞威机电设备有限公司,http://www.11467.com/shanghai/co/309786.htm
上海和杰科技有限公司,http://www.11467.com/shanghai/co/1053934.htm
天津科林泰克科技有限公司,http://www.11467.com/tianjin/co/140904.htm
