莱芜市荣盛纺织品有限公司,http://www.11467.com/laiwu/co/6101.htm
青海省绒业(集团)有限公司,http://www.11467.com/xining/co/25372.htm
南宫市鹰月绒毛有限公司,http://www.11467.com/xintai/co/49011.htm
天津外总集团纤源进出口有限公司,http://www.11467.com/tianjin/co/74381.htm
东莞市蓝辉纺织原料有限公司,http://www.11467.com/dongguan/co/481124.htm
安平县生威鬃尾制品有限公司,http://www.11467.com/hengshui/co/34405.htm
安平县前程鬃尾有限公司,http://www.11467.com/hengshui/co/20376.htm
桐乡市露尔曼皮草有限公司,http://www.11467.com/jiaxing/co/123165.htm
开封亿隆针纺制品有限公司,http://www.11467.com/kaifeng/co/16349.htm
四川原木浆商贸有限公司,http://www.11467.com/nanchong/co/25537.htm
惠东县正泰毛织厂有限公司,http://www.11467.com/shenzhen/co/253516.htm
牧羊童蒙古皮绒毛贸易有限公司广东直销部,http://www.11467.com/wulanchabu/co/6135.htm
内蒙古煜隆皮绒毛贸易有限公司广东直销部,http://www.11467.com/wulanchabu/co/5763.htm
内蒙古煜隆皮绒毛贸易有限责任公司直销部,http://www.11467.com/wulanchabu/co/5766.htm
内蒙古煜隆皮绒毛有限责任公司,http://www.11467.com/wulanchabu/co/5765.htm
咸宁市联新牲畜屠宰有限公司,http://www.11467.com/xianning/co/13469.htm
辽宁超懿工贸集团有限公司,http://www.11467.com/fuxin/co/16302.htm
广州市琴汦岛贸易有限公司,http://www.11467.com/guangzhou/co/177954.htm
广西绿阁环保制品销售有限公司,http://www.11467.com/chongzuo/co/5083.htm
四川张氏猪鬃贸易有限公司,http://www.11467.com/bazhong/co/6858.htm
信阳恒大猪鬃加工有限公司,http://www.11467.com/xinyang/co/20146.htm
信阳市浉河区富民猪鬃有限公司,http://www.11467.com/xinyang/co/20140.htm
云南西苑利昭鬃业有限公司,http://www.11467.com/zhaotong/co/9986.htm
海城市莅源纺织印染有限公司,http://www.11467.com/anshan/co/77746.htm
保定市康源农业经济开发有限公司,http://www.11467.com/baoding/co/56131.htm
包头市同贺兴羊绒制品有限责任公司,http://www.11467.com/baotou/co/27473.htm
澧县弘宇鬃刷有限公司,http://www.11467.com/changde/co/24644.htm
常州申毅纺织有限公司,http://www.11467.com/changzhou/co/94869.htm
江苏常州蓝阔植绒制品有限公司,http://www.11467.com/changzhou/co/124464.htm
珍品毛线有限公司,http://www.11467.com/changzhou/co/125086.htm
太和县亿美发制品有限公司,http://www.11467.com/chaohu/co/17185.htm
天长市志祥服装有限公司,http://www.11467.com/chuzhou/co/24895.htm
大连美源化妆用具有限公司,http://www.11467.com/dalian/co/22037.htm
大连瑞丰皮草有限公司,http://www.11467.com/dalian/co/62559.htm
大连多义进出口贸易有限公司,http://www.11467.com/dalian/co/57292.htm
四川绵竹新海进出口有限公司,http://www.11467.com/deyang/co/34399.htm
四川致远进出口贸易有限公司,http://www.11467.com/deyang/co/29999.htm
浙江省湖州亚宝纺织品有限公司东莞办事处,http://www.11467.com/dongguan/co/186171.htm
鄂尔多斯市鄂贝斯绒毛制品有限公司,http://www.11467.com/eerduosi/co/8680.htm
安徽省太和县明奇畜产品有限公司,http://www.11467.com/fuyang/co/16192.htm
广州谷德化工有限公司,http://www.11467.com/guangzhou/co/469262.htm
广州广龙服装公司,http://www.11467.com/guangzhou/co/409307.htm
广州鑫昌纺织品有限公司(销售二部）,http://www.11467.com/guangzhou/co/399926.htm
邯郸市圣雪海羊绒有限公司,http://www.11467.com/handan/co/49895.htm
杭州翔龙纤维贸易有限公司香港办,http://www.11467.com/hangzhou/co/273239.htm
无锡派克斯管业有限公司杭州办事处,http://www.11467.com/hangzhou/co/245127.htm
安徽中安进出口有限公司,http://www.11467.com/hefei/co/101305.htm
一凡鬃毛加工有限公司,http://www.11467.com/hengshui/co/25866.htm
安平巨龙畜产品有限责任公司,http://www.11467.com/hengshui/co/25827.htm
菏泽市丰硕羊绒毛有限公司,http://www.11467.com/heze/co/19490.htm
世杰皮草(菏泽)有限公司,http://www.11467.com/heze/co/34367.htm
湖州新万盛纺织有限公司,http://www.11467.com/huzhou/co/60585.htm
嘉兴三羊绒业有限公司,http://www.11467.com/jiaxing/co/73015.htm
山东费县大昌纺织有限公司,http://www.11467.com/linyi/co/96532.htm
绍兴县相思树进出口有限公司,http://www.11467.com/lvliang/co/18786.htm
福建莆田市吊吊绒羽绒有限公司,http://www.11467.com/putian/co/39159.htm
湖北富祥养殖技术咨询有限公司,http://www.11467.com/xiaogan/co/22127.htm
内蒙古鸿益羊绒制品有限公司,http://www.11467.com/huhehaote/co/26706.htm
呼和浩特市圣天虹纺织服饰有限责任公司,http://www.11467.com/huhehaote/co/26691.htm
湖州市恒源毛纺原料有限公司,http://www.11467.com/huzhou/co/54201.htm
孟州市鹄海鬃业有限公司,http://www.11467.com/jiaozuo/co/26977.htm
嘉兴市秉承毛纺原料有限公司,http://www.11467.com/jiaxing/co/47591.htm
嘉兴市益业商贸有限公司,http://www.11467.com/jiaxing/co/110124.htm
桐乡市勇取毛纺原料有限公司,http://www.11467.com/jiaxing/co/124797.htm
天机裘皮服饰有限公司,http://www.11467.com/jiaxing/co/90776.htm
桐乡市华丽裘皮制品有限公司,http://www.11467.com/jiaxing/co/50810.htm
霸州市雪绒花织衫有限公司,http://www.11467.com/langfang/co/22351.htm
甘肃宸生土畜产品有限公司,http://www.11467.com/lanzhou/co/40724.htm
甘肃华羚生物科技有限公司业务部,http://www.11467.com/lanzhou/co/70277.htm
蒙阴旭立纺织有限公司,http://www.11467.com/linyi/co/81597.htm
临沂市金汇纺织有限公司,http://www.11467.com/linyi/co/58032.htm
临沂市俊三绒毛有限公司,http://www.11467.com/linyi/co/38217.htm
蒙阴县鸿泰绒毛有限公司,http://www.11467.com/linyi/co/88594.htm
偃师星云贸易公司,http://www.11467.com/luoyang/co/51025.htm
广西南宁美愉贸易有限公司,http://www.11467.com/nanning/co/76286.htm
南通芳达利羊毛制品有限公司,http://www.11467.com/nantong/co/137126.htm
南通云清鬃业制品有限公司,http://www.11467.com/nantong/co/127469.htm
平顶山市食品公司,http://www.11467.com/pingdingshan/co/20001.htm
立辉贸易公司,http://www.11467.com/shangqiu/co/17499.htm
广州市虹禾贸易有限公司,http://www.11467.com/shaoxing/co/82754.htm
绍兴市世博毛纺织有限公司,http://www.11467.com/shaoxing/co/85899.htm
子午线毛纺有限公司,http://www.11467.com/shaoxing/co/84949.htm
道恩羊毛有限公司,http://www.11467.com/shenzhen/co/508103.htm
彩妮化妆用具制品有限公司,http://www.11467.com/shenzhen/co/512670.htm
绿领实业有限公司,http://www.11467.com/shenzhen/co/667157.htm
深圳市恒发尾毛毛刷制品有限公司,http://www.11467.com/shenzhen/co/595049.htm
深圳市旭升华联科技有限公司,http://www.11467.com/shenzhen/co/243935.htm
南京和世软包装有限公司,http://www.11467.com/shenzhen/co/225059.htm
谷鸿化工有限公司,http://www.11467.com/shijiazhuang/co/98813.htm
河北凯洋汽车内饰贸易公司,http://www.11467.com/shijiazhuang/co/103892.htm
河北葆意羊绒制品有限公司,http://www.11467.com/shijiazhuang/co/23086.htm
乾泰隆羊绒制品原料有限公司,http://www.11467.com/shijiazhuang/co/82836.htm
南太平洋贸易有限公司,http://www.11467.com/suzhou/co/212559.htm
天宇羊毛工业（张家港保税区）有限公司,http://www.11467.com/suzhou/co/117243.htm
张家港市云华贸易有限公司,http://www.11467.com/suzhou/co/264821.htm
苏州市阳澄湖好来我蟹王公司,http://www.11467.com/suzhou/co/257141.htm
山东泰安岱鑫种兔有限公司,http://www.11467.com/taian/co/39512.htm
安徽省芜湖华伦土畜产有限公司,http://www.11467.com/wuhu/co/20003.htm
天山毛纺股份有限公司,http://www.11467.com/wulumuqi/co/90995.htm
哈萨克斯坦国营农副产品集团公司驻乌鲁木齐办事处,http://www.11467.com/wulumuqi/co/94735.htm
无锡丰谷科技有限公司,http://www.11467.com/wuxi/co/208203.htm
无锡嘉天纺织品有限公司,http://www.11467.com/wuxi/co/211877.htm
弘雅工贸有限公司,http://www.11467.com/xiamen/co/37603.htm
湖北襄樊金康欣食品公司,http://www.11467.com/xiangfan/co/40256.htm
清河县亚哈斯绒毛制品有限公司,http://www.11467.com/xintai/co/41070.htm
河北银叶云台羊绒制品有限公司,http://www.11467.com/xintai/co/38635.htm
河北利莱绒业公司,http://www.11467.com/xintai/co/33536.htm
清河县康乃馨动纤有限公司,http://www.11467.com/xintai/co/49761.htm
中国*东方拓展商贸公司,http://www.11467.com/xintai/co/50090.htm
清河县隆鑫绒毛制品有限公司,http://www.11467.com/xintai/co/47056.htm
南宫市鑫铎绒毛有限公司,http://www.11467.com/xintai/co/48920.htm
河北绒都羊绒制品有限公司,http://www.11467.com/xintai/co/50421.htm
清河县东奥羊绒制品有限公司,http://www.11467.com/xintai/co/43835.htm
清河县金天地绒毛制品有限公司,http://www.11467.com/xintai/co/51788.htm
河北宏兴毛毡有限公司,http://www.11467.com/xintai/co/50069.htm
信阳恒大猪鬃加工有限公司（业务部）,http://www.11467.com/xinyang/co/18822.htm
徐州华硕鬃刷制品有限公司,http://www.11467.com/xuzhou/co/71372.htm
宁夏天佳时尚绒制品有限公司,http://www.11467.com/yinchuan/co/38957.htm
百容皮草国际有限公司,http://www.11467.com/zhengzhou/co/121216.htm
沈丘县怀安毛刷制品有限公司郑州办,http://www.11467.com/zhengzhou/co/120290.htm
永兴旺漂染有限公司,http://www.11467.com/zhongshan/co/114488.htm
河南鹿邑坤宇毛业有限公司,http://www.11467.com/zhoukou/co/21404.htm
南宫市华龙毛毡制品有限公司天津销售部,http://www.11467.com/tianjin/co/190627.htm
常州市宏芳源纺织技术有限公司,http://www.11467.com/changzhou/co/125167.htm
夏津珠西公司,http://www.11467.com/dezhou/co/37665.htm
允凯尾毛制品(东莞)有限公司,http://www.11467.com/dongguan/co/399768.htm
天鹰实业有限公司,http://www.11467.com/dongguan/co/361020.htm
聊城鑫润纺织公司,http://www.11467.com/dongying/co/30071.htm
太和瑞丰鬃尾有限公司,http://www.11467.com/fuyang/co/27501.htm
广州常明拓展贸易有限公司,http://www.11467.com/guangzhou/co/353242.htm
广州锦瑞工艺制品有限公司,http://www.11467.com/guangzhou/co/475320.htm
广州市锦福地毯有限公司,http://www.11467.com/guangzhou/co/350086.htm
广州鑫昌纺织品有限公司(销售三部）,http://www.11467.com/guangzhou/co/409685.htm
三汇梳业有限公司,http://www.11467.com/guangzhou/co/164474.htm
河北舒琦羊绒有限公司,http://www.11467.com/handan/co/54154.htm
江苏宝华毛纺有限公司,http://www.11467.com/hangzhou/co/301717.htm
杭州联镜贸易有限公司,http://www.11467.com/hangzhou/co/219742.htm
安徽丰盈羽绒公司,http://www.11467.com/hefei/co/101261.htm
上海通莱达针织有限公司,http://www.11467.com/hefei/co/86129.htm
安平台安富鼎五金有限公司,http://www.11467.com/hengshui/co/9419.htm
故城县佳美蓄产制品有限公司,http://www.11467.com/hengshui/co/25841.htm
菏泽市海盟毛纺织有限公司,http://www.11467.com/heze/co/27339.htm
安徽省萧县康宁鬃刷有限责任公司,http://www.11467.com/huaibei/co/8379.htm
内蒙古胜曙实业有限公司,http://www.11467.com/huhehaote/co/25108.htm
内蒙羊绒进出口有限公司,http://www.11467.com/huhehaote/co/24595.htm
呼和浩特市元禾纺织有限责任公司,http://www.11467.com/huhehaote/co/25021.htm
乐记猪场有限公司,http://www.11467.com/huizhou/co/80114.htm
嘉兴市凌晨经贸有限公司,http://www.11467.com/jiaxing/co/73068.htm
桐乡市锦辰贸易有限公司,http://www.11467.com/jiaxing/co/130082.htm
华龙毛毡制品有限公司天津销售部,http://www.11467.com/tianjin/co/99905.htm
天津东方启明商贸有限公司,http://www.11467.com/tianjin/co/99904.htm
天津艾维斯科技有限公司,http://www.11467.com/tianjin/co/304200.htm
天津市新华铝塑门窗配件有限公司,http://www.11467.com/tianjin/co/307270.htm
巴中市猪毛贸易公司,http://www.11467.com/bazhong/co/9215.htm
海宁嫣语贸易有限公司,http://www.11467.com/jiaxing/co/113373.htm
张家港市山丹毛条制造有限公司,http://www.11467.com/suzhou/co/126950.htm
张家港保税区国贸毛纺有限公司,http://www.11467.com/suzhou/co/60707.htm
南宫市金安绒毛有限公司,http://www.11467.com/xintai/co/24552.htm
南宫市新宇羊绒纺织有限公司,http://www.11467.com/xintai/co/45896.htm
河北省清河县恒星羊绒制品有限公司,http://www.11467.com/xintai/co/18747.htm
大连经济技术开发区丰泰商贸有限公司（烟台营业所）,http://www.11467.com/yantai/co/132027.htm
龙新贸易有限公司中山办事处,http://www.11467.com/zhongshan/co/113950.htm
天津市荣唐进出口有限公司市场部,http://www.11467.com/tianjin/co/87742.htm
天津美川商贸有限公司,http://www.11467.com/tianjin/co/304199.htm
