深圳盛佳五金网有限公司,http://www.11467.com/shenzhen/co/369574.htm
深圳市国冶仪器设备有限公司,http://www.11467.com/shenzhen/co/762721.htm
深圳市恒基力佳化工有限公司,http://www.11467.com/shenzhen/co/372485.htm
深圳市诚志化玻有限公司,http://www.11467.com/shenzhen/co/372333.htm
深圳市嘉鸿瑞净化设备有限公司,http://www.11467.com/shenzhen/co/761395.htm
深圳市嘉欣实业有限公司(销售部）,http://www.11467.com/shenzhen/co/117868.htm
深圳市华康科仪设备有限公司（销售部）,http://www.11467.com/shenzhen/co/724753.htm
深圳市科美新辉实验室设备有限公司,http://www.11467.com/shenzhen/co/111320.htm
深圳市金宏达机械设备有限公司,http://www.11467.com/shenzhen/co/761400.htm
深圳市佳博特科技有限公司市场部,http://www.11467.com/shenzhen/co/369900.htm
深圳鹏翔运达机械设备公司,http://www.11467.com/shenzhen/co/369908.htm
深圳市天问化工科技有限公司,http://www.11467.com/shenzhen/co/372330.htm
深圳市圣弗德科技有限公司（销售部）,http://www.11467.com/shenzhen/co/369555.htm
深圳市鑫光明科技有限公司,http://www.11467.com/shenzhen/co/369580.htm
深圳市赛诺实验设备有限公司,http://www.11467.com/shenzhen/co/372329.htm
深圳矽晶品科技有限公司,http://www.11467.com/shenzhen/co/369902.htm
恒鑫工艺制品公司,http://www.11467.com/shenzhen/co/137617.htm
蓝图之星显影液有限公司,http://www.11467.com/shijiazhuang/co/141340.htm
石家庄华宇新锐科技有限公司（业务部）,http://www.11467.com/shijiazhuang/co/77983.htm
石家庄天龙实验设备有限公司,http://www.11467.com/shijiazhuang/co/87462.htm
宿迁创联家具制造有限公司,http://www.11467.com/suqian/co/11183.htm
苏州蒂森实验室系统工程有限公司,http://www.11467.com/suzhou/co/312053.htm
苏州格力特实验室系统工程有限公司内销部,http://www.11467.com/suzhou/co/227083.htm
苏州亿达实验室有限公司,http://www.11467.com/suzhou/co/227086.htm
苏州工业园区博美达试剂仪器有限公司,http://www.11467.com/suzhou/co/227089.htm
苏州凯得龙实验室设备有限公司,http://www.11467.com/suzhou/co/227082.htm
苏州八八金实验器材有限公司,http://www.11467.com/suzhou/co/208306.htm
苏州龙峰钛镍设备有限公司销售部,http://www.11467.com/suzhou/co/227439.htm
苏州马尔实验设备有限公司业务部,http://www.11467.com/suzhou/co/227011.htm
苏州赛夫迪实验室系统工程有限公司,http://www.11467.com/suzhou/co/248845.htm
苏州实验室—苏州亿达实验室系统工程有限公司,http://www.11467.com/suzhou/co/208307.htm
张家港市恒大离心机有限公司,http://www.11467.com/suzhou/co/315283.htm
苏州市华强电气有限公司,http://www.11467.com/suzhou/co/183357.htm
苏州乐泰胶粘剂有限公司,http://www.11467.com/suzhou/co/230880.htm
利盈实验室设备有限公司,http://www.11467.com/suzhou/co/227081.htm
苏州星岛金属制品有限公司,http://www.11467.com/suzhou/co/86506.htm
苏州鑫科达实验设备有限公司,http://www.11467.com/suzhou/co/314891.htm
苏州旭格化工有限公司,http://www.11467.com/suzhou/co/227007.htm
苏州市三杰化学品科技有限公司,http://www.11467.com/suzhou/co/227013.htm
泰安北斗光电仪器有限公司,http://www.11467.com/taian/co/36455.htm
太原市伟诚贸易有限公司,http://www.11467.com/taiyuan/co/37236.htm
淅江万彩塑化有限公司,http://www.11467.com/taizhou/co/88160.htm
威海化工机械有限公司，销售部,http://www.11467.com/weihai/co/30736.htm
湖北路桥有限公司,http://www.11467.com/wuhan/co/75388.htm
武汉新天实验装备有限公司,http://www.11467.com/wuhan/co/75390.htm
武汉和汇科贸有限公司,http://www.11467.com/wuhan/co/75389.htm
武汉博尔教学仪器设备有限责任公司,http://www.11467.com/wuhan/co/75460.htm
武汉神州机电有限公司,http://www.11467.com/wuhan/co/75399.htm
武汉市祥龙化玻仪器有限公司,http://www.11467.com/wuhan/co/3650.htm
武汉市壮小子服装有限公司,http://www.11467.com/wuhan/co/75387.htm
中科院天乐精密科学仪器有限公司,http://www.11467.com/wuhu/co/22189.htm
南长化学试剂有限公司,http://www.11467.com/wuxi/co/188563.htm
无锡帕特纳科技有限公司,http://www.11467.com/wuxi/co/142294.htm
无锡市金义博仪器科技有限公司(武汉分公司),http://www.11467.com/wuxi/co/188824.htm
无锡和诚生化装备有限公司,http://www.11467.com/wuxi/co/143342.htm
宜兴精刚陶瓷科技有限公司,http://www.11467.com/wuxi/co/240435.htm
无锡玉苍钢业有限公司,http://www.11467.com/wuxi/co/189581.htm
无锡苏腾机械设备制造有限公司,http://www.11467.com/wuxi/co/207614.htm
宜兴市前锦炉业设备有限公司,http://www.11467.com/wuxi/co/163806.htm
宜兴市徐工机械设备有限公司,http://www.11467.com/wuxi/co/247606.htm
无锡市万安电子有限公司,http://www.11467.com/wuxi/co/55199.htm
无锡市天皓防腐设备有限公司营销部,http://www.11467.com/wuxi/co/175518.htm
高科杰实验仪器有限公司,http://www.11467.com/xiamen/co/46870.htm
厦门德家和实验室公司,http://www.11467.com/xiamen/co/46868.htm
福建明兴化工有限公司,http://www.11467.com/xiamen/co/46839.htm
厦门德家和实验室设备有限公司销售部,http://www.11467.com/xiamen/co/46869.htm
厦门翔昀实验室设备有限公司 业务部,http://www.11467.com/xiamen/co/47073.htm
厦门瑶兴工贸有限公司,http://www.11467.com/xiamen/co/46834.htm
陕西博思博科教装备有限公司销售一部,http://www.11467.com/xian/co/64151.htm
西安溢福科技有限责任公司,http://www.11467.com/xian/co/68165.htm
天长市沪试分析仪器有限公司青海分公司,http://www.11467.com/xining/co/25635.htm
宣城新达机械设备有限公司,http://www.11467.com/xuancheng/co/22910.htm
江苏恒久集团恒久机械有限公司,http://www.11467.com/xuzhou/co/55216.htm
扬州市顺平化工机电设备有限公司,http://www.11467.com/yangzhou/co/81020.htm
莱阳市康德化工有限公司,http://www.11467.com/yantai/co/36005.htm
烟台科大精密装备有限公司,http://www.11467.com/yantai/co/123769.htm
宜昌市广益化工有限责任公司,http://www.11467.com/yichang/co/44743.htm
福建成兴环保防腐工程有限公司,http://www.11467.com/zhangzhou/co/45407.htm
肇庆市伟达贸易有限公司,http://www.11467.com/zhaoqing/co/31580.htm
河南永一不锈钢有限公司,http://www.11467.com/zhengzhou/co/112414.htm
湖南宇峰实业有限公司(河南总代理),http://www.11467.com/zhengzhou/co/112415.htm
郑州市亚荣仪器有限公司销售部,http://www.11467.com/zhengzhou/co/112444.htm
郑州佳创仪器设备有限公司,http://www.11467.com/zhengzhou/co/107476.htm
镇江奥力化学有限公司,http://www.11467.com/zhenjiang/co/48600.htm
镇江华东器化玻有限公司 国药镇江总代理,http://www.11467.com/zhenjiang/co/48605.htm
中山市美臣化妝品機械有限公司,http://www.11467.com/zhongshan/co/73755.htm
宏辉化工贸易公司,http://www.11467.com/zhongshan/co/73856.htm
润发电镀原材料有限公司,http://www.11467.com/zhongshan/co/73617.htm
珠海市维特生物技术有限公司,http://www.11467.com/zhuhai/co/73716.htm
淄博三剂化工装备有限公司,http://www.11467.com/zibo/co/98017.htm
淄博万豪化工设备有限公司,http://www.11467.com/zibo/co/74204.htm
淄博市临淄海昌机械有限公司,http://www.11467.com/zibo/co/52869.htm
淄博润通无油空压机有限公司,http://www.11467.com/zibo/co/92937.htm
淄博中晓清洗有限公司,http://www.11467.com/zibo/co/74099.htm
安徽中科中佳科学仪器有限公司北京办,http://www.11467.com/beijing/co/312345.htm
北京长空玻璃钢制品公司,http://www.11467.com/beijing/co/554456.htm
北京博美华科玻璃有限公司销售部,http://www.11467.com/beijing/co/103059.htm
北京奥德宇科技有限公司,http://www.11467.com/beijing/co/303410.htm
北京德之高实验室设备有限公司（销售部）,http://www.11467.com/beijing/co/217307.htm
北京北信科仪分析仪器有限公司,http://www.11467.com/beijing/co/692971.htm
北京宏嘉伟业家具有限公司,http://www.11467.com/beijing/co/592896.htm
北京茂利升经贸有限责任公司,http://www.11467.com/beijing/co/103062.htm
北京绿菱气体科技有限公司 市场部,http://www.11467.com/beijing/co/651280.htm
北京若比邻电子信息技术有限责任公司销售部,http://www.11467.com/beijing/co/312351.htm
北京盛发润发安全防护设备有限公司,http://www.11467.com/beijing/co/303085.htm
北京梦涛科技有限公司,http://www.11467.com/beijing/co/103058.htm
北京盛发润发有限责任公司,http://www.11467.com/beijing/co/312367.htm
北京盛发润发安全防护设备公司,http://www.11467.com/beijing/co/312347.htm
北京世纪华科实验仪器有限公司,http://www.11467.com/beijing/co/705689.htm
北京盛世泉通（洗眼器）商贸有限公司,http://www.11467.com/beijing/co/217306.htm
北京斯瑞尼克新材料科技有限公司,http://www.11467.com/beijing/co/217363.htm
北京同方科教设备有限公司,http://www.11467.com/beijing/co/217358.htm
北京万成远行化工产品有限公司销售部门,http://www.11467.com/beijing/co/404896.htm
北京同为基业设备有限公司,http://www.11467.com/beijing/co/303084.htm
北京湘顺源科技有限公司,http://www.11467.com/beijing/co/651312.htm
北京首格科技有限公司,http://www.11467.com/beijing/co/714247.htm
北京燕山名益化工技术有限公司,http://www.11467.com/beijing/co/275936.htm
北京中科实验台实验室家具有限公司,http://www.11467.com/beijing/co/312364.htm
北京友谊丹诺科技有限公司,http://www.11467.com/beijing/co/384068.htm
昊明阳（北京）科技有限公司,http://www.11467.com/beijing/co/312365.htm
蓝须鲸科技发展有限公司,http://www.11467.com/beijing/co/103281.htm
伊特克斯惰性气体系统(北京)有限公司,http://www.11467.com/beijing/co/27032.htm
郑州长城科工贸有限公司北京办事处,http://www.11467.com/beijing/co/405055.htm
北京迎海东旭实验室设备有限公司,http://www.11467.com/beijing/co/103060.htm
北京世纪森朗实验仪器公司维修部,http://www.11467.com/beijing/co/404897.htm
合肥华泰医疗设备有限公司京办,http://www.11467.com/beijing/co/312346.htm
北京中鼎世豪科技有限公司1,http://www.11467.com/beijing/co/312350.htm
北京中健科泰科技有限公司,http://www.11467.com/beijing/co/103099.htm
上海诚铭科技有限公司,http://www.11467.com/shanghai/co/938452.htm
广州市盛华化工科技有限公司上海办事处,http://www.11467.com/shanghai/co/518242.htm
上海崇德刀模有限公司,http://www.11467.com/shanghai/co/518231.htm
上海飞域实验室设备有限公司(总部）,http://www.11467.com/shanghai/co/938449.htm
上海贺利氏电测骑士有限公司,http://www.11467.com/shanghai/co/488698.htm
上海邦尔不锈钢制品有限公司,http://www.11467.com/shanghai/co/668656.htm
上海恒浩塑胶有限公司,http://www.11467.com/shanghai/co/314105.htm
固安捷（中国）工业品有限公司,http://www.11467.com/shanghai/co/518095.htm
上海泉保行实验室设备有限公司,http://www.11467.com/shanghai/co/804627.htm
上海科锐实业有限公司金山区销售部,http://www.11467.com/shanghai/co/424201.htm
上海林频科技发展有限公司厂,http://www.11467.com/shanghai/co/507729.htm
上海晋名实业有限公司销售部,http://www.11467.com/shanghai/co/668479.htm
上海晋名实业有限公司销售二部,http://www.11467.com/shanghai/co/668478.htm
上海人和科学仪器有限公司市场部,http://www.11467.com/shanghai/co/938446.htm
上海宏翔实验室装备有限公司（生产厂家）,http://www.11467.com/shanghai/co/668683.htm
上海乾志实验设备有限公司,http://www.11467.com/shanghai/co/668678.htm
上海乾亚科技发展有限公司,http://www.11467.com/shanghai/co/1046419.htm
上海对外劳务经贸合作有限公司贸易部,http://www.11467.com/shanghai/co/376812.htm
上海九牛化工原料有限公司,http://www.11467.com/shanghai/co/316933.htm
上海人和科学仪器有限公司销售部,http://www.11467.com/shanghai/co/938448.htm
上海伟贞实业有限公司,http://www.11467.com/shanghai/co/40131.htm
上海夏为实验设备有限公司,http://www.11467.com/shanghai/co/316920.htm
上海安泉气候试验设备有限公司,http://www.11467.com/shanghai/co/316923.htm
上海依普监实验室设备公司,http://www.11467.com/shanghai/co/668487.htm
上海新瀚家具有限公司,http://www.11467.com/shanghai/co/518094.htm
上海喻勉实验室设备有限公司销售部,http://www.11467.com/shanghai/co/40508.htm
上海三叶虫软件科技有限公司,http://www.11467.com/shanghai/co/738100.htm
上海朴诚实验室设备有限公司 （销售部）,http://www.11467.com/shanghai/co/668519.htm
上海朴诚实验室设备有限公司 销售部,http://www.11467.com/shanghai/co/668680.htm
上海志泽生物科技发展有限责任公司,http://www.11467.com/shanghai/co/316921.htm
上海振宇化工科技有限公司北京分公司,http://www.11467.com/shanghai/co/518127.htm
上海仲远化学品贸易有限公司,http://www.11467.com/shanghai/co/738115.htm
上海遵捷实验设备有限公司,http://www.11467.com/shanghai/co/938450.htm
天津市德固特发展有限公司,http://www.11467.com/tianjin/co/140942.htm
天津市福缘鑫荣玻璃仪器销售有限公司,http://www.11467.com/tianjin/co/15684.htm
天津华一诺实验室设备有限公司,http://www.11467.com/tianjin/co/200778.htm
天津辉创工贸有限公司,http://www.11467.com/tianjin/co/141656.htm
专一工贸公司,http://www.11467.com/tianjin/co/61896.htm
天津英科联合科技有限公司,http://www.11467.com/tianjin/co/188205.htm
天津市富缔豪实验室家具有限公司,http://www.11467.com/tianjin/co/188204.htm
永源天津实验室设备有限公司,http://www.11467.com/tianjin/co/188223.htm
五环科技公司,http://www.11467.com/tianjin/co/140927.htm
北京北分瑞利分析仪器（集团）有限责任公司重庆办事处,http://www.11467.com/chongqing/co/193229.htm
重庆利迪实验仪器设备有限公司销售部,http://www.11467.com/chongqing/co/125221.htm
重庆劲旗科技发展有限公司,http://www.11467.com/chongqing/co/78102.htm
重庆瑞进公共安全设备有限公司,http://www.11467.com/chongqing/co/12676.htm
自贡旭东管道配件有限公司,http://www.11467.com/chongqing/co/19216.htm
上海金华鹏实验室工程技术有限公司,http://www.11467.com/shanghai/co/1066441.htm
天津中仁恒大科技公司,http://www.11467.com/tianjin/co/300175.htm
天津恒泽机械设备有限公司,http://www.11467.com/tianjin/co/300598.htm
昆山莱柏仪器设备有限公司,http://www.11467.com/suzhou/co/360223.htm
上海书培实验设备有限公司,http://www.11467.com/shanghai/co/1082973.htm
上海凌科实业发展有限公司,http://www.11467.com/shanghai/co/1083044.htm
上海微行炉业有限公司业务部,http://www.11467.com/suzhou/co/404611.htm
上海屹上脚轮有限公司,http://www.11467.com/shanghai/co/1101970.htm
山西昌凯实验室设备有限公司,http://www.11467.com/taiyuan/co/127954.htm
嘉兴市盛德化工公司,http://www.11467.com/jiaxing/co/84049.htm
东方特钢股份有限公司,http://www.11467.com/jiaxing/co/84048.htm
济南金恒翔机电设备有限公司,http://www.11467.com/jinan/co/81413.htm
济南德瑞克仪器公司,http://www.11467.com/jinan/co/81412.htm
济南三泉中石实验仪器有限公司销售部,http://www.11467.com/jinan/co/81609.htm
济南世纪嘉蓝实验室装备有限公司(业务二部),http://www.11467.com/jinan/co/81610.htm
济南杰诚贸易有限公司,http://www.11467.com/jinan/co/81411.htm
济南世纪嘉蓝实验室装备有限公司(销售部),http://www.11467.com/jinan/co/81409.htm
开封市三兴化工设备有限公司,http://www.11467.com/kaifeng/co/14969.htm
昆明卓弈化工技术有限公司,http://www.11467.com/kunming/co/105723.htm
莱芜市奥星工贸有限公司,http://www.11467.com/laiwu/co/10913.htm
廊坊迪远仪器有限责任公司,http://www.11467.com/langfang/co/30698.htm
兰州中科安泰分析科技有限责任公司,http://www.11467.com/lanzhou/co/67695.htm
洛阳市意隆商贸有限公司,http://www.11467.com/luoyang/co/49289.htm
江西南昌汗城化工有限公司,http://www.11467.com/nanchang/co/88619.htm
南京冉然添成干燥设备有限公司,http://www.11467.com/nanjing/co/76304.htm
南京滨浦仪器设备有限公司,http://www.11467.com/nanjing/co/51505.htm
南京市日易化工有限公司,http://www.11467.com/nanjing/co/73205.htm
同仁实业有限公司,http://www.11467.com/nanjing/co/73469.htm
南京幕府石化科研设备有限公司,http://www.11467.com/nanjing/co/36794.htm
南京格迪机电设备有限公司,http://www.11467.com/nanjing/co/153796.htm
南京泛保科技有限公司,http://www.11467.com/nanjing/co/37485.htm
南通开发区锡通五交化有限公司,http://www.11467.com/nantong/co/60454.htm
启东市长江机电有限公司,http://www.11467.com/nantong/co/138140.htm
启东市华宇机械制造有限公司,http://www.11467.com/nantong/co/99536.htm
宁波安之信化试有限公司,http://www.11467.com/ningbo/co/70472.htm
青岛世纪星化学试剂有限公司 销售部,http://www.11467.com/qingdao/co/88959.htm
青岛海通联合国际贸易有限公司,http://www.11467.com/qingdao/co/89171.htm
青岛中和实验室技术装备有限公司,http://www.11467.com/qingdao/co/88984.htm
青岛机电科技股份有限公司,http://www.11467.com/qingdao/co/88958.htm
衢州欧思仪仪器有限公司,http://www.11467.com/quzhou/co/26883.htm
衢州市静尔化工有限公司,http://www.11467.com/quzhou/co/12736.htm
沈阳瑞欣教学仪器有限公司,http://www.11467.com/shenyang/co/60640.htm
庞氏涂料有限公司,http://www.11467.com/shenyang/co/60644.htm
东莞市科正达实验室设备有限公司,http://www.11467.com/shenzhen/co/369576.htm
峰鸟科技有限公司,http://www.11467.com/shenzhen/co/369563.htm
深圳吉美泰电子有限公司,http://www.11467.com/shenzhen/co/369548.htm
海能化工有限公司,http://www.11467.com/shenzhen/co/372493.htm
艾伦赛恩（香港）有限公司(业务部),http://www.11467.com/shenzhen/co/137616.htm
华尔宝机械(深圳)有限公司,http://www.11467.com/shenzhen/co/482046.htm
深圳市 腾龙源实业有限公司,http://www.11467.com/shenzhen/co/369547.htm
深圳铭科化工有限公司,http://www.11467.com/shenzhen/co/372487.htm
深圳理想实验室设备有限公司,http://www.11467.com/shenzhen/co/372477.htm
武汉合联化工有限责任公司,http://www.11467.com/wuhan/co/75395.htm
武汉元亨化工有限公司,http://www.11467.com/wuhan/co/75391.htm
武汉华欣贸易公司,http://www.11467.com/wuhan/co/75392.htm
武汉中一科教传媒有限公司,http://www.11467.com/wuhan/co/75684.htm
武汉神州伟业科技发展有限公司,http://www.11467.com/wuhan/co/40683.htm
武汉市沈玻化工有限公司,http://www.11467.com/wuhan/co/75662.htm
乌鲁木齐市康洁新工贸有限责任公司,http://www.11467.com/wulumuqi/co/92246.htm
无锡万平不锈钢有限公司,http://www.11467.com/wuxi/co/188565.htm
宜兴市天源实验装备有限公司,http://www.11467.com/wuxi/co/171369.htm
无锡市中天科学仪器有限公司,http://www.11467.com/wuxi/co/154834.htm
无锡市同创环境试验设备有限公司,http://www.11467.com/wuxi/co/188807.htm
厦门新梦往实验室技术有限公司,http://www.11467.com/xiamen/co/96614.htm
陕西华美新仪器设备有限公司,http://www.11467.com/xian/co/47956.htm
西安禾普生物科技有限公司,http://www.11467.com/xian/co/63825.htm
西安惠尔公司,http://www.11467.com/xian/co/63929.htm
湘潭市华菱钢铁有限公司,http://www.11467.com/xiangtan/co/24165.htm
咸阳西北地勘机械有限公司(销售部),http://www.11467.com/xianyang/co/21519.htm
湖北泰维医疗科技有限公司,http://www.11467.com/xiaogan/co/19935.htm
邢台中测仪器设备有限公司营业部,http://www.11467.com/xintai/co/34366.htm
新乡诚德气体公司,http://www.11467.com/xinxiang/co/21721.htm
徐州家嘉化玻仪器有限公司,http://www.11467.com/xuzhou/co/55202.htm
扬州瑞邦化工技术有限公司工程部,http://www.11467.com/yangzhou/co/80973.htm
烟台利丰机械有限公司销售部,http://www.11467.com/yantai/co/123696.htm
湖北宜昌市兴发思商贸有限责任公司,http://www.11467.com/yichang/co/44762.htm
岳阳市帝昂科技有限公司,http://www.11467.com/yueyang/co/32446.htm
湖南长恒信通公司,http://www.11467.com/yueyang/co/32447.htm
南工化工有限公司,http://www.11467.com/yunfu/co/21850.htm
洛阳润通工业油脂有限公司,http://www.11467.com/zhengzhou/co/112575.htm
南北设备有限公司,http://www.11467.com/zhengzhou/co/112590.htm
神合化工中心 六环化工有限公司,http://www.11467.com/zhongshan/co/73844.htm
金树焊接设备（中山）有限公司,http://www.11467.com/zhongshan/co/73857.htm
龙胜化妆品机械设备有限公司,http://www.11467.com/zhongshan/co/73616.htm
淄博科达防腐设备有限公司,http://www.11467.com/zibo/co/60483.htm
淄博长昌机械有限公司,http://www.11467.com/zibo/co/74281.htm
北京安通立业有限公司,http://www.11467.com/beijing/co/103061.htm
北京博渊精准科技发展有限公司销售部,http://www.11467.com/beijing/co/103310.htm
北京格瑞盾科技有限公司 销售部,http://www.11467.com/beijing/co/103308.htm
北京国马斯尔福实验室设备有限公司,http://www.11467.com/beijing/co/487797.htm
北京开迈瑞达科贸有限公司,http://www.11467.com/beijing/co/671926.htm
北京朝阳高科应用技术研究所有限公司化工部,http://www.11467.com/beijing/co/27066.htm
北京赛必达科技有限公司,http://www.11467.com/beijing/co/404894.htm
北京华佳美玻璃仪器有限公司,http://www.11467.com/beijing/co/103279.htm
北京东南仪诚实验室设备有限公司学清路营业部,http://www.11467.com/beijing/co/404895.htm
北京世安科兴科技开发有限责任公司销售部ls,http://www.11467.com/beijing/co/671906.htm
北京实验室家具有限公司,http://www.11467.com/beijing/co/103309.htm
北京市洛可天成教学仪器有限责任公司,http://www.11467.com/beijing/co/556794.htm
北京思梦美公司,http://www.11467.com/beijing/co/404838.htm
北京灏汇公司,http://www.11467.com/beijing/co/651306.htm
美国迈尔斯真空设备有限公司,http://www.11467.com/beijing/co/405058.htm
太极计算机股份有限公司分析仪表部,http://www.11467.com/beijing/co/404840.htm
西盟国际集团有限公司,http://www.11467.com/beijing/co/312482.htm
香港科汇科仪有限公司北京办事处,http://www.11467.com/beijing/co/404839.htm
天舟海泰(北京)科技有限公司,http://www.11467.com/beijing/co/404837.htm
上海树立仪器仪表有限公司北京办事处,http://www.11467.com/beijing/co/103278.htm
北京昆仑永泰科技有限公司,http://www.11467.com/beijing/co/404841.htm
国药集团化学试剂有限公司销售部,http://www.11467.com/shanghai/co/247562.htm
上海亨代劳仪器有限公司业务部,http://www.11467.com/shanghai/co/668481.htm
上海麦诚工程设备有限公司,http://www.11467.com/shanghai/co/668483.htm
上海博舜生物科技有限公司,http://www.11467.com/shanghai/co/518093.htm
上海博通化学科技有限公司,http://www.11467.com/shanghai/co/938467.htm
德国西科有限公司（上海郑世贸易有限公司）,http://www.11467.com/shanghai/co/938451.htm
上海鸣浩仪器科技有限公司,http://www.11467.com/shanghai/co/938445.htm
上海漠王科技有限公司,http://www.11467.com/shanghai/co/214872.htm
上海叠峰实业有限公司总公司,http://www.11467.com/shanghai/co/932851.htm
上海亘泽科贸有限公司,http://www.11467.com/shanghai/co/24244.htm
上海科恩化工科技有限公司,http://www.11467.com/shanghai/co/504131.htm
上海热马试验设备有限公司,http://www.11467.com/shanghai/co/738152.htm
上海杰真实验净化设备工程有限公司,http://www.11467.com/shanghai/co/668482.htm
上海宏翔实验装备有限公司,http://www.11467.com/shanghai/co/668486.htm
上海市凡展衡器有限公司,http://www.11467.com/shanghai/co/884533.htm
上海宏翔实验室设备有限公司,http://www.11467.com/shanghai/co/668679.htm
上海索奥检测仪器有限公司,http://www.11467.com/shanghai/co/317047.htm
上海琪丰实验仪器有限公司,http://www.11467.com/shanghai/co/317048.htm
上海腾硕科技设备有限公司（销售部）,http://www.11467.com/shanghai/co/738099.htm
上海曦诚实验设备有限公司销售部,http://www.11467.com/shanghai/co/738154.htm
上海依普监实验室设备有限公司（业务部）,http://www.11467.com/shanghai/co/668520.htm
苏州雷蒙特科学实验室设备有限公司上海办事处,http://www.11467.com/shanghai/co/938506.htm
新求真设备检测有限公司,http://www.11467.com/shanghai/co/40509.htm
上海统和化工有限公司,http://www.11467.com/shanghai/co/316924.htm
英美科自动化设备（上海）有限公司,http://www.11467.com/shanghai/co/832743.htm
上海遵捷实验设备有限公司销售部,http://www.11467.com/shanghai/co/938457.htm
上海禾汽化工科技（玻璃仪器）有限公司,http://www.11467.com/shanghai/co/884640.htm
