东莞市鹏鲲自动化设备有限公司,http://www.11467.com/dongguan/co/273874.htm
深圳市博大精科技实业有限公司,http://www.11467.com/shenzhen/co/111041.htm
上海麦诚工程配套设备有限公司,http://www.11467.com/shanghai/co/668534.htm
岐昱实业（上海）有限公司,http://www.11467.com/shanghai/co/1036373.htm
莱州市力创化工机械有限公司,http://www.11467.com/yantai/co/147718.htm
上海佳熹仪器有限公司,http://www.11467.com/shanghai/co/316963.htm
广州市朗森实验室设备有限公司,http://www.11467.com/guangzhou/co/115403.htm
常州市华夏环境试验设备有限公司,http://www.11467.com/changzhou/co/101811.htm
长沙太康仪器设备有限公司,http://www.11467.com/changsha/co/82309.htm
宁波市鄞州哈迈仪器科技有限公司,http://www.11467.com/ningbo/co/93562.htm
常州市泰达化工设备有限公司,http://www.11467.com/changzhou/co/17810.htm
大连庞德克斯国际贸易有限公司,http://www.11467.com/dalian/co/46383.htm
天津市建仪试验机有限责任公司,http://www.11467.com/tianjin/co/99032.htm
镇江日泰生物工程设备有限公司,http://www.11467.com/zhenjiang/co/48604.htm
江苏华璨光电科技有限公司,http://www.11467.com/nantong/co/137687.htm
常州万泰天平仪器有限公司,http://www.11467.com/changzhou/co/101889.htm
常州市常顺精细化学品有限公司科技研究所,http://www.11467.com/changzhou/co/7371.htm
上海臣明化工有限公司,http://www.11467.com/shanghai/co/425550.htm
苏州辉光仓储物流设备有限公司,http://www.11467.com/suzhou/co/236340.htm
厦门天机自动化有限公司,http://www.11467.com/xiamen/co/51745.htm
西安超杰生物科技有限公司,http://www.11467.com/xian/co/48088.htm
东营市永雄科技有限责任公司,http://www.11467.com/dongying/co/17964.htm
广州市贝亚德环境试验设备有限公司,http://www.11467.com/guangzhou/co/246347.htm
深圳市菲士能净化科技有限公司,http://www.11467.com/shenzhen/co/117389.htm
深圳市铭锐祥自动化设备有限公司,http://www.11467.com/shenzhen/co/729049.htm
东莞市佳合实验室设备有限公司,http://www.11467.com/dongguan/co/410468.htm
深圳市晶科诺尔自动化科技有限公司,http://www.11467.com/shenzhen/co/731704.htm
宁波市鄞州哈迈仪器科技有限公司,http://www.11467.com/ningbo/co/93562.htm
常州澳华仪器有限公司,http://www.11467.com/changzhou/co/129564.htm
湖州联信自动化设备有限公司,http://www.11467.com/huzhou/co/50522.htm
常州市天润空气分离科技有限公司,http://www.11467.com/changzhou/co/50880.htm
金坛市金祥龙电子有限公司,http://www.11467.com/changzhou/co/152709.htm
常州市健辉商贸有限公司,http://www.11467.com/changzhou/co/91935.htm
天津永利达实验室设备有限公司,http://www.11467.com/tianjin/co/196334.htm
广东普洛测控科技有限公司,http://www.11467.com/dongguan/co/562283.htm
大连蓝天中意科技有限公司,http://www.11467.com/dalian/co/45129.htm
东莞市韦思仪器科技有限公司,http://www.11467.com/dongguan/co/488805.htm
广州鸿富化工有限公司,http://www.11467.com/guangzhou/co/246350.htm
广州市康慕安电子科技有限公司,http://www.11467.com/guangzhou/co/495640.htm
常州协信机械制造有限公司,http://www.11467.com/changzhou/co/87829.htm
南宁德江贸易有限公司,http://www.11467.com/nanning/co/79026.htm
上海智翅设备有限公司,http://www.11467.com/shanghai/co/1259981.htm
无锡环宇电气有限责任公司,http://www.11467.com/wuxi/co/177051.htm
苏州贝迪实验室系统工程有限公司,http://www.11467.com/suzhou/co/268892.htm
湘潭市仪器仪表有限公司,http://www.11467.com/xiangtan/co/4246.htm
武汉市腾兴实验仪器有限公司,http://www.11467.com/wuhan/co/75398.htm
苏州江东精密仪器有限公司,http://www.11467.com/suzhou/co/224561.htm
潍坊三水检验设备有限公司,http://www.11467.com/weifang/co/65216.htm
杭州一森机械设备有限公司,http://www.11467.com/hangzhou/co/205595.htm
无锡欧瑞普科技有限公司,http://www.11467.com/wuxi/co/190572.htm
西安德派生物科技有限公司,http://www.11467.com/xian/co/63927.htm
武汉明思克化工仪器有限公司,http://www.11467.com/wuhan/co/75385.htm
菏泽市精科仪器有限公司,http://www.11467.com/heze/co/18605.htm
乌鲁木齐鑫源诚业商贸有限公司,http://www.11467.com/wulumuqi/co/92245.htm
威海宏协化工机械有限公司,http://www.11467.com/weihai/co/30708.htm
苏州市铭宇精密测量仪器有限公司,http://www.11467.com/suzhou/co/269781.htm
杭州金诺实验设备有限公司,http://www.11467.com/hangzhou/co/311361.htm
昆山东之迅仪器设备有限公司,http://www.11467.com/suzhou/co/314186.htm
无锡聚峰实验系统有限公司,http://www.11467.com/wuxi/co/245007.htm
张家港市诚嘉机械有限公司,http://www.11467.com/suzhou/co/322187.htm
深圳市怡华新电子有限公司,http://www.11467.com/shenzhen/co/370313.htm
深圳市兴鸿联科技有限公司,http://www.11467.com/shenzhen/co/578826.htm
广州源霸机械设备有限公司,http://www.11467.com/guangzhou/co/111002.htm
广州市予华仪器有限公司,http://www.11467.com/guangzhou/co/248127.htm
深圳市恒信冷冻设备有限公司,http://www.11467.com/shenzhen/co/63346.htm
兰州中鹏仪器设备制造有限公司,http://www.11467.com/lanzhou/co/63977.htm
无锡艾迪斯自动化设备有限公司,http://www.11467.com/wuxi/co/244712.htm
新梦往(厦门)实验室工程技术有限公司,http://www.11467.com/xiamen/co/13451.htm
深圳市龙利鑫贸易有限公司,http://www.11467.com/shenzhen/co/369544.htm
石家庄丙火机械设备有限公司,http://www.11467.com/shijiazhuang/co/109335.htm
张家港市丁氏机械有限公司,http://www.11467.com/suzhou/co/314113.htm
深圳市佳博特实验设备有限公司,http://www.11467.com/shenzhen/co/770792.htm
深圳市汇沃科技有限公司,http://www.11467.com/shenzhen/co/724763.htm
泰兴市斯美特医疗器械有限公司,http://www.11467.com/taizhoushi/co/49734.htm
乌鲁木齐市凝晶质远环保有限责任公司,http://www.11467.com/wulumuqi/co/91166.htm
太仓保诺化工设备有限公司,http://www.11467.com/suzhou/co/298484.htm
苏州市苏搪化工装备有限责任公司,http://www.11467.com/suzhou/co/165563.htm
深圳市嘉曼工业设备有限公司,http://www.11467.com/shenzhen/co/484008.htm
南京垒君达超声电子设备有限公司,http://www.11467.com/nanjing/co/51508.htm
无锡市健康针纺机械有限公司,http://www.11467.com/wuxi/co/194046.htm
山东东易日盛仪器有限公司,http://www.11467.com/heze/co/59618.htm
河南九和共创仪器有限公司,http://www.11467.com/zhengzhou/co/187585.htm
郑州标和仪器有限公司,http://www.11467.com/zhengzhou/co/222832.htm
郑州华特仪器设备有限公司,http://www.11467.com/zhengzhou/co/183205.htm
深圳市超杰实验仪器有限公司,http://www.11467.com/shenzhen/co/831664.htm
天津市研途实验仪器开发有限公司,http://www.11467.com/tianjin/co/276953.htm
亚速旺(上海)商贸有限公司,http://www.11467.com/shanghai/co/468762.htm
莱州市昌龙化工机械有限公司,http://www.11467.com/yantai/co/176181.htm
新乡市绿声通用机械设备制造有限公司,http://www.11467.com/xinxiang/co/30146.htm
上海鸿经生物仪器制造有限公司,http://www.11467.com/shanghai/co/40528.htm
南京国轩机械设备有限公司,http://www.11467.com/nanjing/co/186975.htm
上海卧宏生物科技有限公司,http://www.11467.com/shanghai/co/1266851.htm
上海夏元仪器有限公司,http://www.11467.com/shanghai/co/668535.htm
上海泛润化工科技有限公司,http://www.11467.com/shanghai/co/668533.htm
上海倍而利实验室家具有限公司,http://www.11467.com/shanghai/co/316950.htm
烟台天一化工实验设备有限公司,http://www.11467.com/yantai/co/123711.htm
武汉拓普实验室设备有限公司昆明分公司,http://www.11467.com/kunming/co/105721.htm
新乡市启航过滤筛分机械有限公司,http://www.11467.com/xinxiang/co/23432.htm
湖南金蓉园仪器有限公司,http://www.11467.com/changsha/co/83676.htm
郑州长城仪器有限公司,http://www.11467.com/zhengzhou/co/148415.htm
淄博搪釜化工设备有限公司,http://www.11467.com/zibo/co/109019.htm
四川创越实验设备有限公司,http://www.11467.com/chengdu/co/294670.htm
徐州隆宇电子仪器有限责任公司,http://www.11467.com/xuzhou/co/12467.htm
上海名大化工有限公司,http://www.11467.com/shanghai/co/833234.htm
上海易泰化工设备制造有限公司,http://www.11467.com/shanghai/co/518092.htm
淄博纽凯机电设备有限公司,http://www.11467.com/zibo/co/97643.htm
万德分（北京）科技有限公司,http://www.11467.com/beijing/co/761909.htm
北京欣惠泽奥科技有限公司,http://www.11467.com/beijing/co/84317.htm
上海康奇实业有限公司,http://www.11467.com/shanghai/co/213178.htm
淄博博山龙康电机有限公司,http://www.11467.com/zibo/co/66850.htm
山东龙兴化工机械集团莱州有限公司,http://www.11467.com/yantai/co/188654.htm
上海力丽贸易有限公司,http://www.11467.com/shanghai/co/85029.htm
邯郸市源利科学器材有限公司,http://www.11467.com/handan/co/50625.htm
杭州米克化工仪器有限公司,http://www.11467.com/hangzhou/co/246579.htm
苏州柏兆科学仪器有限公司,http://www.11467.com/suzhou/co/219731.htm
鞍山市诚信化学试剂有限公司,http://www.11467.com/anshan/co/9782.htm
大连凯美化工工程配套有限公司,http://www.11467.com/dalian/co/66058.htm
上海科济实验室设备有限公司,http://www.11467.com/shanghai/co/425551.htm
河北方盾仪器有限公司,http://www.11467.com/xintai/co/104889.htm
上海传玻玻璃仪器制造有限公司,http://www.11467.com/shanghai/co/1010019.htm
淄博双联仪器有限公司,http://www.11467.com/zibo/co/102.htm
东莞市岛津化玻仪器有限公司,http://www.11467.com/dongguan/co/555861.htm
广州市艾比锡科技有限公司,http://www.11467.com/guangzhou/co/246346.htm
湖南湘汇机械科技有限公司,http://www.11467.com/changsha/co/133076.htm
郑州科泰实验设备有限公司,http://www.11467.com/zhengzhou/co/172877.htm
上海保玲仪器设备有限公司,http://www.11467.com/shanghai/co/1304911.htm
上海摩翱实验设备有限公司,http://www.11467.com/shanghai/co/938473.htm
北京化玻站生物分析技术有限公司,http://www.11467.com/beijing/co/749956.htm
天津市华银建工仪器科技有限公司,http://www.11467.com/tianjin/co/88836.htm
天津尼克仪器有限公司,http://www.11467.com/tianjin/co/300651.htm
上海连桥生物科技有限公司,http://www.11467.com/qiye/93198304.htm
天津市金昌海科工贸有限公司,http://www.11467.com/tianjin/co/308165.htm
深圳市利龙湖实业有限公司,http://www.11467.com/shenzhen/co/890094.htm
蚌埠市华光机械装备制造有限公司,http://www.11467.com/bengbu/co/18998.htm
任丘市程发石油科技有限公司,http://www.11467.com/cangzhou/co/50669.htm
长春工大检测技术有限责任公司,http://www.11467.com/changchun/co/73351.htm
长沙隆泰微波热工有限公司,http://www.11467.com/changsha/co/71058.htm
湖南迈迪科新材有限公司,http://www.11467.com/changsha/co/82057.htm
常州化工设备有限公司,http://www.11467.com/changzhou/co/91934.htm
常州钇金环保科技有限公司,http://www.11467.com/changzhou/co/148421.htm
江苏正基仪器有限公司,http://www.11467.com/changzhou/co/148996.htm
建研建材有限公司,http://www.11467.com/chaoyang/co/26266.htm
成都德力斯实业有限公司,http://www.11467.com/chengdu/co/141803.htm
南京韩威南冷制冷集团有限公司成都办事处,http://www.11467.com/chengdu/co/100598.htm
东莞市晨晖经贸化工有限公司,http://www.11467.com/dongguan/co/232363.htm
东莞市贺利电子科技有限公司,http://www.11467.com/dongguan/co/121884.htm
广东电子器材有限公司,http://www.11467.com/guangzhou/co/241076.htm
广州市恒申贸易有限公司,http://www.11467.com/guangzhou/co/2257.htm
广州市金华大化学试剂有限公司,http://www.11467.com/guangzhou/co/246358.htm
广州天卓实验室设备科技有限公司,http://www.11467.com/guangzhou/co/460045.htm
德帕姆(杭州)泵业科技有限公司,http://www.11467.com/hangzhou/co/257391.htm
杭州福达除湿设备有限公司,http://www.11467.com/hangzhou/co/207234.htm
山东风云国际集团有限公司,http://www.11467.com/jinan/co/81407.htm
浙江金华友谊实业有限公司,http://www.11467.com/jinhua/co/73736.htm
昆明永宝贸易有限公司,http://www.11467.com/kunming/co/105738.htm
连云港佰特科技有限公司－销售部,http://www.11467.com/lianyungang/co/28422.htm
山东聊城科威化工有限公司,http://www.11467.com/liaocheng/co/28916.htm
南京富岛信息工程有限公司,http://www.11467.com/nanjing/co/38296.htm
南京先欧仪器制造有限公司,http://www.11467.com/nanjing/co/51514.htm
南京三乐微波技术发展有限公司,http://www.11467.com/nanjing/co/50189.htm
深圳金铭志实验设备科技有限公司南宁分公司,http://www.11467.com/nanning/co/86170.htm
青岛金泰来实验室设备有限公司,http://www.11467.com/qingdao/co/62417.htm
科诚分析仪器公司,http://www.11467.com/shizuishan/co/9675.htm
常熟菲尔实验设备有限公司,http://www.11467.com/suzhou/co/322487.htm
苏州晟宇气体设备有限公司,http://www.11467.com/suzhou/co/318216.htm
威海化工机械有限公司,http://www.11467.com/weihai/co/30729.htm
湖北道维斯科技发展有限公司,http://www.11467.com/wuhan/co/109872.htm
武汉市熊谷科技有限公司,http://www.11467.com/wuhan/co/83585.htm
芜湖九棋教育科技有限公司,http://www.11467.com/wuhu/co/25447.htm
上海申生科技有限公司,http://www.11467.com/zhongshan/co/117572.htm
江西兴业机械制造有限公司,http://www.11467.com/ganzhou/co/29930.htm
南京天塔机械设备有限公司,http://www.11467.com/nanjing/co/153203.htm
山东省青州市恒冠机械制造有限公司,http://www.11467.com/weifang/co/117370.htm
安庆市卓越化学试剂仪器有限公司,http://www.11467.com/anqing/co/24012.htm
中国河北一川胶带有限公司,http://www.11467.com/baoding/co/57503.htm
滨州市宏远仪器试剂有限公司,http://www.11467.com/binzhou/co/18528.htm
沧州市众邦水处理技术有限公司,http://www.11467.com/cangzhou/co/38718.htm
河北南皮仪器仪表有限公司,http://www.11467.com/cangzhou/co/57428.htm
北京富奇德弘科技有限公司长春办事处,http://www.11467.com/changchun/co/73296.htm
长春市天宇汇成科贸有限公司,http://www.11467.com/changchun/co/73350.htm
长沙海宝电子科技有限公司,http://www.11467.com/changsha/co/69901.htm
长沙市原鹏化工科技有限公司,http://www.11467.com/changsha/co/117470.htm
长沙永航仪器设备有限公司,http://www.11467.com/changsha/co/119504.htm
青岛科宇生物工程有限公司,http://www.11467.com/qingdao/co/64926.htm
秦皇岛金欧化工机械有限公司,http://www.11467.com/qinhuangdao/co/45833.htm
衢州市申科分析技术服务有限公司,http://www.11467.com/quzhou/co/15866.htm
深圳市计测检测设备有限公司,http://www.11467.com/shenzhen/co/476325.htm
深圳市河山新材料有限公司,http://www.11467.com/shenzhen/co/369898.htm
深圳市洁美佳实验室设备有限公司,http://www.11467.com/shenzhen/co/369739.htm
深圳延熙化工有限公司,http://www.11467.com/shenzhen/co/372326.htm
能杰电源系统（深圳）有限公司,http://www.11467.com/shenzhen/co/372473.htm
苏州珀西瓦尔实验设备有限公司,http://www.11467.com/suzhou/co/318574.htm
苏州格力特实验室系统工程有限公司,http://www.11467.com/suzhou/co/227038.htm
泰州华瑞电子专用设备有限公司,http://www.11467.com/taizhoushi/co/894.htm
泰州市苏京实验仪器科技有限公司,http://www.11467.com/taizhoushi/co/34989.htm
唐山轨道客车有限责任公司,http://www.11467.com/tangshan/co/56191.htm
威海市试验机制造有限公司,http://www.11467.com/weihai/co/3490.htm
无锡云通石化装备有限公司,http://www.11467.com/wuxi/co/152789.htm
宜兴市格林达化工有限公司,http://www.11467.com/wuxi/co/216889.htm
厦门市湖里区绿展实验仪器有限公司,http://www.11467.com/xiamen/co/46866.htm
厦门义旭实验室设备有限公司,http://www.11467.com/xiamen/co/46837.htm
西安常仪仪器有限公司,http://www.11467.com/xian/co/123763.htm
盐城市春雨化工贸易有限公司,http://www.11467.com/yancheng/co/79057.htm
山东博精化工机械有限公司,http://www.11467.com/zibo/co/74095.htm
淄博搪联化工装备有限公司,http://www.11467.com/zibo/co/46320.htm
北京东方仿真控制技术有限公司,http://www.11467.com/beijing/co/103280.htm
北京爱普华美生物科技有限公司,http://www.11467.com/beijing/co/404843.htm
上海特弗实验室设备有限公司,http://www.11467.com/shanghai/co/938447.htm
北京鼎国生物技术有限责任公司,http://www.11467.com/shanghai/co/85031.htm
布劳恩惰性气体系统（上海）有限公司,http://www.11467.com/shanghai/co/603801.htm
上海中育实验设备有限公司,http://www.11467.com/shanghai/co/884641.htm
洛阳奥百思特水泥技术有限公司,http://www.11467.com/luoyang/co/68144.htm
天津市奥淇医科医药销售有限公司,http://www.11467.com/tianjin/co/302125.htm
北京德斯莱科技有限公司,http://www.11467.com/beijing/co/749961.htm
东莞市曾氏化工贸易有限公司,http://www.11467.com/dongguan/co/233959.htm
亿恒电子仪器贸易有限公司,http://www.11467.com/dongguan/co/141287.htm
利拿机械实业有限公司,http://www.11467.com/dongguan/co/493461.htm
东营浩纯商贸有限公司,http://www.11467.com/dongying/co/38984.htm
福州申辉贸易有限公司,http://www.11467.com/fuzhou/co/125641.htm
广州邦太自动化科技有限公司,http://www.11467.com/guangzhou/co/457747.htm
广视通科教设备有限公司,http://www.11467.com/guangzhou/co/246357.htm
广州比朗仪器有限公司,http://www.11467.com/guangzhou/co/457581.htm
广州豪贝实验设备有限公司市场部,http://www.11467.com/guangzhou/co/246356.htm
广州佳鎂铧实验室设备有限公司,http://www.11467.com/guangzhou/co/247362.htm
广州欧佩科化工贸易有限公司,http://www.11467.com/guangzhou/co/247277.htm
北京伊特克斯惰性气体有限公司,http://www.11467.com/guangzhou/co/246353.htm
广州市奥成商贸有限公司,http://www.11467.com/guangzhou/co/122785.htm
广州纪雅化工有限公司,http://www.11467.com/guangzhou/co/247281.htm
广州市新杰自动化设备有限公司,http://www.11467.com/guangzhou/co/276548.htm
广州雷得生物技术有限公司,http://www.11467.com/guangzhou/co/36802.htm
广州万宝特种设备有限公司,http://www.11467.com/guangzhou/co/246364.htm
广州市琪运化工有限公司,http://www.11467.com/guangzhou/co/246365.htm
广州市麦得森实验室设备有限公司,http://www.11467.com/guangzhou/co/246504.htm
广州伟昌实验设备科技有限公司销售部,http://www.11467.com/guangzhou/co/247364.htm
广州市纬欣实验仪器设备有限公司,http://www.11467.com/guangzhou/co/246361.htm
广州四面体商贸有限公司,http://www.11467.com/guangzhou/co/246503.htm
上海孚太气体设备有限公司广州办事处,http://www.11467.com/guangzhou/co/247361.htm
深圳木人科技实业有限公司贵阳办事处,http://www.11467.com/guiyang/co/71189.htm
贵州宏森工贸发展有限公司,http://www.11467.com/guiyang/co/49552.htm
哈尔滨钧诚科技开发有限公司,http://www.11467.com/haerbin/co/48142.htm
杭州华达喷射真空设备有限公司,http://www.11467.com/hangzhou/co/128712.htm
杭州拓威尔实验室设备有限公司（业务部）,http://www.11467.com/hangzhou/co/246578.htm
杭州天谱化学科技有限公司,http://www.11467.com/hangzhou/co/246694.htm
杭州三拓印染设备技术开发设备有限公司,http://www.11467.com/hangzhou/co/246581.htm
杭州萧山宏事达化工仪器有限公司,http://www.11467.com/hangzhou/co/246517.htm
杭州利源实业有限公司,http://www.11467.com/hangzhou/co/184695.htm
杭州米克化工仪器有限公司(总公司),http://www.11467.com/hangzhou/co/246836.htm
上海贤佳实验室设备有限公司杭州办事处,http://www.11467.com/hangzhou/co/246514.htm
浙江大学智达信息工程有限公司,http://www.11467.com/hangzhou/co/57067.htm
杭州然宇实验设备制造有限公司,http://www.11467.com/hangzhou/co/246511.htm
杭州瑞森化工技术有限公司,http://www.11467.com/hangzhou/co/196921.htm
浙江中控科教仪器设备有限公司销售部,http://www.11467.com/hangzhou/co/246838.htm
鹤壁市银河分析仪器化工有限公司,http://www.11467.com/hebi/co/8854.htm
合肥天达机械工程技术有限责任公司,http://www.11467.com/hefei/co/1376.htm
合肥四拓机电科技有限公司,http://www.11467.com/hefei/co/122565.htm
上海荣海实验室设备有限公司驻合肥办事处,http://www.11467.com/hefei/co/89173.htm
衡阳市广衡宏达化工有限公司,http://www.11467.com/hengyang/co/6002.htm
河源市大邦化工有限公司,http://www.11467.com/heyuan/co/17822.htm
淮安市高科环境试验设备有限公司,http://www.11467.com/huaian/co/37313.htm
黄冈市博特化工有限公司,http://www.11467.com/huanggang/co/15659.htm
百利宏化工集团惠州联宏化工有限公司,http://www.11467.com/huizhou/co/66405.htm
新利电子公司,http://www.11467.com/huizhou/co/66295.htm
吉安市南巢建材有限公司,http://www.11467.com/jian/co/18898.htm
济南方众实验设备有限公司,http://www.11467.com/jinan/co/60726.htm
济南世纪嘉蓝实验室装备有限公司(业务部),http://www.11467.com/jinan/co/81410.htm
济南福华科技有限公司,http://www.11467.com/jinan/co/81451.htm
济南思达测试技术有限公司总部,http://www.11467.com/jinan/co/81415.htm
济南仰丰科贸有限公司,http://www.11467.com/jinan/co/60826.htm
山东朗伯光谱设备有限公司销售部,http://www.11467.com/jinan/co/81406.htm
济南思达测试技术有限公司销售,http://www.11467.com/jinan/co/81414.htm
津海科学仪器有限公司,http://www.11467.com/jingzhou/co/26787.htm
山西瑞世化工有限公司销售部,http://www.11467.com/jinzhong/co/22250.htm
昆明锦竹化工有限责任公司,http://www.11467.com/kunming/co/105787.htm
兰州林美克机械制造有限公司,http://www.11467.com/lanzhou/co/63691.htm
连云港弘大试验实验设备有限公司销售部,http://www.11467.com/lianyungang/co/28454.htm
临沂市海鑫化工设备有限公司,http://www.11467.com/linyi/co/61108.htm
深圳市东硕实验室设备有限公司,http://www.11467.com/nanchang/co/90010.htm
长沙英泰仪器有限公司（驻江浙沪办事处）,http://www.11467.com/nanjing/co/73198.htm
南京光华化玻有限公司销售部,http://www.11467.com/nanjing/co/73203.htm
南京迈迪特生物化学有限公司,http://www.11467.com/nanjing/co/73206.htm
南京凌帝仁化工科技有限公司,http://www.11467.com/nanjing/co/73470.htm
南京汉之力化工科技有限公司,http://www.11467.com/nanjing/co/66189.htm
纤可商贸有限公司,http://www.11467.com/nanjing/co/73207.htm
南京便诊公司,http://www.11467.com/nanjing/co/73468.htm
南京聚辉化学试剂有限公司,http://www.11467.com/nanjing/co/73197.htm
南宁爱拓思实验室设备有限公司,http://www.11467.com/nanning/co/86784.htm
南通通华石油化工机械工程有限公司,http://www.11467.com/nantong/co/14826.htm
海门市建翔实验仪器有限公司,http://www.11467.com/nantong/co/137495.htm
南通三鼎实验室装备有限公司,http://www.11467.com/nantong/co/105662.htm
南阳宏源化工有限现任公司,http://www.11467.com/nanyang/co/31199.htm
宁波市鄞州达泰水处理工程技术有限公司,http://www.11467.com/ningbo/co/93564.htm
平顶山市卓远工贸有限公司,http://www.11467.com/pingdingshan/co/18738.htm
青岛瑞利仪器设备有限公司技术部,http://www.11467.com/qingdao/co/88955.htm
青岛城阳欧科化工器材有限公司,http://www.11467.com/qingdao/co/88961.htm
青岛海智通科技有限公司,http://www.11467.com/qingdao/co/60156.htm
青岛三合实验室装备有限公司销售部,http://www.11467.com/qingdao/co/88957.htm
青岛康静净化消毒设备有限公司,http://www.11467.com/qingdao/co/88956.htm
厦门安力达实验室设备有限公司泉州事业部,http://www.11467.com/quanzhou/co/130999.htm
玉山县昌泰机械有限公司,http://www.11467.com/shangrao/co/25450.htm
上海新安纳电子科技有限公司,http://www.11467.com/shaoxing/co/78270.htm
沈阳市天虹机械科技有限公司,http://www.11467.com/shenyang/co/50959.htm
沈阳华豪杰泰实验室设备有限公司,http://www.11467.com/shenyang/co/97383.htm
帅呈服装公司,http://www.11467.com/shenyang/co/60641.htm
波波化工化学试剂公司,http://www.11467.com/shenzhen/co/369581.htm
上海尚田深圳分公司,http://www.11467.com/shenzhen/co/369584.htm
美达家具(深圳)有限公司,http://www.11467.com/shenzhen/co/791077.htm
美利达清洗剂有限公司,http://www.11467.com/shenzhen/co/111975.htm
深广工业气体有限公司,http://www.11467.com/shenzhen/co/369907.htm
深圳市宝安区沙井兴源化玻仪器公司,http://www.11467.com/shenzhen/co/369906.htm
深圳木人科技实业有限公司业务部,http://www.11467.com/shenzhen/co/372489.htm
