河南爱博特科技发展有限公司天津办事处,http://www.11467.com/tianjin/co/140929.htm
天津奥特赛恩斯仪器有限公司,http://www.11467.com/tianjin/co/137467.htm
天津创举化工设备有限公司,http://www.11467.com/tianjin/co/98882.htm
天津市隆延科技发展有限公司,http://www.11467.com/tianjin/co/140979.htm
天津正臣科技发展有限公司*,http://www.11467.com/tianjin/co/34820.htm
香河汇群化工设备有限公司,http://www.11467.com/tianjin/co/198251.htm
天津市盛元信达科技发展有限公司,http://www.11467.com/tianjin/co/140980.htm
重庆银河试验仪器有限公司,http://www.11467.com/chongqing/co/8293.htm
天津市劳尔科技有限公司,http://www.11467.com/tianjin/co/300355.htm
