杭州万汇国际货运代理有限公司,http://www.11467.com/hangzhou/co/240537.htm
浙大恩特软件科技有限公司,http://www.11467.com/hangzhou/co/246531.htm
浙江华光科技开发有限公司,http://www.11467.com/hangzhou/co/197957.htm
杭州希成清洗技术有限公司,http://www.11467.com/hangzhou/co/246529.htm
衡水群利橡胶有限公司,http://www.11467.com/hengshui/co/21135.htm
衡阳市昱盛工贸有限公司,http://www.11467.com/hengyang/co/25934.htm
菏泽天昊化工有限公司,http://www.11467.com/heze/co/24274.htm
愛華思科技有限公司,http://www.11467.com/huizhou/co/66291.htm
惠州市永达康装饰材料有限公司,http://www.11467.com/huizhou/co/96936.htm
江门市奥伯森涂料有限公司(芒果树漆),http://www.11467.com/jiangmen/co/115476.htm
英国美乐士制漆有限公司,http://www.11467.com/jiangmen/co/89015.htm
美国涂派(中国 广东)有限公司,http://www.11467.com/jiangmen/co/116147.htm
中山市嘉洁士化工有限公司,http://www.11467.com/jiangmen/co/116061.htm
湖北省荆门市银珠塑化有限公司,http://www.11467.com/jingmen/co/14648.htm
八戒二手油脂设备购销股份有限公司,http://www.11467.com/jining/co/73367.htm
长久二手油脂化工设备购销公司,http://www.11467.com/jining/co/73155.htm
山东新华二手设备购销公司,http://www.11467.com/jining/co/71413.htm
山东正邦二手油脂化工购销公司,http://www.11467.com/jining/co/71910.htm
山东国运二手化工购销有限公司,http://www.11467.com/jining/co/71398.htm
山东梁山崇德机电设备有限公司,http://www.11467.com/jining/co/71402.htm
山东梁山东风油脂化工设备有限公司,http://www.11467.com/jining/co/71912.htm
山东梁山益友二手油脂设备购销公司,http://www.11467.com/jining/co/72648.htm
山东胜达二手化工设备购销公司,http://www.11467.com/jining/co/72899.htm
山东恒力二手油脂设备购销公司,http://www.11467.com/jining/co/71396.htm
中鑫电机电器闲置设备回收公司,http://www.11467.com/jining/co/71907.htm
山东燚朤化工设备【机械密封】有限公司,http://www.11467.com/jining/co/71908.htm
山东汇鑫二手油脂设备购销公司,http://www.11467.com/jining/co/72331.htm
山东福通二手油脂化工设备购销公司,http://www.11467.com/jining/co/72330.htm
山东华商二手化工设备有限公司,http://www.11467.com/jining/co/72896.htm
山东梁山王根华二手油脂设备有限公司,http://www.11467.com/jining/co/72645.htm
山东继仁二手化工油脂设备购销公司,http://www.11467.com/jining/co/72647.htm
山东瑞鑫二手油脂化工设备购销公司,http://www.11467.com/jining/co/72329.htm
平顶山煤业集团开封东大化工有限公司,http://www.11467.com/kaifeng/co/14619.htm
宝城期货有限责任公司昆明营业部,http://www.11467.com/kunming/co/127670.htm
上海众诚士德科技有限公司,http://www.11467.com/kunming/co/105728.htm
廊坊好兄弟墙体艺术装饰有限公司,http://www.11467.com/langfang/co/49127.htm
鼎洋营销品牌管理有限公司,http://www.11467.com/lanzhou/co/66723.htm
兰州西部设备调剂公司,http://www.11467.com/lanzhou/co/80379.htm
连云港市永泰焊割气体有限公司,http://www.11467.com/lianyungang/co/26167.htm
临沂市海鑫化工设备有限公司,http://www.11467.com/linyi/co/61108.htm
柳州市豪杰特化工机械有限责任公司,http://www.11467.com/liuzhou/co/4709.htm
茂名市宝辉贸易有限公司A,http://www.11467.com/maoming/co/31526.htm
源峰磨料磨具有限公司,http://www.11467.com/mudanjiang/co/48388.htm
南昌太平机械有限总公司,http://www.11467.com/nanchang/co/88621.htm
南京千峰科技有限公司第一分公司,http://www.11467.com/nanjing/co/77436.htm
南京华苏石油化工有限公司,http://www.11467.com/nanjing/co/73224.htm
南京品沃科技有限公司,http://www.11467.com/nanjing/co/52258.htm
南京东方鸿运物流有限公司,http://www.11467.com/nanjing/co/73222.htm
南京耐瑟斯化工有限公司,http://www.11467.com/nanjing/co/73204.htm
南京市商业外贸有限公司,http://www.11467.com/nanjing/co/73225.htm
广西怡康化工材料有限公司,http://www.11467.com/nanning/co/65059.htm
南通大润劳务有限公司,http://www.11467.com/nantong/co/63253.htm
河北鑫利达纤维素有限公司(江苏分区),http://www.11467.com/nantong/co/137414.htm
南通时瑞塑胶制品有限公司 (市场部）,http://www.11467.com/nantong/co/101341.htm
青岛新华锦国际贸易服务有限公司,http://www.11467.com/qingdao/co/156602.htm
福建泉州协益鞋材化工有限公司,http://www.11467.com/quanzhou/co/100901.htm
泉州市亿力经贸发展有限公司,http://www.11467.com/quanzhou/co/81255.htm
衢州百诚空调设备有限公司展示中心,http://www.11467.com/quzhou/co/21869.htm
日照锦德商贸有限公司,http://www.11467.com/rizhao/co/12626.htm
宇化机械制造有限公司,http://www.11467.com/sanming/co/30551.htm
辽宁省颐鑫和进出口贸易有限公司,http://www.11467.com/shenyang/co/60653.htm
沈阳恒信机电设备有限公司,http://www.11467.com/shenyang/co/97665.htm
广东深圳正海虹涂料有限公司,http://www.11467.com/shenzhen/co/369691.htm
广东省深圳市鑫辉化工有限公司,http://www.11467.com/shenzhen/co/369682.htm
环发(天津)国际货运代理有限公司,http://www.11467.com/shenzhen/co/369665.htm
恒辉润滑油科技有限公司,http://www.11467.com/shenzhen/co/369689.htm
洁力士化工公司,http://www.11467.com/shenzhen/co/369686.htm
连邦化工原料有限公司,http://www.11467.com/shenzhen/co/369638.htm
华进联合专利商标代理有限公司商标部,http://www.11467.com/shenzhen/co/369659.htm
钜钛国际贸易(深圳)有限公司,http://www.11467.com/shenzhen/co/776399.htm
深扬电子(深圳)有限公司,http://www.11467.com/shenzhen/co/364039.htm
深圳科雄实业有限公司,http://www.11467.com/shenzhen/co/776250.htm
深圳帆顺科技有限公司,http://www.11467.com/shenzhen/co/369674.htm
深圳金塑源（隆昌）工程塑料有限公司,http://www.11467.com/shenzhen/co/369666.htm
深圳盛源通商贸有限公司,http://www.11467.com/shenzhen/co/369706.htm
深圳古兰实业有限公司,http://www.11467.com/shenzhen/co/369697.htm
深圳市宝安区天利丝印器材公司,http://www.11467.com/shenzhen/co/275041.htm
深圳森莱国际有限公司,http://www.11467.com/shenzhen/co/110851.htm
深圳市登尔辉科技有限公司,http://www.11467.com/shenzhen/co/369693.htm
日信商事贸易(深圳)有限公司,http://www.11467.com/shenzhen/co/369632.htm
华鑫达特种印刷器材有限公司,http://www.11467.com/shenzhen/co/369663.htm
深圳市德兹进出口贸易公司,http://www.11467.com/shenzhen/co/369673.htm
深圳世纪经典检测仪器有限公司,http://www.11467.com/shenzhen/co/369647.htm
深圳市翱翔科技股份有限公司,http://www.11467.com/shenzhen/co/105403.htm
深圳市好顺电工有限公司,http://www.11467.com/shenzhen/co/63413.htm
深圳市碧波制冷设备有限公司售后部,http://www.11467.com/shenzhen/co/369645.htm
千代田机工贸易有限公司,http://www.11467.com/shenzhen/co/369646.htm
深圳市富通宇科技有限公司,http://www.11467.com/shenzhen/co/369692.htm
深圳市创佳五金塑胶制品有限公司,http://www.11467.com/shenzhen/co/369642.htm
深圳市集电科技有限公司BECTRON项目部,http://www.11467.com/shenzhen/co/416129.htm
深圳市恒丰电子工具仪器有限公司,http://www.11467.com/shenzhen/co/369675.htm
深圳市兰克贸易有限公司(业务部),http://www.11467.com/shenzhen/co/369643.htm
深圳市金溢盈科技有限公司销售部,http://www.11467.com/shenzhen/co/369634.htm
深圳市凌浩天电子有限公司,http://www.11467.com/shenzhen/co/369650.htm
深圳市科广电自动化设备有限公司,http://www.11467.com/shenzhen/co/411833.htm
深圳精佳电子科技有限公司,http://www.11467.com/shenzhen/co/521564.htm
深圳巨光匠科技有限公司,http://www.11467.com/shenzhen/co/369648.htm
深圳市瑞科科技有限公司,http://www.11467.com/shenzhen/co/319485.htm
深圳市满天星国际贸易有限公司,http://www.11467.com/shenzhen/co/369684.htm
深圳市泰美乐商贸有限公司,http://www.11467.com/shenzhen/co/725807.htm
深圳市永虹达超声波设备有限公司(销售部),http://www.11467.com/shenzhen/co/111903.htm
深圳市源致科技有限公司,http://www.11467.com/shenzhen/co/369631.htm
深圳市好时日工业设备公司,http://www.11467.com/shenzhen/co/369687.htm
深圳市双玉技术有限公司,http://www.11467.com/shenzhen/co/369698.htm
深圳市新源达器材设备有限公司,http://www.11467.com/shenzhen/co/6207.htm
深圳市诸洲行进出口贸易有限公司,http://www.11467.com/shenzhen/co/338362.htm
天龙服务公司,http://www.11467.com/shenzhen/co/369678.htm
深圳市亚信光电科技有限公司,http://www.11467.com/shenzhen/co/797177.htm
深圳市智能达表面处理技术公司,http://www.11467.com/shenzhen/co/804515.htm
深圳市新杉本贸易有限公司业务部,http://www.11467.com/shenzhen/co/484367.htm
亿洋精密五金实业有限公司,http://www.11467.com/shenzhen/co/369651.htm
中通塑胶技术顾问有限公司,http://www.11467.com/shenzhen/co/99146.htm
旭精工力申实业有限公司,http://www.11467.com/shenzhen/co/499922.htm
深圳满威贸易公司,http://www.11467.com/shenzhen/co/369653.htm
河北斯威特淀粉糖技术开发有限责任公司,http://www.11467.com/shijiazhuang/co/86612.htm
随州市星火汽车零部件有限公司,http://www.11467.com/suizhou/co/11548.htm
湖北程力专用汽车有限公司销售部,http://www.11467.com/suizhou/co/11303.htm
宿迁市神工机电水暖技术服务有限公司,http://www.11467.com/suqian/co/11202.htm
昆山佰克汇贸易有限公司,http://www.11467.com/suzhou/co/317436.htm
昆山翔翎自动化工程有限公司,http://www.11467.com/suzhou/co/235063.htm
苏州市恒协机械有限公司,http://www.11467.com/suzhou/co/229737.htm
苏州飞泽电子科技有限公司,http://www.11467.com/suzhou/co/227024.htm
武略化工有限公司,http://www.11467.com/suzhou/co/227030.htm
山西科视无损检测工程技术有限公司,http://www.11467.com/taiyuan/co/84756.htm
太原诚利来表面技术有限公司,http://www.11467.com/taiyuan/co/43508.htm
太原市鑫润达润滑油公司,http://www.11467.com/taiyuan/co/92102.htm
临海市东湖锅炉汽轮机配套设备有限公司,http://www.11467.com/taizhou/co/136994.htm
江苏恒德力化工设备有限公司,http://www.11467.com/taizhoushi/co/49179.htm
山东潍坊顺达科贸有限公司,http://www.11467.com/weifang/co/121144.htm
上海楚汉国际贸易有限公司武汉公司,http://www.11467.com/wuhan/co/75414.htm
湖北易方达商贸有限公司,http://www.11467.com/wuhan/co/75409.htm
武汉飞羽科技有限公司,http://www.11467.com/wuhan/co/54541.htm
武汉圣达电器有限公司,http://www.11467.com/wuhan/co/75411.htm
武汉中正化工设备有限公司销售部,http://www.11467.com/wuhan/co/83369.htm
逍遥游有限公司,http://www.11467.com/wuhan/co/75416.htm
晶晶化学有限公司武汉办事处,http://www.11467.com/wuhan/co/75407.htm
武汉力友工程有限责任公司,http://www.11467.com/wuhan/co/75415.htm
武汉誉洁科贸有限公司,http://www.11467.com/wuhan/co/75412.htm
芜湖加尔贸易有限公司,http://www.11467.com/wuhu/co/20535.htm
新疆万通设备有限公司,http://www.11467.com/wulumuqi/co/87954.htm
青岛三丰量仪精密工具有限公司,http://www.11467.com/wuxi/co/176419.htm
无锡佳德代理有限公司,http://www.11467.com/wuxi/co/174009.htm
无锡市摩力克分子筛有限公司,http://www.11467.com/wuxi/co/188594.htm
无锡市诺亚机械有限公司,http://www.11467.com/wuxi/co/188595.htm
无锡市新洲化工试剂有限公司,http://www.11467.com/wuxi/co/188592.htm
厦门工贸有限公司,http://www.11467.com/xiamen/co/26642.htm
厦门生本进出口有限公司,http://www.11467.com/xiamen/co/46845.htm
厦门海弘信商贸有限公司,http://www.11467.com/xiamen/co/45316.htm
厦门骏皇达贸易有限公司,http://www.11467.com/xiamen/co/46852.htm
陕西海晟化工科技有限公司,http://www.11467.com/xian/co/63944.htm
陕西海晟化工科技有限公司(油墨专用原材料),http://www.11467.com/xian/co/63946.htm
陕西秦虎高科线缆有限公司1,http://www.11467.com/xian/co/63948.htm
上海飞和实业集团西安分公司,http://www.11467.com/xian/co/50378.htm
晨龙锁具有限公司,http://www.11467.com/xian/co/64129.htm
西部金属材料股份有限公司压容厂,http://www.11467.com/xian/co/66942.htm
襄樊市赢未来科技有限责任公司,http://www.11467.com/xiangfan/co/37436.htm
湘杰机械设备有限公司湖北分公司,http://www.11467.com/xiaogan/co/22035.htm
新乡市艾奈基物资有限公司,http://www.11467.com/xinxiang/co/20122.htm
徐州亿捷工程机械有限公司,http://www.11467.com/xuzhou/co/55833.htm
泰州市鹏羽贸易有限公司,http://www.11467.com/yangzhou/co/81577.htm
烟台海翔胶粘剂有限公司,http://www.11467.com/yantai/co/123702.htm
烟台开荣商贸有限公司,http://www.11467.com/yantai/co/123701.htm
烟台开发区星火星煜化工有限公司,http://www.11467.com/yantai/co/123703.htm
汉威石油器材有限公司,http://www.11467.com/yichang/co/44746.htm
宁夏银顺达商贸有限公司,http://www.11467.com/yinchuan/co/39570.htm
岳阳恒升格瑞化工科技有限公司,http://www.11467.com/yueyang/co/31535.htm
湖南宏业化工有限公司,http://www.11467.com/yueyang/co/37001.htm
河南诺金金属材料有限公司信息部,http://www.11467.com/zhengzhou/co/92701.htm
河南省巩义市南洋机械设备有限公司,http://www.11467.com/zhengzhou/co/174862.htm
河南省郑州市塞纳科技实业有限公司,http://www.11467.com/zhengzhou/co/176586.htm
河南科丽奥高新材料有限公司 销售部,http://www.11467.com/zhengzhou/co/94921.htm
聚鼎电子科技有限公司,http://www.11467.com/zhengzhou/co/92585.htm
中山森田化工有限公司市场销售部,http://www.11467.com/zhongshan/co/73624.htm
中山市宝辰机电设备有限公司市场部,http://www.11467.com/zhongshan/co/73622.htm
中山香江洗涤用品有限公司,http://www.11467.com/zhongshan/co/73621.htm
珠海市雨虹环保科技有限公司,http://www.11467.com/zhuhai/co/64243.htm
珠海创鑫贸易有限公司(食品模型),http://www.11467.com/zhuhai/co/73721.htm
珠海共同机械设备有限公司,http://www.11467.com/zhuhai/co/64370.htm
长沙龙力自控技术有限公司,http://www.11467.com/changsha/co/82071.htm
长沙卫奥世康化工贸易有限公司,http://www.11467.com/changsha/co/82070.htm
湘潭科勒颜料有限公司,http://www.11467.com/changsha/co/119560.htm
中国江苏亚邦颜料有限公司,http://www.11467.com/changzhou/co/150740.htm
潮州市长荣物资贸易有限公司,http://www.11467.com/chaozhou/co/28357.htm
滁州图斯卡塑料机械有限公司,http://www.11467.com/chuzhou/co/30279.htm
大译五舟贸易有限公司商品部018,http://www.11467.com/dalian/co/45147.htm
东港市贝思杰复合材料有限公司,http://www.11467.com/dandong/co/51474.htm
山西省大同市宏光建材有限公司,http://www.11467.com/datong/co/14407.htm
东莞睿翔光电贸易有限公司,http://www.11467.com/dongguan/co/232415.htm
东莞市雄泰化工颜料有限公司,http://www.11467.com/dongguan/co/498905.htm
鸿泽进出品有限公司,http://www.11467.com/dongguan/co/506830.htm
康柏塑化公司,http://www.11467.com/dongguan/co/232414.htm
广州铧科机械设备有限公司,http://www.11467.com/dongguan/co/232418.htm
来福大帝有限公司,http://www.11467.com/dongguan/co/306070.htm
正午货运代理有限公司业务部,http://www.11467.com/dongguan/co/232421.htm
永耐防腐设备有限公司工程部,http://www.11467.com/dongguan/co/232403.htm
鸿福塑胶原料有限公司,http://www.11467.com/dongguan/co/506829.htm
珠海市信科自动化设备有限公司销售部,http://www.11467.com/zhuhai/co/73720.htm
山东久塔化工贸易有限公司,http://www.11467.com/zibo/co/99439.htm
淄博邦谊经贸有限公司,http://www.11467.com/zibo/co/76141.htm
淄博搪瓷设备销售有限公司,http://www.11467.com/zibo/co/76155.htm
淄博优能科技发展有限公司,http://www.11467.com/zibo/co/90197.htm
淄博华创精细陶瓷有限公司销售部518,http://www.11467.com/zibo/co/74145.htm
北京恒远科欣科技有限公司,http://www.11467.com/beijing/co/703360.htm
北京南大合荣科技发展有限公司,http://www.11467.com/beijing/co/692188.htm
广州润日贸易有限公司北京分公司,http://www.11467.com/beijing/co/703361.htm
上海百凯化工有限公司佛山办事处,http://www.11467.com/shanghai/co/1052694.htm
美岚实业化工有限公司,http://www.11467.com/shanghai/co/1042646.htm
山东广宜铝业有限公司驻上海办事处,http://www.11467.com/shanghai/co/1042550.htm
上海唐派涂料化工有限公司,http://www.11467.com/shanghai/co/1053850.htm
上海仙群贸易有限公司,http://www.11467.com/shanghai/co/1046966.htm
天津吉恒永泰商贸有限公司,http://www.11467.com/tianjin/co/147662.htm
天津誉宏工贸有限公司,http://www.11467.com/tianjin/co/42198.htm
天津斯威特科技有限公司,http://www.11467.com/tianjin/co/35895.htm
天津斯威特科技有限公司销售部,http://www.11467.com/tianjin/co/36408.htm
盐城优思氟防腐设备有限公司,http://www.11467.com/yancheng/co/81803.htm
山东宏达板式热交换设备有限公司,http://www.11467.com/jinan/co/143147.htm
天津市梅兰纳兰化工材料有限公司,http://www.11467.com/tianjin/co/300636.htm
鹏航（天津）货运代理有限公司,http://www.11467.com/tianjin/co/300637.htm
天津市冉新水电科技有限公司,http://www.11467.com/tianjin/co/300638.htm
风云大唐股份有限责任公司,http://www.11467.com/tianjin/co/301706.htm
世纪同创国际贸易公司,http://www.11467.com/tianjin/co/305303.htm
天津龙泓复合材料有限公司,http://www.11467.com/tianjin/co/305305.htm
天津广源贸易有限公司,http://www.11467.com/tianjin/co/308169.htm
熙旺国际贸易有限公司,http://www.11467.com/tianjin/co/308170.htm
宏力工业设备有限公司,http://www.11467.com/dongguan/co/128042.htm
东营市众人商务有限公司,http://www.11467.com/dongying/co/28630.htm
东营辉煌工贸有限责任公司,http://www.11467.com/dongying/co/20856.htm
佛山德工化工有限公司,http://www.11467.com/foshan/co/347927.htm
佛山市晋善建自动化贸易有限公司,http://www.11467.com/foshan/co/238995.htm
佛山兆特科技商贸有限公司,http://www.11467.com/foshan/co/181802.htm
兆特科技商贸有限公司,http://www.11467.com/foshan/co/181803.htm
梭能精密设备有限公司,http://www.11467.com/foshan/co/182751.htm
广东华南特钟气体研究所有限公司,http://www.11467.com/foshan/co/225635.htm
抚顺恒源化工机械制造有限公司,http://www.11467.com/fushun/co/25022.htm
阜新通宝科技实业有限公司新产品开发部,http://www.11467.com/fuxin/co/16052.htm
阜新大程工贸有限公司新民五金工具精品行,http://www.11467.com/fuxin/co/15595.htm
福州喷码自动化设备有限公司,http://www.11467.com/fuzhou/co/143016.htm
福州龙信环保科技有限公司招商部,http://www.11467.com/fuzhou/co/131536.htm
福州美伦化工贸易有限公司,http://www.11467.com/fuzhou/co/143011.htm
福州秋尔商贸有限公司,http://www.11467.com/fuzhou/co/143014.htm
抚州市景峰润滑油有限公司,http://www.11467.com/fuzhoushi/co/19060.htm
北京泽华化学工程有限公司广州分公司,http://www.11467.com/guangzhou/co/246417.htm
广州港控信息科技有限公司（市场部）,http://www.11467.com/guangzhou/co/255971.htm
广州虎桥进出口贸易有限有限公司,http://www.11467.com/guangzhou/co/246398.htm
广东庆展经济发展有限公司GE,http://www.11467.com/guangzhou/co/246409.htm
广州开昱工业设备有限公司,http://www.11467.com/guangzhou/co/276600.htm
广州市思源贸易有限公司,http://www.11467.com/guangzhou/co/122791.htm
广州多堡隆润滑科技有限公司,http://www.11467.com/guangzhou/co/97035.htm
广州雄菱制冷设备有限公司-后勤部,http://www.11467.com/guangzhou/co/248294.htm
广州怡准化学科技有限公司,http://www.11467.com/guangzhou/co/430090.htm
广州市烨东机械设备有限公司,http://www.11467.com/guangzhou/co/270772.htm
金锦实业有限公司,http://www.11467.com/guangzhou/co/246413.htm
广洲道源精细化工有限公司,http://www.11467.com/guangzhou/co/246382.htm
廣州三鑫金属科技有限公司,http://www.11467.com/guangzhou/co/246406.htm
寅池跨国采购担保有限公司,http://www.11467.com/guangzhou/co/246403.htm
威讯科技(集团)有限公司,http://www.11467.com/guangzhou/co/103930.htm
南方净水材料销售公司,http://www.11467.com/guangzhou/co/246411.htm
深圳市政通发进出口有限公司（广州办事处）,http://www.11467.com/guangzhou/co/246418.htm
潇湘实业发展有限公司公关部,http://www.11467.com/guangzhou/co/246416.htm
浙江五矿金和进出口有限公司化工部,http://www.11467.com/guangzhou/co/122792.htm
武汉嘉劲贸易有限公司,http://www.11467.com/guangzhou/co/246402.htm
广州黄埔乐天实业有限公司(总部),http://www.11467.com/guangzhou/co/246397.htm
贵阳宏开房屋信息公司,http://www.11467.com/guiyang/co/71190.htm
贵阳亚东橡胶有限公司业务部,http://www.11467.com/guiyang/co/67991.htm
黑龙江省哈尔滨市阿城区华宇设备有限公司,http://www.11467.com/haerbin/co/48769.htm
黑龙江省机械设备进出口有限公司,http://www.11467.com/haerbin/co/40840.htm
杭州车加程轮胎科技有限公司,http://www.11467.com/hangzhou/co/380355.htm
杭州海业生物科技有限公司,http://www.11467.com/hangzhou/co/390734.htm
杭州净源环保设备有限公司,http://www.11467.com/hangzhou/co/246533.htm
浙江周全技术有限公司,http://www.11467.com/hangzhou/co/246532.htm
青岛电站阀门厂青岛海联电站阀门有限公司,http://www.11467.com/huizhou/co/70035.htm
广曜自动化设备有限公司,http://www.11467.com/huizhou/co/70438.htm
宏盛油业公司,http://www.11467.com/huizhou/co/98530.htm
东莞新东方硅胶化工有限公司（江门办事处）,http://www.11467.com/jiangmen/co/89014.htm
广东省江门市涂派化工有限公司,http://www.11467.com/jiangmen/co/115730.htm
吉林市夏林化工分离机械工业有限公司,http://www.11467.com/jilinshi/co/77789.htm
吉林市宏日机械有限公司,http://www.11467.com/jilinshi/co/78942.htm
山东腾飞二手化工设备购销公司,http://www.11467.com/jining/co/71410.htm
兆乾二手油脂设备购销公司,http://www.11467.com/jining/co/72895.htm
山东梁山中联二手化工设备购销公司,http://www.11467.com/jining/co/71407.htm
山东梁山智航油脂设备公司,http://www.11467.com/jining/co/72897.htm
山东王崇洋油脂化工设备购销公司,http://www.11467.com/jining/co/71911.htm
山东梁山二手设备购销公司,http://www.11467.com/jining/co/72898.htm
锦州福伦机电设备有限公司,http://www.11467.com/jinzhou/co/43627.htm
昆明水星科技公司,http://www.11467.com/kunming/co/128272.htm
云南英协科技有限公司,http://www.11467.com/kunming/co/105727.htm
云南省化工进出口公司,http://www.11467.com/kunming/co/74483.htm
云南省科学器材公司,http://www.11467.com/kunming/co/74325.htm
莱芜祥宇化工有限公司,http://www.11467.com/laiwu/co/6696.htm
水泥添加剂供应公司,http://www.11467.com/laiwu/co/6695.htm
莱芜市北润物资有限公司,http://www.11467.com/laiwu/co/10113.htm
兰州千美科学分析仪器有限公司,http://www.11467.com/lanzhou/co/17208.htm
兰州副食品有限公司,http://www.11467.com/lanzhou/co/67402.htm
兰州纵横科技仪器有限公司,http://www.11467.com/lanzhou/co/67342.htm
连云港慧诚国际货运代理有限公司,http://www.11467.com/lianyungang/co/28426.htm
连云港明轮国际物流有限公司 销售部,http://www.11467.com/lianyungang/co/28142.htm
聊城宏润导热油经有限公司,http://www.11467.com/liaocheng/co/30385.htm
山东省聊城市三星日化有限公司,http://www.11467.com/liaocheng/co/28921.htm
中商网络科技公司商务一部,http://www.11467.com/liaocheng/co/28919.htm
山西临汾尧王贸易有限公司,http://www.11467.com/linfen/co/31788.htm
山东金邦地科技有限公司,http://www.11467.com/linyi/co/61113.htm
浙江龙大化工有限公司,http://www.11467.com/lishui/co/35441.htm
柳州市银桥化玻有限责任公司,http://www.11467.com/liuzhou/co/36155.htm
洛阳方鼎机电物资有限公司,http://www.11467.com/luoyang/co/56347.htm
香港美特贸易有限公司,http://www.11467.com/maoming/co/31527.htm
梅州市华力化工科技有限公司,http://www.11467.com/meizhou/co/27714.htm
江西方大气动成套设备有限公司,http://www.11467.com/nanchang/co/57179.htm
江西润峰实业有限公司,http://www.11467.com/nanchang/co/88618.htm
振亿隆商贸有限公司,http://www.11467.com/nanchang/co/89955.htm
济南山诺机械电子有限公司（南昌办事处）,http://www.11467.com/nanchang/co/81704.htm
南昌森威产品技术服务有限公司,http://www.11467.com/nanchang/co/82338.htm
南京便诊仪器设备有限公司,http://www.11467.com/nanjing/co/103260.htm
南京浩钢运输有限公司,http://www.11467.com/nanjing/co/73223.htm
