襄樊市赢未来科技有限责任公司,http://www.11467.com/xiangfan/co/37436.htm
新乡市艾奈基物资有限公司,http://www.11467.com/xinxiang/co/20122.htm
浙江亚龙教仪有限公司,http://www.11467.com/xinxiang/co/21727.htm
徐州亿捷工程机械有限公司,http://www.11467.com/xuzhou/co/55833.htm
泰州市鹏羽贸易有限公司,http://www.11467.com/yangzhou/co/81577.htm
烟台海翔胶粘剂有限公司,http://www.11467.com/yantai/co/123702.htm
烟台开荣商贸有限公司,http://www.11467.com/yantai/co/123701.htm
烟台开发区星火星煜化工有限公司,http://www.11467.com/yantai/co/123703.htm
宜宾市硕泰商贸有限公司,http://www.11467.com/yibin/co/23503.htm
汉威石油器材有限公司,http://www.11467.com/yichang/co/44746.htm
宁夏银顺达商贸有限公司,http://www.11467.com/yinchuan/co/39570.htm
岳阳恒升格瑞化工科技有限公司,http://www.11467.com/yueyang/co/31535.htm
河南诺金金属材料有限公司信息部,http://www.11467.com/zhengzhou/co/92701.htm
河南科丽奥高新材料有限公司 销售部,http://www.11467.com/zhengzhou/co/94921.htm
聚鼎电子科技有限公司,http://www.11467.com/zhengzhou/co/92585.htm
河南中防科技有限公司,http://www.11467.com/zhengzhou/co/112425.htm
镇江少阳医疗器械有限公司,http://www.11467.com/zhenjiang/co/48602.htm
创力达电子工具公司,http://www.11467.com/zhongshan/co/73625.htm
达任胶粘剂(南京)有限公司,http://www.11467.com/zhongshan/co/117618.htm
中山森田化工有限公司市场销售部,http://www.11467.com/zhongshan/co/73624.htm
中山市宝辰机电设备有限公司市场部,http://www.11467.com/zhongshan/co/73622.htm
中山市科创专利代理有限公司(工程部/代理部),http://www.11467.com/zhongshan/co/73623.htm
南京舒骏工贸有限公司,http://www.11467.com/zhongshan/co/117617.htm
中山香江洗涤用品有限公司,http://www.11467.com/zhongshan/co/73621.htm
珠海市雨虹环保科技有限公司,http://www.11467.com/zhuhai/co/64243.htm
珠海创鑫贸易有限公司(食品模型),http://www.11467.com/zhuhai/co/73721.htm
珠海共同机械设备有限公司,http://www.11467.com/zhuhai/co/64370.htm
珠海市信科自动化设备有限公司销售部,http://www.11467.com/zhuhai/co/73720.htm
湖南株洲化工集团有限责任公司技术中心,http://www.11467.com/zhuzhou/co/33741.htm
淄博邦谊经贸有限公司,http://www.11467.com/zibo/co/76141.htm
淄博搪瓷设备销售有限公司,http://www.11467.com/zibo/co/76155.htm
淄博华创精细陶瓷有限公司销售部518,http://www.11467.com/zibo/co/74145.htm
北京北化高科新技术有限公司,http://www.11467.com/beijing/co/404853.htm
北京东方澳汉科贸有限责任公司销售部,http://www.11467.com/beijing/co/103065.htm
北京鲁冀旺科贸发展有限公司,http://www.11467.com/beijing/co/217310.htm
北京农博投资科技有限公司,http://www.11467.com/beijing/co/404856.htm
北京清大科码科技有限公司技术开发部,http://www.11467.com/beijing/co/404851.htm
北京立辉宏工贸有限公司,http://www.11467.com/beijing/co/275937.htm
北京华溢昌荣科技有限公司销售部,http://www.11467.com/beijing/co/651283.htm
北京伊诺瓦科技有限责任公司,http://www.11467.com/beijing/co/217311.htm
汉畅国际货运(北京)代理有限公司,http://www.11467.com/beijing/co/103067.htm
欧乐(北京)资讯有限公司,http://www.11467.com/beijing/co/404854.htm
北京市大恒激光设备有限公司,http://www.11467.com/beijing/co/103075.htm
联合技术亚太有限公司,http://www.11467.com/beijing/co/103070.htm
安治化工有限公司水处理事业部,http://www.11467.com/shanghai/co/884540.htm
德国希而科 贸易（上海）有限公司,http://www.11467.com/shanghai/co/668494.htm
上海汇思机电有限公司,http://www.11467.com/shanghai/co/637773.htm
巴基斯坦驻上海阿兹穆贸易公司,http://www.11467.com/shanghai/co/738102.htm
上海市锝秉工控设备有限公司,http://www.11467.com/shanghai/co/316930.htm
上海乔冠化工有限公司 业务部,http://www.11467.com/shanghai/co/518107.htm
上海久杏涂装工程公司,http://www.11467.com/shanghai/co/518105.htm
上海润利化工有限公司,http://www.11467.com/shanghai/co/615041.htm
上海司考科贸发展有限公司,http://www.11467.com/shanghai/co/214853.htm
上海天向环保科技有限公司（上海总部）,http://www.11467.com/shanghai/co/316932.htm
上海衣生缘洗涤有限公司,http://www.11467.com/shanghai/co/968088.htm
上海塑料原料销售公司,http://www.11467.com/shanghai/co/668496.htm
上海融贸实业有限公司,http://www.11467.com/shanghai/co/656807.htm
上海外经集团有限公司,http://www.11467.com/shanghai/co/85034.htm
上海万般贸易有限公司,http://www.11467.com/shanghai/co/518104.htm
天津吉恒永泰商贸有限公司,http://www.11467.com/tianjin/co/147662.htm
天津誉宏工贸有限公司,http://www.11467.com/tianjin/co/42198.htm
天津斯威特科技有限公司,http://www.11467.com/tianjin/co/35895.htm
天津斯威特科技有限公司销售部,http://www.11467.com/tianjin/co/36408.htm
重庆沃斯工贸有限公司,http://www.11467.com/chongqing/co/78081.htm
重庆市贝洛尼贸易有限公司,http://www.11467.com/chongqing/co/125219.htm
重庆旭日化工贸易公司,http://www.11467.com/chongqing/co/52521.htm
盐城优思氟防腐设备有限公司,http://www.11467.com/yancheng/co/81803.htm
山东宏达板式热交换设备有限公司,http://www.11467.com/jinan/co/143147.htm
天津市梅兰纳兰化工材料有限公司,http://www.11467.com/tianjin/co/300636.htm
鹏航（天津）货运代理有限公司,http://www.11467.com/tianjin/co/300637.htm
天津市冉新水电科技有限公司,http://www.11467.com/tianjin/co/300638.htm
风云大唐股份有限责任公司,http://www.11467.com/tianjin/co/301706.htm
世纪同创国际贸易公司,http://www.11467.com/tianjin/co/305303.htm
安徽省安庆市金阳技工贸有限责任公司,http://www.11467.com/anqing/co/25040.htm
鞍山顺达设备物资供应公司,http://www.11467.com/anshan/co/71859.htm
北海宇天顺物资有限责任公司,http://www.11467.com/beihai/co/7981.htm
长沙龙力自控技术有限公司,http://www.11467.com/changsha/co/82071.htm
长沙卫奥世康化工贸易有限公司,http://www.11467.com/changsha/co/82070.htm
长沙德润机电设备有限公司,http://www.11467.com/changsha/co/82074.htm
湖南海利工程安装有限公司,http://www.11467.com/changsha/co/40953.htm
湘潭科勒颜料有限公司,http://www.11467.com/changsha/co/119560.htm
常州市腾荣电力科技有限公司,http://www.11467.com/changzhou/co/101833.htm
常州福华化工换热设备有限公司,http://www.11467.com/changzhou/co/101834.htm
潮州市长荣物资贸易有限公司,http://www.11467.com/chaozhou/co/28357.htm
比朗试验设备（成都）有限公司,http://www.11467.com/chengdu/co/100373.htm
成都环奥科技有限公司,http://www.11467.com/chengdu/co/100374.htm
成都市永鑫化工有限公司,http://www.11467.com/chengdu/co/100330.htm
成都鑫焱机电设备有限公司,http://www.11467.com/chengdu/co/100328.htm
四川兰克设备有限公司,http://www.11467.com/chengdu/co/100379.htm
滁州图斯卡塑料机械有限公司,http://www.11467.com/chuzhou/co/30279.htm
尚扬公司大连分公司,http://www.11467.com/dalian/co/45141.htm
大译五舟贸易有限公司商品部018,http://www.11467.com/dalian/co/45147.htm
山西省大同市宏光建材有限公司,http://www.11467.com/datong/co/14407.htm
东莞睿翔光电贸易有限公司,http://www.11467.com/dongguan/co/232415.htm
东莞市塘厦海曙塑胶机械直销公司,http://www.11467.com/dongguan/co/232432.htm
锋盈五金机电有限公司,http://www.11467.com/dongguan/co/232436.htm
康柏塑化公司,http://www.11467.com/dongguan/co/232414.htm
广州铧科机械设备有限公司,http://www.11467.com/dongguan/co/232418.htm
东莞伟鸿仪器有限公司,http://www.11467.com/dongguan/co/232398.htm
来福大帝有限公司,http://www.11467.com/dongguan/co/306070.htm
正午货运代理有限公司业务部,http://www.11467.com/dongguan/co/232421.htm
祥辉电子有限公司,http://www.11467.com/dongguan/co/232435.htm
永耐防腐设备有限公司工程部,http://www.11467.com/dongguan/co/232403.htm
宏力工业设备有限公司,http://www.11467.com/dongguan/co/128042.htm
东莞市永昌化工有限公司业务部,http://www.11467.com/dongguan/co/232422.htm
东营市众人商务有限公司,http://www.11467.com/dongying/co/28630.htm
东营辉煌工贸有限责任公司,http://www.11467.com/dongying/co/20856.htm
佛山市晋善建自动化贸易有限公司,http://www.11467.com/foshan/co/238995.htm
佛山兆特科技商贸有限公司,http://www.11467.com/foshan/co/181802.htm
天津龙泓复合材料有限公司,http://www.11467.com/tianjin/co/305305.htm
天津广源贸易有限公司,http://www.11467.com/tianjin/co/308169.htm
熙旺国际贸易有限公司,http://www.11467.com/tianjin/co/308170.htm
四介国际贸易有限公司（天津办）,http://www.11467.com/tjnankai/co/16479.htm
思辉流体科技（上海）有限公司,http://www.11467.com/shanghai/co/1135409.htm
聊城市敬业物资有限公司,http://www.11467.com/liaocheng/co/64767.htm
兆特科技商贸有限公司,http://www.11467.com/foshan/co/181803.htm
顺德船务公司,http://www.11467.com/foshan/co/225636.htm
梭能精密设备有限公司,http://www.11467.com/foshan/co/182751.htm
广东华南特钟气体研究所有限公司,http://www.11467.com/foshan/co/225635.htm
抚顺恒源化工机械制造有限公司,http://www.11467.com/fushun/co/25022.htm
阜新通宝科技实业有限公司新产品开发部,http://www.11467.com/fuxin/co/16052.htm
阜新大程工贸有限公司新民五金工具精品行,http://www.11467.com/fuxin/co/15595.htm
福州喷码自动化设备有限公司,http://www.11467.com/fuzhou/co/143016.htm
福州龙信环保科技有限公司招商部,http://www.11467.com/fuzhou/co/131536.htm
兴霖手机美容有限公司,http://www.11467.com/fuzhou/co/143019.htm
福州美伦化工贸易有限公司,http://www.11467.com/fuzhou/co/143011.htm
福州秋尔商贸有限公司,http://www.11467.com/fuzhou/co/143014.htm
抚州市景峰润滑油有限公司,http://www.11467.com/fuzhoushi/co/19060.htm
北京泽华化学工程有限公司广州分公司,http://www.11467.com/guangzhou/co/246417.htm
广州港控信息科技有限公司（市场部）,http://www.11467.com/guangzhou/co/255971.htm
福大自动化科技有限公司 AX部门,http://www.11467.com/guangzhou/co/246422.htm
广州惠建会计师事务所有限公司,http://www.11467.com/guangzhou/co/246425.htm
广州虎桥进出口贸易有限有限公司,http://www.11467.com/guangzhou/co/246398.htm
广东庆展经济发展有限公司GE,http://www.11467.com/guangzhou/co/246409.htm
广州市峻韬贸易(悦尔洋化学科技)有限公司,http://www.11467.com/guangzhou/co/246430.htm
广州开昱工业设备有限公司,http://www.11467.com/guangzhou/co/276600.htm
广州市思源贸易有限公司,http://www.11467.com/guangzhou/co/122791.htm
广州多堡隆润滑科技有限公司,http://www.11467.com/guangzhou/co/97035.htm
广州雄菱制冷设备有限公司-后勤部,http://www.11467.com/guangzhou/co/248294.htm
广州怡准化学科技有限公司,http://www.11467.com/guangzhou/co/430090.htm
广州市烨东机械设备有限公司,http://www.11467.com/guangzhou/co/270772.htm
金锦实业有限公司,http://www.11467.com/guangzhou/co/246413.htm
莲花(国际)采购有限公司,http://www.11467.com/guangzhou/co/246429.htm
广洲道源精细化工有限公司,http://www.11467.com/guangzhou/co/246382.htm
廣州三鑫金属科技有限公司,http://www.11467.com/guangzhou/co/246406.htm
广州市粤控自动化工程有限公司,http://www.11467.com/guangzhou/co/246292.htm
寅池跨国采购担保有限公司,http://www.11467.com/guangzhou/co/246403.htm
深圳市迅泰实业有限公司广州分公司硅油部,http://www.11467.com/guangzhou/co/246424.htm
广州宏剑工业设备有限公司采购部,http://www.11467.com/guangzhou/co/246433.htm
威讯科技(集团)有限公司,http://www.11467.com/guangzhou/co/103930.htm
南方净水材料销售公司,http://www.11467.com/guangzhou/co/246411.htm
深圳市政通发进出口有限公司（广州办事处）,http://www.11467.com/guangzhou/co/246418.htm
潇湘实业发展有限公司公关部,http://www.11467.com/guangzhou/co/246416.htm
广州首途贸易有限公司,http://www.11467.com/guangzhou/co/246431.htm
浙江五矿金和进出口有限公司化工部,http://www.11467.com/guangzhou/co/122792.htm
武汉嘉劲贸易有限公司,http://www.11467.com/guangzhou/co/246402.htm
广州黄埔乐天实业有限公司(总部),http://www.11467.com/guangzhou/co/246397.htm
贵州金湖医疗设备有限公司,http://www.11467.com/guiyang/co/71192.htm
贵州春润贸易有限公司,http://www.11467.com/guiyang/co/71191.htm
贵阳宏开房屋信息公司,http://www.11467.com/guiyang/co/71190.htm
贵阳亚东橡胶有限公司业务部,http://www.11467.com/guiyang/co/67991.htm
黑龙江省哈尔滨市阿城区华宇设备有限公司,http://www.11467.com/haerbin/co/48769.htm
黑龙江省机械设备进出口有限公司,http://www.11467.com/haerbin/co/40840.htm
黑龙江省海天贸易有限责任公司,http://www.11467.com/haerbin/co/48132.htm
杭州车加程轮胎科技有限公司,http://www.11467.com/hangzhou/co/380355.htm
杭州海业生物科技有限公司,http://www.11467.com/hangzhou/co/390734.htm
杭州净源环保设备有限公司,http://www.11467.com/hangzhou/co/246533.htm
杭州利宏化工设备有限公司,http://www.11467.com/hangzhou/co/246536.htm
浙江周全技术有限公司,http://www.11467.com/hangzhou/co/246532.htm
青岛电站阀门厂青岛海联电站阀门有限公司,http://www.11467.com/huizhou/co/70035.htm
广曜自动化设备有限公司,http://www.11467.com/huizhou/co/70438.htm
惠州通达贸易有限公司,http://www.11467.com/huizhou/co/66285.htm
东莞新东方硅胶化工有限公司（江门办事处）,http://www.11467.com/jiangmen/co/89014.htm
广东省江门市新会去中国联通新会分公司,http://www.11467.com/jiangmen/co/89016.htm
广东省江门市江海区广泽机电有限公司,http://www.11467.com/jiangmen/co/89006.htm
吉林市夏林化工分离机械工业有限公司,http://www.11467.com/jilinshi/co/77789.htm
吉林市宏日机械有限公司,http://www.11467.com/jilinshi/co/78942.htm
威迪隆有限公司,http://www.11467.com/jilinshi/co/78943.htm
山东鸿基水技术有限公司,http://www.11467.com/jinan/co/72598.htm
济南远博科学仪器有限公司业务部,http://www.11467.com/jinan/co/81390.htm
山东鸿基换热技术有限公司营销部,http://www.11467.com/jinan/co/81424.htm
济宁市三实国际贸易有限公司业务部,http://www.11467.com/jining/co/48803.htm
锦州福伦机电设备有限公司,http://www.11467.com/jinzhou/co/43627.htm
昆明天惠贸易有限公司,http://www.11467.com/kunming/co/105729.htm
云南英协科技有限公司,http://www.11467.com/kunming/co/105727.htm
云南省化工进出口公司,http://www.11467.com/kunming/co/74483.htm
云南省科学器材公司,http://www.11467.com/kunming/co/74325.htm
莱芜祥宇化工有限公司,http://www.11467.com/laiwu/co/6696.htm
水泥添加剂供应公司,http://www.11467.com/laiwu/co/6695.htm
莱芜市北润物资有限公司,http://www.11467.com/laiwu/co/10113.htm
甘肃新亚奥数码科技有限公司,http://www.11467.com/lanzhou/co/66725.htm
兰州千美科学分析仪器有限公司,http://www.11467.com/lanzhou/co/17208.htm
兰州副食品有限公司,http://www.11467.com/lanzhou/co/67402.htm
兰州纵横科技仪器有限公司,http://www.11467.com/lanzhou/co/67342.htm
江苏锦之捷国际货运代理有限公司货代部,http://www.11467.com/lianyungang/co/28427.htm
连云港慧诚国际货运代理有限公司,http://www.11467.com/lianyungang/co/28426.htm
连云港明轮国际物流有限公司 销售部,http://www.11467.com/lianyungang/co/28142.htm
聊城宏润导热油经有限公司,http://www.11467.com/liaocheng/co/30385.htm
山东省聊城市三星日化有限公司,http://www.11467.com/liaocheng/co/28921.htm
中商网络科技公司商务一部,http://www.11467.com/liaocheng/co/28919.htm
山西临汾尧王贸易有限公司,http://www.11467.com/linfen/co/31788.htm
山东金邦地科技有限公司,http://www.11467.com/linyi/co/61113.htm
临沂友利贸易有限公司,http://www.11467.com/linyi/co/61101.htm
柳州市银桥化玻有限责任公司,http://www.11467.com/liuzhou/co/36155.htm
洛阳方鼎机电物资有限公司,http://www.11467.com/luoyang/co/56347.htm
香港美特贸易有限公司,http://www.11467.com/maoming/co/31527.htm
梅州市华力化工科技有限公司,http://www.11467.com/meizhou/co/27714.htm
江西方大气动成套设备有限公司,http://www.11467.com/nanchang/co/57179.htm
江西润峰实业有限公司,http://www.11467.com/nanchang/co/88618.htm
南昌恒诚工贸有限公司(销售部),http://www.11467.com/nanchang/co/88620.htm
振亿隆商贸有限公司,http://www.11467.com/nanchang/co/89955.htm
济南山诺机械电子有限公司（南昌办事处）,http://www.11467.com/nanchang/co/81704.htm
南昌森威产品技术服务有限公司,http://www.11467.com/nanchang/co/82338.htm
韩国尚贸交易有限公司南京办事处,http://www.11467.com/nanjing/co/10295.htm
南京便诊仪器设备有限公司,http://www.11467.com/nanjing/co/103260.htm
南京浩钢运输有限公司,http://www.11467.com/nanjing/co/73223.htm
南京三瑞机械有限公司,http://www.11467.com/nanjing/co/155851.htm
南京庚辰科学仪器有限公司海尔部,http://www.11467.com/nanjing/co/73219.htm
南京合控商贸有限公司部门,http://www.11467.com/nanjing/co/81304.htm
南京优盟机电有限公司,http://www.11467.com/nanjing/co/77223.htm
南京泰特化工设备有限公司,http://www.11467.com/nanjing/co/73218.htm
盐城市润根金属材料实业有限公司,http://www.11467.com/nanjing/co/73221.htm
新鸿宇汽车漆辅料公司,http://www.11467.com/nanjing/co/73220.htm
南宁佰进商贸有限责任公司,http://www.11467.com/nanning/co/58025.htm
南宁市凯筱仪器设备有限公司,http://www.11467.com/nanning/co/58292.htm
江苏省通州市友力策划公司,http://www.11467.com/nantong/co/138754.htm
驭联变频设备有限公司,http://www.11467.com/nanyang/co/29774.htm
【青岛德来动力装备有限公司】,http://www.11467.com/qingdao/co/88970.htm
福大自动化科技有限公司青岛销售分公司,http://www.11467.com/qingdao/co/88982.htm
万特福商贸有限公司,http://www.11467.com/qingdao/co/88972.htm
青岛阳光嘉恒国际贸易有限公司 进口部,http://www.11467.com/qingdao/co/88974.htm
泉仔商务有限公司,http://www.11467.com/quanzhou/co/100902.htm
日照宇沛进出口有限公司,http://www.11467.com/rizhao/co/12625.htm
日照润生国际船舶代理有限公司,http://www.11467.com/rizhao/co/12627.htm
粤丽水晶饰品有限公司,http://www.11467.com/shantou/co/125526.htm
韶关贸易有限公司,http://www.11467.com/shaoguan/co/24411.htm
辽宁海联发展有限公司,http://www.11467.com/shenyang/co/60655.htm
沈阳市帝增风机销售有限公司,http://www.11467.com/shenyang/co/60656.htm
中美合资芬尔国际化学有限公司,http://www.11467.com/shenyang/co/60651.htm
沈阳协鸿石化泵阀设备有限公司,http://www.11467.com/shenyang/co/64541.htm
沈阳思特莱斯洗衣有限公司,http://www.11467.com/shenyang/co/16644.htm
沈阳格瑞诗科技发展有限公司-格瑞诗工控,http://www.11467.com/shenyang/co/60652.htm
宾海国际公司,http://www.11467.com/shenzhen/co/137621.htm
航邮联国际物流有限公司（福永总公司）,http://www.11467.com/shenzhen/co/369696.htm
广发货运公司,http://www.11467.com/shenzhen/co/369730.htm
聚英咨询服务科技有限公司,http://www.11467.com/shenzhen/co/330468.htm
宏业天成化工有限公司,http://www.11467.com/shenzhen/co/369702.htm
上海通泰化学有限公司深圳办事处,http://www.11467.com/shenzhen/co/369668.htm
深圳深掘科技发展有限公司,http://www.11467.com/shenzhen/co/480339.htm
国宏化工有限公司,http://www.11467.com/shenzhen/co/369703.htm
深圳大汉天威贸易有限公司,http://www.11467.com/shenzhen/co/369734.htm
华信佳电子有限公司,http://www.11467.com/shenzhen/co/369721.htm
深圳大智知识产权代理有限公司,http://www.11467.com/shenzhen/co/369733.htm
深圳精细化工有限公司,http://www.11467.com/shenzhen/co/369480.htm
深圳鼎丰盛精信科技有限公司,http://www.11467.com/shenzhen/co/369690.htm
深圳升佳盈电子有限公司,http://www.11467.com/shenzhen/co/369710.htm
深圳圣瑞贵金属科技有限公司,http://www.11467.com/shenzhen/co/369644.htm
深圳石油设备分公司,http://www.11467.com/shenzhen/co/137623.htm
深圳市邦大科技有限公司（业务部）,http://www.11467.com/shenzhen/co/369694.htm
青岛盖洛普商务有限公司,http://www.11467.com/shenzhen/co/369487.htm
莆新贸易有限公司,http://www.11467.com/shenzhen/co/369727.htm
利鑫达电子科技有限公司,http://www.11467.com/shenzhen/co/408806.htm
深圳市德恒森电子科技有限公司,http://www.11467.com/shenzhen/co/369728.htm
深圳迪凯鑫科技有限公司,http://www.11467.com/shenzhen/co/369660.htm
深圳市达丰商贸有限公司,http://www.11467.com/shenzhen/co/137622.htm
深圳市国润国际货运代理有限公司,http://www.11467.com/shenzhen/co/369476.htm
深圳市诚顺达科技有限公司,http://www.11467.com/shenzhen/co/25397.htm
深圳环宇洗涤设备有限公司,http://www.11467.com/shenzhen/co/369681.htm
深圳市嘉特进出口有限公司,http://www.11467.com/shenzhen/co/137620.htm
深圳奥迈自动化化有限公司,http://www.11467.com/shenzhen/co/369667.htm
深圳市九州通泰实业有限公司,http://www.11467.com/shenzhen/co/369726.htm
深圳市博恒进出口代理有限公司,http://www.11467.com/shenzhen/co/369654.htm
深圳市科维乐科技有限公司,http://www.11467.com/shenzhen/co/488056.htm
深圳市荣嘉科技有限公司,http://www.11467.com/shenzhen/co/75430.htm
深圳市东彩珠光颜料销售有限公司,http://www.11467.com/shenzhen/co/369676.htm
深圳市赛达粘合剂有限公司业务部,http://www.11467.com/shenzhen/co/369699.htm
深圳市三力行精密机械有限公司海外市场部,http://www.11467.com/shenzhen/co/137363.htm
深圳市祺润自动化技术有限公司,http://www.11467.com/shenzhen/co/117325.htm
深圳市深通达科技有限公司,http://www.11467.com/shenzhen/co/369685.htm
深圳市叶茂盛实业发展有限公司,http://www.11467.com/shenzhen/co/6739.htm
深圳市松华电梯有限公司,http://www.11467.com/shenzhen/co/369679.htm
深圳市华威国际货运代理有限公司业务拓展部,http://www.11467.com/shenzhen/co/369486.htm
深圳凯司姆科技有限公司,http://www.11467.com/shenzhen/co/243000.htm
深圳市誉品科技有限公司市场部,http://www.11467.com/shenzhen/co/369649.htm
深圳市掌亮科技有限公司,http://www.11467.com/shenzhen/co/369695.htm
"深圳市永捷机电设备有限公司,",http://www.11467.com/shenzhen/co/369671.htm
深圳市远恒国际货运代理有限公司(深圳分公司),http://www.11467.com/shenzhen/co/369641.htm
深圳市正隆贸易有限公司,http://www.11467.com/shenzhen/co/369707.htm
深圳泰鑫技术开发公司,http://www.11467.com/shenzhen/co/369704.htm
深圳市奕峰通信网络有限公司,http://www.11467.com/shenzhen/co/70404.htm
深圳市致力贸易有限公司,http://www.11467.com/shenzhen/co/369705.htm
伟创科仪精密仪器有限公司(深圳总公司）,http://www.11467.com/shenzhen/co/369662.htm
源沣电子有限公司客服部,http://www.11467.com/shenzhen/co/369656.htm
特研贸易有限公司,http://www.11467.com/shenzhen/co/369680.htm
深圳水都商贸有限公司,http://www.11467.com/shenzhen/co/429359.htm
河北彤瑞进出口公司,http://www.11467.com/shijiazhuang/co/86611.htm
华北化工设备有限公司,http://www.11467.com/shijiazhuang/co/86649.htm
石家庄海洪三利信息咨询服务有限公司,http://www.11467.com/shijiazhuang/co/86613.htm
石家庄市中盛超硬材料有限公司,http://www.11467.com/shijiazhuang/co/86661.htm
石家庄盖德贸易有限公司,http://www.11467.com/shijiazhuang/co/86609.htm
石家庄威尔纳川机电化工有限公司,http://www.11467.com/shijiazhuang/co/86610.htm
石家庄通化工医药设备制造有限公司,http://www.11467.com/shijiazhuang/co/90177.htm
十堰伟卓齿业有限公司部门,http://www.11467.com/shiyan/co/29146.htm
江苏省苏州中江机电工贸有限公司,http://www.11467.com/suzhou/co/227032.htm
苏州易诺威贸易有限公司,http://www.11467.com/suzhou/co/227033.htm
苏州乾晟科技有限公司营销部,http://www.11467.com/suzhou/co/265586.htm
苏州和顺特种气体有限公司,http://www.11467.com/suzhou/co/94844.htm
苏州市峻峰金属制品有限公司,http://www.11467.com/suzhou/co/227026.htm
台灣兴诚科技有限公司,http://www.11467.com/suzhou/co/226987.htm
苏州自动化科技公司,http://www.11467.com/suzhou/co/227034.htm
上海震坤行贸易有限公司苏州办,http://www.11467.com/suzhou/co/227029.htm
苏州狮王建筑装饰材料有限公司,http://www.11467.com/suzhou/co/227037.htm
张家港市新圣机械制造有限公司,http://www.11467.com/suzhou/co/131811.htm
