济南捷昌机电设备有限公司,http://www.11467.com/qiye/93208343.htm
佛山市顺德区三合化工机械有限公司,http://www.11467.com/foshan/co/343710.htm
北京晋意福科技发展有限公司,http://www.11467.com/beijing/co/249094.htm
淄博晨照化工设备有限公司,http://www.11467.com/zibo/co/74142.htm
珠海市凯利达电子材料有限公司,http://www.11467.com/zhuhai/co/73719.htm
珠海市伟昊电子有限公司,http://www.11467.com/zhuhai/co/73718.htm
苏州舜展贸易有限公司,http://www.11467.com/suzhou/co/227023.htm
上海武耀贸易有限公司,http://www.11467.com/shanghai/co/214852.htm
上海先俊电子科技有限公司,http://www.11467.com/shanghai/co/884537.htm
天津国昊国际贸易有限公司,http://www.11467.com/tianjin/co/140931.htm
武汉鹏鑫机电设备有限公司,http://www.11467.com/wuhan/co/21607.htm
上海标强贸易有限公司,http://www.11467.com/shanghai/co/792069.htm
广州市银霖化工有限公司,http://www.11467.com/guangzhou/co/115046.htm
张家港市通宇机械制造有限公司,http://www.11467.com/suzhou/co/127656.htm
广东尚菱视界科技有限公司,http://www.11467.com/dongguan/co/639389.htm
北京易刷新科技有限公司上海分公司,http://www.11467.com/qiye/93115630.htm
广州保圣机械设备有限公司,http://www.11467.com/guangzhou/co/111203.htm
成都科普达空气压缩机有限公司,http://www.11467.com/chengdu/co/141931.htm
武汉威能机电设备有限公司,http://www.11467.com/wuhan/co/75413.htm
深圳市佳力仕胶粘技术有限公司,http://www.11467.com/shenzhen/co/785208.htm
郑州海光日化用品有限公司,http://www.11467.com/zhengzhou/co/112418.htm
无锡名鼎不锈钢有限公司,http://www.11467.com/wuxi/co/251575.htm
天津市华北实验仪器有限公司．,http://www.11467.com/tianjin/co/188203.htm
迈达斯化工有限公司,http://www.11467.com/shenyang/co/101472.htm
上海首立实业有限公司销售部,http://www.11467.com/shanghai/co/518106.htm
郑州商鸿经贸有限公司,http://www.11467.com/zhengzhou/co/112419.htm
美富斯劳腾科贸有限公司,http://www.11467.com/beijing/co/103078.htm
深圳天鼎精细化工制造有限公司,http://www.11467.com/shenzhen/co/701813.htm
湖北程力专用汽车有限公司专用汽车市场销售部,http://www.11467.com/suizhou/co/10563.htm
福大自动化有限公司业务部,http://www.11467.com/fuzhou/co/143017.htm
广州市医信科技有限公司,http://www.11467.com/guangzhou/co/246408.htm
湖北武汉科尔富泵业有限公司,http://www.11467.com/wuhan/co/75408.htm
陕西生益科技有限公司,http://www.11467.com/baoji/co/25102.htm
吉林省中天化工经贸有限公司,http://www.11467.com/changchun/co/65030.htm
内蒙古元原科贸发展有限公司,http://www.11467.com/huhehaote/co/25535.htm
云南云叶化肥股份有限公司,http://www.11467.com/kunming/co/101902.htm
辽宁关东化工填料机械有限公司,http://www.11467.com/liaoyang/co/22543.htm
梅州市捷成贸易有限公司,http://www.11467.com/meizhou/co/23059.htm
南京东森自动化控制系统有限公司,http://www.11467.com/nanjing/co/53447.htm
青岛海之杰工业装备有限公司,http://www.11467.com/qingdao/co/88971.htm
华友化工国际贸易（上海）有限公司,http://www.11467.com/shenzhen/co/369670.htm
成都英思特贸易有限公司,http://www.11467.com/chengdu/co/80428.htm
成都迈德精化科技有限公司,http://www.11467.com/chengdu/co/100329.htm
成都康斯博科技有限责任公司市场部,http://www.11467.com/chengdu/co/100371.htm
四川禾士力贸易有限公司,http://www.11467.com/chengdu/co/100370.htm
北京恒泰德贸易发展有限公司北方市场贸易部,http://www.11467.com/chifeng/co/22689.htm
蓝翔贸易有限责任公司,http://www.11467.com/chifeng/co/22688.htm
大理洛特经纪有限公司市场部,http://www.11467.com/dali/co/12163.htm
大连锐航国际货运代理有限公司总部,http://www.11467.com/dalian/co/45145.htm
大连铂斯特润滑油有限公司,http://www.11467.com/dalian/co/45146.htm
大连工贸公司,http://www.11467.com/dalian/co/45149.htm
天利顺信息咨询有限公司,http://www.11467.com/dalian/co/45148.htm
大连希迈自动化科技有限公司销售中心,http://www.11467.com/dalian/co/45142.htm
大连胜光科技发展有限公司-技术部,http://www.11467.com/dalian/co/45143.htm
虎目信投咨询有限公司投资咨询部,http://www.11467.com/dandong/co/46391.htm
大庆市宝凯经贸有限公司,http://www.11467.com/daqing/co/39842.htm
四川什邡市金地亚美化工有限公司,http://www.11467.com/deyang/co/31487.htm
山东德州阳缆商贸有限公司,http://www.11467.com/dezhou/co/33296.htm
德州力能特种设备发展公司,http://www.11467.com/dezhou/co/33295.htm
北京中恒高博知识产权代理有限公司东莞分公司法务部,http://www.11467.com/dongguan/co/232428.htm
德士肯鞋材有限公司,http://www.11467.com/dongguan/co/232434.htm
东莞凯威尔电子材料有限公司销售部,http://www.11467.com/dongguan/co/121586.htm
东莞三义化工有限公司,http://www.11467.com/dongguan/co/232430.htm
东莞胜利物流有限公司,http://www.11467.com/dongguan/co/232429.htm
东莞市22利业代理责任有限公司,http://www.11467.com/dongguan/co/232413.htm
东莞华港国际贸易有限公司,http://www.11467.com/dongguan/co/217393.htm
东莞华达化工原料有限公司,http://www.11467.com/dongguan/co/232404.htm
东莞市胜威化工有限公司（销售部）,http://www.11467.com/dongguan/co/232400.htm
东莞市日力涂装机械有限公司,http://www.11467.com/dongguan/co/294499.htm
东莞市瑞润化工有限公司（市场部）,http://www.11467.com/dongguan/co/232405.htm
东莞市祥邦塑胶原料有限公司,http://www.11467.com/dongguan/co/232417.htm
東莞宇駿貿易有限公司,http://www.11467.com/dongguan/co/232327.htm
东莞市英特尔电子科技有限公司,http://www.11467.com/dongguan/co/232411.htm
广东东莞天宇印刷机械有限公司,http://www.11467.com/dongguan/co/328190.htm
东莞市华艺铜业有限公司,http://www.11467.com/dongguan/co/232406.htm
东莞粤丰化工有限公司,http://www.11467.com/dongguan/co/127388.htm
东莞市文宏(金果)实业有限公司,http://www.11467.com/dongguan/co/232420.htm
金洋压铸有限公司,http://www.11467.com/dongguan/co/277110.htm
华明化工原料有限公司,http://www.11467.com/dongguan/co/146019.htm
骏越塑胶原料有限公司,http://www.11467.com/dongguan/co/232399.htm
广卫电子科技有限公司行销部,http://www.11467.com/dongguan/co/232426.htm
深圳新亚工具雁田分公司,http://www.11467.com/dongguan/co/232424.htm
宏创自动化科技有限公司,http://www.11467.com/dongguan/co/245767.htm
正大科技化工有限公司,http://www.11467.com/dongguan/co/232402.htm
东莞市哲丰贸易有限公司,http://www.11467.com/dongguan/co/78979.htm
香港谱琳化妆品有限公司东莞分公司,http://www.11467.com/dongguan/co/232401.htm
新亚电子工具连锁店有限公司东莞分公司,http://www.11467.com/dongguan/co/232423.htm
业伟电子材料有限公司,http://www.11467.com/dongguan/co/125447.htm
万航国际货运代理有限公司-东莞部,http://www.11467.com/dongguan/co/232416.htm
唯达焊料科技（东莞）有限公司,http://www.11467.com/dongguan/co/232419.htm
"彤建有限公司DONJON CO., LTD",http://www.11467.com/dongguan/co/232325.htm
东营市胜创石油化工设备有限公司,http://www.11467.com/dongying/co/39473.htm
东营沃融科贸有限公司,http://www.11467.com/dongying/co/19829.htm
安好国际贸易有限公司,http://www.11467.com/erlianhaote/co/614.htm
佛山市洪鹏化工设备制造有限公司,http://www.11467.com/foshan/co/226054.htm
佛山市南海科玛斯自动化设备有限公司,http://www.11467.com/foshan/co/305835.htm
佛山市阳光科技有限公司,http://www.11467.com/foshan/co/225633.htm
佛山市顺德区兆特科技商贸有限公司,http://www.11467.com/foshan/co/225637.htm
佛山雅诺卡机电工程有限公司,http://www.11467.com/foshan/co/187750.htm
佛山市双环机电配套有限公司,http://www.11467.com/foshan/co/225630.htm
王田化工汽车美容有限公司,http://www.11467.com/foshan/co/225627.htm
佛山市志盛化工塑料有限公司,http://www.11467.com/foshan/co/225628.htm
世纪创佳材料有限公司,http://www.11467.com/foshan/co/225631.htm
浩伦东方贸易有限公司,http://www.11467.com/fuzhou/co/143004.htm
福州瑞捷测控技术有限公司,http://www.11467.com/fuzhou/co/130878.htm
福州仁宝贸易有限公司,http://www.11467.com/fuzhou/co/122136.htm
福州伟希进出口有限公司,http://www.11467.com/fuzhou/co/143015.htm
赣州盛德涂装工程有限公司,http://www.11467.com/ganzhou/co/26926.htm
广州高凌化工有限公司,http://www.11467.com/guangzhou/co/52906.htm
广的广告策划有限公司,http://www.11467.com/guangzhou/co/105427.htm
广东绿力生物科技有限公司`,http://www.11467.com/guangzhou/co/246378.htm
广州劲能进口叉车配件批发件有限公司,http://www.11467.com/guangzhou/co/246401.htm
广州市广发贸易发展有限公司,http://www.11467.com/guangzhou/co/246432.htm
广州艾碧希机械设备有限公司,http://www.11467.com/guangzhou/co/111650.htm
广州福大自动化科技有限公司,http://www.11467.com/guangzhou/co/246421.htm
广州市兴轩清洁用品有限公司,http://www.11467.com/guangzhou/co/246420.htm
广州智正财税服务有限公司,http://www.11467.com/guangzhou/co/246419.htm
广州市伟冠贸易有限公司业务部,http://www.11467.com/guangzhou/co/246412.htm
上海帕卓输送传动机械配件有限公司广州办,http://www.11467.com/guangzhou/co/246415.htm
寅驰跨国采购担保有限公司广州分公司,http://www.11467.com/guangzhou/co/122790.htm
广州宏为自动化科技有限公司业务部,http://www.11467.com/guangzhou/co/276202.htm
信宏实业有限公司_美国马士达中国总代理,http://www.11467.com/guangzhou/co/246405.htm
广西弘天票票实业有限公司,http://www.11467.com/guilin/co/43382.htm
雨瀚国际销售公司,http://www.11467.com/guiyang/co/75289.htm
哈尔滨三星经济发展有限公司,http://www.11467.com/haerbin/co/48131.htm
邯郸市洁明水处理工程有限公司,http://www.11467.com/handan/co/48956.htm
杭州万汇国际货运代理有限公司,http://www.11467.com/hangzhou/co/240537.htm
杭州港务集装箱有限公司,http://www.11467.com/hangzhou/co/180231.htm
浙大恩特软件科技有限公司,http://www.11467.com/hangzhou/co/246531.htm
浙江华光科技开发有限公司,http://www.11467.com/hangzhou/co/197957.htm
杭州市星海网络科技有限公司,http://www.11467.com/hangzhou/co/246477.htm
浙江石油化工自动化技术开发有限公司（市场部）,http://www.11467.com/hangzhou/co/246534.htm
浙江湖州中云机械制造有限公司萧山直销处,http://www.11467.com/hangzhou/co/246537.htm
杭州希成清洗技术有限公司,http://www.11467.com/hangzhou/co/246529.htm
衡水群利橡胶有限公司,http://www.11467.com/hengshui/co/21135.htm
衡阳市昱盛工贸有限公司,http://www.11467.com/hengyang/co/25934.htm
菏泽天昊化工有限公司,http://www.11467.com/heze/co/24274.htm
内蒙古大天地贸易有限公司,http://www.11467.com/huhehaote/co/23746.htm
愛華思科技有限公司,http://www.11467.com/huizhou/co/66291.htm
英国美乐士制漆有限公司,http://www.11467.com/jiangmen/co/89015.htm
济南弗兰德化工有限公司 销售部,http://www.11467.com/jinan/co/68049.htm
深圳海川色彩科技有限公司山东分公司,http://www.11467.com/jinan/co/81425.htm
海格里斯科技（北京）有限公司销售部,http://www.11467.com/jinan/co/81423.htm
山东力扬工贸有限公司济南营销总部,http://www.11467.com/jinan/co/81422.htm
湖北省荆门市银珠塑化有限公司,http://www.11467.com/jingmen/co/14648.htm
浙江金鑫工贸有限公司,http://www.11467.com/jinhua/co/73737.htm
济宁市春阳化工设备技术咨询服务有限公司,http://www.11467.com/jining/co/48804.htm
开封市鼎力公司磁选机分厂,http://www.11467.com/kaifeng/co/14620.htm
平顶山煤业集团开封东大化工有限公司,http://www.11467.com/kaifeng/co/14619.htm
上海众诚士德科技有限公司,http://www.11467.com/kunming/co/105728.htm
兰州宏海房屋拆迁工程有限责任公司,http://www.11467.com/lanzhou/co/66712.htm
甘肃凯特利炼化设备有限公司销售部,http://www.11467.com/lanzhou/co/66724.htm
鼎洋营销品牌管理有限公司,http://www.11467.com/lanzhou/co/66723.htm
连云港市永泰焊割气体有限公司,http://www.11467.com/lianyungang/co/26167.htm
临沂市海鑫化工设备有限公司,http://www.11467.com/linyi/co/61108.htm
柳州市豪杰特化工机械有限责任公司,http://www.11467.com/liuzhou/co/4709.htm
湘亿代理采购有限公司,http://www.11467.com/loudi/co/17510.htm
洛阳盛景化工贸易公司,http://www.11467.com/luoyang/co/46886.htm
茂名市宝辉贸易有限公司A,http://www.11467.com/maoming/co/31526.htm
源峰磨料磨具有限公司,http://www.11467.com/mudanjiang/co/48388.htm
南昌太平机械有限总公司,http://www.11467.com/nanchang/co/88621.htm
南京千峰科技有限公司第一分公司,http://www.11467.com/nanjing/co/77436.htm
南京华苏石油化工有限公司,http://www.11467.com/nanjing/co/73224.htm
南京保欧化工有限公司,http://www.11467.com/nanjing/co/73170.htm
南京品沃科技有限公司,http://www.11467.com/nanjing/co/52258.htm
南京舒骏工贸有限公司,http://www.11467.com/nanjing/co/46040.htm
南京东方鸿运物流有限公司,http://www.11467.com/nanjing/co/73222.htm
南京耐瑟斯化工有限公司,http://www.11467.com/nanjing/co/73204.htm
南京市商业外贸有限公司,http://www.11467.com/nanjing/co/73225.htm
广西怡康化工材料有限公司,http://www.11467.com/nanning/co/65059.htm
南通大润劳务有限公司,http://www.11467.com/nantong/co/63253.htm
南通时瑞塑胶制品有限公司 (市场部）,http://www.11467.com/nantong/co/101341.htm
北京神州华茂知识产权代理有限公司宁波办,http://www.11467.com/ningbo/co/93582.htm
宁波市鄞州雷立塑料制品有限公司,http://www.11467.com/ningbo/co/143692.htm
青岛海丽美公司,http://www.11467.com/qingdao/co/88976.htm
青岛嘉泰源国际贸易公司,http://www.11467.com/qingdao/co/88977.htm
青岛德鲁亚国际贸易有限公司,http://www.11467.com/qingdao/co/58531.htm
青岛丽琦国际贸易有限公司,http://www.11467.com/qingdao/co/88936.htm
青岛捷飞国际有限公司,http://www.11467.com/qingdao/co/88983.htm
青岛佳联化工新材料有限公司,http://www.11467.com/qingdao/co/88975.htm
青岛康泰重工机械有限公司,http://www.11467.com/qingdao/co/88969.htm
秦皇岛年影工贸有限公司,http://www.11467.com/qinhuangdao/co/26640.htm
福建泉州协益鞋材化工有限公司,http://www.11467.com/quanzhou/co/100901.htm
泉州市杰利贸易有限公司,http://www.11467.com/quanzhou/co/100904.htm
泉州市亿力经贸发展有限公司,http://www.11467.com/quanzhou/co/81255.htm
衢州百诚空调设备有限公司展示中心,http://www.11467.com/quzhou/co/21869.htm
日照锦德商贸有限公司,http://www.11467.com/rizhao/co/12626.htm
宇化机械制造有限公司,http://www.11467.com/sanming/co/30551.htm
辽宁省颐鑫和进出口贸易有限公司,http://www.11467.com/shenyang/co/60653.htm
沈阳鑫斯达自动化有限公司,http://www.11467.com/shenyang/co/48877.htm
长龙集团有限公司,http://www.11467.com/shenzhen/co/369484.htm
广东深圳正海虹涂料有限公司,http://www.11467.com/shenzhen/co/369691.htm
广东省深圳市鑫辉化工有限公司,http://www.11467.com/shenzhen/co/369682.htm
环发(天津)国际货运代理有限公司,http://www.11467.com/shenzhen/co/369665.htm
恒辉润滑油科技有限公司,http://www.11467.com/shenzhen/co/369689.htm
金品源(拓普威尔)国际有限公司,http://www.11467.com/shenzhen/co/369481.htm
洁力士化工公司,http://www.11467.com/shenzhen/co/369686.htm
林大化工深圳有限公司,http://www.11467.com/shenzhen/co/369655.htm
连邦化工原料有限公司,http://www.11467.com/shenzhen/co/369638.htm
华进联合专利商标代理有限公司商标部,http://www.11467.com/shenzhen/co/369659.htm
深扬电子(深圳)有限公司,http://www.11467.com/shenzhen/co/364039.htm
广州多堡隆润滑科技有限公司,http://www.11467.com/shenzhen/co/369677.htm
深圳帆顺科技有限公司,http://www.11467.com/shenzhen/co/369674.htm
深圳金塑源（隆昌）工程塑料有限公司,http://www.11467.com/shenzhen/co/369666.htm
深圳盛源通商贸有限公司,http://www.11467.com/shenzhen/co/369706.htm
深圳古兰实业有限公司,http://www.11467.com/shenzhen/co/369697.htm
深圳市宝安区天利丝印器材公司,http://www.11467.com/shenzhen/co/275041.htm
深圳森莱国际有限公司,http://www.11467.com/shenzhen/co/110851.htm
深圳市长基润滑技术有限公司,http://www.11467.com/shenzhen/co/369483.htm
深圳市德莱仕科技有限公司,http://www.11467.com/shenzhen/co/724118.htm
深圳市登尔辉科技有限公司,http://www.11467.com/shenzhen/co/369693.htm
深圳海翔贸易有限公司,http://www.11467.com/shenzhen/co/369636.htm
深圳市邦力兴实业有限公司,http://www.11467.com/shenzhen/co/88043.htm
日信商事贸易(深圳)有限公司,http://www.11467.com/shenzhen/co/369632.htm
华鑫达特种印刷器材有限公司,http://www.11467.com/shenzhen/co/369663.htm
深圳市德兹进出口贸易公司,http://www.11467.com/shenzhen/co/369673.htm
深圳世纪经典检测仪器有限公司,http://www.11467.com/shenzhen/co/369647.htm
深圳市翱翔科技股份有限公司,http://www.11467.com/shenzhen/co/105403.htm
深圳昌业隆机电设备有限公司,http://www.11467.com/shenzhen/co/369731.htm
深圳市好顺电工有限公司,http://www.11467.com/shenzhen/co/63413.htm
深圳市博贸易有限公司,http://www.11467.com/shenzhen/co/369711.htm
深圳市碧波制冷设备有限公司售后部,http://www.11467.com/shenzhen/co/369645.htm
千代田机工贸易有限公司,http://www.11467.com/shenzhen/co/369646.htm
深圳市恒科达（检测仪器）有限公司,http://www.11467.com/shenzhen/co/369479.htm
深圳市富通宇科技有限公司,http://www.11467.com/shenzhen/co/369692.htm
深圳市创佳五金塑胶制品有限公司,http://www.11467.com/shenzhen/co/369642.htm
深圳市集电科技有限公司BECTRON项目部,http://www.11467.com/shenzhen/co/416129.htm
深圳市恒丰电子工具仪器有限公司,http://www.11467.com/shenzhen/co/369675.htm
深圳市景中甜实业有限公司,http://www.11467.com/shenzhen/co/65991.htm
深圳市兰克贸易有限公司(业务部),http://www.11467.com/shenzhen/co/369643.htm
深圳诺金报关有限公司,http://www.11467.com/shenzhen/co/369640.htm
深圳市金溢盈科技有限公司销售部,http://www.11467.com/shenzhen/co/369634.htm
深圳市凌浩天电子有限公司,http://www.11467.com/shenzhen/co/369650.htm
深圳市科广电自动化设备有限公司,http://www.11467.com/shenzhen/co/411833.htm
深圳市联和鑫发展有限公司,http://www.11467.com/shenzhen/co/369723.htm
深圳精佳电子科技有限公司,http://www.11467.com/shenzhen/co/521564.htm
深圳巨光匠科技有限公司,http://www.11467.com/shenzhen/co/369648.htm
深圳市瑞科科技有限公司,http://www.11467.com/shenzhen/co/319485.htm
深圳市满天星国际贸易有限公司,http://www.11467.com/shenzhen/co/369684.htm
深圳市纳斯维亚贸易有限公司,http://www.11467.com/shenzhen/co/369633.htm
深圳市泰美乐商贸有限公司,http://www.11467.com/shenzhen/co/725807.htm
深圳市永虹达超声波设备有限公司(销售部),http://www.11467.com/shenzhen/co/111903.htm
深圳市新天西域经贸有限公司,http://www.11467.com/shenzhen/co/369485.htm
深圳市新亚电子制程股份有限公司赛格分公司,http://www.11467.com/shenzhen/co/369652.htm
深圳市源致科技有限公司,http://www.11467.com/shenzhen/co/369631.htm
深圳市好时日工业设备公司,http://www.11467.com/shenzhen/co/369687.htm
深圳市双玉技术有限公司,http://www.11467.com/shenzhen/co/369698.htm
深圳市大正通贸易有限公司,http://www.11467.com/shenzhen/co/725808.htm
深圳市新源达器材设备有限公司,http://www.11467.com/shenzhen/co/6207.htm
深圳住友化工有限公司,http://www.11467.com/shenzhen/co/369658.htm
深圳市一鸣化工有限公司(业务部),http://www.11467.com/shenzhen/co/369475.htm
深圳市诸洲行进出口贸易有限公司,http://www.11467.com/shenzhen/co/338362.htm
天龙服务公司,http://www.11467.com/shenzhen/co/369678.htm
深圳市智高过程控制设备有限公司经营部,http://www.11467.com/shenzhen/co/369701.htm
深圳市新杉本贸易有限公司业务部,http://www.11467.com/shenzhen/co/484367.htm
亿洋精密五金实业有限公司,http://www.11467.com/shenzhen/co/369651.htm
相门贸易公司,http://www.11467.com/shenzhen/co/369639.htm
中通塑胶技术顾问有限公司,http://www.11467.com/shenzhen/co/99146.htm
亿事通财务公司,http://www.11467.com/shenzhen/co/369716.htm
旭精工力申实业有限公司,http://www.11467.com/shenzhen/co/499922.htm
深圳沃能科技有限公司,http://www.11467.com/shenzhen/co/369478.htm
深圳满威贸易公司,http://www.11467.com/shenzhen/co/369653.htm
河北斯威特淀粉糖技术开发有限责任公司,http://www.11467.com/shijiazhuang/co/86612.htm
石家庄市广盛源化工贸易有限公司,http://www.11467.com/shijiazhuang/co/86614.htm
湖北随州东特防腐设备有限公司,http://www.11467.com/suizhou/co/8087.htm
随州市星火汽车零部件有限公司,http://www.11467.com/suizhou/co/11548.htm
湖北程力专用汽车有限公司销售部,http://www.11467.com/suizhou/co/11303.htm
宿迁市神工机电水暖技术服务有限公司,http://www.11467.com/suqian/co/11202.htm
苏州迪泰奇贸易有限公司,http://www.11467.com/suzhou/co/227027.htm
苏州市苏旺机械有限公司,http://www.11467.com/suzhou/co/226988.htm
苏州市骏杰经贸有限公司,http://www.11467.com/suzhou/co/226985.htm
昆山翔翎自动化工程有限公司,http://www.11467.com/suzhou/co/235063.htm
苏州市恒协机械有限公司,http://www.11467.com/suzhou/co/229737.htm
上海洛邦化工有限公司苏州办事处,http://www.11467.com/suzhou/co/227036.htm
苏州昌利电子有限公司工程部,http://www.11467.com/suzhou/co/227025.htm
苏州飞泽电子科技有限公司,http://www.11467.com/suzhou/co/227024.htm
武略化工有限公司,http://www.11467.com/suzhou/co/227030.htm
山西科视无损检测工程技术有限公司,http://www.11467.com/taiyuan/co/84756.htm
太原诚利来表面技术有限公司,http://www.11467.com/taiyuan/co/43508.htm
太原市鑫润达润滑油公司,http://www.11467.com/taiyuan/co/92102.htm
江苏恒德力化工设备有限公司,http://www.11467.com/taizhoushi/co/49179.htm
唐山中北贸易有限公司,http://www.11467.com/tangshan/co/56142.htm
上海楚汉国际贸易有限公司武汉公司,http://www.11467.com/wuhan/co/75414.htm
湖北易方达商贸有限公司,http://www.11467.com/wuhan/co/75409.htm
武汉飞羽科技有限公司,http://www.11467.com/wuhan/co/54541.htm
武汉圣达电器有限公司,http://www.11467.com/wuhan/co/75411.htm
武汉中正化工设备有限公司销售部,http://www.11467.com/wuhan/co/83369.htm
逍遥游有限公司,http://www.11467.com/wuhan/co/75416.htm
重庆里博仪器有限公司武汉销售部,http://www.11467.com/wuhan/co/75405.htm
晶晶化学有限公司武汉办事处,http://www.11467.com/wuhan/co/75407.htm
武汉力友工程有限责任公司,http://www.11467.com/wuhan/co/75415.htm
武汉誉洁科贸有限公司,http://www.11467.com/wuhan/co/75412.htm
芜湖加尔贸易有限公司,http://www.11467.com/wuhu/co/20535.htm
上海绿涯环境技术工程有限公司,http://www.11467.com/wulumuqi/co/92239.htm
新疆万通设备有限公司,http://www.11467.com/wulumuqi/co/87954.htm
新疆万亚贸易有限公司,http://www.11467.com/wulumuqi/co/92253.htm
青岛三丰量仪精密工具有限公司,http://www.11467.com/wuxi/co/176419.htm
无锡华泰机电设备有限公司,http://www.11467.com/wuxi/co/188510.htm
无锡佳德代理有限公司,http://www.11467.com/wuxi/co/174009.htm
无锡市摩力克分子筛有限公司,http://www.11467.com/wuxi/co/188594.htm
无锡市诺亚机械有限公司,http://www.11467.com/wuxi/co/188595.htm
无锡市新洲化工试剂有限公司,http://www.11467.com/wuxi/co/188592.htm
厦门工贸有限公司,http://www.11467.com/xiamen/co/26642.htm
厦门生本进出口有限公司,http://www.11467.com/xiamen/co/46845.htm
福建省厦门利钧贸易有限公司,http://www.11467.com/xiamen/co/46823.htm
厦门海弘信商贸有限公司,http://www.11467.com/xiamen/co/45316.htm
厦门腾飞贸易有限公司(业务部),http://www.11467.com/xiamen/co/46854.htm
厦门骏皇达贸易有限公司,http://www.11467.com/xiamen/co/46852.htm
陕西海晟化工科技有限公司,http://www.11467.com/xian/co/63944.htm
陕西海晟化工科技有限公司(油墨专用原材料),http://www.11467.com/xian/co/63946.htm
陕西秦虎高科线缆有限公司1,http://www.11467.com/xian/co/63948.htm
上海飞和实业集团西安分公司,http://www.11467.com/xian/co/50378.htm
晨龙锁具有限公司,http://www.11467.com/xian/co/64129.htm
西部金属材料股份有限公司压容厂,http://www.11467.com/xian/co/66942.htm
