安徽省宿州市海诚环保科技有限公司,http://www.11467.com/suzhoushi/co/17887.htm
太原市科仕达有限公司,http://www.11467.com/taiyuan/co/96138.htm
太原市新星原机械有限公司,http://www.11467.com/taiyuan/co/73559.htm
太原市塑信科贸有限公司,http://www.11467.com/taiyuan/co/37901.htm
泰州市晨光波纹管有限公司,http://www.11467.com/taizhoushi/co/29030.htm
铜陵市恒发环保产业有限责任公司,http://www.11467.com/tongling/co/10793.htm
青州市金鼎设备制造有限公司,http://www.11467.com/weifang/co/83264.htm
上海恩可埃认证有限公司-产品拓展部,http://www.11467.com/wenzhou/co/140859.htm
温州凌霄贸易有限公司,http://www.11467.com/wenzhou/co/140858.htm
内蒙古乌海名贵腐植酸有限公司,http://www.11467.com/wuhai/co/3664.htm
内蒙古乌海市同盛商贸有限责任公司,http://www.11467.com/wuhai/co/3665.htm
湖北石油润滑油公司,http://www.11467.com/wuhan/co/27874.htm
湖北省针棉织品进出口公司,http://www.11467.com/wuhan/co/56470.htm
博大化学试剂仪器有限公司,http://www.11467.com/wuhan/co/75420.htm
武汉汉恩机械制造有限公司,http://www.11467.com/wuhan/co/75502.htm
武汉纳禄化工机电有限公司,http://www.11467.com/wuhan/co/54121.htm
武汉创想仪器设备有限公司,http://www.11467.com/wuhan/co/75421.htm
武汉雅静系统设备工程有限公司,http://www.11467.com/wuhan/co/42159.htm
武汉超全自动化公司,http://www.11467.com/wuhan/co/75417.htm
武汉时代创兴科技有限公司,http://www.11467.com/wuhan/co/54359.htm
武汉伟骅水电设备工程有限公司,http://www.11467.com/wuhan/co/54490.htm
武汉纳禄化工机电有限公司（2007）,http://www.11467.com/wuhan/co/54146.htm
武汉捷丰商贸有限公司,http://www.11467.com/wuhan/co/75418.htm
武汉天德士数码技术服务有限公司,http://www.11467.com/wuhan/co/75419.htm
武汉风帆商贸有限公司（业务部）,http://www.11467.com/wuhan/co/75404.htm
武汉研达科技器材有限公司,http://www.11467.com/wuhan/co/75406.htm
乌鲁木齐盛华金陵化工设备有限公司,http://www.11467.com/wulumuqi/co/92252.htm
阿拉山口盛坤贸易有限公司,http://www.11467.com/wulumuqi/co/88861.htm
乌鲁木齐德利丰物资有限公司(复盛授权新疆代理商),http://www.11467.com/wulumuqi/co/93286.htm
中国新疆乌鲁木齐高品位化工漆业有限公司,http://www.11467.com/wulumuqi/co/92247.htm
宋坤玻纤有限公司,http://www.11467.com/wulumuqi/co/92251.htm
瑞安（香港）有限公司,http://www.11467.com/wuxi/co/212937.htm
无锡市灿业不锈钢有限公司销售部,http://www.11467.com/wuxi/co/174088.htm
无锡信威机电科技有限公司,http://www.11467.com/wuxi/co/188596.htm
无锡市合众行贸易有限公司,http://www.11467.com/wuxi/co/188591.htm
无锡市雪湖特种仪表有限公司,http://www.11467.com/wuxi/co/188593.htm
厦门市宝能科技有限公司销售部,http://www.11467.com/xiamen/co/46844.htm
厦门市东方聚泰科技有限公司,http://www.11467.com/xiamen/co/46838.htm
貝克威(廈門)科技有限公司,http://www.11467.com/xiamen/co/46850.htm
厦门鑫日新空气净化设备有限公司,http://www.11467.com/xiamen/co/11018.htm
上海锦雍国际贸易有限公司厦门办事处,http://www.11467.com/xiamen/co/46851.htm
厦门金海润工贸有限公司,http://www.11467.com/xiamen/co/46853.htm
厦门鑫华科技有限公司,http://www.11467.com/xiamen/co/24260.htm
厦门颍川贸易公司,http://www.11467.com/xiamen/co/46824.htm
厦门市民丰商贸有限公司,http://www.11467.com/xiamen/co/20738.htm
陕西鑫朝石油科技有限公司,http://www.11467.com/xian/co/23323.htm
陕西鲁冰科技有限责任公司,http://www.11467.com/xian/co/63951.htm
陕西西安霸王传热技术有限公司,http://www.11467.com/xian/co/63947.htm
海浪销销售公司,http://www.11467.com/xian/co/63905.htm
西安德西罗茨鼓风机技术有限公司,http://www.11467.com/xian/co/47872.htm
陕西捷森科技发展有限公司,http://www.11467.com/xian/co/30064.htm
西安捷领石化技术有限公司,http://www.11467.com/xian/co/63949.htm
陕西华圣实业有限责任公司3333,http://www.11467.com/xian/co/63950.htm
陕西凯欣电力设备有限公司,http://www.11467.com/xian/co/69757.htm
西安天秦煤炭科技有限公司,http://www.11467.com/xian/co/50524.htm
西安纯雪化工有限公司,http://www.11467.com/xian/co/50616.htm
西安六备投资管理有限公司,http://www.11467.com/xian/co/63945.htm
广州尚博贸易有限公司西安办事处,http://www.11467.com/xian/co/63952.htm
湘潭市诺方贸易有限公司,http://www.11467.com/xiangtan/co/24144.htm
光明商贸责任有限公司,http://www.11467.com/xianyang/co/21508.htm
连云港大元国际物流有限公司徐州分公司1,http://www.11467.com/xuzhou/co/55140.htm
飞天科技有限责任公司,http://www.11467.com/xuzhou/co/55141.htm
安徽卧龙泵阀有限责任公司徐州分公司,http://www.11467.com/xuzhou/co/48133.htm
陕西延安鸿林工贸有限责任公司,http://www.11467.com/yanan/co/13568.htm
江苏苏亚金诚资产有限公司,http://www.11467.com/yangzhou/co/80978.htm
仪征市恩特仪表科技发展有限公司,http://www.11467.com/yangzhou/co/94822.htm
烟台丰德经贸有限公司,http://www.11467.com/yantai/co/123704.htm
宜昌市清江开发有限公司,http://www.11467.com/yichang/co/44747.htm
湖北滢华贸易有限责任公司,http://www.11467.com/yichang/co/44745.htm
恒华物流有限公司,http://www.11467.com/yingkou/co/42173.htm
榆林瀚昌科工贸有限责任公司,http://www.11467.com/yulinshi/co/19526.htm
永济狼腾化工产品销售有限公司,http://www.11467.com/yuncheng/co/26818.htm
深圳市海川宏科技有限公司,http://www.11467.com/yunfu/co/19241.htm
河南省福顺德商贸有限公司销售部,http://www.11467.com/zhengzhou/co/112424.htm
郑州中科教学仪器设备有限公司,http://www.11467.com/zhengzhou/co/112420.htm
郑州豫兴机电贸易有限公司,http://www.11467.com/zhengzhou/co/54987.htm
郑州鑫隆仪器仪表有限公司,http://www.11467.com/zhengzhou/co/112423.htm
河南德豫科技发展有限公司,http://www.11467.com/zhengzhou/co/112426.htm
郑州好德医疗器械有限公司销售部,http://www.11467.com/zhengzhou/co/112421.htm
河南泽杰物贸有限公司,http://www.11467.com/zhoukou/co/17274.htm
珠海市龙神有限公司,http://www.11467.com/zhuhai/co/49331.htm
珠海艾美特贸易有限公司,http://www.11467.com/zhuhai/co/73722.htm
鸿陆工贸有限公司,http://www.11467.com/zhuhai/co/73724.htm
海川精细化工有限公司,http://www.11467.com/zibo/co/74039.htm
淄博方鼎不锈钢有限公司,http://www.11467.com/zibo/co/74115.htm
保定华益有色金属加工熔炼有限公司北京分公司,http://www.11467.com/beijing/co/103079.htm
北京爱特尔电子科技有限公司,http://www.11467.com/beijing/co/84311.htm
北京北宇机械有限公司,http://www.11467.com/beijing/co/404850.htm
北京奥泰国隆石油化工物资有限公司,http://www.11467.com/beijing/co/103068.htm
北京嘉盛德国际贸易有限公司 业务部,http://www.11467.com/beijing/co/620931.htm
北京旌凯华冠工贸有限责任公司,http://www.11467.com/beijing/co/103077.htm
北京欧能科技发展有限公司刘猛,http://www.11467.com/beijing/co/651282.htm
北京市德思诺科技开发有限责任公司,http://www.11467.com/beijing/co/671907.htm
北京市康星鑫辉科贸有限公司,http://www.11467.com/beijing/co/312352.htm
北京瑞昂特科技有限公司(市场部）,http://www.11467.com/beijing/co/404848.htm
北京拓海贸易公司,http://www.11467.com/beijing/co/620933.htm
北京新兴科瑞达机电有限公司贸易部,http://www.11467.com/beijing/co/404855.htm
北京市北联讯通科技有限公司,http://www.11467.com/beijing/co/103073.htm
美国Chemilizer公司中国代表处,http://www.11467.com/beijing/co/404857.htm
北京亚太久宏科贸有限公司（国际贸易部）,http://www.11467.com/beijing/co/83577.htm
北京欣经科生物技术有限公司,http://www.11467.com/beijing/co/404849.htm
北京天乙泰来咨讯有限责任公司,http://www.11467.com/beijing/co/312353.htm
北京中兵华信国际贸易有限公司,http://www.11467.com/beijing/co/404852.htm
北京朗盛化工有限公司,http://www.11467.com/beijing/co/103076.htm
华阳国际控股有限公司,http://www.11467.com/shanghai/co/668501.htm
集华仪器新加坡有限公司,http://www.11467.com/shanghai/co/938456.htm
上海华湛飞灰处理系统有限公司,http://www.11467.com/shanghai/co/668502.htm
美国耀星国际股份有限公司,http://www.11467.com/shanghai/co/376813.htm
上海利岛化工物资有限公司项目部,http://www.11467.com/shanghai/co/40514.htm
上海慧信商标代理有限公司.,http://www.11467.com/shanghai/co/974230.htm
上海杰瑞贸易有限公司,http://www.11467.com/shanghai/co/668498.htm
上海华斯利国际货物运输代理有限公司(销售部）,http://www.11467.com/shanghai/co/214384.htm
上海浦淼信息科技有限公司,http://www.11467.com/shanghai/co/258545.htm
美国策融公司上海代表处,http://www.11467.com/shanghai/co/247564.htm
上海唐霸石油化工有限公司,http://www.11467.com/shanghai/co/613765.htm
上海久久兄弟合作有限公司,http://www.11467.com/shanghai/co/974235.htm
上海思广公司,http://www.11467.com/shanghai/co/884541.htm
广州傲能屹立燃气设备有限公司,http://www.11467.com/guangzhou/co/275183.htm
格尔木市达利尔机械工程有限责任公司,http://www.11467.com/haixi/co/498.htm
南京瑞霞涂装有限公司,http://www.11467.com/nanjing/co/24526.htm
昆山德源环保发展有限公司,http://www.11467.com/suzhou/co/154563.htm
上海全化贸易有限公司塑胶板材事业部,http://www.11467.com/shanghai/co/668505.htm
上海梓澜实业有限公司,http://www.11467.com/shanghai/co/668500.htm
上海锐泽化工机械有限公司(销售部),http://www.11467.com/shanghai/co/668504.htm
斯特尔贸易（上海）有限公司,http://www.11467.com/shanghai/co/884542.htm
上海品哲贸易有限公司,http://www.11467.com/shanghai/co/22278.htm
上海胜油国际贸易有限公司,http://www.11467.com/shanghai/co/668503.htm
正铁兴有限公司上海代表处,http://www.11467.com/shanghai/co/1010023.htm
戰雪中国贸易公司,http://www.11467.com/shanghai/co/884539.htm
上海中化工程有限公司,http://www.11467.com/shanghai/co/668497.htm
天津嘉盟工贸有限公司,http://www.11467.com/tianjin/co/75060.htm
天津络赛生物科技有限公司,http://www.11467.com/tianjin/co/140932.htm
天津市艾尔特公司,http://www.11467.com/tianjin/co/88806.htm
天津鼎盛烨进出口贸易有限公司,http://www.11467.com/tianjin/co/162562.htm
天津汉林通商科技公司,http://www.11467.com/tianjin/co/140934.htm
天津威茨水工业阀门销售有限公司,http://www.11467.com/tianjin/co/162564.htm
天津市泽宇商贸有限公司,http://www.11467.com/tianjin/co/146175.htm
天津新冠贸易有限公司,http://www.11467.com/tianjin/co/88808.htm
天津浩荣机电设备有限公司泵阀部,http://www.11467.com/tianjin/co/162563.htm
重庆华佳机电有限公司,http://www.11467.com/chongqing/co/52520.htm
重庆英浪家政服务有限公司,http://www.11467.com/chongqing/co/78082.htm
天津鹏达世纪工贸有限公司,http://www.11467.com/tianjin/co/300634.htm
天津彪仕奇色谱耗材有限公司,http://www.11467.com/tianjin/co/300639.htm
天津嘉城国际货运有限公司,http://www.11467.com/tianjin/co/305304.htm
天津元泰贸易有限公司,http://www.11467.com/tianjin/co/308167.htm
海业贸易批发有限公司,http://www.11467.com/tianjin/co/308168.htm
天津开发区泰生科技有限公司,http://www.11467.com/tianjin/co/308171.htm
福建萨普石油有限公司,http://www.11467.com/xiamen/co/139339.htm
开启餐饮有限公司,http://www.11467.com/qiye/93418354.htm
佛山市顺德区三合化工机械有限公司,http://www.11467.com/foshan/co/343710.htm
珠海市凯利达电子材料有限公司,http://www.11467.com/zhuhai/co/73719.htm
山东梁山航天油脂设备有限公司,http://www.11467.com/jining/co/71404.htm
广州市银霖化工有限公司,http://www.11467.com/guangzhou/co/115046.htm
张家港市通宇机械制造有限公司,http://www.11467.com/suzhou/co/127656.htm
郑州海光日化用品有限公司,http://www.11467.com/zhengzhou/co/112418.htm
无锡名鼎不锈钢有限公司,http://www.11467.com/wuxi/co/251575.htm
深圳市佳力仕胶粘技术有限公司,http://www.11467.com/shenzhen/co/785208.htm
深圳虎鯊貿易有限公司,http://www.11467.com/shenzhen/co/721847.htm
佛山市顺德区宝晟贸易有限公司,http://www.11467.com/foshan/co/343647.htm
陕西生益科技有限公司,http://www.11467.com/baoji/co/25102.htm
河北泊头华泰接木胶有限公司,http://www.11467.com/cangzhou/co/60789.htm
吉林省中天化工经贸有限公司,http://www.11467.com/changchun/co/65030.htm
容泽成机械工程运输公司,http://www.11467.com/chengde/co/28603.htm
成都紫外涂料实业有限公司,http://www.11467.com/chengdu/co/213339.htm
杭州赛尔泰科技有限公司(销售部）,http://www.11467.com/hangzhou/co/246530.htm
杭州美滤博科贸有限公司,http://www.11467.com/hangzhou/co/259243.htm
内蒙古元原科贸发展有限公司,http://www.11467.com/huhehaote/co/25535.htm
贵富农资公司,http://www.11467.com/huludao/co/45875.htm
济南赋彩涂料调色技术有限公司,http://www.11467.com/jinan/co/133838.htm
山东国运二手化工购销公司,http://www.11467.com/jinan/co/133817.htm
深圳天鼎精细化工制造有限公司,http://www.11467.com/shenzhen/co/701813.htm
湖北程力专用汽车有限公司专用汽车市场销售部,http://www.11467.com/suizhou/co/10563.htm
湖北武汉科尔富泵业有限公司,http://www.11467.com/wuhan/co/75408.htm
辽宁关东化工填料机械有限公司,http://www.11467.com/liaoyang/co/22543.htm
梅州市捷成贸易有限公司,http://www.11467.com/meizhou/co/23059.htm
南京东森自动化控制系统有限公司,http://www.11467.com/nanjing/co/53447.htm
华友化工国际贸易（上海）有限公司,http://www.11467.com/shenzhen/co/369670.htm
广州顺延化工有限公司,http://www.11467.com/guangzhou/co/468825.htm
广州市医信科技有限公司,http://www.11467.com/guangzhou/co/246408.htm
江西超富清洁用品有限公司,http://www.11467.com/fuzhoushi/co/18646.htm
云南云叶化肥股份有限公司,http://www.11467.com/kunming/co/101902.htm
梁山县龙跃二手油脂设备购销公司,http://www.11467.com/jining/co/73366.htm
兆云二手化工油脂设备购销有限公司,http://www.11467.com/jining/co/71909.htm
郑州商鸿经贸有限公司,http://www.11467.com/zhengzhou/co/112419.htm
北京博越捷创环境工程有限公司,http://www.11467.com/beijing/co/697783.htm
天津市华北实验仪器有限公司．,http://www.11467.com/tianjin/co/188203.htm
迈达斯化工有限公司,http://www.11467.com/shenyang/co/101472.htm
鞍山市同辉科技发展有限公司,http://www.11467.com/anshan/co/70483.htm
包头市东兴锅炉压力容器有限公司,http://www.11467.com/baotou/co/8568.htm
巴彦淖尔市中汇工贸有限公司,http://www.11467.com/bayannaoer/co/4326.htm
内蒙古联邦制药有限公司,http://www.11467.com/bayannaoer/co/4327.htm
安徽省亳州市众乐装饰广告有限公司,http://www.11467.com/bozhou/co/8862.htm
鹏程二手化工设备回收公司,http://www.11467.com/cangzhou/co/60461.htm
新兴化工设备公司,http://www.11467.com/cangzhou/co/60462.htm
河北沧州河间光辉公司,http://www.11467.com/cangzhou/co/60776.htm
长春市莱科科技贸易有限公司,http://www.11467.com/changchun/co/73293.htm
康可尔机械有限公司,http://www.11467.com/changchun/co/74730.htm
浙江博佳电机有限公司长沙分公司,http://www.11467.com/changsha/co/83250.htm
山西省长治市潞奥畅通物资有限公司,http://www.11467.com/changzhi/co/26161.htm
常州高远化工有限公司芳纶纤维部,http://www.11467.com/changzhou/co/101829.htm
常州市益球中亚干燥设备有限公司(营销部),http://www.11467.com/changzhou/co/101828.htm
华信嘉电子有限公司1,http://www.11467.com/changzhou/co/101831.htm
山东鹏达二手化工油脂设备购销公司,http://www.11467.com/jining/co/72326.htm
山东理顺二手油脂化工设备购销公司,http://www.11467.com/jining/co/72646.htm
嘉盛二手油脂设备公司,http://www.11467.com/jining/co/72644.htm
兴昌二手油脂化工设备购销公司,http://www.11467.com/jining/co/71414.htm
聊城恒达管有限公司,http://www.11467.com/liaocheng/co/28920.htm
洛阳市泰禾商贸有限公司,http://www.11467.com/luoyang/co/35538.htm
达任胶粘剂(南京)有限公司,http://www.11467.com/nanjing/co/73217.htm
南京恒尔驰高分子材料科技有限公司,http://www.11467.com/nanjing/co/73202.htm
江苏绿源新材料有限公司销售部,http://www.11467.com/nantong/co/138507.htm
山东欣凯工贸有限公司,http://www.11467.com/qingdao/co/154558.htm
青岛德信源工贸有限公司,http://www.11467.com/qingdao/co/155907.htm
秦皇岛金欧化工机械有限公司,http://www.11467.com/qinhuangdao/co/45833.htm
深圳市锦铭科技有限公司,http://www.11467.com/shenzhen/co/506340.htm
深圳市精声电声实业有限公司,http://www.11467.com/shenzhen/co/65897.htm
深圳市新杉本贸易有限公司广州事务部,http://www.11467.com/shenzhen/co/369635.htm
深圳焱辉胶粘剂有限公司,http://www.11467.com/shenzhen/co/799227.htm
苏州市腾达化工原料有限公司,http://www.11467.com/suzhou/co/227031.htm
温州市芬尼奇皮具修饰科技开发有限公司,http://www.11467.com/wenzhou/co/224303.htm
武汉忠能自动化设备有限公司,http://www.11467.com/wuhan/co/77253.htm
武汉三友石化有限公司,http://www.11467.com/wuhan/co/75410.htm
武汉惠浦科技发展有限公司,http://www.11467.com/wuhan/co/82631.htm
乌鲁木齐盛世天成汽车销售有限公司,http://www.11467.com/wulumuqi/co/103157.htm
无锡云通石化装备有限公司,http://www.11467.com/wuxi/co/152789.htm
厦门鑫龙佳工贸有限公司,http://www.11467.com/xiamen/co/82667.htm
江苏瑞隆化工(宿州)有限公司,http://www.11467.com/xuzhou/co/81102.htm
上海彬泰特钢有限公司,http://www.11467.com/yangzhou/co/80977.htm
榆林市中润工贸有限公司,http://www.11467.com/yulinshi/co/19564.htm
施达优化工有限公司,http://www.11467.com/zhengzhou/co/176067.htm
河南硕达物资公司,http://www.11467.com/zhengzhou/co/177894.htm
天津市侨盛兴业商贸有限公司,http://www.11467.com/tianjin/co/300635.htm
常州市远洋干燥有限公司,http://www.11467.com/changzhou/co/101830.htm
常州英特机电技术有限公司市场部,http://www.11467.com/changzhou/co/88076.htm
蓝翔贸易有限责任公司,http://www.11467.com/chifeng/co/22688.htm
大连锐航国际货运代理有限公司总部,http://www.11467.com/dalian/co/45145.htm
大连铂斯特润滑油有限公司,http://www.11467.com/dalian/co/45146.htm
天利顺信息咨询有限公司,http://www.11467.com/dalian/co/45148.htm
大连希迈自动化科技有限公司销售中心,http://www.11467.com/dalian/co/45142.htm
大连胜光科技发展有限公司-技术部,http://www.11467.com/dalian/co/45143.htm
虎目信投咨询有限公司投资咨询部,http://www.11467.com/dandong/co/46391.htm
大庆市宝凯经贸有限公司,http://www.11467.com/daqing/co/39842.htm
大竹县李先进涂料有限公司,http://www.11467.com/dazhou/co/20666.htm
四川什邡市金地亚美化工有限公司,http://www.11467.com/deyang/co/31487.htm
北京中恒高博知识产权代理有限公司东莞分公司法务部,http://www.11467.com/dongguan/co/232428.htm
东莞凯威尔电子材料有限公司销售部,http://www.11467.com/dongguan/co/121586.htm
东莞三义化工有限公司,http://www.11467.com/dongguan/co/232430.htm
东莞胜利物流有限公司,http://www.11467.com/dongguan/co/232429.htm
东莞市22利业代理责任有限公司,http://www.11467.com/dongguan/co/232413.htm
东莞市辰启贸易有限公司,http://www.11467.com/dongguan/co/490027.htm
东莞华港国际贸易有限公司,http://www.11467.com/dongguan/co/217393.htm
东莞华达化工原料有限公司,http://www.11467.com/dongguan/co/232404.htm
东莞市南越电子材料有限公司,http://www.11467.com/dongguan/co/497095.htm
东莞市胜威化工有限公司（销售部）,http://www.11467.com/dongguan/co/232400.htm
东莞市日力涂装机械有限公司,http://www.11467.com/dongguan/co/294499.htm
东莞市瑞润化工有限公司（市场部）,http://www.11467.com/dongguan/co/232405.htm
东莞市祥邦塑胶原料有限公司,http://www.11467.com/dongguan/co/232417.htm
东莞市英特尔电子科技有限公司,http://www.11467.com/dongguan/co/232411.htm
广东东莞天宇印刷机械有限公司,http://www.11467.com/dongguan/co/328190.htm
东莞市华艺铜业有限公司,http://www.11467.com/dongguan/co/232406.htm
东莞粤丰化工有限公司,http://www.11467.com/dongguan/co/127388.htm
东莞市文宏(金果)实业有限公司,http://www.11467.com/dongguan/co/232420.htm
金洋压铸有限公司,http://www.11467.com/dongguan/co/277110.htm
华明化工原料有限公司,http://www.11467.com/dongguan/co/146019.htm
骏越塑胶原料有限公司,http://www.11467.com/dongguan/co/232399.htm
广卫电子科技有限公司行销部,http://www.11467.com/dongguan/co/232426.htm
深圳新亚工具雁田分公司,http://www.11467.com/dongguan/co/232424.htm
宏创自动化科技有限公司,http://www.11467.com/dongguan/co/245767.htm
正大科技化工有限公司,http://www.11467.com/dongguan/co/232402.htm
东莞市哲丰贸易有限公司,http://www.11467.com/dongguan/co/78979.htm
香港谱琳化妆品有限公司东莞分公司,http://www.11467.com/dongguan/co/232401.htm
新亚电子工具连锁店有限公司东莞分公司,http://www.11467.com/dongguan/co/232423.htm
业伟电子材料有限公司,http://www.11467.com/dongguan/co/125447.htm
万航国际货运代理有限公司-东莞部,http://www.11467.com/dongguan/co/232416.htm
唯达焊料科技（东莞）有限公司,http://www.11467.com/dongguan/co/232419.htm
广东港亚热熔胶有限公司,http://www.11467.com/dongguan/co/497094.htm
广东二手旧机电进口报关备案中检公司,http://www.11467.com/dongguan/co/494896.htm
东营市胜创石油化工设备有限公司,http://www.11467.com/dongying/co/39473.htm
东营沃融科贸有限公司,http://www.11467.com/dongying/co/19829.htm
安好国际贸易有限公司,http://www.11467.com/erlianhaote/co/614.htm
佛山市洪鹏化工设备制造有限公司,http://www.11467.com/foshan/co/226054.htm
佛山市南海科玛斯自动化设备有限公司,http://www.11467.com/foshan/co/305835.htm
佛山市阳光科技有限公司,http://www.11467.com/foshan/co/225633.htm
佛山雅诺卡机电工程有限公司,http://www.11467.com/foshan/co/187750.htm
佛山市双环机电配套有限公司,http://www.11467.com/foshan/co/225630.htm
王田化工汽车美容有限公司,http://www.11467.com/foshan/co/225627.htm
佛山市志盛化工塑料有限公司,http://www.11467.com/foshan/co/225628.htm
世纪创佳材料有限公司,http://www.11467.com/foshan/co/225631.htm
广东省佛山市普瑞斯化工有限公司,http://www.11467.com/foshan/co/338027.htm
福州瑞捷测控技术有限公司,http://www.11467.com/fuzhou/co/130878.htm
福州仁宝贸易有限公司,http://www.11467.com/fuzhou/co/122136.htm
福州伟希进出口有限公司,http://www.11467.com/fuzhou/co/143015.htm
赣州盛德涂装工程有限公司,http://www.11467.com/ganzhou/co/26926.htm
川田润滑油(广州)有限公司,http://www.11467.com/guangzhou/co/482146.htm
广州魅力行化妆品有限公司,http://www.11467.com/guangzhou/co/478695.htm
广的广告策划有限公司,http://www.11467.com/guangzhou/co/105427.htm
广东绿力生物科技有限公司`,http://www.11467.com/guangzhou/co/246378.htm
广州劲能进口叉车配件批发件有限公司,http://www.11467.com/guangzhou/co/246401.htm
广州艾碧希机械设备有限公司,http://www.11467.com/guangzhou/co/111650.htm
广州福大自动化科技有限公司,http://www.11467.com/guangzhou/co/246421.htm
广州市兴轩清洁用品有限公司,http://www.11467.com/guangzhou/co/246420.htm
广州西默科技机电有限公司,http://www.11467.com/guangzhou/co/460509.htm
广州智正财税服务有限公司,http://www.11467.com/guangzhou/co/246419.htm
广州智誠电子科技有限公司,http://www.11467.com/guangzhou/co/483970.htm
广州市伟冠贸易有限公司业务部,http://www.11467.com/guangzhou/co/246412.htm
上海帕卓输送传动机械配件有限公司广州办,http://www.11467.com/guangzhou/co/246415.htm
寅驰跨国采购担保有限公司广州分公司,http://www.11467.com/guangzhou/co/122790.htm
广州征科化工有限公司,http://www.11467.com/guangzhou/co/477373.htm
广州宏为自动化科技有限公司业务部,http://www.11467.com/guangzhou/co/276202.htm
信宏实业有限公司_美国马士达中国总代理,http://www.11467.com/guangzhou/co/246405.htm
广西弘天票票实业有限公司,http://www.11467.com/guilin/co/43382.htm
雨瀚国际销售公司,http://www.11467.com/guiyang/co/75289.htm
邯郸市洁明水处理工程有限公司,http://www.11467.com/handan/co/48956.htm
杭州大兆汽车贸易有限公司,http://www.11467.com/hangzhou/co/370958.htm
