周口腾飞油嘴油泵有限公司,http://www.11467.com/zhoukou/co/17367.htm
岱山县卡乐汽车配件制造有限公司,http://www.11467.com/zhoushan/co/19480.htm
舟山市奥美奇石油化工有限公司,http://www.11467.com/zhoushan/co/17007.htm
岱山县威尔密封件有限公司,http://www.11467.com/zhoushan/co/19484.htm
海博瑞德(北京)汽车技术有限公司,http://www.11467.com/beijing/co/702503.htm
上海贝尼汽车科技有限公司,http://www.11467.com/shanghai/co/426758.htm
上海郎特汽车净化器有限公司,http://www.11467.com/shanghai/co/878034.htm
安徽华祥实业有限公司,http://www.11467.com/anqing/co/16962.htm
包头汇众铝合金锻造有限公司,http://www.11467.com/baotou/co/27145.htm
蚌埠通达汽车零部件有限公司,http://www.11467.com/bengbu/co/28147.htm
沧州精工活塞工业有限公司,http://www.11467.com/cangzhou/co/61521.htm
长春怀林机械工程材料科技有限公司,http://www.11467.com/changchun/co/75700.htm
常德华海液压机械制造有限公司,http://www.11467.com/changde/co/35140.htm
长沙金岭数控磨床有限公司,http://www.11467.com/changsha/co/85400.htm
湖南飞碟新材料有限责任公司长沙分公司,http://www.11467.com/changsha/co/61845.htm
湖南正圆动力配件有限公司,http://www.11467.com/changsha/co/81167.htm
长沙驰鹰机械制造有限公司,http://www.11467.com/changsha/co/97884.htm
常州市新瑞汽车配件制造有限公司,http://www.11467.com/changzhou/co/112739.htm
常州市长昊机械有限公司,http://www.11467.com/changzhou/co/100116.htm
安徽华工汽车电子科技有限公司,http://www.11467.com/chaohu/co/20093.htm
成都新明商贸有限公司,http://www.11467.com/chengdu/co/98291.htm
成都市天马汽车有限责任公司,http://www.11467.com/chengdu/co/216282.htm
四川红光汽车机电有限公司,http://www.11467.com/chengdu/co/214052.htm
四川中自尾气净化有限公司,http://www.11467.com/chengdu/co/110737.htm
大连新重集团有限公司,http://www.11467.com/dalian/co/36012.htm
东莞久力气动液压有限公司,http://www.11467.com/dongguan/co/494526.htm
東莞玖容氣動液壓有限公司,http://www.11467.com/dongguan/co/507931.htm
东莞翔龙汽配有限公司,http://www.11467.com/dongguan/co/294398.htm
广东省冠杰塑胶模具有限公司,http://www.11467.com/dongguan/co/507364.htm
本田金属技术(佛山)有限公司,http://www.11467.com/foshan/co/347388.htm
福卅寓群五金制品有限公司,http://www.11467.com/fuzhou/co/182255.htm
福州泰维克汽车配件有限公司,http://www.11467.com/fuzhou/co/40558.htm
福州好闽兴汽车配件有限公司,http://www.11467.com/fuzhou/co/33518.htm
广东则良蓄电池有限公司市场部,http://www.11467.com/guangzhou/co/297031.htm
东风本田发动机有限公司,http://www.11467.com/guangzhou/co/238132.htm
广州龙腾汽车配件有限公司,http://www.11467.com/guangzhou/co/238178.htm
广州博瑞特汽摩配件有限公司,http://www.11467.com/guangzhou/co/462185.htm
广州华德汽车弹簧有限公司,http://www.11467.com/guangzhou/co/474991.htm
广州市欧瑞德汽车发动机科技有限公司,http://www.11467.com/guangzhou/co/465113.htm
广州创域油封有限公司,http://www.11467.com/guangzhou/co/480511.htm
广州春华汽车配件有限公司,http://www.11467.com/guangzhou/co/25825.htm
广州赛诺贸易有限公司,http://www.11467.com/guangzhou/co/236881.htm
广州松兴电器有限公司,http://www.11467.com/guangzhou/co/116285.htm
广州市迈拓进口汽车配件销售公司,http://www.11467.com/guangzhou/co/467621.htm
广州伟明汽配有限公司,http://www.11467.com/guangzhou/co/459043.htm
重庆金田塑料有限公司,http://www.11467.com/chongqing/co/8062.htm
重庆光灿机械有限公司,http://www.11467.com/chongqing/co/13070.htm
天津博威动力设备有限公司,http://www.11467.com/tianjin/co/301249.htm
凤城市东方增压器制造有限责任公司,http://www.11467.com/dandong/co/51898.htm
九江恒昌共轨电子商务有限公司,http://www.11467.com/qiye/93105461.htm
成都兴佳华自动变速箱技术服务有限公司,http://www.11467.com/qiye/93437012.htm
广州市锐鑫汽车配件有限公司,http://www.11467.com/guangzhou/co/296542.htm
广州易安达腐蚀科技有限公司,http://www.11467.com/guangzhou/co/296592.htm
舟山华意汽车配件制造有限公司,http://www.11467.com/guangzhou/co/237229.htm
广州寰鑫贸易有限公司,http://www.11467.com/guangzhou/co/28088.htm
贵州高山贸易有限公司,http://www.11467.com/guiyang/co/48962.htm
贵州金泰科技发展有限公司,http://www.11467.com/guiyang/co/51671.htm
贵阳平衡机制造有限公司,http://www.11467.com/guiyang/co/83178.htm
哈尔滨市天平贸易有限公司,http://www.11467.com/haerbin/co/48569.htm
杭州昶宏贸易有限公司,http://www.11467.com/hangzhou/co/174325.htm
杭州康特尔发电机有限公司,http://www.11467.com/hangzhou/co/370652.htm
杭州肯来特传动工业有限公司,http://www.11467.com/hangzhou/co/372604.htm
浙江启博机械有限公司,http://www.11467.com/hangzhou/co/370650.htm
合肥恒信汽车发动机部件制造有限公司,http://www.11467.com/hefei/co/88258.htm
上海科星机械工程有限公司合肥办事处,http://www.11467.com/hefei/co/133395.htm
安徽安兴活塞环有限公司,http://www.11467.com/hefei/co/81878.htm
河北腾是达金属结构有限公司,http://www.11467.com/hengshui/co/33866.htm
江苏爱吉斯海珠机械有限公司,http://www.11467.com/huaian/co/21537.htm
湖北轩坤实业有限公司,http://www.11467.com/huanggang/co/17702.htm
浙江飞迪电动车有限公司,http://www.11467.com/huzhou/co/67237.htm
江门市本和密封技术开发有限公司,http://www.11467.com/jiangmen/co/116017.htm
嘉兴盘石轴承有限公司,http://www.11467.com/jiaxing/co/123294.htm
浙江赛亿汽车部件制造有限公司,http://www.11467.com/jiaxing/co/100508.htm
吉林市吉达软轴有限公司,http://www.11467.com/jilinshi/co/57276.htm
济南京浜德利化油器销售有限公司,http://www.11467.com/jinan/co/91047.htm
济南旺特汽车零部件有限公司,http://www.11467.com/jinan/co/138807.htm
济南瑞特阀片制造有限公司,http://www.11467.com/jinan/co/79932.htm
济南瑞云科信电器有限公司,http://www.11467.com/jinan/co/79525.htm
济南同心汽配商贸有限公司品牌部,http://www.11467.com/jinan/co/135190.htm
浙江义乌福斯克皮具有限公司,http://www.11467.com/jinhua/co/125575.htm
锦州美联桥汽车部件有限公司,http://www.11467.com/jinzhou/co/43559.htm
山东呈瑞粉末冶金有限公司,http://www.11467.com/laiwu/co/7167.htm
廊坊市汇钰模塑有限公司,http://www.11467.com/langfang/co/31985.htm
汉和滤清器公司,http://www.11467.com/langfang/co/49054.htm
河北固安恒通滤业有限公司,http://www.11467.com/langfang/co/48302.htm
辽阳市富祥曲轴有限公司,http://www.11467.com/liaoyang/co/14631.htm
临沂市龙盛机械有限公司,http://www.11467.com/linyi/co/76954.htm
浙江伟林机械零部件有限公司,http://www.11467.com/lishui/co/28751.htm
柳州黔桥工程材料有限公司,http://www.11467.com/liuzhou/co/22658.htm
马鞍山方圆动力科技有限公司,http://www.11467.com/maanshan/co/27306.htm
广东茂名市国名汽配公司,http://www.11467.com/maoming/co/39817.htm
南京菲隆科技有限公司,http://www.11467.com/nanjing/co/74341.htm
南京诺盟液压气动技术有限公司,http://www.11467.com/nanjing/co/81698.htm
西峡县西泵特种铸造有限公司,http://www.11467.com/nanyang/co/18047.htm
西峡县内燃机进排气管有限责任公司,http://www.11467.com/nanyang/co/38642.htm
慈溪市博劲电器科技有限公司,http://www.11467.com/ningbo/co/199138.htm
宁波珈多利机械有限公司,http://www.11467.com/ningbo/co/53364.htm
宁波江东鹏兴汽配实业有限公司,http://www.11467.com/ningbo/co/89813.htm
宁波市鑫火车业有限公司,http://www.11467.com/ningbo/co/194189.htm
宁波市镇海金腾电器有限公司,http://www.11467.com/ningbo/co/70541.htm
濮阳丸松精密机械有限公司,http://www.11467.com/puyang/co/19960.htm
福建泉州市丰顺汽车工程机械配件公司,http://www.11467.com/quanzhou/co/131439.htm
福建泉州博大商贸有限公司,http://www.11467.com/quanzhou/co/101330.htm
福建省南安市商业机械有限公司,http://www.11467.com/quanzhou/co/75055.htm
惠安县中盛机械制造有限公司,http://www.11467.com/quanzhou/co/124239.htm
泉州特库克汽车零部件有限公司,http://www.11467.com/quanzhou/co/10498.htm
泉州市艺达车用电器有限公司,http://www.11467.com/quanzhou/co/10095.htm
广东韶配动力机械有限公司,http://www.11467.com/shaoguan/co/24794.htm
沈阳市富冠龙贸易有限公司,http://www.11467.com/shenyang/co/98432.htm
上海钒凯铭涡轮增压器系统有限公司,http://www.11467.com/shenyang/co/98179.htm
深圳九泰化工有限公司(广州办事处),http://www.11467.com/shenzhen/co/782553.htm
深圳锦达盛精密塑模科技有限公司,http://www.11467.com/shenzhen/co/764314.htm
深圳市金华皮具公司,http://www.11467.com/shenzhen/co/800440.htm
深圳市日理江澍实业有限公司,http://www.11467.com/shenzhen/co/118825.htm
唐慶興業有限公司,http://www.11467.com/shenzhen/co/774521.htm
科菲特电子(广州)有限公司北方分公司,http://www.11467.com/shijiazhuang/co/142871.htm
石家庄市五星内燃机配件有限责任公司,http://www.11467.com/shijiazhuang/co/43013.htm
石家庄汇源丰汽配商贸有限公司,http://www.11467.com/shijiazhuang/co/138435.htm
石家庄柳玉汽车配件销售服务有限公司,http://www.11467.com/shijiazhuang/co/91610.htm
天津企联通正科技开发有限公司,http://www.11467.com/shijiazhuang/co/92471.htm
石家庄金正内燃机气门有限公司,http://www.11467.com/shijiazhuang/co/142330.htm
石家庄润熙商贸有限公司,http://www.11467.com/shijiazhuang/co/140581.htm
东风锻造有限公司,http://www.11467.com/shiyan/co/29693.htm
东风（十堰）发动机部件有限公司,http://www.11467.com/shiyan/co/16267.htm
东风（十堰）气缸垫有限公司,http://www.11467.com/shiyan/co/16277.htm
东风(十堰)汽车锻钢件有限公司,http://www.11467.com/shiyan/co/16282.htm
十堰市车来车往汽车零部件制造有限公司,http://www.11467.com/shiyan/co/28675.htm
十堰新华强贸易有限公司,http://www.11467.com/shiyan/co/25684.htm
创迈精密金属成型(苏州)有限公司,http://www.11467.com/suzhou/co/240310.htm
苏州怡丰工业设备有限公司,http://www.11467.com/suzhou/co/165084.htm
苏州华越金属有限公司,http://www.11467.com/suzhou/co/245226.htm
山东厚丰汽车散热器有限公司,http://www.11467.com/taian/co/21355.htm
山东同创汽车散热装置股份有限公司,http://www.11467.com/taian/co/53281.htm
浙江全威机油泵有限公司,http://www.11467.com/taizhou/co/139225.htm
浙江嘉嘉巨能摩托车科技有限公司,http://www.11467.com/taizhou/co/86576.htm
浙江泽威摇臂制造有限公司,http://www.11467.com/taizhou/co/139101.htm
浙江九隆机械有限公司,http://www.11467.com/taizhou/co/86900.htm
浙江远东汽车零部件制造有限公司,http://www.11467.com/taizhou/co/138283.htm
铜陵精恒机械有限责任公司,http://www.11467.com/tongling/co/11761.htm
潍坊市明冠节能科技有限公司,http://www.11467.com/weifang/co/93204.htm
瑞安市建瑞机械有限公司,http://www.11467.com/wenzhou/co/223029.htm
瑞安百联汽车部件有限公司,http://www.11467.com/wenzhou/co/218279.htm
瑞安市百信机车部件有限公司,http://www.11467.com/wenzhou/co/224829.htm
瑞安市恒星汽车配件有限公司,http://www.11467.com/wenzhou/co/223025.htm
温州市日益机车部件有限公司,http://www.11467.com/wenzhou/co/222567.htm
瑞安市凯瑞美汽车零部件有限公司,http://www.11467.com/wenzhou/co/221553.htm
温州神狼皮具有限公司,http://www.11467.com/wenzhou/co/216337.htm
浙江永丰粉末冶金有限公司,http://www.11467.com/wenzhou/co/216372.htm
温州华源动力设备有限公司,http://www.11467.com/wenzhou/co/154120.htm
温州隆华机械有限公司,http://www.11467.com/wenzhou/co/222565.htm
温州嘉豪汽配有限公司,http://www.11467.com/wenzhou/co/220897.htm
武汉中醇化汽车新能源有限公司,http://www.11467.com/wuhan/co/142680.htm
理研汽车配件（武汉）有限公司,http://www.11467.com/wuhan/co/29163.htm
芜湖三联锻造有限公司,http://www.11467.com/wuhu/co/2270.htm
乌鲁木齐菲尔商贸有限公司,http://www.11467.com/wulumuqi/co/103368.htm
京瓷化学(无锡)有限公司,http://www.11467.com/wuxi/co/187871.htm
无锡市飞玛斯精密科技有限公司,http://www.11467.com/wuxi/co/91261.htm
无锡惠山泵业有限公司,http://www.11467.com/wuxi/co/41113.htm
无锡辰天机械设备有限公司,http://www.11467.com/wuxi/co/221161.htm
无锡威孚环保催化剂有限公司,http://www.11467.com/wuxi/co/175754.htm
无锡天拓有限公司,http://www.11467.com/wuxi/co/247180.htm
无锡市祥健四氟制品有限公司,http://www.11467.com/wuxi/co/125333.htm
厦门市金汤橡塑有限公司,http://www.11467.com/xiamen/co/46130.htm
厦门兴恒新橡胶工贸有限公司,http://www.11467.com/xiamen/co/57939.htm
尉氏县中原橡胶有限公司,http://www.11467.com/xian/co/70218.htm
湖南江滨机器（集团）有限责任公司,http://www.11467.com/xiangtan/co/24854.htm
湖南威斯特汽车零配件有限公司,http://www.11467.com/xiangtan/co/23121.htm
金蒙特汽车零部件有限公司,http://www.11467.com/xintai/co/51095.htm
邢台正大汽车配件公司,http://www.11467.com/xintai/co/50865.htm
新乡市摩耐特活塞有限公司,http://www.11467.com/xinxiang/co/21358.htm
徐州潍重汽车配件有限公司,http://www.11467.com/xuzhou/co/27305.htm
奉承万通汽配有限公司,http://www.11467.com/yaan/co/9872.htm
扬州奥力威传感器有限公司,http://www.11467.com/yangzhou/co/68477.htm
江苏仪征威龙活塞环有限公司,http://www.11467.com/yangzhou/co/108005.htm
马勒发动机零部件（营口)有限公司,http://www.11467.com/yingkou/co/42057.htm
山西省新绛县宏鑫实业有限公司,http://www.11467.com/yuncheng/co/30901.htm
广东省湛江市华厦汽车消声器有限公司,http://www.11467.com/zhanjiang/co/52482.htm
河南特润贸易有限公司,http://www.11467.com/zhengzhou/co/172236.htm
邢台欧德汽车配件制造有限公司,http://www.11467.com/xintai/co/39711.htm
湖北五洲正大轴业制造有限公司,http://www.11467.com/xiaogan/co/19890.htm
广州诚信达汽车配件有限公司,http://www.11467.com/guangzhou/co/296633.htm
佛山艾麦工业皮带有限公司,http://www.11467.com/foshan/co/325944.htm
桐城市汽车部件有限公司,http://www.11467.com/anqing/co/13644.htm
安庆市昕峰汽车配件制造有限公司,http://www.11467.com/anqing/co/36090.htm
桐城市照耀汽配有限公司,http://www.11467.com/anqing/co/35694.htm
安徽白兔湖汽配有限公司,http://www.11467.com/anqing/co/35357.htm
安阳联达数控精密锻造有限公司,http://www.11467.com/anyang/co/35317.htm
河北恒通四方汽车消声器有限公司,http://www.11467.com/baoding/co/81646.htm
唐山和烁科技有限公司,http://www.11467.com/baoding/co/90698.htm
郑州利翔商贸有限公司,http://www.11467.com/zhengzhou/co/173403.htm
安庆德伯尔有限公司,http://www.11467.com/zhengzhou/co/174504.htm
郑州岩石博瑞汽车电器有限公司,http://www.11467.com/zhengzhou/co/171452.htm
郑州环宇汽配贸易有限公司,http://www.11467.com/zhengzhou/co/177247.htm
舟山市盛科汽车配件制造有限公司,http://www.11467.com/zhoushan/co/23426.htm
珠海京楚石油技术开发有限公司,http://www.11467.com/zhuhai/co/61942.htm
珠海市友联汽车服务有限公司,http://www.11467.com/zhuhai/co/72551.htm
北京汇百超机电有限公司,http://www.11467.com/beijing/co/111581.htm
北京连众汽车配件有限公司,http://www.11467.com/beijing/co/708940.htm
河北张家口市下花园拓新科技发展有限公司(北京办事处),http://www.11467.com/beijing/co/702511.htm
北京浙绍宏鹏贸易有限公司(京代国际),http://www.11467.com/beijing/co/708939.htm
北京中联车盟网络科技服务有限公司,http://www.11467.com/beijing/co/702505.htm
上海凯吉汽配有限公司场中路分公司,http://www.11467.com/shanghai/co/1043876.htm
上海龙滨汽车配件有限公司,http://www.11467.com/shanghai/co/1047841.htm
上海燃料电池汽车动力系统有限公司,http://www.11467.com/shanghai/co/260380.htm
上海世通商贸汽配有限公司,http://www.11467.com/shanghai/co/525240.htm
斯泰必鲁斯(江苏)有限公司,http://www.11467.com/shanghai/co/1038760.htm
上海胜僖汽车配件有限公司,http://www.11467.com/shanghai/co/486926.htm
天津睿安世达石油工程技术服务有限公司,http://www.11467.com/tianjin/co/202091.htm
天津康保振特无机非金属科技有限责任公司,http://www.11467.com/tianjin/co/197438.htm
天津市广达汽车零部件制造有限公司,http://www.11467.com/tianjin/co/200079.htm
柳机五菱汽车发动机零部件(重庆)制造有限公司,http://www.11467.com/chongqing/co/207572.htm
重庆建宏(科技)机车配件有限公司,http://www.11467.com/chongqing/co/207708.htm
四川省机电产品物资公司重庆公司,http://www.11467.com/chongqing/co/126089.htm
重庆光顺机车部件有限公司,http://www.11467.com/chongqing/co/208173.htm
重庆市坤宇机械配件有限公司,http://www.11467.com/chongqing/co/206141.htm
重庆市邦恩机械有限公司,http://www.11467.com/chongqing/co/79202.htm
重庆华世丹机械制造有限公司,http://www.11467.com/chongqing/co/77900.htm
重庆侨生压铸有限公司,http://www.11467.com/chongqing/co/53144.htm
安徽白兔湖动力股份有限公司,http://www.11467.com/anqing/co/41869.htm
阪东（上海）管理有限公司,http://www.11467.com/tianjin/co/301259.htm
江苏多为泵业股份有限公司,http://www.11467.com/yancheng/co/81967.htm
山东科润机械股份有限公司,http://www.11467.com/laiwu/co/18573.htm
芜湖永达科技有限公司,http://www.11467.com/qiye/27438906.htm
中山市巨信智能科技有限公司,http://www.11467.com/zhongshan/co/231832.htm
涿州超科电气机械设备有限公司,http://www.11467.com/baoding/co/81364.htm
陕西北方动力有限责任公司,http://www.11467.com/baoji/co/24963.htm
宝鸡市鸿锦汽车配件有限公司,http://www.11467.com/baoji/co/24217.htm
蚌埠凤凰滤清器有限责任公司,http://www.11467.com/bengbu/co/35688.htm
蚌埠利华滤清器有限公司,http://www.11467.com/bengbu/co/35734.htm
山东滨州渤海活塞股份有限公司,http://www.11467.com/binzhou/co/16032.htm
河北鑫安驰汽车配件有限公司,http://www.11467.com/cangzhou/co/59920.htm
河北驰耐特汽车零部件有限公司,http://www.11467.com/cangzhou/co/59479.htm
河间市亚代尔汽车零部件有限公司,http://www.11467.com/cangzhou/co/58420.htm
力源集团-力源活塞工业股份有限公司,http://www.11467.com/cangzhou/co/41339.htm
沧州赛威汽车附件有限公司,http://www.11467.com/cangzhou/co/57323.htm
长春市圣金洪汽车配件有限公司,http://www.11467.com/changchun/co/96704.htm
长春新众安汽车零部件有限公司,http://www.11467.com/changchun/co/100332.htm
长春一汽四环正兴汽车零部件有限公司,http://www.11467.com/changchun/co/72689.htm
长铃集团有限公司,http://www.11467.com/changchun/co/72934.htm
吉林瑞鹏集团有限公司,http://www.11467.com/changchun/co/72944.htm
湖南安福气门有限公司,http://www.11467.com/changde/co/35051.htm
长沙瑞楚精密机械有限公司,http://www.11467.com/changsha/co/118666.htm
长沙星欣机械设备有限公司,http://www.11467.com/changsha/co/85691.htm
湖南中恒国际贸易有限公司,http://www.11467.com/changsha/co/121097.htm
长沙正盛活塞环有限公司,http://www.11467.com/changsha/co/118507.htm
山西淮海机电有限公司,http://www.11467.com/changzhi/co/26425.htm
常州艾得尔塑胶材料有限公司,http://www.11467.com/changzhou/co/90090.htm
常州埃特法斯工具有限公司,http://www.11467.com/changzhou/co/52796.htm
常州市莱普拉机械制造有限公司,http://www.11467.com/changzhou/co/54548.htm
常州麦道动力设备有限公司,http://www.11467.com/changzhou/co/99977.htm
常州市精威工具有限公司,http://www.11467.com/changzhou/co/81992.htm
常州市良久机械制造有限公司,http://www.11467.com/changzhou/co/88889.htm
常州伯事达汽车零部件有限公司,http://www.11467.com/changzhou/co/152336.htm
常州市鼎新全意机械有限公司,http://www.11467.com/changzhou/co/100107.htm
江苏星耀电机有限公司,http://www.11467.com/changzhou/co/113094.htm
常州瑞晟星泰汽车配件有限公司,http://www.11467.com/changzhou/co/148935.htm
溧阳市万盛铸造有限公司,http://www.11467.com/changzhou/co/42449.htm
江苏常发实业集团有限公司,http://www.11467.com/changzhou/co/72000.htm
常州市中油华东石油有限责任公司,http://www.11467.com/changzhou/co/85298.htm
江苏立新钢管集团有限公司,http://www.11467.com/changzhou/co/113106.htm
常州市铁英金属制品有限公司,http://www.11467.com/changzhou/co/105634.htm
泰兴市宏伟机电环保科技有限公司,http://www.11467.com/changzhou/co/113002.htm
上海绿霸(常州)液压机械有限公司,http://www.11467.com/changzhou/co/149489.htm
常州诚欧动力科技有限公司,http://www.11467.com/changzhou/co/89469.htm
安徽龙川橡塑制品有限公司,http://www.11467.com/chaohu/co/20907.htm
承德钢鹰曲轴连杆有限公司,http://www.11467.com/chengde/co/22292.htm
成都格罗西贸易有限公司,http://www.11467.com/chengdu/co/98048.htm
成都盛河汽车配件有限公司,http://www.11467.com/chengdu/co/80793.htm
四川江华泵业有限公司,http://www.11467.com/chengdu/co/25047.htm
精钻科技公司,http://www.11467.com/chengdu/co/110212.htm
四川宁江昭和减震器公司,http://www.11467.com/chengdu/co/216448.htm
安徽嘉来顿活塞汽配有限公司,http://www.11467.com/chuzhou/co/24492.htm
大连金辉汽车服务有限公司,http://www.11467.com/dalian/co/24675.htm
大连金华齿轮箱制造有限公司,http://www.11467.com/dalian/co/24667.htm
大连达沃商贸有限公司,http://www.11467.com/dalian/co/44253.htm
凤城市凯驰内燃机配件有限公司,http://www.11467.com/dandong/co/51367.htm
辽宁金伟汽车电机电器有限公司,http://www.11467.com/dandong/co/49830.htm
凤城市恒泰铸造有限公司,http://www.11467.com/dandong/co/43646.htm
四川德阳众凌经贸有限公司,http://www.11467.com/deyang/co/20079.htm
山东飞驰消声器有限公司,http://www.11467.com/dezhou/co/49678.htm
申泉动力汽车缸套有限公司,http://www.11467.com/dezhou/co/50621.htm
兴良三元催化有限公司,http://www.11467.com/dezhou/co/49680.htm
保捷汽车工业有限公司,http://www.11467.com/dongguan/co/506356.htm
东莞市东鑫机电有限公司,http://www.11467.com/dongguan/co/491410.htm
东莞市港润机械科技有限公司,http://www.11467.com/dongguan/co/503568.htm
东莞大雅电子科技有限公司,http://www.11467.com/dongguan/co/47522.htm
东莞建诚淬火设备有限公司,http://www.11467.com/dongguan/co/493812.htm
东莞市恒准精密模具机械有限公司,http://www.11467.com/dongguan/co/279914.htm
东莞市弗特加滤清器制造有限公司,http://www.11467.com/dongguan/co/133149.htm
东莞市金全顺五金模具有限公司,http://www.11467.com/dongguan/co/65438.htm
东莞市宏宝汽车销售服务有限公司,http://www.11467.com/dongguan/co/218429.htm
鴻泰汽車濾清器工業有限公司,http://www.11467.com/dongguan/co/501409.htm
東莞市哈特曼五金科技有限公司華南商務部,http://www.11467.com/dongguan/co/491408.htm
冠杰塑胶有限公司,http://www.11467.com/dongguan/co/218416.htm
隆大貿易有限公司,http://www.11467.com/dongguan/co/218838.htm
东营信拓汽车消声器有限公司,http://www.11467.com/dongying/co/42203.htm
东营海润钢管集团有限公司,http://www.11467.com/dongying/co/42268.htm
广东志达精密管业制造有限公司,http://www.11467.com/foshan/co/345126.htm
广东佛山市康荣火花塞有限公司,http://www.11467.com/foshan/co/252782.htm
广州永福大拇指汽配制造公司,http://www.11467.com/foshan/co/252975.htm
佛山市顺德区发雅尔汽车配件制造有限公司,http://www.11467.com/foshan/co/245116.htm
福州钜全汽车配件有限公司,http://www.11467.com/fuzhou/co/33153.htm
福州新华士特汽车零部件有限公司,http://www.11467.com/fuzhou/co/65900.htm
福州三联汽配有限公司,http://www.11467.com/fuzhou/co/142338.htm
福州华士特汽车零部件有限公司,http://www.11467.com/fuzhou/co/33822.htm
广州德谱工业技术有限公司,http://www.11467.com/guangzhou/co/117346.htm
广州豪杰汽配有限公司,http://www.11467.com/guangzhou/co/459030.htm
广州安京汽配市场有限公司,http://www.11467.com/guangzhou/co/475085.htm
广州红谷皮具有限公司,http://www.11467.com/guangzhou/co/476901.htm
广州戈蓝得汽车配件有限公司,http://www.11467.com/guangzhou/co/471624.htm
广州乐骋汽配工程机械配件有限公司,http://www.11467.com/guangzhou/co/252825.htm
广州市斐恋布克皮具有限公司,http://www.11467.com/guangzhou/co/459559.htm
广州金达工程机械配件有限公司,http://www.11467.com/guangzhou/co/483496.htm
