临清市博航轴承有限公司,http://www.11467.com/liaocheng/co/25652.htm
浙江衢州永丰金属制品有限公司,http://www.11467.com/quzhou/co/34110.htm
慈溪市盛银汽配有限公司,http://www.11467.com/ningbo/co/114623.htm
南通润成机电设备有限公司,http://www.11467.com/nantong/co/137482.htm
浙江长宏机械有限公司,http://www.11467.com/shaoxing/co/119125.htm
诸暨博海管业有限公司,http://www.11467.com/shaoxing/co/119121.htm
奉化市拓金汽车配件有限公司,http://www.11467.com/ningbo/co/194905.htm
江苏里卡多发动机有限公司,http://www.11467.com/nanning/co/64665.htm
浙江瑞庆汽车零部件有限公司,http://www.11467.com/lishui/co/24465.htm
莒县旭升橡塑制品有限公司,http://www.11467.com/rizhao/co/22991.htm
福鼎市华强化油器有限公司,http://www.11467.com/ningde/co/24916.htm
福鼎市云锐机车部件有限公司,http://www.11467.com/ningde/co/28604.htm
泉州市通捷汽车贸易有限公司,http://www.11467.com/quanzhou/co/100399.htm
台州敬炜塑料齿轮有限公司,http://www.11467.com/qingyang/co/12499.htm
宁波市光亚汽车配件有限公司,http://www.11467.com/ningbo/co/90415.htm
宁波立强机械有限公司,http://www.11467.com/ningbo/co/143439.htm
宁波市镇海兴光动力机械有限公司,http://www.11467.com/ningbo/co/114284.htm
宁波天及同步带有限公司,http://www.11467.com/ningbo/co/143750.htm
深圳市奥宝德电子有限公司,http://www.11467.com/shenzhen/co/787664.htm
十堰新乐天工贸有限公司,http://www.11467.com/shiyan/co/27954.htm
深圳市李匠精工模具配件有限公司,http://www.11467.com/shenzhen/co/809430.htm
深圳市正壹自动化技术有限公司,http://www.11467.com/shenzhen/co/810890.htm
沈阳中达全能动力机电有限公司,http://www.11467.com/shenyang/co/50082.htm
十堰市沃曼商用车零部件有限公司,http://www.11467.com/shiyan/co/29474.htm
十堰市华鹏东风科工贸有限公司,http://www.11467.com/shiyan/co/28931.htm
十堰联众贸易有限公司,http://www.11467.com/shiyan/co/22018.htm
十堰森康工贸有限公司,http://www.11467.com/shiyan/co/29051.htm
十堰山力实业有限公司,http://www.11467.com/shiyan/co/22572.htm
十堰市硕鑫工贸有限公司,http://www.11467.com/shiyan/co/26120.htm
沈阳方也信贸易有限公司,http://www.11467.com/shenyang/co/29402.htm
深圳市超盛金属制品有限公司,http://www.11467.com/shenzhen/co/142886.htm
沈阳同方鸿韵贸易有限公司,http://www.11467.com/shenyang/co/66719.htm
沈阳天通实业有限公司,http://www.11467.com/shenyang/co/61693.htm
深圳市飞箭达国际货运代理有限公司,http://www.11467.com/shenzhen/co/144559.htm
河北金刚内燃机配件有限公司,http://www.11467.com/shijiazhuang/co/91724.htm
沈阳时比欧工业皮带密封制品有限公司,http://www.11467.com/shenyang/co/37874.htm
深圳市金芳轴承有限公司,http://www.11467.com/shenzhen/co/507065.htm
深圳市志诚密封技术有限公司,http://www.11467.com/shenzhen/co/103117.htm
深圳市亨特机械配件有限公司,http://www.11467.com/shenzhen/co/724535.htm
深圳市航臣气动元件有限公司,http://www.11467.com/shenzhen/co/799448.htm
深圳市科为气动液压有限公司,http://www.11467.com/shenzhen/co/84915.htm
深圳市荣海鑫机电设备有限公司,http://www.11467.com/shenzhen/co/757866.htm
深圳大金大精密机床有限公司,http://www.11467.com/shenzhen/co/487458.htm
深圳市三格滤清器有限公司,http://www.11467.com/shenzhen/co/117415.htm
深圳市钟辉橡胶制品有限公司,http://www.11467.com/shenzhen/co/253371.htm
石家庄市恒远气门制造有限公司,http://www.11467.com/shijiazhuang/co/91896.htm
石家庄市许继机电设备有限公司,http://www.11467.com/shijiazhuang/co/71995.htm
深圳市基米德科技有限公司,http://www.11467.com/shenzhen/co/725751.htm
深圳市腾源机电有限公司,http://www.11467.com/shenzhen/co/495763.htm
深圳市振华净化科技有限公司,http://www.11467.com/shenzhen/co/768584.htm
深圳市柏乐科技有限公司,http://www.11467.com/shenzhen/co/177336.htm
深圳哈滨机械轴承有限公司,http://www.11467.com/shenzhen/co/506571.htm
深圳市奥安实业有限公司,http://www.11467.com/shenzhen/co/496823.htm
上虞精实密封件有限公司,http://www.11467.com/shaoxing/co/105780.htm
潍坊圣桥动力配件有限公司,http://www.11467.com/weifang/co/78640.htm
十堰松港工贸有限公司,http://www.11467.com/shiyan/co/28892.htm
十堰金屿舟汽车零部件有限公司,http://www.11467.com/shiyan/co/2840.htm
利铭盛工贸有限公司苏州办事处,http://www.11467.com/suzhou/co/241699.htm
武汉山禾电器有限公司,http://www.11467.com/wuhan/co/80402.htm
苏州瑞欧贸易有限公司,http://www.11467.com/suzhou/co/241697.htm
天台亚耐气动密封件有限公司,http://www.11467.com/suzhou/co/240238.htm
泰安市岱岳区鑫岳散热器有限公司,http://www.11467.com/taian/co/37528.htm
十堰代尔汽车零部件有限公司,http://www.11467.com/shiyan/co/29028.htm
湖北斯诺实业有限公司,http://www.11467.com/shiyan/co/29557.htm
浙江方易汽摩部件有限公司,http://www.11467.com/taizhou/co/95204.htm
苏州瑞德压铸模具有限公司,http://www.11467.com/suzhou/co/245568.htm
台州市富通机械制造有限公司,http://www.11467.com/taizhou/co/95572.htm
泰州市三叶电子有限公司,http://www.11467.com/taizhoushi/co/30562.htm
十堰康迅工贸有限公司,http://www.11467.com/shiyan/co/32723.htm
温州广源液压科技有限公司,http://www.11467.com/wenzhou/co/170154.htm
台州市创盛汽车部件有限公司,http://www.11467.com/taizhou/co/95592.htm
十堰金泽发工贸有限公司,http://www.11467.com/shiyan/co/23448.htm
苏州博克倍斯特机电有限公司,http://www.11467.com/suzhou/co/269062.htm
湖北福莱科技发展有限公司,http://www.11467.com/suizhou/co/8586.htm
张家港市普利得机械有限公司,http://www.11467.com/suzhou/co/321159.htm
浙江东原机车部件有限公司,http://www.11467.com/wenzhou/co/222566.htm
浙江天台万有橡胶有限公司,http://www.11467.com/taizhou/co/105873.htm
乐清市华日耐火器材有限公司,http://www.11467.com/wenzhou/co/223020.htm
乐清市宏昇汽配有限公司,http://www.11467.com/wenzhou/co/220900.htm
瑞安市东瓯汽车电器有限公司,http://www.11467.com/wenzhou/co/223847.htm
瑞安市瑞田汽摩配制造有限公司,http://www.11467.com/wenzhou/co/224154.htm
瑞安市昌江滤清器设备有限公司,http://www.11467.com/wenzhou/co/221552.htm
瑞安市胜光汽车配件有限公司,http://www.11467.com/wenzhou/co/222074.htm
温州市恒力弹簧制造有限公司,http://www.11467.com/wenzhou/co/17861.htm
武汉市飞仕泽激光有限公司,http://www.11467.com/wuhan/co/21516.htm
湖北柴发工贸发展有限公司,http://www.11467.com/wuhan/co/22972.htm
无锡市申华汽车电器有限公司,http://www.11467.com/wuxi/co/187045.htm
无锡益百动力机械有限公司,http://www.11467.com/wuxi/co/187040.htm
无锡特得动力机械有限公司,http://www.11467.com/wuxi/co/197402.htm
西安唯信橡胶制品有限公司,http://www.11467.com/xian/co/70134.htm
襄樊市中康汽车配件有限公司,http://www.11467.com/xiangfan/co/831.htm
陕西正信汽配有限责任公司,http://www.11467.com/xian/co/12189.htm
西安智邦实业有限责任公司,http://www.11467.com/xian/co/48682.htm
西安盛唐车辆燃气设备有限公司,http://www.11467.com/xian/co/64145.htm
无锡市吉瑞特机械制造有限公司,http://www.11467.com/wuxi/co/199404.htm
厦门市杏林三源工贸有限公司,http://www.11467.com/xiamen/co/55537.htm
厦门鑫成琳橡胶制品有限公司,http://www.11467.com/xiamen/co/54575.htm
无锡市润邦液压件制造有限公司,http://www.11467.com/wuxi/co/196917.htm
无锡法尔纳汽车空调有限公司,http://www.11467.com/wuxi/co/195985.htm
无锡锡配汽车零配件有限公司,http://www.11467.com/wuxi/co/199842.htm
芜湖富达电机有限责任公司,http://www.11467.com/wuhu/co/9358.htm
武汉市鑫中威汽车配件有限公司,http://www.11467.com/wuhan/co/86744.htm
无锡市富杰机械制造有限公司,http://www.11467.com/wuxi/co/192343.htm
清河县新东汽车零部件有限公司,http://www.11467.com/xintai/co/57630.htm
襄樊华荣泰汽车零部件有限公司,http://www.11467.com/xiangfan/co/38351.htm
无锡东舟科技有限公司,http://www.11467.com/wuxi/co/195946.htm
无锡市新博橡塑制品有限公司,http://www.11467.com/wuxi/co/195820.htm
厦门八度密封件有限公司,http://www.11467.com/xiamen/co/94922.htm
无锡万企气动液压有限公司,http://www.11467.com/wuxi/co/196816.htm
无锡卓伟发动机商贸有限公司,http://www.11467.com/wuxi/co/249869.htm
武汉信昌机电技术服务有限公司,http://www.11467.com/wuhan/co/54998.htm
无锡纽普兰内高压成形科技有限公司,http://www.11467.com/wuxi/co/175731.htm
厦门市三航鑫贸易有限公司,http://www.11467.com/xiamen/co/48355.htm
康机动力（厦门）进出口有限公司,http://www.11467.com/xiamen/co/26570.htm
清河县君威汽车零部件有限公司,http://www.11467.com/xintai/co/50881.htm
邢台市冯氏汽车配件销售有限公司,http://www.11467.com/xintai/co/39239.htm
邢台市淼汇工贸有限公司,http://www.11467.com/xintai/co/34213.htm
新乡市新鹰机械有限公司,http://www.11467.com/xinxiang/co/23151.htm
新乡市国英滤清器有限公司,http://www.11467.com/xinxiang/co/23152.htm
江苏春光汽车配件有限公司,http://www.11467.com/yancheng/co/56759.htm
南宫市澳博毡业有限公司,http://www.11467.com/xintai/co/51138.htm
邢台玉辉汽车缸盖制造有限公司,http://www.11467.com/xintai/co/34122.htm
徐州思源铝业有限公司,http://www.11467.com/xuzhou/co/57624.htm
邢台市巨通机械配件有限公司,http://www.11467.com/xintai/co/24958.htm
清河县伟信密封条有限公司,http://www.11467.com/xintai/co/48806.htm
清河县茂营橡塑制品有限公司,http://www.11467.com/xintai/co/57407.htm
新乡市振阳液压设备有限公司,http://www.11467.com/xinxiang/co/26771.htm
巨鹿县龙海密封件有限公司,http://www.11467.com/xintai/co/49711.htm
徐州柯诺密封科技有限公司,http://www.11467.com/xuzhou/co/69079.htm
清河县天耐汽车配件有限公司,http://www.11467.com/xintai/co/56958.htm
邢台欧凯汽车配件有限公司,http://www.11467.com/xintai/co/39183.htm
清河县万通拉索胶业有限公司,http://www.11467.com/xintai/co/18518.htm
原阳县创新机械制造有限公司,http://www.11467.com/xinxiang/co/28749.htm
徐州润通印铁制盖有限公司,http://www.11467.com/xuzhou/co/63741.htm
邢台威东五金锁具有限公司,http://www.11467.com/xintai/co/44116.htm
邢台市正盛工贸有限公司,http://www.11467.com/xintai/co/44400.htm
清河县硕业汽车配件有限公司,http://www.11467.com/xintai/co/43513.htm
清河县泰瑞汽车配件有限公司,http://www.11467.com/xintai/co/56545.htm
河北京橡汽车零部件有限公司,http://www.11467.com/xintai/co/45055.htm
邢台市盛凯源物资有限公司,http://www.11467.com/xintai/co/24888.htm
河北邢台三鑫橡塑有限责任公司,http://www.11467.com/xintai/co/50379.htm
原阳县恒源汽车配件有限公司,http://www.11467.com/xinxiang/co/17499.htm
北京金利旺达汽车配件有限公司,http://www.11467.com/beijing/co/487520.htm
上海志森工业皮带有限公司,http://www.11467.com/shanghai/co/826869.htm
肇庆市华龙电子有限公司,http://www.11467.com/zhaoqing/co/30030.htm
江西玉虎汽摩配有限公司,http://www.11467.com/yichun/co/20495.htm
漳州市百汇通汽车配件有限公司,http://www.11467.com/zhangzhou/co/38807.htm
舟山市东方气雾器有限公司,http://www.11467.com/zhoushan/co/11118.htm
盐城市华博机械有限公司,http://www.11467.com/yancheng/co/55694.htm
盐城旺凯橡胶密封件有限公司,http://www.11467.com/yancheng/co/9026.htm
镇江协成机电设备进出口有限公司,http://www.11467.com/zhenjiang/co/46002.htm
岱山鑫立达胶带有限公司,http://www.11467.com/zhoushan/co/11018.htm
自贡市时达实业有限公司,http://www.11467.com/zigong/co/21529.htm
上海安坦尼滤清器有限公司,http://www.11467.com/shanghai/co/426773.htm
上海道茨汽车电机有限公司,http://www.11467.com/shanghai/co/323187.htm
上海阜锴增压器有限公司,http://www.11467.com/shanghai/co/315974.htm
上海盖里特涡轮增压器系统有限公司,http://www.11467.com/shanghai/co/737668.htm
上海广绩内燃机配件有限公司,http://www.11467.com/shanghai/co/382912.htm
上海亚域动力工程有限公司,http://www.11467.com/shanghai/co/525624.htm
上海翔征涡轮增压器制造有限公司,http://www.11467.com/shanghai/co/676273.htm
上海孚容铜材导线有限公司,http://www.11467.com/shanghai/co/890140.htm
烟台华忠华密封材料有限公司,http://www.11467.com/yantai/co/167578.htm
营口经济技术开发区正大实业有限公司,http://www.11467.com/yingkou/co/42106.htm
江苏铭川橡胶科技有限公司,http://www.11467.com/yancheng/co/70614.htm
扬州富强滤清器有限公司,http://www.11467.com/yangzhou/co/3861.htm
山东振挺精工活塞有限公司,http://www.11467.com/zhengzhou/co/121841.htm
上海奔放蓄电池股份有限公司,http://www.11467.com/shanghai/co/667016.htm
郑州以赛亚机电设备有限公司,http://www.11467.com/zhengzhou/co/153548.htm
喜威一（北京）刀具有限公司,http://www.11467.com/beijing/co/86500.htm
焕悦机械(上海)有限公司,http://www.11467.com/shanghai/co/1045990.htm
响水恒力轴承有限公司,http://www.11467.com/yancheng/co/78519.htm
上海玻利鸽工贸有限公司,http://www.11467.com/shanghai/co/309000.htm
仪征市联兴汽车配件制造有限公司,http://www.11467.com/yangzhou/co/106877.htm
浙江奥斯特汽车配件有限公司,http://www.11467.com/zhoushan/co/7277.htm
中山市普德净水设备有限公司,http://www.11467.com/zhongshan/co/133489.htm
舟山市恒顺密封件有限公司,http://www.11467.com/zhoushan/co/7057.htm
淄博朔帆经贸有限公司,http://www.11467.com/zibo/co/98259.htm
仪征市中信机械配件有限公司,http://www.11467.com/yangzhou/co/20938.htm
枣庄市润源粉末冶金有限公司,http://www.11467.com/zaozhuang/co/25463.htm
济宁康机商贸有责任限公司,http://www.11467.com/jining/co/109450.htm
昆山球邦机电设备有限公司,http://www.11467.com/suzhou/co/362236.htm
杭州超联机电设备有限公司,http://www.11467.com/hangzhou/co/257974.htm
维飞橡胶制品有限公司,http://www.11467.com/foshan/co/209142.htm
广州御南驾北电子科技有限公司,http://www.11467.com/guangzhou/co/428977.htm
佛山市顺德区祥铖电器实业有限公司,http://www.11467.com/foshan/co/220933.htm
蚌埠华宝工贸有限公司,http://www.11467.com/bengbu/co/26279.htm
大连艾帝格贸易有限公司,http://www.11467.com/dalian/co/48939.htm
邢台磊达橡塑制品有限公司,http://www.11467.com/xintai/co/85005.htm
十堰轩庆工贸有限公司,http://www.11467.com/shiyan/co/35625.htm
广州仝发汽配有限公司,http://www.11467.com/guangzhou/co/699173.htm
山东和晟机械公司,http://www.11467.com/jining/co/107349.htm
广州市进口（晶驰）汽车配件公司,http://www.11467.com/guangzhou/co/614317.htm
佛山市嵘德密封技术有限公司,http://www.11467.com/foshan/co/343728.htm
北京格洛斯流体技术有限公司,http://www.11467.com/beijing/co/762718.htm
济南乌拉尔汽车配件有限公司,http://www.11467.com/jinan/co/160952.htm
朝阳市四惠通商贸有限公司,http://www.11467.com/chaoyang/co/28050.htm
广州市劲炫汽车用品有限公司,http://www.11467.com/guangzhou/co/495797.htm
侯马威创动力机械有限公司,http://www.11467.com/beijing/co/760956.htm
湖南省卓尔轴瓦科技有限公司,http://www.11467.com/loudi/co/29006.htm
沧州易泽汽车配件制造有限公司,http://www.11467.com/cangzhou/co/74940.htm
莱阳鸿昌弹簧有限公司,http://www.11467.com/yantai/co/175535.htm
福州洪泰机车配件有限公司,http://www.11467.com/fuzhou/co/69673.htm
广州能智叉车有限公司,http://www.11467.com/qiye/23590986.htm
连云港发柴发动机科技有限公司,http://www.11467.com/lianyungang/co/49708.htm
广州德信活塞环有限公司,http://www.11467.com/guangzhou/co/696819.htm
广州富泰机械设备有限公司,http://www.11467.com/guangzhou/co/281304.htm
广州奔田滤业有限公司,http://www.11467.com/guangzhou/co/280765.htm
佛山市南海德耐汽车配件制造有限公司,http://www.11467.com/foshan/co/308674.htm
胜利油田瑞康石油设备配套有限责任公司,http://www.11467.com/dongying/co/8726.htm
思源三元催化回收公司,http://www.11467.com/shanghai/co/1067844.htm
杭州康茂机械有限公司,http://www.11467.com/hangzhou/co/257448.htm
广州市凯鑫汽车配件有限公司,http://www.11467.com/guangzhou/co/279973.htm
杭州鼎牛机械有限公司,http://www.11467.com/hangzhou/co/258106.htm
广州佰思登皮具有限公司,http://www.11467.com/guangzhou/co/462741.htm
湖北大豪动力设备有限公司,http://www.11467.com/shiyan/co/31419.htm
济宁山推新动力机械有限公司,http://www.11467.com/jining/co/40400.htm
十堰雷曼汽车零部件有限公司,http://www.11467.com/shiyan/co/29555.htm
济南振中重汽经贸有限公司,http://www.11467.com/jinan/co/91658.htm
南京立煌工贸有限公司,http://www.11467.com/nanjing/co/85720.htm
南京大同实业有限公司,http://www.11467.com/nanjing/co/71980.htm
广西上恩国际贸易有限公司,http://www.11467.com/nanning/co/58452.htm
廊坊开发区京南电机制造有限公司,http://www.11467.com/langfang/co/2657.htm
山东登云汽配销售有限公司,http://www.11467.com/jinan/co/79727.htm
杭州仁亿贸易有限公司,http://www.11467.com/hangzhou/co/369329.htm
泰安市兴隆活塞制造有限公司,http://www.11467.com/taian/co/36295.htm
浙江建豪机车有限公司,http://www.11467.com/taizhou/co/94947.htm
十堰灵通康明汽车部件有限公司,http://www.11467.com/shiyan/co/2138.htm
十堰三明科工贸有限公司,http://www.11467.com/shiyan/co/22553.htm
嘉兴市赛文斯机械制造有限公司,http://www.11467.com/jiaxing/co/75216.htm
杭州万顺氟胶科技有限公司,http://www.11467.com/hangzhou/co/257865.htm
石家庄市华盛汽车配件有限公司,http://www.11467.com/shijiazhuang/co/54194.htm
十堰市郧利宏工贸有限公司,http://www.11467.com/shiyan/co/26843.htm
苏州弗莱依格密封科技有限公司,http://www.11467.com/suzhou/co/239805.htm
泉州市德源工程机械有限公司,http://www.11467.com/quanzhou/co/9568.htm
深圳市元和科技有限公司,http://www.11467.com/shenzhen/co/68436.htm
浙江宏伟缸套有限公司,http://www.11467.com/lishui/co/35395.htm
江门市江海区勤力五金电子有限公司,http://www.11467.com/jiangmen/co/245.htm
太仓市凯诺石墨密封制品有限公司,http://www.11467.com/suzhou/co/100686.htm
石家庄润能科技有限公司,http://www.11467.com/shijiazhuang/co/85887.htm
杭州菲特设备制造有限公司,http://www.11467.com/hangzhou/co/148262.htm
义乌志星汽车零部件制造有限公司,http://www.11467.com/jinhua/co/122356.htm
杭州临安吉星滑动轴承有限公司,http://www.11467.com/hangzhou/co/105109.htm
安徽路昊汽车用品有限公司,http://www.11467.com/hefei/co/88521.htm
安徽图腾汽配有限公司,http://www.11467.com/hefei/co/88495.htm
浙江鑫谷汽配有限公司,http://www.11467.com/lishui/co/13499.htm
深圳市恒邦滤清器制品有限公司,http://www.11467.com/shenzhen/co/505107.htm
玉环迈迅利电子机械有限公司,http://www.11467.com/qingyang/co/12767.htm
诸暨市人杰动力配件有限公司,http://www.11467.com/shaoxing/co/71354.htm
苏州阿尔法环保科技有限公司,http://www.11467.com/suzhou/co/299768.htm
瑞安市美格汽车零部件有限公司,http://www.11467.com/wenzhou/co/219266.htm
重庆擎动机电设备有限公司,http://www.11467.com/chongqing/co/204815.htm
江西浩风电器有限公司,http://www.11467.com/yichun/co/20070.htm
新乡市山林滤清器有限公司,http://www.11467.com/xinxiang/co/23154.htm
新疆浩顺翔工贸有限公司,http://www.11467.com/wulumuqi/co/87952.htm
新乡市德普瑞滤清器有限公司,http://www.11467.com/xinxiang/co/23155.htm
芜湖精艺汽车配件有限公司,http://www.11467.com/wuhu/co/20626.htm
郑州瓦轴轴承销售有限公司,http://www.11467.com/zhengzhou/co/119113.htm
天津市珀金斯动力机械配件维修有限公司,http://www.11467.com/tianjin/co/15711.htm
重庆四通机械制造有限公司,http://www.11467.com/chongqing/co/169140.htm
新乡市平原滤碳制品有限公司,http://www.11467.com/xinxiang/co/23107.htm
无锡市盛禾泰业涡轮增压器有限公司,http://www.11467.com/wuxi/co/199676.htm
福建省华力密封技术有限公司,http://www.11467.com/ningde/co/40971.htm
衡水中德电机有限公司,http://www.11467.com/hengshui/co/32524.htm
邢台中滨密封件有限公司,http://www.11467.com/xintai/co/41080.htm
博益(天津)气动技术研究所有限公司,http://www.11467.com/tianjin/co/199652.htm
厦门合昌隆涂装设备有限公司,http://www.11467.com/xiamen/co/102998.htm
乐清市铂诚弹簧有限公司,http://www.11467.com/wenzhou/co/299011.htm
天津锐微科技有限公司,http://www.11467.com/tianjin/co/137679.htm
重庆渝通机械有限公司,http://www.11467.com/chongqing/co/23270.htm
武汉驷马特轴承有限公司,http://www.11467.com/wuhan/co/83741.htm
浙江庆源车业部件有限公司,http://www.11467.com/wenzhou/co/221556.htm
盐城查尔斯机电有限公司,http://www.11467.com/yancheng/co/65125.htm
邢台市捷鑫密封件有限公司,http://www.11467.com/xintai/co/52383.htm
河北耐奔凯密封部件有限公司,http://www.11467.com/xintai/co/35826.htm
清河县华鹏汽车配件有限公司,http://www.11467.com/xintai/co/18867.htm
天津江轮机电有限公司,http://www.11467.com/tianjin/co/195870.htm
大丰市鑫达汽摩配件有限公司,http://www.11467.com/yancheng/co/80898.htm
河南华通机电设备有限公司,http://www.11467.com/zhengzhou/co/81815.htm
瑞安市莱顿汽车轴承有限公司,http://www.11467.com/wenzhou/co/219268.htm
玉环博高机械有限公司,http://www.11467.com/qingyang/co/12658.htm
诸暨均泰汽车零部件有限公司,http://www.11467.com/shaoxing/co/107986.htm
无锡明柴汽车配件有限公司,http://www.11467.com/wuxi/co/214859.htm
清河县鑫亿滤清器有限公司,http://www.11467.com/xintai/co/18573.htm
天津森源磁性塑胶制品有限公司,http://www.11467.com/tianjin/co/300221.htm
广州雅驰机械贸易有限公司,http://www.11467.com/guangzhou/co/545936.htm
安庆帝伯格茨活塞环有限公司,http://www.11467.com/anqing/co/17391.htm
长春一汽四环发动机制造有限公司,http://www.11467.com/changchun/co/72956.htm
常州法钠尔电子有限公司,http://www.11467.com/changzhou/co/29250.htm
成都银利汽车零部件有限公司,http://www.11467.com/chengdu/co/110223.htm
池州市广和电池有限责任公司,http://www.11467.com/chizhou/co/8506.htm
东莞鸿图精密压铸有限公司,http://www.11467.com/dongguan/co/110095.htm
福州奥特帕斯工业有限公司,http://www.11467.com/fuzhou/co/106057.htm
广州万宝集团压缩机有限公司,http://www.11467.com/guangzhou/co/67820.htm
哈尔滨东安汽车发动机制造有限公司,http://www.11467.com/haerbin/co/51380.htm
浙江康达汽车工贸有限公司,http://www.11467.com/hangzhou/co/198834.htm
合肥红庄机电有限公司,http://www.11467.com/hefei/co/104107.htm
惠州市锦浓贸易有限公司,http://www.11467.com/huizhou/co/81942.htm
辽阳市富祥曲轴有限公司销售部,http://www.11467.com/liaoyang/co/22795.htm
辽阳富桑曲轴有限公司,http://www.11467.com/liaoyang/co/22780.htm
吉林辽源富奥零部件股份公司泵业分公司,http://www.11467.com/liaoyuan/co/8475.htm
缙云县良友工具有限公司,http://www.11467.com/lishui/co/26245.htm
洛阳拖研动力科技有限公司,http://www.11467.com/luoyang/co/46601.htm
洛阳仙峰机械有限公司,http://www.11467.com/luoyang/co/53073.htm
绵阳华力精工机械有限公司,http://www.11467.com/mianyang/co/38632.htm
南京达迈科技实业有限公司,http://www.11467.com/nanjing/co/24959.htm
福鼎市明辉动力机械有限公司,http://www.11467.com/ningde/co/24939.htm
福鼎市永盛工程塑料有限公司,http://www.11467.com/ningde/co/24932.htm
萍乡市高科陶瓷有任公司,http://www.11467.com/pingxiang/co/13006.htm
石河子新能源化工公司,http://www.11467.com/shihezi/co/5723.htm
宁夏大成商贸有限公司,http://www.11467.com/shizuishan/co/9763.htm
陕西永锐工贸有限公司内销部,http://www.11467.com/xian/co/95605.htm
江陵动力（雅安）汽车配件有限公司,http://www.11467.com/yaan/co/8044.htm
陕西延安市兄弟油泵油嘴经销公司,http://www.11467.com/yanan/co/12692.htm
龙口龙泵燃油喷射有限公司,http://www.11467.com/yantai/co/156218.htm
湖南长丰汽车零部件有限责任公司,http://www.11467.com/yongzhou/co/790.htm
运城市鑫工机车附件制造有限公司,http://www.11467.com/yuncheng/co/23822.htm
扶沟县隆力汽缸盖有限公司,http://www.11467.com/zhoukou/co/18092.htm
周口鑫盛机械制造有限公司,http://www.11467.com/zhoukou/co/18079.htm
