上海振增展览服务有限公司,http://www.11467.com/shanghai/co/525243.htm
郑州利赛隆油泵油嘴有限公司,http://www.11467.com/zhengzhou/co/197976.htm
常州奥立工具有限公司,http://www.11467.com/changzhou/co/129634.htm
慈溪市德顺容器有限公司,http://www.11467.com/ningbo/co/195908.htm
诸暨市锐通机械有限公司,http://www.11467.com/shaoxing/co/86899.htm
黄石市瑞通机械有限公司,http://www.11467.com/huangshi/co/18522.htm
安庆帝迈德活塞环制造有限公司,http://www.11467.com/anqing/co/17392.htm
十堰东方赛琦国际贸易有限公司,http://www.11467.com/shiyan/co/27948.htm
江苏雅泰新材料有限公司,http://www.11467.com/suqian/co/11198.htm
十堰琦景工贸有限公司,http://www.11467.com/shiyan/co/30091.htm
十堰市怡鑫汽车电器有限公司,http://www.11467.com/shiyan/co/30058.htm
大庆鑫飞鹏经贸有限公司,http://www.11467.com/daqing/co/40410.htm
江西澳力特缸套有限公司,http://www.11467.com/xinyu/co/6884.htm
安庆市联力机械轴承有限公司,http://www.11467.com/anqing/co/25380.htm
安徽京信汽车配件有限公司,http://www.11467.com/chizhou/co/8278.htm
阜新德克液压机械有限公司,http://www.11467.com/fuxin/co/16138.htm
萍乡市德博科技发展有限公司,http://www.11467.com/pingxiang/co/12038.htm
秦皇岛市福惠科技开发有限公司,http://www.11467.com/qinhuangdao/co/36000.htm
廊坊市精诚气泵有限公司,http://www.11467.com/langfang/co/30922.htm
包头市福瑞德商贸有限公司,http://www.11467.com/baotou/co/24407.htm
上海帝隆工业皮带有限公司,http://www.11467.com/shanghai/co/55356.htm
承德苏垦银河连杆股份有限公司,http://www.11467.com/chengde/co/22280.htm
天津市安瑞博汽车部品有限公司津英轴瓦厂,http://www.11467.com/tianjin/co/191109.htm
包头市崇瑞汽车贸易有限公司,http://www.11467.com/baotou/co/31183.htm
南方泵业股份有限公司,http://www.11467.com/hangzhou/co/310656.htm
铁岭桦林浮动油封有限公司,http://www.11467.com/tieling/co/22247.htm
江门市泓科电子科技有限公司,http://www.11467.com/jiangmen/co/102917.htm
诸暨市樱芝雪机械有限公司,http://www.11467.com/shaoxing/co/86901.htm
山东济南康城油泵油嘴配件销售公司,http://www.11467.com/jinan/co/114371.htm
孝感市欧麦迪机械工业有限公司,http://www.11467.com/xiaogan/co/17278.htm
长葛市合创密封件有限公司,http://www.11467.com/xuchang/co/32623.htm
佛山市南海区盈泓液压气动机电有限公司,http://www.11467.com/foshan/co/356213.htm
十堰广联贸易有限公司,http://www.11467.com/shiyan/co/31413.htm
四川南充兴华机电制造有限公司,http://www.11467.com/nanchong/co/24598.htm
福鼎市华格机车有限公司,http://www.11467.com/ningde/co/36174.htm
芜湖肯昌机电有限公司,http://www.11467.com/wuhu/co/25420.htm
宇环数控机床股份有限公司,http://www.11467.com/changsha/co/135351.htm
贵州安顺晨迪发动机配套有限责任公司,http://www.11467.com/anshun/co/7050.htm
福鼎市协力机车部件有限公司,http://www.11467.com/ningde/co/24947.htm
熙熙有限公司,http://www.11467.com/zhongshan/co/70678.htm
久诚电喷配件有限公司,http://www.11467.com/chengdu/co/142299.htm
济宁沃尔弘商贸有限公司,http://www.11467.com/jining/co/71604.htm
莆田市中路通机械有限公司,http://www.11467.com/putian/co/35933.htm
湖北商配科贸发展有限公司,http://www.11467.com/shiyan/co/29851.htm
诸暨市皮尔萨管业有限公司,http://www.11467.com/shaoxing/co/86903.htm
济宁市恒远机械有限公司,http://www.11467.com/jining/co/56522.htm
衢州新航机动车部件有限公司,http://www.11467.com/quzhou/co/22511.htm
福鼎市鸿辉机车部件有限公司,http://www.11467.com/ningde/co/15237.htm
十堰市龙虎工贸有限公司,http://www.11467.com/shiyan/co/29747.htm
湖南恒裕汽车零部件有限公司,http://www.11467.com/huaihua/co/18916.htm
同源（厦门）五金工业有限公司,http://www.11467.com/xiamen/co/23788.htm
陕西阿普达机电工程有限公司,http://www.11467.com/xian/co/121832.htm
福安市京格电机有限公司,http://www.11467.com/ningde/co/36145.htm
十堰百亚国际贸易有限公司,http://www.11467.com/shiyan/co/31406.htm
临沂市福斯特园林机械有限公司,http://www.11467.com/linyi/co/107045.htm
苏州广用机械自动化有限公司,http://www.11467.com/suzhou/co/357297.htm
福建华泰汽车零部件工业有限公司,http://www.11467.com/nanping/co/35201.htm
诸暨市永兴管业有限公司,http://www.11467.com/shaoxing/co/118157.htm
六安市金城机械有限公司,http://www.11467.com/liuan/co/15157.htm
固安县方兴过滤设备有限公司,http://www.11467.com/langfang/co/52179.htm
临清市鑫特冶金轴承有限公司,http://www.11467.com/liaocheng/co/49842.htm
襄阳远和机电设备有限公司,http://www.11467.com/xiangfan/co/43789.htm
咸阳中海商贸有限公司,http://www.11467.com/xianyang/co/24689.htm
泰州超人气压件有限公司,http://www.11467.com/taizhoushi/co/48349.htm
深圳市盛凌橡塑制品有限公司,http://www.11467.com/nanning/co/85999.htm
秦皇岛恩克密封科技有限公司,http://www.11467.com/qinhuangdao/co/39055.htm
东莞市东思电子技术有限公司,http://www.11467.com/dongguan/co/556722.htm
河南凯赛液压密封件销售有限公司,http://www.11467.com/zhengzhou/co/183438.htm
泉州市嘉通电子科技有限公司,http://www.11467.com/quanzhou/co/147094.htm
石家庄市华腾动力机械有限公司,http://www.11467.com/shijiazhuang/co/69825.htm
浙江博星工贸有限公司,http://www.11467.com/jinhua/co/76607.htm
邢台三力维橡胶有限公司,http://www.11467.com/linyi/co/63054.htm
东风汽车泵业有限公司,http://www.11467.com/shiyan/co/210.htm
十堰法雷诺动力科技有限公司,http://www.11467.com/shiyan/co/29553.htm
瑞安市中建机械配件有限公司,http://www.11467.com/wenzhou/co/138633.htm
厦门黑木科技有限公司,http://www.11467.com/xiamen/co/54276.htm
湖北业浩动力科技有限公司,http://www.11467.com/xiangfan/co/35612.htm
邢台市隆顶机械配件有限公司,http://www.11467.com/xintai/co/35838.htm
北京海力奇增压器有限公司,http://www.11467.com/beijing/co/317251.htm
天津市瑞博尔橡塑制品有限公司,http://www.11467.com/tianjin/co/16509.htm
重庆长安离合器制造有限公司,http://www.11467.com/chongqing/co/125019.htm
洛阳显恒数控机床有限公司,http://www.11467.com/luoyang/co/48035.htm
南昌洪都汽车配件制造有限公司,http://www.11467.com/nanchang/co/89421.htm
江门市骏通橡胶制品有限公司,http://www.11467.com/jiangmen/co/91623.htm
新乡市天瑞液压设备有限公司,http://www.11467.com/xinxiang/co/38434.htm
烟台石川密封垫板有限公司,http://www.11467.com/yantai/co/114631.htm
广州赛鼎汽车配件有限公司,http://www.11467.com/guangzhou/co/236936.htm
广州市正多商贸有限公司,http://www.11467.com/guangzhou/co/482525.htm
杭州雷纳德机械有限公司,http://www.11467.com/hangzhou/co/256187.htm
十堰宏业橡塑制品有限公司,http://www.11467.com/shiyan/co/2528.htm
十堰翔诺汽车零部件有限公司,http://www.11467.com/shiyan/co/32687.htm
厦门沛得国际贸易有限公司,http://www.11467.com/xiamen/co/54778.htm
上海龙华汽车配件有限公司,http://www.11467.com/shanghai/co/912052.htm
江苏台普动力机械有限公司,http://www.11467.com/yancheng/co/52793.htm
石家庄金刚内燃机零部件集团有限公司,http://www.11467.com/shijiazhuang/co/85488.htm
清河县德马汽车零部件有限公司,http://www.11467.com/xintai/co/52835.htm
清河县永顺汽车零部件有限公司,http://www.11467.com/xintai/co/51086.htm
深圳市高士达精密机械有限公司,http://www.11467.com/shenzhen/co/761557.htm
南京欧博斯橡胶制品有限公司,http://www.11467.com/nanjing/co/154877.htm
浙江毅力汽车空调有限公司,http://www.11467.com/lishui/co/35194.htm
瑞安市伟峰机车部件有限公司,http://www.11467.com/wenzhou/co/219273.htm
十堰沃诺重汽零部件有限公司,http://www.11467.com/guangzhou/co/455675.htm
东莞大禹机械有限公司,http://www.11467.com/dongguan/co/119416.htm
东莞市三创五金塑胶有限公司,http://www.11467.com/dongguan/co/200030.htm
烟台福尔精密机械有限公司,http://www.11467.com/yantai/co/62990.htm
芜湖雅伦汽配有限公司,http://www.11467.com/wuhu/co/23191.htm
芜湖通力电机有限责任公司,http://www.11467.com/wuhu/co/5799.htm
无锡富瑞德精密机械有限公司,http://www.11467.com/wuxi/co/142567.htm
无锡凯伦纳弹簧有限公司,http://www.11467.com/wuxi/co/176016.htm
四川新海润泵业有限公司,http://www.11467.com/zigong/co/25413.htm
济宁吉安机械制造有限公司,http://www.11467.com/jining/co/98503.htm
重庆荣轩机电有限责任公司,http://www.11467.com/chongqing/co/62339.htm
上海春阳滚塑制品有限公司,http://www.11467.com/shanghai/co/275171.htm
慈溪市永大轴承有限公司,http://www.11467.com/qiye/12616.htm
柳州源创电喷技术有限公司,http://www.11467.com/liuzhou/co/41303.htm
合肥宝发动力技术有限公司,http://www.11467.com/hefei/co/137522.htm
衡水双兴橡塑制品有限公司,http://www.11467.com/hengshui/co/33748.htm
任丘市强东电机有限公司,http://www.11467.com/cangzhou/co/67749.htm
菏泽恒泰油咀油泵有限公司,http://www.11467.com/heze/co/20762.htm
河北中信橡胶管带有限公司,http://www.11467.com/hengshui/co/29191.htm
开封铁塔橡胶(集团)有限公司,http://www.11467.com/kaifeng/co/13836.htm
常州市江南波纹管有限公司,http://www.11467.com/changzhou/co/106709.htm
常州新瑞汽车配件制造有限公司,http://www.11467.com/changzhou/co/112731.htm
大连路阳科技开发有限公司,http://www.11467.com/dalian/co/61188.htm
滨州东海龙活塞有限公司,http://www.11467.com/binzhou/co/1603.htm
常州鼎豪精机有限公司,http://www.11467.com/changzhou/co/91701.htm
常州环能涡轮动力有限公司,http://www.11467.com/changzhou/co/112740.htm
杭州佳顺汽车配件有限公司,http://www.11467.com/hangzhou/co/263818.htm
东莞市久骥热熔胶喷涂科技有限公司,http://www.11467.com/dongguan/co/123522.htm
河北恒宇橡胶制品集团有限公司,http://www.11467.com/hengshui/co/34681.htm
荆州环宇汽车零部件有限公司,http://www.11467.com/jingzhou/co/228.htm
安平县东捷丝网制品有限公司,http://www.11467.com/hengshui/co/42535.htm
河北省景县永达橡塑有限公司,http://www.11467.com/hengshui/co/33920.htm
东莞市寮步顺销专用机械有限公司,http://www.11467.com/dongguan/co/118136.htm
河北昊通橡塑管业有限公司,http://www.11467.com/hengshui/co/33914.htm
佛山市博瑞斯机电设备有限公司,http://www.11467.com/foshan/co/355739.htm
东莞市胜盛橡胶制品有限公司,http://www.11467.com/dongguan/co/288887.htm
东莞市特利丰无纺布有限公司,http://www.11467.com/dongguan/co/131409.htm
常州丰安机电有限公司,http://www.11467.com/changzhou/co/106532.htm
杭州越凯复合材料有限公司,http://www.11467.com/hangzhou/co/113984.htm
广州市金炜通塑料制品有限公司,http://www.11467.com/guangzhou/co/107561.htm
广州谊隆汽车用品有限公司,http://www.11467.com/guangzhou/co/279844.htm
固安县林嘉过滤器材有限公司,http://www.11467.com/langfang/co/41865.htm
廊坊世纪蓝天过滤科技有限公司,http://www.11467.com/langfang/co/35651.htm
义乌市鼎信百货有限公司,http://www.11467.com/jinhua/co/124625.htm
福州市鼓楼区伟则利贸易有限公司,http://www.11467.com/fuzhou/co/130994.htm
佛山市禅城区中联液压机械有限公司,http://www.11467.com/foshan/co/238308.htm
东莞市贝洛橡胶制品有限公司,http://www.11467.com/dongguan/co/288888.htm
芜湖雪狼汽车零部件有限公司,http://www.11467.com/wuhu/co/25522.htm
东莞市博恩皮业有限公司,http://www.11467.com/dongguan/co/531301.htm
滨州市宝鑫活塞耐磨环有限公司,http://www.11467.com/binzhou/co/31775.htm
湖南鑫源缸套有限责任公司,http://www.11467.com/changde/co/26910.htm
安徽祈艾特电子科技有限公司,http://www.11467.com/bengbu/co/28138.htm
东莞市喜怡液压科技有限公司,http://www.11467.com/dongguan/co/460855.htm
东莞市有为电子有限公司,http://www.11467.com/dongguan/co/133291.htm
福州华高机电有限公司,http://www.11467.com/fuzhou/co/130864.htm
广州键程汽车用品有限公司,http://www.11467.com/guangzhou/co/233600.htm
舟山市柯顺达汽车配件制造有限公司,http://www.11467.com/guangzhou/co/495354.htm
广州天恒机车工业有限公司,http://www.11467.com/guangzhou/co/116449.htm
泰安兴煤矿山机械有限公司,http://www.11467.com/taian/co/37359.htm
南通龙华进出口有限公司,http://www.11467.com/nantong/co/101479.htm
连云港爱孚特密封件有限公司,http://www.11467.com/lianyungang/co/28970.htm
潍坊华源内燃机制造有限公司,http://www.11467.com/weifang/co/120697.htm
江苏晶石科技集团有限公司,http://www.11467.com/wuxi/co/186720.htm
山东熙德机械制造有限公司,http://www.11467.com/liaocheng/co/28634.htm
浙江丽威油泵油嘴有限公司,http://www.11467.com/lishui/co/23013.htm
浙江圣峰汽车部件有限公司,http://www.11467.com/lishui/co/24456.htm
柳州绰丰柳机内燃机有限公司,http://www.11467.com/liuzhou/co/34117.htm
洛阳雷特动力电器科技开发有限公司,http://www.11467.com/luoyang/co/48882.htm
深圳市东川机械设备有限公司,http://www.11467.com/shenzhen/co/144728.htm
十堰市鑫磊鑫工贸有限公司,http://www.11467.com/shiyan/co/26406.htm
随州市奥丰汽车零部件有限公司,http://www.11467.com/suizhou/co/8303.htm
苏州冠诺工业机电设备有限公司,http://www.11467.com/suzhou/co/239998.htm
泰安市立邦活塞制造有限公司,http://www.11467.com/taian/co/36248.htm
青岛春泰汽车配件有限公司,http://www.11467.com/qingdao/co/86881.htm
聊城国泰机械有限公司,http://www.11467.com/liaocheng/co/21122.htm
泰州市高港区盛源橡胶有限公司,http://www.11467.com/taizhoushi/co/30477.htm
芜湖海昌橡胶有限责任公司,http://www.11467.com/wuhu/co/5999.htm
茂名银峰机电设备有限公司,http://www.11467.com/maoming/co/30449.htm
泉州鲤城明侨机械配件有限公司,http://www.11467.com/quanzhou/co/564.htm
临海市裕隆汽配有限公司,http://www.11467.com/taizhou/co/137695.htm
深圳市钜泰泵业有限公司,http://www.11467.com/shenzhen/co/766743.htm
福安市煜坤强威电机有限公司,http://www.11467.com/linyi/co/106880.htm
连云港华信精密模具有限公司,http://www.11467.com/lianyungang/co/29217.htm
余姚市威龙工业有限公司,http://www.11467.com/ningbo/co/195525.htm
任县企大橡胶有限责任公司,http://www.11467.com/xintai/co/49562.htm
河北亚泰工业集团有限公司,http://www.11467.com/xintai/co/26991.htm
固安县林嘉过滤器材有限公司,http://www.11467.com/langfang/co/41865.htm
廊坊世纪蓝天过滤科技有限公司,http://www.11467.com/langfang/co/35651.htm
邢台道宏汽车配件有限公司,http://www.11467.com/xintai/co/44843.htm
无锡凯瑞特种管业有限公司,http://www.11467.com/wuxi/co/173934.htm
福鼎市丰泰化油器制造有限公司,http://www.11467.com/ningde/co/23902.htm
南京绅华汽车贸易有限公司,http://www.11467.com/nanjing/co/70641.htm
南宁强华海岸商贸有限公司,http://www.11467.com/nanning/co/86238.htm
南通宏大机电制造有限公司,http://www.11467.com/nantong/co/137616.htm
深圳市恒基机电设备有限公司,http://www.11467.com/shenzhen/co/111073.htm
泉州市丰泽旭达机械有限公司,http://www.11467.com/quanzhou/co/65214.htm
十堰福尔盾科技有限公司,http://www.11467.com/shiyan/co/29744.htm
河北省固安县前程滤清器有限公司,http://www.11467.com/langfang/co/36219.htm
广州胜奥汽车配件公司,http://www.11467.com/guangzhou/co/238205.htm
石家庄杰颂动力机械销售有限公司,http://www.11467.com/shijiazhuang/co/107856.htm
上海春阳滚塑制品有限公司,http://www.11467.com/shanghai/co/275171.htm
北京元业隆科技发展有限公司,http://www.11467.com/beijing/co/101873.htm
重庆雷联汽车部件有限公司,http://www.11467.com/chongqing/co/13129.htm
新乡斯浦瑞汽配有限公司,http://www.11467.com/zhengzhou/co/148001.htm
广州畅达汽车配件有限公司,http://www.11467.com/guangzhou/co/432442.htm
新乡市华正散热器有限公司,http://www.11467.com/xinxiang/co/22967.htm
徐州奥尼克电气有限公司,http://www.11467.com/xuzhou/co/51823.htm
扬州群发换热器有限公司,http://www.11467.com/yangzhou/co/73636.htm
山东金华飞顺车辆有限公司,http://www.11467.com/zaozhuang/co/8094.htm
肇庆市骏驰科技有限公司,http://www.11467.com/zhaoqing/co/26759.htm
重庆友好活塞有限公司,http://www.11467.com/chongqing/co/169878.htm
上海世德子汽车零部件有限公司,http://www.11467.com/shanghai/co/883849.htm
重庆佳利德汽车部件有限公司,http://www.11467.com/chongqing/co/23261.htm
上海得乐名鑫机电有限公司,http://www.11467.com/shanghai/co/316089.htm
盐城赛福汽车零部件有限公司,http://www.11467.com/yancheng/co/57105.htm
北京恩瑞德轴承销售有限公司,http://www.11467.com/beijing/co/622054.htm
安阳市翔宇车业有限责任公司,http://www.11467.com/anyang/co/26444.htm
福建省莆田中涵机动力有限公司,http://www.11467.com/putian/co/34517.htm
广西玉林玉柴机器配件制造有限公司,http://www.11467.com/yulin/co/15301.htm
盐城市苏海供热设备有限公司,http://www.11467.com/yancheng/co/73379.htm
上海阜景密封技术有限公司,http://www.11467.com/shanghai/co/54330.htm
北京博源通达汽车零部件有限公司,http://www.11467.com/beijing/co/693814.htm
山东润驰重型锻造有限公司,http://www.11467.com/zibo/co/66789.htm
河南龙鼎铸业股份有限公司,http://www.11467.com/zhengzhou/co/111085.htm
江苏泛美工程机械有限公司,http://www.11467.com/xuzhou/co/82941.htm
湖北大豪动力设备有限公司,http://www.11467.com/shiyan/co/31419.htm
淄博金晟橡胶制品有限公司,http://www.11467.com/zibo/co/99450.htm
山东中创活塞制造有限公司,http://www.11467.com/zibo/co/73406.htm
东莞市九合滤清器有限公司,http://www.11467.com/dongguan/co/411996.htm
石家庄匡邦商贸有限公司,http://www.11467.com/shijiazhuang/co/107889.htm
上海康亚工业皮带有限公司,http://www.11467.com/shanghai/co/828192.htm
上海康亚工业皮带有限公司,http://www.11467.com/shanghai/co/828192.htm
广州市顺景汽车配件有限公司,http://www.11467.com/guangzhou/co/469767.htm
济南福沃物资有限公司,http://www.11467.com/jinan/co/137848.htm
潍坊沃华精工零部件制造有限公司,http://www.11467.com/weifang/co/85622.htm
世纪霁海科技（北京）有限公司,http://www.11467.com/qiye/9741.htm
东莞市华俊工业皮带有限公司,http://www.11467.com/dongguan/co/412579.htm
大连泰克密封制品有限公司,http://www.11467.com/dalian/co/49076.htm
常州祥金精密机械有限公司,http://www.11467.com/changzhou/co/104965.htm
常州泛华机械科技有限公司,http://www.11467.com/changzhou/co/109908.htm
长沙米纳电器有限公司,http://www.11467.com/changsha/co/22668.htm
常州市国海轴承有限公司,http://www.11467.com/changzhou/co/110546.htm
常州悦美铸造有限公司,http://www.11467.com/changzhou/co/104449.htm
常州市盟发燃油喷射器有限公司,http://www.11467.com/changzhou/co/109217.htm
东莞市兴彤长电子科技有限公司,http://www.11467.com/dongguan/co/490462.htm
吉林省润峰汽车零部件有限公司,http://www.11467.com/changchun/co/72733.htm
东莞市福森工业皮带有限公司,http://www.11467.com/dongguan/co/484382.htm
东莞市华奇密封件有限公司,http://www.11467.com/dongguan/co/555933.htm
东莞市锐拓机械设备有限公司,http://www.11467.com/dongguan/co/488470.htm
东莞市艾迪朗机械有限公司,http://www.11467.com/dongguan/co/502238.htm
湖南海洲机械制造有限公司,http://www.11467.com/changsha/co/87747.htm
东莞亿福达自动化科技有限公司,http://www.11467.com/dongguan/co/557195.htm
东莞市承兴机电设备有限公司,http://www.11467.com/dongguan/co/414137.htm
东莞市鸿鑫精密工具有限公司,http://www.11467.com/dongguan/co/134001.htm
东莞市百巨五金机电有限公司,http://www.11467.com/dongguan/co/118406.htm
东莞市涌昌电子实业有限公司,http://www.11467.com/dongguan/co/529286.htm
东莞市金维橡胶制品有限公司,http://www.11467.com/dongguan/co/411135.htm
长沙中大水泵实业有限公司,http://www.11467.com/changsha/co/85818.htm
浙江南部气动有限公司,http://www.11467.com/changsha/co/86144.htm
东莞市艳生自动化设备有限公司,http://www.11467.com/dongguan/co/313756.htm
东莞市双腾气动液压件有限公司,http://www.11467.com/dongguan/co/490306.htm
常州市君迪汽车配件有限公司,http://www.11467.com/changzhou/co/99548.htm
常州嘉柏精密机械有限公司,http://www.11467.com/changzhou/co/129495.htm
常州市川成五化交有限公司,http://www.11467.com/changzhou/co/52745.htm
丹东市振华橡胶制品有限公司,http://www.11467.com/dandong/co/18047.htm
东莞市正东过滤材料有限公司,http://www.11467.com/dongguan/co/131036.htm
东莞市典鑫五金机械有限公司,http://www.11467.com/dongguan/co/297394.htm
九江市永信制罐设备有限公司,http://www.11467.com/jiujiang/co/19095.htm
淮安市嘉熙尼龙制品有限公司,http://www.11467.com/huaian/co/38033.htm
景县永昌化工矿冶机械配件有限公司,http://www.11467.com/hengshui/co/28695.htm
江门市蓬江区辉腾橡胶制品有限公司,http://www.11467.com/jiangmen/co/116710.htm
嘉兴市凯美轴承有限公司,http://www.11467.com/jiaxing/co/85679.htm
湖州锐狮标准件制造有限公司,http://www.11467.com/huzhou/co/35405.htm
山东百帝气动液压有限公司,http://www.11467.com/jinan/co/79813.htm
宁德市林氏发电设备有限公司,http://www.11467.com/jinhua/co/73283.htm
衡水康宏橡塑制品有限公司-石家庄办事处,http://www.11467.com/hengshui/co/20854.htm
昆明凯彪科技有限公司,http://www.11467.com/kunming/co/107526.htm
莱芜市亚恒工贸有限公司,http://www.11467.com/laiwu/co/6926.htm
浙江海德曼过滤技术有限公司,http://www.11467.com/jiaxing/co/79797.htm
江门市冷跑王休闲车动力制造有限公司,http://www.11467.com/jiangmen/co/88212.htm
揭阳市新地亚五金配件有限公司,http://www.11467.com/jieyang/co/1125.htm
河北省安平县长安石化设备有限公司,http://www.11467.com/hengshui/co/33950.htm
济南瑜瑞工贸有限公司,http://www.11467.com/jinan/co/90976.htm
淮安市新宏机械有限公司,http://www.11467.com/huaian/co/37227.htm
莱芜永驰橡塑有限责任公司,http://www.11467.com/laiwu/co/7369.htm
建德市春雷五金电器有限公司,http://www.11467.com/hangzhou/co/93453.htm
安徽合畅进出口有限公司,http://www.11467.com/hefei/co/131846.htm
河北振兴化工橡胶有限公司,http://www.11467.com/hengshui/co/37544.htm
东阿德科发机械制造有限公司,http://www.11467.com/liaocheng/co/42207.htm
开封市罗升建筑设备有限公司,http://www.11467.com/kaifeng/co/14757.htm
衡水滨海活塞制造有限公司,http://www.11467.com/hengshui/co/37980.htm
景县华发石油机械有限公司,http://www.11467.com/hengshui/co/29119.htm
杭州欧康汽配有限公司,http://www.11467.com/hangzhou/co/243720.htm
杭州裕宁汽车配件有限公司,http://www.11467.com/hangzhou/co/1265.htm
衡水巨能机械配件有限公司,http://www.11467.com/hengshui/co/26916.htm
义乌市阿斯兰皮具有限公司,http://www.11467.com/jinhua/co/124632.htm
洛阳瑞宇工贸有限公司,http://www.11467.com/luoyang/co/48315.htm
江西元亿实业发展有限公司,http://www.11467.com/pingxiang/co/6805.htm
宁德市超鑫机车部件制造有限公司,http://www.11467.com/ningde/co/24886.htm
聊城市恒瑞汽车部件有限公司,http://www.11467.com/liaocheng/co/25778.htm
聊城市兴宇机械制造有限公司,http://www.11467.com/liaocheng/co/29021.htm
聊城市恒盛轴承有限公司,http://www.11467.com/liaocheng/co/25806.htm
青岛恒生创展贸易有限公司,http://www.11467.com/qingdao/co/124349.htm
泉州市华大汽车零部件有限公司,http://www.11467.com/quanzhou/co/2671.htm
泉州源联盛机械制造有限公司,http://www.11467.com/quanzhou/co/100407.htm
商丘科信油嘴油泵有限公司,http://www.11467.com/shangqiu/co/15893.htm
绍兴市埃可迅机电技术有限公司,http://www.11467.com/shaoxing/co/74237.htm
绍兴市东洲汽车齿轮有限公司,http://www.11467.com/shaoxing/co/8646.htm
宁德市科龙精密机车部件有限公司,http://www.11467.com/ningde/co/24881.htm
上虞市振荣橡胶制品有限公司,http://www.11467.com/shaoxing/co/34706.htm
南京萨米特进出口贸易有限公司,http://www.11467.com/nanjing/co/144174.htm
南通市思诚塑料制品有限公司,http://www.11467.com/nantong/co/113411.htm
诸暨飞挺汽车零部件有限公司,http://www.11467.com/shaoxing/co/118099.htm
福建东南活塞环制造有限公司,http://www.11467.com/quanzhou/co/136973.htm
南充市纵横动力配件有限公司,http://www.11467.com/nanchong/co/23960.htm
