广州普喜伽皮具有限公司,http://www.11467.com/guangzhou/co/484507.htm
广州恒泰自动变速箱维修有限公司,http://www.11467.com/guangzhou/co/233575.htm
广州君风增压器有限公司,http://www.11467.com/guangzhou/co/473485.htm
广州市汇通机械有限公司内蒙古分公司,http://www.11467.com/guangzhou/co/477122.htm
广州市宏程奥铃汽车配件有限公司,http://www.11467.com/guangzhou/co/477970.htm
广州市亮睛睛贸易有限公司,http://www.11467.com/guangzhou/co/279833.htm
广州市长圣贸易责任有限公司,http://www.11467.com/guangzhou/co/479583.htm
广州精英汽配有限公司,http://www.11467.com/guangzhou/co/320964.htm
广州金翼达无人飞行器科技有限公司,http://www.11467.com/guangzhou/co/343369.htm
广州市广泰企业有限公司,http://www.11467.com/guangzhou/co/296960.htm
广州市宝田科技有限公司,http://www.11467.com/guangzhou/co/462182.htm
广州市太邦汽车配件有限公司,http://www.11467.com/guangzhou/co/480508.htm
广州拓达汽车配件有限公司,http://www.11467.com/guangzhou/co/462189.htm
广州斯太尔汽车配件重卡配件销售公司,http://www.11467.com/guangzhou/co/280042.htm
广州市澎潮汽车配件有限公司,http://www.11467.com/guangzhou/co/47665.htm
广州市达利恩贸易有限公司,http://www.11467.com/guangzhou/co/469770.htm
广州市力富五十铃重型机械配件有限公司,http://www.11467.com/guangzhou/co/479996.htm
广州晟达自动变速箱有限公司,http://www.11467.com/guangzhou/co/298500.htm
广州市金华辉汽车配件有限公司,http://www.11467.com/guangzhou/co/481554.htm
广州市越德发动机配件公司,http://www.11467.com/guangzhou/co/462171.htm
广州市名伦实业有限公司,http://www.11467.com/guangzhou/co/294649.htm
广州洋诚汽车配件有限公司,http://www.11467.com/guangzhou/co/467612.htm
广州市穗丰万里汽车配件有限公司,http://www.11467.com/guangzhou/co/298534.htm
广州市飞智贸易公司,http://www.11467.com/guangzhou/co/473484.htm
广州市大荣汽配贸易有限公司,http://www.11467.com/guangzhou/co/234886.htm
广州向上汽车零部件有限公司,http://www.11467.com/guangzhou/co/294612.htm
广州市滤之圣过滤器制造有限公司,http://www.11467.com/guangzhou/co/459014.htm
广州威远汽车电子科技有限公司,http://www.11467.com/guangzhou/co/428882.htm
广州市洛奇汽车配件有限公司,http://www.11467.com/guangzhou/co/297756.htm
广州致晟汽车配件有限公司,http://www.11467.com/guangzhou/co/475089.htm
广州中沃汽配公司,http://www.11467.com/guangzhou/co/471707.htm
广州骐松康明斯小松配件公司,http://www.11467.com/guangzhou/co/462158.htm
广州银皓汽配有限公司,http://www.11467.com/guangzhou/co/467602.htm
广州希普拓机电设备有限公司,http://www.11467.com/guangzhou/co/278116.htm
广州裕隆汽车配件有限公司,http://www.11467.com/guangzhou/co/462177.htm
广州宇鸿企业管理顾问有限公司,http://www.11467.com/guangzhou/co/234670.htm
广州振宏机械有限公司,http://www.11467.com/guangzhou/co/473487.htm
苏州睿昕汽车配件有限公司,http://www.11467.com/guangzhou/co/428878.htm
玉环县锦辉制动器有限公司,http://www.11467.com/guangzhou/co/238047.htm
霍克塞尔涡轮增压器系统有限公司,http://www.11467.com/guangzhou/co/473486.htm
广州鑫俊佑贸易有限公司,http://www.11467.com/guangzhou/co/459032.htm
帅傲国际汽配公司,http://www.11467.com/guangzhou/co/475091.htm
双源贸易有限公司,http://www.11467.com/guangzhou/co/235785.htm
日照市立盈机械制造有限公司,http://www.11467.com/guangzhou/co/247497.htm
全美（国际）贸易有限公司,http://www.11467.com/guangzhou/co/234595.htm
清远市万里丰活塞环有限公司,http://www.11467.com/guangzhou/co/235746.htm
广州市兴之莲汽车配件有限公司,http://www.11467.com/guangzhou/co/467615.htm
广州市建铄机电有限公司,http://www.11467.com/guangzhou/co/428879.htm
无锡市捷瑞特增压器有限公司,http://www.11467.com/guiyang/co/72700.htm
贵州新航力装备制造有限公司,http://www.11467.com/guiyang/co/72270.htm
无锡圣特马动力机械有限公司,http://www.11467.com/guiyang/co/83047.htm
贵阳源康机械制造有限公司,http://www.11467.com/guiyang/co/25502.htm
哈尔滨金雷北京现代起亚汽车配件公司,http://www.11467.com/haerbin/co/70923.htm
哈尔滨志阳汽车电机有限公司,http://www.11467.com/haerbin/co/45849.htm
哈尔滨文信汽车电气有限公司,http://www.11467.com/haerbin/co/51179.htm
杭州诚信汽车轴承有限公司,http://www.11467.com/hangzhou/co/259612.htm
杭州北海龍橡胶密封件有限公司,http://www.11467.com/hangzhou/co/372301.htm
杭州德曼汽车零部件有限公司,http://www.11467.com/hangzhou/co/257840.htm
杭州江东内燃机配件有限公司,http://www.11467.com/hangzhou/co/65535.htm
杭州明锐达汽配有限公司,http://www.11467.com/hangzhou/co/265213.htm
杭州双象汽车零部件有限公司,http://www.11467.com/hangzhou/co/243807.htm
杭州俊豪贸易有限公司总部,http://www.11467.com/hangzhou/co/243705.htm
杭州金叶曲轴有限公司,http://www.11467.com/hangzhou/co/117310.htm
杭州永鑫叉车配件有限公司,http://www.11467.com/hangzhou/co/169228.htm
杭州佑昌齿轮制造有限公司,http://www.11467.com/hangzhou/co/368907.htm
杭州九龙机械制造有限公司,http://www.11467.com/hangzhou/co/251738.htm
杭州特种纸业有限公司,http://www.11467.com/hangzhou/co/311053.htm
杭州兴发弹簧有限公司,http://www.11467.com/hangzhou/co/144074.htm
临安汉克森过滤设备有限公司,http://www.11467.com/hangzhou/co/209090.htm
联大汽车有限公司,http://www.11467.com/hangzhou/co/263897.htm
杭州卫东数控机电有限公司,http://www.11467.com/hangzhou/co/256318.htm
杭州星丰实业有限公司,http://www.11467.com/hangzhou/co/123496.htm
临安启跃汽车部件有限公司,http://www.11467.com/hangzhou/co/371933.htm
杭州玉泉机车配件有限公司,http://www.11467.com/hangzhou/co/264268.htm
中国重型汽车集团公司,http://www.11467.com/hangzhou/co/265221.htm
中国重汽集团杭州发动机有限公司,http://www.11467.com/hangzhou/co/263884.htm
浙江华策汽车有限公司,http://www.11467.com/hangzhou/co/263908.htm
浙江定川机电制造有限公司,http://www.11467.com/hangzhou/co/369330.htm
杭州睿威机车配件有限公司,http://www.11467.com/hangzhou/co/240991.htm
杭州山松工程机械销售有限公司,http://www.11467.com/hangzhou/co/195667.htm
安徽华新科技发展有限公司,http://www.11467.com/hefei/co/81880.htm
安徽辉文机电商贸有限公司,http://www.11467.com/hefei/co/132116.htm
安徽徽铃机电有限公司,http://www.11467.com/hefei/co/93014.htm
合肥赛鸥进出口有限公司,http://www.11467.com/hefei/co/88752.htm
合肥坤强商贸有限责任公司,http://www.11467.com/hefei/co/132119.htm
安徽大成实业有限公司,http://www.11467.com/hefei/co/48206.htm
合肥恒泰汽车服务有限公司 (原恒力),http://www.11467.com/hefei/co/133505.htm
江苏意奔玛机械有限公司,http://www.11467.com/huaian/co/35022.htm
江苏金湖输油泵有限公司,http://www.11467.com/huaian/co/15592.htm
宿迁市波尔特机械制造有限公司,http://www.11467.com/huaian/co/32294.htm
广东惠州华彬汽车电器有限公司,http://www.11467.com/huizhou/co/97274.htm
长兴凯祥电炉科技有限公司,http://www.11467.com/huzhou/co/67040.htm
湖州科富拉膜技术有限公司,http://www.11467.com/huzhou/co/54809.htm
湖州卡拉夫今朝机电科技有限公司,http://www.11467.com/huzhou/co/27519.htm
湖州佳士汽车配件有限公司,http://www.11467.com/huzhou/co/47204.htm
江西骏马鞋业有限公司(皮具),http://www.11467.com/jian/co/18423.htm
江门朝扬精密制造有限公司,http://www.11467.com/jiangmen/co/2857.htm
江门市斯贝科技缸套有限公司,http://www.11467.com/jiangmen/co/93721.htm
江门王野摩托车制造有限公司,http://www.11467.com/jiangmen/co/88109.htm
广东省江门保得利机械工业有限公司,http://www.11467.com/jiangmen/co/93448.htm
力讯汽车电子有限公司,http://www.11467.com/jiaxing/co/86663.htm
全拓交通器材（平湖）有限公司,http://www.11467.com/jiaxing/co/60183.htm
吉林明子气配公司,http://www.11467.com/jilinshi/co/78799.htm
济南百吉威汽车配件有限公司,http://www.11467.com/jinan/co/134331.htm
济南大鑫河汽配有限公司,http://www.11467.com/jinan/co/25893.htm
济南欧三滤清器有限公司,http://www.11467.com/jinan/co/136989.htm
济南骏腾油泵油嘴配件销售有限公司,http://www.11467.com/jinan/co/138518.htm
济南联众工贸有限公司,http://www.11467.com/jinan/co/79906.htm
济南福海特重型汽车配件销售公司,http://www.11467.com/jinan/co/79958.htm
济南中顺重汽配件有限公司,http://www.11467.com/jinan/co/135194.htm
兄弟汽车配件有限公司,http://www.11467.com/jinan/co/137422.htm
山东济南卡乐滤清器有限公司,http://www.11467.com/jinan/co/136498.htm
济南天润龙鑫汽配有限公司,http://www.11467.com/jinan/co/133908.htm
泰安市欧邦暖风散热器有限公司,http://www.11467.com/jinan/co/137420.htm
义乌市掘金电子商务公司,http://www.11467.com/jinhua/co/127533.htm
金华振新皮具有限公司,http://www.11467.com/jinhua/co/122066.htm
浙江省永康市俊尔通用机械有限公司,http://www.11467.com/jinhua/co/122358.htm
义乌市华展会展有限公司(总部),http://www.11467.com/jinhua/co/123104.htm
鸿海箱包有限公司,http://www.11467.com/jinhua/co/122662.htm
义乌市丙昌贸易有限公司,http://www.11467.com/jinhua/co/124759.htm
浙江省金华市武义县盛卓机电设备有限公司,http://www.11467.com/jinhua/co/124433.htm
济宁新源汽修装饰有限公司,http://www.11467.com/jining/co/72081.htm
济宁一松机械有限公司,http://www.11467.com/jining/co/73079.htm
济宁航安皮带扣有限公司,http://www.11467.com/jining/co/64519.htm
梁山县车友汽车配件制造有限公司,http://www.11467.com/jining/co/73000.htm
济宁友邦工程机械有限公司,http://www.11467.com/jining/co/72077.htm
一汽靖烨发动机有限公司,http://www.11467.com/jinzhong/co/22554.htm
中国锦州日菱动力汽车零部件有限公司,http://www.11467.com/jinzhou/co/43533.htm
昆明贵研催化剂有限责任公司,http://www.11467.com/kunming/co/59325.htm
昆明明尚精密机械设备有限公司,http://www.11467.com/kunming/co/107167.htm
莱芜环球汽车零部件有限公司,http://www.11467.com/laiwu/co/2596.htm
莱芜市金辰楔横轧轴件有限公司,http://www.11467.com/laiwu/co/6595.htm
世纪盛新过滤净化设备有限公司,http://www.11467.com/langfang/co/47750.htm
廊坊市云腾滤业有限公司,http://www.11467.com/langfang/co/48303.htm
廊坊顺达过滤器有限公司,http://www.11467.com/langfang/co/48650.htm
廊坊新亚滤清器有限公司(新亚滤业),http://www.11467.com/langfang/co/46738.htm
强威过滤器材有限公司,http://www.11467.com/langfang/co/46737.htm
连云港博莱顿汽车电器有限公司,http://www.11467.com/lianyungang/co/44115.htm
茌平县驰宇汽车零部件有限公司,http://www.11467.com/liaocheng/co/49528.htm
旭日模具汽车冲压配件有限公司,http://www.11467.com/liaocheng/co/50039.htm
旭日模具冲压件有限公司,http://www.11467.com/liaocheng/co/50040.htm
山东华通管业有限公司,http://www.11467.com/liaocheng/co/26065.htm
山东聊城德润机电科技发展有限公司,http://www.11467.com/liaocheng/co/28565.htm
山东新能源开发公司,http://www.11467.com/liaocheng/co/49699.htm
辽宁顺兴重型内燃机曲轴有限公司,http://www.11467.com/liaoyang/co/20706.htm
莒南县谊新机械有限公司,http://www.11467.com/linyi/co/51799.htm
临沂美驰机械有限公司,http://www.11467.com/linyi/co/34521.htm
临沂市金鑫机械有限公司,http://www.11467.com/linyi/co/94973.htm
山东欧之杰南跃汽配销售有限公司,http://www.11467.com/linyi/co/63356.htm
临沂市正工金属制造有限公司,http://www.11467.com/linyi/co/37859.htm
浙江欧派电装有限公司,http://www.11467.com/lishui/co/35189.htm
龙泉市鸿翔胶带有限公司,http://www.11467.com/lishui/co/35396.htm
浙江易欣铁油嘴有限公司,http://www.11467.com/lishui/co/35254.htm
六盘水任大侠汽车修理有限公司,http://www.11467.com/liupanshui/co/11068.htm
洛阳德骋动力部件有限公司 市场部,http://www.11467.com/luoyang/co/48927.htm
洛阳汇翔精机有限公司,http://www.11467.com/luoyang/co/38385.htm
洛阳天洲机械制造有限公司,http://www.11467.com/luoyang/co/60075.htm
一拖众成配件制造有限公司,http://www.11467.com/luoyang/co/44198.htm
四川恒威活塞环有限公司,http://www.11467.com/luzhou/co/17419.htm
兴宁华丰数码构件制造有限公司,http://www.11467.com/meizhou/co/27780.htm
绵阳通达四海贸易有限公司,http://www.11467.com/mianyang/co/46575.htm
绵阳华晨瑞安汽车零部件有限公司,http://www.11467.com/mianyang/co/62.htm
江西省双园工贸有限公司,http://www.11467.com/nanchang/co/64539.htm
江西亚细亚气门芯制造有限公司,http://www.11467.com/nanchang/co/58953.htm
南昌天元汽车配件工业有限公司,http://www.11467.com/nanchang/co/75267.htm
南京阿莫特汽车用品有限公司,http://www.11467.com/nanjing/co/19464.htm
南京超鹤贸易有限公司,http://www.11467.com/nanjing/co/156463.htm
南京美航工程机械有限公司,http://www.11467.com/nanjing/co/114756.htm
南京双发函宏汽配有限公司,http://www.11467.com/nanjing/co/52412.htm
南京海特汽车部件有限公司,http://www.11467.com/nanjing/co/27035.htm
南京锐鹰活塞环制造有限公司,http://www.11467.com/nanjing/co/70792.htm
南京紫燕科技有限公司,http://www.11467.com/nanjing/co/49003.htm
广西南宁市嘉业晟汽车配件有限公司,http://www.11467.com/nanning/co/86235.htm
南宁市达宇兴汽车配件有限公司,http://www.11467.com/nanning/co/87010.htm
华闽南配集团股份有限公司,http://www.11467.com/nanping/co/35017.htm
南通江华机械有限公司,http://www.11467.com/nantong/co/84228.htm
江苏埃姆森滤清器制造有限公司,http://www.11467.com/nantong/co/138543.htm
南通星维油泵油嘴有限公司,http://www.11467.com/nantong/co/113556.htm
南阳市展鸿图物资有限责任公司,http://www.11467.com/nanyang/co/29501.htm
宁波奥赛减震系统有限公司,http://www.11467.com/ningbo/co/89557.htm
宁波保税区中晨工贸有限公司,http://www.11467.com/ningbo/co/67819.htm
宁波保隆汽车消声系统制造有限公司,http://www.11467.com/ningbo/co/197167.htm
宁波安德机械有限公司,http://www.11467.com/ningbo/co/90804.htm
慈溪市奥特力轴承有限公司,http://www.11467.com/ningbo/co/66431.htm
宁波威猛汽车部件有限公司,http://www.11467.com/ningbo/co/195995.htm
宁波市鄞州海鑫气门嘴有限公司,http://www.11467.com/ningbo/co/90400.htm
宁波广良电器有限公司,http://www.11467.com/ningbo/co/114631.htm
宁波捷信机械有限公司,http://www.11467.com/ningbo/co/195770.htm
宁波国通汽车零部件有限公司,http://www.11467.com/ningbo/co/144180.htm
宁波市镇海福德机器部件有限公司,http://www.11467.com/ningbo/co/115342.htm
宁波江北盛翔换热器有限公司,http://www.11467.com/ningbo/co/91019.htm
宁波市北仑模具压铸有限公司,http://www.11467.com/ningbo/co/89867.htm
宁波江北振新纺织机械有限公司,http://www.11467.com/ningbo/co/193468.htm
宁波市江北海通汽车配件有限公司,http://www.11467.com/ningbo/co/54553.htm
宁波欧富特汽配有限公司,http://www.11467.com/ningbo/co/89907.htm
宁波正利滤清器有限公司,http://www.11467.com/ningbo/co/198637.htm
宁波路润冷却器制造有限公司,http://www.11467.com/ningbo/co/197171.htm
福鼎市华格化油器有限公司,http://www.11467.com/ningde/co/30359.htm
福鼎市华宁化油器有限公司,http://www.11467.com/ningde/co/30208.htm
福鼎市金雄机车部件有限公司,http://www.11467.com/ningde/co/18134.htm
福安市振中电器制造有限公司,http://www.11467.com/ningde/co/17195.htm
福鼎市华中化油器有限公司,http://www.11467.com/ningde/co/30307.htm
福建华龙化油器有限公司,http://www.11467.com/ningde/co/10640.htm
萍乡市观海汽车配件有限公司,http://www.11467.com/pingxiang/co/11392.htm
无锡烘泵油泵油嘴有限公司(福建分司),http://www.11467.com/putian/co/39433.htm
青岛雷达工贸有限公司,http://www.11467.com/qingdao/co/98617.htm
青岛迈特动力部件有限公司,http://www.11467.com/qingdao/co/68876.htm
青岛新锦东国际贸易有限公司,http://www.11467.com/qingdao/co/87166.htm
玉环环森机械有限公司,http://www.11467.com/qingyang/co/18132.htm
清远市永捷润滑油有限公司,http://www.11467.com/qingyuan/co/22465.htm
福建省泉州市基强汽车配件有限公司,http://www.11467.com/quanzhou/co/104124.htm
泉州奥特玛克商务有限公司,http://www.11467.com/quanzhou/co/130553.htm
泉州辉泰汽配有限公司,http://www.11467.com/quanzhou/co/130870.htm
江山市通联泵业成套有限公司,http://www.11467.com/quzhou/co/13452.htm
浙江义鑫隆实业有限公司,http://www.11467.com/quzhou/co/34263.htm
日照市北业制动泵有限公司,http://www.11467.com/rizhao/co/5168.htm
力源汽车配件有限公司,http://www.11467.com/shantou/co/150993.htm
浙江万丰科技开发有限公司,http://www.11467.com/shaoxing/co/119124.htm
浙江久运机械有限公司,http://www.11467.com/shaoxing/co/118410.htm
沈阳神龙汽车配件有限公司,http://www.11467.com/shenyang/co/66559.htm
辽宁通用机械对外贸易有限公司,http://www.11467.com/shenyang/co/60882.htm
沈阳华铁汽车散热器有限公司,http://www.11467.com/shenyang/co/59643.htm
沈阳斯瓦特汽车零部件有限公司,http://www.11467.com/shenyang/co/59880.htm
沈阳福汽备品汽配有限公司（汽配公司二）,http://www.11467.com/shenyang/co/66724.htm
沈阳福汽备品汽配有限公司（市场开发部）,http://www.11467.com/shenyang/co/66565.htm
沈阳福汽备品汽配有限公司（汽配公司）,http://www.11467.com/shenyang/co/59509.htm
湖北联飞翔汽车科技有限公司,http://www.11467.com/suizhou/co/11352.htm
常熟市昊阳金属制品有限公司,http://www.11467.com/suzhou/co/299696.htm
利拓机械(昆山)有限公司,http://www.11467.com/suzhou/co/317931.htm
诚信精密电子（苏州）有限公司,http://www.11467.com/suzhou/co/224146.htm
苏州德昇科技有限公司,http://www.11467.com/suzhou/co/324208.htm
苏州工业园区浙瑞电子科技有限公司,http://www.11467.com/suzhou/co/206522.htm
江苏宝利机械科技有限公司,http://www.11467.com/suzhou/co/318195.htm
太仓动力机械有限公司,http://www.11467.com/suzhou/co/314656.htm
苏州盛泰过滤器有限公司,http://www.11467.com/suzhou/co/205273.htm
苏州伍联汽配有限公司,http://www.11467.com/suzhou/co/320188.htm
张家港台和机械有限公司,http://www.11467.com/suzhou/co/317020.htm
苏州驰辰马电机有限公司,http://www.11467.com/suzhou/co/224175.htm
张家港市宏翔金属制品有限公司,http://www.11467.com/suzhou/co/64309.htm
泰安鼎鑫冷却器有限公司,http://www.11467.com/taian/co/23645.htm
上海力柴发动机有限公司太原分公司,http://www.11467.com/taiyuan/co/96573.htm
台州市黄岩汇丰机械有限公司,http://www.11467.com/taizhou/co/105865.htm
台州富聚胶带制造有限公司,http://www.11467.com/taizhou/co/105507.htm
台州市利格机械有限公司,http://www.11467.com/taizhou/co/87281.htm
重庆安康商贸有限公司,http://www.11467.com/taizhou/co/94944.htm
玉环挺利机械有限公司,http://www.11467.com/taizhou/co/137703.htm
玉环县天烨机械有限公司,http://www.11467.com/taizhou/co/137309.htm
台州博得汽车零部件有限公司,http://www.11467.com/taizhou/co/137707.htm
玉环信轮轴承有限公司,http://www.11467.com/taizhou/co/139329.htm
台州市路桥中基摩托车有限公司,http://www.11467.com/taizhou/co/95774.htm
江苏林海集团泰州海风机械有限公司,http://www.11467.com/taizhoushi/co/31618.htm
泰州市海陵区鸿帅电子商务有限公司,http://www.11467.com/taizhoushi/co/48741.htm
泰州通润机电设备有限公司,http://www.11467.com/taizhoushi/co/48866.htm
铁岭天河机械制造有限责任公司,http://www.11467.com/tieling/co/26262.htm
潍坊潍柴柴油机配件公司,http://www.11467.com/weifang/co/118842.htm
潍柴华丰柴油机配件公司,http://www.11467.com/weifang/co/117813.htm
潍坊市万顺汽配公司,http://www.11467.com/weifang/co/82827.htm
潍坊金峰动力机械有限公司,http://www.11467.com/weifang/co/118437.htm
文登恒润锻造有限公司,http://www.11467.com/weihai/co/15207.htm
山东金聚粉末冶金有限公司,http://www.11467.com/weihai/co/47190.htm
陕西天寰机械制造有限公司,http://www.11467.com/weinan/co/24244.htm
密封件大全有限公司,http://www.11467.com/weinan/co/24235.htm
温州欧博电气有限公司外贸部,http://www.11467.com/wenzhou/co/154178.htm
温州博众汽摩电机有限公司,http://www.11467.com/wenzhou/co/126621.htm
瑞安市鸿锐汽配有限公司,http://www.11467.com/wenzhou/co/220901.htm
温州欧柏仑滤清器有限公司,http://www.11467.com/wenzhou/co/218261.htm
瑞安市费朗滤清器有限公司,http://www.11467.com/wenzhou/co/219259.htm
瑞安固高活塞制造有限公司,http://www.11467.com/wenzhou/co/221549.htm
瑞安市程泰活塞制造有限公司,http://www.11467.com/wenzhou/co/194322.htm
温州市新光机车部件有限公司,http://www.11467.com/wenzhou/co/94525.htm
瑞安市金溢丰汽配有限公司,http://www.11467.com/wenzhou/co/225342.htm
乐清市海迪电气有限公司,http://www.11467.com/wenzhou/co/217101.htm
温州大顺机动车配件有限公司,http://www.11467.com/wenzhou/co/88527.htm
温州市南亚汽车配件有限公司,http://www.11467.com/wenzhou/co/22974.htm
五龙汽车零部件有限公司,http://www.11467.com/wenzhou/co/218272.htm
台州汇正汽车电机有限公司,http://www.11467.com/wenzhou/co/169378.htm
温州鸿鹏汽配制造有限公司,http://www.11467.com/wenzhou/co/169615.htm
温州汇福汽车部件有限公司,http://www.11467.com/wenzhou/co/218269.htm
温州锐峰汽配有限公司,http://www.11467.com/wenzhou/co/221551.htm
浙江华东活塞环有限公司,http://www.11467.com/wenzhou/co/217095.htm
温州市志鸿汽车配件有限公司,http://www.11467.com/wenzhou/co/217103.htm
武汉铭宝激光科技有限公司,http://www.11467.com/wuhan/co/145638.htm
武汉菱电汽车电子有限公司营销部,http://www.11467.com/wuhan/co/85938.htm
通汽(十堰)发动机部件制造有限公司(武汉办事处),http://www.11467.com/wuhan/co/143728.htm
武汉武配汽车零部件有限公司,http://www.11467.com/wuhan/co/86657.htm
武汉康机科技有限公司,http://www.11467.com/wuhan/co/31375.htm
武汉宝来贸易有限公司,http://www.11467.com/wuhan/co/29340.htm
武汉威尔特液压机电设备有限公司,http://www.11467.com/wuhan/co/143577.htm
芜湖市轻型汽车配件有限公司,http://www.11467.com/wuhu/co/129.htm
芜湖众发汽车制动系统有限公司,http://www.11467.com/wuhu/co/22053.htm
芜湖众发旋压技术有限公司,http://www.11467.com/wuhu/co/23182.htm
芜湖金源机械制造有限公司,http://www.11467.com/wuhu/co/26403.htm
芜湖通和汽车管路系统有限公司,http://www.11467.com/wuhu/co/21981.htm
新疆亨鑫利国际贸易有限公司,http://www.11467.com/wulumuqi/co/93867.htm
无锡鼎丰不锈钢管有限公司,http://www.11467.com/wuxi/co/175736.htm
无锡上亚发展有限公司,http://www.11467.com/wuxi/co/91605.htm
无锡市海月铝业有限公司,http://www.11467.com/wuxi/co/191654.htm
无锡绿色动力机械工程有限公司,http://www.11467.com/wuxi/co/186958.htm
无锡茂发金属挤压有限公司,http://www.11467.com/wuxi/co/139851.htm
无锡阿卡利特油泵油嘴制造有限公司销售部,http://www.11467.com/wuxi/co/178255.htm
无锡百路盛机电制造有限公司,http://www.11467.com/wuxi/co/192234.htm
江阴市州禾电子科技有限公司,http://www.11467.com/wuxi/co/243875.htm
无锡倍利福金属制品有限公司,http://www.11467.com/wuxi/co/39459.htm
无锡月舟经贸有限公司,http://www.11467.com/wuxi/co/152772.htm
无锡鼎宇机械科技有限公司,http://www.11467.com/wuxi/co/247793.htm
华东思源三元催化有限公司,http://www.11467.com/wuxi/co/215013.htm
江苏迈利科技发展有限公司,http://www.11467.com/wuxi/co/215421.htm
无锡市九日机械有限公司,http://www.11467.com/wuxi/co/221722.htm
无锡市双马增压器制造有限公司,http://www.11467.com/wuxi/co/145044.htm
