佛山盛唐厨卫有限公司销售部,http://www.11467.com/foshan/co/300671.htm
佛山市美华怡嘉新型建材有限公司,http://www.11467.com/foshan/co/211184.htm
佛山市南海区名发建材有限公司,http://www.11467.com/foshan/co/301756.htm
佛山市腾瑞陶瓷有限公司,http://www.11467.com/foshan/co/297716.htm
佛山市银晶玻璃有限公司,http://www.11467.com/foshan/co/12043.htm
佛山市顺德区亿尚玻璃制品有限公司,http://www.11467.com/foshan/co/250948.htm
佛山市实木浴室柜有限公司,http://www.11467.com/foshan/co/304621.htm
顺德山月工艺美术有限公司,http://www.11467.com/foshan/co/247534.htm
佛山市鑫三品不锈钢金属材料有限公司,http://www.11467.com/foshan/co/341762.htm
佛山艺朗卫浴有限公司,http://www.11467.com/foshan/co/322072.htm
佛山市顺德区滢美洁具有限公司,http://www.11467.com/foshan/co/247569.htm
亿尚玻璃制品有限公司 开发部,http://www.11467.com/foshan/co/247358.htm
佛山乾隆皇有限公司,http://www.11467.com/foshan/co/297701.htm
佛山市益美高洁具有限公司,http://www.11467.com/foshan/co/311524.htm
赛尼洁具有限公司业务部,http://www.11467.com/foshan/co/283606.htm
溢华厨卫洁具制造有限公司,http://www.11467.com/foshan/co/303128.htm
福建欧诺德建材有限公司,http://www.11467.com/fuzhou/co/177432.htm
广州风益建材有限公司,http://www.11467.com/guangzhou/co/335123.htm
广州戈兰迪装饰工程有限公司,http://www.11467.com/guangzhou/co/465319.htm
广州市腾云玉石装饰工程有限公司,http://www.11467.com/guangzhou/co/423674.htm
广州斯派迪建材有限公司,http://www.11467.com/guangzhou/co/427053.htm
意大利米兰(中国)建材有限公司,http://www.11467.com/guangzhou/co/422151.htm
杭州久雅装饰工程有限公司,http://www.11467.com/hangzhou/co/309689.htm
杭州洁利塑料制品有限公司,http://www.11467.com/hangzhou/co/261048.htm
杭州九鸿卫浴有限公司,http://www.11467.com/hangzhou/co/309846.htm
杭州党山卫浴洁具有限公司,http://www.11467.com/hangzhou/co/217282.htm
杭州萧山华亚卫浴洁具有限公司,http://www.11467.com/hangzhou/co/260655.htm
杭州舒乐源卫浴设备有限公司,http://www.11467.com/hangzhou/co/260684.htm
东莞市昊威家具有限公司,http://www.11467.com/dongguan/co/404759.htm
东莞市世环建材制品有限公司,http://www.11467.com/dongguan/co/407076.htm
东莞市晶创特种玻璃有限公司,http://www.11467.com/dongguan/co/353280.htm
云浮市新富云岗石有限公司,http://www.11467.com/dongguan/co/408593.htm
力航动力机械有限公司,http://www.11467.com/dongguan/co/407813.htm
佛山市南海区红满天家居有限公司,http://www.11467.com/foshan/co/339135.htm
佛山市南海江南洁具有限公司,http://www.11467.com/foshan/co/303078.htm
佛山市南海碧高卫浴洁具有限公司,http://www.11467.com/foshan/co/188200.htm
佛山市风行新型材料有限公司,http://www.11467.com/foshan/co/300800.htm
佛山市南海区大沥耀祥玻璃制品有限公司,http://www.11467.com/foshan/co/24191.htm
佛山市奥美康陶瓷有限公司,http://www.11467.com/foshan/co/111957.htm
佛山市贝嘉卫浴有限公司,http://www.11467.com/foshan/co/303847.htm
佛山市肖恩卫浴有限公司,http://www.11467.com/foshan/co/296410.htm
佛山市万丽斯顿机械设备有限公司,http://www.11467.com/foshan/co/296978.htm
中低档橱柜公司,http://www.11467.com/foshan/co/300569.htm
珠海市新国艺家具有限公司,http://www.11467.com/foshan/co/301529.htm
顺德东原厨具实业有限公司,http://www.11467.com/foshan/co/301984.htm
福州欧诚工艺有限公司,http://www.11467.com/fuzhou/co/135414.htm
福建宝德利进出口贸易有限公司,http://www.11467.com/fuzhou/co/187333.htm
福州紫芸贸易有限公司,http://www.11467.com/fuzhou/co/146447.htm
广州卉乐装饰材料有限公司,http://www.11467.com/guangzhou/co/420863.htm
阿联酋南设贸易公司采购部,http://www.11467.com/guangzhou/co/220886.htm
广州百好有限公司建材厂,http://www.11467.com/guangzhou/co/43083.htm
广州市奥帕石材有限公司,http://www.11467.com/guangzhou/co/424728.htm
广州伊扬家具有限公司,http://www.11467.com/guangzhou/co/65890.htm
广州市腾云技术开发有限公司,http://www.11467.com/guangzhou/co/420117.htm
广州众昇建材有限公司,http://www.11467.com/guangzhou/co/53125.htm
自然色石材石线有限公司,http://www.11467.com/guangzhou/co/460277.htm
宜昌大韩橱柜有限公司,http://www.11467.com/guangzhou/co/424532.htm
杭州海洋卫浴有限公司,http://www.11467.com/hangzhou/co/245109.htm
杭州奥洁卫浴有限公司,http://www.11467.com/hangzhou/co/261026.htm
杭州红鹰建材有限公司,http://www.11467.com/hangzhou/co/306245.htm
杭州升兴卫浴有限公司,http://www.11467.com/hangzhou/co/307053.htm
杭州港园卫浴有限公司,http://www.11467.com/hangzhou/co/232914.htm
杭州卓菲厨卫有限公司,http://www.11467.com/hangzhou/co/311011.htm
杭州银邦建材有限公司,http://www.11467.com/hangzhou/co/352735.htm
嘉兴天鸿新材料有限公司,http://www.11467.com/jiaxing/co/94314.htm
福建省莆田吉源石材有限公司,http://www.11467.com/putian/co/8819.htm
潮安县唯雅妮陶瓷有限公司,http://www.11467.com/shantou/co/97283.htm
潮安县凯士比陶瓷实业有限公司,http://www.11467.com/shantou/co/96866.htm
绍兴县增奇玻璃制品有限公司,http://www.11467.com/shaoxing/co/10603.htm
厦门鑫宏发进出口有限公司,http://www.11467.com/xiamen/co/81509.htm
漳浦县赤湖凯达石材有限公司,http://www.11467.com/zhangzhou/co/7962.htm
上海维罗那石英石公司,http://www.11467.com/shanghai/co/330140.htm
天津开发区天标工贸有限公司,http://www.11467.com/tianjin/co/164738.htm
上海佳辉不锈钢有限公司,http://www.11467.com/shanghai/co/1066091.htm
东莞金橱世家家具有限公司,http://www.11467.com/dongguan/co/595313.htm
上海翡御实业有限公司,http://www.11467.com/shanghai/co/1139936.htm
骊住海尔住建设施（青岛）有限公司台面分公司,http://www.11467.com/qiye/79739387.htm
