佛山市顺德区金百厨电器有限公司,http://www.11467.com/foshan/co/357034.htm
宿松县新盛家电销售有限公司,http://www.11467.com/anqing/co/11027.htm
安庆市荣庆电器有限公司,http://www.11467.com/anqing/co/15899.htm
常德市宝庆照明电器有限公司,http://www.11467.com/changde/co/19972.htm
长沙锐发电器销售有限公司,http://www.11467.com/changsha/co/53081.htm
长沙凯和电器有限公司,http://www.11467.com/changsha/co/60476.htm
长沙市仁大电器有限公司,http://www.11467.com/changsha/co/60437.htm
长沙锦大电器销售有限公司,http://www.11467.com/changsha/co/50715.htm
长沙益佰电器有限公司,http://www.11467.com/changsha/co/58925.htm
庐江县百大电器有限公司,http://www.11467.com/chaohu/co/11163.htm
福安市东辉电器有限公司,http://www.11467.com/ningde/co/15445.htm
上海秦博电器有限公司,http://www.11467.com/shanghai/co/308489.htm
广东顺德金易厨电器有限公司,http://www.11467.com/foshan/co/359550.htm
深圳市今日电器有限公司,http://www.11467.com/qiye/20701344.htm
佛山市汀卓电器有限公司,http://www.11467.com/qiye/21533080.htm
浙江天喜厨电股份有限公司,http://www.11467.com/lishui/co/42473.htm
河南神神家厨电子商务有限公司,http://www.11467.com/kaifeng/co/35455.htm
合肥荣牌电器有限责任公司,http://www.11467.com/qiye/26122932.htm
长沙私厨电子商务有限公司,http://www.11467.com/changsha/co/238768.htm
广东火凰电器有限公司,http://www.11467.com/qiye/28836526.htm
海尔电器销售（合肥）有限公司,http://www.11467.com/qiye/29302887.htm
芜湖国腾电器有限公司,http://www.11467.com/qiye/29363256.htm
安徽华欣电器销售有限公司,http://www.11467.com/qiye/29369124.htm
合肥资康电器有限公司,http://www.11467.com/qiye/29398939.htm
合肥卡本洛家用电器有限公司,http://www.11467.com/qiye/29399204.htm
合肥康舟电器有限公司,http://www.11467.com/qiye/29459054.htm
芜湖宝佳电器销售有限公司,http://www.11467.com/qiye/29476926.htm
合肥元宜电器有限公司,http://www.11467.com/qiye/29501457.htm
合肥自勇电器安装服务有限公司,http://www.11467.com/qiye/29533933.htm
合肥杰纵电器有限公司,http://www.11467.com/qiye/29533990.htm
安徽省舒格电器科技有限公司,http://www.11467.com/qiye/29544834.htm
合肥美龙盛霸电器科技有限公司,http://www.11467.com/qiye/29548489.htm
合肥海永杰电器有限公司,http://www.11467.com/qiye/29564941.htm
合肥致威电器有限公司,http://www.11467.com/qiye/29587036.htm
蚌埠锦泰电器有限公司,http://www.11467.com/qiye/29607683.htm
合肥美菱电器营销有限公司,http://www.11467.com/qiye/29608043.htm
安徽双米电器有限公司,http://www.11467.com/qiye/29613267.htm
博西华家用电器服务江苏有限公司北京分公司,http://www.11467.com/qiye/29647701.htm
芜湖老板电器销售有限公司,http://www.11467.com/qiye/29664789.htm
合肥德能电器有限公司,http://www.11467.com/qiye/29775737.htm
安徽恒兴电器有限公司,http://www.11467.com/qiye/29888312.htm
安徽五星电器有限公司铜陵大卖场,http://www.11467.com/qiye/29894784.htm
合肥志和电器科技有限公司,http://www.11467.com/qiye/29912873.htm
安徽圣力达电器有限公司,http://www.11467.com/qiye/29913277.htm
郑州三耀电器有限公司,http://www.11467.com/zhengzhou/co/52493.htm
郑州镭鑫电器有限公司,http://www.11467.com/zhengzhou/co/52604.htm
中山市大莱照明电器制造有限公司,http://www.11467.com/zhongshan/co/41293.htm
中山市爱心电器有限公司,http://www.11467.com/zhongshan/co/40060.htm
中山市欧宁电器有限公司德宝分公司,http://www.11467.com/zhongshan/co/41758.htm
中山市金胜电器有限公司,http://www.11467.com/zhongshan/co/41009.htm
中山市王牌生活电器有限公司,http://www.11467.com/zhongshan/co/40447.htm
中山市比德斯电器有限公司,http://www.11467.com/zhongshan/co/40302.htm
中山市宏光照明电器有限公司,http://www.11467.com/zhongshan/co/41670.htm
中山市圣仑电器有限公司,http://www.11467.com/zhongshan/co/40460.htm
中山市美景电器有限公司,http://www.11467.com/zhongshan/co/40191.htm
北京中联科创高压电器有限公司,http://www.11467.com/beijing/co/477643.htm
上海孚道电器有限公司,http://www.11467.com/shanghai/co/875650.htm
上海赫弗盛电器有限公司,http://www.11467.com/shanghai/co/799223.htm
上海虎扑电器有限公司,http://www.11467.com/shanghai/co/422200.htm
上海宜兼通电器有限公司,http://www.11467.com/shanghai/co/875656.htm
上海商务中心家电城市场经营管理有限公司,http://www.11467.com/shanghai/co/194323.htm
重庆市南川区穗恒格力电器销售有限公司,http://www.11467.com/chongqing/co/104034.htm
芜湖御厨电子商务有限公司,http://www.11467.com/wuhu/co/36284.htm
中山市享厨电器有限公司,http://www.11467.com/zhongshan/co/158367.htm
中山市土木电器有限公司,http://www.11467.com/qiye/22251010.htm
深圳市嘉宏电器有限公司,http://www.11467.com/qiye/23078561.htm
宁波梁沐电器科技有限公司,http://www.11467.com/qiye/23344896.htm
苏州斯普科林电器有限公司,http://www.11467.com/suzhou/co/103359.htm
山东省泰安市邦德电器设备有限公司,http://www.11467.com/taian/co/18900.htm
泰安汇达电器设备有限公司,http://www.11467.com/taian/co/18792.htm
威海飞雕电器销售有限公司,http://www.11467.com/weihai/co/27357.htm
温州罗西电器有限公司,http://www.11467.com/wenzhou/co/75435.htm
温州联超电器有限公司,http://www.11467.com/wenzhou/co/76306.htm
温州市亿雄电器有限公司,http://www.11467.com/wenzhou/co/74013.htm
温州市之菱电器制造有限公司,http://www.11467.com/wenzhou/co/75334.htm
无锡市灵浪电器制造有限公司,http://www.11467.com/wuxi/co/91516.htm
禹州市裕兴电器营销有限公司,http://www.11467.com/xuchang/co/9994.htm
延安市宝塔区人民电器销售有限公司,http://www.11467.com/yanan/co/7911.htm
盐城恒信空调销售有限公司,http://www.11467.com/yancheng/co/3763.htm
宜春市立信电器有限公司,http://www.11467.com/yichun/co/13440.htm
银川恒瑞鑫辉电器销售有限公司,http://www.11467.com/yinchuan/co/17644.htm
岳阳巴陵升华电器设备有限公司,http://www.11467.com/yueyang/co/21108.htm
重庆祖厨电子商务有限公司,http://www.11467.com/chongqing/co/301522.htm
大连辽无二电器有限公司,http://www.11467.com/qiye/25589968.htm
重庆宅厨电子商务有限公司,http://www.11467.com/chongqing/co/320341.htm
东莞市尚社电器有限公司,http://www.11467.com/qiye/25809416.htm
重庆万厨电子商务有限公司,http://www.11467.com/chongqing/co/331605.htm
昆山国力真空电器有限公司,http://www.11467.com/qiye/25964958.htm
深圳市卫尚泉卫浴电器有限公司,http://www.11467.com/qiye/26223712.htm
新乡市豫新电器有限公司,http://www.11467.com/qiye/26639690.htm
佛山市一卜电器有限公司,http://www.11467.com/qiye/26680590.htm
苏州工业园区咖乐美电器有限公司,http://www.11467.com/qiye/27586058.htm
睿玛科防水电器股份有限公司,http://www.11467.com/guangzhou/co/755916.htm
河北盛华律声电器科技有限公司,http://www.11467.com/qiye/28911623.htm
乐清领越防爆电器有限公司,http://www.11467.com/wenzhou/co/370775.htm
安徽伊莱雅电器有限责任公司,http://www.11467.com/qiye/29302868.htm
合肥阿德勒电器有限公司,http://www.11467.com/qiye/29306188.htm
北京荣创电器有限公司,http://www.11467.com/qiye/29312672.htm
北京天下城电器有限公司,http://www.11467.com/qiye/29318634.htm
北京京南学东电器有限公司,http://www.11467.com/qiye/29333157.htm
安庆市奥龙电器有限责任公司,http://www.11467.com/qiye/29341757.htm
合肥吉佳电器有限公司,http://www.11467.com/qiye/29343810.htm
安庆市裕祥电器有限公司,http://www.11467.com/qiye/29359205.htm
合肥亿家欢电器有限公司,http://www.11467.com/qiye/29361167.htm
滁州华林电器有限公司,http://www.11467.com/qiye/29477117.htm
悦昌（上海）电器有限公司北京分公司,http://www.11467.com/qiye/29492607.htm
安徽省潜山县雄业矿用电器有限公司,http://www.11467.com/qiye/29515185.htm
广德中鼎宝特电器制造有限公司,http://www.11467.com/qiye/29573323.htm
芜湖市际优电器有限公司,http://www.11467.com/qiye/29575739.htm
安徽自宏新能源电器有限公司,http://www.11467.com/qiye/29581178.htm
安庆市汇鑫电器有限公司,http://www.11467.com/qiye/29591506.htm
阜阳微奥电器营销有限公司,http://www.11467.com/qiye/29595722.htm
马鞍山国美电器有限公司,http://www.11467.com/qiye/29598276.htm
北京鑫业伟诚电器有限公司,http://www.11467.com/qiye/29602368.htm
合肥皓柏电器有限公司,http://www.11467.com/qiye/29604197.htm
合肥天明电器有限公司,http://www.11467.com/qiye/29607650.htm
安徽省宿州市龙华防爆电器有限公司,http://www.11467.com/qiye/29612512.htm
芜湖美的生活电器制造有限公司,http://www.11467.com/qiye/29623632.htm
安庆五一电器安装有限公司,http://www.11467.com/qiye/29638881.htm
宁国拓天电器有限公司,http://www.11467.com/qiye/29663105.htm
安徽鑫龙电器股份有限公司北京鑫龙北方分公司,http://www.11467.com/qiye/29674810.htm
宣城市东科电器有限公司,http://www.11467.com/qiye/29675144.htm
邯郸市西美电器有限公司,http://www.11467.com/qiye/194300.htm
桐城市秋宇电器照明有限公司,http://www.11467.com/anqing/co/15824.htm
安庆市苏扬消防器材电器设备有限公司,http://www.11467.com/anqing/co/16111.htm
安庆红灯电器有限公司,http://www.11467.com/anqing/co/16090.htm
望江县鑫三联电器有限公司,http://www.11467.com/anqing/co/15792.htm
安徽省安庆市鑫泰电器有限公司,http://www.11467.com/anqing/co/16157.htm
安庆市亚东电器有限公司,http://www.11467.com/anqing/co/15936.htm
鞍山市联营商贸有限责任公司家电商场,http://www.11467.com/anshan/co/13572.htm
马鞍山锐畅电器有限责任公司,http://www.11467.com/anshan/co/36959.htm
安阳电力（集团）有限责任公司家电经销二部,http://www.11467.com/anyang/co/4503.htm
安阳电厂综合服务公司五金电器门市部,http://www.11467.com/anyang/co/4541.htm
安徽源盛弘电器有限公司,http://www.11467.com/qiye/29736222.htm
安徽名丰电器有限公司,http://www.11467.com/qiye/29764541.htm
合肥博誉电器有限公司,http://www.11467.com/qiye/29770875.htm
安徽吉乃尔电器科技有限公司,http://www.11467.com/qiye/29778631.htm
芜湖蓓慈电器有限公司,http://www.11467.com/qiye/29786463.htm
安徽省松立电器制造有限责任公司,http://www.11467.com/qiye/29814779.htm
芜湖蓝瑞电器有限公司,http://www.11467.com/qiye/29846884.htm
芜湖奔鑫电器销售有限公司,http://www.11467.com/qiye/29846967.htm
安徽海帅电器制造有限公司,http://www.11467.com/qiye/29878126.htm
安庆市铁生电器销售有限公司,http://www.11467.com/qiye/29879692.htm
合肥启客智能电器有限公司,http://www.11467.com/qiye/29885286.htm
北京物美电器连锁有限公司,http://www.11467.com/qiye/29917072.htm
安徽金全电器有限公司,http://www.11467.com/qiye/29936207.htm
阜阳市煜仁电器销售有限公司,http://www.11467.com/qiye/29978062.htm
安徽红达电器连锁有限公司霍邱分公司,http://www.11467.com/qiye/29994067.htm
滁州扬子亲魅电器有限公司合肥分公司,http://www.11467.com/qiye/90415907.htm
白城金洋电器安装有限公司,http://www.11467.com/baicheng/co/10633.htm
广西壮族自治区靖西县电力公司电器门市部,http://www.11467.com/baise/co/3646.htm
抚松县华隆电子大楼家电经销有限责任公司,http://www.11467.com/baishan/co/4794.htm
北京市北科中天机电设备销售有限公司高碑店格力空调销售分店,http://www.11467.com/baoding/co/43897.htm
保定市新世纪家电销售有限公司,http://www.11467.com/baoding/co/2254.htm
保定市保物家电销售有限公司西苑分公司,http://www.11467.com/baoding/co/6136.htm
保定市远声欣业电器有限公司,http://www.11467.com/baoding/co/47133.htm
定州市永达电器设备有限公司,http://www.11467.com/baoding/co/47519.htm
保定市保物家电销售有限公司,http://www.11467.com/baoding/co/10760.htm
保定市家电销售有限公司西城分店,http://www.11467.com/baoding/co/2264.htm
保定市天桥电器设备有限公司,http://www.11467.com/baoding/co/47070.htm
安新县正大家电销售有限公司,http://www.11467.com/baoding/co/27463.htm
保定市国信家电销售有限公司,http://www.11467.com/baoding/co/3120.htm
保定市家电销售有限公司,http://www.11467.com/baoding/co/10750.htm
保定市满城县广播电视服务公司家电商场,http://www.11467.com/baoding/co/13471.htm
保定市金桥家电销售有限公司,http://www.11467.com/baoding/co/10776.htm
保定市家电销售有限公司物资经销处,http://www.11467.com/baoding/co/10751.htm
安新县新颖家电销售有限公司,http://www.11467.com/baoding/co/27480.htm
保定市美亿电器有限公司,http://www.11467.com/baoding/co/47115.htm
定兴友谊家电销售有限公司,http://www.11467.com/baoding/co/20534.htm
保定市嘉乐嘉电器有限公司,http://www.11467.com/baoding/co/46841.htm
保定市天星家电销售有限公司,http://www.11467.com/baoding/co/6144.htm
涿州市成斯美特电器有限公司,http://www.11467.com/baoding/co/47256.htm
雄县万特电器有限公司,http://www.11467.com/baoding/co/47625.htm
雄县朝鑫电器配件有限公司,http://www.11467.com/baoding/co/47626.htm
雄县天泰电器设备销售有限公司,http://www.11467.com/baoding/co/47634.htm
宝鸡市美松电器有限公司,http://www.11467.com/baoji/co/14651.htm
宝鸡市亚光真空电器有限公司,http://www.11467.com/baoji/co/14641.htm
宝鸡市亚东电器设备有限责任公司,http://www.11467.com/baoji/co/14634.htm
宝鸡市嘉乐电器有限公司,http://www.11467.com/baoji/co/14477.htm
昆明国美电器有限公司保山分公司,http://www.11467.com/baoshan/co/4697.htm
包头市阿城继电器经销有限公司,http://www.11467.com/baotou/co/632.htm
包头市青山区君发电器经销公司,http://www.11467.com/baotou/co/16025.htm
蚌埠市森泰成套电器有限公司,http://www.11467.com/bengbu/co/14398.htm
五河县建明物贸有限责任公司家电经营部,http://www.11467.com/bengbu/co/12576.htm
怀远县辉煌电器有限公司第一分公司,http://www.11467.com/bengbu/co/14306.htm
蚌埠市盛大电器有限公司,http://www.11467.com/bengbu/co/14370.htm
本溪经济开发区博得瑞通电器经销有限公司,http://www.11467.com/benxi/co/6417.htm
滨州国美家电城有限公司,http://www.11467.com/binzhou/co/9176.htm
山东昌荣电器设备有限公司,http://www.11467.com/binzhou/co/11411.htm
邹平县五金交电化工公司家电商场,http://www.11467.com/binzhou/co/8383.htm
邹平县五金交电化工公司家电销售中心,http://www.11467.com/binzhou/co/8382.htm
滨州市合胜电器有限公司,http://www.11467.com/binzhou/co/11645.htm
无棣县信安电器有限公司,http://www.11467.com/binzhou/co/11760.htm
山东滨州滨宁苏宁电器有限公司,http://www.11467.com/binzhou/co/11393.htm
安徽鑫金电器开关有限公司,http://www.11467.com/bozhou/co/8447.htm
沧州万德电器设备有限公司,http://www.11467.com/cangzhou/co/31290.htm
沧州沧宁苏宁电器有限公司,http://www.11467.com/cangzhou/co/31531.htm
盐山县世纪园家电销售有限公司,http://www.11467.com/cangzhou/co/12359.htm
沧州森源电器部件有限公司,http://www.11467.com/cangzhou/co/31250.htm
沧州市中亚电器商贸公司家电总汇,http://www.11467.com/cangzhou/co/423.htm
沧州渤海商业大厦（集团）有限公司金辉家电城,http://www.11467.com/cangzhou/co/2226.htm
青县坤祥电器设备有限公司,http://www.11467.com/cangzhou/co/30952.htm
沧州市大方经贸有限公司国美电器城,http://www.11467.com/cangzhou/co/5197.htm
河间市亚威电器制造有限公司,http://www.11467.com/cangzhou/co/31330.htm
沧州志诚电器销售有限公司,http://www.11467.com/cangzhou/co/30594.htm
沧州鑫顺程电器设备有限公司,http://www.11467.com/cangzhou/co/31483.htm
沧州华翔电器有限公司,http://www.11467.com/cangzhou/co/31229.htm
吉林省宜轩照明电器经销有限公司,http://www.11467.com/changchun/co/1808.htm
长春市鼎盛电器自动化设备有限公司,http://www.11467.com/changchun/co/17863.htm
长春市钰鼎电器有限公司,http://www.11467.com/changchun/co/17897.htm
常德鼎城龙凤电器有限公司,http://www.11467.com/changde/co/19890.htm
常德市超龙电器有限公司,http://www.11467.com/changde/co/20046.htm
常德长城电器销售有限公司,http://www.11467.com/changde/co/19045.htm
常德市武陵区顶新电器设备销售有限公司,http://www.11467.com/changde/co/20080.htm
长沙市溪江电器有限公司,http://www.11467.com/changsha/co/55041.htm
长沙广强电器有限公司,http://www.11467.com/changsha/co/59116.htm
长沙郭氏电器有限公司,http://www.11467.com/changsha/co/58930.htm
长沙海业电器有限公司,http://www.11467.com/changsha/co/59457.htm
湖南长沙大华家电销售有限公司,http://www.11467.com/changsha/co/6764.htm
长沙原森电器有限公司,http://www.11467.com/changsha/co/60342.htm
长沙县业盛电器有限公司,http://www.11467.com/changsha/co/60499.htm
长沙苏科电器有限公司,http://www.11467.com/changsha/co/55888.htm
天水长城控制电器有限责任公司长沙销售分公司,http://www.11467.com/changsha/co/57238.htm
长沙宏殷电器有限公司,http://www.11467.com/changsha/co/60734.htm
佛山市麦尔电器有限公司长沙分公司,http://www.11467.com/changsha/co/57208.htm
长沙天保电器有限公司,http://www.11467.com/changsha/co/59990.htm
湖南创美空调电器设备有限公司,http://www.11467.com/changsha/co/58401.htm
宁乡县历经电器设备安装有限公司,http://www.11467.com/changsha/co/58677.htm
长沙花明成套电器设备有限公司,http://www.11467.com/changsha/co/59201.htm
长沙希而乐电器有限公司,http://www.11467.com/changsha/co/59376.htm
长沙博澳电器有限责任公司,http://www.11467.com/changsha/co/56794.htm
长沙市晨泰电器有限公司,http://www.11467.com/changsha/co/55569.htm
长沙市腾辉照明电器有限公司,http://www.11467.com/changsha/co/56223.htm
望城县明城电器有限公司,http://www.11467.com/changsha/co/57310.htm
宁乡县玉兴电器有限公司,http://www.11467.com/changsha/co/58811.htm
长沙正顺电器有限公司,http://www.11467.com/changsha/co/59237.htm
长沙市南开电器设备成套有限公司,http://www.11467.com/changsha/co/60241.htm
长沙市林聪电器有限公司,http://www.11467.com/changsha/co/54969.htm
长治市海棠伟业电器有限公司,http://www.11467.com/changzhi/co/15517.htm
长治市晋兵电器有限公司,http://www.11467.com/changzhi/co/15611.htm
常州莱玛冷暖电器工程有限公司,http://www.11467.com/changzhou/co/51130.htm
常州明鹏电器有限公司,http://www.11467.com/changzhou/co/51111.htm
常州金鹰电器机械制造有限公司第一分公司,http://www.11467.com/changzhou/co/51243.htm
常州龙舟电器配件有限公司,http://www.11467.com/changzhou/co/51049.htm
常州惠好电器有限公司,http://www.11467.com/changzhou/co/51234.htm
常州市磊晨电器有限公司,http://www.11467.com/changzhou/co/50953.htm
常州市瑞鎏电器有限公司,http://www.11467.com/changzhou/co/50952.htm
常州戴景电器有限公司,http://www.11467.com/changzhou/co/50937.htm
常州银昌电器有限公司,http://www.11467.com/changzhou/co/50917.htm
常州新纪元影视电器城有限公司,http://www.11467.com/changzhou/co/23844.htm
常州市万诺电器有限公司,http://www.11467.com/changzhou/co/51017.htm
常州苏晨电器有限公司,http://www.11467.com/changzhou/co/50868.htm
常州御宝电器有限公司,http://www.11467.com/changzhou/co/51027.htm
常州市致梵电器有限公司,http://www.11467.com/changzhou/co/50750.htm
建平县红太阳家电销售有限公司,http://www.11467.com/chaoyang/co/7740.htm
承德市宏泰隆家电经销有限公司,http://www.11467.com/chengde/co/8975.htm
承德市广凌家电经销有限公司,http://www.11467.com/chengde/co/8987.htm
承德中飞物资有限公司电器商行,http://www.11467.com/chengde/co/9497.htm
平泉县鑫隆昌家电商城有限责任公司,http://www.11467.com/chengde/co/9485.htm
兴隆县新腾达电器有限公司,http://www.11467.com/chengde/co/17579.htm
承德市计量器材开发公司泉城家电经销服务处,http://www.11467.com/chengde/co/8981.htm
成都杰益美家用电器有限公司,http://www.11467.com/chengdu/co/31365.htm
成都市八方电器销售有限公司,http://www.11467.com/chengdu/co/30246.htm
成都市欣成航家电销售有限责任公司,http://www.11467.com/chengdu/co/19504.htm
四川苏宁电器有限公司,http://www.11467.com/chengdu/co/31184.htm
四川格力小家电销售有限公司,http://www.11467.com/chengdu/co/19604.htm
四川核工业局劳动服务公司华西家电经营部小食部,http://www.11467.com/chengdu/co/19605.htm
四川格力电器销售有限责任公司青羊空调专卖店,http://www.11467.com/chengdu/co/6681.htm
四川核工业局劳动服务公司华西家电经营部食品门市部,http://www.11467.com/chengdu/co/19502.htm
四川核工业局劳动服务公司华西家电经营部,http://www.11467.com/chengdu/co/19610.htm
扬州市天虹钢杆照明电器有限公司成都分公司,http://www.11467.com/chengdu/co/32229.htm
郴州市正顺电器设备有限公司,http://www.11467.com/chenzhou/co/11097.htm
池州地区电力物资公司空调总汇,http://www.11467.com/chizhou/co/5647.htm
滁州市邦福莱电器有限公司,http://www.11467.com/chuzhou/co/15314.htm
滁州国泰空调销售有限公司,http://www.11467.com/chuzhou/co/11247.htm
大理滇宁苏宁电器有限公司,http://www.11467.com/dali/co/7593.htm
大连国普电器有限公司,http://www.11467.com/dalian/co/12505.htm
大连经济技术开发区金德空调销售有限公司,http://www.11467.com/dalian/co/6083.htm
大连纪能电器经销有限公司,http://www.11467.com/dalian/co/6084.htm
丹东神宝节能环保电器有限公司,http://www.11467.com/dandong/co/26162.htm
丹东电视机销售公司,http://www.11467.com/dandong/co/2557.htm
大庆格力空调销售有限公司,http://www.11467.com/daqing/co/5018.htm
大庆天阿继电器经销有限公司,http://www.11467.com/daqing/co/13042.htm
大同市中晔机车电器有限公司,http://www.11467.com/datong/co/12921.htm
大同市成锐电器有限公司,http://www.11467.com/datong/co/12994.htm
大同世纪北方电器有限责任公司,http://www.11467.com/datong/co/12953.htm
德阳旌城苏宁电器有限公司,http://www.11467.com/deyang/co/17609.htm
乐陵市恒业船用电器有限公司,http://www.11467.com/dezhou/co/21242.htm
陇西县金辰电器销售有限公司,http://www.11467.com/dingxi/co/5469.htm
敬东实业开发公司五金家电部,http://www.11467.com/dingxi/co/258.htm
东莞丰匡家用电器有限公司,http://www.11467.com/dongguan/co/73121.htm
东莞市奔盛电器有限公司,http://www.11467.com/dongguan/co/68952.htm
东莞可见优照明电器有限公司,http://www.11467.com/dongguan/co/73141.htm
东莞市宾悦电器有限公司,http://www.11467.com/dongguan/co/71411.htm
东莞市川本电器科技有限公司,http://www.11467.com/dongguan/co/70509.htm
东莞市都灵艾电器有限公司,http://www.11467.com/dongguan/co/72078.htm
东莞市富深电器制品有限公司,http://www.11467.com/dongguan/co/70367.htm
东莞市法拉欧电器有限公司,http://www.11467.com/dongguan/co/71363.htm
东莞市供力电器安装有限公司,http://www.11467.com/dongguan/co/73038.htm
东莞市铭艺电热电器有限公司,http://www.11467.com/dongguan/co/70777.htm
东莞市特福电器有限公司,http://www.11467.com/dongguan/co/70568.htm
大同市中晔机车电器有限公司,http://www.11467.com/datong/co/12921.htm
大同市成锐电器有限公司,http://www.11467.com/datong/co/12994.htm
大同世纪北方电器有限责任公司,http://www.11467.com/datong/co/12953.htm
德阳旌城苏宁电器有限公司,http://www.11467.com/deyang/co/17609.htm
乐陵市恒业船用电器有限公司,http://www.11467.com/dezhou/co/21242.htm
陇西县金辰电器销售有限公司,http://www.11467.com/dingxi/co/5469.htm
敬东实业开发公司五金家电部,http://www.11467.com/dingxi/co/258.htm
东莞丰匡家用电器有限公司,http://www.11467.com/dongguan/co/73121.htm
东莞市奔盛电器有限公司,http://www.11467.com/dongguan/co/68952.htm
东莞可见优照明电器有限公司,http://www.11467.com/dongguan/co/73141.htm
东莞市宾悦电器有限公司,http://www.11467.com/dongguan/co/71411.htm
东莞市川本电器科技有限公司,http://www.11467.com/dongguan/co/70509.htm
东莞市都灵艾电器有限公司,http://www.11467.com/dongguan/co/72078.htm
东莞市富深电器制品有限公司,http://www.11467.com/dongguan/co/70367.htm
东莞市法拉欧电器有限公司,http://www.11467.com/dongguan/co/71363.htm
东莞市供力电器安装有限公司,http://www.11467.com/dongguan/co/73038.htm
