桐柏县山城家电广场商贸有限公司,http://www.11467.com/nanyang/co/9028.htm
南阳达尔利电器有限公司,http://www.11467.com/nanyang/co/21261.htm
南阳市弘海商贸有限公司唐河弘海家居家电广场,http://www.11467.com/nanyang/co/13560.htm
南阳市家电器具有限责任公司五交化大厦家电超市,http://www.11467.com/nanyang/co/3185.htm
南阳择润电器有限公司,http://www.11467.com/nanyang/co/21258.htm
宁波海曙前峰电器有限公司,http://www.11467.com/ningbo/co/31644.htm
宁波江东乐友制冷电器有限公司海曙天一分公司,http://www.11467.com/ningbo/co/31739.htm
宁波高新区欣灵电器有限公司,http://www.11467.com/ningbo/co/31277.htm
宁波国易电器有限公司,http://www.11467.com/ningbo/co/31342.htm
宁波江东每胜电器有限公司,http://www.11467.com/ningbo/co/30461.htm
宁波市镇海兴国科技电器有限公司,http://www.11467.com/ningbo/co/31384.htm
宁波市镇海方灵电器有限公司,http://www.11467.com/ningbo/co/30440.htm
宁波市鄞州海贸电器销售有限公司,http://www.11467.com/ningbo/co/27688.htm
宁波市鄞州俊博电器有限公司,http://www.11467.com/ningbo/co/32518.htm
宁波市鄞州顶尔美电器有限公司,http://www.11467.com/ningbo/co/30649.htm
宁波市鄞州美比欧派厨卫电器有限公司,http://www.11467.com/ningbo/co/31131.htm
宁波市鄞州靖峰四维电器有限公司,http://www.11467.com/ningbo/co/31381.htm
宁波市海曙欣尔电器元件有限公司,http://www.11467.com/ningbo/co/32323.htm
宁波市鄞州宝威电器有限公司,http://www.11467.com/ningbo/co/31662.htm
宁波市北仑区慧聪电器有限公司,http://www.11467.com/ningbo/co/30212.htm
宁波市海曙美华电器有限公司,http://www.11467.com/ningbo/co/32315.htm
宁波甬宁苏宁电器有限公司,http://www.11467.com/ningbo/co/29595.htm
宁波市镇海博诚电器科技有限公司,http://www.11467.com/ningbo/co/31977.htm
宁波市富冈电器有限公司,http://www.11467.com/ningbo/co/29897.htm
宁波市福豪电器有限公司,http://www.11467.com/ningbo/co/32413.htm
宁波市海曙雅宁照明电器有限公司,http://www.11467.com/ningbo/co/32134.htm
宁波市海曙新万和电器有限公司,http://www.11467.com/ningbo/co/31572.htm
宁波市江东山松电器有限公司,http://www.11467.com/ningbo/co/30090.htm
宁波市鄞州哲文电器有限公司,http://www.11467.com/ningbo/co/32549.htm
宁波市江东光芒电器有限公司,http://www.11467.com/ningbo/co/31138.htm
福安市祥桥电器发展有限公司,http://www.11467.com/ningde/co/15432.htm
寿宁县冶鑫电器有限公司,http://www.11467.com/ningde/co/14862.htm
福鼎市厦联电器有限公司,http://www.11467.com/ningde/co/15473.htm
福建银象电器有限公司,http://www.11467.com/ningde/co/15478.htm
宁德奔腾电器有限公司,http://www.11467.com/ningde/co/14797.htm
宁德市腾威电器有限公司,http://www.11467.com/ningde/co/14726.htm
福安市创瑞电器有限公司,http://www.11467.com/ningde/co/15393.htm
宁德捷鼎电器有限公司,http://www.11467.com/ningde/co/14525.htm
福安市蓁达电器制造有限公司,http://www.11467.com/ningde/co/15410.htm
福安市富邦尔电机电器有限公司,http://www.11467.com/ningde/co/15005.htm
福安市闽东天宜电器有限公司,http://www.11467.com/ningde/co/14936.htm
宁德市蕉城区东湖电器技术有限公司,http://www.11467.com/ningde/co/14661.htm
盘锦盛业商贸有限公司家电超市,http://www.11467.com/panjin/co/8866.htm
攀枝花金沙苏宁电器有限公司,http://www.11467.com/panzhihua/co/7636.htm
攀枝花市娇阳商贸有限责任公司娇阳电器城,http://www.11467.com/panzhihua/co/1834.htm
平顶山市汇聚源电器有限公司,http://www.11467.com/pingdingshan/co/11853.htm
江西渝州腾达电器有限公司萍乡市湘东分公司,http://www.11467.com/pingxiang/co/6340.htm
萍乡市光荣贸易公司家电商场,http://www.11467.com/pingxiang/co/1226.htm
江西省萍乡市农业生产资料总公司新飞家电商场,http://www.11467.com/pingxiang/co/1236.htm
芦溪县腾达电器有限公司,http://www.11467.com/pingxiang/co/6356.htm
日松下（莆田）电器有限公司,http://www.11467.com/putian/co/13404.htm
莆田市半球照明电器有限公司,http://www.11467.com/putian/co/13725.htm
福建华港电器有限公司,http://www.11467.com/putian/co/13372.htm
莆田市涵江区宝力电器有限公司,http://www.11467.com/putian/co/13951.htm
莆田苏宁电器有限公司,http://www.11467.com/putian/co/13764.htm
莆田市涵江区银平家用电器批发有限公司,http://www.11467.com/putian/co/13552.htm
濮阳瑞华石化机械电器设备有限公司,http://www.11467.com/puyang/co/12567.htm
濮阳市联创机械电器有限公司,http://www.11467.com/puyang/co/12560.htm
凯里市天龙空调销售有限责任公司,http://www.11467.com/qiandongnan/co/7107.htm
黔南州芦辉交电有限公司林明空调经营部,http://www.11467.com/qiannan/co/651.htm
青岛珍宝玛电器有限公司,http://www.11467.com/qingdao/co/21685.htm
青岛众信合电器设备有限公司,http://www.11467.com/qingdao/co/21466.htm
青岛国美电器有限公司李沧书院商城,http://www.11467.com/qingdao/co/21889.htm
青岛海靖翔电器工程有限公司,http://www.11467.com/qingdao/co/22943.htm
青岛海润电器有限公司工程配套分公司,http://www.11467.com/qingdao/co/21305.htm
青岛瑞源德电器有限公司,http://www.11467.com/qingdao/co/21456.htm
青岛海麟瑞电器有限公司,http://www.11467.com/qingdao/co/22593.htm
青岛荣事达丰电器有限公司,http://www.11467.com/qingdao/co/23145.htm
青岛昊海润电器有限公司,http://www.11467.com/qingdao/co/22466.htm
青岛飞雕电器销售有限公司,http://www.11467.com/qingdao/co/19932.htm
青岛广文通电器有限公司,http://www.11467.com/qingdao/co/23054.htm
青岛康宝家用电器有限公司,http://www.11467.com/qingdao/co/21342.htm
青岛东翔电器有限公司,http://www.11467.com/qingdao/co/21627.htm
青岛奥科达电器有限公司,http://www.11467.com/qingdao/co/21384.htm
青岛西冷电器有限公司,http://www.11467.com/qingdao/co/21874.htm
青岛赢丰电器有限公司,http://www.11467.com/qingdao/co/22306.htm
青岛中民电器设备有限公司,http://www.11467.com/qingdao/co/21077.htm
甘肃国美电器有限公司庆阳分公司,http://www.11467.com/qingyang/co/7746.htm
清远市天湖家电广场有限公司连州天湖家电,http://www.11467.com/qingyuan/co/12654.htm
秦皇岛市力伦电器有限公司,http://www.11467.com/qinhuangdao/co/24547.htm
秦皇岛市新秦工贸有限公司舒乐电器商行,http://www.11467.com/qinhuangdao/co/1242.htm
昌黎县五金交电公司家电商场,http://www.11467.com/qinhuangdao/co/16206.htm
秦皇岛市宇虹电器经销有限公司,http://www.11467.com/qinhuangdao/co/1244.htm
秦皇岛市盛阔电器有限公司,http://www.11467.com/qinhuangdao/co/24626.htm
秦皇岛秦宁苏宁电器有限公司,http://www.11467.com/qinhuangdao/co/24725.htm
钦州市钦北区供销联合公司帅康家用电器门市部,http://www.11467.com/qinzhou/co/1051.htm
哈尔滨黑天鹅家电经销实业有限公司第六连锁店,http://www.11467.com/qiqihaer/co/18672.htm
泉州丰伸电器有限公司,http://www.11467.com/quanzhou/co/52284.htm
泉州市新帝电器有限公司,http://www.11467.com/quanzhou/co/51872.htm
四川长虹电器股份有限公司泉州分公司,http://www.11467.com/quanzhou/co/51141.htm
泉州市丰泽区临海电器有限公司,http://www.11467.com/quanzhou/co/52475.htm
南安市南方电器设备有限公司,http://www.11467.com/quanzhou/co/52667.htm
泉州宏灿电器有限公司,http://www.11467.com/quanzhou/co/51788.htm
浙江海邦电器有限公司衢州分公司,http://www.11467.com/quzhou/co/12432.htm
浙江托泰电器有限公司,http://www.11467.com/quzhou/co/12363.htm
龙游中瑞电器有限公司,http://www.11467.com/quzhou/co/11917.htm
衢州市宇泰电器有限责任公司,http://www.11467.com/quzhou/co/12825.htm
日照市凯旋家电销售有限公司,http://www.11467.com/rizhao/co/9194.htm
日照市全泰电器有限公司,http://www.11467.com/rizhao/co/9845.htm
日照鲁宁苏宁电器有限公司,http://www.11467.com/rizhao/co/9801.htm
三明市瑞源节能电器有限公司,http://www.11467.com/sanming/co/17974.htm
三明苏宁电器有限公司,http://www.11467.com/sanming/co/18118.htm
三明市电子器材公司家电商场,http://www.11467.com/sanming/co/1410.htm
民权县鸿泰家电销售有限公司,http://www.11467.com/shangqiu/co/4296.htm
商丘飞龙电器有限公司,http://www.11467.com/shangqiu/co/9399.htm
波阳县金氏摩托家电销售有限公司,http://www.11467.com/shangrao/co/10686.htm
鄱阳县兴博电器有限公司,http://www.11467.com/shangrao/co/14969.htm
上饶市恒生贸易公司大自然空调城,http://www.11467.com/shangrao/co/1009.htm
鄱阳县老陈家电销售有限公司,http://www.11467.com/shangrao/co/10505.htm
富东电器（深圳）有限公司,http://www.11467.com/shenzhen/co/59800.htm
深圳市好妯娌电器有限公司,http://www.11467.com/shenzhen/co/59734.htm
深圳市江源电器有限公司,http://www.11467.com/shenzhen/co/57787.htm
深圳市鹏龙电器有限公司,http://www.11467.com/shenzhen/co/58948.htm
深圳市能力电器有限公司,http://www.11467.com/shenzhen/co/58928.htm
深圳市炜桦电器有限公司,http://www.11467.com/shenzhen/co/58377.htm
御豪强电器（深圳）有限公司,http://www.11467.com/shenzhen/co/57670.htm
石河子市百姓家电销售有限公司,http://www.11467.com/shihezi/co/719.htm
石河子市商联家电超市有限责任公司,http://www.11467.com/shihezi/co/698.htm
河北新兴格力电器销售有限公司家电销售分公司,http://www.11467.com/shijiazhuang/co/16818.htm
河北格力空调销售有限公司第一专卖店,http://www.11467.com/shijiazhuang/co/9230.htm
河北天元空调销售有限公司,http://www.11467.com/shijiazhuang/co/7027.htm
河北格力空调销售有限公司第二专卖店,http://www.11467.com/shijiazhuang/co/16827.htm
河北格力空调销售有限公司,http://www.11467.com/shijiazhuang/co/16837.htm
河北格力空调销售有限公司第五专卖店,http://www.11467.com/shijiazhuang/co/1204.htm
河北格力空调销售有限公司技术维修站,http://www.11467.com/shijiazhuang/co/16808.htm
河北格力空调销售有限公司中央空调销售部,http://www.11467.com/shijiazhuang/co/16816.htm
河北格力空调销售有限公司第三专卖店,http://www.11467.com/shijiazhuang/co/16815.htm
河北新兴格力电器销售有限公司中央空调销售分公司,http://www.11467.com/shijiazhuang/co/16819.htm
河北省晋州市综合经营公司现代家电商场,http://www.11467.com/shijiazhuang/co/49039.htm
石家庄飞雕电器销售有限公司,http://www.11467.com/shijiazhuang/co/54670.htm
河北省华侨友谊公司华谊家电城,http://www.11467.com/shijiazhuang/co/7016.htm
河北迎燕空调销售有限公司,http://www.11467.com/shijiazhuang/co/21632.htm
石家庄市昊鑫电器有限公司,http://www.11467.com/shijiazhuang/co/55866.htm
石家庄新科空调销售有限公司,http://www.11467.com/shijiazhuang/co/7009.htm
石家庄市银海电器销售有限公司第二分公司,http://www.11467.com/shijiazhuang/co/55036.htm
河北金松空调销售有限公司,http://www.11467.com/shijiazhuang/co/9240.htm
河北盛世商贸有限公司丰达家电商场,http://www.11467.com/shijiazhuang/co/16824.htm
石家庄天王冷气有限公司第一家电商场,http://www.11467.com/shijiazhuang/co/9215.htm
河北盛世商贸有限公司新华丰达家电商场,http://www.11467.com/shijiazhuang/co/21644.htm
石家庄市同力家电销售有限公司,http://www.11467.com/shijiazhuang/co/12210.htm
石家庄市银海电器销售有限公司,http://www.11467.com/shijiazhuang/co/54992.htm
晋州市奥利电器有限公司,http://www.11467.com/shijiazhuang/co/55980.htm
石家庄天王冷气有限公司第二家电商场,http://www.11467.com/shijiazhuang/co/9221.htm
石家庄连连通电器销售有限责任公司,http://www.11467.com/shijiazhuang/co/54727.htm
行唐县五金交电公司家电商场,http://www.11467.com/shijiazhuang/co/33727.htm
石家庄美的微波电器销售有限公司,http://www.11467.com/shijiazhuang/co/54530.htm
十堰市荣昌实业开发总公司家电经营部,http://www.11467.com/shiyan/co/5013.htm
朔州市朔城区建宏电器销售有限公司,http://www.11467.com/shuozhou/co/4817.htm
朔州大夏家电有限责任公司国美家电商场,http://www.11467.com/shuozhou/co/34.htm
朔州市恒荣电器销售有限公司,http://www.11467.com/shuozhou/co/4827.htm
泗阳县鑫虹照明电器有限公司,http://www.11467.com/suqian/co/9237.htm
泰安市岱岳区亿民康电器科技有限公司,http://www.11467.com/taian/co/18539.htm
泰安日日顺电器有限公司,http://www.11467.com/taian/co/18719.htm
上海庆泰电器成套有限公司泰安分公司,http://www.11467.com/taian/co/18472.htm
泰安夏琦空调销售有限公司,http://www.11467.com/taian/co/4052.htm
宁阳威利宝电器有限公司,http://www.11467.com/taian/co/18884.htm
山东苏宁电器有限公司泰安分公司,http://www.11467.com/taian/co/18924.htm
乐清市沪安防爆电器有限公司太原分公司,http://www.11467.com/taiyuan/co/37304.htm
山西宝通电器有限公司,http://www.11467.com/taiyuan/co/38228.htm
山西格力中央空调销售有限公司,http://www.11467.com/taiyuan/co/7036.htm
太原市溢春空调销售有限公司,http://www.11467.com/taiyuan/co/30638.htm
山西科尚科技有限公司,http://www.11467.com/taiyuan/co/36187.htm
台州默洛尼家用电器有限公司,http://www.11467.com/taizhou/co/48302.htm
台州市佳力电器有限公司,http://www.11467.com/taizhou/co/48282.htm
台州市路桥文超电器有限公司,http://www.11467.com/taizhou/co/47232.htm
台州市亚球电器有限公司,http://www.11467.com/taizhou/co/46854.htm
台州市路桥辉泓电器有限公司,http://www.11467.com/taizhou/co/46617.htm
台州科远汽车电器有限公司,http://www.11467.com/taizhou/co/48097.htm
浙江斯大威电器有限公司台州市椒江下陈分公司,http://www.11467.com/taizhou/co/47468.htm
台州博润汽车电器有限公司,http://www.11467.com/taizhou/co/48577.htm
台州市海腾电器有限公司,http://www.11467.com/taizhou/co/46920.htm
三门县鑫鹏电器有限公司,http://www.11467.com/taizhou/co/45783.htm
浙江胜天电器有限公司,http://www.11467.com/taizhou/co/47319.htm
苏州西门子电器有限公司天台分公司,http://www.11467.com/taizhou/co/48679.htm
温岭市广播电视服务公司家电经营部,http://www.11467.com/taizhou/co/36600.htm
台州市富鑫电器有限公司,http://www.11467.com/taizhou/co/48313.htm
江苏格朗灵电器有限公司,http://www.11467.com/taizhoushi/co/25719.htm
