东莞市铭艺电热电器有限公司,http://www.11467.com/dongguan/co/70777.htm
东莞市特福电器有限公司,http://www.11467.com/dongguan/co/70568.htm
东莞市帕瓦电器有限公司,http://www.11467.com/dongguan/co/74078.htm
东莞市鹏远电器有限公司,http://www.11467.com/dongguan/co/70282.htm
东莞市日立商用空调销售有限公司,http://www.11467.com/dongguan/co/26806.htm
东莞市迅高电器有限公司,http://www.11467.com/dongguan/co/72154.htm
东莞市展鹏电器有限公司,http://www.11467.com/dongguan/co/71396.htm
东莞市瑞安电器有限公司,http://www.11467.com/dongguan/co/71046.htm
东莞市耀青电器有限公司,http://www.11467.com/dongguan/co/70929.htm
东营创力空调销售有限公司,http://www.11467.com/dongying/co/5006.htm
东营市商业大厦有限责任公司电器分公司,http://www.11467.com/dongying/co/15736.htm
东营市坤达电器有限责任公司,http://www.11467.com/dongying/co/15709.htm
恩施自治州科海商贸有限责任公司科海空调城,http://www.11467.com/enshi/co/210.htm
恩施自治州兴鑫商贸有限责任公司空调城,http://www.11467.com/enshi/co/208.htm
恩施自治州永信魔芋有限责任公司空调城,http://www.11467.com/enshi/co/209.htm
防城港市港口区宇恒电器有限公司,http://www.11467.com/fangchenggang/co/3392.htm
佛山九亿电器有限公司,http://www.11467.com/foshan/co/68563.htm
佛山市南海乐众电器有限公司,http://www.11467.com/foshan/co/67180.htm
佛山市南海区乘盛电器实业有限公司,http://www.11467.com/foshan/co/66942.htm
佛山市常宏控制电器有限公司,http://www.11467.com/foshan/co/68842.htm
佛山市傲邦电器有限公司,http://www.11467.com/foshan/co/68692.htm
佛山市南海明之光照明电器有限公司,http://www.11467.com/foshan/co/67305.htm
佛山市南海区蕲兆照明电器有限公司,http://www.11467.com/foshan/co/68979.htm
佛山市顺德区大良金门子电器有限公司大门分公司,http://www.11467.com/foshan/co/67550.htm
佛山市金福满生活电器制造有限公司,http://www.11467.com/foshan/co/67151.htm
佛山市家乐仕电器科技有限公司,http://www.11467.com/foshan/co/68792.htm
佛山市顺德区森友电器实业有限公司,http://www.11467.com/foshan/co/66699.htm
佛山市顺德区顺昌电器实业有限公司第一分公司,http://www.11467.com/foshan/co/66782.htm
佛山市顺德区能堡电器实业有限公司,http://www.11467.com/foshan/co/67399.htm
佛山市顺德区俊言电器配件有限公司,http://www.11467.com/foshan/co/67161.htm
佛山市禅城区全现代电器销售有限公司,http://www.11467.com/foshan/co/64232.htm
佛山市顺德区顺威龙电器有限公司,http://www.11467.com/foshan/co/66888.htm
佛山市顺德区普能照明电器有限公司,http://www.11467.com/foshan/co/67934.htm
佛山市南海区集尔电器有限公司,http://www.11467.com/foshan/co/67764.htm
佛山市南海区大沥至正电器有限公司,http://www.11467.com/foshan/co/67805.htm
佛山市顺德区志德财家用电器有限公司,http://www.11467.com/foshan/co/69302.htm
佛山市顺德区歌派电器制造有限公司,http://www.11467.com/foshan/co/66623.htm
佛山市顺德区帝尔曼照明电器有限公司,http://www.11467.com/foshan/co/66700.htm
佛山市顺德区吉诺尔电器有限公司,http://www.11467.com/foshan/co/67091.htm
佛山市顺德区华丹电器有限公司,http://www.11467.com/foshan/co/69348.htm
佛山市顺德区弘傲电器有限公司,http://www.11467.com/foshan/co/67928.htm
佛山市氙明电器有限公司,http://www.11467.com/foshan/co/69525.htm
佛山市顺德区佰年好生活电器有限公司,http://www.11467.com/foshan/co/68165.htm
佛山市三水胜风润田电器有限公司,http://www.11467.com/foshan/co/68329.htm
佛山市雪宝电器有限公司,http://www.11467.com/foshan/co/69028.htm
佛山市南海区盛荣照明电器有限公司,http://www.11467.com/foshan/co/68625.htm
佛山市顺德区怡的电器有限公司,http://www.11467.com/foshan/co/69300.htm
佛山市顺德区上邦电器有限公司,http://www.11467.com/foshan/co/69435.htm
佛山市顺德区淇福电器有限公司,http://www.11467.com/foshan/co/66780.htm
佛山市顺德区康凯电器有限公司,http://www.11467.com/foshan/co/66907.htm
广州市国美电器有限公司乐从分公司,http://www.11467.com/foshan/co/69594.htm
佛山市顺德区埃克森电器有限公司,http://www.11467.com/foshan/co/69281.htm
佛山市顺德区奥尔丽电器有限公司,http://www.11467.com/foshan/co/67407.htm
佛山市南海茂芯电器有限公司,http://www.11467.com/foshan/co/67548.htm
佛山市顺德区轩逸家电器实业有限公司,http://www.11467.com/foshan/co/66715.htm
佛山市顺德区美实电器有限公司,http://www.11467.com/foshan/co/66854.htm
佛山市顺德区欧翔电器有限公司分公司,http://www.11467.com/foshan/co/67251.htm
佛山市珠通电器有限公司,http://www.11467.com/foshan/co/69078.htm
佛山市顺德区林凯电器有限公司,http://www.11467.com/foshan/co/67316.htm
佛山市顺德区通联电器有限公司,http://www.11467.com/foshan/co/66738.htm
佛山市顺德区先歌电器制造有限公司,http://www.11467.com/foshan/co/68929.htm
佛山市顺德区力环电器有限公司,http://www.11467.com/foshan/co/68805.htm
佛山市顺德区肯航电器有限公司,http://www.11467.com/foshan/co/67523.htm
抚顺家电城有限公司,http://www.11467.com/fushun/co/5736.htm
沈阳春兴成套电器有限公司抚顺分公司,http://www.11467.com/fushun/co/23177.htm
安徽飞源电器有限公司,http://www.11467.com/fuyang/co/14829.htm
阜南县鸿兴源电器有限公司,http://www.11467.com/fuyang/co/14921.htm
颍上县强力照明电器有限公司,http://www.11467.com/fuyang/co/14960.htm
杭州鸿运照明电器工程有限公司阜阳分公司,http://www.11467.com/fuyang/co/14596.htm
福州奥诚电器销售有限公司,http://www.11467.com/fuzhou/co/63914.htm
福州富山电瓷电器有限公司,http://www.11467.com/fuzhou/co/68197.htm
福州承信电器有限公司,http://www.11467.com/fuzhou/co/69151.htm
福州荣富达电器设备有限公司,http://www.11467.com/fuzhou/co/70252.htm
福建省富鑫电瓷电器有限公司,http://www.11467.com/fuzhou/co/69936.htm
福州千禧电器有限公司,http://www.11467.com/fuzhou/co/68763.htm
福州市仓山区明诚德电器有限公司,http://www.11467.com/fuzhou/co/68744.htm
福州市鼓楼建筑材料公司清风空调商行,http://www.11467.com/fuzhou/co/20625.htm
福州恒创电器有限公司,http://www.11467.com/fuzhou/co/69185.htm
福州诚旺电器有限公司,http://www.11467.com/fuzhou/co/70619.htm
福州台江区帝道电器有限公司,http://www.11467.com/fuzhou/co/68600.htm
福建格兰仕电器销售有限公司,http://www.11467.com/fuzhou/co/63934.htm
福州如日中天照明电器有限公司,http://www.11467.com/fuzhou/co/68261.htm
福州信达锦齐电器有限公司,http://www.11467.com/fuzhou/co/68476.htm
福州索美斯电器实业有限公司,http://www.11467.com/fuzhou/co/70564.htm
福建省永泰县日杂工业品公司杰声电器商行,http://www.11467.com/fuzhou/co/51800.htm
福建金久电器有限公司,http://www.11467.com/fuzhou/co/69942.htm
福州台江区东华伟业电器有限公司,http://www.11467.com/fuzhou/co/68075.htm
闽清县金辉电器有限公司,http://www.11467.com/fuzhou/co/70991.htm
福州台江区华诚家用电器有限公司,http://www.11467.com/fuzhou/co/68123.htm
福州三雄电器有限公司,http://www.11467.com/fuzhou/co/69845.htm
福建省邮电器材有限公司福州分公司,http://www.11467.com/fuzhou/co/69292.htm
福州市三宝电器有限公司,http://www.11467.com/fuzhou/co/68684.htm
华广（福建）电器实业有限公司,http://www.11467.com/fuzhou/co/67448.htm
福州善融电器有限公司,http://www.11467.com/fuzhou/co/68739.htm
福州环球鑫电器成套设备有限公司,http://www.11467.com/fuzhou/co/69003.htm
上海华东电器（集团）福州销售有限公司,http://www.11467.com/fuzhou/co/67432.htm
福州好的家用电器有限公司,http://www.11467.com/fuzhou/co/68569.htm
福州东冉电器有限公司台江维修部,http://www.11467.com/fuzhou/co/69773.htm
闽清宏运电瓷电器有限公司,http://www.11467.com/fuzhou/co/70971.htm
福州市晋安区联众电器有限公司,http://www.11467.com/fuzhou/co/68586.htm
闽清恒隆电器有限公司（特种陶瓷开发部）,http://www.11467.com/fuzhou/co/67293.htm
福州松日照明电器有限公司,http://www.11467.com/fuzhou/co/69059.htm
闽清县玉泰电器有限公司,http://www.11467.com/fuzhou/co/67299.htm
崇仁县副食品公司五金家电经营部,http://www.11467.com/fuzhoushi/co/4984.htm
江西抚州第一百货商场集团有限公司家电商场,http://www.11467.com/fuzhoushi/co/1319.htm
杭州诚方节能电器有限公司,http://www.11467.com/hangzhou/co/115340.htm
杭州汉诺克电器工程有限公司,http://www.11467.com/hangzhou/co/114402.htm
杭州弘顺交通电器有限公司,http://www.11467.com/hangzhou/co/115287.htm
杭州登顶电器有限公司,http://www.11467.com/hangzhou/co/113754.htm
杭州鸿特电器有限公司,http://www.11467.com/hangzhou/co/114291.htm
杭州驰乐电器有限公司,http://www.11467.com/hangzhou/co/114118.htm
杭州康通电器有限公司,http://www.11467.com/hangzhou/co/115270.htm
杭州益惠电器销售有限公司,http://www.11467.com/hangzhou/co/110178.htm
杭州雅枫装饰艺术有限公司（杭州家电城）,http://www.11467.com/hangzhou/co/25430.htm
杭州飞泰电器有限公司,http://www.11467.com/hangzhou/co/114116.htm
杭州金源亨电器检测技术有限公司,http://www.11467.com/hangzhou/co/115147.htm
杭州迅科电器有限公司,http://www.11467.com/hangzhou/co/115338.htm
杭州安驰电器有限公司,http://www.11467.com/hangzhou/co/114743.htm
杭州启通电器有限公司,http://www.11467.com/hangzhou/co/115663.htm
杭州小天使照明电器有限公司,http://www.11467.com/hangzhou/co/114841.htm
杭州欧曼德照明电器有限公司,http://www.11467.com/hangzhou/co/113658.htm
建德市联合正标电器有限公司,http://www.11467.com/hangzhou/co/116263.htm
建德市磊意电器有限公司,http://www.11467.com/hangzhou/co/116278.htm
杭州祥圆鹏电器有限公司,http://www.11467.com/hangzhou/co/115620.htm
上海光点照明电器有限公司杭州分公司,http://www.11467.com/hangzhou/co/112936.htm
杭州弘医综合服务公司家电经营部,http://www.11467.com/hangzhou/co/15427.htm
杭州朗旭电器有限公司,http://www.11467.com/hangzhou/co/114503.htm
浙江星普五星电器有限公司和睦大卖场,http://www.11467.com/hangzhou/co/115629.htm
杭州雨沛厨房电器有限公司,http://www.11467.com/hangzhou/co/113701.htm
中国计量学院经济技术发展总公司家电经营部,http://www.11467.com/hangzhou/co/55791.htm
杭州青鸿电器有限公司,http://www.11467.com/hangzhou/co/114088.htm
浙江国美电器有限公司第十二分公司,http://www.11467.com/hangzhou/co/115981.htm
汉中市华一电器成套有限责任公司,http://www.11467.com/hanzhong/co/14126.htm
鹤壁市创佳电器有限公司,http://www.11467.com/hebi/co/5266.htm
田山伟业（鹤壁）电器有限公司,http://www.11467.com/hebi/co/5258.htm
罗城仫佬族自治县二轻工业总公司家电商场,http://www.11467.com/hechi/co/2642.htm
安徽日洋电器有限公司,http://www.11467.com/hefei/co/44004.htm
安徽省国防商贸总公司家电部,http://www.11467.com/hefei/co/28982.htm
安徽乃大新型电器成套设备有限公司,http://www.11467.com/hefei/co/43888.htm
安徽菱源通电器有限公司,http://www.11467.com/hefei/co/44226.htm
肥东供电局电力服务公司电力电器门市部,http://www.11467.com/hefei/co/39760.htm
合肥邦森电器有限公司,http://www.11467.com/hefei/co/43297.htm
衡水市农业生产资料公司家电经营部,http://www.11467.com/hengshui/co/3172.htm
河北省武强县利达电器设备有限公司,http://www.11467.com/hengshui/co/18381.htm
河北省故城县农机公司飞龙摩托车家电商城,http://www.11467.com/hengshui/co/9948.htm
冀州市法斯德电器有限公司,http://www.11467.com/hengshui/co/18281.htm
衡阳新泰阳电器有限公司西渡分公司,http://www.11467.com/hengyang/co/19922.htm
衡阳市供销大厦股份有限公司名优家电商场,http://www.11467.com/hengyang/co/5193.htm
衡阳市鸿浩机电设备有限公司宏冠电器分公司,http://www.11467.com/hengyang/co/19876.htm
衡阳美利达电器设备有限公司,http://www.11467.com/hengyang/co/20118.htm
河源市阿里斯顿电器有限公司,http://www.11467.com/heyuan/co/8876.htm
河源市鸿晖电器销售服务有限公司,http://www.11467.com/heyuan/co/8699.htm
河源市兴平电器有限公司,http://www.11467.com/heyuan/co/8858.htm
贺州市新中股份合作公司家电部,http://www.11467.com/hezhou/co/2590.htm
昭平县兴昭电气经营有限公司,http://www.11467.com/hezhou/co/2720.htm
云南苏宁电器有限公司个旧分公司,http://www.11467.com/honghe/co/10828.htm
洪泽县利华空调销售有限公司,http://www.11467.com/huaian/co/12381.htm
淮安新辉电器有限公司,http://www.11467.com/huaian/co/17303.htm
涟水县金虹家电销售有限公司,http://www.11467.com/huaian/co/10916.htm
淮安市金谷空调城有限公司,http://www.11467.com/huaian/co/1604.htm
涟水县卫艳空调销售服务有限公司,http://www.11467.com/huaian/co/10911.htm
淮安市恒运电器有限公司,http://www.11467.com/huaian/co/17433.htm
江苏锦华科技有限公司锦华空调总汇二店,http://www.11467.com/huaian/co/10667.htm
淮北凌云电力实业总公司家电城,http://www.11467.com/huaibei/co/2245.htm
怀化中元电器安装维修有限责任公司,http://www.11467.com/huaihua/co/11865.htm
武汉武商集团股份有限公司黄州家电城,http://www.11467.com/huanggang/co/478.htm
麻城市东南家电销售有限公司,http://www.11467.com/huanggang/co/10849.htm
黄梅县九九家电销售有限公司,http://www.11467.com/huanggang/co/8480.htm
黄山市休宁县供销物资公司家电经营部,http://www.11467.com/huangshan/co/5740.htm
黄山五星电器有限公司,http://www.11467.com/huangshan/co/8119.htm
黄石市三禾空调销售有限公司,http://www.11467.com/huangshi/co/2810.htm
深圳市国美电器有限公司惠州江北分公司,http://www.11467.com/huizhou/co/24600.htm
阳天电器（惠州）有限公司,http://www.11467.com/huizhou/co/25381.htm
湖州千林电器有限公司,http://www.11467.com/huzhou/co/28032.htm
湖州南浔腾飞电器有限公司,http://www.11467.com/huzhou/co/28078.htm
湖州赛贝电气科技有限公司,http://www.11467.com/huzhou/co/27520.htm
安吉县恒泰电器安装有限公司,http://www.11467.com/huzhou/co/28188.htm
佳木斯市三信电器经销有限公司,http://www.11467.com/jiamusi/co/5342.htm
嘉峪关市创辉家电经销有限责任公司,http://www.11467.com/jiayuguan/co/762.htm
吉林市正泰电器经销有限公司,http://www.11467.com/jilinshi/co/20355.htm
吉林市恒崧电器经销有限责任公司,http://www.11467.com/jilinshi/co/13018.htm
吉林市宇飞电器有限公司,http://www.11467.com/jilinshi/co/44427.htm
舒兰市环邦电器有限公司,http://www.11467.com/jilinshi/co/44677.htm
吉林市汇源电器经销有限责任公司,http://www.11467.com/jilinshi/co/20361.htm
济南百安电器有限公司,http://www.11467.com/jinan/co/60793.htm
长城电器集团山东有限公司,http://www.11467.com/jinan/co/61727.htm
三联集团长清家电商场有限责任公司,http://www.11467.com/jinan/co/45002.htm
济南速腾电器有限公司,http://www.11467.com/jinan/co/59741.htm
济南济能电器有限公司,http://www.11467.com/jinan/co/59479.htm
济南欣时代电器安装有限公司,http://www.11467.com/jinan/co/59470.htm
山东杨业照明电器有限公司,http://www.11467.com/jinan/co/61520.htm
济南盛京防爆电器制造有限公司,http://www.11467.com/jinan/co/60944.htm
山东三联家电有限公司家用电器维修中心,http://www.11467.com/jinan/co/61643.htm
济南嘉实电器安装有限公司,http://www.11467.com/jinan/co/60875.htm
济南高新开发区金龙电器经销公司,http://www.11467.com/jinan/co/4462.htm
济南富峪电器有限公司,http://www.11467.com/jinan/co/61158.htm
济南中源摩托车家电销售有限公司,http://www.11467.com/jinan/co/48866.htm
山东省金冠体育开发总公司家电部,http://www.11467.com/jinan/co/4463.htm
晋城市幸福快车电器有限公司,http://www.11467.com/jincheng/co/11368.htm
晋城市金旋风空调销售有限公司,http://www.11467.com/jincheng/co/538.htm
景德镇市电瓷电器工业公司电瓷电器经销部,http://www.11467.com/jingdezhen/co/1434.htm
景德镇市汇海家电销售有限公司,http://www.11467.com/jingdezhen/co/1676.htm
金华美星电器销售有限公司,http://www.11467.com/jinhua/co/37858.htm
金华奥吉斯电器有限公司,http://www.11467.com/jinhua/co/40013.htm
武义富为电器有限公司,http://www.11467.com/jinhua/co/38895.htm
武义康雄电器有限公司,http://www.11467.com/jinhua/co/39038.htm
武义欧米燃具电器有限公司,http://www.11467.com/jinhua/co/39141.htm
济宁九洲照明电器有限公司,http://www.11467.com/jining/co/29010.htm
介休市汇丰电器有限公司,http://www.11467.com/jinzhong/co/15666.htm
锦州东鹰高压电器设备有限公司,http://www.11467.com/jinzhou/co/24759.htm
辽宁省百货公司锦州采购供应站家用电器经销部,http://www.11467.com/jinzhou/co/12359.htm
凌海市信桥电器有限公司,http://www.11467.com/jinzhou/co/24621.htm
云南苏宁电器有限公司,http://www.11467.com/kunming/co/47486.htm
莱芜市全通电器有限公司,http://www.11467.com/laiwu/co/5286.htm
文安县中心家电销售有限公司,http://www.11467.com/langfang/co/11813.htm
廊坊市德源电器城有限公司,http://www.11467.com/langfang/co/2071.htm
三河市兴达家电销售有限责任公司,http://www.11467.com/langfang/co/18670.htm
廊坊市隆升电器有限公司,http://www.11467.com/langfang/co/22059.htm
兰州奥马电器销售有限公司,http://www.11467.com/lanzhou/co/31765.htm
兰州众和电器有限公司,http://www.11467.com/lanzhou/co/32229.htm
兰州通德电器设备有限公司,http://www.11467.com/lanzhou/co/32367.htm
兰州一木电器有限公司,http://www.11467.com/lanzhou/co/32371.htm
甘肃原正泰电器销售有限公司,http://www.11467.com/lanzhou/co/31864.htm
兰州鹏润电器有限公司,http://www.11467.com/lanzhou/co/32474.htm
兰州志高空调销售有限公司,http://www.11467.com/lanzhou/co/17764.htm
兰州龙山家电销售有限公司,http://www.11467.com/lanzhou/co/1011.htm
兰州广宝电器有限公司,http://www.11467.com/lanzhou/co/32483.htm
兰州恒创电器有限公司,http://www.11467.com/lanzhou/co/32274.htm
连云港市鹏鑫家电销售有限公司,http://www.11467.com/lianyungang/co/3234.htm
灌南县开源电器有限公司,http://www.11467.com/lianyungang/co/15643.htm
连云港市金龙电器有限公司,http://www.11467.com/lianyungang/co/15717.htm
连云港市威乐电器有限公司,http://www.11467.com/lianyungang/co/15595.htm
镇江市神威电器设备有限公司灌云分公司,http://www.11467.com/lianyungang/co/15745.htm
赣榆县华宝家电销售有限公司,http://www.11467.com/lianyungang/co/7537.htm
连云港禹鸿电器设备有限公司,http://www.11467.com/lianyungang/co/15754.htm
灌南县民生电器有限公司永乐电器分公司,http://www.11467.com/lianyungang/co/15441.htm
人民电器集团连云港销售有限公司,http://www.11467.com/lianyungang/co/15365.htm
东海县晶园家电销售有限公司,http://www.11467.com/lianyungang/co/10451.htm
连云港市东海五交化有限公司家电商场,http://www.11467.com/lianyungang/co/10452.htm
东海县苏东空调销售有限公司,http://www.11467.com/lianyungang/co/10412.htm
灌云县恒丰家电销售有限公司,http://www.11467.com/lianyungang/co/12297.htm
山东聊城齐龙空调销售有限公司,http://www.11467.com/liaocheng/co/111.htm
聊城市奥通汽车电器有限公司,http://www.11467.com/liaocheng/co/16861.htm
聊城市东昌府区金鑫电器设备有限公司,http://www.11467.com/liaocheng/co/16855.htm
茌平县宏大家电有限责任公司宏大家电超市,http://www.11467.com/liaocheng/co/7749.htm
辽阳科信家电销售服务有限公司,http://www.11467.com/liaoyang/co/4926.htm
辽阳山慧空调销售有限公司,http://www.11467.com/liaoyang/co/4922.htm
临汾市尧都区特舒电器有限公司,http://www.11467.com/linfen/co/16626.htm
临汾市成奇正泰电器销售有限公司,http://www.11467.com/linfen/co/16076.htm
莒南县金铭电器有限公司,http://www.11467.com/linyi/co/34924.htm
莒南县美达电力实业有限公司家电部,http://www.11467.com/linyi/co/29302.htm
临沂煜昕照明电器有限公司,http://www.11467.com/linyi/co/34403.htm
山东旭坤照明电器有限公司第一分公司,http://www.11467.com/linyi/co/34637.htm
温州鹏润国美电器有限公司丽水分公司,http://www.11467.com/lishui/co/14555.htm
丽水市未来照明电器有限公司,http://www.11467.com/lishui/co/14339.htm
霍山县百货公司家电经营部,http://www.11467.com/liuan/co/9671.htm
六安市升源电器有限公司大市场分公司,http://www.11467.com/liuan/co/10820.htm
柳州工贸大厦股份有限公司馥荣家电商场,http://www.11467.com/liuzhou/co/5865.htm
福建省长汀县长安家电商场有限公司营背分公司,http://www.11467.com/longyan/co/5318.htm
福建省长汀县长安家电商场有限公司,http://www.11467.com/longyan/co/5319.htm
福建省龙岩银河实业有限公司体育中心电器城,http://www.11467.com/longyan/co/10270.htm
龙岩市汇通电器有限公司,http://www.11467.com/longyan/co/13095.htm
漳州鹏润国美电器有限公司龙岩分公司,http://www.11467.com/longyan/co/13594.htm
龙岩市精博家电有限公司家电超市,http://www.11467.com/longyan/co/9910.htm
福建龙岩恒业电器有限公司,http://www.11467.com/longyan/co/13762.htm
精达电器集团公司福建销售公司,http://www.11467.com/longyan/co/13758.htm
娄底市冠杰电器有限公司,http://www.11467.com/loudi/co/10869.htm
新化县国康电器有限公司,http://www.11467.com/loudi/co/11096.htm
灵宝市新境界家电销售有限责任公司,http://www.11467.com/luohe/co/12058.htm
泸州宏生电器安装工程有限责任公司,http://www.11467.com/luzhou/co/10090.htm
泸州泸宁苏宁电器有限公司,http://www.11467.com/luzhou/co/10024.htm
茂名市超威雕牌电器有限公司,http://www.11467.com/maoming/co/12301.htm
电白县日电电器有限公司,http://www.11467.com/maoming/co/12216.htm
茂名市强兴电器有限公司,http://www.11467.com/maoming/co/12302.htm
化州市石龙商业有限公司河东福万家购物中心电器专柜,http://www.11467.com/maoming/co/12158.htm
茂名现代电器有限公司,http://www.11467.com/maoming/co/12282.htm
梅州市鑫源电器有限公司,http://www.11467.com/meizhou/co/13449.htm
惠州市惠联电器安装工程公司兴宁分公司,http://www.11467.com/meizhou/co/13529.htm
牡丹江市地明电器经销公司,http://www.11467.com/mudanjiang/co/9939.htm
牡丹江市万达照明电器有限公司,http://www.11467.com/mudanjiang/co/26564.htm
江西国金华波尔卡空调销售有限责任公司,http://www.11467.com/nanchang/co/6513.htm
江西洪谱空调城有限公司,http://www.11467.com/nanchang/co/24067.htm
江西国美空调销售有限公司,http://www.11467.com/nanchang/co/17459.htm
江西恒达家电销售有限责任公司,http://www.11467.com/nanchang/co/38660.htm
南昌市国红电器销售有限公司,http://www.11467.com/nanchang/co/39162.htm
江西天马宜佳空调销售有限公司,http://www.11467.com/nanchang/co/7084.htm
江西新华美的空调销售有限公司,http://www.11467.com/nanchang/co/7060.htm
南昌市荣辉电器有限公司,http://www.11467.com/nanchang/co/39425.htm
南昌天义航电器有限公司,http://www.11467.com/nanchang/co/39528.htm
南昌新泰电器机电有限公司,http://www.11467.com/nanchang/co/39421.htm
南昌市锦福电器实业有限公司,http://www.11467.com/nanchang/co/39371.htm
南昌三明家电销售有限公司,http://www.11467.com/nanchang/co/33967.htm
江西中发空调销售有限公司,http://www.11467.com/nanchang/co/6507.htm
江西天马空调销售网络有限公司,http://www.11467.com/nanchang/co/6469.htm
南昌方鑫商贸有限公司康佳家电专卖店,http://www.11467.com/nanchang/co/30171.htm
南充市全通电器有限责任公司,http://www.11467.com/nanchong/co/16499.htm
四川苏宁电器有限公司南充分公司,http://www.11467.com/nanchong/co/16510.htm
蓬安县富升电器有限公司,http://www.11467.com/nanchong/co/16528.htm
南京保亚圣电器销售有限公司,http://www.11467.com/nanjing/co/19089.htm
南京百爱神电器有限公司,http://www.11467.com/nanjing/co/22005.htm
南通百乐家电销售有限公司,http://www.11467.com/nantong/co/9221.htm
海安县俊来电器有限公司,http://www.11467.com/nantong/co/57477.htm
南通南天家电销售有限公司,http://www.11467.com/nantong/co/9177.htm
通州市用电服务公司空调经营部,http://www.11467.com/nantong/co/43458.htm
启东风神空调销售公司,http://www.11467.com/nantong/co/29529.htm
内乡县昌盛家电销售有限责任公司,http://www.11467.com/nanyang/co/15362.htm
