上海极新信息科技有限公司常州分公司,http://www.11467.com/changzhou/co/129101.htm
广州市番怡印刷有限公司,http://www.11467.com/guangzhou/co/456208.htm
重庆德祥工艺礼品有限责任公司,http://www.11467.com/chongqing/co/344275.htm
南宁夏之礼商贸有限公司,http://www.11467.com/nanning/co/99075.htm
聊城华宏包装有限公司,http://www.11467.com/liaocheng/co/75427.htm
北京奇特恒业皮具有限公司,http://www.11467.com/beijing/co/763733.htm
珠海横琴佰顿贸易有限公司,http://www.11467.com/zhuhai/co/128081.htm
新乡市顺兴毯业有限公司,http://www.11467.com/xinxiang/co/54529.htm
温州谷旺工艺品有限公司,http://www.11467.com/baoding/co/91455.htm
东莞市盛洲实业有限公司,http://www.11467.com/dongguan/co/184192.htm
南宁超级星文化用品有限公司,http://www.11467.com/quanzhou/co/129791.htm
福州百洋电子科技开发有限公司,http://www.11467.com/fuzhou/co/103577.htm
广州达雅贸易有限公司,http://www.11467.com/guangzhou/co/285267.htm
苏州利博文具有限公司,http://www.11467.com/suzhou/co/269488.htm
深圳市新越工艺礼品公司,http://www.11467.com/shenzhen/co/1102550.htm
广州市域迪贸易有限公司,http://www.11467.com/guangzhou/co/160963.htm
山东联建华星精瓷有限公司,http://www.11467.com/guangzhou/co/161225.htm
广州市健马贸易有限公司,http://www.11467.com/guangzhou/co/161484.htm
贵州鸿天祥贸易有限公司,http://www.11467.com/guiyang/co/69328.htm
杭州美冠金属包装有限公司,http://www.11467.com/hangzhou/co/222437.htm
合肥美嘉包装制品有限公司,http://www.11467.com/hefei/co/86206.htm
江门市蓬江区金利是五金制品有限公司,http://www.11467.com/jiangmen/co/84429.htm
南京福宣商贸有限责任公司,http://www.11467.com/nanjing/co/93139.htm
福建省大宏电子开发有限公司,http://www.11467.com/quanzhou/co/95436.htm
泉州市贝加轻工制品有限公司,http://www.11467.com/quanzhou/co/93991.htm
上虞盈丰伞业有限公司,http://www.11467.com/shaoxing/co/74859.htm
潍坊迪坤礼品有限公司,http://www.11467.com/weifang/co/69165.htm
潍坊三川工贸有限公司,http://www.11467.com/weifang/co/66683.htm
上海华泳兴业玻璃器皿有限公司,http://www.11467.com/shanghai/co/734743.htm
上海高百实业有限公司,http://www.11467.com/shanghai/co/212330.htm
上海挺豪文具有限公司,http://www.11467.com/shanghai/co/1007494.htm
天津市亿汇调味品有限公司,http://www.11467.com/tianjin/co/6398.htm
杭州兆旺礼品有限公司,http://www.11467.com/hangzhou/co/222241.htm
北京美炫吉商贸有限公司,http://www.11467.com/beijing/co/303937.htm
北京华德泰业商贸有限公司,http://www.11467.com/beijing/co/648276.htm
两条鱼国际礼品（北京）有限公司,http://www.11467.com/beijing/co/120047.htm
石家庄金利泰彩印鼠标垫有限公司,http://www.11467.com/shijiazhuang/co/204800.htm
江苏御马葡萄酒有限公司,http://www.11467.com/shanghai/co/468325.htm
深圳市多丽工艺礼品有限公司,http://www.11467.com/shenzhen/co/224896.htm
上虞市多盈伞业有限公司,http://www.11467.com/shaoxing/co/127117.htm
深圳市盛诺德科技有限公司,http://www.11467.com/shenzhen/co/811110.htm
义乌市利仁家居用品有限公司,http://www.11467.com/jinhua/co/121966.htm
谊都工贸有限公司,http://www.11467.com/xiamen/co/108783.htm
昆明顺邦号商贸有限公司,http://www.11467.com/kunming/co/134094.htm
浙江里乐汇生活用品有限公司,http://www.11467.com/jiaxing/co/92381.htm
邱县创意工艺品销售有限公司,http://www.11467.com/handan/co/75629.htm
杭州宅享家居用品有限公司,http://www.11467.com/hangzhou/co/310736.htm
深圳市韩志电子有限公司,http://www.11467.com/shenzhen/co/723690.htm
厦门韵和礼品有限公司,http://www.11467.com/xiamen/co/108788.htm
厦门鹏创贸易有限公司,http://www.11467.com/xiamen/co/58061.htm
深圳市纳利源电子有限公司,http://www.11467.com/shenzhen/co/40032.htm
深圳市映山红工艺制品有限公司,http://www.11467.com/shenzhen/co/152561.htm
通辽市海程电子商贸有限责任公司,http://www.11467.com/tongliao/co/9441.htm
厦门锐之林包装有限公司,http://www.11467.com/xiamen/co/85329.htm
僑生實業股份有限公司FORTUNE MARK CO,http://www.11467.com/jiangmen/co/96871.htm
济南有涵商贸有限公司,http://www.11467.com/jinan/co/72494.htm
临沂鹏洋陶瓷有限公司,http://www.11467.com/linyi/co/56781.htm
上海海雯妮贸易有限公司,http://www.11467.com/lishui/co/26183.htm
六安市宏方商贸有限责任公司,http://www.11467.com/liuan/co/14821.htm
绵阳市东鸟礼品（商贸）有限责任公司,http://www.11467.com/mianyang/co/36433.htm
南昌家宝礼品有限公司,http://www.11467.com/nanchang/co/93640.htm
南阳艾草堂艾制品有限公司,http://www.11467.com/nanyang/co/34201.htm
宁德市三都澳兴港旅游有限公司,http://www.11467.com/ningde/co/23679.htm
环县环海旅行社有限责任公司,http://www.11467.com/qingyang/co/10115.htm
深圳市泰莲娜家居用品有限公司,http://www.11467.com/shenzhen/co/786011.htm
烟台金王科贸有限公司,http://www.11467.com/yantai/co/107424.htm
祥兴(福建)箱包集团有限公司,http://www.11467.com/beijing/co/119886.htm
济南圣贝雅商贸有限公司,http://www.11467.com/jinan/co/156627.htm
安徽盛誉文化传媒有限公司,http://www.11467.com/hefei/co/104371.htm
上海敏都实业有限公司,http://www.11467.com/shanghai/co/949161.htm
蚌埠市护聪防护用品有限公司,http://www.11467.com/bengbu/co/26409.htm
美可达电子影像有限公司,http://www.11467.com/chaoyang/co/26070.htm
易軒國際有限公司MASTONE INTERNATI,http://www.11467.com/chaozhou/co/26171.htm
成都香黛坊家居用品有限公司,http://www.11467.com/chengdu/co/82072.htm
东莞市昊达塑胶模具有限公司,http://www.11467.com/dongguan/co/351714.htm
东莞市永隽塑胶电子有限公司,http://www.11467.com/dongguan/co/164087.htm
福建瑞达精工股份有限公司,http://www.11467.com/fuzhou/co/137021.htm
广州市爱信兴业贸易有限公司,http://www.11467.com/guangzhou/co/161944.htm
昆明煌钦商贸有限公司,http://www.11467.com/kunming/co/121981.htm
广州市奇点广告有限公司,http://www.11467.com/guangzhou/co/455205.htm
北京励展华群展览有限公司,http://www.11467.com/beijing/co/85577.htm
保定乾丰广告有限公司,http://www.11467.com/baoding/co/82015.htm
成都汇丰礼品有限公司,http://www.11467.com/chengdu/co/117304.htm
四川国广礼品工贸有限公司,http://www.11467.com/chengdu/co/117712.htm
宁波市鄞州康达工贸有限公司,http://www.11467.com/ningbo/co/76587.htm
青岛天物坊陶艺文化有限公司,http://www.11467.com/qingdao/co/76221.htm
福建省大宏实业开发有限公司,http://www.11467.com/quanzhou/co/132300.htm
汕头市澄海区万成丰工艺有限公司,http://www.11467.com/shantou/co/115665.htm
乐扣乐扣贸易（深圳）有限公司,http://www.11467.com/shenzhen/co/220259.htm
樂達環球有限公司ROCKSTAR UNIVERSA,http://www.11467.com/shenzhen/co/224635.htm
深圳市勤诚达电子有限公司,http://www.11467.com/shenzhen/co/224784.htm
深圳市腾之龙雨伞有限公司,http://www.11467.com/shenzhen/co/178463.htm
台州市黄岩宇隆工艺品有限公司,http://www.11467.com/taizhou/co/82143.htm
温州市华辰烟具有限公司,http://www.11467.com/wenzhou/co/75573.htm
厦门伟达彩印有限公司,http://www.11467.com/xiamen/co/40674.htm
厦门市可佳商贸有限公司,http://www.11467.com/xiamen/co/95705.htm
河南鸿久文化传播有限公司,http://www.11467.com/zhengzhou/co/138199.htm
郑州千雅礼品科贸有限公司,http://www.11467.com/zhengzhou/co/178511.htm
珠海市枫叶红贸易有限公司,http://www.11467.com/zhuhai/co/68426.htm
珠海市斯柯达广告礼品有限公司,http://www.11467.com/zhuhai/co/99052.htm
北京吉祥大地文化传播有限公司,http://www.11467.com/beijing/co/90403.htm
青岛马到成功磁化礼品有限公司北京分公司,http://www.11467.com/beijing/co/90412.htm
北京市新利兴酒店用品有限公司,http://www.11467.com/beijing/co/305883.htm
上海雅派工艺礼品有限公司,http://www.11467.com/shanghai/co/943767.htm
兰州金泰迪商贸有限公司,http://www.11467.com/lanzhou/co/90541.htm
深圳市莱恩斯达科技有限公司,http://www.11467.com/shenzhen/co/984975.htm
东莞锦利电子科技有限公司业务部门,http://www.11467.com/dongguan/co/348670.htm
东莞市祥隆皮具有限公司,http://www.11467.com/dongguan/co/164268.htm
东莞樟木头龙创塑胶原料公司,http://www.11467.com/dongguan/co/351760.htm
美凯特(东莞)实业有限公司,http://www.11467.com/dongguan/co/509927.htm
深圳市彩嘉科技发展有限公司,http://www.11467.com/dongguan/co/164899.htm
东莞市卓志五金玻璃制造有限公司,http://www.11467.com/dongguan/co/163569.htm
广州飞达饰品有限公司,http://www.11467.com/dongguan/co/164226.htm
佛山市名钻电器有限公司,http://www.11467.com/foshan/co/267330.htm
佛山市雅馨庭家居用品有限公司,http://www.11467.com/foshan/co/203148.htm
福州雅格贸易有限公司,http://www.11467.com/fuzhou/co/76330.htm
广州博光恒业皮具有限公司,http://www.11467.com/guangzhou/co/131163.htm
广州市楚扬工贸有限公司,http://www.11467.com/guangzhou/co/161898.htm
广州乐活贸易有限公司,http://www.11467.com/guangzhou/co/161713.htm
广州市冠匙玩具有限公司,http://www.11467.com/guangzhou/co/196111.htm
广州市视域数码科技有限公司,http://www.11467.com/guangzhou/co/166815.htm
广州市宏宇合通数码科技有限公司,http://www.11467.com/guangzhou/co/131078.htm
广州灵锐数码科技有限公司销售部,http://www.11467.com/guangzhou/co/161042.htm
青岛佳欣数码科技有限公司（广州运营中心）,http://www.11467.com/guangzhou/co/161939.htm
汉青瓷工艺礼品有限公司,http://www.11467.com/hangzhou/co/214609.htm
杭州泽诺贸易有限公司,http://www.11467.com/hangzhou/co/222340.htm
济南永林家居用品有限公司,http://www.11467.com/jinan/co/72521.htm
义乌紫罗兰礼品有限公司,http://www.11467.com/jinhua/co/79182.htm
义乌市民鼎百货有限公司,http://www.11467.com/jinhua/co/69162.htm
浙江凯达工贸有限公司,http://www.11467.com/jinhua/co/68802.htm
景澜贸易有限公司,http://www.11467.com/jinhua/co/69070.htm
临沂豪德礼品商贸有限公司,http://www.11467.com/linyi/co/56845.htm
临沂市龙泉口杯有限公司,http://www.11467.com/linyi/co/56822.htm
南京太阳雨伞业有限公司,http://www.11467.com/nanjing/co/60442.htm
南宁大正礼品有限责任公司,http://www.11467.com/nanning/co/86886.htm
宁波市镇海欣利工艺品有限公司,http://www.11467.com/ningbo/co/76595.htm
宁海七度户外用品有限公司,http://www.11467.com/ningbo/co/76542.htm
宁波莹凌贸易有限公司,http://www.11467.com/ningbo/co/72019.htm
慈溪市双汇扑克有限公司,http://www.11467.com/ningbo/co/35183.htm
宁波德载日用品有限公司,http://www.11467.com/ningbo/co/76546.htm
宁波市鄞州鑫旺工艺品有限公司,http://www.11467.com/ningbo/co/76537.htm
宁波市江北汉贝贴花有限公司,http://www.11467.com/ningbo/co/76560.htm
美加美餐具股份有限公司,http://www.11467.com/quanzhou/co/95375.htm
汕头诚信库存商贸有限公司,http://www.11467.com/shantou/co/115774.htm
汕头市澄海区信迪工艺玩具有限公司,http://www.11467.com/shantou/co/117794.htm
广东博程贸易有限公司,http://www.11467.com/shantou/co/115675.htm
波爾頓科技發展有限公司BOLTON TECHNOL,http://www.11467.com/shenzhen/co/224461.htm
冠宇實業公司 GOON YUE INDUSTRIAL CO,http://www.11467.com/shenzhen/co/225238.htm
德科電子(香港)有限公司DECO ELECTRON,http://www.11467.com/shenzhen/co/225395.htm
傑源實業有限公司,http://www.11467.com/shenzhen/co/223914.htm
好丽达科技有限公司销售部,http://www.11467.com/shenzhen/co/614929.htm
深圳善日通讯电子公司,http://www.11467.com/shenzhen/co/614987.htm
冠宇實業公司,http://www.11467.com/shenzhen/co/723565.htm
华瑞展示制品有限公司总部,http://www.11467.com/shenzhen/co/224422.htm
深圳华芯光电科技有限公司,http://www.11467.com/shenzhen/co/224086.htm
深圳市芬雅特艺术品有限公司,http://www.11467.com/shenzhen/co/224485.htm
深圳市长旺塑胶制品有限公司,http://www.11467.com/shenzhen/co/277899.htm
深圳市皇庭酒具礼品有限公司,http://www.11467.com/shenzhen/co/225272.htm
深圳市鸿运利达贸易有限公司,http://www.11467.com/shenzhen/co/615111.htm
深圳市精博雅工艺饰品有限公司,http://www.11467.com/shenzhen/co/225043.htm
深圳市科泰安科技有限公司,http://www.11467.com/shenzhen/co/723242.htm
深圳市可可西里电子科技有限公司,http://www.11467.com/shenzhen/co/223881.htm
深圳市青廷艺术饰品有限公司,http://www.11467.com/shenzhen/co/609996.htm
深圳市诺曼精品计时有限公司,http://www.11467.com/shenzhen/co/224717.htm
深圳市捷士宝科技有限公司,http://www.11467.com/shenzhen/co/225001.htm
深圳市好迅达科技有限公司,http://www.11467.com/shenzhen/co/604513.htm
深圳市振兴家庭用品有限公司,http://www.11467.com/shenzhen/co/54556.htm
深圳市恒超鑫科技有限公司,http://www.11467.com/shenzhen/co/225242.htm
深圳特区金利达贸易公司,http://www.11467.com/shenzhen/co/225290.htm
深圳新奇特产品有限公司,http://www.11467.com/shenzhen/co/223983.htm
深圳市易拓伟业电子有限公司,http://www.11467.com/shenzhen/co/225909.htm
田野興業有限公司CHIEN YAUH INTERN,http://www.11467.com/shenzhen/co/224116.htm
深圳市永和鑫电子有限公司,http://www.11467.com/shenzhen/co/224072.htm
深圳市永光科技有限公司,http://www.11467.com/shenzhen/co/154805.htm
深圳市英之健科技有限公司,http://www.11467.com/shenzhen/co/215541.htm
香港瑞华国际有限公司,http://www.11467.com/shenzhen/co/225137.htm
旺得國際貿易有限公司 WANG DE INTERNATION,http://www.11467.com/shenzhen/co/152503.htm
深圳中源祥礼品有限公司,http://www.11467.com/shenzhen/co/791803.htm
深圳市鑫鸿鑫源电子有限公司,http://www.11467.com/shenzhen/co/224412.htm
深圳市祥钰精品制造有限公司,http://www.11467.com/shenzhen/co/224327.htm
深圳市宜瑞特电子科技有限公司,http://www.11467.com/shenzhen/co/660040.htm
深圳市誉扬礼品有限公司,http://www.11467.com/shenzhen/co/225250.htm
深圳市拓铭贸易有限公司,http://www.11467.com/shenzhen/co/225620.htm
苏州天宝礼品有限公司,http://www.11467.com/suzhou/co/214070.htm
台州市金隆泰塑胶有限公司,http://www.11467.com/taizhou/co/13206.htm
台州市鼎泰塑业有限公司,http://www.11467.com/taizhou/co/12443.htm
仙居县裘氏商贸有限公司,http://www.11467.com/taizhou/co/45918.htm
浙江乐雪儿家居用品有限公司,http://www.11467.com/taizhou/co/82128.htm
苍南鹏华塑料制品有限公司,http://www.11467.com/wenzhou/co/160334.htm
温州市奥麦烟具有限公司,http://www.11467.com/wenzhou/co/88877.htm
瑞安市天伦健身器材有限公司,http://www.11467.com/wenzhou/co/56763.htm
温州市安达烟具有限公司,http://www.11467.com/wenzhou/co/88788.htm
温州市博康工艺烟具有限公司,http://www.11467.com/wenzhou/co/127547.htm
温州市恒润鞋材有限公司,http://www.11467.com/wenzhou/co/95731.htm
瑞安市伟力光学有限公司,http://www.11467.com/wenzhou/co/216290.htm
温州市杉亚贸易有限公司,http://www.11467.com/wenzhou/co/128025.htm
厦门兆利塑胶科技有限公司,http://www.11467.com/xiamen/co/33106.htm
岳晨商贸有限公司,http://www.11467.com/xian/co/122553.htm
红点气模有限公司,http://www.11467.com/zhengzhou/co/102297.htm
郑州澜川商贸有限公司,http://www.11467.com/zhengzhou/co/175774.htm
泉州多彩礼品公司,http://www.11467.com/quanzhou/co/114115.htm
重庆乾勤商贸有限公司,http://www.11467.com/chongqing/co/127926.htm
名赫杯业有限公司,http://www.11467.com/zibo/co/93262.htm
术朵礼品有限公司,http://www.11467.com/guangzhou/co/433964.htm
悠品堂礼品公司,http://www.11467.com/nanjing/co/115398.htm
广州术朵日用礼品有限公司,http://www.11467.com/guangzhou/co/434171.htm
石家庄中华行商贸有限公司,http://www.11467.com/shijiazhuang/co/108706.htm
重庆礼仪之邦电子商务有限公司,http://www.11467.com/chongqing/co/171414.htm
深圳市百森纸品有限公司,http://www.11467.com/shenzhen/co/730835.htm
深圳市信诚阳光科技有限公司,http://www.11467.com/shenzhen/co/731527.htm
临沂广告礼品公司,http://www.11467.com/linyi/co/79361.htm
邯郸市迅飞贸易有限公司,http://www.11467.com/handan/co/57028.htm
绍兴市舜邦篷业有限公司,http://www.11467.com/shaoxing/co/118065.htm
长沙购乐文化传播有限公司,http://www.11467.com/changsha/co/72878.htm
吴江辉煌铜字标牌有限公司,http://www.11467.com/suzhou/co/313216.htm
成都盛吉隆贸易有限公司,http://www.11467.com/chengdu/co/211860.htm
广西南宁市鲍氏商贸有限公司,http://www.11467.com/nanning/co/86044.htm
广州亿标箱包实业有限公司,http://www.11467.com/guangzhou/co/456065.htm
深圳市圣威尔皮具有限公司,http://www.11467.com/shenzhen/co/759080.htm
郑州昂宝商贸有限公司,http://www.11467.com/zhengzhou/co/170394.htm
中山市标奇家庭用品有限公司,http://www.11467.com/zhongshan/co/48798.htm
湖南省株洲醴陵市瑞恒陶瓷有限公司,http://www.11467.com/zhuzhou/co/39538.htm
淄博市博山博瑞陶瓷有限公司,http://www.11467.com/zibo/co/82224.htm
淄博颜山陶瓷有限公司,http://www.11467.com/zibo/co/69417.htm
北京格瑞思乐商贸有限公司,http://www.11467.com/beijing/co/90453.htm
北京京精诚机床技术有限公司业务部门,http://www.11467.com/beijing/co/214403.htm
北京桃源记工艺品有限公司,http://www.11467.com/beijing/co/88636.htm
北京伟宇富盛商贸有限公司销售部,http://www.11467.com/beijing/co/90930.htm
上海迪创商贸发展有限公司,http://www.11467.com/shanghai/co/297011.htm
上海林星日用品有限公司,http://www.11467.com/shanghai/co/880289.htm
上海宁兴建材有限公司,http://www.11467.com/shanghai/co/510406.htm
上海罗盛丰国际贸易有限公司,http://www.11467.com/shanghai/co/83038.htm
上海舜华雨具有限公司,http://www.11467.com/shanghai/co/245897.htm
上海天琪工艺礼品有限公司,http://www.11467.com/shanghai/co/660240.htm
重庆树德工贸有限公司,http://www.11467.com/chongqing/co/148265.htm
湖南德儒工贸有限公司,http://www.11467.com/changsha/co/180559.htm
广西北海翔欣礼品有限公司,http://www.11467.com/beihai/co/14129.htm
阳信吉祥不锈钢制品有限公司,http://www.11467.com/binzhou/co/19028.htm
温州新港印刷有限公司,http://www.11467.com/cangnan/co/7629.htm
长沙磊华贸易公司,http://www.11467.com/changsha/co/91381.htm
湖南芮竹纺织品有限公司,http://www.11467.com/changsha/co/76446.htm
湖南骏腾文化传播有限公司,http://www.11467.com/changsha/co/75819.htm
湖南潇湘传谋公司,http://www.11467.com/changsha/co/91175.htm
长沙市百嘉礼品有限公司,http://www.11467.com/changsha/co/75861.htm
常州市威林钟表有限公司,http://www.11467.com/changzhou/co/26339.htm
常州冠美玩具有限公司,http://www.11467.com/changzhou/co/26510.htm
常州君炀塑胶有限公司,http://www.11467.com/changzhou/co/94241.htm
广东省雅格丽陶瓷有限公司,http://www.11467.com/chaozhou/co/26125.htm
潮州明芸塑料有限公司,http://www.11467.com/chaozhou/co/35374.htm
成都润之礼商贸有限公司,http://www.11467.com/chengdu/co/214982.htm
广州赤兔工艺品有限公司,http://www.11467.com/guangzhou/co/456225.htm
廊坊市盛世嘉华文化传媒发展有限公司,http://www.11467.com/langfang/co/33126.htm
浙江淘也贸易有限公司,http://www.11467.com/hangzhou/co/368686.htm
广东省东莞市金诚鑫礼品有限公司,http://www.11467.com/dongguan/co/489447.htm
济南一格广告传媒有限公司,http://www.11467.com/jinan/co/133621.htm
广州奥楷月历有限公司,http://www.11467.com/guangzhou/co/456636.htm
贵阳恩泽龙贸易有限公司,http://www.11467.com/guiyang/co/82815.htm
合肥炎芒礼品有限公司,http://www.11467.com/hefei/co/131640.htm
江门市新林礼业有限公司,http://www.11467.com/jiangmen/co/114079.htm
苏州邦和礼品有限公司,http://www.11467.com/suzhou/co/313842.htm
广州順虎户外用品有限公司,http://www.11467.com/guangzhou/co/477459.htm
合肥安柏伞具有限公司,http://www.11467.com/hefei/co/141531.htm
衢州桦林礼品有限公司,http://www.11467.com/quzhou/co/36098.htm
广州迪欣礼品贸易有限公司,http://www.11467.com/guangzhou/co/494457.htm
高阳县家之宝纺织品销售有限公司,http://www.11467.com/baoding/co/79388.htm
齐发广告礼品有限公司,http://www.11467.com/dezhou/co/35656.htm
创鑫工艺礼品公司,http://www.11467.com/dongguan/co/169568.htm
东莞捷程工艺制品有限公司,http://www.11467.com/dongguan/co/351724.htm
东莞市博仁塑胶礼品有限公司,http://www.11467.com/dongguan/co/164716.htm
东莞金隆鑫塑胶制品有限公司,http://www.11467.com/dongguan/co/350996.htm
东莞锦利电子科技有限公司销售部,http://www.11467.com/dongguan/co/350068.htm
成都创珈文化用品有限公司,http://www.11467.com/chengdu/co/89022.htm
成都图锐礼品有限公司(业务部),http://www.11467.com/chengdu/co/89162.htm
成都市盛世立元商贸有限公司,http://www.11467.com/chengdu/co/88094.htm
成都久兴商贸有限公司,http://www.11467.com/chengdu/co/82015.htm
成都祥瑞云桥牌用品有限公司,http://www.11467.com/chengdu/co/87796.htm
成都思迈腾商贸有限公司,http://www.11467.com/chengdu/co/212483.htm
成都星仕辰礼品有限公司,http://www.11467.com/chengdu/co/82099.htm
成都金盛行文化传媒有限公司,http://www.11467.com/chengdu/co/82064.htm
成都市上之登商贸有限公司,http://www.11467.com/chengdu/co/82055.htm
信仁贸易有限公司,http://www.11467.com/chengdu/co/118001.htm
四川凯驰达商务礼品有限公司,http://www.11467.com/chengdu/co/117514.htm
大连侯明轩文化艺术有限公司,http://www.11467.com/dalian/co/39090.htm
大连网前科技有限公司,http://www.11467.com/dalian/co/37096.htm
传世工贸有限公司,http://www.11467.com/dalian/co/39086.htm
大连广纳礼品有限公司,http://www.11467.com/dalian/co/42319.htm
东莞市富胜印刷有限公司,http://www.11467.com/dongguan/co/144794.htm
昌源塑胶制品有限公司,http://www.11467.com/dongguan/co/147976.htm
东莞虎门青青礼品有限公司,http://www.11467.com/dongguan/co/348403.htm
东莞市博雅木制品有限公司营销部,http://www.11467.com/dongguan/co/147952.htm
东莞市极客库电子商务有限公司,http://www.11467.com/dongguan/co/351706.htm
东莞华富五金塑胶有限公司,http://www.11467.com/dongguan/co/20037.htm
东莞市浩克威日用品有限公司国内销售部,http://www.11467.com/dongguan/co/164845.htm
东莞市恒骏五金压铸制品有限公司,http://www.11467.com/dongguan/co/69362.htm
东莞市嘉锐科技有限公司,http://www.11467.com/dongguan/co/494016.htm
东莞市酷尔体育用品有限公司,http://www.11467.com/dongguan/co/351670.htm
东莞市茂通礼品有限公司,http://www.11467.com/dongguan/co/203294.htm
东莞市建达饰品有限公司,http://www.11467.com/dongguan/co/164144.htm
东莞市梦幻服饰有限公司,http://www.11467.com/dongguan/co/164605.htm
东莞市尚缔礼品有限公司,http://www.11467.com/dongguan/co/494988.htm
东莞市柏逊电子贸易有限公司,http://www.11467.com/dongguan/co/68127.htm
东莞市莞军礼品有限公司,http://www.11467.com/dongguan/co/494009.htm
东莞市诺天硅胶制品有限公司,http://www.11467.com/dongguan/co/478097.htm
东莞市万华电子有限公司,http://www.11467.com/dongguan/co/21524.htm
东莞市泽鸿礼品贸易有限公司,http://www.11467.com/dongguan/co/164574.htm
东莞市二鸣品牌策划有限公司,http://www.11467.com/dongguan/co/72453.htm
东莞市宏玖塑胶有限公司（业务部）,http://www.11467.com/dongguan/co/147978.htm
东莞市虹唯礼品有限公司,http://www.11467.com/dongguan/co/351079.htm
东莞宇浩礼品有限公司,http://www.11467.com/dongguan/co/507443.htm
东莞市万鑫隆制罐有限公司,http://www.11467.com/dongguan/co/23811.htm
东莞市天曼文化传播有限公司,http://www.11467.com/dongguan/co/164204.htm
东莞市久杰工艺品有限公司,http://www.11467.com/dongguan/co/164547.htm
东莞市广货直销玩具礼品有限公司,http://www.11467.com/dongguan/co/164860.htm
东莞市华美礼品有限公司,http://www.11467.com/dongguan/co/510649.htm
凱時高顧問(香港)有限公司KENCE DOMINA,http://www.11467.com/dongguan/co/164480.htm
东莞市卓铄贸易有限公司,http://www.11467.com/dongguan/co/147969.htm
東邦禮品有限公司EAST UNION GIFT C,http://www.11467.com/dongguan/co/351755.htm
广西陆川裕镁金属制品有限公司,http://www.11467.com/dongguan/co/199389.htm
东莞市展鹏塑胶饰品有限公司,http://www.11467.com/dongguan/co/164079.htm
御膳美耐皿有限公司,http://www.11467.com/dongguan/co/165334.htm
东莞市天睿工艺品有限公司,http://www.11467.com/dongguan/co/351753.htm
