广州市星晔礼品玩具有限公司,http://www.11467.com/dongguan/co/199456.htm
怡鑫体育有限公司,http://www.11467.com/dongguan/co/164190.htm
佩乐礼品精品有限公司,http://www.11467.com/dongguan/co/349297.htm
咏乐运动用品有限公司业务部,http://www.11467.com/dongguan/co/151475.htm
沃克塑胶玩具有限公司工程部,http://www.11467.com/dongguan/co/348709.htm
佛山市碧涛发帐篷限公司,http://www.11467.com/foshan/co/203207.htm
佛山市美彤礼品包装有限公司,http://www.11467.com/foshan/co/267328.htm
佛山市南海区万艺实业有限公司,http://www.11467.com/foshan/co/97274.htm
潮安县腾发不锈钢制品有限公司,http://www.11467.com/foshan/co/203220.htm
佛山市南海区九江联发五金制罐有限公司,http://www.11467.com/foshan/co/25329.htm
佛山市美加优电器五金有限公司,http://www.11467.com/foshan/co/267331.htm
佛山市品佳日用品有限公司,http://www.11467.com/foshan/co/203125.htm
佛山市依之美礼品有限公司,http://www.11467.com/foshan/co/266313.htm
广州市我扬实业有限公司,http://www.11467.com/foshan/co/221552.htm
佛山市南海正辉金属制品有限公司,http://www.11467.com/foshan/co/203123.htm
广东日美灯箱展示制作有限公司,http://www.11467.com/foshan/co/203111.htm
颖尚饰品有限公司,http://www.11467.com/foshan/co/203193.htm
佛山市顺德区旗胜礼品有限公司,http://www.11467.com/foshan/co/344085.htm
佛山市顺德区永康雨具制品有限公司销售部,http://www.11467.com/foshan/co/203056.htm
深圳市佳景有限公司,http://www.11467.com/foshan/co/203040.htm
佛山市顺德区伟政五金制品有限公司,http://www.11467.com/foshan/co/248046.htm
福州爱尚个性礼品有限公司,http://www.11467.com/fuzhou/co/133671.htm
福州礼部尚舒贸易有限公司,http://www.11467.com/fuzhou/co/136043.htm
福建聚明经贸有限公司,http://www.11467.com/fuzhou/co/135995.htm
福州瑞恒电子科技有限公司,http://www.11467.com/fuzhou/co/151640.htm
福州博思智业营销顾问有限公司,http://www.11467.com/fuzhou/co/136054.htm
福州宜家贸易有限公司销售部,http://www.11467.com/fuzhou/co/136154.htm
福州市鼓楼区杰辉贸易有限公司,http://www.11467.com/fuzhou/co/136088.htm
福州翰唐贸易有限公司,http://www.11467.com/fuzhou/co/136012.htm
福州市晋安区西林特贸易有限公司,http://www.11467.com/fuzhou/co/136017.htm
宣意礼品有限公司,http://www.11467.com/fuzhou/co/151241.htm
江西省环球陶瓷有限公司,http://www.11467.com/fuzhoushi/co/16459.htm
赣州市新起点工贸有限公司采购部,http://www.11467.com/ganzhou/co/26150.htm
新意思工贸有限公司,http://www.11467.com/ganzhou/co/26137.htm
安廸魔術（國際）企業公司ANDY MAGIC IN,http://www.11467.com/guangzhou/co/161652.htm
广州宝珀表业有限公司,http://www.11467.com/guangzhou/co/161946.htm
格琅頓香港表業有限公司GRANDEN HONGKO,http://www.11467.com/guangzhou/co/161831.htm
广州爱宜家居用品有限公司,http://www.11467.com/guangzhou/co/161857.htm
广州汇东皮具有限公司,http://www.11467.com/guangzhou/co/161565.htm
广东朗凌家庭用品有限公司,http://www.11467.com/guangzhou/co/82203.htm
广州鸿利达塑胶制品有限公司,http://www.11467.com/guangzhou/co/161688.htm
广州好生活精品有限公司,http://www.11467.com/guangzhou/co/131811.htm
广州缤纷时尚礼品有限公司,http://www.11467.com/guangzhou/co/162080.htm
广州飞鸟卡通服装有限公司,http://www.11467.com/guangzhou/co/131171.htm
福威表业公司,http://www.11467.com/guangzhou/co/161894.htm
广州古古皮具有限公司,http://www.11467.com/guangzhou/co/161743.htm
广州美阳珠宝首饰有限公司,http://www.11467.com/guangzhou/co/161619.htm
北京和兴泰达科贸有限公司,http://www.11467.com/guangzhou/co/345359.htm
广州可意文化用品有限公司市场部,http://www.11467.com/guangzhou/co/166207.htm
广州市辰隆礼品有限公司,http://www.11467.com/guangzhou/co/161827.htm
广州市皇臣商贸有限公司,http://www.11467.com/guangzhou/co/161666.htm
广州市创品嘉礼品有限公司,http://www.11467.com/guangzhou/co/161678.htm
广州市恒乾贸易有限公司,http://www.11467.com/guangzhou/co/44046.htm
广州市飞跃科技有限公司,http://www.11467.com/guangzhou/co/161311.htm
广州森和铁盒包装公司,http://www.11467.com/guangzhou/co/345385.htm
广州若元贸易有限公司,http://www.11467.com/guangzhou/co/482652.htm
广州居道金属制品有限公司,http://www.11467.com/guangzhou/co/345366.htm
广州好生活精品有限公司-广州一德路分部,http://www.11467.com/guangzhou/co/161924.htm
广州市汇达利电器有限公司,http://www.11467.com/guangzhou/co/428713.htm
广州市博尚贸易有限公司,http://www.11467.com/guangzhou/co/131161.htm
广州市全美大东科贸开发有限公司,http://www.11467.com/guangzhou/co/161880.htm
广州大象贸易有限公司,http://www.11467.com/guangzhou/co/161736.htm
广州市君雅礼品有限公司,http://www.11467.com/guangzhou/co/342197.htm
广州市广鞍手袋有限公司,http://www.11467.com/guangzhou/co/60656.htm
广州奇泰PU制品有限公司,http://www.11467.com/guangzhou/co/161222.htm
广州市国巨电子有限公司,http://www.11467.com/guangzhou/co/118718.htm
广州亮尚影象科技有限公司,http://www.11467.com/guangzhou/co/161379.htm
广州琥珀之恋有限公司,http://www.11467.com/guangzhou/co/161914.htm
广州市红点美妆有限公司,http://www.11467.com/guangzhou/co/161810.htm
广州市安南商贸有限公司,http://www.11467.com/guangzhou/co/131097.htm
广州思诗尼电子科技有限公司,http://www.11467.com/guangzhou/co/480446.htm
广州市冠盛实业有限公司,http://www.11467.com/guangzhou/co/161683.htm
广州市亿尚贸易有限公司,http://www.11467.com/guangzhou/co/161339.htm
广州市豪福文化用品有限公司,http://www.11467.com/guangzhou/co/49403.htm
广州星艺科技有限公司,http://www.11467.com/guangzhou/co/133702.htm
广州市信中创科技有限公司,http://www.11467.com/guangzhou/co/161059.htm
广州市慧博数码科技有限公司,http://www.11467.com/guangzhou/co/166132.htm
广州市澳司威贸易有限公司,http://www.11467.com/guangzhou/co/131126.htm
广州云程信息科技有限公司,http://www.11467.com/guangzhou/co/163857.htm
广州市阳晴服装有限公司,http://www.11467.com/guangzhou/co/161129.htm
广州翔亿工贸有限公司,http://www.11467.com/guangzhou/co/344903.htm
广州天基礼品公司,http://www.11467.com/guangzhou/co/340488.htm
廉江市皓天贸易有限公司,http://www.11467.com/guangzhou/co/345376.htm
广州市九九礼品有限公司,http://www.11467.com/guangzhou/co/161616.htm
广州智森精品有限公司 销售部,http://www.11467.com/guangzhou/co/340378.htm
广州市优雅生活用品有限公司,http://www.11467.com/guangzhou/co/160990.htm
广州中统网络科技有限公司,http://www.11467.com/guangzhou/co/127822.htm
广州市振华兆业皮具有限公司,http://www.11467.com/guangzhou/co/161724.htm
广州雅量展示牌有限公司,http://www.11467.com/guangzhou/co/480074.htm
广州粤淇彩球有限公司,http://www.11467.com/guangzhou/co/85389.htm
广州逸品文化传播有限公司,http://www.11467.com/guangzhou/co/163116.htm
广州市五娃贸易有限公司,http://www.11467.com/guangzhou/co/161760.htm
广州一片心商贸有限公司,http://www.11467.com/guangzhou/co/161060.htm
合众创意生活用品有限公司,http://www.11467.com/guangzhou/co/340652.htm
恒时表业贸易有限公司,http://www.11467.com/guangzhou/co/161650.htm
广州市裕曦贸易有限公司,http://www.11467.com/guangzhou/co/131182.htm
广州市源加贸易有限公司,http://www.11467.com/guangzhou/co/161355.htm
香港米可Mike表业有限公司,http://www.11467.com/guangzhou/co/131196.htm
香港致佳国际贸易广州分公司,http://www.11467.com/guangzhou/co/164937.htm
广州优士泰精品有限公司,http://www.11467.com/guangzhou/co/161080.htm
派菲科实业有限公司,http://www.11467.com/guangzhou/co/342093.htm
永盛玩具礼品公司,http://www.11467.com/guangzhou/co/161800.htm
秦皇岛居秀家居用品有限公司,http://www.11467.com/guangzhou/co/160991.htm
广州市斗彭皮具有限公司,http://www.11467.com/guangzhou/co/100659.htm
广州市发财眼罩精品有限公司,http://www.11467.com/guangzhou/co/162069.htm
广州时光手表有限公司,http://www.11467.com/guangzhou/co/340779.htm
华兴家居科技有限公司,http://www.11467.com/guangzhou/co/161456.htm
义乌铭辉日用品有限公司,http://www.11467.com/guangzhou/co/160944.htm
万基实业有限公司,http://www.11467.com/guangzhou/co/161364.htm
威丝曼文化传媒有限公司,http://www.11467.com/guangzhou/co/341878.htm
嘉昱皮具有限公司广州分公司,http://www.11467.com/guangzhou/co/131351.htm
名指美容美甲公司,http://www.11467.com/guangzhou/co/161761.htm
广州市礼尚往来贸易有限公司,http://www.11467.com/guangzhou/co/161851.htm
广州市俪奇贸易有限公司,http://www.11467.com/guangzhou/co/131111.htm
广州市英昊帽业有限公司,http://www.11467.com/guangzhou/co/67109.htm
广州馨沁贸易有限公司,http://www.11467.com/guangzhou/co/161832.htm
圣意气球玩具制品有限公司,http://www.11467.com/guangzhou/co/161621.htm
金丽饰品贸易有限公司,http://www.11467.com/guangzhou/co/161471.htm
沙拉外贸有限责任公司,http://www.11467.com/guangzhou/co/161842.htm
广州优派日用品有限公司,http://www.11467.com/guangzhou/co/161078.htm
杨氏外贸公司,http://www.11467.com/guilin/co/42136.htm
贵阳精丽尚礼品发展有限公司,http://www.11467.com/guiyang/co/69229.htm
贵阳凯尔电器有限公司,http://www.11467.com/guiyang/co/69310.htm
贵州红家居商贸有限公司,http://www.11467.com/guiyang/co/69326.htm
哈尔滨金璧钰礼品公司销售部,http://www.11467.com/haerbin/co/71966.htm
杭州飞点儿磁性剪纸有限公司,http://www.11467.com/hangzhou/co/311594.htm
杭州酷鹰五金制造有限公司,http://www.11467.com/hangzhou/co/214608.htm
杭州华泰绸庄有限公司,http://www.11467.com/hangzhou/co/25400.htm
杭州俊美装饰装潢有限公司,http://www.11467.com/hangzhou/co/222362.htm
杭州学联办公用品有限公司礼品部,http://www.11467.com/hangzhou/co/278190.htm
杭州乐自在实业有限公司,http://www.11467.com/hangzhou/co/222177.htm
杭州嘉遥贸易有限公司,http://www.11467.com/hangzhou/co/222154.htm
杭州精汇礼品有限公司,http://www.11467.com/hangzhou/co/193125.htm
杭州云中鹤礼品有限公司,http://www.11467.com/hangzhou/co/278391.htm
杭州唯民家居用品有限公司,http://www.11467.com/hangzhou/co/232488.htm
青岛德美达燃气冰箱有限公司,http://www.11467.com/hangzhou/co/222498.htm
杭州钰钦贸易有限公司,http://www.11467.com/hangzhou/co/112601.htm
杭州桐石丝绸有限公司,http://www.11467.com/hangzhou/co/224544.htm
绍兴奇福玩具有限公司,http://www.11467.com/hangzhou/co/214750.htm
安徽凯乐气球商贸有限公司,http://www.11467.com/hefei/co/84811.htm
安徽翔瑞工艺品有限公司,http://www.11467.com/hefei/co/82546.htm
因耐特网络科技有限公司,http://www.11467.com/hefei/co/84899.htm
折叠生活家居生活用品销售公司,http://www.11467.com/hefei/co/85127.htm
安徽皖务尚志商业发展有限公司市场部,http://www.11467.com/hefei/co/85166.htm
淮安大唐礼品公司,http://www.11467.com/huaian/co/35799.htm
淮南市森朗商贸有限公司,http://www.11467.com/huainan/co/21539.htm
晋江市雨立方伞业有限公司,http://www.11467.com/huhehaote/co/33333.htm
嘉美百货公司,http://www.11467.com/huizhou/co/60815.htm
惠兰商贸有限公司,http://www.11467.com/huizhou/co/60862.htm
惠州弘一礼品公司,http://www.11467.com/huizhou/co/97488.htm
惠州市德威贸易有限公司,http://www.11467.com/huizhou/co/60813.htm
惠州市鲲鹏工艺品有限公司,http://www.11467.com/huizhou/co/60840.htm
湖州阳和纺织品有限公司,http://www.11467.com/huzhou/co/52347.htm
江西省吉安市红双喜文化传播有限公司,http://www.11467.com/jian/co/15558.htm
江门市东艺宫灯有限公司,http://www.11467.com/jiangmen/co/84743.htm
揭阳市旗丰生活用品有限公司,http://www.11467.com/jieyang/co/22130.htm
百利实业香港有限公司,http://www.11467.com/jieyang/co/31449.htm
济南金奖华光日化有限公司,http://www.11467.com/jinan/co/41081.htm
济南动力科技电子商务有限公司,http://www.11467.com/jinan/co/72519.htm
济南新奇特饰品工艺品有限公司,http://www.11467.com/jinan/co/72496.htm
济南盛桦商贸有限公司,http://www.11467.com/jinan/co/97145.htm
济南佳永日用品有限公司,http://www.11467.com/jinan/co/72556.htm
济南诗如意经贸有限公司,http://www.11467.com/jinan/co/72508.htm
济南腾福商贸有限公司,http://www.11467.com/jinan/co/72525.htm
济南至纯酒业有限公司,http://www.11467.com/jinan/co/97149.htm
上海希瑞日用品有限公司,http://www.11467.com/jinan/co/68617.htm
景德镇市联力礼品陶瓷有限公司,http://www.11467.com/jingdezhen/co/10484.htm
荆州市虎渡河传媒有限公司,http://www.11467.com/jingzhou/co/27609.htm
金华市筷速制造工艺品有限公司,http://www.11467.com/jinhua/co/69244.htm
义乌市卡哇依文化用品有限公司,http://www.11467.com/jinhua/co/79179.htm
义乌鑫奇特外贸有限公司,http://www.11467.com/jinhua/co/67580.htm
金华市筷乐制造工艺品有限公司,http://www.11467.com/jinhua/co/69249.htm
金华市银湖雨具有限公司,http://www.11467.com/jinhua/co/57061.htm
金华市永涛工艺相框有限公司,http://www.11467.com/jinhua/co/67571.htm
义乌市寰创工艺礼品有限公司,http://www.11467.com/jinhua/co/126046.htm
金华市天朝极地工艺品有限公司,http://www.11467.com/jinhua/co/69126.htm
永康市集成日用品有限责任公司,http://www.11467.com/jinhua/co/69199.htm
浙江佳思珠宝有限公司,http://www.11467.com/jinhua/co/124598.htm
金华市世美日用品有限公司,http://www.11467.com/jinhua/co/68026.htm
永康市匡迪工贸有限公司(内销部）,http://www.11467.com/jinhua/co/69742.htm
浙江卡通乐购园精品贸易公司,http://www.11467.com/jinhua/co/69169.htm
浙江卡通乐购园精品贸易公司,http://www.11467.com/jinhua/co/69169.htm
芙蓉阁特色工艺品有限公司(驻义乌办事处),http://www.11467.com/jinhua/co/126468.htm
永康市真善美工贸有限公司,http://www.11467.com/jinhua/co/69229.htm
义乌市文翔眼镜有限公司,http://www.11467.com/jinhua/co/69079.htm
双江贸易有限公司,http://www.11467.com/jinhua/co/69240.htm
好乐百货有限公司,http://www.11467.com/jinhua/co/69090.htm
永康市鸿康工贸有限公司,http://www.11467.com/jinhua/co/69232.htm
浙江永康子宁实业有限公司,http://www.11467.com/jinhua/co/67585.htm
温州明发光学塑料有限公司,http://www.11467.com/jinhua/co/69153.htm
义乌传长工艺品有限公司,http://www.11467.com/jinhua/co/128296.htm
义乌市宸焕日用品有限公司,http://www.11467.com/jinhua/co/69057.htm
金华市百利塑胶有限公司,http://www.11467.com/jinhua/co/67563.htm
金华易高丽工艺品有限公司,http://www.11467.com/jinhua/co/67627.htm
云南元泰昌经贸有限公司元泰昌普洱茶行,http://www.11467.com/kunming/co/110507.htm
临沂银穗商贸有限公司,http://www.11467.com/linyi/co/57044.htm
丹东市广缘科技有限公司,http://www.11467.com/dandong/co/45275.htm
广州市飞腾骏业礼品制造有限公司,http://www.11467.com/guangzhou/co/161585.htm
江门市天域展示器材有限公司,http://www.11467.com/jiangmen/co/82250.htm
旺科电脑有限公司,http://www.11467.com/zhuhai/co/86113.htm
苍南县四海工艺礼品有限公司,http://www.11467.com/jinhua/co/81770.htm
汕头市乐立方玩具实业有限公司,http://www.11467.com/shantou/co/133904.htm
汕头市龙湖区银河星文具有限公司,http://www.11467.com/shantou/co/2114.htm
东莞市洁康超声波设备有限公司,http://www.11467.com/dongguan/co/128402.htm
广州市枫采贸易有限公司,http://www.11467.com/guangzhou/co/66782.htm
西安际华三五一一家纺有限公司,http://www.11467.com/xian/co/52300.htm
东莞市闪亮电子科技有限公司,http://www.11467.com/dongguan/co/414238.htm
东莞市巨鼎硅胶制品有限公司,http://www.11467.com/dongguan/co/164219.htm
东莞市睿恒实业有限公司,http://www.11467.com/dongguan/co/497599.htm
深圳市三和晟电子有限公司,http://www.11467.com/shenzhen/co/224395.htm
揭阳市恒胜玩具有限公司,http://www.11467.com/jieyang/co/29758.htm
深圳市雷诺达钟表有限公司,http://www.11467.com/shenzhen/co/224910.htm
灵璧县灵石坊砭磬石开发有限公司,http://www.11467.com/suzhoushi/co/19172.htm
惠州龙为科技有限公司,http://www.11467.com/huizhou/co/97258.htm
佛山郭氏稳泰卷尺有限公司,http://www.11467.com/foshan/co/243894.htm
东海县丽安水晶有限公司,http://www.11467.com/lianyungang/co/44680.htm
深圳市怡康科技有限公司,http://www.11467.com/shenzhen/co/223940.htm
中山市拉菲酷电器有限公司,http://www.11467.com/zhongshan/co/117873.htm
苏州益节智能科技有限公司,http://www.11467.com/suzhou/co/223889.htm
深圳市三人行科技有限公司,http://www.11467.com/shenzhen/co/14644.htm
深圳市天美意科技有限公司,http://www.11467.com/shenzhen/co/27945.htm
广州敬诚电子科技有限公司,http://www.11467.com/guangzhou/co/114176.htm
佛山市仁品家居用品有限公司,http://www.11467.com/foshan/co/192526.htm
东莞市华博绳袋有限公司,http://www.11467.com/dongguan/co/164116.htm
东莞市徽道硅橡胶制品有限公司,http://www.11467.com/dongguan/co/414199.htm
苍南赛雅工艺礼品有限公司,http://www.11467.com/baoding/co/91434.htm
长沙市雅德陶瓷有限公司,http://www.11467.com/changsha/co/104513.htm
泛亚信息技术江苏有限公司,http://www.11467.com/wuxi/co/207921.htm
盐城市颐达工艺品有限公司,http://www.11467.com/yancheng/co/58028.htm
广州亮节电子科技有限公司,http://www.11467.com/guangzhou/co/161380.htm
广州市力昇电子科技有限公司,http://www.11467.com/guangzhou/co/90143.htm
上海霞影实业有限公司,http://www.11467.com/shanghai/co/946818.htm
东莞市瑞辉塑胶制品有限公司,http://www.11467.com/dongguan/co/164160.htm
东莞市富昇工艺制品有限公司,http://www.11467.com/dongguan/co/164519.htm
深圳市好稀奇创意产品有限公司,http://www.11467.com/shenzhen/co/763209.htm
长沙天狮烟具有限公司,http://www.11467.com/changsha/co/82144.htm
东莞市佳骋纺织品有限公司,http://www.11467.com/dongguan/co/153863.htm
广州市创以晨电子科技有限公司,http://www.11467.com/guangzhou/co/429581.htm
浙江辉达电子有限公司,http://www.11467.com/jinzhou/co/51128.htm
深圳市品冠达数码科技有限公司,http://www.11467.com/shenzhen/co/725002.htm
东莞市松菱实业有限公司,http://www.11467.com/dongguan/co/206804.htm
东莞市三赢贸易有限公司,http://www.11467.com/dongguan/co/411847.htm
东莞市美佳环保材料有限公司,http://www.11467.com/dongguan/co/413906.htm
东莞市鼎峰硅胶制品有限公司,http://www.11467.com/dongguan/co/509213.htm
郑州鼎盛广告制品有限公司,http://www.11467.com/zhengzhou/co/170015.htm
长沙典雅环保科技有限公司,http://www.11467.com/changsha/co/89979.htm
苍南县悦美工艺礼品有限公司,http://www.11467.com/baoding/co/91235.htm
深圳市赛杰电子有限公司,http://www.11467.com/shenzhen/co/140812.htm
深圳市新派产品设计开发有限公司,http://www.11467.com/shenzhen/co/45079.htm
扬州礼购商贸有限公司,http://www.11467.com/yangzhou/co/89711.htm
福建省德化县三星陶瓷有限公司,http://www.11467.com/quanzhou/co/130216.htm
广州星晖展览有限公司,http://www.11467.com/guangzhou/co/433996.htm
广州市千博网络科技有限公司,http://www.11467.com/guangzhou/co/434125.htm
青岛奇迹网络科技有限公司,http://www.11467.com/qingdao/co/152080.htm
桐城市龙港万能彩印有限公司,http://www.11467.com/anqing/co/27673.htm
常州思博特塑胶科技有限公司,http://www.11467.com/changzhou/co/95617.htm
东莞市百顺硅塑胶制品有限公司,http://www.11467.com/dongguan/co/414017.htm
东莞市晶富美有机玻璃制品有限公司,http://www.11467.com/dongguan/co/470678.htm
佛山市南海区中锋鞋业有限公司,http://www.11467.com/foshan/co/204971.htm
广州市昌成陶瓷有限公司,http://www.11467.com/guangzhou/co/131186.htm
深圳市百乐礼品有限公司,http://www.11467.com/shenzhen/co/224627.htm
深圳市汉高科实业发展有限公司,http://www.11467.com/shenzhen/co/224039.htm
深圳市金福嘉工艺品有限公司,http://www.11467.com/shenzhen/co/728999.htm
长沙欣茂文化传播有限公司,http://www.11467.com/changsha/co/104476.htm
广州市奥宇电子科技有限公司,http://www.11467.com/guangzhou/co/131106.htm
广州火杰箱包有限公司,http://www.11467.com/guangzhou/co/161505.htm
上海泽楷文具礼品有限公司,http://www.11467.com/nanchang/co/82966.htm
汕头市和兴盛文具实业有限公司,http://www.11467.com/shantou/co/135303.htm
丽水市博人电子科技有限公司,http://www.11467.com/lishui/co/1412.htm
桐乡市培得福蚕丝家纺有限公司,http://www.11467.com/jiaxing/co/81005.htm
杭州富阳迈瑞恩工艺品有限公司,http://www.11467.com/hangzhou/co/98095.htm
广州永杰热转印材料有限公司,http://www.11467.com/guangzhou/co/207757.htm
广州市达芬奇实业有限公司,http://www.11467.com/guangzhou/co/131079.htm
南京万欧信息技术咨询有限公司,http://www.11467.com/nanjing/co/60498.htm
佛山市顺德区金厨电器有限公司,http://www.11467.com/foshan/co/193271.htm
义乌市玖仑贸易有限公司,http://www.11467.com/jinhua/co/121751.htm
武义佰腾贸易有限公司,http://www.11467.com/jinzhou/co/49605.htm
福州市新秋龙工艺品有限公司,http://www.11467.com/fuzhou/co/161413.htm
广州超亮贸易有限公司,http://www.11467.com/guangzhou/co/431412.htm
广州市千印表业有限公司,http://www.11467.com/guangzhou/co/429054.htm
广州维尼达展览服务有限公司,http://www.11467.com/guangzhou/co/455681.htm
昆明牧牛人皮具有限公司,http://www.11467.com/kunming/co/102066.htm
惠州美熙日用品有限公司,http://www.11467.com/huizhou/co/81772.htm
广东时尚元素生活用品有限公司,http://www.11467.com/shantou/co/117835.htm
广州欣胜日用品有限公司,http://www.11467.com/guangzhou/co/112790.htm
广州奥奇无纺布有限公司,http://www.11467.com/guangzhou/co/429963.htm
金华君博工贸有限公司,http://www.11467.com/guangzhou/co/495939.htm
广州市巴斯迪日用品有限公司,http://www.11467.com/guangzhou/co/430755.htm
杭州昌达制罐工具有限公司,http://www.11467.com/hangzhou/co/117519.htm
上海翔龙文具用品有限公司,http://www.11467.com/guangzhou/co/368343.htm
广州市骆宾王皮具有限公司,http://www.11467.com/guangzhou/co/195277.htm
南京控疾日用品有限公司,http://www.11467.com/nanjing/co/56903.htm
福建省德化县世博陶瓷有限公司,http://www.11467.com/quanzhou/co/130214.htm
深圳市同益欣科技有限公司,http://www.11467.com/shenzhen/co/723092.htm
汕头市澄海区鹏成玩具有限公司,http://www.11467.com/shantou/co/140901.htm
深圳市奥捷电器有限公司,http://www.11467.com/shenzhen/co/145231.htm
深圳市博鑫源工艺品有限公司,http://www.11467.com/shenzhen/co/150544.htm
深圳市凌云龙实业发展有限公司,http://www.11467.com/shenzhen/co/149292.htm
深圳市物美电子有限公司,http://www.11467.com/shenzhen/co/224537.htm
深圳市弘尚电子有限公司,http://www.11467.com/shenzhen/co/326592.htm
深圳市驰锋电子有限公司,http://www.11467.com/shenzhen/co/723500.htm
汕头市澄海区西琪塑胶制品有限公司,http://www.11467.com/shantou/co/117861.htm
深圳市赛维纳实业有限公司,http://www.11467.com/shenzhen/co/224148.htm
深圳市辰科电子有限公司,http://www.11467.com/shenzhen/co/137152.htm
深圳市九一贸易有限公司,http://www.11467.com/shenzhen/co/725795.htm
深圳市美恩电子有限公司,http://www.11467.com/shenzhen/co/179646.htm
深圳市宏格威科技有限公司,http://www.11467.com/shenzhen/co/625182.htm
深圳市科邦通电子有限公司,http://www.11467.com/shenzhen/co/224748.htm
深圳市森美鸿电子有限公司,http://www.11467.com/shenzhen/co/239617.htm
深圳市华泳盛科技有限公司,http://www.11467.com/shenzhen/co/277349.htm
深圳市红土地实业有限公司,http://www.11467.com/shenzhen/co/178488.htm
深圳市华正纺织品有限公司,http://www.11467.com/shenzhen/co/334774.htm
深圳市康美迪科技有限公司,http://www.11467.com/shenzhen/co/224269.htm
深圳市铭宇达礼品制造有限公司,http://www.11467.com/shenzhen/co/724959.htm
深圳市鑫源祥科技有限公司,http://www.11467.com/shenzhen/co/723199.htm
深圳市晶耀科技有限公司,http://www.11467.com/shenzhen/co/196847.htm
深圳市精品尚电子科技有限公司,http://www.11467.com/shenzhen/co/224755.htm
深圳市迪优科电子技术有限公司,http://www.11467.com/shenzhen/co/157897.htm
深圳市八骏科技有限公司,http://www.11467.com/shenzhen/co/139458.htm
深圳市广兴展手袋有限公司,http://www.11467.com/shenzhen/co/566390.htm
