广州市皓宜贸易有限公司,http://www.11467.com/guangzhou/co/142197.htm
广州市呈祥工艺品有限公司,http://www.11467.com/guangzhou/co/162068.htm
广州市巴斯迪日用品有限公司,http://www.11467.com/guangzhou/co/430755.htm
杭州杭画扇庄有限公司,http://www.11467.com/hangzhou/co/222495.htm
杭州圣贤礼品有限公司,http://www.11467.com/hangzhou/co/222395.htm
杭州无忧家居有限公司,http://www.11467.com/hangzhou/co/222262.htm
杭州欧莱特展示设备有限公司,http://www.11467.com/hangzhou/co/222442.htm
杭州大有医疗器械有限公司,http://www.11467.com/hangzhou/co/222485.htm
黑龙江省哈尔滨市程峰新奇特产品总汇有限公司,http://www.11467.com/haerbin/co/42760.htm
南昌隔世水印流行饰品有限公司,http://www.11467.com/guangzhou/co/160937.htm
广州市励宏实业有限公司,http://www.11467.com/guangzhou/co/161547.htm
广州市兴隆电子精品有限公司,http://www.11467.com/guangzhou/co/161543.htm
遂溪绿叶橡胶制品有限公司,http://www.11467.com/guangzhou/co/161183.htm
青岛市青冠啤酒有限公司,http://www.11467.com/guangzhou/co/161298.htm
广州顺利达气模制品有限公司,http://www.11467.com/guangzhou/co/161189.htm
广州源通日用品有限公司,http://www.11467.com/guangzhou/co/161063.htm
杭州富阳迈瑞恩工艺品有限公司,http://www.11467.com/hangzhou/co/98095.htm
广州永杰热转印材料有限公司,http://www.11467.com/guangzhou/co/207757.htm
优乐创意精品有限公司,http://www.11467.com/guangzhou/co/161370.htm
广州维尼达展览服务有限公司,http://www.11467.com/guangzhou/co/455681.htm
广州艺时代展览策划有限公司,http://www.11467.com/guangzhou/co/343992.htm
广州欣胜日用品有限公司,http://www.11467.com/guangzhou/co/112790.htm
广州市粤昌月历有限公司,http://www.11467.com/guangzhou/co/345446.htm
广州市骆宾王皮具有限公司,http://www.11467.com/guangzhou/co/195277.htm
上海翔龙文具用品有限公司,http://www.11467.com/guangzhou/co/368343.htm
金华君博工贸有限公司,http://www.11467.com/guangzhou/co/495939.htm
中国浙江桐庐分水创元文具制造有限公司业务二部,http://www.11467.com/hangzhou/co/222203.htm
杭州知更鸟贸易有限公司,http://www.11467.com/hangzhou/co/222147.htm
杭州腾飞日用品有限公司,http://www.11467.com/hangzhou/co/222189.htm
杭州尚爱贸易有限公司,http://www.11467.com/hangzhou/co/222251.htm
衡阳市升元贸易有限公司,http://www.11467.com/hengyang/co/24995.htm
深圳市高岛科技有限公司,http://www.11467.com/huizhou/co/60796.htm
惠州市正奇工艺精品开发有限公司,http://www.11467.com/huizhou/co/52769.htm
江门市蓬江区荷塘嘉升雨具有限公司,http://www.11467.com/jiangmen/co/84447.htm
江门市龙图腾电子科技有限公司,http://www.11467.com/jiangmen/co/84466.htm
新会琥珀烛艺有限公司,http://www.11467.com/jiangmen/co/84434.htm
桐乡市培得福蚕丝家纺有限公司,http://www.11467.com/jiaxing/co/81005.htm
惠州市欣艺工艺礼品有限公司,http://www.11467.com/huizhou/co/60786.htm
江西省景德镇尚品陶瓷有限公司,http://www.11467.com/jingdezhen/co/10486.htm
景德镇市君海礼品陶瓷有限责任公司,http://www.11467.com/jingdezhen/co/10460.htm
景德镇市金龙瓷业有限公司,http://www.11467.com/jingdezhen/co/10488.htm
揭阳市百顺塑胶有限公司,http://www.11467.com/jieyang/co/22115.htm
惠州世通皮具制品有限公司,http://www.11467.com/huizhou/co/5956.htm
海宁市乐博橡塑有限公司,http://www.11467.com/jiaxing/co/123640.htm
惠州美熙日用品有限公司,http://www.11467.com/huizhou/co/81772.htm
杭州昌达制罐工具有限公司,http://www.11467.com/hangzhou/co/117519.htm
福建省泉州市兴艺礼品有限公司,http://www.11467.com/quanzhou/co/95399.htm
上海泽楷文具礼品有限公司,http://www.11467.com/nanchang/co/82966.htm
永贤科技有限责任公司,http://www.11467.com/nanchong/co/24165.htm
广西南宁翔耀电子科技有限公司,http://www.11467.com/nanning/co/70215.htm
莆田美锐电子礼品公司,http://www.11467.com/putian/co/24980.htm
福建省莆田市盛世经典文化传播有限公司,http://www.11467.com/putian/co/12756.htm
福建大鸿发电子有限公司,http://www.11467.com/putian/co/24943.htm
昆明泰庚言科技有限责任公司茶叶分公司,http://www.11467.com/kunming/co/47655.htm
丽水市博人电子科技有限公司,http://www.11467.com/lishui/co/1412.htm
洛阳功有道贸易有限公司,http://www.11467.com/luoyang/co/49911.htm
绵阳雨虹礼品销售有限公司,http://www.11467.com/mianyang/co/33732.htm
福建泉州市恒昌帐篷户外用品有限公司,http://www.11467.com/quanzhou/co/95389.htm
青岛集雅斋商贸有限公司,http://www.11467.com/qingdao/co/105740.htm
青岛维特利工贸有限公司,http://www.11467.com/qingdao/co/105721.htm
福建省南平市金罗商贸有限公司,http://www.11467.com/nanping/co/30993.htm
南京万欧信息技术咨询有限公司,http://www.11467.com/nanjing/co/60498.htm
武义佰腾贸易有限公司,http://www.11467.com/jinzhou/co/49605.htm
昆明牧牛人皮具有限公司,http://www.11467.com/kunming/co/102066.htm
宁波海曙区艳丽多家纺有限公司,http://www.11467.com/ningbo/co/76514.htm
青岛金宇不锈钢制品有限公司,http://www.11467.com/qingdao/co/6470.htm
南京控疾日用品有限公司,http://www.11467.com/nanjing/co/56903.htm
永康市福尔达杯业有限公司,http://www.11467.com/jinhua/co/69118.htm
福建省德化县世博陶瓷有限公司,http://www.11467.com/quanzhou/co/130214.htm
宁波凌志玩具制造有限公司,http://www.11467.com/ningbo/co/47352.htm
青岛亲依下母婴用品有限公司,http://www.11467.com/qingdao/co/76180.htm
汕头宝马工艺制品厂有限公司,http://www.11467.com/shantou/co/31380.htm
三明市美家塑胶制品有限公司,http://www.11467.com/sanming/co/30713.htm
汕头市和兴盛文具实业有限公司,http://www.11467.com/shantou/co/135303.htm
深圳市奥捷电器有限公司,http://www.11467.com/shenzhen/co/145231.htm
汕头市南北祥塑胶制品有限公司,http://www.11467.com/shantou/co/133928.htm
绍兴宏博礼品有限公司,http://www.11467.com/shaoxing/co/43925.htm
沈阳万代盛商贸有限公司,http://www.11467.com/shenyang/co/55084.htm
汕头市和盛隆塑胶有限公司,http://www.11467.com/shantou/co/133897.htm
泉州恒泰包袋有限公司,http://www.11467.com/quanzhou/co/95401.htm
泉州飞达礼品有限公司,http://www.11467.com/quanzhou/co/107487.htm
福建省建瓯市圆角密胺塑料制品有限公司,http://www.11467.com/quanzhou/co/95346.htm
泉州市永春华亿艺品有限公司,http://www.11467.com/quanzhou/co/95385.htm
沈阳东辰日用品实业有限公司,http://www.11467.com/shenyang/co/70296.htm
汕头市澄海区西琪塑胶制品有限公司,http://www.11467.com/shantou/co/117861.htm
深圳市辰科电子有限公司,http://www.11467.com/shenzhen/co/137152.htm
深圳市达凯电子有限公司,http://www.11467.com/shenzhen/co/15319.htm
深圳市迪优科电子技术有限公司,http://www.11467.com/shenzhen/co/157897.htm
深圳市晶耀科技有限公司,http://www.11467.com/shenzhen/co/196847.htm
深圳市精品尚电子科技有限公司,http://www.11467.com/shenzhen/co/224755.htm
广东时尚元素生活用品有限公司,http://www.11467.com/shantou/co/117835.htm
深圳酷迅科技有限公司,http://www.11467.com/shenzhen/co/255534.htm
上虞市苏杭伞业有限公司,http://www.11467.com/shaoxing/co/75742.htm
深圳市八骏科技有限公司,http://www.11467.com/shenzhen/co/139458.htm
深圳市广兴展手袋有限公司,http://www.11467.com/shenzhen/co/566390.htm
深圳市同益欣科技有限公司,http://www.11467.com/shenzhen/co/723092.htm
深圳市建州电子科技有限公司,http://www.11467.com/shenzhen/co/58275.htm
深圳市博鑫源工艺品有限公司,http://www.11467.com/shenzhen/co/150544.htm
深圳市凌云龙实业发展有限公司,http://www.11467.com/shenzhen/co/149292.htm
深圳市物美电子有限公司,http://www.11467.com/shenzhen/co/224537.htm
深圳市弘尚电子有限公司,http://www.11467.com/shenzhen/co/326592.htm
深圳市康乐旺贸易有限公司,http://www.11467.com/shenzhen/co/179461.htm
深圳市新岭南电子科技有限公司,http://www.11467.com/shenzhen/co/519490.htm
深圳市赛维纳实业有限公司,http://www.11467.com/shenzhen/co/224148.htm
深圳市驰锋电子有限公司,http://www.11467.com/shenzhen/co/723500.htm
深圳市九一贸易有限公司,http://www.11467.com/shenzhen/co/725795.htm
深圳市综艺达电子有限公司,http://www.11467.com/shenzhen/co/225012.htm
深圳泰格康科技有限公司,http://www.11467.com/shenzhen/co/723405.htm
深圳市宇讯昌电子有限公司,http://www.11467.com/shenzhen/co/813190.htm
深圳市科邦通电子有限公司,http://www.11467.com/shenzhen/co/224748.htm
深圳市宏格威科技有限公司,http://www.11467.com/shenzhen/co/625182.htm
深圳市美恩电子有限公司,http://www.11467.com/shenzhen/co/179646.htm
深圳市华瑞申科技有限公司,http://www.11467.com/shenzhen/co/769854.htm
深圳市森美鸿电子有限公司,http://www.11467.com/shenzhen/co/239617.htm
深圳市华泳盛科技有限公司,http://www.11467.com/shenzhen/co/277349.htm
深圳市红土地实业有限公司,http://www.11467.com/shenzhen/co/178488.htm
深圳市健怡康科技有限公司,http://www.11467.com/shenzhen/co/216588.htm
深圳市华正纺织品有限公司,http://www.11467.com/shenzhen/co/334774.htm
深圳市康美迪科技有限公司,http://www.11467.com/shenzhen/co/224269.htm
深圳市铭宇达礼品制造有限公司,http://www.11467.com/shenzhen/co/724959.htm
深圳市鑫源祥科技有限公司,http://www.11467.com/shenzhen/co/723199.htm
深圳市新华丰钟表有限公司,http://www.11467.com/shenzhen/co/224456.htm
深圳市亚迪表业有限公司,http://www.11467.com/shenzhen/co/152505.htm
深圳市永峰陶瓷有限公司,http://www.11467.com/shenzhen/co/51861.htm
深圳市联华龙展示制品有限公司,http://www.11467.com/shenzhen/co/254096.htm
深圳市合浦电子有限公司,http://www.11467.com/shenzhen/co/768706.htm
深圳市张家实业有限公司,http://www.11467.com/shenzhen/co/22179.htm
深圳市珍爱世佳贸易有限公司,http://www.11467.com/shenzhen/co/224226.htm
深圳市鑫永华泰科技有限公司,http://www.11467.com/shenzhen/co/626784.htm
深圳市派乐家居礼品有限公司,http://www.11467.com/shenzhen/co/723094.htm
深圳市炫舞电子有限公司,http://www.11467.com/shenzhen/co/225414.htm
深圳市恒正电子有限公司,http://www.11467.com/shenzhen/co/16627.htm
深圳市仁裕和科技有限公司,http://www.11467.com/shenzhen/co/723283.htm
深圳市群益塑胶电子有限公司,http://www.11467.com/shenzhen/co/223988.htm
深圳市瑞美康科技有限公司,http://www.11467.com/shenzhen/co/765378.htm
深圳市杰思伟创科技有限公司,http://www.11467.com/shenzhen/co/769409.htm
深圳市金伯爵钟表有限公司,http://www.11467.com/shenzhen/co/152616.htm
深圳市明卓科技有限公司,http://www.11467.com/shenzhen/co/186425.htm
深圳市升昕顺饰品有限公司,http://www.11467.com/shenzhen/co/224150.htm
深圳市新晨兴科技有限公司,http://www.11467.com/shenzhen/co/115742.htm
深圳市梦燕科技有限公司,http://www.11467.com/shenzhen/co/223831.htm
深圳市兴宏升塑胶电子有限公司,http://www.11467.com/shenzhen/co/145913.htm
温州久久不锈钢制品有限公司,http://www.11467.com/wenzhou/co/2239.htm
武汉诗发绣品工艺有限公司,http://www.11467.com/wuhan/co/70616.htm
厦门欣之源贸易有限公司,http://www.11467.com/xiamen/co/65605.htm
厦门伟荣礼品制造有限公司,http://www.11467.com/xiamen/co/65600.htm
泰安市永顺食品有限公司,http://www.11467.com/taian/co/35187.htm
苏州容易箱包服饰有限公司,http://www.11467.com/suzhou/co/243747.htm
泰州市高港区康泰钟表有限公司,http://www.11467.com/taizhoushi/co/32607.htm
潍坊旺之源经贸有限公司,http://www.11467.com/weifang/co/80556.htm
潍坊远大气模庆典设备有限公司,http://www.11467.com/weifang/co/80543.htm
潍坊雅士礼品有限公司,http://www.11467.com/weifang/co/60357.htm
苍南县鑫威印业有限公司,http://www.11467.com/wenzhou/co/189267.htm
梅花伞业股份有限公司,http://www.11467.com/xiamen/co/65561.htm
安徽卓越有机玻璃制品有限公司,http://www.11467.com/wuhu/co/20881.htm
鑫丰电器礼品有限公司,http://www.11467.com/shijiazhuang/co/78432.htm
石家庄市德丰塑胶制品有限公司,http://www.11467.com/shijiazhuang/co/66843.htm
苏州多普贸易有限公司,http://www.11467.com/suzhou/co/312526.htm
温州美特尔工艺品有限公司,http://www.11467.com/wenzhou/co/129598.htm
台州市黄岩天韵塑胶有限公司,http://www.11467.com/taizhou/co/82189.htm
台州市黄岩英利塑业有限公司,http://www.11467.com/taizhou/co/52808.htm
温州万盛烟具有限公司,http://www.11467.com/wenzhou/co/75635.htm
温州市瓯南印业有限公司,http://www.11467.com/wenzhou/co/102917.htm
苍南县万利达制袋有限公司,http://www.11467.com/wenzhou/co/136116.htm
苍南县翱鹰工艺礼品制造有限公司,http://www.11467.com/wenzhou/co/129742.htm
浙江黄岩佳欣塑料有限公司,http://www.11467.com/taizhou/co/7548.htm
台州市云博日用品有限公司,http://www.11467.com/taizhou/co/82147.htm
盐城雅儒商贸有限公司,http://www.11467.com/yancheng/co/60882.htm
株洲市亨大贸易有限责任公司,http://www.11467.com/zhuzhou/co/26518.htm
淄博国茂陶瓷有限公司,http://www.11467.com/zibo/co/81984.htm
珠海市英雄体育工艺奖品有限公司,http://www.11467.com/zhuhai/co/68396.htm
北京博瑞利泉商贸有限公司,http://www.11467.com/beijing/co/670530.htm
北京风雪清商贸有限公司,http://www.11467.com/beijing/co/177674.htm
厦门市隆丰隆压克力制品有限公司,http://www.11467.com/xiamen/co/65579.htm
襄樊宏伟航空器有限责任公司,http://www.11467.com/xiangfan/co/28376.htm
湖北思博贸易有限公司,http://www.11467.com/xianning/co/12700.htm
阳江市臻阳工贸有限公司,http://www.11467.com/yangjiang/co/13312.htm
阳江市秦远五金塑料制品有限公司,http://www.11467.com/yangjiang/co/14606.htm
阳江市展业五金制品有限公司,http://www.11467.com/yangjiang/co/13303.htm
漳州市龙文区创兴塑胶制品有限公司,http://www.11467.com/zhangzhou/co/37277.htm
河南喜悦水晶有限公司,http://www.11467.com/zhengzhou/co/127564.htm
镇江程锦百货商贸有限公司,http://www.11467.com/zhenjiang/co/51765.htm
郑州猎豹手工皮具有限公司,http://www.11467.com/zhengzhou/co/127579.htm
北京安雅汇家居用品有限责任公司,http://www.11467.com/beijing/co/303917.htm
镇江市业峰雨伞有限公司,http://www.11467.com/zhenjiang/co/47013.htm
中山市永衡日用制品有限公司,http://www.11467.com/zhongshan/co/53566.htm
郑州斯多瑞表业有限公司,http://www.11467.com/zhengzhou/co/102299.htm
邢台欧硕商贸有限公司,http://www.11467.com/xintai/co/39144.htm
山东省淄博市钟生杯业有限公司,http://www.11467.com/zibo/co/82250.htm
北京东方艺轩金属工艺品有限公司,http://www.11467.com/beijing/co/394431.htm
上海辉月展览展示服务有限公司,http://www.11467.com/shanghai/co/734727.htm
尚都百货批发贸易有限公司,http://www.11467.com/beijing/co/321073.htm
北京太阳石恒信电子科技有限公司,http://www.11467.com/beijing/co/214202.htm
北京时代先锋商贸有限公司,http://www.11467.com/beijing/co/305861.htm
北京漪宏亭商贸有限公司,http://www.11467.com/beijing/co/305857.htm
北京新广汇文化发展有限公司,http://www.11467.com/beijing/co/305882.htm
上海美昌工艺品有限公司,http://www.11467.com/beijing/co/305880.htm
福建省三喜珠宝首饰有限公司,http://www.11467.com/beijing/co/649800.htm
北京太平洋世纪文化发展有限公司,http://www.11467.com/beijing/co/394430.htm
北京启迪东方商贸有限公司,http://www.11467.com/beijing/co/303947.htm
北京蓝彩旗景工贸有限责任公司,http://www.11467.com/beijing/co/214207.htm
北京久峰盛世商贸有限公司,http://www.11467.com/beijing/co/299603.htm
北京春秋腾飞商贸有限公司,http://www.11467.com/beijing/co/394507.htm
北京大唐百惠瓷器有限责任公司,http://www.11467.com/beijing/co/584918.htm
北京金百通网络投资顾问有限公司,http://www.11467.com/beijing/co/670926.htm
北京宏恩世纪商贸有限公司,http://www.11467.com/beijing/co/305887.htm
北京嘉信胜杰国际商贸有限公司,http://www.11467.com/beijing/co/649784.htm
上海鸿广文具礼品有限公司,http://www.11467.com/shanghai/co/424520.htm
南京英力特商贸有限公司,http://www.11467.com/shanghai/co/1007469.htm
上海锦旭箱包有限公司,http://www.11467.com/shanghai/co/802284.htm
盈邦（北京）科技发展有限公司,http://www.11467.com/beijing/co/120046.htm
上海景都汇文化传播有限公司,http://www.11467.com/shanghai/co/976456.htm
金山婚庆用品有限公司,http://www.11467.com/shanghai/co/427446.htm
九马文具礼品有限责任公司,http://www.11467.com/shanghai/co/245913.htm
上海澈田工贸有限公司,http://www.11467.com/shanghai/co/35814.htm
融通堂文化艺术有限公司,http://www.11467.com/beijing/co/394464.htm
北京心连心伞业有限公司,http://www.11467.com/beijing/co/187848.htm
北京华晨和通贸易有限公司,http://www.11467.com/beijing/co/562030.htm
北京福海盛世商贸有限公司,http://www.11467.com/beijing/co/305868.htm
北京锦绣鲜沣商贸有限公司,http://www.11467.com/beijing/co/429151.htm
北京鑫上日达国际经贸有限公司,http://www.11467.com/beijing/co/305911.htm
林森购物有限责任公司,http://www.11467.com/beijing/co/120065.htm
北京信诚恒嘉商贸有限公司,http://www.11467.com/beijing/co/302785.htm
上海紫扬礼品有限公司,http://www.11467.com/shanghai/co/976454.htm
上海歆润工贸有限公司,http://www.11467.com/shanghai/co/250385.htm
天津长泽餐具有限公司,http://www.11467.com/tianjin/co/100710.htm
天津市金顺发文化传播有限公司,http://www.11467.com/tianjin/co/161746.htm
上海奕特营销策划有限公司普陀分公司,http://www.11467.com/shanghai/co/733572.htm
上海芮全旗业有限公司,http://www.11467.com/shanghai/co/681356.htm
上海华焰礼品有限公司,http://www.11467.com/shanghai/co/377760.htm
上海海域笔业有限公司,http://www.11467.com/shanghai/co/1007492.htm
上海望跃贸易有限公司,http://www.11467.com/shanghai/co/468327.htm
上海晶陶实业有限公司,http://www.11467.com/shanghai/co/83031.htm
上海杰勋日用品有限公司,http://www.11467.com/shanghai/co/734735.htm
上海双赛五金匙链饰品制造有限公司,http://www.11467.com/shanghai/co/681362.htm
上海海扬充气制品有限公司,http://www.11467.com/shanghai/co/35838.htm
上海五云制伞有限公司,http://www.11467.com/shanghai/co/734261.htm
上海鑫日工艺礼品有限公司,http://www.11467.com/shanghai/co/250388.htm
上海希瑞日用品有限公司,http://www.11467.com/shanghai/co/161253.htm
上海凡沃礼品有限公司,http://www.11467.com/shanghai/co/935093.htm
上海才尚工艺品有限公司,http://www.11467.com/shanghai/co/325655.htm
上海旗信贸易有限公司,http://www.11467.com/shanghai/co/802287.htm
上海润客工贸有限公司,http://www.11467.com/shanghai/co/424524.htm
上海腾鑫旗业有限公司,http://www.11467.com/shanghai/co/802275.htm
上海三味家居饰品有限公司,http://www.11467.com/shanghai/co/325656.htm
上海纤楚商贸有限公司,http://www.11467.com/shanghai/co/733546.htm
上海启时数码科技有限公司,http://www.11467.com/shanghai/co/1007491.htm
上海蕴味商贸有限公司,http://www.11467.com/shanghai/co/212327.htm
上海璞美雨具有限公司,http://www.11467.com/shanghai/co/734748.htm
上海源中实业有限公司,http://www.11467.com/shanghai/co/935088.htm
上海钰畅贸易发展有限公司,http://www.11467.com/shanghai/co/325651.htm
上海聚奎电子科技有限公司,http://www.11467.com/shanghai/co/912814.htm
上海咏美塑胶制品有限公司,http://www.11467.com/shanghai/co/161255.htm
天津寓意真礼文化礼品有限公司,http://www.11467.com/tianjin/co/48319.htm
上海越洋商贸发展有限公司,http://www.11467.com/shanghai/co/211752.htm
上海银迅商务咨询有限公司,http://www.11467.com/shanghai/co/1007504.htm
上海众辉医疗器械制造有限公司,http://www.11467.com/shanghai/co/161250.htm
上海和开光电科技有限公司,http://www.11467.com/shanghai/co/1007489.htm
天津至尊堡国际时尚数码有限公司,http://www.11467.com/tianjin/co/139123.htm
上海至臻贸易有限公司,http://www.11467.com/shanghai/co/245900.htm
苍南县海联印务有限公司,http://www.11467.com/shanghai/co/166827.htm
上海九狮工贸有限公司,http://www.11467.com/shanghai/co/161270.htm
上海洋汉文化用品有限公司,http://www.11467.com/shanghai/co/510428.htm
上海胜筹塑胶日用制品有限公司,http://www.11467.com/shanghai/co/161831.htm
上海旺源工艺制品有限公司,http://www.11467.com/shanghai/co/808827.htm
广州市术朵日用品有限公司,http://www.11467.com/guangzhou/co/660675.htm
东莞市金逸实业有限公司,http://www.11467.com/dongguan/co/614774.htm
东莞市兴硕礼品有限公司,http://www.11467.com/dongguan/co/615465.htm
重庆冬枫商贸有限公司,http://www.11467.com/chongqing/co/77247.htm
重庆碧丹科技发展有限公司,http://www.11467.com/chongqing/co/191923.htm
重庆和讯礼品有限公司,http://www.11467.com/chongqing/co/98508.htm
重庆同玖祥商贸有限公司,http://www.11467.com/chongqing/co/77252.htm
珠海凤鑫礼品有限公司,http://www.11467.com/zhuhai/co/102487.htm
重庆雅尚美术礼品有限公司,http://www.11467.com/chongqing/co/51618.htm
昆明广告帐篷促销有限公司,http://www.11467.com/kunming/co/140629.htm
厦门礼品家文化传播有限公司,http://www.11467.com/xiamen/co/124599.htm
珠海欣业礼品公司珠海商务礼品定制公司,http://www.11467.com/zhuhai/co/100128.htm
深圳同益欣科技有限公司,http://www.11467.com/shenzhen/co/814415.htm
珠海凤鑫广告礼品有限公司,http://www.11467.com/zhuhai/co/100661.htm
深圳市健怡康科技有限公司业务部,http://www.11467.com/shenzhen/co/814269.htm
东莞市万江至上工艺制品有限公司,http://www.11467.com/dongguan/co/558551.htm
深圳市舒思盾电子科技有限公司,http://www.11467.com/shenzhen/co/916094.htm
昆明环保袋制作有限公司,http://www.11467.com/kunming/co/137873.htm
包头七彩气球装饰公司,http://www.11467.com/baotou/co/32559.htm
永康市祈晴工贸有限公司,http://www.11467.com/jinhua/co/163609.htm
重庆市君悦礼品有限公司,http://www.11467.com/chongqing/co/238820.htm
银川多彩印业商贸有限公司,http://www.11467.com/yinchuan/co/44404.htm
深圳市名特微尔科技有限公司,http://www.11467.com/shenzhen/co/814265.htm
郑州赢心礼品有限公司,http://www.11467.com/zhengzhou/co/193676.htm
东莞文博工艺品有限公司,http://www.11467.com/dongguan/co/558171.htm
石家庄和柔卫生用品有限公司,http://www.11467.com/shijiazhuang/co/193001.htm
佛山市酷迪贸易有限公司,http://www.11467.com/foshan/co/361493.htm
上海纱布蒂实业有限公司,http://www.11467.com/shanghai/co/1161738.htm
中山市智享家居有限公司,http://www.11467.com/zhongshan/co/209442.htm
合肥礼品城团购公司,http://www.11467.com/hefei/co/143585.htm
赣州奥其工贸有限公司,http://www.11467.com/ganzhou/co/39193.htm
泉州佳誉礼品公司,http://www.11467.com/quanzhou/co/150755.htm
苏州鸿跃礼品公司,http://www.11467.com/suzhou/co/357502.htm
泉州市丰泽区美誉商贸有限公司,http://www.11467.com/quanzhou/co/114022.htm
沈阳佳琦商务策划有限公司,http://www.11467.com/shenyang/co/81563.htm
成都昊天雨具有限公司,http://www.11467.com/chengdu/co/118010.htm
广州海邦文具礼品有限公司,http://www.11467.com/guangzhou/co/161226.htm
广州市创时钟表有限公司,http://www.11467.com/guangzhou/co/161447.htm
广州市泓宣商贸有限公司,http://www.11467.com/guangzhou/co/161509.htm
广州市尚高塑料制品有限公司,http://www.11467.com/guangzhou/co/161252.htm
广州好耐日用品有限公司,http://www.11467.com/guangzhou/co/494731.htm
保定白沟酷格皮具有限公司,http://www.11467.com/baoding/co/63716.htm
湖南富克纳斯环保产品有限公司,http://www.11467.com/changsha/co/89244.htm
石家庄创中商贸有限公司,http://www.11467.com/shijiazhuang/co/223825.htm
乐意礼品发展有限公司,http://www.11467.com/changsha/co/201165.htm
福州闽为贸易有限公司,http://www.11467.com/fuzhou/co/144254.htm
佛山市润立硅胶工业科技有限公司,http://www.11467.com/foshan/co/207237.htm
昆明胤徕商贸有限公司,http://www.11467.com/kunming/co/149490.htm
广州市沃品工艺品有限公司,http://www.11467.com/guangzhou/co/701777.htm
东莞市鸿睿塑胶制品有限公司,http://www.11467.com/dongguan/co/632371.htm
广州市常鸿箱包有限公司,http://www.11467.com/guangzhou/co/496421.htm
汕头市智汇电子科技实业有限公司,http://www.11467.com/shantou/co/117884.htm
