丹东市广缘科技有限公司,http://www.11467.com/dandong/co/45275.htm
深圳市思正电子有限公司,http://www.11467.com/shenzhen/co/728445.htm
上海鼎复商贸有限公司,http://www.11467.com/shanghai/co/949062.htm
广州旭升印刷有限公司,http://www.11467.com/guangzhou/co/160966.htm
广州市飞腾骏业礼品制造有限公司,http://www.11467.com/guangzhou/co/161585.htm
安顺市西秀区屯堡绣坊贸易有限公司,http://www.11467.com/anshun/co/7867.htm
广州市番禺天虹雨伞有限公司,http://www.11467.com/guangzhou/co/161878.htm
广州荣威手袋制品有限公司,http://www.11467.com/guangzhou/co/432883.htm
永康市远业工贸有限公司,http://www.11467.com/jinhua/co/135619.htm
哈尔滨市春辉新奇特商贸有限公司,http://www.11467.com/haerbin/co/53535.htm
合肥诗意画廊有限公司,http://www.11467.com/hefei/co/95774.htm
广州市斐高箱包有限公司,http://www.11467.com/guangzhou/co/161584.htm
广东亿术陶瓷制作有限公司,http://www.11467.com/chaozhou/co/30443.htm
通化市保丰源土特产销售有限公司,http://www.11467.com/tonghua/co/31570.htm
深圳市同源达科科技有限公司,http://www.11467.com/shenzhen/co/729340.htm
东莞市狼眼电子科技有限公司,http://www.11467.com/dongguan/co/413903.htm
东莞市尚格工艺品有限公司,http://www.11467.com/dongguan/co/413220.htm
揭阳市振强五金制品厂有限公司,http://www.11467.com/jieyang/co/25683.htm
深圳市艾斯达克塑胶五金制品有限公司,http://www.11467.com/shenzhen/co/813496.htm
东莞市闪亮电子科技有限公司,http://www.11467.com/dongguan/co/414238.htm
深圳艾维芯科技有限公司,http://www.11467.com/shenzhen/co/730569.htm
昆明礼盾经贸有限公司,http://www.11467.com/kunming/co/122140.htm
桐乡市瑞帛家纺有限公司,http://www.11467.com/tongxian/co/7956.htm
深圳市三和晟电子有限公司,http://www.11467.com/shenzhen/co/224395.htm
深圳鼎扬塑胶制品有限公司,http://www.11467.com/shenzhen/co/730319.htm
西安地铁商品股份有限公司,http://www.11467.com/xian/co/95976.htm
郑州新常裕商贸有限公司,http://www.11467.com/zhengzhou/co/148672.htm
郑州麦琪商贸有限公司,http://www.11467.com/zhengzhou/co/170661.htm
盈动成都礼品公司,http://www.11467.com/chengdu/co/211658.htm
广州迪欣贸易有限公司,http://www.11467.com/guangzhou/co/161919.htm
长沙市雅德陶瓷有限公司,http://www.11467.com/changsha/co/104513.htm
南阳云润文化传媒有限公司,http://www.11467.com/nanyang/co/59619.htm
平顶山市巨力科技有限公司,http://www.11467.com/pingdingshan/co/43008.htm
苏州怡宁雅礼品科技有限公司,http://www.11467.com/suzhou/co/269800.htm
上海集德创建实业有限公司,http://www.11467.com/shanghai/co/935109.htm
东莞市昊天硅胶科技有限公司,http://www.11467.com/dongguan/co/625998.htm
徐州盘古天下礼品有限公司,http://www.11467.com/xuzhou/co/63980.htm
咸阳天豪礼品有限公司,http://www.11467.com/xianyang/co/21012.htm
宁波诚杰无纺布制品有限公司,http://www.11467.com/wenzhou/co/238620.htm
上海灵东广告有限公司,http://www.11467.com/shanghai/co/533536.htm
江门市天域展示器材有限公司,http://www.11467.com/jiangmen/co/82250.htm
鹤山市雨之贵实业有限公司,http://www.11467.com/jiangmen/co/166911.htm
偉寶實業有限公司VINBO INDUSTRIAL,http://www.11467.com/shantou/co/117828.htm
咸阳申氏工贸有限公司,http://www.11467.com/xianyang/co/21011.htm
四川省资阳市初雨实业有限公司,http://www.11467.com/ziyang/co/11735.htm
丽水市华太天天健康商贸有限公司,http://www.11467.com/lishui/co/25094.htm
宜昌博美营销文化传播有限公司,http://www.11467.com/yichang/co/43625.htm
濮阳市源鑫商贸有限公司,http://www.11467.com/puyang/co/19326.htm
中山市昌能礼品有限公司,http://www.11467.com/zhongshan/co/104052.htm
济宁枫林广告有限公司,http://www.11467.com/jining/co/87920.htm
东莞市一米工艺品有限公司,http://www.11467.com/dongguan/co/641737.htm
新乡市合适地毯有限公司,http://www.11467.com/xinxiang/co/24001.htm
创艺劳保有限公司,http://www.11467.com/liaocheng/co/75443.htm
东莞市劲泓实业有限公司,http://www.11467.com/dongguan/co/642023.htm
东莞市礼贤工艺礼品有限公司,http://www.11467.com/dongguan/co/558117.htm
北京爱礼无限科技发展有限公司,http://www.11467.com/beijing/co/716812.htm
东莞礼维礼品有限公司,http://www.11467.com/dongguan/co/411865.htm
揭阳市恒胜玩具有限公司,http://www.11467.com/jieyang/co/29758.htm
深圳市雷诺达钟表有限公司,http://www.11467.com/shenzhen/co/224910.htm
灵璧县灵石坊砭磬石开发有限公司,http://www.11467.com/suzhoushi/co/19172.htm
惠州龙为科技有限公司,http://www.11467.com/huizhou/co/97258.htm
东海县丽安水晶有限公司,http://www.11467.com/lianyungang/co/44680.htm
中山市拉菲酷电器有限公司,http://www.11467.com/zhongshan/co/117873.htm
上海冰航实业有限公司,http://www.11467.com/shanghai/co/657538.htm
香港福园实业有限公司,http://www.11467.com/shenzhen/co/814921.htm
江西园堤礼品销售有限公司,http://www.11467.com/fuzhoushi/co/28845.htm
上海传康实业有限公司,http://www.11467.com/shanghai/co/34252.htm
宁波北仑美洁家居用品有限公司,http://www.11467.com/ningbo/co/72001.htm
广州胜意贸易有限公司,http://www.11467.com/qiye/93196524.htm
石狮市大宇纸塑制品有限公司,http://www.11467.com/shishi/co/8737.htm
广东金鑫陶瓷实业有限公司,http://www.11467.com/chaozhou/co/26179.htm
潮安县豪鹏陶瓷实业有限公司,http://www.11467.com/chaozhou/co/26248.htm
潮州市顺创不锈钢制品有限公司,http://www.11467.com/chaozhou/co/26209.htm
成都影响婚礼策划有限公司,http://www.11467.com/chengdu/co/118039.htm
杭州精诚三和定时器实业有限公司,http://www.11467.com/hangzhou/co/222403.htm
杭州义邦礼品有限公司,http://www.11467.com/hangzhou/co/222327.htm
杭州荣高贸易有限公司,http://www.11467.com/hangzhou/co/222444.htm
荆州市荆玻易发商贸有限公司,http://www.11467.com/jingzhou/co/26141.htm
江苏吾能电子科技有限公司,http://www.11467.com/nanjing/co/93137.htm
酷派（三明）家居用品有限公司,http://www.11467.com/sanming/co/18849.htm
汕头市乐立方玩具实业有限公司,http://www.11467.com/shantou/co/133904.htm
汕头市龙湖区银河星文具有限公司,http://www.11467.com/shantou/co/2114.htm
广州市科纶实业有限公司,http://www.11467.com/guangzhou/co/161421.htm
石家庄文锋工艺礼品有限公司,http://www.11467.com/shijiazhuang/co/80747.htm
东莞市洁康超声波设备有限公司,http://www.11467.com/dongguan/co/128402.htm
广州市枫采贸易有限公司,http://www.11467.com/guangzhou/co/66782.htm
东莞市巨鼎硅胶制品有限公司,http://www.11467.com/dongguan/co/164219.htm
北京东方雅品国际贸易有限公司,http://www.11467.com/beijing/co/670539.htm
东莞市睿恒实业有限公司,http://www.11467.com/dongguan/co/497599.htm
广州拓新塑胶制品有限公司,http://www.11467.com/guangzhou/co/459550.htm
深圳市金格朗伊科技有限公司,http://www.11467.com/shenzhen/co/254452.htm
北京荣泰佳昊商贸有限公司,http://www.11467.com/beijing/co/305871.htm
淄博艾莎轻工制品销售有限公司,http://www.11467.com/zibo/co/69437.htm
长沙迷妮包装制品有限公司,http://www.11467.com/changsha/co/231530.htm
杭州衡美礼品有限公司,http://www.11467.com/hangzhou/co/368527.htm
佛山郭氏稳泰卷尺有限公司,http://www.11467.com/foshan/co/243894.htm
上海吉辰充气制品有限公司,http://www.11467.com/shanghai/co/660236.htm
重庆骅仁商贸有限公司,http://www.11467.com/chongqing/co/326893.htm
深圳市怡康科技有限公司,http://www.11467.com/shenzhen/co/223940.htm
深圳市三人行科技有限公司,http://www.11467.com/shenzhen/co/14644.htm
深圳市天美意科技有限公司,http://www.11467.com/shenzhen/co/27945.htm
广州敬诚电子科技有限公司,http://www.11467.com/guangzhou/co/114176.htm
苍南赛雅工艺礼品有限公司,http://www.11467.com/baoding/co/91434.htm
广州名阳文化用品有限公司,http://www.11467.com/guangzhou/co/194472.htm
厦门翌翔喷绘有限公司,http://www.11467.com/xiamen/co/92928.htm
东莞市华博绳袋有限公司,http://www.11467.com/dongguan/co/164116.htm
东莞市徽道硅橡胶制品有限公司,http://www.11467.com/dongguan/co/414199.htm
苏州益节智能科技有限公司,http://www.11467.com/suzhou/co/223889.htm
广州市星晔礼品玩具有限公司,http://www.11467.com/guangzhou/co/161161.htm
惠安振达电子有限公司,http://www.11467.com/quanzhou/co/13607.htm
盐城市颐达工艺品有限公司,http://www.11467.com/yancheng/co/58028.htm
广州亮节电子科技有限公司,http://www.11467.com/guangzhou/co/161380.htm
广州市力昇电子科技有限公司,http://www.11467.com/guangzhou/co/90143.htm
绍兴县民间扇业工艺品有限公司,http://www.11467.com/shaoxing/co/75737.htm
义乌市蓝泉饰品有限公司,http://www.11467.com/jinhua/co/79162.htm
杭州家天堂时尚用品有限公司,http://www.11467.com/hangzhou/co/222220.htm
杭州造府艺术品有限公司,http://www.11467.com/hangzhou/co/222469.htm
广州市锦知兴贸易有限公司,http://www.11467.com/guangzhou/co/142348.htm
福州台江区玉强贸易有限公司,http://www.11467.com/fuzhou/co/151637.htm
广州市粤行毛巾有限公司,http://www.11467.com/guangzhou/co/161148.htm
博罗石湾高轩塑胶电子有限公司,http://www.11467.com/huizhou/co/75749.htm
扬州市美能靓塑胶日化有限公司,http://www.11467.com/yangzhou/co/84831.htm
厦门恒好旅游用品有限公司,http://www.11467.com/xiamen/co/65608.htm
启智玩具贸易有限公司,http://www.11467.com/shantou/co/133932.htm
信昱國際股份有限公司ANNO MUNDI INTE,http://www.11467.com/guangzhou/co/131087.htm
河北菁轩实业有限公司,http://www.11467.com/langfang/co/29264.htm
深圳市好稀奇创意产品有限公司,http://www.11467.com/shenzhen/co/763209.htm
江门市晴天实业有限公司,http://www.11467.com/jiangmen/co/84427.htm
广州市创以晨电子科技有限公司,http://www.11467.com/guangzhou/co/429581.htm
浙江辉达电子有限公司,http://www.11467.com/jinzhou/co/51128.htm
深圳市磁展悬浮科技有限公司,http://www.11467.com/shenzhen/co/797227.htm
深圳市品冠达数码科技有限公司,http://www.11467.com/shenzhen/co/725002.htm
杭州齐峰日用品有限公司,http://www.11467.com/hangzhou/co/113883.htm
深圳市赛杰电子有限公司,http://www.11467.com/shenzhen/co/140812.htm
深圳市新派产品设计开发有限公司,http://www.11467.com/shenzhen/co/45079.htm
温州精新五金制造有限公司,http://www.11467.com/wenzhou/co/129504.htm
济南安佑若商贸有限公司,http://www.11467.com/jinan/co/72505.htm
福建省德化县三星陶瓷有限公司,http://www.11467.com/quanzhou/co/130216.htm
深圳市百乐礼品有限公司,http://www.11467.com/shenzhen/co/224627.htm
深圳市汉高科实业发展有限公司,http://www.11467.com/shenzhen/co/224039.htm
深圳市金福嘉工艺品有限公司,http://www.11467.com/shenzhen/co/728999.htm
佛山市仁品家居用品有限公司,http://www.11467.com/foshan/co/192526.htm
广州市昌成陶瓷有限公司,http://www.11467.com/guangzhou/co/131186.htm
福建省德化县和丰陶瓷有限公司,http://www.11467.com/quanzhou/co/107485.htm
上海炫名坊塑胶电子有限公司,http://www.11467.com/shanghai/co/731845.htm
东莞市诚鼎礼品有限公司,http://www.11467.com/dongguan/co/164563.htm
泉州多彩印务公司,http://www.11467.com/quanzhou/co/113788.htm
珠海斯柯达广告礼品有限公司,http://www.11467.com/zhuhai/co/81829.htm
上海青一禾国际贸易有限公司,http://www.11467.com/shanghai/co/972552.htm
上海泽泰瓷业有限公司,http://www.11467.com/shanghai/co/1007463.htm
北京美佳靓丽工艺品有限公司,http://www.11467.com/beijing/co/177676.htm
北京天开创新技术有限公司,http://www.11467.com/beijing/co/394424.htm
爱普文具礼品商贸有限公司,http://www.11467.com/shanghai/co/933165.htm
上海釜天气膜科技有限公司,http://www.11467.com/shanghai/co/258852.htm
上海友你杯杯具有限公司,http://www.11467.com/shanghai/co/1007474.htm
天津市圣米罗商贸有限公司,http://www.11467.com/tianjin/co/60907.htm
重庆易莱宝旅游用品有限公司,http://www.11467.com/chongqing/co/51342.htm
珠海市德泉商贸有限公司,http://www.11467.com/zhuhai/co/82033.htm
广州搜礼贸易有限公司,http://www.11467.com/guangzhou/co/511534.htm
成都新欣雅商贸有限公司,http://www.11467.com/chengdu/co/283250.htm
东莞市能者橡胶制品有限公司,http://www.11467.com/dongguan/co/409628.htm
东莞市富里达橡胶有限公司,http://www.11467.com/dongguan/co/412086.htm
深圳市万坤不锈钢制品有限公司,http://www.11467.com/shenzhen/co/224026.htm
石家庄金帆礼品有限公司,http://www.11467.com/shijiazhuang/co/107914.htm
武汉鼠标垫商贸有限公司,http://www.11467.com/wuhan/co/116931.htm
深圳市金晟丰塑胶制品有限公司,http://www.11467.com/shenzhen/co/460612.htm
东莞向日葵工艺礼品有限公司,http://www.11467.com/dongguan/co/411045.htm
鸿运文化礼品有限公司,http://www.11467.com/foshan/co/305374.htm
深圳市宝祥塑胶制品有限公司,http://www.11467.com/shenzhen/co/721825.htm
深圳市斯丽发光礼品有限公司,http://www.11467.com/shenzhen/co/725313.htm
扬州礼购商贸有限公司,http://www.11467.com/yangzhou/co/89711.htm
深圳市泰之丰雨具有限公司,http://www.11467.com/shanghai/co/660194.htm
东莞金诚鑫礼品公司,http://www.11467.com/dongguan/co/412053.htm
通盈实业礼品有限公司,http://www.11467.com/jinhua/co/84012.htm
深圳创益无限科技有限公司,http://www.11467.com/shenzhen/co/722884.htm
昆明爱家礼品有限公司,http://www.11467.com/kunming/co/121699.htm
北京宏旭圣业贸易有限公司,http://www.11467.com/beijing/co/145437.htm
昆明密斯特礼商贸有限公司,http://www.11467.com/kunming/co/121702.htm
广州迈格斯印刷科技有限公司,http://www.11467.com/guangzhou/co/108511.htm
河北永盛贸易礼品公司,http://www.11467.com/handan/co/54880.htm
上海英朗实业有限公司,http://www.11467.com/shanghai/co/510385.htm
惠州惠之美礼品有限公司,http://www.11467.com/huizhou/co/81884.htm
深圳乐美礼品有限公司,http://www.11467.com/shenzhen/co/728605.htm
泉州多彩公司,http://www.11467.com/quanzhou/co/114109.htm
腾盛日用制品有限公司,http://www.11467.com/jiangmen/co/96684.htm
深圳市鼎扬塑胶制品有限公司,http://www.11467.com/shenzhen/co/225041.htm
深圳市佳伟包装印业有限公司,http://www.11467.com/shenzhen/co/651170.htm
石家庄艺林礼品有限公司,http://www.11467.com/shijiazhuang/co/108676.htm
东莞市文博工艺品有限公司,http://www.11467.com/dongguan/co/414709.htm
重庆晨海广告设计有限公司,http://www.11467.com/chongqing/co/195872.htm
邯郸市丛台远见文化礼品有限公司,http://www.11467.com/handan/co/55039.htm
温州市捷尔印业有限公司,http://www.11467.com/wenzhou/co/157395.htm
厦门市金陆顺酒业有限公司,http://www.11467.com/xiamen/co/85637.htm
武汉风行食品贸易有限公司,http://www.11467.com/wuhan/co/117250.htm
三明礼想贸易有限公司,http://www.11467.com/sanming/co/32218.htm
北京中昊亿田商贸有限公司,http://www.11467.com/beijing/co/565670.htm
深圳市常青博远科技有限公司,http://www.11467.com/shenzhen/co/728335.htm
北京金果实科技有限公司变色杯宣传语,http://www.11467.com/beijing/co/331065.htm
潍坊益舟礼品有限公司,http://www.11467.com/weifang/co/93185.htm
北京金果实科技有限公司全球拍软件,http://www.11467.com/beijing/co/331081.htm
六安大古都礼品有限公司,http://www.11467.com/liuan/co/16159.htm
深圳市毅泰印刷制品有限公司,http://www.11467.com/shenzhen/co/730026.htm
深圳市宝祥塑胶制品有限公司,http://www.11467.com/shenzhen/co/721825.htm
深圳市艾维芯科技有限公司,http://www.11467.com/shenzhen/co/725214.htm
东莞市江晨实业投资有限公司,http://www.11467.com/dongguan/co/414268.htm
佛山市大势创意投资有限公司,http://www.11467.com/foshan/co/306899.htm
重庆源龙伞业有限公司,http://www.11467.com/chongqing/co/175800.htm
郑州漫天商贸有限公司,http://www.11467.com/zhengzhou/co/149029.htm
上海志唐贸易有限公司,http://www.11467.com/shanghai/co/91018.htm
台州市黄岩美都塑胶有限公司市场部,http://www.11467.com/taizhou/co/106051.htm
重庆星外礼品广告有限公司,http://www.11467.com/chongqing/co/81002.htm
河北鼎石文化传播有限公司,http://www.11467.com/shijiazhuang/co/108183.htm
汕头乐奇士塑胶制品有限公司,http://www.11467.com/shantou/co/142301.htm
上海尚多皮具有限公司,http://www.11467.com/shanghai/co/734730.htm
珠海市欣达文化传播有限公司,http://www.11467.com/zhuhai/co/89254.htm
深圳市文泰工艺制品有限公司,http://www.11467.com/shenzhen/co/758995.htm
上海俊龙食品有限公司,http://www.11467.com/shanghai/co/18017.htm
福州明灯广告有限公司,http://www.11467.com/fuzhou/co/180467.htm
深圳市鼎芯创科技有限公司,http://www.11467.com/shenzhen/co/731696.htm
淄博欧宇瓷业有限公司,http://www.11467.com/zibo/co/82252.htm
上海和贤工艺礼品有限公司,http://www.11467.com/shanghai/co/161263.htm
厦门锐远广告有限公司,http://www.11467.com/xiamen/co/92859.htm
东莞市狼眼电子科技有限公司,http://www.11467.com/dongguan/co/413903.htm
福州野狼广告有限公司,http://www.11467.com/fuzhou/co/180570.htm
武汉礼遇礼业有限公司,http://www.11467.com/wuhan/co/117849.htm
深圳市万坤不锈钢制品有限公司,http://www.11467.com/shenzhen/co/224026.htm
深圳市京竺沅纺织用品有限公司,http://www.11467.com/shenzhen/co/224872.htm
广州七色礼品印制有限公司,http://www.11467.com/guangzhou/co/434780.htm
石家庄中华行商贸有限公司,http://www.11467.com/shijiazhuang/co/137621.htm
烟台八点光电传媒有限公司,http://www.11467.com/yantai/co/154744.htm
深圳市长坤科技有限公司,http://www.11467.com/shenzhen/co/223196.htm
石家庄帝邦贸易有限公司,http://www.11467.com/shijiazhuang/co/137843.htm
上海和越工艺礼品公司,http://www.11467.com/shanghai/co/1034874.htm
宁波市金鑫五金制品有限公司,http://www.11467.com/ningbo/co/148434.htm
苍南县荣英工艺品有限公司,http://www.11467.com/wenzhou/co/170610.htm
深圳市长坤科技有限公司,http://www.11467.com/shenzhen/co/223196.htm
石家庄顺成商贸有限公司,http://www.11467.com/shijiazhuang/co/137783.htm
苍南县悦美工艺礼品有限公司,http://www.11467.com/baoding/co/91235.htm
溋信数码科技有限公司,http://www.11467.com/shenzhen/co/731207.htm
华宇国际科技发展有限公司,http://www.11467.com/guangzhou/co/455722.htm
上海幸福乐购有限公司,http://www.11467.com/shanghai/co/469883.htm
上海品漫网络科技有限公司,http://www.11467.com/shanghai/co/1016918.htm
深圳市谷城科技有限公司,http://www.11467.com/shenzhen/co/225293.htm
桐城市龙港万能彩印有限公司,http://www.11467.com/anqing/co/27673.htm
佛山市鹏成泰五金制品有限公司,http://www.11467.com/foshan/co/337896.htm
长沙奥海文化传播有限公司,http://www.11467.com/changsha/co/75866.htm
长治市天酬文化艺术传播有限公司,http://www.11467.com/changzhi/co/18350.htm
潮州宇蓝陶瓷有限公司,http://www.11467.com/chaozhou/co/26275.htm
宝鸡宝钛工艺制品有限公司,http://www.11467.com/baoji/co/24261.htm
宝鸡锋华钛礼品有限公司,http://www.11467.com/baoji/co/24461.htm
潮州市博苑家居用品有限公司,http://www.11467.com/chaozhou/co/25286.htm
潮州市金星工艺陶瓷有限公司,http://www.11467.com/chaozhou/co/20282.htm
潮州市永汉陶瓷有限公司,http://www.11467.com/chaozhou/co/26128.htm
博艺陶瓷制作公司,http://www.11467.com/chaozhou/co/30424.htm
潮州富蓝尔瓷艺有限公司,http://www.11467.com/chaozhou/co/25277.htm
大连宏宇礼品有限公司,http://www.11467.com/dalian/co/39077.htm
大田表业有限公司,http://www.11467.com/dongguan/co/164209.htm
成都志杰红太阳商贸有限公司,http://www.11467.com/chengdu/co/118046.htm
大连同德创业礼品有限公司,http://www.11467.com/dalian/co/39093.htm
长沙典雅环保科技有限公司,http://www.11467.com/changsha/co/89979.htm
常州思博特塑胶科技有限公司,http://www.11467.com/changzhou/co/95617.htm
成都蓝图纸品有限责任公司,http://www.11467.com/chengdu/co/93684.htm
佛山市大匠创意礼品有限公司,http://www.11467.com/foshan/co/323079.htm
东莞市瑞辉塑胶制品有限公司,http://www.11467.com/dongguan/co/164160.htm
东莞市鑫宝工艺饰品实业有限公司,http://www.11467.com/dongguan/co/164732.htm
富美达橡胶有限公司,http://www.11467.com/dongguan/co/164725.htm
鑫新水晶胶制品有限公司,http://www.11467.com/dongguan/co/164382.htm
启航国际有限公司销售部,http://www.11467.com/dongguan/co/164338.htm
东莞市钜创电子有限公司,http://www.11467.com/dongguan/co/164167.htm
东莞市富昇工艺制品有限公司,http://www.11467.com/dongguan/co/164519.htm
东莞市东林玩具有限公司,http://www.11467.com/dongguan/co/164693.htm
东莞市鼎致工艺品有限公司,http://www.11467.com/dongguan/co/164241.htm
东莞市信荣达皮具有限公司,http://www.11467.com/dongguan/co/164662.htm
恒丰裕玻璃制品有限公司广东销售分公司,http://www.11467.com/dongguan/co/164269.htm
福建华美国际贸易有限公司,http://www.11467.com/fuzhou/co/136086.htm
福州睿隆嘉居贸易有限公司,http://www.11467.com/fuzhou/co/136073.htm
福州万商贸易有限公司,http://www.11467.com/fuzhou/co/151619.htm
赣州市飞腾贸易有限责任公司,http://www.11467.com/ganzhou/co/26139.htm
东莞市佳骋纺织品有限公司,http://www.11467.com/dongguan/co/153863.htm
广东淘加旺工艺礼品有限公司,http://www.11467.com/dongguan/co/164183.htm
佛山市顺德区金厨电器有限公司,http://www.11467.com/foshan/co/193271.htm
福州市鼓楼区荣凯商务有限公司,http://www.11467.com/fuzhou/co/136096.htm
东莞市万向塑胶制品有限公司,http://www.11467.com/dongguan/co/496362.htm
东莞市松菱实业有限公司,http://www.11467.com/dongguan/co/206804.htm
福州市新秋龙工艺品有限公司,http://www.11467.com/fuzhou/co/161413.htm
东莞市正杰工艺品有限公司,http://www.11467.com/dongguan/co/496269.htm
东莞市同创塑胶工艺礼品有限公司,http://www.11467.com/dongguan/co/496447.htm
东莞市三赢贸易有限公司,http://www.11467.com/dongguan/co/411847.htm
东莞市美佳环保材料有限公司,http://www.11467.com/dongguan/co/413906.htm
东莞市鼎峰硅胶制品有限公司,http://www.11467.com/dongguan/co/509213.htm
东莞市百顺硅塑胶制品有限公司,http://www.11467.com/dongguan/co/414017.htm
东莞市晶富美有机玻璃制品有限公司,http://www.11467.com/dongguan/co/470678.htm
佛山市南海区中锋鞋业有限公司,http://www.11467.com/foshan/co/204971.htm
广州市奥宇电子科技有限公司,http://www.11467.com/guangzhou/co/131106.htm
广州市尚得皮具有限公司,http://www.11467.com/guangzhou/co/161241.htm
广州火杰箱包有限公司,http://www.11467.com/guangzhou/co/161505.htm
广州梵洋文化传播有限公司,http://www.11467.com/guangzhou/co/5491.htm
广州尚品茶具有限公司,http://www.11467.com/guangzhou/co/161201.htm
广州美乐气球有限公司,http://www.11467.com/guangzhou/co/161348.htm
广州市航技国际哲也有限公司,http://www.11467.com/guangzhou/co/161289.htm
广州巨丰电子有限公司,http://www.11467.com/guangzhou/co/161389.htm
广东海尚生活用品有限公司广州办,http://www.11467.com/guangzhou/co/161560.htm
广州奇玩科技有限公司,http://www.11467.com/guangzhou/co/161338.htm
广州市金子胜玻璃有限公司,http://www.11467.com/guangzhou/co/161470.htm
广州市荣仕宝电子有限公司,http://www.11467.com/guangzhou/co/161212.htm
广州市汇美笔业有限公司,http://www.11467.com/guangzhou/co/161497.htm
广州快子笔文具有限公司,http://www.11467.com/guangzhou/co/161407.htm
广州市靖霖家居用品有限公司,http://www.11467.com/guangzhou/co/161422.htm
广州市乐宝频道电子有限公司,http://www.11467.com/guangzhou/co/161544.htm
广州市铭健日用品有限公司,http://www.11467.com/guangzhou/co/161493.htm
广州欣悦充气制品有限公司,http://www.11467.com/guangzhou/co/161002.htm
广州市品扬贸易有限公司,http://www.11467.com/guangzhou/co/161434.htm
广州市达芬奇实业有限公司,http://www.11467.com/guangzhou/co/131079.htm
广州市百步贸易有限公司,http://www.11467.com/guangzhou/co/161745.htm
广州君创网络科技有限公司,http://www.11467.com/guangzhou/co/161352.htm
广州超亮贸易有限公司,http://www.11467.com/guangzhou/co/431412.htm
广州市千印表业有限公司,http://www.11467.com/guangzhou/co/429054.htm
广州奥奇无纺布有限公司,http://www.11467.com/guangzhou/co/429963.htm
佛山市顺德区安达电子有限公司,http://www.11467.com/guangzhou/co/161627.htm
