秦皇岛耀华建筑装饰玻璃有限公司,http://www.11467.com/qinhuangdao/co/3021.htm
广州卓越特种玻璃有限公司,http://www.11467.com/qiye/93318945.htm
佛山恒鑫扬玻璃有限公司,http://www.11467.com/qiye/93031560.htm
深圳市泽亮玻璃有限公司,http://www.11467.com/shenzhen/co/150590.htm
沙河市华成玻璃有限公司,http://www.11467.com/xintai/co/58977.htm
常州华阳玻璃设备有限公司,http://www.11467.com/changzhou/co/28277.htm
广州保均玻璃材料有限公司,http://www.11467.com/guangzhou/co/43191.htm
九州纺织实业有限公司,http://www.11467.com/dongguan/co/611892.htm
惠州市远大玻璃科技有限公司,http://www.11467.com/huizhou/co/99002.htm
沙河市东明玻璃制品有限公司,http://www.11467.com/xintai/co/44318.htm
南京浩辉玻璃有限公司,http://www.11467.com/nanjing/co/86004.htm
广州市嘉鑫装饰材料有限公司,http://www.11467.com/guangzhou/co/455358.htm
广州飞天建材科技有限公司,http://www.11467.com/guangzhou/co/495334.htm
广州融大化工有限公司,http://www.11467.com/guangzhou/co/276850.htm
广州雍祥玻璃有限公司,http://www.11467.com/guangzhou/co/455618.htm
广州宇邦有机玻璃制品有限公司,http://www.11467.com/guangzhou/co/463444.htm
东盛玻璃有限公司,http://www.11467.com/dongying/co/32832.htm
广州炼信门窗有限公司,http://www.11467.com/guangzhou/co/494163.htm
东道主汽车有限公司,http://www.11467.com/foshan/co/305370.htm
福建省鑫景建筑工程有限公司,http://www.11467.com/chaohu/co/14655.htm
明光市新新科技有限公司,http://www.11467.com/chuzhou/co/22651.htm
衣德祥咨询服务公司,http://www.11467.com/baicheng/co/18784.htm
蚌埠华劲钢化玻璃制品有限公司,http://www.11467.com/bengbu/co/29855.htm
天津市百泰玻璃有限公司,http://www.11467.com/huhehaote/co/29463.htm
阜新恒瑞科技有限公司,http://www.11467.com/fuxin/co/16844.htm
阜新恒瑞科技有限公司 出口部,http://www.11467.com/fuxin/co/16837.htm
广州兴华玻璃工业有限公司,http://www.11467.com/guangzhou/co/427001.htm
平顶山市恒鑫丰玻璃有限责任公司,http://www.11467.com/pingdingshan/co/19104.htm
安源玻璃有限公司,http://www.11467.com/pingxiang/co/13211.htm
秦皇岛胜必徳玻璃有限公司,http://www.11467.com/qinhuangdao/co/38820.htm
云南云翔玻璃有限公司,http://www.11467.com/qujing/co/18870.htm
金玻玻璃科技（河南）有限公司,http://www.11467.com/shangqiu/co/17791.htm
苏州市金字塔工贸有限公司,http://www.11467.com/suzhou/co/268286.htm
苏州市格丽特玻璃有限公司,http://www.11467.com/suzhou/co/268141.htm
苏州耀宇钢化玻璃有限公司,http://www.11467.com/suzhou/co/267998.htm
威海东方玻璃有限公司,http://www.11467.com/weihai/co/35915.htm
乌海市东皇工贸有限责任公司,http://www.11467.com/wuhai/co/4352.htm
吉安市南亮幕墙工程有限公司,http://www.11467.com/jian/co/16900.htm
绵阳市蓝天特种玻璃制造有限公司,http://www.11467.com/mianyang/co/38491.htm
南平市正鑫钢化玻璃有限公司,http://www.11467.com/nanping/co/36141.htm
青岛海泰镜业有限公司,http://www.11467.com/pingxiang/co/13330.htm
秦皇岛耀新安全玻璃有限公司,http://www.11467.com/qinhuangdao/co/38724.htm
秦皇岛市奥晶玻璃制品有限公司业务部,http://www.11467.com/qinhuangdao/co/38568.htm
秦皇岛华强中空材料有限公司,http://www.11467.com/qinhuangdao/co/38727.htm
秦皇岛市奥晶玻璃制品有限公司销售部,http://www.11467.com/qinhuangdao/co/38735.htm
秦皇岛星岛玻璃有限公司(业务部）,http://www.11467.com/qinhuangdao/co/38691.htm
秦皇岛市霖丰玻璃公司,http://www.11467.com/qinhuangdao/co/38767.htm
秦皇岛云迈商贸有限公司,http://www.11467.com/qinhuangdao/co/38860.htm
秦皇岛德华玻璃有限公司,http://www.11467.com/qinhuangdao/co/38870.htm
秦皇岛利达安全技术玻璃有限公司,http://www.11467.com/qinhuangdao/co/38551.htm
秦皇岛钰仁工艺玻璃有限公司,http://www.11467.com/qinhuangdao/co/38698.htm
华兴装饰玻璃有限公司,http://www.11467.com/qinhuangdao/co/38737.htm
秦皇岛市景兴玻璃实业有限公司,http://www.11467.com/qinhuangdao/co/38631.htm
辽宁阜新华辰玻璃有限公司,http://www.11467.com/fuxin/co/16823.htm
明天玻璃实业有限公司,http://www.11467.com/guangzhou/co/427029.htm
贵州川耀钢化玻璃有限公司,http://www.11467.com/guiyang/co/77787.htm
贵州龙志天成装饰工程有限公司销售部,http://www.11467.com/guiyang/co/77896.htm
河源市光辉钢化玻璃实业有限公司,http://www.11467.com/heyuan/co/14990.htm
山东金奥康玻璃深加工有限公司,http://www.11467.com/heze/co/23502.htm
曹州玻璃有限公司,http://www.11467.com/heze/co/23416.htm
菏泽嘉华玻璃有限公司,http://www.11467.com/heze/co/23441.htm
呼和浩特市天目科技有限公司,http://www.11467.com/huhehaote/co/29379.htm
佳木斯市佳星玻璃股份有限公司,http://www.11467.com/jiamusi/co/34080.htm
双峰工艺玻璃责任有限公司,http://www.11467.com/jingzhou/co/29043.htm
双峰工艺玻璃责任有限公司,http://www.11467.com/jingzhou/co/29042.htm
亿钧玻璃股份有限公司,http://www.11467.com/jingzhou/co/28975.htm
金华市翼飞玻璃有限公司,http://www.11467.com/jinhua/co/83492.htm
锦州市成功石英玻璃厂销售公司,http://www.11467.com/jinzhou/co/45608.htm
兰州蓝天浮法玻璃有限公司,http://www.11467.com/lanzhou/co/72844.htm
连云港市燎原玻璃装饰有限公司,http://www.11467.com/lianyungang/co/32733.htm
福建省龙岩市恒发建材工贸有限公司,http://www.11467.com/longyan/co/23366.htm
福建恒毅钢结构工程有限公司,http://www.11467.com/longyan/co/23385.htm
漯河市恒达不锈钢玻璃工程公司,http://www.11467.com/luohe/co/18662.htm
秦皇岛晶瑞玻璃有限公司销售部,http://www.11467.com/qinhuangdao/co/38684.htm
秦皇岛市耀笛玻璃有限公司,http://www.11467.com/qinhuangdao/co/38810.htm
秦皇岛市天艺艺术玻璃有限公司,http://www.11467.com/qinhuangdao/co/38853.htm
秦皇岛尚杰实业有限公司-玻璃销售部,http://www.11467.com/qinhuangdao/co/38800.htm
秦皇岛磐石玻璃有限公司,http://www.11467.com/qinhuangdao/co/38782.htm
秦皇岛市天艺艺术玻璃有限公司,http://www.11467.com/qinhuangdao/co/38852.htm
秦皇岛丹蕊商贸有限公司,http://www.11467.com/qinhuangdao/co/38697.htm
秦皇岛大屿装饰玻璃有限公司,http://www.11467.com/qinhuangdao/co/38834.htm
格拉斯玻璃有限公司,http://www.11467.com/qinhuangdao/co/38768.htm
志宏玻璃公司,http://www.11467.com/qinhuangdao/co/38613.htm
秦皇岛奥格玻璃有限公司销售部,http://www.11467.com/qinhuangdao/co/38510.htm
昌亿玻璃科技有限公司,http://www.11467.com/shangqiu/co/17844.htm
商丘市永兴（国际）贸易有限公司,http://www.11467.com/shangqiu/co/17840.htm
中国河南商丘永兴贸易公司,http://www.11467.com/shangqiu/co/17896.htm
广州华睿玻璃有限公司韶关分公司,http://www.11467.com/shaoguan/co/26143.htm
邵阳烘彬玻璃有限公司,http://www.11467.com/shaoyang/co/25101.htm
南昌天穹棚业有限公司,http://www.11467.com/shenzhen/co/720167.htm
河北泓光建筑装饰工程有限公司,http://www.11467.com/shijiazhuang/co/107051.htm
四川天虹水晶玻璃制品有限公司,http://www.11467.com/suining/co/9413.htm
宿迁市艺腾玻璃有限公司,http://www.11467.com/suqian/co/14808.htm
临海市江南玻璃有限公司,http://www.11467.com/taizhou/co/105348.htm
福耀集团通辽有限公司,http://www.11467.com/tongliao/co/10105.htm
温州景阳装饰玻璃有限公司,http://www.11467.com/wenzhou/co/168774.htm
乌海蓝星玻璃有限责任公司,http://www.11467.com/wuhai/co/4361.htm
西安亚派玻璃装饰有限公司,http://www.11467.com/xian/co/93776.htm
陕西蓝星玻璃有限公司销售部,http://www.11467.com/xianyang/co/23171.htm
青岛银晶玻璃有限公司外贸部,http://www.11467.com/xining/co/27624.htm
烟台蓦然玻璃工艺制品有限公司,http://www.11467.com/yantai/co/133807.htm
烟台英顺热弯玻璃有限公司,http://www.11467.com/yantai/co/133228.htm
烟台市永德安全玻璃有限公司,http://www.11467.com/yantai/co/133212.htm
营口金晨玻璃有限公司,http://www.11467.com/yingkou/co/44054.htm
龙兴装饰有限公司,http://www.11467.com/yulinshi/co/20063.htm
陕西榆林维高装饰有限责任公司,http://www.11467.com/yulinshi/co/20044.htm
湛江明新玻璃钢化有限公司,http://www.11467.com/zhanjiang/co/45100.htm
贵州宏安玻璃有限公司,http://www.11467.com/zunyi/co/22817.htm
柳州森海玻璃有限公司,http://www.11467.com/liuzhou/co/49390.htm
河南360度装饰工程有限公司,http://www.11467.com/zhengzhou/co/212977.htm
云南省家华新型墙体玻璃有限公司,http://www.11467.com/kunming/co/140641.htm
保定鑫旺纸塑包装有限公司,http://www.11467.com/baoding/co/36642.htm
湖南兴龙科技有限公司,http://www.11467.com/changsha/co/102852.htm
山西三元煤业股份有限公司,http://www.11467.com/changzhi/co/20878.htm
巢湖市伟业玻璃有限公司,http://www.11467.com/chaohu/co/20852.htm
成都南玻玻璃有限公司,http://www.11467.com/chengdu/co/93421.htm
滁州蓝天特种玻璃有限公司,http://www.11467.com/chuzhou/co/22529.htm
信义玻璃控股有限公司,http://www.11467.com/dongguan/co/406779.htm
台玻华南玻璃有限公司,http://www.11467.com/dongguan/co/407798.htm
佛山市顺德区格拉斯玻璃有限公司,http://www.11467.com/foshan/co/193037.htm
福州建东玻璃有限公司,http://www.11467.com/fuzhou/co/160575.htm
秦皇岛立华玻璃加工有限公司,http://www.11467.com/qinhuangdao/co/38593.htm
秦皇岛市君顺艺术玻璃喷绘有限公司.,http://www.11467.com/qinhuangdao/co/38535.htm
精华玻璃有限公司,http://www.11467.com/qinhuangdao/co/38707.htm
秦皇岛利欧钢化玻璃有限公司,http://www.11467.com/qinhuangdao/co/38514.htm
瑞华玻璃有限公司,http://www.11467.com/qinhuangdao/co/38794.htm
秦皇岛市耀翔玻璃有限公司,http://www.11467.com/qinhuangdao/co/38496.htm
秦皇岛市鼎鉴实业有限公司 销售部,http://www.11467.com/qinhuangdao/co/38764.htm
日照金玻工贸有限公司(销售部),http://www.11467.com/rizhao/co/16601.htm
日照盛达玻璃科技发展有限公司,http://www.11467.com/rizhao/co/16769.htm
商丘虹光玻璃公司,http://www.11467.com/shangqiu/co/17903.htm
商丘振华装饰玻璃制品有限公司,http://www.11467.com/shangqiu/co/17816.htm
河南省商丘虹光玻璃公司,http://www.11467.com/shangqiu/co/17841.htm
浮法玻璃有限公司,http://www.11467.com/shangqiu/co/17818.htm
商丘昌亿磁控镀膜有限公司,http://www.11467.com/shangqiu/co/17813.htm
江西上饶嘉艺术模型公司,http://www.11467.com/shangrao/co/23349.htm
十堰北玻玻璃有限公司,http://www.11467.com/shiyan/co/31357.htm
神彩艺术玻璃技术有限公司,http://www.11467.com/suizhou/co/10418.htm
威海市毅然贸易有限公司,http://www.11467.com/weihai/co/36085.htm
天远装饰玻璃工程有限公司,http://www.11467.com/wuhu/co/25318.htm
无锡金城幕墙装饰工程有限公司,http://www.11467.com/wuxi/co/42594.htm
仙桃市文昌玻璃制品有限责任公司,http://www.11467.com/xiantao/co/15222.htm
仙桃市林鑫玻璃膜商贸有限公司,http://www.11467.com/xiantao/co/15233.htm
宜宾环球光电节能科技有限公司,http://www.11467.com/yibin/co/28662.htm
五粮液环球集团光电有限公司,http://www.11467.com/yibin/co/24874.htm
四川宜宾环球光电玻璃制造有限公司市场部,http://www.11467.com/yibin/co/24875.htm
江西宜春玉天源玻璃技术有限公司,http://www.11467.com/yichun/co/21812.htm
鼎鑫玻璃软件开发有限公司,http://www.11467.com/yingkou/co/44080.htm
益阳通达玻璃有限公司,http://www.11467.com/yiyang/co/19853.htm
榆林顺發玻璃工程有限责任公司,http://www.11467.com/yulinshi/co/20050.htm
株洲旗滨玻璃集团有限公司,http://www.11467.com/zhuzhou/co/37299.htm
武汉峰发科技有限公司,http://www.11467.com/wuhan/co/155562.htm
襄阳市保宁环保建材科技有限公司,http://www.11467.com/qiye/20218615.htm
常州晟兴和幕墙有限公司,http://www.11467.com/changzhou/co/128066.htm
常州市武进新宇金属玻璃制品有限公司,http://www.11467.com/changzhou/co/114470.htm
常州市宏越玻璃有限公司,http://www.11467.com/changzhou/co/127636.htm
常州市华鼎鑫瑞物资有限公司,http://www.11467.com/changzhou/co/135654.htm
常州美林玻璃有限公司,http://www.11467.com/changzhou/co/127220.htm
朝阳大光明玻璃有限公司,http://www.11467.com/chaoyang/co/5427.htm
玻璃（成都）有限公司,http://www.11467.com/chengdu/co/139256.htm
宝德来艺术护角公司,http://www.11467.com/chengdu/co/140744.htm
成都巨人玻璃工程有限公司,http://www.11467.com/chengdu/co/57642.htm
成都环球特种玻璃制造有限公司超白玻璃事业部,http://www.11467.com/chengdu/co/139917.htm
成都七洲玻璃工程有限公司,http://www.11467.com/chengdu/co/140872.htm
弘耀水晶玻璃有限公司,http://www.11467.com/chengdu/co/140983.htm
成都天然居建筑膜有限公司,http://www.11467.com/chengdu/co/138161.htm
成都新概念玻璃护角有限公司,http://www.11467.com/chengdu/co/140003.htm
成都市昊信中空材料有限公司,http://www.11467.com/chengdu/co/138842.htm
安徽晋烨线材有限公司,http://www.11467.com/chuzhou/co/30441.htm
大连华宇海洋科技有限公司,http://www.11467.com/dalian/co/64255.htm
大连物华天宝节能材料有限公司,http://www.11467.com/dalian/co/64267.htm
大连惠普环保节能科技有限公司,http://www.11467.com/dalian/co/65317.htm
大连市铃阁国际贸易公司,http://www.11467.com/dalian/co/64643.htm
深圳瑞盛商贸有限公司,http://www.11467.com/dalian/co/64757.htm
山东德州振华装饰玻璃有限公司,http://www.11467.com/dezhou/co/37869.htm
华夏广汇工贸有限公司,http://www.11467.com/dezhou/co/37918.htm
晶华玻璃有限公司,http://www.11467.com/dezhou/co/37831.htm
山东省温屏节能玻璃有限公司,http://www.11467.com/dezhou/co/38010.htm
德州振华装饰玻璃有限公司销售部,http://www.11467.com/dezhou/co/38114.htm
爱尔兰 卫 宝 贸易公司东莞采购处,http://www.11467.com/dongguan/co/404198.htm
东莞恒硕贸易有限公司,http://www.11467.com/dongguan/co/404391.htm
东莞坤兴玻璃制品有限公司,http://www.11467.com/dongguan/co/404311.htm
东莞市明达玻璃有限公司,http://www.11467.com/dongguan/co/126927.htm
东莞南玻工程玻璃有限公司市场部,http://www.11467.com/dongguan/co/407194.htm
东莞市明达玻璃有限公司-业务部,http://www.11467.com/dongguan/co/406754.htm
东莞市美迪玻璃制品有限公司,http://www.11467.com/dongguan/co/411862.htm
水晶居玻璃建材有限公司,http://www.11467.com/foshan/co/301038.htm
顺德区金一百实业有限公司,http://www.11467.com/foshan/co/299724.htm
四会市伟祺玻璃建材有限公司,http://www.11467.com/foshan/co/302243.htm
顺利达玻璃制品有限公司,http://www.11467.com/foshan/co/303699.htm
江龙实业有限公司,http://www.11467.com/foshan/co/300103.htm
金米兰马赛克制品有限公司,http://www.11467.com/foshan/co/300924.htm
福建省福州开发区建安玻璃有限公司,http://www.11467.com/fuzhou/co/160123.htm
福州野鹰装饰材料有限公司,http://www.11467.com/fuzhou/co/160199.htm
福建艺根玻璃有限公司,http://www.11467.com/fuzhou/co/160379.htm
德信国际有限公司,http://www.11467.com/guangzhou/co/423096.htm
广东旭粤特种玻璃公司,http://www.11467.com/guangzhou/co/483819.htm
广州富友玻璃制品有限公司,http://www.11467.com/guangzhou/co/427077.htm
福耀集团(福建)工程玻璃有限公司广州分公司,http://www.11467.com/guangzhou/co/422582.htm
广州爱屋建材有限公司销售市场部,http://www.11467.com/guangzhou/co/424757.htm
广州华睿玻璃实业有限公司,http://www.11467.com/guangzhou/co/419010.htm
广州利晶（玻璃）贸易有限公司,http://www.11467.com/guangzhou/co/202201.htm
創佳藝術玻璃有限公司,http://www.11467.com/guangzhou/co/424689.htm
广东东泽建材有限公司,http://www.11467.com/guangzhou/co/418703.htm
广东特纳玻璃科技有限公司,http://www.11467.com/guangzhou/co/426752.htm
广州美格乐五金有限公司,http://www.11467.com/guangzhou/co/424443.htm
广州市飞虎钢化玻璃有限公司,http://www.11467.com/guangzhou/co/419897.htm
广州利晶贸易有限公司,http://www.11467.com/guangzhou/co/29161.htm
广州利明家具配件有限公司,http://www.11467.com/guangzhou/co/421993.htm
广州彗晶玻璃有限公司,http://www.11467.com/guangzhou/co/422857.htm
广州金桥玻璃有限公司,http://www.11467.com/guangzhou/co/420643.htm
广州华晶玻璃制品有限公司(销售部),http://www.11467.com/guangzhou/co/421286.htm
广州保均玻璃材料有限公司销售一部,http://www.11467.com/guangzhou/co/419225.htm
广州嘉颢特种玻璃有限公司销售部,http://www.11467.com/guangzhou/co/420866.htm
广州市丰泉贸易有限公司,http://www.11467.com/guangzhou/co/419512.htm
广州华新玻璃有限公司,http://www.11467.com/guangzhou/co/418605.htm
东莞市新长江钢化玻璃有限公司,http://www.11467.com/guangzhou/co/425633.htm
广州市骏誉安全玻璃有限公司,http://www.11467.com/guangzhou/co/89285.htm
广州市爱纶思玻璃有限公司,http://www.11467.com/guangzhou/co/128429.htm
广州欧浪艺术玻璃有限公司,http://www.11467.com/guangzhou/co/422727.htm
广州市华睿玻璃贸易有限公司（销售部）,http://www.11467.com/guangzhou/co/420592.htm
广州市志冠贸易有限公司,http://www.11467.com/guangzhou/co/424674.htm
广州市高城建材有限公司,http://www.11467.com/guangzhou/co/97907.htm
广州圣易玻璃膜有限公司工程部,http://www.11467.com/guangzhou/co/426781.htm
广州市创佳艺术玻璃有限公司,http://www.11467.com/guangzhou/co/419129.htm
广州祺艺装饰玻璃有限公司,http://www.11467.com/guangzhou/co/488656.htm
秦皇岛开发区华光工业技术玻璃有限公司,http://www.11467.com/qinhuangdao/co/3066.htm
秦皇岛市迅发玻璃有限公司,http://www.11467.com/qinhuangdao/co/45958.htm
秦皇岛禧丰玻璃有限公司,http://www.11467.com/qinhuangdao/co/37833.htm
秦皇岛奥格玻璃有限公司,http://www.11467.com/qinhuangdao/co/3044.htm
秦皇岛市景兴玻璃有限公司,http://www.11467.com/qinhuangdao/co/5840.htm
秦皇岛市吉祥玻璃工业技术有限公司,http://www.11467.com/qinhuangdao/co/25464.htm
秦皇岛明鼎钢化玻璃有限公司,http://www.11467.com/qinhuangdao/co/45909.htm
秦皇岛天瑞钢化技术玻璃有限公司,http://www.11467.com/qinhuangdao/co/66.htm
秦皇岛市鸽翔特种玻璃有限公司,http://www.11467.com/qinhuangdao/co/34397.htm
衢州金刚钢化玻璃有限公司,http://www.11467.com/quzhou/co/22428.htm
上饶市联发金属结构工程有限公司,http://www.11467.com/shangrao/co/15350.htm
广东金刚玻璃科技股份有限公司,http://www.11467.com/shantou/co/58566.htm
汕頭市偉業鋼化玻璃公司,http://www.11467.com/shantou/co/143679.htm
浙江省东亚工程玻璃有限公司,http://www.11467.com/shaoxing/co/86276.htm
浙江诸暨晶鑫特种玻璃有限公司,http://www.11467.com/shaoxing/co/86473.htm
湖南圣昌玻璃有限公司,http://www.11467.com/shaoyang/co/553.htm
沈阳金泰集团重工机械制造有限公司,http://www.11467.com/shenyang/co/80009.htm
沈阳耀华玻璃有限责任公司,http://www.11467.com/shenyang/co/1164.htm
沈阳市蓝星玻璃有限公司,http://www.11467.com/shenyang/co/12273.htm
沈阳宇中翔经贸有限公司,http://www.11467.com/shenyang/co/79195.htm
沈阳星光建材集团有限公司,http://www.11467.com/shenyang/co/79960.htm
沈阳蓝星玻璃有限公司,http://www.11467.com/shenyang/co/79753.htm
沈阳俊捷玻璃深加工有限公司,http://www.11467.com/shenyang/co/79961.htm
CIE香港公司(驻深圳办事处),http://www.11467.com/shenzhen/co/711289.htm
梵登贸易有限公司,http://www.11467.com/shenzhen/co/715709.htm
恒达光学有限公司,http://www.11467.com/shenzhen/co/717204.htm
深南益玻璃制品有限公司,http://www.11467.com/shenzhen/co/719676.htm
广东百强钢化玻璃有限公司,http://www.11467.com/shenzhen/co/713780.htm
清远市志豪兴工程玻璃有限公司,http://www.11467.com/shenzhen/co/716046.htm
和记玻璃公司,http://www.11467.com/shenzhen/co/713402.htm
深圳金刚玻璃光伏建筑科技有限公司,http://www.11467.com/shenzhen/co/720122.htm
凯升节能节能科技有限公司,http://www.11467.com/shenzhen/co/714008.htm
深圳龙威玻璃装饰工程公司,http://www.11467.com/shenzhen/co/716895.htm
山东青岛金晶股份有限公司,http://www.11467.com/shenzhen/co/711428.htm
龙电科技实业有限公司(销售部),http://www.11467.com/shenzhen/co/711750.htm
深圳利康达实业有限公司,http://www.11467.com/shenzhen/co/712666.htm
深圳东方杰玻璃有限公司,http://www.11467.com/shenzhen/co/719126.htm
深圳市 双振电子有限公司总公司,http://www.11467.com/shenzhen/co/718893.htm
绿之宇科技有限公司（外贸部）,http://www.11467.com/shenzhen/co/713090.htm
深圳三鑫特种玻璃技术股份有限公司,http://www.11467.com/shenzhen/co/717021.htm
深圳南玻幕墙及光伏工程有限公司光伏事业部,http://www.11467.com/shenzhen/co/718071.htm
深圳龙飞贸易有限公司,http://www.11467.com/shenzhen/co/710871.htm
云南玉溪市浩盛玻璃科技有限公司,http://www.11467.com/yuxi/co/16171.htm
山东锦华镀膜玻璃有限公司,http://www.11467.com/zaozhuang/co/30502.htm
滕州市润宏玻璃科技有限公司,http://www.11467.com/zaozhuang/co/36936.htm
山东锦华玻璃有限公司,http://www.11467.com/zaozhuang/co/30387.htm
湛江市搏信钢化玻璃有限公司,http://www.11467.com/zhanjiang/co/52469.htm
杭州恒达钢构公司河南分公司,http://www.11467.com/zhengzhou/co/146783.htm
河南省郑州大明玻璃有限公司,http://www.11467.com/zhengzhou/co/147182.htm
郑州金泰玻璃公司,http://www.11467.com/zhengzhou/co/147261.htm
郑州华郑装饰工程有限公司,http://www.11467.com/zhengzhou/co/167703.htm
郑州新中原玻璃制品有限公司,http://www.11467.com/zhengzhou/co/57588.htm
郑州市运通玻璃销售有限公司,http://www.11467.com/zhengzhou/co/147442.htm
恒大玻璃装饰有限公司,http://www.11467.com/zhengzhou/co/176952.htm
郑州市晶耀玻璃有限公司,http://www.11467.com/zhengzhou/co/147315.htm
郑州大明钢化玻璃有限公司,http://www.11467.com/zhengzhou/co/145542.htm
郑州莲非进出口贸易有限公司,http://www.11467.com/zhengzhou/co/173021.htm
郑州金源玻璃深加工有限公司,http://www.11467.com/zhengzhou/co/146654.htm
河南蓝欣玻璃有限公司,http://www.11467.com/zhengzhou/co/146530.htm
郑州大明玻璃有限公司,http://www.11467.com/zhengzhou/co/5518.htm
格兰特工程玻璃(中山)有限公司(业务部),http://www.11467.com/zhongshan/co/116984.htm
中山佳信玻璃有限公司,http://www.11467.com/zhongshan/co/116215.htm
沙河市正科玻璃有限公司,http://www.11467.com/xintai/co/50742.htm
河北向明玻璃有限公司,http://www.11467.com/xintai/co/46002.htm
沙河市速汇尔艺术玻璃有限公司,http://www.11467.com/xintai/co/55551.htm
沙河市维娜玻璃贸易有限公司,http://www.11467.com/xintai/co/39799.htm
新乡市江源铜业有限公司,http://www.11467.com/xinxiang/co/21084.htm
徐州鹏宇钢化玻璃公司,http://www.11467.com/xuzhou/co/81769.htm
江苏耀华特种玻璃有限公司~销售部,http://www.11467.com/xuzhou/co/63054.htm
江苏耀华特种玻璃有限公司业务部,http://www.11467.com/xuzhou/co/63349.htm
徐州苏轩琉璃艺术有限公司,http://www.11467.com/xuzhou/co/62882.htm
阳江市坚城玻璃公司,http://www.11467.com/yangjiang/co/18212.htm
扬州市鑫福钢化玻璃建材有限公司,http://www.11467.com/yangzhou/co/89497.htm
烟台蓝天玻璃有限公司,http://www.11467.com/yantai/co/127388.htm
烟台鸿正昌经贸有限公司,http://www.11467.com/yantai/co/133180.htm
莱州市鑫涛隔热材料有限公司,http://www.11467.com/yantai/co/133387.htm
莱州市鑫涛隔热材料有限公司,http://www.11467.com/yantai/co/133388.htm
朋利工贸公司,http://www.11467.com/yulinshi/co/19473.htm
北京凯谛玻璃技术有限公司,http://www.11467.com/beijing/co/330283.htm
北京绿墙玻璃科技有限公司,http://www.11467.com/beijing/co/329069.htm
北京清大思创科技发展有限公司,http://www.11467.com/beijing/co/319014.htm
北京美景美莹装饰玻璃有限公司,http://www.11467.com/beijing/co/141148.htm
北京秒吉祥藏通汇国际投资咨询有限公司,http://www.11467.com/beijing/co/141433.htm
北京三洪淋浴房批发公司,http://www.11467.com/beijing/co/226401.htm
北京秦润玻璃有限公司销售部,http://www.11467.com/beijing/co/226127.htm
北京秦润玻璃有限公司网络销售部,http://www.11467.com/beijing/co/226429.htm
北京博来装饰工程有限公司,http://www.11467.com/beijing/co/140791.htm
北京恒坤货架有限公司,http://www.11467.com/beijing/co/226528.htm
北京市汉顿玻璃有限公司,http://www.11467.com/beijing/co/143716.htm
北京晟隆玻璃公司,http://www.11467.com/beijing/co/438182.htm
