北京新立基真空玻璃技术有限公司销售公司,http://www.11467.com/beijing/co/438054.htm
北京新成龙玻璃有限责任公司销售部,http://www.11467.com/beijing/co/31665.htm
北京新成龙玻璃公司,http://www.11467.com/beijing/co/253703.htm
北京新立基真空玻璃技术有限公司,http://www.11467.com/beijing/co/627540.htm
北京新盛和钢化玻璃有限公司销售部,http://www.11467.com/beijing/co/226404.htm
北京建恒嘉创贸易有限公司,http://www.11467.com/beijing/co/141259.htm
北京万人迷玻璃科技有限公司,http://www.11467.com/beijing/co/330384.htm
北京室昱重光艺术镜业有限公司,http://www.11467.com/beijing/co/226553.htm
北京市文丰嘉元玻璃有限公司,http://www.11467.com/beijing/co/627628.htm
北京汇海利达玻璃有限公司,http://www.11467.com/beijing/co/329158.htm
北京兴阳世家玻璃制品有限公司,http://www.11467.com/beijing/co/226043.htm
北京顺时针装饰公司,http://www.11467.com/beijing/co/142420.htm
北京顺兴佳益玻璃钢制品有限公司,http://www.11467.com/beijing/co/48688.htm
北京顺鑫盛玻璃百页窗有限公司,http://www.11467.com/beijing/co/588010.htm
北京顺意祥玻璃加工有限公司,http://www.11467.com/beijing/co/587369.htm
北京银晶玻璃有限公司市场调研部,http://www.11467.com/beijing/co/141423.htm
北京中盛大唐夹丝玻璃公司,http://www.11467.com/beijing/co/329730.htm
北京信捷玻璃公司,http://www.11467.com/beijing/co/141874.htm
凯华玻璃有限公司,http://www.11467.com/beijing/co/655333.htm
秦皇岛市鼎鉴实业有限公司 北京办事处,http://www.11467.com/beijing/co/225915.htm
屋蓝博科贸有限公司,http://www.11467.com/beijing/co/144036.htm
洲兴玻璃公司,http://www.11467.com/beijing/co/330168.htm
亿峰玻璃不锈钢公司,http://www.11467.com/beijing/co/330596.htm
北京永成康正装饰有限责任公司,http://www.11467.com/beijing/co/288794.htm
北京世纪佳业展览有限公司,http://www.11467.com/beijing/co/561641.htm
北京世纪西飞幕墙材料有限责任公司,http://www.11467.com/beijing/co/330360.htm
潍坊展美玻璃装饰公司,http://www.11467.com/weifang/co/117029.htm
天津灵草妙心科技有限公司,http://www.11467.com/tianjin/co/304641.htm
昆明赣朋玻璃科技有限公司,http://www.11467.com/kunming/co/134186.htm
仙居县德忆装饰材料有限公司,http://www.11467.com/taizhou/co/153943.htm
金得力环保科技（天津）有限公司,http://www.11467.com/tianjin/co/307528.htm
天津飞达汽车零部件有限公司,http://www.11467.com/tianjin/co/307529.htm
天津棋汇建筑工程有限公司,http://www.11467.com/tianjin/co/307530.htm
上海群力玻璃有限公司,http://www.11467.com/shnanhui/co/38014.htm
鑫福森建筑材料有限公司,http://www.11467.com/tianjin/co/310325.htm
江苏琳琅玻璃有限公司,http://www.11467.com/xuzhou/co/83297.htm
山东无棣欣泽西中空玻璃设备有限公司,http://www.11467.com/binzhou/co/46101.htm
江苏省常州市三好建筑材料有限公司,http://www.11467.com/changzhou/co/153134.htm
上海博迪装饰材料有限公司,http://www.11467.com/shnanhui/co/5248.htm
上海航迈工贸有限公司,http://www.11467.com/shnanhui/co/7071.htm
上海展恒装潢玻璃有限公司,http://www.11467.com/shnanhui/co/7847.htm
河北省东光县津东玻璃工艺制品有限公司,http://www.11467.com/cangzhou/co/87607.htm
河北腾宇玻璃有限公司,http://www.11467.com/xintai/co/73357.htm
吉林市英惠工贸有限公司,http://www.11467.com/jilinshi/co/98165.htm
湖南固湘源办公系统工程有限公司,http://www.11467.com/changsha/co/163486.htm
佛山市禅城区洋日钢化玻璃有限公司,http://www.11467.com/foshan/co/406456.htm
上海格卉玻璃有限公司,http://www.11467.com/shanghai/co/1161429.htm
广州市东千玻璃制品有限公司,http://www.11467.com/guangzhou/co/634027.htm
安彩玻璃（上海）有限公司,http://www.11467.com/shanghai/co/1161474.htm
东营正大建筑玻璃贴膜有限公司,http://www.11467.com/dongying/co/55201.htm
通化经济开发区跃礼玻璃有限公司,http://www.11467.com/tonghua/co/35678.htm
鹤山市三鼎防火玻璃有限公司,http://www.11467.com/jiangmen/co/155017.htm
安徽凹凸隔断型材有限公司,http://www.11467.com/anqing/co/46308.htm
临朐盛昌玻璃钢制品有限公司,http://www.11467.com/weifang/co/173459.htm
陕西华鑫玻璃有限公司,http://www.11467.com/xian/co/167766.htm
南充市腾龙玻璃有限责任公司,http://www.11467.com/nanchong/co/31960.htm
江苏新富瑞节能玻璃有限公司,http://www.11467.com/zhenjiang/co/72027.htm
沙河市宏森玻璃贸易有限公司,http://www.11467.com/xintai/co/103181.htm
沈阳吉亚建筑材料有限公司,http://www.11467.com/shenyang/co/107748.htm
上海皓硕玻璃制品有限公司,http://www.11467.com/shanghai/co/1267322.htm
北京志强联创玻璃科技有限公司,http://www.11467.com/beijing/co/764055.htm
秦皇岛蕾迪商贸有限公司,http://www.11467.com/qinhuangdao/co/73386.htm
四川天幕钢结构有限公司,http://www.11467.com/qiye/93104990.htm
佛山南海金世界铝制品有限公司,http://www.11467.com/foshan/co/296738.htm
佛山北龙(北江)玻璃机械有限公司售后服务门市部,http://www.11467.com/foshan/co/301693.htm
佛山市禅城区恒盛胶业有限公司,http://www.11467.com/foshan/co/298677.htm
佛山市帝豪龙玻璃制品有限公司,http://www.11467.com/foshan/co/331419.htm
佛山市南海区爽健玻璃建材有限公司,http://www.11467.com/foshan/co/303968.htm
佛山市禅城区高力威机械贸易有限公司,http://www.11467.com/foshan/co/303516.htm
枫明装饰材料有限公司（销售部）,http://www.11467.com/foshan/co/298880.htm
佛山市大筑建材有限公司,http://www.11467.com/foshan/co/300110.htm
佛山市风行新型材料有限公司,http://www.11467.com/foshan/co/300800.htm
佛山市龙宝利玻璃有限公司外贸部,http://www.11467.com/foshan/co/299302.htm
广东洛玻玻璃有限公司,http://www.11467.com/foshan/co/301507.htm
佛山市澳威科技实业有限公司 玻璃事业部,http://www.11467.com/foshan/co/296015.htm
佛山南海新华强玻璃工艺有限公司,http://www.11467.com/foshan/co/303446.htm
佛山市艺高陶瓷制品有限公司,http://www.11467.com/foshan/co/238298.htm
佛山市南海区新华强玻璃工艺有限公司财务部,http://www.11467.com/foshan/co/303539.htm
佛山市群力玻璃有限公司,http://www.11467.com/foshan/co/301998.htm
佛山群力玻璃有限公司,http://www.11467.com/foshan/co/304206.htm
佛山市南海区新华强玻璃工艺有限公司,http://www.11467.com/foshan/co/32484.htm
佛山市南海黄歧辉驰膜业公司,http://www.11467.com/foshan/co/298763.htm
佛山旭光特种玻璃有限公司,http://www.11467.com/foshan/co/302487.htm
佛山旭板玻璃工业有限公司,http://www.11467.com/foshan/co/302993.htm
广东特米艺术装饰材料有限公司,http://www.11467.com/foshan/co/300296.htm
佛山市顺德区裕能热能技术有限公司,http://www.11467.com/foshan/co/193195.htm
雅仕玻璃有限公司,http://www.11467.com/foshan/co/301910.htm
江门新会富虹玻璃制品有限公司,http://www.11467.com/foshan/co/299526.htm
金彤洁具公司,http://www.11467.com/foshan/co/297485.htm
旺得富艺术玻璃有限公司,http://www.11467.com/foshan/co/299476.htm
沃玛玻璃马赛克有限公司,http://www.11467.com/foshan/co/300164.htm
佛山市元宏玻璃工艺有限公司,http://www.11467.com/foshan/co/300266.htm
康达洁具有限公司,http://www.11467.com/foshan/co/298151.htm
中南玻璃有限公司,http://www.11467.com/foshan/co/300086.htm
福州奥士商贸有限公司,http://www.11467.com/fuzhou/co/161087.htm
福建恒成玻璃有限公司,http://www.11467.com/fuzhou/co/167867.htm
福州开发区天诚钢化玻璃有限公司(宁德销售分公司),http://www.11467.com/fuzhou/co/160087.htm
福州冠虹建材有限公司_销售部,http://www.11467.com/fuzhou/co/160103.htm
