深圳市永信海电子科技有限公司,http://www.11467.com/shenzhen/co/758322.htm
深圳市兴天宇电子设备有限公司,http://www.11467.com/shenzhen/co/812415.htm
温州兆业电子有限公司,http://www.11467.com/shenzhen/co/441534.htm
深圳市亚特联科技有限公司,http://www.11467.com/shenzhen/co/129168.htm
深圳市亿门电子有限公司,http://www.11467.com/shenzhen/co/726250.htm
深圳市鑫准机电设备有限公司,http://www.11467.com/shenzhen/co/787677.htm
深圳为胜智控技术有限公司,http://www.11467.com/shenzhen/co/808159.htm
深圳市质耐电子科技有限公司,http://www.11467.com/shenzhen/co/347289.htm
深圳市永利兴科技有限公司,http://www.11467.com/shenzhen/co/764835.htm
深圳市欣瑞商贸有限公司,http://www.11467.com/shenzhen/co/731063.htm
深圳市卓卓电子科技有限公司,http://www.11467.com/shenzhen/co/413360.htm
深圳市中擎科电子有限公司,http://www.11467.com/shenzhen/co/724391.htm
深圳市世钰电子有限公司,http://www.11467.com/shenzhen/co/812954.htm
深圳市新安卓睿电子有限公司,http://www.11467.com/shenzhen/co/772784.htm
深圳市正立佳电子有限公司,http://www.11467.com/shenzhen/co/392236.htm
深圳志亚科技有限公司,http://www.11467.com/shenzhen/co/812205.htm
深圳市亚洲龙电子科技有限公司,http://www.11467.com/shenzhen/co/351006.htm
深圳市深艺成电子科技有限公司,http://www.11467.com/shenzhen/co/757780.htm
深圳市兴达恒业科技有限公司,http://www.11467.com/shenzhen/co/809282.htm
深圳市中曼科技有限公司,http://www.11467.com/shenzhen/co/392803.htm
深圳泰岳科技有限公司,http://www.11467.com/shenzhen/co/788021.htm
深圳市友东自动化有限公司,http://www.11467.com/shenzhen/co/767249.htm
深圳市兴铠瑞电子有限公司,http://www.11467.com/shenzhen/co/722409.htm
深圳顺途科技有限公司,http://www.11467.com/shenzhen/co/129457.htm
深圳园方华科技有限公司,http://www.11467.com/shenzhen/co/400229.htm
深圳市中信宝电子有限公司,http://www.11467.com/shenzhen/co/761870.htm
深圳市戴氏电子薄膜开关有限公司,http://www.11467.com/shenzhen/co/761292.htm
深圳市鑫奥泰电器有限公司,http://www.11467.com/shenzhen/co/767177.htm
深圳市盛明半导体器件有限公司,http://www.11467.com/shenzhen/co/359435.htm
深圳市卓思达通讯技术有限公司,http://www.11467.com/shenzhen/co/757882.htm
深圳市深云锡业有限公司,http://www.11467.com/shenzhen/co/422783.htm
深圳市新然达科技有限公司,http://www.11467.com/shenzhen/co/586516.htm
深圳市欣广鑫科技有限公司,http://www.11467.com/shenzhen/co/122594.htm
深圳市英泰科机电设备有限公司,http://www.11467.com/shenzhen/co/725587.htm
深圳市双双益科技有限公司,http://www.11467.com/shenzhen/co/766459.htm
深圳市志达峰科技有限公司,http://www.11467.com/shenzhen/co/779853.htm
深圳市众澳诚芯科技有限公司,http://www.11467.com/shenzhen/co/453738.htm
深圳市众志联盟科技有限公司,http://www.11467.com/shenzhen/co/416337.htm
深圳市裕辉美科技有限公司,http://www.11467.com/shenzhen/co/381690.htm
深圳市易思德科技有限公司,http://www.11467.com/shenzhen/co/122393.htm
深圳市永伟盛科技有限公司,http://www.11467.com/shenzhen/co/445448.htm
深圳市优耐特佳新材料科技有限公司,http://www.11467.com/shenzhen/co/785268.htm
深圳市中拓海外电子有限公司,http://www.11467.com/shenzhen/co/415523.htm
深圳市渝南松电子科技有限公司,http://www.11467.com/shenzhen/co/728746.htm
深圳市鑫瑞创盛电子有限公司,http://www.11467.com/shenzhen/co/789180.htm
深圳市伟力创电子有限公司,http://www.11467.com/shenzhen/co/438968.htm
苏州欧莱德控制系统有限公司,http://www.11467.com/suzhou/co/206944.htm
苏州昭华电子有限公司,http://www.11467.com/suzhou/co/208397.htm
苏州天剑电子有限公司,http://www.11467.com/suzhou/co/230331.htm
苏州邻德电子有限公司,http://www.11467.com/suzhou/co/230337.htm
台州市铭佳电器有限公司,http://www.11467.com/taizhou/co/87781.htm
苏州市博大光电开关有限公司,http://www.11467.com/suzhou/co/11095.htm
苏州曹氏电子科技有限公司,http://www.11467.com/suzhou/co/230336.htm
江苏施耐特电气有限公司,http://www.11467.com/suqian/co/9934.htm
苏州铭赛自动化设备有限公司,http://www.11467.com/suzhou/co/356873.htm
石家庄市泽天电子科技有限公司,http://www.11467.com/shijiazhuang/co/55707.htm
新谛(苏州)电子有限公司,http://www.11467.com/suzhou/co/234456.htm
浙江佳龙电子有限公司台州路桥销售部,http://www.11467.com/taizhou/co/87787.htm
深圳市颖博电子有限公司,http://www.11467.com/shenzhen/co/70039.htm
深圳市东松盛电器有限公司,http://www.11467.com/shenzhen/co/349436.htm
深圳市拓奇五金制品有限公司,http://www.11467.com/shenzhen/co/724387.htm
深圳市拓安达电子有限公司,http://www.11467.com/shenzhen/co/466484.htm
浙江步步精电子有限公司,http://www.11467.com/shenzhen/co/728743.htm
石家庄鸿森空调设备有限公司,http://www.11467.com/shijiazhuang/co/87551.htm
石家庄华通线缆有限公司,http://www.11467.com/shijiazhuang/co/142061.htm
致通达科技(深圳)有限公司,http://www.11467.com/shenzhen/co/397458.htm
昆山瑞德仕维电子科技有限公司,http://www.11467.com/suzhou/co/315563.htm
苏州杰明光电科技有限公司,http://www.11467.com/suzhou/co/327274.htm
台州市振宇电气设备有限公司,http://www.11467.com/taizhou/co/46657.htm
台州市德科电气科技有限公司,http://www.11467.com/taizhou/co/137213.htm
上海顺飞电子有限公司,http://www.11467.com/suzhou/co/208426.htm
泰州苏宝泰金属制品有限公司,http://www.11467.com/taizhoushi/co/51671.htm
昆山艾尔思自动化设备有限公司,http://www.11467.com/suzhou/co/337570.htm
深圳市东南伟业电子有限公司,http://www.11467.com/shenzhen/co/812039.htm
深圳西蒙奇胜科技有限公司,http://www.11467.com/shenzhen/co/812367.htm
深圳市爱博尔科技有限公司,http://www.11467.com/shenzhen/co/141944.htm
新乐市长城电器有限公司,http://www.11467.com/shijiazhuang/co/141786.htm
深圳市同创发电子有限公司,http://www.11467.com/shenzhen/co/385688.htm
源丰电子（深圳）有限公司,http://www.11467.com/shenzhen/co/96411.htm
昆山福鑫贸易有限公司,http://www.11467.com/suzhou/co/154351.htm
苏州卡泰自动化设备有限公司,http://www.11467.com/suzhou/co/327306.htm
台州爱力生电器有限公司,http://www.11467.com/taizhou/co/79286.htm
张家港市银丰电子有限公司,http://www.11467.com/suzhou/co/319773.htm
苏州松祥精密五金有限公司,http://www.11467.com/suzhou/co/308738.htm
苏州宝龙电器有限公司,http://www.11467.com/suzhou/co/206673.htm
张家港奇胜电器有限责任公司,http://www.11467.com/suzhou/co/60165.htm
深圳思科触控技术有限公司,http://www.11467.com/shenzhen/co/105202.htm
扬州德仪电器有限公司,http://www.11467.com/shuozhou/co/9892.htm
深圳盟泰格电子科技有限公司,http://www.11467.com/shenzhen/co/772478.htm
厦门创祥自动化科技有限公司,http://www.11467.com/xiamen/co/93526.htm
厦门为承自动化科技有限公司,http://www.11467.com/xiamen/co/93504.htm
无锡爱斯普自控阀门有限公司,http://www.11467.com/wuxi/co/177723.htm
厦门迎欣商贸有限公司,http://www.11467.com/xiamen/co/103475.htm
扬州国通电力工具制造有限公司,http://www.11467.com/yangzhou/co/76781.htm
金燕照明有限公司,http://www.11467.com/zhongshan/co/80521.htm
厦门睿明电子有限公司,http://www.11467.com/xiamen/co/47966.htm
无锡市勃朗电器有限责任公司,http://www.11467.com/wuxi/co/13455.htm
武汉宝玲龙科技有限公司,http://www.11467.com/wuhan/co/74833.htm
德力西集团新疆机电设备有限公司,http://www.11467.com/wulumuqi/co/40156.htm
襄樊向明电气科技有限公司,http://www.11467.com/xiangfan/co/35895.htm
徐州市赛姆科技有限公司,http://www.11467.com/xuzhou/co/56026.htm
徐州艾华电器有限公司,http://www.11467.com/xuzhou/co/55429.htm
镇江宇航电工设备有限公司,http://www.11467.com/zhenjiang/co/42537.htm
阳东县新正电力器材有限公司,http://www.11467.com/yangjiang/co/14383.htm
枣庄伟华薄膜电路有限公司,http://www.11467.com/zaozhuang/co/20843.htm
乐清市中一电气有限公司,http://www.11467.com/wenzhou/co/220761.htm
徐州市好达电子有限公司,http://www.11467.com/xuzhou/co/1528.htm
河南亚丰电瓷电器有限公司,http://www.11467.com/xuchang/co/25983.htm
神电电机(厦门)有限公司,http://www.11467.com/xiamen/co/13801.htm
玉林汇泰电子自动化科技发展公司,http://www.11467.com/yulin/co/17215.htm
武汉旷远电子技术有限公司,http://www.11467.com/wuhan/co/142910.htm
人民电器集团无锡电器销售有限公司,http://www.11467.com/wuxi/co/246588.htm
西安宝利铁路器材有限公司,http://www.11467.com/xian/co/67822.htm
广州市得力亚机电设备有限公司,http://www.11467.com/yunfu/co/21721.htm
江阴市玛斯特橡塑电气有限公司,http://www.11467.com/wuxi/co/250034.htm
华瑞自动化有限公司,http://www.11467.com/zhengzhou/co/148256.htm
郑州沃德机电设备有限公司,http://www.11467.com/zhengzhou/co/115226.htm
郑州市飞亚平照明电器有限公司,http://www.11467.com/zhengzhou/co/189228.htm
无锡科汇自动化控制设备科技有限公司,http://www.11467.com/wuxi/co/173506.htm
厦门拉赫工贸有限公司,http://www.11467.com/xiamen/co/28193.htm
厦门市聚成鑫自动化科技有限公司,http://www.11467.com/xiamen/co/49093.htm
无锡市蓝爵电器有限公司,http://www.11467.com/wuxi/co/190740.htm
奥研神控（厦门）电子有限公司,http://www.11467.com/xiamen/co/95388.htm
厦门今明科技电子有限公司,http://www.11467.com/xiamen/co/30776.htm
中山市森特线缆有限公司,http://www.11467.com/zhongshan/co/79537.htm
中山扬曲电子科技有限公司,http://www.11467.com/zhongshan/co/75433.htm
中山市松港金牛电子科技有限公司,http://www.11467.com/zhongshan/co/75287.htm
中山市众欣灯饰电器有限公司,http://www.11467.com/zhongshan/co/152848.htm
中山市锦盛电器有限公司,http://www.11467.com/zhongshan/co/71001.htm
鹤山市宏顺灯饰有限公司,http://www.11467.com/zhongshan/co/80520.htm
珠海市欧莱宝电器有限公司,http://www.11467.com/zhuhai/co/65215.htm
北京东安创新科技有限公司,http://www.11467.com/beijing/co/406398.htm
中山市宝玑电器有限公司,http://www.11467.com/zhongshan/co/78989.htm
中山市超英热保护器有限公司,http://www.11467.com/zhongshan/co/145495.htm
中山市昌宏热保护器有限公司,http://www.11467.com/zhongshan/co/45325.htm
中山市佰信宝电子商务有限公司,http://www.11467.com/zhongshan/co/152690.htm
中山市山崴电气有限公司,http://www.11467.com/zhongshan/co/45613.htm
中山市小可铝制品有限公司,http://www.11467.com/zhongshan/co/134424.htm
中山市格优电器配件有限公司,http://www.11467.com/zhongshan/co/46865.htm
北京市博万特科技有限公司,http://www.11467.com/beijing/co/700276.htm
中山市亿通电器有限公司,http://www.11467.com/zhongshan/co/118229.htm
中山市小榄镇华声热保护器厂有限公司,http://www.11467.com/zhongshan/co/45509.htm
中山市展颢电子有限公司,http://www.11467.com/zhongshan/co/118750.htm
中山市起点电子有限公司,http://www.11467.com/zhongshan/co/152916.htm
中山市光高照明电子科技有限公司,http://www.11467.com/zhongshan/co/153239.htm
珠海市锐星电子科技有限公司,http://www.11467.com/zhuhai/co/75943.htm
珠海雷特电子科技有限公司,http://www.11467.com/zhuhai/co/100081.htm
深圳圣耐精密科技有限公司,http://www.11467.com/shenzhen/co/1004040.htm
深圳市子庚科技有限公司,http://www.11467.com/shenzhen/co/1070430.htm
东莞市久晨电子有限公司,http://www.11467.com/dongguan/co/602487.htm
深圳市维格森科技有限公司,http://www.11467.com/shenzhen/co/983424.htm
上海升羿防爆电器有限公司,http://www.11467.com/shanghai/co/1114158.htm
沈阳创佳华美电器有限公司,http://www.11467.com/shenyang/co/107659.htm
深圳市凯拓林电子科技有限公司,http://www.11467.com/shenzhen/co/835295.htm
深圳市三博荣科技有限公司,http://www.11467.com/shenzhen/co/1060456.htm
中山市汉的灯控电气有限公司,http://www.11467.com/zhongshan/co/167343.htm
四川科飞博光通信科技有限公司,http://www.11467.com/mianyang/co/52725.htm
东莞市卓田电子有限公司,http://www.11467.com/dongguan/co/616107.htm
东莞泰美电器有限公司,http://www.11467.com/dongguan/co/607150.htm
东莞市森义实业有限公司,http://www.11467.com/dongguan/co/616261.htm
深圳启源电子有限公司,http://www.11467.com/shenzhen/co/1088631.htm
兰斯特（武汉）自动化系统工程公司,http://www.11467.com/wuhan/co/197401.htm
上海蕊丰科技有限公司,http://www.11467.com/shanghai/co/1198620.htm
无锡市韩光电器有限公司,http://www.11467.com/wuxi/co/272979.htm
麻城市施迈赛工业自动化有限公司,http://www.11467.com/huanggang/co/19776.htm
深圳市展誉传感器科技有限公司,http://www.11467.com/shenzhen/co/837116.htm
上海博谊自控电气有限公司,http://www.11467.com/shanghai/co/1067871.htm
上海心雨机电有限公司,http://www.11467.com/shanghai/co/1102721.htm
乐清津湾电气有限公司,http://www.11467.com/wenzhou/co/253380.htm
乐清市三口电子科技有限公司,http://www.11467.com/wenzhou/co/294311.htm
北京意昂科技有限公司,http://www.11467.com/beijing/co/735766.htm
西门子香港电器有限公司,http://www.11467.com/guangzhou/co/511858.htm
东莞市佳煌电子有限公司,http://www.11467.com/dongguan/co/615117.htm
深圳多普智能技术有限公司,http://www.11467.com/shenzhen/co/1070286.htm
深圳市佳鼎盛科技有限公司,http://www.11467.com/shenzhen/co/1088270.htm
景德镇金乐琪电子有限公司,http://www.11467.com/jingdezhen/co/18327.htm
瑞丰五金制品（东莞）有限公司,http://www.11467.com/dongguan/co/626037.htm
北京裕林同创自动化技术有限公司,http://www.11467.com/beijing/co/761034.htm
东莞市元迪电子有限公司,http://www.11467.com/dongguan/co/563930.htm
深圳市易科塞德科技有限公司,http://www.11467.com/shenzhen/co/943808.htm
宁波广永电子有限公司,http://www.11467.com/ningbo/co/230983.htm
乐清市青羊电气有限公司,http://www.11467.com/wenzhou/co/310400.htm
深圳智慧季节科技有限公司,http://www.11467.com/shenzhen/co/1088650.htm
东莞市悦势电子有限公司,http://www.11467.com/dongguan/co/563953.htm
广州致能电器科技有限公司,http://www.11467.com/guangzhou/co/544846.htm
佛山市尚兰德电器有限公司,http://www.11467.com/foshan/co/361696.htm
上海航哲自动化设备有限公司,http://www.11467.com/shanghai/co/1260210.htm
深圳市合新源科技有限公司,http://www.11467.com/shenzhen/co/1088443.htm
广州朗牌电器有限公司,http://www.11467.com/guangzhou/co/696842.htm
前海嘉川实业（深圳）有限公司,http://www.11467.com/shenzhen/co/1087098.htm
乐清市尚本电子有限公司,http://www.11467.com/wenzhou/co/324653.htm
深圳市晶利恒科技有限公司,http://www.11467.com/shenzhen/co/838419.htm
厦门德力信智能科技有限公司,http://www.11467.com/xiamen/co/116264.htm
深圳瑞丰同创科技有限公司,http://www.11467.com/foshan/co/380465.htm
乐清唯信电子有限公司,http://www.11467.com/wenzhou/co/280003.htm
杭州中晟电子薄膜有限公司,http://www.11467.com/hangzhou/co/462825.htm
深圳明纬电子有限公司,http://www.11467.com/shenzhen/co/1102645.htm
乐清市圣创防爆电器有限公司,http://www.11467.com/wenzhou/co/219920.htm
东莞市顺鹏电子有限公司,http://www.11467.com/dongguan/co/474352.htm
东莞市创首电子科技有限公司,http://www.11467.com/dongguan/co/523565.htm
东莞市昊发电子有限公司,http://www.11467.com/dongguan/co/262263.htm
深圳市辉鼎盛科技有限公司,http://www.11467.com/shenzhen/co/1128181.htm
东莞市鸿欣电子有限公司,http://www.11467.com/dongguan/co/413599.htm
东莞市裕骅电子有限公司,http://www.11467.com/dongguan/co/557435.htm
东莞市科美电子有限公司,http://www.11467.com/dongguan/co/486881.htm
东莞市汉达实业有限公司,http://www.11467.com/dongguan/co/468733.htm
东莞茂立电子科技有限公司,http://www.11467.com/dongguan/co/641756.htm
东莞照鑫电子有限公司,http://www.11467.com/dongguan/co/557074.htm
乐清市三鑫电子有限公司,http://www.11467.com/dongguan/co/226959.htm
乐清市圣茂电子有限公司,http://www.11467.com/qiye/242119.htm
上海亿丰电气有限公司,http://www.11467.com/shanghai/co/517744.htm
东莞市亮利电子有限公司,http://www.11467.com/dongguan/co/262898.htm
东莞市益谦电子有限公司,http://www.11467.com/dongguan/co/639910.htm
东莞市鼎尚电子有限公司,http://www.11467.com/dongguan/co/413747.htm
浙江西开电气有限公司,http://www.11467.com/wenzhou/co/215642.htm
东莞市如科电子有限公司,http://www.11467.com/dongguan/co/492984.htm
东莞市骏铿电了有限公司,http://www.11467.com/dongguan/co/636648.htm
温州蒙诗尼电气有限公司,http://www.11467.com/wenzhou/co/329810.htm
宁波立顺机电设备有限公司,http://www.11467.com/ningbo/co/232059.htm
深圳市途易电子科技有限公司,http://www.11467.com/qiye/241812.htm
常州市久安电器制造有限公司,http://www.11467.com/changzhou/co/152834.htm
东莞市达昌实业有限公司,http://www.11467.com/dongguan/co/98606.htm
东莞市龙创电子有限公司,http://www.11467.com/dongguan/co/412449.htm
东莞市众博电子有限公司,http://www.11467.com/dongguan/co/410278.htm
浙江贝尔佳电子有限公司东莞分公司,http://www.11467.com/dongguan/co/142736.htm
四川宏幸电气设备有限公司,http://www.11467.com/chengdu/co/285824.htm
江门市余航电子科技有限公司,http://www.11467.com/jiangmen/co/166755.htm
乐清市古尔电气有限公司,http://www.11467.com/wenzhou/co/370403.htm
聊城市宏德力电器有限公司,http://www.11467.com/liaocheng/co/75519.htm
凯顺电子有限公司,http://www.11467.com/shenzhen/co/1128633.htm
上海桂伦工控自动化有限公司,http://www.11467.com/shanghai/co/1270343.htm
东莞市厚和五金有限公司,http://www.11467.com/dongguan/co/478434.htm
乐清市荣达电子有限公司,http://www.11467.com/dongguan/co/258514.htm
深圳市绿环电器有限公司,http://www.11467.com/dongguan/co/556662.htm
东莞市合彩电子有限公司,http://www.11467.com/dongguan/co/491339.htm
东莞市极烨电子科技有限公司,http://www.11467.com/dongguan/co/495433.htm
天津普瑞斯特科技发展有限公司,http://www.11467.com/tianjin/co/137207.htm
杭州金达电子有限公司,http://www.11467.com/hangzhou/co/50852.htm
广州市港祺电子有限公司,http://www.11467.com/guangzhou/co/496454.htm
福州福茂电子有限公司,http://www.11467.com/fuzhou/co/144724.htm
福州新东水暖设备有限公司,http://www.11467.com/fuzhou/co/142787.htm
惠州市朗西实业有限公司,http://www.11467.com/huizhou/co/67039.htm
嘉兴诺剑电子科技有限公司,http://www.11467.com/jiaxing/co/84870.htm
杭州中特电子有限公司,http://www.11467.com/hangzhou/co/49507.htm
佛山市金怡通贸易有限公司,http://www.11467.com/foshan/co/185669.htm
广州誉博五金机电设备有限公司,http://www.11467.com/guangzhou/co/121186.htm
广州市瑞德尔机电设备有限公司,http://www.11467.com/guangzhou/co/90311.htm
杭州鹏胜制冷设备有限公司,http://www.11467.com/hangzhou/co/391377.htm
福州艾尔佳机电设备有限公司,http://www.11467.com/fuzhou/co/181474.htm
广州晋元机电工程有限公司,http://www.11467.com/guangzhou/co/235943.htm
黑龙江鸿伟自动化设备销售有限公司,http://www.11467.com/haerbin/co/42131.htm
广州市科菱电器设备有限公司,http://www.11467.com/guangzhou/co/118782.htm
高要市星平电器有限公司,http://www.11467.com/foshan/co/356304.htm
杭州双盾电子有限公司,http://www.11467.com/hangzhou/co/362631.htm
杭州广鑫机电有限公司,http://www.11467.com/hangzhou/co/211362.htm
富阳创红进出口有限公司,http://www.11467.com/hangzhou/co/369133.htm
平湖开源电子贸易有限公司,http://www.11467.com/jiaxing/co/135216.htm
佛山市的得特电器有限公司,http://www.11467.com/foshan/co/224598.htm
佛山市顺德区精睿电子有限公司,http://www.11467.com/foshan/co/182599.htm
东莞市恒聚电子有限公司,http://www.11467.com/dongguan/co/495425.htm
轩立贸易(深圳)有限公司,http://www.11467.com/dongguan/co/239534.htm
佛山市捷扬电器有限公司,http://www.11467.com/foshan/co/9041.htm
佛山市南海创屹五金配件有限公司,http://www.11467.com/foshan/co/306157.htm
佛山市顺德区富铫塑料包装制品有限公司,http://www.11467.com/foshan/co/227292.htm
佛山善正电子有限公司,http://www.11467.com/foshan/co/182603.htm
福建省闽清君信电器有限公司,http://www.11467.com/fuzhou/co/69248.htm
广州市唐耀电线有限公司,http://www.11467.com/guangzhou/co/125245.htm
广州市锦诺电子有限公司,http://www.11467.com/guangzhou/co/118783.htm
广州铂美电子科技发展有限公司,http://www.11467.com/guangzhou/co/123331.htm
广州电魁电子科技有限公司,http://www.11467.com/guangzhou/co/432467.htm
深圳市福华机电有限公司,http://www.11467.com/shenzhen/co/724280.htm
宁波晨翔电子有限公司,http://www.11467.com/ningbo/co/197734.htm
南京宏聚电子有限公司,http://www.11467.com/nanjing/co/74537.htm
南京稳正电子电器有限公司,http://www.11467.com/nanjing/co/3551.htm
济南一平照明电器有限公司,http://www.11467.com/jinan/co/82433.htm
宁波灵象电器有限公司,http://www.11467.com/ningbo/co/95015.htm
深圳市华奕鹏电子有限公司,http://www.11467.com/shenzhen/co/348618.htm
深圳市科安特电子有限公司,http://www.11467.com/shenzhen/co/133698.htm
深圳市安瑞科电子有限公司,http://www.11467.com/shenzhen/co/141135.htm
深圳市三信微电子有限公司,http://www.11467.com/shenzhen/co/812855.htm
清远市铭道电器有限公司,http://www.11467.com/qingyuan/co/21803.htm
深圳市成贤电器旋钮有限公司,http://www.11467.com/shenzhen/co/90761.htm
如皋市卓凡电子元件有限公司,http://www.11467.com/nantong/co/137889.htm
深圳市红门开科技有限公司沙井分公司,http://www.11467.com/shenzhen/co/766893.htm
深圳市赛皇电器有限公司,http://www.11467.com/jieyang/co/32009.htm
深圳斌兴科技有限公司,http://www.11467.com/shantou/co/152162.htm
深圳市广泰德精密电子有限公司,http://www.11467.com/shenzhen/co/807774.htm
深圳市若士科技有限公司,http://www.11467.com/shenzhen/co/809641.htm
绍兴市玖龙机械自动化有限公司,http://www.11467.com/shaoxing/co/73833.htm
钟祥市中原电子有限责任公司,http://www.11467.com/jingmen/co/6792.htm
深圳市高科泰电子制造有限公司,http://www.11467.com/shenzhen/co/335067.htm
深圳市德莱易控电子有限公司,http://www.11467.com/shenzhen/co/761891.htm
南京哈得恩自动化工程有限公司,http://www.11467.com/nanjing/co/160206.htm
深圳市雷鸟科技有限公司,http://www.11467.com/shenzhen/co/546744.htm
深圳市百力武机电设备有限公司,http://www.11467.com/shenzhen/co/811868.htm
加加力光电科技（深圳）有限公司,http://www.11467.com/shenzhen/co/385546.htm
南京全旺薄膜开关有限公司,http://www.11467.com/nanjing/co/74320.htm
临沂盛耀电气有限公司,http://www.11467.com/linyi/co/107028.htm
绍兴中新电器有限公司,http://www.11467.com/shaoxing/co/10860.htm
沈阳奥克创自动化设备有限公司,http://www.11467.com/shenyang/co/65360.htm
乐清市佳锐电子科技有限公司,http://www.11467.com/shenzhen/co/812632.htm
深圳市睿科智成电子科技有限公司,http://www.11467.com/shenzhen/co/761865.htm
深圳市万宏达电力设备有限公司,http://www.11467.com/shenzhen/co/123887.htm
深圳市杉磁实业有限公司,http://www.11467.com/shenzhen/co/54735.htm
深圳市鸿德达电子有限公司,http://www.11467.com/shenzhen/co/65313.htm
广州市民启电子有限公司,http://www.11467.com/guangzhou/co/696869.htm
上海轩彧工业设备有限公司,http://www.11467.com/shanghai/co/1237510.htm
南通朗格电器有限公司,http://www.11467.com/nantong/co/101719.htm
天津皓正电气科技发展有限公司,http://www.11467.com/tianjin/co/137690.htm
京仁电子(天津)有限公司,http://www.11467.com/tianjin/co/26100.htm
东莞市皓富电子科技有限公司,http://www.11467.com/dongguan/co/563951.htm
深圳市东奥电子有限公司,http://www.11467.com/shenzhen/co/814235.htm
桂林宏研电子贸易有限公司,http://www.11467.com/guilin/co/44177.htm
深圳美凯帝科技有限公司,http://www.11467.com/shenzhen/co/1087535.htm
深圳东奥伟达科技有限公司,http://www.11467.com/shenzhen/co/826480.htm
中山市雷中闪电器有限公司,http://www.11467.com/zhongshan/co/152789.htm
福州家典电器有限公司,http://www.11467.com/fuzhou/co/185675.htm
深圳市拓伟电器有限公司,http://www.11467.com/shenzhen/co/813041.htm
