深圳市复兴伟业技术有限公司,http://www.11467.com/shenzhen/co/731065.htm
天津联科思创科技发展有限公司,http://www.11467.com/tianjin/co/195911.htm
东莞市艾奇诺自动化设备有限公司,http://www.11467.com/dongguan/co/614540.htm
东莞市舜银五金制品有限公司,http://www.11467.com/dongguan/co/262800.htm
广州吉普佳电子科技有限公司,http://www.11467.com/guangzhou/co/242922.htm
惠州冠泰电子有限公司,http://www.11467.com/huizhou/co/66084.htm
乐清市欧璐智能电器有限公司,http://www.11467.com/wenzhou/co/141484.htm
郑州春泉节能股份有限公司,http://www.11467.com/zhengzhou/co/225832.htm
株洲市共创科技有限公司,http://www.11467.com/zhuzhou/co/35216.htm
深圳市华方圆电子有限公司,http://www.11467.com/shenzhen/co/775097.htm
江苏八达钛制品有限公司,http://www.11467.com/taizhoushi/co/53047.htm
石家庄依顿商贸有限公司,http://www.11467.com/shijiazhuang/co/137684.htm
亳州市鑫和电器贸易有限公司,http://www.11467.com/bozhou/co/10603.htm
韶关市英诺维科技设备有限公司,http://www.11467.com/shaoguan/co/23605.htm
深圳市长江连接器有限公司,http://www.11467.com/shenzhen/co/43890.htm
上海申诺科技发展有限公司,http://www.11467.com/dingxi/co/8254.htm
成都南方电子仪表有限公司,http://www.11467.com/chengdu/co/101428.htm
赤峰市康博商贸有限公司,http://www.11467.com/chifeng/co/22784.htm
滁州胜利电器有限公司,http://www.11467.com/chuzhou/co/239.htm
陕西家天意建筑装饰工程有限公司,http://www.11467.com/hanzhong/co/22207.htm
汕尾红海湾耀东塑料五金制品有限公司,http://www.11467.com/shanwei/co/9146.htm
四川飞龙电子材料有限公司,http://www.11467.com/nanchong/co/24593.htm
深圳市夫夷微电子科技有限公司,http://www.11467.com/shenzhen/co/761888.htm
广州宏山自动识别技术有限公司,http://www.11467.com/guangzhou/co/471376.htm
东莞市三焱电子有限公司,http://www.11467.com/dongguan/co/557497.htm
东莞科苏达电子科技有限公司,http://www.11467.com/dongguan/co/558342.htm
东莞市乐磁电子有限公司,http://www.11467.com/dongguan/co/414514.htm
宝鸡市英达泰金属材料有限公司,http://www.11467.com/baoji/co/30782.htm
乐清市吉开电力科技有限公司,http://www.11467.com/wenzhou/co/216802.htm
常州市先特机电有限公司,http://www.11467.com/changzhou/co/152861.htm
合肥希圣自动化设备有限公司,http://www.11467.com/hefei/co/131495.htm
扬州欣达电子有限公司,http://www.11467.com/yangzhou/co/109116.htm
厦门世骏精密电子科技有限公司,http://www.11467.com/xiamen/co/103523.htm
博罗县宏宇创新电子有限公司,http://www.11467.com/huizhou/co/96727.htm
浙江互特电器有限公司,http://www.11467.com/quzhou/co/34073.htm
南京江陵机电集团有限公司,http://www.11467.com/nanjing/co/153069.htm
东莞市维胜五金塑胶有限公司,http://www.11467.com/dongguan/co/557504.htm
宝鸡市捷云科技有限责任公司,http://www.11467.com/baoji/co/30700.htm
扬州长祥电子有限公司,http://www.11467.com/shuozhou/co/11856.htm
铜仁市舒心科技有限责任公司,http://www.11467.com/tongren/co/7482.htm
江苏鸥柯薄膜开关有限公司,http://www.11467.com/changzhou/co/129857.htm
绵阳慧联光通信设备有限公司,http://www.11467.com/mianyang/co/50678.htm
永鸥电气有限公司,http://www.11467.com/leqing/co/23028.htm
无锡旭泰电气有限公司,http://www.11467.com/wuxi/co/176885.htm
深圳市亮键电子科技有限公司,http://www.11467.com/shenzhen/co/983334.htm
天津嘉诺德科贸有限公司,http://www.11467.com/tianjin/co/75220.htm
拓森（厦门）节能设备有限公司,http://www.11467.com/xiamen/co/167199.htm
上海承顶机电设备有限公司,http://www.11467.com/shanghai/co/1217435.htm
上海知进电气科技有限公司,http://www.11467.com/shanghai/co/1084373.htm
深圳市博瑞泰电子有限公司,http://www.11467.com/shenzhen/co/838340.htm
东莞品赞电子科技有限公司,http://www.11467.com/dongguan/co/625883.htm
潮州市汇泰电器实业有限公司,http://www.11467.com/chaozhou/co/23895.htm
温州力沃电器有限公司,http://www.11467.com/wenzhou/co/141600.htm
湖南科通电气设备制造有限公司,http://www.11467.com/xiangtan/co/24344.htm
怀化市川路电子电器有限公司,http://www.11467.com/huaihua/co/3407.htm
丰叶电器制造厂（河源）有限公司,http://www.11467.com/heyuan/co/13607.htm
乐清市拓福电子电器有限公司,http://www.11467.com/wenzhou/co/221387.htm
常熟市凯瑞电器设备有限公司,http://www.11467.com/suzhou/co/357051.htm
江苏中科国腾科技有限公司,http://www.11467.com/wuxi/co/250057.htm
武强县林兴变压器配件有限公司,http://www.11467.com/hengshui/co/27203.htm
上海倍杰自动化科技有限公司,http://www.11467.com/shanghai/co/878577.htm
深圳市登科硅橡胶制品有限公司,http://www.11467.com/shenzhen/co/412857.htm
深圳市美联瑞科技有限公司,http://www.11467.com/shenzhen/co/731162.htm
深圳市宏博轩科技有限公司,http://www.11467.com/shenzhen/co/813377.htm
南京渔麦耘苏机电贸易有限公司,http://www.11467.com/nanjing/co/160210.htm
乐清诚品电气有限公司,http://www.11467.com/wenzhou/co/355356.htm
兴宁市伟华电子制品有限公司,http://www.11467.com/huizhou/co/99035.htm
深圳市幸福铭希电子科技有限公司,http://www.11467.com/jieyang/co/32145.htm
湖南川路科技有限责任公司,http://www.11467.com/huaihua/co/22345.htm
鹰潭乌尔巴兴业金属材料有限公司,http://www.11467.com/yingtan/co/6994.htm
北京匠人世纪科技有限公司,http://www.11467.com/beijing/co/762303.htm
深圳市日昇电子科技有限公司,http://www.11467.com/shenzhen/co/1128509.htm
永州市永邦电器有限公司,http://www.11467.com/yongzhou/co/19054.htm
温州松虹电器有限公司,http://www.11467.com/wenzhou/co/26463.htm
宁波市鄞州求精电器有限公司,http://www.11467.com/ningbo/co/144290.htm
东莞市凯华电子有限公司,http://www.11467.com/dongguan/co/228452.htm
佛山市南海施霸电器制品有限公司,http://www.11467.com/guangzhou/co/244831.htm
安徽德通电气有限责任公司,http://www.11467.com/hefei/co/81069.htm
广州励治冷气机电有限公司,http://www.11467.com/guangzhou/co/442977.htm
余姚市凯莱电器有限公司,http://www.11467.com/ningbo/co/92506.htm
东莞市五盈电子有限公司,http://www.11467.com/dongguan/co/615405.htm
深圳市南岛机电有限公司,http://www.11467.com/shenzhen/co/534155.htm
惠州市宏枫实业有限公司,http://www.11467.com/huizhou/co/66961.htm
惠州市冠毅电子有限公司,http://www.11467.com/huizhou/co/96756.htm
吉安福音电子科技有限公司,http://www.11467.com/jian/co/16968.htm
江苏钟山电子器件有限责任公司,http://www.11467.com/nanjing/co/11845.htm
漳州市名鸟电子机械有限公司,http://www.11467.com/zhangzhou/co/27950.htm
东莞市德崧电子有限公司,http://www.11467.com/dongguan/co/413909.htm
大连同辉机电有限公司,http://www.11467.com/dalian/co/49024.htm
南京世通朗能电气有限公司,http://www.11467.com/nanjing/co/72313.htm
南京钟山薄膜开关有限公司,http://www.11467.com/nanjing/co/11186.htm
中山市宇嘉电线电器有限公司,http://www.11467.com/zhongshan/co/71284.htm
山东汉诺精机自动化科技有限公司,http://www.11467.com/weifang/co/174114.htm
南京通群机电科技有限公司,http://www.11467.com/nanjing/co/53285.htm
南昌市常安机电设备有限公司,http://www.11467.com/nanchang/co/103686.htm
东莞市科伟自动化设备有限公司,http://www.11467.com/dongguan/co/87943.htm
沈阳市鑫源电器有限公司,http://www.11467.com/shenyang/co/90791.htm
深圳市科蓬达电子有限公司,http://www.11467.com/shenzhen/co/14900.htm
东莞唯佳电子有限公司,http://www.11467.com/dongguan/co/21579.htm
佛山市顺德区美至美电器制造有限公司,http://www.11467.com/dongguan/co/556948.htm
上海七力电子科技有限公司,http://www.11467.com/shanghai/co/1048946.htm
深圳市宇思岸电子有限公司,http://www.11467.com/shenzhen/co/392541.htm
天津市海源自控系统有限公司,http://www.11467.com/tianjin/co/137707.htm
天津市高德电器设备销售有限公司,http://www.11467.com/tianjin/co/211798.htm
杭州科赛控制技术有限公司,http://www.11467.com/hangzhou/co/210633.htm
深圳市西柯南电子科技有限公司,http://www.11467.com/shenzhen/co/413307.htm
沈阳市博瑞斯五金机电有限公司,http://www.11467.com/shenyang/co/77119.htm
开封中志工控仪表有限公司,http://www.11467.com/kaifeng/co/16775.htm
南京滨购贸易有限公司,http://www.11467.com/nanjing/co/153068.htm
江山市风远电器制造有限公司,http://www.11467.com/quzhou/co/25157.htm
杭州广安汽车电器有限公司,http://www.11467.com/hangzhou/co/311387.htm
广州创兆电电子科技有限公司,http://www.11467.com/guangzhou/co/496791.htm
嘉兴市英耐德电器有限公司,http://www.11467.com/jiaxing/co/123625.htm
深圳市源佳科技有限公司,http://www.11467.com/shenzhen/co/813334.htm
苏州海泰克电梯有限公司,http://www.11467.com/suzhou/co/294282.htm
苏州明浩电子有限公司,http://www.11467.com/suzhou/co/179058.htm
赣州市众盈铭牌有限公司,http://www.11467.com/ganzhou/co/40078.htm
泰州市惠泽机械有限公司,http://www.11467.com/taizhoushi/co/28581.htm
深圳市百斯特电子有限公司,http://www.11467.com/shenzhen/co/88337.htm
深圳市恒思特科技有限公司,http://www.11467.com/shenzhen/co/129237.htm
深圳市鸿壹部品电子有限公司,http://www.11467.com/shenzhen/co/777072.htm
乐清市津皓电气有限公司,http://www.11467.com/wenzhou/co/223756.htm
武汉万富通电气有限公司,http://www.11467.com/wuhan/co/55276.htm
乐清市智源电力科技有限公司,http://www.11467.com/wenzhou/co/220706.htm
苏州工业园区思威电子有限公司,http://www.11467.com/suzhou/co/10834.htm
温州市阿木伦电气有限公司,http://www.11467.com/wenzhou/co/221389.htm
上海模尚薄膜开关有限公司,http://www.11467.com/shanghai/co/164078.htm
武汉宇恒电子有限公司,http://www.11467.com/wuhan/co/76729.htm
乐清市乐业电子科技有限公司,http://www.11467.com/wenzhou/co/216774.htm
天津索龙电子科技有限公司,http://www.11467.com/tianjin/co/137495.htm
珠海拓林电子科技有限公司,http://www.11467.com/zhuhai/co/8022.htm
乐清市福一开关有限公司,http://www.11467.com/wenzhou/co/218009.htm
浙江宏立电器有限公司,http://www.11467.com/wenzhou/co/224120.htm
深圳市宝力源视听科技有限公司,http://www.11467.com/shenzhen/co/460841.htm
无锡志恒自动化系统有限公司,http://www.11467.com/wuxi/co/150279.htm
乐清市天璐电器有限公司,http://www.11467.com/wenzhou/co/219925.htm
乐清市欧特电气有限公司,http://www.11467.com/wenzhou/co/222925.htm
深圳市沃尔克自动化控制有限公司,http://www.11467.com/shenzhen/co/723072.htm
东莞市研伦电气有限公司,http://www.11467.com/dongguan/co/414980.htm
温州爱普电气有限公司,http://www.11467.com/wenzhou/co/219018.htm
浙江兴星电子有限公司,http://www.11467.com/wenzhou/co/220720.htm
乐清市弘基电子有限公司,http://www.11467.com/wenzhou/co/216738.htm
深圳市亿泽鑫科技有限公司,http://www.11467.com/shenzhen/co/278299.htm
中山市顺宏电气有限公司,http://www.11467.com/zhongshan/co/79063.htm
武汉菲舍控制技术有限公司,http://www.11467.com/wuhan/co/146431.htm
深圳市晨科科技发展有限公司,http://www.11467.com/shenzhen/co/401482.htm
郑州正实科技有限公司,http://www.11467.com/zhengzhou/co/178038.htm
深圳市宇泰尔科技有限公司,http://www.11467.com/shenzhen/co/812127.htm
深圳市蓝之宇电子有限公司,http://www.11467.com/shenzhen/co/123751.htm
深圳市民兰鼎电子有限公司,http://www.11467.com/shenzhen/co/466510.htm
乐清市铭佳电气有限公司,http://www.11467.com/wenzhou/co/223360.htm
乐清市艾唯利电子有限公司,http://www.11467.com/wenzhou/co/225301.htm
乐清市金鼎电子科技有限公司,http://www.11467.com/wenzhou/co/219064.htm
深圳市比特科技有限公司,http://www.11467.com/shenzhen/co/9138.htm
中山市东峰电子有限公司,http://www.11467.com/zhongshan/co/153224.htm
厦门汉盛电子有限公司,http://www.11467.com/xiamen/co/46394.htm
烟台冰河制冷空调设备有限公司,http://www.11467.com/yantai/co/135800.htm
深圳市奥立科控制系统有限公司,http://www.11467.com/shenzhen/co/140218.htm
昆山卓南电子有限公司,http://www.11467.com/suzhou/co/314052.htm
安徽淏民水控科技有限责任公司,http://www.11467.com/tongling/co/16511.htm
上海迪尼电器有限公司,http://www.11467.com/wenzhou/co/219914.htm
佛山市奇创自动化设备有限公司,http://www.11467.com/foshan/co/229136.htm
东莞市福鹰电子有限公司,http://www.11467.com/dongguan/co/142203.htm
东莞市晶森电子科技有限公司,http://www.11467.com/dongguan/co/258560.htm
东莞市德凌塑胶电子有限公司,http://www.11467.com/dongguan/co/488683.htm
东莞市时德电子有限公司,http://www.11467.com/dongguan/co/490691.htm
东莞市永捷电子有限公司,http://www.11467.com/dongguan/co/46759.htm
常州市昊诚电子有限公司,http://www.11467.com/changzhou/co/112460.htm
佛山市顺德区顺燊电器有限公司,http://www.11467.com/foshan/co/356301.htm
潮州市金宏达实业有限公司,http://www.11467.com/chaozhou/co/24112.htm
沧州德信佳力电子有限公司,http://www.11467.com/cangzhou/co/40495.htm
温州市宏亚电器有限公司,http://www.11467.com/wenzhou/co/26494.htm
东莞市智胜净化技术有限公司,http://www.11467.com/dongguan/co/294866.htm
佛山市顺德区精恒弹簧实业有限公司,http://www.11467.com/foshan/co/67649.htm
东莞市国菱电子有限公司,http://www.11467.com/dongguan/co/265281.htm
东莞市森宏电子有限公司,http://www.11467.com/dongguan/co/507049.htm
青县大宇电子设备有限公司,http://www.11467.com/cangzhou/co/30901.htm
东莞市韩荣电子有限公司,http://www.11467.com/dongguan/co/492956.htm
东莞市利托电子有限公司,http://www.11467.com/dongguan/co/257074.htm
沧县宝利印刷有限公司,http://www.11467.com/cangzhou/co/5461.htm
东莞市德秦电子材料有限公司,http://www.11467.com/dongguan/co/142454.htm
东莞市桑炫贸易有限公司,http://www.11467.com/dongguan/co/482702.htm
东莞市太宇电子有限公司,http://www.11467.com/dongguan/co/242036.htm
东莞市广督实业有限公司,http://www.11467.com/dongguan/co/460180.htm
东莞市普佳电子科技有限公司,http://www.11467.com/dongguan/co/555803.htm
东莞市康深电子科技有限公司,http://www.11467.com/dongguan/co/466757.htm
东莞市泰耀电子有限公司,http://www.11467.com/dongguan/co/235741.htm
常州科能电子有限公司,http://www.11467.com/changzhou/co/32855.htm
任丘市精工电力器材制造有限公司,http://www.11467.com/cangzhou/co/46171.htm
东莞市苏迪罗电子科技有限公司,http://www.11467.com/dongguan/co/488240.htm
东莞宙达电子科技有限公司,http://www.11467.com/dongguan/co/499334.htm
东莞市志成康福星实业有限公司,http://www.11467.com/dongguan/co/130347.htm
东莞市汉江精密机械有限公司,http://www.11467.com/dongguan/co/303719.htm
东莞市天台电子有限公司,http://www.11467.com/dongguan/co/507284.htm
东莞市稳金五金有限公司,http://www.11467.com/dongguan/co/454771.htm
东莞国昱电子有限公司,http://www.11467.com/dongguan/co/264499.htm
东莞市特赛豪电子有限公司,http://www.11467.com/dongguan/co/260208.htm
东莞市金峰金属材料有限公司,http://www.11467.com/dongguan/co/133976.htm
东莞市恒意电子科技有限公司,http://www.11467.com/dongguan/co/557315.htm
东莞市元利富电子科技有限公司,http://www.11467.com/dongguan/co/46469.htm
东莞市顺翔电子有限公司,http://www.11467.com/dongguan/co/259537.htm
深圳市亮群电子有限公司,http://www.11467.com/dongguan/co/411350.htm
温州安瑞其电器有限公司,http://www.11467.com/wenzhou/co/140392.htm
深圳市信为科技发展有限公司,http://www.11467.com/shenzhen/co/129169.htm
深圳市侨迪电子有限公司,http://www.11467.com/wenzhou/co/141608.htm
深圳市亚隆电器有限公司,http://www.11467.com/shenzhen/co/729690.htm
浙江上力电器有限公司,http://www.11467.com/wenzhou/co/143648.htm
温州莉格电器有限公司,http://www.11467.com/wenzhou/co/140383.htm
乐清巨杰电气有限公司,http://www.11467.com/wenzhou/co/141606.htm
昆山博瑞电子科技有限公司,http://www.11467.com/suzhou/co/234357.htm
温州市汤斯电器有限公司,http://www.11467.com/wenzhou/co/140256.htm
深圳市杰能宝智能科技有限公司,http://www.11467.com/shenzhen/co/728741.htm
乐清市福田电器有限公司,http://www.11467.com/wenzhou/co/217957.htm
铜陵市诚泰线缆有限责任公司,http://www.11467.com/tongling/co/11346.htm
温州海亿电器科技有限公司,http://www.11467.com/wenzhou/co/124864.htm
浙江三利电气科技有限公司,http://www.11467.com/wenzhou/co/221382.htm
深圳市凝锐电子科技有限公司,http://www.11467.com/shenzhen/co/761876.htm
上海顿邦电气科技有限公司,http://www.11467.com/wenzhou/co/140543.htm
乐清市七洋电子有限公司,http://www.11467.com/wenzhou/co/217962.htm
温州思万奇科技有限公司,http://www.11467.com/wenzhou/co/219069.htm
浙江中普防爆电器有限公司,http://www.11467.com/wenzhou/co/216783.htm
苏州达菱工控设备有限公司,http://www.11467.com/suzhou/co/242547.htm
卓合国际贸易(上海)有限公司,http://www.11467.com/shenzhen/co/413314.htm
乐清市民达仪器仪表有限公司,http://www.11467.com/wenzhou/co/219710.htm
浙江紫瑞电子有限公司,http://www.11467.com/wenzhou/co/216899.htm
武汉微科特传感器有限公司,http://www.11467.com/wuhan/co/141866.htm
乐清市南灿电气有限公司,http://www.11467.com/wenzhou/co/216752.htm
乐清市鸿润电气有限公司,http://www.11467.com/wenzhou/co/219907.htm
乐清市海康电子有限公司,http://www.11467.com/wenzhou/co/216746.htm
乐清市西普电子科技有限公司,http://www.11467.com/wenzhou/co/216726.htm
乐清市豪尼斯电气有限公司,http://www.11467.com/wenzhou/co/216792.htm
乐清市益瑞电器有限公司,http://www.11467.com/wenzhou/co/222452.htm
深圳市艾尔美科技有限公司,http://www.11467.com/shenzhen/co/399825.htm
深圳市星航智能科技发展有限公司,http://www.11467.com/shenzhen/co/71926.htm
上海皖通电力科技有限公司,http://www.11467.com/wenzhou/co/217969.htm
温州鼎和电子有限公司,http://www.11467.com/wenzhou/co/216902.htm
深圳市捷迈科技发展有限公司,http://www.11467.com/shenzhen/co/399869.htm
苏州久德机电科技有限公司,http://www.11467.com/suzhou/co/206487.htm
温州宝翔电气有限公司,http://www.11467.com/wenzhou/co/74366.htm
日昇电子科技有限公司,http://www.11467.com/shenzhen/co/721783.htm
厦门卿顺自动化科技有限公司,http://www.11467.com/xiamen/co/46012.htm
深圳市日展电子有限公司,http://www.11467.com/shenzhen/co/813826.htm
深圳凯进电子科技有限公司,http://www.11467.com/shenzhen/co/727842.htm
东莞市高飞电子科技有限公司,http://www.11467.com/dongguan/co/225850.htm
厦门市宏宇发电子有限公司,http://www.11467.com/xiamen/co/2234.htm
厦门市捷佳鑫电子有限公司,http://www.11467.com/xiamen/co/61119.htm
徐州上达科技有限公司,http://www.11467.com/xuzhou/co/56024.htm
天津市津耐电器有限公司,http://www.11467.com/tianjin/co/168079.htm
中山市河森五金电器有限公司,http://www.11467.com/zhongshan/co/147018.htm
深圳市柯玛斯科技有限公司,http://www.11467.com/shenzhen/co/367334.htm
厦门巨创科技有限公司,http://www.11467.com/xiamen/co/20473.htm
无锡市瑞莱电器有限公司,http://www.11467.com/wuxi/co/215043.htm
无锡市江泉机电有限公司,http://www.11467.com/wuxi/co/117813.htm
天津市智拓达科技有限公司,http://www.11467.com/tianjin/co/137851.htm
中山市芯灵点电子有限公司,http://www.11467.com/zhongshan/co/153163.htm
天津市启宏达机电设备有限公司,http://www.11467.com/tianjin/co/196357.htm
江西金比电子有限公司,http://www.11467.com/fuzhoushi/co/22152.htm
深圳市柯玛斯科技有限公司,http://www.11467.com/shenzhen/co/367334.htm
上海硕印电子科技有限公司,http://www.11467.com/shanghai/co/1037842.htm
天津威斯康电能补偿系统有限公司,http://www.11467.com/tianjin/co/34730.htm
中山市钰山橡胶电子有限公司,http://www.11467.com/zhongshan/co/26446.htm
太原领豪科技有限公司,http://www.11467.com/taiyuan/co/129812.htm
无锡市吉斯安自动化科技有限公司,http://www.11467.com/wuxi/co/176624.htm
厦门福控电气设备有限公司,http://www.11467.com/xiamen/co/10406.htm
乐清市恒龙机电有限公司,http://www.11467.com/wenzhou/co/216804.htm
中山市名迪电器有限公司,http://www.11467.com/zhongshan/co/118194.htm
珠海市钰星电子有限公司,http://www.11467.com/zhuhai/co/78219.htm
中山市乐磁电子有限公司,http://www.11467.com/zhongshan/co/140191.htm
天津市泰益通科技有限公司,http://www.11467.com/tianjin/co/141150.htm
武汉鑫盛达机电设备有限公司,http://www.11467.com/wuhan/co/143110.htm
苏州索尔安电子有限公司,http://www.11467.com/suzhou/co/235472.htm
东莞市凯诚自动化设备有限公司,http://www.11467.com/qiye/12751.htm
福州兴创源电气有限公司,http://www.11467.com/qiye/13043.htm
宁波金晟杰机电有限公司,http://www.11467.com/ningbo/co/230874.htm
福州泽通电子有限公司,http://www.11467.com/qiye/23826.htm
沈阳宝鑫达五金机电有限公司,http://www.11467.com/shenyang/co/60348.htm
东莞市百灵电子有限公司,http://www.11467.com/dongguan/co/139877.htm
东莞市富鹏电子有限公司,http://www.11467.com/dongguan/co/136211.htm
常州市西王裕华电子有限公司,http://www.11467.com/changzhou/co/101818.htm
东莞市东尼电子科技有限公司,http://www.11467.com/dongguan/co/555992.htm
东莞高星电子有限公司,http://www.11467.com/dongguan/co/47760.htm
成都华臻科技有限公司,http://www.11467.com/chengdu/co/104411.htm
成都力图物资贸易有限公司,http://www.11467.com/chengdu/co/104608.htm
天长市佳尔电子有限公司,http://www.11467.com/chuzhou/co/21733.htm
慈溪市锐特电子科技有限公司,http://www.11467.com/cixi/co/16275.htm
丹东惠凯电器有限责任公司,http://www.11467.com/dandong/co/5484.htm
东莞市德艺隆电子有限公司,http://www.11467.com/dongguan/co/142656.htm
东莞市乐辉电子有限公司,http://www.11467.com/dongguan/co/412447.htm
常州市科纳思传感器有限公司,http://www.11467.com/changzhou/co/129907.htm
东莞市开通电子有限公司,http://www.11467.com/dongguan/co/495430.htm
东莞市富宽源电子有限公司,http://www.11467.com/dongguan/co/493076.htm
常州康凯仪表有限公司,http://www.11467.com/changzhou/co/129372.htm
天长市科信电子有限公司,http://www.11467.com/chuzhou/co/25713.htm
东莞市皓宇电子有限公司,http://www.11467.com/dongguan/co/46947.htm
东莞市博川电气有限公司,http://www.11467.com/dongguan/co/490546.htm
东莞市大星电子有限公司,http://www.11467.com/dongguan/co/142352.htm
东莞市奥普机电有限公司,http://www.11467.com/dongguan/co/524934.htm
常州银冠智能科技有限公司,http://www.11467.com/changzhou/co/91999.htm
东莞市德沃电子科技有限公司,http://www.11467.com/dongguan/co/490541.htm
东莞市骏铿电子有限公司,http://www.11467.com/dongguan/co/226764.htm
东莞市乐臻电子五金有限公司,http://www.11467.com/dongguan/co/134992.htm
常州翰轩电子有限公司,http://www.11467.com/changzhou/co/144949.htm
东莞市攀迪电子科技有限公司,http://www.11467.com/dongguan/co/262450.htm
东莞市浩盛电子科技有限公司,http://www.11467.com/dongguan/co/411339.htm
东莞市佳汶塑胶电子有限公司,http://www.11467.com/dongguan/co/206101.htm
东莞市欧上电子科技有限公司,http://www.11467.com/dongguan/co/136899.htm
东莞市冠钧电子科技有限公司,http://www.11467.com/dongguan/co/513774.htm
东莞市力度电子有限公司,http://www.11467.com/dongguan/co/479967.htm
东莞市广诚机电设备有限公司,http://www.11467.com/dongguan/co/411334.htm
东莞市腾杰机械科技有限公司,http://www.11467.com/dongguan/co/468260.htm
东莞市美伦电工材料有限公司,http://www.11467.com/dongguan/co/466507.htm
东莞市高敏电子有限公司,http://www.11467.com/dongguan/co/140829.htm
东莞市赛宏电子科技有限公司,http://www.11467.com/dongguan/co/411357.htm
东莞市创跃自动化设备有限公司,http://www.11467.com/dongguan/co/293261.htm
东莞市创誉电子有限公司,http://www.11467.com/dongguan/co/357651.htm
东莞市杰祺电子有限公司,http://www.11467.com/dongguan/co/547627.htm
东莞市嘉准电子科技有限公司,http://www.11467.com/dongguan/co/136821.htm
东莞市广龙自动化设备有限公司,http://www.11467.com/dongguan/co/557352.htm
东莞市欧西普电子有限公司,http://www.11467.com/dongguan/co/137162.htm
东莞市腾越电子有限公司,http://www.11467.com/dongguan/co/225840.htm
