东莞市南煌实业有限公司,http://www.11467.com/dongguan/co/456260.htm
东莞市科宇电器有限公司,http://www.11467.com/dongguan/co/557226.htm
东莞市联烨电子有限公司,http://www.11467.com/dongguan/co/557437.htm
东莞市尼亚电子科技有限公司,http://www.11467.com/dongguan/co/557196.htm
东莞市闽越电子科技有限公司,http://www.11467.com/dongguan/co/548855.htm
东莞市汩天实业有限公司,http://www.11467.com/dongguan/co/293859.htm
东莞市铭家电子科技有限公司,http://www.11467.com/dongguan/co/475171.htm
东莞市禾鸿洋电子有限公司,http://www.11467.com/dongguan/co/256955.htm
东莞市合智电子有限公司,http://www.11467.com/dongguan/co/490549.htm
东莞市高拓电子科技有限公司,http://www.11467.com/dongguan/co/529961.htm
东莞市捷笙电子有限公司,http://www.11467.com/dongguan/co/259873.htm
东莞市嘉百电子有限公司,http://www.11467.com/dongguan/co/411450.htm
东莞市凝锐开关有限公司,http://www.11467.com/dongguan/co/257942.htm
东莞市欣华电线有限公司,http://www.11467.com/dongguan/co/143644.htm
惠州市贝尔佳电子有限公司,http://www.11467.com/dongguan/co/142456.htm
东莞市文凤电子元件有限公司,http://www.11467.com/dongguan/co/259674.htm
东莞市韩晶电子有限公司,http://www.11467.com/dongguan/co/557232.htm
东莞市鑫凯塑胶五金有限公司,http://www.11467.com/dongguan/co/140032.htm
东莞市西弗莱电子有限公司,http://www.11467.com/dongguan/co/492967.htm
东莞市跳祥电子有限公司,http://www.11467.com/dongguan/co/552776.htm
东莞市顺优电子有限公司,http://www.11467.com/dongguan/co/490623.htm
东莞市谐煌塑胶电子有限公司,http://www.11467.com/dongguan/co/199523.htm
东莞市日鑫电子有限公司,http://www.11467.com/dongguan/co/490558.htm
东莞市新东五金电器有限公司,http://www.11467.com/dongguan/co/309039.htm
东莞市盈合电子制品有限公司,http://www.11467.com/dongguan/co/224530.htm
东莞市杨杰精密电子有限公司,http://www.11467.com/dongguan/co/228732.htm
东莞市旭通电子有限公司,http://www.11467.com/dongguan/co/260950.htm
东莞市泽田电子有限公司,http://www.11467.com/dongguan/co/229409.htm
东莞市中林电气设备有限公司,http://www.11467.com/dongguan/co/415738.htm
东莞市田都电子有限公司,http://www.11467.com/dongguan/co/241991.htm
东莞市鲜明电子有限公司,http://www.11467.com/dongguan/co/227850.htm
东莞市欣余电子材料有限公司,http://www.11467.com/dongguan/co/295273.htm
东莞市日威电器有限公司,http://www.11467.com/dongguan/co/247363.htm
东莞市顺帆电子科技有限公司,http://www.11467.com/dongguan/co/474349.htm
东莞市威浩电子科技有限公司,http://www.11467.com/dongguan/co/413397.htm
东莞市盈飞电子有限公司,http://www.11467.com/dongguan/co/266082.htm
东莞市事兴电子有限公司,http://www.11467.com/dongguan/co/128422.htm
东莞市华标电子科技有限公司,http://www.11467.com/dongguan/co/222436.htm
东莞市宏霞电子有限公司,http://www.11467.com/dongguan/co/259102.htm
东莞市红东电子有限公司,http://www.11467.com/dongguan/co/412446.htm
东莞市亚龙自动化设备有限公司,http://www.11467.com/dongguan/co/62072.htm
东莞市富格电器元件有限公司,http://www.11467.com/dongguan/co/218989.htm
东莞市艳生自动化设备有限公司,http://www.11467.com/dongguan/co/313756.htm
东莞市亿典五金科技有限公司,http://www.11467.com/dongguan/co/136280.htm
东莞市亚森路电子有限公司,http://www.11467.com/dongguan/co/409956.htm
东莞市益荣电子有限公司,http://www.11467.com/dongguan/co/410210.htm
东莞市盈达自动化设备有限公司,http://www.11467.com/dongguan/co/506050.htm
东莞市双腾气动液压件有限公司,http://www.11467.com/dongguan/co/490306.htm
佛山市军红电子有限公司,http://www.11467.com/foshan/co/234681.htm
东莞市丰正电子有限公司,http://www.11467.com/dongguan/co/411290.htm
深圳市正久电子科技有限公司,http://www.11467.com/dongguan/co/556656.htm
佛山市顺德区中江节能电子有限公司,http://www.11467.com/foshan/co/240506.htm
深圳市欧特森电子有限公司,http://www.11467.com/dongguan/co/556402.htm
东莞市友晖电子有限公司,http://www.11467.com/dongguan/co/268963.htm
东莞市正雅电子有限公司,http://www.11467.com/dongguan/co/556389.htm
东莞市卓佳五金电子有限公司,http://www.11467.com/dongguan/co/465094.htm
佛山市舰宏电子科技有限公司,http://www.11467.com/foshan/co/337480.htm
乐清市长华电子有限公司,http://www.11467.com/dongguan/co/412366.htm
深圳市永顺裕电子有限公司,http://www.11467.com/dongguan/co/241224.htm
深圳市创深电子有限公司,http://www.11467.com/dongguan/co/557180.htm
佛山市其尚电器有限公司,http://www.11467.com/foshan/co/356265.htm
东莞市友胜电子有限公司,http://www.11467.com/dongguan/co/226893.htm
广东省东莞市创辉电子科技有限公司,http://www.11467.com/dongguan/co/242051.htm
东莞市普辉绝缘材料有限公司,http://www.11467.com/dongguan/co/226539.htm
佛山市晋善建贸易有限公司,http://www.11467.com/foshan/co/185868.htm
佛山市往易机电有限公司,http://www.11467.com/foshan/co/308046.htm
佛山腾晨电子电器有限公司,http://www.11467.com/foshan/co/356197.htm
佛山恒众达自控设备有限公司,http://www.11467.com/foshan/co/185954.htm
佛山市钜鑫电器有限公司,http://www.11467.com/foshan/co/355939.htm
佛山市南海区海乐电器实业有限公司,http://www.11467.com/foshan/co/104562.htm
东莞市正中电子有限公司,http://www.11467.com/dongguan/co/266813.htm
佛山市顺德区绅士电器有限公司,http://www.11467.com/foshan/co/305528.htm
佛山市南海区大沥胜茂机电有限公司,http://www.11467.com/foshan/co/185867.htm
舟山市天正电器贸易有限公司,http://www.11467.com/dongguan/co/140391.htm
东莞隆鑫测控科技有限公司,http://www.11467.com/dongguan/co/477375.htm
东莞市菱记电子有限公司,http://www.11467.com/dongguan/co/411211.htm
佛山市民扬五金电器有限公司,http://www.11467.com/foshan/co/8803.htm
深圳市昌德成电子有限公司,http://www.11467.com/dongguan/co/236627.htm
佛山市顺德区源峰五金电器有限公司,http://www.11467.com/foshan/co/226858.htm
佛山市南海腾亚电器有限公司,http://www.11467.com/foshan/co/229056.htm
东莞市六钧电子五金有限公司,http://www.11467.com/dongguan/co/237167.htm
东莞市菲比电子科技有限公司,http://www.11467.com/dongguan/co/557181.htm
佛山市皓宝电器有限公司,http://www.11467.com/foshan/co/234485.htm
佛山市达能工业自动化有限公司,http://www.11467.com/foshan/co/69033.htm
佛山市顺德区松维电器有限公司,http://www.11467.com/foshan/co/224746.htm
佛山市南海区建明贸易有限公司,http://www.11467.com/foshan/co/334854.htm
杭州纳隆电子科技有限公司,http://www.11467.com/hangzhou/co/369856.htm
合肥环信科技发展有限公司,http://www.11467.com/hefei/co/55223.htm
廊坊市百特电子有限公司,http://www.11467.com/langfang/co/21688.htm
合肥爱默尔电子科技有限公司,http://www.11467.com/hefei/co/90869.htm
合肥良品机电科技有限公司,http://www.11467.com/hefei/co/90825.htm
济南恒影光电产品开发有限公司,http://www.11467.com/jinan/co/81022.htm
嘉兴市峰德利亚电器有限公司,http://www.11467.com/jiaxing/co/79914.htm
嘉兴市沃达电气有限公司,http://www.11467.com/jiaxing/co/80131.htm
惠州市瑞新工业设备有限公司,http://www.11467.com/huizhou/co/57072.htm
广州市明大自动化设备有限公司,http://www.11467.com/guangzhou/co/118851.htm
衡阳佥立汽车配件制造有限公司,http://www.11467.com/hengyang/co/24941.htm
杭州赛盾门控设备有限公司,http://www.11467.com/hangzhou/co/391139.htm
广州正耀电子科技有限公司,http://www.11467.com/guangzhou/co/263921.htm
合肥荣佳电气设备有限公司,http://www.11467.com/hefei/co/81214.htm
临安科力自动化工程有限公司,http://www.11467.com/hangzhou/co/327145.htm
杭州弗雷电气有限公司,http://www.11467.com/hangzhou/co/311339.htm
杭州天马时控科技有限公司,http://www.11467.com/hangzhou/co/368903.htm
嘉兴兆圣电子有限公司,http://www.11467.com/jiaxing/co/117818.htm
杭州嘉川科技有限公司,http://www.11467.com/hangzhou/co/369112.htm
杭州宏凌电子有限公司,http://www.11467.com/hangzhou/co/252357.htm
杭州合新薄膜开关有限公司,http://www.11467.com/hangzhou/co/253338.htm
杭州玛实迪电器科技有限公司,http://www.11467.com/hangzhou/co/211083.htm
惠州市金田电气有限公司,http://www.11467.com/huizhou/co/81814.htm
平湖市欧凯贸易有限公司,http://www.11467.com/jiaxing/co/135213.htm
杭州华贝电子薄膜开关有限公司,http://www.11467.com/hangzhou/co/211692.htm
杭州尺上电子有限公司,http://www.11467.com/hangzhou/co/249619.htm
杭州法珀激光科技有限公司,http://www.11467.com/hangzhou/co/245475.htm
广州市达联电力设备有限公司,http://www.11467.com/guangzhou/co/119712.htm
广州市嘉艺电子薄膜开关有限公司,http://www.11467.com/guangzhou/co/252071.htm
广州市杰睿电子科技有限公司,http://www.11467.com/guangzhou/co/433034.htm
惠州市丰菱电子科技有限公司,http://www.11467.com/huizhou/co/90765.htm
惠州市海牛电器有限公司,http://www.11467.com/huizhou/co/4957.htm
杭州亮派科技有限公司,http://www.11467.com/hangzhou/co/248242.htm
杭州亿嘉薄膜开关有限公司,http://www.11467.com/hangzhou/co/391244.htm
耐思电气（嘉兴）有限公司,http://www.11467.com/jiaxing/co/86398.htm
余姚市华亚电子有限公司,http://www.11467.com/ningbo/co/92975.htm
宁波海曙穆雷自控仪表有限公司,http://www.11467.com/ningbo/co/28369.htm
宁波江东亿波电子有限公司,http://www.11467.com/ningbo/co/92649.htm
宁波江东永利电子元件有限公司,http://www.11467.com/ningbo/co/100197.htm
秦皇岛金兰电器有限责任公司,http://www.11467.com/qinhuangdao/co/22480.htm
天诺电器有限公司,http://www.11467.com/shangqiu/co/15985.htm
宁波市镇海友通电子有限公司,http://www.11467.com/ningbo/co/99205.htm
南平市旭光电子科技有限公司,http://www.11467.com/nanping/co/2678.htm
洛阳华聚消防设备有限公司,http://www.11467.com/luoyang/co/48191.htm
南昌市鲍尔电气有限公司,http://www.11467.com/nanchang/co/82852.htm
南京恺华电子科技有限公司,http://www.11467.com/nanjing/co/78361.htm
南京智立华电子有限公司,http://www.11467.com/nanjing/co/149092.htm
南通杰诺电气设备有限公司,http://www.11467.com/nantong/co/137210.htm
莆田市荔城区亿松贸易有限公司,http://www.11467.com/putian/co/28732.htm
南京茶花电子有限公司,http://www.11467.com/nanjing/co/75539.htm
南京巨科电子有限公司,http://www.11467.com/nanjing/co/76313.htm
南京眙商仪器仪表有限公司,http://www.11467.com/nanjing/co/153816.htm
南京宁恒科技有限公司,http://www.11467.com/nanjing/co/114574.htm
南昌科威自动化有限公司,http://www.11467.com/nanchang/co/45160.htm
缙云县博海电子有限公司,http://www.11467.com/lincang/co/6897.htm
南京见田机电有限公司,http://www.11467.com/nanjing/co/74527.htm
丽水市长新电器制造有限公司,http://www.11467.com/lishui/co/16859.htm
南通冠能电器有限公司,http://www.11467.com/nantong/co/132343.htm
浙江乐马电气有限公司,http://www.11467.com/ningbo/co/94762.htm
南京大王暖通电气有限公司,http://www.11467.com/nanjing/co/147361.htm
南京亮瑜电器有限公司,http://www.11467.com/nanjing/co/114904.htm
慈溪盛安电子有限公司,http://www.11467.com/ningbo/co/192916.htm
南通杰润电子科技有限公司,http://www.11467.com/nantong/co/132402.htm
启东市博强冶金设备制造有限公司,http://www.11467.com/nantong/co/137103.htm
南京攀峰电子电器有限公司,http://www.11467.com/nanjing/co/114729.htm
南京越美电气有限公司,http://www.11467.com/nanjing/co/53568.htm
南京盛企电子有限公司,http://www.11467.com/nanjing/co/54601.htm
南京弘恩电子科技有限公司,http://www.11467.com/nanjing/co/150390.htm
临沂艳阳灯饰有限公司,http://www.11467.com/linyi/co/10701.htm
宁波市江东黑珍珠电子科技开发有限公司,http://www.11467.com/ningbo/co/92413.htm
深圳陈氏光星电子科技有限公司,http://www.11467.com/shenzhen/co/724388.htm
深圳市奥盛利电子有限公司,http://www.11467.com/shenzhen/co/728894.htm
深圳金福群电子科技有限公司,http://www.11467.com/shenzhen/co/386442.htm
乐清市申乐电器有限公司,http://www.11467.com/shenzhen/co/362878.htm
乐清市先驱电子科技有限公司,http://www.11467.com/shenzhen/co/474442.htm
深圳市阜平电子科技有限公司,http://www.11467.com/shenzhen/co/812319.htm
深圳市佰斯特科技有限公司,http://www.11467.com/shenzhen/co/772823.htm
湖南省荣泰电气有限公司,http://www.11467.com/shaoyang/co/23091.htm
沈阳市天都商贸有限公司,http://www.11467.com/shenyang/co/44802.htm
深圳市安定宝电子科技有限公司,http://www.11467.com/shenzhen/co/291433.htm
绍兴何贝智能电子有限公司,http://www.11467.com/shaoxing/co/43454.htm
绍兴市赛恩斯电控设备有限公司,http://www.11467.com/shaoxing/co/74226.htm
深圳奥圣科技发展有限公司,http://www.11467.com/shenzhen/co/347271.htm
深圳德弘泰科技有限公司,http://www.11467.com/shenzhen/co/445069.htm
上虞市荣腾电器有限公司,http://www.11467.com/shaoxing/co/118604.htm
深圳荣合翔电子有限公司,http://www.11467.com/shenzhen/co/767003.htm
深圳市博义德科技有限公司,http://www.11467.com/shenzhen/co/812330.htm
乐清市首普电子有限公司,http://www.11467.com/shenzhen/co/813095.htm
乐清市星利电子有限公司,http://www.11467.com/shenzhen/co/460823.htm
深圳市创宝科技有限公司,http://www.11467.com/shenzhen/co/122283.htm
衡阳港龙电子有限公司,http://www.11467.com/shenzhen/co/397722.htm
明利五金电业（深圳）有限公司,http://www.11467.com/shenzhen/co/99469.htm
北京中泰达电子科技有限公司,http://www.11467.com/shenzhen/co/772474.htm
嵊州市金诚电子有限公司,http://www.11467.com/shaoxing/co/120112.htm
深圳市柏尔电子有限公司,http://www.11467.com/shenzhen/co/439233.htm
深圳市大全电子有限公司,http://www.11467.com/shenzhen/co/385936.htm
深圳市搏世通用科技开发有限公司,http://www.11467.com/shenzhen/co/812533.htm
深圳华尔高电器有限公司,http://www.11467.com/shenzhen/co/780537.htm
深圳市创永奇科技有限公司,http://www.11467.com/shenzhen/co/761354.htm
深圳科蒙科技有限公司,http://www.11467.com/shenzhen/co/348199.htm
深圳市海运来科技有限公司,http://www.11467.com/shenzhen/co/363445.htm
深圳市百力威电子有限公司,http://www.11467.com/shenzhen/co/129380.htm
深圳市佳通鑫电子有限公司,http://www.11467.com/shenzhen/co/340084.htm
深圳市奥林斯特电子有限公司,http://www.11467.com/shenzhen/co/811898.htm
深圳市琛达智科电子有限公司,http://www.11467.com/shenzhen/co/145204.htm
深圳市翰群科技有限公司,http://www.11467.com/shenzhen/co/63691.htm
深圳市华发大智能科技有限公司,http://www.11467.com/shenzhen/co/724658.htm
深圳市金达旺电子有限公司,http://www.11467.com/shenzhen/co/456287.htm
深圳市铪慧科技有限公司,http://www.11467.com/shenzhen/co/414739.htm
深圳市聚升源电子有限公司,http://www.11467.com/shenzhen/co/811431.htm
深圳市鸿明强科技有限公司,http://www.11467.com/shenzhen/co/757775.htm
深圳多普智能技术有限公司,http://www.11467.com/shenzhen/co/503553.htm
深圳市金正和科技有限公司,http://www.11467.com/shenzhen/co/464506.htm
深圳市金昌来科技有限公司,http://www.11467.com/shenzhen/co/795323.htm
深圳市恒业创展电子有限公司,http://www.11467.com/shenzhen/co/125296.htm
深圳市辰杰电子有限公司,http://www.11467.com/shenzhen/co/354806.htm
深圳市嘉洲电缆电器有限公司,http://www.11467.com/shenzhen/co/809834.htm
深圳市佳福盛电子科技有限公司,http://www.11467.com/shenzhen/co/401024.htm
深圳市吉顺电子有限公司,http://www.11467.com/shenzhen/co/777287.htm
深圳市富美莱怡家智能科技有限公司,http://www.11467.com/shenzhen/co/452032.htm
深圳市建联电子科技有限公司,http://www.11467.com/shenzhen/co/42052.htm
深圳市方睿世纪科技有限公司,http://www.11467.com/shenzhen/co/766423.htm
深圳市建峰达电子有限公司,http://www.11467.com/shenzhen/co/812195.htm
深圳市好的电子有限公司,http://www.11467.com/shenzhen/co/161457.htm
深圳市华泓安电子有限公司,http://www.11467.com/shenzhen/co/142138.htm
深圳市坤龙科技有限公司,http://www.11467.com/shenzhen/co/451414.htm
深圳市海乐成科技有限公司,http://www.11467.com/shenzhen/co/784553.htm
深圳市博浩光电子科技有限公司,http://www.11467.com/shenzhen/co/431121.htm
深圳市开创电器有限公司,http://www.11467.com/shenzhen/co/138741.htm
深圳市科美顺科技有限公司,http://www.11467.com/shenzhen/co/351007.htm
深圳市恒运达电器有限公司,http://www.11467.com/shenzhen/co/397655.htm
深圳市根永健电子有限公司,http://www.11467.com/shenzhen/co/161785.htm
深圳市格瑞电子有限公司,http://www.11467.com/shenzhen/co/114210.htm
深圳市广宏达科技有限公司,http://www.11467.com/shenzhen/co/723993.htm
深圳市百佳发科技开发有限公司,http://www.11467.com/shenzhen/co/397937.htm
深圳市鸿瀚好科技有限公司,http://www.11467.com/shenzhen/co/460822.htm
深圳市富路科技有限公司,http://www.11467.com/shenzhen/co/114320.htm
深圳市宏欣薄膜开关有限公司,http://www.11467.com/shenzhen/co/761880.htm
深圳市欧美瑞科技有限公司,http://www.11467.com/shenzhen/co/772689.htm
深圳市全成弹簧五金有限公司,http://www.11467.com/shenzhen/co/790379.htm
深圳市欧卡达科技有限公司,http://www.11467.com/shenzhen/co/724277.htm
深圳市诚强光电数码有限公司,http://www.11467.com/shenzhen/co/353262.htm
深圳市创森达电子科技有限公司,http://www.11467.com/shenzhen/co/757793.htm
深圳市森恒盛科技有限公司,http://www.11467.com/shenzhen/co/457170.htm
深圳市三顺电子有限公司,http://www.11467.com/shenzhen/co/456302.htm
深圳市峰宝德电子技术发展有限公司,http://www.11467.com/shenzhen/co/812329.htm
深圳市捷时电子有限公司,http://www.11467.com/shenzhen/co/359177.htm
深圳市环坚电子有限公司,http://www.11467.com/shenzhen/co/64644.htm
深圳市金洋宏业科技有限公司,http://www.11467.com/shenzhen/co/761275.htm
深圳市卡亿连接器有限公司,http://www.11467.com/shenzhen/co/197042.htm
深圳市精英通科技有限公司,http://www.11467.com/shenzhen/co/810213.htm
深圳市佛泰电子有限公司,http://www.11467.com/shenzhen/co/378714.htm
深圳市日正达照明电器有限公司,http://www.11467.com/shenzhen/co/452039.htm
深圳市港中兴电子有限公司,http://www.11467.com/shenzhen/co/464174.htm
深圳市金顺韩电子科技有限公司,http://www.11467.com/shenzhen/co/467093.htm
深圳市景泰隆电子有限公司,http://www.11467.com/shenzhen/co/437789.htm
深圳市金恒信薄膜开关技术有限公司,http://www.11467.com/shenzhen/co/386314.htm
深圳市捷普瑞科技有限公司,http://www.11467.com/shenzhen/co/474911.htm
深圳市晶鼎鑫电子有限公司,http://www.11467.com/shenzhen/co/363514.htm
深圳市精恒鑫科技有限公司,http://www.11467.com/shenzhen/co/726138.htm
深圳市麦科德科技有限公司,http://www.11467.com/shenzhen/co/449749.htm
深圳市联泰德电子有限公司,http://www.11467.com/shenzhen/co/83676.htm
深圳市亮群电子有限公司,http://www.11467.com/shenzhen/co/139003.htm
深圳市利欣丰电子有限公司,http://www.11467.com/shenzhen/co/287923.htm
深圳市金泰盛电子有限公司,http://www.11467.com/shenzhen/co/449174.htm
深圳市凯威精密配件有限公司,http://www.11467.com/shenzhen/co/489676.htm
深圳市华兀联科技有限公司,http://www.11467.com/shenzhen/co/129264.htm
深圳市酷达科技有限公司,http://www.11467.com/shenzhen/co/121663.htm
深圳市全信宝科技有限公司,http://www.11467.com/shenzhen/co/351145.htm
深圳市福瑞盈机电科技开发有限公司,http://www.11467.com/shenzhen/co/725218.htm
深圳市佳利得科技有限公司,http://www.11467.com/shenzhen/co/812082.htm
深圳市吉威电子有限公司,http://www.11467.com/shenzhen/co/351142.htm
深圳市麦探滃科技有限公司,http://www.11467.com/shenzhen/co/812483.htm
深圳市莱威斯电子有限公司,http://www.11467.com/shenzhen/co/452093.htm
深圳市凯顺电子有限公司,http://www.11467.com/shenzhen/co/363950.htm
深圳市明光利电子有限公司,http://www.11467.com/shenzhen/co/59604.htm
深圳市创遥科技有限公司,http://www.11467.com/shenzhen/co/328615.htm
深圳市康继电气有限公司,http://www.11467.com/shenzhen/co/122284.htm
深圳市华之键电子科技有限公司,http://www.11467.com/shenzhen/co/437739.htm
深圳市菘翊科技发展有限公司,http://www.11467.com/shenzhen/co/59333.htm
深圳市泰新伟业电子有限公司,http://www.11467.com/shenzhen/co/132959.htm
深圳市兴炜业科技有限公司,http://www.11467.com/shenzhen/co/362637.htm
深圳市新天地自动化设备有限公司,http://www.11467.com/shenzhen/co/809522.htm
深圳市深创为电子有限公司,http://www.11467.com/shenzhen/co/439782.htm
深圳市润昕电气有限公司,http://www.11467.com/shenzhen/co/757801.htm
深圳市南雄塑胶有限公司,http://www.11467.com/shenzhen/co/399861.htm
深圳市隆伟特电子有限公司,http://www.11467.com/shenzhen/co/762555.htm
深圳市唯信尔科技有限公司,http://www.11467.com/shenzhen/co/811869.htm
深圳市仁德机电设备有限公司,http://www.11467.com/shenzhen/co/491311.htm
深圳市三合正电子有限公司,http://www.11467.com/shenzhen/co/468042.htm
深圳市悦海电子有限公司,http://www.11467.com/shenzhen/co/141214.htm
深圳市鑫佳达电子有限公司,http://www.11467.com/shenzhen/co/811321.htm
深圳市富士册电子有限公司,http://www.11467.com/shenzhen/co/722346.htm
深圳市亿凯电子元件有限公司,http://www.11467.com/shenzhen/co/345365.htm
深圳市力峰电子有限公司,http://www.11467.com/shenzhen/co/131131.htm
深圳市沃德莱电子科技有限公司,http://www.11467.com/shenzhen/co/784653.htm
深圳市松明光电有限公司,http://www.11467.com/shenzhen/co/466566.htm
深圳市华泰兴电子有限公司,http://www.11467.com/shenzhen/co/399490.htm
深圳市泽馨和科技有限公司,http://www.11467.com/shenzhen/co/809542.htm
深圳市弗朗特科技有限公司,http://www.11467.com/shenzhen/co/122437.htm
深圳市深格电子有限公司,http://www.11467.com/shenzhen/co/129178.htm
深圳市启源电子有限公司,http://www.11467.com/shenzhen/co/785078.htm
深圳市统技科电子有限公司,http://www.11467.com/shenzhen/co/722194.htm
深圳市维尔奥科技有限公司,http://www.11467.com/shenzhen/co/757880.htm
深圳市新生力实业有限公司,http://www.11467.com/shenzhen/co/124526.htm
深圳市铭邦自动化有限公司,http://www.11467.com/shenzhen/co/809696.htm
深圳市合力士五金电器有限公司,http://www.11467.com/shenzhen/co/120997.htm
深圳市实利科技有限公司,http://www.11467.com/shenzhen/co/78066.htm
深圳市亿控机电有限公司,http://www.11467.com/shenzhen/co/761946.htm
深圳市旺荣鑫科技有限公司,http://www.11467.com/shenzhen/co/722999.htm
深圳市新玉婕科技有限公司,http://www.11467.com/shenzhen/co/765399.htm
深圳市五洲电子有限公司,http://www.11467.com/shenzhen/co/316800.htm
深圳市顺金利五金制品有限公司,http://www.11467.com/shenzhen/co/492835.htm
深圳市新天马电子有限公司,http://www.11467.com/shenzhen/co/130934.htm
深圳市顺鑫达工贸有限公司,http://www.11467.com/shenzhen/co/123496.htm
深圳市赛尔威电子有限公司,http://www.11467.com/shenzhen/co/169442.htm
深圳市威尔富科技有限公司,http://www.11467.com/shenzhen/co/413389.htm
深圳市华控力科电子有限公司,http://www.11467.com/shenzhen/co/812473.htm
深圳市上明佳电子有限公司,http://www.11467.com/shenzhen/co/451365.htm
深圳市锦鑫隆科技有限公司,http://www.11467.com/shenzhen/co/729630.htm
深圳市怡之佳电子有限公司,http://www.11467.com/shenzhen/co/435977.htm
深圳市亿达聚塑胶五金有限公司,http://www.11467.com/shenzhen/co/726507.htm
深圳市战狼科技发展有限公司,http://www.11467.com/shenzhen/co/784552.htm
深圳市鹏成薄膜开关有限公司,http://www.11467.com/shenzhen/co/811320.htm
深圳市旭瑞特电子科技有限公司,http://www.11467.com/shenzhen/co/206316.htm
深圳市华南一号贸易有限公司,http://www.11467.com/shenzhen/co/812623.htm
深圳市强博欣电子有限公司,http://www.11467.com/shenzhen/co/797664.htm
深圳市侨迪电子有限公司,http://www.11467.com/shenzhen/co/362876.htm
深圳市翔鑫宏达电子有限公司,http://www.11467.com/shenzhen/co/722525.htm
深圳市扬名伟业科技有限公司,http://www.11467.com/shenzhen/co/366031.htm
深圳市佳奇达科技有限公司,http://www.11467.com/shenzhen/co/809884.htm
