北京中科索尼科技发展有限公司(注：北京中科索尼专业广电设备工,http://www.11467.com/beijing/co/423266.htm
体验传媒（北京）有限公司,http://www.11467.com/beijing/co/122961.htm
信元新科有限公司,http://www.11467.com/beijing/co/423589.htm
冲浪平台(北京)网络技术公司,http://www.11467.com/beijing/co/707676.htm
创想空间信息通讯科技有限公司,http://www.11467.com/beijing/co/424186.htm
多线科技有限公司,http://www.11467.com/beijing/co/322197.htm
上海创程电讯设备有限公司（销售部）,http://www.11467.com/shanghai/co/743394.htm
上海春夏秋冬贸易有限公司,http://www.11467.com/shanghai/co/377880.htm
上海澳派信息技术有限公司,http://www.11467.com/shanghai/co/1049249.htm
上海点客信息技术有限公司 数据业务部,http://www.11467.com/shanghai/co/944433.htm
上海立佰翰信息科技有限公司,http://www.11467.com/shanghai/co/1014237.htm
艾方信息科技有限公司,http://www.11467.com/shanghai/co/1049250.htm
TBASE信息技术有限公司,http://www.11467.com/shanghai/co/1051993.htm
宽能通讯技术（上海）有限公司,http://www.11467.com/shanghai/co/944546.htm
上海莲阳网络科技有限公司,http://www.11467.com/shanghai/co/530844.htm
上海管家通信科技有限公司,http://www.11467.com/shanghai/co/1045835.htm
上海襟怀商贸有限公司,http://www.11467.com/shanghai/co/743387.htm
上海群欣信息顾问有限公司,http://www.11467.com/shanghai/co/682548.htm
上海爽爷信息技术有限公司,http://www.11467.com/shanghai/co/326080.htm
上海灵通网络公司,http://www.11467.com/shanghai/co/944547.htm
厦门欣仰邦科技有限公司,http://www.11467.com/qiye/93208287.htm
广州天烁通讯科技有限公司,http://www.11467.com/guangzhou/co/27409.htm
南京优佳信息科技有限公司,http://www.11467.com/nanjing/co/156619.htm
深圳市宗义科技有限公司,http://www.11467.com/shenzhen/co/494211.htm
北京声望华胜科技有限公司,http://www.11467.com/beijing/co/423414.htm
上海灵通网络公司,http://www.11467.com/shanghai/co/944547.htm
上海米格实业有限公司,http://www.11467.com/shanghai/co/944418.htm
上海乐阔贸易有限公司,http://www.11467.com/shanghai/co/1014224.htm
上海嘉允网络技术有限公司,http://www.11467.com/shanghai/co/1050666.htm
上海九百遨天信息工程有限公司,http://www.11467.com/shanghai/co/377888.htm
上海久宇通讯有限公司,http://www.11467.com/shanghai/co/682595.htm
上海驿顺实业有限公司,http://www.11467.com/shanghai/co/682588.htm
上海周荀通信工程有限公司业务部,http://www.11467.com/shanghai/co/530812.htm
上海周荀通信工程公司,http://www.11467.com/shanghai/co/530813.htm
上海平洲信息科技有限公司,http://www.11467.com/shanghai/co/743348.htm
上海万腾电子有限公司,http://www.11467.com/shanghai/co/682592.htm
上海英拓信息技术有限公司,http://www.11467.com/shanghai/co/682554.htm
东鹏网络通讯有限公司,http://www.11467.com/tianjin/co/17500.htm
天津路普电子科技有限公司,http://www.11467.com/tianjin/co/145160.htm
广州艾讯计算机信息科技有限公司 (一路中国)重庆站,http://www.11467.com/chongqing/co/194547.htm
重庆华翰科技有限公司,http://www.11467.com/chongqing/co/79817.htm
重庆萌聚科技有限公司,http://www.11467.com/chongqing/co/204759.htm
天津尚学科技有限公司,http://www.11467.com/tianjin/co/309304.htm
南昌宜景科技有限公司,http://www.11467.com/nanchang/co/128379.htm
桂林绿洲科技有限公司,http://www.11467.com/guilin/co/54394.htm
广州云聿科技有限公司,http://www.11467.com/qiye/93154740.htm
成都原图信息技术有限公司,http://www.11467.com/qiye/93196522.htm
广州信政亨电子有限公司,http://www.11467.com/guangzhou/co/13487.htm
深圳市蓝硕通讯设备有限公司,http://www.11467.com/shenzhen/co/642541.htm
天津市世纪荣光通信技术有限公司,http://www.11467.com/tianjin/co/141910.htm
宁波特汇通信技术有限公司,http://www.11467.com/qiye/93069823.htm
深圳市苏山伟达通讯设备有限公司,http://www.11467.com/shenzhen/co/858091.htm
成都盛鑫联科技有限公司,http://www.11467.com/chengdu/co/264827.htm
深圳市新为科技有限公司,http://www.11467.com/shenzhen/co/211921.htm
深圳市矽数微电子有限公司,http://www.11467.com/shenzhen/co/765407.htm
深圳市伟斯泰尔科技有限公司,http://www.11467.com/shenzhen/co/809793.htm
深圳市联普泰通信技术有限公司,http://www.11467.com/shenzhen/co/769205.htm
深圳市融智信达科技有限公司,http://www.11467.com/shenzhen/co/763353.htm
河北诺创通信设备科技有限公司,http://www.11467.com/shijiazhuang/co/145665.htm
福州赣华通讯器材有限公司,http://www.11467.com/fuzhou/co/111658.htm
深圳市博浩实业发展有限公司,http://www.11467.com/shenzhen/co/93229.htm
深圳市亿可信通讯设备有限公司,http://www.11467.com/shenzhen/co/763645.htm
深圳市捷腾科技有限公司,http://www.11467.com/shenzhen/co/857985.htm
深圳市宏成数字科技股份有限公司,http://www.11467.com/shenzhen/co/623991.htm
深圳市中子为科技有限公司,http://www.11467.com/shenzhen/co/761975.htm
深圳市唐诺科技有限公司,http://www.11467.com/shenzhen/co/201322.htm
深圳市矽伟智科技有限公司,http://www.11467.com/shenzhen/co/768677.htm
深圳市一致精展塑胶制品有限公司,http://www.11467.com/shenzhen/co/256044.htm
深圳市天玑智能终端有限公司,http://www.11467.com/shenzhen/co/778030.htm
深圳市讯呼信息技术有限公司,http://www.11467.com/shenzhen/co/627023.htm
深圳市智岭数字技术有限公司,http://www.11467.com/shenzhen/co/352529.htm
永华利科技有限公司,http://www.11467.com/shenzhen/co/390170.htm
深圳市爱科赛科技有限公司,http://www.11467.com/shenzhen/co/559163.htm
北京阜康天地科技发展有限公司,http://www.11467.com/suzhou/co/269178.htm
山西天赐达科技有限公司,http://www.11467.com/taiyuan/co/114418.htm
西安仁川数码科技有限公司,http://www.11467.com/xian/co/124294.htm
张家界和通网络有限公司,http://www.11467.com/zhangjiajie/co/7825.htm
郑州动力无限科技有限公司,http://www.11467.com/zhengzhou/co/176069.htm
丹阳市丹雨广电设备有限公司,http://www.11467.com/zhenjiang/co/62583.htm
深圳市蓝天白云电子科技有限公司,http://www.11467.com/shenzhen/co/760864.htm
广州华工信元通信技术有限公司,http://www.11467.com/guangzhou/co/152087.htm
广州市启大电子科技有限公司,http://www.11467.com/guangzhou/co/88858.htm
嘉兴市凯斯通讯器材有限公司,http://www.11467.com/jiaxing/co/83769.htm
泉州泽仕通科技有限公司,http://www.11467.com/quanzhou/co/88062.htm
佳慧网络科技发展（深圳）有限公司,http://www.11467.com/shenzhen/co/642124.htm
深圳市鸿佳宇信息技术有限公司,http://www.11467.com/shenzhen/co/778163.htm
郑州金尚德节能科技有限公司,http://www.11467.com/zhengzhou/co/170053.htm
沧州万隆电子通信设备有限公司,http://www.11467.com/cangzhou/co/57667.htm
中业通讯器材有限公司,http://www.11467.com/cangzhou/co/43100.htm
长沙世邦通信技术有限公司,http://www.11467.com/changsha/co/79780.htm
湖南长沙无线城网络科技有限公司,http://www.11467.com/changsha/co/88353.htm
长沙牛谷信息技术有限公司,http://www.11467.com/changsha/co/120619.htm
常州市武进苏南通讯器材有限公司,http://www.11467.com/changzhou/co/100351.htm
东莞市九维网络科技有限公司,http://www.11467.com/dongguan/co/491226.htm
上海安畅网络科技股份有限公司,http://www.11467.com/shanghai/co/1092513.htm
深圳市新天源科技有限公司,http://www.11467.com/shenzhen/co/10409.htm
东莞世华电子有限公司,http://www.11467.com/dongguan/co/49542.htm
贵来网络科技有限公司,http://www.11467.com/dongguan/co/359364.htm
友盟科技电子有限公司,http://www.11467.com/dongguan/co/276913.htm
张家港市昊海电子有限公司,http://www.11467.com/dongguan/co/135023.htm
东莞钰晨商贸有限公司,http://www.11467.com/dongguan/co/491314.htm
宇通通讯网络科技有限公司,http://www.11467.com/dongguan/co/161499.htm
佛山鑫煌网络技术有限公司,http://www.11467.com/foshan/co/323618.htm
中国联合网络通信有限公司佛山分公司,http://www.11467.com/foshan/co/192144.htm
广州嘉滕信息科技有限公司,http://www.11467.com/guangzhou/co/483623.htm
广州诺科电子有限公司,http://www.11467.com/guangzhou/co/200715.htm
广州新宇田电信设备有限公司,http://www.11467.com/guangzhou/co/358837.htm
杭州弗里德科技有限公司,http://www.11467.com/hangzhou/co/384036.htm
杭州华迈通信科技有限公司,http://www.11467.com/hangzhou/co/282245.htm
杭州泰圣电子科技有限公司,http://www.11467.com/hangzhou/co/311698.htm
浙江鸿力电子信息有限公司,http://www.11467.com/hangzhou/co/199709.htm
济南万杰胜科技有限公司,http://www.11467.com/jinan/co/104996.htm
聊城市东昌府区北斗星企业管理咨询有限公司,http://www.11467.com/liaocheng/co/46316.htm
南通通沪通讯设备有限公司,http://www.11467.com/nantong/co/134695.htm
青岛网科信息工程有限公司,http://www.11467.com/qingdao/co/114988.htm
浙江普森通信科技有限公司,http://www.11467.com/shaoxing/co/97787.htm
东方龙大电子（深圳）有限公司,http://www.11467.com/shenzhen/co/388712.htm
鴻馳實業有限公司,http://www.11467.com/shenzhen/co/359864.htm
茂源科技（香港）有限公司,http://www.11467.com/shenzhen/co/147423.htm
广东固联网络科技有限公司,http://www.11467.com/shenzhen/co/788383.htm
凯旋电源电子有限公司,http://www.11467.com/shenzhen/co/434328.htm
深圳六方通信技术有限公司,http://www.11467.com/shenzhen/co/196025.htm
深圳凌博创科技有限责任公司,http://www.11467.com/shenzhen/co/723619.htm
深圳连达升科技有限公司,http://www.11467.com/shenzhen/co/779090.htm
深圳日海通讯技术股份有限公司总部,http://www.11467.com/shenzhen/co/268564.htm
深圳市德松电子有限公司,http://www.11467.com/shenzhen/co/622668.htm
深圳市点畅触控科技有限公司,http://www.11467.com/shenzhen/co/763583.htm
深圳市合众联盟投资发展有限公司（研发部）,http://www.11467.com/shenzhen/co/557328.htm
深圳市碧盛元实业发展有限公司,http://www.11467.com/shenzhen/co/529071.htm
深圳市国诚新特科技有限公司,http://www.11467.com/shenzhen/co/724300.htm
深圳市帝力科技有限公司,http://www.11467.com/shenzhen/co/225377.htm
深圳市虹远通信有限责任公司,http://www.11467.com/shenzhen/co/638260.htm
深圳市宏胜达通讯有限公司,http://www.11467.com/shenzhen/co/763808.htm
深圳市惠想科技有限责任公司,http://www.11467.com/shenzhen/co/803623.htm
深圳市海兴和电子有限公司,http://www.11467.com/shenzhen/co/477832.htm
深圳市创威视科技有限公司,http://www.11467.com/shenzhen/co/781975.htm
深圳市华讯通科技有限公司,http://www.11467.com/shenzhen/co/642538.htm
深圳市美德光电通讯有限公司,http://www.11467.com/shenzhen/co/641782.htm
深圳市润翔电缆有限公司,http://www.11467.com/shenzhen/co/534541.htm
深圳市世通贝尔科技有限公司,http://www.11467.com/shenzhen/co/793544.htm
深圳市明奥科技有限公司,http://www.11467.com/shenzhen/co/359402.htm
深圳市盛美达通信有限公司,http://www.11467.com/shenzhen/co/518170.htm
深圳市仁昌鸿电机有限公司,http://www.11467.com/shenzhen/co/477940.htm
深圳市兴永联电子有限公司,http://www.11467.com/shenzhen/co/477271.htm
深圳市瑞光佳讯科技开发有限公司,http://www.11467.com/shenzhen/co/785598.htm
深圳市业松电子有限公司,http://www.11467.com/shenzhen/co/802118.htm
深圳市荣维电子有限公司,http://www.11467.com/shenzhen/co/130087.htm
深圳市世硕科技有限公司,http://www.11467.com/shenzhen/co/776540.htm
深圳市亿联天成通信设备有限公司,http://www.11467.com/shenzhen/co/782207.htm
深圳市宇联讯达科技发展有限公司,http://www.11467.com/shenzhen/co/161569.htm
深圳市因特路通信有限公司,http://www.11467.com/shenzhen/co/159662.htm
深圳市英默仕电子有限公司,http://www.11467.com/shenzhen/co/793274.htm
深圳市中舟通信技术有限公司,http://www.11467.com/shenzhen/co/791344.htm
永耀有限公司,http://www.11467.com/shenzhen/co/574097.htm
深圳市中诚科技有限公司,http://www.11467.com/shenzhen/co/181767.htm
深圳中舟通信技术有限公司,http://www.11467.com/shenzhen/co/763639.htm
深圳市东远精工电子有限公司,http://www.11467.com/shenzhen/co/261023.htm
深圳亚斯克通信科技有限公司,http://www.11467.com/shenzhen/co/169408.htm
易贝尔电子科技有限公司内贸部,http://www.11467.com/shenzhen/co/159481.htm
深圳市艾维声电子科技有限公司,http://www.11467.com/shenzhen/co/776524.htm
石家庄华信通科技有限公司新飞腾通信部,http://www.11467.com/shijiazhuang/co/78883.htm
昆山裕富宁精密电子有限公司,http://www.11467.com/suzhou/co/292329.htm
苏州埃尔特电子有限公司,http://www.11467.com/suzhou/co/269105.htm
苏州纤效电子科技有限公司,http://www.11467.com/suzhou/co/245118.htm
张家港市万科信息技术有限公司,http://www.11467.com/suzhou/co/127748.htm
靖江斯诺新电气设备有限公司,http://www.11467.com/taizhoushi/co/50398.htm
武汉海迅网络技术有限公司生产部,http://www.11467.com/wuhan/co/59797.htm
武汉明驰达通讯技术有限公司,http://www.11467.com/wuhan/co/79697.htm
武汉佳诚贝尔科技有限公司,http://www.11467.com/wuhan/co/76418.htm
无锡國豐电子科技有限公司,http://www.11467.com/wuxi/co/205254.htm
西安终南信息技术有限公司,http://www.11467.com/xian/co/54608.htm
河南华博科技有限公司,http://www.11467.com/zhengzhou/co/130087.htm
镇江新区雷鸣机电有限公司,http://www.11467.com/zhenjiang/co/49749.htm
雷迪威电子科技有限公司,http://www.11467.com/zhuhai/co/71342.htm
北京国信网络通信有限公司,http://www.11467.com/beijing/co/432348.htm
北京星海星科技发展有限公司市场部,http://www.11467.com/beijing/co/432553.htm
北京国义和科技有限责任公司,http://www.11467.com/beijing/co/726315.htm
天津世成嘉茂商贸有限公司,http://www.11467.com/tianjin/co/302148.htm
南昌市易呼天下科技有限公司,http://www.11467.com/nanchang/co/120288.htm
天津市烽讯通科技有限公司,http://www.11467.com/tianjin/co/306505.htm
深圳长城宽带有限公司,http://www.11467.com/shenzhen/co/883983.htm
郑州炫彩网络科技有限公司,http://www.11467.com/zhengzhou/co/203032.htm
颖科电子有限公司天津分公司,http://www.11467.com/tianjin/co/309022.htm
天津揽盛通讯设备有限公司,http://www.11467.com/tianjin/co/309298.htm
东莞联通公司,http://www.11467.com/dongguan/co/159673.htm
东莞市艾狮自动化设备有限公司,http://www.11467.com/dongguan/co/553432.htm
东莞市驰程网络科技有限公司,http://www.11467.com/dongguan/co/552692.htm
东莞市金昶电线制造有限公司,http://www.11467.com/dongguan/co/452867.htm
广州富可欧科技有限公司销售部,http://www.11467.com/guangzhou/co/263003.htm
广州城头电子科技有限公司,http://www.11467.com/guangzhou/co/352922.htm
广州汇信特通信技术有限公司,http://www.11467.com/guangzhou/co/244313.htm
广州众源网络科技有限公司网络销售部,http://www.11467.com/guangzhou/co/239543.htm
广州神韵信息科技有限公司,http://www.11467.com/guangzhou/co/139100.htm
启东市卓程通信器材有限公司,http://www.11467.com/guangzhou/co/262556.htm
广州市祥誉通讯设备有限公司,http://www.11467.com/guangzhou/co/11356.htm
信源电子有限公司,http://www.11467.com/guangzhou/co/263529.htm
中国移动广州分公司,http://www.11467.com/guangzhou/co/464645.htm
富阳市万方通信设备有限公司,http://www.11467.com/hangzhou/co/100330.htm
合肥帝智诺广告传媒有限公司,http://www.11467.com/hefei/co/131820.htm
内蒙古中博科贸有限责任公司,http://www.11467.com/huhehaote/co/24142.htm
南宁天灿商贸有限公司,http://www.11467.com/nanning/co/86337.htm
沈阳市恒远电子有限公司hydz,http://www.11467.com/shenyang/co/71297.htm
沈阳信天择网络通讯有限公司,http://www.11467.com/shenyang/co/48994.htm
沈阳非凡科技有限公司,http://www.11467.com/shenyang/co/66116.htm
深圳世天工业公司,http://www.11467.com/shenzhen/co/676260.htm
深圳市创意通信息技术有限公司,http://www.11467.com/shenzhen/co/636930.htm
深圳市鸿骏达通讯设备有限公司,http://www.11467.com/shenzhen/co/807803.htm
深圳市奥威尔投资发展有限公司,http://www.11467.com/shenzhen/co/387959.htm
深圳市乐美佳科技有限公司,http://www.11467.com/shenzhen/co/596084.htm
深圳市科华通光电有限公司,http://www.11467.com/shenzhen/co/138576.htm
深圳市鹏威实业有限公司,http://www.11467.com/shenzhen/co/174834.htm
深圳市三卓光电科技有限公司,http://www.11467.com/shenzhen/co/769231.htm
深圳市诠诚兴科技有限公司,http://www.11467.com/shenzhen/co/198102.htm
深圳市泰霖科技有限公司,http://www.11467.com/shenzhen/co/11107.htm
深圳市义瑞特智能科技有限公司,http://www.11467.com/shenzhen/co/767255.htm
深圳市易方信通信设备有限公司,http://www.11467.com/shenzhen/co/159017.htm
深圳市振通科技有限公司市场部,http://www.11467.com/shenzhen/co/637360.htm
深圳市田泽华电子有限公司,http://www.11467.com/shenzhen/co/176392.htm
深圳友达网络科技有限公司,http://www.11467.com/shenzhen/co/163821.htm
威达电子科技有限公司,http://www.11467.com/shenzhen/co/639558.htm
深圳中通信息科技发展有限公司,http://www.11467.com/shenzhen/co/768897.htm
颖俊电子有限公司,http://www.11467.com/shenzhen/co/777602.htm
深圳兴科科技有限公司,http://www.11467.com/shenzhen/co/780553.htm
伸铭精密电子（苏州）有限公司(加工课）,http://www.11467.com/suzhou/co/259532.htm
太仓市浩腾视听设备配件有限公司,http://www.11467.com/suzhou/co/286499.htm
吴江亨讯通讯设备有限公司,http://www.11467.com/suzhou/co/346717.htm
武汉市蔡甸区电信分公司,http://www.11467.com/wuhan/co/104628.htm
厦门超博信息技术有限公司,http://www.11467.com/xiamen/co/98275.htm
厦门南和伟业信息技术有限公司,http://www.11467.com/xiamen/co/100117.htm
河南奥创通信科技有限公司,http://www.11467.com/xinxiang/co/34755.htm
