北京网联光通技术有限公司,http://www.11467.com/beijing/co/702345.htm
珠海飞宇光电科技有限公司,http://www.11467.com/shenzhen/co/730960.htm
河北图泰电子技术有限公司,http://www.11467.com/cangzhou/co/98708.htm
北京华人开创科技发展有限公司,http://www.11467.com/beijing/co/691481.htm
深圳市纳鑫达通讯设备有限公司,http://www.11467.com/shenzhen/co/141485.htm
深圳市灿科盟实业有限公司,http://www.11467.com/shenzhen/co/23304.htm
厦门欣仰邦科技有限公司,http://www.11467.com/qiye/93208287.htm
深圳市嘉亿通科技有限公司,http://www.11467.com/shenzhen/co/724333.htm
讯达康通讯设备（惠州）有限公司,http://www.11467.com/shenzhen/co/760503.htm
镇江市富祥电子有限公司,http://www.11467.com/zhenjiang/co/49395.htm
南京纽曲克电子有限公司,http://www.11467.com/nanjing/co/72702.htm
镇江市丹徒区龙发通讯有限公司,http://www.11467.com/zhenjiang/co/51852.htm
嘉兴市鸿道通讯科技有限公司,http://www.11467.com/jiaxing/co/84379.htm
天津远时通信技术有限公司,http://www.11467.com/tianjin/co/90976.htm
山东中呼信息科技有限公司,http://www.11467.com/weifang/co/87586.htm
江苏华普通信科技有限公司,http://www.11467.com/taizhoushi/co/31542.htm
深圳市晶瑞速讯科技有限公司,http://www.11467.com/shenzhen/co/758455.htm
杭州富阳科龙电信器材有限公司,http://www.11467.com/hangzhou/co/140584.htm
东莞市锐展绝缘材料有限公司,http://www.11467.com/dongguan/co/497630.htm
广西科友通信科技有限公司,http://www.11467.com/nanning/co/86592.htm
深圳市后天网络通信技术有限公司,http://www.11467.com/shenzhen/co/163765.htm
深圳市智昊通信科技有限公司,http://www.11467.com/shenzhen/co/811259.htm
深圳市矽数微电子有限公司,http://www.11467.com/shenzhen/co/765407.htm
深圳亿维通讯科技有限公司,http://www.11467.com/shenzhen/co/763925.htm
广州大鹏信息科技有限公司,http://www.11467.com/guangzhou/co/429592.htm
深圳市研川科技有限公司,http://www.11467.com/shenzhen/co/182548.htm
深圳市尚源通讯技术有限公司,http://www.11467.com/shenzhen/co/353167.htm
镇江市天和塑模科技有限公司,http://www.11467.com/zhenjiang/co/51967.htm
深圳市稳胜电子有限公司,http://www.11467.com/shenzhen/co/813376.htm
深圳市慧网时代科技有限公司,http://www.11467.com/shenzhen/co/170045.htm
上海有所信息工程有限公司,http://www.11467.com/shanghai/co/682659.htm
丹阳华神电器有限公司,http://www.11467.com/zhenjiang/co/66519.htm
重庆市达林顿科技发展有限公司,http://www.11467.com/chongqing/co/170381.htm
湖北安心智能家居科技有限公司,http://www.11467.com/xiaogan/co/23797.htm
深圳市飞通宽带技术有限公司,http://www.11467.com/shenzhen/co/641129.htm
深圳市中易腾达科技有限公司,http://www.11467.com/shenzhen/co/623344.htm
广州奥鑫通讯设备有限公司,http://www.11467.com/guangzhou/co/65007.htm
河北恒辉通信设备股份有限公司,http://www.11467.com/cangzhou/co/68183.htm
南京维六信息技术有限公司,http://www.11467.com/nanjing/co/115222.htm
深圳市立盛通信设备有限公司,http://www.11467.com/shenzhen/co/725386.htm
中国移动通信集团陕西公司西安分公司,http://www.11467.com/xian/co/127938.htm
深圳欧林克科技有限公司,http://www.11467.com/wuhan/co/96115.htm
深圳市嘉亿通科技有限公司,http://www.11467.com/qiye/26657.htm
深圳市倚天丰华电子有限公司,http://www.11467.com/shenzhen/co/172731.htm
深圳市讯达康通讯设备有限公司,http://www.11467.com/shenzhen/co/350677.htm
深圳市蓝硕通讯设备有限公司,http://www.11467.com/shenzhen/co/642541.htm
北京亿伦时代科技有限公司,http://www.11467.com/beijing/co/423084.htm
广州市众辉通信科技有限公司,http://www.11467.com/guangzhou/co/458349.htm
泰州市长润电子设备有限公司,http://www.11467.com/qiye/242003.htm
深圳市常亮实业有限公司,http://www.11467.com/shenzhen/co/256763.htm
深圳市昊海通信技术有限公司,http://www.11467.com/shenzhen/co/815239.htm
深圳市苏山伟达通讯设备有限公司,http://www.11467.com/shenzhen/co/858091.htm
成都盛鑫联科技有限公司,http://www.11467.com/chengdu/co/264827.htm
广州昂连电子有限公司,http://www.11467.com/guangzhou/co/428801.htm
深圳市新为科技有限公司,http://www.11467.com/shenzhen/co/211921.htm
杭州联亨通讯设备有限公司,http://www.11467.com/hangzhou/co/238759.htm
合肥文琴传动机械有限公司,http://www.11467.com/hefei/co/91816.htm
深圳市网今科技有限公司,http://www.11467.com/shenzhen/co/289690.htm
深圳市宏声微电子有限公司,http://www.11467.com/shenzhen/co/768909.htm
深圳市鸿创鑫科技有限公司,http://www.11467.com/shenzhen/co/811257.htm
深圳市矽数微电子有限公司,http://www.11467.com/shenzhen/co/765407.htm
东莞市硅翔绝缘材料有限公司,http://www.11467.com/dongguan/co/118826.htm
绍兴华信通信技术有限公司,http://www.11467.com/shaoxing/co/86756.htm
深圳市网今科技有限公司,http://www.11467.com/shenzhen/co/289690.htm
广州市欧科通信科技有限公司,http://www.11467.com/guangzhou/co/271873.htm
任丘市恒威通信设备有限公司,http://www.11467.com/cangzhou/co/52126.htm
长沙国通网络科技有限公司,http://www.11467.com/changsha/co/84616.htm
东莞市腾康通信设备有限公司,http://www.11467.com/dongguan/co/499715.htm
深圳市博浩实业发展有限公司,http://www.11467.com/shenzhen/co/93229.htm
深圳市畅翔光科技有限公司,http://www.11467.com/shenzhen/co/581213.htm
深圳市伟斯泰尔科技有限公司,http://www.11467.com/shenzhen/co/809793.htm
深圳市融智信达科技有限公司,http://www.11467.com/shenzhen/co/763353.htm
深圳市亿可信通讯设备有限公司,http://www.11467.com/shenzhen/co/763645.htm
河北诺创通信设备科技有限公司,http://www.11467.com/shijiazhuang/co/145665.htm
中山市凯瑞斯信息科技有限公司,http://www.11467.com/zhongshan/co/181083.htm
深圳市中子为科技有限公司,http://www.11467.com/shenzhen/co/761975.htm
深圳市唐诺科技有限公司,http://www.11467.com/shenzhen/co/201322.htm
深圳市建晟源机电科技有限公司,http://www.11467.com/shenzhen/co/803612.htm
深圳市宏成数字科技股份有限公司,http://www.11467.com/shenzhen/co/623991.htm
重庆孚脉科技有限公司,http://www.11467.com/ningbo/co/205157.htm
余姚市尚品通信设备有限公司,http://www.11467.com/ningbo/co/198862.htm
深圳市保利嘉数码网络有限公司,http://www.11467.com/shenzhen/co/813349.htm
任丘市百巨圣通讯器材有限公司,http://www.11467.com/cangzhou/co/68131.htm
北京天宇浩海信息技术有限公司,http://www.11467.com/beijing/co/690408.htm
南京中源屯江电子有限公司,http://www.11467.com/nanjing/co/155938.htm
宁波奥涵光纤有限公司,http://www.11467.com/ningbo/co/194044.htm
宁波臻和通信设备有限公司,http://www.11467.com/qiye/93122076.htm
广州信政亨电子有限公司,http://www.11467.com/guangzhou/co/13487.htm
宁波书宇通信科技有限公司,http://www.11467.com/ningbo/co/234035.htm
天津市世纪荣光通信技术有限公司,http://www.11467.com/tianjin/co/141910.htm
贵州蜀鸿明商贸有限公司,http://www.11467.com/guiyang/co/87154.htm
杭州巨松科技有限公司,http://www.11467.com/hangzhou/co/558713.htm
北京首联互动信息技术有限公司,http://www.11467.com/beijing/co/771564.htm
杭州琪曼金属制品限公司,http://www.11467.com/hangzhou/co/311029.htm
四川恒晟泰电子科技有限公司,http://www.11467.com/chengdu/co/283683.htm
南宁亦然通信技术有限公司,http://www.11467.com/nanning/co/98592.htm
福州赣华通讯器材有限公司,http://www.11467.com/fuzhou/co/111658.htm
深圳市联普泰通信技术有限公司,http://www.11467.com/shenzhen/co/769205.htm
深圳市捷腾科技有限公司,http://www.11467.com/shenzhen/co/857985.htm
贵州汇海商联科技有限公司,http://www.11467.com/guiyang/co/86746.htm
杭州物联网络科技有限公司,http://www.11467.com/hangzhou/co/462892.htm
安徽雄天伟宇网络科技有限公司,http://www.11467.com/hefei/co/104530.htm
长沙世邦通信技术有限公司,http://www.11467.com/changsha/co/79780.htm
东莞市九维网络科技有限公司,http://www.11467.com/dongguan/co/491226.htm
广州华工信元通信技术有限公司,http://www.11467.com/guangzhou/co/152087.htm
嘉兴市凯斯通讯器材有限公司,http://www.11467.com/jiaxing/co/83769.htm
泉州泽仕通科技有限公司,http://www.11467.com/quanzhou/co/88062.htm
中国网络通信集团公司曲靖市分公司,http://www.11467.com/qujing/co/18473.htm
深圳华佳慧科技有限公司(中兴代理),http://www.11467.com/shenzhen/co/768912.htm
佳慧网络科技发展（深圳）有限公司,http://www.11467.com/shenzhen/co/642124.htm
深圳市鸿佳宇信息技术有限公司,http://www.11467.com/shenzhen/co/778163.htm
深圳华视电子读书设备有限公司湖南办事处,http://www.11467.com/shenzhen/co/791266.htm
深圳市宏电技术股份有限公司,http://www.11467.com/shenzhen/co/177954.htm
深圳市螺光科技有限公司,http://www.11467.com/shenzhen/co/761179.htm
深圳市希格玛计算机技术有限公司,http://www.11467.com/shenzhen/co/192523.htm
深圳市得伯乐科技有限公司,http://www.11467.com/shenzhen/co/637589.htm
深圳易网联光电科技有限公司,http://www.11467.com/shenzhen/co/785555.htm
深圳市爱科赛科技有限公司,http://www.11467.com/shenzhen/co/559163.htm
石家庄腾奥科技有限公司,http://www.11467.com/shijiazhuang/co/96529.htm
苏州汉明科技有限公司,http://www.11467.com/suzhou/co/254696.htm
西安仁川数码科技有限公司,http://www.11467.com/xian/co/124294.htm
西安贤泽信息科技有限公司,http://www.11467.com/xian/co/24638.htm
张家界和通网络有限公司,http://www.11467.com/zhangjiajie/co/7825.htm
郑州动力无限科技有限公司,http://www.11467.com/zhengzhou/co/176069.htm
北京市神威迅腾科技发展有限公司,http://www.11467.com/beijing/co/705216.htm
众智联云(北京)通信技术有限公司,http://www.11467.com/beijing/co/696058.htm
上海际联信息科技有限公司北京分公司,http://www.11467.com/beijing/co/703851.htm
深圳市微看宝宝物联网有限公司,http://www.11467.com/qiye/93305364.htm
河南亿恩科技股份有限公司,http://www.11467.com/zhengzhou/co/220393.htm
北京网联光通技术有限公司,http://www.11467.com/beijing/co/702345.htm
北京银驼铃通信技术有限公司-销售部,http://www.11467.com/beijing/co/423902.htm
上海长城宽带网络服务有限公司（商业客户部）,http://www.11467.com/shanghai/co/377879.htm
上海伟盟软件科技有限公司,http://www.11467.com/shanghai/co/944544.htm
成都爱诚科技有限公司,http://www.11467.com/chengdu/co/216613.htm
大连捷成实业发展有限公司,http://www.11467.com/dalian/co/28325.htm
东莞宏达通讯有限公司,http://www.11467.com/dongguan/co/493673.htm
德国舒玛特(中国)公司 广州舒玛特视听科技有限公司,http://www.11467.com/guangzhou/co/471441.htm
广州市南星通信科技有限公司,http://www.11467.com/guangzhou/co/476328.htm
广州市启大电子科技有限公司,http://www.11467.com/guangzhou/co/88858.htm
中国通信建设第四工程局有限公司,http://www.11467.com/guangzhou/co/360168.htm
天伊卓思机电环保设备有限公司,http://www.11467.com/guangzhou/co/460780.htm
北京阳光耀华光通讯技术有限公司山东办事处,http://www.11467.com/jinan/co/139451.htm
济南科电光通信有限公司,http://www.11467.com/jinan/co/137391.htm
南京智慧家居用品有限公司,http://www.11467.com/nanjing/co/155642.htm
慈溪众科通信设备有限公司,http://www.11467.com/ningbo/co/194800.htm
宁波网通信息港发展有限公司,http://www.11467.com/ningbo/co/126921.htm
浙江慈溪联众通信设备有限公司,http://www.11467.com/ningbo/co/197462.htm
浙江龙游光泛通信科技有限公司13395810637,http://www.11467.com/quzhou/co/34361.htm
海润国际(汕头)通信科技有限公司,http://www.11467.com/shantou/co/151542.htm
深圳联海通讯设备有限公司,http://www.11467.com/shenzhen/co/763640.htm
深圳科士达科技发展有限公司1,http://www.11467.com/shenzhen/co/641801.htm
深圳市晶品鑫科技有限公司 销售部,http://www.11467.com/shenzhen/co/641237.htm
深圳市蓝天白云电子科技有限公司,http://www.11467.com/shenzhen/co/760864.htm
深圳市三木实业有限公司,http://www.11467.com/shenzhen/co/433187.htm
深圳市矽伟智科技有限公司,http://www.11467.com/shenzhen/co/768677.htm
深圳市金宝大电子有限公司(采购部门),http://www.11467.com/shenzhen/co/639328.htm
深圳市讯呼信息技术有限公司,http://www.11467.com/shenzhen/co/627023.htm
深圳市一致精展塑胶制品有限公司,http://www.11467.com/shenzhen/co/256044.htm
深圳市天玑智能终端有限公司,http://www.11467.com/shenzhen/co/778030.htm
深圳市新天源科技有限公司,http://www.11467.com/shenzhen/co/10409.htm
深圳市昊昇实业有限公司市场部,http://www.11467.com/shenzhen/co/639355.htm
深圳市盼兮科技有限公司,http://www.11467.com/shenzhen/co/59662.htm
银叶王科技有限公司,http://www.11467.com/shenzhen/co/763642.htm
深圳市智岭数字技术有限公司,http://www.11467.com/shenzhen/co/352529.htm
深圳市东进通讯技术股份有限公司,http://www.11467.com/shenzhen/co/638492.htm
特瑞达节能技术有限公司,http://www.11467.com/shenzhen/co/795981.htm
永华利科技有限公司,http://www.11467.com/shenzhen/co/390170.htm
石家庄东方信联通信设备有限公司,http://www.11467.com/shijiazhuang/co/96670.htm
北京阜康天地科技发展有限公司,http://www.11467.com/suzhou/co/269178.htm
山西天赐达科技有限公司,http://www.11467.com/taiyuan/co/114418.htm
北京金拇指环球科技有限公司全国400受理中心,http://www.11467.com/zhengzhou/co/129946.htm
丹阳市丹雨广电设备有限公司,http://www.11467.com/zhenjiang/co/62583.htm
北京分公司,http://www.11467.com/beijing/co/423219.htm
北京东进记录科技有限公司,http://www.11467.com/beijing/co/423145.htm
晶通科技有限公司,http://www.11467.com/shenzhen/co/639638.htm
深圳市光网讯科技有限公司,http://www.11467.com/shenzhen/co/761443.htm
西安创迪信息技术有限公司,http://www.11467.com/xian/co/121989.htm
海通有限责任公司,http://www.11467.com/baoji/co/26626.htm
沧州万隆电子通信设备有限公司,http://www.11467.com/cangzhou/co/57667.htm
青县鑫通鸿达电子设备有限公司,http://www.11467.com/cangzhou/co/58954.htm
中业通讯器材有限公司,http://www.11467.com/cangzhou/co/43100.htm
湖南海洋网络科技有限公司,http://www.11467.com/changsha/co/93014.htm
长沙勇拓信息技术有限公司,http://www.11467.com/changsha/co/93187.htm
长沙锐通网络科技有限公司,http://www.11467.com/changsha/co/120843.htm
湖南长沙无线城网络科技有限公司,http://www.11467.com/changsha/co/88353.htm
长沙牛谷信息技术有限公司,http://www.11467.com/changsha/co/120619.htm
湖南移动通信有限责任公司长沙分公司,http://www.11467.com/changsha/co/93121.htm
长沙中唐信息技术有限公司,http://www.11467.com/changsha/co/71873.htm
常州鼎飞网络科技有限公司业务部,http://www.11467.com/changzhou/co/118694.htm
常州市武进苏南通讯器材有限公司,http://www.11467.com/changzhou/co/100351.htm
常州新区贝尔数据通信设备有限公司国内销售部,http://www.11467.com/changzhou/co/118673.htm
常州市武进鸿利达电子有限公司业务部,http://www.11467.com/changzhou/co/118751.htm
上海云律贸易有限公司苏州分公司,http://www.11467.com/changzhou/co/118749.htm
邦信知识产权保护有限公司,http://www.11467.com/chengdu/co/120813.htm
成都方圆华通科技有限公司（营销部）,http://www.11467.com/chengdu/co/120905.htm
成都捷诺达科技实业有限公司.,http://www.11467.com/chengdu/co/120393.htm
成都惠好通讯有限公司,http://www.11467.com/chengdu/co/120877.htm
成都网络电话安装有限公司,http://www.11467.com/chengdu/co/215042.htm
四川成都华润通讯网络科技有限公司,http://www.11467.com/chengdu/co/120718.htm
成都飞创力科技有限公司 市场部,http://www.11467.com/chengdu/co/120500.htm
成都胜梦电子有限公司,http://www.11467.com/chengdu/co/120876.htm
成都星锐蓝海科技有限公司,http://www.11467.com/chengdu/co/212982.htm
成都双信电子新技术开发有限公司,http://www.11467.com/chengdu/co/120370.htm
成都鑫鑫虹通信科技有限公司,http://www.11467.com/chengdu/co/120455.htm
四川杰锐通信有限公司,http://www.11467.com/chengdu/co/120324.htm
四川宏图实业有限公司,http://www.11467.com/chengdu/co/120507.htm
中国联通攀枝花分公司,http://www.11467.com/chengdu/co/120678.htm
四川鸿达公司,http://www.11467.com/chengdu/co/213549.htm
四川成都宏发数码科技有限公司,http://www.11467.com/chengdu/co/120668.htm
大连三阳流体工程有限公司,http://www.11467.com/dalian/co/55274.htm
德州华诚文化传播有限公司(市场部),http://www.11467.com/dezhou/co/35907.htm
德州华诚文化传播有限公司(市场一部),http://www.11467.com/dezhou/co/35899.htm
北方网通科技有限责任公司,http://www.11467.com/dongguan/co/501336.htm
上海云视科技有限公司,http://www.11467.com/shanghai/co/1037365.htm
上海安畅网络科技股份有限公司,http://www.11467.com/shanghai/co/1092513.htm
苏州峰通光电有限公司,http://www.11467.com/suzhou/co/401921.htm
东莞世华电子有限公司,http://www.11467.com/dongguan/co/49542.htm
东莞鼎欣网络科技通讯公司,http://www.11467.com/dongguan/co/359380.htm
东莞市贵来网络科技公司,http://www.11467.com/dongguan/co/358424.htm
东莞市雄骏通信科技有限公司,http://www.11467.com/dongguan/co/359019.htm
东莞市维格家具有限公司,http://www.11467.com/dongguan/co/6505.htm
东莞市润科通信有限公司,http://www.11467.com/dongguan/co/359107.htm
骏发(东莞)通信科技有限公司,http://www.11467.com/dongguan/co/491266.htm
贵来网络科技有限公司,http://www.11467.com/dongguan/co/359364.htm
东莞四方贸易有限公司,http://www.11467.com/dongguan/co/501335.htm
友盟科技电子有限公司,http://www.11467.com/dongguan/co/276913.htm
深圳市民益得信息科技有限公司东莞分公司,http://www.11467.com/dongguan/co/506316.htm
张家港市昊海电子有限公司,http://www.11467.com/dongguan/co/135023.htm
香港星际信息技术有限公司东莞办事处,http://www.11467.com/dongguan/co/358786.htm
东莞钰晨商贸有限公司,http://www.11467.com/dongguan/co/491314.htm
新一代网络通讯(东莞)公司开发部,http://www.11467.com/dongguan/co/359234.htm
宇通通讯网络科技有限公司,http://www.11467.com/dongguan/co/161499.htm
中国铁通东莞分公司大朗中心分局,http://www.11467.com/dongguan/co/505205.htm
东莞市九联通讯公司,http://www.11467.com/dongguan/co/358421.htm
中盟网络科技有限公司,http://www.11467.com/dongguan/co/359491.htm
胜利油田阳光网络工程有限责任公司,http://www.11467.com/dongying/co/8920.htm
佛山鑫煌网络技术有限公司,http://www.11467.com/foshan/co/323618.htm
佛山珠江传媒网络有限公司市场部,http://www.11467.com/foshan/co/275132.htm
佛山市新光宏锐电源设备有限公司工程部,http://www.11467.com/foshan/co/275020.htm
中国网通顺德分公司业务受理部,http://www.11467.com/foshan/co/274938.htm
格威通信有限公司,http://www.11467.com/foshan/co/274882.htm
中国联合网络通信有限公司佛山分公司,http://www.11467.com/foshan/co/192144.htm
佛山市顺德区律方圆企业管理有限公司,http://www.11467.com/foshan/co/345598.htm
福建省亿力电力网络信息设备有限公司,http://www.11467.com/fuzhou/co/13604.htm
东大门中国贸易公司,http://www.11467.com/guangzhou/co/359089.htm
广东省电信实业集团广州市有限公司企业客户部,http://www.11467.com/guangzhou/co/359037.htm
广州高科通信技术股份有限公司业务部,http://www.11467.com/guangzhou/co/358935.htm
创金科技信息有限公司,http://www.11467.com/guangzhou/co/360756.htm
广州惠矽电子科技有限公司,http://www.11467.com/guangzhou/co/779.htm
广州捷讯科技网络有限公司,http://www.11467.com/guangzhou/co/477769.htm
广州凯图电子科技有限公司（市场部）,http://www.11467.com/guangzhou/co/360016.htm
广州七彩商贸有限公司广州总部,http://www.11467.com/guangzhou/co/359626.htm
广州尚崇网络科技有限公司,http://www.11467.com/guangzhou/co/474839.htm
广州赛诺通信科技有限公司,http://www.11467.com/guangzhou/co/359435.htm
广州嘉滕信息科技有限公司,http://www.11467.com/guangzhou/co/483623.htm
广州括讯通信有限公司,http://www.11467.com/guangzhou/co/358756.htm
广州市实创信息技术有限公司,http://www.11467.com/guangzhou/co/233325.htm
广州华卫科技有限公司,http://www.11467.com/guangzhou/co/359429.htm
广州市弘讯网络通信有限公司,http://www.11467.com/guangzhou/co/360845.htm
广州市华通电子有限公司,http://www.11467.com/guangzhou/co/360618.htm
广州一诺信息技术有限公司,http://www.11467.com/guangzhou/co/359487.htm
广州诺科电子有限公司,http://www.11467.com/guangzhou/co/200715.htm
广州市绿苹果电器有限公司,http://www.11467.com/guangzhou/co/464652.htm
广州市圳夏电子科技有限公司,http://www.11467.com/guangzhou/co/360616.htm
广州微光通信科技有限公司,http://www.11467.com/guangzhou/co/86479.htm
上海汇付支付服务公司广州办事处,http://www.11467.com/guangzhou/co/484213.htm
广州昱晟电子科技有限公司,http://www.11467.com/guangzhou/co/360097.htm
燕讯计算机科技有限公司,http://www.11467.com/guangzhou/co/143003.htm
天鹭通讯技术有限公司,http://www.11467.com/guangzhou/co/360409.htm
广州新宇田电信设备有限公司,http://www.11467.com/guangzhou/co/358837.htm
新大陆通讯技术有限公司,http://www.11467.com/guangzhou/co/471443.htm
广州原通通讯有限公司,http://www.11467.com/guangzhou/co/359841.htm
仙膦游艺设备有限公司,http://www.11467.com/guangzhou/co/360888.htm
乐谱经贸公司,http://www.11467.com/haerbin/co/54229.htm
杭州弗里德科技有限公司,http://www.11467.com/hangzhou/co/384036.htm
杭州华迈通信科技有限公司,http://www.11467.com/hangzhou/co/282245.htm
杭州颐旭网络科技有限公司,http://www.11467.com/hangzhou/co/282305.htm
杭州初灵信息技术股份有限公司销售部,http://www.11467.com/hangzhou/co/281903.htm
杭州泰圣电子科技有限公司,http://www.11467.com/hangzhou/co/311698.htm
杭州服迅数码科技有限公司,http://www.11467.com/hangzhou/co/281906.htm
杭州天盈金属制品有限公司(品质部）,http://www.11467.com/hangzhou/co/282328.htm
杭州新港计算机网络科技有限公司,http://www.11467.com/hangzhou/co/281876.htm
浙江益朋科技有限公司,http://www.11467.com/hangzhou/co/282407.htm
浙江杭州冠迎贸易公司,http://www.11467.com/hangzhou/co/281842.htm
中宽网信杭州分公司,http://www.11467.com/hangzhou/co/282090.htm
浙江鸿力电子信息有限公司,http://www.11467.com/hangzhou/co/199709.htm
浙江瑞和通信有限公司,http://www.11467.com/hangzhou/co/371106.htm
杭州驷玲玲网络有限公司,http://www.11467.com/hangzhou/co/282100.htm
安徽新力电气设备有限公司,http://www.11467.com/hefei/co/96917.htm
合肥美新科技有限公司,http://www.11467.com/hefei/co/96871.htm
安徽省卡麦龙建材商贸有限公司,http://www.11467.com/hefei/co/131724.htm
济南日易科技有限公司,http://www.11467.com/heze/co/21605.htm
深圳电信工种有限公司惠州分公司,http://www.11467.com/huizhou/co/76685.htm
嘉兴罗格泰克通讯科技有限公司,http://www.11467.com/jiaxing/co/88976.htm
济南东普安全技术有限公司,http://www.11467.com/jinan/co/136443.htm
北京恩源科技有限公司400企业形象电话办理,http://www.11467.com/jinan/co/98888.htm
济南通广公司,http://www.11467.com/jinan/co/99155.htm
济南宽易通信技术有限公司,http://www.11467.com/jinan/co/99090.htm
深圳市联晨科技有限公司（济南分公司）,http://www.11467.com/jinan/co/99051.htm
济南启迪经贸有限公司,http://www.11467.com/jinan/co/98802.htm
济南宣奥科技有限公司,http://www.11467.com/jinan/co/99154.htm
山东首指商贸有限公司,http://www.11467.com/jinan/co/98883.htm
广东九博电子科技有限公司济南办事处,http://www.11467.com/jinan/co/98820.htm
德州华诚文化传播有限公司,http://www.11467.com/jinan/co/99129.htm
中国多多网络技术有限公司,http://www.11467.com/jining/co/51868.htm
昆明熠嘉信息技术有限公司,http://www.11467.com/kunming/co/111824.htm
聊城市前线通讯设备有限公司销售一部,http://www.11467.com/liaocheng/co/33610.htm
聊城市东昌府区北斗星企业管理咨询有限公司,http://www.11467.com/liaocheng/co/46316.htm
中国联通龙岩分公司,http://www.11467.com/longyan/co/22407.htm
佳天通讯服务有限公司,http://www.11467.com/luoyang/co/50195.htm
马鞍山市大成科技有限公司,http://www.11467.com/maanshan/co/15474.htm
