中国电信牡丹江分公司,http://www.11467.com/mudanjiang/co/48751.htm
江西电信绿色网盟公司,http://www.11467.com/nanchang/co/94483.htm
江西省泰博文化有限公司,http://www.11467.com/nanchang/co/94376.htm
南京宝芝工贸有限公司,http://www.11467.com/nanjing/co/95057.htm
南京星期八网络科技有限公司,http://www.11467.com/nanjing/co/95461.htm
南京欣凌静电子科技有限公司,http://www.11467.com/nanjing/co/95504.htm
南京爱尔法特电气设备有限公司,http://www.11467.com/nanjing/co/95260.htm
南京正普通信科技有限公司,http://www.11467.com/nanjing/co/8446.htm
南京易枭龙科技有限公司,http://www.11467.com/nanjing/co/95110.htm
广西大道科技有限公司（市场部）,http://www.11467.com/nanning/co/71035.htm
富元网络科技有限公司,http://www.11467.com/nanning/co/71151.htm
南通通沪通讯设备有限公司,http://www.11467.com/nantong/co/134695.htm
南方通信设备有限公司,http://www.11467.com/ningbo/co/194802.htm
杭州亿邦通信科技有限公司杭州分公司,http://www.11467.com/ningbo/co/127078.htm
宁波市鄞州驰通光信科技有限公司(销售部),http://www.11467.com/ningbo/co/127028.htm
慈溪市恒联通信设备有限公司,http://www.11467.com/ningbo/co/197461.htm
余姚市大华通信设备制造有限公司,http://www.11467.com/ningbo/co/193134.htm
宁波永恒通光纤公司,http://www.11467.com/ningbo/co/127002.htm
盘锦华方电子科技有限公司,http://www.11467.com/panjin/co/4257.htm
青岛百工信息科技有限公司,http://www.11467.com/qingdao/co/107452.htm
青岛有线电视网络有限公司,http://www.11467.com/qingdao/co/107360.htm
青岛宇通网络通信有限公司 业务部,http://www.11467.com/qingdao/co/107453.htm
青岛天成达网络科技有限公司,http://www.11467.com/qingdao/co/107477.htm
青岛恒通达机电设备有限公司,http://www.11467.com/qingdao/co/153266.htm
商丘百易科技公司,http://www.11467.com/shangqiu/co/16766.htm
晨通信息科技有限公司,http://www.11467.com/shantou/co/134758.htm
汕头市瞳翔商贸有限公司,http://www.11467.com/shantou/co/134720.htm
浙江普森通信科技有限公司,http://www.11467.com/shaoxing/co/97787.htm
志宏砂轮有限公司,http://www.11467.com/shaoyang/co/24273.htm
辽宁华易通科技有限责任公司市场部,http://www.11467.com/shenyang/co/71314.htm
沈阳旅行家网络科技有限公司,http://www.11467.com/shenyang/co/71386.htm
辽宁中信瑞通科技有限公司,http://www.11467.com/shenyang/co/97538.htm
众方通信技术有限公司,http://www.11467.com/shenyang/co/71266.htm
沈阳慧创光电科技有限公司,http://www.11467.com/shenyang/co/71327.htm
沈阳嘉亿佳商贸有限公司,http://www.11467.com/shenyang/co/34900.htm
奥达电子科技有限公司,http://www.11467.com/shenzhen/co/642384.htm
北京神州远望通信技术服务中心有限公司深圳分公司,http://www.11467.com/shenzhen/co/642503.htm
博威科技有限公司,http://www.11467.com/shenzhen/co/637182.htm
东方龙大电子（深圳）有限公司,http://www.11467.com/shenzhen/co/388712.htm
陈列公司深圳分公司,http://www.11467.com/shenzhen/co/640522.htm
鴻馳實業有限公司,http://www.11467.com/shenzhen/co/359864.htm
环球通讯国际（香港）有限公司,http://www.11467.com/shenzhen/co/640987.htm
茂源科技（香港）有限公司,http://www.11467.com/shenzhen/co/147423.htm
广州辉讯电子有限公司深圳办,http://www.11467.com/shenzhen/co/637060.htm
广州市鑫昌电子有限公司销售部,http://www.11467.com/shenzhen/co/640570.htm
广东固联网络科技有限公司,http://www.11467.com/shenzhen/co/788383.htm
互联技术有限公司,http://www.11467.com/shenzhen/co/638374.htm
深圳佳宏数字科技有限公司,http://www.11467.com/shenzhen/co/641165.htm
凯旋电源电子有限公司,http://www.11467.com/shenzhen/co/434328.htm
深圳壁虎网络技术有限公司（业务部）,http://www.11467.com/shenzhen/co/637419.htm
纳斯卡网络通讯有限公司,http://www.11467.com/shenzhen/co/641895.htm
强力科技贸易有限公司,http://www.11467.com/shenzhen/co/642463.htm
深圳壁虎网络技术有限公司,http://www.11467.com/shenzhen/co/638095.htm
晶山威电子有限公司,http://www.11467.com/shenzhen/co/641015.htm
深圳丰富光电技术有限公司,http://www.11467.com/shenzhen/co/637819.htm
梦网科技有限公司市场部,http://www.11467.com/shenzhen/co/639491.htm
深圳市奥迅通科技有限公司,http://www.11467.com/shenzhen/co/640725.htm
深信服科技信息有限公司,http://www.11467.com/shenzhen/co/778343.htm
深圳广联威有限公司,http://www.11467.com/shenzhen/co/639384.htm
深圳后天科技有限公司,http://www.11467.com/shenzhen/co/641577.htm
深圳六方通信技术有限公司,http://www.11467.com/shenzhen/co/196025.htm
深圳凌博创科技有限责任公司,http://www.11467.com/shenzhen/co/723619.htm
深圳连达升科技有限公司,http://www.11467.com/shenzhen/co/779090.htm
深圳市创宇通科技有限公司,http://www.11467.com/shenzhen/co/637526.htm
深圳日海通讯技术股份有限公司总部,http://www.11467.com/shenzhen/co/268564.htm
联华世纪通信技术有限公司,http://www.11467.com/shenzhen/co/639738.htm
深圳海之维科技有限公司,http://www.11467.com/shenzhen/co/788533.htm
深圳和信通科技有限公司,http://www.11467.com/shenzhen/co/641268.htm
深圳得利亿电子科技有限公司销售部,http://www.11467.com/shenzhen/co/639209.htm
深圳市德松电子有限公司,http://www.11467.com/shenzhen/co/622668.htm
深圳市点畅触控科技有限公司,http://www.11467.com/shenzhen/co/763583.htm
深圳世纪网通技术开发有限公司,http://www.11467.com/shenzhen/co/637267.htm
深圳市古鼎光电技术有限公司销售部,http://www.11467.com/shenzhen/co/640161.htm
深圳市合众联盟投资发展有限公司（研发部）,http://www.11467.com/shenzhen/co/557328.htm
深圳市国诚新特科技有限公司,http://www.11467.com/shenzhen/co/724300.htm
深圳市帝力科技有限公司,http://www.11467.com/shenzhen/co/225377.htm
深圳市虹远通信有限责任公司,http://www.11467.com/shenzhen/co/638260.htm
深圳市格律诗通信科技有限公司,http://www.11467.com/shenzhen/co/636962.htm
深圳市宏胜达通讯有限公司,http://www.11467.com/shenzhen/co/763808.htm
深圳华盈科技有限责任公司,http://www.11467.com/shenzhen/co/640803.htm
深圳市飞达科技有限公司,http://www.11467.com/shenzhen/co/91077.htm
深圳汇康丰科技发展有限公司,http://www.11467.com/shenzhen/co/638213.htm
深圳市飞行迅达科技有限公司通讯部,http://www.11467.com/shenzhen/co/640534.htm
深圳市惠想科技有限责任公司,http://www.11467.com/shenzhen/co/803623.htm
深圳市惠想科技有限公司,http://www.11467.com/shenzhen/co/642523.htm
深圳市奥星网络科技有限公司,http://www.11467.com/shenzhen/co/785556.htm
深圳乘宇风科技有限公司销售部,http://www.11467.com/shenzhen/co/638354.htm
深圳市海兴和电子有限公司,http://www.11467.com/shenzhen/co/477832.htm
深圳市飞鸿光电子有限公司内贸部华东区,http://www.11467.com/shenzhen/co/641903.htm
深圳市飞扬电子科技有限公司,http://www.11467.com/shenzhen/co/352828.htm
深圳市创威视科技有限公司,http://www.11467.com/shenzhen/co/781975.htm
深圳市华兴网络通讯科技有限公司,http://www.11467.com/shenzhen/co/773958.htm
深圳市华讯通科技有限公司,http://www.11467.com/shenzhen/co/642538.htm
深圳市华正系统集成有限公司业务部,http://www.11467.com/shenzhen/co/638993.htm
深圳市乘宇风网络电话科技有限公司,http://www.11467.com/shenzhen/co/641795.htm
深圳市集时通讯有限公司电购事业部,http://www.11467.com/shenzhen/co/638936.htm
深圳市浪涛光电有限公司,http://www.11467.com/shenzhen/co/761178.htm
深圳市江泰科技有限公司(思科專營部),http://www.11467.com/shenzhen/co/637428.htm
深圳市美德光电通讯有限公司,http://www.11467.com/shenzhen/co/641782.htm
深圳市纳斯卡网络通讯有限公司,http://www.11467.com/shenzhen/co/641174.htm
深圳精维光通信有限公司,http://www.11467.com/shenzhen/co/768913.htm
深圳市润迅移动通信服务有限公司数据事业部,http://www.11467.com/shenzhen/co/639340.htm
深圳市润讯通信息技术有限公司,http://www.11467.com/shenzhen/co/166362.htm
深圳市润翔电缆有限公司,http://www.11467.com/shenzhen/co/534541.htm
深圳开德实业有限公司,http://www.11467.com/shenzhen/co/640367.htm
深圳市实创兴通讯有限公司市场部,http://www.11467.com/shenzhen/co/640777.htm
深圳市世通贝尔科技有限公司,http://www.11467.com/shenzhen/co/793544.htm
深圳市硕鼎贸易有限公司,http://www.11467.com/shenzhen/co/639307.htm
深圳市思图科技有限公司,http://www.11467.com/shenzhen/co/637501.htm
深圳市乾鼎通信设备有限公司,http://www.11467.com/shenzhen/co/640732.htm
深圳市明奥科技有限公司,http://www.11467.com/shenzhen/co/359402.htm
深圳市每天视讯技术有限公司,http://www.11467.com/shenzhen/co/791267.htm
深圳市盛美达通信有限公司,http://www.11467.com/shenzhen/co/518170.htm
深圳市朗维光子技术有限公司,http://www.11467.com/shenzhen/co/773960.htm
深圳市兴永联电子有限公司,http://www.11467.com/shenzhen/co/477271.htm
深圳市瑞光佳讯科技开发有限公司,http://www.11467.com/shenzhen/co/785598.htm
深圳市业松电子有限公司,http://www.11467.com/shenzhen/co/802118.htm
深圳市顺山峰科技有限公司,http://www.11467.com/shenzhen/co/638072.htm
深圳市荣维电子有限公司,http://www.11467.com/shenzhen/co/130087.htm
深圳市世硕科技有限公司,http://www.11467.com/shenzhen/co/776540.htm
深圳市亿联天成通信设备有限公司,http://www.11467.com/shenzhen/co/782207.htm
深圳市宇联讯达科技发展有限公司,http://www.11467.com/shenzhen/co/161569.htm
深圳市宇晟技术公司,http://www.11467.com/shenzhen/co/642488.htm
深圳市亿众科技有限公司,http://www.11467.com/shenzhen/co/637514.htm
深圳天容信息有限公司,http://www.11467.com/shenzhen/co/642286.htm
深圳网电通信设备有限公司,http://www.11467.com/shenzhen/co/638679.htm
深圳银深通贸易有限公司,http://www.11467.com/shenzhen/co/641940.htm
深圳市因特路通信有限公司,http://www.11467.com/shenzhen/co/159662.htm
深圳市英默仕电子有限公司,http://www.11467.com/shenzhen/co/793274.htm
世纪捷通科技有限公司,http://www.11467.com/shenzhen/co/640384.htm
深圳市众方信息科技有限公司市场部,http://www.11467.com/shenzhen/co/639575.htm
深圳市中舟通信技术有限公司,http://www.11467.com/shenzhen/co/791344.htm
深圳市易兴泰科技有限公司-市场部,http://www.11467.com/shenzhen/co/640195.htm
深圳市天亚通科技有限公司(市场一部）,http://www.11467.com/shenzhen/co/641462.htm
深圳市通月科技发展有限公司,http://www.11467.com/shenzhen/co/637840.htm
深圳御道科技有限公司,http://www.11467.com/shenzhen/co/787537.htm
深圳市盈德信科技有限公司,http://www.11467.com/shenzhen/co/795982.htm
永耀有限公司,http://www.11467.com/shenzhen/co/574097.htm
深圳市中诚科技有限公司,http://www.11467.com/shenzhen/co/181767.htm
深圳中舟通信技术有限公司,http://www.11467.com/shenzhen/co/763639.htm
深圳中网万通网络通信技术有限公司,http://www.11467.com/shenzhen/co/641810.htm
深圳众方信息有限公司,http://www.11467.com/shenzhen/co/638801.htm
深圳市东远精工电子有限公司,http://www.11467.com/shenzhen/co/261023.htm
众鑫国际-芯软时代有限公司,http://www.11467.com/shenzhen/co/642270.htm
资高电子科技（深圳）有限公司,http://www.11467.com/shenzhen/co/44013.htm
台湾创为精密材料有限公司(北京办事处),http://www.11467.com/shenzhen/co/636958.htm
泰吉通电子有限公司（业务部）,http://www.11467.com/shenzhen/co/640985.htm
深圳亚斯克通信科技有限公司,http://www.11467.com/shenzhen/co/169408.htm
深圳翔龙通讯有限公司callcenter业务部,http://www.11467.com/shenzhen/co/639548.htm
易贝尔电子科技有限公司内贸部,http://www.11467.com/shenzhen/co/159481.htm
深圳泽优科技有限公司业务部,http://www.11467.com/shenzhen/co/642517.htm
雅宝实业有限公司-发展部,http://www.11467.com/shenzhen/co/641763.htm
深圳市众方信息科技有限公司西南分公司,http://www.11467.com/shenzhen/co/637376.htm
深圳市志润达实业有限公司@市场部,http://www.11467.com/shenzhen/co/637327.htm
深圳市艾韦尔显示有限公司,http://www.11467.com/shenzhen/co/640862.htm
深圳麦艾可网络通信技术有限公司销售部,http://www.11467.com/shenzhen/co/641645.htm
深圳市艾维声电子科技有限公司,http://www.11467.com/shenzhen/co/776524.htm
趋势网络通讯有限公司,http://www.11467.com/shijiazhuang/co/96742.htm
石家庄华信通科技有限公司新飞腾通信部,http://www.11467.com/shijiazhuang/co/78883.htm
石家庄瑞信通信科技有限公司,http://www.11467.com/shijiazhuang/co/96575.htm
江苏省苏州市魏氏电信通信网络集团有限公司,http://www.11467.com/suzhou/co/254845.htm
昆山裕富宁精密电子有限公司,http://www.11467.com/suzhou/co/292329.htm
苏州埃尔特电子有限公司,http://www.11467.com/suzhou/co/269105.htm
苏州纤效电子科技有限公司,http://www.11467.com/suzhou/co/245118.htm
苏州国坦通信设备有限公司,http://www.11467.com/suzhou/co/254691.htm
张家港市万科信息技术有限公司,http://www.11467.com/suzhou/co/127748.htm
中国联通苏州分公司,http://www.11467.com/suzhou/co/321879.htm
中国电信集团北方通信公司泰安分公司,http://www.11467.com/taian/co/53414.htm
山西泽尔文化有限公司,http://www.11467.com/taiyuan/co/100948.htm
中国网通集团太原市通信分公司,http://www.11467.com/taiyuan/co/100958.htm
靖江斯诺新电气设备有限公司,http://www.11467.com/taizhoushi/co/50398.htm
北京恩源科技有限公司潍坊分公司销售一部,http://www.11467.com/weifang/co/87582.htm
浙江海飞接线盒有限公司,http://www.11467.com/wenzhou/co/220845.htm
众兴科技网络通讯公司,http://www.11467.com/wuhai/co/3902.htm
深圳市信诺盈科技开发有限公司武汉办事处,http://www.11467.com/wuhan/co/144427.htm
武汉海迅网络技术有限公司生产部,http://www.11467.com/wuhan/co/59797.htm
武汉明驰达通讯技术有限公司,http://www.11467.com/wuhan/co/79697.htm
武汉立孚光电网络设备有限公司,http://www.11467.com/wuhan/co/59220.htm
武汉精凯通信设备有限公司（技术部）,http://www.11467.com/wuhan/co/96184.htm
武汉迅腾科技有限公司,http://www.11467.com/wuhan/co/96359.htm
武汉维云科技有限公司,http://www.11467.com/wuhan/co/76800.htm
武汉天尚光电有限公司,http://www.11467.com/wuhan/co/95899.htm
武汉佳诚贝尔科技有限公司,http://www.11467.com/wuhan/co/76418.htm
无锡际能通讯配套设备有限公司,http://www.11467.com/wuxi/co/205240.htm
无锡國豐电子科技有限公司,http://www.11467.com/wuxi/co/205254.htm
无锡市企通软件科技有限公司,http://www.11467.com/wuxi/co/205193.htm
厦门蓝芒科技有限公司,http://www.11467.com/xiamen/co/20317.htm
厦门新控网络科技有限责任公司技术部,http://www.11467.com/xiamen/co/67239.htm
厦门吉电科贸有限公司,http://www.11467.com/xiamen/co/67345.htm
陕西普声电气有限公司,http://www.11467.com/xian/co/79765.htm
西安艾讯网络科技有限公司,http://www.11467.com/xian/co/121489.htm
西安汇太通信技术有限公司,http://www.11467.com/xian/co/124292.htm
西安晨舟电子科技有限公司,http://www.11467.com/xian/co/125639.htm
华东电讯公司,http://www.11467.com/xian/co/79836.htm
尤特电子科技公司,http://www.11467.com/xian/co/79832.htm
西安迈瑞电气有限公司,http://www.11467.com/xian/co/122932.htm
西安终南信息技术有限公司,http://www.11467.com/xian/co/54608.htm
西安浦渭系统科技有限公司,http://www.11467.com/xian/co/79787.htm
网易通通讯公司,http://www.11467.com/xiangfan/co/39041.htm
扬州中通科技有限公司网络部,http://www.11467.com/yangzhou/co/85242.htm
金三峡网络通信连锁公司,http://www.11467.com/yichang/co/46069.htm
中国铁通集团有限公司营口分公司,http://www.11467.com/yingkou/co/43066.htm
千传网络通信技术公司,http://www.11467.com/zhengzhou/co/130015.htm
河南商贾计算机有限公司,http://www.11467.com/zhengzhou/co/129926.htm
河南华博科技有限公司,http://www.11467.com/zhengzhou/co/130087.htm
河南达奔赢科技有限公司,http://www.11467.com/zhengzhou/co/129783.htm
郑州国通通信产品技术开发有限公司,http://www.11467.com/zhengzhou/co/130165.htm
北京华信东方科技有限公司郑州办事处,http://www.11467.com/zhengzhou/co/130152.htm
镇江新区雷鸣机电有限公司,http://www.11467.com/zhenjiang/co/49749.htm
镇江一鑫通信物资有限公司,http://www.11467.com/zhenjiang/co/26874.htm
欧康工程有限公司,http://www.11467.com/zhongshan/co/107730.htm
深圳市因特讯科技发展公司,http://www.11467.com/zhongshan/co/107843.htm
雷迪威电子科技有限公司,http://www.11467.com/zhuhai/co/71342.htm
珠海启迪通信技术有限公司,http://www.11467.com/zhuhai/co/36924.htm
北京丰亿成科技有限公司,http://www.11467.com/beijing/co/702347.htm
北京东方平治科技有限公司,http://www.11467.com/beijing/co/122682.htm
北京电信通电信工程有限公司(环网电通),http://www.11467.com/beijing/co/708835.htm
北京光科讯科技有限公司,http://www.11467.com/beijing/co/122509.htm
北京宏申实信科技有限公司销售部,http://www.11467.com/beijing/co/424130.htm
北京恒泰舞台设备有限公司,http://www.11467.com/beijing/co/702343.htm
北京华琪软通技术有限公司 市场部,http://www.11467.com/beijing/co/424291.htm
北京电信通领旗网络技术服务有限公司,http://www.11467.com/beijing/co/122590.htm
北京华夏联动网络技术有限公司,http://www.11467.com/beijing/co/702346.htm
北京飞华领航有限公司,http://www.11467.com/beijing/co/322117.htm
北京鸿泰德瑞科技有限公司,http://www.11467.com/beijing/co/692532.htm
北京宏福集团建科科贸有限公司,http://www.11467.com/beijing/co/28310.htm
北京宏申实信科贸有限公司AudioCodes产品部,http://www.11467.com/beijing/co/653343.htm
北京宏圣讯通网络信息技术有限公司,http://www.11467.com/beijing/co/122827.htm
北京国华科技有限公司,http://www.11467.com/beijing/co/564337.htm
北京路友伟业科技发展有限公司销售部,http://www.11467.com/beijing/co/222371.htm
北京联诚智胜信息技术有限公司,http://www.11467.com/beijing/co/423504.htm
北京佳讯鸿泰科技有限公司,http://www.11467.com/beijing/co/304258.htm
北京明兆科技发展有限公司市场部,http://www.11467.com/beijing/co/424210.htm
北京启铭伟业科技有限公司,http://www.11467.com/beijing/co/698556.htm
北京三旺通信技术有限公司,http://www.11467.com/beijing/co/122418.htm
北京辉煌天成科技有限公司,http://www.11467.com/beijing/co/693475.htm
北京新诺四达科技有限公司,http://www.11467.com/beijing/co/122637.htm
北京天顺达科技有限公司（市场部）,http://www.11467.com/beijing/co/122671.htm
北京特网科技有限公司 市场部,http://www.11467.com/beijing/co/653398.htm
北京鼹鼠科技发展有限公司,http://www.11467.com/beijing/co/424037.htm
北京兆维晓通科技有限公司,http://www.11467.com/beijing/co/250996.htm
北京青山科技有限公司,http://www.11467.com/beijing/co/29929.htm
国宁环宇（北京）科技有限公司,http://www.11467.com/beijing/co/423535.htm
北京宇易厚科技有限公司,http://www.11467.com/beijing/co/122813.htm
北邮英科（北京）信息技术研究所有限公司,http://www.11467.com/beijing/co/423365.htm
上海华亨电信设备有限公司北京销售分公司销售部,http://www.11467.com/beijing/co/673382.htm
神州宏翔科贸有限公司,http://www.11467.com/beijing/co/322181.htm
北京数码晨景信息技术有限公司融通事业部,http://www.11467.com/beijing/co/424094.htm
北京数码晨景信息技术有限责任公司,http://www.11467.com/beijing/co/423756.htm
北京正荣网际科技有限公司-综合服务业务部,http://www.11467.com/beijing/co/424264.htm
吴珍贸易有限公司,http://www.11467.com/beijing/co/424084.htm
北京中普讯通科技有限公司,http://www.11467.com/beijing/co/564360.htm
北京智捷科技有限公司,http://www.11467.com/beijing/co/711724.htm
中国天地畅通科技有限公司,http://www.11467.com/beijing/co/322063.htm
北京正有网络通信技术股份有限公司,http://www.11467.com/beijing/co/423552.htm
远特（北京）通信技术有限公司销售部,http://www.11467.com/beijing/co/122642.htm
上海方略网络物业有限公司,http://www.11467.com/shanghai/co/88076.htm
上海道通网络科技系统有限公司,http://www.11467.com/shanghai/co/530786.htm
上海寰邦通信科技有限公司,http://www.11467.com/shanghai/co/1038548.htm
上海蓝超电子科技有限公司,http://www.11467.com/shanghai/co/530765.htm
上海蓝天科技通信有限责任公司,http://www.11467.com/shanghai/co/976675.htm
上海华涛通信科技有限公司,http://www.11467.com/shanghai/co/267460.htm
上海华仕佳国际物流有限公司,http://www.11467.com/shanghai/co/1047733.htm
上海宁煜计算机科技有限公司,http://www.11467.com/shanghai/co/1059405.htm
上海九庆信息科技公司,http://www.11467.com/shanghai/co/682615.htm
上海始足网络科技有限公司,http://www.11467.com/shanghai/co/1043688.htm
上海市长直通信科技有限公司,http://www.11467.com/shanghai/co/682481.htm
北京天下精诚信息技术有限公司,http://www.11467.com/shanghai/co/48087.htm
上海通信管家有限公司,http://www.11467.com/shanghai/co/743441.htm
张梁通信有限公司,http://www.11467.com/shanghai/co/743409.htm
上海胜特钢杆有限公司,http://www.11467.com/shanghai/co/848816.htm
上海航目电子科技有限公司,http://www.11467.com/shanghai/co/1050665.htm
天津思科赛思科技有限公司,http://www.11467.com/tianjin/co/198091.htm
河南安阳市易利科技有限公司,http://www.11467.com/anyang/co/29508.htm
内蒙古巴彦淖尔市东艺舞台有限公司,http://www.11467.com/bayannaoer/co/4532.htm
安徽千兆通讯器材有限公司,http://www.11467.com/bengbu/co/35776.htm
沧州天维通信设备有限公司,http://www.11467.com/cangzhou/co/58369.htm
网通长春分公司,http://www.11467.com/changchun/co/77913.htm
吉林省润祥科技有限责任公司,http://www.11467.com/changchun/co/96585.htm
长沙电信公司,http://www.11467.com/changsha/co/93211.htm
湖南长沙顶胜科技有限公司,http://www.11467.com/changsha/co/93051.htm
长沙市海湾通讯科技有限公司,http://www.11467.com/changsha/co/92928.htm
长沙慧信科技有限公司业务部,http://www.11467.com/changsha/co/93114.htm
长沙盈联通信器材有限公司,http://www.11467.com/changsha/co/93179.htm
常州伟奇电子系统有限公司,http://www.11467.com/changzhou/co/118748.htm
朝阳通达电子有限公司,http://www.11467.com/chaoyang/co/3426.htm
成都嘉视通数字科技有限公司,http://www.11467.com/chengdu/co/120485.htm
成都市友创信息技术有限公司,http://www.11467.com/chengdu/co/214741.htm
成都鑫元帝科技有限公司,http://www.11467.com/chengdu/co/65926.htm
成都豪通电子技术有限公司,http://www.11467.com/chengdu/co/120322.htm
飞越通讯有限责任公司,http://www.11467.com/chengdu/co/120742.htm
成都神舟软件有限公司,http://www.11467.com/chengdu/co/120342.htm
四川省艾普网络有限公司,http://www.11467.com/chengdu/co/120327.htm
成都捷尔希科技有限公司,http://www.11467.com/chengdu/co/214382.htm
中国联合网络通信有限公司400营销中心,http://www.11467.com/chengdu/co/120660.htm
成都智科电子信息技术有限公司,http://www.11467.com/chengdu/co/120925.htm
大连亿天科技发展有限公司,http://www.11467.com/dalian/co/55245.htm
东莞联通公司,http://www.11467.com/dongguan/co/159673.htm
重庆惠通科技有限公司,http://www.11467.com/chongqing/co/79818.htm
重庆主旋律科技有限公司,http://www.11467.com/chongqing/co/194560.htm
北京国义和科技有限责任公司,http://www.11467.com/beijing/co/726315.htm
天津世成嘉茂商贸有限公司,http://www.11467.com/tianjin/co/302148.htm
南昌市易呼天下科技有限公司,http://www.11467.com/nanchang/co/120288.htm
北京东用科技有限公司,http://www.11467.com/beijing/co/729929.htm
天津市烽讯通科技有限公司,http://www.11467.com/tianjin/co/306505.htm
深圳长城宽带有限公司,http://www.11467.com/shenzhen/co/883983.htm
郑州炫彩网络科技有限公司,http://www.11467.com/zhengzhou/co/203032.htm
北京正仁德信科技有限公司,http://www.11467.com/beijing/co/716424.htm
颖科电子有限公司天津分公司,http://www.11467.com/tianjin/co/309022.htm
天津揽盛通讯设备有限公司,http://www.11467.com/tianjin/co/309298.htm
深圳市锐曦达技术有限公司,http://www.11467.com/shenzhen/co/952200.htm
东莞市荣鸿电子科技有限公司,http://www.11467.com/dongguan/co/605664.htm
武夷山市景程互联网信息技术有限公司,http://www.11467.com/nanping/co/47610.htm
