海域广信息技术有限公司,http://www.11467.com/jinan/co/153032.htm
武汉睿智科通信技术有限公司技术部,http://www.11467.com/wuhan/co/175832.htm
光路在线科(深圳)技有限公司,http://www.11467.com/shenzhen/co/1004097.htm
深圳华之网科技有限公司,http://www.11467.com/shenzhen/co/1037871.htm
深圳市华讯威视科技有限公司,http://www.11467.com/shenzhen/co/1087099.htm
北京亿网互通通信技术有限公司,http://www.11467.com/beijing/co/763306.htm
深圳市奥普特旺科技股份有限公司,http://www.11467.com/shenzhen/co/1108311.htm
上海凯毅科技发展有限公司,http://www.11467.com/shanghai/co/1305242.htm
东莞大汇电子实业公司,http://www.11467.com/dongguan/co/511169.htm
东莞市艾狮自动化设备有限公司,http://www.11467.com/dongguan/co/553432.htm
东莞市乘宇风科技有限公司,http://www.11467.com/dongguan/co/359199.htm
东莞市驰程网络科技有限公司,http://www.11467.com/dongguan/co/552692.htm
东莞市金昶电线制造有限公司,http://www.11467.com/dongguan/co/452867.htm
东莞市新嘉华电子有限公司,http://www.11467.com/dongguan/co/358622.htm
东莞市网络传真电子传真有限公司,http://www.11467.com/dongguan/co/493674.htm
金龙通信科技有限公司,http://www.11467.com/dongguan/co/358758.htm
新星通科技有限公司,http://www.11467.com/dongguan/co/359057.htm
东莞星韵五金电子有限公司,http://www.11467.com/dongguan/co/358974.htm
中国联通广东东莞分公司,http://www.11467.com/dongguan/co/358873.htm
武汉兆年信息技术有限公司,http://www.11467.com/ezhou/co/11784.htm
佛山市环讯科技开发有限公司,http://www.11467.com/foshan/co/108529.htm
佛山市虹炜通信有限公司（市场部）,http://www.11467.com/foshan/co/274800.htm
功夫菜刀公司,http://www.11467.com/foshan/co/275092.htm
阜阳市智讯办公设备有限责任公司,http://www.11467.com/fuyang/co/26753.htm
福州海特信息技术有限公司,http://www.11467.com/fuzhou/co/152740.htm
北京华铁广通电信技术有限公司华南营销部,http://www.11467.com/guangzhou/co/359370.htm
广东正为科技有限公司,http://www.11467.com/guangzhou/co/360786.htm
广州富可欧科技有限公司销售部,http://www.11467.com/guangzhou/co/263003.htm
广州高盈网络科技有限公司,http://www.11467.com/guangzhou/co/464651.htm
广州科灵电子通讯有限公司,http://www.11467.com/guangzhou/co/359763.htm
广州康之宁光学仪器公司,http://www.11467.com/guangzhou/co/360099.htm
广州利凯通信器材有限公司业务部门,http://www.11467.com/guangzhou/co/359399.htm
广州华光通信技术有限公司,http://www.11467.com/guangzhou/co/359442.htm
广州钜像五金公司,http://www.11467.com/guangzhou/co/360553.htm
广州赛华为通讯科技有限公司,http://www.11467.com/guangzhou/co/473231.htm
广州昂扬通讯设备有限公司,http://www.11467.com/guangzhou/co/359941.htm
广州艾讯计算机信息科技有限公司(市场开发部),http://www.11467.com/guangzhou/co/471444.htm
广州市华谱电子科技有限公司市场部,http://www.11467.com/guangzhou/co/359878.htm
广州龙邦智能科技工程有限公司,http://www.11467.com/guangzhou/co/360021.htm
广州城头电子科技有限公司,http://www.11467.com/guangzhou/co/352922.htm
广州人和广联通信科技有限公司,http://www.11467.com/guangzhou/co/467199.htm
广州汇信特通信技术有限公司,http://www.11467.com/guangzhou/co/244313.htm
广州市易发科技有限公司,http://www.11467.com/guangzhou/co/469442.htm
广州市升海投资顾问有限公司,http://www.11467.com/guangzhou/co/359595.htm
广州市炬元通讯有限公司,http://www.11467.com/guangzhou/co/358885.htm
广州众源网络科技有限公司网络销售部,http://www.11467.com/guangzhou/co/239543.htm
广州神韵信息科技有限公司,http://www.11467.com/guangzhou/co/139100.htm
启东市卓程通信器材有限公司,http://www.11467.com/guangzhou/co/262556.htm
广州市中联科技有限公司,http://www.11467.com/guangzhou/co/147633.htm
深圳市金伦科技有限公司广州分公司（销售部）,http://www.11467.com/guangzhou/co/360687.htm
深圳市网商电子有限公司,http://www.11467.com/guangzhou/co/360734.htm
广州市祥誉通讯设备有限公司,http://www.11467.com/guangzhou/co/11356.htm
伟诚商务公司,http://www.11467.com/guangzhou/co/359170.htm
广州新翼信息技术有限公司市场部,http://www.11467.com/guangzhou/co/359472.htm
广州新翼信息技术有限公司,http://www.11467.com/guangzhou/co/359323.htm
升路网络科技有限公司,http://www.11467.com/guangzhou/co/360348.htm
广州中信商务有限公司(销售部）,http://www.11467.com/guangzhou/co/358986.htm
信源电子有限公司,http://www.11467.com/guangzhou/co/263529.htm
中国移动广州分公司,http://www.11467.com/guangzhou/co/464645.htm
广州市吉网通讯科技有限公司IT产品部,http://www.11467.com/guangzhou/co/359658.htm
中国铁通广州分公司400ye,http://www.11467.com/guangzhou/co/359447.htm
贵阳普天信息技术有限公司,http://www.11467.com/guiyang/co/61906.htm
哈尔滨锦程科技贸易公司,http://www.11467.com/haerbin/co/54218.htm
邯郸市海迈数码科技有限公司,http://www.11467.com/handan/co/52554.htm
富阳市万方通信设备有限公司,http://www.11467.com/hangzhou/co/100330.htm
杭州讯诺电子科技有限公司,http://www.11467.com/hangzhou/co/282300.htm
杭州沸点商务调查有限公司,http://www.11467.com/hangzhou/co/281922.htm
杭州开正机电有限公司,http://www.11467.com/hangzhou/co/370585.htm
湖南永发贸易有限公司,http://www.11467.com/hangzhou/co/281869.htm
浙江省电信线路建设公司,http://www.11467.com/hangzhou/co/200994.htm
杭州众方电子工程技术有限公司市场部,http://www.11467.com/hangzhou/co/282268.htm
浙江科赛通信技术有限公司,http://www.11467.com/hangzhou/co/281861.htm
安徽家家园网络技术服务有限公司,http://www.11467.com/hefei/co/96895.htm
合肥帝智诺广告传媒有限公司,http://www.11467.com/hefei/co/131820.htm
合肥远讯商贸有限公司,http://www.11467.com/hefei/co/96816.htm
亦通网络科技有限公司,http://www.11467.com/huainan/co/16135.htm
明源中天投资有限公司,http://www.11467.com/huhehaote/co/27238.htm
内蒙古中博科贸有限责任公司,http://www.11467.com/huhehaote/co/24142.htm
天讯瑞达通信技术有限公司东莞分公司,http://www.11467.com/huizhou/co/76626.htm
呼伦贝尔市极速干线网络有限责任公司,http://www.11467.com/hulunbeier/co/17487.htm
佳木斯易浩网络信息技术有限公司,http://www.11467.com/jiamusi/co/33479.htm
济南乐拓信息发展有限公司,http://www.11467.com/jinan/co/136444.htm
济南思昱创新通讯器材有限公司市场一部,http://www.11467.com/jinan/co/99068.htm
山东连邦网络技术有限公司,http://www.11467.com/jinan/co/98668.htm
济南思昱创新通讯器材公司,http://www.11467.com/jinan/co/99011.htm
济南万胜科技有限公司,http://www.11467.com/jinan/co/98759.htm
济南银泉科技有限公司（网络数字通信（中国）股份有限公司）,http://www.11467.com/jinan/co/98860.htm
济南舜达网络科技有限公司,http://www.11467.com/jinan/co/98774.htm
山东星宏电讯有限公司,http://www.11467.com/jinan/co/98677.htm
济南颢华科技有限公司,http://www.11467.com/jinan/co/98691.htm
山东丰硕科技有限公司,http://www.11467.com/jinan/co/99120.htm
中网通讯网络有限公司,http://www.11467.com/jinan/co/98889.htm
金辰凯特技术有限公司,http://www.11467.com/jingdezhen/co/13691.htm
云南福缘数字电视工程技术有限公司,http://www.11467.com/kunming/co/111868.htm
昆明泰瑞信科技有限公司,http://www.11467.com/kunming/co/111815.htm
陕西贝尔格科技有限公司兰州分公司,http://www.11467.com/lanzhou/co/69443.htm
辽阳华驿软件开发有限公司,http://www.11467.com/liaoyang/co/25013.htm
居美丽家科技公司,http://www.11467.com/linyi/co/96131.htm
柳州睿讯科技公司,http://www.11467.com/liuzhou/co/42469.htm
洛阳网通公司,http://www.11467.com/luoyang/co/50201.htm
香港恒辉公司,http://www.11467.com/meishan/co/13944.htm
四川九洲集团有限责任公司,http://www.11467.com/mianyang/co/36734.htm
四川灵通电子科技股份有限责任公司,http://www.11467.com/mianyang/co/36740.htm
南京大健电子设备有限公司,http://www.11467.com/nanjing/co/95268.htm
南京赛卡机电工程有限公司,http://www.11467.com/nanjing/co/52218.htm
南京沃翼通信科技有限公司,http://www.11467.com/nanjing/co/95422.htm
南京朗若科技有限公司,http://www.11467.com/nanjing/co/155942.htm
南京阳夷电子有限责任公司,http://www.11467.com/nanjing/co/95163.htm
南京春科技有限公司,http://www.11467.com/nanjing/co/95170.htm
江苏省邮电工程建设有限公司,http://www.11467.com/nanjing/co/95138.htm
南宁联创科技公司,http://www.11467.com/nanning/co/71075.htm
广西智荣科技有限公司,http://www.11467.com/nanning/co/71150.htm
南宁天灿商贸有限公司,http://www.11467.com/nanning/co/86337.htm
广西渠峰电子科技有限公司,http://www.11467.com/nanning/co/87567.htm
珠海泰坦科技股份有限公司广西办事处,http://www.11467.com/nanning/co/71176.htm
福建杉雅科技开发有限责任公司,http://www.11467.com/nanping/co/35525.htm
广阔网络通信技术有限公司,http://www.11467.com/nantong/co/109659.htm
宁波江北观通电子工程有限公司,http://www.11467.com/ningbo/co/127031.htm
宁波韵升光通信技术有限公司销售部,http://www.11467.com/ningbo/co/126918.htm
宁波海曙盛博信息科技有限公司销售部,http://www.11467.com/ningbo/co/127084.htm
宁波市江北区特立电子有限公司,http://www.11467.com/ningbo/co/126984.htm
劲电科技有限公司,http://www.11467.com/ningbo/co/196383.htm
北京平湖科贸有限公司赢网通讯部,http://www.11467.com/putian/co/32209.htm
青岛金科通科技有限公司,http://www.11467.com/qingdao/co/107382.htm
汕头市奔腾通信有限公司,http://www.11467.com/shantou/co/134740.htm
汕头益通电信设备实业有限公司,http://www.11467.com/shantou/co/134768.htm
长城宽带韶关分公司,http://www.11467.com/shaoguan/co/25184.htm
基和唯上通信科技有限公司,http://www.11467.com/shaoxing/co/81568.htm
沈阳市恒远电子有限公司hydz,http://www.11467.com/shenyang/co/71297.htm
沈阳信天择网络通讯有限公司,http://www.11467.com/shenyang/co/48994.htm
沈阳非凡科技有限公司,http://www.11467.com/shenyang/co/66116.htm
沈阳啄木鸟科技有限公司,http://www.11467.com/shenyang/co/71399.htm
安科视讯有限公司,http://www.11467.com/shenzhen/co/641759.htm
广东格律诗科技有限公司,http://www.11467.com/shenzhen/co/637944.htm
铼诚兴光电有限公司,http://www.11467.com/shenzhen/co/638869.htm
长宽电信网络有限公司深圳分公司,http://www.11467.com/shenzhen/co/778345.htm
上海迅时通信设备有限公司深圳办事处,http://www.11467.com/shenzhen/co/640712.htm
宏安科技电子有限公司,http://www.11467.com/shenzhen/co/638163.htm
洪宝科技有限公司,http://www.11467.com/shenzhen/co/637379.htm
百一寬頻股份有限公司,http://www.11467.com/shenzhen/co/639517.htm
爱的呼通讯(厦门）有限公司深圳分公司,http://www.11467.com/shenzhen/co/637749.htm
纳斯卡通讯网络科技有限公司,http://www.11467.com/shenzhen/co/157908.htm
深圳市栢信泰电子科技有限公司,http://www.11467.com/shenzhen/co/636898.htm
深圳恒兴技有限公司,http://www.11467.com/shenzhen/co/642430.htm
深圳市宝安新安创亚电子有限公司,http://www.11467.com/shenzhen/co/785557.htm
深圳欧克思特科技有限公司,http://www.11467.com/shenzhen/co/637660.htm
深圳联地科技发展有限公司,http://www.11467.com/shenzhen/co/638410.htm
深圳市创意通信息技术有限公司,http://www.11467.com/shenzhen/co/636930.htm
翎之创电子技术有限公司,http://www.11467.com/shenzhen/co/637242.htm
深圳市德拓科技有限公司,http://www.11467.com/shenzhen/co/637601.htm
深圳市东景盛电子技术有限公司采购部,http://www.11467.com/shenzhen/co/640173.htm
瑞易科技有限公司,http://www.11467.com/shenzhen/co/637778.htm
深圳华强网通有限公司,http://www.11467.com/shenzhen/co/638674.htm
深圳市丰锐科技有限公司,http://www.11467.com/shenzhen/co/95163.htm
深圳得伯乐科技有限公司,http://www.11467.com/shenzhen/co/637581.htm
深圳市博智通通信有限公司,http://www.11467.com/shenzhen/co/637180.htm
深圳博络科技有限公司,http://www.11467.com/shenzhen/co/640843.htm
深圳成功数字有限公司,http://www.11467.com/shenzhen/co/637020.htm
深圳市国顺实业有限公司业务部,http://www.11467.com/shenzhen/co/637155.htm
深圳市鼎正兴科技有限公司（市场部）,http://www.11467.com/shenzhen/co/637701.htm
深圳华智通科技有限公司,http://www.11467.com/shenzhen/co/637423.htm
深圳市鸿骏达通讯设备有限公司,http://www.11467.com/shenzhen/co/807803.htm
深圳翱宇通讯科技有限公司,http://www.11467.com/shenzhen/co/639979.htm
深圳市奥通信息技术有限公司,http://www.11467.com/shenzhen/co/640443.htm
深圳市奥威尔投资发展有限公司,http://www.11467.com/shenzhen/co/387959.htm
深圳市海硕科技有限公司销售部,http://www.11467.com/shenzhen/co/638078.htm
深圳市飞鸿光电子有限公司／销售部,http://www.11467.com/shenzhen/co/640525.htm
深圳市巨澜信息技术有限公司销售部,http://www.11467.com/shenzhen/co/640613.htm
深圳市波导实业有限公司业务部,http://www.11467.com/shenzhen/co/639559.htm
深圳市乐美佳科技有限公司,http://www.11467.com/shenzhen/co/596084.htm
深圳市联升通信技术有限公司<插头二部>,http://www.11467.com/shenzhen/co/639872.htm
深圳市凯路科技有限公司业务部,http://www.11467.com/shenzhen/co/639722.htm
深圳市科华通光电有限公司,http://www.11467.com/shenzhen/co/138576.htm
深圳市诺盛通讯设备发展有限公司,http://www.11467.com/shenzhen/co/638956.htm
深圳市灵创通科技有限公司商务2部,http://www.11467.com/shenzhen/co/206644.htm
深圳市鹏威实业有限公司,http://www.11467.com/shenzhen/co/174834.htm
深圳市平凡科技有限公司（市场部）,http://www.11467.com/shenzhen/co/638907.htm
深圳市胜唐通信有限公司,http://www.11467.com/shenzhen/co/639794.htm
深圳市三正达电子有限公司工程,http://www.11467.com/shenzhen/co/638263.htm
深圳市三卓光电科技有限公司,http://www.11467.com/shenzhen/co/769231.htm
深圳市诠诚兴科技有限公司,http://www.11467.com/shenzhen/co/198102.htm
深圳市纳斯卡通讯科技公司,http://www.11467.com/shenzhen/co/639612.htm
深圳市泰霖科技有限公司,http://www.11467.com/shenzhen/co/11107.htm
深圳市网驰科技有限公司,http://www.11467.com/shenzhen/co/9761.htm
深圳市天博通信设备有限公司商务部,http://www.11467.com/shenzhen/co/637536.htm
深圳市义瑞特智能科技有限公司,http://www.11467.com/shenzhen/co/767255.htm
深圳市华天磊有限公司,http://www.11467.com/shenzhen/co/641814.htm
深圳市实硕实业有限公司,http://www.11467.com/shenzhen/co/636905.htm
深圳市世纪兴华科技有限公司销售部,http://www.11467.com/shenzhen/co/640228.htm
深圳市视高科技发展有限公司 seegle,http://www.11467.com/shenzhen/co/639073.htm
深圳市宇晟技术有限责任公司,http://www.11467.com/shenzhen/co/788530.htm
深圳市易方信通信设备有限公司,http://www.11467.com/shenzhen/co/159017.htm
深圳市粤海恒通信设备有限公司,http://www.11467.com/shenzhen/co/640787.htm
深圳市振通科技有限公司市场部,http://www.11467.com/shenzhen/co/637360.htm
深圳市得利亿电子科技有限公司(市场部),http://www.11467.com/shenzhen/co/638325.htm
深圳市研格科技有限公司,http://www.11467.com/shenzhen/co/639883.htm
深圳市田泽华电子有限公司,http://www.11467.com/shenzhen/co/176392.htm
深圳市先创数字技术有限公司渠道销售部,http://www.11467.com/shenzhen/co/638580.htm
深圳友达网络科技有限公司,http://www.11467.com/shenzhen/co/163821.htm
深圳市扬宇电子有限公司,http://www.11467.com/shenzhen/co/642186.htm
网华电脑网络有限公司,http://www.11467.com/shenzhen/co/639063.htm
深圳市阳光华视科技有限公司,http://www.11467.com/shenzhen/co/768907.htm
世纪网通信设备有限公司,http://www.11467.com/shenzhen/co/640855.htm
香港南霸(亚太)国际有限公司,http://www.11467.com/shenzhen/co/638535.htm
香港新点通讯(深圳)有限公司,http://www.11467.com/shenzhen/co/782145.htm
深圳市深资源科技有限公司,http://www.11467.com/shenzhen/co/640413.htm
威达电子科技有限公司,http://www.11467.com/shenzhen/co/639558.htm
深圳中夏兴业数码科技有限公司,http://www.11467.com/shenzhen/co/641876.htm
深圳中通信息科技发展有限公司,http://www.11467.com/shenzhen/co/768897.htm
深圳众焱传媒科技有限公司,http://www.11467.com/shenzhen/co/640091.htm
振鸿电子(深圳)贸易公司,http://www.11467.com/shenzhen/co/638316.htm
宇晟技术(深圳)有限公司,http://www.11467.com/shenzhen/co/788531.htm
中太（深圳）股份有限公司,http://www.11467.com/shenzhen/co/638351.htm
特利达通讯技术有限公司,http://www.11467.com/shenzhen/co/806494.htm
腾飞科技有限公司-业务部,http://www.11467.com/shenzhen/co/637511.htm
乙辰科技有限公司,http://www.11467.com/shenzhen/co/639861.htm
颖俊电子有限公司,http://www.11467.com/shenzhen/co/777602.htm
深圳远视安防科技有限公司,http://www.11467.com/shenzhen/co/782142.htm
深圳兴科科技有限公司,http://www.11467.com/shenzhen/co/780553.htm
深圳似衡电子科技有限公司,http://www.11467.com/shenzhen/co/641173.htm
深圳市中宝通科技有限公司,http://www.11467.com/shenzhen/co/451634.htm
深圳市艾玛网络有限公司,http://www.11467.com/shenzhen/co/640786.htm
河北新东方传媒公司,http://www.11467.com/shijiazhuang/co/96797.htm
石家庄市天源汇丰科技有限公司,http://www.11467.com/shijiazhuang/co/142859.htm
天锐的通科技有限公司,http://www.11467.com/shijiazhuang/co/96548.htm
科纳技术(蘇州)有限公司,http://www.11467.com/suzhou/co/254667.htm
苏州科苑网络科技有限公司,http://www.11467.com/suzhou/co/254730.htm
太仓市浩腾视听设备配件有限公司,http://www.11467.com/suzhou/co/286499.htm
苏州通盛通信系统有限公司,http://www.11467.com/suzhou/co/254766.htm
吴江亨讯通讯设备有限公司,http://www.11467.com/suzhou/co/346717.htm
苏州新居信息设备有限公司,http://www.11467.com/suzhou/co/254831.htm
信诚商贸有限公司,http://www.11467.com/taiyuan/co/100966.htm
泰州市佳迅通信科技有限公司,http://www.11467.com/taizhoushi/co/32808.htm
威海誉达光通信技术有限公司,http://www.11467.com/weihai/co/33193.htm
天那科技有限公司,http://www.11467.com/wenzhou/co/161239.htm
武汉飞鸿光网络有限公司,http://www.11467.com/wuhan/co/95915.htm
荆州市导通科技有限责任公司,http://www.11467.com/wuhan/co/95868.htm
武汉鸿达伟业科技有限公司,http://www.11467.com/wuhan/co/96283.htm
武汉鼎盛实业有限公司,http://www.11467.com/wuhan/co/95924.htm
武汉无源光网科技有限公司,http://www.11467.com/wuhan/co/61392.htm
武汉大象信息有限公司,http://www.11467.com/wuhan/co/95951.htm
金正数码科技有限公司,http://www.11467.com/wuhan/co/96186.htm
武汉兆年信息技术有限公司（销售部）,http://www.11467.com/wuhan/co/96032.htm
武汉市武汉电信器件有限公司,http://www.11467.com/wuhan/co/95874.htm
无锡市宏达科技有限公司.市场部,http://www.11467.com/wuxi/co/205159.htm
藤县创益科技商务有限公司,http://www.11467.com/wuzhou/co/18371.htm
厦门超博信息技术有限公司,http://www.11467.com/xiamen/co/98275.htm
厦门奥博特光电技术有限公司,http://www.11467.com/xiamen/co/67353.htm
萧一网络技术有限公司,http://www.11467.com/xiamen/co/67396.htm
厦门南和伟业信息技术有限公司,http://www.11467.com/xiamen/co/100117.htm
厦门心灵驿站服务有限公司,http://www.11467.com/xiamen/co/67140.htm
西安唐龙通信有限公司,http://www.11467.com/xian/co/79842.htm
中国一码通智能科技公司,http://www.11467.com/xian/co/79727.htm
陕西朗萨科技发展有限公司,http://www.11467.com/xian/co/79515.htm
咸阳飞讯网络技术有限公司,http://www.11467.com/xianyang/co/22227.htm
河南奥创通信科技有限公司,http://www.11467.com/xinxiang/co/34755.htm
徐州恒远科技通讯有限公司,http://www.11467.com/xuzhou/co/59408.htm
中国铁通盐城分公司,http://www.11467.com/yancheng/co/58213.htm
烟台易通网络科技开发公司,http://www.11467.com/yantai/co/128338.htm
河南华宜网络科技有限公司商务部,http://www.11467.com/zhengzhou/co/129865.htm
河南盛和科技发展有限公司,http://www.11467.com/zhengzhou/co/86576.htm
郑州广源视听设备有限公司,http://www.11467.com/zhengzhou/co/130201.htm
远创商务信息咨询有限公司,http://www.11467.com/zhengzhou/co/129955.htm
郑州信达网络通信有限公司,http://www.11467.com/zhengzhou/co/129883.htm
郑州中原显示技术有限公司生产部,http://www.11467.com/zhengzhou/co/129741.htm
豫王科技信息有限公司,http://www.11467.com/zhengzhou/co/130107.htm
郑州金烁计算机网络科技有限公司,http://www.11467.com/zhengzhou/co/129881.htm
郑州孚润德通信科技有限公司,http://www.11467.com/zhengzhou/co/175118.htm
广东新俊科技股份有限公司,http://www.11467.com/zhongshan/co/107837.htm
珠海市佳讯实业有限公司(珠海),http://www.11467.com/zhuhai/co/83212.htm
株洲梦网信息科技有限公司,http://www.11467.com/zhuzhou/co/35845.htm
淄博海讯电子设备有限公司,http://www.11467.com/zibo/co/186.htm
北京达峰恒业通信技术有限公司,http://www.11467.com/beijing/co/322258.htm
北京动力源科技股份有限公司,http://www.11467.com/beijing/co/314116.htm
北京飞天基业科技发展有限公司,http://www.11467.com/beijing/co/423355.htm
北京创天诚信科技有限公司（代发彩信业务）,http://www.11467.com/beijing/co/424136.htm
北京海为明通信发展有限公司,http://www.11467.com/beijing/co/703852.htm
北京博络科技有限公司,http://www.11467.com/beijing/co/423975.htm
北京得天同瑞信息技术有限公司,http://www.11467.com/beijing/co/122686.htm
北京德隆昌盛科技有限公司,http://www.11467.com/beijing/co/322077.htm
北京金正通达科贸有限公司,http://www.11467.com/beijing/co/705215.htm
北京寰宇网信信息技术有限责任公司,http://www.11467.com/beijing/co/564342.htm
北京佳讯飞鸿有限公司,http://www.11467.com/beijing/co/424194.htm
北京金华永信科技发展有限公司,http://www.11467.com/beijing/co/322141.htm
北京平安力合科技发展有限公司LED事业部,http://www.11467.com/beijing/co/122706.htm
北京鹏宇成科技发展有限责任公司,http://www.11467.com/beijing/co/714051.htm
北京启元同创通讯技术有限公司,http://www.11467.com/beijing/co/423844.htm
北京市华铁广通电信技术有限公司,http://www.11467.com/beijing/co/251882.htm
北京三宝科技有限公司,http://www.11467.com/beijing/co/122722.htm
北京市三威讯通通信技术有限公司,http://www.11467.com/beijing/co/403479.htm
北京思易普科技有限公司,http://www.11467.com/beijing/co/653342.htm
北京华伟远通科技有限公司,http://www.11467.com/beijing/co/423403.htm
北京网创博达科技有限公司,http://www.11467.com/beijing/co/424225.htm
北京天诺信达科技有限公司,http://www.11467.com/beijing/co/322167.htm
北京天润融通科技有限公司事业部,http://www.11467.com/beijing/co/653391.htm
北京网探科技有限公司,http://www.11467.com/beijing/co/653353.htm
北京力光时代科技有限公司,http://www.11467.com/beijing/co/423116.htm
北京万多科技有限公司市场部,http://www.11467.com/beijing/co/122517.htm
北京时代泽熙科技有限公司,http://www.11467.com/beijing/co/122858.htm
北京亿楼地产网络技术有限公司,http://www.11467.com/beijing/co/322229.htm
北京易嘉联合科技公司,http://www.11467.com/beijing/co/423382.htm
北京阳光华硕科技发展有限公司,http://www.11467.com/beijing/co/424200.htm
北京天网信息通信有限责任公司,http://www.11467.com/beijing/co/423242.htm
北京壹典辉腾网络科技有限公司销售部,http://www.11467.com/beijing/co/423566.htm
北京志信恒远科技有限公司,http://www.11467.com/beijing/co/423641.htm
北京中科汉威信息技术有限公司,http://www.11467.com/beijing/co/423426.htm
北京市远耀高科科技有限公司,http://www.11467.com/beijing/co/702344.htm
广州市毅航通信技术有限公司,http://www.11467.com/beijing/co/423480.htm
北京尤莱特科贸有限公司,http://www.11467.com/beijing/co/423337.htm
北京宇红捷讯科技发展有限公司,http://www.11467.com/beijing/co/423670.htm
瑞康电子有限公司,http://www.11467.com/beijing/co/122729.htm
深圳市梦网科技发展有限公司北京营销中心,http://www.11467.com/beijing/co/423607.htm
北京新讯信通科技有限责任公司,http://www.11467.com/beijing/co/423114.htm
