樺櫟傢具（大連）有限公司,http://www.11467.com/dalian/co/54612.htm
大连双飞贸易有限公司,http://www.11467.com/dalian/co/53083.htm
天霖科技公司,http://www.11467.com/dalian/co/54420.htm
大连禧丰商贸有限公司,http://www.11467.com/dalian/co/39253.htm
大连耀楠贸易有限公司,http://www.11467.com/dalian/co/12336.htm
百丰行商贸有限公司,http://www.11467.com/dongguan/co/326999.htm
东莞摩登宠儿商业有限公司,http://www.11467.com/dongguan/co/192818.htm
东莞市艾伦家具有限公司,http://www.11467.com/dongguan/co/352851.htm
东莞海洋超声波机械有限公司,http://www.11467.com/dongguan/co/162771.htm
东莞品博有机玻璃制品有限公司,http://www.11467.com/dongguan/co/501428.htm
曹之轩工艺品有限公司,http://www.11467.com/dongguan/co/320838.htm
东莞联大酒店用品有限公司,http://www.11467.com/dongguan/co/493814.htm
东莞家宝生活用品有限公司,http://www.11467.com/dongguan/co/352040.htm
东莞森茂五金有限公司业务部,http://www.11467.com/dongguan/co/148627.htm
东莞市宝贝家具有限公司,http://www.11467.com/dongguan/co/184718.htm
东莞市百汇特包装制品有限公司,http://www.11467.com/dongguan/co/470951.htm
东莞市鼎诚皮具有限公司,http://www.11467.com/dongguan/co/362847.htm
东莞东泰进出口公司,http://www.11467.com/dongguan/co/163347.htm
东莞市东顺皮具科技有限公司,http://www.11467.com/dongguan/co/497978.htm
东莞市百事通礼品有限公司,http://www.11467.com/dongguan/co/494242.htm
东莞市百旭五金有限公司,http://www.11467.com/dongguan/co/71024.htm
东莞市火凤皇自动焊接机械有限公司,http://www.11467.com/dongguan/co/244111.htm
东莞市嘉联包装制品有限公司,http://www.11467.com/dongguan/co/240905.htm
东莞市三匠工艺品制造有限公司,http://www.11467.com/dongguan/co/199690.htm
东莞市酷宁电器有限公司,http://www.11467.com/dongguan/co/477776.htm
东莞市商兴木业有限公司,http://www.11467.com/dongguan/co/163641.htm
东莞市品地皮具有限公司,http://www.11467.com/dongguan/co/462188.htm
东莞市铭航五金制品有限公司,http://www.11467.com/dongguan/co/454279.htm
东莞市腾辉木制品有限公司,http://www.11467.com/dongguan/co/491418.htm
东莞市腾越塑胶制品有限公司深圳销售点,http://www.11467.com/dongguan/co/412561.htm
东莞市飘飘收纳箱公司,http://www.11467.com/dongguan/co/354224.htm
东莞市欣格家具有限公司,http://www.11467.com/dongguan/co/158095.htm
东莞市瑞琳包装制品有限公司,http://www.11467.com/dongguan/co/325844.htm
东莞市旭辉家居用品有限公司,http://www.11467.com/dongguan/co/492500.htm
东莞市徐达木制品有限公司,http://www.11467.com/dongguan/co/154009.htm
东莞市圆点家居用品有限公司业务部,http://www.11467.com/dongguan/co/354166.htm
东莞市艺兴木器制品有限公司,http://www.11467.com/dongguan/co/452548.htm
东莞市瑞祥皮具有限公司,http://www.11467.com/dongguan/co/171280.htm
东莞市鸿华包装材料有限公司,http://www.11467.com/dongguan/co/199961.htm
东莞市宏富工艺品有限公司,http://www.11467.com/dongguan/co/316147.htm
廣東東莞圓晟塑膠制品有限公司,http://www.11467.com/dongguan/co/270146.htm
东莞市万泽家居用品有限公司,http://www.11467.com/dongguan/co/148463.htm
东莞市熙尚服饰有限公司,http://www.11467.com/dongguan/co/473070.htm
东莞市亿骏制袋有限公司业务部,http://www.11467.com/dongguan/co/319858.htm
东莞市精伦金属制品有限公司,http://www.11467.com/dongguan/co/251813.htm
东莞市亿骏制袋有限公司营业部,http://www.11467.com/dongguan/co/319934.htm
互仁实业发展有限公司,http://www.11467.com/dongguan/co/162131.htm
东莞市互仁实业发展有限公司,http://www.11467.com/dongguan/co/214546.htm
东莞市华贸塑胶制品有限公司,http://www.11467.com/dongguan/co/157087.htm
明荣实业有限公司,http://www.11467.com/dongguan/co/188594.htm
东莞思科生活用品有限公司,http://www.11467.com/dongguan/co/163289.htm
上海千趣会贸易有限公司东莞分公司,http://www.11467.com/dongguan/co/160760.htm
新天缝制品有限公司,http://www.11467.com/dongguan/co/144456.htm
东莞市隆达酒店用品有限公司,http://www.11467.com/dongguan/co/337175.htm
胜威皮具制品有限公司,http://www.11467.com/dongguan/co/505432.htm
深圳市照鹏塑胶制品有限公司营业部,http://www.11467.com/dongguan/co/157225.htm
亿骏制袋有限公司销售部,http://www.11467.com/dongguan/co/206674.htm
兄联服饰有限公司,http://www.11467.com/dongguan/co/148781.htm
普世饰品(深圳)有限公司,http://www.11467.com/dongguan/co/148377.htm
金骏礼品包装有限责任公司,http://www.11467.com/dongguan/co/498243.htm
东莞信赖贸易有限公司,http://www.11467.com/dongguan/co/162050.htm
东莞新奇特日用品公司,http://www.11467.com/dongguan/co/159786.htm
东莞雅万客生活制品有限公司,http://www.11467.com/dongguan/co/164068.htm
御格国际股份有限公司,http://www.11467.com/dongguan/co/161016.htm
旺润实业有限公司,http://www.11467.com/dongguan/co/220937.htm
东莞市有歌智能科技有限公司,http://www.11467.com/dongguan/co/496392.htm
东莞市玉隆五金塑胶有限公司,http://www.11467.com/dongguan/co/122148.htm
东莞市友业皮具有限公司,http://www.11467.com/dongguan/co/474427.htm
紫晶礼品包装有限公司,http://www.11467.com/dongguan/co/161807.htm
东莞市久茂五金塑胶有限公司（设计部）,http://www.11467.com/dongguan/co/340865.htm
鄂尔多斯市馨凯商贸有限责任公司,http://www.11467.com/eerduosi/co/9980.htm
佛山市华顺兴金属工艺制品有限公司(销售部）,http://www.11467.com/foshan/co/248048.htm
佛山市南海区必易家居用品有限公司,http://www.11467.com/foshan/co/231799.htm
中山市万雄卫厨制品有限公司,http://www.11467.com/foshan/co/92400.htm
福建绿园工艺品工贸有限公司,http://www.11467.com/fuzhou/co/136542.htm
福州黄岩贸易有限公司,http://www.11467.com/fuzhou/co/113867.htm
福州和诚压克力制品有限公司,http://www.11467.com/fuzhou/co/139660.htm
鑫祺压克力工艺包装展示公司,http://www.11467.com/fuzhou/co/182409.htm
福建言诺礼品有限公司,http://www.11467.com/fuzhou/co/181118.htm
福州高明服饰有限公司销售部,http://www.11467.com/fuzhou/co/147620.htm
福州市闽侯县敦睦贸易有限公司,http://www.11467.com/fuzhou/co/174120.htm
福州西弗贸易有限公司采购部,http://www.11467.com/fuzhou/co/133612.htm
惠肯日用品公司,http://www.11467.com/fuzhou/co/148920.htm
福建言诺家居有限公司,http://www.11467.com/fuzhou/co/135100.htm
福州春辉皮塑有限公司,http://www.11467.com/fuzhou/co/106885.htm
福州尚品工艺品有限公司业务部,http://www.11467.com/fuzhou/co/135421.htm
丸昌日用品有限公司,http://www.11467.com/fuzhou/co/140655.htm
福建万福企业有限公司外贸业务部,http://www.11467.com/fuzhou/co/135187.htm
赣州市蔚蓝家居用品有限公司,http://www.11467.com/ganzhou/co/27444.htm
赣州市霖润佳商贸有限公司,http://www.11467.com/ganzhou/co/27909.htm
广东华发印刷公司,http://www.11467.com/guangzhou/co/481588.htm
广州爱远日用品有限公司采购部,http://www.11467.com/guangzhou/co/147007.htm
冠灵家居用品有限公司,http://www.11467.com/guangzhou/co/158896.htm
广州绿源无纺布制品有限公司 销售部,http://www.11467.com/guangzhou/co/167116.htm
广州利民无纺布制品有限公司业务部,http://www.11467.com/guangzhou/co/234703.htm
广州镭射无纺布腹合材料有限公司,http://www.11467.com/guangzhou/co/314481.htm
广州爱远日用品有限公司,http://www.11467.com/guangzhou/co/315378.htm
广州呵呵虎商贸有限公司,http://www.11467.com/guangzhou/co/351088.htm
广州汇德家居饰品有限公司,http://www.11467.com/guangzhou/co/301379.htm
广州亮峰科技有限公司,http://www.11467.com/guangzhou/co/251204.htm
广州汇丰礼品有限公司,http://www.11467.com/guangzhou/co/170469.htm
广州慧慧精品贸易有限公司,http://www.11467.com/guangzhou/co/211390.htm
广州聪泰日用制品有限公司,http://www.11467.com/guangzhou/co/462316.htm
广州市佰洋手袋箱包制品公司,http://www.11467.com/guangzhou/co/312395.htm
广州市佰洋手袋箱包有限公司,http://www.11467.com/guangzhou/co/126383.htm
广州赛之美精典家居用品有限公司业务部,http://www.11467.com/guangzhou/co/309395.htm
多好礼品公司,http://www.11467.com/guangzhou/co/346630.htm
广州晨阳家居饰品公司,http://www.11467.com/guangzhou/co/141601.htm
广州利无纺布有限公司,http://www.11467.com/guangzhou/co/132557.htm
广州福泽龙卫生材料有限责任公司,http://www.11467.com/guangzhou/co/430749.htm
广州市长今皮具有限公司,http://www.11467.com/guangzhou/co/67120.htm
广州南裕贸易有限公司,http://www.11467.com/guangzhou/co/284883.htm
广州梦诚箱包有限公司,http://www.11467.com/guangzhou/co/245275.htm
广州赛之美精典家居用品有限公司业务一部,http://www.11467.com/guangzhou/co/312803.htm
广州金腾源进出口贸易有限公司,http://www.11467.com/guangzhou/co/349238.htm
广州锦卓皮具有限公司,http://www.11467.com/guangzhou/co/470270.htm
广州市鸿泰广告制作有限公司,http://www.11467.com/guangzhou/co/480560.htm
广州市雅居阁家居布艺用品有限公司,http://www.11467.com/guangzhou/co/149965.htm
广州亮装塑料薄膜有限公司,http://www.11467.com/guangzhou/co/48316.htm
广州市邻舍日用品有限公司,http://www.11467.com/guangzhou/co/156871.htm
广州市雅居家居布艺用品有限公司,http://www.11467.com/guangzhou/co/155726.htm
广州市太利安有限公司,http://www.11467.com/guangzhou/co/160821.htm
广州市赛嘉日用品有限公司,http://www.11467.com/guangzhou/co/459063.htm
广州市利民无纺布制品有限公司/业务部,http://www.11467.com/guangzhou/co/148394.htm
广州市利民无纺布环保制品有限公司,http://www.11467.com/guangzhou/co/311706.htm
广州市新奇特居家有限公司,http://www.11467.com/guangzhou/co/186363.htm
广州市木野工艺品有限公司,http://www.11467.com/guangzhou/co/69503.htm
广州市亚琪皮具有限公司外贸部,http://www.11467.com/guangzhou/co/314397.htm
广州市烨奇创艺有限公司,http://www.11467.com/guangzhou/co/314479.htm
广州市美炫家居饰品有限公司,http://www.11467.com/guangzhou/co/350387.htm
广州市绿源无纺布制品有限公司,http://www.11467.com/guangzhou/co/132226.htm
林华展示架有限公司经营部,http://www.11467.com/guangzhou/co/241895.htm
广州星禾贸易有限公司,http://www.11467.com/guangzhou/co/163377.htm
广州市瑞祯工艺制品有限公司（销售部）,http://www.11467.com/guangzhou/co/166161.htm
广州维纳斯家居用品有限公司,http://www.11467.com/guangzhou/co/459062.htm
丽淇商贸发展有限公司,http://www.11467.com/guangzhou/co/342633.htm
怡居五金有限公司,http://www.11467.com/guangzhou/co/465153.htm
威利（香港）商贸有限公司,http://www.11467.com/guangzhou/co/159944.htm
广州市利民无纺布制品公司,http://www.11467.com/guangzhou/co/155704.htm
广州市宇恒日用品有限公司,http://www.11467.com/guangzhou/co/200395.htm
广州市信辉实业有限公司,http://www.11467.com/guangzhou/co/210516.htm
景浩日用品有限公司,http://www.11467.com/guangzhou/co/459065.htm
山卡拉（广州）百货贸易有限公司,http://www.11467.com/guangzhou/co/152491.htm
广州市简逸居家庭用品有限公司,http://www.11467.com/guangzhou/co/309078.htm
广西桂林岭南批发贸易有限公司,http://www.11467.com/guilin/co/41908.htm
桂林米青商贸公司,http://www.11467.com/guilin/co/44331.htm
点积商贸有限公司,http://www.11467.com/guiyang/co/73789.htm
绵阳华盛祥商贸有限公司,http://www.11467.com/guiyang/co/70395.htm
(哈尔滨)舒悦家居有限公司,http://www.11467.com/haerbin/co/53800.htm
哈尔滨广丰经贸有限公司,http://www.11467.com/haerbin/co/51341.htm
杭州创力智能箱柜有限公司,http://www.11467.com/hangzhou/co/353431.htm
杭州顿力医疗器械股份有限公司,http://www.11467.com/hangzhou/co/305252.htm
杭州大鼎金属制品有限公司贸易部,http://www.11467.com/hangzhou/co/262077.htm
杭州百信工贸有限公司,http://www.11467.com/hangzhou/co/373177.htm
杭州朵兰娜家纺有限公司,http://www.11467.com/hangzhou/co/217000.htm
杭州永翔建设集团有限公司第一分公司,http://www.11467.com/hangzhou/co/279698.htm
杭州汉阁休闲家居有限公司（商品企划部）,http://www.11467.com/hangzhou/co/266227.htm
杭州网商商务咨询有限公司,http://www.11467.com/hangzhou/co/216910.htm
杭州良渚古文化工艺制品有限公司,http://www.11467.com/hangzhou/co/128157.htm
杭州悍马进出口有限公司,http://www.11467.com/hangzhou/co/241515.htm
天台县伊利特汽车用品有限公司,http://www.11467.com/hangzhou/co/243100.htm
杭州乐道标识设计有限公司,http://www.11467.com/hangzhou/co/113217.htm
杭州淘宜购家居用品有限公司,http://www.11467.com/hangzhou/co/232731.htm
杭州腾原箱包有限公司,http://www.11467.com/hangzhou/co/355656.htm
杭州米思电子商务有限公司,http://www.11467.com/hangzhou/co/273695.htm
安徽长百塑胶科技有限公司,http://www.11467.com/hefei/co/81432.htm
安徽艺园商贸有限公司,http://www.11467.com/hefei/co/95628.htm
合肥东成名家晾衣架有限公司,http://www.11467.com/hefei/co/92382.htm
合肥索菲智能科技有限公司,http://www.11467.com/hefei/co/132371.htm
合肥市茶花家居塑料用品有限公司,http://www.11467.com/hefei/co/95806.htm
合肥成洲装饰工程有限公司,http://www.11467.com/hefei/co/95446.htm
合肥爱心家庭用品有限公司,http://www.11467.com/hefei/co/51457.htm
安平县园迪商贸有限公司,http://www.11467.com/hengshui/co/34394.htm
河北雅馨家居布艺商贸公司,http://www.11467.com/hengshui/co/26808.htm
曹县仁力实木包装有限公司,http://www.11467.com/heze/co/34343.htm
山东曹县商都工艺品有限公司,http://www.11467.com/heze/co/34125.htm
曹县圣亚工艺品有限公司,http://www.11467.com/heze/co/6557.htm
山东菏泽博尚饰品有限公司,http://www.11467.com/heze/co/19272.htm
菏泽曹氏集团有限公司,http://www.11467.com/heze/co/19987.htm
菏泽鼎好饰家家居有限公司,http://www.11467.com/heze/co/34428.htm
淮安市晟祺商贸有限公司,http://www.11467.com/huaian/co/36205.htm
惠州市美华包装材料有限公司,http://www.11467.com/huizhou/co/92476.htm
金山塑胶制品有限公司,http://www.11467.com/huizhou/co/59022.htm
惠州市昌亿塑料制品有限公司（住宿部）,http://www.11467.com/huizhou/co/75919.htm
东莞市常平大田商贸有限公司,http://www.11467.com/huizhou/co/64650.htm
杭州趣彩商贸有限公司,http://www.11467.com/hangzhou/co/367434.htm
好富贵家居用品有限公司,http://www.11467.com/huizhou/co/59203.htm
惠州市鸿泰金属制品有限公司,http://www.11467.com/huizhou/co/62828.htm
势必德实业有限公司,http://www.11467.com/huizhou/co/62560.htm
惠州市昌亿塑料制品有限公司,http://www.11467.com/huizhou/co/79503.htm
惠州市永力实业有限公司,http://www.11467.com/huizhou/co/96833.htm
葫芦岛创元设计公司,http://www.11467.com/huludao/co/42817.htm
湖州绿色居家有限公司,http://www.11467.com/huzhou/co/47428.htm
安吉冠丰竹木制品有限公司,http://www.11467.com/huzhou/co/67054.htm
德清县荣昊工艺品有限公司,http://www.11467.com/huzhou/co/67041.htm
富拓家居用品有限公司,http://www.11467.com/jiangmen/co/84306.htm
广东和记雨具(五金)有限公司,http://www.11467.com/jiangmen/co/115948.htm
江门市德悦进出口有限公司,http://www.11467.com/jiangmen/co/83779.htm
江门市江海区恒燊五金制品有限公司,http://www.11467.com/jiangmen/co/106317.htm
阳江市图强工业有限公司,http://www.11467.com/jiangmen/co/74602.htm
江门市拓艺家居用品有限公司,http://www.11467.com/jiangmen/co/87817.htm
新创家居用品有限公司,http://www.11467.com/jiangmen/co/86225.htm
台山市嘉和皮具制品有限公司,http://www.11467.com/jiangmen/co/110095.htm
江门市新会区凯胜贸易有限公司,http://www.11467.com/jiangmen/co/111510.htm
嘉兴龙正文化传媒有限公司,http://www.11467.com/jiaxing/co/81022.htm
嘉兴市辉胜金属制品有限公司,http://www.11467.com/jiaxing/co/47737.htm
嘉兴市乐居电子商务有限公司,http://www.11467.com/jiaxing/co/123479.htm
嘉兴市云龙金属制品有限公司,http://www.11467.com/jiaxing/co/47788.htm
揭阳市家乐福塑胶有限公司,http://www.11467.com/jieyang/co/31283.htm
揭阳市吉庆塑胶有限公司,http://www.11467.com/jieyang/co/9694.htm
广东省揭阳市兴阳塑胶制品有限公司,http://www.11467.com/jieyang/co/27338.htm
揭阳双桥塑料五金有限公司,http://www.11467.com/jieyang/co/31281.htm
揭阳裕颖塑胶制品厂有限公司,http://www.11467.com/jieyang/co/21875.htm
山东金铭商贸有限公司,http://www.11467.com/jinan/co/97160.htm
济南市爱格商贸有限公司,http://www.11467.com/jinan/co/69911.htm
湖北怡家家庭用品有限公司,http://www.11467.com/jingmen/co/16693.htm
义乌市面对面电子商务有限公司,http://www.11467.com/jinhua/co/123306.htm
创达外贸有限公司,http://www.11467.com/jinhua/co/123639.htm
金华新新休闲用品有限公司,http://www.11467.com/jinhua/co/79216.htm
东阳市奥健日用品有限公司,http://www.11467.com/jinhua/co/67821.htm
义乌兰香阁布艺公司,http://www.11467.com/jinhua/co/68779.htm
浙江依琳家居用品有限公司,http://www.11467.com/jinhua/co/125386.htm
义乌市卓格狼箱包有限公司,http://www.11467.com/jinhua/co/125385.htm
上海嘉居生活用品有限公司,http://www.11467.com/jinhua/co/122362.htm
义乌好菲尔布艺有限公司,http://www.11467.com/jinhua/co/125814.htm
汕头市盛美日用品有限公司,http://www.11467.com/jinhua/co/126836.htm
义乌传百股份有限公司,http://www.11467.com/jinhua/co/124482.htm
义乌市斯美制袋有限公司,http://www.11467.com/jinhua/co/122367.htm
义乌市艺纯布艺有限公司,http://www.11467.com/jinhua/co/124988.htm
广东汕头家用塑料制造有限公司,http://www.11467.com/jinhua/co/67638.htm
义乌博特电子商务有限公司,http://www.11467.com/jinhua/co/67902.htm
浙江金粉世家工艺品有限公司,http://www.11467.com/jinhua/co/127694.htm
义乌金粉世家工艺品有限公司,http://www.11467.com/jinhua/co/127927.htm
义乌市宇翔日用品有限公司,http://www.11467.com/jinhua/co/122146.htm
义乌市运合进出口有限公司,http://www.11467.com/jinhua/co/124443.htm
义乌市同梦家居日用品有限公司,http://www.11467.com/jinhua/co/67945.htm
武义乐美日用品有限公司,http://www.11467.com/jinzhou/co/49840.htm
武义百特贸易有限公司,http://www.11467.com/jinzhou/co/49346.htm
浙江南洋工贸有限公司,http://www.11467.com/jinzhou/co/46309.htm
浙江枫悦工贸有限公司,http://www.11467.com/jinzhou/co/49358.htm
昆明地瓶线商贸有限公司,http://www.11467.com/kunming/co/100761.htm
廊坊市美木美化妆品有限公司,http://www.11467.com/langfang/co/43244.htm
金馨家纺商贸公司,http://www.11467.com/lanzhou/co/65736.htm
连云港市惠乐家居礼品有限公司,http://www.11467.com/lianyungang/co/44079.htm
连云港晶狐水晶家居用品有限公司（销售部）,http://www.11467.com/lianyungang/co/26835.htm
连云港新海家居有限公司,http://www.11467.com/lianyungang/co/26866.htm
临沂昂必立工艺品有限公司,http://www.11467.com/linyi/co/56807.htm
临沂润盈工艺品有限公司,http://www.11467.com/linyi/co/15476.htm
临沂申屠家庭用品有限公司,http://www.11467.com/linyi/co/55688.htm
临沂开元工艺品有限公司,http://www.11467.com/linyi/co/66906.htm
临沂益鑫工艺商贸有限公司,http://www.11467.com/linyi/co/57002.htm
郯城县东润工艺品有限公司,http://www.11467.com/linyi/co/89144.htm
临沂金艺工艺品有限公司,http://www.11467.com/linyi/co/58055.htm
龙岩市万事兴箱柜有限公司,http://www.11467.com/longyan/co/24996.htm
合江义乌家居饰品公司,http://www.11467.com/luzhou/co/16744.htm
山东省博兴县中艺纺织有限公司,http://www.11467.com/lvliang/co/15203.htm
上海双佰服饰有限公司江西分公司,http://www.11467.com/nanchang/co/83056.htm
金陵塑胶化工有限公司中空桶托盘塑料制品销售部,http://www.11467.com/nanjing/co/50672.htm
南京稻草人家居用品有限公司,http://www.11467.com/nanjing/co/56880.htm
雷龍服飾工藝有限公司,http://www.11467.com/nanjing/co/64006.htm
巨卓国际有限公司采购部,http://www.11467.com/nanjing/co/83584.htm
南京帝雅西家居有限公司,http://www.11467.com/nanjing/co/60263.htm
南京光神环保科技有限公司竹编加工厂,http://www.11467.com/nanjing/co/93355.htm
南京茂美凯地商贸有限公司,http://www.11467.com/nanjing/co/59397.htm
南京家宝日用品有限公司,http://www.11467.com/nanjing/co/83648.htm
南京龙马申泰工贸有限公司,http://www.11467.com/nanjing/co/60272.htm
南京荣熠箱包制造有限公司,http://www.11467.com/nanjing/co/83935.htm
南京聚诚科技有限公司,http://www.11467.com/nanjing/co/53552.htm
南京高德箔业装饰材料有限公司,http://www.11467.com/nanjing/co/64257.htm
南京枫林惠工贸有限公司,http://www.11467.com/nanjing/co/57821.htm
佳辉家居用品批发公司,http://www.11467.com/nanning/co/86604.htm
广州市永宁清洁用品代理有限公司,http://www.11467.com/nanning/co/70514.htm
南通宝通日用品有限公司,http://www.11467.com/nantong/co/138801.htm
南通中盛工贸有限公司,http://www.11467.com/nantong/co/72502.htm
南通贝蕾玩具礼品有限公司,http://www.11467.com/nantong/co/61608.htm
内江市东和商贸有限公司,http://www.11467.com/neijiang/co/20641.htm
宁波国银箱柜有限公司,http://www.11467.com/ningbo/co/186912.htm
宁波江东易居人生商贸有限公司,http://www.11467.com/ningbo/co/143583.htm
环球经贸技术合作有限公司,http://www.11467.com/ningbo/co/75962.htm
宁波意趣家居用品有限公司,http://www.11467.com/ningbo/co/74125.htm
宁波乐凯包装有限公司,http://www.11467.com/ningbo/co/194910.htm
余姚市舜佳彩印包装有限公司,http://www.11467.com/ningbo/co/194909.htm
宁波市北仑喜多塑业有限公司 销售部,http://www.11467.com/ningbo/co/124747.htm
台湾鼎丰实业有限公司金华分公司采购部,http://www.11467.com/ningbo/co/73703.htm
屏南县旺诚工艺品有限公司,http://www.11467.com/ningde/co/4743.htm
福建鲤光木制品工艺有限公司,http://www.11467.com/putian/co/39551.htm
福建鲤光木制工艺有限公司,http://www.11467.com/putian/co/39436.htm
青岛城阳盛达木业有限公司,http://www.11467.com/qingdao/co/11618.htm
青岛蒲菲工艺品有限公司,http://www.11467.com/qingdao/co/153617.htm
青岛永丰工艺品有限公司,http://www.11467.com/qingdao/co/153302.htm
泉州市哥弟五金制品有限公司(哥弟布衣柜),http://www.11467.com/quanzhou/co/130872.htm
圣德利有限公司,http://www.11467.com/quanzhou/co/130555.htm
浙江龙游华亿贸易有限公司,http://www.11467.com/quzhou/co/21726.htm
商丘新新百货公司,http://www.11467.com/shangqiu/co/15314.htm
玉山县金鹰箱包有限公司,http://www.11467.com/shangrao/co/25327.htm
广东省汕头市弘信贸易有限公司,http://www.11467.com/shantou/co/134095.htm
广东银润实业有限公司,http://www.11467.com/shantou/co/117154.htm
汕头市洪林贸易有限公司,http://www.11467.com/shantou/co/117629.htm
汕头市铠达塑胶有限公司,http://www.11467.com/shantou/co/150408.htm
汕头康加好工贸有限公司,http://www.11467.com/shantou/co/134171.htm
汕头市澄海区华盛达塑胶有限公司,http://www.11467.com/shantou/co/142486.htm
汕头市信荣塑料五金工艺有限公司,http://www.11467.com/shantou/co/126514.htm
汕头文生贸易有限公司,http://www.11467.com/shantou/co/117123.htm
汕头市东兴金属制品有限公司,http://www.11467.com/shantou/co/122221.htm
绍兴县康洁生物制品有限公司,http://www.11467.com/shaoxing/co/80135.htm
绍兴县求是不锈钢管业有限公司,http://www.11467.com/shaoxing/co/16240.htm
绍兴半球家居用品有限公司,http://www.11467.com/shaoxing/co/117772.htm
沈阳市同根商贸有限公司,http://www.11467.com/shenyang/co/97356.htm
沈阳雅世装饰五金有限公司,http://www.11467.com/shenyang/co/66007.htm
沈阳汇尔商贸有限公司,http://www.11467.com/shenyang/co/52620.htm
郑州雅迪工贸有限公司[沈阳办事处],http://www.11467.com/shenyang/co/70379.htm
博恩施达国际有限公司,http://www.11467.com/shenzhen/co/610290.htm
东科包装有限公司,http://www.11467.com/shenzhen/co/287052.htm
佛丽斯塑胶制品有限公司,http://www.11467.com/shenzhen/co/150774.htm
东科塑胶包装有限公司,http://www.11467.com/shenzhen/co/349314.htm
宏骏达企业有限公司销售部,http://www.11467.com/shenzhen/co/221984.htm
东兴百货商贸有限公司,http://www.11467.com/shenzhen/co/782655.htm
龙得云科技发展公司,http://www.11467.com/shenzhen/co/218119.htm
深圳东科塑料包装有限公司,http://www.11467.com/shenzhen/co/565649.htm
