东莞市九鼎印刷制品有限公司,http://www.11467.com/dongguan/co/496153.htm
繼陽家居公司,http://www.11467.com/dongguan/co/353266.htm
肯尼制造（东莞）有限公司采购部,http://www.11467.com/dongguan/co/167884.htm
新铭柳制工艺品有限公司,http://www.11467.com/dongguan/co/327154.htm
东莞韦宝玩具有限公司,http://www.11467.com/dongguan/co/51037.htm
东莞威盟五金塑胶制品有限公司,http://www.11467.com/dongguan/co/77763.htm
东莞五洲制罐厂有限公司,http://www.11467.com/dongguan/co/24011.htm
天彩塑胶制品有限公司,http://www.11467.com/dongguan/co/159757.htm
东莞益多家居用品有限公司,http://www.11467.com/dongguan/co/161699.htm
东莞市林顺手袋有限公司,http://www.11467.com/dongguan/co/507511.htm
南力企业有限公司,http://www.11467.com/dongguan/co/190940.htm
順利企業有限公司,http://www.11467.com/dongguan/co/339452.htm
菲兰特皮具有限公司,http://www.11467.com/dongguan/co/162218.htm
宜而简家居用品（上海）有限公司,http://www.11467.com/dongguan/co/215709.htm
奇尚创意家居饰品有限公司,http://www.11467.com/dongguan/co/162009.htm
东莞市有泽五金制品有限公司,http://www.11467.com/dongguan/co/200139.htm
东莞市湖嵘家居用品有限公司业务部,http://www.11467.com/dongguan/co/328204.htm
天汇（东莞）金属皮具有限公司,http://www.11467.com/dongguan/co/300919.htm
统颖礼品家饰（东莞）有限公司（业务部）,http://www.11467.com/dongguan/co/339931.htm
广东省东莞机械进出口有限公司业务7部,http://www.11467.com/dongguan/co/314344.htm
凱博手袋製品有限公司,http://www.11467.com/dongguan/co/324096.htm
鄂尔多斯市企美广告礼品有限公司,http://www.11467.com/eerduosi/co/8217.htm
朝新皮件（中山）有限公司,http://www.11467.com/foshan/co/85011.htm
佛山市南海区衡朗金属制品有限公司,http://www.11467.com/foshan/co/230323.htm
飞翔贸易公司销售部,http://www.11467.com/foshan/co/262370.htm
杭州沃尔德金属工艺品有限公司,http://www.11467.com/foshan/co/305627.htm
佛山市顺德区和畅五金电器实业有限公司,http://www.11467.com/foshan/co/185331.htm
佛山市视觉倾城广告有限公司,http://www.11467.com/foshan/co/256799.htm
鸿盛贸易公司,http://www.11467.com/foshan/co/231019.htm
佛山澳边包装及鞋业有限公司,http://www.11467.com/foshan/co/258559.htm
佛山市金镌锋家居用品有限公司,http://www.11467.com/foshan/co/204345.htm
佛山市华羽包装袋有限公司,http://www.11467.com/foshan/co/347602.htm
佛山市顺德海维思家具有限公司,http://www.11467.com/foshan/co/201368.htm
佛山市金雅源酒店用品公司,http://www.11467.com/foshan/co/262552.htm
洋洋时尚家居用品有限公司,http://www.11467.com/foshan/co/235752.htm
鸿绪家具公司,http://www.11467.com/foshan/co/269729.htm
佛山市顺德区森唛卡电器有限公司,http://www.11467.com/foshan/co/331166.htm
品佳创意用品有限公司,http://www.11467.com/foshan/co/204772.htm
可馨家饰有限公司,http://www.11467.com/foshan/co/254939.htm
佳适工艺品公司,http://www.11467.com/foshan/co/199444.htm
竖横贸易有限公司,http://www.11467.com/foshan/co/199909.htm
安徽阜南县合兴柳编工艺制品有限公司,http://www.11467.com/fuyang/co/14788.htm
福州艾美家居用品有限公司,http://www.11467.com/fuzhou/co/146678.htm
福建省南平市润欣贸易有限公司,http://www.11467.com/fuzhou/co/135550.htm
福州福旺贸易有限公司,http://www.11467.com/fuzhou/co/185281.htm
福建新奇小商品货源有限公司,http://www.11467.com/fuzhou/co/147560.htm
福州霖力达工艺品有限公司,http://www.11467.com/fuzhou/co/40052.htm
福建福州威诚工艺品有限公司-业务部,http://www.11467.com/fuzhou/co/140329.htm
福州和亨日家居用品有限公司,http://www.11467.com/fuzhou/co/135834.htm
福州和信达工艺品有限公司,http://www.11467.com/fuzhou/co/68621.htm
福州和亨日用品有限公司,http://www.11467.com/fuzhou/co/140301.htm
洁雅坊家坊公司,http://www.11467.com/fuzhou/co/135954.htm
福州和亨日用品有限公司业务部,http://www.11467.com/fuzhou/co/148694.htm
福州鸿艺饰家工艺品有限公司,http://www.11467.com/fuzhou/co/148583.htm
依卡贝日用纺织品有限公司,http://www.11467.com/fuzhou/co/181499.htm
福建鑫创源日用品有限公司,http://www.11467.com/fuzhou/co/181945.htm
闽侯东才贸易有限公司,http://www.11467.com/fuzhou/co/181219.htm
安徽阜南县美燕柳编工艺品有限公司销售部,http://www.11467.com/guangzhou/co/210650.htm
丰泰实业有限公司,http://www.11467.com/guangzhou/co/231102.htm
广州顶晖贸易有限公司销售部,http://www.11467.com/guangzhou/co/157906.htm
广州福星灯饰有限公司,http://www.11467.com/guangzhou/co/459064.htm
广州飞行人皮具制品有限公司,http://www.11467.com/guangzhou/co/132811.htm
广州利民无纺布有限公司,http://www.11467.com/guangzhou/co/346343.htm
广州穆紫坊工艺品有限公司,http://www.11467.com/guangzhou/co/315691.htm
广州品昕贸易有限公司,http://www.11467.com/guangzhou/co/96239.htm
广州派典无纺布有限公司,http://www.11467.com/guangzhou/co/215075.htm
广东颐乐购百货有限公司商品部,http://www.11467.com/guangzhou/co/112802.htm
广州贸易发展有限公司,http://www.11467.com/guangzhou/co/457856.htm
广州美炫家居饰品有限公司-业务部,http://www.11467.com/guangzhou/co/350389.htm
佛山市时尚生活礼品公司,http://www.11467.com/guangzhou/co/141369.htm
广州杰威箱包皮具有限公司,http://www.11467.com/guangzhou/co/141550.htm
广州盟鑫陈列用品有限公司,http://www.11467.com/guangzhou/co/467631.htm
广州杰信商贸有限公司,http://www.11467.com/guangzhou/co/169428.htm
广州捷豹皮具有限公司,http://www.11467.com/guangzhou/co/491997.htm
广州浩泰无纺布有限公司,http://www.11467.com/guangzhou/co/64963.htm
广州美炫家居饰品有限公司-销售部,http://www.11467.com/guangzhou/co/350390.htm
广有限公司,http://www.11467.com/guangzhou/co/465156.htm
广州点精企业形象策划有限公司,http://www.11467.com/guangzhou/co/465154.htm
广州顶丰电子有限公司,http://www.11467.com/guangzhou/co/147367.htm
广州嘉宝日用有限公司,http://www.11467.com/guangzhou/co/157655.htm
广州赛之美精典家居用品有限公司,http://www.11467.com/guangzhou/co/201871.htm
广州市恒创环保包装制品有限公司,http://www.11467.com/guangzhou/co/315761.htm
广州番禺恒星五金有限公司,http://www.11467.com/guangzhou/co/286940.htm
广州楚丰无纺布制品有限公司,http://www.11467.com/guangzhou/co/49368.htm
广州市奥特贸易公司,http://www.11467.com/guangzhou/co/156746.htm
广州市碧亮日用品有限公司,http://www.11467.com/guangzhou/co/210299.htm
广州华辉企业有限公司,http://www.11467.com/guangzhou/co/467630.htm
广州谦达工艺制品有限公司进出口部,http://www.11467.com/guangzhou/co/309001.htm
广州市国熙日用品有限公司,http://www.11467.com/guangzhou/co/315370.htm
广州美亚贸易有限公司,http://www.11467.com/guangzhou/co/125028.htm
广州市世文中西厨业有限公司,http://www.11467.com/guangzhou/co/69538.htm
广州市生景工艺品有限公司,http://www.11467.com/guangzhou/co/92413.htm
广州市山河贸易有限公司,http://www.11467.com/guangzhou/co/347951.htm
广州家弘金属制品有限公司,http://www.11467.com/guangzhou/co/131836.htm
广州嘉美塑料包装制品有限公司,http://www.11467.com/guangzhou/co/210753.htm
广州市亚琪皮具制品有限公司,http://www.11467.com/guangzhou/co/287188.htm
广州市信驰皮具制品有限公司,http://www.11467.com/guangzhou/co/210724.htm
广州市美炫家居有限公司,http://www.11467.com/guangzhou/co/471820.htm
广州市海兰贸易有限公司,http://www.11467.com/guangzhou/co/320327.htm
广州欧麦拉家居饰品有限公司,http://www.11467.com/guangzhou/co/213236.htm
广州市美炫家居饰品有限公司业务部,http://www.11467.com/guangzhou/co/350388.htm
广州直阔皮具有限公司,http://www.11467.com/guangzhou/co/197897.htm
广州泰燊家具饰品有限公司(业务部),http://www.11467.com/guangzhou/co/348957.htm
广州市天顺贸易有限公司,http://www.11467.com/guangzhou/co/264589.htm
广州市梦莎家居用品有限公司,http://www.11467.com/guangzhou/co/346562.htm
广州市云上居家饰坊独资公司,http://www.11467.com/guangzhou/co/162795.htm
广州中佳塑料文具包装材料有限公司（销售部2）,http://www.11467.com/guangzhou/co/315060.htm
力至拓塑料模具有限公司业务部,http://www.11467.com/guangzhou/co/245405.htm
广州庄之蝶金属制品有限公司,http://www.11467.com/guangzhou/co/195712.htm
广州市瑞辉贸易有限公司,http://www.11467.com/guangzhou/co/90321.htm
贵州帝欧商贸有限公司,http://www.11467.com/guangzhou/co/159897.htm
廣州恒星五金公司,http://www.11467.com/guangzhou/co/148689.htm
广州易趣家居用品有限公司 (销售部）,http://www.11467.com/guangzhou/co/326657.htm
广州市温馨纺织品有限公司,http://www.11467.com/guangzhou/co/210962.htm
广州西玛德企业管理咨询有限公司 乐趣生活,http://www.11467.com/guangzhou/co/159474.htm
广州市铭嵘贸易有限公司,http://www.11467.com/guangzhou/co/195645.htm
广州小月亮创意家居创意礼品公司,http://www.11467.com/guangzhou/co/301419.htm
恒鑫百货有限公司,http://www.11467.com/guangzhou/co/163402.htm
广州市韵语家居用品有限公司,http://www.11467.com/guangzhou/co/284880.htm
广州振兴塑料实业有限公司,http://www.11467.com/guangzhou/co/155305.htm
麒麟汽车礼品用品有限公司,http://www.11467.com/guangzhou/co/149276.htm
强士不锈钢卫浴有限公司,http://www.11467.com/guangzhou/co/284314.htm
汇昕国际有限公司业务部,http://www.11467.com/guangzhou/co/214459.htm
美炫家居用品有限公司,http://www.11467.com/guangzhou/co/350391.htm
广州新惠宝日用品有限公司商品开发部,http://www.11467.com/guangzhou/co/149804.htm
广州鑫琪贸易有限公司,http://www.11467.com/guangzhou/co/314896.htm
广州英利日用品有限公司,http://www.11467.com/guangzhou/co/311855.htm
广州市优越无纺布制品有限公司,http://www.11467.com/guangzhou/co/146884.htm
新桠酒店用品有限公司,http://www.11467.com/guangzhou/co/230330.htm
循环集团有限公司,http://www.11467.com/guangzhou/co/465155.htm
无限创意家居有限公司,http://www.11467.com/guangzhou/co/147422.htm
广州市信辉实业有限公司销售部,http://www.11467.com/guangzhou/co/212654.htm
汕头市金铼贸易有限公司,http://www.11467.com/guangzhou/co/210767.htm
广州市佳年华饰品有限公司,http://www.11467.com/guangzhou/co/156443.htm
广州骅保无纺布制品有限公司,http://www.11467.com/guangzhou/co/215414.htm
广州宇杰贸易有限公司,http://www.11467.com/guangzhou/co/188568.htm
平南县卓惠工艺制品有限公司,http://www.11467.com/guigang/co/7844.htm
多宝宫日用品及内衣批发公司,http://www.11467.com/guilin/co/44782.htm
惠然经贸有限公司哈尔滨业务部,http://www.11467.com/haerbin/co/43708.htm
邯郸开发区陆合家居用品有限公司,http://www.11467.com/handan/co/68846.htm
邯郸陆合家具有限公司,http://www.11467.com/handan/co/69150.htm
杭州居家乐家庭用品有限公司,http://www.11467.com/hangzhou/co/279438.htm
杭州灵博贸易有限公司（销售部）,http://www.11467.com/hangzhou/co/223369.htm
杭州简纳家居有限公司,http://www.11467.com/hangzhou/co/217153.htm
杭州吉丽亚卫浴有限公司,http://www.11467.com/hangzhou/co/221315.htm
杭州木善木美家居用品有限公司,http://www.11467.com/hangzhou/co/232708.htm
杭州纽拓科技有限公司,http://www.11467.com/hangzhou/co/365111.htm
杭州顺发工艺品有限公司（业务部）,http://www.11467.com/hangzhou/co/220663.htm
杭州颐居易购家居用品有限公司,http://www.11467.com/hangzhou/co/361780.htm
杭州丹阳科技有限公司,http://www.11467.com/hangzhou/co/278629.htm
杭州咔咔麦电子商务有限公司,http://www.11467.com/hangzhou/co/276864.htm
杭州北斗整合包装有限公司,http://www.11467.com/hangzhou/co/111224.htm
杭州群英贸易有限公司,http://www.11467.com/hangzhou/co/221454.htm
杭州上杭电子商务有限公司,http://www.11467.com/hangzhou/co/280341.htm
杭州威廉斯仙人球有限公司,http://www.11467.com/hangzhou/co/279320.htm
杭州同享科技有限公司,http://www.11467.com/hangzhou/co/206200.htm
浙江心想是橙贸易有限公司,http://www.11467.com/hangzhou/co/222277.htm
浙江龙游华亿贸易有限公司销售部,http://www.11467.com/hangzhou/co/213043.htm
杭州缘尚网络科技有限公司,http://www.11467.com/hangzhou/co/279276.htm
大头卡通家居用品有限公司,http://www.11467.com/hangzhou/co/278431.htm
中国和风外贸有限公司(南方总部),http://www.11467.com/hangzhou/co/219023.htm
中国杭州自然家品天然生活用品有限公司,http://www.11467.com/hangzhou/co/233798.htm
杭州紫月亮有机玻璃制品有限公司,http://www.11467.com/hangzhou/co/233398.htm
杭州挚诚贸易有限公司,http://www.11467.com/hangzhou/co/218185.htm
杭州顺发工艺品有限公司,http://www.11467.com/hangzhou/co/71077.htm
杭州锐创软件有限公司,http://www.11467.com/hangzhou/co/214806.htm
杭州映睿贸易有限公司,http://www.11467.com/hangzhou/co/313652.htm
合肥爱皖日用品有限公司,http://www.11467.com/hefei/co/126321.htm
荣誉盈商贸有限公司,http://www.11467.com/hefei/co/84456.htm
合肥沙洲电子科技有限公司,http://www.11467.com/hefei/co/84661.htm
单县舜心商贸公司,http://www.11467.com/heze/co/34597.htm
曹县宏宇工艺品有限公司,http://www.11467.com/heze/co/33544.htm
菏泽市牡丹区昊诚布艺礼品有限公司,http://www.11467.com/heze/co/29658.htm
曹县众立工艺品有限公司,http://www.11467.com/heze/co/24618.htm
欧利美时尚家具有限公司,http://www.11467.com/heze/co/19121.htm
快展进出口有限公司,http://www.11467.com/heze/co/19624.htm
山东乐家木业发展有限公司,http://www.11467.com/heze/co/19964.htm
淮安史特克斯国际贸易有限公司,http://www.11467.com/huaian/co/35495.htm
上海泓鑫实业有限公司,http://www.11467.com/huangshan/co/12485.htm
惠州市瑞豪家居用品有限公司,http://www.11467.com/huizhou/co/97614.htm
惠州市义诚五金制品有限公司,http://www.11467.com/huizhou/co/71117.htm
南海化纤制品有限公司,http://www.11467.com/huizhou/co/60663.htm
惠州市富远铝塑有限公司,http://www.11467.com/huizhou/co/97613.htm
浙江上源休闲用品有限公司,http://www.11467.com/huzhou/co/27714.htm
广东江门泰格贸易有限公司,http://www.11467.com/jiangmen/co/97257.htm
江门市蓬江区名硕五金塑料制品有限公司,http://www.11467.com/jiangmen/co/114288.htm
盈通工贸发展有限公司,http://www.11467.com/jiangmen/co/83528.htm
江门市广茂家具有限公司,http://www.11467.com/jiangmen/co/102162.htm
江门淘乐礼品有限公司,http://www.11467.com/jiangmen/co/84571.htm
香港鸿益国际家品有限公司,http://www.11467.com/jiangmen/co/92049.htm
海盐飞雪日用品有限公司生产销售部,http://www.11467.com/jiaxing/co/80660.htm
海盐手握手礼品公司,http://www.11467.com/jiaxing/co/88408.htm
嘉兴市盛晨箱包有限公司,http://www.11467.com/jiaxing/co/10396.htm
嘉兴中尔雅木制品有限公司,http://www.11467.com/jiaxing/co/88345.htm
嘉兴市好思鑫箱包有限公司,http://www.11467.com/jiaxing/co/84982.htm
嘉兴市全成无纺布制品有限公司,http://www.11467.com/jiaxing/co/46850.htm
浙江省衢州中吉郎箱包有限公司,http://www.11467.com/jiaxing/co/87074.htm
揭阳市区创大钟表电器厂有限公司,http://www.11467.com/jieyang/co/16194.htm
揭阳市信发五金塑料有限公司,http://www.11467.com/jieyang/co/3484.htm
揭阳市乾鼎五金塑料有限公司,http://www.11467.com/jieyang/co/25883.htm
揭阳美庭塑胶有限公司销售部,http://www.11467.com/jieyang/co/21908.htm
雷搏创业公司,http://www.11467.com/jilinshi/co/78071.htm
济南金尚艺实业有限公司市场部,http://www.11467.com/jinan/co/68724.htm
土纳木外贸箱包贸易有限公司,http://www.11467.com/jinan/co/71655.htm
土纳木外贸包贸易有限公司,http://www.11467.com/jinan/co/97272.htm
济南萱草商贸有限公司,http://www.11467.com/jinan/co/137875.htm
山西风行学生用品有限公司,http://www.11467.com/jincheng/co/17335.htm
义乌优芬日用品有限公司,http://www.11467.com/jinhua/co/123804.htm
义乌谊家美进出口有限公司,http://www.11467.com/jinhua/co/124436.htm
义乌易红电子商务有限公司,http://www.11467.com/jinhua/co/124442.htm
金华市蓝色小屋家居饰品有限公司,http://www.11467.com/jinhua/co/125387.htm
