白骨精贸易有限公司,http://www.11467.com/shenzhen/co/619355.htm
百分百商品贸易公司,http://www.11467.com/shenzhen/co/178769.htm
创美家居用品有限公司,http://www.11467.com/shenzhen/co/224917.htm
深圳给力尚品电子科技有限公司,http://www.11467.com/shenzhen/co/798274.htm
美瑞家居用品公司销售部,http://www.11467.com/shenzhen/co/213872.htm
深圳东科塑胶包装有限公司-业务部,http://www.11467.com/shenzhen/co/219530.htm
深圳盛莱美箱包皮具有限公司,http://www.11467.com/shenzhen/co/765117.htm
深圳宏兆渡甫箱包有限公司,http://www.11467.com/shenzhen/co/724728.htm
龙腾商贸(国际)有限公司,http://www.11467.com/shenzhen/co/220032.htm
三洋高科（深圳）有限公司,http://www.11467.com/shenzhen/co/616788.htm
深圳日信皮具袋有限公司,http://www.11467.com/shenzhen/co/796600.htm
深圳瑞景有机玻璃制品有限公司,http://www.11467.com/shenzhen/co/802167.htm
深圳市东方盛世工艺品有限公司,http://www.11467.com/shenzhen/co/254456.htm
深圳市菲梦思商贸有限公司,http://www.11467.com/shenzhen/co/214067.htm
深圳市北辰进出口有限公司,http://www.11467.com/shenzhen/co/219475.htm
深圳市保利博纳贸易有限公司（生产部）,http://www.11467.com/shenzhen/co/222596.htm
深圳市博亿亨实业有限公司,http://www.11467.com/shenzhen/co/277842.htm
深圳市帝壹科技有限公司,http://www.11467.com/shenzhen/co/786023.htm
深圳市昂威手袋有限公司,http://www.11467.com/shenzhen/co/224983.htm
深圳市长鹏环球工贸有限公司（业务部）,http://www.11467.com/shenzhen/co/221215.htm
路威五金制品有限公司外贸部,http://www.11467.com/shenzhen/co/513655.htm
深圳市铵兴泰贸易有限公司,http://www.11467.com/shenzhen/co/578554.htm
深圳市华光百货批发有限公司,http://www.11467.com/shenzhen/co/212704.htm
深圳市佳昌达实业有限公司销售部,http://www.11467.com/shenzhen/co/223094.htm
深圳市宏洲贸易有限公司,http://www.11467.com/shenzhen/co/179787.htm
深圳市法莱克斯包装制品有限公司,http://www.11467.com/shenzhen/co/238788.htm
深圳市富盟皮具制品有限公司,http://www.11467.com/shenzhen/co/222469.htm
深圳市积可达电子有限公司,http://www.11467.com/shenzhen/co/223184.htm
深圳市百购谷商贸有限公司,http://www.11467.com/shenzhen/co/269404.htm
深圳市嘉雅吉工艺品有限公司,http://www.11467.com/shenzhen/co/565388.htm
深圳市韩天塑胶有限公司,http://www.11467.com/shenzhen/co/722992.htm
深圳市弘飞皮具制品有限公司业务部,http://www.11467.com/shenzhen/co/267856.htm
深圳市蓝宇鸿科技有限公司,http://www.11467.com/shenzhen/co/804616.htm
深圳市卡都亚广场有限公司,http://www.11467.com/shenzhen/co/235021.htm
深圳市君澜华夏纺织品有限公司,http://www.11467.com/shenzhen/co/789318.htm
深圳市集强进出口有限公司,http://www.11467.com/shenzhen/co/778798.htm
深圳市贺翔实业有限公司销售部,http://www.11467.com/shenzhen/co/149141.htm
深圳市和美富塑胶有限公司 市场拓展部,http://www.11467.com/shenzhen/co/284632.htm
深圳市兰德工艺礼品有限公司,http://www.11467.com/shenzhen/co/215040.htm
深圳市礼尚来科技有限公司礼品部,http://www.11467.com/shenzhen/co/216749.htm
深圳市可爱佳家庭用品有限公司,http://www.11467.com/shenzhen/co/259172.htm
深圳龙得云科技公司,http://www.11467.com/shenzhen/co/220787.htm
深圳市明彩塑胶制品有限公司,http://www.11467.com/shenzhen/co/277931.htm
深圳市美可家居用品有限公司,http://www.11467.com/shenzhen/co/152533.htm
深圳卡尔威投资发展有限公司,http://www.11467.com/shenzhen/co/774633.htm
深圳市上上好科技有限公司,http://www.11467.com/shenzhen/co/216556.htm
深圳市莎士丹皮具有限公司,http://www.11467.com/shenzhen/co/577791.htm
深圳市赛艺手袋电压有限公司,http://www.11467.com/shenzhen/co/575770.htm
深圳市兴易达手袋有限公司,http://www.11467.com/shenzhen/co/779469.htm
深圳市瑞尔环保科技有限公司,http://www.11467.com/shenzhen/co/566174.htm
深圳市特美特袋业有限公司,http://www.11467.com/shenzhen/co/327850.htm
深圳市网商时代信息科技有限公司,http://www.11467.com/shenzhen/co/578248.htm
深圳市永旭家居饰品有限公司,http://www.11467.com/shenzhen/co/605477.htm
深圳市义和山绳带制造有限公司,http://www.11467.com/shenzhen/co/223918.htm
深圳市新源制品有限公司,http://www.11467.com/shenzhen/co/619665.htm
深圳市鑫耀宇科技有限责任公司销售部,http://www.11467.com/shenzhen/co/151928.htm
舒然运动器材有限公司,http://www.11467.com/shenzhen/co/769546.htm
深圳市依璐盈贸易有限公司,http://www.11467.com/shenzhen/co/178273.htm
深圳康铭商贸进出口有限公司,http://www.11467.com/shenzhen/co/610689.htm
深圳市天欣谭氏工艺品有限公司,http://www.11467.com/shenzhen/co/568480.htm
深圳市先锋龙有机玻璃制品公司(市场部),http://www.11467.com/shenzhen/co/278990.htm
深圳市自由设计柜有限公司,http://www.11467.com/shenzhen/co/201583.htm
深圳市雅燕家居饰品有限公司,http://www.11467.com/shenzhen/co/607111.htm
深圳市营世贸易有限公司,http://www.11467.com/shenzhen/co/207863.htm
武汉华中贸易公司,http://www.11467.com/shenzhen/co/206070.htm
香港为美布艺国际有限公司手袋业务部,http://www.11467.com/shenzhen/co/576286.htm
浙江居家欢乐购贸易有限公司,http://www.11467.com/shenzhen/co/282960.htm
威赢工贸(深圳)有限公司,http://www.11467.com/shenzhen/co/774530.htm
众成概念工艺品有限公司业务部,http://www.11467.com/shenzhen/co/577135.htm
深圳市新华商贸易有限公司,http://www.11467.com/shenzhen/co/322642.htm
深圳市東科塑膠包裝有限公司,http://www.11467.com/shenzhen/co/577843.htm
深圳市东泰无纺布有限公司,http://www.11467.com/shenzhen/co/91134.htm
万宝隆礼品实业(深圳）有限公司,http://www.11467.com/shenzhen/co/212740.htm
桐興(香港)有限公司,http://www.11467.com/shenzhen/co/723028.htm
中怡贸易公司,http://www.11467.com/shenzhen/co/602091.htm
天宝手袋制品有限公司,http://www.11467.com/shenzhen/co/794341.htm
深圳义乌藤编工艺品有限公司,http://www.11467.com/shenzhen/co/218005.htm
深圳沃康达环保科技有限公司,http://www.11467.com/shenzhen/co/798291.htm
新力富国际有限公司,http://www.11467.com/shenzhen/co/283409.htm
深圳市嘉力皮具有限公司,http://www.11467.com/shenzhen/co/211231.htm
恒兴礼品公司,http://www.11467.com/shenzhen/co/225853.htm
深圳市艾尚创意家居有限公司销售部,http://www.11467.com/shenzhen/co/617744.htm
深圳美之高实业发展有限公司（内贸部）,http://www.11467.com/shenzhen/co/303615.htm
深圳美最时家居工艺品有限公司,http://www.11467.com/shenzhen/co/236460.htm
深圳协威雅铁塑制品有限公司(业务部）,http://www.11467.com/shenzhen/co/217626.htm
北方扫帚有限公司,http://www.11467.com/shijiazhuang/co/79997.htm
佳丽家居饰品实业公司,http://www.11467.com/shijiazhuang/co/78483.htm
北京艾和商贸有限公司,http://www.11467.com/shijiazhuang/co/78349.htm
石家庄市嘉祥布艺家居有限公司,http://www.11467.com/shijiazhuang/co/140207.htm
七色彩虹家居家饰有限公司,http://www.11467.com/shijiazhuang/co/95240.htm
石家庄名睿家居用品有限公司-办公室,http://www.11467.com/shijiazhuang/co/95858.htm
石家庄木博家居用品贸易有限公司,http://www.11467.com/shijiazhuang/co/123198.htm
石家庄丹丝兰纺织品贸易有限公司,http://www.11467.com/shijiazhuang/co/120980.htm
琳琅满目家居饰品有限公司,http://www.11467.com/shijiazhuang/co/140965.htm
蓝屋日用品有限公司,http://www.11467.com/suqian/co/12085.htm
华丽没家居文化公司,http://www.11467.com/suqian/co/10321.htm
宿迁双鲸皮件有限公司,http://www.11467.com/suqian/co/12110.htm
宿迁光彦箱柜有限公司,http://www.11467.com/suqian/co/20756.htm
宿迁佳怡家居用品有限公司,http://www.11467.com/suqian/co/12280.htm
宿迁乐乐家居装饰有限公司,http://www.11467.com/suqian/co/10355.htm
我爱我家家居有限公司,http://www.11467.com/suqian/co/12246.htm
常熟市鼎强复合材料有限公司,http://www.11467.com/suzhou/co/315876.htm
苏州聚合发塑胶电子有限公司,http://www.11467.com/suzhou/co/287490.htm
苏州鑫世家家居用品有限公司,http://www.11467.com/suzhou/co/315878.htm
苏州春天印象家居有限公司,http://www.11467.com/suzhou/co/253534.htm
苏州海贝妮丝贸易有限公司,http://www.11467.com/suzhou/co/213294.htm
苏州曦源家居有限公司,http://www.11467.com/suzhou/co/211885.htm
苏州市天创金属制品有限公司(采购部),http://www.11467.com/suzhou/co/243490.htm
苏州美达斯机电有限公司,http://www.11467.com/suzhou/co/179201.htm
苏州耐尔顺塑料有限公司,http://www.11467.com/suzhou/co/248536.htm
苏州泰灵达电子有限公司,http://www.11467.com/suzhou/co/317252.htm
苏州起程礼品公司,http://www.11467.com/suzhou/co/223621.htm
太原心荷家居用品有限公司,http://www.11467.com/taiyuan/co/124735.htm
台州市天晨日用品有限公司(业务部）,http://www.11467.com/taizhou/co/98828.htm
台州市万源鸿塑胶有限公司,http://www.11467.com/taizhou/co/80373.htm
龙艺办公用品有限公司,http://www.11467.com/taizhou/co/98747.htm
贵溪银美工艺品有限公司,http://www.11467.com/taizhou/co/80897.htm
台州市佰达工贸有限公司,http://www.11467.com/taizhou/co/81806.htm
台州市文丰家居用品有限公司,http://www.11467.com/taizhou/co/98861.htm
台州多彩家居饰品有限公司,http://www.11467.com/taizhou/co/81805.htm
台州市万源鸿塑胶有限公司（销售部）,http://www.11467.com/taizhou/co/80978.htm
四轮马车休闲日用品有限公司,http://www.11467.com/taizhou/co/98731.htm
台州黄岩旭昶塑模有限公司,http://www.11467.com/taizhou/co/80445.htm
异家塑料贸易有限公司,http://www.11467.com/taizhou/co/80401.htm
台州市佰亿特塑料家居用品有限公司,http://www.11467.com/taizhou/co/81438.htm
浙江省天台县橡塑贸易公司,http://www.11467.com/taizhou/co/81325.htm
台州双剑塑业有限公司,http://www.11467.com/taizhou/co/137337.htm
泰兴市梦帆箱柜有限公司,http://www.11467.com/taizhoushi/co/43632.htm
诸城市恒顺达纸制品有限公司,http://www.11467.com/weifang/co/117824.htm
平阳县禾加礼品有限公司,http://www.11467.com/wenzhou/co/129246.htm
瑞安市千彩包装有限公司,http://www.11467.com/wenzhou/co/218290.htm
温州保利吉五金制品有限公司销售部,http://www.11467.com/wenzhou/co/128921.htm
平阳翔宇标牌有限公司,http://www.11467.com/wenzhou/co/219505.htm
温州三和实业有限公司,http://www.11467.com/wenzhou/co/128733.htm
温州博意博箱包有限公司,http://www.11467.com/wenzhou/co/75679.htm
湖北海燕商贸有限公司,http://www.11467.com/wuhan/co/61965.htm
武汉爱贝家居用品有限公司,http://www.11467.com/wuhan/co/62452.htm
武汉安尚工艺礼品有限公司,http://www.11467.com/wuhan/co/70165.htm
武汉创富文化传播有限公司,http://www.11467.com/wuhan/co/20894.htm
武汉美忆包装有限公司,http://www.11467.com/wuhan/co/70070.htm
武汉美林美家家居品连锁销售有限公司,http://www.11467.com/wuhan/co/93974.htm
武汉鑫月家居用品有限公司销售部,http://www.11467.com/wuhan/co/61221.htm
文文家装有限公司,http://www.11467.com/wuhan/co/93294.htm
武汉市嘉哼酒店用品有限公司,http://www.11467.com/wuhan/co/142101.htm
武汉市爱之家实业有限公司市场部,http://www.11467.com/wuhan/co/62102.htm
武汉秋润商贸有限公司,http://www.11467.com/wuhan/co/143282.htm
武汉源晋创意家居用品有限公司,http://www.11467.com/wuhan/co/63398.htm
命运（武汉）科技有限公司,http://www.11467.com/wuhan/co/94581.htm
武汉聚光翰华数字科技有限公司,http://www.11467.com/wuhan/co/94041.htm
武汉金宝力商贸有限公司,http://www.11467.com/wuhan/co/62693.htm
武汉命运科技有限公司,http://www.11467.com/wuhan/co/94582.htm
芜湖市青松旅游用品有限公司,http://www.11467.com/wuhu/co/17984.htm
芜湖卓尚园家居用品贸易有限公司,http://www.11467.com/wuhu/co/29744.htm
芜湖亿腾商贸有限公司,http://www.11467.com/wuhu/co/20911.htm
江阴市龙洋塑料包装有限公司,http://www.11467.com/wuxi/co/218325.htm
无锡莫凡思化妆品有限公司,http://www.11467.com/wuxi/co/244895.htm
扬州市凯诺进出口贸易有限公司,http://www.11467.com/wuxi/co/177802.htm
无锡豪思纺织品有限公司业务部,http://www.11467.com/wuxi/co/180195.htm
中兴百货有限公司,http://www.11467.com/wuzhou/co/15692.htm
古德轩酒店设备制造有限公司(业务部),http://www.11467.com/xiamen/co/39017.htm
泉州锦盛皮塑包袋有限公司,http://www.11467.com/xiamen/co/41146.htm
龙海市中原家具有限公司,http://www.11467.com/xiamen/co/30965.htm
厦门嵘源日用品有限公司设计部,http://www.11467.com/xiamen/co/31570.htm
厦门富立行工贸有限公司销售部,http://www.11467.com/xiamen/co/37691.htm
厦门市圣德元工贸有限公司,http://www.11467.com/xiamen/co/55325.htm
厦门杰西商贸有限公司,http://www.11467.com/xiamen/co/38038.htm
厦门乐家坊日用品有限公司,http://www.11467.com/xiamen/co/84669.htm
厦门涌涛包袋有限公司,http://www.11467.com/xiamen/co/31522.htm
厦门力家美贸易有限公司采购部,http://www.11467.com/xiamen/co/32000.htm
厦门帅旗贸易有限贵公司,http://www.11467.com/xiamen/co/35965.htm
厦门永丰商贸有限公司,http://www.11467.com/xiamen/co/60853.htm
厦门伊家宜家庭用品有限公司,http://www.11467.com/xiamen/co/41432.htm
厦门市及及毛绒玩具公司,http://www.11467.com/xiamen/co/32338.htm
厦门市晶采贸易有限责任公司,http://www.11467.com/xiamen/co/38096.htm
厦门悠派无纺布制品有限公司,http://www.11467.com/xiamen/co/93442.htm
厦门远航家庭有限公司,http://www.11467.com/xiamen/co/59796.htm
漳州入门笑日用品有限公司,http://www.11467.com/xiamen/co/30297.htm
物豪工贸(厦门)有限公司,http://www.11467.com/xiamen/co/96081.htm
厦门锦福特商贸有限公司,http://www.11467.com/xiamen/co/41054.htm
西安东洁清洗有限公司,http://www.11467.com/xian/co/48140.htm
陕西维美纸业有限责任公司,http://www.11467.com/xian/co/59008.htm
西安尚乐信息科技有限公司,http://www.11467.com/xian/co/78068.htm
南宫市青隆毛毡工艺礼品有限公司,http://www.11467.com/xintai/co/36951.htm
徐州迦南时尚家居公司,http://www.11467.com/xuzhou/co/52501.htm
徐州辛勤国际贸易有限公司,http://www.11467.com/xuzhou/co/79006.htm
徐州金益德商贸有限公司,http://www.11467.com/xuzhou/co/58780.htm
华奈家纺实业有限公司,http://www.11467.com/xuzhou/co/52680.htm
徐州天润纸业有限公司,http://www.11467.com/xuzhou/co/52270.htm
爱帮网购有限公司,http://www.11467.com/xuzhou/co/52182.htm
徐州纳馨家居旗舰店公司,http://www.11467.com/xuzhou/co/58873.htm
盐城羽佳塑业销售公司,http://www.11467.com/yancheng/co/54698.htm
阳东县广大五金塑料制品有限公司,http://www.11467.com/yangjiang/co/6914.htm
广东美信坊经贸有限公司,http://www.11467.com/yangjiang/co/15534.htm
扬州和沣科技有限公司,http://www.11467.com/yangzhou/co/77654.htm
宜春昊昱贸易有限公司,http://www.11467.com/yichun/co/20139.htm
广西玉林市广龙藤业有限公司,http://www.11467.com/yulin/co/17575.htm
深圳鸿宝科技有限公司,http://www.11467.com/yunfu/co/19998.htm
文斌豆制品公司,http://www.11467.com/zaozhuang/co/25988.htm
枣庄恺莲家居布艺有限公司,http://www.11467.com/zaozhuang/co/27962.htm
龙海市国展工艺品有限公司,http://www.11467.com/zhangzhou/co/46738.htm
东东布艺有限公司,http://www.11467.com/zhengzhou/co/105715.htm
深圳富泽商贸有限公司郑州办事处,http://www.11467.com/zhengzhou/co/127795.htm
舜佳包装公司,http://www.11467.com/zhengzhou/co/101562.htm
河南郑州振华乳业物资供应有限公司,http://www.11467.com/zhengzhou/co/127941.htm
郑州清妙科技有限公司,http://www.11467.com/zhengzhou/co/168799.htm
郑州永旺酒店用品有限公司,http://www.11467.com/zhengzhou/co/101211.htm
河南东方旭龙科贸有限公司,http://www.11467.com/zhengzhou/co/122299.htm
郑州新佳贸易有限公司,http://www.11467.com/zhengzhou/co/101667.htm
郑州古香蔓家饰有限公司,http://www.11467.com/zhengzhou/co/102750.htm
郑州洁雅纸品有限公司,http://www.11467.com/zhengzhou/co/172617.htm
郑州绿星编织有限公司,http://www.11467.com/zhengzhou/co/121146.htm
郑州爱秀壹佰商贸有限公司,http://www.11467.com/zhengzhou/co/102301.htm
郑州领潮文化传媒有限公司,http://www.11467.com/zhengzhou/co/172591.htm
广通贸易公司经营部,http://www.11467.com/zhongshan/co/54756.htm
太力家庭制品有限公司,http://www.11467.com/zhongshan/co/51993.htm
中山常胜金属制品有限公司销售部,http://www.11467.com/zhongshan/co/51741.htm
中山市家居乐家庭用品有限公司,http://www.11467.com/zhongshan/co/50015.htm
中山市毅霖礼品制造有限公司,http://www.11467.com/zhongshan/co/61498.htm
伊藤艺藤草家居用品有限公司,http://www.11467.com/zhongshan/co/104735.htm
施恩普企业有限公司中山办事处,http://www.11467.com/zhongshan/co/52021.htm
中山市泰恒金属制品有限公司,http://www.11467.com/zhongshan/co/43367.htm
中山市洁美礼品制造有限公司,http://www.11467.com/zhongshan/co/60068.htm
中山新思路五金贸易制品有限公司,http://www.11467.com/zhongshan/co/51529.htm
生如夏花家居用品有限公司,http://www.11467.com/zhuhai/co/68242.htm
广州市师奶梦手工场家居有限公司,http://www.11467.com/zhuhai/co/68392.htm
國踩廠运动用品有限公司,http://www.11467.com/zhuhai/co/67581.htm
珠海拾伍圆日用品有限公司,http://www.11467.com/zhuhai/co/67851.htm
珠海华纶无纺布有限公司,http://www.11467.com/zhuhai/co/69743.htm
珠海经济特区科赛进出口有限公司外贸部,http://www.11467.com/zhuhai/co/67870.htm
株洲鸿程家居布艺有限公司,http://www.11467.com/zhuzhou/co/32110.htm
淄博东祥实业有限公司,http://www.11467.com/zibo/co/39628.htm
北京哥顿赛博工贸有限公司,http://www.11467.com/beijing/co/618914.htm
北京宏利众邦机械技术有限公司,http://www.11467.com/beijing/co/389573.htm
北京创意工艺品有限公司,http://www.11467.com/beijing/co/25039.htm
北京瑞佳利合商贸有限公司,http://www.11467.com/beijing/co/213752.htm
北京佳融立泰商贸有限公司,http://www.11467.com/beijing/co/381231.htm
简单生活家居有限公司,http://www.11467.com/beijing/co/88605.htm
一凡一次性用品(北京)有限公司,http://www.11467.com/beijing/co/710920.htm
台州麦宝隆塑胶生活用品有限公司北京办事处,http://www.11467.com/beijing/co/120152.htm
力宇鸿达（北京）科技有限公司,http://www.11467.com/beijing/co/304768.htm
上海百露生活实业有限公司,http://www.11467.com/shanghai/co/509164.htm
家远实业有限公司,http://www.11467.com/shanghai/co/1041381.htm
上海百露实业有限公司业务部,http://www.11467.com/shanghai/co/508466.htm
上海孚奈贸易有限公司,http://www.11467.com/shanghai/co/734330.htm
美居购网络科技有限公司,http://www.11467.com/shanghai/co/1041380.htm
上海博韵实业发展有限公司,http://www.11467.com/shanghai/co/424463.htm
上海博韵实业有限公司,http://www.11467.com/shanghai/co/427452.htm
上海迈芝安商贸有限公司,http://www.11467.com/shanghai/co/1053281.htm
霸港贸易有些公司,http://www.11467.com/shanghai/co/892773.htm
上海高平管业有限公司营业部,http://www.11467.com/shanghai/co/166943.htm
上海蕾斯酒店用品有限公司,http://www.11467.com/shanghai/co/1037333.htm
上海海边人家家居装饰有限公司,http://www.11467.com/shanghai/co/211927.htm
上海九瑜贸易有限责任公司,http://www.11467.com/shanghai/co/510316.htm
上海田园藤业工艺品有限公司,http://www.11467.com/shanghai/co/909449.htm
上海巧室美经贸有限公司(业务部),http://www.11467.com/shanghai/co/880251.htm
上海安巢家居生活用品有限公司,http://www.11467.com/shanghai/co/503109.htm
上海世博贸易有限公司,http://www.11467.com/shanghai/co/734506.htm
宜人堂创意家居（上海）有限公司,http://www.11467.com/shanghai/co/976525.htm
上海君之科技工程有限公司,http://www.11467.com/shanghai/co/35621.htm
上海友程实业有限公司,http://www.11467.com/shanghai/co/510154.htm
上海瑞翔日用制品有限公司,http://www.11467.com/shanghai/co/16925.htm
天工贸易公司,http://www.11467.com/tianjin/co/25977.htm
天津京丰盛室内用品有限公司业务部,http://www.11467.com/tianjin/co/118106.htm
天津斌利工贸有限公司,http://www.11467.com/tianjin/co/179932.htm
天津艺添众里科技有限公司,http://www.11467.com/tianjin/co/15597.htm
天津市宜品商贸有限公司,http://www.11467.com/tianjin/co/87259.htm
天津市永富春塑料制品有限公司,http://www.11467.com/tianjin/co/197440.htm
重庆市海大卫生用品有限公司,http://www.11467.com/chongqing/co/207246.htm
重庆厚时商贸有限公司,http://www.11467.com/chongqing/co/206129.htm
浙江文武软包装彩印有限公司,http://www.11467.com/taizhou/co/146906.htm
纽蓝信息咨询（上海）有限公司,http://www.11467.com/shanghai/co/1090256.htm
雄县旭日包装有限公司,http://www.11467.com/tianjin/co/302605.htm
东莞市丰而意包装材料有限公司,http://www.11467.com/dongguan/co/571256.htm
天津市鑫新网电子科技有限责任公司,http://www.11467.com/tianjin/co/302606.htm
深圳市渡甫皮具有限公司,http://www.11467.com/shenzhen/co/853968.htm
天津红宝塔木业有限公司,http://www.11467.com/tianjin/co/302608.htm
天津市高义广告有限公司,http://www.11467.com/tianjin/co/308695.htm
佛山市顺德区洲昊家具有限公司,http://www.11467.com/foshan/co/393685.htm
天津铭印广告有限公司,http://www.11467.com/tianjin/co/309175.htm
义乌百思特百货商贸有限公司,http://www.11467.com/jinhua/co/138836.htm
深圳麦乐居实业有限公司,http://www.11467.com/shenzhen/co/820623.htm
广州森荣洗漱包制造有限公司,http://www.11467.com/guangzhou/co/683162.htm
支点科技（中山）有限公司,http://www.11467.com/zhongshan/co/217208.htm
壹美壹家贸易有限公司,http://www.11467.com/ningbo/co/148298.htm
鑫雕工贸有限公司,http://www.11467.com/baoding/co/80242.htm
保定市百利卫生用品有限公司,http://www.11467.com/baoding/co/81419.htm
雄县纳川箱包制造有限公司,http://www.11467.com/baoding/co/85259.htm
陕西千饰万品有限公司,http://www.11467.com/baoji/co/31015.htm
沧州如意家居有限公司,http://www.11467.com/cangzhou/co/59487.htm
祥宇抽纱实业有限公司,http://www.11467.com/cangzhou/co/59490.htm
吉林市鸿程伟业有限公司,http://www.11467.com/changchun/co/70270.htm
长沙汕深包装材料公司,http://www.11467.com/changsha/co/119627.htm
山东鄄城柳轩家居用品有限公司,http://www.11467.com/changsha/co/75100.htm
广东潮州杰艺有机玻璃制品有限公司,http://www.11467.com/chaozhou/co/35611.htm
成都格律诗有限责任公司,http://www.11467.com/chengdu/co/87377.htm
成都市姐弟家编工艺品有限公司,http://www.11467.com/chengdu/co/213678.htm
成都蓝扬景畅贸易有限公司,http://www.11467.com/chengdu/co/87322.htm
成都市威斯特邦贸易有限公司,http://www.11467.com/chengdu/co/86706.htm
成都斯伟箱柜有限公司,http://www.11467.com/chengdu/co/181039.htm
大连汉和工贸有限公司,http://www.11467.com/dalian/co/38925.htm
大连爱玛商贸有限公司,http://www.11467.com/dalian/co/41496.htm
大连锋和商贸有限公司,http://www.11467.com/dalian/co/39635.htm
大连斯瑞文贸易有限公司;,http://www.11467.com/dalian/co/37182.htm
(东莞)巨千家具有限公司,http://www.11467.com/dongguan/co/148630.htm
东莞瑞鸿家用品有限公司,http://www.11467.com/dongguan/co/494343.htm
东莞 名慧清洁用品有限公司,http://www.11467.com/dongguan/co/162182.htm
东莞金利怡卫浴有限公司,http://www.11467.com/dongguan/co/162631.htm
东莞市禾昌手袋皮具有限公司,http://www.11467.com/dongguan/co/530594.htm
东莞市旗峰对外贸易有限公司,http://www.11467.com/dongguan/co/90440.htm
东莞市铭德金属制品有限公司,http://www.11467.com/dongguan/co/8827.htm
东莞市斯玛特家居用品有限公司,http://www.11467.com/dongguan/co/550261.htm
广州轩盈塑胶制品有限公司,http://www.11467.com/guangzhou/co/753498.htm
东莞市欧尚工艺品有限公司,http://www.11467.com/dongguan/co/498087.htm
东莞市森域五金制罐有限公司,http://www.11467.com/dongguan/co/199659.htm
东莞市鑫沛塑胶五金电子有限公司,http://www.11467.com/dongguan/co/463419.htm
东莞市荣尊塑胶制品有限公司（业务部）,http://www.11467.com/dongguan/co/352417.htm
东莞市容正制罐有限公司,http://www.11467.com/dongguan/co/514848.htm
东莞市皇泰日用品有限公司,http://www.11467.com/dongguan/co/547482.htm
东莞市维群包装制品有限公司（业务部）,http://www.11467.com/dongguan/co/320177.htm
