义乌网奇电子商务有限公司,http://www.11467.com/jinhua/co/145303.htm
无锡市绿佳绿人造草坪有限公司,http://www.11467.com/wuxi/co/215669.htm
广州市信怡晟贸易有限公司,http://www.11467.com/guangzhou/co/495488.htm
菏泽博飞木业有限公司,http://www.11467.com/heze/co/23625.htm
徐州市红全球汽车用品贸易有限公司,http://www.11467.com/xuzhou/co/63860.htm
临沭县玉树工艺品有限公司,http://www.11467.com/yushu/co/775.htm
中山市锵辉金属制品有限公司,http://www.11467.com/zhongshan/co/83538.htm
上海尚易家庭用品有限公司,http://www.11467.com/shanghai/co/34947.htm
盐城市天鑫塑业有限公司,http://www.11467.com/yancheng/co/57587.htm
广西玉林家意日用工艺品有限公司,http://www.11467.com/yulin/co/17550.htm
福州鑫容川家庭日用品有限公司,http://www.11467.com/fuzhou/co/149489.htm
江门市蓬江区嘉宝盛塑料五金厂有限公司,http://www.11467.com/jiangmen/co/83181.htm
江门市新会区广鸿五金塑料制品有限公司,http://www.11467.com/jiangmen/co/88635.htm
嘉兴市恒诺金属制品有限公司,http://www.11467.com/jiaxing/co/80545.htm
广州市枫采贸易有限公司,http://www.11467.com/guangzhou/co/66782.htm
南京多莱欣家居用品有限公司,http://www.11467.com/nanjing/co/153062.htm
临沭县喜悦家纺工艺品有限公司,http://www.11467.com/linyi/co/107041.htm
深圳市康佳旭袋业有限公司,http://www.11467.com/shenzhen/co/723017.htm
深圳市诺亚思玩具有限公司,http://www.11467.com/shenzhen/co/253988.htm
广州市水禾田箱包皮具有限公司,http://www.11467.com/guangzhou/co/263180.htm
广州市旗王皮具有限公司,http://www.11467.com/guangzhou/co/495519.htm
佛山市顺德区誉展恒塑料制品有限公司,http://www.11467.com/foshan/co/224047.htm
揭阳市新颖五金塑胶有限公司,http://www.11467.com/jieyang/co/21590.htm
昌邑市富彬家居有限公司,http://www.11467.com/jilinshi/co/82423.htm
义乌索佳家居用品有限公司,http://www.11467.com/jinhua/co/127920.htm
杭州金朝会展服务有限公司,http://www.11467.com/hangzhou/co/368559.htm
青岛百艺丰工艺品有限公司,http://www.11467.com/qingdao/co/151899.htm
汕头市今唯网络科技有限公司,http://www.11467.com/shantou/co/151688.htm
汕头市纳川塑胶制品有限公司,http://www.11467.com/shantou/co/41045.htm
北京利快贸易有限公司,http://www.11467.com/shaoxing/co/75659.htm
深圳市常丰塑胶包装制品有限公司,http://www.11467.com/shenzhen/co/578474.htm
深圳市恒兴昌模具科技有限公司,http://www.11467.com/shenzhen/co/495108.htm
厦门弘艺堂竹木制品有限公司,http://www.11467.com/xiamen/co/4268.htm
广州嘉联皮具制品有限公司,http://www.11467.com/guangzhou/co/428678.htm
遂昌维康竹炭开发有限公司,http://www.11467.com/lishui/co/23878.htm
衢州普润日用品有限公司,http://www.11467.com/quzhou/co/20513.htm
深圳市海昊箱包袋业发展有限公司,http://www.11467.com/shenzhen/co/148219.htm
宁波壹美壹家贸易有限公司,http://www.11467.com/ningbo/co/144310.htm
厦门市鑫日盛五金有限公司,http://www.11467.com/xiamen/co/2061.htm
泉州市如家家居用品有限公司,http://www.11467.com/quanzhou/co/94418.htm
珠海杰友服饰有限公司,http://www.11467.com/zhuhai/co/72841.htm
东莞市倍特包装材料有限公司,http://www.11467.com/dongguan/co/540261.htm
珠海宜恒家居用品有限公司,http://www.11467.com/zhuhai/co/99237.htm
珠海智光塑料制品有限公司,http://www.11467.com/zhuhai/co/72262.htm
中山市常胜金属制品有限公司,http://www.11467.com/zhongshan/co/49876.htm
昆山福纳森木业有限公司,http://www.11467.com/suzhou/co/317185.htm
厦门骏扬工贸有限公司,http://www.11467.com/xiamen/co/10330.htm
济南微意创意格子批发有限公司,http://www.11467.com/jinan/co/133487.htm
东莞市特顺手袋皮具有限公司,http://www.11467.com/dongguan/co/411852.htm
东莞市旺仕实业有限公司,http://www.11467.com/dongguan/co/556072.htm
东莞市展宏实业有限公司,http://www.11467.com/dongguan/co/470919.htm
深圳市金典文化用品有限公司,http://www.11467.com/shenzhen/co/66163.htm
东莞市文浩包装制品有限公司,http://www.11467.com/dongguan/co/529866.htm
东莞市宝悦实业有限公司,http://www.11467.com/dongguan/co/504099.htm
佛山市南海区弘渡五金装饰品有限公司,http://www.11467.com/foshan/co/247448.htm
深圳市铭宇工艺品有限公司,http://www.11467.com/shenzhen/co/769785.htm
汕头市好集祥塑胶制品有限公司,http://www.11467.com/shantou/co/117844.htm
福州聚缘工艺品有限公司,http://www.11467.com/qiye/240492.htm
广州宇玲皮具有限公司,http://www.11467.com/qiye/241419.htm
苍南县悦美工艺礼品有限公司,http://www.11467.com/baoding/co/91235.htm
太仓市明和商贸有限公司,http://www.11467.com/suzhou/co/356564.htm
中山伟圣照明有限公司,http://www.11467.com/zhongshan/co/65058.htm
东光县利泽工艺品有限公司,http://www.11467.com/cangzhou/co/49098.htm
黄骅市新林坡塑料有限公司,http://www.11467.com/cangzhou/co/26471.htm
江苏丽都箱包有限公司,http://www.11467.com/changzhou/co/129193.htm
常州市强大包装印务有限公司,http://www.11467.com/changzhou/co/115324.htm
东莞市龙德塑胶制品有限公司,http://www.11467.com/dongguan/co/463277.htm
临海市双盛工艺礼品有限公司,http://www.11467.com/dongguan/co/144652.htm
东莞市乐翔工艺制品有限公司,http://www.11467.com/dongguan/co/489953.htm
揭阳市美庭塑胶有限公司,http://www.11467.com/jieyang/co/22975.htm
杭州灿都工艺品有限公司,http://www.11467.com/hangzhou/co/222477.htm
贵州慧鸿佳世贸易有限公司,http://www.11467.com/guiyang/co/72821.htm
福州市仓山区塑冠通用设备有限公司,http://www.11467.com/fuzhou/co/141229.htm
福州鑫四海箱包有限公司,http://www.11467.com/fuzhou/co/140259.htm
杭州卓灿贸易有限公司,http://www.11467.com/hangzhou/co/390946.htm
广州超亮贸易有限公司,http://www.11467.com/guangzhou/co/431412.htm
广州市为鸿皮具有限公司,http://www.11467.com/guangzhou/co/455364.htm
广州市麒麟祥皮具制品有限公司,http://www.11467.com/guangzhou/co/429570.htm
杭州维意洁具有限公司,http://www.11467.com/hangzhou/co/391361.htm
广州市照鹏塑胶制品有限公司,http://www.11467.com/guangzhou/co/494824.htm
浙江丹龙休闲用品有限公司,http://www.11467.com/hangzhou/co/391072.htm
曹县宇光工艺品有限公司,http://www.11467.com/heze/co/26009.htm
广州市亚琪皮具有限公司,http://www.11467.com/guangzhou/co/211087.htm
佛山市顺德区广佛顺五金制品有限公司,http://www.11467.com/foshan/co/230257.htm
广州辰丰皮具有限公司,http://www.11467.com/guangzhou/co/479599.htm
福建世贸投资有限公司,http://www.11467.com/fuzhou/co/64240.htm
广州市创尚日用品有限公司,http://www.11467.com/guangzhou/co/470007.htm
广州市天顺之箱包有限公司,http://www.11467.com/guangzhou/co/494994.htm
深圳市汉川实业发展有限公司,http://www.11467.com/shenzhen/co/63741.htm
天紫娃娃贸易公司,http://www.11467.com/suqian/co/10123.htm
深圳市斯八达克科技发展有限公司,http://www.11467.com/shenzhen/co/809356.htm
深圳市华峰工艺品有限公司,http://www.11467.com/shenzhen/co/148199.htm
亮丽包装（香港）有限公司,http://www.11467.com/shenzhen/co/148200.htm
上海思牧家居用品有限公司,http://www.11467.com/nantong/co/104111.htm
河北百草园无纺布制品有限公司,http://www.11467.com/shijiazhuang/co/84023.htm
韩尚实木家居有限公司,http://www.11467.com/suqian/co/10017.htm
秦皇岛正文贸易有限公司,http://www.11467.com/qinhuangdao/co/33549.htm
深圳市格萨塑胶制品有限公司,http://www.11467.com/shenzhen/co/673746.htm
深圳市贝琳娜家居用品有限公司,http://www.11467.com/shenzhen/co/764586.htm
泉州市丰泽区麦西商贸有限公司,http://www.11467.com/quanzhou/co/147084.htm
缙云县嘉宇家居用品有限公司,http://www.11467.com/lincang/co/6900.htm
深圳市华宇鑫皮具制品有限公司,http://www.11467.com/shenzhen/co/810586.htm
深圳市太阳雨展示制品有限公司,http://www.11467.com/shenzhen/co/253398.htm
余姚市博雅包装制品有限公司,http://www.11467.com/ningbo/co/193334.htm
深圳市百业制袋有限公司,http://www.11467.com/shenzhen/co/810337.htm
深圳宏兆箱包有限公司,http://www.11467.com/shenzhen/co/811362.htm
宁海县鸿杰日用品有限公司,http://www.11467.com/ningbo/co/72995.htm
福建省政和县绿竹园竹木制品有限公司,http://www.11467.com/nanping/co/37473.htm
晋江市冠琦家居用品有限公司,http://www.11467.com/quanzhou/co/146988.htm
郯城新记工艺有限公司,http://www.11467.com/linyi/co/10543.htm
深圳市万兴和包装器材有限公司,http://www.11467.com/shenzhen/co/103622.htm
深圳市裕创威手袋有限公司,http://www.11467.com/shenzhen/co/727877.htm
深圳市金兴顺五金制品有限公司,http://www.11467.com/shenzhen/co/411258.htm
深圳市粤新皮具有限公司,http://www.11467.com/shenzhen/co/774632.htm
深圳市雅皮仕皮艺家居用品有限公司,http://www.11467.com/shenzhen/co/798513.htm
深圳誉美信皮具包装制品有限公司,http://www.11467.com/shenzhen/co/769788.htm
武义金尚工艺品有限公司,http://www.11467.com/jinzhou/co/49576.htm
浙江武义永顺箱柜有限公司,http://www.11467.com/jinzhou/co/49994.htm
连云港天盛草编制品有限公司,http://www.11467.com/lianyungang/co/40921.htm
曹县宇光工艺品有限公司,http://www.11467.com/qingdao/co/124271.htm
深圳市德晟日用品有限公司,http://www.11467.com/shenzhen/co/728739.htm
深圳市金博龙实业有限公司,http://www.11467.com/shenzhen/co/811384.htm
深圳市力洁科技有限公司,http://www.11467.com/shenzhen/co/367371.htm
厦门半木商贸有限公司,http://www.11467.com/quanzhou/co/131450.htm
深圳佳利得服饰制造有限公司,http://www.11467.com/shenzhen/co/602550.htm
汕头市双子星塑胶实业有限公司,http://www.11467.com/shantou/co/117892.htm
广州城品家居用品有限公司,http://www.11467.com/guangzhou/co/161149.htm
苏州市天创金属制品有限公司,http://www.11467.com/suzhou/co/9586.htm
北京兴隆悦达科技有限公司,http://www.11467.com/beijing/co/309635.htm
湛江市赤坎联恒贸易有限公司,http://www.11467.com/zhanjiang/co/41386.htm
上海雪梦礼品有限公司,http://www.11467.com/xuzhou/co/52176.htm
中山市美力金属电子有限公司,http://www.11467.com/zhongshan/co/76888.htm
中山市幸鑫五金电子有限公司,http://www.11467.com/zhongshan/co/80848.htm
苏州浩鑫包装材料有限公司,http://www.11467.com/suzhou/co/368395.htm
义乌市翰磊日用品有限公司,http://www.11467.com/jinhua/co/184696.htm
厦门嵘源日用品有限公司,http://www.11467.com/xiamen/co/30196.htm
东莞市鹏威塑胶制品有限公司,http://www.11467.com/dongguan/co/209424.htm
闽侯圣博家饰有限公司,http://www.11467.com/fuzhou/co/196027.htm
东莞市恒大家居用品有限公司,http://www.11467.com/dongguan/co/612582.htm
艺升创意家居有限公司,http://www.11467.com/guangzhou/co/660571.htm
上海米酷礼品有限公司,http://www.11467.com/shanghai/co/1046002.htm
太仓圣亚包装有限公司,http://www.11467.com/suzhou/co/314658.htm
厦门神冠软件科技有限公司,http://www.11467.com/xiamen/co/103432.htm
邢台欧硕商贸有限公司,http://www.11467.com/xintai/co/39144.htm
温州市仁爱工艺礼品制造有限公司,http://www.11467.com/wenzhou/co/169886.htm
阳东县一州不锈钢制品有限公司,http://www.11467.com/yangjiang/co/11719.htm
广州市正达包装印刷有限公司,http://www.11467.com/guangzhou/co/210296.htm
东莞市拿铁城礼品有限公司,http://www.11467.com/dongguan/co/522516.htm
中山市琚宝五金制品有限公司,http://www.11467.com/zhongshan/co/32535.htm
中山市泰盛塑胶制品有限公司,http://www.11467.com/zhongshan/co/31417.htm
苏州扬名塑料制品有限公司,http://www.11467.com/suzhou/co/362374.htm
深圳市美而好商贸有限公司,http://www.11467.com/shenzhen/co/878928.htm
深圳市阿华士科技有限公司,http://www.11467.com/shenzhen/co/1128311.htm
东莞市宝丞手袋皮具制品有限公司,http://www.11467.com/dongguan/co/514992.htm
佛山市恩牌建材有限公司,http://www.11467.com/foshan/co/356187.htm
广州格理无纺布制品有限公司,http://www.11467.com/guangzhou/co/210891.htm
佛山市梵帝罗贸易有限公司,http://www.11467.com/guangzhou/co/496361.htm
杭州天行物资有限公司,http://www.11467.com/hangzhou/co/157816.htm
新大生（杭州）工艺品有限公司,http://www.11467.com/hangzhou/co/99686.htm
菏泽良桐家具有限公司,http://www.11467.com/heze/co/295.htm
江门市新会区汇富工艺制品有限公司,http://www.11467.com/jiangmen/co/84476.htm
浙江纳斯特日用品有限公司,http://www.11467.com/jiaxing/co/84459.htm
中山市能隆旗贸易有限公司,http://www.11467.com/zhongshan/co/80858.htm
嘉兴市禾福工艺品有限公司,http://www.11467.com/jiaxing/co/81019.htm
上海明蕾服饰有限公司,http://www.11467.com/shanghai/co/763792.htm
曹县华晨木业有限公司,http://www.11467.com/heze/co/42958.htm
曹县黑森木业有限公司,http://www.11467.com/heze/co/6870.htm
曹县中艺木业有限责任公司,http://www.11467.com/heze/co/34683.htm
嘉兴飞雪格尔进出口有限公司,http://www.11467.com/jiaxing/co/84040.htm
浙江家爱伊工贸有限公司,http://www.11467.com/lishui/co/35257.htm
衢州瑞库贸易有限公司,http://www.11467.com/quzhou/co/32656.htm
衢州市芝康家居用品有限公司,http://www.11467.com/quzhou/co/35538.htm
厦门富曼工贸有限公司,http://www.11467.com/xiamen/co/96819.htm
厦门易安居家居用品有限公司,http://www.11467.com/xiamen/co/61129.htm
深圳市达兴手袋有限公司,http://www.11467.com/shenzhen/co/810336.htm
上海劲品贸易有限公司,http://www.11467.com/shanghai/co/1043884.htm
中山市太力家庭用品制造有限公司,http://www.11467.com/zhongshan/co/52659.htm
西安木西电子科技有限公司,http://www.11467.com/xian/co/95523.htm
徐州永祺商贸有限公司,http://www.11467.com/xuzhou/co/63757.htm
烟台天福包装有限公司,http://www.11467.com/yantai/co/133623.htm
广西博白工艺品供应有限公司,http://www.11467.com/yulin/co/17549.htm
衢州佳时特日用品有限公司,http://www.11467.com/quzhou/co/25080.htm
上饶市鸿达工艺品有限公司,http://www.11467.com/shangrao/co/23452.htm
婺源县旺德福实业有限公司,http://www.11467.com/shangrao/co/23474.htm
衢州侨丰家居有限公司,http://www.11467.com/quzhou/co/25130.htm
广西南宁百有汇贸易有限公司,http://www.11467.com/nanning/co/79153.htm
保定白沟万波龙家居用品有限公司,http://www.11467.com/baoding/co/63719.htm
大连艺锦商贸有限公司,http://www.11467.com/dalian/co/66123.htm
福建省旅游贸易公司,http://www.11467.com/fuzhou/co/90661.htm
广州市丰铭家庭用品有限公司,http://www.11467.com/guangzhou/co/58622.htm
科斯特（厦门）节水设备有限公司,http://www.11467.com/chengdu/co/87733.htm
东莞市巨千家具有限公司,http://www.11467.com/dongguan/co/496152.htm
佛山市顺德区双诚至力家具有限公司,http://www.11467.com/foshan/co/192583.htm
金麟实业有限公司,http://www.11467.com/foshan/co/343314.htm
福州安之新生活用品有限公司,http://www.11467.com/fuzhou/co/68566.htm
福建天汇无纺布有限公司,http://www.11467.com/fuzhou/co/181498.htm
福州厚丰工艺有限公司,http://www.11467.com/fuzhou/co/140286.htm
福州心飞翔贸易有限公司,http://www.11467.com/fuzhou/co/161426.htm
福州星月家居装饰用品有限公司,http://www.11467.com/fuzhou/co/164945.htm
广州市浚烽贸易有限公司,http://www.11467.com/guangzhou/co/141931.htm
杭州追远贸易有限公司,http://www.11467.com/hangzhou/co/369360.htm
杭州市轻工工艺纺织品进出口有限公司,http://www.11467.com/hangzhou/co/157448.htm
合肥金心日用品有限公司,http://www.11467.com/hefei/co/59916.htm
安徽钺登贸易有限公司,http://www.11467.com/hefei/co/135222.htm
曹县正达工艺品有限公司,http://www.11467.com/heze/co/6426.htm
煜伦家用品（惠州）有限公司,http://www.11467.com/huizhou/co/59692.htm
来宾市东糖集团桂宝有限公司,http://www.11467.com/laibin/co/4097.htm
颍上县天裕塑业有限责任公司,http://www.11467.com/linyi/co/72957.htm
临沂市罗庄区尚居优品工艺品有限公司,http://www.11467.com/linyi/co/86752.htm
浙江森田竹业有限公司,http://www.11467.com/lishui/co/35267.htm
南京和正家居用品有限公司,http://www.11467.com/nanjing/co/56924.htm
南宁市汇博塑料有限公司,http://www.11467.com/nanning/co/80455.htm
南平宇烨商贸有限公司,http://www.11467.com/nanping/co/37083.htm
汕头市恒信塑胶制品厂有限公司(销售部),http://www.11467.com/shantou/co/121817.htm
汕头市锦丰塑胶制品有限公司,http://www.11467.com/shantou/co/116322.htm
邵阳市华盛家用产品科技开发有限公司,http://www.11467.com/shaoyang/co/20186.htm
深圳市点方达科技有限公司,http://www.11467.com/shenzhen/co/774608.htm
深圳市国豪皮具制品有限公司,http://www.11467.com/shenzhen/co/763566.htm
深圳市百合隆工艺制品有限公司,http://www.11467.com/shenzhen/co/253972.htm
石家庄俱龙家具有限公司,http://www.11467.com/shijiazhuang/co/54778.htm
无锡市康之佳贸易有限公司,http://www.11467.com/wuxi/co/121228.htm
古德轩酒店设备制造有限公司,http://www.11467.com/xiamen/co/94679.htm
郑州喜来客商贸有限公司,http://www.11467.com/zhengzhou/co/172619.htm
安徽毅昌科技有限公司,http://www.11467.com/qiye/29672469.htm
吉林志成电子商务有限公司,http://www.11467.com/changchun/co/96498.htm
湖南贞达贸易有限公司,http://www.11467.com/changsha/co/74848.htm
常州市东科电子科技有限公司,http://www.11467.com/changzhou/co/18202.htm
东莞三发钢木家具有限公司,http://www.11467.com/dongguan/co/6595.htm
东莞市格林电子材料有限公司,http://www.11467.com/dongguan/co/494512.htm
东莞市继隆袋业有限公司,http://www.11467.com/dongguan/co/473037.htm
东莞市简明包装制品有限公司,http://www.11467.com/dongguan/co/412854.htm
东莞市远哲实业有限公司营业部,http://www.11467.com/dongguan/co/328389.htm
东莞永泰手袋制品有限公司,http://www.11467.com/dongguan/co/75226.htm
东莞市恒昊塑胶制品有限公司,http://www.11467.com/dongguan/co/493815.htm
阜南县大自然工艺品有限公司,http://www.11467.com/fuyang/co/31275.htm
丰宸千禧工艺品有限公司,http://www.11467.com/fuzhou/co/135887.htm
广州市合创日用品有限公司,http://www.11467.com/guangzhou/co/476569.htm
广州卡爱罗贸易有限公司,http://www.11467.com/guangzhou/co/147671.htm
广州傲禾商贸有限公司,http://www.11467.com/guangzhou/co/155780.htm
广州世纪鸿鑫皮具有限公司,http://www.11467.com/guangzhou/co/459246.htm
桂林市浩林木业有限公司,http://www.11467.com/guilin/co/44999.htm
杭州万峰实业有限公司,http://www.11467.com/hangzhou/co/260679.htm
建德市华盛塑纺有限公司,http://www.11467.com/hangzhou/co/311952.htm
浙江德艾可家居用品有限公司,http://www.11467.com/hangzhou/co/221945.htm
山东盛鼎工艺品有限公司,http://www.11467.com/heze/co/34341.htm
曹县睿帆工艺品有限公司,http://www.11467.com/heze/co/24606.htm
曹县天海工艺有限公司,http://www.11467.com/heze/co/34573.htm
山东丽天抽纱有限公司,http://www.11467.com/heze/co/34429.htm
江门市裕源印刷有限公司,http://www.11467.com/jiangmen/co/115869.htm
厦门茶江湖茶业有限公司,http://www.11467.com/xiamen/co/70131.htm
厦门市金晔工贸有限公司,http://www.11467.com/xiamen/co/59393.htm
中山市太力塑胶电子有限公司,http://www.11467.com/zhongshan/co/49840.htm
青岛昊馥经贸有限公司,http://www.11467.com/zibo/co/68474.htm
北京尚多时代皮具贸易有限公司(酒店用品),http://www.11467.com/beijing/co/698916.htm
揭阳市聚力共赢贸易有限公司,http://www.11467.com/jieyang/co/48196.htm
揭阳市东裕塑胶有限公司,http://www.11467.com/jieyang/co/29779.htm
揭阳宜馨贸易有限公司,http://www.11467.com/jieyang/co/31282.htm
东海新奇特有限公司,http://www.11467.com/jinhua/co/125057.htm
浙江金保科技有限公司,http://www.11467.com/jinhua/co/83890.htm
义乌市派士龙箱包有限公司,http://www.11467.com/jinhua/co/123111.htm
霸州市华宇货架有限公司,http://www.11467.com/langfang/co/46216.htm
益鑫工艺柳编有限公司,http://www.11467.com/linyi/co/96221.htm
宁波完美生活贸易有限公司,http://www.11467.com/ningbo/co/143857.htm
宁波顶太包装材料有限公司,http://www.11467.com/ningbo/co/193332.htm
宁海伟业工艺制品有限公司,http://www.11467.com/ningbo/co/73631.htm
宁波木森纸业有限公司,http://www.11467.com/ningbo/co/195555.htm
余姚市中信印业有限公司,http://www.11467.com/ningbo/co/193333.htm
宁波市海翔彩印有限公司,http://www.11467.com/ningbo/co/143582.htm
睢宁县美怡家家具有限公司,http://www.11467.com/qingyang/co/17322.htm
江西省宇翔日用品有限公司,http://www.11467.com/shangrao/co/25766.htm
汕头市恒信塑胶制品厂有限公司(销售一部）,http://www.11467.com/shantou/co/122599.htm
美瑞家居用品有限公司,http://www.11467.com/shenzhen/co/278649.htm
美新隆集团有限公司市场部,http://www.11467.com/shenzhen/co/516940.htm
深圳市奥大科技有限公司业务部,http://www.11467.com/shenzhen/co/618935.htm
深圳飞科有机玻璃有限公司,http://www.11467.com/shenzhen/co/782681.htm
深圳市仁利实业有限公司,http://www.11467.com/shenzhen/co/216721.htm
深圳市沐兰皮具制品有限公司,http://www.11467.com/shenzhen/co/796417.htm
深圳市丹尼奥箱包有限公司,http://www.11467.com/shenzhen/co/786472.htm
深圳万通有机玻璃制品有限公司,http://www.11467.com/shenzhen/co/764481.htm
深圳市迅驰飞扬电子有限公司,http://www.11467.com/shenzhen/co/764527.htm
盛业制品（深圳）有限公司,http://www.11467.com/shenzhen/co/285085.htm
深圳市星源家饰居家有限公司,http://www.11467.com/shenzhen/co/208855.htm
佳尔美(香港)国际集团有限公司,http://www.11467.com/shijiazhuang/co/139680.htm
石家庄名睿家居用品有限公司,http://www.11467.com/shijiazhuang/co/80722.htm
石家庄市鑫日贸易有限公司,http://www.11467.com/shijiazhuang/co/70921.htm
苏州恒禹箱包有限公司,http://www.11467.com/suzhou/co/213252.htm
苏州凯乔精工箱柜有限公司,http://www.11467.com/suzhou/co/309945.htm
盱眙舜天恒生箱包有限公司,http://www.11467.com/suzhou/co/224043.htm
苏州市欧陆包装材料有限公司,http://www.11467.com/suzhou/co/203346.htm
台州昱升印务有限公司,http://www.11467.com/taizhou/co/84930.htm
深圳兴大祥工贸发展有限公司,http://www.11467.com/shenzhen/co/278287.htm
义乌市俏货天下电子商务有限公司,http://www.11467.com/jinhua/co/126202.htm
桐城市华伟实业有限公司,http://www.11467.com/anqing/co/16451.htm
安徽安庆惠民团购服务有限公司,http://www.11467.com/anqing/co/25881.htm
桐城市茂源塑料有限公司,http://www.11467.com/anqing/co/13234.htm
保定鑫雕工贸有限公司,http://www.11467.com/baoding/co/63718.htm
保定爱健清洁纸品有限公司,http://www.11467.com/baoding/co/54874.htm
安新县振东塑胶制品有限公司,http://www.11467.com/baoding/co/76747.htm
雄县德法永纸塑包装有限公司,http://www.11467.com/baoding/co/79387.htm
伟鸿商贸公司,http://www.11467.com/baotou/co/25934.htm
北海金典旧货责任有限公司,http://www.11467.com/beihai/co/14143.htm
温州鹏翔包装有限公司,http://www.11467.com/wenzhou/co/219282.htm
温州茂源洁具有限公司,http://www.11467.com/wenzhou/co/216249.htm
武汉市康搏顺家居用品有限公司,http://www.11467.com/wuhan/co/59186.htm
无锡自然家居针纺织品有限公司,http://www.11467.com/wuxi/co/240872.htm
无锡市佳韵生活用品有限公司,http://www.11467.com/wuxi/co/121688.htm
厦门诚益兴商贸有限公司,http://www.11467.com/xiamen/co/65901.htm
厦门市兴超乐旅游用品有限公司,http://www.11467.com/xiamen/co/28917.htm
银川欧觊包装印刷有限公司,http://www.11467.com/yinchuan/co/44235.htm
广东太力家庭用品制造有限公司,http://www.11467.com/zhongshan/co/51994.htm
中山市太力家庭用品制造有限公司电子商务部,http://www.11467.com/zhongshan/co/51905.htm
中山市裕亿金属制品有限公司,http://www.11467.com/zhongshan/co/85308.htm
珠海佳特美家居用品有限公司,http://www.11467.com/zhuhai/co/82210.htm
珠海宜心家居有限公司,http://www.11467.com/zhuhai/co/82119.htm
北京智扬丽家商贸有限公司,http://www.11467.com/beijing/co/120539.htm
新象实业(上海)有限公司,http://www.11467.com/shanghai/co/1047848.htm
天津益尚国际贸易有限公司,http://www.11467.com/tianjin/co/90751.htm
泉州爱悦家居有限公司,http://www.11467.com/quanzhou/co/170246.htm
大连光矿能生活用品有限公司,http://www.11467.com/dalian/co/37185.htm
大连雅洁纸业有限公司,http://www.11467.com/dalian/co/41838.htm
