凌源市金山矿业有限公司,http://www.11467.com/chaoyang/co/19753.htm
北票宏光冶金矿业有限公司朝阳分公司,http://www.11467.com/chaoyang/co/2060.htm
朝阳兴沈冶金矿山物资有限公司,http://www.11467.com/chaoyang/co/6060.htm
中国黄金总公司二道沟金矿招待所,http://www.11467.com/chaoyang/co/11544.htm
承德市冶金矿山工业公司德益楼酒店,http://www.11467.com/chengde/co/4004.htm
河北省平泉县黄金矿业开发公司,http://www.11467.com/chengde/co/11113.htm
马尔康锂业技术发展有限责任公司,http://www.11467.com/aba/co/5515.htm
四川省九寨沟县紫金矿业有限公司,http://www.11467.com/aba/co/4051.htm
四川九寨沟马脑壳金矿开发有限责任公司,http://www.11467.com/aba/co/1092.htm
小金县金源矿业有限责任公司,http://www.11467.com/aba/co/5772.htm
汶川三江矿业开发有限责任公司,http://www.11467.com/aba/co/4705.htm
阿勒泰市金鑫铅锌矿业有限责任公司,http://www.11467.com/aletai/co/2857.htm
福海县大洋有限责任公司,http://www.11467.com/aletai/co/3815.htm
福海县矿业有限公司,http://www.11467.com/aletai/co/3889.htm
哈巴河华泰黄金有限责任公司,http://www.11467.com/aletai/co/5691.htm
哈巴河县恰奔矿业有限责任公司,http://www.11467.com/aletai/co/5759.htm
青河县惠源矿业有限责任公司,http://www.11467.com/aletai/co/4175.htm
招金矿业股份有限公司金翅岭金矿,http://www.11467.com/yantai/co/53907.htm
龙口市宏源黄金有限责任公司,http://www.11467.com/yantai/co/64879.htm
中矿金业股份有限公司,http://www.11467.com/yantai/co/72244.htm
远安县小汉口矿业有限公司,http://www.11467.com/yichang/co/25474.htm
伊犁察布查尔县乔拉克矿业有限公司,http://www.11467.com/yili/co/11746.htm
盖州市鑫龙矿业有限责任公司,http://www.11467.com/yingkou/co/25512.htm
万年矿业有限公司,http://www.11467.com/yingtan/co/4196.htm
湖南安化鑫丰矿业有限公司,http://www.11467.com/yiyang/co/12958.htm
衡阳远景钨业有限责任公司,http://www.11467.com/yiyang/co/10674.htm
湖南省岳阳万鑫黄金公司,http://www.11467.com/yueyang/co/22610.htm
临湘市振兴矿业有限责任公司,http://www.11467.com/yueyang/co/23716.htm
希克斯坝贸易有限公司(南非),http://www.11467.com/yuncheng/co/30888.htm
新平腰街思源矿产有限公司,http://www.11467.com/yuxi/co/11780.htm
尚义县银泉公路服务有限公司,http://www.11467.com/zhangjiakou/co/42276.htm
封开县金装河生黄金开采有限公司,http://www.11467.com/zhaoqing/co/11259.htm
郑州金银海足疗服务有限公司,http://www.11467.com/zhengzhou/co/186504.htm
中国黄金河南公司,http://www.11467.com/zhengzhou/co/54147.htm
宁夏中卫天银矿业有限公司,http://www.11467.com/zhongwei/co/1091.htm
淄博华奥稀土材料有限公司,http://www.11467.com/zibo/co/60305.htm
淄博银座商城有限责任公司柳泉路店,http://www.11467.com/zibo/co/103442.htm
淄博张金矿业有限公司,http://www.11467.com/zibo/co/14091.htm
淄博银座商城有限责任公司桃园分公司,http://www.11467.com/zibo/co/101824.htm
贵州金鑫铝矿有限公司,http://www.11467.com/zunyi/co/5668.htm
上海五金矿产发展有限公司,http://www.11467.com/shanghai/co/648064.htm
天津银信典当有限责任公司,http://www.11467.com/tianjin/co/210309.htm
天津宝银号典当有限责任公司,http://www.11467.com/tianjin/co/210645.htm
重庆大一钡业有限公司,http://www.11467.com/chongqing/co/20091.htm
重庆市大足锶矿开发有限公司,http://www.11467.com/chongqing/co/25777.htm
海南鸿海矿业开发有限公司,http://www.11467.com/wanning/co/54.htm
阿纳国际有限公司,http://www.11467.com/shenzhen/co/814044.htm
保定京素科技有限公司,http://www.11467.com/baoding/co/115557.htm
重庆其昶有色金属有限公司,http://www.11467.com/chongqing/co/317674.htm
安新县兆丰有色金属贸易有限公司,http://www.11467.com/baoding/co/144982.htm
中兴恒和(义县)黄金有限公司,http://www.11467.com/jinzhou/co/51945.htm
佛山钢瑞钢铁贸易有限公司,http://www.11467.com/qiye/28857927.htm
洛阳铭研特有色金属有限公司,http://www.11467.com/luoyang/co/94558.htm
平泉县黄金矿业开发公司鑫鑫金店,http://www.11467.com/chengde/co/11128.htm
承德市开发区小寺沟铜矿建筑安装公司,http://www.11467.com/chengde/co/4056.htm
兴隆县安子岭铅锌矿业有限公司,http://www.11467.com/chengde/co/8307.htm
河北峪耳崖金矿综合服务公司,http://www.11467.com/chengde/co/15321.htm
平泉县华云金矿有限责任公司,http://www.11467.com/chengde/co/11099.htm
河北省兴隆县燕山矿业开发有限公司,http://www.11467.com/chengde/co/19738.htm
承德市鹰手营子矿区振兴矿产品有限责任公司,http://www.11467.com/chengde/co/20447.htm
承德鑫鑫矿业有限公司,http://www.11467.com/chengde/co/18656.htm
承德县众权矿业有限公司,http://www.11467.com/chengde/co/18625.htm
承德宽城唐杖子矿业有限责任公司,http://www.11467.com/chengde/co/20829.htm
河北省平泉县鑫洛矿业有限公司,http://www.11467.com/chengde/co/19706.htm
兴隆县垒鑫矿业有限公司,http://www.11467.com/chengde/co/19949.htm
寿王坟铜矿实业开发总公司,http://www.11467.com/chengde/co/5609.htm
北京风险工程贸易总公司丰宁城根营金矿,http://www.11467.com/chengde/co/14553.htm
承德同顺矿产品有限责任公司,http://www.11467.com/chengde/co/18253.htm
承德县银峰矿业有限公司,http://www.11467.com/chengde/co/18606.htm
承德县鑫兴冶金矿业有限公司,http://www.11467.com/chengde/co/6921.htm
滦平县建成冶金矿业有限公司西地物资经销部,http://www.11467.com/chengde/co/12194.htm
中金黄金股份有限公司河北峪耳崖金矿,http://www.11467.com/chengde/co/15304.htm
滦平县建成冶金矿业有限公司,http://www.11467.com/chengde/co/12178.htm
承德县德鑫矿业有限公司,http://www.11467.com/chengde/co/18330.htm
隆化县五金矿产有限责任公司,http://www.11467.com/chengde/co/13339.htm
寿王坟铜矿建筑工程公司,http://www.11467.com/chengde/co/5605.htm
寿王坟铜矿供销公司,http://www.11467.com/chengde/co/5616.htm
福满家集团有限公司承德市双桥区银都海棠园二期便利三十五店,http://www.11467.com/chengde/co/29212.htm
成都深景有色金属有限公司,http://www.11467.com/chengdu/co/217700.htm
成都银唐会务服务有限公司,http://www.11467.com/chengdu/co/238274.htm
四川省互惠商业有限责任公司新津银杏店,http://www.11467.com/chengdu/co/230827.htm
四川省汉源蜀源矿业开发有限责任公司青羊分公司,http://www.11467.com/chengdu/co/75314.htm
成都益家佳超市有限公司银河北街店,http://www.11467.com/chengdu/co/227683.htm
四川世纪银邦非融资性担保有限公司,http://www.11467.com/chengdu/co/220895.htm
白河县汇丰矿业有限责任公司,http://www.11467.com/ankang/co/10985.htm
旬阳县银联矿业有限公司,http://www.11467.com/ankang/co/11887.htm
旬阳县五联构元矿业有限责任公司,http://www.11467.com/ankang/co/11849.htm
陕西省旬阳永富矿业有限公司,http://www.11467.com/ankang/co/10829.htm
宿松县界岭金矿有限责任公司,http://www.11467.com/anqing/co/10534.htm
潜山县福建闽发矿业有限公司,http://www.11467.com/anqing/co/22668.htm
安庆银翔钢结构有限公司,http://www.11467.com/anqing/co/37404.htm
太湖县鑫河矿业有限责任公司天桥分公司,http://www.11467.com/anqing/co/23439.htm
太湖县鑫河矿业有限责任公司,http://www.11467.com/anqing/co/23438.htm
海城市牌楼镁矿公司,http://www.11467.com/anshan/co/31220.htm
海城市荣利镁矿有限公司,http://www.11467.com/anshan/co/31164.htm
海城市军海镁矿有限公司,http://www.11467.com/anshan/co/31166.htm
海城第一高纯镁有限公司,http://www.11467.com/anshan/co/44193.htm
鞍山市长富物资有限公司,http://www.11467.com/anshan/co/68239.htm
海城市后印镁矿公司,http://www.11467.com/anshan/co/31242.htm
加拿大比弗布鲁克锑矿公司成都代表处,http://www.11467.com/chengdu/co/5227.htm
四川海洲有色金属有限公司,http://www.11467.com/chengdu/co/223290.htm
银川银重（集团）起重机有限公司四川分公司,http://www.11467.com/chengdu/co/236417.htm
四川凌冶矿业有限公司,http://www.11467.com/chengdu/co/38301.htm
郴州市银锑有色金属有限公司,http://www.11467.com/chenzhou/co/23848.htm
郴州市派安矿业有限责任公司,http://www.11467.com/chenzhou/co/17443.htm
桂阳恒晟矿业有限公司,http://www.11467.com/chenzhou/co/11680.htm
盈达综合选矿有限责任公司,http://www.11467.com/chenzhou/co/13150.htm
永兴县银鑫铅业有限责任公司柏林分公司,http://www.11467.com/chenzhou/co/23731.htm
宜章鑫源矿业有限公司,http://www.11467.com/chenzhou/co/12443.htm
郴州市泰鹏有色金属有限公司,http://www.11467.com/chenzhou/co/14864.htm
郴州市腾新有色金属有限公司,http://www.11467.com/chenzhou/co/23442.htm
桂阳县合力矿业有限责任公司,http://www.11467.com/chenzhou/co/11837.htm
湖南意水有色金属股份有限公司,http://www.11467.com/chenzhou/co/23918.htm
桂阳县润兴有色金属有限公司,http://www.11467.com/chenzhou/co/24091.htm
君宜有色金属有限公司,http://www.11467.com/chenzhou/co/23157.htm
郴州汇银典当有限责任公司,http://www.11467.com/chenzhou/co/23575.htm
宜章县怡辉工贸有限公司,http://www.11467.com/chenzhou/co/12425.htm
郴州市御丰有色金属有限公司,http://www.11467.com/chenzhou/co/23432.htm
郴州市翔泰有色金属有限公司,http://www.11467.com/chenzhou/co/23412.htm
临武县东山矿业有限责任公司,http://www.11467.com/chenzhou/co/13107.htm
安仁县恒兴有色金属有限公司,http://www.11467.com/chenzhou/co/23971.htm
资兴市金茂矿产有限公司,http://www.11467.com/chenzhou/co/18188.htm
汝城县富华矿业有限公司,http://www.11467.com/chenzhou/co/13302.htm
赤峰市红花沟金矿劳动服务公司基建维修队,http://www.11467.com/chifeng/co/10124.htm
赤峰市红花沟金矿劳动服务公司青年商店,http://www.11467.com/chifeng/co/10143.htm
赤峰市红花沟金矿劳动服务公司养殖厂,http://www.11467.com/chifeng/co/10131.htm
赤峰市红花沟金矿劳动服务公司电器维修部,http://www.11467.com/chifeng/co/10221.htm
赤峰市红花沟金矿劳动服务公司红金酒家,http://www.11467.com/chifeng/co/10139.htm
赤峰市红花沟金矿劳动服务公司,http://www.11467.com/chifeng/co/10186.htm
赤峰市红花沟金矿劳动服务公司粮油经营部,http://www.11467.com/chifeng/co/10132.htm
赤峰市红花沟金矿劳动服务公司理发部,http://www.11467.com/chifeng/co/10135.htm
赤峰丰金矿业有限责任公司,http://www.11467.com/chifeng/co/10220.htm
宁城县东风金矿劳动服务公司,http://www.11467.com/chifeng/co/20251.htm
巴林左旗白音诺尔益兴铅锌矿业有限责任公司,http://www.11467.com/chifeng/co/12802.htm
池州市贵池铜鑫矿业有限公司,http://www.11467.com/chizhou/co/6256.htm
安徽扬子矿业有限公司,http://www.11467.com/chizhou/co/7747.htm
池州市南方矿业有限公司铜山排铜矿,http://www.11467.com/chizhou/co/1010.htm
安徽省池州市九洲矿业开发有限公司,http://www.11467.com/chizhou/co/7009.htm
池州黄山岭铅锌矿劳动服务公司,http://www.11467.com/chizhou/co/995.htm
池州银海民间借贷中介服务有限责任公司,http://www.11467.com/chizhou/co/13704.htm
池州市贵池区姚街矿业有限公司,http://www.11467.com/chizhou/co/7282.htm
牟定桂山矿业开发有限责任公司,http://www.11467.com/chuxiong/co/10003.htm
昆明映彤科技有限公司武定邵家坡铜矿采选厂,http://www.11467.com/chuxiong/co/11889.htm
楚雄天林工贸有限公司,http://www.11467.com/chuxiong/co/8182.htm
昆明坤之杰经贸有限公司勤川基地,http://www.11467.com/chuxiong/co/12840.htm
云南星焰有色金属股份有限公司仁兴分公司,http://www.11467.com/chuxiong/co/12834.htm
牟定星宇工贸有限公司,http://www.11467.com/chuxiong/co/10329.htm
云南省禄丰仁兴矿产公司,http://www.11467.com/chuxiong/co/12384.htm
云县江天矿冶有限责任公司,http://www.11467.com/chuxiong/co/10531.htm
云南牟定兴宏井巷工程有限责任公司,http://www.11467.com/chuxiong/co/9561.htm
武定县九厂矿业公司,http://www.11467.com/chuxiong/co/12087.htm
武定县猫街镇矿业开发公司,http://www.11467.com/chuxiong/co/12130.htm
定远县银峰米业有限公司,http://www.11467.com/chuzhou/co/31446.htm
滁州市银丰装卸有限公司,http://www.11467.com/chuzhou/co/32813.htm
云龙县漕涧镇瑞达有限责任公司,http://www.11467.com/dali/co/11711.htm
巍山彝族回族自治县鑫源矿业开发有限公司,http://www.11467.com/dali/co/11459.htm
兰坪天浩有限责任公司,http://www.11467.com/dali/co/7723.htm
云龙县锡电工业有限责任公司,http://www.11467.com/dali/co/11801.htm
云南云宝铂钯矿业有限公司,http://www.11467.com/dali/co/10157.htm
兰坪精城有色金属选冶有限公司,http://www.11467.com/dali/co/7718.htm
兰坪金鼎锌业有限公司,http://www.11467.com/dali/co/7712.htm
瓦房店市华铜矿业有限公司,http://www.11467.com/dalian/co/10908.htm
宽甸满族自治县鑫联矿业有限公司,http://www.11467.com/dandong/co/34999.htm
凤城市枫福矿业有限公司,http://www.11467.com/dandong/co/43376.htm
宽甸满族自治县长安矿产品有限公司,http://www.11467.com/dandong/co/26271.htm
辽宁金凤黄金矿业有限责任公司,http://www.11467.com/dandong/co/25312.htm
五龙金矿劳动服务公司办矿队,http://www.11467.com/dandong/co/13290.htm
宽甸满族自治县超群矿业有限公司,http://www.11467.com/dandong/co/26299.htm
宽甸满族自治县会鑫矿业有限公司,http://www.11467.com/dandong/co/34423.htm
丹东青城子矿业有限公司,http://www.11467.com/dandong/co/41035.htm
丹东嘉鑫矿业有限公司,http://www.11467.com/dandong/co/30873.htm
安新县腾跃有色金属购销有限公司,http://www.11467.com/baoding/co/87526.htm
安新县跃威有色金属熔炼有限公司,http://www.11467.com/baoding/co/90134.htm
安新县恒昌有色金属购销有限公司,http://www.11467.com/baoding/co/83742.htm
安新县建磊有色金属购销有限公司,http://www.11467.com/baoding/co/88356.htm
涞源县轻工矿业开发公司,http://www.11467.com/baoding/co/50280.htm
黄石市源发矿产有限责任公司驻涞源小河选矿厂,http://www.11467.com/baoding/co/50345.htm
涞源县通达冶金矿业有限公司,http://www.11467.com/baoding/co/26095.htm
涞源县长祥矿业有限责任公司,http://www.11467.com/baoding/co/50203.htm
涞水县矿产公司,http://www.11467.com/baoding/co/50054.htm
安新县鸿益洲有色金属熔炼有限公司,http://www.11467.com/baoding/co/90567.htm
涞源县宏达冶金矿山公司,http://www.11467.com/baoding/co/26089.htm
保定市华源丰顺有色金属有限公司,http://www.11467.com/baoding/co/87162.htm
涞水县萍涞金矿采选有限公司,http://www.11467.com/baoding/co/17028.htm
涞源县波特矿业有限责任公司,http://www.11467.com/baoding/co/50201.htm
锦州市沈宏实业股份有限公司涞源分公司,http://www.11467.com/baoding/co/49072.htm
涞源县郎坤矿业有限责任公司,http://www.11467.com/baoding/co/50265.htm
涞源县铜矿兴铜工贸实业公司,http://www.11467.com/baoding/co/26108.htm
安新县金都有色金属加工有限公司,http://www.11467.com/baoding/co/85019.htm
涞水县和瑞选金有限公司,http://www.11467.com/baoding/co/50015.htm
安新县弘鑫有色金属熔炼有限公司,http://www.11467.com/baoding/co/87407.htm
安新县金润有色金属熔炼有限公司,http://www.11467.com/baoding/co/89449.htm
安新县海铝有色金属熔炼有限公司,http://www.11467.com/baoding/co/89780.htm
安新县泽汇泰有色金属熔炼有限公司,http://www.11467.com/baoding/co/90883.htm
保定市西北冶金矿山机电有限公司,http://www.11467.com/baoding/co/27320.htm
河北省易县泰利矿业开发有限公司,http://www.11467.com/baoding/co/49805.htm
安新县银雨有色金属熔炼有限公司,http://www.11467.com/baoding/co/89807.htm
东莞胜誉金银回收有限公司,http://www.11467.com/dongguan/co/532052.htm
东莞市艾诺银饰有限公司,http://www.11467.com/dongguan/co/549562.htm
东莞市德邦货运有限公司大朗银朗南路营业部,http://www.11467.com/dongguan/co/515056.htm
丹东大勇矿产有限公司,http://www.11467.com/dandong/co/41769.htm
丹东兴达选矿有限公司,http://www.11467.com/dandong/co/33675.htm
凤城市厚利选矿有限责任公司,http://www.11467.com/dandong/co/43694.htm
凤城市鑫鹏矿业有限公司,http://www.11467.com/dandong/co/44810.htm
丹东雷蒙得矿产品开发有限公司,http://www.11467.com/dandong/co/30299.htm
凤城市鑫凤矿业有限责任公司,http://www.11467.com/dandong/co/44804.htm
丹东凤银矿冶有限责任公司,http://www.11467.com/dandong/co/25313.htm
丹东实信黄金选冶有限公司,http://www.11467.com/dandong/co/42498.htm
山西大同黄金矿业有限责任公司,http://www.11467.com/datong/co/6182.htm
山西省天镇县亿德兴工贸有限责任公司,http://www.11467.com/datong/co/13328.htm
云南锡业集团梁河矿业有限责任公司,http://www.11467.com/dehong/co/3480.htm
云南盈江外贸进出口公司,http://www.11467.com/dehong/co/3979.htm
四川绵竹龙金矿产品有限责任公司,http://www.11467.com/deyang/co/16835.htm
四川银天石业有限公司,http://www.11467.com/deyang/co/37727.htm
山东融银担保有限公司乐陵分公司,http://www.11467.com/dezhou/co/53367.htm
岷县天昊黄金有限责任公司,http://www.11467.com/dingxi/co/7888.htm
陇西县矿业开发有限责任公司,http://www.11467.com/dingxi/co/7179.htm
静宁众星矿业有限公司,http://www.11467.com/dingxi/co/5801.htm
云南省香格里拉县卓玛有色矿产工贸有限责任总公司,http://www.11467.com/diqing/co/1462.htm
安新县银雨有色金属熔炼有限公司,http://www.11467.com/baoding/co/89807.htm
涞源县金燕矿冶有限责任公司,http://www.11467.com/baoding/co/50251.htm
安新县诚泰有色金属购销有限公司,http://www.11467.com/baoding/co/87473.htm
安新县瑞翔有色金属熔炼有限公司,http://www.11467.com/baoding/co/89441.htm
蠡县银座皮草制造有限公司,http://www.11467.com/baoding/co/87821.htm
安新县生力有色金属熔炼有限公司,http://www.11467.com/baoding/co/89507.htm
安新县胜达有色金属熔炼有限公司,http://www.11467.com/baoding/co/89021.htm
涞源县碧溪矿业有限责任公司,http://www.11467.com/baoding/co/50199.htm
涞源恒达矿业有限公司,http://www.11467.com/baoding/co/50184.htm
涞源康丽矿业有限责任公司,http://www.11467.com/baoding/co/50186.htm
涞源县后清黄金矿业有限责任公司,http://www.11467.com/baoding/co/26088.htm
河北省易县黄金矿业开发有限公司,http://www.11467.com/baoding/co/31069.htm
清苑县克莱森有色金属销售有限公司,http://www.11467.com/baoding/co/83863.htm
凤县志达工贸有限责任公司,http://www.11467.com/baoji/co/15857.htm
陕西凤县四方金矿有限责任公司,http://www.11467.com/baoji/co/13802.htm
凤县中宝矿业有限责任公司,http://www.11467.com/baoji/co/15860.htm
陕西太白金矿劳动服务公司,http://www.11467.com/baoji/co/14099.htm
陕西银母寺矿业有限责任公司,http://www.11467.com/baoji/co/20217.htm
凤县永兴矿业有限责任公司,http://www.11467.com/baoji/co/15853.htm
宝鸡县明鑫五金矿产工贸有限公司,http://www.11467.com/baoji/co/7878.htm
陕西铅硐山矿业有限公司,http://www.11467.com/baoji/co/19723.htm
腾冲县干河矿业有限责任公司,http://www.11467.com/baoshan/co/5008.htm
腾冲县佳益矿业有限责任公司,http://www.11467.com/baoshan/co/5381.htm
瑞丽市畹町经济开发区天兰矿业有限公司,http://www.11467.com/baoshan/co/8892.htm
腾冲县茂兴锡矿开发有限责任公司,http://www.11467.com/baoshan/co/1775.htm
云南德宏云敏矿产资源开发有限公司,http://www.11467.com/baoshan/co/7870.htm
东莞市良稳有色金属有限公司,http://www.11467.com/dongguan/co/538185.htm
东莞市嘉隆金银回收有限公司,http://www.11467.com/dongguan/co/545037.htm
东营市东营区东晨工贸有限责任公司,http://www.11467.com/dongying/co/24071.htm
鹤峰县天泰实业有限公司建始工业硅厂,http://www.11467.com/enshi/co/10023.htm
宣恩县东方矿业有限公司,http://www.11467.com/enshi/co/8605.htm
佛山市南海区里水基利心五金矿产制品有限公司,http://www.11467.com/foshan/co/40999.htm
佛山市南海区银都门业有限公司,http://www.11467.com/foshan/co/353405.htm
昆明金银岛黄金交易有限公司佛山市南庄分公司,http://www.11467.com/foshan/co/354526.htm
佛山市银矿湾贸易有限公司,http://www.11467.com/foshan/co/41019.htm
抚顺红透山铜矿劳动服务公司抚顺开发区分公司,http://www.11467.com/fushun/co/17219.htm
抚顺红透山铜矿清原服务公司,http://www.11467.com/fushun/co/22754.htm
抚顺红透山铜矿经销公司,http://www.11467.com/fushun/co/22743.htm
抚顺红透山铜矿服务公司冰果店,http://www.11467.com/fushun/co/22688.htm
界首市佳富有色金属购销有限公司,http://www.11467.com/fuyang/co/36397.htm
界首市新宇有色金属购销有限公司,http://www.11467.com/fuyang/co/35492.htm
太和县银晶特玻钢化有限公司,http://www.11467.com/fuyang/co/37026.htm
界首市泽中有色金属购销有限公司,http://www.11467.com/fuyang/co/36679.htm
福建省永泰县建三矿业有限公司,http://www.11467.com/fuzhou/co/102089.htm
福建中信银丰担保有限公司,http://www.11467.com/fuzhou/co/193998.htm
江西铜业集团东同矿业有限责任公司,http://www.11467.com/fuzhoushi/co/10608.htm
黎川县德胜关金鑫矿产品有限责任公司,http://www.11467.com/fuzhoushi/co/14929.htm
中国核工业总公司七二一矿,http://www.11467.com/fuzhoushi/co/15404.htm
江西省广昌万鑫矿业有限公司,http://www.11467.com/fuzhoushi/co/11476.htm
银江股份有限公司抚州分公司,http://www.11467.com/fuzhoushi/co/19806.htm
东乡铜兴工贸有限责任公司,http://www.11467.com/fuzhoushi/co/10301.htm
金溪县矿业有限责任公司,http://www.11467.com/fuzhoushi/co/11922.htm
甘肃省合作早子沟金矿有限责任公司,http://www.11467.com/gannan/co/104.htm
天水中新矿产品有限公司卓尼有色选炼厂,http://www.11467.com/gannan/co/2289.htm
赣州市嘉应有色金属有限公司,http://www.11467.com/ganzhou/co/33923.htm
南康市燕杨矿业有限公司,http://www.11467.com/ganzhou/co/25135.htm
江西西华山钨业有限公司,http://www.11467.com/ganzhou/co/20246.htm
江西省营前矿业有限公司,http://www.11467.com/ganzhou/co/20228.htm
江西大吉山钨业有限公司,http://www.11467.com/ganzhou/co/20283.htm
江西赣县光华矿产品机电发展有限公司,http://www.11467.com/ganzhou/co/20457.htm
西华山钨矿建筑公司,http://www.11467.com/ganzhou/co/4926.htm
铁山垅钨矿劳动服务公司,http://www.11467.com/ganzhou/co/11974.htm
江西宏捷新材料有限公司,http://www.11467.com/ganzhou/co/20480.htm
龙南县龙纪庆达矿产品公司,http://www.11467.com/ganzhou/co/21097.htm
大余县宝石钨业有限公司,http://www.11467.com/ganzhou/co/24027.htm
铁山垅钨矿工商联合公司,http://www.11467.com/ganzhou/co/11971.htm
崇义县青山钨锡矿有限公司,http://www.11467.com/ganzhou/co/6110.htm
赣州丰瑞钨业开发有限公司,http://www.11467.com/ganzhou/co/18480.htm
大余县大华工矿贸易有限公司,http://www.11467.com/ganzhou/co/24047.htm
大余县力源有色金属有限责任公司,http://www.11467.com/ganzhou/co/24125.htm
龙南县金宏有色金属有限责任公司,http://www.11467.com/ganzhou/co/33866.htm
瑞金市金鑫矿产品实业有限公司,http://www.11467.com/ganzhou/co/19778.htm
大余县海欣有色金属有限公司,http://www.11467.com/ganzhou/co/34827.htm
江西省赣县稀土公司,http://www.11467.com/ganzhou/co/20689.htm
赣州稀土（龙南）有色金属有限公司,http://www.11467.com/ganzhou/co/34765.htm
赣州南方稀土矿冶有限责任公司赣县分公司,http://www.11467.com/ganzhou/co/2674.htm
西华山钨矿生活服务公司,http://www.11467.com/ganzhou/co/4892.htm
崇义县高坌长飞矿业有限公司,http://www.11467.com/ganzhou/co/24310.htm
大余县特精钨钼加工有限公司,http://www.11467.com/ganzhou/co/24189.htm
赣州宏捷新材料有限公司,http://www.11467.com/ganzhou/co/22618.htm
兴国县崇兴矿业有限责任公司,http://www.11467.com/ganzhou/co/18583.htm
瑞金市今朝矿业开发有限公司,http://www.11467.com/ganzhou/co/19768.htm
赣州南方稀土矿冶有限责任公司宁都分公司,http://www.11467.com/ganzhou/co/11013.htm
南康市华山矿业有限公司,http://www.11467.com/ganzhou/co/25269.htm
赣州南方稀土矿冶有限责任公司信丰分公司,http://www.11467.com/ganzhou/co/4092.htm
大余县林宝矿业有限公司,http://www.11467.com/ganzhou/co/24132.htm
赣州南方稀土矿冶有限责任公司,http://www.11467.com/ganzhou/co/1517.htm
安远县天宝铅锌矿业有限公司,http://www.11467.com/ganzhou/co/6872.htm
大余县芮生矿业有限公司,http://www.11467.com/ganzhou/co/24175.htm
