杨家杖子矿务局第三产业总公司实业公司钼矿,http://www.11467.com/huludao/co/5242.htm
杨家杖子矿务局附属企业公司戮力矿,http://www.11467.com/huludao/co/42601.htm
兴城龙盛选矿有限责任公司,http://www.11467.com/huludao/co/37830.htm
葫芦岛振兴矿业有限公司,http://www.11467.com/huludao/co/30800.htm
葫芦岛市杨家杖子经济技术开发区工业公司二厂,http://www.11467.com/huludao/co/32735.htm
建昌县永昌矿业有限责任公司,http://www.11467.com/huludao/co/41449.htm
牙克石市金源铅锌矿业有限公司,http://www.11467.com/hulunbeier/co/13488.htm
新巴尔虎右旗震财铜银矿业开发公司,http://www.11467.com/hulunbeier/co/8047.htm
新巴尔虎右旗北方银铅锌矿业有限责任公司,http://www.11467.com/hulunbeier/co/8051.htm
黑龙江省汤原县东风山矿业有限公司,http://www.11467.com/jiamusi/co/17265.htm
江西小龙钨业有限公司,http://www.11467.com/jian/co/13257.htm
吉安鑫业有色金属有限公司,http://www.11467.com/jian/co/19437.htm
泰和县瑞鑫有色金属有限公司,http://www.11467.com/jian/co/19409.htm
万安县晶鑫矿业有限公司,http://www.11467.com/jian/co/13471.htm
焦作市冶金矿产总公司瑞赛矿产分公司,http://www.11467.com/jiaozuo/co/2981.htm
海宁市银明直立棉有限公司,http://www.11467.com/jiaxing/co/132868.htm
吉林市银城塑钢窗有限公司,http://www.11467.com/jilinshi/co/92976.htm
桦甸市华丰矿业有限责任公司,http://www.11467.com/jilinshi/co/75953.htm
磐石市烟筒山镇银丰农贸市场有限公司,http://www.11467.com/jilinshi/co/93037.htm
吉林省夹皮沟黄金矿业公司建筑安装公司第一工程队,http://www.11467.com/jilinshi/co/37996.htm
吉林银粮米业有限公司,http://www.11467.com/jilinshi/co/93009.htm
山东统一银座商业有限公司山水泉城店,http://www.11467.com/jinan/co/140229.htm
九江大地科技开发公司浮梁县茅棚店锡矿,http://www.11467.com/jingdezhen/co/3852.htm
江西省金叶发矿产实业有限公司,http://www.11467.com/jingdezhen/co/6043.htm
浮梁县大舟金矿有限公司,http://www.11467.com/jingdezhen/co/3851.htm
京山华邦功能材料有限公司,http://www.11467.com/jingmen/co/9080.htm
永康市杰特五金矿产有限公司,http://www.11467.com/jinhua/co/37253.htm
金华市速客超市连锁有限公司银都花园店,http://www.11467.com/jinhua/co/132065.htm
义乌市银环商品采购有限公司,http://www.11467.com/jinhua/co/134768.htm
济宁市鑫融银担保有限公司,http://www.11467.com/jining/co/75188.htm
济宁银银担保有限公司,http://www.11467.com/jining/co/77949.htm
孝义濮耐高铝材料有限公司,http://www.11467.com/jinzhong/co/19217.htm
锦州广玉矿业有限公司,http://www.11467.com/jinzhou/co/31284.htm
九江昌顺铜硫矿产品有限公司,http://www.11467.com/jiujiang/co/18801.htm
瑞昌市荣达矿业发展有限公司,http://www.11467.com/jiujiang/co/16758.htm
江西省修水香炉山钨业有限责任公司,http://www.11467.com/jiujiang/co/15737.htm
瑞昌市黄金公司,http://www.11467.com/jiujiang/co/16604.htm
瑞昌市四方废尾矿回收有限公司,http://www.11467.com/jiujiang/co/16819.htm
江西铜业股份有限公司武山铜矿,http://www.11467.com/jiujiang/co/11773.htm
中国核工业总公司七二四矿,http://www.11467.com/jiujiang/co/12382.htm
江西铜业公司武山铜矿鑫达实业公司,http://www.11467.com/jiujiang/co/11772.htm
瑞昌市恒泰银锌矿业有限公司,http://www.11467.com/jiujiang/co/16547.htm
肃北县金鹰黄金有限责任公司,http://www.11467.com/jiuquan/co/6322.htm
安西县安南矿业有限责任公司,http://www.11467.com/jiuquan/co/6093.htm
肃北蒙古族自治县宏浩电熔镁砂有限责任公司,http://www.11467.com/jiuquan/co/6276.htm
肃北县银城施工有限责任公司,http://www.11467.com/jiuquan/co/12330.htm
密山市通达投资有限公司,http://www.11467.com/jixi/co/15153.htm
兰考县鑫利有色金属有限公司,http://www.11467.com/kaifeng/co/21492.htm
喀什峻岭矿业开发有限责任公司,http://www.11467.com/kashi/co/5761.htm
伽师县铜辉矿业有限责任公司,http://www.11467.com/kashi/co/6914.htm
莎车县金宝矿业有限责任公司,http://www.11467.com/kashi/co/7164.htm
叶城县乔戈里矿业工贸有限责任公司,http://www.11467.com/kashi/co/6850.htm
加拿大比弗布鲁克锑矿公司成都代表处,http://www.11467.com/chengdu/co/5227.htm
四川海洲有色金属有限公司,http://www.11467.com/chengdu/co/223290.htm
银川银重（集团）起重机有限公司四川分公司,http://www.11467.com/chengdu/co/236417.htm
四川凌冶矿业有限公司,http://www.11467.com/chengdu/co/38301.htm
郴州市银锑有色金属有限公司,http://www.11467.com/chenzhou/co/23848.htm
郴州市派安矿业有限责任公司,http://www.11467.com/chenzhou/co/17443.htm
桂阳恒晟矿业有限公司,http://www.11467.com/chenzhou/co/11680.htm
盈达综合选矿有限责任公司,http://www.11467.com/chenzhou/co/13150.htm
永兴县银鑫铅业有限责任公司柏林分公司,http://www.11467.com/chenzhou/co/23731.htm
宜章鑫源矿业有限公司,http://www.11467.com/chenzhou/co/12443.htm
郴州市泰鹏有色金属有限公司,http://www.11467.com/chenzhou/co/14864.htm
郴州市腾新有色金属有限公司,http://www.11467.com/chenzhou/co/23442.htm
桂阳县合力矿业有限责任公司,http://www.11467.com/chenzhou/co/11837.htm
湖南意水有色金属股份有限公司,http://www.11467.com/chenzhou/co/23918.htm
桂阳县润兴有色金属有限公司,http://www.11467.com/chenzhou/co/24091.htm
君宜有色金属有限公司,http://www.11467.com/chenzhou/co/23157.htm
郴州汇银典当有限责任公司,http://www.11467.com/chenzhou/co/23575.htm
宜章县怡辉工贸有限公司,http://www.11467.com/chenzhou/co/12425.htm
郴州市御丰有色金属有限公司,http://www.11467.com/chenzhou/co/23432.htm
郴州市翔泰有色金属有限公司,http://www.11467.com/chenzhou/co/23412.htm
临武县东山矿业有限责任公司,http://www.11467.com/chenzhou/co/13107.htm
安仁县恒兴有色金属有限公司,http://www.11467.com/chenzhou/co/23971.htm
资兴市金茂矿产有限公司,http://www.11467.com/chenzhou/co/18188.htm
汝城县富华矿业有限公司,http://www.11467.com/chenzhou/co/13302.htm
赤峰市红花沟金矿劳动服务公司基建维修队,http://www.11467.com/chifeng/co/10124.htm
赤峰市红花沟金矿劳动服务公司青年商店,http://www.11467.com/chifeng/co/10143.htm
赤峰市红花沟金矿劳动服务公司养殖厂,http://www.11467.com/chifeng/co/10131.htm
赤峰市红花沟金矿劳动服务公司电器维修部,http://www.11467.com/chifeng/co/10221.htm
赤峰市红花沟金矿劳动服务公司红金酒家,http://www.11467.com/chifeng/co/10139.htm
赤峰市红花沟金矿劳动服务公司,http://www.11467.com/chifeng/co/10186.htm
赤峰市红花沟金矿劳动服务公司粮油经营部,http://www.11467.com/chifeng/co/10132.htm
赤峰市红花沟金矿劳动服务公司理发部,http://www.11467.com/chifeng/co/10135.htm
赤峰丰金矿业有限责任公司,http://www.11467.com/chifeng/co/10220.htm
宁城县东风金矿劳动服务公司,http://www.11467.com/chifeng/co/20251.htm
喀什地区新鑫矿业有限公司,http://www.11467.com/kashi/co/5901.htm
托里县乡镇企业实业开发公司,http://www.11467.com/kelamayi/co/7574.htm
新疆哈图金矿劳动服务公司,http://www.11467.com/kelamayi/co/1695.htm
托里县松泉鸽子硐黄金开发有限责任公司,http://www.11467.com/kelamayi/co/7555.htm
托里县鑫磊矿业有限责任公司,http://www.11467.com/kelamayi/co/7578.htm
和布克赛尔县西部恒海矿业开发有限责任公司,http://www.11467.com/kelamayi/co/7325.htm
新疆国苑矿业有限公司,http://www.11467.com/kelamayi/co/7779.htm
托里县鑫达黄金矿业有限责任公司,http://www.11467.com/kelamayi/co/7577.htm
托里县明力黄金开发有限责任公司,http://www.11467.com/kelamayi/co/7537.htm
阿图什市顺鑫矿业有限责任公司,http://www.11467.com/kezilesu/co/1739.htm
乌恰天振矿业有限责任公司,http://www.11467.com/kezilesu/co/1930.htm
昆明市东川区三源有限责任公司,http://www.11467.com/kunming/co/48168.htm
昆明禄劝恒源矿产有限责任公司,http://www.11467.com/kunming/co/50057.htm
昆明市东川众誉矿业有限责任公司,http://www.11467.com/kunming/co/48235.htm
昆明裕东锌业有限责任公司,http://www.11467.com/kunming/co/48024.htm
云南金沙矿业股份有限公司,http://www.11467.com/kunming/co/47769.htm
云南天成有色金属矿产有限公司,http://www.11467.com/kunming/co/75418.htm
昆明开元经纬矿业有限公司,http://www.11467.com/kunming/co/48236.htm
云南大互通工贸有限公司大营钛选厂,http://www.11467.com/kunming/co/69696.htm
云南富盛资源开发股份有限公司,http://www.11467.com/kunming/co/70634.htm
云南嵩明楠璧矿冶公司,http://www.11467.com/kunming/co/49165.htm
昆明市锦银矿产品销售有限公司,http://www.11467.com/kunming/co/14885.htm
东川碧龙矿产有限公司,http://www.11467.com/kunming/co/47955.htm
云南众韬经贸有限公司,http://www.11467.com/kunming/co/79328.htm
昆明银箐造林有限公司,http://www.11467.com/kunming/co/128730.htm
云南珞玮矿业开发有限公司,http://www.11467.com/kunming/co/71642.htm
云南省富民县钛业公司,http://www.11467.com/kunming/co/76412.htm
云南银鹏实业集团有限公司第二分公司,http://www.11467.com/kunming/co/131512.htm
广西金秀华鑫公司,http://www.11467.com/laibin/co/4910.htm
广西柳州地区冶金矿业有限公司,http://www.11467.com/laibin/co/2404.htm
武宣县盘龙铅锌矿有限责任公司,http://www.11467.com/laibin/co/1445.htm
大城县泰富有色金属有限公司,http://www.11467.com/langfang/co/52984.htm
白银深部实业开发公司,http://www.11467.com/lanzhou/co/53701.htm
甘肃信特誉有色金属有限公司,http://www.11467.com/lanzhou/co/82069.htm
兰州炭素（集团）有限责任公司,http://www.11467.com/lanzhou/co/44914.htm
甘肃盛达金银元宝制品有限公司,http://www.11467.com/lanzhou/co/85047.htm
甘肃华奥矿业发展有限公司,http://www.11467.com/lanzhou/co/38777.htm
白银天翔化工建材有限责任公司,http://www.11467.com/lanzhou/co/33291.htm
甘肃成州矿冶股份有限公司,http://www.11467.com/lanzhou/co/40756.htm
兰州市五金矿产总公司第一经营部,http://www.11467.com/lanzhou/co/10657.htm
乐山市沙湾区天盛矿业有限公司,http://www.11467.com/leshan/co/17346.htm
西昌市华澜实业有限公司会理铜选厂,http://www.11467.com/liangshan/co/12349.htm
宁南县友联矿业采选有限责任公司,http://www.11467.com/liangshan/co/15230.htm
宁南县鑫丰矿业有限公司,http://www.11467.com/liangshan/co/15222.htm
西昌志能实业有限责任公司,http://www.11467.com/liangshan/co/13490.htm
汕头出口基地凉山五金矿产资源开发公司,http://www.11467.com/liangshan/co/1331.htm
四川冕宁昌兰稀土公司,http://www.11467.com/liangshan/co/10808.htm
四川省金钒科技有限责任公司,http://www.11467.com/liangshan/co/10631.htm
四川会东铅锌矿实业开发公司,http://www.11467.com/liangshan/co/5441.htm
西昌冶金矿山公司太阳能厂经营部,http://www.11467.com/liangshan/co/1325.htm
会东县世佳有色金属矿业有限公司,http://www.11467.com/liangshan/co/14380.htm
四川省会东县大银厂铅锌矿有限公司,http://www.11467.com/liangshan/co/5435.htm
会东县三友矿产品贸易有限责任公司,http://www.11467.com/liangshan/co/14374.htm
西昌元东矿业有限公司冕宁分公司,http://www.11467.com/liangshan/co/13473.htm
会理大铜矿综合经营公司,http://www.11467.com/liangshan/co/4533.htm
会理县华澜铜业有限责任公司,http://www.11467.com/liangshan/co/13954.htm
会理天宝矿业有限责任公司,http://www.11467.com/liangshan/co/13831.htm
会理县矿产品开发有限责任公司,http://www.11467.com/liangshan/co/13999.htm
德昌县泰嘉科技发展有限公司,http://www.11467.com/liangshan/co/13677.htm
巴林左旗白音诺尔益兴铅锌矿业有限责任公司,http://www.11467.com/chifeng/co/12802.htm
池州市贵池铜鑫矿业有限公司,http://www.11467.com/chizhou/co/6256.htm
安徽扬子矿业有限公司,http://www.11467.com/chizhou/co/7747.htm
池州市南方矿业有限公司铜山排铜矿,http://www.11467.com/chizhou/co/1010.htm
安徽省池州市九洲矿业开发有限公司,http://www.11467.com/chizhou/co/7009.htm
池州黄山岭铅锌矿劳动服务公司,http://www.11467.com/chizhou/co/995.htm
池州银海民间借贷中介服务有限责任公司,http://www.11467.com/chizhou/co/13704.htm
池州市贵池区姚街矿业有限公司,http://www.11467.com/chizhou/co/7282.htm
牟定桂山矿业开发有限责任公司,http://www.11467.com/chuxiong/co/10003.htm
昆明映彤科技有限公司武定邵家坡铜矿采选厂,http://www.11467.com/chuxiong/co/11889.htm
楚雄天林工贸有限公司,http://www.11467.com/chuxiong/co/8182.htm
昆明坤之杰经贸有限公司勤川基地,http://www.11467.com/chuxiong/co/12840.htm
云南星焰有色金属股份有限公司仁兴分公司,http://www.11467.com/chuxiong/co/12834.htm
牟定星宇工贸有限公司,http://www.11467.com/chuxiong/co/10329.htm
云南省禄丰仁兴矿产公司,http://www.11467.com/chuxiong/co/12384.htm
云县江天矿冶有限责任公司,http://www.11467.com/chuxiong/co/10531.htm
云南牟定兴宏井巷工程有限责任公司,http://www.11467.com/chuxiong/co/9561.htm
武定县九厂矿业公司,http://www.11467.com/chuxiong/co/12087.htm
武定县猫街镇矿业开发公司,http://www.11467.com/chuxiong/co/12130.htm
定远县银峰米业有限公司,http://www.11467.com/chuzhou/co/31446.htm
滁州市银丰装卸有限公司,http://www.11467.com/chuzhou/co/32813.htm
云龙县漕涧镇瑞达有限责任公司,http://www.11467.com/dali/co/11711.htm
龙泉市埠头莹石矿有限公司,http://www.11467.com/lishui/co/15024.htm
浙江省松阳金山矿业有限公司,http://www.11467.com/lishui/co/21131.htm
青田剑石钼材料有限公司,http://www.11467.com/lishui/co/20177.htm
遂昌县恒汇有色金属回收有限公司,http://www.11467.com/lishui/co/37963.htm
青田泰正钼业开发有限公司,http://www.11467.com/lishui/co/19839.htm
青田金达矿业有限公司,http://www.11467.com/lishui/co/20181.htm
青田县新兴铅锌有限公司,http://www.11467.com/lishui/co/20391.htm
青田恒新钼业有限公司,http://www.11467.com/lishui/co/20157.htm
安徽金寨金铜矿业有限责任公司,http://www.11467.com/liuan/co/8537.htm
盘县齐辉矿业开发有限责任公司,http://www.11467.com/liupanshui/co/9482.htm
盘县银信担保有限责任公司红果分公司,http://www.11467.com/liupanshui/co/11203.htm
水城县久益实业有限公司,http://www.11467.com/liupanshui/co/6026.htm
贵州省威宁浙仁矿业有限责任公司,http://www.11467.com/liupanshui/co/9065.htm
水城正鑫锌业有限责任公司,http://www.11467.com/liupanshui/co/5940.htm
贵州省威宁县红岭福利锌业有限责任公司,http://www.11467.com/liupanshui/co/9018.htm
六盘水市东云商贸有限公司,http://www.11467.com/liupanshui/co/8134.htm
柳州市辉德宝有色金属科技有限公司,http://www.11467.com/liuzhou/co/23624.htm
融水苗族自治县鑫慧矿产有限责任公司,http://www.11467.com/liuzhou/co/28220.htm
金秀瑶族自治县矿产公司,http://www.11467.com/liuzhou/co/25633.htm
柳州市尊霖矿产品有限责任公司选矿厂,http://www.11467.com/liuzhou/co/25763.htm
广西壮族自治区矿业建设公司九谋锡矿,http://www.11467.com/liuzhou/co/19808.htm
柳州市永生得金矿业有限责任公司,http://www.11467.com/liuzhou/co/11616.htm
武宣县濠丰矿业有限公司,http://www.11467.com/liuzhou/co/28640.htm
融安县宏昌福利矿产有限责任公司,http://www.11467.com/liuzhou/co/28386.htm
柳州市恒宏公司象州浮选厂,http://www.11467.com/liuzhou/co/32668.htm
广西融水县甲龙铜锡有限公司,http://www.11467.com/liuzhou/co/37408.htm
广西融水苗族自治县金石源商贸有限责任公司,http://www.11467.com/liuzhou/co/37392.htm
广西柳城县亿博真空矿冶有限责任公司,http://www.11467.com/liuzhou/co/37004.htm
广西西部矿业集团有限责任公司,http://www.11467.com/liuzhou/co/37474.htm
柳州华锡集团有限责任公司,http://www.11467.com/liuzhou/co/23794.htm
白银公司厂坝铅锌矿子弟中学综合加工厂,http://www.11467.com/longnan/co/4984.htm
白银有色金属公司厂坝铅锌矿银兴实业总公司,http://www.11467.com/longnan/co/4948.htm
成县安信矿业有限责任公司,http://www.11467.com/longnan/co/5602.htm
白银有色金属公司厂坝铅锌矿银兴实业总公司服装厂,http://www.11467.com/longnan/co/4971.htm
白银有色金属公司厂坝铅锌矿银兴实业总公司综合加工部,http://www.11467.com/longnan/co/4954.htm
徽县沙坝矿业有限责任公司,http://www.11467.com/longnan/co/6982.htm
甘肃省成县龙华铅锌矿业有限责任公司,http://www.11467.com/longnan/co/4946.htm
白银有色金属公司厂坝铅锌矿银兴实业总公司选矿厂,http://www.11467.com/longnan/co/4957.htm
白银公司厂坝铅锌矿银兴实业总公司银兴餐厅,http://www.11467.com/longnan/co/4976.htm
徽县社会福利黄坝铅锌有限责任公司,http://www.11467.com/longnan/co/6984.htm
白银公司厂坝铅锌矿银兴实业总公司银兴理发部,http://www.11467.com/longnan/co/4979.htm
陇南华源实业开发有限公司,http://www.11467.com/longnan/co/6009.htm
甘肃文县阳山金矿有限公司,http://www.11467.com/longnan/co/5341.htm
徽县鸿远矿业有限责任公司,http://www.11467.com/longnan/co/6867.htm
徽县金茂有限责任公司,http://www.11467.com/longnan/co/6902.htm
西和县矿产品联营公司,http://www.11467.com/longnan/co/6317.htm
成县世荣矿业开发有限公司,http://www.11467.com/longnan/co/5752.htm
西和县中兴商贸有限公司,http://www.11467.com/longnan/co/6201.htm
礼县矿业有限责任公司,http://www.11467.com/longnan/co/6573.htm
甘肃康县华泰黄金矿业有限公司,http://www.11467.com/longnan/co/2598.htm
陇南民福西和铅锌采选有限责任公司,http://www.11467.com/longnan/co/6436.htm
成县民政福利综合开发有限责任公司,http://www.11467.com/longnan/co/5729.htm
成县茨坝须弥山实业有限公司,http://www.11467.com/longnan/co/5629.htm
福建省武平县金鑫矿业有限公司,http://www.11467.com/longyan/co/20400.htm
福建紫金矿业股份有限公司,http://www.11467.com/longyan/co/7342.htm
福建省漳平市五金矿产公司,http://www.11467.com/longyan/co/11432.htm
巍山彝族回族自治县鑫源矿业开发有限公司,http://www.11467.com/dali/co/11459.htm
兰坪天浩有限责任公司,http://www.11467.com/dali/co/7723.htm
云龙县锡电工业有限责任公司,http://www.11467.com/dali/co/11801.htm
云南云宝铂钯矿业有限公司,http://www.11467.com/dali/co/10157.htm
兰坪精城有色金属选冶有限公司,http://www.11467.com/dali/co/7718.htm
兰坪金鼎锌业有限公司,http://www.11467.com/dali/co/7712.htm
瓦房店市华铜矿业有限公司,http://www.11467.com/dalian/co/10908.htm
宽甸满族自治县鑫联矿业有限公司,http://www.11467.com/dandong/co/34999.htm
凤城市枫福矿业有限公司,http://www.11467.com/dandong/co/43376.htm
宽甸满族自治县长安矿产品有限公司,http://www.11467.com/dandong/co/26271.htm
辽宁金凤黄金矿业有限责任公司,http://www.11467.com/dandong/co/25312.htm
五龙金矿劳动服务公司办矿队,http://www.11467.com/dandong/co/13290.htm
宽甸满族自治县超群矿业有限公司,http://www.11467.com/dandong/co/26299.htm
宽甸满族自治县会鑫矿业有限公司,http://www.11467.com/dandong/co/34423.htm
丹东青城子矿业有限公司,http://www.11467.com/dandong/co/41035.htm
丹东嘉鑫矿业有限公司,http://www.11467.com/dandong/co/30873.htm
上杭县良兴工贸有限公司,http://www.11467.com/longyan/co/19444.htm
福建省上杭县金山矿业有限公司,http://www.11467.com/longyan/co/17917.htm
福建省龙岩市龙腾地质矿业有限公司,http://www.11467.com/longyan/co/17257.htm
福建省上杭县祥鑫工贸有限公司,http://www.11467.com/longyan/co/17769.htm
涟源金灿有色金属销售有限公司,http://www.11467.com/loudi/co/21355.htm
锡矿山矿务局劳动服务公司,http://www.11467.com/loudi/co/5736.htm
锡矿山矿务局工业公司同利保健站,http://www.11467.com/loudi/co/5603.htm
锡矿山矿务局锑华企业公司,http://www.11467.com/loudi/co/5609.htm
娄底市永鑫金银制品经营服务有限公司,http://www.11467.com/loudi/co/21242.htm
冷水江市金波锑业开发有限责任公司,http://www.11467.com/loudi/co/14084.htm
灵宝桐沟金矿黄金交易有限责任公司,http://www.11467.com/luohe/co/12037.htm
洛阳市黄金工业公司,http://www.11467.com/luoyang/co/27810.htm
洛阳市丰金矿产开发有限公司,http://www.11467.com/luoyang/co/18111.htm
栾川县潭头金矿有限公司,http://www.11467.com/luoyang/co/17453.htm
洛宁县大千井巷工程有限公司,http://www.11467.com/luoyang/co/25706.htm
洛宁县豫京矿业开发有限公司,http://www.11467.com/luoyang/co/25889.htm
中国长城铝业公司洛阳铝矿鑫磊石材公司驻洛办事处,http://www.11467.com/luoyang/co/11313.htm
栾川县中兴矿业有限责任公司,http://www.11467.com/luoyang/co/25670.htm
河南黄金建筑安装公司嵩县瑶沟金矿,http://www.11467.com/luoyang/co/18122.htm
栾川县蒙克矿业有限公司,http://www.11467.com/luoyang/co/38054.htm
洛宁县腾达井巷工程有限公司,http://www.11467.com/luoyang/co/25824.htm
栾川县鑫达矿业有限公司,http://www.11467.com/luoyang/co/38227.htm
偃师市鑫泰矿业有限公司,http://www.11467.com/luoyang/co/43165.htm
栾川县鑫川矿业开发有限责任公司,http://www.11467.com/luoyang/co/38226.htm
东莞胜誉金银回收有限公司,http://www.11467.com/dongguan/co/532052.htm
东莞市艾诺银饰有限公司,http://www.11467.com/dongguan/co/549562.htm
东莞市德邦货运有限公司大朗银朗南路营业部,http://www.11467.com/dongguan/co/515056.htm
丹东大勇矿产有限公司,http://www.11467.com/dandong/co/41769.htm
丹东兴达选矿有限公司,http://www.11467.com/dandong/co/33675.htm
凤城市厚利选矿有限责任公司,http://www.11467.com/dandong/co/43694.htm
凤城市鑫鹏矿业有限公司,http://www.11467.com/dandong/co/44810.htm
丹东雷蒙得矿产品开发有限公司,http://www.11467.com/dandong/co/30299.htm
凤城市鑫凤矿业有限责任公司,http://www.11467.com/dandong/co/44804.htm
丹东凤银矿冶有限责任公司,http://www.11467.com/dandong/co/25313.htm
丹东实信黄金选冶有限公司,http://www.11467.com/dandong/co/42498.htm
山西大同黄金矿业有限责任公司,http://www.11467.com/datong/co/6182.htm
山西省天镇县亿德兴工贸有限责任公司,http://www.11467.com/datong/co/13328.htm
云南锡业集团梁河矿业有限责任公司,http://www.11467.com/dehong/co/3480.htm
云南盈江外贸进出口公司,http://www.11467.com/dehong/co/3979.htm
四川绵竹龙金矿产品有限责任公司,http://www.11467.com/deyang/co/16835.htm
四川银天石业有限公司,http://www.11467.com/deyang/co/37727.htm
山东融银担保有限公司乐陵分公司,http://www.11467.com/dezhou/co/53367.htm
岷县天昊黄金有限责任公司,http://www.11467.com/dingxi/co/7888.htm
陇西县矿业开发有限责任公司,http://www.11467.com/dingxi/co/7179.htm
静宁众星矿业有限公司,http://www.11467.com/dingxi/co/5801.htm
云南省香格里拉县卓玛有色矿产工贸有限责任总公司,http://www.11467.com/diqing/co/1462.htm
嵩县鑫瑞矿业有限责任公司,http://www.11467.com/luoyang/co/42815.htm
洛宁县鑫晖矿业有限公司,http://www.11467.com/luoyang/co/25854.htm
栾川县鑫川矿业开发有限公司嵩县分公司,http://www.11467.com/luoyang/co/38225.htm
洛阳银溪湖营销策划有限公司,http://www.11467.com/luoyang/co/61337.htm
宜阳县冶金矿山公司,http://www.11467.com/luoyang/co/19800.htm
洛阳市长鑫矿产研究有限公司,http://www.11467.com/luoyang/co/29429.htm
中国长城铝业公司洛阳铝矿鑫磊石材公司,http://www.11467.com/luoyang/co/16412.htm
河南省栾川县有色金属工业公司,http://www.11467.com/luoyang/co/25315.htm
洛阳万银石化有限公司,http://www.11467.com/luoyang/co/63218.htm
偃师市利龙矿产有限公司,http://www.11467.com/luoyang/co/42912.htm
泸州冶金矿山设备有限公司,http://www.11467.com/luzhou/co/2770.htm
山西铝厂孝义铝矿劳动服务公司,http://www.11467.com/lvliang/co/8707.htm
马鞍山市荣川商贸有限公司,http://www.11467.com/maanshan/co/11289.htm
高州市石龙金矿有限公司,http://www.11467.com/maoming/co/24278.htm
化州市丰盛铅锌矿有限公司,http://www.11467.com/maoming/co/29299.htm
茂名市茂南七色星矿土有限公司,http://www.11467.com/maoming/co/17482.htm
化州市平定镇矿产品贸易有限公司,http://www.11467.com/maoming/co/30190.htm
化州市新华矿业有限公司,http://www.11467.com/maoming/co/28589.htm
化州市华兴矿业有限公司,http://www.11467.com/maoming/co/29626.htm
四川省彭山县恒信物资有限公司,http://www.11467.com/meishan/co/11727.htm
