山东鲁铜有色金属有限公司,http://www.11467.com/linyi/co/101238.htm
嵩县鎏源矿产品有限公司,http://www.11467.com/luoyang/co/42734.htm
伊犁正元矿业有限责任公司,http://www.11467.com/yili/co/10309.htm
北京佳铭铂业有色金属有限公司,http://www.11467.com/beijing/co/715238.htm
德州恒盛有色金属有限公司,http://www.11467.com/dezhou/co/60020.htm
陕西日月北斗有色金属经营有限公司,http://www.11467.com/xian/co/168238.htm
上海华虎投资集团有色金属有限公司,http://www.11467.com/shanghai/co/1065058.htm
靖江市金泽福金属材料有限公司,http://www.11467.com/qiye/93321267.htm
无锡市明诺有色金属制造有限公司,http://www.11467.com/wuxi/co/249994.htm
深圳市金隆金属材料有限公司,http://www.11467.com/qiye/93146788.htm
山东金洲矿业集团有限公司,http://www.11467.com/yantai/co/76761.htm
凉山矿业股份有限公司,http://www.11467.com/liangshan/co/11269.htm
淄博银轩碳素技术有限公司,http://www.11467.com/zibo/co/102296.htm
兰州银河化学清洗技术有限公司,http://www.11467.com/lanzhou/co/83104.htm
枞阳县井边选矿有限责任公司,http://www.11467.com/anqing/co/18176.htm
海城市菱镁矿产品有限公司,http://www.11467.com/anshan/co/31205.htm
岫岩满族自治县华威矿业有限公司,http://www.11467.com/anshan/co/62171.htm
平果铝业公司,http://www.11467.com/baise/co/6964.htm
广西田林高龙黄金矿业有限责任公司,http://www.11467.com/baise/co/4985.htm
隆林各族自治县黄金工业公司,http://www.11467.com/baise/co/7419.htm
白银红利来科贸有限公司,http://www.11467.com/baiyin/co/6875.htm
白银钱隆典当有限公司,http://www.11467.com/baiyin/co/6665.htm
白银庆祥钢制品有限公司,http://www.11467.com/baiyin/co/6147.htm
华光铅锌矿材有限公司,http://www.11467.com/baoding/co/79535.htm
蚌埠市银辉糖酒有限公司,http://www.11467.com/bengbu/co/37467.htm
新疆天龙矿业股份有限公司,http://www.11467.com/changji/co/10468.htm
湖南盛世银安信息有限责任公司,http://www.11467.com/changsha/co/127232.htm
祥云县黄金工业有限责任公司,http://www.11467.com/dali/co/10871.htm
雅宝研磨材（贵州）有限公司,http://www.11467.com/qiandongnan/co/10473.htm
贵州紫金矿业股份有限公司,http://www.11467.com/qianxinan/co/1805.htm
天玺科技有限责任公司,http://www.11467.com/shenzhen/co/783637.htm
新疆富源矿业有限公司,http://www.11467.com/wulumuqi/co/103315.htm
南阳市银河有色金属有限公司,http://www.11467.com/xinyang/co/23893.htm
新疆中核天山铀业有限公司,http://www.11467.com/yili/co/9016.htm
湖南安化湘安钨业有限责任公司,http://www.11467.com/yiyang/co/12956.htm
广西高峰矿业有限责任公司,http://www.11467.com/hechi/co/10318.htm
蒙自矿冶有限责任公司,http://www.11467.com/honghe/co/10899.htm
云南锡业集团有限责任公司,http://www.11467.com/honghe/co/14223.htm
云南铝业股份有限公司,http://www.11467.com/kunming/co/71742.htm
江油核宝纳米材料有限公司,http://www.11467.com/mianyang/co/25245.htm
广西南宁飞拓矿产贸易有限公司,http://www.11467.com/nanning/co/87277.htm
平凉市银和二手房销售有限公司,http://www.11467.com/pingliang/co/10077.htm
庄浪县金龙矿业有限责任公司,http://www.11467.com/pingliang/co/8524.htm
湖南有色金属交易有限公司,http://www.11467.com/changsha/co/203626.htm
郴州博航有色金属经营有限公司,http://www.11467.com/chenzhou/co/40184.htm
涞水县金华隆矿业有限责任公司,http://www.11467.com/baoding/co/50038.htm
腾冲隆腾矿业有限责任公司,http://www.11467.com/baoshan/co/4933.htm
腾冲县贡源锡矿有限公司,http://www.11467.com/baoshan/co/1762.htm
桓仁矿业有限公司,http://www.11467.com/benxi/co/28097.htm
长沙肯德基有限公司银盆岭分店,http://www.11467.com/changsha/co/133422.htm
宁乡银汇通担保有限公司,http://www.11467.com/changsha/co/133295.htm
北票市金海矿业有限公司,http://www.11467.com/chaoyang/co/14931.htm
宽城升金矿业有限公司,http://www.11467.com/chengde/co/15287.htm
成都市锦江区银泰百合融资担保有限公司,http://www.11467.com/chengdu/co/239819.htm
成都智润机电科技有限公司,http://www.11467.com/chengdu/co/50174.htm
郴州市银晟典当有限责任公司,http://www.11467.com/chenzhou/co/23487.htm
宜章金子坪矿业有限公司,http://www.11467.com/chenzhou/co/12208.htm
赤峰柴胡栏子黄金矿业有限公司,http://www.11467.com/chifeng/co/10211.htm
翁牛特旗皇姑屯铅锌矿产有限责任公司,http://www.11467.com/chifeng/co/17378.htm
池州市天灵矿业有限公司,http://www.11467.com/chizhou/co/7392.htm
安徽池州诚兴矿产品有限责任公司,http://www.11467.com/chizhou/co/6334.htm
昆明恒生铜业有限公司禄丰分公司,http://www.11467.com/chuxiong/co/12839.htm
禄丰银鑫实业有限公司,http://www.11467.com/chuxiong/co/12813.htm
滁州铜鑫矿业有限责任公司,http://www.11467.com/chuzhou/co/16695.htm
云南省永平矿业有限责任公司,http://www.11467.com/dali/co/11513.htm
宽甸辽东双林地质矿业有限公司,http://www.11467.com/dandong/co/34212.htm
凤城市广振铅锌矿业有限公司,http://www.11467.com/dandong/co/25112.htm
凤城市黄金（集团）有限公司,http://www.11467.com/dandong/co/43732.htm
丹东永丰矿业有限公司,http://www.11467.com/dandong/co/29568.htm
开迪亚洲北京进出口有限公司,http://www.11467.com/dongguan/co/503269.htm
江西临川鲁金矿业有限公司,http://www.11467.com/fuzhoushi/co/1966.htm
中核抚州金安铀业有限公司,http://www.11467.com/fuzhoushi/co/15403.htm
大余县经纬钨业有限公司,http://www.11467.com/ganzhou/co/24119.htm
大余县忠盛矿业有限公司,http://www.11467.com/ganzhou/co/24251.htm
大余县伟良钨业有限公司,http://www.11467.com/ganzhou/co/24202.htm
大余县宏达矿业有限责任公司,http://www.11467.com/ganzhou/co/24079.htm
中核赣州金瑞铀业有限公司,http://www.11467.com/ganzhou/co/24994.htm
大余县新城钨制品有限责任公司,http://www.11467.com/ganzhou/co/24214.htm
大余县欣荣钨业有限公司,http://www.11467.com/ganzhou/co/24213.htm
大渡河矿业有限责任公司,http://www.11467.com/ganzi/co/3561.htm
丹巴县三强综业有限责任公司,http://www.11467.com/ganzi/co/3969.htm
康定县瑞鑫矿业有限责任公司,http://www.11467.com/ganzi/co/4227.htm
康定县山源矿业有限责任公司,http://www.11467.com/ganzi/co/4232.htm
四川里伍铜业股份有限公司,http://www.11467.com/ganzi/co/3513.htm
山东鲁铜有色金属有限公司,http://www.11467.com/linyi/co/101238.htm
嵩县鎏源矿产品有限公司,http://www.11467.com/luoyang/co/42734.htm
伊犁正元矿业有限责任公司,http://www.11467.com/yili/co/10309.htm
北京佳铭铂业有色金属有限公司,http://www.11467.com/beijing/co/715238.htm
德州恒盛有色金属有限公司,http://www.11467.com/dezhou/co/60020.htm
陕西日月北斗有色金属经营有限公司,http://www.11467.com/xian/co/168238.htm
上海华虎投资集团有色金属有限公司,http://www.11467.com/shanghai/co/1065058.htm
靖江市金泽福金属材料有限公司,http://www.11467.com/qiye/93321267.htm
无锡市明诺有色金属制造有限公司,http://www.11467.com/wuxi/co/249994.htm
深圳市金隆金属材料有限公司,http://www.11467.com/qiye/93146788.htm
山东金洲矿业集团有限公司,http://www.11467.com/yantai/co/76761.htm
凉山矿业股份有限公司,http://www.11467.com/liangshan/co/11269.htm
淄博银轩碳素技术有限公司,http://www.11467.com/zibo/co/102296.htm
兰州银河化学清洗技术有限公司,http://www.11467.com/lanzhou/co/83104.htm
枞阳县井边选矿有限责任公司,http://www.11467.com/anqing/co/18176.htm
海城市菱镁矿产品有限公司,http://www.11467.com/anshan/co/31205.htm
岫岩满族自治县华威矿业有限公司,http://www.11467.com/anshan/co/62171.htm
平果铝业公司,http://www.11467.com/baise/co/6964.htm
广西田林高龙黄金矿业有限责任公司,http://www.11467.com/baise/co/4985.htm
隆林各族自治县黄金工业公司,http://www.11467.com/baise/co/7419.htm
白银红利来科贸有限公司,http://www.11467.com/baiyin/co/6875.htm
白银钱隆典当有限公司,http://www.11467.com/baiyin/co/6665.htm
白银庆祥钢制品有限公司,http://www.11467.com/baiyin/co/6147.htm
华光铅锌矿材有限公司,http://www.11467.com/baoding/co/79535.htm
蚌埠市银辉糖酒有限公司,http://www.11467.com/bengbu/co/37467.htm
新疆天龙矿业股份有限公司,http://www.11467.com/changji/co/10468.htm
湖南盛世银安信息有限责任公司,http://www.11467.com/changsha/co/127232.htm
祥云县黄金工业有限责任公司,http://www.11467.com/dali/co/10871.htm
雅宝研磨材（贵州）有限公司,http://www.11467.com/qiandongnan/co/10473.htm
贵州紫金矿业股份有限公司,http://www.11467.com/qianxinan/co/1805.htm
天玺科技有限责任公司,http://www.11467.com/shenzhen/co/783637.htm
新疆富源矿业有限公司,http://www.11467.com/wulumuqi/co/103315.htm
南阳市银河有色金属有限公司,http://www.11467.com/xinyang/co/23893.htm
新疆中核天山铀业有限公司,http://www.11467.com/yili/co/9016.htm
湖南安化湘安钨业有限责任公司,http://www.11467.com/yiyang/co/12956.htm
广西高峰矿业有限责任公司,http://www.11467.com/hechi/co/10318.htm
蒙自矿冶有限责任公司,http://www.11467.com/honghe/co/10899.htm
云南锡业集团有限责任公司,http://www.11467.com/honghe/co/14223.htm
云南铝业股份有限公司,http://www.11467.com/kunming/co/71742.htm
江油核宝纳米材料有限公司,http://www.11467.com/mianyang/co/25245.htm
广西南宁飞拓矿产贸易有限公司,http://www.11467.com/nanning/co/87277.htm
平凉市银和二手房销售有限公司,http://www.11467.com/pingliang/co/10077.htm
庄浪县金龙矿业有限责任公司,http://www.11467.com/pingliang/co/8524.htm
湖南有色金属交易有限公司,http://www.11467.com/changsha/co/203626.htm
郴州博航有色金属经营有限公司,http://www.11467.com/chenzhou/co/40184.htm
兴安县矿业公司,http://www.11467.com/guilin/co/28406.htm
兴安县银剑矿业有限责任公司,http://www.11467.com/guilin/co/28585.htm
恭城瑶族自治县矿产公司,http://www.11467.com/guilin/co/25581.htm
清镇雄超矿业有限公司,http://www.11467.com/guiyang/co/82898.htm
祁连东铜矿业有限公司,http://www.11467.com/haibei/co/558.htm
德令哈市鸿鑫矿业开发有限责任公司,http://www.11467.com/haixi/co/4383.htm
哈密市长兴矿业有限责任公司,http://www.11467.com/hami/co/3133.htm
哈密市广圣矿业资源开发有限责任公司,http://www.11467.com/hami/co/3245.htm
哈密市佳泰矿产资源开发有限责任公司,http://www.11467.com/hami/co/3359.htm
哈密鑫龙矿业开发有限责任公司,http://www.11467.com/hami/co/2409.htm
邯郸市银海典当有限公司,http://www.11467.com/handan/co/74494.htm
武安市冶金矿山集团凤凰山矿业有限责任公司,http://www.11467.com/handan/co/34411.htm
武安市冶金矿山集团小汪矿业有限责任公司,http://www.11467.com/handan/co/34408.htm
武安市冶金矿山集团淮河沟矿业有限责任公司,http://www.11467.com/handan/co/34426.htm
略阳县兴龙黄金有限责任公司,http://www.11467.com/hanzhong/co/15641.htm
南丹新南星矿冶有限公司,http://www.11467.com/hechi/co/8554.htm
南丹县精诚矿业有限责任公司,http://www.11467.com/hechi/co/8585.htm
南丹县东进矿业有限责任公司,http://www.11467.com/hechi/co/8744.htm
深圳市新晋业实业发展有限公司巴马分公司,http://www.11467.com/hechi/co/9748.htm
巴马瑶族自治县百合矿业有限公司,http://www.11467.com/hechi/co/8146.htm
皖银控股股份有限公司,http://www.11467.com/hefei/co/139397.htm
黑河金泰硅镁冶炼有限公司,http://www.11467.com/heihe/co/15150.htm
湖南水口山有色金属集团有限公司,http://www.11467.com/hengyang/co/24530.htm
河源市华达集团东源古云矿产开采有限公司,http://www.11467.com/heyuan/co/10844.htm
云南金平县红河矿业有限公司,http://www.11467.com/honghe/co/13923.htm
龙兴矿业公司,http://www.11467.com/honghe/co/18187.htm
湖南辰州矿业有限责任公司,http://www.11467.com/huaihua/co/12053.htm
淮南银丰赛格科贸有限公司谢家集分公司,http://www.11467.com/huainan/co/21717.htm
安徽省绩溪钨业有限公司,http://www.11467.com/huangshan/co/9745.htm
阳新县鑫华矿业有限公司,http://www.11467.com/huangshi/co/16045.htm
内蒙古玉金矿业有限责任公司,http://www.11467.com/huhehaote/co/12218.htm
焦作市冶金矿产总公司,http://www.11467.com/jiaozuo/co/3001.htm
吉林市东北亚园林绿化有限责任公司,http://www.11467.com/jilinshi/co/52805.htm
山东黄金矿业股份有限公司,http://www.11467.com/jinan/co/6947.htm
甘肃金昌昌平物资物流有限责任公司,http://www.11467.com/jinchang/co/5255.htm
济宁银座商城有限公司邹城分公司,http://www.11467.com/jining/co/77553.htm
九江县柴桑矿产品经贸有限公司,http://www.11467.com/jiujiang/co/12889.htm
肃北县金马黄金有限责任公司,http://www.11467.com/jiuquan/co/6321.htm
玉门市永德豪矿业有限公司,http://www.11467.com/jiuquan/co/8548.htm
昆明龙祥矿业有限公司,http://www.11467.com/kunming/co/48038.htm
昆明市东川骏明矿业有限责任公司,http://www.11467.com/kunming/co/48068.htm
云南钛金矿业有限公司,http://www.11467.com/kunming/co/36851.htm
昆明全利矿业有限公司,http://www.11467.com/kunming/co/47747.htm
中国有色金属工业华昆工程承包公司,http://www.11467.com/kunming/co/51602.htm
云南铜业（集团）有限公司,http://www.11467.com/kunming/co/75128.htm
甘肃冶金矿产经济技术开发公司,http://www.11467.com/lanzhou/co/10623.htm
乐山市金口河区大白岩矿业开发有限公司,http://www.11467.com/leshan/co/16561.htm
乐山市金口河元宝山矿业有限公司,http://www.11467.com/leshan/co/16682.htm
四川会理大铜有限责任公司,http://www.11467.com/liangshan/co/10791.htm
甘洛县铅锌矿劳动服务公司洗选厂,http://www.11467.com/liangshan/co/8523.htm
会东县江川矿业有限责任公司,http://www.11467.com/liangshan/co/14306.htm
冕宁县飞天实业有限责任公司,http://www.11467.com/liangshan/co/14652.htm
会理县万旺锌业有限责任公司,http://www.11467.com/liangshan/co/14212.htm
会理县洪川桥矿业有限责任公司,http://www.11467.com/liangshan/co/13949.htm
会理县坤鹏矿业有限责任公司,http://www.11467.com/liangshan/co/14002.htm
辽阳县万凯峰矿业有限责任公司,http://www.11467.com/liaoyang/co/18469.htm
霍山县黄金矿业有限责任公司,http://www.11467.com/liuan/co/9456.htm
盘县聚鑫矿业开发有限责任公司,http://www.11467.com/liupanshui/co/9519.htm
武宣县万隆实业有限责任公司,http://www.11467.com/liuzhou/co/28769.htm
广西融水濠景矿业有限公司,http://www.11467.com/liuzhou/co/37383.htm
文县新关黄金开发有限责任公司,http://www.11467.com/longnan/co/7865.htm
武平县三鑫矿业开发有限公司,http://www.11467.com/longyan/co/16874.htm
福建省上杭县裕鑫矿产有限公司,http://www.11467.com/longyan/co/17799.htm
龙岩金闽矿业有限公司,http://www.11467.com/longyan/co/14175.htm
河南金源黄金矿业有限责任公司,http://www.11467.com/luoyang/co/18115.htm
河南嵩县金都矿业有限责任公司,http://www.11467.com/luoyang/co/24698.htm
洛宁华泰矿业开发有限公司,http://www.11467.com/luoyang/co/25682.htm
五华县冶金矿产总公司,http://www.11467.com/meizhou/co/10943.htm
四川省江油市天坤铅锌矿有限公司,http://www.11467.com/mianyang/co/18147.htm
东宁县金厂乡鑫城金矿有限责任公司,http://www.11467.com/mudanjiang/co/17456.htm
广西武鸣康华矿业有限公司,http://www.11467.com/nanning/co/37817.htm
广西上林县三鑫矿业有限责任公司,http://www.11467.com/nanning/co/38186.htm
福建省南平市闽宁钽铌矿业开发有限公司,http://www.11467.com/nanping/co/1253.htm
攀枝花金钛高科技有限责任公司,http://www.11467.com/panzhihua/co/14856.htm
盐边县伟健熔炼有限责任公司,http://www.11467.com/panzhihua/co/15323.htm
攀枝花市盐边县二滩矿产品开发有限责任公司,http://www.11467.com/panzhihua/co/12001.htm
盐边县宏大铜镍有限责任公司,http://www.11467.com/panzhihua/co/15172.htm
攀枝花市千帆铁钛有限责任公司,http://www.11467.com/panzhihua/co/13951.htm
攀枝花市盐边县汇鑫矿产品开发有限责任公司,http://www.11467.com/panzhihua/co/12004.htm
宝丰县永顺铝土有限公司,http://www.11467.com/pingdingshan/co/13174.htm
黄平县兴达矿业有限公司,http://www.11467.com/qiandongnan/co/10028.htm
都匀市双龙泉矿业有限公司,http://www.11467.com/qiannan/co/8240.htm
贵州金兴黄金矿业有限责任公司,http://www.11467.com/qianxinan/co/1298.htm
贵州锦丰矿业有限公司,http://www.11467.com/qianxinan/co/5542.htm
黔西南金龙黄金矿业有限责任公司,http://www.11467.com/qianxinan/co/3005.htm
青龙满族自治县紫金矿业开发有限公司,http://www.11467.com/qinhuangdao/co/15734.htm
福建省尤溪县盛隆矿业有限公司,http://www.11467.com/sanming/co/29471.htm
洛南县景兴金矿有限责任公司,http://www.11467.com/shangluo/co/1343.htm
陕西柞水县国宝矿业开发有限责任公司,http://www.11467.com/shangluo/co/6122.htm
柞水县金正矿业有限公司,http://www.11467.com/shangluo/co/5987.htm
涞水县金华隆矿业有限责任公司,http://www.11467.com/baoding/co/50038.htm
腾冲隆腾矿业有限责任公司,http://www.11467.com/baoshan/co/4933.htm
腾冲县贡源锡矿有限公司,http://www.11467.com/baoshan/co/1762.htm
桓仁矿业有限公司,http://www.11467.com/benxi/co/28097.htm
长沙肯德基有限公司银盆岭分店,http://www.11467.com/changsha/co/133422.htm
宁乡银汇通担保有限公司,http://www.11467.com/changsha/co/133295.htm
北票市金海矿业有限公司,http://www.11467.com/chaoyang/co/14931.htm
宽城升金矿业有限公司,http://www.11467.com/chengde/co/15287.htm
成都市锦江区银泰百合融资担保有限公司,http://www.11467.com/chengdu/co/239819.htm
成都智润机电科技有限公司,http://www.11467.com/chengdu/co/50174.htm
郴州市银晟典当有限责任公司,http://www.11467.com/chenzhou/co/23487.htm
宜章金子坪矿业有限公司,http://www.11467.com/chenzhou/co/12208.htm
赤峰柴胡栏子黄金矿业有限公司,http://www.11467.com/chifeng/co/10211.htm
翁牛特旗皇姑屯铅锌矿产有限责任公司,http://www.11467.com/chifeng/co/17378.htm
池州市天灵矿业有限公司,http://www.11467.com/chizhou/co/7392.htm
安徽池州诚兴矿产品有限责任公司,http://www.11467.com/chizhou/co/6334.htm
昆明恒生铜业有限公司禄丰分公司,http://www.11467.com/chuxiong/co/12839.htm
禄丰银鑫实业有限公司,http://www.11467.com/chuxiong/co/12813.htm
滁州铜鑫矿业有限责任公司,http://www.11467.com/chuzhou/co/16695.htm
云南省永平矿业有限责任公司,http://www.11467.com/dali/co/11513.htm
宽甸辽东双林地质矿业有限公司,http://www.11467.com/dandong/co/34212.htm
凤城市广振铅锌矿业有限公司,http://www.11467.com/dandong/co/25112.htm
凤城市黄金（集团）有限公司,http://www.11467.com/dandong/co/43732.htm
丹东永丰矿业有限公司,http://www.11467.com/dandong/co/29568.htm
开迪亚洲北京进出口有限公司,http://www.11467.com/dongguan/co/503269.htm
江西临川鲁金矿业有限公司,http://www.11467.com/fuzhoushi/co/1966.htm
中核抚州金安铀业有限公司,http://www.11467.com/fuzhoushi/co/15403.htm
大余县经纬钨业有限公司,http://www.11467.com/ganzhou/co/24119.htm
大余县忠盛矿业有限公司,http://www.11467.com/ganzhou/co/24251.htm
大余县伟良钨业有限公司,http://www.11467.com/ganzhou/co/24202.htm
大余县宏达矿业有限责任公司,http://www.11467.com/ganzhou/co/24079.htm
中核赣州金瑞铀业有限公司,http://www.11467.com/ganzhou/co/24994.htm
大余县新城钨制品有限责任公司,http://www.11467.com/ganzhou/co/24214.htm
大余县欣荣钨业有限公司,http://www.11467.com/ganzhou/co/24213.htm
大渡河矿业有限责任公司,http://www.11467.com/ganzi/co/3561.htm
丹巴县三强综业有限责任公司,http://www.11467.com/ganzi/co/3969.htm
康定县瑞鑫矿业有限责任公司,http://www.11467.com/ganzi/co/4227.htm
康定县山源矿业有限责任公司,http://www.11467.com/ganzi/co/4232.htm
四川里伍铜业股份有限公司,http://www.11467.com/ganzi/co/3513.htm
弋阳县恒安实业有限公司,http://www.11467.com/shangrao/co/21281.htm
江西省德兴市花桥金矿有限责任公司,http://www.11467.com/shangrao/co/14421.htm
江西省友丰有色金属开发实业有限公司,http://www.11467.com/shangrao/co/20506.htm
中核韶关金宏铀业有限责任公司,http://www.11467.com/shaoguan/co/4455.htm
韶关石人嶂矿业有限责任公司,http://www.11467.com/shaoguan/co/7019.htm
深圳市中金岭南有色金属股份有限公司凡口铅锌矿,http://www.11467.com/shaoguan/co/7784.htm
石家庄福禄详化工有限公司,http://www.11467.com/shijiazhuang/co/139350.htm
湖北鑫银贵金属股份有限公司,http://www.11467.com/shiyan/co/19840.htm
苏州银荣精密模塑制品有限公司,http://www.11467.com/suzhou/co/345828.htm
托里县辉绿山黄金矿业开发有限公司,http://www.11467.com/tacheng/co/2524.htm
山东润银典当有限责任公司,http://www.11467.com/taian/co/57853.htm
太原市通力高能永磁有限公司,http://www.11467.com/taiyuan/co/57049.htm
迁西县昌合冶金有限责任公司,http://www.11467.com/tangshan/co/41229.htm
张家川回族自治县鑫达矿业开发有限责任公司,http://www.11467.com/tianshui/co/15002.htm
集安市活龙矿业有限责任公司,http://www.11467.com/tonghua/co/18477.htm
梅河口市吉通黄金矿业有限责任公司,http://www.11467.com/tonghua/co/12763.htm
白山市利源矿业有限责任公司,http://www.11467.com/tonghua/co/15065.htm
安徽省铜陵县牛山矿业有限责任公司,http://www.11467.com/tongling/co/11194.htm
鄯善县正恒矿业有限责任公司,http://www.11467.com/tulufan/co/2947.htm
文登炎阳有色金属有限公司,http://www.11467.com/weihai/co/48753.htm
北京星巴克咖啡有限公司威海银座咖啡店,http://www.11467.com/weihai/co/51384.htm
金堆城钼业公司,http://www.11467.com/weinan/co/18588.htm
广南堂上金业有限公司,http://www.11467.com/wenshan/co/4801.htm
麻栗坡县云发矿业有限责任公司,http://www.11467.com/wenshan/co/4040.htm
芜湖飞尚矿业发展有限公司,http://www.11467.com/wuhu/co/14049.htm
苍梧亿丰矿业有限公司,http://www.11467.com/wuzhou/co/9528.htm
陕西龙宇贸易有限公司,http://www.11467.com/xian/co/123125.htm
花垣县海丰矿业有限责任公司,http://www.11467.com/xianxi/co/6491.htm
花垣县汇银有限责任公司,http://www.11467.com/xianxi/co/6515.htm
花垣县德忠有限责任公司,http://www.11467.com/xianxi/co/6465.htm
青海森源矿业开发有限公司,http://www.11467.com/xining/co/14123.htm
青海海鑫矿业有限公司,http://www.11467.com/xining/co/15878.htm
河北万银典当有限公司,http://www.11467.com/xintai/co/53300.htm
息县银兴面业有限公司,http://www.11467.com/xinyang/co/24814.htm
芜湖市连山矿业有限公司,http://www.11467.com/xuancheng/co/15017.htm
宣城华通矿业有限公司,http://www.11467.com/xuancheng/co/12984.htm
吉林海沟黄金矿业有限责任公司,http://www.11467.com/yanbian/co/22513.htm
龙口市大园黄金有限责任公司,http://www.11467.com/yantai/co/64360.htm
龙口市金泰黄金有限公司,http://www.11467.com/yantai/co/65296.htm
山东招金集团有限公司,http://www.11467.com/yantai/co/72379.htm
招金矿业股份有限公司河东金矿,http://www.11467.com/yantai/co/53897.htm
招金矿业股份有限公司夏甸金矿,http://www.11467.com/yantai/co/53905.htm
马尔康锂业技术发展有限责任公司,http://www.11467.com/aba/co/5515.htm
四川省九寨沟县紫金矿业有限公司,http://www.11467.com/aba/co/4051.htm
四川九寨沟马脑壳金矿开发有限责任公司,http://www.11467.com/aba/co/1092.htm
小金县金源矿业有限责任公司,http://www.11467.com/aba/co/5772.htm
汶川三江矿业开发有限责任公司,http://www.11467.com/aba/co/4705.htm
阿勒泰市金鑫铅锌矿业有限责任公司,http://www.11467.com/aletai/co/2857.htm
福海县大洋有限责任公司,http://www.11467.com/aletai/co/3815.htm
福海县矿业有限公司,http://www.11467.com/aletai/co/3889.htm
哈巴河华泰黄金有限责任公司,http://www.11467.com/aletai/co/5691.htm
哈巴河县恰奔矿业有限责任公司,http://www.11467.com/aletai/co/5759.htm
青河县惠源矿业有限责任公司,http://www.11467.com/aletai/co/4175.htm
招金矿业股份有限公司金翅岭金矿,http://www.11467.com/yantai/co/53907.htm
龙口市宏源黄金有限责任公司,http://www.11467.com/yantai/co/64879.htm
中矿金业股份有限公司,http://www.11467.com/yantai/co/72244.htm
远安县小汉口矿业有限公司,http://www.11467.com/yichang/co/25474.htm
伊犁察布查尔县乔拉克矿业有限公司,http://www.11467.com/yili/co/11746.htm
