西华山钨矿大华工艺美术装璜公司,http://www.11467.com/ganzhou/co/4915.htm
大余县三鑫钨业有限公司,http://www.11467.com/ganzhou/co/24176.htm
大余县伟良钨业有限公司原料部,http://www.11467.com/ganzhou/co/24203.htm
大余县祥隆钨业有限公司,http://www.11467.com/ganzhou/co/24212.htm
昆明警坤西南集团总公司施甸分公司,http://www.11467.com/baoshan/co/7510.htm
保山保盈金属硅有限公司,http://www.11467.com/baoshan/co/7186.htm
陇川县正义采矿有限公司,http://www.11467.com/baoshan/co/6558.htm
保山市沙河铜矿物资供销公司,http://www.11467.com/baoshan/co/4210.htm
包头市达茂旗赛乌素黄金矿业有限责任公司,http://www.11467.com/baotou/co/22709.htm
内蒙古阿拉西亚海辰金矿勘查有限公司,http://www.11467.com/bayannaoer/co/2167.htm
内蒙古乌拉特后旗额布图镍矿有限责任公司,http://www.11467.com/bayannaoer/co/2414.htm
若羌县丰基矿业有限责任公司,http://www.11467.com/bayinguoleng/co/9642.htm
若羌县羌东铜矿开发有限责任公司,http://www.11467.com/bayinguoleng/co/4883.htm
和静新盛矿业有限责任公司,http://www.11467.com/bayinguoleng/co/9541.htm
和静县金宇矿业有限责任公司,http://www.11467.com/bayinguoleng/co/9496.htm
四川省南江铁山冶金矿业有限公司,http://www.11467.com/bazhong/co/3389.htm
广西南宁地区外贸五金矿产公司北分公司,http://www.11467.com/beihai/co/2058.htm
合浦县兴盛矿业有限公司,http://www.11467.com/beihai/co/10747.htm
五河县桥南黄金开发有限责任公司,http://www.11467.com/bengbu/co/21452.htm
五河县招金矿业有限公司,http://www.11467.com/bengbu/co/12273.htm
本溪东方矿业有限公司,http://www.11467.com/benxi/co/17863.htm
桓仁铜锌矿劳动服务公司,http://www.11467.com/benxi/co/14941.htm
贵州省毕节地区外贸五金矿产品公司,http://www.11467.com/bijie/co/85.htm
新疆机械化工五金矿产轻工业品进出品公司阿拉山口分公司,http://www.11467.com/boerdala/co/225.htm
沧州银信仓储有限公司,http://www.11467.com/cangzhou/co/62926.htm
河北南皮农村商业银业股份有限公司大浪淀支行,http://www.11467.com/cangzhou/co/64967.htm
肃宁县银桥纸塑分离有限公司,http://www.11467.com/cangzhou/co/66036.htm
成都火山岩科技有限公司丹巴分公司,http://www.11467.com/ganzi/co/4122.htm
丹巴县宝丹矿业有限责任公司,http://www.11467.com/ganzi/co/3943.htm
道孚县润丰矿业有限责任公司,http://www.11467.com/ganzi/co/4016.htm
东丹矿业开发有限责任公司,http://www.11467.com/ganzi/co/3934.htm
甘孜州鹏程矿业有限责任公司,http://www.11467.com/ganzi/co/3685.htm
九龙县闽兴矿业开发有限公司,http://www.11467.com/ganzi/co/3897.htm
九龙县铜铅多金属矿有限公司,http://www.11467.com/ganzi/co/3916.htm
康定县長鑫矿业有限责任公司,http://www.11467.com/ganzi/co/4161.htm
康定县富康矿业有限责任公司,http://www.11467.com/ganzi/co/4172.htm
康定县康马矿业有限责任公司,http://www.11467.com/ganzi/co/4195.htm
康定县联运矿业有限责任公司,http://www.11467.com/ganzi/co/4200.htm
泸定县矿产公司,http://www.11467.com/ganzi/co/3406.htm
四川省甘孜州鑫阳矿业有限公司,http://www.11467.com/ganzi/co/3542.htm
四川省甘孜州紫金矿业有限公司,http://www.11467.com/ganzi/co/3543.htm
四川省康定县兆庆矿业开发有限公司,http://www.11467.com/ganzi/co/3546.htm
旺苍县全金矿产有限责任公司,http://www.11467.com/guangyuan/co/5031.htm
青川县晋磊矿业开发有限责任公司,http://www.11467.com/guangyuan/co/15741.htm
青川佰亨金矿有限责任公司,http://www.11467.com/guangyuan/co/5939.htm
广元市鑫宇镍铂稀散元素有限责任公司,http://www.11467.com/guangyuan/co/12771.htm
广东省五金矿产集团公司展信贸易公司,http://www.11467.com/guangzhou/co/9244.htm
立拓国际矿业投资有限公司,http://www.11467.com/guangzhou/co/477359.htm
灌阳县江东冶金矿产有限责任公司,http://www.11467.com/guilin/co/20631.htm
恭城瑶族自治县矿产公司收购组,http://www.11467.com/guilin/co/25582.htm
恭城瑶族自治县矿产公司回头山铅锌矿,http://www.11467.com/guilin/co/23792.htm
阳朔县兴源铅锌矿有限责任公司,http://www.11467.com/guilin/co/14849.htm
灵川县桂大矿业有限公司,http://www.11467.com/guilin/co/28168.htm
贵阳新业矿产有限公司,http://www.11467.com/guiyang/co/55641.htm
贵州黔铜矿业有限责任公司,http://www.11467.com/guiyang/co/33702.htm
贵州南琦磨料磨具有限公司,http://www.11467.com/guiyang/co/43636.htm
开阳县腾达工农贸易有限公司,http://www.11467.com/guiyang/co/41076.htm
贵阳宏和矿业有限公司,http://www.11467.com/guiyang/co/59381.htm
贵州铝厂第二铝矿工矿实业公司经营部,http://www.11467.com/guiyang/co/38086.htm
宾县瑞丰矿业开发有限公司,http://www.11467.com/haerbin/co/25796.htm
大柴旦盛源矿业开发有限公司,http://www.11467.com/haixi/co/4439.htm
都兰县五龙矿业有限责任公司,http://www.11467.com/haixi/co/3954.htm
都兰县夏日哈隆盛多金属选矿有限责任公司,http://www.11467.com/haixi/co/3955.htm
格尔木金丰矿业发展有限责任公司,http://www.11467.com/haixi/co/3535.htm
格尔木懋源工贸有限责任公司,http://www.11467.com/haixi/co/3644.htm
青海茫崖中兴矿业开发有限责任公司,http://www.11467.com/haixi/co/4068.htm
青海中信国安技术发展有限公司,http://www.11467.com/haixi/co/4294.htm
巴里坤哈萨克自治县昌盛金矿有限公司,http://www.11467.com/hami/co/2358.htm
哈密东源矿业公司,http://www.11467.com/hami/co/3700.htm
哈密市恒鑫矿业开发有限责任公司,http://www.11467.com/hami/co/3275.htm
哈密市聚宝资源开发有限公司,http://www.11467.com/hami/co/2897.htm
哈密市俊业矿业开发有限责任公司,http://www.11467.com/hami/co/2904.htm
哈密市新治矿业有限责任公司,http://www.11467.com/hami/co/2714.htm
哈密市鑫泉矿业开发有限责任公司,http://www.11467.com/hami/co/2724.htm
华北冶金矿山建设公司乐泰密封胶经营部,http://www.11467.com/handan/co/7109.htm
上海华银开关厂有限公司邯郸分公司,http://www.11467.com/handan/co/70562.htm
武安市远银棉花有限公司,http://www.11467.com/handan/co/72363.htm
河北省武安市冶金矿山集团有限公司,http://www.11467.com/handan/co/34428.htm
邯郸市广源冶金矿用机械备件有限公司,http://www.11467.com/handan/co/7084.htm
武安市诚通冶金矿产品有限责任公司,http://www.11467.com/handan/co/34413.htm
武安市冶金矿山集团石板坡矿业有限责任公司,http://www.11467.com/handan/co/34415.htm
邯邢冶金矿山管理局建筑安装工程公司青年商店,http://www.11467.com/handan/co/34427.htm
邯邢冶金矿山管理局动力公司,http://www.11467.com/handan/co/7078.htm
武安市冶金矿山公司矿用设备供应站经销部,http://www.11467.com/handan/co/34406.htm
武安市冶金矿山集团东河湾矿业有限责任公司,http://www.11467.com/handan/co/34384.htm
武安市冶金矿山集团平顶山矿业有限公司,http://www.11467.com/handan/co/34495.htm
邯邢冶金矿山管理局建材经销公司,http://www.11467.com/handan/co/7075.htm
华北冶金矿山建设公司计算机经营部,http://www.11467.com/handan/co/7081.htm
武安市冶金矿山集团团城东矿业有限公司选厂,http://www.11467.com/handan/co/34418.htm
富阳富驰有色金属有限公司,http://www.11467.com/hangzhou/co/378461.htm
富阳中跃有色金属有限公司,http://www.11467.com/hangzhou/co/378200.htm
富阳绿麦有色金属有限公司,http://www.11467.com/hangzhou/co/383864.htm
富阳市古锋有色金属有限公司,http://www.11467.com/hangzhou/co/380977.htm
杭州银盘咖啡有限公司,http://www.11467.com/hangzhou/co/383830.htm
富阳市利源有色金属有限公司,http://www.11467.com/hangzhou/co/383437.htm
富阳市林发有色金属有限公司,http://www.11467.com/hangzhou/co/379395.htm
宁强县黄金矿山公司,http://www.11467.com/hanzhong/co/11668.htm
宁强县金丰矿业有限责任公司,http://www.11467.com/hanzhong/co/14976.htm
陕西汉中长城矿业公司,http://www.11467.com/hanzhong/co/19544.htm
陕西煎茶岭矿业开发有限责任公司略阳分公司,http://www.11467.com/hanzhong/co/15308.htm
陕西省南郑县三鑫矿业开发有限公司,http://www.11467.com/hanzhong/co/19827.htm
宁强县远达矿产品经销有限公司,http://www.11467.com/hanzhong/co/15119.htm
略阳县凌口工贸有限公司,http://www.11467.com/hanzhong/co/15536.htm
陕西宁强县申银矿产品有限责任公司,http://www.11467.com/hanzhong/co/11657.htm
鹤壁泰隆冶金矿山备件有限公司,http://www.11467.com/hebi/co/5031.htm
南丹县光明矿冶有限责任公司,http://www.11467.com/hechi/co/8760.htm
长春市华银伟业试验仪器有限公司,http://www.11467.com/changchun/co/99549.htm
北京银燕空港航空地面服务有限公司长春分公司,http://www.11467.com/changchun/co/101234.htm
桃源县利民资源开发有限责任公司,http://www.11467.com/changde/co/20825.htm
湖南银华顺泰棉业有限公司,http://www.11467.com/changde/co/36266.htm
湖南常德凯旋实业发展公司,http://www.11467.com/changde/co/26795.htm
奇台县双泉黄金开发有限责任公司,http://www.11467.com/changji/co/11762.htm
阜康有色发展有限责任公司,http://www.11467.com/changji/co/10432.htm
长沙银卓镀锌有限公司,http://www.11467.com/changsha/co/135168.htm
长沙聚力白银制品销售有限公司,http://www.11467.com/changsha/co/129717.htm
湖南明银祥石业有限公司,http://www.11467.com/changsha/co/134920.htm
湖南永裕有色金属有限公司,http://www.11467.com/changsha/co/133595.htm
深圳市银溪数码技术有限公司湖南分公司,http://www.11467.com/changsha/co/131262.htm
长沙银麓地毯有限公司,http://www.11467.com/changsha/co/130020.htm
浏阳市宝鑫矿业开发有限公司,http://www.11467.com/changsha/co/69503.htm
湖南中大联合有色金属有限公司,http://www.11467.com/changsha/co/129516.htm
浏阳市中铝经贸发展有限公司,http://www.11467.com/changsha/co/67987.htm
山西银融信仓储服务有限公司,http://www.11467.com/changzhi/co/32009.htm
山西省长治市外贸五金矿产机械公司,http://www.11467.com/changzhi/co/3032.htm
沁源县圣地铝业开发有限公司,http://www.11467.com/changzhi/co/23693.htm
沁源县银源铝矾土经营有限公司,http://www.11467.com/changzhi/co/23734.htm
长治市晋强冶金矿山电力修造有限公司,http://www.11467.com/changzhi/co/3033.htm
铜陵有色金属集团铜冠矿山建设股份有限公司庐江分公司,http://www.11467.com/chaohu/co/21127.htm
安徽省庐江县祥玲矿产品经销有限公司,http://www.11467.com/chaohu/co/12920.htm
凌源金阳实业集团有限公司,http://www.11467.com/chaoyang/co/20388.htm
朝阳县金矿劳动服务公司,http://www.11467.com/chaoyang/co/4978.htm
中国黄金总公司二道沟金矿,http://www.11467.com/chaoyang/co/11512.htm
凌源市金山矿业有限公司,http://www.11467.com/chaoyang/co/19753.htm
北票宏光冶金矿业有限公司朝阳分公司,http://www.11467.com/chaoyang/co/2060.htm
朝阳兴沈冶金矿山物资有限公司,http://www.11467.com/chaoyang/co/6060.htm
中国黄金总公司二道沟金矿招待所,http://www.11467.com/chaoyang/co/11544.htm
承德市冶金矿山工业公司德益楼酒店,http://www.11467.com/chengde/co/4004.htm
河北省平泉县黄金矿业开发公司,http://www.11467.com/chengde/co/11113.htm
罗城仫佬族自治县工矿供销公司,http://www.11467.com/hechi/co/7184.htm
罗城仫佬族自治县天宝实业公司,http://www.11467.com/hechi/co/7380.htm
广西环江毛南族自治县新兴矿业有限责任公司,http://www.11467.com/hechi/co/9949.htm
广西环江毛南族自治县乡镇企业矿业有限责任公司,http://www.11467.com/hechi/co/9948.htm
广西环江志信矿产有限责任公司板坝铅锌矿,http://www.11467.com/hechi/co/3360.htm
罗城仫佬族自治县矿产实业公司,http://www.11467.com/hechi/co/7265.htm
南丹县恒源矿冶有限责任公司,http://www.11467.com/hechi/co/8768.htm
南丹华锡选矿有限公司,http://www.11467.com/hechi/co/8643.htm
广西罗城仫佬族自治县金源有色金属工业总公司四堡锡矿,http://www.11467.com/hechi/co/2610.htm
南丹县新洲锡矿劳动服务公司,http://www.11467.com/hechi/co/1211.htm
广西环江志信矿产有限责任公司,http://www.11467.com/hechi/co/9959.htm
河池地区益兴选矿有限责任公司,http://www.11467.com/hechi/co/9558.htm
广西环江银河有限责任公司,http://www.11467.com/hechi/co/9965.htm
巴马瑶族自治县大地矿业有限公司,http://www.11467.com/hechi/co/8158.htm
巴马县金太利矿业有限责任公司,http://www.11467.com/hechi/co/8129.htm
河池市金大卢实业贸易有限公司,http://www.11467.com/hechi/co/9065.htm
河池地区益兴有限责任公司南丹选矿厂,http://www.11467.com/hechi/co/9559.htm
巴马县钛业开发公司,http://www.11467.com/hechi/co/8134.htm
河池华锡长坡矿业有限责任公司,http://www.11467.com/hechi/co/9583.htm
河池地区有色矿产工贸总公司凤山县公司,http://www.11467.com/hechi/co/9563.htm
河池市源通矿业有限公司巴马赐福钛铁矿厂,http://www.11467.com/hechi/co/8924.htm
广西巴马金盛矿业有限责任公司,http://www.11467.com/hechi/co/8880.htm
广西巴马鑫恒矿业有限公司,http://www.11467.com/hechi/co/8888.htm
巴马瑶族自治县金石实业有限公司,http://www.11467.com/hechi/co/8219.htm
广西巴马鑫泰有限责任公司,http://www.11467.com/hechi/co/8889.htm
凤山县宏益矿业有限责任公司,http://www.11467.com/hechi/co/8381.htm
金城江腾龙锌业开发有限责任公司,http://www.11467.com/hechi/co/9711.htm
广西河池金河矿冶有限公司,http://www.11467.com/hechi/co/10257.htm
凤山县矿业开发公司,http://www.11467.com/hechi/co/8402.htm
广西河池华盛矿业有限公司,http://www.11467.com/hechi/co/10306.htm
河池市秀河有限责任公司,http://www.11467.com/hechi/co/9037.htm
环江锌源矿业有限责任公司,http://www.11467.com/hechi/co/10909.htm
河池市有色工业公司,http://www.11467.com/hechi/co/8919.htm
安徽金红石通信有限公司,http://www.11467.com/hefei/co/8967.htm
安徽荃银超大种业有限公司,http://www.11467.com/hefei/co/138565.htm
安徽易润有色金属有限公司,http://www.11467.com/hefei/co/141492.htm
大兴安岭德胜集团采金公司,http://www.11467.com/hegang/co/7939.htm
黑龙江省多宝山铜矿劳动服务公司,http://www.11467.com/heihe/co/4624.htm
黑龙江省多宝山铜矿经济技术开发公司,http://www.11467.com/heihe/co/4698.htm
衡阳市江东冶金矿山设备制造公司,http://www.11467.com/hengyang/co/9875.htm
衡阳市金恒冶金矿山设备公司,http://www.11467.com/hengyang/co/2750.htm
湖南水口山矿业开发有限责任公司黄金分公司,http://www.11467.com/hengyang/co/24529.htm
常宁市今朝化工有限责任公司,http://www.11467.com/hengyang/co/24451.htm
耒阳银河民间资本交易服务中心有限公司,http://www.11467.com/hengyang/co/31503.htm
平泉县黄金矿业开发公司鑫鑫金店,http://www.11467.com/chengde/co/11128.htm
承德市开发区小寺沟铜矿建筑安装公司,http://www.11467.com/chengde/co/4056.htm
兴隆县安子岭铅锌矿业有限公司,http://www.11467.com/chengde/co/8307.htm
河北峪耳崖金矿综合服务公司,http://www.11467.com/chengde/co/15321.htm
平泉县华云金矿有限责任公司,http://www.11467.com/chengde/co/11099.htm
河北省兴隆县燕山矿业开发有限公司,http://www.11467.com/chengde/co/19738.htm
承德市鹰手营子矿区振兴矿产品有限责任公司,http://www.11467.com/chengde/co/20447.htm
承德鑫鑫矿业有限公司,http://www.11467.com/chengde/co/18656.htm
承德县众权矿业有限公司,http://www.11467.com/chengde/co/18625.htm
承德宽城唐杖子矿业有限责任公司,http://www.11467.com/chengde/co/20829.htm
衡阳市盛源冶金矿山设备有限公司,http://www.11467.com/hengyang/co/9865.htm
水口山矿务局采掘工程公司,http://www.11467.com/hengyang/co/24654.htm
祁东泰扬矿业有限公司,http://www.11467.com/hengyang/co/22652.htm
衡东大鑫有色金属有限公司,http://www.11467.com/hengyang/co/32094.htm
常宁衡鑫矿产有限责任公司,http://www.11467.com/hengyang/co/24336.htm
川口钨矿劳动服务公司,http://www.11467.com/hengyang/co/9008.htm
川口钨矿聚利实业有限公司,http://www.11467.com/hengyang/co/9004.htm
和田县矿产实业有限公司,http://www.11467.com/hetian/co/4209.htm
东源县鑫国矿产资源开发有限公司,http://www.11467.com/heyuan/co/9221.htm
巨野银源果蔬有限公司,http://www.11467.com/heze/co/37954.htm
巨野银源果蔬有限公司,http://www.11467.com/heze/co/37083.htm
山东银香伟业集团有限公司第八牧场分公司,http://www.11467.com/heze/co/35994.htm
广西贺州市明和鑫矿业有限责任公司,http://www.11467.com/hezhou/co/4667.htm
广西昭平县矿产有限公司,http://www.11467.com/hezhou/co/3040.htm
广西钟山泰迪瓷业有限公司,http://www.11467.com/hezhou/co/3362.htm
昭平县黄金公司,http://www.11467.com/hezhou/co/3182.htm
昭平县黄金公司金竹洲金矿,http://www.11467.com/hezhou/co/2652.htm
钟山县荣兴矿业有限公司,http://www.11467.com/hezhou/co/3548.htm
金平远大矿业有限责任公司,http://www.11467.com/honghe/co/14738.htm
金平科祥龙有限责任公司,http://www.11467.com/honghe/co/14551.htm
红河州晟鑫矿产有限责任公司,http://www.11467.com/honghe/co/12733.htm
云南荣丰有色金属矿产品开发有限公司,http://www.11467.com/honghe/co/13978.htm
红河州红源工贸有限公司,http://www.11467.com/honghe/co/12954.htm
红河州四通矿产有限责任公司,http://www.11467.com/honghe/co/12740.htm
个旧市钰源矿产有限责任公司,http://www.11467.com/honghe/co/11204.htm
红河州兴源矿产有限责任公司,http://www.11467.com/honghe/co/12626.htm
个旧云锡矿冶开发公司综合商店,http://www.11467.com/honghe/co/10286.htm
云南省蒙自县三丰工贸有限责任公司,http://www.11467.com/honghe/co/13794.htm
红河州玉华矿业有限公司,http://www.11467.com/honghe/co/12577.htm
红河州甲寅商贸有限公司,http://www.11467.com/honghe/co/12780.htm
云南锡业公司,http://www.11467.com/honghe/co/14193.htm
建水县虾洞冶金矿业有限责任公司,http://www.11467.com/honghe/co/5118.htm
鑫南矿业有限公司,http://www.11467.com/honghe/co/18201.htm
个旧市富祥工贸有限责任公司,http://www.11467.com/honghe/co/12296.htm
个旧市雷云实业有限公司,http://www.11467.com/honghe/co/11265.htm
个旧市利权实业有限责任公司,http://www.11467.com/honghe/co/11276.htm
个旧市云山有色矿产公司,http://www.11467.com/honghe/co/10993.htm
云南锡业公司老厂锡矿俱乐部修理室,http://www.11467.com/honghe/co/9417.htm
元阳县鑫源矿业有限公司,http://www.11467.com/honghe/co/17217.htm
个旧市森源有限责任公司,http://www.11467.com/honghe/co/12312.htm
个旧市志达实业有限责任公司,http://www.11467.com/honghe/co/11035.htm
云南省建水县永玖有限责任公司,http://www.11467.com/honghe/co/15463.htm
个旧云锡矿冶开发公司家用电器修理门市部,http://www.11467.com/honghe/co/9379.htm
怀化市金石新材料有限责任公司,http://www.11467.com/huaihua/co/12008.htm
湖南省麻阳铜矿劳动服务公司,http://www.11467.com/huaihua/co/6241.htm
怀化银龙水务有限公司,http://www.11467.com/huaihua/co/22148.htm
新晃夜郎化工有限责任公司,http://www.11467.com/huaihua/co/13634.htm
安徽华联商厦有限责任公司银鹭万树城小区便利店,http://www.11467.com/huainan/co/21080.htm
红安县冶金矿产物资开发公司,http://www.11467.com/huanggang/co/2702.htm
黄冈市利银矿业有限公司,http://www.11467.com/huanggang/co/14929.htm
蕲春县冶金矿业公司,http://www.11467.com/huanggang/co/7087.htm
祁门县正信矿业有限公司,http://www.11467.com/huangshan/co/12165.htm
大冶市喻家山矿业有限公司,http://www.11467.com/huangshi/co/8913.htm
湖北大冶有色金属公司丰山铜矿,http://www.11467.com/huangshi/co/5579.htm
大冶海昌实业有限责任公司,http://www.11467.com/huangshi/co/10083.htm
大冶市福昌矿产品贸易有限公司,http://www.11467.com/huangshi/co/10145.htm
河北省平泉县鑫洛矿业有限公司,http://www.11467.com/chengde/co/19706.htm
兴隆县垒鑫矿业有限公司,http://www.11467.com/chengde/co/19949.htm
寿王坟铜矿实业开发总公司,http://www.11467.com/chengde/co/5609.htm
北京风险工程贸易总公司丰宁城根营金矿,http://www.11467.com/chengde/co/14553.htm
承德同顺矿产品有限责任公司,http://www.11467.com/chengde/co/18253.htm
承德县银峰矿业有限公司,http://www.11467.com/chengde/co/18606.htm
承德县鑫兴冶金矿业有限公司,http://www.11467.com/chengde/co/6921.htm
滦平县建成冶金矿业有限公司西地物资经销部,http://www.11467.com/chengde/co/12194.htm
中金黄金股份有限公司河北峪耳崖金矿,http://www.11467.com/chengde/co/15304.htm
滦平县建成冶金矿业有限公司,http://www.11467.com/chengde/co/12178.htm
承德县德鑫矿业有限公司,http://www.11467.com/chengde/co/18330.htm
隆化县五金矿产有限责任公司,http://www.11467.com/chengde/co/13339.htm
寿王坟铜矿建筑工程公司,http://www.11467.com/chengde/co/5605.htm
寿王坟铜矿供销公司,http://www.11467.com/chengde/co/5616.htm
福满家集团有限公司承德市双桥区银都海棠园二期便利三十五店,http://www.11467.com/chengde/co/29212.htm
成都深景有色金属有限公司,http://www.11467.com/chengdu/co/217700.htm
成都银唐会务服务有限公司,http://www.11467.com/chengdu/co/238274.htm
四川省互惠商业有限责任公司新津银杏店,http://www.11467.com/chengdu/co/230827.htm
四川省汉源蜀源矿业开发有限责任公司青羊分公司,http://www.11467.com/chengdu/co/75314.htm
成都益家佳超市有限公司银河北街店,http://www.11467.com/chengdu/co/227683.htm
四川世纪银邦非融资性担保有限公司,http://www.11467.com/chengdu/co/220895.htm
大冶市长松矿业有限责任公司,http://www.11467.com/huangshi/co/9583.htm
大冶市佳鑫矿产品贸易有限责任公司,http://www.11467.com/huangshi/co/9881.htm
大冶市康华矿业有限责任公司,http://www.11467.com/huangshi/co/10020.htm
大冶市浩达矿产品贸易有限责任公司,http://www.11467.com/huangshi/co/9739.htm
大冶市鲤泥湖矿业有限公司,http://www.11467.com/huangshi/co/10047.htm
大冶市陈贵镇花香山矿产品贸易有限公司,http://www.11467.com/huangshi/co/9621.htm
大冶市金鹏矿业有限公司,http://www.11467.com/huangshi/co/9961.htm
大冶市灵乡德宁配矿有限责任公司,http://www.11467.com/huangshi/co/10066.htm
大冶市金井矿业有限公司,http://www.11467.com/huangshi/co/9933.htm
阳新县鑫成矿业有限公司,http://www.11467.com/huangshi/co/16044.htm
阳新县中诚矿业有限责任公司,http://www.11467.com/huangshi/co/16089.htm
大冶市三义矿产品有限公司,http://www.11467.com/huangshi/co/9151.htm
大冶市陈贵镇金利选矿有限责任公司,http://www.11467.com/huangshi/co/9624.htm
阳新县李家湾铜矿经营服务公司,http://www.11467.com/huangshi/co/5569.htm
阳新县福源矿业有限公司,http://www.11467.com/huangshi/co/15805.htm
阳新县鹏凌矿业有限责任公司,http://www.11467.com/huangshi/co/15952.htm
大冶有色金属公司铜山口铜矿,http://www.11467.com/huangshi/co/7578.htm
阳新县三江矿业有限责任公司,http://www.11467.com/huangshi/co/15968.htm
大冶有色金属公司丰山铜矿劳动服务公司,http://www.11467.com/huangshi/co/5561.htm
阳新县冶金矿山公司,http://www.11467.com/huangshi/co/5590.htm
浙江台州东景集团阳新矿业有限公司,http://www.11467.com/huangshi/co/11291.htm
大冶有色金属公司新冶铜矿劳动服务公司,http://www.11467.com/huangshi/co/7697.htm
大冶市鑫海物资贸易有限公司,http://www.11467.com/huangshi/co/9379.htm
大冶市大红山矿业有限公司,http://www.11467.com/huangshi/co/9686.htm
大冶有色金属公司丰山铜矿,http://www.11467.com/huangshi/co/5577.htm
黄石潘隆新矿业有限公司,http://www.11467.com/huangshi/co/13697.htm
湖北省冶金矿山公司储运公司,http://www.11467.com/huangshi/co/4118.htm
黄石兴金矿业工程技术咨询有限责任公司,http://www.11467.com/huangshi/co/4122.htm
内蒙古昊金矿产品加工有限公司,http://www.11467.com/huhehaote/co/5854.htm
惠州市东生砂业有限公司,http://www.11467.com/huizhou/co/41201.htm
博罗县冶金矿产公司,http://www.11467.com/huizhou/co/18331.htm
兴城市华光铅锌矿业有限公司,http://www.11467.com/huludao/co/16775.htm
建昌金泰矿业有限责任公司,http://www.11467.com/huludao/co/40720.htm
葫芦岛八家子铅锌矿劳动服务公司工贸分公司,http://www.11467.com/huludao/co/13983.htm
葫芦岛八家子铅锌矿劳动服务公司工会,http://www.11467.com/huludao/co/14031.htm
葫芦岛八家子铅锌矿原料公司,http://www.11467.com/huludao/co/13986.htm
