衢州广润塑粉有限公司,http://www.11467.com/quzhou/co/24604.htm
浙江衢州贝利德涂料有限公司,http://www.11467.com/quzhou/co/24607.htm
深圳市昊雪新材料科技股份有限公司,http://www.11467.com/shenzhen/co/692236.htm
珠海飞扬新材料股份有限公司,http://www.11467.com/shenzhen/co/760781.htm
石家庄鼎新力行科技有限公司,http://www.11467.com/shijiazhuang/co/103660.htm
上海嘉美建材有限公司,http://www.11467.com/taiyuan/co/104603.htm
永州市旺达工业有限公司,http://www.11467.com/yongzhou/co/17184.htm
岳阳市格瑞科技有限公司,http://www.11467.com/yueyang/co/34313.htm
永辉化工回收有限公司,http://www.11467.com/handan/co/55126.htm
河北三瑞化工有限公司,http://www.11467.com/handan/co/55171.htm
北京市蓝宝新技术有限公司,http://www.11467.com/beijing/co/435127.htm
亚太涂料有限公司,http://www.11467.com/ankang/co/13479.htm
康宇（陕西）科技有限公司,http://www.11467.com/ankang/co/13471.htm
安阳星火涂料化工技术有限公司,http://www.11467.com/anyang/co/31588.htm
华庭专业涂装公司,http://www.11467.com/baicheng/co/18651.htm
白城市索田涂料有限公司,http://www.11467.com/baicheng/co/18658.htm
豪玉石建筑防水材料公司,http://www.11467.com/baise/co/12039.htm
百色圣昌彩钢商贸有限公司,http://www.11467.com/baise/co/12035.htm
广西百色市右江区明园基础建材有限公司,http://www.11467.com/baise/co/12037.htm
河北晨阳工贸集团有限公司,http://www.11467.com/baoding/co/79336.htm
包头市三和涂料装饰有限责任公司,http://www.11467.com/baotou/co/27482.htm
包头市利银涂料有限责任公司,http://www.11467.com/baotou/co/26990.htm
宏磊装饰公司,http://www.11467.com/bayannaoer/co/4921.htm
华政建筑装饰公司,http://www.11467.com/bayannaoer/co/4925.htm
内蒙古巴彦淖儿市昆龙装饰有限公司,http://www.11467.com/bayannaoer/co/4924.htm
巴中市新视界化工有限公司,http://www.11467.com/bazhong/co/6863.htm
天缘家具漆公司,http://www.11467.com/bazhong/co/6861.htm
广西北海市启利新材料科技股份有限公司,http://www.11467.com/beihai/co/16014.htm
广西北海市永华涂料有限责任公司,http://www.11467.com/beihai/co/16026.htm
北海鑫华泰建材有限公司,http://www.11467.com/beihai/co/15980.htm
名苑装饰有限公司,http://www.11467.com/beihai/co/16007.htm
广西北海启利新材料有限公司,http://www.11467.com/beihai/co/16015.htm
万兴实业有限公司,http://www.11467.com/tongling/co/12930.htm
天津市泰氟隆科技有限公司,http://www.11467.com/xianyang/co/23300.htm
信阳市晶磊矿产品有限责任公司,http://www.11467.com/xinyang/co/20211.htm
大日精化(上海)贸易有限公司,http://www.11467.com/yanan/co/13063.htm
宜昌索维珥斯科技有限公司,http://www.11467.com/yichang/co/47520.htm
湖南省中政建材有限公司,http://www.11467.com/yongzhou/co/17209.htm
湖南白银新材料有限公司,http://www.11467.com/yueyang/co/34284.htm
肇庆市宏基化工科技有限公司,http://www.11467.com/zhaoqing/co/34060.htm
中山市阿科瑞诗涂料有限公司,http://www.11467.com/zhongshan/co/114525.htm
佛山市顺德区正泽精细化工有限公司,http://www.11467.com/zhongshan/co/112145.htm
珠海市立州涂料有限公司,http://www.11467.com/zhuhai/co/87685.htm
银浪美食策划有限公司,http://www.11467.com/beihai/co/15953.htm
安徽好思家涂料有限公司 策划部,http://www.11467.com/bengbu/co/29676.htm
玻院强强涂料公司,http://www.11467.com/bengbu/co/29694.htm
蚌埠七博士制漆有限公司,http://www.11467.com/bengbu/co/29691.htm
蚌埠市新石缘环保科技有限公司,http://www.11467.com/bengbu/co/29675.htm
凯思达化工有限公司,http://www.11467.com/bengbu/co/29682.htm
蚌埠赛尼迪克艺术涂料有限公司,http://www.11467.com/bengbu/co/29673.htm
锦幻墙艺装饰工程公司,http://www.11467.com/bengbu/co/29672.htm
营口银行股份有限公司,http://www.11467.com/benxi/co/30238.htm
祥坤涂料有限公司,http://www.11467.com/benxi/co/30250.htm
沧州市鑫隆防腐保温材料有限责任公司,http://www.11467.com/cangzhou/co/45215.htm
长春倍诺海涂料有限公司,http://www.11467.com/changchun/co/83227.htm
长春市顺元防腐新材料有限公司,http://www.11467.com/changchun/co/81143.htm
青岛大伟新模具制造有限公司,http://www.11467.com/changde/co/33018.htm
长沙森伟建材科技有限公司,http://www.11467.com/changsha/co/104334.htm
湖南海胜交通工程技术有限公司,http://www.11467.com/changsha/co/99974.htm
湖南本安亚大新材料有限公司,http://www.11467.com/changsha/co/100777.htm
摩马斯特(北京)装饰材料有限公司,http://www.11467.com/chaoyang/co/26467.htm
北京新诺安粉末聚合物有限公司,http://www.11467.com/chaoyang/co/26468.htm
北京鹏程博亚经贸有限公司,http://www.11467.com/chaoyang/co/26469.htm
承德力洁硅藻泥壁材有限公司,http://www.11467.com/chengde/co/23274.htm
通建科瑞商贸有限公司,http://www.11467.com/chengde/co/23268.htm
成都天合宏业科技发展有限公司,http://www.11467.com/chengdu/co/134565.htm
赤峰大唐漆业有限责任公司,http://www.11467.com/chifeng/co/23919.htm
绿园特种玻璃有限责任公司,http://www.11467.com/chizhou/co/9153.htm
池州市义平涂料建材有限公司,http://www.11467.com/chizhou/co/9137.htm
安徽省池州新赛德化工有限公司化工销售部,http://www.11467.com/chizhou/co/9136.htm
崇左市进港矿业有限公司,http://www.11467.com/chongzuo/co/4915.htm
大理金翼建材装饰工程有限公司,http://www.11467.com/dali/co/12638.htm
大庆市美图装饰工程有限公司,http://www.11467.com/daqing/co/42197.htm
大庆通宝公司,http://www.11467.com/daqing/co/42183.htm
大庆市天齐贸易有限公司,http://www.11467.com/daqing/co/42184.htm
大庆市鹏达环保科技有限公司,http://www.11467.com/daqing/co/42171.htm
大庆市东鹏防腐保温材料制造有限公司,http://www.11467.com/daqing/co/42225.htm
黑龙江大庆高新技术开发区大庆中大建筑安装有限公司,http://www.11467.com/daqing/co/42172.htm
大同市南郊区双龙油漆涂料装饰有限公司,http://www.11467.com/datong/co/15691.htm
大同同飞装饰有限公司,http://www.11467.com/datong/co/15690.htm
个体经营理财服务公司,http://www.11467.com/datong/co/15692.htm
狩猎天堂有限责任公司,http://www.11467.com/datong/co/15681.htm
建德市龙华塑化有限公司,http://www.11467.com/datong/co/16201.htm
达州市天恒精品家装饰材有限公司,http://www.11467.com/dazhou/co/17707.htm
成都新虎涂料有限责任公司,http://www.11467.com/deyang/co/32886.htm
四川德阳市欧业涂料装饰公司,http://www.11467.com/deyang/co/32859.htm
瓦格纳化工有限公司,http://www.11467.com/deyang/co/32874.htm
四川奥林涂料工业有限公司,http://www.11467.com/deyang/co/32858.htm
茂名市英达精细化工有限公司,http://www.11467.com/dongguan/co/400081.htm
鄂尔多斯市昌盛宏业房地产开发有限公司,http://www.11467.com/eerduosi/co/9004.htm
鄂尔多斯市鼎豪防水材料有限公司,http://www.11467.com/eerduosi/co/9011.htm
土漆贸易有限公司,http://www.11467.com/enshi/co/12945.htm
金升装饰有限公司,http://www.11467.com/enshi/co/12936.htm
大冶市久泰非金属原料有限责任公司,http://www.11467.com/ezhou/co/12581.htm
广西双虹防水建材有限公司,http://www.11467.com/fangchenggang/co/6789.htm
香港皇朝化工實業有限公司HONG KONG ROY,http://www.11467.com/foshan/co/294381.htm
抚顺森鑫煤炭公司,http://www.11467.com/fushun/co/27547.htm
辽宁奥华科技发展有限公司,http://www.11467.com/fushun/co/27606.htm
抚顺华润涂料有限公司,http://www.11467.com/fushun/co/27559.htm
抚顺市科耐特防腐工程有限公司,http://www.11467.com/fushun/co/27571.htm
辽宁鑫枫涂料有限公司,http://www.11467.com/fuxin/co/16718.htm
伟也油漆有限公司,http://www.11467.com/fuyang/co/27574.htm
香港中元涂料国际集团股份有限公司,http://www.11467.com/fuyang/co/27591.htm
上海美莲金箔公司,http://www.11467.com/fuyang/co/27573.htm
广州市瑜彩贸易有限公司,http://www.11467.com/guangzhou/co/433717.htm
贵港市绚彩色浆涂料贸易公司,http://www.11467.com/guigang/co/6974.htm
贵州熙霖新型材料有限公司,http://www.11467.com/guiyang/co/77221.htm
贵阳广达纳米涂料有限公司,http://www.11467.com/guiyang/co/77218.htm
贵阳云岩锦筑建材有限公司,http://www.11467.com/guiyang/co/77217.htm
陕西裕丰实业有限公司,http://www.11467.com/hanzhong/co/22604.htm
汉中明达涂涂料装饰工程有限公司,http://www.11467.com/hanzhong/co/23031.htm
汉中漆海物资有限公司,http://www.11467.com/hanzhong/co/23025.htm
方圆科技发展有限公司,http://www.11467.com/hebi/co/9867.htm
衡水成林工程橡塑制品有限公司,http://www.11467.com/hengshui/co/25998.htm
山东麟州干果食品公司,http://www.11467.com/heze/co/22964.htm
贺州市民昇粉体有限公司,http://www.11467.com/hezhou/co/5705.htm
幻彩装饰涂料（广州）有限公司,http://www.11467.com/huaibei/co/14057.htm
淮北市承凯贸易有限公司,http://www.11467.com/huaibei/co/14024.htm
淮北昭吉金属材料有限公司,http://www.11467.com/huaibei/co/14062.htm
邮邮有限公司,http://www.11467.com/huaibei/co/14054.htm
松宇液体壁纸怀化分公司,http://www.11467.com/huaihua/co/19827.htm
怀化中富贸易有限公司,http://www.11467.com/huaihua/co/19801.htm
武汉海德国雅涂装工程有限公司怀化分公司,http://www.11467.com/huaihua/co/19816.htm
佳吕地板有限公司,http://www.11467.com/huaihua/co/19803.htm
怀化市美多邦涂料有限公司,http://www.11467.com/huaihua/co/19818.htm
贵族漆业有限公司,http://www.11467.com/huaihua/co/19807.htm
贵族纳米漆业有限公司,http://www.11467.com/huaihua/co/19802.htm
浠水东盛装饰材料有限公司,http://www.11467.com/huanggang/co/16334.htm
安徽阜阳众合建材有限公司,http://www.11467.com/fuyang/co/27578.htm
安徽冠程防水保温工程有限公司,http://www.11467.com/fuyang/co/27566.htm
福建三棵树涂料股份有限公司-阜阳办事处,http://www.11467.com/fuyang/co/27589.htm
江苏大象东亚制漆有限公司抚州地区运营中心,http://www.11467.com/fuzhoushi/co/16896.htm
大象东亚制漆有限公司抚州运营中心,http://www.11467.com/fuzhoushi/co/16897.htm
广元佳巢建筑装饰材料有限公司,http://www.11467.com/guangyuan/co/17025.htm
协合漆业有限公司,http://www.11467.com/guangyuan/co/17011.htm
广州楚烽建筑材料有限公司,http://www.11467.com/guangzhou/co/409867.htm
黄山科诺高分子材料有限公司,http://www.11467.com/huangshan/co/14005.htm
黄山唐龙商贸有限公司,http://www.11467.com/huangshan/co/14007.htm
黄石市安康纳米装饰材料有限公司,http://www.11467.com/huangshi/co/18285.htm
全骏纤维制品有限公司,http://www.11467.com/huangshi/co/18280.htm
黄石博文教育文化咨询有限公司,http://www.11467.com/huangshi/co/18293.htm
鄂州金盾公司黄石汽车调色中心,http://www.11467.com/huangshi/co/18309.htm
武汉民居新型环保材料有限公司,http://www.11467.com/huangshi/co/18319.htm
黄石国征防水高科技有限公司,http://www.11467.com/huangshi/co/18289.htm
龙门县创艺涂料有限公司,http://www.11467.com/huizhou/co/81966.htm
惠州市亚泰塑胶五金制品有限公司,http://www.11467.com/huizhou/co/80529.htm
深圳市精拓生科技有限公司,http://www.11467.com/huizhou/co/80524.htm
惠州市凯辉化工有限公司,http://www.11467.com/huizhou/co/6733.htm
深圳市千色变颜料有限公司,http://www.11467.com/huizhou/co/82014.htm
葫芦岛现代化学公司,http://www.11467.com/huludao/co/44141.htm
葫芦岛现代化学有限公司,http://www.11467.com/huludao/co/44176.htm
葫芦岛预科能源有限公司,http://www.11467.com/huludao/co/44173.htm
香港豪诺涂料（江西）有限公司,http://www.11467.com/jian/co/16723.htm
庐陵化工有限公司,http://www.11467.com/jian/co/16740.htm
江门市华尔嘉涂料有限公司,http://www.11467.com/jiangmen/co/101746.htm
江门市蓝羽墙纸配套用品有限公司,http://www.11467.com/jiangmen/co/101733.htm
江门市新会区天源化工有限公司,http://www.11467.com/jiangmen/co/101748.htm
中山市华石涂料有限公司,http://www.11467.com/jiangmen/co/101751.htm
明新化工贸易有限责任公司,http://www.11467.com/jiayuguan/co/1928.htm
晋城市风雅装饰有限公司,http://www.11467.com/jincheng/co/18232.htm
晋城津典精细化工有限公司,http://www.11467.com/jincheng/co/18231.htm
荆门市鹏源化工有限责任公司,http://www.11467.com/jingmen/co/15659.htm
北京东洋泰中化工有限公司,http://www.11467.com/jingmen/co/15666.htm
湖北省荆州市华宇防水材料有限公司,http://www.11467.com/jingzhou/co/28685.htm
圆方装饰工程公司,http://www.11467.com/jingzhou/co/28734.htm
天宇防水公司,http://www.11467.com/jingzhou/co/28711.htm
湖北省城建五公司,http://www.11467.com/jingzhou/co/28715.htm
佳佳装饰有限公司,http://www.11467.com/jinzhong/co/23134.htm
晋中芳芳涂料产业有限公司,http://www.11467.com/jinzhong/co/23137.htm
保红涂料有限公司,http://www.11467.com/jinzhong/co/23130.htm
山西明亮建筑装饰有限公司,http://www.11467.com/jinzhong/co/4034.htm
大禹涂料防水有限公司,http://www.11467.com/jinzhong/co/23146.htm
酒泉城市人家装饰公司,http://www.11467.com/jiuquan/co/11114.htm
四通装饰公司,http://www.11467.com/jiuquan/co/11111.htm
开封市顺美装饰公司,http://www.11467.com/kaifeng/co/16420.htm
广源科技开发有限公司,http://www.11467.com/kaifeng/co/16383.htm
开封市汇成漆业有限公司,http://www.11467.com/kaifeng/co/16387.htm
河南五一涂料有限公司-资信部,http://www.11467.com/kaifeng/co/16375.htm
开封市汇成公司,http://www.11467.com/kaifeng/co/16386.htm
中国开封天力防腐工程有限公司,http://www.11467.com/kaifeng/co/16401.htm
河南亚泰集团住宅建筑公司,http://www.11467.com/kaifeng/co/16429.htm
来宾江龙木业有限公司,http://www.11467.com/laibin/co/4451.htm
贻会墙艺有限公司,http://www.11467.com/laibin/co/4522.htm
山东省莱芜市鲁班建安公司涂料厂,http://www.11467.com/laiwu/co/9291.htm
山东莱芜市圆达化工有限公司,http://www.11467.com/laiwu/co/9298.htm
潍坊市恒润防水材料有限公司,http://www.11467.com/laiwu/co/9259.htm
河北凯华防火材料有限公司,http://www.11467.com/langfang/co/34973.htm
廊坊市安次区华明塑粉有限公司,http://www.11467.com/langfang/co/34974.htm
兰州赛琪涂料有限公司,http://www.11467.com/lanzhou/co/71854.htm
东城装饰有限公司,http://www.11467.com/leshan/co/20993.htm
山东聊城美利莱化工建材有限公司,http://www.11467.com/liaocheng/co/37742.htm
高键涂料有限公司,http://www.11467.com/liaoyang/co/23544.htm
辽宁省辽阳市石油公司,http://www.11467.com/liaoyang/co/23546.htm
辽阳众泉防火材料制造有限公司,http://www.11467.com/liaoyang/co/23548.htm
临汾市武圣节能装饰工程有限公司,http://www.11467.com/linfen/co/32860.htm
山西奥鑫海纳米涂料有限公司,http://www.11467.com/linfen/co/32888.htm
广东中山三森汉诺威化工涂料有限公司山西管理中心,http://www.11467.com/linfen/co/32886.htm
安徽立佳有限公司,http://www.11467.com/liuan/co/15936.htm
上海巨和化工有限公司,http://www.11467.com/liuan/co/15934.htm
贵州省六盘水市迪诺建材有限公司,http://www.11467.com/liupanshui/co/10278.htm
福建省闽清古灵芝漆业有限公司柳州办事处,http://www.11467.com/liuzhou/co/44009.htm
广东合胜化工实业有限公司驻柳州店,http://www.11467.com/liuzhou/co/44022.htm
香港美多邦涂料（中国-柳州）有限公司,http://www.11467.com/liuzhou/co/44095.htm
广西柳州宇阳防水材料有限公司,http://www.11467.com/liuzhou/co/44100.htm
柳州新颖地坪工程有限公司,http://www.11467.com/liuzhou/co/44088.htm
柳州彼得涂料有限公司,http://www.11467.com/liuzhou/co/44018.htm
福瑞达建材经销公司,http://www.11467.com/longyan/co/23163.htm
龙岩市龙腾商贸有限公司,http://www.11467.com/longyan/co/23113.htm
龙岩市享家涂料有限公司,http://www.11467.com/longyan/co/23171.htm
福建省龙岩市豪迪公司,http://www.11467.com/longyan/co/23110.htm
龙岩市清大纳美涂料有限公司,http://www.11467.com/longyan/co/23169.htm
世纪金源装饰工程有限公司,http://www.11467.com/loudi/co/18513.htm
深圳市国彩纳米建材有限公司湖南办事处,http://www.11467.com/loudi/co/18502.htm
加拿大伊顿涂料（沈阳）有限公司湖南分公司,http://www.11467.com/loudi/co/18508.htm
深圳市国彩纳米建材有限公司娄底办事处,http://www.11467.com/loudi/co/18501.htm
漯河市越大贸易有限公司,http://www.11467.com/luohe/co/18473.htm
漯河市华意防火涂料有限公司,http://www.11467.com/luohe/co/18459.htm
漯河工装公司,http://www.11467.com/luohe/co/18431.htm
河南省漯河市奥德防水保温技术有限公司,http://www.11467.com/luohe/co/18470.htm
来润集团有限公司,http://www.11467.com/luohe/co/18425.htm
华意防火涂料公司,http://www.11467.com/luohe/co/18296.htm
泸州市天马贸易有限公司,http://www.11467.com/luzhou/co/18422.htm
四川莱威化工有限公司,http://www.11467.com/luzhou/co/18323.htm
马鞍山吉成建材有限公司,http://www.11467.com/maanshan/co/21283.htm
马鞍山市广缘商贸有限公司,http://www.11467.com/maanshan/co/21288.htm
马鞍山市康华化工有限公司,http://www.11467.com/maanshan/co/21284.htm
金韩涂料制造有限公司,http://www.11467.com/maanshan/co/21294.htm
雅丽涂料有限公司,http://www.11467.com/maanshan/co/21286.htm
马鞍山市墙艺涂料技术服务有限公司,http://www.11467.com/maanshan/co/21302.htm
安徽中元涂料制造公司,http://www.11467.com/maanshan/co/21293.htm
佛山市东成建材有限公司,http://www.11467.com/maoming/co/33527.htm
茂名市政扬化工有限公司,http://www.11467.com/maoming/co/33385.htm
四川绵阳滋润涂料有限公司,http://www.11467.com/mianyang/co/38086.htm
绵阳市科成建材有限责任公司,http://www.11467.com/mianyang/co/38085.htm
黑龙江省思尔德销售有限公司,http://www.11467.com/mudanjiang/co/49388.htm
四川格瑞化工原料有限公司,http://www.11467.com/nanchong/co/25557.htm
美国杜邦制漆有限公司南充总代理,http://www.11467.com/nanchong/co/25559.htm
广东嘉宝莉化工集团公司,http://www.11467.com/nanchong/co/25563.htm
星星涂料有限公司,http://www.11467.com/nanchong/co/25576.htm
深圳蓝星田科技有限公司南充办事处,http://www.11467.com/nanchong/co/25577.htm
江苏绿源新材料有限公司,http://www.11467.com/nantong/co/86771.htm
内江乐川涂料有限公司,http://www.11467.com/neijiang/co/18869.htm
宁波市江北龙祥化工有限公司,http://www.11467.com/ningbo/co/139267.htm
广州市雅居仕环保科技有限公司,http://www.11467.com/ningde/co/24739.htm
盘锦奥马漆业有限公司市场部,http://www.11467.com/panjin/co/25477.htm
华宸装饰工程有限公司,http://www.11467.com/panjin/co/25470.htm
盘锦斯比瑞涂装有限公司,http://www.11467.com/panjin/co/25488.htm
四川锐达科技发展有限公司,http://www.11467.com/panzhihua/co/16858.htm
攀枝花公路建设有限公司,http://www.11467.com/panzhihua/co/16854.htm
平凉市多力涂料有限责任公司,http://www.11467.com/pingliang/co/9182.htm
维新树脂公司,http://www.11467.com/pingxiang/co/13085.htm
安泰涂料化工有限公司,http://www.11467.com/putian/co/34020.htm
濮阳县和瑞化工有限公司,http://www.11467.com/puyang/co/21267.htm
霸州市奥翔塑粉有限公司,http://www.11467.com/qingdao/co/119411.htm
庆阳市大千涂料有限公司,http://www.11467.com/qingyang/co/10597.htm
庆阳市昌庆建设工程有限公司,http://www.11467.com/qingyang/co/10594.htm
清远市保鸿涂料有限公司,http://www.11467.com/qingyuan/co/24121.htm
金琪化工材料有限公司,http://www.11467.com/qiqihaer/co/59856.htm
齐齐哈尔安顺建筑防水涂料制造有限责任公司,http://www.11467.com/qiqihaer/co/59865.htm
齐齐哈尔正宝涂料有限责任公司,http://www.11467.com/qiqihaer/co/59861.htm
常山县鼎立钙化有限公司,http://www.11467.com/quzhou/co/25162.htm
江山市欣业安装清洗有限公司,http://www.11467.com/quzhou/co/24527.htm
宏方装饰材料公司,http://www.11467.com/quzhou/co/24514.htm
