徐州尊信物资贸易有限公司,http://www.11467.com/xuzhou/co/92188.htm
武汉武立涂料有限公司,http://www.11467.com/wuhan/co/111502.htm
山东新大地实业集团有限公司,http://www.11467.com/jinan/co/147665.htm
上海振华重工（集团）常州油漆有限公司,http://www.11467.com/changzhou/co/173060.htm
内蒙古天第化工有限公司,http://www.11467.com/baotou/co/2540.htm
大余松瀛化工有限公司,http://www.11467.com/ganzhou/co/40405.htm
广东巴德士化工有限公司,http://www.11467.com/zhengzhou/co/143209.htm
凯里市双林矿业有限公司,http://www.11467.com/qiandongnan/co/12544.htm
北京仕全兴涂料有限责任公司,http://www.11467.com/beijing/co/187969.htm
广州市美地化工有限公司,http://www.11467.com/guangzhou/co/397706.htm
河南颂源涂料有限公司,http://www.11467.com/zhengzhou/co/201033.htm
合肥中鼎建材科技有限公司,http://www.11467.com/hefei/co/101586.htm
江门市润立化工实业有限公司,http://www.11467.com/jiangmen/co/114037.htm
湖南湘江涂料集团有限公司,http://www.11467.com/changsha/co/100885.htm
江苏百代节能建材有限公司,http://www.11467.com/taizhoushi/co/34300.htm
广州亮豹涂料科技有限公司,http://www.11467.com/guangzhou/co/571524.htm
天津市双狮涂料有限公司,http://www.11467.com/tianjin/co/196630.htm
武汉家美漆业有限责任公司,http://www.11467.com/wuhan/co/191178.htm
青岛益群漆业集团有限公司,http://www.11467.com/qingdao/co/156008.htm
沈阳柏林派尔科技有限公司,http://www.11467.com/shenyang/co/111048.htm
佛山市南海金伊达冶金材料有限公司,http://www.11467.com/foshan/co/305699.htm
福州金鼎建材有限公司,http://www.11467.com/fuzhou/co/159098.htm
佛山市顺德区合胜化工实业有限公司,http://www.11467.com/foshan/co/293240.htm
佛山市德工化工有限公司,http://www.11467.com/foshan/co/337849.htm
百年达(福建)工贸有限公司,http://www.11467.com/putian/co/48277.htm
陕西京鍠装饰材料有限公司,http://www.11467.com/xian/co/167758.htm
中山市中坡工业地板有限公司,http://www.11467.com/zhongshan/co/187857.htm
湖南樵志建材有限公司,http://www.11467.com/changsha/co/170021.htm
深圳市威尔地坪材料有限公司,http://www.11467.com/shenzhen/co/705251.htm
广州富露华贸易有限公司,http://www.11467.com/guangzhou/co/432247.htm
厦门威亮光学涂层技术有限公司,http://www.11467.com/xiamen/co/76875.htm
江门市苹果化工有限公司,http://www.11467.com/jiangmen/co/38807.htm
安徽泰达新材料股份有限公司,http://www.11467.com/huangshan/co/13163.htm
安徽省明美矿物化工有限公司,http://www.11467.com/chuzhou/co/30367.htm
重庆市品胜涂料有限公司,http://www.11467.com/chongqing/co/88790.htm
新乡市荷涂科技有限公司,http://www.11467.com/xinxiang/co/55688.htm
合肥创大环氧地坪装饰有限公司,http://www.11467.com/hefei/co/143560.htm
天津市津海特种涂料装饰有限公司,http://www.11467.com/tianjin/co/12326.htm
常州万特涂料有限公司,http://www.11467.com/changzhou/co/148891.htm
福州皇家地坪有限公司,http://www.11467.com/fuzhou/co/180821.htm
武汉弗美克建材有限公司,http://www.11467.com/wuhan/co/110458.htm
江门市好运涂料有限公司,http://www.11467.com/jiangmen/co/101183.htm
深圳市康立德高新科技有限公司,http://www.11467.com/shenzhen/co/150746.htm
广东顺德漆强化工科技有限公司,http://www.11467.com/foshan/co/445316.htm
烟台华盛涂料装饰有限公司,http://www.11467.com/yantai/co/132287.htm
长沙湘江涂料经贸公司,http://www.11467.com/changsha/co/118921.htm
东莞市中天胶粘材料有限公司,http://www.11467.com/dongguan/co/77188.htm
江苏朝晖化工有限公司,http://www.11467.com/changzhou/co/152823.htm
中山市弘星塑料粉末有限公司,http://www.11467.com/zhongshan/co/117489.htm
山东省宁津县五湖涂料化工有限公司,http://www.11467.com/dezhou/co/7315.htm
辽宁宝山生态涂料有限公司,http://www.11467.com/yingkou/co/46470.htm
韶关锦威化工有限公司,http://www.11467.com/guangzhou/co/428529.htm
福州神工建材有限公司,http://www.11467.com/fuzhou/co/157984.htm
辽宁啄木鸟漆业发展有限公司,http://www.11467.com/huludao/co/45870.htm
成都新振通商贸有限公司,http://www.11467.com/chengdu/co/214721.htm
沈阳山佳防水卷材有限公司,http://www.11467.com/shenyang/co/77775.htm
武汉兴海环保科技有限公司,http://www.11467.com/wuhan/co/208597.htm
佛山市顺德区数码彩涂料有限公司,http://www.11467.com/foshan/co/282705.htm
山东蓝盟防腐科技股份有限公司,http://www.11467.com/yantai/co/188783.htm
大庆合正化工有限公司,http://www.11467.com/daqing/co/41964.htm
东莞市长佑涂料有限公司,http://www.11467.com/dongguan/co/409611.htm
宁德市星光化工有限公司,http://www.11467.com/ningde/co/24888.htm
宁波诺沃新材料科技有限公司,http://www.11467.com/ningbo/co/205923.htm
扬州双益工业涂装设备有限公司,http://www.11467.com/yangzhou/co/109068.htm
舟山生铭丰贸易有限公司,http://www.11467.com/zhoushan/co/19093.htm
廊坊市大成纺织乳液有限公司,http://www.11467.com/langfang/co/34479.htm
浙江荣泰科技企业有限公司,http://www.11467.com/jiaxing/co/90224.htm
芜湖海帆商贸有限公司,http://www.11467.com/wuhu/co/22154.htm
山东浩博生物材料有限公司,http://www.11467.com/zaozhuang/co/29609.htm
保定亿路达交通设施有限公司,http://www.11467.com/baoding/co/59094.htm
金华市蓝波表面处理科技有限公司,http://www.11467.com/jinhua/co/81939.htm
枣庄市银丝纺织有限公司,http://www.11467.com/zaozhuang/co/29615.htm
佛山市顺德区勒流镇飞扬涂料有限公司,http://www.11467.com/foshan/co/293019.htm
广东中山市福莱特建筑材料有限公司,http://www.11467.com/zhongshan/co/166404.htm
成都捷宇涂料有限公司,http://www.11467.com/chengdu/co/292923.htm
东营市圣赛易装饰工程有限公司,http://www.11467.com/dongying/co/31917.htm
嘉兴市开林化工建材有限公司,http://www.11467.com/jiaxing/co/134965.htm
江门市新会区涂派涂料化工有限公司,http://www.11467.com/jiangmen/co/101745.htm
青岛杜森商贸有限公司,http://www.11467.com/haerbin/co/62375.htm
广州香海生物科技有限公司,http://www.11467.com/guangzhou/co/696973.htm
无锡朗科防护工程有限公司,http://www.11467.com/wuxi/co/274372.htm
宜昌元龙塑模技术开发有限责任公司,http://www.11467.com/yichang/co/43321.htm
江苏镇钛化工有限公司,http://www.11467.com/zhenjiang/co/52831.htm
沈阳爱尚涂料有限公司,http://www.11467.com/shenyang/co/107755.htm
上海永铭化工有限公司,http://www.11467.com/wuhu/co/35295.htm
广东豪得丽化工有限公司,http://www.11467.com/jieyang/co/26736.htm
湖南流派绿色环保涂料有限公司,http://www.11467.com/changsha/co/220449.htm
江苏居安涂料有限公司,http://www.11467.com/lianyungang/co/50335.htm
新乡市佳多邦涂料有限公司,http://www.11467.com/xinxiang/co/30911.htm
常州市一坤建筑材料有限公司,http://www.11467.com/changzhou/co/126376.htm
江门市蓬江区荷塘万利宝工业有限公司,http://www.11467.com/jiangmen/co/101747.htm
内蒙古大风经贸进出口有限责任公司,http://www.11467.com/erlianhaote/co/877.htm
邹平县致才颜料科技有限公司,http://www.11467.com/binzhou/co/34770.htm
新乡市日月防水技术有限公司,http://www.11467.com/xinxiang/co/26133.htm
河南中奥防火材料有限公司,http://www.11467.com/zhengzhou/co/169977.htm
新疆永安消防工程有限公司,http://www.11467.com/wulumuqi/co/105498.htm
湖南容佳新材料技术有限公司,http://www.11467.com/changsha/co/205677.htm
广州广祺展览服务有限公司,http://www.11467.com/guangzhou/co/206036.htm
武汉天龙涂料有限责任公司,http://www.11467.com/wuhan/co/144397.htm
广州市捷润贸易有限公司,http://www.11467.com/guangzhou/co/476224.htm
泰州市海陵区力泰幕墙材料有限公司,http://www.11467.com/taizhoushi/co/34675.htm
福州中美达装饰材料有限公司,http://www.11467.com/fuzhou/co/159108.htm
安平县冠威交通丝网制造有限公司,http://www.11467.com/hengshui/co/36106.htm
杭州连年贸易有限公司,http://www.11467.com/hangzhou/co/303113.htm
厦门市蓬兴达工贸发展有限公司,http://www.11467.com/xiamen/co/76908.htm
黄山沃尔夫化学有限公司,http://www.11467.com/huangshan/co/13139.htm
抚顺东启化工有限公司,http://www.11467.com/fushun/co/25490.htm
临沂市鲁宏工贸有限公司,http://www.11467.com/linyi/co/71945.htm
三棵树涂料股份有限公司,http://www.11467.com/putian/co/25503.htm
衢州市德丰化工有限公司,http://www.11467.com/quzhou/co/24225.htm
石家庄同人伟业科技有限公司,http://www.11467.com/shijiazhuang/co/102320.htm
临沂市财亨物贸有限公司,http://www.11467.com/linyi/co/71984.htm
柳州市聚瑞精细化工有限公司,http://www.11467.com/liuzhou/co/42331.htm
江西贝思特科技有限公司,http://www.11467.com/nanchang/co/98410.htm
深圳市铭升源科技有限公司,http://www.11467.com/shenzhen/co/813313.htm
江门市大自然化工有限公司,http://www.11467.com/jiangmen/co/101156.htm
广州市台实防水补强有限公司,http://www.11467.com/guangzhou/co/413569.htm
威海豪府建材有限公司,http://www.11467.com/weihai/co/35829.htm
杭州法莱利化工涂料有限公司,http://www.11467.com/hangzhou/co/52901.htm
合肥本诺新型建材有限公司,http://www.11467.com/hefei/co/141627.htm
芜湖市多彩饰面材料有限公司,http://www.11467.com/wuhu/co/33069.htm
圣姗姆漆业(厦门)有限公司,http://www.11467.com/xiamen/co/93475.htm
长沙维一化工涂料有限公司西安分公司,http://www.11467.com/xian/co/127972.htm
许昌县兴洋绝缘材料有限公司,http://www.11467.com/xuchang/co/18977.htm
湖北三诚伟业科技发展有限公司,http://www.11467.com/wuhan/co/149676.htm
惠州市长胜实业有限公司,http://www.11467.com/huizhou/co/80239.htm
哈尔滨市瑞峰创展防水材料有限公司,http://www.11467.com/haerbin/co/59166.htm
沭阳县东湖油品有限公司,http://www.11467.com/suqian/co/26834.htm
深圳市强塑科技有限公司,http://www.11467.com/shenzhen/co/700119.htm
南京奥桑涂装工程有限公司,http://www.11467.com/nanjing/co/108205.htm
辽宁蓝水化学品制造有限公司,http://www.11467.com/shenyang/co/81146.htm
深圳市优美涂科技有限公司,http://www.11467.com/shenzhen/co/954003.htm
陕西创胜环保科技有限公司,http://www.11467.com/xian/co/155015.htm
天津市星展粉末涂料有限公司,http://www.11467.com/tianjin/co/218116.htm
哈尔滨景江地坪有限公司,http://www.11467.com/haerbin/co/73348.htm
廊坊市金飞鱼商贸有限公司,http://www.11467.com/langfang/co/65228.htm
惠州佳慧地板有限公司,http://www.11467.com/huizhou/co/113790.htm
佛山市顺德区隆艺德涂料有限公司,http://www.11467.com/foshan/co/406333.htm
常州戴氏化工有限公司,http://www.11467.com/changzhou/co/161294.htm
佛山市顺德区梦伸涂料有限公司,http://www.11467.com/foshan/co/423237.htm
宁波市北仑漆锐涂料有限公司,http://www.11467.com/ningbo/co/205786.htm
天津市外星化工涂料有限公司,http://www.11467.com/tianjin/co/213583.htm
肇庆市皓明有机硅材料有限公司,http://www.11467.com/foshan/co/374315.htm
赛诺化工(上海)有限公司,http://www.11467.com/shanghai/co/1146468.htm
武汉雨晴铁路物资有限公司,http://www.11467.com/wuhan/co/165340.htm
上海房宝建材科技有限公司,http://www.11467.com/shanghai/co/1139475.htm
佛山市顺德区晶宸化工有限公司,http://www.11467.com/foshan/co/385846.htm
济宁卫士宝化工有限公司,http://www.11467.com/jining/co/89771.htm
郑州吉麟工贸有限公司,http://www.11467.com/zhengzhou/co/139965.htm
镇江华夏制漆有限公司,http://www.11467.com/zhenjiang/co/52835.htm
运城市丰源科创化工有限公司,http://www.11467.com/yuncheng/co/25772.htm
上海其泰工业涂料有限公司,http://www.11467.com/shanghai/co/429321.htm
武汉诺曼克建材有限公司,http://www.11467.com/wuhan/co/165256.htm
济南高佳新型建材有限公司,http://www.11467.com/jinan/co/151363.htm
广州坤鹏建材有限公司,http://www.11467.com/guangzhou/co/669507.htm
温州瓯瑞水性涂料有限公司,http://www.11467.com/wenzhou/co/283974.htm
山东亿展科技开发有限公司,http://www.11467.com/jining/co/104901.htm
广东三防漆化工科技有限公司,http://www.11467.com/dongguan/co/558182.htm
潍坊济通地坪工程有限公司,http://www.11467.com/weifang/co/141292.htm
云浮市云安县嘉源粉体有限公司,http://www.11467.com/yunfu/co/29879.htm
中山市大卫化工有限公司,http://www.11467.com/zhongshan/co/154399.htm
连云港经典地坪工程有限公司,http://www.11467.com/lianyungang/co/49592.htm
成都市豪士漆业有限责任公司,http://www.11467.com/chengdu/co/274803.htm
中山市阿里大师化工实业有限公司,http://www.11467.com/zhongshan/co/147139.htm
镇江悦达科技有限公司,http://www.11467.com/zhenjiang/co/53431.htm
中山市澳霸化工有限公司,http://www.11467.com/zhongshan/co/149458.htm
东莞市旭邦化工有限公司,http://www.11467.com/dongguan/co/585993.htm
宜兴市恒伟环保防腐材料有限公司,http://www.11467.com/wuxi/co/254250.htm
晋州富强精细化工有限公司,http://www.11467.com/shijiazhuang/co/181642.htm
深圳市鸿天建材科技有限公司,http://www.11467.com/shenzhen/co/820479.htm
常州新禾地坪科技有限公司,http://www.11467.com/changzhou/co/161291.htm
深圳市大荷科技有限公司,http://www.11467.com/shenzhen/co/954001.htm
河南省德嘉丽科技开发有限公司,http://www.11467.com/zhengzhou/co/90912.htm
郑州易乐科技有限公司,http://www.11467.com/zhengzhou/co/216184.htm
烟台市普源涂料有限公司,http://www.11467.com/yantai/co/155361.htm
中山市三彩化工有限公司,http://www.11467.com/zhongshan/co/150402.htm
北京紫禁城漆业有限公司,http://www.11467.com/beijing/co/626438.htm
凯睿达粉体工程（上海）有限公司,http://www.11467.com/shanghai/co/1051568.htm
廊坊市超群粉末涂料回收有限公司,http://www.11467.com/langfang/co/57583.htm
山东奥辉漆业有限公司,http://www.11467.com/jining/co/107410.htm
广州市奥力泰建材实业有限公司,http://www.11467.com/guangzhou/co/745457.htm
上海彩生色料化学股份有限公司,http://www.11467.com/shanghai/co/1259905.htm
廊坊星尔化工产品销售有限公司,http://www.11467.com/langfang/co/81472.htm
常州本洲涂料有限公司,http://www.11467.com/changzhou/co/171592.htm
山东华犇环保科技有限公司,http://www.11467.com/jining/co/107369.htm
青岛杜美新科技科技有限公司,http://www.11467.com/qingdao/co/188524.htm
广东顺德石头彩涂料有限公司,http://www.11467.com/foshan/co/475744.htm
广州方鼎实业有限公司,http://www.11467.com/shanghai/co/1259840.htm
清远君诚丽装建筑材料有限公司,http://www.11467.com/qingyuan/co/56046.htm
济南立朗商贸有限公司,http://www.11467.com/jinan/co/157045.htm
桂林馨玉装饰材料有限公司,http://www.11467.com/guilin/co/54398.htm
广州瓷添乐装饰材料有限公司,http://www.11467.com/guangzhou/co/693025.htm
徐州乐化油漆有限公司,http://www.11467.com/xuzhou/co/93296.htm
郑州优波科新材料股份有限公司,http://www.11467.com/zhengzhou/co/264065.htm
河北清淇防腐设备有限公司,http://www.11467.com/langfang/co/96064.htm
徐州市乐涂地坪科技有限公司,http://www.11467.com/xuzhou/co/92194.htm
山东慧创科技有限公司,http://www.11467.com/jining/co/106773.htm
郑州康特化工有限公司,http://www.11467.com/zhengzhou/co/225886.htm
东莞耐高温油漆有限公司,http://www.11467.com/dongguan/co/625953.htm
清远楼固环保建材有限公司,http://www.11467.com/qingyuan/co/56014.htm
清远市环睿涂料有限公司,http://www.11467.com/qingyuan/co/56050.htm
广东省江门市涂霸建材实业有限公司,http://www.11467.com/jiangmen/co/165701.htm
石家庄金澳地坪工程有限公司,http://www.11467.com/shijiazhuang/co/252150.htm
上海双利建筑装饰有限公司,http://www.11467.com/shanghai/co/1260533.htm
广东省佛山市顺德石头彩涂料有限公司,http://www.11467.com/foshan/co/473125.htm
成都金弘源科技有限公司,http://www.11467.com/chengdu/co/283615.htm
中山市韵彩装鉓设计工程有限公司,http://www.11467.com/zhongshan/co/217240.htm
西安际创物资有限公司,http://www.11467.com/xian/co/167886.htm
绵阳涅磐商贸有限公司,http://www.11467.com/mianyang/co/53564.htm
江门市箭牌涂料有限公司,http://www.11467.com/jiangmen/co/147363.htm
广东欧诺士油漆有限公司,http://www.11467.com/foshan/co/451599.htm
济南道裕建材有限公司,http://www.11467.com/jinan/co/158901.htm
义乌市威振纳鑫进出口有限公司,http://www.11467.com/shanghai/co/1275015.htm
河南伟之蓝装饰工程有限公司,http://www.11467.com/zhengzhou/co/225348.htm
安阳西北永新油漆涂料公司,http://www.11467.com/anyang/co/44517.htm
米格（浙江）创新科技有限公司,http://www.11467.com/jinhua/co/262912.htm
时太工业科技（上海）有限公司,http://www.11467.com/shanghai/co/1198723.htm
绵阳伏天商贸有限公司,http://www.11467.com/mianyang/co/53548.htm
耐高（青岛）涂料制造有限公司,http://www.11467.com/qingdao/co/188335.htm
江西省玉贝商贸有限公司,http://www.11467.com/nanchang/co/140610.htm
山西腾途基础工程有限公司,http://www.11467.com/taiyuan/co/129573.htm
苏州奥莱鑫建材有限公司,http://www.11467.com/suzhou/co/320148.htm
北京天佐消防产品有限公司,http://www.11467.com/beijing/co/209233.htm
四川合胜林防腐木有限公司,http://www.11467.com/qiye/93191382.htm
山东地平线建筑节能科技有限公司,http://www.11467.com/zaozhuang/co/54759.htm
商丘耐博仕建材有限公司,http://www.11467.com/shangqiu/co/34456.htm
山东双能建材有限公司,http://www.11467.com/linyi/co/33124.htm
济宁卫士宝化工科技有限公司,http://www.11467.com/jining/co/54222.htm
浙江国光生化股份有限公司,http://www.11467.com/quzhou/co/19211.htm
广州市仕展材料有限公司,http://www.11467.com/guangzhou/co/565884.htm
山东鲁兴胶业有限公司,http://www.11467.com/linyi/co/73594.htm
厦门欣信和颜料有限公司,http://www.11467.com/xiamen/co/2238.htm
烟台市三立机械设备有限公司,http://www.11467.com/yantai/co/123715.htm
无锡市太湖防腐材料有限公司,http://www.11467.com/wuxi/co/203345.htm
江门市蓬江区好运涂料有限公司,http://www.11467.com/jiangmen/co/128154.htm
烟台罗麦防锈材料有限公司,http://www.11467.com/yantai/co/114355.htm
苏州瑞阳陶瓷纤维设备有限公司,http://www.11467.com/suzhou/co/320150.htm
南阳市凌宝珠光颜料有限公司,http://www.11467.com/nanyang/co/9585.htm
桂林市罗派涂料有限公司,http://www.11467.com/guilin/co/54383.htm
河北铂润化工科技有限公司,http://www.11467.com/qiye/27569959.htm
长沙鲁班防水科技有限公司,http://www.11467.com/changsha/co/233670.htm
厦门市金玉峰工贸有限公司,http://www.11467.com/xiamen/co/64337.htm
深圳市粤辉煌自动化设备有限公司,http://www.11467.com/shenzhen/co/111842.htm
山东那美新材料有限公司,http://www.11467.com/jinan/co/139635.htm
苏州工业园区健洋科技工程有限公司,http://www.11467.com/suzhou/co/205779.htm
苏州君泰建筑粉末有限公司,http://www.11467.com/suzhou/co/401676.htm
中泰致远(天津)涂料有限公司,http://www.11467.com/tianjin/co/180465.htm
苏州麦奇新型材料有限公司,http://www.11467.com/suzhou/co/265062.htm
宣城喷特普聚氨酯有限公司,http://www.11467.com/xuancheng/co/20711.htm
北京荣力恒业科技有限公司,http://www.11467.com/beijing/co/277705.htm
山东帝高漆业有限公司,http://www.11467.com/linyi/co/94713.htm
深圳市盛田丰科技有限公司,http://www.11467.com/shenzhen/co/586677.htm
郑州大成涂料有限公司,http://www.11467.com/zhengzhou/co/143376.htm
苏州瑞斯特防护包装材料有限公司,http://www.11467.com/suzhou/co/269102.htm
山东信科粉末涂料有限公司,http://www.11467.com/weifang/co/101413.htm
泰州市铁猫涂料有限公司,http://www.11467.com/taizhoushi/co/1665.htm
山东松山防水保温材料有限公司,http://www.11467.com/zibo/co/90470.htm
浙江顺虎德邦涂料有限公司,http://www.11467.com/lishui/co/25914.htm
珠海亮洁环保科技有限公司,http://www.11467.com/zhuhai/co/87641.htm
大城县汇通保温建材有限公司,http://www.11467.com/langfang/co/47615.htm
临汾铁环漆业有限公司,http://www.11467.com/linfen/co/39013.htm
深圳市能驭科技有限公司,http://www.11467.com/shenzhen/co/706069.htm
深圳市创吉建材有限公司,http://www.11467.com/shenzhen/co/479212.htm
石家庄彩奥建材有限公司,http://www.11467.com/shijiazhuang/co/104212.htm
广东顺德嘉乐士涂料有限公司,http://www.11467.com/foshan/co/386139.htm
上海保立佳化工有限公司,http://www.11467.com/shanghai/co/128772.htm
广东优冠生物科技有限公司,http://www.11467.com/guangzhou/co/745254.htm
上海劳安涂料有限公司,http://www.11467.com/shanghai/co/497932.htm
山东联迪漆业有限公司,http://www.11467.com/jining/co/47421.htm
青岛百威制漆有限公司,http://www.11467.com/huangshan/co/14245.htm
江苏群宝涂料有限公司,http://www.11467.com/changzhou/co/148131.htm
广州奥奥化工科技有限公司,http://www.11467.com/guangzhou/co/482368.htm
濮阳市新豫石油化工有限责任公司,http://www.11467.com/puyang/co/21106.htm
佛山市保路威环保材料有限公司,http://www.11467.com/foshan/co/209103.htm
广州市绿菩提装饰有限公司,http://www.11467.com/guangzhou/co/410650.htm
深圳市志邦科技有限公司,http://www.11467.com/zhongshan/co/114673.htm
天津市三鸿专用涂料有限公司,http://www.11467.com/tianjin/co/171706.htm
东莞市金基环保科技有限公司,http://www.11467.com/dongguan/co/460120.htm
山西红冠涂料有限公司,http://www.11467.com/yuncheng/co/30717.htm
佛山市康威涂料实业有限公司,http://www.11467.com/foshan/co/209164.htm
山东那美新材料有限公司,http://www.11467.com/jinan/co/139635.htm
江苏亚邦涂料股份有限公司,http://www.11467.com/changzhou/co/71607.htm
成都飞亚粉漆有限公司,http://www.11467.com/chengdu/co/134836.htm
长沙维一化工涂料有限公司,http://www.11467.com/changsha/co/40247.htm
广州市双纬化工有限公司,http://www.11467.com/guangzhou/co/92564.htm
佛山市南海里水诺信专业涂装有限公司,http://www.11467.com/foshan/co/115003.htm
东莞市彩丽宝涂料有限公司,http://www.11467.com/dongguan/co/556330.htm
佛山市顺德区德龙涂料有限公司,http://www.11467.com/foshan/co/337341.htm
金华市天立宏科技开发有限公司,http://www.11467.com/jinhua/co/82703.htm
新乡宇仁化学有限公司,http://www.11467.com/xinxiang/co/26186.htm
伯爵油漆（中国）有限公司,http://www.11467.com/ningbo/co/143626.htm
常州中浦化工有限公司,http://www.11467.com/changzhou/co/144019.htm
长沙市海岩混凝土外加剂有限公司,http://www.11467.com/changsha/co/54960.htm
佛山市康韵涂料有限公司,http://www.11467.com/foshan/co/343855.htm
东莞市欧仕装饰材料有限公司,http://www.11467.com/dongguan/co/131641.htm
东莞市益典实业有限公司,http://www.11467.com/dongguan/co/487846.htm
安徽西格尔涂料科技有限公司,http://www.11467.com/chuzhou/co/25845.htm
沧州宸宇粉末机箱制造有限公司,http://www.11467.com/cangzhou/co/57644.htm
常州市中天涂料有限公司,http://www.11467.com/changzhou/co/28752.htm
南通市晗泰化工有限公司,http://www.11467.com/nantong/co/18906.htm
青岛海科林电子材料科技有限公司,http://www.11467.com/qingdao/co/152560.htm
福州金日升工贸有限公司,http://www.11467.com/fuzhou/co/148525.htm
福州汉标建材有限公司,http://www.11467.com/fuzhou/co/158984.htm
福州恩键贸易有限公司,http://www.11467.com/fuzhou/co/107173.htm
佛山市丽锦化工染料有限公司,http://www.11467.com/foshan/co/4594.htm
佛山市顺德区伦教顺时丽涂料有限公司,http://www.11467.com/foshan/co/294330.htm
佛山优石丽建筑材料有限公司,http://www.11467.com/foshan/co/224455.htm
上海祥龙虞吉建设发展有限公司,http://www.11467.com/shanghai/co/947896.htm
昆山金凯迪化工有限公司,http://www.11467.com/shanghai/co/1038316.htm
东莞市家美环保涂料有限公司,http://www.11467.com/dongguan/co/164492.htm
上海马士达实业有限公司,http://www.11467.com/shanghai/co/327728.htm
四川祥和涂料有限公司,http://www.11467.com/chengdu/co/135632.htm
馨雅墙艺科技有限公司,http://www.11467.com/linyi/co/77275.htm
江苏金陵特种涂料有限公司直销中心,http://www.11467.com/yangzhou/co/90116.htm
重庆益辉涂料有限公司,http://www.11467.com/chongqing/co/100874.htm
上海沪正纳米科技有限公司（导电、防静电涂料部）,http://www.11467.com/shanghai/co/709030.htm
中釉玻璃陶瓷上色颜料有限公司,http://www.11467.com/dongguan/co/413962.htm
沧州鑫岳钢管防腐有限公司,http://www.11467.com/cangzhou/co/31241.htm
