厦门宏涂工贸有限公司,http://www.11467.com/xiamen/co/79981.htm
厦门美耐施防水保温材料有限公司,http://www.11467.com/xiamen/co/37974.htm
无锡市启泰贸易有限公司,http://www.11467.com/wuxi/co/126236.htm
河北信迪克涂料有限公司,http://www.11467.com/shijiazhuang/co/32624.htm
晋州市天联树脂有限公司,http://www.11467.com/shijiazhuang/co/142533.htm
苏州广得建筑工程有限公司,http://www.11467.com/suzhou/co/344455.htm
昆山宝德商贸有限公司,http://www.11467.com/suzhou/co/265244.htm
苏州海鸿化工有限公司,http://www.11467.com/suzhou/co/292818.htm
张家港市新天港漆业制造有限公司,http://www.11467.com/suzhou/co/131826.htm
张家港市金昌化工有限责任公司,http://www.11467.com/suzhou/co/59507.htm
武汉市鑫海洲工贸有限公司,http://www.11467.com/wuhan/co/117202.htm
武汉川崎电子水泵制造有限公司,http://www.11467.com/wuhan/co/116989.htm
山东东平湖饲料有限公司,http://www.11467.com/taian/co/58968.htm
泰州市海洋涂料有限公司,http://www.11467.com/taizhoushi/co/51758.htm
珠海市香洲三达防水装饰有限公司,http://www.11467.com/zhuhai/co/5065.htm
北京立高立德工程技术有限公司,http://www.11467.com/beijing/co/698351.htm
郑州市程师傅涂料有限公司,http://www.11467.com/zhengzhou/co/178803.htm
中山市富钜电子印刷器材有限公司,http://www.11467.com/zhongshan/co/83640.htm
自贡市三力化工有限公司,http://www.11467.com/zigong/co/21742.htm
珠海经济特区园林花卉有限公司园林工程分公司,http://www.11467.com/zhuhai/co/13175.htm
镇江西格姆墙艺有限公司,http://www.11467.com/zhenjiang/co/51479.htm
镇江星星阻燃剂有限公司,http://www.11467.com/zhenjiang/co/42952.htm
镇江华方墙艺有限公司,http://www.11467.com/zhenjiang/co/47476.htm
镇江市远方表面技术工程有限公司,http://www.11467.com/zhenjiang/co/48576.htm
宜春市宏林科技有限公司,http://www.11467.com/yichun/co/20275.htm
北京皮尔高德汽车涂料技术有限公司,http://www.11467.com/beijing/co/216899.htm
上海匡泰建筑材料科技发展有限公司,http://www.11467.com/shanghai/co/687876.htm
烟台市再生资源总公司,http://www.11467.com/yantai/co/12365.htm
盐城市康泰建筑灌浆技术有限公司,http://www.11467.com/yancheng/co/54643.htm
北京七彩华茂涂装科技有限公司,http://www.11467.com/beijing/co/225040.htm
邢台市传世复合材料有限公司,http://www.11467.com/xintai/co/50846.htm
中山市凌骏涂料有限公司,http://www.11467.com/zhongshan/co/114655.htm
扬州加尔美涂料有限公司,http://www.11467.com/yangzhou/co/82495.htm
河南鼎新防腐耐磨材料有限公司,http://www.11467.com/zhengzhou/co/150107.htm
北京金诺金典建筑材料有限公司,http://www.11467.com/beijing/co/435343.htm
珠海市彩龙塑胶油墨制品有限公司,http://www.11467.com/zhuhai/co/35358.htm
中山市宏扬装饰工程有限公司,http://www.11467.com/zhongshan/co/152930.htm
汉科乐业（北京）建材有限公司,http://www.11467.com/beijing/co/224868.htm
上海开林油漆有限公司,http://www.11467.com/shanghai/co/978414.htm
上海彩地建材有限公司,http://www.11467.com/shanghai/co/317055.htm
上海承益实业有限公司,http://www.11467.com/shanghai/co/52445.htm
郑州燮塔油漆有限公司,http://www.11467.com/zhengzhou/co/57508.htm
徐州市茂源油漆有限公司,http://www.11467.com/xuzhou/co/45312.htm
盐城市恒固新材料科技有限公司,http://www.11467.com/yancheng/co/60815.htm
江苏汇川塑料实业有限公司,http://www.11467.com/yancheng/co/80174.htm
盐城市黄海化工有限公司,http://www.11467.com/yancheng/co/80851.htm
四会市澳思漆业有限公司,http://www.11467.com/zhaoqing/co/39751.htm
宜宾市方越建材有限公司,http://www.11467.com/yibin/co/28673.htm
营口新创涂料科技有限公司,http://www.11467.com/yingkou/co/39926.htm
中山海虹水性涂料有限公司,http://www.11467.com/zhongshan/co/117867.htm
淄博良邦电力科技发展有限公司,http://www.11467.com/zibo/co/79699.htm
上海高霆玻璃材料有限公司,http://www.11467.com/shanghai/co/42421.htm
戈申涂料(上海)有限公司,http://www.11467.com/shanghai/co/1043582.htm
上海龙祥国际贸易有限公司,http://www.11467.com/shanghai/co/1054269.htm
上海冯氏实业有限公司,http://www.11467.com/shanghai/co/1041034.htm
上海开一林防腐涂料有限公司,http://www.11467.com/shanghai/co/219635.htm
天津市澳美化工涂料有限公司,http://www.11467.com/tianjin/co/166230.htm
上海友友涂料有限公司,http://www.11467.com/shanghai/co/329042.htm
上海庄璞化工有限公司,http://www.11467.com/shanghai/co/811341.htm
重庆双天化工有限责任公司,http://www.11467.com/chongqing/co/148560.htm
天津市华颖印刷有限公司,http://www.11467.com/tianjin/co/116559.htm
天津市汇友商贸有限公司,http://www.11467.com/tianjin/co/141707.htm
上海乐昊涂料有限公司,http://www.11467.com/shanghai/co/876651.htm
天津市茂丰橡胶助剂有限公司,http://www.11467.com/tianjin/co/61015.htm
天津市奥尼斯特化工商贸有限公司,http://www.11467.com/tianjin/co/92037.htm
河北蓝雄涂料有限公司,http://www.11467.com/handan/co/76980.htm
广东荔枝树涂料有限公司,http://www.11467.com/foshan/co/361504.htm
宏锦翔实业投资有限公司,http://www.11467.com/dongguan/co/575960.htm
天津福居天丰装饰有限公司,http://www.11467.com/tianjin/co/99932.htm
上海汉中涂料有限公司,http://www.11467.com/shanghai/co/428738.htm
东莞市宝大建筑材料有限公司,http://www.11467.com/dongguan/co/575992.htm
惠州市振美实业有限公司,http://www.11467.com/huizhou/co/99060.htm
重庆市康装涂料有限公司,http://www.11467.com/chongqing/co/204575.htm
天津市美居涂料有限公司,http://www.11467.com/tianjin/co/45572.htm
杭州卓月油漆油墨有限公司,http://www.11467.com/hangzhou/co/391623.htm
武汉科利特涂装技术有限公司,http://www.11467.com/wuhan/co/153746.htm
天津助邦商贸发展有限公司,http://www.11467.com/tianjin/co/91940.htm
上海劲雅贸易有限公司,http://www.11467.com/shanghai/co/329039.htm
上海杰姆赛勒化工有限公司,http://www.11467.com/shanghai/co/536185.htm
上海永铭化工有限公司,http://www.11467.com/shanghai/co/328938.htm
上海亚顿建筑材料有限公司,http://www.11467.com/shanghai/co/896702.htm
河南固彩地坪漆材料有限公司,http://www.11467.com/zhengzhou/co/191847.htm
广东顺德紫嘉化工有限公司,http://www.11467.com/foshan/co/385838.htm
康韵涂料有限公司,http://www.11467.com/foshan/co/361490.htm
上海神诺贸易有限公司,http://www.11467.com/shanghai/co/1038355.htm
天津一远金属材料有限公司,http://www.11467.com/tianjin/co/18806.htm
天津市庆鑫塑料制品有限公司,http://www.11467.com/tianjin/co/116180.htm
天津市新天宇压型板材有限公司,http://www.11467.com/tianjin/co/187641.htm
天津市精达涂料有限公司,http://www.11467.com/tianjin/co/168618.htm
天津世纪永盛科技发展有限公司,http://www.11467.com/tianjin/co/198039.htm
天津渤海望亚涂料有限公司,http://www.11467.com/tianjin/co/168652.htm
上海宇翔贸易有限公司,http://www.11467.com/shanghai/co/52425.htm
上海雅彩涂料有限公司,http://www.11467.com/shanghai/co/832848.htm
上海荣权化工有限公司,http://www.11467.com/shanghai/co/328866.htm
上海贵洋装饰有限公司,http://www.11467.com/shanghai/co/689839.htm
上海锦拓化工有限公司,http://www.11467.com/shanghai/co/810645.htm
广州化工科技有限公司,http://www.11467.com/guangzhou/co/559535.htm
深圳昌鑫达屏蔽材料有限公司,http://www.11467.com/shenzhen/co/864241.htm
沧州嘉胜涂料有限公司,http://www.11467.com/cangzhou/co/80382.htm
福州卡比特地坪材料有限公司,http://www.11467.com/fuzhou/co/203692.htm
东莞尚地涂料科技有限公司,http://www.11467.com/dongguan/co/614552.htm
郑州实创化工产品销售有限公司,http://www.11467.com/zhengzhou/co/203739.htm
廊坊四星防腐材料有限公司,http://www.11467.com/langfang/co/65572.htm
郑州汇皓耐磨材料有限公司,http://www.11467.com/zhengzhou/co/216463.htm
苏州恒仕龙建材有限公司,http://www.11467.com/suzhou/co/365796.htm
广州市惠博化工有限公司,http://www.11467.com/guangzhou/co/512460.htm
宜兴鼎珂陶瓷有限公司,http://www.11467.com/wuxi/co/261130.htm
广饶斯泰普力建材有限公司,http://www.11467.com/dongying/co/48545.htm
济宁宏业化工有限公司,http://www.11467.com/jining/co/91434.htm
德国玛丽涂料实业（广东）有限公司,http://www.11467.com/foshan/co/371405.htm
顺德莱茵绿洲涂料有限公司,http://www.11467.com/foshan/co/361713.htm
深圳市添彩环氧地坪工程有限公司,http://www.11467.com/shenzhen/co/887007.htm
济南倍耐斯新材料科技有限公司,http://www.11467.com/jinan/co/152817.htm
广东东莞市金釉发化工原料有限公司,http://www.11467.com/dongguan/co/614547.htm
东莞金釉发化工原料有限公司,http://www.11467.com/dongguan/co/558450.htm
南京圆祐工程材料有限公司,http://www.11467.com/nanjing/co/168609.htm
温州市洁美装饰地坪有限公司,http://www.11467.com/wenzhou/co/268137.htm
宁波漆锐涂料有限公司,http://www.11467.com/ningbo/co/227419.htm
沈阳天雀建材有限公司,http://www.11467.com/shenyang/co/105354.htm
上海禾禧新型材料有限公司,http://www.11467.com/shanghai/co/1139463.htm
佛山彩孔雀化工有限公司,http://www.11467.com/foshan/co/403153.htm
海虹老人牌油漆（昆山）有限公司,http://www.11467.com/wuhan/co/151021.htm
苏州悦美地坪工程有限公司,http://www.11467.com/suzhou/co/385950.htm
东莞市鸿博纳米材料有限公司,http://www.11467.com/dongguan/co/558205.htm
深圳米晴科技有限公司,http://www.11467.com/shenzhen/co/815172.htm
东莞市德桦化工有限公司,http://www.11467.com/dongguan/co/576045.htm
商水县中意化涂料有限公司,http://www.11467.com/zhoukou/co/27405.htm
上海品奥涂料有限公司武汉分公司,http://www.11467.com/wuhan/co/159814.htm
重庆祥和磷化（涂料）有限公司,http://www.11467.com/chongqing/co/242449.htm
连云港市常青石粉有限公司,http://www.11467.com/lianyungang/co/48453.htm
石家庄合社装饰工程有限公司,http://www.11467.com/shijiazhuang/co/191769.htm
广州西泊夫化工有限公司,http://www.11467.com/guangzhou/co/560348.htm
上海荣拓实业有限公司,http://www.11467.com/shnanhui/co/25698.htm
有行鲨鱼上海科技股份有限公司,http://www.11467.com/shanghai/co/1067253.htm
徐州凝彩建材有限公司,http://www.11467.com/xuzhou/co/87950.htm
美国杜邦制漆集团有限公司,http://www.11467.com/foshan/co/403139.htm
东莞市为易化工科技有限公司,http://www.11467.com/dongguan/co/601202.htm
郑州亿涂化工产品销售有限公司,http://www.11467.com/zhengzhou/co/214407.htm
天津市金釉德涂料有限公司,http://www.11467.com/tianjin/co/304326.htm
东莞尚地环氧树脂地坪漆材料有限公司,http://www.11467.com/dongguan/co/558126.htm
深圳市天昊海科技有限公司,http://www.11467.com/shenzhen/co/886989.htm
武汉百立宏涂装工程有限责任公司,http://www.11467.com/wuhan/co/157146.htm
长沙市美立佳环保科技有限公司,http://www.11467.com/changsha/co/154801.htm
武汉武立大新华建材科技有限公司,http://www.11467.com/wuhan/co/165339.htm
宁波市北仑漆锐有限公司,http://www.11467.com/ningbo/co/230435.htm
维轶建材有限公司,http://www.11467.com/shanghai/co/1144378.htm
佛山市塑博塑料防腐设备有限公司,http://www.11467.com/foshan/co/417258.htm
新乡市华创建材有限公司,http://www.11467.com/xinxiang/co/41847.htm
北京步鑫世纪科技有限公司,http://www.11467.com/beijing/co/762017.htm
深圳市世杰化工有限公司,http://www.11467.com/shenzhen/co/1080355.htm
东莞市景鹏船舶机械有限公司,http://www.11467.com/dongguan/co/614757.htm
廊坊阿意斯壮保温建材有限公司,http://www.11467.com/langfang/co/74637.htm
济宁慧创科贸有限公司,http://www.11467.com/jining/co/106756.htm
河南博浪实业有限公司,http://www.11467.com/zhengzhou/co/225875.htm
广东顺德嘉立斯涂料有限公司,http://www.11467.com/foshan/co/430451.htm
阿赫佐工业防护涂料（上海）有限公司,http://www.11467.com/shanghai/co/1178774.htm
山东金博防腐材料有限公司,http://www.11467.com/dongying/co/57801.htm
北京鸿鹄都喻商贸有限公司,http://www.11467.com/beijing/co/761750.htm
湖南开磷涂装销售有限公司,http://www.11467.com/hengyang/co/47038.htm
阿赫佐工业防护涂料有限公司,http://www.11467.com/shanghai/co/1198452.htm
沧州鑫岳涂料有限公司,http://www.11467.com/cangzhou/co/95257.htm
济宁亿展科技发展有限公司,http://www.11467.com/jining/co/105083.htm
东莞景鹏船舶机械有限公司,http://www.11467.com/dongguan/co/615300.htm
济宁亿展科技有限公司,http://www.11467.com/jining/co/105580.htm
广州德建建材有限公司,http://www.11467.com/guangzhou/co/691679.htm
威海市久高贸易有限公司,http://www.11467.com/weihai/co/61474.htm
衡水天辰建筑装饰工程有限公司,http://www.11467.com/hengshui/co/62526.htm
山东耐迪建筑涂装工程有限公司,http://www.11467.com/weifang/co/173481.htm
深圳华星恒泰环境科技有限公司,http://www.11467.com/shenzhen/co/1070966.htm
中山东意涂料有限公司,http://www.11467.com/zhongshan/co/213058.htm
郑州奥玫斯建材有限公司,http://www.11467.com/zhengzhou/co/222760.htm
广東一丰建材有限公司,http://www.11467.com/dongguan/co/615324.htm
郑州五彩防腐涂料有限公司,http://www.11467.com/zhengzhou/co/220415.htm
苏州金润新材料科技有限公司,http://www.11467.com/suzhou/co/400528.htm
江门市蓬江区宝莹先俊化工有限公司,http://www.11467.com/jiangmen/co/155027.htm
广东嘉佰丽防水涂料有限公司,http://www.11467.com/guangzhou/co/696943.htm
东莞荣协化工材料有限公司,http://www.11467.com/dongguan/co/616498.htm
天盛化学工业有限公司,http://www.11467.com/zhengzhou/co/222847.htm
重庆雅涂涂料有限公司,http://www.11467.com/chongqing/co/289738.htm
江门市锦富百年建材有限公司,http://www.11467.com/jiangmen/co/143619.htm
深圳市志诚志远地坪工程有限公司,http://www.11467.com/shenzhen/co/1007957.htm
广东双赢体育设施有限公司,http://www.11467.com/huizhou/co/151741.htm
莱芜莉宝莱涂料有限公司,http://www.11467.com/laiwu/co/18811.htm
珠海市立鼎化工科技有限公司,http://www.11467.com/zhuhai/co/121921.htm
长春瑞特粉体材料有限公司,http://www.11467.com/changchun/co/110746.htm
济宁市卫士宝化工科技有限公司,http://www.11467.com/jining/co/104940.htm
陕西飞跃石油化工发展有限公司涂料事业部,http://www.11467.com/xian/co/154904.htm
沈阳饰璧涂料科技有限公司,http://www.11467.com/shenyang/co/107389.htm
成都佳朋物资有限公司,http://www.11467.com/chengdu/co/283340.htm
佛山市漆宝化工有限公司,http://www.11467.com/foshan/co/445361.htm
石家庄防腐涂料有限公司,http://www.11467.com/shijiazhuang/co/227574.htm
佛山市顺德区帝卡斯建材有限公司,http://www.11467.com/foshan/co/451618.htm
天津步鑫建材有限公司,http://www.11467.com/tianjin/co/237510.htm
奥莱鑫科技股份有限公司,http://www.11467.com/qiye/93199568.htm
济南涂特化工有限公司,http://www.11467.com/qiye/93364032.htm
北京蓝色利文科技有限公司,http://www.11467.com/beijing/co/435375.htm
武汉钊旭化工涂料有限公司,http://www.11467.com/wuhan/co/117141.htm
常州市南电线缆有限公司,http://www.11467.com/changzhou/co/112317.htm
淄博海莱经贸有限公司,http://www.11467.com/guangzhou/co/142344.htm
杭州永星五交化有限公司,http://www.11467.com/hangzhou/co/169252.htm
大连天保劳动防护用品有限公司,http://www.11467.com/dalian/co/42677.htm
佛山市南海澳神涂料有限公司,http://www.11467.com/foshan/co/209065.htm
广州格士鸿贸易有限公司,http://www.11467.com/guangzhou/co/296079.htm
无锡柯维尔涂装工程有限公司,http://www.11467.com/wuxi/co/213604.htm
东莞市佳睿机械设备有限公司,http://www.11467.com/dongguan/co/523398.htm
广州真智好贸易有限公司,http://www.11467.com/guangzhou/co/455713.htm
无锡安迪斯地坪材料有限公司,http://www.11467.com/qiye/93210861.htm
佛山市三水大唐树脂有限公司,http://www.11467.com/foshan/co/355799.htm
佛山市鲸鲨化工有限公司,http://www.11467.com/foshan/co/338387.htm
广州市纬宸化工有限公司,http://www.11467.com/guangzhou/co/400051.htm
广州市慧欣贸易有限公司,http://www.11467.com/guangzhou/co/396033.htm
东莞市林之叶防水材料有限公司,http://www.11467.com/dongguan/co/379378.htm
廊坊万汇通涂料有限公司,http://www.11467.com/langfang/co/35960.htm
常州市永光物资有限公司,http://www.11467.com/changzhou/co/55775.htm
万磊建筑涂料有限公司,http://www.11467.com/foshan/co/299731.htm
杭州富阳方士装饰材料有限公司,http://www.11467.com/hangzhou/co/324469.htm
大连锦隆化工有限公司,http://www.11467.com/dalian/co/28910.htm
常州圣安涂料有限公司,http://www.11467.com/changzhou/co/28945.htm
广州市捷富亚油漆有限公司,http://www.11467.com/guangzhou/co/432349.htm
佛山市顺德区宏燕建材有限公司,http://www.11467.com/foshan/co/262821.htm
广州市德班化工科技有限公司,http://www.11467.com/guangzhou/co/103891.htm
佛山市威仕利通用纳米化工有限公司,http://www.11467.com/foshan/co/341554.htm
抚顺北源精细化工有限公司,http://www.11467.com/fushun/co/27190.htm
福州益博金建材有限公司,http://www.11467.com/fuzhou/co/160531.htm
佛山市顺德区博宜防腐涂料科技有限公司,http://www.11467.com/foshan/co/323987.htm
东莞市千虹五金制品有限公司,http://www.11467.com/dongguan/co/189381.htm
佛山市鲸鲨美克地坪涂料有限公司,http://www.11467.com/foshan/co/294407.htm
中山市老人头涂料有限公司,http://www.11467.com/zhongshan/co/42446.htm
杭州化工原料有限公司,http://www.11467.com/hangzhou/co/10748.htm
广州市溢威涂料有限公司,http://www.11467.com/guangzhou/co/455440.htm
山东省聊城市新雅涂料有限公司,http://www.11467.com/liaocheng/co/16959.htm
广州兰林装饰材料有限公司,http://www.11467.com/guangzhou/co/238663.htm
东莞市大翔涂料有限公司,http://www.11467.com/dongguan/co/118115.htm
江苏悦华高空维修防腐有限公司,http://www.11467.com/yancheng/co/57742.htm
东莞中诺质检仪器设备有限公司,http://www.11467.com/dongguan/co/493392.htm
武汉鑫兴化工有限公司,http://www.11467.com/wuhan/co/109675.htm
河北兴发制漆有限公司,http://www.11467.com/tianjin/co/164950.htm
广东琪粤化工有限公司,http://www.11467.com/zhaoqing/co/34405.htm
河北翔源防腐材料有限公司,http://www.11467.com/qiye/93169706.htm
东莞市世名体育设施有限公司,http://www.11467.com/qiye/93316436.htm
山东海纳工业涂料有限公司,http://www.11467.com/qiye/93113125.htm
廊坊佳辰防腐材料有限公司,http://www.11467.com/langfang/co/107213.htm
江西碧枫环保建材科技有限公司,http://www.11467.com/shangrao/co/46617.htm
广东铂英特新型材料有限公司,http://www.11467.com/qiye/93314865.htm
沈阳金宇鑫涂料有限公司,http://www.11467.com/shenyang/co/63648.htm
天津市力士成化工涂料有限公司,http://www.11467.com/tianjin/co/17993.htm
天津市兴发工贸有限公司,http://www.11467.com/tianjin/co/60347.htm
长沙市恒广地坪涂料有限公司,http://www.11467.com/changsha/co/201146.htm
河北廊坊荣威防腐材料有限公司,http://www.11467.com/langfang/co/99547.htm
天津市东塔涂料有限公司,http://www.11467.com/tianjin/co/9980.htm
河南孚太建材有限公司,http://www.11467.com/qiye/93084173.htm
陕西方洲防腐科技有限公司,http://www.11467.com/xian/co/177594.htm
东莞市晖航体育设施工程有限公司,http://www.11467.com/qiye/93419481.htm
廊坊市正亚环保科技有限公司,http://www.11467.com/qiye/93213176.htm
杭州臣禾贸易有限公司,http://www.11467.com/hangzhou/co/112807.htm
佛山市顺德区阿士丹涂饰工程有限公司,http://www.11467.com/foshan/co/457262.htm
重庆隆成化工有限公司,http://www.11467.com/guiyang/co/90758.htm
昆山合元利机械设备有限公司,http://www.11467.com/qiye/93320191.htm
杜比克化工有限公司,http://www.11467.com/jiangmen/co/116825.htm
山东济宁赛德丽漆业集团有限公司,http://www.11467.com/jining/co/87180.htm
汕头市阳帆塑粉有限公司,http://www.11467.com/shantou/co/161043.htm
佛山市三贝涂料有限公司,http://www.11467.com/qiye/26634511.htm
徐州青年阳光漆业有限公司,http://www.11467.com/xuzhou/co/91970.htm
安徽禹耀地坪工程有限公司,http://www.11467.com/hefei/co/164817.htm
广西南宁正祥涂料有限公司,http://www.11467.com/nanning/co/98068.htm
温州联胜防腐阀门有限公司,http://www.11467.com/wenzhou/co/282985.htm
广东润立新材科技有限公司,http://www.11467.com/qiye/93312969.htm
河北赫威防腐材料有限公司,http://www.11467.com/qiye/93173885.htm
晋州市鸿苑纤维素有限公司,http://www.11467.com/qiye/93203811.htm
广州莱德易建材有限公司,http://www.11467.com/qiye/93115588.htm
宁波市鄞州恒昌化工建材有限公司,http://www.11467.com/ningbo/co/230712.htm
天津胜茂硅藻科技有限公司,http://www.11467.com/tianjin/co/279191.htm
深圳市赛亚工程有限公司,http://www.11467.com/shenzhen/co/1136128.htm
杭州肖巢贸易有限公司,http://www.11467.com/hangzhou/co/303160.htm
杭州日月涂料有限公司,http://www.11467.com/hangzhou/co/52579.htm
江苏纳科科技有限公司,http://www.11467.com/huaian/co/40234.htm
湖南康瑞涂料科技有限公司,http://www.11467.com/huaihua/co/19814.htm
惠州市长润发涂料有限公司,http://www.11467.com/huizhou/co/80186.htm
星皇亚太企业(博罗)化工有限公司,http://www.11467.com/huizhou/co/97234.htm
长春化工（江苏）有限公司,http://www.11467.com/changchun/co/83200.htm
北京碧海舟腐蚀防护工业股份有限公司,http://www.11467.com/chaoyang/co/26466.htm
江西龙正科技发展有限公司,http://www.11467.com/ganzhou/co/29343.htm
西安智泽化工科技有限公司,http://www.11467.com/xian/co/87661.htm
河南一方建材有限公司,http://www.11467.com/zhengzhou/co/140085.htm
镇江市凯尔建材科技开发有限公司,http://www.11467.com/zhenjiang/co/53418.htm
西安汇乙创业投资有限公司,http://www.11467.com/ankang/co/13481.htm
沧州市德昌保温涂料工程有限公司,http://www.11467.com/cangzhou/co/45079.htm
滁州市凤凰自动控制器有限公司,http://www.11467.com/chuzhou/co/17341.htm
大连三达奥克化学有限公司大庆公司,http://www.11467.com/daqing/co/42208.htm
山西大同电力公司,http://www.11467.com/datong/co/15693.htm
胜利油田方圆防腐材料有限公司,http://www.11467.com/dongying/co/31326.htm
湖北来斯化工新材料有限公司,http://www.11467.com/ezhou/co/12343.htm
抚顺市海丰化工有限公司,http://www.11467.com/fushun/co/27608.htm
福州龙朋涂料有限公司,http://www.11467.com/fuzhou/co/158754.htm
上海威德沃涂料有限公司,http://www.11467.com/guilin/co/46773.htm
采奕装饰工程有限责任公司,http://www.11467.com/hanzhong/co/23011.htm
美国杜邦漆(中国)涂料有限公司(广西地区),http://www.11467.com/hechi/co/11680.htm
安徽威耐得新型建材有限公司,http://www.11467.com/hefei/co/101379.htm
淮北市乾元工贸有限责任公司,http://www.11467.com/huaibei/co/14023.htm
内蒙古五一油漆有限公司,http://www.11467.com/huhehaote/co/28967.htm
葫芦岛市恒通特种漆有限公司,http://www.11467.com/huludao/co/44156.htm
江门市皇宙化工有限公司,http://www.11467.com/jiangmen/co/101020.htm
江门市天皓化工涂料有限公司,http://www.11467.com/jiangmen/co/101744.htm
河南科来福化工有限公司,http://www.11467.com/kaifeng/co/16440.htm
临汾市皇甫涂料有限公司,http://www.11467.com/linfen/co/32897.htm
临沂市金沂蒙生物科技有限公司,http://www.11467.com/linyi/co/71926.htm
丽水市金太阳贸易有限公司,http://www.11467.com/lishui/co/25934.htm
丽水市金太阳贸易有限公司,http://www.11467.com/lishui/co/25935.htm
柳州百韧特先进材料有限公司,http://www.11467.com/liuzhou/co/44048.htm
马鞍山市金韩涂料制造有限公司,http://www.11467.com/maanshan/co/21313.htm
安徽飞达消防设备工程有限公司马鞍山分公司,http://www.11467.com/maanshan/co/21562.htm
安徽意尔涂料制造有限公司,http://www.11467.com/maanshan/co/21289.htm
眉山市富辰化工油漆有限公司,http://www.11467.com/meishan/co/14500.htm
江苏博思源节能科技有限公司,http://www.11467.com/nantong/co/112467.htm
盘锦禹帝新型防水材料有限公司,http://www.11467.com/panjin/co/25501.htm
濮阳惠成化工有限公司,http://www.11467.com/puyang/co/19919.htm
濮阳惠成电子材料股份有限公司,http://www.11467.com/puyang/co/24115.htm
汇康荧光科技(清远)有限公司,http://www.11467.com/qingyuan/co/28672.htm
福建嘉豪化工有限公司,http://www.11467.com/quanzhou/co/112463.htm
