昆山永虹商贸有限公司,http://www.11467.com/suzhou/co/270209.htm
富阳赛弗交通设施有限公司,http://www.11467.com/hangzhou/co/373618.htm
佛山市顺德区力科化工有限公司,http://www.11467.com/foshan/co/281841.htm
彩星涂料有限公司,http://www.11467.com/handan/co/55165.htm
江门市亚国建筑涂料有限公司,http://www.11467.com/jiangmen/co/103132.htm
扬州长三角涂料涂装工程有限公司,http://www.11467.com/yangzhou/co/88853.htm
苏州市威智利三防漆有限公司,http://www.11467.com/suzhou/co/271229.htm
四川祥和涂料有限公司,http://www.11467.com/chengdu/co/211680.htm
广州市锦钢建材制品有限公司,http://www.11467.com/zhongshan/co/114768.htm
福建虹侨防水有限公司,http://www.11467.com/fuzhou/co/161783.htm
郑州华为防水材料有限公司,http://www.11467.com/zhengzhou/co/170237.htm
重庆耘森地坪工程公司,http://www.11467.com/chongqing/co/81012.htm
东莞市鹏展地板有限公司,http://www.11467.com/dongguan/co/401433.htm
金成手板工艺材料公司,http://www.11467.com/huizhou/co/97250.htm
重庆科冠涂料有限公司,http://www.11467.com/chongqing/co/204279.htm
深圳市拓航金属科技有限公司,http://www.11467.com/shenzhen/co/729831.htm
重庆祥和涂料磷化有限公司,http://www.11467.com/chongqing/co/81036.htm
佛山市避水通新型建筑材料有限公司,http://www.11467.com/foshan/co/294067.htm
惠州市恒光机电工程有限公司,http://www.11467.com/huizhou/co/57864.htm
珠海鳄鱼涂料有限公司温州总代理,http://www.11467.com/wenzhou/co/169724.htm
福州金牌建材有限公司梦幻可彩营销部,http://www.11467.com/fuzhou/co/161880.htm
广东省佛山市顺德区乐泰化工有限公司,http://www.11467.com/foshan/co/337319.htm
无锡奥科涂装工程有限公司,http://www.11467.com/wuxi/co/140373.htm
西安秦平电力科技发展有限公司,http://www.11467.com/xian/co/95990.htm
北京市蓝宝新技术有限责任研发公司,http://www.11467.com/beijing/co/439576.htm
佛山市瀚邦涂料科技有限公司,http://www.11467.com/foshan/co/225598.htm
宁波汇金漆业有限公司,http://www.11467.com/ningbo/co/139631.htm
特力材料科技（上海）有限公司,http://www.11467.com/shanghai/co/811514.htm
天中热熔胶有限公司,http://www.11467.com/foshan/co/347700.htm
中山市超前金属颜料有限公司,http://www.11467.com/zhongshan/co/118897.htm
天津裕华华丽商贸有限公司,http://www.11467.com/tianjin/co/77134.htm
南京雅佳乐涂料有限公司,http://www.11467.com/nanjing/co/104938.htm
成都大中三联油漆销售有限公司,http://www.11467.com/chengdu/co/142354.htm
南京兴联防腐保温材料有限公司,http://www.11467.com/nanjing/co/115127.htm
广州市捷富亚油漆有限公司,http://www.11467.com/guangzhou/co/432349.htm
鸿运化工有限公司,http://www.11467.com/handan/co/54988.htm
科标化工分析检测有限公司,http://www.11467.com/qingdao/co/124602.htm
青岛东蒙化工有限公司,http://www.11467.com/qingdao/co/124659.htm
成都金富祥建筑工程有限公司,http://www.11467.com/chengdu/co/211789.htm
淄博远光新材料有限公司,http://www.11467.com/zibo/co/90383.htm
重庆耘森装饰设计工程有限公司,http://www.11467.com/chongqing/co/204379.htm
安阳市乾汇铁合金有限责任公司,http://www.11467.com/anyang/co/26383.htm
长春市成盛金属材料有限公司,http://www.11467.com/changchun/co/69384.htm
大连众邦科技有限公司,http://www.11467.com/dalian/co/33222.htm
佛山市顺德区绿宝石涂料有限公司,http://www.11467.com/foshan/co/310951.htm
东莞市泰升颜料有限公司,http://www.11467.com/dongguan/co/489764.htm
郑州马路划线漆有限公司,http://www.11467.com/zhengzhou/co/170571.htm
北京锦润华夏新材料有限公司,http://www.11467.com/beijing/co/690966.htm
广州双虹建材有限公司,http://www.11467.com/guangzhou/co/413403.htm
佛山市顺德区欧辰化工有限公司,http://www.11467.com/foshan/co/337812.htm
保定骏享机械设备销售有限公司,http://www.11467.com/baoding/co/82440.htm
天津市仁爱科技开发有限公司,http://www.11467.com/tianjin/co/196601.htm
成都祥和涂料磷化有限公司,http://www.11467.com/chengdu/co/135403.htm
大连喜立德科技有限公司,http://www.11467.com/dalian/co/64719.htm
常州思诺尔化工有限公司,http://www.11467.com/changzhou/co/96772.htm
北京京能恒基新材料有限公司,http://www.11467.com/beijing/co/691063.htm
深圳市鑫展鹏复合材料有限公司,http://www.11467.com/shenzhen/co/759860.htm
无锡金鹰建筑材料有限公司,http://www.11467.com/wuxi/co/214936.htm
长沙华信涂料开发有限公司,http://www.11467.com/changsha/co/100985.htm
常州市晨阳化工有限公司,http://www.11467.com/changzhou/co/122253.htm
溧阳市宇峰新材料有限公司,http://www.11467.com/changzhou/co/152772.htm
常州市博营化工有限公司,http://www.11467.com/changzhou/co/152644.htm
厦门弘驰建材有限公司,http://www.11467.com/xiamen/co/93075.htm
枞阳县三金颜料有限责任公司,http://www.11467.com/dongguan/co/402372.htm
东莞市福兴化工有限公司,http://www.11467.com/dongguan/co/401249.htm
东升地坪材料有限公司,http://www.11467.com/dongguan/co/499698.htm
長兆企業有限公司,http://www.11467.com/dongguan/co/490145.htm
东莞市巴图印花材料有限公司,http://www.11467.com/dongguan/co/196383.htm
东莞广通化工制品有限公司,http://www.11467.com/dongguan/co/112156.htm
成都艺盛装饰工程有限公司,http://www.11467.com/chengdu/co/212053.htm
定兴县盟隆非金属高科开发有限公司,http://www.11467.com/baoding/co/70495.htm
成都栢斯特建材有限公司,http://www.11467.com/chengdu/co/218750.htm
成都纳尼亚涂料有限公司,http://www.11467.com/chengdu/co/216602.htm
常州市佳美涂料有限公司,http://www.11467.com/changzhou/co/28654.htm
常州市亚明涂料有限公司,http://www.11467.com/changzhou/co/126375.htm
长沙恒旺乐化工有限公司,http://www.11467.com/changsha/co/119546.htm
广州秦隆建筑材料科技有限公司,http://www.11467.com/guangzhou/co/413484.htm
常州市戚墅堰精细化工有限公司,http://www.11467.com/changzhou/co/116062.htm
佛山市南海宝骏装饰材料有限公司,http://www.11467.com/foshan/co/212984.htm
东莞市力胜化工有限公司,http://www.11467.com/dongguan/co/466731.htm
东莞市镁宝化工有限公司,http://www.11467.com/dongguan/co/170186.htm
佛山市诚元贸易有限公司,http://www.11467.com/foshan/co/213001.htm
东莞市匠艺广告装饰工程有限公司,http://www.11467.com/dongguan/co/555949.htm
东莞市五度机电设备有限公司,http://www.11467.com/dongguan/co/131549.htm
东莞市统成装饰材料有限公司,http://www.11467.com/dongguan/co/406768.htm
东莞市蓝彩科迪涂料科技有限公司,http://www.11467.com/dongguan/co/535193.htm
东莞市盛唯贸易有限公司,http://www.11467.com/dongguan/co/556711.htm
东莞市畅宇装饰材料有限公司,http://www.11467.com/dongguan/co/196079.htm
东莞市耐德地坪工程有限公司,http://www.11467.com/dongguan/co/492167.htm
佛山市杰克涂涂料有限公司,http://www.11467.com/foshan/co/355708.htm
东莞市宝月化工有限公司,http://www.11467.com/dongguan/co/140790.htm
东莞市璟龙塑化材料有限公司,http://www.11467.com/dongguan/co/400476.htm
东莞市瑞澳化工原料有限公司,http://www.11467.com/dongguan/co/196395.htm
东莞市星航涂料科技有限公司,http://www.11467.com/dongguan/co/402363.htm
东莞市精圆信实业有限公司,http://www.11467.com/dongguan/co/413148.htm
东莞市宏涂化工有限公司,http://www.11467.com/dongguan/co/536213.htm
东莞市百特净化科技有限公司,http://www.11467.com/dongguan/co/130804.htm
东莞市光亮防尘防静电有限公司,http://www.11467.com/dongguan/co/379399.htm
东莞市和信实业有限公司,http://www.11467.com/dongguan/co/399980.htm
东莞市盛容实业有限公司,http://www.11467.com/dongguan/co/543128.htm
东莞市川桥化工有限公司,http://www.11467.com/dongguan/co/402329.htm
东莞市丽拉涂化工有限公司,http://www.11467.com/dongguan/co/401228.htm
东莞市佳特地板有限公司,http://www.11467.com/dongguan/co/457176.htm
东莞市邦昵涂料有限公司,http://www.11467.com/dongguan/co/491196.htm
东莞市华连冠化工有限公司,http://www.11467.com/dongguan/co/16386.htm
东莞市华创研磨材料有限公司,http://www.11467.com/dongguan/co/300350.htm
东莞市裕祥塑胶原料贸易有限公司,http://www.11467.com/dongguan/co/491075.htm
深圳市惠成中实业有限公司,http://www.11467.com/dongguan/co/350753.htm
东莞市升科工业地板有限公司,http://www.11467.com/dongguan/co/238369.htm
东莞市永和实业有限公司,http://www.11467.com/dongguan/co/74418.htm
东莞市鑫茂化工有限公司,http://www.11467.com/dongguan/co/171336.htm
佛山市南海区东谷新型材料有限公司,http://www.11467.com/foshan/co/337203.htm
安乡多乐美化工有限公司,http://www.11467.com/foshan/co/294422.htm
佛山市桓林化工科技有限公司,http://www.11467.com/foshan/co/338330.htm
东莞市隆源化工有限公司,http://www.11467.com/dongguan/co/481855.htm
东莞市优卡实业投资有限公司,http://www.11467.com/dongguan/co/183525.htm
广州市天溢涂料有限公司,http://www.11467.com/guangzhou/co/474779.htm
福州惠佰年装饰材料有限公司,http://www.11467.com/fuzhou/co/157880.htm
广州市长兴防水装饰工程有限公司,http://www.11467.com/guangzhou/co/103146.htm
广州市海琦贸易有限公司,http://www.11467.com/guangzhou/co/29105.htm
广州敬业防水建材有限公司,http://www.11467.com/guangzhou/co/429941.htm
广州纳易化工有限公司,http://www.11467.com/guangzhou/co/319697.htm
广州天凌硅胶有限公司,http://www.11467.com/guangzhou/co/494753.htm
广州明权机械设备有限公司,http://www.11467.com/guangzhou/co/430432.htm
福州佳宝丽建材有限公司,http://www.11467.com/fuzhou/co/63879.htm
广州胜联贸易有限公司,http://www.11467.com/guangzhou/co/322442.htm
广州浩发装饰工程有限公司,http://www.11467.com/guangzhou/co/375818.htm
佛山市顺德区瓦科涂料实业有限公司,http://www.11467.com/foshan/co/341498.htm
广州天珑高分子材料科技有限公司,http://www.11467.com/guangzhou/co/429932.htm
佛山市顺德区阿士丹涂装工程有限公司,http://www.11467.com/foshan/co/320693.htm
广州市葆力孚化工科技有限公司,http://www.11467.com/guangzhou/co/241104.htm
广州金坊化工有限公司,http://www.11467.com/guangzhou/co/458020.htm
广州市绿映红贸易有限公司,http://www.11467.com/guangzhou/co/494895.htm
广州市齐晖贸易有限公司,http://www.11467.com/guangzhou/co/207706.htm
广州和氏璧化工材料有限公司,http://www.11467.com/guangzhou/co/208820.htm
广州市聚通钛白粉有限公司,http://www.11467.com/guangzhou/co/207803.htm
广州华楚新能源科技有限公司,http://www.11467.com/guangzhou/co/494930.htm
广州闽维聚乙烯醇销售有限公司,http://www.11467.com/guangzhou/co/267389.htm
佛山市顺德区国硕化工有限公司,http://www.11467.com/foshan/co/293144.htm
佛山市顺德区地缘电子科技有限公司,http://www.11467.com/foshan/co/234284.htm
佛山市南海区东恒化工有限公司,http://www.11467.com/foshan/co/306470.htm
广州晶彩颜料科技有限公司,http://www.11467.com/guangzhou/co/209346.htm
广州阁美仕建材有限公司,http://www.11467.com/guangzhou/co/413470.htm
广州市集彩贸易有限公司,http://www.11467.com/guangzhou/co/433273.htm
上海洽欣工贸有限公司,http://www.11467.com/guangzhou/co/495147.htm
广州市湘维贸易有限公司,http://www.11467.com/guangzhou/co/42515.htm
广州市天之海进出口贸易有限公司,http://www.11467.com/guangzhou/co/496557.htm
广州欣凯化工科技有限公司,http://www.11467.com/guangzhou/co/169156.htm
广州市客临登装饰材料有限公司,http://www.11467.com/guangzhou/co/400134.htm
广州市安誉贸易有限公司,http://www.11467.com/guangzhou/co/237302.htm
广州若贝尔建材有限公司,http://www.11467.com/guangzhou/co/469330.htm
广州市依码新材料科技有限公司,http://www.11467.com/guangzhou/co/460152.htm
广州市康绿宝贸易有限公司,http://www.11467.com/guangzhou/co/496379.htm
广东香岛颜料有限公司,http://www.11467.com/guangzhou/co/42403.htm
广州博涛贸易有限公司,http://www.11467.com/guangzhou/co/394808.htm
广州蓝曦金属表面处理科技有限公司,http://www.11467.com/guangzhou/co/67434.htm
佛山市顺德区奥伦格水性漆业有限公司,http://www.11467.com/foshan/co/294401.htm
佛山市南海鸿雅园艺配套制品有限公司,http://www.11467.com/foshan/co/355709.htm
佛山市三水兴达涂料有限公司,http://www.11467.com/foshan/co/293012.htm
佛山市公隆化工材料有限公司,http://www.11467.com/foshan/co/341492.htm
佛山新地阳光油漆有限公司,http://www.11467.com/foshan/co/293368.htm
山东新佳涂料有限公司,http://www.11467.com/jinan/co/133862.htm
江门市蓬江区宝莹先骏化工有限公司,http://www.11467.com/jiangmen/co/114691.htm
江门市蓬江区辉腾橡胶制品有限公司,http://www.11467.com/jiangmen/co/116710.htm
淮安利安科技发展有限公司,http://www.11467.com/huaian/co/36184.htm
惠州市科盛贸易有限公司,http://www.11467.com/huizhou/co/23940.htm
湖州璟宝新型建材有限公司,http://www.11467.com/huzhou/co/48128.htm
江门市新会区大泽化工有限公司,http://www.11467.com/jiangmen/co/95303.htm
江门市蓬江区光华涂料有限公司,http://www.11467.com/jiangmen/co/86542.htm
济南立都自动化设备有限公司,http://www.11467.com/jinan/co/81906.htm
嘉兴众鑫新材料技术有限公司,http://www.11467.com/jiaxing/co/123886.htm
江门市新会区新日旭电子材料有限公司,http://www.11467.com/jiangmen/co/82324.htm
吉林市恒瑞达贸易有限责任公司,http://www.11467.com/jilinshi/co/67492.htm
杭州五会港胶粘剂有限公司,http://www.11467.com/hangzhou/co/390936.htm
杭州柯林斯净化工程有限公司,http://www.11467.com/hangzhou/co/391380.htm
广州亿珲盛化工有限公司,http://www.11467.com/guangzhou/co/464455.htm
惠州市统洋贸易有限公司,http://www.11467.com/huizhou/co/72976.htm
嘉兴市达因涂料科技有限公司,http://www.11467.com/jiaxing/co/67875.htm
济宁市新天地漆业有限公司,http://www.11467.com/jining/co/62579.htm
河北华日空调工程有限公司,http://www.11467.com/hengshui/co/42927.htm
杭州林沃防水建材有限公司,http://www.11467.com/hangzhou/co/373139.htm
黄山市徽州佳杰化工有限公司,http://www.11467.com/huangshan/co/11394.htm
涉县宏途公路设施维护有限公司,http://www.11467.com/handan/co/65329.htm
杭州秀朗地坪工程有限公司,http://www.11467.com/hangzhou/co/114215.htm
济南卓力科技有限公司,http://www.11467.com/jinan/co/87937.htm
杭州磊翔建材有限公司,http://www.11467.com/hangzhou/co/355654.htm
广州市力宝龙涂料有限公司,http://www.11467.com/guangzhou/co/424459.htm
江门市宣威威廉斯化工有限公司,http://www.11467.com/jiangmen/co/101310.htm
江门市椭圆环保科技有限公司,http://www.11467.com/jiangmen/co/112979.htm
金展鸿涂料有限公司,http://www.11467.com/jiangmen/co/116091.htm
黄山市科贝瑞化工有限公司,http://www.11467.com/huangshan/co/17704.htm
惠州市嘉淇涂料有限公司,http://www.11467.com/huizhou/co/6241.htm
浙江德清美史乐颜料科技有限公司,http://www.11467.com/huzhou/co/66814.htm
贵港市华一商贸有限公司,http://www.11467.com/guigang/co/7810.htm
贵阳安筑五交化公司,http://www.11467.com/guiyang/co/57345.htm
杭州宏景涂料有限公司,http://www.11467.com/hangzhou/co/303102.htm
杭州福思特地面工程有限公司,http://www.11467.com/hangzhou/co/149198.htm
杭州杰浩涂装有限公司,http://www.11467.com/hangzhou/co/255037.htm
杭州罗川化工有限公司,http://www.11467.com/hangzhou/co/232855.htm
合肥祺云化工有限公司,http://www.11467.com/hefei/co/116454.htm
杭州恒笑贸易有限公司,http://www.11467.com/hangzhou/co/303141.htm
杭州微微纳米技术有限公司,http://www.11467.com/hangzhou/co/160545.htm
上海俊深实业有限公司,http://www.11467.com/jiaxing/co/134926.htm
江门市洁达涂料有限公司,http://www.11467.com/jiangmen/co/101728.htm
金华市智达颜料有限公司,http://www.11467.com/jinhua/co/82710.htm
廊坊科明静电喷涂设备有限公司,http://www.11467.com/langfang/co/35780.htm
山东东阿鑫缔汽车饰品有限责任公司,http://www.11467.com/liaocheng/co/30053.htm
南京金悦化工有限公司,http://www.11467.com/nanjing/co/73229.htm
南京金耐德装饰材料有限公司,http://www.11467.com/nanjing/co/105339.htm
茂名市宝润化工有限公司,http://www.11467.com/maoming/co/32984.htm
连云港市城玮化工有限公司,http://www.11467.com/lianyungang/co/27327.htm
廊坊市中环水所化工有限公司,http://www.11467.com/langfang/co/28701.htm
廊坊开发区祁源化工建材有限公司,http://www.11467.com/langfang/co/23975.htm
廊坊市海寰化工有限公司,http://www.11467.com/langfang/co/2976.htm
廊坊永兴嘉业建材化工有限公司,http://www.11467.com/langfang/co/28444.htm
南通威鹏建材开发贸易有限公司,http://www.11467.com/nantong/co/79697.htm
汕头市亚克力高分子树脂厂有限公司,http://www.11467.com/shantou/co/141439.htm
汕头市朱颜精细化工有限公司,http://www.11467.com/shantou/co/130986.htm
绍兴市泰和交通技术工程有限公司,http://www.11467.com/shaoxing/co/78144.htm
柳州辰阳科技有限公司,http://www.11467.com/liuzhou/co/38144.htm
广州赣威贸易有限公司,http://www.11467.com/nanning/co/64537.htm
连云港振港电力辅机有限公司,http://www.11467.com/lianyungang/co/43659.htm
南昌坤士利科技有限公司,http://www.11467.com/nanchang/co/98559.htm
菏泽仕达化工有限公司,http://www.11467.com/linyi/co/73724.htm
廊坊宝来防火建材有限公司,http://www.11467.com/langfang/co/46039.htm
南京宇晔科技有限公司,http://www.11467.com/nanjing/co/64213.htm
南京通海科技发展有限公司,http://www.11467.com/nanjing/co/90144.htm
南京共创防腐保温有限公司,http://www.11467.com/nanjing/co/154573.htm
茂名市龙腾石化有限公司,http://www.11467.com/maoming/co/39868.htm
南昌华特化工有限公司,http://www.11467.com/nanchang/co/100488.htm
江山市波恩化工有限公司,http://www.11467.com/quzhou/co/8877.htm
福建省永安市荣达建材有限公司,http://www.11467.com/sanming/co/22698.htm
山东昌裕集团聊城齐鲁漆业有限公司,http://www.11467.com/qingdao/co/119788.htm
余姚市慈燕涂料有限公司,http://www.11467.com/ningbo/co/195389.htm
南通金顺化工科技有限公司,http://www.11467.com/nantong/co/111139.htm
南通生达化工有限公司,http://www.11467.com/nantong/co/113573.htm
晋江市申达建筑材料有限公司,http://www.11467.com/quanzhou/co/128394.htm
廊坊莱欧保温材料有限公司,http://www.11467.com/langfang/co/47820.htm
河北华奇军旺防火材料有限公司,http://www.11467.com/langfang/co/46450.htm
临沂市三辰装饰材料有限公司,http://www.11467.com/linyi/co/57386.htm
山东金泰山漆业有限公司,http://www.11467.com/linyi/co/76848.htm
临沂市金汇五金化工有限公司,http://www.11467.com/linyi/co/2381.htm
南京卓立贸易有限责任公司,http://www.11467.com/nanjing/co/49174.htm
广西隆安银丰淀粉有限公司,http://www.11467.com/nanning/co/78944.htm
南昌市青果实业有限公司,http://www.11467.com/nanchang/co/98745.htm
深圳市荣恩科技有限公司,http://www.11467.com/shenzhen/co/463484.htm
沈阳万隆建材有限公司,http://www.11467.com/shenyang/co/76451.htm
深圳市大彩科技有限公司,http://www.11467.com/shenzhen/co/762863.htm
绍兴市泰和交通技术工程有限公司,http://www.11467.com/shaoxing/co/78144.htm
沈阳市闽老大商贸有限公司,http://www.11467.com/shenyang/co/74759.htm
深圳市美而雅酒店用品有限公司,http://www.11467.com/shenzhen/co/150336.htm
深圳市鑫盛丰科技有限公司,http://www.11467.com/shenzhen/co/706122.htm
深圳市三化化工有限公司,http://www.11467.com/shenzhen/co/812966.htm
深圳华信腾辉科技有限公司,http://www.11467.com/shenzhen/co/346214.htm
深圳市恒深科技有限公司,http://www.11467.com/shenzhen/co/63269.htm
深圳市联欧科技发展有限公司,http://www.11467.com/shenzhen/co/335532.htm
深圳市美易图贸易有限公司,http://www.11467.com/shenzhen/co/685615.htm
深圳市涂得丽科技有限公司,http://www.11467.com/shenzhen/co/703855.htm
深圳市麦克福科技有限公司,http://www.11467.com/shenzhen/co/685671.htm
浙江易能感光材料有限公司,http://www.11467.com/shaoxing/co/118529.htm
深圳市华恒发化工有限公司,http://www.11467.com/shenzhen/co/94607.htm
深圳市好彩头化工有限公司,http://www.11467.com/shenzhen/co/706120.htm
深圳市美和乐精细化工有限公司,http://www.11467.com/shenzhen/co/809197.htm
深圳市高彩化工有限公司,http://www.11467.com/shenzhen/co/726779.htm
海丰县荣彬贸易有限公司,http://www.11467.com/shenzhen/co/586705.htm
深圳星火源电子有限公司,http://www.11467.com/shenzhen/co/530636.htm
深圳市正大油业化工有限公司,http://www.11467.com/shenzhen/co/540248.htm
深圳市欧芙琳技术有限公司,http://www.11467.com/shenzhen/co/617952.htm
深圳市大洲化工有限公司,http://www.11467.com/shenzhen/co/762848.htm
深圳市威仕环保科技有限公司,http://www.11467.com/shenzhen/co/757252.htm
深圳市庄彩科技有限公司,http://www.11467.com/shenzhen/co/223853.htm
济宁鲁佳涂料有限公司,http://www.11467.com/shenzhen/co/723842.htm
广西平南县建美石灰制品非金属原料有限公司,http://www.11467.com/shenzhen/co/706095.htm
深圳市宝和装饰工程有限公司,http://www.11467.com/shenzhen/co/776350.htm
深圳市川福实业有限公司,http://www.11467.com/shenzhen/co/33666.htm
深圳市东方红精细化工有限公司,http://www.11467.com/shenzhen/co/90957.htm
沈阳昊天阳光板有限公司,http://www.11467.com/shenyang/co/96616.htm
深圳市崇化鑫科技有限公司,http://www.11467.com/shenzhen/co/693003.htm
深圳市鸿豪科技有限公司,http://www.11467.com/shenzhen/co/763028.htm
深圳市富通源科技有限公司,http://www.11467.com/shenzhen/co/685652.htm
深圳市辉宏兴化工科技有限公司,http://www.11467.com/shenzhen/co/797847.htm
深圳市华之键电子科技有限公司,http://www.11467.com/shenzhen/co/437739.htm
深圳市利红金科技有限公司,http://www.11467.com/shenzhen/co/763147.htm
深圳市开元龙电子科技有限公司,http://www.11467.com/shenzhen/co/408238.htm
深圳市漫彩科技有限公司,http://www.11467.com/shenzhen/co/702932.htm
深圳市璐锋建筑防水材料有限公司,http://www.11467.com/shenzhen/co/789605.htm
深圳市诺诚装饰材料有限公司,http://www.11467.com/shenzhen/co/811558.htm
深圳市晶之源碳石墨材料有限公司,http://www.11467.com/shenzhen/co/338075.htm
石家庄纳伦化工科技有限公司,http://www.11467.com/shijiazhuang/co/138362.htm
山东云清新技术开发有限公司,http://www.11467.com/weihai/co/29999.htm
昆山银洛工业设备有限公司,http://www.11467.com/suzhou/co/315274.htm
武汉然美装饰材料有限公司,http://www.11467.com/wuhan/co/141244.htm
湖北首云建筑防水工程有限公司,http://www.11467.com/wuhan/co/71565.htm
张家港市福明防水防腐材料有限公司,http://www.11467.com/suzhou/co/130415.htm
厦门金天然环保科技有限公司,http://www.11467.com/xiamen/co/62447.htm
陕西星瑞航天科技发展有限责任公司,http://www.11467.com/xian/co/48060.htm
武汉吉和昌化工科技有限公司,http://www.11467.com/wuhan/co/79035.htm
青海铬盐高新科技股份有限公司,http://www.11467.com/xining/co/16143.htm
老河口市凌晨玻璃钢有限公司,http://www.11467.com/xiangfan/co/14450.htm
石家庄市欣尔利化工有限公司,http://www.11467.com/shijiazhuang/co/93525.htm
石家庄韵石新型建材有限公司,http://www.11467.com/shijiazhuang/co/138772.htm
武汉润兴源物资商贸有限公司,http://www.11467.com/wuhan/co/106605.htm
潍坊益松贸易发展有限公司,http://www.11467.com/weifang/co/91549.htm
苏州创源化工有限公司,http://www.11467.com/suzhou/co/313103.htm
张家港市通宇机械制造有限公司,http://www.11467.com/suzhou/co/127656.htm
无锡市全顺防腐化工新材料有限公司,http://www.11467.com/wuxi/co/245903.htm
无锡顺达金属粉末有限公司,http://www.11467.com/wuxi/co/193501.htm
苏州四季精华贸易有限公司,http://www.11467.com/suzhou/co/317844.htm
深圳市天驰防腐涂料有限公司,http://www.11467.com/shenzhen/co/685712.htm
江阴市理想橡塑科技有限公司,http://www.11467.com/wuxi/co/244380.htm
无锡盛尔立新材料科技有限公司,http://www.11467.com/wuxi/co/214938.htm
武汉沃尔固地坪材料有限公司,http://www.11467.com/wuhan/co/144744.htm
深圳市正和翔科技有限公司,http://www.11467.com/shenzhen/co/582028.htm
厦门鹰派新材料科技有限公司,http://www.11467.com/xiamen/co/103428.htm
陕西笑笑防水科技服务有限公司,http://www.11467.com/xian/co/90188.htm
