汕头市伟业化妆品有限公司,http://www.11467.com/shantou/co/40885.htm
上海郭冉调味食品有限公司,http://www.11467.com/shanghai/co/17060.htm
广西友邦过滤机有限公司,http://www.11467.com/nanning/co/58033.htm
辽宁仪表研究所有限责任公司(辽宁仪表研究所),http://www.11467.com/dandong/co/47163.htm
青岛合和纸业有限公司,http://www.11467.com/qingdao/co/154887.htm
阜阳市绿洲木业有限公司,http://www.11467.com/fuyang/co/26344.htm
海丰县同翔纸制品有限公司,http://www.11467.com/shanwei/co/8982.htm
龙岩市联环纸制品包装有限公司,http://www.11467.com/longyan/co/1160.htm
盐城市秦南高空油漆安装总公司,http://www.11467.com/yancheng/co/2070.htm
天津市福盛纸业有限公司,http://www.11467.com/tianjin/co/113290.htm
莆田市清和木业有限公司,http://www.11467.com/putian/co/30348.htm
深圳市喜得圣贸易有限公司,http://www.11467.com/shenzhen/co/149321.htm
湖南冠宇投资有限责任公司,http://www.11467.com/changsha/co/89321.htm
阿克苏地区锦鸿棉业有限公司,http://www.11467.com/akesu/co/11503.htm
广西嘉宇纸张纸浆有限公司,http://www.11467.com/liuzhou/co/41828.htm
润博纸业(天津)有限公司,http://www.11467.com/tianjin/co/90251.htm
东莞市绿保纸塑制品有限公司,http://www.11467.com/dongguan/co/329703.htm
沧州临港资通纸业有限公司,http://www.11467.com/cangzhou/co/45802.htm
郓城县春之来木业有限公司,http://www.11467.com/heze/co/39197.htm
莒县信博纸业有限责任公司,http://www.11467.com/rizhao/co/29372.htm
中山市大利路精工机械有限公司,http://www.11467.com/zhongshan/co/42811.htm
广东中轻南方炼糖纸业有限公司,http://www.11467.com/guangzhou/co/13318.htm
安平县金宝利丝网制品有限公司,http://www.11467.com/changsha/co/89696.htm
东莞市东建浆纸有限公司,http://www.11467.com/dongguan/co/94830.htm
沧州科瑞再生资源利用有限公司,http://www.11467.com/cangzhou/co/68005.htm
河南枫林纸浆有限公司,http://www.11467.com/zhengzhou/co/169088.htm
青岛鑫永丰包装有限公司,http://www.11467.com/qingdao/co/153641.htm
南宁龙派糖纸有限公司,http://www.11467.com/nanning/co/86654.htm
连云港市展亚贸易有限公司,http://www.11467.com/lianyungang/co/27453.htm
江门市新会区贝丽纸业有限公司,http://www.11467.com/jiangmen/co/82681.htm
淄博至胜实业有限公司,http://www.11467.com/zibo/co/46484.htm
上海林鑫进出口有限公司,http://www.11467.com/shanghai/co/1041971.htm
上海惟海实业有限公司,http://www.11467.com/shanghai/co/652696.htm
中南纸业（福建）有限公司,http://www.11467.com/zhangzhou/co/52979.htm
江西科特精细粉体有限公司,http://www.11467.com/yichun/co/23588.htm
青岛凯益林国际贸易有限公司,http://www.11467.com/qingdao/co/102739.htm
湖南泰格林纸集团洪江纸业有限责任公司,http://www.11467.com/huaihua/co/20109.htm
上栗县恒达纸业有限公司,http://www.11467.com/pingxiang/co/13324.htm
武汉晨鸣汉阳纸业股份有限公司,http://www.11467.com/wuhan/co/34581.htm
保定市金博商贸有限公司,http://www.11467.com/baoding/co/59928.htm
陕西兴翔纸业有限责任公司,http://www.11467.com/baoji/co/8364.htm
肃宁县三基环科再生纸业有限公司,http://www.11467.com/cangzhou/co/46349.htm
常州吉春包装有限公司,http://www.11467.com/changzhou/co/38632.htm
安县纸业有限公司,http://www.11467.com/chengdu/co/141830.htm
河北鹤煌网业股份有限公司,http://www.11467.com/dongguan/co/128020.htm
抚顺普菲特纸业有限公司,http://www.11467.com/fushun/co/28012.htm
抚顺优特塑编有限公司,http://www.11467.com/fushun/co/25042.htm
广东中轻糖业集团有限公司,http://www.11467.com/guangzhou/co/429186.htm
汇丰纸业有限公司,http://www.11467.com/hebi/co/9183.htm
安徽省技术进出口股份有限公司,http://www.11467.com/hefei/co/78468.htm
鹤岗市华欣纸业有线责任公司,http://www.11467.com/hegang/co/10057.htm
句末木业公司,http://www.11467.com/heze/co/34758.htm
美国吉帝国际公司中国代表处,http://www.11467.com/huaibei/co/13439.htm
湖州金源化工有限公司,http://www.11467.com/huzhou/co/56215.htm
腾升商贸有限责任公司,http://www.11467.com/jiayuguan/co/1714.htm
山东枫叶国际贸易发展有限公司,http://www.11467.com/jinan/co/95275.htm
湖北玉雅纸业有限公司,http://www.11467.com/jingmen/co/14964.htm
四川夹江复兴画廊千千纸业有限公司,http://www.11467.com/leshan/co/23708.htm
眉山玖襄化工有限公司,http://www.11467.com/meishan/co/14692.htm
江苏精科嘉益工业技术有限公司,http://www.11467.com/nanjing/co/89553.htm
南京化纤股份有限公司,http://www.11467.com/nanjing/co/90282.htm
南宁巨润机电科技有限公司,http://www.11467.com/nanning/co/79009.htm
泉州恒润纸业有限公司,http://www.11467.com/quanzhou/co/131756.htm
泉州天娇妇幼卫生用品有限公司,http://www.11467.com/quanzhou/co/93733.htm
诸城永惠工贸有限公司,http://www.11467.com/weifang/co/117513.htm
厦门建发纸业有限公司,http://www.11467.com/xiamen/co/28744.htm
徐州市东岳木质纤维有限公司,http://www.11467.com/xuzhou/co/63805.htm
烟台通润化工科技有限公司,http://www.11467.com/yantai/co/153753.htm
营口红日造纸有限公司,http://www.11467.com/yingkou/co/42813.htm
张掖市明阳纸业有限责任公司,http://www.11467.com/zhangye/co/9272.htm
湛江市东方剑麻制品有限公司,http://www.11467.com/zhanjiang/co/45197.htm
河南省启硕金属材料有限公司,http://www.11467.com/zhengzhou/co/173904.htm
郑州真字号餐巾纸业有限公司,http://www.11467.com/zhengzhou/co/175908.htm
宁夏三雅精细化工有限公司,http://www.11467.com/zhongwei/co/1751.htm
赤峰农神科技种苗繁育有限责任公司,http://www.11467.com/beijing/co/701291.htm
天津鼎优贸易有限公司,http://www.11467.com/tianjin/co/302367.htm
湖南泓天贸易有限公司,http://www.11467.com/changsha/co/82316.htm
大连万通工业装备有限公司,http://www.11467.com/dalian/co/45899.htm
山东中茂圣源纸浆有限公司,http://www.11467.com/dezhou/co/50655.htm
廣東理文造紙有限公司,http://www.11467.com/dongguan/co/200503.htm
佛山市至富经贸有限公司,http://www.11467.com/foshan/co/305585.htm
福建教育发展(集团)有限公司,http://www.11467.com/fuzhou/co/149257.htm
广东南蒲纸业有限公司,http://www.11467.com/guangzhou/co/127034.htm
广州赛唯热工设备有限公司,http://www.11467.com/guangzhou/co/105019.htm
广州市永坚竹浆有限公司,http://www.11467.com/guangzhou/co/322497.htm
骏宇贸易有限公司,http://www.11467.com/guangzhou/co/460072.htm
鹤山众信纸业有限公司,http://www.11467.com/guangzhou/co/470483.htm
杭州经安进出品有限公司,http://www.11467.com/hangzhou/co/235816.htm
杭州经安贸易公司,http://www.11467.com/hangzhou/co/235834.htm
杭州至正纸业有限公司,http://www.11467.com/hangzhou/co/271671.htm
杭州千禧纸业有限公司,http://www.11467.com/hangzhou/co/10427.htm
郓城县腾达木业有限公司,http://www.11467.com/heze/co/34383.htm
淮南市奕天浆纸贸易有限公司,http://www.11467.com/huainan/co/19861.htm
长兴县华东矿粉有限公司,http://www.11467.com/huzhou/co/30869.htm
佳木斯东方纸业有限公司,http://www.11467.com/jiamusi/co/6273.htm
温县菲亚特巨力机械有限公司,http://www.11467.com/jiaozuo/co/26975.htm
济宁市新科木业有限责任公司,http://www.11467.com/jining/co/73725.htm
江西云翔国际货运代理有限公司,http://www.11467.com/jiujiang/co/24391.htm
昆明硕赛商贸有限公司,http://www.11467.com/kunming/co/121726.htm
聊城开发区德林木业有限公司,http://www.11467.com/liaocheng/co/27863.htm
山东省高唐县恒盛工贸有限公司,http://www.11467.com/liaocheng/co/49448.htm
临汾市同达康餐具有限公司,http://www.11467.com/linfen/co/32119.htm
遂昌金盛纤维有限公司,http://www.11467.com/lishui/co/14880.htm
柳州市慧宝贸易有限公司,http://www.11467.com/liuzhou/co/38003.htm
江苏省出版印刷物资公司,http://www.11467.com/nanjing/co/30335.htm
进进包袋有限公司,http://www.11467.com/nanning/co/62995.htm
南宁金浪浆业有限公司,http://www.11467.com/nanning/co/69087.htm
福建腾荣达制浆有限公司,http://www.11467.com/nanping/co/32606.htm
青岛冠孚昊国际贸易有限公司,http://www.11467.com/qingdao/co/102875.htm
青岛建发纸业有限公司,http://www.11467.com/qingdao/co/102830.htm
德化县德辉彩印包装有限公司,http://www.11467.com/quanzhou/co/113811.htm
城步银河纸业有限公司,http://www.11467.com/shaoyang/co/26735.htm
深圳鲁越机械设备有限责任公司,http://www.11467.com/shenzhen/co/765532.htm
佳利华纸品（深圳）有限公司,http://www.11467.com/shenzhen/co/42817.htm
深圳市铭丰纸塑包装制品有限公司业务工程部,http://www.11467.com/shenzhen/co/398664.htm
深圳市鑫利佳贸易有限公司,http://www.11467.com/shenzhen/co/74072.htm
昆山格林恩纸塑包装科技有限公司,http://www.11467.com/suzhou/co/317226.htm
温州博强离心机科技有限公司,http://www.11467.com/wuxi/co/244199.htm
厦门陆海环保产业开发有限公司,http://www.11467.com/xiamen/co/78616.htm
江苏八达重工机械有限公司,http://www.11467.com/xuzhou/co/81512.htm
河南省洧源商贸有限公司,http://www.11467.com/zhengzhou/co/106748.htm
江苏大唐机械有限公司,http://www.11467.com/zhenjiang/co/64505.htm
安庆市明华环保科技有限责任公司,http://www.11467.com/anqing/co/24776.htm
安阳市普杰林贸易有限公司,http://www.11467.com/anyang/co/28736.htm
广西贺州市南方贸易公司,http://www.11467.com/baise/co/11268.htm
广西兴能电力有限责任公司,http://www.11467.com/baise/co/11259.htm
甘肃银星纸业有限责任公司(泰德纸制品公司),http://www.11467.com/baiyin/co/6010.htm
保定市宇林纸业有限责任公司,http://www.11467.com/baoding/co/9631.htm
祥云纸品营销公司,http://www.11467.com/baoding/co/54851.htm
保定冶化泵业制造有限公司（龙鑫泵业）,http://www.11467.com/baoding/co/54126.htm
山东海润纸业有限公司,http://www.11467.com/binzhou/co/34845.htm
山东海韵纸业有限公司,http://www.11467.com/binzhou/co/34689.htm
黄河造纸有限公司,http://www.11467.com/binzhou/co/21380.htm
河北沧州临港经济技术开发区资通纸业有限公司,http://www.11467.com/cangzhou/co/42759.htm
天美纸业有限公司,http://www.11467.com/cangzhou/co/39054.htm
吴桥成城木纤维有限责任公司,http://www.11467.com/cangzhou/co/59976.htm
长春鸿利纸业有限公司,http://www.11467.com/changchun/co/76679.htm
长沙鑫欣贸易有限公司,http://www.11467.com/changsha/co/61329.htm
湖南山川-速生丰产林工程有限公司,http://www.11467.com/changsha/co/90032.htm
湖南长丰环球经贸有限公司供销部,http://www.11467.com/changsha/co/89836.htm
湖南永嘉新型材料有限公司,http://www.11467.com/changsha/co/119335.htm
长沙湘禾进出口贸易有限公司,http://www.11467.com/changsha/co/72742.htm
湖南山川速生丰产林工程有限公司,http://www.11467.com/changsha/co/90033.htm
湖南维克奇纸塑包装有限公司,http://www.11467.com/changsha/co/88772.htm
常州彬彬装饰材料有限公司-销售部,http://www.11467.com/changzhou/co/97846.htm
江苏省旺达纸业有限公司,http://www.11467.com/changzhou/co/97185.htm
雪杰纸业有限公司,http://www.11467.com/changzhou/co/96588.htm
成都申鑫实业有限责任公司,http://www.11467.com/chengdu/co/93765.htm
升荣贸易有限公司,http://www.11467.com/chengdu/co/93760.htm
青山实业有限公司,http://www.11467.com/chengdu/co/115145.htm
四川川眉特种芒硝有限责任公司,http://www.11467.com/chengdu/co/115104.htm
四川川福林业投资管理咨询有限责任公司,http://www.11467.com/chengdu/co/114947.htm
遂宁市双江镇竹浆制造公司,http://www.11467.com/chengdu/co/114992.htm
淄博汇顿国际贸易有限公司,http://www.11467.com/zibo/co/66449.htm
淄博瑞生纤维素有限公司,http://www.11467.com/zibo/co/81047.htm
贵州赤天化纸业股份有限公司,http://www.11467.com/zunyi/co/12160.htm
北京星诺斯达科技有限公司,http://www.11467.com/beijing/co/397704.htm
霍尼韦尔国际公司,http://www.11467.com/beijing/co/701292.htm
天津吉鑫工贸有限公司,http://www.11467.com/tianjin/co/90389.htm
天津市旭阳天德商贸有限公司,http://www.11467.com/tianjin/co/89252.htm
重庆理文造纸有限公司,http://www.11467.com/chongqing/co/159675.htm
成都清雅纸业有限公司,http://www.11467.com/chengdu/co/264314.htm
玛纳斯祥云化纤有限公司,http://www.11467.com/changji/co/13549.htm
裕农纸业有限公司,http://www.11467.com/chenzhou/co/19690.htm
内蒙古蒙联纸业有限责任公司,http://www.11467.com/chifeng/co/22974.htm
安徽中石纸业有限公司,http://www.11467.com/chuzhou/co/15087.htm
大连富尔林业有限公司市场八部,http://www.11467.com/dalian/co/41818.htm
大连鸿深木制品有限公司,http://www.11467.com/dalian/co/66068.htm
大连嘉珑缓冲材料制品有限公司,http://www.11467.com/dalian/co/49727.htm
大连快活林生物科技有限公司,http://www.11467.com/dalian/co/19805.htm
大连冰清贸易有限公司,http://www.11467.com/dalian/co/31242.htm
大连汇星贸易有限公司-市场部,http://www.11467.com/dalian/co/52544.htm
辽宁鸭绿江纸业有限公司,http://www.11467.com/dandong/co/47166.htm
大庆国际工贸有限公司,http://www.11467.com/daqing/co/43342.htm
杜尔伯特蒙古族自治县海达纸业有限公司,http://www.11467.com/daqing/co/40670.htm
德州市中茂圣源纸浆有限公司,http://www.11467.com/dezhou/co/50365.htm
东莞飞扬化工有限公司,http://www.11467.com/dongguan/co/336588.htm
东莞鼎名特种纸板有限公司,http://www.11467.com/dongguan/co/494487.htm
创高实业投资有限公司,http://www.11467.com/dongguan/co/320090.htm
东莞市合东纸托制品有限公司业务部,http://www.11467.com/dongguan/co/321760.htm
东莞市汇鸿纸业有限公司,http://www.11467.com/dongguan/co/194948.htm
东莞市汇邦电子科技有限公司,http://www.11467.com/dongguan/co/200252.htm
东莞市汇鸿纸业有限公司（纸浆部）,http://www.11467.com/dongguan/co/194552.htm
东莞市信丰纸塑有限公司,http://www.11467.com/dongguan/co/320287.htm
东莞市福特包装材料有限公司,http://www.11467.com/dongguan/co/203382.htm
东莞市炜丰纸业有限公司,http://www.11467.com/dongguan/co/240824.htm
东莞市一步包装材料有限公司（销售2部）,http://www.11467.com/dongguan/co/226140.htm
东莞市奇林纸业有限公司,http://www.11467.com/dongguan/co/417215.htm
理文造纸有限公司,http://www.11467.com/dongguan/co/206576.htm
明丰鞋材有限公司,http://www.11467.com/dongguan/co/325114.htm
明辉纸巾贸易公司,http://www.11467.com/dongguan/co/194640.htm
科大(东莞)绿源纸品助剂有限公司,http://www.11467.com/dongguan/co/204192.htm
太平洋进出口贸易公司,http://www.11467.com/dongguan/co/336814.htm
万顺纸业（中国）有限公司,http://www.11467.com/dongguan/co/200615.htm
东莞中天公司,http://www.11467.com/dongguan/co/196077.htm
广州秋实商贸有限公司,http://www.11467.com/dongguan/co/202365.htm
广西旭光化工有限公司,http://www.11467.com/dongguan/co/337022.htm
涌新国际有限公司,http://www.11467.com/dongguan/co/200375.htm
裕来贸易公司,http://www.11467.com/dongguan/co/194760.htm
东莞市正佳纸品有限公司,http://www.11467.com/dongguan/co/328324.htm
东莞市绿恒纸制品有限公司市场部,http://www.11467.com/dongguan/co/492050.htm
青云 郑州青云商贸有限公司,http://www.11467.com/dongguan/co/336691.htm
怡丰发泡胶有限公司,http://www.11467.com/dongguan/co/205604.htm
佛山市京旺贸易有限公司,http://www.11467.com/foshan/co/212361.htm
佛山华新进出口有限公司,http://www.11467.com/foshan/co/116105.htm
佛山市顺德佳孚贸易有限公司,http://www.11467.com/foshan/co/340025.htm
万昌科艺有限公司,http://www.11467.com/foshan/co/262763.htm
福建省华福科技发展有限公司,http://www.11467.com/fuzhou/co/145302.htm
福建鞋业有限公司,http://www.11467.com/fuzhou/co/146571.htm
福建省冠翔实业有限公司业务部,http://www.11467.com/fuzhou/co/149186.htm
上井造纸有限公司,http://www.11467.com/fuzhou/co/133505.htm
福州林林贸易有限公司,http://www.11467.com/fuzhou/co/139863.htm
福建省恒兴纸业有限公司,http://www.11467.com/fuzhou/co/169194.htm
彬彬贸易公司,http://www.11467.com/guangzhou/co/127658.htm
柏兴贸易公司,http://www.11467.com/guangzhou/co/280724.htm
广东粤景集团有限公司采购部,http://www.11467.com/guangzhou/co/319404.htm
富托数码实业有限公司,http://www.11467.com/guangzhou/co/323287.htm
广州红菱电热设备有限公司（研发部）,http://www.11467.com/guangzhou/co/109994.htm
广东轻工业品进出口集团中粤进出口有限公司,http://www.11467.com/guangzhou/co/323430.htm
广州超凌热力设备有限公司/业务部,http://www.11467.com/guangzhou/co/104191.htm
广州市金山联纸业有限公司,http://www.11467.com/guangzhou/co/318169.htm
广州淼源进出口贸易有限公司,http://www.11467.com/guangzhou/co/127397.htm
广州凯宏贸易有限公司,http://www.11467.com/guangzhou/co/396092.htm
广州市金山联纸业有限公司总部,http://www.11467.com/guangzhou/co/318168.htm
广东南油经济发展公司,http://www.11467.com/guangzhou/co/83585.htm
广州市韵奇贸易有限公司,http://www.11467.com/guangzhou/co/251270.htm
广州市鹰联投资顾问有限公司,http://www.11467.com/guangzhou/co/322512.htm
凌科国际(加拿大)有限公司中国办事处,http://www.11467.com/guangzhou/co/207163.htm
广州市中园物资回收有限公司,http://www.11467.com/guangzhou/co/206520.htm
广州市昊翔实业有限公司,http://www.11467.com/guangzhou/co/320331.htm
湖南洪江恒光化工有限公司广州办事处,http://www.11467.com/guangzhou/co/320925.htm
浦清流体控制系统工程有限公司,http://www.11467.com/guangzhou/co/468378.htm
枣阳四海化工有限公司广州办事处,http://www.11467.com/guangzhou/co/323255.htm
广州恒通进出口贸易公司,http://www.11467.com/guangzhou/co/470482.htm
南沙纸浆有限公司,http://www.11467.com/guangzhou/co/322525.htm
广州市永沛贸易有限公司,http://www.11467.com/guangzhou/co/205765.htm
石家庄市京丰达(滤纸）有限公司广州办事处,http://www.11467.com/guangzhou/co/281083.htm
骏湖废纸回收公司,http://www.11467.com/guangzhou/co/206106.htm
贵港正林纤维业有限公司,http://www.11467.com/guigang/co/5572.htm
贵港前进纸托公司（南宁）业务部,http://www.11467.com/guigang/co/6381.htm
贵港前进纸托产品公司,http://www.11467.com/guigang/co/6380.htm
贵州德纳仕工贸有限公司,http://www.11467.com/guiyang/co/73386.htm
德纳仕工贸易销售有限公司,http://www.11467.com/guiyang/co/70252.htm
鑫禾纸业有限公司,http://www.11467.com/haerbin/co/52622.htm
黑龙江粤景浆纸有限公司,http://www.11467.com/haerbin/co/21776.htm
哈尔滨瑞德经济技术合作公司,http://www.11467.com/haerbin/co/46213.htm
绥芬河三都纸业有限责任公司,http://www.11467.com/haerbin/co/46539.htm
绥芬河市三都纸业有限责任公司,http://www.11467.com/haerbin/co/49623.htm
邱县中洋纸业有限公司,http://www.11467.com/handan/co/27107.htm
杭州鼎尊贸易有限公司,http://www.11467.com/hangzhou/co/149864.htm
杭州贯宇贸易有限公司,http://www.11467.com/hangzhou/co/179863.htm
杭州金德瑞化学有限公司,http://www.11467.com/hangzhou/co/270594.htm
杭州沃华贸易有限公司,http://www.11467.com/hangzhou/co/271916.htm
杭州鹏威贸易有限公司,http://www.11467.com/hangzhou/co/213704.htm
杭州余杭骏马纸业有限公司,http://www.11467.com/hangzhou/co/78530.htm
桐庐星晨纸业有限公司,http://www.11467.com/hangzhou/co/89036.htm
加拿大环球销售公司,http://www.11467.com/hangzhou/co/235790.htm
临安家才竹粉有限公司,http://www.11467.com/hangzhou/co/370818.htm
临安市家才竹粉有限公司,http://www.11467.com/hangzhou/co/272006.htm
南大环保科技集团有限公司,http://www.11467.com/hangzhou/co/238046.htm
浙江省轻纺供销有限公司,http://www.11467.com/hangzhou/co/201460.htm
杭州至正实业有限公司纸浆部,http://www.11467.com/hangzhou/co/235804.htm
杭州至正实业口有限公司（纸浆部）,http://www.11467.com/hangzhou/co/235806.htm
安徽省粮油进出口有限公司,http://www.11467.com/hefei/co/82272.htm
安徽省技术进出口股份有限公司浆纸部,http://www.11467.com/hefei/co/87213.htm
衡水安平县兴鑫金属筛网有限公司总公司,http://www.11467.com/hengshui/co/34066.htm
山东河泽大华环保科技有限公司,http://www.11467.com/heze/co/20492.htm
菏泽思泉纸业有限公司,http://www.11467.com/heze/co/21111.htm
山东中盈纸业科技环保有限公司,http://www.11467.com/heze/co/34172.htm
金利达纸业有限公司,http://www.11467.com/huaian/co/36428.htm
鼎格國際事業有限公司,http://www.11467.com/huaian/co/51584.htm
湖南省洪江市海得利纸业有限公司,http://www.11467.com/huaihua/co/19030.htm
湖北宏达粉体销售公司,http://www.11467.com/huanggang/co/17632.htm
内蒙古运筹工贸有限责任公司,http://www.11467.com/huhehaote/co/33876.htm
惠州市金超人包装材料有限公司,http://www.11467.com/huizhou/co/63730.htm
湖州青木炭业有限公司,http://www.11467.com/huzhou/co/35324.htm
江门市新会区金博信贸易有限公司,http://www.11467.com/jiangmen/co/95858.htm
焦作瑞丰纸业有限公司,http://www.11467.com/jiaozuo/co/400.htm
沁阳市兰天造纸黑液综合利用工程有限公司,http://www.11467.com/jiaozuo/co/19420.htm
嘉兴市东轻科技贸易有限公司,http://www.11467.com/jiaxing/co/65869.htm
浙江莱仕浆纸有限公司,http://www.11467.com/jiaxing/co/87475.htm
浙江创洁纸业有限公司,http://www.11467.com/jiaxing/co/123699.htm
济南金盛伦经贸有限公司,http://www.11467.com/jinan/co/78309.htm
山东省济南市北垛春茶业商贸有限公司,http://www.11467.com/jinan/co/95149.htm
济南福润丰经贸有限公司,http://www.11467.com/jinan/co/95311.htm
山东东昊纸业有限公司,http://www.11467.com/jinan/co/136089.htm
山东省轻工业供销总公司化工部,http://www.11467.com/jinan/co/75843.htm
湖北荆门市格林环保纸模有限公司,http://www.11467.com/jingmen/co/14131.htm
荆州市宽宏纸业有限公司,http://www.11467.com/jingzhou/co/5537.htm
浙中纸浆模塑包装有限公司,http://www.11467.com/jinhua/co/122802.htm
义乌市鸿浩包装有限公司,http://www.11467.com/jinhua/co/124222.htm
锦州东鑫化工有限公司,http://www.11467.com/jinzhou/co/44270.htm
昆明鲁发商贸有限公司,http://www.11467.com/kunming/co/98079.htm
昆明市东方纸业有限公司,http://www.11467.com/kunming/co/108984.htm
临沧南华糖业有限公司,http://www.11467.com/kunming/co/103600.htm
莱芜兴业滤材树脂有限公司销售科,http://www.11467.com/laiwu/co/7197.htm
河北廊坊硅酸铝生产公司(海恩尼斯化工科技有限公司),http://www.11467.com/langfang/co/46484.htm
恒升竹木制公司,http://www.11467.com/leshan/co/20271.htm
连云港市国洲贸易有限公司,http://www.11467.com/lianyungang/co/41310.htm
甲乙（连云港）粘胶有限公司,http://www.11467.com/lianyungang/co/26054.htm
山东鲁西高科纤维机械助剂服务有限公司,http://www.11467.com/liaocheng/co/32432.htm
临沂市国新纸业有限公司,http://www.11467.com/linyi/co/2573.htm
鲁南纸业灌云公司,http://www.11467.com/linyi/co/58700.htm
临沂昌祺商贸有限公司,http://www.11467.com/linyi/co/66732.htm
临沂兰华中铁绿色环保包装有限公司供销部,http://www.11467.com/linyi/co/59389.htm
郯城县双嘉纸品有限公司,http://www.11467.com/linyi/co/95181.htm
一诺卫生用品公司,http://www.11467.com/linyi/co/66779.htm
广西嘉宇纸张纸浆有限公司（销售部）,http://www.11467.com/liuzhou/co/41790.htm
广西高富龙达商贸有限公司,http://www.11467.com/liuzhou/co/39596.htm
柳州两面针纸业有限公司,http://www.11467.com/liuzhou/co/39588.htm
柳州市洁美多纸业有限责任公司,http://www.11467.com/liuzhou/co/9582.htm
洛阳华众公司,http://www.11467.com/luoyang/co/49427.htm
汉中纸浆有限公司,http://www.11467.com/luoyang/co/49431.htm
泸州巨森纸业有限公司,http://www.11467.com/luzhou/co/17487.htm
华科科工贸有限公司,http://www.11467.com/maanshan/co/20487.htm
广州市华洁纸业有限公司,http://www.11467.com/maoming/co/32137.htm
四川新惠阳保鲜有限公司 网络销售部,http://www.11467.com/meishan/co/13836.htm
四川省绵阳市晟邦科技有限责任公司,http://www.11467.com/mianyang/co/34483.htm
三台县铄壩竹业科技有限公司,http://www.11467.com/mianyang/co/46542.htm
江西晨鸣纸业有限责任公司（脱墨车间,http://www.11467.com/nanchang/co/92323.htm
江西晨鸣纸业金源物流公司,http://www.11467.com/nanchang/co/86907.htm
江西省南昌市德顺贸易有限公司,http://www.11467.com/nanchang/co/83021.htm
南京福同享物资有限公司,http://www.11467.com/nanjing/co/114791.htm
