北京嘉禾木科技有限公司临漳分公司供应部,http://www.11467.com/handan/co/52117.htm
杭州艾森哲进出口有限公司(纸浆部),http://www.11467.com/hangzhou/co/271904.htm
富阳中富纸业有限公司,http://www.11467.com/hangzhou/co/100511.htm
杭州市深凯冲浪板有限公司,http://www.11467.com/hangzhou/co/311193.htm
杭州华锦进出口有限公司销售部,http://www.11467.com/hangzhou/co/235668.htm
杭州经安进出口有限公司（业务）,http://www.11467.com/hangzhou/co/271710.htm
杭州玄通特种纸销售有限公司(业务部）,http://www.11467.com/hangzhou/co/271824.htm
杭州华锦进出口有限公司,http://www.11467.com/hangzhou/co/236193.htm
杭州天宁机械制造有限公司,http://www.11467.com/hangzhou/co/243586.htm
杭州华锦进出口有限公司进口部,http://www.11467.com/hangzhou/co/235997.htm
杭州天海物资有限公司,http://www.11467.com/hangzhou/co/269816.htm
浙江中包浆纸进出口有限公司,http://www.11467.com/hangzhou/co/259478.htm
浙江省物产化工集团有限公司浆纸部,http://www.11467.com/hangzhou/co/270941.htm
浙江物产实业控股集团有限公司,http://www.11467.com/hangzhou/co/270487.htm
浙江万邦浆纸集团有限公司业务部,http://www.11467.com/hangzhou/co/235651.htm
杭州国纪经贸有限公司,http://www.11467.com/hangzhou/co/175662.htm
浙江万邦浆纸集团有限公司　销售部,http://www.11467.com/hangzhou/co/235693.htm
浙江华立国际发展有限公司进口部,http://www.11467.com/hangzhou/co/244110.htm
浙江东方纸业有限公司,http://www.11467.com/hangzhou/co/235670.htm
浙江升华贸易有限公司,http://www.11467.com/hangzhou/co/271616.htm
安徽华文国际经贸股份有限公司　进口一部,http://www.11467.com/hefei/co/86645.htm
安徽省丝绸股份有限公司贸发部,http://www.11467.com/hefei/co/86824.htm
安徽省合肥市同力纸浆有限公司,http://www.11467.com/hefei/co/82309.htm
合肥银山棉麻股份有限公司,http://www.11467.com/hefei/co/72353.htm
合肥银山棉麻股份有限公司（棉浆粕经营公司）,http://www.11467.com/hefei/co/94580.htm
华文经贸有限公司,http://www.11467.com/hefei/co/94634.htm
河北衡水大禹纸业有限公司,http://www.11467.com/hengshui/co/23257.htm
山东省单县天元纸业有限公司,http://www.11467.com/heze/co/9238.htm
中承纸业有限公司,http://www.11467.com/heze/co/34171.htm
京长风科技有限公司,http://www.11467.com/hezhou/co/4977.htm
湖南省长宏纸业有限公司,http://www.11467.com/huaihua/co/21432.htm
科硕节能建材科技有限公司,http://www.11467.com/huainan/co/20378.htm
武汉大别山纸业有限公司,http://www.11467.com/huanggang/co/15872.htm
黄山市黄山区振太有限公司,http://www.11467.com/huangshan/co/12332.htm
兴城市盛昌隆农副食品有限公司,http://www.11467.com/huludao/co/45858.htm
佳木斯源林纸业有限公司,http://www.11467.com/jiamusi/co/35474.htm
东莞市诺信瑞鑫科技创新纸业有限公司,http://www.11467.com/jiangmen/co/91009.htm
江门市江海区天之娇纸品有限公司,http://www.11467.com/jiangmen/co/3865.htm
江门市新会区辉昊化工有限公司,http://www.11467.com/jiangmen/co/114796.htm
时利和竹业有限公司,http://www.11467.com/jiangmen/co/115135.htm
美国华隆贸易有限公司驻广东办事处,http://www.11467.com/jiangmen/co/95411.htm
利得信贸易有限公司,http://www.11467.com/jiangmen/co/116320.htm
嘉兴市中天经贸有限公司,http://www.11467.com/jiaxing/co/83039.htm
广东揭阳洋鹏贸易责任有限公司,http://www.11467.com/jieyang/co/22922.htm
济南市一轻工业供销总公司纸业部,http://www.11467.com/jinan/co/95220.htm
山东金融资产服务管理公司,http://www.11467.com/jinan/co/75860.htm
济南市一轻工业供销总公司（木浆业务部）,http://www.11467.com/jinan/co/95268.htm
济南亿霖木业有限公司,http://www.11467.com/jinan/co/75777.htm
山东创亿绿源实业有限公司,http://www.11467.com/jinan/co/75846.htm
雨林贸易公司,http://www.11467.com/jinan/co/75880.htm
岩泉华工有限公司,http://www.11467.com/jinan/co/95363.htm
鑫康环能科技实业有限公司,http://www.11467.com/jinzhong/co/27574.htm
金城造纸股份有限公司,http://www.11467.com/jinzhou/co/26736.htm
锦州金亮塑料制品有限公司,http://www.11467.com/jinzhou/co/19702.htm
开封市长河吟物资回收公司,http://www.11467.com/kaifeng/co/14361.htm
云南思豪经贸有限公司,http://www.11467.com/kunming/co/109715.htm
宏昌纸业有限公司,http://www.11467.com/langfang/co/30229.htm
连云港市华丰实业有限公司,http://www.11467.com/lianyungang/co/21672.htm
临清市鑫达碳酸钙有限公司,http://www.11467.com/liaocheng/co/47131.htm
金门卫生巾原材料有限公司,http://www.11467.com/linyi/co/66792.htm
临沂市友源经贸有限公司业务部,http://www.11467.com/linyi/co/58651.htm
临沂市祥山化工有限公司,http://www.11467.com/linyi/co/94852.htm
临沂有限公司,http://www.11467.com/linyi/co/95182.htm
广西荣昌医药公司,http://www.11467.com/liuzhou/co/41800.htm
甘肃维格农恳发展有限公司,http://www.11467.com/longnan/co/9415.htm
福建省龙岩市祥泰造纸包装有限公司,http://www.11467.com/longyan/co/21292.htm
龙岩联环纸制品包装有限公司,http://www.11467.com/longyan/co/21285.htm
河南漯河实达科技发展有限公司,http://www.11467.com/luohe/co/17007.htm
洛阳锦帛植物材料有限公司,http://www.11467.com/luoyang/co/49437.htm
叙永县荆榜竹类商贸有限责任公司,http://www.11467.com/luzhou/co/17541.htm
泸州兴兴纸浆有限公司,http://www.11467.com/luzhou/co/17539.htm
泸州市雀氏竹浆发展有限公司,http://www.11467.com/luzhou/co/17545.htm
茂名海迪贸易公司,http://www.11467.com/maoming/co/39845.htm
宜信发展公司,http://www.11467.com/maoming/co/39933.htm
江西省奇盛源农业生物科技有限公司,http://www.11467.com/nanchang/co/92652.htm
江西纸业进出口公司,http://www.11467.com/nanchang/co/108500.htm
江西杨氏集团总公司,http://www.11467.com/nanchang/co/87131.htm
南昌三达造纸机械有限公司,http://www.11467.com/nanchang/co/82765.htm
江苏明华非金属矿新材料有限公司,http://www.11467.com/nanjing/co/30827.htm
南京乾华经贸发展有限公司,http://www.11467.com/nanjing/co/65785.htm
南京欧林再生资源有限责任公司,http://www.11467.com/nanjing/co/65691.htm
广西南宁益禄旺纸业有限公司,http://www.11467.com/nanning/co/87847.htm
南宁爱普贸易有限公司,http://www.11467.com/nanning/co/69081.htm
广西沙龙纸业有限公司,http://www.11467.com/nanning/co/63020.htm
南宁裕能纸业有限公司,http://www.11467.com/nanning/co/63034.htm
广西宏阳纸业有限公司,http://www.11467.com/nanning/co/68723.htm
万林木业有限公司,http://www.11467.com/nanning/co/69039.htm
广西南宁润驰商贸有限公司,http://www.11467.com/nanning/co/69059.htm
广西恒林源贸易有限责任公司,http://www.11467.com/nanning/co/69011.htm
黄氏贸易有限公司南宁办事处,http://www.11467.com/nanning/co/63044.htm
南宁市唯美造纸设备有限公司,http://www.11467.com/nanning/co/32264.htm
广西南宁市蒲糖纸业有限公司,http://www.11467.com/nanning/co/69072.htm
南平市森辉商贸有限公司,http://www.11467.com/nanping/co/26370.htm
长远物流有限公司,http://www.11467.com/nantong/co/137975.htm
南阳泰龙纸业集团有限公司,http://www.11467.com/nanyang/co/38417.htm
宁波科伦纸业有限公司,http://www.11467.com/ningbo/co/120740.htm
山水绿色包装有限公司,http://www.11467.com/ningbo/co/195651.htm
福建阿肯纸业公司,http://www.11467.com/putian/co/39216.htm
濮龙丰纸业有限公司,http://www.11467.com/puyang/co/19147.htm
青岛中易纸业有限公司销售部,http://www.11467.com/qingdao/co/81700.htm
山东华富通国际贸易有限公司,http://www.11467.com/qingdao/co/102824.htm
康日洁有限公司,http://www.11467.com/qingdao/co/81776.htm
世友贸易公司,http://www.11467.com/qingdao/co/155572.htm
山东三明生物科技有限公司青岛林业分公司,http://www.11467.com/qingdao/co/102862.htm
青岛同诚纸模包装有限公司(销售部）,http://www.11467.com/qingdao/co/102789.htm
青岛宏业林浆纸有限公司,http://www.11467.com/qingdao/co/102796.htm
青岛厦森经贸有限公司,http://www.11467.com/qingdao/co/102769.htm
清远市成威原材料有限公司,http://www.11467.com/qingyuan/co/23189.htm
东北光华森林贸易公司,http://www.11467.com/qiqihaer/co/58377.htm
百达建设咨询有限公司,http://www.11467.com/rizhao/co/12125.htm
福建省三农碳酸钙有限责任公司,http://www.11467.com/sanming/co/12468.htm
福建沙县富康纸业有限公司,http://www.11467.com/sanming/co/36208.htm
广兴纸制品（始兴）有限公司,http://www.11467.com/shaoguan/co/23120.htm
广东省中竹纸业有限公司,http://www.11467.com/shaoguan/co/29426.htm
绍兴三山贸易有限公司,http://www.11467.com/shaoxing/co/80398.htm
绍兴美洲纸业包装有限公司,http://www.11467.com/shaoxing/co/371.htm
邵阳市骏马纸业有限责任公司,http://www.11467.com/shaoyang/co/23506.htm
绥宁县胜德造纸有限责任公司,http://www.11467.com/shaoyang/co/10689.htm
绥宁宝庆联合造纸有限公司,http://www.11467.com/shaoyang/co/26774.htm
沈阳绿广纸制品有限公司,http://www.11467.com/shenyang/co/49853.htm
沈阳金惠得纸业有限公司,http://www.11467.com/shenyang/co/58226.htm
蒙氏纸业有限公司,http://www.11467.com/shenyang/co/57509.htm
广东优品竹浆有限公司,http://www.11467.com/shenzhen/co/480256.htm
深圳市方嘉商贸有限公司贸易部,http://www.11467.com/shenzhen/co/297110.htm
深圳安健达实业发展有限公司,http://www.11467.com/shenzhen/co/592103.htm
深圳市华爵投资有限公司,http://www.11467.com/shenzhen/co/591012.htm
深圳市科信隆环保包装制品有限公司-业务部,http://www.11467.com/shenzhen/co/588083.htm
深圳市科信隆环保包装制品有限公司,http://www.11467.com/shenzhen/co/54083.htm
深圳市沙井镇力隆环保包装制品有限公司,http://www.11467.com/shenzhen/co/770821.htm
深圳市浦诚贸易有限公司紙品經營部,http://www.11467.com/shenzhen/co/571028.htm
"深圳市铭丰纸塑包装制品有限公司/业务部,",http://www.11467.com/shenzhen/co/564588.htm
深圳市铭丰纸塑包装有限公司@,http://www.11467.com/shenzhen/co/592001.htm
深圳市裕煌胶贴制品有限公司,http://www.11467.com/shenzhen/co/775598.htm
深圳市夏克贸易有限公司,http://www.11467.com/shenzhen/co/591642.htm
沃普生纸浆模塑设备有限公司,http://www.11467.com/shenzhen/co/103749.htm
深圳翔瑞科技有限公司,http://www.11467.com/shenzhen/co/765533.htm
英赛特纸品有限公司,http://www.11467.com/shenzhen/co/274471.htm
河北物发进出口贸易有限公司,http://www.11467.com/shijiazhuang/co/116523.htm
十堰利丹纤维制品有限公司,http://www.11467.com/shiyan/co/28465.htm
朔州木材公司,http://www.11467.com/shuozhou/co/8170.htm
昆山格瑞特环保科技有限公司,http://www.11467.com/suzhou/co/349731.htm
苏州工业园区瑞莎贸易有限公司,http://www.11467.com/suzhou/co/250296.htm
苏州枫港钛材设备制造有限公司（销售部）,http://www.11467.com/suzhou/co/229707.htm
佳木斯外贸包装公司,http://www.11467.com/suzhou/co/324353.htm
苏州工业园区亚太纸品加工有限公司,http://www.11467.com/suzhou/co/174599.htm
腾辉贸易有限公司业务部,http://www.11467.com/suzhou/co/228644.htm
苏州金丝网业有限公司,http://www.11467.com/suzhou/co/141372.htm
明惠缘电子科技有限公司,http://www.11467.com/suzhou/co/218998.htm
山西太原浩富经贸有限公司,http://www.11467.com/taiyuan/co/52674.htm
台州市茂林纸业有限公司(销售部门),http://www.11467.com/taizhou/co/84811.htm
泰州市金泰纸品贸易有限公司,http://www.11467.com/taizhoushi/co/28124.htm
青州市储运商贸有限公司,http://www.11467.com/weifang/co/118570.htm
青州市鑫源贸易有限公司,http://www.11467.com/weifang/co/119314.htm
华文商贸有限公司,http://www.11467.com/wenzhou/co/135431.htm
宜昌神济生态资源开发有限公司汉口分公司,http://www.11467.com/wuhan/co/68939.htm
雷顿服饰有限公司,http://www.11467.com/wuhu/co/23516.htm
广西岑溪中泰富纸业有限公司,http://www.11467.com/wuzhou/co/7682.htm
麻蕉纸浆厦门代理有限公司,http://www.11467.com/xiamen/co/39810.htm
厦门市广天包装有限公司,http://www.11467.com/xiamen/co/94445.htm
农正天成(厦门）现代农业开发有限公司,http://www.11467.com/xiamen/co/41694.htm
厦门榕兴纸业制造有限公司营销部,http://www.11467.com/xiamen/co/52344.htm
中国厦门市榕薪环保设备有限公司,http://www.11467.com/xiamen/co/52466.htm
厦门宝好生活用品公司,http://www.11467.com/xiamen/co/39774.htm
厦门医药保健品进出口公司,http://www.11467.com/xiamen/co/28877.htm
厦门杰凯纸制品有限公司,http://www.11467.com/xiamen/co/52340.htm
陕西长荣和化工有限公司,http://www.11467.com/xian/co/98360.htm
陕西祥源农业综合开发有限公司,http://www.11467.com/xian/co/75998.htm
西安明创展览有限公司,http://www.11467.com/xian/co/122647.htm
陕西益和印物有限责任公司,http://www.11467.com/xian/co/75362.htm
西安旭昌电子科技有限公司,http://www.11467.com/xian/co/95243.htm
西安索元特工贸有限责任公司,http://www.11467.com/xian/co/74623.htm
南漳县华林木业有限公司,http://www.11467.com/xiangfan/co/43899.htm
智桥造纸科技公司,http://www.11467.com/xianyang/co/22041.htm
河北华丰公司,http://www.11467.com/xintai/co/50150.htm
丰源（邢台）特种纸业有限公司,http://www.11467.com/xintai/co/3390.htm
方圆纸业公司,http://www.11467.com/xinxiang/co/24376.htm
新乡造纸技术服务有限公司,http://www.11467.com/xinxiang/co/24413.htm
河南新乡市大振筛机有限公司,http://www.11467.com/xinxiang/co/24379.htm
徐州富民再生公司,http://www.11467.com/xuzhou/co/54227.htm
徐州亮华纸塑制品有限公司,http://www.11467.com/xuzhou/co/80731.htm
云南云景林纸股有限公司,http://www.11467.com/xuzhou/co/81950.htm
盐城市常城秸秆有限公司,http://www.11467.com/yancheng/co/57745.htm
盐城市常城秸秆有限公司销售部,http://www.11467.com/yancheng/co/57752.htm
江苏三里港高空修建防腐有限公司,http://www.11467.com/yancheng/co/57759.htm
烟台市欣荣纸品贸易有限责任公司,http://www.11467.com/yantai/co/126771.htm
四川宜宾长毅浆粕有限责任公司,http://www.11467.com/yibin/co/23909.htm
宜昌舒云卫生用品有限公司行销部,http://www.11467.com/yichang/co/44321.htm
经贸物产贸易公司,http://www.11467.com/yingkou/co/42877.htm
辽宁营口华邦纸业销售公司,http://www.11467.com/yingkou/co/42870.htm
营口中林公司,http://www.11467.com/yingkou/co/41753.htm
岳阳市普莱顿造纸化学品有限公司,http://www.11467.com/yueyang/co/33069.htm
达士尼商务集团有限公司,http://www.11467.com/yulin/co/21220.htm
广西益客纸业有限公司,http://www.11467.com/yulin/co/18021.htm
山西省剧心科技有限公司,http://www.11467.com/yuncheng/co/30796.htm
广州博伺乐自动化设备有限公司销售总部,http://www.11467.com/yunfu/co/19221.htm
云南江川翠峰纸业有限公司,http://www.11467.com/yuxi/co/3428.htm
海特科技纸制品有限公司,http://www.11467.com/zaozhuang/co/26736.htm
山东秦世集团双龙纸业有限公司,http://www.11467.com/zaozhuang/co/27924.htm
漳州三利达环保产业开发有限公司,http://www.11467.com/zhangzhou/co/21982.htm
湛江恒基公司,http://www.11467.com/zhanjiang/co/42607.htm
遂溪县恒隆淀粉有限公司,http://www.11467.com/zhanjiang/co/18820.htm
湛江冠龙纸业有限公司,http://www.11467.com/zhanjiang/co/251.htm
广东鼎丰纸业有限公司,http://www.11467.com/zhaoqing/co/7858.htm
河南省轻工业品进出口集团有限公司大地纸业,http://www.11467.com/zhengzhou/co/107054.htm
河南欣豫国际浆纸有限公司,http://www.11467.com/zhengzhou/co/172908.htm
河南云新进出口贸易公司,http://www.11467.com/zhengzhou/co/125283.htm
河南欣豫国际贸易有限公司,http://www.11467.com/zhengzhou/co/125444.htm
河南鸿运木材粉碎设备有限公司,http://www.11467.com/zhengzhou/co/173392.htm
郑州大可贸易有限公司业务部,http://www.11467.com/zhengzhou/co/106658.htm
河南云新进出口贸易有限公司,http://www.11467.com/zhengzhou/co/173905.htm
河南运新进出口贸易有限公司,http://www.11467.com/zhengzhou/co/125368.htm
河南润华科技有限公司,http://www.11467.com/zhengzhou/co/117368.htm
镇江南泰对外经贸有限公司进出口一部,http://www.11467.com/zhenjiang/co/47657.htm
恒华纸业公司,http://www.11467.com/zhenjiang/co/47708.htm
中山市火炬开开发区佳能公司,http://www.11467.com/zhongshan/co/81441.htm
中山市三角纸品制造有限公司(采购部),http://www.11467.com/zhongshan/co/60622.htm
中山维臣纸业有限公司,http://www.11467.com/zhongshan/co/100919.htm
中山市星达集团有限公司,http://www.11467.com/zhongshan/co/99066.htm
周口绿海林业发展有限公司,http://www.11467.com/zhoukou/co/17497.htm
沈丘宏达纸业有限公司,http://www.11467.com/zhoukou/co/21172.htm
广东省珠海市伴球有限公司,http://www.11467.com/zhuhai/co/74070.htm
晨尧贸易公司,http://www.11467.com/zibo/co/80551.htm
山东淄博安泰进出口有限公司,http://www.11467.com/zibo/co/67705.htm
淄博远达陶瓷机械设备有限公司,http://www.11467.com/zibo/co/74005.htm
淄博银雪泡花碱有限公司,http://www.11467.com/zibo/co/50823.htm
北京华清慧伦科技有限公司,http://www.11467.com/beijing/co/694624.htm
北京锐士高科植物纤维制品有限公司,http://www.11467.com/beijing/co/221226.htm
北京海天塑料制品有限公司,http://www.11467.com/beijing/co/692295.htm
北京瑞博特印刷器材有限责任公司,http://www.11467.com/beijing/co/705703.htm
北京恋日宏大橡胶有限公司,http://www.11467.com/beijing/co/282260.htm
北京汤丽纸业贸易有限责任公司业务部,http://www.11467.com/beijing/co/251436.htm
北京增圆投资开发有限公司,http://www.11467.com/beijing/co/419009.htm
北京天资绿源科技开发有限公司,http://www.11467.com/beijing/co/220745.htm
中外合资北京嘉禾木科技有限公司,http://www.11467.com/beijing/co/419043.htm
中印物质贸易有限公司,http://www.11467.com/beijing/co/672920.htm
北京中基明星纸业有限公司华北,http://www.11467.com/beijing/co/179348.htm
北京中基明星纸业有限公司国内业务部,http://www.11467.com/beijing/co/178289.htm
上海峰联浆纸有限公司,http://www.11467.com/shanghai/co/679694.htm
上海建发实业有限公司纸业部,http://www.11467.com/shanghai/co/679727.htm
上海江永纸业有限公司(销售部),http://www.11467.com/shanghai/co/37550.htm
上海日田子纸业有限公司,http://www.11467.com/shanghai/co/1041972.htm
上海三瑟德仪器有限公司(外资),http://www.11467.com/shanghai/co/742283.htm
上海爱林纸业有限公司,http://www.11467.com/shanghai/co/936550.htm
上海森茂浆纸有限公司,http://www.11467.com/shanghai/co/679662.htm
上海怡括贸易有限公司,http://www.11467.com/shanghai/co/1041970.htm
上海亿德利纸业有限公司,http://www.11467.com/shanghai/co/21018.htm
上海誉衡商贸有限公司纸浆部,http://www.11467.com/shanghai/co/663622.htm
中轻上海进出口公司,http://www.11467.com/shanghai/co/1059147.htm
厦门象屿集团公司,http://www.11467.com/shanghai/co/246716.htm
上海菩漫贸易有限公司,http://www.11467.com/shanghai/co/1046433.htm
上海纸源工贸有限公司,http://www.11467.com/shanghai/co/1048198.htm
福州玉国贸易有限公司,http://www.11467.com/fuzhou/co/171667.htm
富阳华伦纸业有限公司,http://www.11467.com/hangzhou/co/97826.htm
富阳市文博纸业有限公司,http://www.11467.com/hangzhou/co/100455.htm
富阳市明鑫纸业有限公司,http://www.11467.com/hangzhou/co/100638.htm
杭州瑞东贸易有限公司,http://www.11467.com/hangzhou/co/196634.htm
云南纸源工贸有限公司,http://www.11467.com/kunming/co/79389.htm
广西斯壮股份有限公司贸易分公司,http://www.11467.com/nanning/co/38325.htm
邵阳市天成造纸有限公司,http://www.11467.com/shaoyang/co/26284.htm
山西八同纸业有限公司,http://www.11467.com/taiyuan/co/25195.htm
宜兴市圣德力合成革材料有限公司,http://www.11467.com/wuxi/co/163157.htm
厦门硕丰进出口有限公司,http://www.11467.com/xiamen/co/14067.htm
河南省大地纸业有限公司,http://www.11467.com/zhengzhou/co/29945.htm
镇江红鑫纸业有限公司,http://www.11467.com/zhenjiang/co/1829.htm
中山市德伦包装材料有限公司,http://www.11467.com/zhongshan/co/18896.htm
中山市星达纸品厂有限公司,http://www.11467.com/zhongshan/co/25678.htm
淄博昶宇国际贸易有限公司,http://www.11467.com/zibo/co/98210.htm
上海中冶国际经济贸易有限公司,http://www.11467.com/shanghai/co/639817.htm
天津市必利优科技发展有限公司,http://www.11467.com/tianjin/co/162432.htm
天津市佰纳纸业有限公司,http://www.11467.com/tianjin/co/161991.htm
天津海洁纸业发展有限公司,http://www.11467.com/tianjin/co/154034.htm
天津宏大盛通进出口贸易有限公司,http://www.11467.com/tianjin/co/48623.htm
天津世纪乐风国际贸易有限公司,http://www.11467.com/tianjin/co/90460.htm
天津扬普商贸有限公司,http://www.11467.com/tianjin/co/200147.htm
天津涌金纸制品有限公司,http://www.11467.com/tianjin/co/189646.htm
天津优怡酒店用品销售有限公司,http://www.11467.com/tianjin/co/78289.htm
天津市中澳纸业有限公司,http://www.11467.com/tianjin/co/55498.htm
天津外总集团轻工有限公司,http://www.11467.com/tianjin/co/75755.htm
天津市兄弟纸业有限公司,http://www.11467.com/tianjin/co/163523.htm
天津市亚太博易投资咨询有限公司,http://www.11467.com/tianjin/co/74519.htm
重庆方盛净化设备有限公司销售部,http://www.11467.com/chongqing/co/79555.htm
新兴纸业公司,http://www.11467.com/chongqing/co/206481.htm
重慶理文造紙有限公司,http://www.11467.com/chongqing/co/159972.htm
重庆钱海废旧生产资料回收有限公司,http://www.11467.com/chongqing/co/159676.htm
天津金证科技造纸有限公司,http://www.11467.com/tianjin/co/302156.htm
安徽津商生物科技有限公司,http://www.11467.com/tianjin/co/302370.htm
天津逸飞铭纸业有限公司,http://www.11467.com/tianjin/co/302374.htm
芸海工贸发展有限公司,http://www.11467.com/tianjin/co/306234.htm
中博商务有限公司,http://www.11467.com/tianjin/co/306236.htm
济南舜谊商贸有限公司,http://www.11467.com/jinan/co/153048.htm
奉新季布诺纸浆回收有限公司,http://www.11467.com/qiye/91027779.htm
江门市德祥电子有限公司,http://www.11467.com/qiye/93204488.htm
河南省大地纸业有限公司,http://www.11467.com/zhengzhou/co/29945.htm
镇江红鑫纸业有限公司,http://www.11467.com/zhenjiang/co/1829.htm
中山市德伦包装材料有限公司,http://www.11467.com/zhongshan/co/18896.htm
中山市星达纸品厂有限公司,http://www.11467.com/zhongshan/co/25678.htm
淄博昶宇国际贸易有限公司,http://www.11467.com/zibo/co/98210.htm
天津外总集团轻工有限公司,http://www.11467.com/tianjin/co/75755.htm
芜湖市晨鹏纸浆模塑有限公司,http://www.11467.com/qiye/29827098.htm
佛山市顺德区苏尔仕纸浆模塑设备有限公司,http://www.11467.com/qiye/61229371.htm
哈尔滨连江纸浆模型设备有限公司,http://www.11467.com/qiye/61311772.htm
西安顶泰纸浆纸张有限公司,http://www.11467.com/qiye/63223449.htm
济宁碧海纸浆科技有限公司,http://www.11467.com/qiye/64612884.htm
宜城大雁工业公司纸浆厂,http://www.11467.com/qiye/65296932.htm
宁波保税区保得利纸浆栈板有限公司,http://www.11467.com/qiye/65778318.htm
江西佳森纸浆有限公司,http://www.11467.com/qiye/70169264.htm
济南新绿宝纸浆用品有限公司,http://www.11467.com/qiye/72199024.htm
吉林市鑫嘉源联友纸浆有限公司,http://www.11467.com/qiye/81152035.htm
江门市美泰纸浆贸易有限公司,http://www.11467.com/qiye/82624256.htm
乐清市海昌纸浆模塑有限公司,http://www.11467.com/qiye/82872043.htm
上海国吉纸浆纸张贸易有限公司,http://www.11467.com/qiye/83296313.htm
上海国吉纸浆纸张贸易有限公司分公司,http://www.11467.com/qiye/83296314.htm
安吉瑞特纸浆销售有限公司,http://www.11467.com/qiye/84041703.htm
长沙金湘纸张纸浆经销有限公司,http://www.11467.com/qiye/84834353.htm
山东茌平兴华纸浆制品有限公司,http://www.11467.com/qiye/86168998.htm
大连高新园区金华纸浆制品有限公司,http://www.11467.com/qiye/86400259.htm
杭州北亚瑞松纸张纸浆有限公司,http://www.11467.com/qiye/86455837.htm
四川广安纸浆制品有限公司,http://www.11467.com/qiye/88732234.htm
中山市龙昊纸浆有限公司义乌分公司,http://www.11467.com/qiye/89052506.htm
中卫县百丰纸浆餐具制品有限公司,http://www.11467.com/qiye/89986919.htm
上海宝星纸浆模塑有限公司,http://www.11467.com/qiye/90036287.htm
沈阳加林纸张纸浆有限公司,http://www.11467.com/qiye/90501791.htm
