南京福同享物质有限公司-南京纸张加工厂,http://www.11467.com/nanjing/co/65918.htm
美国(棉花)市场服务公司南京代表处,http://www.11467.com/nanjing/co/32779.htm
江苏三里港高空修建防腐有限公司,http://www.11467.com/nanjing/co/87050.htm
南京四新科技应用研究所有限公司造纸事业部,http://www.11467.com/nanjing/co/55101.htm
香港兴隆国际发展有限公司H.K. XINGLONG,http://www.11467.com/nanjing/co/65468.htm
万林木业公司,http://www.11467.com/nanning/co/69040.htm
广西南宁宏发纸业有限公司,http://www.11467.com/nanning/co/68270.htm
广西东亚纸业有限公司,http://www.11467.com/nanning/co/63303.htm
广西南宁市润驰商贸有限公司,http://www.11467.com/nanning/co/69060.htm
广西正能纸业有限公司（蒲新纸厂）,http://www.11467.com/nanning/co/68761.htm
南寧動點公司,http://www.11467.com/nanning/co/69052.htm
南宁茂峻贸易有限责任公司,http://www.11467.com/nanning/co/53109.htm
南宁市蒲糖纸业有限公司销售部,http://www.11467.com/nanning/co/63054.htm
南宁凤凰纸业公司,http://www.11467.com/nanning/co/69066.htm
南宁市卓发信贸易有限公司,http://www.11467.com/nanning/co/69095.htm
马山和发纸业有限公司,http://www.11467.com/nanning/co/63017.htm
广西南宁市广森纸业有限公司,http://www.11467.com/nanning/co/63168.htm
福建省南平市福正造纸机械有限公司,http://www.11467.com/nanping/co/38576.htm
南通凯乐纸业包装有限公司,http://www.11467.com/nantong/co/137611.htm
南阳泰龙纸业新野有限公司,http://www.11467.com/nanyang/co/24699.htm
艾普乐思工贸有限公司,http://www.11467.com/ningbo/co/120877.htm
甘肃维格农垦发展有限公司销售部,http://www.11467.com/ningbo/co/83243.htm
宁波市文缘纸浆模塑制品有限公司,http://www.11467.com/ningbo/co/83302.htm
广东东和实业有限公司,http://www.11467.com/shanwei/co/12375.htm
华联物资公司,http://www.11467.com/shaoguan/co/24484.htm
亦珠基业有限公司,http://www.11467.com/shaoxing/co/80414.htm
亿铭纸业有限公司,http://www.11467.com/shaoxing/co/77545.htm
辽宁鸿皓纸业有限公司,http://www.11467.com/shenyang/co/772.htm
北方纸张贸易公司,http://www.11467.com/shenzhen/co/564048.htm
广东弘茂集团弘茂实业深圳分公司,http://www.11467.com/shenzhen/co/591800.htm
皇都贸易公司,http://www.11467.com/shenzhen/co/590668.htm
富阳市明鑫纸业有限公司,http://www.11467.com/ningbo/co/143827.htm
余姚鸿翔印务有限公司,http://www.11467.com/ningbo/co/196095.htm
宁波江北鑫宝贸易有限公司,http://www.11467.com/ningbo/co/53751.htm
盘锦春成纸业有限公司,http://www.11467.com/panjin/co/10304.htm
福建莆田市金伦纸业有限公司,http://www.11467.com/putian/co/28153.htm
龙丰纸业有限公司,http://www.11467.com/puyang/co/20252.htm
青岛世纪纸业有限公司,http://www.11467.com/qingdao/co/102773.htm
青岛中易纸业有限公司保税区销售部,http://www.11467.com/qingdao/co/102833.htm
山东省轻工业供销总公司青岛分公司,http://www.11467.com/qingdao/co/102743.htm
青岛中易职业有限公司,http://www.11467.com/qingdao/co/102798.htm
青岛中易国际贸易有限公司,http://www.11467.com/qingdao/co/124512.htm
青岛江容国际贸易有限公司,http://www.11467.com/qingdao/co/102654.htm
山东省青岛市蔚蓝远东国际贸易有限公司,http://www.11467.com/qingdao/co/81736.htm
青岛纽威国际贸易有限公司,http://www.11467.com/qingdao/co/102682.htm
青岛威尔华贸易有限公司,http://www.11467.com/qingdao/co/81722.htm
青岛凯瑞思国际贸易有限公司,http://www.11467.com/qingdao/co/152833.htm
青岛欧美投资有限公司,http://www.11467.com/qingdao/co/102696.htm
青岛凯特尔贸易有限公司,http://www.11467.com/qingdao/co/81775.htm
青岛江容国际贸易有限公司业务部,http://www.11467.com/qingdao/co/81689.htm
青岛天润振远国际贸易有限公司,http://www.11467.com/qingdao/co/81738.htm
仁和纸业有限公司,http://www.11467.com/qinhuangdao/co/33439.htm
鸣宝生活用品福建有限公司,http://www.11467.com/quanzhou/co/98900.htm
泉州市丰泽区诚实木浆棉有限公司,http://www.11467.com/quanzhou/co/105668.htm
浙江恒达纸业有限公司,http://www.11467.com/quzhou/co/7168.htm
浙江鑫茂贸易有限公司,http://www.11467.com/quzhou/co/21551.htm
浙江鑫丰特种纸业股份有限公司采购部,http://www.11467.com/quzhou/co/21508.htm
成龙进出口公司,http://www.11467.com/rizhao/co/12211.htm
山东亚太森博浆纸有限公司,http://www.11467.com/rizhao/co/12120.htm
香港三联林业产品有限公司日照办事处,http://www.11467.com/rizhao/co/11163.htm
福建省青山纸业有限公司,http://www.11467.com/sanming/co/36202.htm
华峰制浆股份有限公司,http://www.11467.com/shangqiu/co/20979.htm
永盛秸秆有限公司,http://www.11467.com/shangqiu/co/16507.htm
汕头市鑫达贸易有限公司,http://www.11467.com/shantou/co/65084.htm
汕头市造纸实业有限公司,http://www.11467.com/shantou/co/123573.htm
兴仕有限公司,http://www.11467.com/shanwei/co/8983.htm
锦天鸿进出口贸易有限公司,http://www.11467.com/shenzhen/co/488158.htm
加拿大皇家DMGS进出口公司中国代表处,http://www.11467.com/shenzhen/co/286751.htm
锦胜（深圳）包装有限公司,http://www.11467.com/shenzhen/co/429631.htm
深圳前进纸托产品贸易公司,http://www.11467.com/shenzhen/co/591576.htm
辽宁营口造纸有限公司,http://www.11467.com/shenzhen/co/590978.htm
泉州市远东鑫美纸制品有限公司深圳办事处,http://www.11467.com/shenzhen/co/270066.htm
深圳鲁越机械设备有限公司,http://www.11467.com/shenzhen/co/765534.htm
深圳市超导环保科技有限公司（纸浆贸易部）,http://www.11467.com/shenzhen/co/590681.htm
连州市伟信硅灰石钙业有限公司(驻深圳办事处),http://www.11467.com/shenzhen/co/770820.htm
深圳航亮实业有限公司lsz,http://www.11467.com/shenzhen/co/588363.htm
荣信纸品有限公司,http://www.11467.com/shenzhen/co/567021.htm
深圳金红叶纸业有限公司,http://www.11467.com/shenzhen/co/591016.htm
深圳市构思生物技术有限公司,http://www.11467.com/shenzhen/co/64483.htm
深圳市鸿利酒店用品有限公司,http://www.11467.com/shenzhen/co/269445.htm
深圳市汇盛纸业有限公司 纸杯厂,http://www.11467.com/shenzhen/co/574717.htm
深圳市华祥和纸业有限公司,http://www.11467.com/shenzhen/co/271461.htm
深圳市昆保达纸塑包装制品有限公司（销售部）,http://www.11467.com/shenzhen/co/311731.htm
深圳市利文达实业有限公司,http://www.11467.com/shenzhen/co/648844.htm
深圳市联合鑫科技有限公司/市场销售部,http://www.11467.com/shenzhen/co/547756.htm
深圳市奥力奇清洁用品有限公司,http://www.11467.com/shenzhen/co/49968.htm
深圳市铭丰纸浆模塑（纸托）包装制品有限公司,http://www.11467.com/shenzhen/co/309680.htm
深圳市名丰纸塑包装制品有限公司,http://www.11467.com/shenzhen/co/590774.htm
深圳市理平贸易有限公司,http://www.11467.com/shenzhen/co/566497.htm
深圳市华晟进出口贸易有限公司,http://www.11467.com/shenzhen/co/61679.htm
深圳市三和纸业有限公司,http://www.11467.com/shenzhen/co/16817.htm
深圳市铭丰纸托包装制品有限公司,http://www.11467.com/shenzhen/co/316087.htm
深圳市茂江投资有限公司,http://www.11467.com/shenzhen/co/299313.htm
深圳市炎彩染化化工有限公司,http://www.11467.com/shenzhen/co/550190.htm
顺嘉纸业有限公司深圳市场部,http://www.11467.com/shenzhen/co/592278.htm
尤特尔生化有限公司,http://www.11467.com/shenzhen/co/590834.htm
河北人和商贸有限公司销售部,http://www.11467.com/shijiazhuang/co/83523.htm
石家庄天丰纸业有限公司,http://www.11467.com/shijiazhuang/co/90269.htm
藁城成功科技公司,http://www.11467.com/shijiazhuang/co/138635.htm
石家庄东晨工业原料有限公司,http://www.11467.com/shijiazhuang/co/74319.htm
吉林公主岭源和农用育苗纸制品有限责任公司,http://www.11467.com/siping/co/33546.htm
苏州德坤贸易有限公司销售部,http://www.11467.com/suzhou/co/250274.htm
苏州国信集团丰源进出口有限公司,http://www.11467.com/suzhou/co/269392.htm
苏州市绿晨包装科技有限公司,http://www.11467.com/suzhou/co/219019.htm
中国苏州美森无纺科技有限公司,http://www.11467.com/suzhou/co/250304.htm
张家港保税区鑫盛翔国际贸易有限公司,http://www.11467.com/suzhou/co/324423.htm
苏州优耐特离心机制造有限公司,http://www.11467.com/suzhou/co/316165.htm
廷祥纸塑包材有限公司,http://www.11467.com/suzhou/co/222323.htm
安徽森发纸业有限公司,http://www.11467.com/suzhoushi/co/17746.htm
泰安市龙信科技贸易有限公司,http://www.11467.com/taian/co/34422.htm
百川纸业有限责任公司,http://www.11467.com/taian/co/53288.htm
泰安奇能化工科技有限责任公司,http://www.11467.com/taian/co/35955.htm
铜陵市劲豪木粉有限公司,http://www.11467.com/tongling/co/15319.htm
诸城市宏宇轻机机械有限公司,http://www.11467.com/weifang/co/118044.htm
诸城市丽洲纸业有限公司,http://www.11467.com/weifang/co/118043.htm
潍坊市华海经贸责任有限公司,http://www.11467.com/weifang/co/118569.htm
威海海润速生林开发有限限公司,http://www.11467.com/weihai/co/32550.htm
RADIGROUP武汉瑞迪经贸有限公司,http://www.11467.com/wuhan/co/70262.htm
上海秦桑进出口贸易有限公司,http://www.11467.com/wuhan/co/90847.htm
上海凯琳实业有限公司（武汉办）,http://www.11467.com/wuhan/co/70497.htm
武汉永结物回有限公司,http://www.11467.com/wuhan/co/91023.htm
武汉长生纸业贸易有限公司,http://www.11467.com/wuhan/co/145184.htm
厦门建发纸业有限公司(武汉分公司),http://www.11467.com/wuhan/co/69114.htm
中轻物产股份有限公司武汉分公司,http://www.11467.com/wuhan/co/91042.htm
武汉市新洲区耀华化工有限公司,http://www.11467.com/wuhan/co/117087.htm
芜湖创杰纸业有限公司销售部,http://www.11467.com/wuhu/co/22587.htm
无锡贝斯尔紧密机械有限公司,http://www.11467.com/wuxi/co/193984.htm
宜兴市筠箭竹木有限公司,http://www.11467.com/wuxi/co/169833.htm
无锡市培枫贸易有限公司,http://www.11467.com/wuxi/co/127027.htm
远纺工业无锡有限公司,http://www.11467.com/wuxi/co/182954.htm
福建欣美物宝仓储有限公司,http://www.11467.com/xiamen/co/94198.htm
厦门市恒辉商贸有限公司,http://www.11467.com/xiamen/co/10153.htm
厦门杰凯纸纸品有限公司,http://www.11467.com/xiamen/co/41442.htm
厦门彤庆商贸有限公司,http://www.11467.com/xiamen/co/14215.htm
厦门晟鑫宝贸易有限公司,http://www.11467.com/xiamen/co/62371.htm
厦门侨盛贸易有限公司,http://www.11467.com/xiamen/co/47230.htm
厦门金裕安工贸有限公司,http://www.11467.com/xiamen/co/62245.htm
厦门象屿集团公司,http://www.11467.com/xiamen/co/78445.htm
西安富源纸业公司,http://www.11467.com/xian/co/75372.htm
陕西合亚达胶粘制品有限公司西安分公司,http://www.11467.com/xian/co/59997.htm
黑龙江斯达造纸集团西北分公司,http://www.11467.com/xian/co/76021.htm
陕西信友纸业有限公司,http://www.11467.com/xian/co/6137.htm
湖南天捷海泡石有限公司,http://www.11467.com/xiangtan/co/23835.htm
孝感申欧企业发展有限公司,http://www.11467.com/xiaogan/co/16516.htm
湖北燕坤贸易有限公司,http://www.11467.com/xiaogan/co/22064.htm
维达纸业（湖北）公司,http://www.11467.com/xiaogan/co/19788.htm
诺鑫物资回收利用有限责任公司,http://www.11467.com/xining/co/26083.htm
邢台市好美时卫生用品有限公司,http://www.11467.com/xintai/co/33630.htm
河南雷诺电子科技有限公司销售部,http://www.11467.com/xinxiang/co/24384.htm
河南鑫通商贸有限公司,http://www.11467.com/xinxiang/co/26822.htm
许昌蒋马纸业有限公司,http://www.11467.com/xuchang/co/23249.htm
江苏双灯纸业有限公司,http://www.11467.com/yancheng/co/17842.htm
扬州东林木业有限公司,http://www.11467.com/yangzhou/co/79598.htm
宜宾长毅浆粕有限公司供应部,http://www.11467.com/yibin/co/23324.htm
宜宾长毅浆粕有限责任公司销售部,http://www.11467.com/yibin/co/23906.htm
宜宾长毅浆粕有限责任公司供应部,http://www.11467.com/yibin/co/23907.htm
辽宁省营口市祥和纸业有限公司,http://www.11467.com/yingkou/co/42875.htm
岳阳丰利纸业有限公司,http://www.11467.com/yueyang/co/6510.htm
岳阳市天叶纸业科技有限公司,http://www.11467.com/yueyang/co/32158.htm
广西广树益客纸业有限公司,http://www.11467.com/yulin/co/18713.htm
漳州海纳百川矿物再生资源环保(纸业)纤维浆有限公司,http://www.11467.com/zhangzhou/co/37785.htm
亚太林业(漳州)有限公司,http://www.11467.com/zhangzhou/co/37777.htm
河南省源蓝贸易有限公司纸桨部,http://www.11467.com/zhengzhou/co/106767.htm
河南省源蓝贸易有限公司,http://www.11467.com/zhengzhou/co/106768.htm
河南太格实业有限公司,http://www.11467.com/zhengzhou/co/97293.htm
河南众邦纸品有限公司,http://www.11467.com/zhengzhou/co/106699.htm
郑州市亚松浆纸有限公司,http://www.11467.com/zhengzhou/co/61299.htm
郑州融通浆纸有限公司,http://www.11467.com/zhengzhou/co/176445.htm
郑州融通物贸有限公司,http://www.11467.com/zhengzhou/co/62240.htm
河南大地纸业有限公司,http://www.11467.com/zhengzhou/co/106794.htm
河南森祺浆纸有限公司,http://www.11467.com/zhengzhou/co/106757.htm
河南大丰纸浆贸易有限公司,http://www.11467.com/zhengzhou/co/125342.htm
郑州远林浆纸有限公司,http://www.11467.com/zhengzhou/co/125407.htm
郑州青云商贸有限公司,http://www.11467.com/zhengzhou/co/63435.htm
新郑宇盛植物纤维有限公司,http://www.11467.com/zhengzhou/co/125449.htm
郑州绿汇纸塑有限公司,http://www.11467.com/zhengzhou/co/106771.htm
郑州浩宇商贸有限公司,http://www.11467.com/zhengzhou/co/125171.htm
郑州伊特诺机械设备有限公司,http://www.11467.com/zhengzhou/co/159464.htm
郑州永光纸业有限公司,http://www.11467.com/zhengzhou/co/44852.htm
中储发展股份有限公司郑州南阳寨分公司经销部,http://www.11467.com/zhengzhou/co/107876.htm
郑州商以诚商贸有限公司,http://www.11467.com/zhengzhou/co/125317.htm
郑州大可贸易有限公司,http://www.11467.com/zhengzhou/co/74427.htm
郑州东方昊炅贸易有限公司,http://www.11467.com/zhengzhou/co/75460.htm
河南创一林业科技发展有限公司,http://www.11467.com/zhengzhou/co/106788.htm
郑州商以诚商贸有限公司纸浆部,http://www.11467.com/zhengzhou/co/106745.htm
镇江金河纸业有限公司,http://www.11467.com/zhenjiang/co/1820.htm
广州白锦氏妇婴用品（中山）有限公司,http://www.11467.com/zhongshan/co/60588.htm
中山市绿森纸托包装制品有限公司,http://www.11467.com/zhongshan/co/131784.htm
维臣纸业有限公司,http://www.11467.com/zhongshan/co/100842.htm
周口蓝晶环保设备制造有限公司,http://www.11467.com/zhoukou/co/535.htm
山东鸿昌进出口有限公司业务3部,http://www.11467.com/zibo/co/65753.htm
淄博功力机械制造有限责任公司,http://www.11467.com/zibo/co/59108.htm
淄博鸿宁机械制造有限公司销售部,http://www.11467.com/zibo/co/65974.htm
山东淄博光正铝盐化工有限公司,http://www.11467.com/zibo/co/80871.htm
高青县好得利棉业有限公司,http://www.11467.com/zibo/co/81030.htm
赤天化纸业股份公司,http://www.11467.com/zunyi/co/21867.htm
北京嘉禾木科技有限公司销售分公司,http://www.11467.com/beijing/co/397715.htm
北京中冶美利国际浆纸有限公司,http://www.11467.com/beijing/co/116965.htm
时代有限公司,http://www.11467.com/baoding/co/79784.htm
内蒙古美利北辰浆纸有限公司,http://www.11467.com/bayannaoer/co/5724.htm
河北中捷资通纸业有限公司,http://www.11467.com/cangzhou/co/58522.htm
吉林省长春日报报业集团国际贸易有限责任公司,http://www.11467.com/changchun/co/96860.htm
长春市造纸设备有限公司,http://www.11467.com/changchun/co/96524.htm
北京中兴天贸易有限公司,http://www.11467.com/beijing/co/117022.htm
黑河溢焜经贸公司,http://www.11467.com/beijing/co/419071.htm
北京中纸飞迅科技有限公司,http://www.11467.com/beijing/co/699466.htm
天津中金明星纸业有限公司,http://www.11467.com/beijing/co/85204.htm
北京天资绿源生物有限公司,http://www.11467.com/beijing/co/221224.htm
上海楚霖贸易有限公司,http://www.11467.com/shanghai/co/1037217.htm
上海博田实业有限公司,http://www.11467.com/shanghai/co/1037216.htm
上海明阳佳木国际贸易有限公司销售部,http://www.11467.com/shanghai/co/663577.htm
开天贸易有限责任公司,http://www.11467.com/shanghai/co/377583.htm
上海美家居装饰建材有限公司,http://www.11467.com/shanghai/co/1048199.htm
上海绿滔物资有限公司,http://www.11467.com/shanghai/co/1037218.htm
上海强竞企业管理咨询有限公司,http://www.11467.com/shanghai/co/1048197.htm
上海市江岛工贸有限公司,http://www.11467.com/shanghai/co/217134.htm
上海嘉南红塔实业有限公司,http://www.11467.com/shanghai/co/1041973.htm
上海三江实业有限公司,http://www.11467.com/shanghai/co/1046432.htm
上海安帝化工有限公司,http://www.11467.com/shanghai/co/657352.htm
上海运城制版公司,http://www.11467.com/shanghai/co/330655.htm
天津港苏帝国际贸易有限公司,http://www.11467.com/tianjin/co/62959.htm
天津市科达经济技术发展有限公司,http://www.11467.com/tianjin/co/199318.htm
天津金证造纸有限公司(市场部),http://www.11467.com/tianjin/co/63039.htm
天津市俄林浆纸商贸有限公司,http://www.11467.com/tianjin/co/14911.htm
天津市格蓝特科技发展有限公司,http://www.11467.com/tianjin/co/163033.htm
天津市俄林浆纸商贸有限公司财务部,http://www.11467.com/tianjin/co/163484.htm
天津市合时物资公司,http://www.11467.com/tianjin/co/87769.htm
天津华美纸业有限公司,http://www.11467.com/tianjin/co/25892.htm
天津市白雪纸业发展有限公司,http://www.11467.com/tianjin/co/87727.htm
天津市晟丰行化工贸易有限公司,http://www.11467.com/tianjin/co/86146.htm
重庆理文造纸有限公司竹木原料采购部,http://www.11467.com/chongqing/co/159680.htm
海南乾通投资有限公司,http://www.11467.com/haikou/co/4636.htm
天津拓维亿华科技有限公司,http://www.11467.com/tianjin/co/302224.htm
赛发过滤科技（苏州）有限公司天津分公司,http://www.11467.com/tianjin/co/302368.htm
天津莫妮尔国际贸易有限公司,http://www.11467.com/tianjin/co/302369.htm
天津进口木浆销售有限公司,http://www.11467.com/tianjin/co/302371.htm
路生纸业工贸有限公司,http://www.11467.com/tianjin/co/302372.htm
天津市玖仟纸业有限公司,http://www.11467.com/tianjin/co/302375.htm
天津市施好福（商贸）有限公司,http://www.11467.com/tianjin/co/302376.htm
天津市威士科浆粕科技有限公司,http://www.11467.com/tianjin/co/306232.htm
建发纸业天津分公司,http://www.11467.com/tianjin/co/306235.htm
常德鼎城虹图广告有限公司,http://www.11467.com/changde/co/35040.htm
湖南长丰环球经贸有限公司业务部,http://www.11467.com/changsha/co/78630.htm
新时代财富投资有限公司,http://www.11467.com/changsha/co/78434.htm
大连迈克斯流体工程技术有限公司,http://www.11467.com/dalian/co/73221.htm
丹东东方轻工机械有限公司,http://www.11467.com/dandong/co/31541.htm
东莞市大通装饰材料有限公司,http://www.11467.com/dongguan/co/108874.htm
东莞市冠隆塑料包装有限公司,http://www.11467.com/dongguan/co/498519.htm
东莞市仁兴纸品有限公司,http://www.11467.com/dongguan/co/468086.htm
东莞市格林纸塑制品有限公司,http://www.11467.com/dongguan/co/492051.htm
富生实业有限公司,http://www.11467.com/dongguan/co/335406.htm
东莞市宏辉工业皮带有公司（东莞厂）,http://www.11467.com/dongguan/co/226020.htm
东莞市宏辉工业皮带有限公司,http://www.11467.com/dongguan/co/123355.htm
广州高圣达环保科技有限公司,http://www.11467.com/dongguan/co/170428.htm
育英贸易有限公司,http://www.11467.com/dongguan/co/146131.htm
坤盛环保包装有限公司,http://www.11467.com/dongguan/co/144202.htm
丰惠国际有限公司,http://www.11467.com/dongguan/co/142404.htm
裕丰包装材料有限公司,http://www.11467.com/dongguan/co/201449.htm
广东理文造纸有限公司销售部,http://www.11467.com/dongguan/co/202116.htm
立成纸包装制品有限公司 （启亮特种纸业）,http://www.11467.com/dongguan/co/336925.htm
禾富鞋材有限公司（业务部）,http://www.11467.com/dongguan/co/336545.htm
东营恒鑫工贸有限公司,http://www.11467.com/dongying/co/28066.htm
鄂尔多斯市治梅林纸业有限公司,http://www.11467.com/eerduosi/co/8393.htm
广西防城港市贸易有限公司,http://www.11467.com/fangchenggang/co/6227.htm
蓝盛自控设备有限公司,http://www.11467.com/foshan/co/212301.htm
佛山市顺德区开达威贸易有限公司业务部,http://www.11467.com/foshan/co/262650.htm
佛山至富经贸有限公司,http://www.11467.com/foshan/co/342691.htm
佛山市卓岳纸业有限公司,http://www.11467.com/foshan/co/261350.htm
志宇贸易有限公司,http://www.11467.com/foshan/co/212363.htm
安徽阜阳鑫美印绣有限责任公司,http://www.11467.com/fuyang/co/35219.htm
福建青春贸易有限公司,http://www.11467.com/fuzhou/co/88577.htm
福州华冠实业有限公司,http://www.11467.com/fuzhou/co/149512.htm
福建省福州德本隆贸易有限公司,http://www.11467.com/fuzhou/co/149559.htm
闽清聚丰纸业有限公司,http://www.11467.com/fuzhou/co/139879.htm
广东中粤进出口有限公司,http://www.11467.com/guangzhou/co/74741.htm
广东雄洲纸品股份有限公司,http://www.11467.com/guangzhou/co/463272.htm
广东粤景集团有限公司纸浆营销部,http://www.11467.com/guangzhou/co/323514.htm
广东粤景集团有限公司,http://www.11467.com/guangzhou/co/212466.htm
广州海翔国际货运代理有限公司,http://www.11467.com/guangzhou/co/429898.htm
广州派特机电设备安装有限公司,http://www.11467.com/guangzhou/co/112266.htm
广州杰达礼品有限公司门市部,http://www.11467.com/guangzhou/co/310705.htm
广州嘉发纸业有限公司,http://www.11467.com/guangzhou/co/209241.htm
广东粤景集团有限公司（采购中心）,http://www.11467.com/guangzhou/co/208252.htm
广州博伺乐自动化设备有限公司,http://www.11467.com/guangzhou/co/267697.htm
广州神海贸易有限公司,http://www.11467.com/guangzhou/co/127577.htm
广州市邦森贸易有限公司,http://www.11467.com/guangzhou/co/468377.htm
广东粤景集团有限公司纸浆销售部,http://www.11467.com/guangzhou/co/322693.htm
广州神海贸易公司,http://www.11467.com/guangzhou/co/313311.htm
广州清晖纸制品有限公司,http://www.11467.com/guangzhou/co/67481.htm
广州思文商贸有限公司,http://www.11467.com/guangzhou/co/430448.htm
广州市海睿贸易有限公司,http://www.11467.com/guangzhou/co/207653.htm
广州市华实纸业集团有限公司,http://www.11467.com/guangzhou/co/213607.htm
广州市森龙纸浆厂有限公司,http://www.11467.com/guangzhou/co/205927.htm
广州市璐名阳流体控制设备有限公司,http://www.11467.com/guangzhou/co/205779.htm
湖北枣阳四海化工有限公司,http://www.11467.com/guangzhou/co/405601.htm
广州市熠恩懋商贸有限公司销售部,http://www.11467.com/guangzhou/co/205924.htm
广州中粤进出口有限公司,http://www.11467.com/guangzhou/co/472339.htm
汉方绿色科技有限公司,http://www.11467.com/guangzhou/co/322813.htm
广州亿愿胶粘剂有限公司,http://www.11467.com/guangzhou/co/323456.htm
广州鹰联投资顾问有限公司,http://www.11467.com/guangzhou/co/308498.htm
广州淘金再生资源回收有限公司,http://www.11467.com/guangzhou/co/206949.htm
志峰贸易公司,http://www.11467.com/guangzhou/co/206075.htm
广州远豪贸易有限公司,http://www.11467.com/guangzhou/co/27750.htm
厦门速传物流发展股份有限公司广州分公司,http://www.11467.com/guangzhou/co/32602.htm
纤贸纸业有限公司广州代表处,http://www.11467.com/guangzhou/co/308482.htm
金风车国际贸易有限公司（荷兰喜宝欧）广州办事处,http://www.11467.com/guangzhou/co/308457.htm
中粤进出口有限公司,http://www.11467.com/guangzhou/co/215899.htm
科迪色彩有限公司,http://www.11467.com/guangzhou/co/318815.htm
广西贵糖(集团)股份有限公司轻工机械厂,http://www.11467.com/guigang/co/6174.htm
腾海纸业有限公司,http://www.11467.com/guilin/co/44699.htm
黑龙江亿利达国际贸易有限公司,http://www.11467.com/haerbin/co/50362.htm
厦门建发纸业有限公司东北分公司,http://www.11467.com/haerbin/co/52536.htm
哈尔滨铁路局对外经济技术合作公司,http://www.11467.com/haerbin/co/3643.htm
中国铁路物资哈尔滨公司市场经营一部,http://www.11467.com/haerbin/co/52577.htm
中国铁路物资哈尔滨公司市场一部,http://www.11467.com/haerbin/co/52148.htm
牡丹江斯达造纸有限公司,http://www.11467.com/haerbin/co/52581.htm
邯郸开发区净佳科技有限公司,http://www.11467.com/handan/co/48953.htm
