山东万事达建筑钢品科技有限公司,http://www.11467.com/binzhou/co/35293.htm
山东顺达涂镀钢板有限公司,http://www.11467.com/binzhou/co/35723.htm
长沙腾源轻钢活动板房南昌分公司,http://www.11467.com/changsha/co/119810.htm
通辽市科尔沁草业有限公司,http://www.11467.com/tongliao/co/10131.htm
山东电力建设第三工程公司,http://www.11467.com/weifang/co/57910.htm
威海泓临贸易有限公司,http://www.11467.com/weihai/co/36122.htm
内蒙古能源发电公司,http://www.11467.com/wulanchabu/co/6265.htm
新疆伊宁尼勒克县裕源矿业有限公司,http://www.11467.com/wulumuqi/co/100103.htm
昌吉市矿业总公司,http://www.11467.com/wulumuqi/co/100059.htm
新疆绿洲贸易有限公司,http://www.11467.com/wulumuqi/co/100014.htm
新疆新鑫矿业股份公司,http://www.11467.com/wulumuqi/co/99981.htm
新疆麦趣尔(集团)有限责任公司,http://www.11467.com/wulumuqi/co/100156.htm
无锡柏乐科技有限公司,http://www.11467.com/wuxi/co/214699.htm
湖北省襄樊安能热电有限公司,http://www.11467.com/xiangfan/co/40891.htm
青海水利水电（集团）有限责任公司,http://www.11467.com/xining/co/27681.htm
富源电力集团有限公司,http://www.11467.com/xining/co/27660.htm
安徽合肥联盟商务有限公司,http://www.11467.com/yanan/co/13045.htm
陕西延长石油(集团)销售公司永坪销售处,http://www.11467.com/yanan/co/13050.htm
阳泉市郊区联贸铝业有限公司,http://www.11467.com/yangquan/co/12062.htm
进亮锻造有限公司,http://www.11467.com/yantai/co/133503.htm
烟台大班国际贸易有限公司广州办事处,http://www.11467.com/yantai/co/133502.htm
烟台文盛工贸有限公司,http://www.11467.com/yantai/co/133504.htm
烟台大班国际贸易有限公司广州办事处,http://www.11467.com/yantai/co/133501.htm
珙县新光经贸有限公司,http://www.11467.com/yibin/co/24999.htm
苗超废旧物资回收有限公司,http://www.11467.com/yichunshi/co/16558.htm
李立振物资回收公司,http://www.11467.com/yinchuan/co/42611.htm
宁夏安泰新能源股份有限公司,http://www.11467.com/yinchuan/co/42643.htm
深圳富时达电子科技有限公司业务部,http://www.11467.com/yunfu/co/26686.htm
自贡民福碳素有限公司,http://www.11467.com/zigong/co/23039.htm
上海擎隆铝业有限公司,http://www.11467.com/shanghai/co/1044771.htm
德国韦尔斯国际石油集团(中国)有限公司,http://www.11467.com/tianjin/co/200375.htm
库珀(天津)科技有限公司,http://www.11467.com/tianjin/co/200691.htm
白沙实业有限责任公司,http://www.11467.com/hengyang/co/33317.htm
湖南湘江电力建设集团有限公司,http://www.11467.com/loudi/co/24613.htm
宏伟集团四川宏伟钢带有限公司,http://www.11467.com/chengdu/co/215433.htm
德国鲍氏国际集团有限公司,http://www.11467.com/chuzhou/co/30483.htm
德阳市富可斯润滑油有限公司,http://www.11467.com/deyang/co/37371.htm
安徽省安庆市荣华玻璃纤维有限公司,http://www.11467.com/dongguan/co/493269.htm
东莞市 祥錩化工有限公司,http://www.11467.com/dongguan/co/495707.htm
德国巴艾斯化学(中国)有限公司,http://www.11467.com/dongguan/co/497771.htm
东莞润工润滑油公司,http://www.11467.com/dongguan/co/506174.htm
东莞长安扬铃电子商贸有限公司,http://www.11467.com/dongguan/co/501132.htm
东莞出光润滑油有限公司,http://www.11467.com/dongguan/co/511090.htm
东莞升威润滑油有限公司,http://www.11467.com/dongguan/co/502565.htm
东莞市米特塑胶原料有限公司,http://www.11467.com/dongguan/co/493271.htm
东莞市鹏程润滑油科技有限公司,http://www.11467.com/dongguan/co/502569.htm
东莞市震源机械设备有限公司,http://www.11467.com/dongguan/co/490947.htm
东莞市长安三旭联特种工程塑料绝缘材料科技有限公司,http://www.11467.com/dongguan/co/501129.htm
广东铁威龙科技发展有限公司,http://www.11467.com/dongguan/co/505061.htm
东莞垠星科技发展有限公司,http://www.11467.com/dongguan/co/499544.htm
美国百川国际石油集团东莞百路达公司,http://www.11467.com/dongguan/co/507197.htm
广州红狮贸易有限公司东莞分公司,http://www.11467.com/dongguan/co/508120.htm
鑫佳金属材料有限公司,http://www.11467.com/dongguan/co/508595.htm
鑫塑源科技有限公司,http://www.11467.com/dongguan/co/508974.htm
伟业润滑油(深圳)有限公司 东莞分公司,http://www.11467.com/dongguan/co/509764.htm
中国万能工业材料有限公司,http://www.11467.com/dongguan/co/502563.htm
东营市恒阳化工有限责任公司,http://www.11467.com/dongying/co/42118.htm
东营市东科宏工贸有限责任公司,http://www.11467.com/dongying/co/18981.htm
佛山市雄正贸易有限公司,http://www.11467.com/foshan/co/342069.htm
佛山市顺德区盈基(豪耀)贸易有限公司,http://www.11467.com/foshan/co/345386.htm
佛山元永恒不锈钢有限公司,http://www.11467.com/foshan/co/343577.htm
廣東鋼海商貿有限公司,http://www.11467.com/foshan/co/341236.htm
佛山至仁建材科技有限公司,http://www.11467.com/foshan/co/339126.htm
佛山再尚不锈钢有限公司,http://www.11467.com/foshan/co/339124.htm
佛山市禅城区骏业不锈钢材料制品公司,http://www.11467.com/foshan/co/340215.htm
佛山市顺德区立本钢铁贸易有限公司,http://www.11467.com/foshan/co/339109.htm
湖北松滋市南海化工有限公司广州分公司,http://www.11467.com/guangzhou/co/461311.htm
聚优高分子材料有限公司(广州),http://www.11467.com/guangzhou/co/464360.htm
杭州五源科技实业有限公司,http://www.11467.com/hangzhou/co/207972.htm
杭州益通润滑技术有限公司,http://www.11467.com/hangzhou/co/369203.htm
广东惠州友安化工有限公司,http://www.11467.com/huizhou/co/97001.htm
江门新邦润滑油有限公司,http://www.11467.com/jiangmen/co/115995.htm
嘉兴市佰达金属材料有限公司,http://www.11467.com/jiaxing/co/123384.htm
济南镁辰建材机械有限公司,http://www.11467.com/jinan/co/135506.htm
山东济南信义通铝业有限公司,http://www.11467.com/jinan/co/137973.htm
济南腾捷物资有限公司,http://www.11467.com/jinan/co/138323.htm
寿力空压机配件山东济南凯斯通销售分公司,http://www.11467.com/jinan/co/140030.htm
济南四环经贸有限公司,http://www.11467.com/jinan/co/137158.htm
浙江佰耐钢带有限公司,http://www.11467.com/jinhua/co/128084.htm
山东鲁金方管有限公司,http://www.11467.com/jining/co/74115.htm
昆明桂松宝经贸有限公司,http://www.11467.com/kunming/co/127335.htm
山东莱芜博钢经贸有限公司,http://www.11467.com/laiwu/co/14618.htm
南京柏林地板超市有限公司,http://www.11467.com/nanjing/co/157092.htm
南京科润工业介质股份有限公司,http://www.11467.com/nanjing/co/154070.htm
江苏省南通康桥化工有限公司,http://www.11467.com/nantong/co/137488.htm
宁波市鑫旺金属制品有限公司,http://www.11467.com/ningbo/co/198982.htm
宁波鄞州奔力钢铁有限公司,http://www.11467.com/ningbo/co/197614.htm
武汉新阳塑化有限公司,http://www.11467.com/ningbo/co/193024.htm
宁波市北仑区宁丰润滑油销售有限公司,http://www.11467.com/ningbo/co/196338.htm
舞钢市远航(钢铁)工贸有限责任公司,http://www.11467.com/pingdingshan/co/23838.htm
舞钢金益全商贸有限公司,http://www.11467.com/pingdingshan/co/23786.htm
河南中原绿能高科有限责任公司,http://www.11467.com/puyang/co/19788.htm
诸暨市三合化工有限公司,http://www.11467.com/shaoxing/co/118620.htm
深铁隆贸易有限公司,http://www.11467.com/shenzhen/co/805694.htm
深圳创美金属材料有限公司,http://www.11467.com/shenzhen/co/805693.htm
深圳捷诚科技有限公司,http://www.11467.com/shenzhen/co/793431.htm
深圳长青润滑油有限公司,http://www.11467.com/shenzhen/co/768250.htm
深圳市宏利运通货运公司,http://www.11467.com/shenzhen/co/793434.htm
深圳市富士达工业有限公司,http://www.11467.com/shenzhen/co/336532.htm
深圳冲压拉伸油有限公司,http://www.11467.com/shenzhen/co/797896.htm
深圳市诺基能源有限公司,http://www.11467.com/shenzhen/co/120827.htm
深圳市科力达润滑油有限公司,http://www.11467.com/shenzhen/co/793432.htm
深圳市碳氢清洗剂有限公司,http://www.11467.com/shenzhen/co/795751.htm
深圳市威爵润滑油有限公司,http://www.11467.com/shenzhen/co/788208.htm
深圳市永裕隆润滑油发展有限公司,http://www.11467.com/shenzhen/co/777915.htm
深圳市盛世隆润滑油有限公司,http://www.11467.com/shenzhen/co/797892.htm
深圳美迪斯源电子材料有限公司,http://www.11467.com/shenzhen/co/781738.htm
石家庄市中捷彩钢压型板材有限公司,http://www.11467.com/shijiazhuang/co/138105.htm
四川美可迪科技开发有限责任公司,http://www.11467.com/suining/co/8753.htm
常熟艾威娜国际贸易有限公司,http://www.11467.com/suzhou/co/321030.htm
肥城集智化工有限公司,http://www.11467.com/taian/co/52747.htm
浙江万盛股份有限公司,http://www.11467.com/taizhou/co/137626.htm
唐山兰泰镁业化工有限公司,http://www.11467.com/tangshan/co/75636.htm
瑞安万佳金属物资有限公司,http://www.11467.com/wenzhou/co/222770.htm
芜湖四创新材料技术有限公司,http://www.11467.com/wuhu/co/32828.htm
乌鲁木齐德新盛商贸有限公司,http://www.11467.com/wulumuqi/co/100146.htm
江阴市鸿宜不锈钢有限公司,http://www.11467.com/wuxi/co/247078.htm
上海基坑降水 轻型井点降水有限公司,http://www.11467.com/wuxi/co/244196.htm
无锡力天不锈钢有限公司,http://www.11467.com/wuxi/co/245044.htm
宜兴市阳洋塑料助剂有限公司,http://www.11467.com/wuxi/co/243908.htm
无锡市元宏钢板切割销售有限公司,http://www.11467.com/wuxi/co/247412.htm
厦门彩暄贸易有限公司,http://www.11467.com/xiamen/co/84744.htm
烟台通润化工科技有限公司,http://www.11467.com/yantai/co/153753.htm
烟台市顺沁园燃料油有限公司,http://www.11467.com/yantai/co/155188.htm
山东公信安全科技有限公司,http://www.11467.com/zaozhuang/co/30538.htm
中山华明泰材料科技有限公司,http://www.11467.com/zhongshan/co/148155.htm
北京海运商贸物资有限公司,http://www.11467.com/beijing/co/703120.htm
北京泰合源通生物科技有限公司,http://www.11467.com/beijing/co/693116.htm
苏州晟世能源管理有限公司,http://www.11467.com/suzhou/co/270718.htm
融正五岳信用担保有限公司,http://www.11467.com/jinan/co/124234.htm
扬中市优进密封件有限公司,http://www.11467.com/zhenjiang/co/64607.htm
旻山控股集团有限公司,http://www.11467.com/beijing/co/714808.htm
安阳市互创物资有限公司,http://www.11467.com/anyang/co/36926.htm
安阳市钢之杰物资有限责任公司,http://www.11467.com/anyang/co/36925.htm
金山矿业公司,http://www.11467.com/baoji/co/28601.htm
宝鸡市钛莱机械设备有限公司,http://www.11467.com/baoji/co/30790.htm
东方希望包头稀土铝业有限责任公司,http://www.11467.com/baotou/co/368.htm
山东宏昱精密钢板有限公司,http://www.11467.com/binzhou/co/35099.htm
山东佳诚彩钢板公司,http://www.11467.com/binzhou/co/35006.htm
山东宏盛达板业有限公司,http://www.11467.com/binzhou/co/35012.htm
山东彩涂板镀锌板有限公司,http://www.11467.com/binzhou/co/34708.htm
山东宏信达彩钢有限公司,http://www.11467.com/binzhou/co/35007.htm
山东万利达彩钢板业有限公司,http://www.11467.com/binzhou/co/35726.htm
山东省博兴县瀚发精密薄板有限公司,http://www.11467.com/binzhou/co/35198.htm
昂龙涂镀钢铁有限公司,http://www.11467.com/binzhou/co/34709.htm
山东省博兴县晟能彩钢有限公司,http://www.11467.com/binzhou/co/35292.htm
山东腾发彩钢公司,http://www.11467.com/binzhou/co/35843.htm
山东浦项新材料有限责任公司,http://www.11467.com/binzhou/co/35845.htm
山东玉峰钢铁有限公司,http://www.11467.com/binzhou/co/34881.htm
山东省博兴县金波利彩钢有限公司,http://www.11467.com/binzhou/co/35104.htm
山东润通油脂有限公司,http://www.11467.com/binzhou/co/35143.htm
山东鑫辉仓储物流有限公司,http://www.11467.com/binzhou/co/35004.htm
山东万聚丰茂板业有限公司,http://www.11467.com/binzhou/co/34706.htm
北京铁诚工贸有限公司,http://www.11467.com/beijing/co/710339.htm
北京兴业鑫源铝业有限公司,http://www.11467.com/beijing/co/708254.htm
北京海润尔商贸有限公司,http://www.11467.com/beijing/co/713294.htm
上海宝靖实业有限公司,http://www.11467.com/shanghai/co/1051255.htm
上海扁钢有限公司,http://www.11467.com/shanghai/co/1057496.htm
上海化轻染料有限公司科莱恩颜料专卖店,http://www.11467.com/shanghai/co/1040856.htm
上海国际钛白化工有限公司,http://www.11467.com/shanghai/co/1040859.htm
上海米蓝贸易有限公司,http://www.11467.com/shanghai/co/1058997.htm
上海市凯茵化工有限公司,http://www.11467.com/shanghai/co/1040857.htm
上海煜铁商贸(宝山)有限公司,http://www.11467.com/shanghai/co/1044769.htm
上海新凯润润滑油技术公司,http://www.11467.com/shanghai/co/1051885.htm
上海易百实业有限公司,http://www.11467.com/shanghai/co/1053688.htm
无锡市卓腾贸易有限公司上海办事处,http://www.11467.com/shanghai/co/1042374.htm
上海蜀宝低合金钢板有限公司,http://www.11467.com/shanghai/co/1053690.htm
天津摩通润滑技术有限公司,http://www.11467.com/tianjin/co/198637.htm
天津强邦实业有限公司,http://www.11467.com/tianjin/co/198948.htm
天津宏扬钢铁贸易有限公司,http://www.11467.com/tianjin/co/198397.htm
天津盈日钢材贸易有限公司,http://www.11467.com/tianjin/co/197723.htm
天津顺鑫通板材销售有限公司,http://www.11467.com/tianjin/co/201595.htm
天津鑫佳伟业钢管有限公司,http://www.11467.com/tianjin/co/199416.htm
天津静海大邱庄福瑞达钢铁有限公司,http://www.11467.com/tianjin/co/202242.htm
吉林省京吉再生能源有限公司,http://www.11467.com/changchun/co/108705.htm
鲁阳钢铁有限公司,http://www.11467.com/binzhou/co/34711.htm
山东宇鑫源彩钢有限公司,http://www.11467.com/binzhou/co/34879.htm
山东省博兴县科福钢板有限公司,http://www.11467.com/binzhou/co/35197.htm
山东众城板业有限公司,http://www.11467.com/binzhou/co/35199.htm
盐山靖敏钢管有限公司,http://www.11467.com/cangzhou/co/59210.htm
河北炼化华雨沥青制品有限公司,http://www.11467.com/cangzhou/co/62372.htm
长沙市双城特种润滑油有限公司,http://www.11467.com/changsha/co/119965.htm
格林泰科绿色建筑科技有限公司,http://www.11467.com/changsha/co/105122.htm
长沙杰燃环保科技有限公司,http://www.11467.com/changsha/co/104814.htm
湖南自力包装材料有限公司,http://www.11467.com/changsha/co/119395.htm
湖南新华联特种材料有限公司,http://www.11467.com/changsha/co/103937.htm
常州哈德威尔微晶耐磨材料有限公司,http://www.11467.com/changzhou/co/149676.htm
成都炳泰化工原料有限公司,http://www.11467.com/chengdu/co/212314.htm
成都蜀冶钢铁有限公司,http://www.11467.com/chengdu/co/214217.htm
成都新力石化有限公司,http://www.11467.com/chengdu/co/214357.htm
自贡联合石油工程技术有限公司,http://www.11467.com/chengdu/co/141680.htm
大连慧能达有限公司,http://www.11467.com/dalian/co/73546.htm
德州市友邦工程有限公司,http://www.11467.com/dezhou/co/49817.htm
德州新江化工有限公司,http://www.11467.com/dezhou/co/49818.htm
德州鑫城特种工业油品有限公司,http://www.11467.com/dezhou/co/49894.htm
天乐家电有限公司,http://www.11467.com/dezhou/co/50112.htm
山东森昊润滑油有限责任公司,http://www.11467.com/dezhou/co/51331.htm
安徽省卡尔文塑胶科技有限公司,http://www.11467.com/dongguan/co/495706.htm
德士美润滑油科技(宁波)有限公司,http://www.11467.com/dongguan/co/506176.htm
东莞宝粤金属材料有限公司,http://www.11467.com/dongguan/co/510150.htm
东莞市博思润滑油有限公司,http://www.11467.com/dongguan/co/502568.htm
东莞谷歌润滑油有限公司,http://www.11467.com/dongguan/co/508146.htm
东莞金门石化有限公司,http://www.11467.com/dongguan/co/493345.htm
东莞市福光高科技节能有限公司,http://www.11467.com/dongguan/co/97986.htm
东莞森田润滑油有限公司,http://www.11467.com/dongguan/co/501127.htm
东莞市北山润滑油有限公司网络销售部,http://www.11467.com/dongguan/co/493351.htm
东莞市贝浩润滑脂有限公司,http://www.11467.com/dongguan/co/495768.htm
东莞市孚泰莲合化工有限公司,http://www.11467.com/dongguan/co/495711.htm
诚达洋行(东莞)有限公司,http://www.11467.com/dongguan/co/502566.htm
东莞聚创润滑油有限公司,http://www.11467.com/dongguan/co/493353.htm
东莞市汇美五金制品有限公司,http://www.11467.com/dongguan/co/492301.htm
东莞市同佳贸易有限公司,http://www.11467.com/dongguan/co/502567.htm
东莞市三诚科技有限公司,http://www.11467.com/dongguan/co/490880.htm
东莞市润高润滑油有限公司,http://www.11467.com/dongguan/co/490948.htm
广东东莞市佳润润滑油有限公司,http://www.11467.com/dongguan/co/502564.htm
光大银河不锈钢有限公司,http://www.11467.com/dongguan/co/492302.htm
东莞双利钛白粉化工有限公司,http://www.11467.com/dongguan/co/495710.htm
化学有限公司,http://www.11467.com/dongguan/co/505063.htm
汇洲高分子材料有限公司,http://www.11467.com/dongguan/co/490890.htm
金猴电子有限公司,http://www.11467.com/dongguan/co/408757.htm
卡尔文塑胶科技(中国)有限公司,http://www.11467.com/dongguan/co/493268.htm
科泽润滑油有限公司,http://www.11467.com/dongguan/co/507190.htm
东莞市托圣斯电子科技有限公司,http://www.11467.com/dongguan/co/239595.htm
东莞鲁布恒业润滑油有限公司,http://www.11467.com/dongguan/co/490944.htm
东莞市陆海钢铁有限公司,http://www.11467.com/dongguan/co/500457.htm
索晶润滑剂(中国)有限公司,http://www.11467.com/dongguan/co/503900.htm
英国粤马士石油化工(香港)有限公司,http://www.11467.com/dongguan/co/505065.htm
众帮化工有限公司,http://www.11467.com/dongguan/co/409345.htm
山东红星化工有限公司,http://www.11467.com/dongying/co/42292.htm
东营绿森信息咨询有限公司,http://www.11467.com/dongying/co/42028.htm
内蒙古凯顺工贸有限公司,http://www.11467.com/eerduosi/co/9997.htm
佛山市泓宝润滑油公司,http://www.11467.com/foshan/co/343826.htm
佛山市鸿宇不锈钢制品有限公司,http://www.11467.com/foshan/co/342849.htm
佛山市保马不锈钢有限公司,http://www.11467.com/foshan/co/344257.htm
佛山市吉诚彩色不锈钢制品有限公司,http://www.11467.com/foshan/co/341240.htm
佛山市六一六不锈钢有限公司,http://www.11467.com/foshan/co/345383.htm
佛山市绿净废油化工回收公司,http://www.11467.com/foshan/co/340567.htm
佛山市坚翔钢材贸易有限公司,http://www.11467.com/foshan/co/343586.htm
佛山市顺德区宽裕不锈钢制品有限公司,http://www.11467.com/foshan/co/340220.htm
佛山市顺德区华美达实业有限公司,http://www.11467.com/foshan/co/342860.htm
佛山市顺德区金凤翔精细化工实业有限公司,http://www.11467.com/foshan/co/339466.htm
佛山市顺德区铭航贸易有限公司,http://www.11467.com/foshan/co/341235.htm
佛山市双业不锈钢有限公司,http://www.11467.com/foshan/co/345385.htm
广东 易创贸易有限公司,http://www.11467.com/foshan/co/339116.htm
广东弘辉废油回收处理有限公司,http://www.11467.com/foshan/co/345040.htm
广东佛山市华兴不锈钢制品有限公司,http://www.11467.com/foshan/co/346327.htm
鑫海亿金属材料有限公司,http://www.11467.com/foshan/co/339127.htm
佛山市顺德区树枫贸易有限公司,http://www.11467.com/foshan/co/339108.htm
五洋不锈钢有限公司,http://www.11467.com/foshan/co/344264.htm
香港太今金属实业有限公司,http://www.11467.com/foshan/co/339121.htm
开宝不锈钢有限公司,http://www.11467.com/foshan/co/345380.htm
广州宝卓贸易有限公司,http://www.11467.com/guangzhou/co/463532.htm
广州市广京装饰材料有限公司欧佰天花,http://www.11467.com/guangzhou/co/460342.htm
广州市光琦贸易有限公司,http://www.11467.com/guangzhou/co/467038.htm
广州川崎矽钢片有限公司,http://www.11467.com/guangzhou/co/470668.htm
广州市德兢化工有限公司,http://www.11467.com/guangzhou/co/480235.htm
广州友辉物流有限公司,http://www.11467.com/guangzhou/co/460341.htm
广州新诚轴贸易有限公司,http://www.11467.com/guangzhou/co/482352.htm
顺德幸福油回收有限公司,http://www.11467.com/guangzhou/co/476222.htm
广州市坚兴五金钢材销售加工有限公司,http://www.11467.com/guangzhou/co/468608.htm
河北邯郸石油设备总公司,http://www.11467.com/handan/co/69501.htm
河北金亿强钢结构有限公司,http://www.11467.com/handan/co/69475.htm
河北汇银板业有限责任公司,http://www.11467.com/handan/co/68791.htm
武安市瑞鑫润滑油经销有限公司,http://www.11467.com/handan/co/68729.htm
中天碳素有限公司,http://www.11467.com/handan/co/68505.htm
邯郸市兆裕物资有限公司,http://www.11467.com/handan/co/69120.htm
杭州金德瑞化工颜料有限公司,http://www.11467.com/hangzhou/co/371068.htm
杭州顺大不锈钢材料有限公司,http://www.11467.com/hangzhou/co/371730.htm
杭州环能生物制品有限公司,http://www.11467.com/hangzhou/co/232891.htm
浙江海普顿新材料股份有限公司,http://www.11467.com/hangzhou/co/369184.htm
浙江舜能润滑油有限公司,http://www.11467.com/hangzhou/co/371876.htm
浙江通用动力有限公司,http://www.11467.com/hangzhou/co/372246.htm
合肥徽力电气技术有限公司,http://www.11467.com/hefei/co/81117.htm
河北地矿建设工程集团衡水公司,http://www.11467.com/hengshui/co/2329.htm
正兴网业制造有限公司,http://www.11467.com/hengshui/co/37062.htm
昊丰丝网制品有限公司,http://www.11467.com/hengshui/co/37501.htm
江苏希能蓄电池材料有限公司,http://www.11467.com/huaian/co/51720.htm
惠州市林惠电子材料有限公司,http://www.11467.com/huizhou/co/96783.htm
迪赛恩润滑科技有限公司,http://www.11467.com/huizhou/co/97233.htm
鑫昌龙润滑科技有限公司,http://www.11467.com/huizhou/co/97965.htm
格林润滑科技(惠州)有限公司江苏办事处,http://www.11467.com/huizhou/co/98081.htm
吉安市兴旺物质有限责任公司,http://www.11467.com/jian/co/18501.htm
加拿大能达化学有限公司,http://www.11467.com/jiangmen/co/115042.htm
开平市中研磨具磨料有限公司,http://www.11467.com/jiangmen/co/115724.htm
江门市壹品润滑油包装配件有限公司(上海),http://www.11467.com/jiangmen/co/116087.htm
江门鑫越轴承有限公司,http://www.11467.com/jiangmen/co/114680.htm
济南鼎信立业物资有限公司,http://www.11467.com/jinan/co/137156.htm
济南巨邦润滑油有限公司,http://www.11467.com/jinan/co/135810.htm
济南唐嘉重卡润滑油有限公司,http://www.11467.com/jinan/co/138029.htm
济南旭合物资有限公司,http://www.11467.com/jinan/co/136685.htm
泰安市巨鼎钢材有限公司,http://www.11467.com/jinan/co/139933.htm
济阳县升旭润滑油有限公司,http://www.11467.com/jinan/co/134151.htm
济南重卡领袖至尊润滑油有限公司,http://www.11467.com/jinan/co/137353.htm
复盛空压机配件济南凯斯通有限公司,http://www.11467.com/jinan/co/138750.htm
济南众成天下塑料有限公司,http://www.11467.com/jinan/co/134133.htm
英国嘉士度石油有限公司,http://www.11467.com/jinan/co/135041.htm
济南鑫源汽车润滑油商贸公司,http://www.11467.com/jinan/co/139813.htm
英格索兰空压机配件济南凯斯通分公司,http://www.11467.com/jinan/co/138751.htm
荆州市恒宇精密薄板有限公司,http://www.11467.com/jingzhou/co/30414.htm
浙江佰耐钢带有限公司销售部,http://www.11467.com/jinhua/co/127350.htm
山东中汇工贸有限公司,http://www.11467.com/jining/co/71464.htm
邹城市旭辉工程机械有限公司,http://www.11467.com/jining/co/72427.htm
济宁山推石油化工股分有限公司,http://www.11467.com/jining/co/74225.htm
曲阜市红马工贸有限公司,http://www.11467.com/jining/co/71894.htm
山东中化二手化工设备购销公司,http://www.11467.com/jining/co/72732.htm
济宁桓榕特钢有限公司,http://www.11467.com/jining/co/73914.htm
云南友信经贸有限公司,http://www.11467.com/kunming/co/128302.htm
廊坊慧华保温材料有限公司,http://www.11467.com/langfang/co/46902.htm
霸州庆远制管有限公司,http://www.11467.com/langfang/co/47638.htm
山东众安冲压件有限公司,http://www.11467.com/liaocheng/co/50870.htm
聊城鼎泰钢铁有限公司,http://www.11467.com/liaocheng/co/49801.htm
冠县冠安恒升薄板有限公司,http://www.11467.com/liaocheng/co/50122.htm
瑞邦塑料助剂有限公司,http://www.11467.com/liaocheng/co/50174.htm
山东隆达钢材物质有限公司,http://www.11467.com/liaocheng/co/51047.htm
山东茌平元丰工贸有限公司,http://www.11467.com/liaocheng/co/50702.htm
山东冠鹏金属薄板有限公司,http://www.11467.com/liaocheng/co/49802.htm
山东聊城万信达物资有限公司,http://www.11467.com/liaocheng/co/50529.htm
山东阳谷祥泰塑料有限公司,http://www.11467.com/liaocheng/co/50317.htm
