日照鑫泰莱光电有限公司,http://www.11467.com/rizhao/co/12706.htm
武汉博智人才人力资源有限公司,http://www.11467.com/wuhan/co/141143.htm
北京赢创永嘉润滑油有限公司,http://www.11467.com/beijing/co/710729.htm
兰州中兴再生资源回收有限责任公司,http://www.11467.com/qiye/93305385.htm
天津市奥利达设备工程技术有限公司,http://www.11467.com/tianjin/co/196412.htm
成都众盛鑫新能源有限公司,http://www.11467.com/qiye/93079170.htm
荆州市大地生物工程有限公司,http://www.11467.com/jingzhou/co/29063.htm
太原群源化工有限公司,http://www.11467.com/changzhi/co/27749.htm
北京启源新能科技有限公司,http://www.11467.com/beijing/co/439214.htm
惠州市信和节能锅炉有限公司,http://www.11467.com/huizhou/co/71138.htm
深圳市张驰管理咨询有限公司,http://www.11467.com/shenzhen/co/722896.htm
张家港多瑞金属有限公司,http://www.11467.com/suzhou/co/321028.htm
深圳市美润达润滑油有限公司营销中心,http://www.11467.com/shenzhen/co/916157.htm
河南东风汽车油品有限公司,http://www.11467.com/xuchang/co/20110.htm
攀枝花鑫华节能技术服务有限公司,http://www.11467.com/panzhihua/co/18345.htm
苏州鑫保成新能源科技有限公司,http://www.11467.com/suzhou/co/385635.htm
淄博瑞能热电科技有限公司,http://www.11467.com/zibo/co/93159.htm
江苏德恒新能源科技股份有限公司,http://www.11467.com/suqian/co/32089.htm
劳联企业管理有限公司,http://www.11467.com/shanghai/co/1016639.htm
广州市科飞贸易有限公司,http://www.11467.com/guangzhou/co/433858.htm
奎屯市宇泰化工有限责任公司,http://www.11467.com/kelamayi/co/9114.htm
河北筑盛建材科技开发有限公司,http://www.11467.com/shijiazhuang/co/106281.htm
邢台市硕星耐火材料有限公司,http://www.11467.com/xintai/co/50498.htm
沧州玉庆激光机械加工有限公司,http://www.11467.com/cangzhou/co/65745.htm
广西联成融资性担保有限公司,http://www.11467.com/nanning/co/79170.htm
安徽创亚光电科技有限公司,http://www.11467.com/hefei/co/155147.htm
南京邗立新能源科技有限公司,http://www.11467.com/nanjing/co/167704.htm
青岛沃富新能源科技有限公司,http://www.11467.com/qingdao/co/191637.htm
铜川晟茂新能源有限公司,http://www.11467.com/tongchuan/co/10109.htm
江西宏浩商业管理集团有限公司,http://www.11467.com/qiye/93212469.htm
沈阳“创新”桑拿设备有限公司,http://www.11467.com/shenyang/co/81406.htm
济南发展有限公司,http://www.11467.com/jinan/co/114786.htm
佛山市酷有网络有限公司,http://www.11467.com/foshan/co/307185.htm
山东佳诚彩钢压型板有限公司,http://www.11467.com/binzhou/co/35724.htm
宜春市永和鑫电子有限公司,http://www.11467.com/yichun/co/21855.htm
抚顺市济开程化工有限公司,http://www.11467.com/fushun/co/27305.htm
杭州利畅不锈钢有限公司,http://www.11467.com/hangzhou/co/207474.htm
上海灿虎金属制品有限公司,http://www.11467.com/shanghai/co/1052530.htm
新加坡稀世英铂有限公司,http://www.11467.com/shanghai/co/747829.htm
上海麦润实业有限公司,http://www.11467.com/shanghai/co/1046754.htm
标点国际商务有限公司,http://www.11467.com/shenzhen/co/730783.htm
西安江河电站技术开发有限责任公司,http://www.11467.com/xian/co/69829.htm
南京盛略科技有限公司,http://www.11467.com/nanjing/co/75548.htm
杭州力特油剂有限公司,http://www.11467.com/hangzhou/co/191908.htm
常州勤邦润滑油有限公司,http://www.11467.com/changzhou/co/99454.htm
江门市凯斯莱工贸有限公司,http://www.11467.com/jiangmen/co/88499.htm
自贡山川气体压缩机有限公司,http://www.11467.com/zigong/co/21800.htm
北京华劲旗电子有限责任公司,http://www.11467.com/beijing/co/620836.htm
沈阳速驰商贸有限公司,http://www.11467.com/shenyang/co/97518.htm
瑞士弗力克石油国际集团中国有限公司,http://www.11467.com/zhengzhou/co/178436.htm
中山市铝掌柜装饰材料有限公司,http://www.11467.com/zhongshan/co/147402.htm
上海誉铁实业有限公司,http://www.11467.com/shanghai/co/1044754.htm
苏州博远企业管理有限公司,http://www.11467.com/suzhou/co/268977.htm
山东梁山三晶石化有限责任公司,http://www.11467.com/jining/co/72029.htm
江悦节能科技（上海）有限公司,http://www.11467.com/shanghai/co/949025.htm
泉州译语翻译服务公司,http://www.11467.com/quanzhou/co/113891.htm
福建中佰川生物润滑剂有限公司,http://www.11467.com/longyan/co/27188.htm
阿特斯化学（香港）有限公司,http://www.11467.com/shenzhen/co/777908.htm
上海振钰实业有限公司,http://www.11467.com/shanghai/co/1046755.htm
上海仕创钢铁销售有限公司,http://www.11467.com/shanghai/co/1039741.htm
巩义市昊伟铝业有限公司,http://www.11467.com/zhengzhou/co/174082.htm
宁波壹贰叁科化塑胶技术有限公司,http://www.11467.com/ningbo/co/193020.htm
青岛南永润滑油工贸有限公司,http://www.11467.com/qingdao/co/152566.htm
福建省德化县鹏翔陶瓷有限公司,http://www.11467.com/quanzhou/co/52375.htm
太仓市云峰润滑油有限公司,http://www.11467.com/suzhou/co/314464.htm
瑞星集团有限公司,http://www.11467.com/taian/co/52746.htm
无锡环科新能源科技工程有限公司,http://www.11467.com/wuxi/co/175236.htm
保定市蓝山科技新能源有限公司,http://www.11467.com/baoding/co/63788.htm
深圳市世纪方策企业管理咨询有限公司,http://www.11467.com/shenzhen/co/727502.htm
康华小额贷款有限制公司,http://www.11467.com/beijing/co/655483.htm
江西科苑辐照技术开发有限公司,http://www.11467.com/nanchang/co/60841.htm
舞钢市中鑫物资有限公司,http://www.11467.com/pingdingshan/co/23821.htm
萍乡市下埠供水有限责任公司,http://www.11467.com/pingxiang/co/13336.htm
昆明廉明石化有限公司,http://www.11467.com/kunming/co/121813.htm
东莞市格美制冷设备有限公司（气体部）,http://www.11467.com/dongguan/co/412132.htm
重庆市九龙坡区隆携小额贷款股份有限公司,http://www.11467.com/chongqing/co/80988.htm
广州畅鑫贸易有限公司,http://www.11467.com/guangzhou/co/261714.htm
东营市绿森信息咨询服务有限公司,http://www.11467.com/dongying/co/32332.htm
曲靖市顺泽矿业技术咨询有限公司,http://www.11467.com/qujing/co/18918.htm
东莞市翔宇劳务派遣有限公司,http://www.11467.com/dongguan/co/411965.htm
天津立业钢铁集团有限公司,http://www.11467.com/tianjin/co/199836.htm
上海珑技模具钢材有限公司,http://www.11467.com/shanghai/co/1042362.htm
长沙华锋知识产权代理有限公司,http://www.11467.com/changsha/co/104019.htm
东营市城烨商贸有限公司,http://www.11467.com/dongying/co/32713.htm
成都凯擎投资管理有限公司,http://www.11467.com/chengdu/co/141718.htm
东莞市信越电子材料有限公司,http://www.11467.com/dongguan/co/493350.htm
武汉宝丰泰投资公司,http://www.11467.com/wuhan/co/141120.htm
东莞市特润德化工材料有限公司,http://www.11467.com/dongguan/co/499539.htm
深圳市晟阳光电有限公司,http://www.11467.com/shenzhen/co/120812.htm
广州南粤人才市场有限公司,http://www.11467.com/guangzhou/co/432305.htm
金坛梅香仪器（低温水槽）有限公司,http://www.11467.com/changzhou/co/129839.htm
厦门誉颁会展服务有限公司,http://www.11467.com/xiamen/co/92795.htm
哈尔滨欣晨怡网景电子有限公司,http://www.11467.com/haerbin/co/49187.htm
佛山市帕金斯动力设备有限公司,http://www.11467.com/foshan/co/355700.htm
兰州卓展空调设备有限公司,http://www.11467.com/lanzhou/co/79998.htm
东莞市宝盛润滑油有限公司,http://www.11467.com/dongguan/co/489633.htm
许昌市众心诚物资有限公司,http://www.11467.com/xuchang/co/22843.htm
苏州金宏气体股份有限公司吴江分公司,http://www.11467.com/wujiang/co/29287.htm
河南澳华出入境服务有限公司,http://www.11467.com/zhengzhou/co/149618.htm
上海蕊弘实业有限公司,http://www.11467.com/shanghai/co/898341.htm
广州鞍科金属制品有限公司,http://www.11467.com/guangzhou/co/468611.htm
东莞市星源环保热能设备有限公司,http://www.11467.com/dongguan/co/127900.htm
河南金恒铝业有限公司,http://www.11467.com/zhengzhou/co/173122.htm
常州骏煌石油化工有限公司,http://www.11467.com/changzhou/co/128907.htm
西安新能源有限公司,http://www.11467.com/xian/co/121178.htm
派克汉尼汾中国总公司,http://www.11467.com/guangzhou/co/434406.htm
青岛库邦新材料技术有限公司,http://www.11467.com/qingdao/co/125274.htm
聚成股份南京分公司,http://www.11467.com/nanjing/co/115549.htm
深圳市上朗科技咨询服务有限公司,http://www.11467.com/shenzhen/co/733398.htm
北京茂丰元工贸有限公司,http://www.11467.com/beijing/co/588110.htm
福州安顺贷有限公司,http://www.11467.com/fuzhou/co/162035.htm
九行投资（上海）有限公司,http://www.11467.com/shanghai/co/1016715.htm
金凯利投资担保有限公司,http://www.11467.com/qingdao/co/124793.htm
烟台金晖资产管理有限公司,http://www.11467.com/yantai/co/154659.htm
东莞广聚情缘婚介服务有限公司,http://www.11467.com/dongguan/co/413961.htm
淄博市讯浪纳米技术有限公司,http://www.11467.com/zibo/co/93213.htm
山西省忻州市五台县皓源矿业有限公司,http://www.11467.com/xinzhou/co/17595.htm
烟台华顺润滑油有限公司,http://www.11467.com/yantai/co/136093.htm
杭州晨希过滤机有限公司,http://www.11467.com/hangzhou/co/207870.htm
佛山市志好钢业有限公司,http://www.11467.com/foshan/co/339483.htm
东莞市道润商贸有限公司,http://www.11467.com/dongguan/co/493340.htm
郴州市诚远工贸有限公司,http://www.11467.com/chenzhou/co/23026.htm
东莞市华普电池科技有限公司,http://www.11467.com/dongguan/co/410279.htm
湖北鑫海纳硅业有限公司,http://www.11467.com/xiangfan/co/43933.htm
辽阳瑞博石油化工有限公司,http://www.11467.com/liaoyang/co/24929.htm
鑫诺国际金融投资股份有限公司,http://www.11467.com/shanghai/co/1034821.htm
南京纳飞特流体技术有限公司,http://www.11467.com/nanjing/co/115161.htm
浙江千禄贵金属制品有限公司,http://www.11467.com/hangzhou/co/311808.htm
衡水天龙物业服务有限责任公司,http://www.11467.com/hengshui/co/27004.htm
环亚国际知识产权（九江）分公司,http://www.11467.com/jiujiang/co/22408.htm
南通强生储罐清洗服务有限公司,http://www.11467.com/nantong/co/113704.htm
北京中贸国际展览有限公司,http://www.11467.com/beijing/co/439391.htm
东莞市安卓热能设备有限公司,http://www.11467.com/dongguan/co/556616.htm
深圳沃特玛电池有限公司,http://www.11467.com/shenzhen/co/519770.htm
哈尔滨金石生物质能源发展有限公司,http://www.11467.com/haerbin/co/41704.htm
湖北百杰瑞新材料有限公司,http://www.11467.com/wuhan/co/107723.htm
杭州世融投资咨询有限公司,http://www.11467.com/hangzhou/co/512738.htm
山东霄瀚能源有限公司,http://www.11467.com/qiye/93326127.htm
中山市维博新能源科技有限公司,http://www.11467.com/zhongshan/co/229043.htm
淄博贝翔经贸有限责任公司,http://www.11467.com/zibo/co/117262.htm
长沙鑫广能源科技有限公司,http://www.11467.com/qiye/93160903.htm
吉林省神华生物质新能源供热有限公司,http://www.11467.com/changchun/co/110801.htm
永年县冀骄紧固件有限公司,http://www.11467.com/handan/co/141952.htm
南京洁能缘有限公司,http://www.11467.com/nanjing/co/115005.htm
广州兴新机钻深水井公司,http://www.11467.com/guangzhou/co/692786.htm
杭州航翔气体有限公司,http://www.11467.com/hangzhou/co/418305.htm
深圳市电霸科技有限公司,http://www.11467.com/shenzhen/co/1003651.htm
烟台卓越新能源有限公司,http://www.11467.com/yantai/co/188939.htm
天津法斯特科技有限公司,http://www.11467.com/tianjin/co/230533.htm
重庆奉节旅游有限公司,http://www.11467.com/chongqing/co/29842.htm
天津市易兆辰钢铁贸易有限公司,http://www.11467.com/qiye/93063365.htm
苏州绿华冷冻有限公司,http://www.11467.com/qiye/93081783.htm
高邮市锐意炉衬材料有限公司,http://www.11467.com/yangzhou/co/106093.htm
天津市顺发祥新能源科技有限公司,http://www.11467.com/tianjin/co/282371.htm
济南华飞思创电力科技有限公司,http://www.11467.com/jinan/co/160943.htm
深圳市明道达能源科技有限公司,http://www.11467.com/shenzhen/co/720726.htm
广州市羿珑贸易有限公司,http://www.11467.com/guangzhou/co/461315.htm
舞钢市中鑫物资有限公司,http://www.11467.com/pingdingshan/co/23821.htm
广东省南海鼎丰化工有限公司,http://www.11467.com/foshan/co/339468.htm
中山市伟进金属材料有限公司,http://www.11467.com/zhongshan/co/151838.htm
霍尔果斯口岸源能热力有限公司,http://www.11467.com/yili/co/11960.htm
上海玺达实业有限公司,http://www.11467.com/shanghai/co/54243.htm
寿光富士木业有限公司,http://www.11467.com/weifang/co/118683.htm
镇江市金山典当有限责任公司信达分公司,http://www.11467.com/zhenjiang/co/54092.htm
荷露废钢废旧物资回收公司,http://www.11467.com/zhengzhou/co/149391.htm
圣诺珂陶瓷科技（苏州）有限公司,http://www.11467.com/suzhou/co/270749.htm
重庆登顺科技有限公司,http://www.11467.com/chongqing/co/171936.htm
新疆阿舍勒铜业股份有限公司,http://www.11467.com/aletai/co/5278.htm
东营市飒格曼石油科技开发有限公司,http://www.11467.com/dongying/co/32676.htm
贵州乌江水电开发有限责任公司,http://www.11467.com/guiyang/co/78210.htm
昆明恒达商贸有限公司,http://www.11467.com/taizhou/co/105439.htm
延长石油公司,http://www.11467.com/yanan/co/13039.htm
江苏舜天高新炭材有限公司,http://www.11467.com/yancheng/co/59541.htm
盐城市锅炉制造有限公司,http://www.11467.com/yancheng/co/60721.htm
辽源市长城重型机器有限责任公司,http://www.11467.com/liaoyuan/co/8811.htm
陇南市东诚建设集团有限公司,http://www.11467.com/longnan/co/8072.htm
娄底市辉宇科技有限公司,http://www.11467.com/loudi/co/18717.htm
漯河市光大石油有限公司,http://www.11467.com/luohe/co/18733.htm
四川普华建筑智能化工程有限公司,http://www.11467.com/chengdu/co/141692.htm
四川普华建筑智能化工程有限公司,http://www.11467.com/chengdu/co/141691.htm
中国石油天然气集团公司油田节能监测中心,http://www.11467.com/daqing/co/42675.htm
东莞市恒隆热能设备有限公司,http://www.11467.com/dongguan/co/126601.htm
内蒙古二连浩特木材交易公司,http://www.11467.com/erlianhaote/co/932.htm
江西省远景林业开发有限公司赣州分公司,http://www.11467.com/ganzhou/co/29825.htm
广元碘向世家水电投资管理有限公司,http://www.11467.com/guangyuan/co/17159.htm
贵州龙盛源有限责任公司,http://www.11467.com/guiyang/co/78309.htm
哈尔滨市呼兰区双来热力有限公司,http://www.11467.com/haerbin/co/62312.htm
菏泽亿龙塑胶有限公司,http://www.11467.com/heze/co/23741.htm
淮北建峰节能科技服务有限公司,http://www.11467.com/huaibei/co/14289.htm
内蒙古新鸿盛高科技园区有限责任公司,http://www.11467.com/huhehaote/co/29619.htm
浙江湖州东南炭业有限公司,http://www.11467.com/huzhou/co/56053.htm
浙江中胜科技有限公司,http://www.11467.com/huzhou/co/56076.htm
辽宁安耐吉计量科技发展有限公司（总公司）,http://www.11467.com/jinzhou/co/45632.htm
云华昕贸易有限公司 销售部,http://www.11467.com/jiujiang/co/22351.htm
莱芜市金赜能源有限公司,http://www.11467.com/laiwu/co/9689.htm
兰州奔马实业（集团）有限公司,http://www.11467.com/lanzhou/co/72921.htm
亚太电效系统有限公司,http://www.11467.com/lanzhou/co/72872.htm
甘肃省陇南隆华水电开发有限责任公司,http://www.11467.com/longnan/co/8217.htm
茂名市锐进化工有限公司,http://www.11467.com/maoming/co/33884.htm
宁波中腾实业公司,http://www.11467.com/ningbo/co/142940.htm
盘锦瑞特科技服务有限公司,http://www.11467.com/panjin/co/25682.htm
大成恩矿业公司,http://www.11467.com/panzhihua/co/17016.htm
新特工贸公司,http://www.11467.com/panzhihua/co/17036.htm
江西省萍乡市春蕾钻井助剂有限责任公司,http://www.11467.com/pingxiang/co/13274.htm
美国英特莱德咨询有限公司,http://www.11467.com/puyang/co/21467.htm
新油管道技术有限公司管道检测分公司,http://www.11467.com/puyang/co/21475.htm
新油管道技术有限公司管道检测分公司,http://www.11467.com/puyang/co/21474.htm
旺旺木炭公司,http://www.11467.com/shangqiu/co/17921.htm
江西天实业有限公司,http://www.11467.com/shangrao/co/23438.htm
联益集团公司,http://www.11467.com/shaoguan/co/26178.htm
四川鼎力石化有限公司,http://www.11467.com/chengdu/co/142645.htm
百色市富源水电有限责任公司,http://www.11467.com/baise/co/12280.htm
麦雅国际贸易有限公司,http://www.11467.com/baotou/co/28085.htm
北海华生矿业有限公司,http://www.11467.com/beihai/co/16275.htm
环宇稀土有限公司,http://www.11467.com/bijie/co/8903.htm
山东滨州市民众生物燃料有限责任公司,http://www.11467.com/binzhou/co/24738.htm
山东盛和热能有限公司,http://www.11467.com/binzhou/co/24756.htm
鲁胜二氧化碳公司,http://www.11467.com/binzhou/co/24726.htm
金海经贸有限公司,http://www.11467.com/songyuan/co/15856.htm
宿迁市广源能源投资有限公司,http://www.11467.com/suqian/co/14885.htm
宿迁市广源能源投资有限公司,http://www.11467.com/suqian/co/14884.htm
泰安市宏达水利工程有限公司,http://www.11467.com/taian/co/41643.htm
陕西省铜川市鑫辉有限责任公司,http://www.11467.com/tongchuan/co/8590.htm
铜陵环亚有限责任公司,http://www.11467.com/tongling/co/13075.htm
武汉盛华微系统技术股份有限公司,http://www.11467.com/wuhan/co/96281.htm
乌鲁木齐东方凯隆商贸有限公司,http://www.11467.com/wulumuqi/co/100125.htm
阿拉山口鹰泰贸易有限公司,http://www.11467.com/wulumuqi/co/99950.htm
新疆风能有限责任公司,http://www.11467.com/wulumuqi/co/100055.htm
乌鲁木齐高远矿业咨询有限责任公司,http://www.11467.com/wulumuqi/co/100001.htm
西安鸿晨环保科技有限公司,http://www.11467.com/xian/co/123877.htm
意弘商务公司,http://www.11467.com/xiangfan/co/40909.htm
许昌许继昌南通信设备有限公司,http://www.11467.com/xuchang/co/195.htm
延安工贸有限公司,http://www.11467.com/yanan/co/13046.htm
通达石油机械配件公司,http://www.11467.com/yanan/co/13044.htm
山西江合通达油气工程材料制造有限公司,http://www.11467.com/yangquan/co/12120.htm
烟台开元节水技术开发有限公司,http://www.11467.com/yantai/co/133515.htm
三峡陈禹富奇石有限公司,http://www.11467.com/yichang/co/48015.htm
宁夏银川高新区致远工程服务有限公司,http://www.11467.com/yinchuan/co/42618.htm
岳阳杜邦德力科技有限公司销售公司,http://www.11467.com/yueyang/co/34649.htm
华能岳阳电厂实业总公司,http://www.11467.com/yueyang/co/34623.htm
红红火炭业有限公司,http://www.11467.com/yunfu/co/26684.htm
枣庄市鸿建建材有限公司,http://www.11467.com/zaozhuang/co/30726.htm
太康天利热电生化有限公司,http://www.11467.com/zhoukou/co/18057.htm
株洲天地龙电源科技有限公司,http://www.11467.com/zhuzhou/co/37438.htm
淄博龙海石化润滑油有限公司,http://www.11467.com/zibo/co/92869.htm
青岛汕水旅游度假有限公司,http://www.11467.com/zibo/co/92868.htm
天津达璞瑞科技有限公司,http://www.11467.com/tianjin/co/197001.htm
天津市联瑞阻燃材料有限公司,http://www.11467.com/tianjin/co/197294.htm
福建中海石化有限公司,http://www.11467.com/putian/co/51086.htm
常德市联嘉机械有限公司,http://www.11467.com/changde/co/29820.htm
山西振东集团石油公司,http://www.11467.com/changzhi/co/27728.htm
巢湖市金源橡胶制品有限公司,http://www.11467.com/chaohu/co/14660.htm
赤峰市金泽矿产品营销有限公司,http://www.11467.com/chifeng/co/24295.htm
安徽矿业有限公司,http://www.11467.com/chizhou/co/9152.htm
滁州扬子必威中央空调有限公司技术部,http://www.11467.com/chuzhou/co/22584.htm
黑龙江省大庆市天龙石油公司,http://www.11467.com/daqing/co/42649.htm
大同能源公司,http://www.11467.com/datong/co/15968.htm
东莞市大田金属容器有限公司,http://www.11467.com/dongguan/co/497765.htm
山东省东营市鑫泰来润滑脂有限公司广东省办事处,http://www.11467.com/dongying/co/32685.htm
胜利油田测井一分公司,http://www.11467.com/dongying/co/32634.htm
抚顺石油化工公司,http://www.11467.com/fushun/co/27967.htm
抚顺页岩油有限公司,http://www.11467.com/fushun/co/27994.htm
圣兴碳业有限公司,http://www.11467.com/fuxin/co/16941.htm
江西省抚州兴源实业有限公司,http://www.11467.com/fuzhoushi/co/17054.htm
贵州江南航天生物能源科技有限公司,http://www.11467.com/guiyang/co/78193.htm
贵州显昭汽车用品有限公司,http://www.11467.com/guiyang/co/82924.htm
贵州省银河电力开发有限公司,http://www.11467.com/guiyang/co/78311.htm
贵阳市勇兴矿产资源咨询服务有限公司,http://www.11467.com/guiyang/co/78228.htm
天聪投资咨询有限公司,http://www.11467.com/guiyang/co/78212.htm
贵阳市勇兴矿产资源咨询服务有限公司,http://www.11467.com/guiyang/co/78229.htm
天聪投资咨询有限公司,http://www.11467.com/guiyang/co/78213.htm
哈密大运矿业有限公司,http://www.11467.com/hami/co/4988.htm
邯郸市卓立精细板材有限公司,http://www.11467.com/handan/co/68506.htm
小刚养殖公司,http://www.11467.com/hebi/co/10018.htm
河池市护生气体有限公司,http://www.11467.com/hechi/co/11775.htm
衡水泰灰渣销售公司,http://www.11467.com/hengshui/co/26730.htm
中国安铭科技有限公司,http://www.11467.com/heze/co/23729.htm
辽宁东方经贸有限公司,http://www.11467.com/huludao/co/44379.htm
德清京浙建材有限公司,http://www.11467.com/huzhou/co/66870.htm
吉安亿能信息发展有限公司,http://www.11467.com/jian/co/16941.htm
金昌市物资再生利用有限责任公司,http://www.11467.com/jinchang/co/4983.htm
恒光热电有限公司,http://www.11467.com/jincheng/co/18499.htm
祁县华能科技有限公司,http://www.11467.com/jinzhong/co/23349.htm
大连金博扬碳业有限公司,http://www.11467.com/jixi/co/21005.htm
公共事务管理公司,http://www.11467.com/kelamayi/co/8877.htm
广西来宾县鑫旺碳业有限公司,http://www.11467.com/laibin/co/4596.htm
四川新光硅业科技有限公司,http://www.11467.com/leshan/co/21243.htm
金阳光土地承包有限公司,http://www.11467.com/linfen/co/33117.htm
龙岩市新区自来水有限公司,http://www.11467.com/longyan/co/23486.htm
中国生物柴油国际控股有限公司,http://www.11467.com/longyan/co/23480.htm
四川和益电力股份有限公司供电分公司,http://www.11467.com/luzhou/co/18606.htm
眉山桉树林木有限公司,http://www.11467.com/meishan/co/14675.htm
绵阳市星火科技有限公司,http://www.11467.com/mianyang/co/38593.htm
宁波伊德尔新材料有限公司,http://www.11467.com/ningbo/co/193018.htm
辽宁电力有限公司盘锦供电公司,http://www.11467.com/panjin/co/25689.htm
绿色生活贸易股份有限公司,http://www.11467.com/pingdingshan/co/20348.htm
宇宙集团濮阳炭业有限公司,http://www.11467.com/puyang/co/21481.htm
青岛捷能高新技术有限责任公司,http://www.11467.com/qingdao/co/123895.htm
秦皇岛宇瑞贸易有限公司,http://www.11467.com/qinhuangdao/co/38974.htm
广西钦州丰源水利供水有限公司,http://www.11467.com/qinzhou/co/9009.htm
顺通锅炉材料有限公司,http://www.11467.com/qiqihaer/co/60157.htm
浙江飞宇光电科技有限公司 销售部,http://www.11467.com/quzhou/co/25049.htm
浙江中硅电子科技有限公司（综合办）,http://www.11467.com/quzhou/co/25066.htm
叶鑫贸易有限公司,http://www.11467.com/sanming/co/32188.htm
商丘市神火炭业公司,http://www.11467.com/shangqiu/co/17942.htm
远山贸易有限公司,http://www.11467.com/shangqiu/co/17952.htm
广东红海湾发电有限公司,http://www.11467.com/shanwei/co/9593.htm
广东红海湾发电有限公司,http://www.11467.com/shanwei/co/9592.htm
湖南邵阳市生物质油脂公司,http://www.11467.com/shaoyang/co/25127.htm
石家庄合谷润滑油有限公司,http://www.11467.com/shijiazhuang/co/140918.htm
吉林省环生能源科技开发有限公司业务部,http://www.11467.com/siping/co/32051.htm
四川省福鑫能源投资有限公司,http://www.11467.com/suining/co/9443.htm
常熟宝进钢材加工有限公司,http://www.11467.com/suzhou/co/323371.htm
宿州皖北气体公司,http://www.11467.com/suzhoushi/co/19095.htm
山西汾渭信息技术有限公司（市场部）,http://www.11467.com/taiyuan/co/106488.htm
太原市来如联贸易有限公司,http://www.11467.com/taiyuan/co/106588.htm
太原天宝商贸有限公司,http://www.11467.com/taiyuan/co/105931.htm
辽宁天力林业有限公司大连分公司,http://www.11467.com/tieling/co/32068.htm
河南意都钢铁实业有限公司,http://www.11467.com/anyang/co/36704.htm
