东科轴配有限公司,http://www.11467.com/liaocheng/co/51135.htm
临汾双山焦铝有限公司,http://www.11467.com/linfen/co/32132.htm
山东华彩珠光颜料有限公司,http://www.11467.com/linyi/co/94701.htm
洛阳正本润滑材料有限公司,http://www.11467.com/luoyang/co/60059.htm
茂名市腾意石油化工有限公司,http://www.11467.com/maoming/co/5585.htm
江西京冶科技有限责任公司,http://www.11467.com/nanchang/co/108069.htm
南京圣诺热管有限公司,http://www.11467.com/nanjing/co/43881.htm
南京澜大生化境科技有限公司,http://www.11467.com/nanjing/co/156378.htm
南宁市海聚米汽车配件有限公司,http://www.11467.com/nanning/co/86573.htm
创润润滑油(广西)有限公司,http://www.11467.com/nanning/co/86574.htm
广西金辉润滑油有限公司,http://www.11467.com/nanning/co/86991.htm
广西恒大润滑油有限公司,http://www.11467.com/nanning/co/86374.htm
福建省顺昌县天诚化工有限公司,http://www.11467.com/nanping/co/40281.htm
江苏凯业装饰材料有限公司,http://www.11467.com/nantong/co/137644.htm
宁波保润石化(巴润特)有限公司,http://www.11467.com/ningbo/co/193979.htm
宁波江北铭宏国光化工有限公司,http://www.11467.com/ningbo/co/198051.htm
余姚市中发工程塑料有限公司,http://www.11467.com/ningbo/co/199086.htm
余姚荆海化工颜料有限公司,http://www.11467.com/ningbo/co/193968.htm
宁波展鹏金属制品有限公司,http://www.11467.com/ningbo/co/196947.htm
浙江宏谐物资股份有限公司,http://www.11467.com/ningbo/co/193632.htm
舞钢市悦森物资责任有限公司,http://www.11467.com/pingdingshan/co/23831.htm
舞钢金昌物资有限责任公司,http://www.11467.com/pingdingshan/co/23745.htm
舞钢市华龙物资有限责任公司,http://www.11467.com/pingdingshan/co/23670.htm
河南省长城特种润滑脂有限公司,http://www.11467.com/puyang/co/24256.htm
青岛国际贸易有限公司,http://www.11467.com/qingdao/co/85743.htm
青岛道普化学有限公司,http://www.11467.com/qingdao/co/154696.htm
青岛德汇润滑油品有限公司,http://www.11467.com/qingdao/co/155089.htm
青岛胶州市恒力物资贸易有限公司,http://www.11467.com/qingdao/co/157038.htm
青岛嘉实多润滑油有限公司,http://www.11467.com/qingdao/co/155090.htm
青岛一峰化工材料有限公司,http://www.11467.com/qingdao/co/153774.htm
青岛国化富润化工有限公司,http://www.11467.com/qingdao/co/156193.htm
青岛隆基通钢结构工程有限公司,http://www.11467.com/qingdao/co/154515.htm
中国海洋石油能源集团发展有限公司青岛分公司,http://www.11467.com/qingdao/co/155091.htm
青岛莹延商贸有限公司,http://www.11467.com/qingdao/co/153773.htm
越城润滑油贸易公司,http://www.11467.com/quanzhou/co/131633.htm
江山市塑料管件有限公司,http://www.11467.com/quzhou/co/34114.htm
沈阳奥依特蛭石防火制品有限公司,http://www.11467.com/shenyang/co/96893.htm
沈阳鸿澳商贸有限公司(昆仑润滑油销售中心),http://www.11467.com/shenyang/co/98728.htm
沈阳慧鑫伟化工有限公司,http://www.11467.com/shenyang/co/97740.htm
沈阳东泰新热源发展有限责任公司,http://www.11467.com/shenyang/co/29525.htm
华莱斯润滑油(深圳)有限公司,http://www.11467.com/shenzhen/co/790993.htm
多博络化工科技有限公司,http://www.11467.com/shenzhen/co/785230.htm
浩域电子（深圳）有限公司,http://www.11467.com/shenzhen/co/720462.htm
嘉鑫豪塑胶制品有限公司,http://www.11467.com/shenzhen/co/797266.htm
东莞安美润滑科技有限公司,http://www.11467.com/shenzhen/co/720645.htm
城特润滑贸易有限公司,http://www.11467.com/shenzhen/co/768235.htm
洛克润滑油科技有限公司,http://www.11467.com/shenzhen/co/773423.htm
今山青井贸易(深圳)有限公司,http://www.11467.com/shenzhen/co/792361.htm
宏利宝钢铁公司,http://www.11467.com/shenzhen/co/796933.htm
洛克润滑油【深圳】有限公司,http://www.11467.com/shenzhen/co/785229.htm
美国飞达仕涂油机设备公司华南办事处,http://www.11467.com/shenzhen/co/786890.htm
森华孚润滑科技有限公司,http://www.11467.com/shenzhen/co/768249.htm
深圳奥德润滑油有限公司,http://www.11467.com/shenzhen/co/768241.htm
深圳恒泽丰贸易有限公司,http://www.11467.com/shenzhen/co/793424.htm
广东深圳市优宝惠新材料科技有限公司,http://www.11467.com/shenzhen/co/777913.htm
深圳华润邦润滑油有限公司,http://www.11467.com/shenzhen/co/801751.htm
美邦威润滑油(深圳)化工有限公司,http://www.11467.com/shenzhen/co/762956.htm
深圳奥凯润商贸有限公司,http://www.11467.com/shenzhen/co/768245.htm
深圳市宏达莱特科技有限公司,http://www.11467.com/shenzhen/co/762950.htm
深圳市博诺斯化工有限公司,http://www.11467.com/shenzhen/co/785173.htm
深圳市特润宝润滑材料有限公司,http://www.11467.com/shenzhen/co/430384.htm
深圳市康安福五金塑胶有限公司,http://www.11467.com/shenzhen/co/277659.htm
深圳市文汇嘉科技科技有限公司(长城润滑油),http://www.11467.com/shenzhen/co/788206.htm
深圳市新特润滑材料有限公司,http://www.11467.com/shenzhen/co/768252.htm
深圳市润达行润滑油有限公司,http://www.11467.com/shenzhen/co/768247.htm
深圳市思敏实业有限公司,http://www.11467.com/shenzhen/co/80091.htm
深圳市宇润润滑科技有限公司,http://www.11467.com/shenzhen/co/788203.htm
深圳市粤鹏孚贸易有限公司,http://www.11467.com/shenzhen/co/762951.htm
通标标准技术服务有限公司深圳分公司认证部,http://www.11467.com/shenzhen/co/721400.htm
香港鑫胜科技发展有限公司,http://www.11467.com/shenzhen/co/762949.htm
深圳市艾美壳润滑材料有限公司,http://www.11467.com/shenzhen/co/768253.htm
深圳洛克润滑油科技有限公司,http://www.11467.com/shenzhen/co/790997.htm
河北筑嘉商贸有限公司,http://www.11467.com/shijiazhuang/co/138985.htm
石家庄天宏伟业贸易有限公司化工分公司,http://www.11467.com/shijiazhuang/co/139584.htm
美国劲力宝科技有限公司,http://www.11467.com/shijiazhuang/co/142305.htm
河北京都石油化工有限公司,http://www.11467.com/shijiazhuang/co/140919.htm
湖北开源燃料有限公司,http://www.11467.com/suizhou/co/11134.htm
江苏苏州玖城润滑油有限公司,http://www.11467.com/suzhou/co/316855.htm
昆山龙拓金属制品有限公司,http://www.11467.com/suzhou/co/317354.htm
昆山正森金属材料有限公司,http://www.11467.com/suzhou/co/318225.htm
昆山市时代塑胶颜料有限公司,http://www.11467.com/suzhou/co/316825.htm
迈吉森复合材料有限公司,http://www.11467.com/suzhou/co/314431.htm
苏州达昇电子材料有限公司,http://www.11467.com/suzhou/co/318202.htm
克洛克纳(常熟)金属加工有限公司,http://www.11467.com/suzhou/co/315095.htm
苏州立成金属材料有限公司,http://www.11467.com/suzhou/co/319071.htm
苏州润英联新材料有限公司,http://www.11467.com/suzhou/co/320109.htm
苏州卓之达步标钢铁发展有限公司,http://www.11467.com/suzhou/co/317353.htm
苏州通钢舜业钢材加工有限公司,http://www.11467.com/suzhou/co/324112.htm
苏州威尔柯贸易有限公司(原苏州特种油品贸易有限公司),http://www.11467.com/suzhou/co/320114.htm
苏州特丰铝业有限公司,http://www.11467.com/suzhou/co/319790.htm
张家港铁牛贸易有限公司,http://www.11467.com/suzhou/co/322553.htm
张家港保税区鼎祥国际贸易有限公司,http://www.11467.com/suzhou/co/322080.htm
泰安市北方电力设备有限公司,http://www.11467.com/taian/co/53523.htm
江苏。靖江。纽桑达润滑油有限公司,http://www.11467.com/taizhoushi/co/50252.htm
张家港保税区环拓国际贸易有限公司,http://www.11467.com/taizhoushi/co/48630.htm
唐山润驰润滑油有限公司,http://www.11467.com/tangshan/co/75974.htm
唐山市路南华润物资经销有限公司,http://www.11467.com/tangshan/co/75815.htm
唐山市嘉欢带钢有限公司,http://www.11467.com/tangshan/co/76156.htm
山东三润助剂科技有限公司,http://www.11467.com/weifang/co/118779.htm
山东豪马克石油化工有限公司,http://www.11467.com/weifang/co/121174.htm
潍坊汇特润滑油有限公司,http://www.11467.com/weifang/co/118795.htm
潍坊东临化工有限公司,http://www.11467.com/weifang/co/118364.htm
浙江伟明环保股份有限公司,http://www.11467.com/wenzhou/co/169206.htm
武汉九达恒通物资有限公司,http://www.11467.com/wuhan/co/143866.htm
武汉苏天润滑油脂有限公司,http://www.11467.com/wuhan/co/142570.htm
乌鲁木齐富芬贸易有限公司,http://www.11467.com/wulumuqi/co/103146.htm
江苏同越经贸发展有限公司,http://www.11467.com/wuxi/co/247562.htm
江阴市铭丰法兰有限公司,http://www.11467.com/wuxi/co/246902.htm
无锡瑞萨贸易有限公司,http://www.11467.com/wuxi/co/212462.htm
沙钢宽厚板(无锡元宏)钢板加工有限公司,http://www.11467.com/wuxi/co/244647.htm
无锡凯达化工换热设备有限公司,http://www.11467.com/wuxi/co/138522.htm
宜兴市德科化工有限公司,http://www.11467.com/wuxi/co/245581.htm
无锡乘春贸易有限公司,http://www.11467.com/wuxi/co/245432.htm
无锡英臻科技有限公司,http://www.11467.com/wuxi/co/184800.htm
无锡闽路钢材贸易有限公司,http://www.11467.com/wuxi/co/245437.htm
无锡仁美钢铁有限公司,http://www.11467.com/wuxi/co/246033.htm
江苏无锡佳士达钢铁有限公司,http://www.11467.com/wuxi/co/246701.htm
无锡市百汇机械集团有限公司,http://www.11467.com/wuxi/co/137790.htm
无锡碳氢清洗科技有限公司,http://www.11467.com/wuxi/co/245886.htm
厦门信峪电子科技有限公司,http://www.11467.com/xiamen/co/94619.htm
惟乐环保材料有限公司,http://www.11467.com/xiamen/co/93922.htm
厦门鸿铎贸易有限公司,http://www.11467.com/xiamen/co/94618.htm
厦门宏东翰工贸有限公司,http://www.11467.com/xiamen/co/96679.htm
西安鼎顺钢铁有限公司,http://www.11467.com/xian/co/122712.htm
西安市临潼区骊山风景区地热资源开发有限责任公司,http://www.11467.com/xian/co/94950.htm
西安劳特电子有限责任公司,http://www.11467.com/xian/co/94971.htm
西安中天钢铁有限公司,http://www.11467.com/xian/co/125359.htm
河北田氏化工有限公司,http://www.11467.com/xintai/co/51592.htm
邢台宏业润滑科技有限公司,http://www.11467.com/xintai/co/52106.htm
河南新乡市起重钢格板有限公司,http://www.11467.com/xinxiang/co/31705.htm
新乡市宝尔弗润滑油有限公司,http://www.11467.com/xinxiang/co/32400.htm
河曲县万维耐火材料有限责任公司,http://www.11467.com/xinzhou/co/20141.htm
邳州隆宇钢材贸易有限公司,http://www.11467.com/xuzhou/co/81942.htm
徐州鸿森商贸(木业)有限公司,http://www.11467.com/xuzhou/co/81079.htm
中煤第五建设公司,http://www.11467.com/xuzhou/co/48100.htm
江苏瑞德铝业科技有限公司,http://www.11467.com/xuzhou/co/81609.htm
阜宁立鑫钢铁贸易有限公司,http://www.11467.com/yancheng/co/79280.htm
扬州东林木屑公司,http://www.11467.com/yangzhou/co/106619.htm
烟台恒邦集团经贸分公司金属材料公司,http://www.11467.com/yantai/co/155290.htm
江西金阳带钢有限公司,http://www.11467.com/yichun/co/23684.htm
营口鲅鱼圈恒兴有限公司,http://www.11467.com/yingkou/co/46414.htm
辽宁营口恒兴商贸公司,http://www.11467.com/yingkou/co/46431.htm
福建凯西集团有限公司,http://www.11467.com/zhangzhou/co/48017.htm
漳州千坤塑料有限公司,http://www.11467.com/zhangzhou/co/47760.htm
河南省宏达炉业有限公司,http://www.11467.com/zhengzhou/co/25196.htm
河南良友化工产品有限公司,http://www.11467.com/zhengzhou/co/172399.htm
郑州启升钢结构技术有限公司,http://www.11467.com/zhengzhou/co/173125.htm
郑州长通塑业有限公司,http://www.11467.com/zhengzhou/co/174078.htm
埃尼化学(中国)有限公司,http://www.11467.com/zhongshan/co/149073.htm
斯美特电器有限公司,http://www.11467.com/zhongshan/co/147639.htm
山东科鲁能源动力有限公司,http://www.11467.com/zibo/co/92674.htm
淄博耀东耐火材料有限公司,http://www.11467.com/zibo/co/3719.htm
山东淄博英可利化工贸易公司,http://www.11467.com/zibo/co/99474.htm
北京长丰彩钢钢结构有限公司,http://www.11467.com/beijing/co/708253.htm
北京京鑫钢构有限公司,http://www.11467.com/beijing/co/694906.htm
北京嘉力润润滑油有限公司,http://www.11467.com/beijing/co/702190.htm
北京金宝利润滑油公司,http://www.11467.com/beijing/co/709777.htm
北京沪锦科技有限公司,http://www.11467.com/beijing/co/705082.htm
北京三友工贸发展有限公司,http://www.11467.com/beijing/co/704607.htm
北京家喻腾达贸易有限公司,http://www.11467.com/beijing/co/703118.htm
北京新元瑞普科技发展有限公司,http://www.11467.com/beijing/co/226685.htm
北京云间涛水钢铁有限公司,http://www.11467.com/beijing/co/699767.htm
吉林省电力建设总公司,http://www.11467.com/beijing/co/226721.htm
北京喜来登钢铁有限公司,http://www.11467.com/beijing/co/701545.htm
美国森福特石油化工有限公司,http://www.11467.com/beijing/co/710728.htm
中海炼石油化工有限公司,http://www.11467.com/beijing/co/693153.htm
新奥科技发展有限公司,http://www.11467.com/beijing/co/226689.htm
韩国NABAKEM中国区总经销上海南邦润滑剂有限公司,http://www.11467.com/shanghai/co/1038271.htm
上海彩毅贸易有限公司,http://www.11467.com/shanghai/co/1038201.htm
上海迪海实业有限公司,http://www.11467.com/shanghai/co/1046756.htm
上海超润贸易有限公司,http://www.11467.com/shanghai/co/1040909.htm
上海富爱润滑油有限公司,http://www.11467.com/shanghai/co/1049133.htm
上海济联实业发展有限公司,http://www.11467.com/shanghai/co/1054775.htm
上海宝钢高强钢加工配送有限公司,http://www.11467.com/shanghai/co/1042357.htm
上海富萌商贸有限公司,http://www.11467.com/shanghai/co/1049904.htm
上海恒久实业有限公司,http://www.11467.com/shanghai/co/1051263.htm
上海力营实业彩纲有限公司,http://www.11467.com/shanghai/co/1056676.htm
上海博迈能实业有限公司,http://www.11467.com/shanghai/co/1044739.htm
上海博怀化工有限责任公司,http://www.11467.com/shanghai/co/1040861.htm
上海碧万顷金属材料有限公司,http://www.11467.com/shanghai/co/1044750.htm
法钢特种钢材(上海)有限公司,http://www.11467.com/shanghai/co/1044742.htm
上海蓝贸国际贸易有限公司,http://www.11467.com/shanghai/co/1044752.htm
低合金管材有限公司,http://www.11467.com/shanghai/co/1046749.htm
上海翃鼎实业有限公司,http://www.11467.com/shanghai/co/1049898.htm
柏克新能科技股份有限公司上海华彪电子分公司,http://www.11467.com/shanghai/co/1039759.htm
上海龙纳物贸有限公司,http://www.11467.com/shanghai/co/1053689.htm
上海浍南钢贸有限公司,http://www.11467.com/shanghai/co/1046750.htm
山东万事达钢铁贸易有限公司上海分公司,http://www.11467.com/shanghai/co/1046743.htm
上海丽亭商贸有限公司,http://www.11467.com/shanghai/co/1043409.htm
上海高高国际商贸有限公司,http://www.11467.com/shanghai/co/1038273.htm
上海隆坤金属材料有限公司销售部,http://www.11467.com/shanghai/co/1058280.htm
上海奇科工贸有限公司,http://www.11467.com/shanghai/co/1038272.htm
上海谦汇贸易有限公司,http://www.11467.com/shanghai/co/1039762.htm
上海柯旭金属材料有限公司,http://www.11467.com/shanghai/co/1044740.htm
上海谭钢实业有限公司,http://www.11467.com/shanghai/co/1055826.htm
上海妙克化学科技有限公司,http://www.11467.com/shanghai/co/1038263.htm
上海乾品国际贸易有限公司,http://www.11467.com/shanghai/co/1051258.htm
上海实储企业发展在限公司,http://www.11467.com/shanghai/co/1052538.htm
上海润亨润滑油有限公司,http://www.11467.com/shanghai/co/1038266.htm
上海天坛助剂有限公司,http://www.11467.com/shanghai/co/1051851.htm
上海卿翰特种钢有限公司,http://www.11467.com/shanghai/co/1049899.htm
上海市艾肯化工科技有限公司,http://www.11467.com/shanghai/co/1038268.htm
上海安亿纳米材料有限公司,http://www.11467.com/shanghai/co/1056237.htm
上海世顺鑫机械有限公司,http://www.11467.com/shanghai/co/1044751.htm
上海雁阵金属有限公司,http://www.11467.com/shanghai/co/1044756.htm
上海新灿门业有限公司,http://www.11467.com/shanghai/co/1042370.htm
上海永全科技润滑油有限公司,http://www.11467.com/shanghai/co/1051887.htm
特尔高进口轴承(上海)有限公司,http://www.11467.com/shanghai/co/1057887.htm
尊敬的上海钢启钢铁贸易有限公司,http://www.11467.com/shanghai/co/1058992.htm
生隆石油化工有限公司,http://www.11467.com/shanghai/co/1057885.htm
上海钧华经贸有限公司,http://www.11467.com/shanghai/co/1038264.htm
上海向福钢铁贸易有限公司,http://www.11467.com/shanghai/co/1057499.htm
上海仝(TONG)坤国际贸易有限公司,http://www.11467.com/shanghai/co/1044768.htm
上海傲渊实业有限公司,http://www.11467.com/shanghai/co/1044753.htm
上海正霸特种润滑油有限公司,http://www.11467.com/shanghai/co/1045671.htm
上海因特润滑剂有限公司,http://www.11467.com/shanghai/co/1050562.htm
上海中曼石油天然气集团有限公司,http://www.11467.com/shanghai/co/693173.htm
上海英弗润国际贸易有限公司.,http://www.11467.com/shanghai/co/1051888.htm
上海图纳实业有限公司,http://www.11467.com/shanghai/co/1039760.htm
天津大邱庄高盛钢铁有限公司,http://www.11467.com/tianjin/co/200848.htm
天津东昌华泰钢铁商贸有限公司,http://www.11467.com/tianjin/co/200539.htm
弘鑫金融投资担保股份有限公司,http://www.11467.com/hangzhou/co/311831.htm
郑州方源电力设备有限公司,http://www.11467.com/zhengzhou/co/149115.htm
沈阳速驰商贸有限公司,http://www.11467.com/shenyang/co/97518.htm
江苏联亚国际展览有限公司,http://www.11467.com/nanjing/co/115439.htm
成都铭锍清洁服务有限公司,http://www.11467.com/chengdu/co/142803.htm
宁夏鑫亿鸿石化销售有限公司,http://www.11467.com/yinchuan/co/42817.htm
厦门郅鑫投资有限公司,http://www.11467.com/xiamen/co/85931.htm
甘肃兰州万通物资回收有限公司,http://www.11467.com/lanzhou/co/74893.htm
邯郸市东方风机制造有限公司,http://www.11467.com/handan/co/57044.htm
南美映墨盟拓投资咨询（上海）有限公司,http://www.11467.com/shanghai/co/221496.htm
秦皇岛晨华劳务有限公司,http://www.11467.com/qinhuangdao/co/45307.htm
南宁市邦德美家政服务公司,http://www.11467.com/nanning/co/85973.htm
吉林鑫雅枫木业有限公司,http://www.11467.com/jilinshi/co/91616.htm
东莞市梁艺辉胱粘剂有限公司,http://www.11467.com/dongguan/co/488933.htm
盛国展览有限公司,http://www.11467.com/guangzhou/co/456012.htm
烟台东兴期货公司,http://www.11467.com/yantai/co/154828.htm
上海房开投资管理有限公司,http://www.11467.com/shanghai/co/1036468.htm
无锡市昆沃钢铁有限公司,http://www.11467.com/wuxi/co/245047.htm
深圳鸿达镍钴技术有限公司,http://www.11467.com/shenzhen/co/760527.htm
上海博仑润滑油有限公司,http://www.11467.com/shanghai/co/1049130.htm
绍兴利倍石油化工有限公司,http://www.11467.com/shaoxing/co/118623.htm
天津泰福祥钢铁贸易有限公司,http://www.11467.com/tianjin/co/201112.htm
天津鸿泰钢铁销售有限公司,http://www.11467.com/tianjin/co/198949.htm
天津博瑞祥钢铁实业有限公司,http://www.11467.com/tianjin/co/197726.htm
天津镀锌带钢有限公司,http://www.11467.com/tianjin/co/198394.htm
天津市君利昌钢铁销售有限公司,http://www.11467.com/tianjin/co/198389.htm
天津厦翔集团有限公司,http://www.11467.com/tianjin/co/202240.htm
天津市泽弘晟润滑油脂有限责任公司,http://www.11467.com/tianjin/co/198634.htm
亿博瑞(天津)化工有限公司,http://www.11467.com/tianjin/co/198005.htm
天津天利远中国际贸易有限公司,http://www.11467.com/tianjin/co/164885.htm
天津信嘉金属商贸有限公司,http://www.11467.com/tianjin/co/198390.htm
天津鑫盛诚钢铁贸易有限公司,http://www.11467.com/tianjin/co/201592.htm
天津兴远钢铁贸易有限公司,http://www.11467.com/tianjin/co/197721.htm
天津统鑫钢铁贸易有限公司,http://www.11467.com/tianjin/co/197720.htm
重庆日丰商贸商贸有限公司,http://www.11467.com/chongqing/co/208046.htm
重庆吉能吉贸易有限公司,http://www.11467.com/chongqing/co/205691.htm
牡丹江市荣诚阀门有限公司,http://www.11467.com/tianjin/co/304804.htm
天津热建机电工程有限公司,http://www.11467.com/tianjin/co/307671.htm
太原桑普技术有限公司,http://www.11467.com/taiyuan/co/128756.htm
浙江瑞亚能源科技有限公司,http://www.11467.com/hangzhou/co/418314.htm
深圳市安博瑞新材料科技有限公司,http://www.11467.com/shenzhen/co/1138141.htm
小松日石润滑油（厦门）有限公司,http://www.11467.com/xiamen/co/95156.htm
天津唐济金属材料有限公司,http://www.11467.com/tianjin/co/196997.htm
武汉长江华盛高强钢板有限公司,http://www.11467.com/wuhan/co/144207.htm
佛山市鸿跃金属材料有限公司,http://www.11467.com/foshan/co/340223.htm
山西商贸有限公司,http://www.11467.com/datong/co/16132.htm
石家庄永发废品收购有限公司,http://www.11467.com/shijiazhuang/co/161408.htm
润携(上海)贸易有限公司,http://www.11467.com/shanghai/co/1038269.htm
安徽欣雨环卫机械有限公司,http://www.11467.com/anqing/co/35723.htm
鞍山热电新材股份有限公司,http://www.11467.com/anshan/co/11873.htm
肇庆市挪邦实业有限公司鞍山办事处,http://www.11467.com/anshan/co/78583.htm
贵州玖固钢结构有限公司,http://www.11467.com/anshun/co/9177.htm
安阳新瑞源商贸有限公司,http://www.11467.com/anyang/co/36257.htm
安阳市鸿图商贸有限公司,http://www.11467.com/anyang/co/36591.htm
安阳恒立钢铁贸易有限公司,http://www.11467.com/anyang/co/36654.htm
河南龙腾中亿钢铁有限公司,http://www.11467.com/anyang/co/36806.htm
安阳天源商贸有限公司,http://www.11467.com/anyang/co/36655.htm
安阳金凯钢铁贸易有限公司,http://www.11467.com/anyang/co/36418.htm
安阳市希旺金铖源贸易有限公司,http://www.11467.com/anyang/co/36927.htm
安阳率森石油化工有限公司,http://www.11467.com/anyang/co/36317.htm
河南双海钢铁贸易有限公司,http://www.11467.com/anyang/co/36592.htm
安阳艺轩商贸有限公司,http://www.11467.com/anyang/co/36656.htm
安阳昆华商务能源公司,http://www.11467.com/anyang/co/32195.htm
汤阴县世名石化有限公司,http://www.11467.com/anyang/co/36960.htm
安阳市徳智物资有限责任公司,http://www.11467.com/anyang/co/36419.htm
河南安阳鹏诚商贸有限责任公司,http://www.11467.com/anyang/co/36808.htm
河南安阳勇昌化工有限公司(碳黑),http://www.11467.com/anyang/co/36311.htm
安阳市合贵贸易有限责任公司,http://www.11467.com/anyang/co/36807.htm
满城县新瑞化工助剂有限公司,http://www.11467.com/baoding/co/81497.htm
江源色母粒有限公司,http://www.11467.com/baoding/co/80214.htm
宏鑫颜料化工公司,http://www.11467.com/baoding/co/79936.htm
宝鸡泰坦金属有限公司,http://www.11467.com/baoji/co/30918.htm
和静县新科尼龙制品有限责任公司,http://www.11467.com/bayinguoleng/co/9524.htm
河南三明塑母有限责任公司(蚌埠市办事处),http://www.11467.com/bengbu/co/35794.htm
博兴万润商贸有限公司,http://www.11467.com/binzhou/co/35226.htm
山东恒达精密薄板有限公司,http://www.11467.com/binzhou/co/35102.htm
山东博兴捷隆彩涂板有限公司,http://www.11467.com/binzhou/co/35103.htm
山东博兴多源钢铁有限公司,http://www.11467.com/binzhou/co/35637.htm
山东博兴金汇博新材料有限公司,http://www.11467.com/binzhou/co/35291.htm
山东博兴金泰利彩钢板有限公司,http://www.11467.com/binzhou/co/35100.htm
山东博兴县卓越钢板有限公司,http://www.11467.com/binzhou/co/34876.htm
山东铭元通钢铁有限公司,http://www.11467.com/binzhou/co/34878.htm
山东联众钢铁集团彩钢有限公司,http://www.11467.com/binzhou/co/35844.htm
山东瑞鸿吉板业有限公司,http://www.11467.com/binzhou/co/35366.htm
山东万鑫源钢铁有限公司,http://www.11467.com/binzhou/co/34880.htm
齐盛钢铁有限公司,http://www.11467.com/binzhou/co/35848.htm
山东省云光钢铁有限公司,http://www.11467.com/binzhou/co/35444.htm
山东联众钢铁有限公司,http://www.11467.com/binzhou/co/35558.htm
山东润发精密薄板有限公司,http://www.11467.com/binzhou/co/35200.htm
山东兴宇彩钢钢板有限公司,http://www.11467.com/binzhou/co/35766.htm
任丘市华北石油金锐达钻采设备有限公司,http://www.11467.com/cangzhou/co/50701.htm
黄骅港钢材管件销售有限公司,http://www.11467.com/cangzhou/co/58004.htm
南皮县盛兴达金属有限公司,http://www.11467.com/cangzhou/co/58002.htm
河北康达利药业有限公司,http://www.11467.com/cangzhou/co/40699.htm
东大钻井工程技术服务有限公司,http://www.11467.com/cangzhou/co/45643.htm
长春大力纳米技术开发有限公司,http://www.11467.com/changchun/co/96184.htm
辉南宏日新能源有限责任公司,http://www.11467.com/changchun/co/83058.htm
