德国DE润滑油(中国)有限公司,http://www.11467.com/huizhou/co/98345.htm
惠州鑫恒通能源科技有限公司市场部,http://www.11467.com/huizhou/co/81569.htm
葫芦岛金属复合材料有限公司(销售部),http://www.11467.com/huludao/co/45902.htm
德清县圆正粉末有限公司,http://www.11467.com/huzhou/co/66786.htm
长兴县恒昌物资有限公司,http://www.11467.com/huzhou/co/46178.htm
湖州龙祥超细硅粉有限公司,http://www.11467.com/huzhou/co/67030.htm
鹤山能达化工有限公司,http://www.11467.com/jiangmen/co/114173.htm
领先润滑油有限公司,http://www.11467.com/jiangmen/co/102767.htm
广东省江门市江海区嘉诺化工发展有限公司,http://www.11467.com/jiangmen/co/114863.htm
陈氏船舶拆废公司,http://www.11467.com/jiaxing/co/92235.htm
桐乡市普捷机械制造有限公司,http://www.11467.com/jiaxing/co/108825.htm
吉林市超唯经贸有限责任公司,http://www.11467.com/jilinshi/co/91893.htm
济南聚彬钢材有限公司,http://www.11467.com/jinan/co/139345.htm
济南瑞孚润滑材料有限公司,http://www.11467.com/jinan/co/138129.htm
济南昆仑物资有限公司,http://www.11467.com/jinan/co/136191.htm
济南誉达铝业有限公司,http://www.11467.com/jinan/co/136192.htm
济南福耀钢材有限公司,http://www.11467.com/jinan/co/135504.htm
济南天润百特工贸有限公司,http://www.11467.com/jinan/co/137774.htm
山东汇能电力工程有限公司,http://www.11467.com/jinan/co/136190.htm
济南鑫富源实业有限责任公司,http://www.11467.com/jinan/co/134696.htm
济南悍强经贸有限公司,http://www.11467.com/jinan/co/135503.htm
济南三源宝泰钢铁贸易有限公司,http://www.11467.com/jinan/co/136193.htm
山东双祺有限公司,http://www.11467.com/jinan/co/140032.htm
济南亚泓商贸有限公司,http://www.11467.com/jinan/co/135795.htm
济南欧陆博汽车配件有限公司,http://www.11467.com/jinan/co/135812.htm
济宁市新沸点科技有限公司,http://www.11467.com/jinan/co/137775.htm
山东啸创金属材料有限公司,http://www.11467.com/jinan/co/137971.htm
济南亿佳化工有限公司,http://www.11467.com/jinan/co/137356.htm
济南格瑞能源技术有限公司,http://www.11467.com/jinan/co/113564.htm
山东滨泰再生资源回收公司,http://www.11467.com/jinan/co/113551.htm
山东三江贸易有限公司,http://www.11467.com/jinan/co/113775.htm
山东日新石化有限公司,http://www.11467.com/jinan/co/137357.htm
济南英冠润滑油有限公司,http://www.11467.com/jinan/co/134153.htm
高平市恒基阻燃材料有限责任公司,http://www.11467.com/jincheng/co/22151.htm
湖北荆门国汇科技有限公司,http://www.11467.com/jingmen/co/16688.htm
湖北洪湖市百丽化工有限公司,http://www.11467.com/jingzhou/co/30359.htm
金华康力博润滑油有限公司（销售部）,http://www.11467.com/jinhua/co/83761.htm
金华佳利安塑料新材料有限公司广东办事处,http://www.11467.com/jinhua/co/122299.htm
金华安快达贸易有限公司,http://www.11467.com/jinhua/co/128134.htm
济宁市顺源工矿设备有限公司钢材分公司,http://www.11467.com/jining/co/73796.htm
济宁佳润石化有限公司,http://www.11467.com/jining/co/72033.htm
山东中贸商务公司钢材分公司,http://www.11467.com/jining/co/72634.htm
嘉祥县恒信钢管有限公司,http://www.11467.com/jining/co/73797.htm
山东旺旺炭业有限公司,http://www.11467.com/jining/co/56113.htm
山东运河煤炭贸易公司,http://www.11467.com/jining/co/56058.htm
源根石化山东有限公司,http://www.11467.com/jining/co/73231.htm
山东济宁佳润石化有限公司,http://www.11467.com/jining/co/72030.htm
山东梁山昆仑润滑油科技有限公司,http://www.11467.com/jining/co/72733.htm
济宁山推石化小松润滑油销售有限公司,http://www.11467.com/jining/co/74144.htm
开封市德旺科技有限公司,http://www.11467.com/kaifeng/co/19405.htm
万鑫润滑油有限公司,http://www.11467.com/kaifeng/co/19958.htm
喀什冀衡发彩钢钢结构有限公司,http://www.11467.com/kashi/co/9162.htm
昆明蓓思特精化科技发展公司,http://www.11467.com/kunming/co/127222.htm
昆明雨柠电子工程有限公司,http://www.11467.com/kunming/co/87236.htm
昆明云涛贸易有限公司,http://www.11467.com/kunming/co/127764.htm
云南大众石化有限公司昆仑工业润滑油贵州销售处,http://www.11467.com/kunming/co/127600.htm
瑞玺集团有限公司,http://www.11467.com/kunming/co/121574.htm
昆明市通宝科技有限公司,http://www.11467.com/kunming/co/105832.htm
云南克强投资有限公司,http://www.11467.com/kunming/co/127565.htm
云南博晨龙生物技术开发有限公司,http://www.11467.com/kunming/co/119205.htm
云南卯阳贸易有限公司,http://www.11467.com/kunming/co/127657.htm
云南省盈江县永福实业有限责任公司,http://www.11467.com/kunming/co/121653.htm
云南省盈江县永福实业有限责任公司,http://www.11467.com/kunming/co/121652.htm
中诚公路桥梁工程公司,http://www.11467.com/kunming/co/121666.htm
云南源霖能源开发有限公司,http://www.11467.com/kunming/co/121640.htm
莱芜宏力物资有限公司,http://www.11467.com/laiwu/co/14669.htm
莱芜市丰顺再生资源有限公司,http://www.11467.com/laiwu/co/14124.htm
莱芜市金铁城板业有限公司,http://www.11467.com/laiwu/co/14683.htm
莱芜市鑫万达有限责任公司,http://www.11467.com/laiwu/co/14554.htm
山东省莱芜市鑫昌工贸有限公司,http://www.11467.com/laiwu/co/14608.htm
霸州市志兴金属制品有限公司,http://www.11467.com/langfang/co/46161.htm
霸州市东升金属制品有限公司,http://www.11467.com/langfang/co/48049.htm
廊坊鑫昊板材商贸公司,http://www.11467.com/langfang/co/48392.htm
霸州福玉金属制品有限公司,http://www.11467.com/langfang/co/46160.htm
廊坊通恒保温材料有限公司,http://www.11467.com/langfang/co/46572.htm
河北华美神州保温有限公司,http://www.11467.com/langfang/co/46165.htm
霸州市圣百川金属制品有限公司,http://www.11467.com/langfang/co/46901.htm
文安县华跃塑料工贸有限公司,http://www.11467.com/langfang/co/46680.htm
廊坊誉达钢带有限公司,http://www.11467.com/langfang/co/46158.htm
三皇工贸有限公司,http://www.11467.com/langfang/co/48777.htm
兰州鲁克石油化工有限公司,http://www.11467.com/lanzhou/co/80274.htm
甘肃中钢联物资有限公司,http://www.11467.com/lanzhou/co/80106.htm
兰州汇腾润滑油公司,http://www.11467.com/lanzhou/co/80177.htm
兰州运通铁路科技有限责任公司,http://www.11467.com/lanzhou/co/47720.htm
连云港新电光明有限公司,http://www.11467.com/lianyungang/co/43828.htm
连云港盈旭碳素有限公司,http://www.11467.com/lianyungang/co/40158.htm
山东聊城金聚盈金属材料有限公司,http://www.11467.com/liaocheng/co/56231.htm
山东聊城巨火特钢物资有限公司,http://www.11467.com/liaocheng/co/50125.htm
山东众冠交通有限公司,http://www.11467.com/liaocheng/co/50264.htm
天津永明化工有限公司聊城办事处,http://www.11467.com/liaocheng/co/38865.htm
聊城大业兴金属材料有限公司,http://www.11467.com/liaocheng/co/50652.htm
山东澳沣金属材料有限公司,http://www.11467.com/liaocheng/co/49609.htm
山东百斯特板业有限公司,http://www.11467.com/liaocheng/co/50530.htm
山东聊城市冠县新宇制钢有限公司,http://www.11467.com/liaocheng/co/50124.htm
莘县祥和塑业有限公司,http://www.11467.com/liaocheng/co/39894.htm
山东金冠精密薄板有限公司,http://www.11467.com/liaocheng/co/50265.htm
中国寰球网络有限公司,http://www.11467.com/liaocheng/co/38828.htm
山东宏泰金属材料有限公司,http://www.11467.com/liaocheng/co/50651.htm
临清市东辰化工有限公司,http://www.11467.com/liaocheng/co/50463.htm
山东冠县林衫板业有限公司,http://www.11467.com/liaocheng/co/49964.htm
山东优盛金属制品有限公司,http://www.11467.com/liaocheng/co/49605.htm
山东齐鑫能源科技发展有限公司,http://www.11467.com/liaocheng/co/41578.htm
聊城市恒达管材有限公司,http://www.11467.com/liaocheng/co/38832.htm
聊城市创鑫管业有限公司,http://www.11467.com/liaocheng/co/50653.htm
山东亿源金属有限公司,http://www.11467.com/liaocheng/co/50872.htm
山东省茌平国强商贸有限公司,http://www.11467.com/liaocheng/co/50925.htm
山东聊城华晨丰达钢铁贸易有限公司,http://www.11467.com/liaocheng/co/50126.htm
山东鑫隆商贸有限公司,http://www.11467.com/liaocheng/co/50924.htm
山东远洋诺尔板材销售有限公司,http://www.11467.com/liaocheng/co/50267.htm
聊城市鼎泰金属材料有限公司,http://www.11467.com/liaocheng/co/49608.htm
临沂旺利达彩涂有限公司,http://www.11467.com/linyi/co/95718.htm
临沂星辰化工有限公司,http://www.11467.com/linyi/co/95329.htm
临沂佳帅木业有限公司,http://www.11467.com/linyi/co/95251.htm
临沂思迈尔木业有限公司,http://www.11467.com/linyi/co/95506.htm
临沂市金华油脂有限责任公司,http://www.11467.com/linyi/co/9819.htm
万翔塑料色母有限公司,http://www.11467.com/linyi/co/94700.htm
兴达化工公司,http://www.11467.com/linyi/co/95330.htm
临沂烨鑫彩钢有限公司,http://www.11467.com/linyi/co/95504.htm
六安市意德福钻井有限公司,http://www.11467.com/liuan/co/23138.htm
六盘水新陆油品有限公司,http://www.11467.com/liupanshui/co/11089.htm
龙岩佰川润滑防锈技术有限公司,http://www.11467.com/longyan/co/21201.htm
河南博远进出口贸易有限公司,http://www.11467.com/luohe/co/20461.htm
伊川县旭兴原钢有限公司,http://www.11467.com/luoyang/co/59902.htm
洛阳市一诺化工有限公司,http://www.11467.com/luoyang/co/60053.htm
顺方股份有限公司,http://www.11467.com/luoyang/co/52916.htm
洛阳天强冶金有限公司,http://www.11467.com/luoyang/co/60061.htm
洛阳天霞实业有限公司托轮油轮带油大齿圈油,http://www.11467.com/luoyang/co/60060.htm
天霞化工有限公司,http://www.11467.com/luoyang/co/60256.htm
洛阳江隆商贸有限公司,http://www.11467.com/luoyang/co/59960.htm
洛阳九霄菱镁有限公司,http://www.11467.com/luoyang/co/59749.htm
山西立信化工有限公司(炭黑厂),http://www.11467.com/lvliang/co/29209.htm
山西国润天能科技有限公司,http://www.11467.com/lvliang/co/11048.htm
江西俊美实业有限公司,http://www.11467.com/nanchang/co/108090.htm
博汉化工科技有限公司,http://www.11467.com/nanjing/co/154942.htm
南京莱钻钢铁有限公司,http://www.11467.com/nanjing/co/156288.htm
美孚润滑油南京分公司,http://www.11467.com/nanjing/co/157192.htm
中国企业高速公路国际认证公司,http://www.11467.com/nanjing/co/114106.htm
南京贸桥化工有限公司,http://www.11467.com/nanjing/co/154063.htm
南京天奇工贸有限公司,http://www.11467.com/nanjing/co/157191.htm
南京旭远油罐清洗有限公司,http://www.11467.com/nanjing/co/157000.htm
南京胜昔油品有限公司,http://www.11467.com/nanjing/co/156779.htm
南京千峰科技有限公司(化工部),http://www.11467.com/nanjing/co/154071.htm
南京法斯特工贸有限公司,http://www.11467.com/nanjing/co/114101.htm
润滑油事业部(南京维洁特科技有限公司),http://www.11467.com/nanjing/co/155907.htm
无锡市赣宝物资有限公司,http://www.11467.com/nanjing/co/114346.htm
南宁市清腾新能源开发有限责任公司,http://www.11467.com/nanning/co/70745.htm
南宁楚辉活动板房有限公司,http://www.11467.com/nanning/co/86803.htm
广西广拓公司,http://www.11467.com/nanning/co/78771.htm
南宁市万腾达汽配有限公司,http://www.11467.com/nanning/co/86575.htm
汇发船舶配套有限公司,http://www.11467.com/nantong/co/138119.htm
南通润翔能源科技有限公司,http://www.11467.com/nantong/co/101451.htm
南通金康泰化学有限公司,http://www.11467.com/nantong/co/137227.htm
锐克润滑化学(中国)有限公司,http://www.11467.com/nantong/co/138277.htm
启东市恒怡电源有限公司,http://www.11467.com/nantong/co/99655.htm
南通乾坤油品有限公司,http://www.11467.com/nantong/co/133663.htm
通成贸易有限公司(外贸出口）,http://www.11467.com/nantong/co/113274.htm
西峡县华茂工贸有限公司,http://www.11467.com/nanyang/co/38807.htm
四川齐丰管业有限公司,http://www.11467.com/neijiang/co/3440.htm
慈溪金途化工有限公司,http://www.11467.com/ningbo/co/198052.htm
东莞市名品塑胶有限公司(浙江办),http://www.11467.com/ningbo/co/196334.htm
宁波国华国际货运有限公司,http://www.11467.com/ningbo/co/142904.htm
宁波市鄞州冉润贸易有限公司,http://www.11467.com/ningbo/co/198050.htm
余姚九鼎化工材料有限公司,http://www.11467.com/ningbo/co/193019.htm
宁波典弘润滑油科技有限公司苏州办事处,http://www.11467.com/ningbo/co/193980.htm
宁波东远钢铁有限公司,http://www.11467.com/ningbo/co/197914.htm
凯辰化学贸易有限公司,http://www.11467.com/ningbo/co/193025.htm
慈溪市双林润滑油脂有限公司,http://www.11467.com/ningbo/co/196337.htm
宁波模德国光石化有限公司,http://www.11467.com/ningbo/co/194741.htm
宁波全兴不锈钢限公司,http://www.11467.com/ningbo/co/199219.htm
宁波江东鸿建化工有限公司,http://www.11467.com/ningbo/co/3930.htm
宁波悠扬活动板房有限公司,http://www.11467.com/ningbo/co/194458.htm
余姚儒派新材料有限公司,http://www.11467.com/ningbo/co/193967.htm
浙江兆隆合金股份有限公司,http://www.11467.com/ningbo/co/194457.htm
余姚市康巴斯化工科技有限公司,http://www.11467.com/ningbo/co/195376.htm
福建宏利钢管有限公司,http://www.11467.com/ningde/co/25734.htm
盘锦鸿塑商贸有限公司,http://www.11467.com/panjin/co/26589.htm
河南省舞钢和泰钢铁贸易有限公司,http://www.11467.com/pingdingshan/co/23763.htm
舞钢市盛辉商贸有限公司,http://www.11467.com/pingdingshan/co/23785.htm
舞钢市远航工贸有限责任公司,http://www.11467.com/pingdingshan/co/23839.htm
舞钢市银联物资有限责任公司,http://www.11467.com/pingdingshan/co/23764.htm
河南舞钢昌申钢铁公司,http://www.11467.com/pingdingshan/co/23819.htm
舞钢市盈瑞物质有限公司,http://www.11467.com/pingdingshan/co/23723.htm
舞钢市长裕隆工贸有限公司,http://www.11467.com/pingdingshan/co/23635.htm
舞钢市宗伟公司,http://www.11467.com/pingdingshan/co/23720.htm
广东佛山雅达利装饰材料有限公司莆田分公司,http://www.11467.com/putian/co/39523.htm
福建莆田金嗨通信科技莆田有限公司,http://www.11467.com/putian/co/34441.htm
福建莆田金嗨通信科技莆田有限公司,http://www.11467.com/putian/co/34442.htm
濮阳市弘成石化有限公司,http://www.11467.com/puyang/co/24184.htm
濮阳市鑫业特种润滑油脂有限公司,http://www.11467.com/puyang/co/24255.htm
濮阳市太和测试技术有限公司,http://www.11467.com/puyang/co/16065.htm
河南省濮阳市龙翔石化润滑脂有限公司,http://www.11467.com/puyang/co/24213.htm
濮阳长虹润滑脂有限公司,http://www.11467.com/puyang/co/24119.htm
贵州卫星炉具制造有限公司,http://www.11467.com/qiandongnan/co/12550.htm
独山独峰锑业有限公司,http://www.11467.com/qiannan/co/10928.htm
崇裕科技有限公司青岛分公司,http://www.11467.com/qingdao/co/152550.htm
青岛市雅信诚伟业科技有限公司,http://www.11467.com/qingdao/co/69336.htm
金边信托集团青岛时讯投资咨询有限公司,http://www.11467.com/qingdao/co/123967.htm
青岛(上海)鼎鹏物资有限公司,http://www.11467.com/qingdao/co/153569.htm
青岛荣达鼎盛金属材料有限公司,http://www.11467.com/qingdao/co/156366.htm
青岛瑞丰钢结构彩钢板房公司,http://www.11467.com/qingdao/co/154103.htm
天津聚鑫伟业青岛分公司,http://www.11467.com/qingdao/co/154278.htm
青岛百利豪经贸有限公司,http://www.11467.com/qingdao/co/154707.htm
青岛天源贸易有限公司,http://www.11467.com/qingdao/co/123887.htm
青岛鑫泉环保有限公司,http://www.11467.com/qingdao/co/156367.htm
青岛君伟俊厚商贸有限公司,http://www.11467.com/qingdao/co/154277.htm
青岛森汇林业有限公司,http://www.11467.com/qingdao/co/123997.htm
青岛新天德商贸有限公司,http://www.11467.com/qingdao/co/154708.htm
青岛有盈恒旭工贸有限公司,http://www.11467.com/qingdao/co/153190.htm
青岛嘉德利石油化学有限公司,http://www.11467.com/qingdao/co/154279.htm
潍坊大通钢铁贸易有限公司驻胶州办事处,http://www.11467.com/qingdao/co/156772.htm
鑫建钢结构工程有限公司,http://www.11467.com/qingdao/co/156774.htm
青岛贤哲钢铁有限公司,http://www.11467.com/qingdao/co/155616.htm
青岛东枫煊润滑油有限公司,http://www.11467.com/qingdao/co/153191.htm
青岛金宏骏实业有限公司,http://www.11467.com/qingdao/co/154517.htm
青岛锦旭贸易有限公司,http://www.11467.com/qingdao/co/152551.htm
青岛申鹏工贸有限公司,http://www.11467.com/qingdao/co/152552.htm
三通世纪贸易公司,http://www.11467.com/qingdao/co/152937.htm
青岛欧尔石墨有限公司,http://www.11467.com/qingdao/co/154518.htm
广东省清远市阳山县嘉兴钙粉有限公司,http://www.11467.com/qingyuan/co/28792.htm
秦皇岛市森富瑞特种润滑油有限公司,http://www.11467.com/qinhuangdao/co/45761.htm
秦皇岛锌钛恒金属材料有限公司,http://www.11467.com/qinhuangdao/co/45777.htm
晋江市元盛塑料制品有限公司,http://www.11467.com/quanzhou/co/130130.htm
泉州特酷溶剂回收机有限公司,http://www.11467.com/quanzhou/co/131349.htm
福新鞋材贸易有限公司,http://www.11467.com/quanzhou/co/130504.htm
宝州化工(福建)有限公司,http://www.11467.com/quanzhou/co/130503.htm
泉州中仑润滑油销售有限公司,http://www.11467.com/quanzhou/co/132883.htm
泉州市德威高质压铸材料有限公司,http://www.11467.com/quanzhou/co/132996.htm
福建省三农碳酸钙有限公司,http://www.11467.com/sanming/co/36214.htm
商丘市精诚助剂有限公司,http://www.11467.com/shangqiu/co/20899.htm
新通达热镀锌钢带管有限公司,http://www.11467.com/shantou/co/151383.htm
绍兴县日升昌新能源有限公司,http://www.11467.com/shaoxing/co/88415.htm
浙江虞乐集团绍兴宇乐化工有限公司,http://www.11467.com/shaoxing/co/118621.htm
天龙洋电工材料有限公司,http://www.11467.com/shaoyang/co/26938.htm
沈阳市特种油品有限公司,http://www.11467.com/shenyang/co/97520.htm
沈阳天顺润滑油有限公司,http://www.11467.com/shenyang/co/97517.htm
浦项(辽宁)汽车配件制造有限公司,http://www.11467.com/shenyang/co/97183.htm
辽宁沈阳美孚润滑油代理经销商(沈阳美孚润滑油销售总公司),http://www.11467.com/shenyang/co/98411.htm
辽宁能源投资（集团）有限责任公司,http://www.11467.com/shenyang/co/80986.htm
辽宁沈阳美孚润滑油经销商(沈阳美孚润滑油销售总公司),http://www.11467.com/shenyang/co/98288.htm
辽宁沈阳美孚润滑油销售总公司(美孚润滑油经销商),http://www.11467.com/shenyang/co/98413.htm
沈阳壳牌润滑油有限公司(壳牌润滑油经销商),http://www.11467.com/shenyang/co/98412.htm
沈阳废油回收公司,http://www.11467.com/shenyang/co/97290.htm
沈阳太和金傲商贸有限公司,http://www.11467.com/shenyang/co/97181.htm
沈阳新抚化工有限公司,http://www.11467.com/shenyang/co/98150.htm
沈阳圣博钢筋焊网有限公司,http://www.11467.com/shenyang/co/97964.htm
昆西空压机油空压机配件销售公司,http://www.11467.com/shenyang/co/98993.htm
天津豪天钢管有限公司沈阳分公司,http://www.11467.com/shenyang/co/97182.htm
沈阳奥尔润滑油有限公司,http://www.11467.com/shenyang/co/98913.htm
祥逸特种发丝有限公司,http://www.11467.com/shenyang/co/80978.htm
【美孚润滑油】深圳市鑫瑞达特润滑油贸易有限公司,http://www.11467.com/shenzhen/co/785213.htm
澳拿石油(香港)有限公司深圳市分公司,http://www.11467.com/shenzhen/co/797897.htm
北斗星太阳能硅片有限公司,http://www.11467.com/shenzhen/co/721387.htm
法科达高分子材料(深圳)有限公司,http://www.11467.com/shenzhen/co/353706.htm
福祥科技(香港)有限公司深圳润滑油分公司,http://www.11467.com/shenzhen/co/797890.htm
东莞顶星电子有限公司,http://www.11467.com/shenzhen/co/799006.htm
东彩塑胶颜料(深圳)有限公司业,http://www.11467.com/shenzhen/co/768148.htm
广东海利润滑油有限公司销售部,http://www.11467.com/shenzhen/co/720469.htm
汉斯石油化工有限公司,http://www.11467.com/shenzhen/co/795749.htm
懋源行润滑油(深圳)有限公司苏州分公司,http://www.11467.com/shenzhen/co/797893.htm
江西上高明辉能源有限公司,http://www.11467.com/shenzhen/co/720804.htm
捷孚石化有限公司,http://www.11467.com/shenzhen/co/721258.htm
深圳普益电池科技有限公司,http://www.11467.com/shenzhen/co/772489.htm
和奇实业有限公司,http://www.11467.com/shenzhen/co/720473.htm
明栩集团(深圳)分公司,http://www.11467.com/shenzhen/co/780016.htm
上海企跃化工(深圳分公司),http://www.11467.com/shenzhen/co/790958.htm
湖南省三才光电信息材料有限公司,http://www.11467.com/shenzhen/co/720437.htm
上海华兴利华金属材料有限公司驻深圳直销,http://www.11467.com/shenzhen/co/789709.htm
深圳岗松技术开发有限公司(龙华分部),http://www.11467.com/shenzhen/co/110835.htm
深圳金确科技有限责任公司,http://www.11467.com/shenzhen/co/430105.htm
深圳长江润滑油包装桶有限公司,http://www.11467.com/shenzhen/co/793423.htm
深圳嘉宏威塑胶电子有限公司,http://www.11467.com/shenzhen/co/720180.htm
深圳东电设备有限公司,http://www.11467.com/shenzhen/co/720938.htm
深圳尚盈科技有限公司,http://www.11467.com/shenzhen/co/721064.htm
深圳神光不锈钢有限公司,http://www.11467.com/shenzhen/co/804307.htm
深圳金霸行贸易有限公司,http://www.11467.com/shenzhen/co/773418.htm
深圳爱德龙润滑油有限公司,http://www.11467.com/shenzhen/co/762958.htm
深圳市百洋化工贸易有限公司,http://www.11467.com/shenzhen/co/762948.htm
深圳市柏顿润滑油商贸有限公司,http://www.11467.com/shenzhen/co/762955.htm
湖南省三才光电信息材料有限公司,http://www.11467.com/shenzhen/co/720438.htm
乾泰擎天科技有限公司,http://www.11467.com/shenzhen/co/768144.htm
深圳蓝德润滑油科技有限公司(切削液),http://www.11467.com/shenzhen/co/790996.htm
深圳力函科技有限公司,http://www.11467.com/shenzhen/co/721160.htm
金鼎诚科技有限公司,http://www.11467.com/shenzhen/co/720972.htm
华通五金冲压材料有限公司,http://www.11467.com/shenzhen/co/789712.htm
深圳华莱实业公司,http://www.11467.com/shenzhen/co/795747.htm
深圳华泰润滑油有限公司,http://www.11467.com/shenzhen/co/785220.htm
深圳市宝利达润滑油有限公司,http://www.11467.com/shenzhen/co/720221.htm
深圳市德发科技公司,http://www.11467.com/shenzhen/co/773359.htm
深圳市奥德润滑油有限公司,http://www.11467.com/shenzhen/co/777900.htm
深圳市奥德商贸有限公司,http://www.11467.com/shenzhen/co/773414.htm
深圳市安达路化工有限公司,http://www.11467.com/shenzhen/co/793433.htm
深圳市海洋蒸汽服务有限公司,http://www.11467.com/shenzhen/co/721373.htm
深圳市弘天联合冷冻油有限公司,http://www.11467.com/shenzhen/co/799915.htm
深圳市定龙化工有限公司,http://www.11467.com/shenzhen/co/768145.htm
深圳市电力通讯技术有限公司,http://www.11467.com/shenzhen/co/720333.htm
深圳市汇兴金属材料有限公司,http://www.11467.com/shenzhen/co/765854.htm
深圳市富村润滑油科技有限公司,http://www.11467.com/shenzhen/co/777906.htm
深圳高顺昌钢板有限公司,http://www.11467.com/shenzhen/co/789711.htm
深圳市国润华贸易有限公司,http://www.11467.com/shenzhen/co/777911.htm
深圳市华永信科技有限公司,http://www.11467.com/shenzhen/co/795753.htm
深圳市华永信润滑油化工有限公司,http://www.11467.com/shenzhen/co/795746.htm
深圳市蓝德润滑科技有限公司,http://www.11467.com/shenzhen/co/768242.htm
深圳市凯泰威商贸有限公司,http://www.11467.com/shenzhen/co/790988.htm
深圳市华易通润滑油有限公司,http://www.11467.com/shenzhen/co/806354.htm
深圳市康泰世纪科技有限公司,http://www.11467.com/shenzhen/co/775988.htm
深圳市森华孚润滑科技有限公司,http://www.11467.com/shenzhen/co/773411.htm
深圳市思敏油品贸易有限公司,http://www.11467.com/shenzhen/co/80092.htm
深圳市泰力松科技有限公司（工程部）,http://www.11467.com/shenzhen/co/720915.htm
深圳市万盛兴科技有限公司,http://www.11467.com/shenzhen/co/454600.htm
深圳市洛克特种润滑油有限公司,http://www.11467.com/shenzhen/co/801753.htm
深圳市文汇嘉科技有限公司(业务部）,http://www.11467.com/shenzhen/co/720265.htm
深圳市山井润滑脂有限公司,http://www.11467.com/shenzhen/co/773421.htm
深圳市深鸿孚润滑油有限公司,http://www.11467.com/shenzhen/co/773412.htm
深圳市深化润滑油有限公司,http://www.11467.com/shenzhen/co/762947.htm
深圳市金润盛润滑油有限公司,http://www.11467.com/shenzhen/co/768240.htm
深圳市华盛行润滑油有限公司,http://www.11467.com/shenzhen/co/720742.htm
深圳市鑫聚润滑油有限公司,http://www.11467.com/shenzhen/co/721223.htm
