北京华夏本草中药科技有限公司,http://www.11467.com/beijing/co/25894.htm
江西金思康药业有限公司,http://www.11467.com/yichun/co/32299.htm
广州市唐顿商贸有限公司,http://www.11467.com/guangzhou/co/496081.htm
山东宏济堂制药集团济南阿胶制品有限公司,http://www.11467.com/jinan/co/161866.htm
北京泰德制药股份有限公司,http://www.11467.com/qiye/29584810.htm
合肥立方制药股份有限公司,http://www.11467.com/qiye/29671233.htm
黑龙江乌苏里江制药有限公司,http://www.11467.com/haerbin/co/60534.htm
河南省济源市济世药业有限公司,http://www.11467.com/jiaozuo/co/11524.htm
浙江中法制药有限公司,http://www.11467.com/jiaxing/co/82772.htm
甘肃奇正实业集团有限公司,http://www.11467.com/lanzhou/co/65869.htm
陇南辉腾昌忠药材有限责任公司,http://www.11467.com/longnan/co/8223.htm
洛阳顺势药业有限公司,http://www.11467.com/luoyang/co/17834.htm
南通中港化学品有限公司,http://www.11467.com/nantong/co/111161.htm
浙江汇力胶囊有限公司,http://www.11467.com/shaoxing/co/119068.htm
深圳万和制药有限公司,http://www.11467.com/shenzhen/co/259774.htm
石家庄四药有限公司,http://www.11467.com/shijiazhuang/co/83199.htm
四平市高斯达纳米材料设备有限公司,http://www.11467.com/siping/co/25897.htm
苏州二叶制药有限公司,http://www.11467.com/suzhou/co/218721.htm
湖北省医药工业研究院有限公司,http://www.11467.com/wuhan/co/12717.htm
无锡凯夫制药有限公司,http://www.11467.com/wuxi/co/54784.htm
陕西筋骨堂药业有限公司,http://www.11467.com/xian/co/58691.htm
咸阳萃纳贝每生物工程有限公司,http://www.11467.com/xianyang/co/21196.htm
信阳市平桥区运鸿药材购销有限公司,http://www.11467.com/xinyang/co/20347.htm
烟台鲁银药业有限公司,http://www.11467.com/yantai/co/7015.htm
宜昌人福药业有限责任公司,http://www.11467.com/yichang/co/160.htm
宜昌市夜明珠天然植物制品有限责任公司,http://www.11467.com/yichang/co/37773.htm
湖南希尔天然药业有限公司,http://www.11467.com/yongzhou/co/15725.htm
遂溪县胜华生物原料有限公司,http://www.11467.com/zhanjiang/co/45220.htm
珠海联邦制药股份有限公司,http://www.11467.com/zhuhai/co/36424.htm
河南利华制药有限公司,http://www.11467.com/anyang/co/5594.htm
吉林省抚松制药股份有限公司,http://www.11467.com/baishan/co/11113.htm
宝鸡向源中药饮片有限责任公司,http://www.11467.com/baoji/co/4101.htm
安徽福康药业有限责任公司,http://www.11467.com/bengbu/co/318.htm
诚信药业有限公司,http://www.11467.com/bozhou/co/10264.htm
安徽广印堂制药有限公司,http://www.11467.com/bozhou/co/8581.htm
长春海外制药集团有限公司,http://www.11467.com/changchun/co/76754.htm
昌吉市丽康源科工贸有限责任公司,http://www.11467.com/changji/co/9667.htm
黑龙江省济仁药业有限公司,http://www.11467.com/chaoyang/co/26481.htm
四川禾正制药有限责任公司,http://www.11467.com/chengdu/co/93417.htm
宁波杰顺生物科技有限公司市场部,http://www.11467.com/enshi/co/12297.htm
湖北圣峰药业有限公司,http://www.11467.com/enshi/co/12961.htm
福州力为康医药技术有限公司,http://www.11467.com/fuzhou/co/139598.htm
沈阳恩世制药有限公司,http://www.11467.com/anyang/co/27251.htm
安徽城市药业有限责任公司,http://www.11467.com/bengbu/co/212.htm
安徽环球药业股份有限公司,http://www.11467.com/bengbu/co/3946.htm
安徽德馨香精香料有限公司,http://www.11467.com/bozhou/co/14463.htm
安徽德昌药业饮片有限公司,http://www.11467.com/bozhou/co/8759.htm
湖南今汉生物医药技术有限公司,http://www.11467.com/changsha/co/95645.htm
湖南春光九汇现代中药有限公司,http://www.11467.com/changsha/co/101485.htm
成都美迪康生物工程有限公司,http://www.11467.com/chengdu/co/115361.htm
国药集团川抗制药有限公司,http://www.11467.com/chengdu/co/93497.htm
四川沱牌药业有限责任公司,http://www.11467.com/chengdu/co/92749.htm
四川省中药饮片有限责任公司,http://www.11467.com/chengdu/co/10968.htm
大连康博软件有限公司,http://www.11467.com/dalian/co/4618.htm
大连泛谷制药有限公司,http://www.11467.com/dalian/co/73904.htm
东莞市美泰生物科技有限公司,http://www.11467.com/dongguan/co/494991.htm
东营海福食品技术有限公司,http://www.11467.com/dongying/co/27224.htm
阜阳市晨曦制药有限公司,http://www.11467.com/fuyang/co/25455.htm
贵州君之堂制药有限公司,http://www.11467.com/guiyang/co/35388.htm
河北金芳制药有限公司,http://www.11467.com/handan/co/68467.htm
回音必集团抚州制药有限公司,http://www.11467.com/hangzhou/co/234228.htm
浙江弘盛药业有限公司,http://www.11467.com/hangzhou/co/97325.htm
湖南三九唯康药业有限公司,http://www.11467.com/hengyang/co/24985.htm
怀化市文理生物资源开发有限公司,http://www.11467.com/huaihua/co/12662.htm
多多药业有限公司,http://www.11467.com/jiamusi/co/33366.htm
山西德元堂药业有限公司,http://www.11467.com/jinzhong/co/22113.htm
江苏恒瑞医药股份有限公司,http://www.11467.com/lianyungang/co/25864.htm
山西康欣药业有限公司,http://www.11467.com/lvliang/co/1354.htm
南昌弘益药业有限公司,http://www.11467.com/nanchang/co/196.htm
南昌济顺制药有限公司,http://www.11467.com/nanchang/co/35550.htm
河北九派制药有限公司,http://www.11467.com/shijiazhuang/co/94171.htm
石家庄利德尔动物药业有限公司,http://www.11467.com/shijiazhuang/co/104532.htm
山西诺成制药有限公司,http://www.11467.com/shuozhou/co/8762.htm
扬子江药业集团江苏海慈生物药业有限公司,http://www.11467.com/taizhoushi/co/34228.htm
铜陵凤丹种植科技开发有限责任公司,http://www.11467.com/tongling/co/13680.htm
山东华辰生物科技有限公司,http://www.11467.com/weifang/co/86656.htm
武汉联合药业有限责任公司,http://www.11467.com/wuhan/co/68036.htm
烟台通元共和生物科技发展有限公司,http://www.11467.com/yantai/co/155620.htm
北京森昌泰和科技有限责任公司,http://www.11467.com/beijing/co/117488.htm
北京天元康医药有限公司,http://www.11467.com/beijing/co/672928.htm
山东禹王制药有限公司,http://www.11467.com/dezhou/co/65365.htm
赛诺菲（北京）制药有限公司,http://www.11467.com/qiye/29381839.htm
北京红林制药有限公司,http://www.11467.com/qiye/29601611.htm
上海华源制药安徽广生药业有限公司,http://www.11467.com/qiye/29672645.htm
北京双吉制药有限公司,http://www.11467.com/qiye/29822509.htm
安徽美欣制药有限公司,http://www.11467.com/qiye/29823077.htm
北京京丰制药集团有限公司,http://www.11467.com/qiye/29978809.htm
昆明奥深生物科技有限公司,http://www.11467.com/kunming/co/98986.htm
临汾宝珠制药有限公司,http://www.11467.com/linfen/co/9937.htm
山东启发药业有限公司,http://www.11467.com/linyi/co/58206.htm
四川一辰药业有限公司,http://www.11467.com/meishan/co/18041.htm
邵武市美菰林卫生用品有限公司,http://www.11467.com/nanping/co/19191.htm
南通天时药业有限公司,http://www.11467.com/nantong/co/113580.htm
宁波智涌塑胶有限公司,http://www.11467.com/ningbo/co/82283.htm
澳诺(中国)制药有限公司,http://www.11467.com/qingdao/co/72308.htm
广东仙乐制药有限公司,http://www.11467.com/shantou/co/122302.htm
沈阳华夷生发健发科技开发有限公司,http://www.11467.com/shenyang/co/70503.htm
三台县双飞麦冬商贸有限责任公司,http://www.11467.com/shenzhen/co/253795.htm
深圳三九中医药投资发展有限公司,http://www.11467.com/shenzhen/co/2943.htm
深圳康林生物科技有限公司,http://www.11467.com/shenzhen/co/47879.htm
深圳万泽医药连锁有限公司,http://www.11467.com/shenzhen/co/263050.htm
河北利华药业有限公司,http://www.11467.com/shijiazhuang/co/23877.htm
河北金汉方生物科技开发有限公司,http://www.11467.com/shijiazhuang/co/83370.htm
石家庄正大鸿福牧业有限公司,http://www.11467.com/shijiazhuang/co/72015.htm
泰兴市瑞畅输送带制造有限公司-业务部,http://www.11467.com/taizhoushi/co/29920.htm
泰州仁济中药饮片有限公司,http://www.11467.com/taizhoushi/co/25899.htm
唐山市参花制药集团有限公司,http://www.11467.com/tangshan/co/47959.htm
唐山康神药业有限公司,http://www.11467.com/tangshan/co/63395.htm
陕西丰禾制药有限公司,http://www.11467.com/tongchuan/co/4054.htm
吉林天强制药有限公司,http://www.11467.com/tonghua/co/33029.htm
山东潍坊制药厂有限公司,http://www.11467.com/weifang/co/5147.htm
武汉枫叶红生物科技有限公司,http://www.11467.com/wuhan/co/20696.htm
湖北荷普药业有限公司,http://www.11467.com/wuhan/co/68374.htm
芜湖三益制药有限公司,http://www.11467.com/wuhu/co/6063.htm
厦门万禾园辐照技术有限公司,http://www.11467.com/xiamen/co/14239.htm
陕西超群科技股份有限公司,http://www.11467.com/xian/co/29420.htm
中国陕西方舟制药有限公司,http://www.11467.com/xian/co/76237.htm
陕西制药有限责任公司,http://www.11467.com/xian/co/58801.htm
西安天安制药股份有限公司,http://www.11467.com/xian/co/58794.htm
西安千禾药业有限责任公司,http://www.11467.com/xian/co/76218.htm
西安创景生物科技有限公司,http://www.11467.com/xian/co/111882.htm
湖南飞鸽药业有限公司,http://www.11467.com/xiangtan/co/25106.htm
陕西奥星制药有限公司,http://www.11467.com/xianyang/co/449.htm
湖北端药药业有限公司,http://www.11467.com/xiaogan/co/1383.htm
徐州曼迪科技发展有限公司,http://www.11467.com/xuzhou/co/53707.htm
烟台市元生生物工程有限公司,http://www.11467.com/yantai/co/101034.htm
湖北民康制药有限公司,http://www.11467.com/yichang/co/45732.htm
宁夏沙赛制药有限公司,http://www.11467.com/yinchuan/co/35347.htm
郑州豫密药业股份有限公司,http://www.11467.com/zhengzhou/co/44436.htm
舟山雷大电子科技有限公司,http://www.11467.com/zhoushan/co/17375.htm
珠海奥伦特有限公司,http://www.11467.com/zhuhai/co/70132.htm
山东世博金都药业有限公司,http://www.11467.com/zibo/co/79773.htm
山东新华制药股份有限公司,http://www.11467.com/zibo/co/42724.htm
北京九龙制药有限公司,http://www.11467.com/beijing/co/95715.htm
北京市燕京药业有限公司,http://www.11467.com/beijing/co/95494.htm
天津新内田制药有限公司,http://www.11467.com/tianjin/co/132657.htm
菏泽九为置业有限公司,http://www.11467.com/heze/co/49322.htm
安庆农业经营公司,http://www.11467.com/anqing/co/24601.htm
保定三九生物药业有限公司,http://www.11467.com/baoding/co/56443.htm
河北唐山双喜科技发展有限公司,http://www.11467.com/baoding/co/56378.htm
陕西宝鸡市普兰特生物工程有限公司,http://www.11467.com/baoji/co/24685.htm
宝鸡市虹源生物科技有限公司（生产部）,http://www.11467.com/baoji/co/24721.htm
陕西辉瑞生物科技有限公司,http://www.11467.com/baoji/co/24677.htm
内蒙古蒙正药业股份有限公司,http://www.11467.com/baotou/co/215.htm
乾坤药业有限公司,http://www.11467.com/bozhou/co/8752.htm
安徽省济人药业有限公司,http://www.11467.com/bozhou/co/8743.htm
安徽协和成药业饮片有限公司-中药养生保健分部,http://www.11467.com/bozhou/co/9018.htm
亳州市普济堂药业有限公司,http://www.11467.com/bozhou/co/518.htm
安徽省亳州市四海药业有限责任公司 李鹏（个体经营）,http://www.11467.com/bozhou/co/8775.htm
安徽国鑫中药饮片有限公司销售部,http://www.11467.com/bozhou/co/8757.htm
亳州市药材总公司中药材购销站,http://www.11467.com/bozhou/co/923.htm
安徽致和堂药业有限公司,http://www.11467.com/bozhou/co/7663.htm
安徽致和堂药业有限公司(销售部),http://www.11467.com/bozhou/co/8748.htm
新科技药材种苗生产有限公司,http://www.11467.com/bozhou/co/8761.htm
芜湖佳明生物科技有限公司（销售部）,http://www.11467.com/bozhou/co/8780.htm
河北康泰药业有限公司原料部,http://www.11467.com/cangzhou/co/42800.htm
吉林道君生物科技有限公司,http://www.11467.com/changchun/co/71605.htm
吉林省六福堂昌隆生化药业有限公司,http://www.11467.com/changchun/co/9563.htm
金烁商贸有限公司,http://www.11467.com/changchun/co/71563.htm
长沙绿蔓生物科技有限公司-销售部,http://www.11467.com/changsha/co/78265.htm
长沙华诚生物科技有限公司业务部,http://www.11467.com/changsha/co/78041.htm
长沙普拉达电子科技有限公司,http://www.11467.com/changsha/co/112279.htm
长沙蕴茵生物科技有限公司植物提取物销售部,http://www.11467.com/changsha/co/101469.htm
常州盛辉药业有限公司,http://www.11467.com/changzhou/co/116732.htm
潮州市泽润制药有限公司,http://www.11467.com/chaozhou/co/31560.htm
承德市神洲药业开发有限公司,http://www.11467.com/chengde/co/22157.htm
成都七合医药科技发展有限公司,http://www.11467.com/chengdu/co/81579.htm
成都恩威集团公司,http://www.11467.com/chengdu/co/92968.htm
成都宇卓保健服务有限公司,http://www.11467.com/chengdu/co/92256.htm
北京利和制药有限公司,http://www.11467.com/qiye/29365863.htm
合肥爱瑞特生物制药有限公司,http://www.11467.com/qiye/29366508.htm
安徽悦康凯悦制药有限公司,http://www.11467.com/qiye/29565324.htm
保和堂（亳州）制药有限公司,http://www.11467.com/qiye/29595417.htm
芜湖中加生物制药股份有限公司,http://www.11467.com/qiye/29793696.htm
佛山市南海区中大义齿有限公司,http://www.11467.com/foshan/co/210868.htm
广东省药材公司中药饮片厂,http://www.11467.com/foshan/co/31523.htm
安徽省阜阳市金马药业公司,http://www.11467.com/fuyang/co/26520.htm
福州康尔威生物医药科技有限公司,http://www.11467.com/fuzhou/co/139517.htm
福州世恒医药科技有限公司,http://www.11467.com/fuzhou/co/139174.htm
福建医道养生用品有限公司,http://www.11467.com/fuzhou/co/133530.htm
抚州苍源药业有限公司,http://www.11467.com/fuzhoushi/co/16014.htm
回音必集团抚州制药有限公司 总工办,http://www.11467.com/fuzhoushi/co/16016.htm
江西富中药业有限公司,http://www.11467.com/fuzhoushi/co/10220.htm
虔发中药饮片有限公司,http://www.11467.com/ganzhou/co/27899.htm
江西山香药业有限公司,http://www.11467.com/ganzhou/co/6511.htm
四川中方制药有限公司,http://www.11467.com/guangyuan/co/509.htm
广州康信药业有限公司,http://www.11467.com/guangzhou/co/199867.htm
广东广弘药材有限公司中药材药品批发部,http://www.11467.com/guangzhou/co/324801.htm
广州市亲亲我贸易有限公司采购部门,http://www.11467.com/guangzhou/co/326876.htm
广州宸星贸易有限公司黄埔分公司,http://www.11467.com/guangzhou/co/204906.htm
广州梦丽生物科技有限公司,http://www.11467.com/guangzhou/co/491739.htm
广州姚志萍美容化妆品公司,http://www.11467.com/guangzhou/co/200189.htm
广州特莱维生物科技有限公司,http://www.11467.com/guangzhou/co/480000.htm
广州市一之药业有限公司,http://www.11467.com/guangzhou/co/200713.htm
广州市益体健生物工程有限公司(ＯＥＭ事业部),http://www.11467.com/guangzhou/co/203913.htm
广州粤丰动物保健有限公司,http://www.11467.com/guangzhou/co/324392.htm
归元中成药制品有限公司,http://www.11467.com/guangzhou/co/202898.htm
桂林葛仙翁葯業有限公司,http://www.11467.com/guangzhou/co/199690.htm
广州市秋实生物技术有限公司,http://www.11467.com/guangzhou/co/53782.htm
江西天海药业股份有限公司,http://www.11467.com/guangzhou/co/202342.htm
无名小卒专业服务有限公司,http://www.11467.com/guangzhou/co/202852.htm
湘北威尔曼制药有限公司,http://www.11467.com/guangzhou/co/326729.htm
琪宝(番禺南沙)制药有限公司,http://www.11467.com/guangzhou/co/203077.htm
吉林延边土特产经销公司,http://www.11467.com/guangzhou/co/323839.htm
深圳佳泰药业有限公司,http://www.11467.com/guangzhou/co/200229.htm
庄吉国际广州公司,http://www.11467.com/guangzhou/co/323632.htm
温州市康德堂保健品公司广州办事处,http://www.11467.com/guangzhou/co/196724.htm
贵州金宇药业有限公司,http://www.11467.com/guiyang/co/73417.htm
哈尔滨仁皇药业股份有限公司物资部,http://www.11467.com/haerbin/co/46112.htm
哈尔滨乐泰药业有限公司提取分公司,http://www.11467.com/haerbin/co/15561.htm
黑龙江鑫威格药业有限公司,http://www.11467.com/haerbin/co/46069.htm
河北邯郸金芳制药有限公司,http://www.11467.com/handan/co/52168.htm
邢台自由医药公司,http://www.11467.com/handan/co/50031.htm
杭州德默医药科技有限公司,http://www.11467.com/hangzhou/co/177475.htm
富阳市三阳芦荟实验有限公司,http://www.11467.com/hangzhou/co/143121.htm
杭州民生药业有限公司输液分公司,http://www.11467.com/hangzhou/co/234515.htm
香港珍宝堂燕窝批发有限公司,http://www.11467.com/shantou/co/115320.htm
中南制药有限责任公司,http://www.11467.com/shaoyang/co/23119.htm
辽宁华强医药有限公司,http://www.11467.com/shenyang/co/52429.htm
丹东市通远药业有限公司营销中心,http://www.11467.com/shenyang/co/69222.htm
维康医药集团有限公司,http://www.11467.com/shenyang/co/56978.htm
(香港)羽億生技股份有限公司,http://www.11467.com/shenzhen/co/151143.htm
广东中大绿原生物科技有限公司,http://www.11467.com/shenzhen/co/261155.htm
佛山市琦可贸易有限公司,http://www.11467.com/shenzhen/co/261456.htm
甘肃省岷县腾龙中药材有限责任公司(深圳),http://www.11467.com/shenzhen/co/255781.htm
深圳市诚信贸易有限公司,http://www.11467.com/shenzhen/co/593730.htm
深圳市蓝勤电子有限公司,http://www.11467.com/shenzhen/co/595904.htm
深圳市逸丰鸿运实业有限公司,http://www.11467.com/shenzhen/co/268841.htm
深圳市正皇庄中药饮片有限公司,http://www.11467.com/shenzhen/co/262128.htm
深圳同济生物科技有限公司,http://www.11467.com/shenzhen/co/595116.htm
永盛興業有限公司,http://www.11467.com/shenzhen/co/268123.htm
河北点点连科技有限责任公司,http://www.11467.com/shijiazhuang/co/83416.htm
河北新世纪药业有限公司(国际贸易部),http://www.11467.com/shijiazhuang/co/83439.htm
华北制药集团北元有限公司,http://www.11467.com/shijiazhuang/co/57606.htm
华北制药(河北）神草有限公司,http://www.11467.com/shijiazhuang/co/83206.htm
石家庄市健力营养食品有限公司,http://www.11467.com/shijiazhuang/co/83477.htm
石药集团中诺药业公司,http://www.11467.com/shijiazhuang/co/83429.htm
石家庄津澳不锈钢管有限公司,http://www.11467.com/shijiazhuang/co/86580.htm
石药集团恩必普药业有限公司（生产部）,http://www.11467.com/shijiazhuang/co/83092.htm
帅玮笛生化有限公司,http://www.11467.com/shijiazhuang/co/83392.htm
石家庄市海天药业有限公司,http://www.11467.com/shijiazhuang/co/83095.htm
晋州市豪祥锌业有限公司,http://www.11467.com/shijiazhuang/co/139000.htm
石家庄岩峰医药科技有限公司销售2部,http://www.11467.com/shijiazhuang/co/83210.htm
遂宁旭泰植物原料有限公司,http://www.11467.com/suining/co/8678.htm
苏州维朗医疗用品有限公司,http://www.11467.com/suzhou/co/269399.htm
苏州优越科技有限公司,http://www.11467.com/suzhou/co/220300.htm
上海古迪电子设备有限公司,http://www.11467.com/suzhou/co/269398.htm
苏州市协和药业有限公司营销部,http://www.11467.com/suzhou/co/217544.htm
山西安吉尔机械工业有限公司,http://www.11467.com/taiyuan/co/99845.htm
山西菲尼克斯生物科技有限公司,http://www.11467.com/taiyuan/co/94435.htm
山西天星制药有限公司销售部,http://www.11467.com/taiyuan/co/94468.htm
山西海正科贸有限公司,http://www.11467.com/taiyuan/co/94602.htm
山西阳林进出口贸易有限公司,http://www.11467.com/taiyuan/co/99814.htm
香港创世纪（国际）控股集团有限公司,http://www.11467.com/taizhou/co/79726.htm
格林菲尔德(江苏)药业有限公司,http://www.11467.com/taizhoushi/co/1510.htm
陕西方舟制药有限公司,http://www.11467.com/tongchuan/co/3119.htm
通化东圣药业股份有限公司,http://www.11467.com/tonghua/co/12007.htm
潍坊腾飞有限公司,http://www.11467.com/weifang/co/81872.htm
山东威高康盛药业有限公司,http://www.11467.com/weihai/co/29779.htm
陕西省商洛市健达中药保健品有限公司,http://www.11467.com/xian/co/58277.htm
杨凌景卉生态工程有限公司,http://www.11467.com/xian/co/58545.htm
西安天一生物技术有限公司营销部,http://www.11467.com/xian/co/58208.htm
陕西康源生物工程有限公司,http://www.11467.com/xian/co/58295.htm
陕西佰瑞生物化工有限责任公司,http://www.11467.com/xian/co/58706.htm
西安天本生物工程有限公司(销售部),http://www.11467.com/xian/co/82702.htm
美复苑保健公司,http://www.11467.com/xiangfan/co/36797.htm
福寿堂制药有限公司中药提取部,http://www.11467.com/xiangtan/co/25120.htm
西安阿房宫药业有限公司咸阳总代理,http://www.11467.com/xianyang/co/21224.htm
陕西金象制药有限公司（生产部）,http://www.11467.com/xianyang/co/21243.htm
陕西康惠制药有限公司,http://www.11467.com/xianyang/co/845.htm
陕西咸阳市萃纳贝每生物工程有限公司,http://www.11467.com/xianyang/co/21246.htm
秦昆生物医学工程有限公司,http://www.11467.com/xianyang/co/21226.htm
青海银鼎科技发展有限公司,http://www.11467.com/xining/co/17402.htm
新乡恒久远药业有限公司,http://www.11467.com/xinxiang/co/26332.htm
许昌市元化生物科技有限公司-市场部,http://www.11467.com/xuchang/co/17361.htm
烟台豪迈工贸有限公司,http://www.11467.com/yantai/co/122051.htm
烟台元生药业有限公司生产部,http://www.11467.com/yantai/co/122155.htm
天然植物制品有限公司,http://www.11467.com/yichang/co/44255.htm
伊春远东北药(集团)发展有限公司,http://www.11467.com/yichunshi/co/15893.htm
益阳洞庭生物科贸有限公司,http://www.11467.com/yiyang/co/16588.htm
晶鑫国际大酒店有限公司医药项目筹备处,http://www.11467.com/yiyang/co/18022.htm
山东鑫顺中药饮片有限公司(生产厂家),http://www.11467.com/zaozhuang/co/26430.htm
河南少林医药保健有限公司,http://www.11467.com/zhanjiang/co/41326.htm
广东省肇庆市远东药用辅料厂有限公司,http://www.11467.com/zhaoqing/co/31060.htm
河南省诺金生物科技有限公司,http://www.11467.com/zhengzhou/co/106202.htm
河南省永春医药有限公司,http://www.11467.com/zhengzhou/co/106367.htm
河南汇杰科创动物药业有限公司,http://www.11467.com/zhengzhou/co/142300.htm
河南益人医药保健品有限公司,http://www.11467.com/zhengzhou/co/84683.htm
河南农大玉兔药业有限公司,http://www.11467.com/zhengzhou/co/106287.htm
郑州洛珞神药业有限公司,http://www.11467.com/zhengzhou/co/105883.htm
绿源生物科技有限公司销售部,http://www.11467.com/zhengzhou/co/106427.htm
郑州民安贸有限公司,http://www.11467.com/zhengzhou/co/106455.htm
河南郑州天思明科贸有限公司,http://www.11467.com/zhengzhou/co/105761.htm
郑州报恩堂生物科技有限公司,http://www.11467.com/zhengzhou/co/127623.htm
河南福美生物科技有限公司业务部,http://www.11467.com/zhengzhou/co/125768.htm
郑州华仁康泰生物制品有限公司,http://www.11467.com/zhengzhou/co/105857.htm
镇江力凡胶囊有限公司,http://www.11467.com/zhenjiang/co/7593.htm
中山京祥药业有限公司,http://www.11467.com/zhongshan/co/3661.htm
浙江诚东医药有限公司,http://www.11467.com/zhoushan/co/17320.htm
大众保健品公司,http://www.11467.com/zibo/co/71752.htm
北京百世央格科技发展有限公司,http://www.11467.com/beijing/co/671384.htm
北京蟾寿康医药有限责任公司,http://www.11467.com/beijing/co/419197.htm
北京哈比特生物制品有限公司,http://www.11467.com/beijing/co/201300.htm
北京格莱美生物科技发展有限公司,http://www.11467.com/beijing/co/319660.htm
北京法姆药物研究技术有限公司,http://www.11467.com/beijing/co/29260.htm
北京京育康健保险代理有限公司,http://www.11467.com/beijing/co/95676.htm
北京康的药业有限公司(销售部),http://www.11467.com/beijing/co/308972.htm
北京京驰健康食品研发有限公司,http://www.11467.com/beijing/co/397629.htm
北京华斌博鳌科技有限公司,http://www.11467.com/beijing/co/250013.htm
北京吉康宠物用品有限公司销售部,http://www.11467.com/beijing/co/308584.htm
北京华颖实业集团有限公司,http://www.11467.com/beijing/co/419238.htm
北京华亿大地科技有限公司,http://www.11467.com/beijing/co/397661.htm
北京普蒂奇天然生物工程科技有限公司,http://www.11467.com/beijing/co/95319.htm
北京同沃科技有限公司,http://www.11467.com/beijing/co/95162.htm
北京同沃科技有限公司（市场部业务部）,http://www.11467.com/beijing/co/619792.htm
北京一平天下科技有限公司,http://www.11467.com/beijing/co/215125.htm
北京万草堂保健食品有限公司销售部,http://www.11467.com/beijing/co/85312.htm
