上海好成食品有限公司 销售部,http://www.11467.com/shanghai/co/512939.htm
天津市协外制药有限公司,http://www.11467.com/tianjin/co/61242.htm
天津市绿原工贸有限公司,http://www.11467.com/tianjin/co/181248.htm
天津中天制药有限公司,http://www.11467.com/tianjin/co/144549.htm
重庆鼎扬科技发展有限公司,http://www.11467.com/chongqing/co/76963.htm
重庆恒云医药科技有限公司,http://www.11467.com/chongqing/co/77473.htm
重庆华立药业股份有限公司,http://www.11467.com/chongqing/co/53563.htm
重庆华立药业有限公司,http://www.11467.com/chongqing/co/12577.htm
天津天士力股份有限公司,http://www.11467.com/tianjin/co/309026.htm
天津百康科技发展有限公司,http://www.11467.com/tianjin/co/309028.htm
北京银象医药集团有限公司,http://www.11467.com/bjhaidian/co/83013.htm
寿光双源生物科技有限公司,http://www.11467.com/weifang/co/173875.htm
北京中农华威制药股份有限公司,http://www.11467.com/qiye/29354766.htm
广东国医堂制药股份有限公司北京企业管理中心,http://www.11467.com/qiye/29416708.htm
安徽绿莹彩龙艾绒制药有限公司,http://www.11467.com/qiye/29441097.htm
京卫制药（北京）有限公司,http://www.11467.com/qiye/29453869.htm
安徽赛乐普制药有限公司,http://www.11467.com/qiye/29455139.htm
安徽蒂诺生物制药有限公司,http://www.11467.com/qiye/29459034.htm
北京同仁堂制药亳州有限公司,http://www.11467.com/qiye/29466295.htm
日健中外制药有限公司北京分公司,http://www.11467.com/qiye/29508304.htm
安徽艾珂尔制药有限公司,http://www.11467.com/qiye/29520844.htm
北京御生堂（亳州）健康制药有限公司,http://www.11467.com/qiye/29536351.htm
合肥九研制药有限公司,http://www.11467.com/qiye/29541611.htm
广印堂富山制药（亳州）有限公司,http://www.11467.com/qiye/29565106.htm
贵州百灵企业集团制药股份有限公司北京营销管理中心,http://www.11467.com/qiye/29570732.htm
蚌埠火鹤制药有限公司,http://www.11467.com/qiye/29581378.htm
安徽松瑞制药有限公司,http://www.11467.com/qiye/29612472.htm
赛诺菲（杭州）制药有限公司北京分公司,http://www.11467.com/qiye/29629492.htm
大桐制药（中国）有限责任公司,http://www.11467.com/qiye/29671366.htm
北京诺华制药有限公司合肥分公司,http://www.11467.com/qiye/29673768.htm
恒诚制药集团淮南有限公司,http://www.11467.com/qiye/29679770.htm
北京农发生物制药有限公司,http://www.11467.com/qiye/29685816.htm
西安天安制药股份有限公司北京办事处,http://www.11467.com/qiye/29709961.htm
蚌埠丰原涂山制药有限公司大庆路分厂,http://www.11467.com/qiye/29716564.htm
安徽华明制药有限公司,http://www.11467.com/qiye/29761960.htm
安徽康益制药有限公司,http://www.11467.com/qiye/29791985.htm
安徽昌宏制药有限公司,http://www.11467.com/qiye/29865538.htm
亳州君益制药有限公司,http://www.11467.com/qiye/29875799.htm
安徽全力生物制药有限公司,http://www.11467.com/qiye/29875933.htm
芜湖诺特制药技术有限公司,http://www.11467.com/qiye/29884025.htm
安徽方氏制药有限公司,http://www.11467.com/qiye/29902081.htm
北京中农华威制药股份有限公司制药厂,http://www.11467.com/qiye/29917342.htm
安徽修一制药有限公司,http://www.11467.com/qiye/29933014.htm
北京迈斯凯成制药技术有限公司,http://www.11467.com/qiye/29937783.htm
黑龙江宝泉制药有限公司北京办事处,http://www.11467.com/qiye/29940484.htm
北京科创制药有限公司,http://www.11467.com/qiye/29970628.htm
盐城市大丰区盐师院海洋生物制药科技有限公司,http://www.11467.com/qiye/60484596.htm
上海韧丰制药机械有限公司,http://www.11467.com/qiye/60690105.htm
利安隆（天津）制药有限公司,http://www.11467.com/qiye/61889624.htm
天津和治友德制药有限公司河南分公司,http://www.11467.com/qiye/62177408.htm
天津和治友德制药有限公司云南分公司,http://www.11467.com/qiye/62177411.htm
中山万汉制药有限公司,http://www.11467.com/qiye/62207347.htm
石家庄福广多制药机械销售有限公司,http://www.11467.com/qiye/62574589.htm
回音必集团浙江齐齐制药有限公司,http://www.11467.com/qiye/63589800.htm
礼来苏州制药有限公司合肥分公司,http://www.11467.com/qiye/64202942.htm
永州大自然医院集团制药实业有限公司,http://www.11467.com/qiye/65673991.htm
庐山百草堂生物制药有限公司广州分公司,http://www.11467.com/qiye/67553947.htm
吉林省图们江制药有限公司,http://www.11467.com/qiye/67840547.htm
宜兴正皓制药机械科技有限公司,http://www.11467.com/qiye/67977326.htm
淄博昊威兽药有限公司,http://www.11467.com/zibo/co/58521.htm
海安制药厂综合服务公司,http://www.11467.com/qiye/27296303.htm
淮南舜隆制药有限公司,http://www.11467.com/qiye/29334193.htm
华裕（无锡）制药有限公司北京办事处,http://www.11467.com/qiye/29391935.htm
杭州赛诺菲安万特民生制药有限公司北京办事处,http://www.11467.com/qiye/29415517.htm
日本苏爱康制药有限公司北京代表处,http://www.11467.com/qiye/29490938.htm
安徽省百春制药有限公司北京分公司,http://www.11467.com/qiye/29531140.htm
比利时浩卫制药股份有限公司北京代表处,http://www.11467.com/qiye/29546367.htm
韩国现代制药有限公司北京代表处,http://www.11467.com/qiye/29572284.htm
北京诺华制药有限公司北京第二分公司,http://www.11467.com/qiye/29584748.htm
北京易安制药有限公司,http://www.11467.com/qiye/29587372.htm
北京天地制药有限公司,http://www.11467.com/qiye/29599789.htm
青海格萨尔王藏药制药有限责任公司北京代表处,http://www.11467.com/qiye/29620739.htm
赛诺菲（北京）制药有限公司,http://www.11467.com/qiye/29629466.htm
北京凯迈科斯制药技术有限公司,http://www.11467.com/qiye/29693600.htm
安徽中邦制药有限公司,http://www.11467.com/qiye/29730158.htm
合肥格宁制药有限公司,http://www.11467.com/qiye/29758482.htm
合肥泰凌生物制药有限公司,http://www.11467.com/qiye/29814999.htm
北京中源飞天制药有限责任公司,http://www.11467.com/qiye/29822538.htm
上海华源安徽仁济制药有限公司保健品分公司,http://www.11467.com/qiye/29832124.htm
合肥天圣制药有限责任公司,http://www.11467.com/qiye/29878017.htm
铜陵和氏制药有限责任公司,http://www.11467.com/qiye/29904571.htm
北京中农华威制药股份有限公司,http://www.11467.com/qiye/29917336.htm
住友制药（苏州）有限公司北京第二分公司,http://www.11467.com/qiye/29924346.htm
合肥凯华制药有限公司湿巾分公司,http://www.11467.com/qiye/29930040.htm
广西朗田生物制药有限公司合肥分公司,http://www.11467.com/qiye/29954147.htm
住友制药（苏州）有限公司北京第二分公司,http://www.11467.com/qiye/29955191.htm
海南斯达制药有限公司北京分公司,http://www.11467.com/qiye/29975809.htm
开封恒宇制药有限公司深圳办事处,http://www.11467.com/qiye/90022777.htm
东莞博诺制药装备科技有限公司,http://www.11467.com/qiye/90059902.htm
上海先灵葆雅制药有限公司广州分公司,http://www.11467.com/qiye/90157955.htm
北京双桥制药公司大连办事处,http://www.11467.com/qiye/90305483.htm
内蒙古蒙利中蒙制药有限责任公司兽药厂,http://www.11467.com/qiye/90322120.htm
云南省玉溪市维和制药有限公司二车间,http://www.11467.com/qiye/90366474.htm
瑞安市江南制药机械有限公司环保机械分公司,http://www.11467.com/qiye/90392287.htm
温州普瑞斯特制药机械有限公司,http://www.11467.com/qiye/90401349.htm
湖南湘泉制药有限公司摆手堂分公司,http://www.11467.com/qiye/90422920.htm
清华紫光古汉生物制药股份有限公司衡阳制药厂,http://www.11467.com/qiye/90423034.htm
广州华厦生物制药有限公司,http://www.11467.com/qiye/61921789.htm
挪威雅赛利制药有限公司上海代表处,http://www.11467.com/qiye/61988274.htm
东北制药联合企业集团经销公司丹东市开发区分公司,http://www.11467.com/qiye/62028459.htm
海南三永制药有限公司海口经营部,http://www.11467.com/qiye/62119412.htm
江西赣中制药厂万达销售有限公司,http://www.11467.com/qiye/62276215.htm
济南爱民制药有限责任公司销售服务中心,http://www.11467.com/qiye/62732241.htm
韩国现代制药有限公司北京代表处,http://www.11467.com/qiye/29572284.htm
北京诺华制药有限公司北京第二分公司,http://www.11467.com/qiye/29584748.htm
北京易安制药有限公司,http://www.11467.com/qiye/29587372.htm
北京天地制药有限公司,http://www.11467.com/qiye/29599789.htm
青海格萨尔王藏药制药有限责任公司北京代表处,http://www.11467.com/qiye/29620739.htm
赛诺菲（北京）制药有限公司,http://www.11467.com/qiye/29629466.htm
北京凯迈科斯制药技术有限公司,http://www.11467.com/qiye/29693600.htm
安徽中邦制药有限公司,http://www.11467.com/qiye/29730158.htm
合肥格宁制药有限公司,http://www.11467.com/qiye/29758482.htm
合肥泰凌生物制药有限公司,http://www.11467.com/qiye/29814999.htm
北京中源飞天制药有限责任公司,http://www.11467.com/qiye/29822538.htm
上海华源安徽仁济制药有限公司保健品分公司,http://www.11467.com/qiye/29832124.htm
合肥天圣制药有限责任公司,http://www.11467.com/qiye/29878017.htm
铜陵和氏制药有限责任公司,http://www.11467.com/qiye/29904571.htm
北京中农华威制药股份有限公司,http://www.11467.com/qiye/29917336.htm
住友制药（苏州）有限公司北京第二分公司,http://www.11467.com/qiye/29924346.htm
合肥凯华制药有限公司湿巾分公司,http://www.11467.com/qiye/29930040.htm
广西朗田生物制药有限公司合肥分公司,http://www.11467.com/qiye/29954147.htm
住友制药（苏州）有限公司北京第二分公司,http://www.11467.com/qiye/29955191.htm
海南斯达制药有限公司北京分公司,http://www.11467.com/qiye/29975809.htm
上海三维制药销售有限公司,http://www.11467.com/qiye/60278427.htm
陕西怡悦制药有限公司西安龙渠湾分公司,http://www.11467.com/qiye/60290540.htm
西安恩慈制药有限公司一分厂,http://www.11467.com/qiye/60429521.htm
河南远程生物制药有限公司,http://www.11467.com/qiye/60822349.htm
重庆东方制药股份有限公司驻长春办事处,http://www.11467.com/qiye/61257532.htm
浙江大郎制药机械装备有限公司,http://www.11467.com/qiye/61364260.htm
成武胜康化工制药（集团）有限公司,http://www.11467.com/qiye/61403883.htm
湖北李时珍文林制药有限公司,http://www.11467.com/qiye/93216803.htm
江苏朗科制药有限公司,http://www.11467.com/qiye/93216804.htm
西安天一秦昆制药有限责任公司铜川分公司,http://www.11467.com/qiye/93216810.htm
河南省中州制药有限公司,http://www.11467.com/qiye/71090382.htm
石药集团中禾制药(内蒙古)有限公司,http://www.11467.com/qiye/71296543.htm
云南大东生物制药股份有限公司陆良朝阳西街销售点,http://www.11467.com/qiye/71920488.htm
牡丹江柴河威虎山制药有限责任公司山城酒店,http://www.11467.com/qiye/71979483.htm
吉林省博大伟业制药有限公司长春科技开发分公司,http://www.11467.com/qiye/72086536.htm
江西力克制药有限公司辽阳分公司０１,http://www.11467.com/qiye/72311948.htm
四川东方制药股份有限公司内江药品经营部,http://www.11467.com/qiye/73340439.htm
贵州云药堂制药有限公司,http://www.11467.com/qiye/73429165.htm
海口海药制药厂有限公司,http://www.11467.com/qiye/73493175.htm
辽阳制药机械股份有限公司供销公司,http://www.11467.com/qiye/73509416.htm
辽阳制药机械总厂集体企业公司综合厂,http://www.11467.com/qiye/74927959.htm
安阳予北制药厂通达实业公司宏达再生纸厂,http://www.11467.com/qiye/75073815.htm
华北制药（河北）神草有限公司中山东路经营部,http://www.11467.com/qiye/75360127.htm
佳木斯国安制药有限公司延年健康咨询中心,http://www.11467.com/qiye/76071046.htm
吉林海兰江生物制药有限公司,http://www.11467.com/qiye/77432630.htm
西安德立斯顿制药有限公司,http://www.11467.com/qiye/77458413.htm
广州白云山制药股份有限公司福州经营部(缓检),http://www.11467.com/qiye/77686907.htm
成都森料制药有限公司药品经营分公司,http://www.11467.com/qiye/77742926.htm
济南鲁平裕腾制药有限公司,http://www.11467.com/qiye/77866363.htm
耐诺邦纳米生物制药技术（北京）有限责任公司,http://www.11467.com/qiye/78403098.htm
成都后藤制药有限公司,http://www.11467.com/qiye/78597812.htm
北京博轩制药公司,http://www.11467.com/qiye/78790809.htm
武汉天奥制药有限公司呼和浩特办事处,http://www.11467.com/qiye/78940534.htm
九江制药厂销售公司,http://www.11467.com/qiye/78983028.htm
河北恒利集团制药公司邢台办事处,http://www.11467.com/qiye/79043029.htm
华北制药河北华诺有限公司和平店,http://www.11467.com/qiye/79080936.htm
东药集团丹东前进制药有限公司驻长春办事处,http://www.11467.com/qiye/79229800.htm
华北制药集团有限责任公司驻深圳办事处,http://www.11467.com/qiye/79476527.htm
中国大冢制药有限公司青岛办事处,http://www.11467.com/qiye/79477860.htm
天圣制药集团股份有限公司饮片厂,http://www.11467.com/qiye/79478270.htm
成都恒瑞制药有限公司糖尿病药物研究院,http://www.11467.com/qiye/79485247.htm
四川蜀中制药有限公司制药一厂,http://www.11467.com/qiye/79486400.htm
四川禾嘉华福宁制药有限公司,http://www.11467.com/qiye/79487384.htm
贵州西创制药有限公司,http://www.11467.com/qiye/79488822.htm
上海景峰制药有限公司浦东新区分公司,http://www.11467.com/qiye/79488823.htm
上海莱福制药有限公司,http://www.11467.com/qiye/79489433.htm
杭州默沙东制药有限公司杭州分公司,http://www.11467.com/qiye/79491143.htm
杭州默沙东制药有限公司青岛办事处,http://www.11467.com/qiye/79491260.htm
华瑞制药有限公司武汉分公司,http://www.11467.com/qiye/79491580.htm
成都永安制药有限公司驻市区联络处,http://www.11467.com/qiye/79491883.htm
湖北新峰制药有限公司,http://www.11467.com/qiye/79501814.htm
上海联友制药技术有限公司,http://www.11467.com/qiye/79503187.htm
湖南正清制药集团股份有限公司长沙办事处*,http://www.11467.com/qiye/79503260.htm
大连百利天华制药有限公司长春分公司,http://www.11467.com/qiye/79503590.htm
吉林省博大制药有限责任公司长春科技开发分公司,http://www.11467.com/qiye/79507892.htm
惠氏制药有限公司福州办事处,http://www.11467.com/qiye/79510720.htm
常德南方制药有限公司,http://www.11467.com/qiye/79511242.htm
中盛海天制药有限公司天津分公司,http://www.11467.com/qiye/79513869.htm
深圳致君制药有限公司观澜基地,http://www.11467.com/qiye/79514282.htm
哈尔滨祥鸿制药有限公司,http://www.11467.com/qiye/79515183.htm
湖南康源制药有限公司长沙办事处,http://www.11467.com/qiye/79529512.htm
上海清松制药有限公司分公司,http://www.11467.com/qiye/79533143.htm
海南皇隆制药股份有限公司北京分公司,http://www.11467.com/qiye/79533454.htm
上海奥星制药技术装备有限公司第一分公司,http://www.11467.com/qiye/79533560.htm
云南明镜亨利制药有限公司江川分公司,http://www.11467.com/qiye/79536123.htm
云南明镜亨利制药有限公司文山分公司,http://www.11467.com/qiye/79536124.htm
广州南新制药有限公司济南办事处,http://www.11467.com/qiye/79536304.htm
重庆南柏生物制药有限公司,http://www.11467.com/qiye/79536386.htm
河南辅仁堂制药有限公司亳州药材分公司,http://www.11467.com/qiye/79540548.htm
广东双林生物制药有限公司新疆分公司,http://www.11467.com/qiye/79732078.htm
武汉维奥制药有限公司哈尔滨办事处,http://www.11467.com/qiye/79738141.htm
苏州康肽生物制药有限公司天津分公司,http://www.11467.com/qiye/79739856.htm
河北中盛制药有限公司,http://www.11467.com/qiye/79749555.htm
石药欧意国际制药有限公司,http://www.11467.com/qiye/79749556.htm
上海同仁药业有限公司十八制药厂,http://www.11467.com/qiye/79753119.htm
浙江奥托康制药集团股份有限公司永康输液分厂,http://www.11467.com/qiye/79754948.htm
西安圣威制药有限公司咸阳办事处,http://www.11467.com/qiye/79755068.htm
西安圣威制药有限公司生产基地,http://www.11467.com/qiye/79755070.htm
山东鲁抗东岳制药有限公司,http://www.11467.com/qiye/79755952.htm
常州市兰陵制药有限公司兽药分公司,http://www.11467.com/qiye/79758608.htm
资阳正源顺康制药有限公司,http://www.11467.com/qiye/79762583.htm
资阳禾章制药有限公司,http://www.11467.com/qiye/79762585.htm
资阳禾联制药有限公司,http://www.11467.com/qiye/79762586.htm
资阳兴邦制药有限公司,http://www.11467.com/qiye/79762587.htm
湖南尔康制药有限公司南宁分公司,http://www.11467.com/qiye/79773482.htm
国药一心制药有限公司北京研发中心,http://www.11467.com/qiye/79774976.htm
长兴制药有限公司泗安分公司,http://www.11467.com/qiye/79775391.htm
安徽省准中制药有限责任公司,http://www.11467.com/qiye/79790392.htm
北京亚东生物制药有限公司门头沟分公司,http://www.11467.com/qiye/79793378.htm
宁波立华制药有限公司江北办事处,http://www.11467.com/qiye/79799227.htm
宁波立华制药有限公司镇海生产车间,http://www.11467.com/qiye/79799228.htm
珠海联邦制药股份有限公司青岛办事处,http://www.11467.com/qiye/79809411.htm
山东金泰集团股份有限公司济南金泰制药厂,http://www.11467.com/qiye/79817938.htm
第一三共制药（北京）有限公司成都分公司,http://www.11467.com/qiye/79819443.htm
第一三共制药(北京)有限公司青岛分公司,http://www.11467.com/qiye/79819444.htm
西安安健药业有限公司制药分公司,http://www.11467.com/qiye/79820484.htm
广西南宁化学制药有限责任公司第一分公司,http://www.11467.com/qiye/79823415.htm
山东齐鲁兴华制药有限公司,http://www.11467.com/qiye/79827198.htm
四川新硒康生物制药有限公司,http://www.11467.com/qiye/79842088.htm
绵阳一康制药有限公司成都分公司,http://www.11467.com/qiye/79842089.htm
华润三九（郴州）制药有限公司销售分公司,http://www.11467.com/qiye/79860960.htm
海南锦瑞制药股份有限公司海口分公司,http://www.11467.com/qiye/79867079.htm
郑州瑞龙（集团）制药有限公司荥阳开发区办事处,http://www.11467.com/qiye/79867580.htm
中山市中智制药有限公司,http://www.11467.com/qiye/79869341.htm
河北联合制药有限公司赵县分公司,http://www.11467.com/qiye/79885745.htm
太极集团四川绵阳制药有限公司经营部,http://www.11467.com/qiye/79896113.htm
重庆凯林制药有限公司长寿分厂,http://www.11467.com/qiye/79897194.htm
成都天台山制药有限公司邛崃经营部,http://www.11467.com/qiye/79898064.htm
上海强生制药有限公司上海办事处,http://www.11467.com/qiye/79911137.htm
贵州神奇第二制药有限责任公司都匀经营部,http://www.11467.com/qiye/79925370.htm
贵州神奇制药有限公司兴义分厂,http://www.11467.com/qiye/79925371.htm
上海中联制药装备有限公司经营分公司,http://www.11467.com/qiye/79927188.htm
上海中联制药装备有限公司经营分公司,http://www.11467.com/qiye/79927189.htm
上海中联制药装备有限公司经营部,http://www.11467.com/qiye/79927190.htm
上海中联制药装备有限公司经营部,http://www.11467.com/qiye/79927191.htm
第一三共制药（北京）有限公司上海分公司,http://www.11467.com/qiye/79927733.htm
通化茂祥制药有限公司铜川新区分公司,http://www.11467.com/qiye/79951941.htm
丹阳市华泰制药机械有限公司无锡分公司,http://www.11467.com/qiye/79960174.htm
上海联民制药装备实业有限公司虹口分公司,http://www.11467.com/qiye/79980892.htm
上海联民制药装备实业有限公司分公司,http://www.11467.com/qiye/79980893.htm
上海联民制药装备实业有限公司,http://www.11467.com/qiye/79980894.htm
云南开远市明威有限公司制药分厂,http://www.11467.com/qiye/79981264.htm
浙江普洛康裕制药有限公司门市部,http://www.11467.com/qiye/80014222.htm
云南英茂红河制药有限公司药品分公司,http://www.11467.com/qiye/80015047.htm
云南红河制药科技发展有限公司药品第一营业部,http://www.11467.com/qiye/80015048.htm
云南红河制药科技发展有限公司药品分公司,http://www.11467.com/qiye/80015049.htm
广东大冢制药有限公司上海事务所,http://www.11467.com/qiye/80016038.htm
广东大冢制药有限公司上海分公司,http://www.11467.com/qiye/80016039.htm
湖南九芝堂斯奇生物制药有限公司斯奇康感冒哮喘皮肤病健康咨询中心,http://www.11467.com/qiye/80016926.htm
湖南安邦制药有限公司葆妇欣宫内避孕副反应健康咨询中心,http://www.11467.com/qiye/80017024.htm
浙江施泰乐制药有限公司,http://www.11467.com/qiye/80020122.htm
成都美域高制药有限公司,http://www.11467.com/qiye/80026228.htm
天津和治友德制药有限公司四川分公司,http://www.11467.com/qiye/80032892.htm
大连泠美制药有限公司,http://www.11467.com/qiye/80033164.htm
清华紫光古汉生物制药股份有限公司衡阳南岳制药厂,http://www.11467.com/qiye/80035179.htm
南岳生物制药有限公司岳阳二基地,http://www.11467.com/qiye/80035180.htm
青海大地药业有限公司海南制药分公司,http://www.11467.com/qiye/80045085.htm
上海成旺软胶丸制药机械有限公司分公司,http://www.11467.com/qiye/80078060.htm
上海礼宝制药机械有限公司第一分公司,http://www.11467.com/qiye/80124616.htm
长宁县国强制药有限责任公司,http://www.11467.com/qiye/80141469.htm
四川省宜宾五粮液集团宜宾制药有限责任公司营销分公司,http://www.11467.com/qiye/80141471.htm
安徽现代化工制药有限公司开发区分公司,http://www.11467.com/qiye/80154452.htm
安徽省丰禾万象生物制药有限公司,http://www.11467.com/qiye/80158378.htm
巨化集团公司制药厂职工技术协会,http://www.11467.com/qiye/80190301.htm
山西银湖制药有限责任公司业务部,http://www.11467.com/qiye/80195392.htm
山东天达生物制药股份有限公司睿源制药分公司,http://www.11467.com/qiye/80209864.htm
山东华润制药有限公司北京技术开发中心,http://www.11467.com/qiye/80211102.htm
天士力胜宝（天津）生物制药科技有限公司,http://www.11467.com/qiye/80228741.htm
宁夏荣生制药有限责任公司湖南办事处,http://www.11467.com/qiye/80235187.htm
资阳禾顺制药有限公司,http://www.11467.com/qiye/80311964.htm
四川省金鹿制药有限公司,http://www.11467.com/qiye/80313285.htm
四川省嘉蓉制药股份有限公司第二兽药经营部,http://www.11467.com/qiye/80314244.htm
四川康弘合成制药有限公司,http://www.11467.com/qiye/80317864.htm
青神彩康制药有限公司,http://www.11467.com/qiye/80317869.htm
四川保宁制药有限公司南充营销分公司(已注销),http://www.11467.com/qiye/80321029.htm
上海步长制药有限公司,http://www.11467.com/qiye/80337537.htm
上海步长制药有限公司,http://www.11467.com/qiye/80337538.htm
咸阳步长制药有限公司哈尔滨办事处,http://www.11467.com/qiye/80337541.htm
吉林省辉南辉发制药股份有限公司青海办事处,http://www.11467.com/qiye/80347352.htm
敦化市敖康欣制药有限公司,http://www.11467.com/qiye/80348676.htm
香港法国双飞人制药（集团）有限公司,http://www.11467.com/qiye/80362428.htm
江苏金森赛迪制药有限公司,http://www.11467.com/qiye/80406407.htm
广东省郁南天宝生物制药有限公司,http://www.11467.com/qiye/80447015.htm
常熟市泰鼎制药有限公司,http://www.11467.com/qiye/80548307.htm
山东良福制药常州研究院有限公司,http://www.11467.com/qiye/80673670.htm
重庆葛兰素威康制药有限公司济南办事处,http://www.11467.com/qiye/80812220.htm
广东三生制药有限公司,http://www.11467.com/qiye/80847011.htm
江苏欧信制药有限公司,http://www.11467.com/qiye/80934628.htm
四川森科制药有限公司,http://www.11467.com/qiye/81027153.htm
常州健益生物制药有限公司,http://www.11467.com/qiye/81082781.htm
上海华联制药有限公司吴淞制药厂,http://www.11467.com/qiye/81093662.htm
哈尔滨百达制药有限公司哈尔滨办事处,http://www.11467.com/qiye/81112901.htm
湖南汇丰制药有限公司,http://www.11467.com/qiye/81123813.htm
德国安达制药有限公司上海代表处,http://www.11467.com/qiye/81133178.htm
甘肃慈康制药有限公司,http://www.11467.com/qiye/81182259.htm
河北广祥制药有限公司,http://www.11467.com/qiye/81240435.htm
六目源制药有限公司,http://www.11467.com/qiye/81362456.htm
梧州大礼制药有限公司,http://www.11467.com/qiye/81533980.htm
石家庄制药集团达宝化工有限公司,http://www.11467.com/qiye/81569913.htm
