法国皮尔法伯制药公司上海代表处,http://www.11467.com/qiye/81717398.htm
郑州薇薇朵生物制药有限公司,http://www.11467.com/qiye/81734142.htm
联宁（苏州）生物制药有限公司,http://www.11467.com/qiye/81747902.htm
辽阳银轩制药机械有限公司机械制造分公司,http://www.11467.com/qiye/81782213.htm
广东省天宝生物制药有限公司广州分公司,http://www.11467.com/qiye/81788537.htm
福建省天健制药有限公司连城分公司,http://www.11467.com/qiye/81899381.htm
湖南华阳制药有限公司,http://www.11467.com/qiye/82012471.htm
连云港市丰恒生物制药有限公司,http://www.11467.com/qiye/82031685.htm
四川禾邦阳光制药有限责任公司经营分公司,http://www.11467.com/qiye/82104973.htm
亳州市丰雷溢制药机械有限公司,http://www.11467.com/qiye/82117607.htm
贵州柏德制药有限公司,http://www.11467.com/qiye/82185701.htm
葛兰素威康（苏州）制药有限公司青岛办事处,http://www.11467.com/qiye/82203880.htm
武汉五行制药机械有限责任公司,http://www.11467.com/qiye/82211751.htm
南京养元堂制药有限公司,http://www.11467.com/qiye/82215126.htm
宁波泰怡康成生物制药科技有限公司,http://www.11467.com/qiye/82232062.htm
深圳市朗润生物制药有限公司,http://www.11467.com/qiye/82238244.htm
湖北制药联合有限公司,http://www.11467.com/qiye/82266203.htm
上海正晔制药机械有限公司分公司,http://www.11467.com/qiye/82364025.htm
河北慈航制药有限公司,http://www.11467.com/qiye/82404676.htm
浙江东方制药有限公司新药部,http://www.11467.com/qiye/82464725.htm
山东颜春制药有限公司,http://www.11467.com/qiye/82582478.htm
成都隆迪阳光制药有限公司,http://www.11467.com/qiye/82783784.htm
武汉百纳礼康生物制药有限公司,http://www.11467.com/qiye/82836903.htm
山西博华制药有限公司,http://www.11467.com/qiye/82855250.htm
厦门金日第二制药有限公司,http://www.11467.com/qiye/82881032.htm
丹东永泉制药有限公司,http://www.11467.com/qiye/83055810.htm
海门市金睛制药机械有限公司,http://www.11467.com/qiye/83094628.htm
辽宁嵩洋生物制药有限公司,http://www.11467.com/qiye/83095134.htm
广东颂德制药有限公司,http://www.11467.com/qiye/86723992.htm
四川升和制药有限公司龙泉分厂,http://www.11467.com/qiye/86817642.htm
贵州苗本草生物制药有限公司,http://www.11467.com/qiye/86843924.htm
贵州神奇盛世制药有限责任公司脚癣研究所,http://www.11467.com/qiye/86940986.htm
山东美貌制药有限公司,http://www.11467.com/qiye/86945401.htm
广州百济神州生物制药有限公司,http://www.11467.com/qiye/86963049.htm
成都思威制药公司,http://www.11467.com/qiye/86982966.htm
山西正来制药有限公司,http://www.11467.com/qiye/86990045.htm
北京大熊制药有限公司,http://www.11467.com/qiye/86997515.htm
西安恩慈制药有限公司生产分公司,http://www.11467.com/qiye/87007912.htm
江西盛永生物制药有限公司,http://www.11467.com/qiye/87036989.htm
浙江新昌京新制药有限公司,http://www.11467.com/qiye/87068398.htm
湖南湘泉制药有限公司劝君酒分公司,http://www.11467.com/qiye/87071070.htm
云南医投善美制药有限公司,http://www.11467.com/qiye/87158064.htm
江西海外制药有限公司,http://www.11467.com/qiye/87407325.htm
浙江一新制药股份有限公司广州分公司,http://www.11467.com/qiye/87606384.htm
常德康哲广明制药有限公司,http://www.11467.com/qiye/87734758.htm
浙江康乐集团有限公司温州制药厂,http://www.11467.com/qiye/87761301.htm
昆山龙灯瑞迪制药有限公司上海办事处,http://www.11467.com/qiye/87839179.htm
广州智润生物制药科技有限公司,http://www.11467.com/qiye/87901052.htm
长沙维神制药有限公司,http://www.11467.com/qiye/87988721.htm
湖南省益阳碧云制药有限公司,http://www.11467.com/qiye/88118674.htm
上海信谊制药技术装备公司,http://www.11467.com/qiye/88128306.htm
厦门建发制药有限公司怀德居诊所,http://www.11467.com/qiye/88358575.htm
天津泰阳制药有限公司茶叶销售分公司,http://www.11467.com/qiye/88580353.htm
亳州市楚王制药机械制造有限公司,http://www.11467.com/qiye/88600187.htm
武汉远大制药集团有限公司销售分公司,http://www.11467.com/qiye/90547380.htm
新疆麦迪森维药有限公司制药厂,http://www.11467.com/qiye/90623052.htm
美国新月美制药集团有限公司上海代表处,http://www.11467.com/qiye/90627254.htm
新乡佐今明制药股份有限公司阿明锅仔,http://www.11467.com/qiye/90633289.htm
黑龙江庆安制药股份有限公司临海分公司,http://www.11467.com/qiye/90727657.htm
鞍山市第一制药厂对外服务公司,http://www.11467.com/qiye/90748561.htm
艾康礼德制药（浙江）有限公司上海分公司,http://www.11467.com/qiye/90860650.htm
山东华信制药有限公司菏泽华信药品经营部,http://www.11467.com/qiye/90885620.htm
本溪制药有限责任公司青岛办事处,http://www.11467.com/qiye/90892027.htm
黄玲莉-长沙市开福区湖南制药有限公司宿舍19栋111号,http://www.11467.com/qiye/90892191.htm
西安至信制药装备技术有限公司,http://www.11467.com/qiye/90945670.htm
辽宁红五星制药有限公司沈阳分公司,http://www.11467.com/qiye/90963412.htm
南京珀设继业制药机械有限公司,http://www.11467.com/qiye/90977338.htm
湖北制药有限公司,http://www.11467.com/qiye/90977477.htm
海南久常制药有限公司,http://www.11467.com/qiye/90978809.htm
四川制药股份有限公司岳阳市分公司,http://www.11467.com/qiye/90980501.htm
洛阳泰生堂生物制药有限公司,http://www.11467.com/qiye/91053957.htm
无锡市第七制药有限公司分公司,http://www.11467.com/qiye/91153673.htm
东阳市益州制药有限公司,http://www.11467.com/qiye/91163097.htm
陕西奥星制药有限公司西宁分公司,http://www.11467.com/qiye/91338289.htm
安徽广印堂制药有限公司交易中心经营部,http://www.11467.com/qiye/91595241.htm
济南永日制药技术有限公司,http://www.11467.com/qiye/91604842.htm
陕西海姆普德制药有限公司渭南第二分公司,http://www.11467.com/qiye/91671226.htm
山东天达生物制药股份有限公司徐州分公司,http://www.11467.com/qiye/91710725.htm
久光制药（中国）有限公司,http://www.11467.com/qiye/91803190.htm
山东永乐堂阿胶集团无极制药有限公司亚昌药业分公司,http://www.11467.com/qiye/93052782.htm
吉林省洪荒制药有限公司,http://www.11467.com/qiye/93077803.htm
湖南贵隆制药有限公司,http://www.11467.com/qiye/93077804.htm
天津中新药业集团新新(沧州)制药有限公司,http://www.11467.com/qiye/93077805.htm
津村盛实制药科技有限公司,http://www.11467.com/qiye/93077813.htm
宜昌东阳光制药有限公司,http://www.11467.com/qiye/93077814.htm
昂彪制药(上海)有限公司,http://www.11467.com/qiye/93077816.htm
重庆先锋制药有限公司,http://www.11467.com/qiye/93077818.htm
云南金七制药有限公司昆明分公司,http://www.11467.com/qiye/93077819.htm
湖南省金龟制药有限公司,http://www.11467.com/qiye/93077821.htm
河北昆仑制药有限公司,http://www.11467.com/qiye/93077825.htm
河北方园隆盛制药有限公司,http://www.11467.com/qiye/93077826.htm
天津和治友德制药有限公司青海分公司,http://www.11467.com/qiye/93077829.htm
重庆珍景制药有限公司,http://www.11467.com/qiye/93077830.htm
成都信德百峰制药有限公司,http://www.11467.com/qiye/93077834.htm
湖南方盛康华制药有限公司,http://www.11467.com/qiye/93077836.htm
内蒙古圣雪大成制药有限公司,http://www.11467.com/qiye/93077837.htm
百川制药股份有限公司,http://www.11467.com/qiye/93077840.htm
唐山第一制药集团有限公司,http://www.11467.com/qiye/93077841.htm
山东罗欣乐康制药有限公司,http://www.11467.com/qiye/93077842.htm
贵州新百花制药有限公司,http://www.11467.com/qiye/93077846.htm
广西敬业制药有限公司,http://www.11467.com/qiye/93077848.htm
衡阳小桔制药有限公司,http://www.11467.com/qiye/93077851.htm
延安御唐制药有限公司,http://www.11467.com/qiye/93077852.htm
浙江大冢制药有限公司上海分公司,http://www.11467.com/qiye/93077855.htm
吉林省百年汉克制药有限公司长春分公司,http://www.11467.com/qiye/93130501.htm
江苏胜普泰制药有限公司,http://www.11467.com/qiye/93216761.htm
山东金山现代制药有限公司,http://www.11467.com/qiye/93216763.htm
安徽泰福制药有限公司,http://www.11467.com/qiye/93216765.htm
上海金不换兰考制药有限公司开封分公司,http://www.11467.com/qiye/93216768.htm
山东宜岛康制药有限公司,http://www.11467.com/qiye/93216771.htm
黑龙江余庆堂制药有限公司,http://www.11467.com/qiye/93216772.htm
合肥丰天谷制药有限公司,http://www.11467.com/qiye/93216773.htm
合肥菲氏制药有限公司,http://www.11467.com/qiye/93216775.htm
江苏本心制药有限公司,http://www.11467.com/qiye/93216778.htm
武汉君衡正同制药有限公司,http://www.11467.com/qiye/93216780.htm
北京春风一方制药有限公司河北分公司,http://www.11467.com/qiye/93216782.htm
泽生制药(宁波)有限公司,http://www.11467.com/qiye/93216784.htm
广西灵验制药有限公司,http://www.11467.com/qiye/93216786.htm
南京协同制药有限公司,http://www.11467.com/qiye/93216787.htm
重庆合汇制药有限公司,http://www.11467.com/qiye/93216788.htm
弘美制药(深圳)有限公司,http://www.11467.com/qiye/93216789.htm
柳河长隆制药有限公司,http://www.11467.com/qiye/93216793.htm
北京春风一方制药有限公司,http://www.11467.com/qiye/93216797.htm
大湾汉唯(广州)中药制药有限公司,http://www.11467.com/qiye/93216800.htm
潍坊浩普制药有限公司,http://www.11467.com/qiye/93216801.htm
江西普正制药有限公司峡江分公司,http://www.11467.com/qiye/93216802.htm
湖北李时珍文林制药有限公司,http://www.11467.com/qiye/93216803.htm
江苏朗科制药有限公司,http://www.11467.com/qiye/93216804.htm
西安天一秦昆制药有限责任公司铜川分公司,http://www.11467.com/qiye/93216810.htm
惠州华大生物科技有限公司,http://www.11467.com/huizhou/co/163439.htm
湖南海康仪器仪表有限公司,http://www.11467.com/changsha/co/18560.htm
上海罗技机械设备有限公司,http://www.11467.com/dingxi/co/8252.htm
宝鸡市普兰特生物工程有限公司,http://www.11467.com/baoji/co/16874.htm
吉林省华蔚生物科技有限公司,http://www.11467.com/changchun/co/71460.htm
浙江大东吴药业有限公司,http://www.11467.com/huzhou/co/47294.htm
沾益县益康中药饮片有限责任公司,http://www.11467.com/qujing/co/18130.htm
湖北立能浓缩机有限公司,http://www.11467.com/shiyan/co/28400.htm
山西中康伟业生物技术有限公司,http://www.11467.com/taiyuan/co/94862.htm
宁夏启元国药有限公司,http://www.11467.com/yinchuan/co/38959.htm
亳州市道庄药业有限公司,http://www.11467.com/bozhou/co/704.htm
河北康泰药业有限公司,http://www.11467.com/cangzhou/co/18857.htm
福建省闽东力捷迅药业有限公司,http://www.11467.com/fuzhou/co/139111.htm
西安蓝晶生物科技有限公司,http://www.11467.com/xian/co/58078.htm
浙江东来天然生物制品有限公司,http://www.11467.com/huzhou/co/48981.htm
常州万基干燥制粒设备有限公司,http://www.11467.com/changzhou/co/56126.htm
常州志邦电子科技有限公司,http://www.11467.com/changzhou/co/129475.htm
蕲春时珍本草科技有限公司,http://www.11467.com/huanggang/co/17927.htm
苏州世茂机电有限公司,http://www.11467.com/suzhou/co/261733.htm
郑州玉德医药科技有限公司,http://www.11467.com/zhengzhou/co/97328.htm
珠海市艺杰商贸有限公司,http://www.11467.com/zhuhai/co/89321.htm
珠海国佳高分子新材料有限公司,http://www.11467.com/zhuhai/co/69812.htm
江阴天江中医门诊部有限公司,http://www.11467.com/wuxi/co/239142.htm
南京澳润微波科技有限公司,http://www.11467.com/nanjing/co/50813.htm
盘锦森淼植物提取有限公司,http://www.11467.com/panjin/co/14516.htm
杭州晨希过滤机有限公司,http://www.11467.com/hangzhou/co/207870.htm
江西绿尔康医疗器械有限公司膏药加工部,http://www.11467.com/jian/co/18474.htm
广州市唐顿商贸有限公司,http://www.11467.com/guangzhou/co/496081.htm
西藏藏威康医药有限公司,http://www.11467.com/lasa/co/465.htm
诚信药业有限公司,http://www.11467.com/bozhou/co/10264.htm
安徽广印堂制药有限公司,http://www.11467.com/bozhou/co/8581.htm
昌吉市丽康源科工贸有限责任公司,http://www.11467.com/changji/co/9667.htm
湖北圣峰药业有限公司,http://www.11467.com/enshi/co/12961.htm
黑龙江省济仁药业有限公司,http://www.11467.com/chaoyang/co/26481.htm
河南省济源市济世药业有限公司,http://www.11467.com/jiaozuo/co/11524.htm
盛大投资公司,http://www.11467.com/lanzhou/co/72443.htm
陇南辉腾昌忠药材有限责任公司,http://www.11467.com/longnan/co/8223.htm
南通中港化学品有限公司,http://www.11467.com/nantong/co/111161.htm
浙江汇力胶囊有限公司,http://www.11467.com/shaoxing/co/119068.htm
深圳万和制药有限公司,http://www.11467.com/shenzhen/co/259774.htm
信阳市平桥区运鸿药材购销有限公司,http://www.11467.com/xinyang/co/20347.htm
宜昌市夜明珠天然植物制品有限责任公司,http://www.11467.com/yichang/co/37773.htm
吉林省抚松制药股份有限公司,http://www.11467.com/baishan/co/11113.htm
宝鸡向源中药饮片有限责任公司,http://www.11467.com/baoji/co/4101.htm
安徽环球药业股份有限公司,http://www.11467.com/bengbu/co/3946.htm
安徽省万生中药饮片有限公司公司销售部,http://www.11467.com/bozhou/co/10526.htm
安徽德馨香精香料有限公司,http://www.11467.com/bozhou/co/14463.htm
长春海外制药集团有限公司,http://www.11467.com/changchun/co/76754.htm
湖南今汉生物医药技术有限公司,http://www.11467.com/changsha/co/95645.htm
湖南春光九汇现代中药有限公司,http://www.11467.com/changsha/co/101485.htm
大连泛谷制药有限公司,http://www.11467.com/dalian/co/73904.htm
东莞市美泰生物科技有限公司,http://www.11467.com/dongguan/co/494991.htm
东营海福食品技术有限公司,http://www.11467.com/dongying/co/27224.htm
宁波杰顺生物科技有限公司市场部,http://www.11467.com/enshi/co/12297.htm
福州力为康医药技术有限公司,http://www.11467.com/fuzhou/co/139598.htm
黑龙江乌苏里江制药有限公司,http://www.11467.com/haerbin/co/60534.htm
河北金芳制药有限公司,http://www.11467.com/handan/co/68467.htm
湖南三九唯康药业有限公司,http://www.11467.com/hengyang/co/24985.htm
怀化市文理生物资源开发有限公司,http://www.11467.com/huaihua/co/12662.htm
浙江中法制药有限公司,http://www.11467.com/jiaxing/co/82772.htm
昆明奥深生物科技有限公司,http://www.11467.com/kunming/co/98986.htm
江苏恒瑞医药股份有限公司,http://www.11467.com/lianyungang/co/25864.htm
临汾宝珠制药有限公司,http://www.11467.com/linfen/co/9937.htm
山东启发药业有限公司,http://www.11467.com/linyi/co/58206.htm
洛阳顺势药业有限公司,http://www.11467.com/luoyang/co/17834.htm
山西康欣药业有限公司,http://www.11467.com/lvliang/co/1354.htm
四川一辰药业有限公司,http://www.11467.com/meishan/co/18041.htm
邵武市美菰林卫生用品有限公司,http://www.11467.com/nanping/co/19191.htm
南通天时药业有限公司,http://www.11467.com/nantong/co/113580.htm
沈阳华夷生发健发科技开发有限公司,http://www.11467.com/shenyang/co/70503.htm
深圳三九中医药投资发展有限公司,http://www.11467.com/shenzhen/co/2943.htm
石家庄利德尔动物药业有限公司,http://www.11467.com/shijiazhuang/co/104532.htm
石家庄正大鸿福牧业有限公司,http://www.11467.com/shijiazhuang/co/72015.htm
山西诺成制药有限公司,http://www.11467.com/shuozhou/co/8762.htm
四平市高斯达纳米材料设备有限公司,http://www.11467.com/siping/co/25897.htm
泰兴市瑞畅输送带制造有限公司-业务部,http://www.11467.com/taizhoushi/co/29920.htm
扬子江药业集团江苏海慈生物药业有限公司,http://www.11467.com/taizhoushi/co/34228.htm
泰州仁济中药饮片有限公司,http://www.11467.com/taizhoushi/co/25899.htm
唐山康神药业有限公司,http://www.11467.com/tangshan/co/63395.htm
铜陵凤丹种植科技开发有限责任公司,http://www.11467.com/tongling/co/13680.htm
咸阳萃纳贝每生物工程有限公司,http://www.11467.com/xianyang/co/21196.htm
烟台通元共和生物科技发展有限公司,http://www.11467.com/yantai/co/155620.htm
烟台鲁银药业有限公司,http://www.11467.com/yantai/co/7015.htm
湖南希尔天然药业有限公司,http://www.11467.com/yongzhou/co/15725.htm
遂溪县胜华生物原料有限公司,http://www.11467.com/zhanjiang/co/45220.htm
山东禹王制药有限公司,http://www.11467.com/dezhou/co/65365.htm
可复润（北京）生物科技有限公司,http://www.11467.com/qiye/27776078.htm
中天气体有限公司,http://www.11467.com/chongqing/co/204472.htm
亳州市普济堂药业有限公司,http://www.11467.com/bozhou/co/518.htm
亳州市药材总公司中药材购销站,http://www.11467.com/bozhou/co/923.htm
安徽致和堂药业有限公司,http://www.11467.com/bozhou/co/7663.htm
安徽致和堂药业有限公司(销售部),http://www.11467.com/bozhou/co/8748.htm
吉林省六福堂昌隆生化药业有限公司,http://www.11467.com/changchun/co/9563.htm
金烁商贸有限公司,http://www.11467.com/changchun/co/71563.htm
长沙普拉达电子科技有限公司,http://www.11467.com/changsha/co/112279.htm
长沙蕴茵生物科技有限公司植物提取物销售部,http://www.11467.com/changsha/co/101469.htm
潮州市泽润制药有限公司,http://www.11467.com/chaozhou/co/31560.htm
承德市神洲药业开发有限公司,http://www.11467.com/chengde/co/22157.htm
云南金碧制药有限公司,http://www.11467.com/chuxiong/co/3015.htm
云南大理祥龙药业有限责任公司,http://www.11467.com/dali/co/2313.htm
大连金盛精细化工有限公司,http://www.11467.com/dalian/co/60583.htm
海城信诺西尔矿业有限公司(销售部）,http://www.11467.com/dalian/co/35415.htm
大同市卫华药业有限责任公司,http://www.11467.com/datong/co/1727.htm
广汉市木子工艺品有限公司,http://www.11467.com/deyang/co/37962.htm
东莞市君胜净化科技有限公司,http://www.11467.com/dongguan/co/252883.htm
东莞市金植物生物工程有限公司,http://www.11467.com/dongguan/co/183497.htm
东莞雅派化妆品有限公司,http://www.11467.com/dongguan/co/491499.htm
江西宜春市强盛实业有限公司,http://www.11467.com/fangchenggang/co/6219.htm
广东省药材公司中药饮片厂,http://www.11467.com/foshan/co/31523.htm
广州梦丽生物科技有限公司,http://www.11467.com/guangzhou/co/491739.htm
广州特莱维生物科技有限公司,http://www.11467.com/guangzhou/co/480000.htm
广州粤丰动物保健有限公司,http://www.11467.com/guangzhou/co/324392.htm
归元中成药制品有限公司,http://www.11467.com/guangzhou/co/202898.htm
广州市秋实生物技术有限公司,http://www.11467.com/guangzhou/co/53782.htm
深圳佳泰药业有限公司,http://www.11467.com/guangzhou/co/200229.htm
哈尔滨乐泰药业有限公司提取分公司,http://www.11467.com/haerbin/co/15561.htm
北京世纪本草生物科技有限公司,http://www.11467.com/haerbin/co/60953.htm
富阳市三阳芦荟实验有限公司,http://www.11467.com/hangzhou/co/143121.htm
杭州创新生物检控技术有限公司,http://www.11467.com/hangzhou/co/148935.htm
陕西丰禾制药有限公司,http://www.11467.com/tongchuan/co/4054.htm
吉林天强制药有限公司,http://www.11467.com/tonghua/co/33029.htm
武汉枫叶红生物科技有限公司,http://www.11467.com/wuhan/co/20696.htm
陕西超群科技股份有限公司,http://www.11467.com/xian/co/29420.htm
西安创景生物科技有限公司,http://www.11467.com/xian/co/111882.htm
湖南飞鸽药业有限公司,http://www.11467.com/xiangtan/co/25106.htm
陕西奥星制药有限公司,http://www.11467.com/xianyang/co/449.htm
烟台市元生生物工程有限公司,http://www.11467.com/yantai/co/101034.htm
郑州豫密药业股份有限公司,http://www.11467.com/zhengzhou/co/44436.htm
舟山雷大电子科技有限公司,http://www.11467.com/zhoushan/co/17375.htm
山东世博金都药业有限公司,http://www.11467.com/zibo/co/79773.htm
天津新内田制药有限公司,http://www.11467.com/tianjin/co/132657.htm
菏泽九为置业有限公司,http://www.11467.com/heze/co/49322.htm
杏辉天力（杭州）药业有限公司,http://www.11467.com/hangzhou/co/213767.htm
杭州思进无纺布有限公司,http://www.11467.com/hangzhou/co/80064.htm
浙江大冢制药有限公司,http://www.11467.com/hangzhou/co/235357.htm
淮安市法雅生物制品工程有限公司,http://www.11467.com/huaian/co/26742.htm
黄冈市之和中药饮片有限公司,http://www.11467.com/huanggang/co/14760.htm
内蒙古宇航人药业有限责任公司,http://www.11467.com/huhehaote/co/21655.htm
湖州巴克生物科技有限公司,http://www.11467.com/huzhou/co/53279.htm
江西复真药业有限公司,http://www.11467.com/jian/co/16164.htm
广东百澳药业有限公司,http://www.11467.com/jiangmen/co/45208.htm
海宁维晶药用辅料技术开发有限公司,http://www.11467.com/jiaxing/co/116916.htm
广东粤龙药业有限公司,http://www.11467.com/jieyang/co/6808.htm
昆明市豪杰化工公司,http://www.11467.com/kunming/co/103393.htm
昆明魔力达生物科技有限公司,http://www.11467.com/kunming/co/92509.htm
连云港康茵美贸易有限公司,http://www.11467.com/lianyungang/co/43004.htm
山东康宁药业有限公司,http://www.11467.com/liaocheng/co/15630.htm
眉山鹏福进出口有限公司五部,http://www.11467.com/meishan/co/13495.htm
黑龙江绿草堂生物科技发展有限公司,http://www.11467.com/mudanjiang/co/47954.htm
江西奇而特生物技术有限公司,http://www.11467.com/nanchang/co/63504.htm
南京周怡伶中药美容连锁公司,http://www.11467.com/nanjing/co/90562.htm
南阳市艾鑫艾草生物制品有限公司,http://www.11467.com/nanyang/co/38191.htm
四川恒通动物制药有限公司,http://www.11467.com/neijiang/co/3294.htm
河南省濮阳豫龙生物科技有限公司,http://www.11467.com/puyang/co/20273.htm
广东在田药业有限公司,http://www.11467.com/qingyuan/co/223.htm
江西泽众制药有限公司,http://www.11467.com/shangrao/co/22004.htm
维康医药集团有限公司,http://www.11467.com/shenyang/co/56978.htm
深圳市诚信贸易有限公司,http://www.11467.com/shenzhen/co/593730.htm
华北制药集团北元有限公司,http://www.11467.com/shijiazhuang/co/57606.htm
华北制药(河北）神草有限公司,http://www.11467.com/shijiazhuang/co/83206.htm
石家庄津澳不锈钢管有限公司,http://www.11467.com/shijiazhuang/co/86580.htm
帅玮笛生化有限公司,http://www.11467.com/shijiazhuang/co/83392.htm
晋州市豪祥锌业有限公司,http://www.11467.com/shijiazhuang/co/139000.htm
石家庄岩峰医药科技有限公司销售2部,http://www.11467.com/shijiazhuang/co/83210.htm
苏州维朗医疗用品有限公司,http://www.11467.com/suzhou/co/269399.htm
苏州优越科技有限公司,http://www.11467.com/suzhou/co/220300.htm
上海古迪电子设备有限公司,http://www.11467.com/suzhou/co/269398.htm
山西阳林进出口贸易有限公司,http://www.11467.com/taiyuan/co/99814.htm
陕西方舟制药有限公司,http://www.11467.com/tongchuan/co/3119.htm
通化东圣药业股份有限公司,http://www.11467.com/tonghua/co/12007.htm
武汉兵兵药业有限公司,http://www.11467.com/wuhan/co/57417.htm
芜湖德邦机电有限公司,http://www.11467.com/wuhu/co/22879.htm
江苏四环生物股份有限公司,http://www.11467.com/wuxi/co/114110.htm
无锡千禧百惠超微粉体有限公司,http://www.11467.com/wuxi/co/182580.htm
无锡昌恩科技发展有限公司,http://www.11467.com/wuxi/co/184769.htm
南京普研药业技术有限公司,http://www.11467.com/wuxi/co/182911.htm
厦门朝阳生物工程有限公司,http://www.11467.com/xiamen/co/88667.htm
陕西宏达植物化工有限公司市场销售部门,http://www.11467.com/xian/co/76191.htm
宝鸡市方晟生物开发有限公司西安销售部,http://www.11467.com/xian/co/58877.htm
石家庄玉芝种植牙公司,http://www.11467.com/shijiazhuang/co/108900.htm
大连海云建材有限公司,http://www.11467.com/dalian/co/51548.htm
佛山市巴莱贸易有限公司,http://www.11467.com/foshan/co/283637.htm
福州美新源贸易有限公司,http://www.11467.com/fuzhou/co/174186.htm
安远县康博生物科技开发有限公司,http://www.11467.com/ganzhou/co/17541.htm
江西天海药业股份有限公司营销中心,http://www.11467.com/guangzhou/co/199359.htm
三兄弟有限公司,http://www.11467.com/guangzhou/co/122862.htm
贵州万顺堂药业有限公司商务部,http://www.11467.com/guiyang/co/70106.htm
贵州济美保健有限公司,http://www.11467.com/guiyang/co/50198.htm
贵州银信实业有限公司,http://www.11467.com/guiyang/co/73426.htm
安徽科兴医药科技有限公司,http://www.11467.com/hefei/co/86619.htm
