北京汇金堂科技发展有限公司销售部,http://www.11467.com/beijing/co/650556.htm
北京一平天下生物科技有限公司膏药布膏药贴部,http://www.11467.com/beijing/co/215107.htm
北京一平天下生物科技有限公司采购部,http://www.11467.com/beijing/co/215276.htm
北京一平天下生物科技有限公司,http://www.11467.com/beijing/co/215106.htm
北京维德尔生物科技有限公司,http://www.11467.com/beijing/co/215111.htm
北京星辰万有科技有限公司销售部,http://www.11467.com/beijing/co/397285.htm
北京源生素源生物科技有限公司,http://www.11467.com/beijing/co/13651.htm
北京蓝贝望医药科技开发有限公司,http://www.11467.com/beijing/co/397287.htm
湖南康鑫医药有限公司,http://www.11467.com/beijing/co/95771.htm
河北华加胶囊有限公司驻北京办事处,http://www.11467.com/beijing/co/397508.htm
杭州天诚药业有限公司北京办事处,http://www.11467.com/beijing/co/319676.htm
盛世嘉年生物科技有限公司,http://www.11467.com/beijing/co/215354.htm
石家庄以岭药业有限公司采购部,http://www.11467.com/beijing/co/215154.htm
迪沙药业集团北京迪沙生物制品有限公司,http://www.11467.com/beijing/co/221262.htm
北京一平天下生物科技有限公司国际部,http://www.11467.com/beijing/co/221347.htm
淄博华龙制药有限公司,http://www.11467.com/beijing/co/117544.htm
万全药业集团（中国）有限公司,http://www.11467.com/beijing/co/397558.htm
北京世纪亘健科技有限公司,http://www.11467.com/beijing/co/29229.htm
焦作市绿洲怀药生物科技有限公司北京分公司,http://www.11467.com/beijing/co/251468.htm
联欧美技术开发公司,http://www.11467.com/beijing/co/652731.htm
北京正大天成科技有限公司,http://www.11467.com/beijing/co/385046.htm
华新精细化学品公司产品开发部,http://www.11467.com/shanghai/co/943113.htm
江西远东药业有限公司-上海事业部,http://www.11467.com/shanghai/co/211702.htm
江苏省宜兴市紫云商贸有限公司,http://www.11467.com/shanghai/co/973216.htm
上海莱辉生物制品有限公司,http://www.11467.com/shanghai/co/484151.htm
安徽松瑞制药有限公司上海办事处,http://www.11467.com/shanghai/co/662858.htm
上海丽珠制药有限公司,http://www.11467.com/shanghai/co/596947.htm
上海鸿彬保健品有限公司,http://www.11467.com/shanghai/co/245458.htm
派格生物医药（苏州）有限公司,http://www.11467.com/shanghai/co/663230.htm
安徽金寨乔康药业有限公司,http://www.11467.com/shanghai/co/508268.htm
上海华济药业有限公司 质量管理部,http://www.11467.com/shanghai/co/892142.htm
上海普华生物科技有限公司,http://www.11467.com/shanghai/co/662857.htm
上海林叶生物科技有限公司,http://www.11467.com/shanghai/co/892130.htm
上海华光实业发展有限公司,http://www.11467.com/shanghai/co/313961.htm
上海微丸医药开发有限公司（贸易部）,http://www.11467.com/shanghai/co/663430.htm
郑州民安商贸有限公司,http://www.11467.com/shanghai/co/662726.htm
上海玉安药业有限公司,http://www.11467.com/shanghai/co/596529.htm
上海应佳工贸有限公司工业管路事业部,http://www.11467.com/shanghai/co/679878.htm
天津汉普森药业有限公司-生产供应,http://www.11467.com/tianjin/co/139712.htm
天津世济生物工程有限公司,http://www.11467.com/tianjin/co/92529.htm
天津市兆士德保健用品销售有限公司,http://www.11467.com/tianjin/co/35231.htm
重庆陪都股份有限公司,http://www.11467.com/chongqing/co/98739.htm
重庆华立药业股份有限公司市场部,http://www.11467.com/chongqing/co/13266.htm
重庆知木坊工艺品有限公司,http://www.11467.com/chongqing/co/13692.htm
天津檀香堂商贸有限公司,http://www.11467.com/tianjin/co/302420.htm
上海有吉医药化工有限公司,http://www.11467.com/shanghai/co/1095640.htm
英赛德德集团信息有限公司,http://www.11467.com/tianjin/co/304496.htm
天津挚信鸿达医疗器械开发有限公司,http://www.11467.com/tianjin/co/307443.htm
天津中新药业集团股份有限公司中新制药厂,http://www.11467.com/tianjin/co/309024.htm
天津百康医药科技有限公司,http://www.11467.com/tianjin/co/309027.htm
哈尔滨乐龄医药技术开发有限公司,http://www.11467.com/haerbin/co/75517.htm
齐河县安泰单采血浆有限公司,http://www.11467.com/dezhou/co/71587.htm
深圳市叁捌贸易发展有限公司,http://www.11467.com/shenzhen/co/1108290.htm
北京赛孚制药股份有限公司,http://www.11467.com/qiye/29352438.htm
惠氏制药有限公司北京分公司,http://www.11467.com/qiye/29496502.htm
安徽普洛康裕制药有限公司,http://www.11467.com/qiye/29581401.htm
合肥安德生制药有限公司,http://www.11467.com/qiye/29614115.htm
马鞍山丰原制药有限公司,http://www.11467.com/qiye/29626037.htm
北京佑众全椒制药有限公司,http://www.11467.com/qiye/29643963.htm
安徽万和制药有限公司,http://www.11467.com/qiye/29655325.htm
安徽墨药制药股份有限公司,http://www.11467.com/qiye/29749752.htm
山东国和堂制药有限公司,http://www.11467.com/qiye/92888048.htm
昆明斛之梦制药有限公司,http://www.11467.com/qiye/93244773.htm
上海旭康科技有限公司,http://www.11467.com/dongguan/co/191022.htm
秋实医药化工有限公司,http://www.11467.com/dongying/co/27939.htm
佛山市巴莱贸易有限公司,http://www.11467.com/foshan/co/283637.htm
佛山市怡创生化科技有限公司营销部,http://www.11467.com/foshan/co/209584.htm
广东一片天制药有限公司,http://www.11467.com/foshan/co/263097.htm
辽宁康泰药业有限公司,http://www.11467.com/fuxin/co/16309.htm
福州博立医药科技有限公司,http://www.11467.com/fuzhou/co/139795.htm
福建济之源科技发展有限公司,http://www.11467.com/fuzhou/co/149748.htm
重庆天海公司,http://www.11467.com/fuzhou/co/139397.htm
珍视明药业有限公司,http://www.11467.com/fuzhoushi/co/16000.htm
安远县康博生物科技开发有限公司,http://www.11467.com/ganzhou/co/17541.htm
白云山产品营销有限公司,http://www.11467.com/guangzhou/co/323775.htm
广东同德药业有限公司(广州办事处),http://www.11467.com/guangzhou/co/204477.htm
广东利明药材有限公司,http://www.11467.com/guangzhou/co/200094.htm
广州汉方现代中药研究开发有限公司市场拓展,http://www.11467.com/guangzhou/co/205424.htm
广州汉方现代中药研究开发有限公司(市场部),http://www.11467.com/guangzhou/co/203835.htm
广东美好制药有限公司事业部,http://www.11467.com/guangzhou/co/203952.htm
广州汉方现代中药研究开发有限公司市场拓展部,http://www.11467.com/guangzhou/co/325703.htm
广州汇美健康用品有限公司,http://www.11467.com/guangzhou/co/197621.htm
广州利士诺丹生物科技有限公司(商务部),http://www.11467.com/guangzhou/co/205493.htm
广州汉方现代中药研究开发有限公司制剂室,http://www.11467.com/guangzhou/co/200849.htm
广州创美生物科技有限公司,http://www.11467.com/guangzhou/co/430467.htm
广州市贝奇制药有限公司,http://www.11467.com/guangzhou/co/323736.htm
广州市美誉度化妆品生物科技公司,http://www.11467.com/guangzhou/co/324398.htm
江西天海药业股份有限公司营销中心,http://www.11467.com/guangzhou/co/199359.htm
广州生物科技有限公司,http://www.11467.com/guangzhou/co/324994.htm
广州振兴实业有限责任公司,http://www.11467.com/guangzhou/co/202020.htm
梦里睡乡中草药枕有限公司,http://www.11467.com/guangzhou/co/198165.htm
三兄弟有限公司,http://www.11467.com/guangzhou/co/122862.htm
军企药业有限公司,http://www.11467.com/guangzhou/co/200696.htm
桂林莱茵生物科技股份有限公司 市场一部,http://www.11467.com/guilin/co/42784.htm
贵州正鑫药业有限责任公司,http://www.11467.com/guiyang/co/73400.htm
广东康力医药有限公司贵阳分公司,http://www.11467.com/guiyang/co/73415.htm
贵州朝歌建鸿制药有限公司,http://www.11467.com/guiyang/co/35026.htm
贵州东伟药业有限公司,http://www.11467.com/guiyang/co/35398.htm
贵州万顺堂药业有限公司商务部,http://www.11467.com/guiyang/co/70106.htm
贵州济美保健有限公司,http://www.11467.com/guiyang/co/50198.htm
贵阳博华贸易投资有限公司,http://www.11467.com/guiyang/co/70163.htm
贵州银信实业有限公司,http://www.11467.com/guiyang/co/73426.htm
广东康力医药有限公司贵州分公司,http://www.11467.com/guiyang/co/70193.htm
黑龙江鑫威格药业公司,http://www.11467.com/haerbin/co/45870.htm
黑龙江地王医药股份有限公司,http://www.11467.com/haerbin/co/24920.htm
哈尔滨天地仁公司,http://www.11467.com/haerbin/co/45872.htm
哈尔滨天木药业股份有限公司,http://www.11467.com/haerbin/co/45981.htm
黑龙江天宏药业有限公司物资部,http://www.11467.com/haerbin/co/46163.htm
杭州埃诺公司（销售部）,http://www.11467.com/hangzhou/co/272635.htm
香港草之缘日化股份有限公司销售,http://www.11467.com/hangzhou/co/234792.htm
杭州天龙植物萃取有限公司,http://www.11467.com/hangzhou/co/159809.htm
新奥医药信息咨询公司,http://www.11467.com/hangzhou/co/234537.htm
杭州舒元医药科技有限公司,http://www.11467.com/hangzhou/co/272591.htm
汉中愛诺动物药品有限公司,http://www.11467.com/hanzhong/co/22040.htm
安徽省股份有限公司,http://www.11467.com/hefei/co/86385.htm
合肥九通生物科技公司,http://www.11467.com/hefei/co/86586.htm
中人科技公司,http://www.11467.com/hefei/co/86479.htm
安徽高翔投资管理公司,http://www.11467.com/hefei/co/86441.htm
安徽科兴医药科技有限公司,http://www.11467.com/hefei/co/86619.htm
安天生物技术服务有限责任公司,http://www.11467.com/hefei/co/82346.htm
河源澳源生物科技有限公司,http://www.11467.com/heyuan/co/14170.htm
山东天草药业有限公司业务部,http://www.11467.com/heze/co/19672.htm
山东神州制药有限公司,http://www.11467.com/heze/co/19665.htm
黄冈市恒兴源化工有限责任公司,http://www.11467.com/huanggang/co/14671.htm
黄山云川生物工程有限公司,http://www.11467.com/huangshan/co/12663.htm
黄山新医药业有限公司(供应),http://www.11467.com/huangshan/co/12666.htm
福建省绿冬生物技术有限公司,http://www.11467.com/huhehaote/co/26690.htm
内蒙古惠丰药业有限公司(商务部),http://www.11467.com/huhehaote/co/26701.htm
惠州大亚湾澳珍药业有限公司,http://www.11467.com/huizhou/co/5663.htm
湖州天添福生物有限公司,http://www.11467.com/huzhou/co/51813.htm
江西天和药业有限公司,http://www.11467.com/jian/co/15635.htm
江门市外用制剂有限公司,http://www.11467.com/jiangmen/co/86107.htm
吉林省华龙微生物控制技术研究所有限公司,http://www.11467.com/jilinshi/co/3667.htm
济南宝嗓子生物科技有限公司,http://www.11467.com/jinan/co/75557.htm
济南康百科技有限公司,http://www.11467.com/jinan/co/75647.htm
山东明仁福瑞达制药有限公司,http://www.11467.com/jinan/co/75104.htm
山东山大康诺制药有限公司原料,http://www.11467.com/jinan/co/95616.htm
济南信和缘科技有限公司,http://www.11467.com/jinan/co/114100.htm
中国济南贝尔特生物制品有限公司,http://www.11467.com/jinan/co/95381.htm
山东宝来利来生物制药（光明）有限公司,http://www.11467.com/jinan/co/68513.htm
济南贝尔特生物制品有限公司,http://www.11467.com/jinan/co/95386.htm
济南明圣制药技术有限公司研发部,http://www.11467.com/jinan/co/75439.htm
山东脉迪商贸有限公司市场部,http://www.11467.com/jinan/co/74981.htm
山东康美源医药科技有限公司,http://www.11467.com/jinan/co/75185.htm
济南赢联投资咨询有限公司,http://www.11467.com/jinan/co/75630.htm
金华明珠制药有限公司,http://www.11467.com/jinhua/co/71567.htm
宝利旅游用品公司,http://www.11467.com/jinhua/co/78000.htm
山东雷丰药业有限公司,http://www.11467.com/jining/co/47719.htm
济宁市安康制药有限责任公司（总部）,http://www.11467.com/jining/co/47853.htm
华奥基因诊断有限公司,http://www.11467.com/shenzhen/co/150915.htm
深圳可可有限公司,http://www.11467.com/shenzhen/co/595081.htm
深圳绿诗源生物技术有限公司 客服/销售,http://www.11467.com/shenzhen/co/596232.htm
深圳市九华华源生物药业有限公司,http://www.11467.com/shenzhen/co/266421.htm
深圳市亨哈生物工程有限公司,http://www.11467.com/shenzhen/co/258804.htm
深圳市凤凰生活科技有限公司,http://www.11467.com/shenzhen/co/219095.htm
天竺生物科技（深圳）有限公司,http://www.11467.com/shenzhen/co/264301.htm
永达医药贸易公司,http://www.11467.com/shenzhen/co/594304.htm
深圳市星星药业有限公司,http://www.11467.com/shenzhen/co/261355.htm
深圳益康源保健品有限公司,http://www.11467.com/shenzhen/co/596164.htm
河北威远动物药业有限公司 销售部,http://www.11467.com/shijiazhuang/co/83231.htm
河北省常山生化药业有限公司,http://www.11467.com/shijiazhuang/co/83256.htm
石家庄四药股份有限公司,http://www.11467.com/shijiazhuang/co/83427.htm
石家庄市爱家消杀有限公司,http://www.11467.com/shijiazhuang/co/78326.htm
河北柏奇药业有限公司销售部,http://www.11467.com/shijiazhuang/co/83380.htm
赞皇县泽凡商贸有限公司,http://www.11467.com/shijiazhuang/co/160957.htm
石家庄市爱默尔贸易有限公司,http://www.11467.com/shijiazhuang/co/83478.htm
四平埃默药业有限公司,http://www.11467.com/siping/co/4839.htm
黑龙江绥化生物制剂有限公司,http://www.11467.com/suihua/co/14244.htm
华宏仪表（苏州）有限公司,http://www.11467.com/suzhou/co/230364.htm
苏州佳洁空气过滤器有限公司,http://www.11467.com/suzhou/co/204218.htm
苏州排头兵药业有限公司,http://www.11467.com/suzhou/co/217676.htm
山东某制药有限公司,http://www.11467.com/taian/co/35676.htm
山西青云宏科工贸有限公司,http://www.11467.com/taiyuan/co/99829.htm
浙江济民制药有限公司,http://www.11467.com/taizhou/co/5832.htm
泰州恒鑫医用敷料有限公司销售公司,http://www.11467.com/taizhoushi/co/27936.htm
吉林巨仁堂药业股份有限公司,http://www.11467.com/tonghua/co/6194.htm
山东潍坊盛宏医药科技有限公司,http://www.11467.com/weifang/co/81752.htm
潍坊舒一集团有限公司,http://www.11467.com/weifang/co/60616.htm
陕西兴海生物科技有限公司,http://www.11467.com/weinan/co/23340.htm
温州弘景生物科技开发有限公司,http://www.11467.com/wenzhou/co/134771.htm
湖北吉达药业有限公司,http://www.11467.com/wuhan/co/68241.htm
邓功制药君寿堂医药有限公司,http://www.11467.com/wuhan/co/68668.htm
湖北潜江制药股份有限公司 招商部,http://www.11467.com/wuhan/co/68578.htm
湖北百里香生物医药科技有限公司,http://www.11467.com/wuhan/co/68833.htm
武汉金田高科技发展有限公司,http://www.11467.com/wuhan/co/68046.htm
湖北俊辉药业有限公司,http://www.11467.com/wuhan/co/91221.htm
虎泉药业有限公司,http://www.11467.com/wuhan/co/91290.htm
武汉楚冠医疗科技有限公司,http://www.11467.com/wuhan/co/34616.htm
武汉市新洲区天马贸易有限公司,http://www.11467.com/wuhan/co/67949.htm
静安服务公司,http://www.11467.com/wuhu/co/21497.htm
新疆欣宇药业有限公司,http://www.11467.com/wulumuqi/co/94705.htm
雪莲维药公司,http://www.11467.com/wulumuqi/co/90931.htm
彩虹防伪科技有限公司,http://www.11467.com/xiamen/co/39569.htm
厦门艾帝儿医药公司,http://www.11467.com/xiamen/co/39215.htm
厦门市王焕妙工贸有限公司,http://www.11467.com/xiamen/co/38424.htm
厦门天舜制药有限公司,http://www.11467.com/xiamen/co/38291.htm
陕西皓林生物医药有限公司,http://www.11467.com/xian/co/58249.htm
陕西禾博天然产物公司,http://www.11467.com/xian/co/76086.htm
西安飞达生物技术有限公司（外贸部）,http://www.11467.com/xian/co/76130.htm
陕西春辉生态药物科技培植开发有限公司,http://www.11467.com/xian/co/58217.htm
陕西鸿金成生物科技有限公司,http://www.11467.com/xian/co/58698.htm
西安合邦生物科技有限公司,http://www.11467.com/xian/co/127606.htm
陕西华昌生物工程有限公司商务,http://www.11467.com/xian/co/58500.htm
陕西华宇生物技术有限公司,http://www.11467.com/xian/co/76133.htm
化学科技公司,http://www.11467.com/xian/co/58683.htm
陕西雨茂制药有限公司,http://www.11467.com/xian/co/89898.htm
西安俏丽升生物科技有限公司1,http://www.11467.com/xian/co/58421.htm
西安海澳生物有限公司,http://www.11467.com/xian/co/58520.htm
陕西少华山生物科技有限公司（市场1部）,http://www.11467.com/xian/co/58499.htm
陕西众邦药业科技有限公司国际业务部,http://www.11467.com/xian/co/58690.htm
汇生医药公司,http://www.11467.com/xian/co/58858.htm
玉叶养生保健品有限责任公司,http://www.11467.com/xian/co/58190.htm
西安俏丽升生物科技有限公司,http://www.11467.com/xian/co/58049.htm
汉中天然谷生物技术有限公司,http://www.11467.com/xian/co/76187.htm
西安金瑞有限公司,http://www.11467.com/xian/co/58213.htm
西安锐源生物科技有限公司销售部,http://www.11467.com/xian/co/58887.htm
西安原生植物工程技术有限公司业务部,http://www.11467.com/xian/co/76289.htm
西安世纪制冷工程公司,http://www.11467.com/xian/co/58375.htm
海欣庆华医药化工有限公司,http://www.11467.com/xian/co/76184.htm
西安斯强保健品公司,http://www.11467.com/xian/co/58941.htm
陕西容厦药业股份有限公司,http://www.11467.com/xian/co/58945.htm
襄阳万里科技开发有限公司,http://www.11467.com/xiangfan/co/26730.htm
华中药业有限公司,http://www.11467.com/xiangfan/co/36890.htm
湖北华中药业有限公司-市场部,http://www.11467.com/xiangfan/co/36911.htm
咸阳萃纳贝每生物工程有限公司网络销售部,http://www.11467.com/xianyang/co/21231.htm
青海央宗药业有限公司,http://www.11467.com/xining/co/4883.htm
邢台华龙金属网有限公司,http://www.11467.com/xintai/co/32521.htm
新乡市百业振动设备有限公司,http://www.11467.com/xinxiang/co/19614.htm
精方药业股份有限公司,http://www.11467.com/xuancheng/co/20287.htm
兴化市美全科技有限公司,http://www.11467.com/yangzhou/co/56203.htm
扬州中惠制药有限公司,http://www.11467.com/yangzhou/co/30804.htm
扬州市龙王阁制药有限公司,http://www.11467.com/yangzhou/co/79521.htm
烟台华润医药化工有限公司,http://www.11467.com/yantai/co/136355.htm
烟台洁净有害生物防治有限公司,http://www.11467.com/yantai/co/122157.htm
烟台天乐生物科技有限公司,http://www.11467.com/yantai/co/122144.htm
湖北省八峰药化股份有限公司宜昌分公司,http://www.11467.com/yichang/co/27979.htm
湖北八峰药化有限责任公司宜昌分公司,http://www.11467.com/yichang/co/44305.htm
湖北八峰药化股份有限公司宜昌分公司,http://www.11467.com/yichang/co/44274.htm
银川市万通工贸有限公司,http://www.11467.com/yinchuan/co/22339.htm
宁夏天景山草业发展有限公司,http://www.11467.com/yinchuan/co/39003.htm
双牌县金蕊实业有限责任公司,http://www.11467.com/yongzhou/co/10080.htm
湖南省永州市聚隆高科技药业有限公司,http://www.11467.com/yongzhou/co/16311.htm
广西玉林市陌莹中药饮片有限公司（销售部）,http://www.11467.com/yulin/co/17935.htm
玉溪市汝智美容有限公司,http://www.11467.com/yuxi/co/507.htm
百纳生物科技（漳州）有限公司,http://www.11467.com/zhangzhou/co/51335.htm
湛江市金福康有限公司,http://www.11467.com/zhanjiang/co/24253.htm
河南永春医药科技有限公司,http://www.11467.com/zhengzhou/co/125603.htm
君利生物科技公司,http://www.11467.com/zhengzhou/co/125719.htm
河南天方医药有限责任公司,http://www.11467.com/zhengzhou/co/106089.htm
河南海内动物药业有限公司,http://www.11467.com/zhengzhou/co/125611.htm
河南佰特药业有限公司,http://www.11467.com/zhengzhou/co/106429.htm
河南新感觉兽药有限公司,http://www.11467.com/zhengzhou/co/106192.htm
上海全宇宏锐动物药业有限公司,http://www.11467.com/zhengzhou/co/105919.htm
康莱特生物科技有限公司,http://www.11467.com/zhengzhou/co/106430.htm
郑州正达医疗科技有限公司,http://www.11467.com/zhengzhou/co/125793.htm
昊宁制药有限公司,http://www.11467.com/zhengzhou/co/106301.htm
河南省华龙药业有限公司(电子商务部),http://www.11467.com/zhengzhou/co/125635.htm
郑州劲牛动物保健品有限公司,http://www.11467.com/zhengzhou/co/105928.htm
鼎盛生物医药有限公司,http://www.11467.com/zhengzhou/co/106277.htm
广寿保健品有限公司,http://www.11467.com/zhengzhou/co/172612.htm
河南普诺生物有限公司,http://www.11467.com/zhengzhou/co/106555.htm
郑州泰仁生物科技有限公司,http://www.11467.com/zhengzhou/co/106395.htm
河南康惠生物科技有限公司,http://www.11467.com/zhengzhou/co/125706.htm
郑州博灵贸易有限责任公司,http://www.11467.com/zhengzhou/co/105825.htm
郑州康琦药业有限公司,http://www.11467.com/zhengzhou/co/106448.htm
湖北金色田野动物药业有限公司,http://www.11467.com/zhengzhou/co/125726.htm
郑州吉利医药保健品有限公司,http://www.11467.com/zhengzhou/co/106499.htm
郑州今日动物药品有限公司,http://www.11467.com/zhengzhou/co/6875.htm
郑州帝诺科技有限公司,http://www.11467.com/zhengzhou/co/106569.htm
郑州市报恩堂生物科技有限公司,http://www.11467.com/zhengzhou/co/105911.htm
珠海制药联邦股份有限公司中山分公司,http://www.11467.com/zhongshan/co/101082.htm
珠海金鸿药业有限公司,http://www.11467.com/zhuhai/co/69972.htm
珠海国佳高分子新材料有限公司(销售部),http://www.11467.com/zhuhai/co/70125.htm
珠海嘉伦药业集团有限公司,http://www.11467.com/zhuhai/co/70070.htm
珠海海瑞德生物科技有限公司(采购部）,http://www.11467.com/zhuhai/co/69954.htm
珠海正太制药有限公司市场部,http://www.11467.com/zhuhai/co/70347.htm
珠海和正堂保健按摩有限公司,http://www.11467.com/zhuhai/co/95925.htm
山东齐都药业有限公司生物中心,http://www.11467.com/zibo/co/71295.htm
淄博昊威兽药有限公司业务部,http://www.11467.com/zibo/co/71367.htm
淄博利源高科辐照技术有限公司,http://www.11467.com/zibo/co/71143.htm
自贡市丛林绿色产业有限公司,http://www.11467.com/zigong/co/16166.htm
北京本草中药有限公司,http://www.11467.com/beijing/co/672935.htm
北京安宁科亚有限公司,http://www.11467.com/beijing/co/397196.htm
北京富元永兴制药有限公司,http://www.11467.com/beijing/co/619917.htm
北京国宗医药科技发展有限公司,http://www.11467.com/beijing/co/117387.htm
北京博鑫锐思生物化学实验室技术有限公司,http://www.11467.com/beijing/co/419184.htm
北京金百康医药科技有限公司,http://www.11467.com/beijing/co/308818.htm
北京东华阳光医药科技有限公司,http://www.11467.com/beijing/co/672926.htm
北京翰林苑时代科技有限公司,http://www.11467.com/beijing/co/117417.htm
北京百慧生化制药有限责任公司,http://www.11467.com/beijing/co/281783.htm
北京宏宇时代科技有限公司销售部,http://www.11467.com/beijing/co/250011.htm
北京卡利得技术发展有限责任公司业务部,http://www.11467.com/beijing/co/308700.htm
北京赛特瑞科技发展有限公司生产销售部,http://www.11467.com/beijing/co/397401.htm
北京金蜂蜂业有限公司国际贸易部,http://www.11467.com/beijing/co/671367.htm
北京娜尔生物技术有限公司办公室,http://www.11467.com/beijing/co/397355.htm
北京华夏康桥生物技术有限公司,http://www.11467.com/beijing/co/117571.htm
北京普仁鸿医药销售有限公司,http://www.11467.com/beijing/co/95292.htm
北京燕京药业有限公司,http://www.11467.com/beijing/co/95438.htm
北京悦康源通医药有限公司,http://www.11467.com/beijing/co/419336.htm
北京天玺宝科技有限公司,http://www.11467.com/beijing/co/221397.htm
贵州省华鹰化学工业有限责任公司北京销售分公司,http://www.11467.com/beijing/co/562619.htm
北京益佰阳光科技有限公司,http://www.11467.com/beijing/co/117415.htm
北京轩岐医药科技有限公司 营销部,http://www.11467.com/beijing/co/117275.htm
双鹤药业公司,http://www.11467.com/beijing/co/95706.htm
北京众生平安医药有限公司,http://www.11467.com/beijing/co/94991.htm
张家口圣大药业有限公司,http://www.11467.com/beijing/co/397185.htm
北京阔利达工贸有限公司销售部,http://www.11467.com/beijing/co/686200.htm
法国雅芙（中国）生物制品有限公司,http://www.11467.com/beijing/co/215132.htm
上海拜耳科生物科技有限公司,http://www.11467.com/shanghai/co/936447.htm
上海富电国际贸易有限公司（销售部）,http://www.11467.com/shanghai/co/679912.htm
上海弘昊化工有限公司,http://www.11467.com/shanghai/co/679857.htm
上海亿德实业有限公司,http://www.11467.com/shanghai/co/424816.htm
众恒国际有限公司,http://www.11467.com/shanghai/co/971991.htm
上海泽荟化妆品有限公司销售部,http://www.11467.com/shanghai/co/83975.htm
上海振兴发展有限公司,http://www.11467.com/shanghai/co/246692.htm
