杭州中香化学有限公司,http://www.11467.com/hangzhou/co/289765.htm
浙江温州雁荡公司,http://www.11467.com/hangzhou/co/287648.htm
浙江恒昌远大商贸有限公司,http://www.11467.com/hangzhou/co/199558.htm
浙江嘉合医药化工有限公司,http://www.11467.com/hangzhou/co/289671.htm
杭州瑞江化工有限公司 进口部,http://www.11467.com/hangzhou/co/220650.htm
安徽省华润盐业发展有限公司,http://www.11467.com/hefei/co/98628.htm
安徽德威富香精工业有限公司,http://www.11467.com/hefei/co/98407.htm
合肥方舟远洋食品配料有限公司,http://www.11467.com/hefei/co/98467.htm
合肥华宇食品原料有限公司,http://www.11467.com/hefei/co/99204.htm
合肥永宝食品有限公司,http://www.11467.com/hefei/co/98990.htm
苏州恒泰食品有限责任公司,http://www.11467.com/hefei/co/98533.htm
安徽凤凰商贸有限公司,http://www.11467.com/hefei/co/99245.htm
安徽凯博贸易公司/雷雨农副产品加工厂,http://www.11467.com/hefei/co/98459.htm
衡水华鼎油脂化学有限公司,http://www.11467.com/hengshui/co/24098.htm
河北冀州华恒生物科技有限公司,http://www.11467.com/hengshui/co/34465.htm
衡水科鑫精细化学有限公司销售部,http://www.11467.com/hengshui/co/24110.htm
河北鑫淼创业食品机械公司,http://www.11467.com/hengshui/co/24213.htm
衡水隆泰香精香料有限公司,http://www.11467.com/hengshui/co/24239.htm
冀州市华阳化工有限责任公司1,http://www.11467.com/hengshui/co/24077.htm
湖南裕华化工集团有限公司（外贸部）,http://www.11467.com/hengyang/co/27303.htm
雄伟投资公司,http://www.11467.com/hengyang/co/27313.htm
山东菏泽方明制药有限公司,http://www.11467.com/heze/co/21879.htm
山东天久生物技术公司,http://www.11467.com/heze/co/22294.htm
山东健宇生物科技有限公司东明分公司,http://www.11467.com/heze/co/22171.htm
菏泽佳佳乐食品有限公司,http://www.11467.com/heze/co/21956.htm
中食都庆（山东）生物技术有限公司 销售部,http://www.11467.com/heze/co/21872.htm
淮安市亚太化工有限公司,http://www.11467.com/huaian/co/39657.htm
淮安东江保鲜剂有限公司,http://www.11467.com/huaian/co/39438.htm
淮安市盛宇香料有限公司,http://www.11467.com/huaian/co/39720.htm
江苏诚意药业有限公司,http://www.11467.com/huaian/co/39549.htm
湖南利农科贸有限公司,http://www.11467.com/huaihua/co/20741.htm
淮南亿万达（集团）有限责任公司千里纤维素厂,http://www.11467.com/huainan/co/16273.htm
湖北同源甜味制品有限责任公司,http://www.11467.com/huanggang/co/17719.htm
黄冈市华阳生化有限公司,http://www.11467.com/huanggang/co/17736.htm
麻城天安化工纳米材料有限公司,http://www.11467.com/huanggang/co/17692.htm
惠州芳帝食品添加剂有限公司,http://www.11467.com/huizhou/co/1600.htm
惠州达尔生物技术有限公司,http://www.11467.com/huizhou/co/78146.htm
惠州意尔生物技术有限公司,http://www.11467.com/huizhou/co/78145.htm
惠州市百利兰生物技术有限公司,http://www.11467.com/huizhou/co/77657.htm
葫芦岛茂华生物有限责任公司,http://www.11467.com/huludao/co/45876.htm
湖州巴克生物科技有限公司销售部,http://www.11467.com/huzhou/co/53054.htm
浙江金陵药材开发有限公司（销售）,http://www.11467.com/huzhou/co/52992.htm
湖州荣凯植物提取有限公司(销售中心）,http://www.11467.com/huzhou/co/53008.htm
庆达化工股份有限公司,http://www.11467.com/huzhou/co/53024.htm
金陵药业浙江金陵药材开发有限公司,http://www.11467.com/huzhou/co/53101.htm
湖州市菱湖新望化学有限公司(销售部),http://www.11467.com/huzhou/co/53199.htm
浙江大为生物化学有限公司贸易部,http://www.11467.com/huzhou/co/52931.htm
闻名食品化工经销公司,http://www.11467.com/jiamusi/co/33805.htm
广东江门甲木食品化工有限公司,http://www.11467.com/jiangmen/co/98864.htm
广东江门生物技术开发中心有限公司,http://www.11467.com/jiangmen/co/31405.htm
江门科隆生物技术股份有限公司（供销部）,http://www.11467.com/jiangmen/co/98519.htm
高达食品公司,http://www.11467.com/jiangmen/co/98402.htm
广东江门市森普林有限公司,http://www.11467.com/jiangmen/co/98345.htm
江门市晶菱制冷实业有限公司,http://www.11467.com/jiangmen/co/81124.htm
江门市科隆生物技术有限公司,http://www.11467.com/jiangmen/co/98763.htm
江门市新会区汇香源生物科技有限公司,http://www.11467.com/jiangmen/co/99087.htm
江门汇香源生物科技有限公司,http://www.11467.com/jiangmen/co/98881.htm
中盛生物科技有限公司,http://www.11467.com/jiangmen/co/98717.htm
鸿基生物有限公司,http://www.11467.com/jiaozuo/co/26921.htm
河南孟州泰利杰有限责任公司,http://www.11467.com/jiaozuo/co/21975.htm
河南省焦作市新元生物化工食品有限公司,http://www.11467.com/jiaozuo/co/22007.htm
焦作新元生物化工食品有限公司,http://www.11467.com/jiaozuo/co/21902.htm
焦作新元食品化工有限公司,http://www.11467.com/jiaozuo/co/22004.htm
嘉兴市多味特食品添加剂有限公司,http://www.11467.com/jiaxing/co/89658.htm
甘肃临夏州华安生物制品有限责任公司嘉兴办事处,http://www.11467.com/jiaxing/co/89566.htm
嘉兴市天和诚生物科技有限公司,http://www.11467.com/jiaxing/co/123357.htm
桐乡天和诚食品科技有限公司,http://www.11467.com/jiaxing/co/124182.htm
吉林市新星天然植物开发有限责任公司-营业部,http://www.11467.com/jilinshi/co/80667.htm
吉林鑫溪商贸有限公司业务部,http://www.11467.com/jilinshi/co/80897.htm
济南凯曼商贸有限公司,http://www.11467.com/jinan/co/60410.htm
济南海右固特科技有限公司,http://www.11467.com/jinan/co/102519.htm
济南鸿翔精细化工有限公司,http://www.11467.com/jinan/co/102863.htm
济南利骏达商贸有限公司,http://www.11467.com/jinan/co/101845.htm
济南波远食品有限公司,http://www.11467.com/jinan/co/140085.htm
济南丰润得实业有限公司,http://www.11467.com/jinan/co/103508.htm
济南高德医药有限公司,http://www.11467.com/jinan/co/103316.htm
济南佳成生物科技有限公司,http://www.11467.com/jinan/co/135316.htm
济南和业贸易有限公司业务部,http://www.11467.com/jinan/co/102130.htm
济南萨美特贸易有限公司销售部,http://www.11467.com/jinan/co/101843.htm
济南格润化工有限公司,http://www.11467.com/jinan/co/101914.htm
山东博宇精细化工有限公司,http://www.11467.com/jinan/co/101563.htm
山东大华广济生化工程有限公司（李先生）,http://www.11467.com/jinan/co/102665.htm
济南世友国际贸易有限公司,http://www.11467.com/jinan/co/101535.htm
济南中宣经贸有限公司,http://www.11467.com/jinan/co/102402.htm
济南自然力生物科技有限公司,http://www.11467.com/jinan/co/103459.htm
济南佳成化工有限公司食品添加剂事业部,http://www.11467.com/jinan/co/136040.htm
山东新发药业有限公司外贸部,http://www.11467.com/jinan/co/102446.htm
山东省中协食品添加剂研究开发中心有限公司,http://www.11467.com/jinan/co/103315.htm
济南景福商贸有限责任公司,http://www.11467.com/jinan/co/92831.htm
济南酿造之友经贸有限公司,http://www.11467.com/jinan/co/102338.htm
济南大地食品有限公司,http://www.11467.com/jinan/co/101694.htm
济南圣泉唐和唐生物科技公司,http://www.11467.com/jinan/co/101383.htm
山东三清生物制品有限公司,http://www.11467.com/jinan/co/102943.htm
济南佳佳美食有限公司,http://www.11467.com/jinan/co/101675.htm
莎克化工有限公司,http://www.11467.com/jinan/co/101940.htm
华宝食品配料有限公司,http://www.11467.com/jinan/co/101902.htm
山东圣源化学科技有限公司,http://www.11467.com/jinan/co/103332.htm
山东万多福精细化学材料有限公司,http://www.11467.com/jinan/co/103442.htm
济南浩化实业有限责任公司原料部,http://www.11467.com/jinan/co/103131.htm
湖北龙翔生物有限公司,http://www.11467.com/jingzhou/co/30386.htm
金华市同元土特产有限公司,http://www.11467.com/jinhua/co/56270.htm
金华益康生物科技开发有限公司,http://www.11467.com/jinhua/co/80912.htm
浙江金华迪耳化工有限公司,http://www.11467.com/jinhua/co/81296.htm
浙江迪耳化工有限公司营销部,http://www.11467.com/jinhua/co/71970.htm
杭州瑞林化工有限公司,http://www.11467.com/jinhua/co/81084.htm
济宁博纳甜菊制品有限公司,http://www.11467.com/jining/co/52480.htm
华洋甜菊制品有限公司,http://www.11467.com/jining/co/52919.htm
梁山水泊大曲有限公司,http://www.11467.com/jining/co/73597.htm
济宁市佳龙食品有限制公司,http://www.11467.com/jining/co/52450.htm
山东华仙甜菊股份有限公司-销售部,http://www.11467.com/jining/co/52232.htm
济宁市恒大绿色工程有限公司,http://www.11467.com/jining/co/44038.htm
运河甜菊有限公司,http://www.11467.com/jining/co/52662.htm
山东华仙甜菊股份有限公司/济宁勃升利发贸易有限公司,http://www.11467.com/jining/co/52823.htm
运河甜菊糖有限公司,http://www.11467.com/jining/co/52801.htm
山东华仙甜菊股份有限公司国际部,http://www.11467.com/jining/co/52439.htm
曲阜香洲甜菊制品有限公司,http://www.11467.com/jining/co/73275.htm
邹城市通用生物化工有限公司,http://www.11467.com/jining/co/52856.htm
江西九江五谷食品化学工业有限公司,http://www.11467.com/jiujiang/co/21371.htm
酒泉市东源蔬菜脱水有限责任公司,http://www.11467.com/jiuquan/co/10136.htm
海源集团昆明贸易有限公司,http://www.11467.com/kunming/co/127071.htm
昆明三府经贸有限公司,http://www.11467.com/kunming/co/115025.htm
云南得丰食用化工有限公司,http://www.11467.com/kunming/co/127740.htm
云南益生天然色素有限公司,http://www.11467.com/kunming/co/116239.htm
云南华宁抚仙湖生化有限公司销售部,http://www.11467.com/kunming/co/113724.htm
云南普洱永吉生物技术有限责任公司,http://www.11467.com/kunming/co/127997.htm
昆明蔡氏兄弟商贸有限公司销售部,http://www.11467.com/kunming/co/116874.htm
昆明万森商贸有限公司,http://www.11467.com/kunming/co/113751.htm
莱芜泰禾生化有限公司(销售部),http://www.11467.com/laiwu/co/8111.htm
河北兴源化工有限公司,http://www.11467.com/langfang/co/46474.htm
廊坊紫英食品有限公司,http://www.11467.com/langfang/co/34047.htm
兰州市百味香食品添加剂公司,http://www.11467.com/lanzhou/co/70292.htm
甘肃商科食品科技开发有限责任公司,http://www.11467.com/lanzhou/co/42274.htm
甘肃华羚生物科技有限公司国际国内贸易部,http://www.11467.com/lanzhou/co/70051.htm
兰州伟日生物工程有限公司外贸部,http://www.11467.com/lanzhou/co/70421.htm
甘肃华羚生物科技有限公司市场部,http://www.11467.com/lanzhou/co/70410.htm
甘肃华羚生物科技有限公司酶工程部,http://www.11467.com/lanzhou/co/70278.htm
兰州伟日生物工程有限公司经贸部,http://www.11467.com/lanzhou/co/70135.htm
兰州伟日生物工程有限公司 外贸部,http://www.11467.com/lanzhou/co/70313.htm
兰州佳盛源装饰装潢有限公司,http://www.11467.com/lanzhou/co/70302.htm
甘肃泛植生物科技有限公司,http://www.11467.com/lanzhou/co/70110.htm
甘肃华羚生物科技有限公司 市场部,http://www.11467.com/lanzhou/co/70543.htm
兰州伟日生物工程有限公司.,http://www.11467.com/lanzhou/co/70315.htm
中国甘肃亚盛集团股份有限公司,http://www.11467.com/lanzhou/co/70648.htm
连云港市诺信化工有限公司销售部,http://www.11467.com/lianyungang/co/30745.htm
连云港树人科创食品添加剂有限公司 销售部,http://www.11467.com/lianyungang/co/30841.htm
连云港东源食品有限公司贸易部,http://www.11467.com/lianyungang/co/30984.htm
连云港林炎商贸有限公司,http://www.11467.com/lianyungang/co/28686.htm
连云港润普食品配料有限公司业务部,http://www.11467.com/lianyungang/co/30797.htm
连云港润普食品配料有限公司 销售二部,http://www.11467.com/lianyungang/co/30547.htm
连云港三珉食品添加剂有限公司,http://www.11467.com/lianyungang/co/31037.htm
连云港润普食品配料有限公司市场部,http://www.11467.com/lianyungang/co/30566.htm
连云港中壹贸易有限公司销售一部,http://www.11467.com/lianyungang/co/30956.htm
连云港通源化工有限公司销售部,http://www.11467.com/lianyungang/co/30995.htm
连云港润普食品配料有限公司销售部,http://www.11467.com/lianyungang/co/30525.htm
连云港瑞丰化工有限公司,http://www.11467.com/lianyungang/co/6411.htm
连云港科信化工有限公司（市场部）,http://www.11467.com/lianyungang/co/30890.htm
连云港市九盛化工有限公司,http://www.11467.com/lianyungang/co/30508.htm
连云港西都生化有限公司（华南区域）,http://www.11467.com/lianyungang/co/30981.htm
连云港西都生化有限责任公司,http://www.11467.com/lianyungang/co/30783.htm
连云港天骄海藻工业有限公司,http://www.11467.com/lianyungang/co/30920.htm
连云港兴辉源贸易有限公司,http://www.11467.com/lianyungang/co/30874.htm
连云港通源化工有限公司外销部,http://www.11467.com/lianyungang/co/30894.htm
连云港鑫山化工有限公司,http://www.11467.com/lianyungang/co/30749.htm
中外合资江苏连云港诺贝生化科技有限公司,http://www.11467.com/lianyungang/co/30705.htm
连云港市方晟化工有限公司,http://www.11467.com/lianyungang/co/30719.htm
连云港鑫山化工（食品添加剂）有限公司,http://www.11467.com/lianyungang/co/30604.htm
连云港阳明科技有限公司,http://www.11467.com/lianyungang/co/18946.htm
连云港科信化工有限公司营销部,http://www.11467.com/lianyungang/co/30492.htm
连云港益康佳化工有限公司,http://www.11467.com/lianyungang/co/33005.htm
连云港润普食品配料有限公司工厂部,http://www.11467.com/lianyungang/co/30806.htm
科信化工有限公司国际业务部,http://www.11467.com/lianyungang/co/30540.htm
连云港科信化工有限公司 销售部,http://www.11467.com/lianyungang/co/30736.htm
连云港友进食品添加剂技术开发有限公司,http://www.11467.com/lianyungang/co/43670.htm
连云港润普食品配料有限公司润普工厂,http://www.11467.com/lianyungang/co/31051.htm
聊城市启元食品添加剂有限公司销售部,http://www.11467.com/liaocheng/co/34549.htm
聊城市启元食品添加剂有限公司,http://www.11467.com/liaocheng/co/34055.htm
东阿县华艺食品添加剂有限公司,http://www.11467.com/liaocheng/co/53250.htm
希杰(聊城)生物科技有限公司,http://www.11467.com/liaocheng/co/34696.htm
山东奥尔良生物科技有限公司,http://www.11467.com/liaocheng/co/49556.htm
聊城金麦食品有限公司,http://www.11467.com/liaocheng/co/34339.htm
希杰(聊城)生物科技有限公司销售科,http://www.11467.com/liaocheng/co/34225.htm
希杰聊城生物科技有限公司,http://www.11467.com/liaocheng/co/34469.htm
聊城市食品添加剂有限公司,http://www.11467.com/liaocheng/co/34933.htm
聊城鑫源食品添加剂公司,http://www.11467.com/liaocheng/co/34394.htm
山东星光亿金百味食品添加剂有限公司西北区办事处,http://www.11467.com/liaocheng/co/34787.htm
山东聊城恒信面粉有限公司,http://www.11467.com/liaocheng/co/50070.htm
山东新嘉华集团有限公司蛋白事业部,http://www.11467.com/liaocheng/co/34119.htm
睿星明胶(厦门)有限公司,http://www.11467.com/linfen/co/32433.htm
邦泰集团山东宏仕德化工有限公司,http://www.11467.com/linyi/co/70124.htm
临沂爱达食品有限公司,http://www.11467.com/linyi/co/70025.htm
北京北方霞光食品添加剂公司临沂分公司,http://www.11467.com/linyi/co/70018.htm
临沂宏昇白铁制品有限公司,http://www.11467.com/linyi/co/69575.htm
湖滨化工有限公司,http://www.11467.com/linyi/co/70675.htm
临沂市振宇物资有限公司,http://www.11467.com/linyi/co/69974.htm
临沂泰豪国际贸易有限公司 商务部,http://www.11467.com/linyi/co/70709.htm
临沂市兰山区正坤食品有限公司,http://www.11467.com/linyi/co/91484.htm
临沂振宇 物资有限公司,http://www.11467.com/linyi/co/69975.htm
穆陵关化工有限公司,http://www.11467.com/linyi/co/96786.htm
临沂维宏化工有限公司,http://www.11467.com/linyi/co/2290.htm
临沂耐思化工有限公司,http://www.11467.com/linyi/co/70673.htm
山东齐氏坚果食品有限公司,http://www.11467.com/linyi/co/73995.htm
山东沂水隆大生物工程有限责任公司,http://www.11467.com/linyi/co/70042.htm
临沂太太乐调味品有限公司外贸部,http://www.11467.com/linyi/co/70225.htm
上海味源有限公司驻临沂办事处,http://www.11467.com/linyi/co/70339.htm
山东宏仕德化工有限公司外贸部,http://www.11467.com/linyi/co/69280.htm
山东宏仕德化工有限公司业务一部,http://www.11467.com/linyi/co/69579.htm
临沂市美元调味料有限公司,http://www.11467.com/linyi/co/69753.htm
沂南天成生物制品有限公司,http://www.11467.com/linyi/co/96175.htm
临沂耐思化工贸有限公司,http://www.11467.com/linyi/co/69354.htm
临沂泰豪国际贸易有限公司(销售部),http://www.11467.com/linyi/co/70497.htm
上海泰斯麦香精香料有限公司（美商独资）,http://www.11467.com/linyi/co/69289.htm
山东废塑料炼油有限公司,http://www.11467.com/linyi/co/70369.htm
临沂盈泰经贸有限公司,http://www.11467.com/linyi/co/70702.htm
丽水酝香坊商贸有限公司,http://www.11467.com/lishui/co/25379.htm
广西博和贸易有限公司,http://www.11467.com/liuzhou/co/46804.htm
柳州弘宏德医药有限公司(销售部）,http://www.11467.com/liuzhou/co/42786.htm
柳州市天龙化工责任有限公司,http://www.11467.com/liuzhou/co/42944.htm
柳州市金太味业食品有限公司,http://www.11467.com/liuzhou/co/16788.htm
柳州市耀兴糖酒有限公司销售部,http://www.11467.com/liuzhou/co/42847.htm
柳州长远食品配料科技有限公司,http://www.11467.com/liuzhou/co/46532.htm
柳州宏德食品添加剂有限公司,http://www.11467.com/liuzhou/co/42901.htm
龙岩瑞丰公贸有限公司,http://www.11467.com/longyan/co/22683.htm
河南省漯河市五龙明胶有限公司.,http://www.11467.com/luohe/co/18105.htm
漯河市龙腾生物科技有限公司,http://www.11467.com/luohe/co/17965.htm
漯河市天利食化有限公司,http://www.11467.com/luohe/co/13178.htm
漯河德发商贸有限公司,http://www.11467.com/luohe/co/20386.htm
漯河市五龙明胶有限公司.,http://www.11467.com/luohe/co/17913.htm
漯河市五龙明胶有限公司销售公司,http://www.11467.com/luohe/co/17921.htm
广州市馨祺邦贸易有限公司,http://www.11467.com/guangzhou/co/570309.htm
郑州鸿祥化工有限公司,http://www.11467.com/zhengzhou/co/170301.htm
郑州仁恒化工产品有限公司,http://www.11467.com/zhengzhou/co/149856.htm
泰安广源国际贸易有限公司,http://www.11467.com/taian/co/39866.htm
常州市群才干燥设备有限公司,http://www.11467.com/changzhou/co/147999.htm
西安世珍生物技术有限责任公司,http://www.11467.com/xian/co/85325.htm
陕西太极华青科技有限公司,http://www.11467.com/xian/co/87654.htm
湖北斯元化工有限公司,http://www.11467.com/wuhan/co/117235.htm
河北省东盛蜂蜡有限公司,http://www.11467.com/cangzhou/co/46366.htm
合肥翔之鸿食品有限公司,http://www.11467.com/hefei/co/131455.htm
郑州坤利食品添加剂有限公司,http://www.11467.com/zhengzhou/co/137286.htm
安徽天启化工科技有限公司,http://www.11467.com/huaibei/co/13670.htm
江门科隆生物技术股份有限公司,http://www.11467.com/jiangmen/co/99102.htm
咸阳瑞欣生物技术有限公司,http://www.11467.com/xianyang/co/21192.htm
湖北仙果园科技发展有限公司,http://www.11467.com/wuhan/co/89441.htm
武汉市金德戈糖业有限公司,http://www.11467.com/wuhan/co/103886.htm
安徽省天创生物科技有限公司,http://www.11467.com/suzhoushi/co/18457.htm
厦门雅加美食品有限公司,http://www.11467.com/xiamen/co/74853.htm
衡阳市建衡实业有限公司,http://www.11467.com/hengyang/co/27826.htm
江西金碧源实业有限责任公司,http://www.11467.com/nanchang/co/96938.htm
石家庄聚格化工有限公司,http://www.11467.com/shijiazhuang/co/137758.htm
陕西帕尼尔生物科技有限公司,http://www.11467.com/xian/co/127970.htm
莆田市城厢区昌德食品有限公司,http://www.11467.com/putian/co/33467.htm
嘉兴恒杰生物制药有限公司,http://www.11467.com/jiaxing/co/92288.htm
湖州市菱湖新望化学有限公司,http://www.11467.com/huzhou/co/36855.htm
青海森利进出口贸易有限公司,http://www.11467.com/xining/co/26967.htm
河南京华食品科技开发有限公司,http://www.11467.com/jiaozuo/co/22152.htm
嘉兴市虎啸化工有限公司,http://www.11467.com/jiaxing/co/123263.htm
广州市耶尚贸易有限公司,http://www.11467.com/guangzhou/co/387176.htm
韶关市颐林泉生物科技有限公司,http://www.11467.com/shaoguan/co/25559.htm
东莞东美食品有限公司,http://www.11467.com/dongguan/co/48034.htm
郑州市鸿程化工产品有限公司,http://www.11467.com/zhengzhou/co/170120.htm
广西南宁万特机电设备有限公司,http://www.11467.com/nanning/co/58605.htm
沙县超燃能源科技开发有限公司,http://www.11467.com/sanming/co/32192.htm
桐乡市泸东化工助剂有限公司,http://www.11467.com/jiaxing/co/135047.htm
云南宏绿辣素有限公司,http://www.11467.com/kunming/co/127049.htm
鄂托克旗德荣藻业有限责任公司,http://www.11467.com/eerduosi/co/10098.htm
安徽富坤贸易有限公司,http://www.11467.com/hefei/co/100226.htm
郑州蓝驰实业有限公司,http://www.11467.com/zhengzhou/co/149471.htm
河南仰韶生化工程有限公司,http://www.11467.com/xinyang/co/22968.htm
郑州龙海啤酒物资有限公司,http://www.11467.com/zhengzhou/co/66304.htm
常州远大新星聚氨酯制品有限公司,http://www.11467.com/changzhou/co/56424.htm
合肥香岛食品有限公司,http://www.11467.com/hefei/co/141611.htm
衡阳市春茂化工有限公司,http://www.11467.com/hengyang/co/28525.htm
山东协力生物科技股份有限公司,http://www.11467.com/heze/co/34192.htm
惠州市万憬丰化工有限公司,http://www.11467.com/huizhou/co/98926.htm
上海宛道实业有限公司,http://www.11467.com/shanghai/co/1066129.htm
厦门仁驰化工有限公司,http://www.11467.com/xiamen/co/84629.htm
郑州丰乐化工产品有限公司,http://www.11467.com/zhengzhou/co/148696.htm
陕西森弗高科实业有限公司,http://www.11467.com/xian/co/85298.htm
河南金润食品添加剂有限公司,http://www.11467.com/zhengzhou/co/137225.htm
上海祁邦实业有限公司,http://www.11467.com/shanghai/co/429182.htm
宁波北仑雅旭化工有限公司,http://www.11467.com/ningbo/co/143983.htm
长沙华康生物技术开发有限公司,http://www.11467.com/changsha/co/92302.htm
郑州天乐化工产品有限公司,http://www.11467.com/zhengzhou/co/147962.htm
郑州瑞恒化工有限公司,http://www.11467.com/zhengzhou/co/148643.htm
大连兴和酵母有限公司,http://www.11467.com/dalian/co/57549.htm
汕头市华馨香料有限公司,http://www.11467.com/shantou/co/137294.htm
山东明辉食品有限公司,http://www.11467.com/liaocheng/co/34958.htm
江西省华宏化工有限公司,http://www.11467.com/nanchang/co/66461.htm
徐州诚铭动物胶有限公司,http://www.11467.com/xuzhou/co/54189.htm
连云港光裕永食品配料有限公司,http://www.11467.com/lianyungang/co/30563.htm
济南安姆生物技术有限公司,http://www.11467.com/jinan/co/133387.htm
郑州华耀生物科技有限公司,http://www.11467.com/zhengzhou/co/149035.htm
盐城市海亚冷冻食品有限公司,http://www.11467.com/yancheng/co/5054.htm
天津环宇红星食品贸易有限公司,http://www.11467.com/tianjin/co/63932.htm
永州市雅大科技实业有限公司,http://www.11467.com/yongzhou/co/13999.htm
河南亿特化工产品有限公司,http://www.11467.com/zhengzhou/co/188910.htm
石家庄泽兴氨基酸有限公司,http://www.11467.com/shijiazhuang/co/112318.htm
南京伊贝加科技有限公司,http://www.11467.com/nanjing/co/101669.htm
淄博海澜化工有限公司,http://www.11467.com/zibo/co/84549.htm
广州市加桦贸易有限公司,http://www.11467.com/guangzhou/co/206272.htm
连云港市贸发实业有限公司,http://www.11467.com/lianyungang/co/19685.htm
南宁市春旭化工有限责任公司,http://www.11467.com/nanning/co/69263.htm
南通市舒洋贸易有限公司,http://www.11467.com/nantong/co/81822.htm
东莞市欣荣天丽科技实业有限公司,http://www.11467.com/dongguan/co/487291.htm
厦门玖芳食品有限公司,http://www.11467.com/xiamen/co/84547.htm
郑州晨阳化工有限公司,http://www.11467.com/zhengzhou/co/170472.htm
郑州程达化工产品有限公司,http://www.11467.com/zhengzhou/co/171639.htm
郑州容大食品有限公司,http://www.11467.com/zhengzhou/co/175867.htm
杭州绿源精细化工有限公司,http://www.11467.com/hangzhou/co/81288.htm
贵州红星发展都匀绿友有限责任公司,http://www.11467.com/qiannan/co/8979.htm
厦门欣长隆商贸有限公司,http://www.11467.com/xiamen/co/103091.htm
徐州恒世食品有限公司,http://www.11467.com/xuzhou/co/60214.htm
