东莞市五龙明胶有限公司（商务部）,http://www.11467.com/dongguan/co/368718.htm
东莞市五龙明胶有限公司,http://www.11467.com/dongguan/co/72947.htm
东莞市五龙明胶有限公司业务部,http://www.11467.com/dongguan/co/370947.htm
广东一品鲜生物科技有限公司—上海办,http://www.11467.com/dongguan/co/370446.htm
漯河市五龙明胶有限公司东莞市分公司,http://www.11467.com/dongguan/co/370000.htm
泰盛昌食品有限公司,http://www.11467.com/dongguan/co/370934.htm
广益食品添加剂有限公司-采购部,http://www.11467.com/dongguan/co/370502.htm
兴丰食品有限公司东莞办事处,http://www.11467.com/dongguan/co/511315.htm
东莞市露晶洗涤日用品有限公司,http://www.11467.com/dongguan/co/494408.htm
国民兄弟食品配料有限公司(汇华东泽),http://www.11467.com/dongguan/co/369268.htm
河南省漯河五龙明胶有限公司,http://www.11467.com/dongguan/co/369553.htm
乔宇金属制品有限公司,http://www.11467.com/dongguan/co/369477.htm
香港添达实业有限公司,http://www.11467.com/dongguan/co/369703.htm
味佳食品有限公司,http://www.11467.com/dongguan/co/509295.htm
广东东莞市五龙明胶有限公司,http://www.11467.com/dongguan/co/370876.htm
天丽食品添加剂有限公司,http://www.11467.com/dongguan/co/366673.htm
东营佳鑫化工科技有限公司,http://www.11467.com/dongying/co/30816.htm
东营天润生物科技有限责任公司（供销部）,http://www.11467.com/dongying/co/30698.htm
胜利油田灵威科工贸有限责任公司销售部,http://www.11467.com/dongying/co/30872.htm
东营市信德化工有限责任公司,http://www.11467.com/dongying/co/13738.htm
佛山市绿川生物科技有限公司,http://www.11467.com/foshan/co/345443.htm
佛山市佳一旺休闲食品有限公司,http://www.11467.com/foshan/co/278232.htm
佛山市合新食品原料有限公司,http://www.11467.com/foshan/co/278470.htm
佛山市南海旭晞贸易有限公司,http://www.11467.com/foshan/co/279084.htm
佛山市南海怡康天然制品有限公司,http://www.11467.com/foshan/co/103175.htm
佛山市南海穗扬食品原料有限公司业务部,http://www.11467.com/foshan/co/279813.htm
广东高力表面技术有限公司,http://www.11467.com/foshan/co/83396.htm
远大制釉有限公司,http://www.11467.com/foshan/co/277876.htm
佛山市溢香源食品有限公司,http://www.11467.com/foshan/co/279774.htm
佛山市壹盈贸易有限公司,http://www.11467.com/foshan/co/330165.htm
佛山市涌泉食品添加剂有限公司,http://www.11467.com/foshan/co/278311.htm
三杰食品化工有限公司,http://www.11467.com/foshan/co/279480.htm
三杰食品添加剂有限公司,http://www.11467.com/foshan/co/279281.htm
抚顺市独凤轩食品配料有限公司,http://www.11467.com/fushun/co/26922.htm
抚顺市独凤轩食品有限公司-上海办事处,http://www.11467.com/fushun/co/27009.htm
安徽华源生物药业有限公司 柠檬酸销售部,http://www.11467.com/fuyang/co/27070.htm
安徽华源药业有限公司,http://www.11467.com/fuyang/co/26931.htm
安徽中科大易元生物技术有限公司,http://www.11467.com/fuyang/co/16146.htm
安徽中科大易元生物技术有限公司供应部,http://www.11467.com/fuyang/co/27218.htm
安徽金安客食品技术有限公司,http://www.11467.com/fuyang/co/27054.htm
福建古田万红有限公司,http://www.11467.com/fuzhou/co/155074.htm
福州正奇食品添加剂有限公司,http://www.11467.com/fuzhou/co/23385.htm
福州新成功贸易有限公司,http://www.11467.com/fuzhou/co/181770.htm
福州益友投资公司,http://www.11467.com/fuzhou/co/181257.htm
福州瑞辉食品有限公司,http://www.11467.com/fuzhou/co/155071.htm
福州先同达贸易有限公司(BD),http://www.11467.com/fuzhou/co/182199.htm
福州叹香食品有限公司,http://www.11467.com/fuzhou/co/181413.htm
嘉烨（福州）进出口有限公司,http://www.11467.com/fuzhou/co/133511.htm
福州市旭隆贸易有限公司,http://www.11467.com/fuzhou/co/155825.htm
福州伟业包装有限公司,http://www.11467.com/fuzhou/co/156695.htm
仙游县东泰食品助剂有限公司销售部,http://www.11467.com/fuzhou/co/154622.htm
甘南州科瑞乳品开发有限公司,http://www.11467.com/gannan/co/1981.htm
宝桃食品(上海)有限公司,http://www.11467.com/guangzhou/co/463070.htm
广东博奇香精香料集团有限公司食品香精销售部,http://www.11467.com/guangzhou/co/380365.htm
广东九州通医药有限公司（广州）,http://www.11467.com/guangzhou/co/380700.htm
广东双星商贸发展有限公司,http://www.11467.com/guangzhou/co/71434.htm
广州方道商贸有限公司,http://www.11467.com/guangzhou/co/378827.htm
广东华盛食化有限公司,http://www.11467.com/guangzhou/co/260897.htm
广州澳霖化工有限公司－驻成都办事处,http://www.11467.com/guangzhou/co/378337.htm
广州冠球化工有限公司销售,http://www.11467.com/guangzhou/co/384141.htm
广东越海食用化工有限公司,http://www.11467.com/guangzhou/co/18812.htm
广东省迪美生物技术有限公司,http://www.11467.com/guangzhou/co/384380.htm
广东世香生物科技有限公司,http://www.11467.com/guangzhou/co/382487.htm
广州好食品配料有限公司,http://www.11467.com/guangzhou/co/386230.htm
广州派霖美食品原料有限公司 采购部,http://www.11467.com/guangzhou/co/382725.htm
北京北方霞光食品添加剂有限公司广州专卖店,http://www.11467.com/guangzhou/co/379967.htm
广州标思贸易有限公司,http://www.11467.com/guangzhou/co/465908.htm
广州汇科精细化工有限公司 技术部,http://www.11467.com/guangzhou/co/384825.htm
广东广州华汇生物实业有限公司销售部,http://www.11467.com/guangzhou/co/383376.htm
广州禾夫食品有限公司,http://www.11467.com/guangzhou/co/377025.htm
广州冠球化工有限公司,http://www.11467.com/guangzhou/co/96900.htm
广州金正工贸发展有限公司,http://www.11467.com/guangzhou/co/378984.htm
广州宏越贸易有限公司,http://www.11467.com/guangzhou/co/475547.htm
广东华盛食化有限公司广州分公司业务部,http://www.11467.com/guangzhou/co/384785.htm
广州健科生物科技有限公司,http://www.11467.com/guangzhou/co/161694.htm
广州凯宏食品有限公司,http://www.11467.com/guangzhou/co/380719.htm
广州拜晴生物科技有限公司销售部,http://www.11467.com/guangzhou/co/376649.htm
广州贝可烘焙科技有限公司,http://www.11467.com/guangzhou/co/376851.htm
广州美益香料有限公司,http://www.11467.com/guangzhou/co/382780.htm
广州富航生物科技有限公司（销售部）,http://www.11467.com/guangzhou/co/382017.htm
广州乐焙仕食品有限公司,http://www.11467.com/guangzhou/co/46745.htm
广州华进化工有限公司,http://www.11467.com/guangzhou/co/381552.htm
广州鸿翔化工有限公司,http://www.11467.com/guangzhou/co/380311.htm
广州科谷食品有限公司,http://www.11467.com/guangzhou/co/379912.htm
广州凯闻食品发展有限公司,http://www.11467.com/guangzhou/co/377376.htm
广州市飞马食品有限公司,http://www.11467.com/guangzhou/co/378061.htm
广东兴亿海洋生物工程有限公司（销售部）,http://www.11467.com/guangzhou/co/376431.htm
广州艾辉生物科技有限公司市场部,http://www.11467.com/guangzhou/co/378824.htm
广州皓海生物科技有限公司,http://www.11467.com/guangzhou/co/386572.htm
广东天冠化工有限责任公司,http://www.11467.com/guangzhou/co/379203.htm
广州绿颖生物科技有限公司,http://www.11467.com/guangzhou/co/385497.htm
广州市步思化工有限公司,http://www.11467.com/guangzhou/co/458004.htm
广州昇晖商贸发展有限公司,http://www.11467.com/guangzhou/co/379146.htm
广州金华大化学试剂有限公司 拓展部,http://www.11467.com/guangzhou/co/383970.htm
广州华汇生物实业有限公司,http://www.11467.com/guangzhou/co/377501.htm
广州品上生物科技有限公司,http://www.11467.com/guangzhou/co/384898.htm
贝格贝克（广州）食品配料有限公司,http://www.11467.com/guangzhou/co/377152.htm
广州乐焙仕食品有限公司市场部,http://www.11467.com/guangzhou/co/385697.htm
广东云天志贸易有限公司（广州中庸贸易有限公司）,http://www.11467.com/guangzhou/co/386517.htm
广州市金阳食品有限公司,http://www.11467.com/guangzhou/co/387027.htm
芬维食品有限公司,http://www.11467.com/guangzhou/co/378056.htm
本色集团股份公司,http://www.11467.com/guangzhou/co/380585.htm
广州柏棠贸易有限公司,http://www.11467.com/guangzhou/co/66625.htm
广州恒成生物科技有限公司,http://www.11467.com/guangzhou/co/379607.htm
广州聚通钛白粉有限公司,http://www.11467.com/guangzhou/co/380665.htm
广州晨丹贸易发展有限公司,http://www.11467.com/guangzhou/co/380758.htm
广州方道商贸有限责任公司,http://www.11467.com/guangzhou/co/385957.htm
广州市丰裕行贸易有限公司销售部,http://www.11467.com/guangzhou/co/381441.htm
广州昊翔生物有限公司,http://www.11467.com/guangzhou/co/376122.htm
广州市恒竤贸易有限公司,http://www.11467.com/guangzhou/co/386920.htm
广州市红狮贸易有限公司（业务部彭先生）,http://www.11467.com/guangzhou/co/380762.htm
广州黄埔天泰化轻有限公司,http://www.11467.com/guangzhou/co/382727.htm
广州市际成商贸有限公司（销售部）,http://www.11467.com/guangzhou/co/377361.htm
广州市光雄贸易有限公司上海办,http://www.11467.com/guangzhou/co/378856.htm
广州炬峰贸易有限公司,http://www.11467.com/guangzhou/co/380706.htm
广州奥新特生物科技有限公司,http://www.11467.com/guangzhou/co/379084.htm
广州市古田食品有限公司,http://www.11467.com/guangzhou/co/385104.htm
广州千湖贸易有限公司业务部,http://www.11467.com/guangzhou/co/379104.htm
广州陆鑫贸易有限公司,http://www.11467.com/guangzhou/co/385003.htm
广州陆鑫(益鑫)贸易有限公司市场部,http://www.11467.com/guangzhou/co/379358.htm
广州立维生物科技有限公司,http://www.11467.com/guangzhou/co/379036.htm
广州明远工贸有限公司,http://www.11467.com/guangzhou/co/169261.htm
广州市华汇生物实业有限公司,http://www.11467.com/guangzhou/co/386200.htm
广州铭俊食品配料公司,http://www.11467.com/guangzhou/co/380598.htm
广州茗穗食品有限公司,http://www.11467.com/guangzhou/co/378840.htm
广州仟禾生物科技有限公司销售部,http://www.11467.com/guangzhou/co/382813.htm
广州年和精细化工贸易有限公司,http://www.11467.com/guangzhou/co/386800.htm
广州市俊豪贸易有限公司(业务部）,http://www.11467.com/guangzhou/co/381116.htm
广州晋华贸易有限公司,http://www.11467.com/guangzhou/co/379532.htm
广州日康食用化工有限公司（销售部）,http://www.11467.com/guangzhou/co/383059.htm
广州市科诚食品工业有限公司,http://www.11467.com/guangzhou/co/380786.htm
广州钱盛化工有限公司经销部,http://www.11467.com/guangzhou/co/379275.htm
广州科宏食品添加物有限公司,http://www.11467.com/guangzhou/co/94562.htm
广州荣泽生物科技有限公司,http://www.11467.com/guangzhou/co/386442.htm
广州市龙和生物科技有限公司(销售部),http://www.11467.com/guangzhou/co/376696.htm
广州市联鑫贸易有限公司,http://www.11467.com/guangzhou/co/459831.htm
广州市红狮貿易有限公司,http://www.11467.com/guangzhou/co/377086.htm
广州健信食品科技有限公司,http://www.11467.com/guangzhou/co/476974.htm
广州市嘉逸化工有限公司,http://www.11467.com/guangzhou/co/457391.htm
广州市天阳泰天然色素有限公司（业务部）,http://www.11467.com/guangzhou/co/384031.htm
广州市天阳泰天然色素有限公司销售部,http://www.11467.com/guangzhou/co/380094.htm
广州市凯闻食品原料有限公司国际业务部,http://www.11467.com/guangzhou/co/380856.htm
广州市科隆达实业有限公司,http://www.11467.com/guangzhou/co/380920.htm
广州市科诚食品工业有限公司 销售部,http://www.11467.com/guangzhou/co/382242.htm
广州市天阳泰天然色素有限公司业务部,http://www.11467.com/guangzhou/co/383263.htm
广州市泰龙生化科技有限公司第三业务部,http://www.11467.com/guangzhou/co/382069.htm
广州市科谷食品有限公司销售部,http://www.11467.com/guangzhou/co/382088.htm
广州市科冠食品有限公司,http://www.11467.com/guangzhou/co/387058.htm
广州宏图贸易有限公司,http://www.11467.com/guangzhou/co/380010.htm
广州市依山贸易有限公司,http://www.11467.com/guangzhou/co/51131.htm
广州市怡生园食品公司,http://www.11467.com/guangzhou/co/385161.htm
广州南沙南英外经贸集团有限公司,http://www.11467.com/guangzhou/co/382769.htm
广州日康营养科技有限公司,http://www.11467.com/guangzhou/co/479670.htm
广州市华大化工贸易有限公司,http://www.11467.com/guangzhou/co/383288.htm
广州市乐子贸易有限公司销售部,http://www.11467.com/guangzhou/co/381142.htm
广州艾辉生物技术有限公司,http://www.11467.com/guangzhou/co/381482.htm
广州市恒宏化工有限公司,http://www.11467.com/guangzhou/co/383593.htm
广州市仟禾食品添加剂有限公司,http://www.11467.com/guangzhou/co/377953.htm
广州市广见化工科技有限公司上海销售部,http://www.11467.com/guangzhou/co/378848.htm
广州日康食用化工有限公司销售部,http://www.11467.com/guangzhou/co/383060.htm
广州市雄海食品有限公司,http://www.11467.com/guangzhou/co/383772.htm
广州颐高贸易发展有限公司,http://www.11467.com/guangzhou/co/386030.htm
广州穗润坊食品公司,http://www.11467.com/guangzhou/co/386657.htm
广州市华珍合贸易有限公司,http://www.11467.com/guangzhou/co/381061.htm
广州业鹏贸易有限公司,http://www.11467.com/guangzhou/co/387181.htm
广州颐高贸易发展有限责任公司,http://www.11467.com/guangzhou/co/386031.htm
广州市达势优贸易有限公司,http://www.11467.com/guangzhou/co/382851.htm
广州市义和化工有限公司,http://www.11467.com/guangzhou/co/35681.htm
广州硕维食品添加剂有限公司,http://www.11467.com/guangzhou/co/215951.htm
广州市天河新海信贸易有限公司,http://www.11467.com/guangzhou/co/383713.htm
广州祥光贸易有限公司,http://www.11467.com/guangzhou/co/378618.htm
广州晓雨化工有限公司,http://www.11467.com/guangzhou/co/382970.htm
广州硕维食品技术有有限公司,http://www.11467.com/guangzhou/co/477398.htm
广州钱盛化工有限公司,http://www.11467.com/guangzhou/co/111392.htm
广州市鑫昇贸易有限公司（销售部）,http://www.11467.com/guangzhou/co/385080.htm
广州祥濠香精香料有限公司番禺销售部,http://www.11467.com/guangzhou/co/384408.htm
广州市仟和商贸有限公司,http://www.11467.com/guangzhou/co/378706.htm
广州威司特生物科技公司,http://www.11467.com/guangzhou/co/384874.htm
广州威荣登化工有限公司,http://www.11467.com/guangzhou/co/463066.htm
华明食品添加剂公司,http://www.11467.com/guangzhou/co/381885.htm
广州红狮贸易有限公司,http://www.11467.com/guangzhou/co/459830.htm
广州市易宝贸易有限公司,http://www.11467.com/guangzhou/co/377790.htm
广州至友添加剂有限公司,http://www.11467.com/guangzhou/co/386986.htm
广州市银鹿实业有限公司,http://www.11467.com/guangzhou/co/28238.htm
广州中鹏化工原料有限公司,http://www.11467.com/guangzhou/co/379370.htm
广州市正佳食品有限公司,http://www.11467.com/guangzhou/co/376879.htm
广州日康食用化工有限公司原料部,http://www.11467.com/guangzhou/co/383261.htm
广州市天阳泰天然色素有限公司加工和批发销售部,http://www.11467.com/guangzhou/co/384172.htm
广州市欧颖化工有限公司采购部,http://www.11467.com/guangzhou/co/382557.htm
广州市夏天科技有限公司,http://www.11467.com/guangzhou/co/383671.htm
广州市伟冠贸易有限公司,http://www.11467.com/guangzhou/co/130282.htm
国胜商贸有限公司,http://www.11467.com/guangzhou/co/382598.htm
广州宗圣贸易有限公司,http://www.11467.com/guangzhou/co/376176.htm
广州市纪雅化工有限公司,http://www.11467.com/guangzhou/co/378981.htm
广州味博生物科技有限公司,http://www.11467.com/guangzhou/co/386228.htm
广州普仁商贸有限公司,http://www.11467.com/guangzhou/co/383405.htm
广州天阳泰天然色素有限公司,http://www.11467.com/guangzhou/co/384005.htm
江西井冈山生物资源有限公司广州分公司,http://www.11467.com/guangzhou/co/378575.htm
广州市泽钰生物科技有限公司销售部,http://www.11467.com/guangzhou/co/379392.htm
广州市骊翔食品有限公司,http://www.11467.com/guangzhou/co/52628.htm
连云港食品添加剂有限公司驻广州办,http://www.11467.com/guangzhou/co/377995.htm
广州市翔诚贸易发展公司,http://www.11467.com/guangzhou/co/380829.htm
广州市鲜百度食品科技有限公司,http://www.11467.com/guangzhou/co/379272.htm
广州优宝工业有限公司销售部,http://www.11467.com/guangzhou/co/383776.htm
广州裕立宝生物科技有限公司,http://www.11467.com/guangzhou/co/384204.htm
广州元味隆贸易有限公司销售部,http://www.11467.com/guangzhou/co/380897.htm
广州友意食品(配料)添加剂有限公司;,http://www.11467.com/guangzhou/co/382579.htm
永利贸易有限公司,http://www.11467.com/guangzhou/co/376467.htm
青岛香巴尔香精香料有限公司（华南办事处）营销部,http://www.11467.com/guangzhou/co/386778.htm
青岛香巴尔香精香料有限公司（华南办事处）,http://www.11467.com/guangzhou/co/386502.htm
广州市二龙贸易有限公司,http://www.11467.com/guangzhou/co/380396.htm
广州市顶真商贸有限公司,http://www.11467.com/guangzhou/co/386672.htm
穗润坊食品有限公司,http://www.11467.com/guangzhou/co/377784.htm
广州市西陇化工有限公司原料部,http://www.11467.com/guangzhou/co/376574.htm
越海食用化工有限公司,http://www.11467.com/guangzhou/co/383272.htm
广州食品化工原料有限公司,http://www.11467.com/guangzhou/co/386551.htm
乔富企业有限公司食品配料广州分公司,http://www.11467.com/guangzhou/co/381237.htm
乔富食品工业有限公司广州办事处,http://www.11467.com/guangzhou/co/380743.htm
广州恒宏贸易有限公司,http://www.11467.com/guangzhou/co/378608.htm
汇平化工广州分公司,http://www.11467.com/guangzhou/co/465909.htm
健鸥食品有限公司,http://www.11467.com/guangzhou/co/380384.htm
佳味实业有限公司,http://www.11467.com/guangzhou/co/386791.htm
佳合胶体科技有限公司,http://www.11467.com/guangzhou/co/380043.htm
孟州市泰利杰有限责任公司（驻广州办事处）,http://www.11467.com/guangzhou/co/381697.htm
孟州泰利杰麦特灵有限公司（销售办）,http://www.11467.com/guangzhou/co/381523.htm
广州市立维生物科技有限公司(销售部),http://www.11467.com/guangzhou/co/383278.htm
广州市立维生物科技有限公司,http://www.11467.com/guangzhou/co/387068.htm
广州新盛实业有限公司,http://www.11467.com/guangzhou/co/384831.htm
广州鑫昌生物科技有限公司,http://www.11467.com/guangzhou/co/379260.htm
广州市永城化工有限公司,http://www.11467.com/guangzhou/co/380079.htm
广州鑫昇贸易有限公司,http://www.11467.com/guangzhou/co/383124.htm
施恩(广州)婴幼儿营养品有限公司,http://www.11467.com/guangzhou/co/52426.htm
广州源邦贸易有限公司,http://www.11467.com/guangzhou/co/385380.htm
新加坡奥兰国际有限公司(乳品部),http://www.11467.com/guangzhou/co/376457.htm
深圳嘉迈实业广州分公司,http://www.11467.com/guangzhou/co/376500.htm
兴隆日用工艺品有限公司,http://www.11467.com/guangzhou/co/386172.htm
武汉泛亚化工有限公司,http://www.11467.com/guangzhou/co/387105.htm
润鹏海产品有限公司,http://www.11467.com/guangzhou/co/383172.htm
山东赫达股份有限公司华南办事处,http://www.11467.com/guangzhou/co/385285.htm
山东赫达股份有限公司广州分公司,http://www.11467.com/guangzhou/co/383275.htm
广州市鑫昌生物科技有限公司销售部,http://www.11467.com/guangzhou/co/380791.htm
广州市新源粮油批发市场有限公司,http://www.11467.com/guangzhou/co/43411.htm
山东齐氏坚果有限公司广州营销中心,http://www.11467.com/guangzhou/co/377200.htm
广州市雄海食品工贸有限公司 销售部,http://www.11467.com/guangzhou/co/377576.htm
仲园技术服务有限公司,http://www.11467.com/guangzhou/co/378150.htm
广州味大师食品有限公司,http://www.11467.com/guangzhou/co/69826.htm
广州味正食品有限公司－销售部,http://www.11467.com/guangzhou/co/381121.htm
重庆纳特尔化工有限责任公司广州办事处,http://www.11467.com/guangzhou/co/385249.htm
上海爱普食品工业有限公司 广州办,http://www.11467.com/guangzhou/co/386384.htm
广州市暨生元生物科技有限公司,http://www.11467.com/guangzhou/co/463067.htm
广州市健鸥食品有限公司,http://www.11467.com/guangzhou/co/57618.htm
广州市健鸥食品有限公司销售部,http://www.11467.com/guangzhou/co/380385.htm
广州市嘉伟达化工有限公司销售部,http://www.11467.com/guangzhou/co/380668.htm
广州市羽中化工有限公司~,http://www.11467.com/guangzhou/co/385808.htm
杭州金诚助剂有限公司广东办事处,http://www.11467.com/guangzhou/co/380285.htm
河北天旭天然色素有限公司广州分公司销售部,http://www.11467.com/guangzhou/co/384004.htm
英瀚贸易有限公司,http://www.11467.com/guangzhou/co/383661.htm
广州市 红狮贸易 有限公司,http://www.11467.com/guangzhou/co/384997.htm
广西平南县建美石灰制品非金属原料有限公司,http://www.11467.com/guigang/co/7703.htm
桂林吉福思生物技术有限公司,http://www.11467.com/guilin/co/34879.htm
桂林红星生物科技有限公司业务部,http://www.11467.com/guilin/co/46196.htm
北方霞光食品添加剂有限公司贵州分公司,http://www.11467.com/guiyang/co/74898.htm
广州义和化工有限公司,http://www.11467.com/guiyang/co/75774.htm
天剑实业有限公司,http://www.11467.com/guiyang/co/75040.htm
北京北方霞光食品添加剂贵阳分公司,http://www.11467.com/guiyang/co/75731.htm
哈尔滨氯化镁氯化钾氯化钙经销公司,http://www.11467.com/haerbin/co/57774.htm
哈尔滨鑫千奥经贸有限公司市场部,http://www.11467.com/haerbin/co/56446.htm
瑞隆经贸有限公司,http://www.11467.com/haerbin/co/56924.htm
哈尔滨天仁科技有限公司,http://www.11467.com/haerbin/co/56394.htm
绥芬河市龙生经贸有限责任公司,http://www.11467.com/haerbin/co/55984.htm
哈尔滨市金苹果饮品有限责任公司,http://www.11467.com/haerbin/co/55785.htm
黑龙江九三油脂集团销售总公司,http://www.11467.com/haerbin/co/55570.htm
黑龙江欣姿生物科技有限责任公司,http://www.11467.com/haerbin/co/55569.htm
河北天旭天然色素集团有限公司,http://www.11467.com/handan/co/53019.htm
杭州诚缘生物科技有限公司,http://www.11467.com/hangzhou/co/291701.htm
杭州贝斯特香精有限公司,http://www.11467.com/hangzhou/co/287584.htm
杭州福世堂生物技术有限公司,http://www.11467.com/hangzhou/co/288503.htm
杭州杭曼香精有限公司-网络销售部,http://www.11467.com/hangzhou/co/291044.htm
杭州海硕贸易有限公司,http://www.11467.com/hangzhou/co/289702.htm
杭州健能生物技术有限公司,http://www.11467.com/hangzhou/co/287739.htm
杭州茗宝食品有限公司 综合部,http://www.11467.com/hangzhou/co/289488.htm
杭州华博食品生物科技有限公司,http://www.11467.com/hangzhou/co/288610.htm
杭州乐环生化有限公司,http://www.11467.com/hangzhou/co/288920.htm
杭州安达食品有限公司,http://www.11467.com/hangzhou/co/288553.htm
杭州禾田生物技术有限公司销售部,http://www.11467.com/hangzhou/co/288183.htm
杭州万隆贸易有限公司,http://www.11467.com/hangzhou/co/290398.htm
杭州恒泉科技开发公司,http://www.11467.com/hangzhou/co/289623.htm
杭州盛华香料有限公司,http://www.11467.com/hangzhou/co/9481.htm
杭州下沙生物科技有限公司,http://www.11467.com/hangzhou/co/162171.htm
杭州香蜜贸易有限公司,http://www.11467.com/hangzhou/co/291758.htm
杭州馨艺坊香精香料有限公司,http://www.11467.com/hangzhou/co/291706.htm
杭州博多工贸有限公司食品厂,http://www.11467.com/hangzhou/co/291324.htm
杭州味之味香精香料有限公司,http://www.11467.com/hangzhou/co/303090.htm
盛华香料（杭州）有限公司,http://www.11467.com/hangzhou/co/287491.htm
杭州良金药业有限公司,http://www.11467.com/hangzhou/co/288719.htm
南宁卓永建工贸有限公司杭州办事处,http://www.11467.com/hangzhou/co/289755.htm
齐齐哈尔台龙食品有限公司业务部,http://www.11467.com/hangzhou/co/291532.htm
金菌克生物制品有限公司,http://www.11467.com/hangzhou/co/290329.htm
浙江诺诚食品配料有限公司,http://www.11467.com/hangzhou/co/289429.htm
浙江中融科贸集团有限公司,http://www.11467.com/hangzhou/co/204268.htm
浙江省建德市正发药业有限公司,http://www.11467.com/hangzhou/co/369491.htm
浙江省建德市正发实业有限公司,http://www.11467.com/hangzhou/co/370169.htm
山东山大华特科技股份有限公司环保公司杭州办,http://www.11467.com/hangzhou/co/370796.htm
重庆武隆仙女天然色素公司,http://www.11467.com/hangzhou/co/291488.htm
杭州沁源天然植物科技有限公司,http://www.11467.com/hangzhou/co/187377.htm
