沂源康源生物科技有限公司,http://www.11467.com/zibo/co/97934.htm
杭州富春食品添加剂有限公司,http://www.11467.com/zjfuyang/co/11941.htm
浙江华康药业股份有限公司,http://www.11467.com/quzhou/co/24001.htm
山东悦翔生物有限公司,http://www.11467.com/binzhou/co/41857.htm
宜都大恒碳酸钙开发有限公司,http://www.11467.com/yichang/co/52258.htm
上海甘源实业有限公司,http://www.11467.com/shanghai/co/54523.htm
郑州瑞普生物工程有限公司,http://www.11467.com/zhengzhou/co/62814.htm
泰安广源国际贸易有限公司,http://www.11467.com/taian/co/39866.htm
新疆绿旗生物科技有限公司,http://www.11467.com/changji/co/12848.htm
江门市桑海化工有限公司,http://www.11467.com/jiangmen/co/114376.htm
郑州雪麦龙食品香料有限公司,http://www.11467.com/zhengzhou/co/135074.htm
邢台万达生物工程有限公司,http://www.11467.com/xintai/co/31187.htm
常州市群才干燥设备有限公司,http://www.11467.com/changzhou/co/147999.htm
荆门市磊鑫石膏制品有限公司,http://www.11467.com/jingmen/co/15361.htm
合肥翔之鸿食品有限公司,http://www.11467.com/hefei/co/131455.htm
东莞市天丽食品添加剂实业有限公司重庆办事处,http://www.11467.com/chongqing/co/55411.htm
郑州拜纳佛生物工程股份有限公司,http://www.11467.com/zhengzhou/co/138875.htm
安徽省天创生物科技有限公司,http://www.11467.com/suzhoushi/co/18457.htm
阳江市港阳香化企业有限公司,http://www.11467.com/yangjiang/co/17781.htm
辽宁科海食品化学工程有限公司,http://www.11467.com/dandong/co/47939.htm
江门科隆生物技术股份有限公司,http://www.11467.com/jiangmen/co/99102.htm
孟州市超鑫食品有限公司,http://www.11467.com/jiaozuo/co/22155.htm
安徽天启化工科技有限公司,http://www.11467.com/huaibei/co/13670.htm
衡阳市建衡实业有限公司,http://www.11467.com/hengyang/co/27826.htm
青岛天新食品添加剂有限公司,http://www.11467.com/qingdao/co/9375.htm
江西聪聪乐食品工业有限公司,http://www.11467.com/nanchang/co/96898.htm
佛山市顺德区高峰淀粉化学有限公司,http://www.11467.com/foshan/co/280007.htm
连云港东泰食品配料有限公司,http://www.11467.com/lianyungang/co/31056.htm
嘉兴恒杰生物制药有限公司,http://www.11467.com/jiaxing/co/92288.htm
河南京华食品科技开发有限公司,http://www.11467.com/jiaozuo/co/22152.htm
郑州康晖食品科技有限公司,http://www.11467.com/zhengzhou/co/133155.htm
安徽三信化工有限公司,http://www.11467.com/chizhou/co/61.htm
淮北领航生物科技有限公司,http://www.11467.com/huaibei/co/13838.htm
宿迁市宏顺食品工业有限公司,http://www.11467.com/suqian/co/13058.htm
韶关市颐林泉生物科技有限公司,http://www.11467.com/shaoguan/co/25559.htm
上海东索贸易有限公司郑州办事处,http://www.11467.com/zhengzhou/co/134085.htm
寿光市华天糖醇有限公司山梨醇业务部,http://www.11467.com/weifang/co/120986.htm
保龄宝生物股份有限公司,http://www.11467.com/dezhou/co/50863.htm
鄂托克旗德荣藻业有限责任公司,http://www.11467.com/eerduosi/co/10098.htm
沙县超燃能源科技开发有限公司,http://www.11467.com/sanming/co/32192.htm
大庆市禹光生物科技有限公司,http://www.11467.com/daqing/co/41708.htm
合肥香岛食品有限公司,http://www.11467.com/hefei/co/141611.htm
衡阳市春茂化工有限公司,http://www.11467.com/hengyang/co/28525.htm
山东协力生物科技股份有限公司,http://www.11467.com/heze/co/34192.htm
江门市恒俊食用化工有限公司,http://www.11467.com/jiangmen/co/99096.htm
惠州市万憬丰化工有限公司,http://www.11467.com/huizhou/co/98926.htm
云浮市新金山生物科技有限公司,http://www.11467.com/yunfu/co/18297.htm
正扬杀菌保鲜技术（泰州）有限公司,http://www.11467.com/taizhoushi/co/2983.htm
广州市馨祺邦贸易有限公司,http://www.11467.com/guangzhou/co/570309.htm
广州四季风香精香料有限公司,http://www.11467.com/guangzhou/co/161589.htm
上海顶淳食品有限公司,http://www.11467.com/shanghai/co/1058861.htm
济南维辰生物技术有限公司,http://www.11467.com/jinan/co/142025.htm
阳江市星光香化有限公司,http://www.11467.com/yangjiang/co/17778.htm
杞县世林电子商务有限公司,http://www.11467.com/kaifeng/co/31871.htm
安徽沃尔德生物科技有限公司,http://www.11467.com/bengbu/co/39358.htm
芜湖市同力食品有限公司,http://www.11467.com/wuhu/co/25405.htm
西安世珍生物技术有限责任公司,http://www.11467.com/xian/co/85325.htm
陕西太极华青科技有限公司,http://www.11467.com/xian/co/87654.htm
上海鹤善实业有限责任公司,http://www.11467.com/shanghai/co/429196.htm
齐齐哈尔台龙食品有限公司,http://www.11467.com/qiqihaer/co/15969.htm
莆田市海悦食品有限公司,http://www.11467.com/putian/co/33453.htm
厦门雅加美食品有限公司,http://www.11467.com/xiamen/co/74853.htm
咸阳瑞欣生物技术有限公司,http://www.11467.com/xianyang/co/21192.htm
烟台市润隆海洋生物制品有限公司,http://www.11467.com/yantai/co/130687.htm
枣庄市大大食品有限公司,http://www.11467.com/zaozhuang/co/26389.htm
徐闻县奥凯生物科技有限公司,http://www.11467.com/zhanjiang/co/44021.htm
徐州冬荷科技有限公司,http://www.11467.com/xuzhou/co/60844.htm
南通晶鑫医学科技有限公司,http://www.11467.com/nantong/co/110626.htm
江西金碧源实业有限责任公司,http://www.11467.com/nanchang/co/96938.htm
石家庄聚格化工有限公司,http://www.11467.com/shijiazhuang/co/137758.htm
陕西帕尼尔生物科技有限公司,http://www.11467.com/xian/co/127970.htm
莆田市城厢区昌德食品有限公司,http://www.11467.com/putian/co/33467.htm
中食都庆生物技术有限公司,http://www.11467.com/heze/co/58616.htm
西安天汉食化有限公司,http://www.11467.com/xian/co/163100.htm
河南莲花酶工程有限公司,http://www.11467.com/zhoukou/co/36861.htm
青海森利进出口贸易有限公司,http://www.11467.com/xining/co/26967.htm
青岛玉婷食品有限公司,http://www.11467.com/qingdao/co/152186.htm
廊坊丰得润化工有限公司,http://www.11467.com/langfang/co/33886.htm
梁山县益民生物科技有限公司,http://www.11467.com/jining/co/109596.htm
山东三元生物科技股份有限公司,http://www.11467.com/binzhou/co/22150.htm
山东中科生物科技股份有限公司,http://www.11467.com/weifang/co/89217.htm
郑州市鸿程化工产品有限公司,http://www.11467.com/zhengzhou/co/170120.htm
山东省悦翔生物有限公司,http://www.11467.com/binzhou/co/55669.htm
河南巨龙生物工程股份有限公司,http://www.11467.com/pingdingshan/co/33194.htm
漯河骏驰变性淀粉有限公司,http://www.11467.com/luohe/co/25687.htm
宁都县福明林产科技有限公司,http://www.11467.com/ganzhou/co/40855.htm
安泰生物工程股份有限公司,http://www.11467.com/qiqihaer/co/59298.htm
桐乡市泸东化工助剂有限公司,http://www.11467.com/jiaxing/co/135047.htm
河南汇福和植物蛋白科技有限公司,http://www.11467.com/kaifeng/co/19695.htm
常州远大新星聚氨酯制品有限公司,http://www.11467.com/changzhou/co/56424.htm
郑州龙海啤酒物资有限公司,http://www.11467.com/zhengzhou/co/66304.htm
河南仰韶生化工程有限公司,http://www.11467.com/xinyang/co/22968.htm
济宁科硕生物科技有限公司,http://www.11467.com/jining/co/105634.htm
中食都庆（山东菏泽）生物技术有限公司,http://www.11467.com/heze/co/59590.htm
南宁庞博生物工程有限公司,http://www.11467.com/nanning/co/54027.htm
郑州龙和化工有限公司,http://www.11467.com/zhengzhou/co/149514.htm
汕头市明德食品添加剂有限公司,http://www.11467.com/guangzhou/co/387091.htm
陕西森弗高科实业有限公司,http://www.11467.com/xian/co/85298.htm
河南金润食品添加剂有限公司,http://www.11467.com/zhengzhou/co/137225.htm
南宁东恒华道生物科技有限责任公司,http://www.11467.com/nanning/co/74445.htm
郑州天通食品配料有限公司,http://www.11467.com/zhengzhou/co/136894.htm
湖北富程魔芋产业发展有限公司,http://www.11467.com/yichang/co/46924.htm
上海戴迪实业发展有限公司,http://www.11467.com/shanghai/co/946265.htm
长沙华康生物技术开发有限公司,http://www.11467.com/changsha/co/92302.htm
成都华高药业有限公司,http://www.11467.com/chengdu/co/16134.htm
大连兴和酵母有限公司,http://www.11467.com/dalian/co/57549.htm
江苏瑞丰化工有限公司,http://www.11467.com/lianyungang/co/30583.htm
湖北仙果园科技发展有限公司,http://www.11467.com/wuhan/co/89441.htm
武汉市金德戈糖业有限公司,http://www.11467.com/wuhan/co/103886.htm
江苏优普保鲜技术有限公司,http://www.11467.com/nantong/co/151362.htm
上海华宝孔雀香精香料有限公司,http://www.11467.com/shanghai/co/327138.htm
滕州中正化工有限公司,http://www.11467.com/zaozhuang/co/36764.htm
柳州高通食品化工有限公司,http://www.11467.com/liuzhou/co/43255.htm
永州市雅大科技实业有限公司,http://www.11467.com/yongzhou/co/13999.htm
河南奥尼斯特食品有限公司,http://www.11467.com/zhengzhou/co/173804.htm
湖州市菱湖新望化学有限公司,http://www.11467.com/huzhou/co/36855.htm
广州市永晟贸易有限公司,http://www.11467.com/guangzhou/co/387158.htm
郑州铸鼎化工产品发展有限公司,http://www.11467.com/zhengzhou/co/149375.htm
蓬莱市海洋生物有限公司,http://www.11467.com/yantai/co/133931.htm
淮南天力生物工程开发有限公司,http://www.11467.com/huainan/co/11896.htm
嘉兴市虎啸化工有限公司,http://www.11467.com/jiaxing/co/123263.htm
广州市耶尚贸易有限公司,http://www.11467.com/guangzhou/co/387176.htm
淄博中食歌瑞生物技术有限公司,http://www.11467.com/zibo/co/84011.htm
广州优锐生物科技有限公司,http://www.11467.com/guangzhou/co/379338.htm
东莞东美食品有限公司,http://www.11467.com/dongguan/co/48034.htm
广西南宁万特机电设备有限公司,http://www.11467.com/nanning/co/58605.htm
山东康宝生化科技有限公司,http://www.11467.com/dongying/co/42056.htm
武汉佳成生物有限公司,http://www.11467.com/wuhan/co/169671.htm
郑州君发科技有限公司,http://www.11467.com/zhengzhou/co/172800.htm
郑州容大食品有限公司,http://www.11467.com/zhengzhou/co/175867.htm
安徽富坤贸易有限公司,http://www.11467.com/hefei/co/100226.htm
曲阜圣仁制药有限公司,http://www.11467.com/jining/co/47715.htm
云南宏绿辣素有限公司,http://www.11467.com/kunming/co/127049.htm
青岛同兴天然色素有限公司,http://www.11467.com/qingdao/co/156909.htm
东莞市天丽食品添加剂实业有限公司,http://www.11467.com/dongguan/co/370996.htm
广西大普食品有限公司,http://www.11467.com/nanning/co/85971.htm
山东健宇生物科技有限公司,http://www.11467.com/heze/co/22377.htm
徐州恒世食品有限公司,http://www.11467.com/xuzhou/co/60214.htm
上海香杰香精香料有限公司,http://www.11467.com/shanghai/co/49240.htm
青岛聚大洋藻业集团有限公司,http://www.11467.com/qingdao/co/172691.htm
江苏大华科技产业有限公司,http://www.11467.com/nanjing/co/99092.htm
渭南瑞源生物科技有限责任公司,http://www.11467.com/xian/co/85332.htm
山东天骄生物技术有限公司,http://www.11467.com/heze/co/34260.htm
山东天久生物技术有限公司,http://www.11467.com/heze/co/22174.htm
上海江沪实业有限公司,http://www.11467.com/shanghai/co/211685.htm
百氏得森（上海）精细化工有限公司,http://www.11467.com/shanghai/co/89198.htm
淄博联技甜味剂有限公司,http://www.11467.com/zibo/co/84527.htm
上海冠英生物科技发展有限公司,http://www.11467.com/shanghai/co/977587.htm
上海得胜味食品有限公司,http://www.11467.com/shanghai/co/533276.htm
汕头市华馨香料有限公司,http://www.11467.com/shantou/co/137294.htm
徐州诚铭动物胶有限公司,http://www.11467.com/xuzhou/co/54189.htm
郑州鑫明源化工产品有限公司,http://www.11467.com/zhengzhou/co/137364.htm
嘉兴市沪东日用助剂有限公司,http://www.11467.com/jiaxing/co/87570.htm
山东明辉食品有限公司,http://www.11467.com/liaocheng/co/34958.htm
江西省华宏化工有限公司,http://www.11467.com/nanchang/co/66461.htm
连云港光裕永食品配料有限公司,http://www.11467.com/lianyungang/co/30563.htm
珠海紫英生物科技有限公司,http://www.11467.com/zhuhai/co/33909.htm
盐城市海亚冷冻食品有限公司,http://www.11467.com/yancheng/co/5054.htm
北京格莱蒙特国际贸易有限公司,http://www.11467.com/beijing/co/132675.htm
青岛大伟生物工程有限公司,http://www.11467.com/qingdao/co/114150.htm
福建明福琼脂有限公司,http://www.11467.com/sanming/co/18770.htm
无锡华东可可食品股份有限公司,http://www.11467.com/wuxi/co/180293.htm
金华市南山食品添加剂有限公司,http://www.11467.com/jinhua/co/6467.htm
河南亿特化工产品有限公司,http://www.11467.com/zhengzhou/co/188910.htm
浙江巨成化工有限公司,http://www.11467.com/quzhou/co/19276.htm
广东红狮进出口有限公司,http://www.11467.com/guangzhou/co/496566.htm
上海聚鹰国际贸易有限公司,http://www.11467.com/shanghai/co/1041822.htm
淄博海澜化工有限公司,http://www.11467.com/zibo/co/84549.htm
南京伊贝加科技有限公司,http://www.11467.com/nanjing/co/101669.htm
河南华建化工产品有限公司,http://www.11467.com/zhengzhou/co/172782.htm
连云港市贸发实业有限公司,http://www.11467.com/lianyungang/co/19685.htm
广州市加桦贸易有限公司,http://www.11467.com/guangzhou/co/206272.htm
上海大鹰生物科技有限公司,http://www.11467.com/shanghai/co/326825.htm
南宁市春旭化工有限责任公司,http://www.11467.com/nanning/co/69263.htm
南通市舒洋贸易有限公司,http://www.11467.com/nantong/co/81822.htm
广州永易食品原料有限公司,http://www.11467.com/guangzhou/co/387130.htm
郑州程达化工产品有限公司,http://www.11467.com/zhengzhou/co/171639.htm
厦门欣长隆商贸有限公司,http://www.11467.com/xiamen/co/103091.htm
开封市祥龙工贸有限公司,http://www.11467.com/kaifeng/co/11316.htm
贵州红星发展都匀绿友有限责任公司,http://www.11467.com/qiannan/co/8979.htm
杭州绿源精细化工有限公司,http://www.11467.com/hangzhou/co/81288.htm
上海喜若飞精细化工有限公司,http://www.11467.com/shanghai/co/894180.htm
上海健音食品科技有限公司,http://www.11467.com/shanghai/co/1039150.htm
神州富盛科技（北京）有限公司,http://www.11467.com/beijing/co/624977.htm
青岛海伽生物科技有限公司,http://www.11467.com/qingdao/co/154427.htm
广州市名花香料有限公司,http://www.11467.com/guangzhou/co/52803.htm
河北欣奇典生物科技有限公司,http://www.11467.com/zhangjiakou/co/44196.htm
无锡市宝丽鑫化工贸易有限公司,http://www.11467.com/wuxi/co/208749.htm
石家庄旭尔美生物科技有限公司,http://www.11467.com/shijiazhuang/co/142574.htm
郑州市瑞恒化工产品有限公司,http://www.11467.com/zhengzhou/co/148674.htm
西安大丰收生物科技有限公司,http://www.11467.com/xian/co/95852.htm
郑州弘益泰化工产品有限公司,http://www.11467.com/zhengzhou/co/148636.htm
郑州鸿祥化工食品有限公司,http://www.11467.com/zhengzhou/co/149079.htm
郑州亿邦实业有限公司,http://www.11467.com/zhengzhou/co/137130.htm
郑州超群化工有限公司,http://www.11467.com/zhengzhou/co/173822.htm
北京京润宇通经贸有限公司,http://www.11467.com/beijing/co/673870.htm
江西高能化学工业有限公司,http://www.11467.com/nanchang/co/61461.htm
上海耐因实业有限公司总部,http://www.11467.com/shanghai/co/538827.htm
济南德乐生物技术有限公司,http://www.11467.com/jinan/co/114159.htm
北京天竹鸟食品添加剂有限公司,http://www.11467.com/beijing/co/325243.htm
北京荣振丰达商贸有限公司,http://www.11467.com/beijing/co/312159.htm
天津环宇红星食品贸易有限公司,http://www.11467.com/tianjin/co/63932.htm
山东滨州三元生物科技有限公司,http://www.11467.com/binzhou/co/22443.htm
深圳市美多实业有限公司,http://www.11467.com/shenzhen/co/81480.htm
河南沃凯德食品配料有限公司,http://www.11467.com/zhengzhou/co/264103.htm
郑州盛源化工产品有限公司,http://www.11467.com/dazhou/co/17557.htm
淄博同善德食品添加剂有限公司,http://www.11467.com/zibo/co/84385.htm
开封百川汇宝实业有限公司,http://www.11467.com/kaifeng/co/16779.htm
济南亚西亚药业有限公司,http://www.11467.com/jinan/co/97890.htm
湖北兴银禾食品配料有限公司,http://www.11467.com/wuhan/co/117428.htm
郑州赛尔福食品有限公司,http://www.11467.com/zhengzhou/co/136867.htm
大连保鲜剂有限公司,http://www.11467.com/dalian/co/66080.htm
上海市东佐食品有限公司,http://www.11467.com/shanghai/co/429159.htm
北京华印世方国际贸易有限公司销售部,http://www.11467.com/beijing/co/655527.htm
北京华印世方国际贸易有限公司,http://www.11467.com/beijing/co/655526.htm
青岛陆橘科技有限公司,http://www.11467.com/qingdao/co/193647.htm
重庆市荣清净水材料有限公司,http://www.11467.com/chongqing/co/113752.htm
北京鑫成潞河食品有限公司,http://www.11467.com/beijing/co/761989.htm
郑州阳光食品配料有限公司,http://www.11467.com/zhengzhou/co/134116.htm
上海倍翔生物科技有限公司,http://www.11467.com/shanghai/co/685836.htm
上海呈味食品有限公司,http://www.11467.com/shanghai/co/898199.htm
河南龙生食品化工有限公司,http://www.11467.com/zhengzhou/co/148658.htm
如泰味业科贸有限公司,http://www.11467.com/beijing/co/278347.htm
成都名洲贸易有限公司,http://www.11467.com/chengdu/co/142332.htm
西安美智进出口贸易有限公司,http://www.11467.com/xian/co/95743.htm
汝南县梦庆达调味品有限公司,http://www.11467.com/zhumadian/co/23681.htm
安徽兴宙医药有限公司,http://www.11467.com/xuancheng/co/21191.htm
徐州品乐道食品配料有限公司,http://www.11467.com/xuzhou/co/61257.htm
南京林诺工贸有限公司,http://www.11467.com/nanjing/co/41988.htm
青岛德维普化工有限公司,http://www.11467.com/qingdao/co/154572.htm
广州市博顺化工有限公司,http://www.11467.com/qiye/5354.htm
郑州亚邦化工产品有限公司,http://www.11467.com/zhengzhou/co/137367.htm
广州健威食品添加剂有限公司,http://www.11467.com/guangzhou/co/484127.htm
赛尔福食品有限公司,http://www.11467.com/zhengzhou/co/148301.htm
郑州科瑞达食品有限公司,http://www.11467.com/zhengzhou/co/5016.htm
哈尔滨市盈鑫大豆蛋白厂 哈尔滨鑫事达经贸有限公司,http://www.11467.com/haerbin/co/62328.htm
山东华硕生物科技有限责任公司,http://www.11467.com/jining/co/56519.htm
郑州天顺食品添加剂有限公司,http://www.11467.com/zhengzhou/co/149798.htm
郑州天宇食品配料有限公司,http://www.11467.com/zhengzhou/co/137278.htm
郑州超群化工食品有限公司,http://www.11467.com/zhengzhou/co/149756.htm
青岛市圣禾食品科技有限公司,http://www.11467.com/qingdao/co/82822.htm
郑州天乐化工产品有限公司,http://www.11467.com/zhengzhou/co/149567.htm
郑州天通食品配料有限公司,http://www.11467.com/zhengzhou/co/170085.htm
郑州福润德生物工程有限公司,http://www.11467.com/zhengzhou/co/134502.htm
石家庄绿川生物科技有限公司,http://www.11467.com/shijiazhuang/co/108509.htm
广州巨兰化工科技有限公司,http://www.11467.com/guangzhou/co/494735.htm
长沙拓福食品科技有限公司,http://www.11467.com/changsha/co/97464.htm
浙江深友生物技术有限公司,http://www.11467.com/huzhou/co/52960.htm
郑州诚旺化工产品有限公司,http://www.11467.com/zhengzhou/co/149080.htm
临汾市力圣生物科技开发有限公司,http://www.11467.com/linfen/co/31557.htm
珠海市华美生化科技发展有限公司,http://www.11467.com/zhuhai/co/84792.htm
本溪黑马化工实业有限公司,http://www.11467.com/benxi/co/15672.htm
长沙农建科技有限公司,http://www.11467.com/changsha/co/97556.htm
长春赢顺商贸有限公司,http://www.11467.com/changchun/co/69387.htm
成都亚先晶泰新材料有限公司,http://www.11467.com/chengdu/co/124540.htm
烟台华信工贸发展有限公司,http://www.11467.com/yantai/co/129298.htm
大连华农豆业科技发展有限公司,http://www.11467.com/dalian/co/57342.htm
长春天明瑞科技有限公司,http://www.11467.com/changchun/co/95733.htm
郑州直支食品添加剂有限公司,http://www.11467.com/zhengzhou/co/170181.htm
上海金津贸易有限公司,http://www.11467.com/shanghai/co/745164.htm
北京中海康源公司,http://www.11467.com/beijing/co/145883.htm
东莞市新科源化工有限公司,http://www.11467.com/dongguan/co/271723.htm
河南百川汇宝食用冰醋酸有限公司,http://www.11467.com/zhengzhou/co/149298.htm
广州五味源生物科技有限公司,http://www.11467.com/guangzhou/co/455062.htm
郑州锐意工贸有限公司,http://www.11467.com/zhengzhou/co/149762.htm
青岛市圣禾食品科技有限公司,http://www.11467.com/qingdao/co/82822.htm
上海毅资贸易有限公司,http://www.11467.com/shanghai/co/747836.htm
淄博中食歌瑞生物技术有限公司,http://www.11467.com/zibo/co/84011.htm
东莞市飞度五金机械有限公司,http://www.11467.com/dongguan/co/502562.htm
长春申通科技开发有限公司,http://www.11467.com/changchun/co/78688.htm
常州山鹰食用化工有限公司,http://www.11467.com/changzhou/co/17934.htm
上海耐今实业有限公司,http://www.11467.com/shanghai/co/1035736.htm
东光县通宇化工有限责任公司,http://www.11467.com/cangzhou/co/58465.htm
龙海市天地食品科技有限公司,http://www.11467.com/zhangzhou/co/54820.htm
石家庄振铭化工有限公司,http://www.11467.com/baoding/co/91483.htm
深圳市欣荣泰贸易有限公司,http://www.11467.com/shenzhen/co/759120.htm
河南宣源化工有限公司,http://www.11467.com/zhengzhou/co/149157.htm
河南省可以化工有限公司,http://www.11467.com/zhengzhou/co/134419.htm
河南正通化工有限公司,http://www.11467.com/zhengzhou/co/25573.htm
佛山市层层高食品有限公司,http://www.11467.com/foshan/co/260416.htm
广州博峰化工科技有限公司,http://www.11467.com/guangzhou/co/429546.htm
广州穗欣化工有限公司,http://www.11467.com/guangzhou/co/322371.htm
广州市嘉伟达化工有限公司,http://www.11467.com/guangzhou/co/380669.htm
桂林永福罗汉果产业有限公司,http://www.11467.com/guilin/co/28642.htm
济南恒利达食品添加剂有限公司,http://www.11467.com/jinan/co/28976.htm
山东华仙甜菊股份有限公司,http://www.11467.com/jining/co/34146.htm
连云港市诺信化工有限公司,http://www.11467.com/lianyungang/co/31078.htm
连云港格兰特化工有限公司,http://www.11467.com/lianyungang/co/6771.htm
连云港润普食品配料有限公司,http://www.11467.com/lianyungang/co/30818.htm
连云港信瑞国际贸易有限公司,http://www.11467.com/lianyungang/co/30148.htm
福建省南平森发天然色素有限公司,http://www.11467.com/nanping/co/30905.htm
广饶六合化工有限公司,http://www.11467.com/qingdao/co/114263.htm
临沂伟泰贸易有限公司,http://www.11467.com/linyi/co/70775.htm
广西南宁杰沃利生物制品有限公司,http://www.11467.com/nanning/co/62635.htm
广州市越佳贸易有限公司,http://www.11467.com/guangzhou/co/494820.htm
广州合全商贸有限公司,http://www.11467.com/guangzhou/co/261774.htm
南京永青食品高新技术发展有限公司,http://www.11467.com/nanjing/co/101673.htm
南京清荷化工有限公司,http://www.11467.com/nanjing/co/101693.htm
青岛瑞捷食品化工有限公司,http://www.11467.com/qingdao/co/114260.htm
昆明益绅特工贸有限责任公司,http://www.11467.com/kunming/co/116656.htm
河北百味生物科技有限公司,http://www.11467.com/handan/co/68206.htm
杭州达康化工有限公司,http://www.11467.com/hangzhou/co/1229.htm
济宁市运河甜菊糖有限公司,http://www.11467.com/jining/co/40294.htm
广州市宁阳化工有限公司,http://www.11467.com/guangzhou/co/387103.htm
广州市升迅化工有限公司,http://www.11467.com/guangzhou/co/353193.htm
广州市乐子贸易有限公司,http://www.11467.com/guangzhou/co/387057.htm
广州市聚通钛白粉有限公司,http://www.11467.com/guangzhou/co/207803.htm
广州恒硕化工有限公司,http://www.11467.com/guangzhou/co/400008.htm
南宁荟力生化科技有限公司,http://www.11467.com/nanning/co/86773.htm
冀州华恒生物科技有限公司,http://www.11467.com/hengshui/co/35162.htm
莒南县志达包装有限公司,http://www.11467.com/linyi/co/94775.htm
临沂市华茂贸易有限公司,http://www.11467.com/linyi/co/94346.htm
云南昆虫生物科技有限公司,http://www.11467.com/kunming/co/114114.htm
广州市南一进出口贸易有限公司,http://www.11467.com/guangzhou/co/387097.htm
广州天宝食品添加剂有限公司,http://www.11467.com/guangzhou/co/387147.htm
广州天金化工有限公司,http://www.11467.com/guangzhou/co/35762.htm
格尔木西部富丰钾肥销售有限公司,http://www.11467.com/haixi/co/5347.htm
广州市斌龙化工有限公司,http://www.11467.com/guangzhou/co/35609.htm
