上海锐鲨高新材料有限公司,http://www.11467.com/shanghai/co/1090514.htm
维氏实业（上海）有限公司,http://www.11467.com/shanghai/co/946007.htm
南通万通食品科技有限公司,http://www.11467.com/nantong/co/113734.htm
南京诺泰施格科学仪器有限公司,http://www.11467.com/nanjing/co/160287.htm
安徽丰原发酵技术工程研究有限公司,http://www.11467.com/bengbu/co/1821.htm
山东恒通生物科技有限公司,http://www.11467.com/binzhou/co/35351.htm
山东西王糖业有限公司,http://www.11467.com/binzhou/co/19378.htm
山东西王食品有限公司,http://www.11467.com/binzhou/co/22331.htm
西王药业有限公司,http://www.11467.com/binzhou/co/22753.htm
山东中惠食品有限公司,http://www.11467.com/binzhou/co/3266.htm
山东省博兴县恒源化工有限公司,http://www.11467.com/binzhou/co/34682.htm
江苏康力生物科技发展有限公司,http://www.11467.com/changzhou/co/148557.htm
长青商贸有限公司,http://www.11467.com/chengdu/co/125684.htm
赤峰盛川膨润土有限公司,http://www.11467.com/chifeng/co/26561.htm
安徽尚善生物科技有限公司,http://www.11467.com/chuzhou/co/30584.htm
东莞领鲜生物科技有限公司,http://www.11467.com/dongguan/co/494407.htm
东莞市志胜实业有限公司,http://www.11467.com/dongguan/co/345769.htm
永泰食品有限公司,http://www.11467.com/fuyang/co/27202.htm
丽珠集团福州福兴医药有限公司,http://www.11467.com/fuzhou/co/155560.htm
广州陆鑫贸易有限公司(销售二部),http://www.11467.com/guangzhou/co/386674.htm
广州市仟禾商贸有限公司,http://www.11467.com/guangzhou/co/90545.htm
广州市食品工业研究所有限公司,http://www.11467.com/guangzhou/co/386955.htm
海南省文昌市友助食品有限公司,http://www.11467.com/guangzhou/co/379958.htm
桂林市红星化工有限责任公司,http://www.11467.com/guilin/co/8412.htm
友谊九鼎酵母有限公司,http://www.11467.com/haerbin/co/57130.htm
邯郸市飞鸿物资有限公司,http://www.11467.com/handan/co/38453.htm
河北天旭天然色素有限公司,http://www.11467.com/handan/co/68946.htm
杭州南海食品配料有限公司,http://www.11467.com/hangzhou/co/290726.htm
杭州普丽美地生物科技有限公司,http://www.11467.com/hangzhou/co/371258.htm
菏泽大树生物工程科技有限公司,http://www.11467.com/heze/co/29292.htm
孟州泰利杰有限责任公司,http://www.11467.com/jiaozuo/co/26865.htm
焦作市奥润生物工程有限公司,http://www.11467.com/jiaozuo/co/14044.htm
孟州市融丰食品有限公司,http://www.11467.com/jiaozuo/co/26691.htm
宁波王龙科技股份有限公司,http://www.11467.com/ningbo/co/192579.htm
青岛海之林生物科技开发有限公司,http://www.11467.com/qingdao/co/153447.htm
青岛保税区三丰和贸易有限公司,http://www.11467.com/qingdao/co/109904.htm
青岛倍拓生物工程有限公司,http://www.11467.com/qingdao/co/111973.htm
青岛天之味食品有限公司,http://www.11467.com/qingdao/co/153459.htm
福建省金燕海洋生物科技股份有限公司,http://www.11467.com/quanzhou/co/120096.htm
沈阳中街冰点城食品有限公司,http://www.11467.com/shenyang/co/18253.htm
深圳加森科技有限公司,http://www.11467.com/shenzhen/co/798749.htm
深圳江源商贸有限公司,http://www.11467.com/shenzhen/co/775459.htm
深圳市汉福隆贸易有限公司，,http://www.11467.com/shenzhen/co/663914.htm
深圳市派浦科技有限公司,http://www.11467.com/shenzhen/co/769655.htm
万载县辉明化工有限公司,http://www.11467.com/shenzhen/co/590517.htm
郑州市洁星力清洗日化有限公司,http://www.11467.com/shenzhen/co/665597.htm
鹰特化工(石家庄)有限公司,http://www.11467.com/shijiazhuang/co/141317.htm
苏州高峰淀粉科技有限公司,http://www.11467.com/suzhou/co/250373.htm
武汉星辰现代生物工程有限公司,http://www.11467.com/wuhan/co/42098.htm
武汉三江航天固德生物科技有限公司,http://www.11467.com/wuhan/co/100815.htm
武汉味佳麦斯特味食品原料有限公司,http://www.11467.com/wuhan/co/102797.htm
无锡赛德生物工程有限公司,http://www.11467.com/wuxi/co/141935.htm
江苏博立生物制品有限公司,http://www.11467.com/wuxi/co/206492.htm
河南前进商贸有限公司,http://www.11467.com/xinxiang/co/31490.htm
江苏省徐州韵舟商贸有限公司,http://www.11467.com/xuzhou/co/80707.htm
徐州健翔食品配料有限公司,http://www.11467.com/xuzhou/co/82026.htm
山东好加旺生物科技有限公司,http://www.11467.com/yantai/co/155573.htm
烟台麦特尔生物技术有限公司,http://www.11467.com/yantai/co/60836.htm
岳阳湘茂医药化工有限公司,http://www.11467.com/yueyang/co/33552.htm
河南省郑州市成果食品添加剂有限公司,http://www.11467.com/zhengzhou/co/174636.htm
河南省所以化工商贸有限公司,http://www.11467.com/zhengzhou/co/133988.htm
河南省所以食品添加剂有限公司,http://www.11467.com/zhengzhou/co/133984.htm
河南阳光化工产品发展有限公司,http://www.11467.com/zhengzhou/co/172796.htm
河南省所以化工有限公司销售二部,http://www.11467.com/zhengzhou/co/134011.htm
河南省典华商贸有限公司,http://www.11467.com/zhengzhou/co/133379.htm
所以化工配料有限公司,http://www.11467.com/zhengzhou/co/133378.htm
河南省所以化工有限公司销售3部,http://www.11467.com/zhengzhou/co/137092.htm
河南省所以化工有限公司销售三部,http://www.11467.com/zhengzhou/co/135452.htm
河南中豪食品添加剂有限公司,http://www.11467.com/zhengzhou/co/176395.htm
河南郑州所以化工有限公司销售二部,http://www.11467.com/zhengzhou/co/137098.htm
郑州顺达食品添加剂有限公司,http://www.11467.com/zhengzhou/co/176889.htm
郑州一品科贸有限公司,http://www.11467.com/zhengzhou/co/58533.htm
河南世纪百川食品配料有限公司,http://www.11467.com/zhengzhou/co/135276.htm
郑州市所以化工有限公司,http://www.11467.com/zhengzhou/co/137095.htm
河南省所以化工有限公司销售六部,http://www.11467.com/zhengzhou/co/135449.htm
郑州世纪安华食品配料有限公司,http://www.11467.com/zhengzhou/co/133439.htm
河南省所以化工有限公司一分公司,http://www.11467.com/zhengzhou/co/136733.htm
郑州元丰食品添加剂有限公司,http://www.11467.com/zhengzhou/co/133316.htm
郑州明欣化工有限公司,http://www.11467.com/zhengzhou/co/176394.htm
郑州富康精细化工有限公司,http://www.11467.com/zhengzhou/co/172804.htm
郑州百家实业有限公司,http://www.11467.com/zhengzhou/co/136712.htm
活力源酵母有限公司,http://www.11467.com/qiqihaer/co/61923.htm
陕西安康秦东魔芋食品有限公司,http://www.11467.com/ankang/co/13202.htm
金洋生物工程有限责任公司,http://www.11467.com/baoding/co/81274.htm
陕西天一谷物科技有限公司,http://www.11467.com/baoji/co/31090.htm
宝鸡润与生物科技有限公司,http://www.11467.com/baoji/co/30861.htm
包头市方元食品原料有限责任公司,http://www.11467.com/baotou/co/26362.htm
内蒙古嘉源生物科技有限责任公司,http://www.11467.com/bayannaoer/co/5753.htm
贵州玖圣淀粉加工有限公司,http://www.11467.com/bijie/co/9352.htm
邹平西王生物工程有限公司,http://www.11467.com/binzhou/co/35755.htm
滨州市耀星生物科技有限公司,http://www.11467.com/binzhou/co/22645.htm
山东省滨州市绿洲食品有限公司,http://www.11467.com/binzhou/co/1983.htm
吉林省百汇食品添加剂有限公司,http://www.11467.com/changchun/co/78802.htm
新疆保润农业发展有限公司,http://www.11467.com/changji/co/13540.htm
长沙龙润食品添加剂公司,http://www.11467.com/changsha/co/96183.htm
湖南康麓生物科技有限公司,http://www.11467.com/changsha/co/119710.htm
郑州新宇翔食品有限公司,http://www.11467.com/zhengzhou/co/135991.htm
河南省盛祥化工有限公司,http://www.11467.com/zhengzhou/co/173827.htm
郑州浩力化工集团有限公司第一分部,http://www.11467.com/zhengzhou/co/133761.htm
郑州浩力化工集团有限公司,http://www.11467.com/zhengzhou/co/133760.htm
嘉吉生物工程(淄博)有限公司,http://www.11467.com/zibo/co/83506.htm
北京麦乐宝食品有限责任公司,http://www.11467.com/beijing/co/286050.htm
北京诺美医药科技有限公司,http://www.11467.com/beijing/co/674201.htm
北京威康信国际贸易有限公司,http://www.11467.com/beijing/co/132180.htm
中国医药工业有限公司,http://www.11467.com/beijing/co/430366.htm
上海化泰实业有限公司,http://www.11467.com/shanghai/co/653229.htm
上海蓝平实业有限公司销售部,http://www.11467.com/shanghai/co/427838.htm
上海蓝平添加剂二实业有限公司,http://www.11467.com/shanghai/co/427790.htm
上海蓝平集团有限公司,http://www.11467.com/shanghai/co/427923.htm
上海梅香实业有限公司,http://www.11467.com/shanghai/co/1044298.htm
上海蓝平配料有限公司,http://www.11467.com/shanghai/co/427781.htm
上海柯原实业有限公司分公司（销售部）,http://www.11467.com/shanghai/co/89016.htm
上海柯原实业食品添加剂有限公司,http://www.11467.com/shanghai/co/89014.htm
上海柯原实业总公司,http://www.11467.com/shanghai/co/89184.htm
上海柯原实业有限公司销售总部,http://www.11467.com/shanghai/co/88987.htm
上海柯原实业公司,http://www.11467.com/shanghai/co/89018.htm
上海柯原实业有限公司销售一部,http://www.11467.com/shanghai/co/88985.htm
上海柯原实业有限九公司,http://www.11467.com/shanghai/co/89013.htm
上海柯原实业有限公司分公司,http://www.11467.com/shanghai/co/89015.htm
上海钰通化工科技有限责任公司,http://www.11467.com/shanghai/co/678895.htm
天津天康源生物技术有限公司,http://www.11467.com/tianjin/co/197540.htm
天津西青区乐邦生物科技有限公司,http://www.11467.com/tianjin/co/200896.htm
重庆力宏精细化工有限公司,http://www.11467.com/chongqing/co/91325.htm
重庆欣欣向荣精细化工有限公司,http://www.11467.com/chongqing/co/19350.htm
广西诺方生物技术有限公司,http://www.11467.com/nanning/co/93960.htm
天津金佰佳生物科技有限公司,http://www.11467.com/tianjin/co/270287.htm
浏阳艾特天然产物研究与开发有限公司,http://www.11467.com/changsha/co/97427.htm
湖南长沙华冠科技有限公司,http://www.11467.com/changsha/co/119713.htm
常州市华泰氨基酸(集团)有限公司,http://www.11467.com/changzhou/co/119845.htm
常茂生物化学工程股份有限公司,http://www.11467.com/changzhou/co/87523.htm
成都市一心化工有限责任公司,http://www.11467.com/chengdu/co/126965.htm
成都希福食品有限公司,http://www.11467.com/chengdu/co/125571.htm
四川省成都市为民食品配料有限公司,http://www.11467.com/chengdu/co/128575.htm
大连闻达国际贸易有限公司,http://www.11467.com/dalian/co/58149.htm
大连隆琪贸易有限公司,http://www.11467.com/dalian/co/56776.htm
大连闻达生物科技有限公司,http://www.11467.com/dalian/co/59140.htm
中化辽宁公司,http://www.11467.com/dalian/co/58644.htm
什邡川西兴达化工有限公司,http://www.11467.com/deyang/co/14020.htm
东莞市广益食品添加剂实业有限公司(业务部）,http://www.11467.com/dongguan/co/368073.htm
东莞市广益食品添加剂实业有限公司,http://www.11467.com/dongguan/co/366977.htm
东莞市金仙峰实业有限公司,http://www.11467.com/dongguan/co/371022.htm
广东一品鲜生物科技有限公司（东莞总部）,http://www.11467.com/dongguan/co/370447.htm
乐子贸易有限公司(东莞)分部,http://www.11467.com/dongguan/co/369908.htm
湖北发盛魔芋有限公司,http://www.11467.com/enshi/co/14066.htm
武汉远城科技发展有限公司(赵),http://www.11467.com/ezhou/co/13233.htm
佛山市南海区夏天科技有限公司,http://www.11467.com/foshan/co/278719.htm
佛山市顺德区纳科化工材料有限公司,http://www.11467.com/foshan/co/322563.htm
佛山市奇毅贸易有限公司,http://www.11467.com/foshan/co/281715.htm
佛山悦创化工有限公司,http://www.11467.com/foshan/co/278527.htm
中山市南方新元食品生物工程有限公司,http://www.11467.com/foshan/co/165310.htm
顺德区科德化工实业有限公司,http://www.11467.com/foshan/co/279258.htm
鲁洲生物科技（辽宁）有限公司,http://www.11467.com/fushun/co/27073.htm
丹尼斯克(中国)有限公司,http://www.11467.com/guangzhou/co/377523.htm
广东天冠食品添加剂有限责任公司,http://www.11467.com/guangzhou/co/475549.htm
广州华汇生物公司,http://www.11467.com/guangzhou/co/470406.htm
广州华昶贸易有限公司,http://www.11467.com/guangzhou/co/43671.htm
广州卡罗食品有限公司,http://www.11467.com/guangzhou/co/378732.htm
广东华盛食化有限公司广州分公司,http://www.11467.com/guangzhou/co/246711.htm
广州拜晴公司,http://www.11467.com/guangzhou/co/470408.htm
广东天冠生物科技有限公司,http://www.11467.com/guangzhou/co/463069.htm
广州陆鑫(益鑫)贸易有限公司销售部,http://www.11467.com/guangzhou/co/385543.htm
广州市三尚贸易有限公司,http://www.11467.com/guangzhou/co/325821.htm
广州市泽运洲贸易有限公司,http://www.11467.com/guangzhou/co/379384.htm
广州市鑫昌生物科技有限公司,http://www.11467.com/guangzhou/co/384335.htm
广州帅星实业有限公司,http://www.11467.com/guangzhou/co/459835.htm
江西井冈山生物资源有限公司广州分公司（销售部）,http://www.11467.com/guangzhou/co/380676.htm
广州越秀企业(集团)公司,http://www.11467.com/guangzhou/co/294875.htm
广州市润欣贸易有限公司,http://www.11467.com/guangzhou/co/353262.htm
广州天冠食用化工有限公司,http://www.11467.com/guangzhou/co/379615.htm
广州市亿奇化工科技有限公司,http://www.11467.com/guangzhou/co/376023.htm
广州市香料有限公司,http://www.11467.com/guangzhou/co/472264.htm
广州优宝工业有限公司,http://www.11467.com/guangzhou/co/379334.htm
谱赛科（江西）生物技术有限公司,http://www.11467.com/guangzhou/co/376434.htm
广州市中香香精香料有限公司,http://www.11467.com/guangzhou/co/383705.htm
开封永盛食品配料有限公司,http://www.11467.com/kaifeng/co/15779.htm
开封越宫化工有限公司,http://www.11467.com/kaifeng/co/19912.htm
昆明爱科特生物科技有限公司,http://www.11467.com/kunming/co/96611.htm
云南盛丰德矿业有限公司,http://www.11467.com/kunming/co/116787.htm
三河汇福生物科技有限公司,http://www.11467.com/langfang/co/43884.htm
甘肃华羚生物科技有限公司销售部,http://www.11467.com/lanzhou/co/70516.htm
鲁洲生物科技有限公司,http://www.11467.com/linyi/co/95658.htm
临沂市鑫轮化工有限公司,http://www.11467.com/linyi/co/34289.htm
皖西翔宇香料有限公司,http://www.11467.com/liuan/co/7.htm
江西康源食品有限公司,http://www.11467.com/nanchang/co/108248.htm
江西味元食品有限公司,http://www.11467.com/nanchang/co/96608.htm
南昌泰康科技有限公司,http://www.11467.com/nanchang/co/96803.htm
台湾逸铭酵素实业(香港)有限公司,http://www.11467.com/guangzhou/co/463068.htm
桂林三宝药业有限公司,http://www.11467.com/guilin/co/50724.htm
桂林市润东粮油食品有限公司,http://www.11467.com/guilin/co/51396.htm
桂林微邦生物技术有限公司,http://www.11467.com/guilin/co/50540.htm
哈尔滨工大高新技术产业开发股份有限公司中大植物蛋白分公司,http://www.11467.com/haerbin/co/46042.htm
九三集团哈尔滨惠康食品有限公司,http://www.11467.com/haerbin/co/46063.htm
田乐色素公司,http://www.11467.com/handan/co/53091.htm
杭州德茂贸易有限公司,http://www.11467.com/hangzhou/co/117797.htm
杭州保安康生物技术有限公司,http://www.11467.com/hangzhou/co/172778.htm
杭州绿天生物技术有限公司,http://www.11467.com/hangzhou/co/294781.htm
杭州民生制胶有限公司,http://www.11467.com/hangzhou/co/78040.htm
杭州胜东贸易有限公司,http://www.11467.com/hangzhou/co/195157.htm
杭州威欧生物科技有限公司,http://www.11467.com/hangzhou/co/291757.htm
杭州天工食品科技有限公司,http://www.11467.com/hangzhou/co/288763.htm
浙江禾脉科技有限公司,http://www.11467.com/hangzhou/co/372034.htm
浙江大学百川生物食品技术有限公司,http://www.11467.com/hangzhou/co/14232.htm
浙江三和食品科技有限公司,http://www.11467.com/hangzhou/co/289525.htm
河南永昌飞天淀粉糖有限公司,http://www.11467.com/hebi/co/11629.htm
冀州市华恒生物科技有限公司,http://www.11467.com/hengshui/co/34478.htm
淮南市天力生物工程开发公司,http://www.11467.com/huainan/co/16294.htm
内蒙古呼和浩特市河东公司,http://www.11467.com/huhehaote/co/28119.htm
惠州市品之源食品配料有限公司,http://www.11467.com/huizhou/co/78051.htm
浙江金陵药材开发有限公司,http://www.11467.com/huzhou/co/44927.htm
吉安贝蕾香料有限公司,http://www.11467.com/jian/co/16446.htm
开平健之源保健食品有限公司,http://www.11467.com/jiangmen/co/114381.htm
江门量子高科生物工程有限公司,http://www.11467.com/jiangmen/co/98837.htm
嘉兴天和诚生物科技有限公司,http://www.11467.com/jiaxing/co/123695.htm
吉林市铭洲食品有限责任公司,http://www.11467.com/jilinshi/co/91746.htm
济南圣泉唐和唐生物科技有限公司,http://www.11467.com/jinan/co/101814.htm
济南福克达生物技术有限公司,http://www.11467.com/jinan/co/135207.htm
济南鑫利化工有限公司,http://www.11467.com/jinan/co/134115.htm
浙江迪耳化工有限公司,http://www.11467.com/jinhua/co/80749.htm
曲阜香洲甜菊制品有限责任公司,http://www.11467.com/jining/co/73448.htm
山东梁山长久生物制曲有限公司,http://www.11467.com/jining/co/72497.htm
山东千千药业有限公司,http://www.11467.com/jining/co/72135.htm
梁山京九生物工程有限公司,http://www.11467.com/jining/co/72498.htm
南京迈达化学实业有限公司*,http://www.11467.com/nanjing/co/99937.htm
江苏星泰国际贸易发展有限公司,http://www.11467.com/nanjing/co/100579.htm
南京瑞景特生物技术有限公司,http://www.11467.com/nanjing/co/99224.htm
南京华锦生物制品有限公司,http://www.11467.com/nanjing/co/99700.htm
南宁市越前食品添加剂有限公司,http://www.11467.com/nanning/co/74220.htm
南宁赛龙林化生物有限公司,http://www.11467.com/nanning/co/73672.htm
南通博钰工贸有限公司,http://www.11467.com/nantong/co/110374.htm
南通瑞泰食品技术开发有限公司业务部,http://www.11467.com/nantong/co/110606.htm
南通市优普保鲜技术有限公司,http://www.11467.com/nantong/co/1458.htm
南通光合生物技术有限公司市场部,http://www.11467.com/nantong/co/110264.htm
宁波大红鹰生物工程股份有限公司,http://www.11467.com/ningbo/co/78112.htm
宁波市鄞州区味可香精香料有限公司,http://www.11467.com/ningbo/co/132356.htm
福建省仙游三和生物科技有限公司,http://www.11467.com/putian/co/39226.htm
山东大唐植物素有限公司销售部,http://www.11467.com/qingdao/co/112798.htm
青岛中人智业生物科技有限公司,http://www.11467.com/qingdao/co/153444.htm
青岛兆龙食品机械有限公司,http://www.11467.com/qingdao/co/154862.htm
西陇化工股份有限公司山东办,http://www.11467.com/qingdao/co/113517.htm
青岛大宫食品有限公司,http://www.11467.com/qingdao/co/11422.htm
青岛鹏远康华天然产物有限公司,http://www.11467.com/qingdao/co/152792.htm
青岛腾原食品添加剂有限公司,http://www.11467.com/qingdao/co/153990.htm
青岛锐健医药化工科技有限公司,http://www.11467.com/qingdao/co/112654.htm
青岛多富康食品有限公司,http://www.11467.com/qingdao/co/153981.htm
泉州市东长食品添加剂有限公司,http://www.11467.com/quanzhou/co/110138.htm
泉州德翔商贸有限公司（福建）,http://www.11467.com/quanzhou/co/108841.htm
北方霞光食品配料有限公司,http://www.11467.com/quanzhou/co/131270.htm
红梅包装有限公司,http://www.11467.com/rizhao/co/14429.htm
福建省宁化县利丰化工有限公司,http://www.11467.com/sanming/co/5916.htm
河南天润生物科技有限公司,http://www.11467.com/shangqiu/co/21154.htm
满地可食品有限公司,http://www.11467.com/shantou/co/137153.htm
汕头市雅园生物工程有限公司,http://www.11467.com/shantou/co/65320.htm
沈阳市红梅生物科技有限公司,http://www.11467.com/shenyang/co/74337.htm
辽宁微维生物工程开发有限公司,http://www.11467.com/shenyang/co/21274.htm
辽宁盘谷科技发展有限公司,http://www.11467.com/shenyang/co/81121.htm
沈阳红梅企业集团有限责任公司——骨汤,http://www.11467.com/shenyang/co/74080.htm
长沙元晟化工有限公司,http://www.11467.com/shenzhen/co/663635.htm
北京诺福生态科技深圳分公司,http://www.11467.com/shenzhen/co/765363.htm
深圳立森电子科技有限公司,http://www.11467.com/shenzhen/co/670122.htm
深圳市华纳科技有限公司,http://www.11467.com/shenzhen/co/665748.htm
深圳市光华伟业实业有限公司,http://www.11467.com/shenzhen/co/723178.htm
深圳市绿微康生物工程有限公司,http://www.11467.com/shenzhen/co/269786.htm
深圳市振三环塑胶助剂有限公司,http://www.11467.com/shenzhen/co/67611.htm
生物源生物技术（深圳）有限公司,http://www.11467.com/shenzhen/co/702301.htm
深圳市唐正生物科技有限公司（深圳办）,http://www.11467.com/shenzhen/co/661810.htm
深圳市艾纳提化工科技有限公司,http://www.11467.com/shenzhen/co/775457.htm
河北新东华氨基酸有限公司/河北东华舰化工有限公司,http://www.11467.com/shijiazhuang/co/99125.htm
河北星启化工科技有限公司,http://www.11467.com/shijiazhuang/co/98991.htm
绿晶食品有限公司,http://www.11467.com/shijiazhuang/co/139213.htm
鹰特化工(石家庄)有限公司营销中心,http://www.11467.com/shijiazhuang/co/140676.htm
苏州高地营养素贸易公司,http://www.11467.com/suzhou/co/257176.htm
无锡阳山生化有限责任公司,http://www.11467.com/wuxi/co/152559.htm
河南森源本草天然产物股份有限公司,http://www.11467.com/xuchang/co/22953.htm
河南森源本草集团有限公司,http://www.11467.com/xuchang/co/23244.htm
徐州润嘉东方化工有限公司,http://www.11467.com/xuzhou/co/1771.htm
阳江市星光食品配料有限公司,http://www.11467.com/yangjiang/co/23252.htm
扬州中福生物技术有限公司,http://www.11467.com/yangzhou/co/108015.htm
烟台精协海洋科技发展有限公司,http://www.11467.com/yantai/co/130344.htm
营口市华度生物科技有限公司,http://www.11467.com/yingkou/co/43193.htm
玉溪自强绿香科技开发有限公司,http://www.11467.com/yuxi/co/16359.htm
枣庄同泰维润化工有限公司,http://www.11467.com/zaozhuang/co/36864.htm
枣庄市杰诺生物酶有限公司,http://www.11467.com/zaozhuang/co/25922.htm
肇庆长龙生物科技有限公司,http://www.11467.com/zhaoqing/co/40091.htm
广东肇庆星湖生物科技股份有限公司(物资采购分公司),http://www.11467.com/zhaoqing/co/33379.htm
上海德津化工有限公司河南七分公司,http://www.11467.com/zhengzhou/co/133363.htm
河南永久化工产品有限公司,http://www.11467.com/zhengzhou/co/175268.htm
河南森普诺食品添加剂有限公司,http://www.11467.com/zhengzhou/co/172395.htm
厦门豪麦生物科技有限公司,http://www.11467.com/xiamen/co/7737.htm
厦门震轩贸易有限公司（销售部）,http://www.11467.com/xiamen/co/74669.htm
厦门仁驰实业有限公司,http://www.11467.com/xiamen/co/95007.htm
陕西慈缘生物技术有限公司（市场部）,http://www.11467.com/xian/co/82552.htm
西安飞达生物技术有限公司商务部,http://www.11467.com/xian/co/84805.htm
陕西太极华青信息系统有限公司,http://www.11467.com/xian/co/85106.htm
西安唐朝化工有限公司,http://www.11467.com/xian/co/122147.htm
西安唐朝化工生物科技有限公司,http://www.11467.com/xian/co/121613.htm
西安银能科技发展有限责任公司,http://www.11467.com/xian/co/83223.htm
西安鲜诺生物科技有限公司,http://www.11467.com/xian/co/84024.htm
青海康普生物科技股份有限公司,http://www.11467.com/xining/co/25407.htm
新乡前进商贸有限公司,http://www.11467.com/xinxiang/co/31916.htm
新乡市华幸化工有限责任公司（综合办公室）,http://www.11467.com/xinxiang/co/25263.htm
江西新王龙实业有限公司,http://www.11467.com/xinyu/co/7284.htm
苏州孔雀食品添加剂有限公司,http://www.11467.com/suzhou/co/29395.htm
苏州逾世纪生物科技有限公司,http://www.11467.com/suzhou/co/316131.htm
山东新凯生物技术有限公司,http://www.11467.com/weifang/co/120723.htm
潍坊祥维斯化学品有限公司,http://www.11467.com/weifang/co/59958.htm
潍坊振兴成城精细化工有限公司,http://www.11467.com/weifang/co/19008.htm
威海迪沙海洋生物制品有限公司,http://www.11467.com/weihai/co/47342.htm
武汉德赢食品添加剂有限公司,http://www.11467.com/wuhan/co/142821.htm
湖北天天食品配料有限公司,http://www.11467.com/wuhan/co/142820.htm
湖北鑫润德化工有限公司,http://www.11467.com/wuhan/co/141136.htm
湖北鑫拓楚生物科技有限公司,http://www.11467.com/wuhan/co/146101.htm
武汉凯迪精细化工有限公司,http://www.11467.com/wuhan/co/102701.htm
武汉格瑞贸易有限公司,http://www.11467.com/wuhan/co/31131.htm
